Hash;Title;Link;Description;Category;KeyWords;Published;LastUpdated;Author;Source;Paywall
93dbea136beaabd73f7256aa1bc30c31c683f474ea4aad38ec5d862b40df68ec;Drei Schwerverletzte bei Autounfall im Vogtlandkreis;https://www.zeit.de/news/2024-04/22/drei-schwerverletzte-bei-autounfall-im-vogtlandkreis;Hier finden Sie Informationen zu dem Thema „Unfälle“. Lesen Sie jetzt „Drei Schwerverletzte bei Autounfall im Vogtlandkreis“.;"Z+ (abopflichtiger Inhalt);
        
    
Unfälle";News, Unfälle, Vogtlandkreis, Autounfall, Unfall, Rettungswagen;2024-04-22T06:26:28+02:00;2024-04-22T06:26:28+02:00;;dpa Sachsen;false
287bb21ba8269aa71dff5ffd3e2a73bad7fea002c372b785e2ea0d97794b7a17;"Mainz erhöht Druck: ""Wird mit unseren Gegnern etwas machen""";https://www.zeit.de/news/2024-04/22/mainz-erhoeht-druck-wird-mit-unseren-gegnern-etwas-machen;"Hier finden Sie Informationen zu dem Thema „Bundesliga“. Lesen Sie jetzt „Mainz erhöht Druck: ""Wird mit unseren Gegnern etwas machen""“.";"Z+ (abopflichtiger Inhalt);
        
    
Bundesliga";News, Bundesliga, Jonathan Burkardt, Martin Schmidt, Mainz, Freiburg, Köln, SC Freiburg, 1. FSV Mainz 05, Bundesliga;2024-04-22T06:22:46+02:00;2024-04-22T06:22:46+02:00;;dpa Rheinland-Pfalz/Saarland;false
2d8c86c51c9cbeee786a12cd1da8dc103d92a7df68219220967994b1f82aa3df;Unbesiegbarkeit als Mission: Leverkusen und die späten Tore;https://www.zeit.de/news/2024-04/21/bayer-erfolgsserie-haelt-1-1-in-dortmund;Hier finden Sie Informationen zu dem Thema „30. Spieltag“. Lesen Sie jetzt „Unbesiegbarkeit als Mission: Leverkusen und die späten Tore“.;"Z+ (abopflichtiger Inhalt);
        
    
30. Spieltag";News, 30. Spieltag, Josip Stanisic, Julian Brandt, Lukas Hradecky, Leverkusen, Dortmund, Bremen, West Ham, BVB, Bayer 04 Leverkusen, Bundesliga;2024-04-22T06:21:44+02:00;2024-04-22T06:21:44+02:00;;dpa;false
79f14841875f2557a412c446dfc4babd359ee90d7676a5f44ce4aa187946f4d8;Probleme bei Anreise: Mainz-Profis schenken Fans Trikots;https://www.zeit.de/news/2024-04/22/probleme-bei-anreise-mainz-profis-schenken-fans-trikots;Hier finden Sie Informationen zu dem Thema „Bundesliga“. Lesen Sie jetzt „Probleme bei Anreise: Mainz-Profis schenken Fans Trikots“.;"Z+ (abopflichtiger Inhalt);
        
    
Bundesliga";News, Bundesliga, SC Freiburg, 1. FSV Mainz 05, Bundesliga, Anreise, Trikot;2024-04-22T06:16:49+02:00;2024-04-22T06:16:49+02:00;;dpa Rheinland-Pfalz/Saarland;false
2c4b3eed4f05e130d9edac3e5e5a4855acff39b9b839d82b5c64bbf2a29af61c;Leselernhelfer starten auch Online-Lesestunden;https://www.zeit.de/news/2024-04/22/leselernhelfer-starten-auch-online-lesestunden;Hier finden Sie Informationen zu dem Thema „Bildung“. Lesen Sie jetzt „Leselernhelfer starten auch Online-Lesestunden“.;"Z+ (abopflichtiger Inhalt);
        
    
Bildung";News, Bildung, Welttag des Buches, Kinderzimmer;2024-04-22T06:14:41+02:00;2024-04-22T06:14:41+02:00;;dpa Nordrhein-Westfalen;false
8294f6bddc359cfb623f7c5cb6359089640f8bd2d920cd0fda9bec8d35878908;Der neue Straßenkampf: Wenn Passanten Parksünder anzeigen;https://www.zeit.de/news/2024-04/22/der-neue-strassenkampf-wenn-passanten-parksuender-anzeigen;Hier finden Sie Informationen zu dem Thema „Gesellschaft“. Lesen Sie jetzt „Der neue Straßenkampf: Wenn Passanten Parksünder anzeigen“.;"Z+ (abopflichtiger Inhalt);
        
    
Gesellschaft";News, Gesellschaft, Falko Görres, Frankfurt am Main, Frankfurt, Nordrhein-Westfalen, Wuppertal, Bochum, Bielefeld, Baden-Württemberg, Polizei, Straßenkampf;2024-04-22T06:13:05+02:00;2024-04-22T06:13:05+02:00;;dpa;false
6e4780f6c2927bb460a22cbadcb222140eadb3e560254f310735645e2e2c4d9d;Leverkusen: Unbesiegbarkeit als Mission;https://www.zeit.de/news/2024-04/21/dortmund-pressekonferenz-faellt-nach-alarm-aus;Hier finden Sie Informationen zu dem Thema „Bundesliga“. Lesen Sie jetzt „Leverkusen: Unbesiegbarkeit als Mission“.;"Z+ (abopflichtiger Inhalt);
        
    
Bundesliga";News, Bundesliga, Dortmund, BVB, Bayer 04 Leverkusen, Bundesliga, Alarm;2024-04-22T06:11:54+02:00;2024-04-22T06:11:54+02:00;;dpa Nordrhein-Westfalen;false
45244cfb5fefc072cd95432f14619ae4cf7f146ac81d3e0c5f10a58db0a500f3;Erst TikTok, dann Botox;https://www.zeit.de/gesundheit/2024-04/schoenheitsideale-social-media-chirurgie-tiktok;Junge Menschen kommen mit stark bearbeiteten Fotos in die Praxen plastischer Chirurgen und wollen operiert werden. Manche bauen sich ihre Nase mit dem Handy sogar selbst.;"Z+ (abopflichtiger Inhalt);
        
    
Schönheitsideale auf Social Media";Gesundheit, Schönheitsideale auf Social Media, plastische Chirurgie, Schönheitsoperation, Social Media, TikTok, Instagram, Botox, Schönheitsideal, Operation, Hyaluronsäure, Influencer;2024-04-22T06:11:45+02:00;2024-04-22T06:11:45+02:00;Nora Burgard-Arp;;false
83299ed8f45da8d729ffb714477e53dba95bd17c165cc342653138336b5a9db1;Feuerwehr rettet Menschen aus brennendem Haus: Verletzte;https://www.zeit.de/news/2024-04/22/feuerwehr-rettet-menschen-aus-brennendem-haus-verletzte;Hier finden Sie Informationen zu dem Thema „Brände“. Lesen Sie jetzt „Feuerwehr rettet Menschen aus brennendem Haus: Verletzte“.;"Z+ (abopflichtiger Inhalt);
        
    
Brände";News, Brände, Feuerwehr, Einsatzfahrzeug, Blaulicht, Brand;2024-04-22T06:08:06+02:00;2024-04-22T06:08:06+02:00;;dpa Nordrhein-Westfalen;false
4cc0a30ead7373b87c48ccddb3d92fac79dd8e41b9b7dcb79189b6ebf26c72cb;Mögliche US-Sanktionen gegen Bataillon, Galant warnt vor Präzedenzfall;https://www.zeit.de/politik/ausland/2024-04/nahost-nacht-ueberblick-sanktionen-usa-israel-galant;Die USA wollen laut Berichten Sanktionen gegen eine ultraorthodoxe israelische Militäreinheit verhängen. Israels Verteidigungsminister kritisiert den Schritt. Die Nacht;"Z+ (abopflichtiger Inhalt);
        
    
Nahostüberblick";Politik, Nahostüberblick, Nahost, USA, Israel, Militär, Gazastreifen, Sanktion;2024-04-22T06:06:42+02:00;2024-04-22T06:06:42+02:00;;ZEIT ONLINE,        dpa,        AFP,        Reuters,        sbo;false
53bc4a2bc4937b91327d6b8b0ce8fce984bd8ce0ab91097989ec093ed966c418;Tabak aus der Badewanne;https://www.zeit.de/2024/17/wasserpfeifen-tabak-schwarzmarkt-shishas-gesetz;Eine Gesetzesänderung für Wasserpfeifen hat in Deutschland einen gewaltigen Schwarzmarkt geschaffen. Sie bedeutet gleichzeitig neue Risiken für die Verbraucher.;"Z+ (abopflichtiger Inhalt);
        
    
Wasserpfeifen";Wirtschaft, Wasserpfeifen, Tabak, Shisha, Rauchen, Wasserpfeife, Schwarzmarkt, Wasserpfeifentabak;2024-04-22T06:06:09+02:00;2024-04-22T06:06:09+02:00;Celine Schäfer;Aus der        ZEIT Nr. 17/2024;false
841c5b7c71ff9b49fb45970e71bf46fd71d1407c88ba108d47ee2f49edd42d15;28-Jährige mit Messer attackiert: Freund festgenommen;https://www.zeit.de/news/2024-04/22/28-jaehrige-mit-messer-attackiert-freund-festgenommen;Hier finden Sie Informationen zu dem Thema „Häusliche Gewalt“. Lesen Sie jetzt „28-Jährige mit Messer attackiert: Freund festgenommen“.;"Z+ (abopflichtiger Inhalt);
        
    
Häusliche Gewalt";News, Häusliche Gewalt, Polizeiauto;2024-04-22T06:05:04+02:00;2024-04-22T06:05:04+02:00;;dpa Nordrhein-Westfalen;false
64e036b4d3a1300a5053a4834c4ff8fb5b7fcb234013ab1a2171b8a1d0e56bf7;58-Jähriger wird vom Fahrrad geschubst und verletzt sich;https://www.zeit.de/news/2024-04/22/58-jaehriger-wird-vom-fahrrad-geschubst-und-verletzt-sich;Hier finden Sie Informationen zu dem Thema „Verkehr“. Lesen Sie jetzt „58-Jähriger wird vom Fahrrad geschubst und verletzt sich“.;"Z+ (abopflichtiger Inhalt);
        
    
Verkehr";News, Verkehr, Verkehr, Rettungswagen, Blaulicht, Fahrrad;2024-04-22T05:57:51+02:00;2024-04-22T05:57:51+02:00;;dpa Niedersachsen;false
3f7e80abd6309e970bee91cdbef2e469f82d7388d95e9dd6a9b8117a94764637;Zusammenstoß beim Überholen: Fünf Verletzte;https://www.zeit.de/news/2024-04/22/zusammenstoss-beim-ueberholen-fuenf-verletzte;Hier finden Sie Informationen zu dem Thema „Unfälle“. Lesen Sie jetzt „Zusammenstoß beim Überholen: Fünf Verletzte“.;"Z+ (abopflichtiger Inhalt);
        
    
Unfälle";News, Unfälle, Polizei, Zusammenstoß, Unfall, Symbolfoto, Schwertransport, Blaulicht;2024-04-22T05:50:28+02:00;2024-04-22T05:50:28+02:00;;dpa Niedersachsen;false
0e6bfc68ae90165ab57c5ff9614415ab7a033b6ab6de9c8762e89620860caaed;Abiturprüfungen beginnen in MV;https://www.zeit.de/news/2024-04/22/abiturpruefungen-beginnen-in-mv;Hier finden Sie Informationen zu dem Thema „Bildung“. Lesen Sie jetzt „Abiturprüfungen beginnen in MV“.;"Z+ (abopflichtiger Inhalt);
        
    
Bildung";News, Bildung, Abiturprüfung;2024-04-22T05:47:15+02:00;2024-04-22T05:47:15+02:00;;dpa Mecklenburg-Vorpommern;false
86100a2a2513c9638f02ac6b91c7c9d8d92b8e496a6a1b603a21aa88007e82aa;Mit KI gegen Pflegenotstand - Messe zur Pflege der Zukunft;https://www.zeit.de/news/2024-04/22/mit-ki-gegen-pflegenotstand-messe-zur-pflege-der-zukunft;Hier finden Sie Informationen zu dem Thema „Gesellschaft“. Lesen Sie jetzt „Mit KI gegen Pflegenotstand - Messe zur Pflege der Zukunft“.;"Z+ (abopflichtiger Inhalt);
        
    
Gesellschaft";News, Gesellschaft, Steve Schrader, Karl Lauterbach, Pflegenotstand, Pflege, Pflegebranche, Leitmesse, Personalmangel, Geldsorge, künstliche Intelligenz, Geld;2024-04-22T05:44:33+02:00;2024-04-22T05:44:33+02:00;;dpa;false
6624e1f93d80bb072a5f41326ddc9ea93697bbfe13fc6ab744def400a88aaf33;Feuerwehr rettet sechs Menschen aus brennendem Haus;https://www.zeit.de/news/2024-04/22/feuerwehr-rettet-sechs-menschen-aus-brennendem-haus;Hier finden Sie Informationen zu dem Thema „Brände“. Lesen Sie jetzt „Feuerwehr rettet sechs Menschen aus brennendem Haus“.;"Z+ (abopflichtiger Inhalt);
        
    
Brände";News, Brände, Feuerwehr, Einsatzfahrzeug, Einsatzkraft, Brand;2024-04-22T05:44:12+02:00;2024-04-22T05:44:12+02:00;;dpa Mecklenburg-Vorpommern;false
ed2083f387f782c952f1e9efa697c80b76e9c2bc0671b962c36b448e07f051f9;Jomo ist das neue Fomo;https://www.zeit.de/sinn/2024-04/nichtstun-lernen-jomo-niksen-entspannung;Einfach mal wieder nichts tun wäre schön! Kann man das lernen? Womöglich ist ein Trend aus den Niederlanden die Antwort.;"Z+ (abopflichtiger Inhalt);
        
    
Nichtstun lernen";Sinn, Nichtstun lernen, Niederlande, Entspannung, Alltag, Haushalt, Familie, Beziehung;2024-04-22T05:43:22+02:00;2024-04-22T05:43:22+02:00;Anna-Lena Schlitt;;false
12c7a723018f5ddaf05f0618ac42379c316dce48c59e33d7cedf650bbce4f9c5;Der Stachel in Julians Herz;https://www.zeit.de/sport/2024-04/bundesliga-rueckschau-1-fc-koeln-bremen-stuttgart-ducksch;Die Trennung vom FC Bayern ist für Julian Nagelsmann noch zu frisch. Sagt jedenfalls Max Eberl. Und Leverkusens Serie hält, die von Marvin Ducksch nicht. Der 30. Spieltag;"Z+ (abopflichtiger Inhalt);
        
    
Bundesligarückschau";Sport, Bundesligarückschau, Fußball-Bundesliga, 1. FC Köln, SV Werder Bremen, VfB Stuttgart, Fußball, Profisport;2024-04-22T05:39:02+02:00;2024-04-22T05:39:02+02:00;Tammo Blomberg;;false
fa5b6a1aec189d35a805b093339f6b179ca8c8a0c60b7fb699d1d48c1c49c4de;Rostock, HSV - und dann der Aufstieg?;https://www.zeit.de/news/2024-04/22/rostock-hsv-und-dann-der-aufstieg;Hier finden Sie Informationen zu dem Thema „2. Liga“. Lesen Sie jetzt „Rostock, HSV - und dann der Aufstieg?“.;"Z+ (abopflichtiger Inhalt);
        
    
2. Liga";News, 2. Liga, Karol Mets, Hauke Wahl, Rostock, St. Paulis, Hannover, HSV, Heinz, Hannover 96, FC St. Pauli, Bundesliga;2024-04-22T05:37:21+02:00;2024-04-22T05:37:21+02:00;;dpa Hamburg/Schleswig-Holstein;false
de2dbe88a0d7e7e2561b13984277666715fea2b686fbf235b702bf7edc8b42b3;"""Ich sehe eine gewisse Dringlichkeit""";https://www.zeit.de/politik/deutschland/2024-04/johannes-masing-richter-bundesverfassungsgericht-schutz-grundgesetz;Muss das Bundesverfassungsgericht besser geschützt werden, bevor die AfD noch stärker wird? Ein früherer Verfassungsrichter rät dazu und kritisiert das Justizministerium.;"Z+ (abopflichtiger Inhalt);
        
    
Bundesverfassungsgericht";Politik, Bundesverfassungsgericht, Polen, Ungarn, Verfassungsgericht, Justizministerium, Bundestag, Alternative für Deutschland;2024-04-22T05:37:01+02:00;2024-04-22T05:37:01+02:00;Heinrich Wefing;;false
1fac7a333e42bdfe3b845b53754e9699fb395d91f7bff3e0638120dee3382c5f;Bremer Institut: Schiffsverkehr bis 2050 nicht klimaneutral;https://www.zeit.de/news/2024-04/22/bremer-institut-schiffsverkehr-bis-2050-nicht-klimaneutral;Hier finden Sie Informationen zu dem Thema „Energie“. Lesen Sie jetzt „Bremer Institut: Schiffsverkehr bis 2050 nicht klimaneutral“.;"Z+ (abopflichtiger Inhalt);
        
    
Energie";News, Energie, Burkhard Lemper, Wilhelmshaven, Bremen, Institut für Seeverkehrswirtschaft und Logistik, LNG, Schiffsverkehr, Luftaufnahme, Schiff;2024-04-22T05:34:15+02:00;2024-04-22T05:34:15+02:00;;dpa Hamburg/Schleswig-Holstein;false
7a718041f6324b64971b4580f3a25a4854fd29314cfcfbf6d53c7fb13ceb056e;Joko und Klaas waren ein Tag ProSieben;https://www.zeit.de/news/2024-04/21/joko-und-klaas-zur-primetime-gibt-es-100-000-euro-quiz;Hier finden Sie Informationen zu dem Thema „24-Stunden-Programmtag“. Lesen Sie jetzt „Joko und Klaas waren ein Tag ProSieben“.;"Z+ (abopflichtiger Inhalt);
        
    
24-Stunden-Programmtag";News, 24-Stunden-Programmtag, Klaas Heufer-Umlauf, Joko Winterscheidt, Pro7, ProSieben, Primetime;2024-04-22T05:27:21+02:00;2024-04-22T05:27:21+02:00;;dpa Berlin/Brandenburg;false
874f12750e568738b5b442dc6144606c2808adb0b4d0fb7eecaea963001a9be0;Wie der Staat CO₂-Ausstoß belohnt;https://www.zeit.de/wissen/umwelt/2024-04/klimaschaedliche-subventionen-co2-ausstoss-studie;Forscher haben berechnet, mit wie vielen Milliarden Euro der Staat CO₂-Emissionen fördert. Von dem Geld ließe sich eine Menge Klimaschutz finanzieren.;"Z+ (abopflichtiger Inhalt);
        
    
Klimaschädliche Subventionen";Wissen, Klimaschädliche Subventionen, CO2, Klimaschutz, Subvention, Studie, Klimawandel, Pendlerpauschale;2024-04-22T05:24:11+02:00;2024-04-22T05:24:11+02:00;Stefan Schmitt;DIE ZEIT Nr. 18/2024;false
2adf133d4f3d877a7d55137e6832988875e193a0e28699d3e6c35d033058a392;Präsident Noboa erklärt Sieg nach Referendum zu Sicherheitsreform;https://www.zeit.de/politik/ausland/2024-04/ecuador-kriminalitaet-gewalt-referendum-mord;Ecuadors Präsident Daniel Noboa will die Verfassung ändern, um seine Befugnisse zur Bekämpfung der Kriminalität auszuweiten. Am Tag der Abstimmung kam es zu einem Mord.;"Z+ (abopflichtiger Inhalt);
        
    
Ecuador";Politik, Ecuador, Ecuador, Reform, Organisierte Kriminalität, Sicherheitspolitik, Drogenhandel, Tötungsdelikt;2024-04-22T05:21:55+02:00;2024-04-22T05:21:55+02:00;;ZEIT ONLINE,        Reuters,        AFP,        dpa,        AP,        sbo;false
7281916a40e6e4ca0390e76391f7c0577966fb340a52721924cfd88cee122d53;Bandengewalt in Haitis Hauptstadt eskaliert vor Regierungswechsel;https://www.zeit.de/politik/ausland/2024-04/haiti-gewalt-port-au-prince-banden-regierungswechsel;Ein Übergangsrat soll in Haiti den Weg zur Normalität ebnen, doch Schusswechsel zwischen Polizei und Banden halten an. Mehr als 360.000 Menschen sind auf der Flucht.;"Z+ (abopflichtiger Inhalt);
        
    
Port-au-Prince";Politik, Port-au-Prince, Haiti, Bandenkriminalität, Port-au-Prince, Regierungswechsel, Polizei, Twitter;2024-04-22T05:13:28+02:00;2024-04-22T05:13:28+02:00;;ZEIT ONLINE,        Reuters,        lip;false
eddacd955d9c87d7b8eacffc74da68d2f7f3dce8712ff8f53871a4dff01780df;Felix Burda Award für Wissenschaftler aus Heidelberg;https://www.zeit.de/news/2024-04/22/felix-burda-award-fuer-wissenschaftler-aus-heidelberg;Hier finden Sie Informationen zu dem Thema „Forschung“. Lesen Sie jetzt „Felix Burda Award für Wissenschaftler aus Heidelberg“.;"Z+ (abopflichtiger Inhalt);
        
    
Forschung";News, Forschung, Hubert Burda, Heidelberg, Berlin, DKFZ, Award;2024-04-22T05:10:50+02:00;2024-04-22T05:10:50+02:00;;dpa Baden-Württemberg;false
2689f84350e9b8935bacb93644e7f5dea121f8e95c9c811ad386017088055dbc;PwC: Deutschland und EU könnten Wasserstoffziele verfehlen;https://www.zeit.de/news/2024-04/22/pwc-deutschland-und-eu-koennten-wasserstoffziele-verfehlen;Hier finden Sie Informationen zu dem Thema „Energie“. Lesen Sie jetzt „PwC: Deutschland und EU könnten Wasserstoffziele verfehlen“.;"Z+ (abopflichtiger Inhalt);
        
    
Energie";News, Energie, Europa, Pricewaterhousecoopers, EU, Wasserstoffziel, Wasserstoff, Klimaziel, Unternehmensberatung;2024-04-22T04:21:01+02:00;2024-04-22T04:21:01+02:00;;dpa;false
78c2476fa17fa70eaad43fad43bcca5129b7bb9256dda1e12913374268315b4c;Forschungsministerin Stark-Watzinger will ein Gesetz für Kernfusion;https://www.zeit.de/politik/deutschland/2024-04/stark-watzinger-gesetz-kernfusion;Kernfusion gilt als Zukunftstechnologie für die Energieversorgung. Die Bundesforschungsministerin fordert gesetzliche Rahmenbedingungen für Unternehmen und Investoren.;"Z+ (abopflichtiger Inhalt);
        
    
Energieerzeugung";Politik, Energieerzeugung, Bettina Stark-Watzinger, FDP, Energieversorgung, Kernfusion, Robert Habeck, Ursula von der Leyen;2024-04-22T03:38:11+02:00;2024-04-22T03:38:11+02:00;;ZEIT ONLINE,        dpa,        sbo;false
49fcadfa669e3bfda004b5808a2ebdf9faf1739453c4d2bad66ca3db316f6f87;Rushdie: Trump wäre bei zweiter Amtszeit schlimmer;https://www.zeit.de/news/2024-04/22/rushdie-trump-waere-bei-zweiter-amtszeit-schlimmer;Hier finden Sie Informationen zu dem Thema „Wahlen“. Lesen Sie jetzt „Rushdie: Trump wäre bei zweiter Amtszeit schlimmer“.;"Z+ (abopflichtiger Inhalt);
        
    
Wahlen";News, Wahlen, Donald Trump, Salman Rushdie, Amtszeit;2024-04-22T01:49:06+02:00;2024-04-22T01:49:06+02:00;;dpa;false
1e44ae16c69c18a216847360f97299c08ec0c8c01eea668d35d971494a87bf4d;Zehntausende protestieren gegen Regierung von Präsident Gustavo Petro;https://www.zeit.de/politik/ausland/2024-04/kolumbien-protest-petro-praesident-gesundheit;Die linksgerichtete Regierung will die Rolle von Privatunternehmen im Gesundheitswesen einschränken und Frieden schaffen. Nun kam es zum größten Protest seit Amtsantritt.;"Z+ (abopflichtiger Inhalt);
        
    
Kolumbien";Politik, Kolumbien, Kolumbien, Sozialismus, Verstaatlichung, Gesundheitssystem, Bogotá, Dürre;2024-04-22T01:31:59+02:00;2024-04-22T01:31:59+02:00;;ZEIT ONLINE,        AFP,        AP,        sbo;false
d50b1c8afaa8a1e3370d002b8e3996985582e2c1e54a320b08af6f6903d827f9;Serbische Minderheit boykottiert Referendum im Kosovo;https://www.zeit.de/politik/ausland/2024-04/kosovo-serbien-buergermeisterwahl;Tausende Unterschriften sammelte die Serbische Liste für ein Referendum zur Absetzung von Bürgermeistern. Dann rief sie zum Boykott auf – nur 253 Menschen stimmten ab.;"Z+ (abopflichtiger Inhalt);
        
    
Kosovo";Politik, Kosovo, Serbien, Kosovo, Belgrad, Albanien, Prishtinë, Nato;2024-04-22T00:28:55+02:00;2024-04-22T00:28:55+02:00;;ZEIT ONLINE,        AP,        AFP,        svj;false
368368be5d008d710eb813021b6acaddf80420f18ef1d8b46fd6dff2de3ac5f0;Unfälle auf schneebedeckter A95 - ein Toter, Verletzte;https://www.zeit.de/news/2024-04/22/unfaelle-auf-schneebedeckter-a95-ein-toter-verletzte;Hier finden Sie Informationen zu dem Thema „Wetter“. Lesen Sie jetzt „Unfälle auf schneebedeckter A95 - ein Toter, Verletzte“.;"Z+ (abopflichtiger Inhalt);
        
    
Wetter";News, Wetter, Bayern, München, Unfall, Unfallserie, Wetter, Fahrzeug;2024-04-22T00:23:17+02:00;2024-04-22T00:23:17+02:00;;dpa;false
870c23f61d3f80c1a5ec916a5fc56c29bdf27b145d6f49c0c23899c89e249b3c;Weltweite Militärausgaben so hoch wie noch nie;https://www.zeit.de/politik/ausland/2024-04/sipri-bericht-militaerausgaben-welt-konflikte-ukraine-nahost-suedchinesisches-meer;"Laut Friedensforschenden wurden 2023 Waffen für 2,25 Billionen Euro verkauft. Die Zahlen spiegelten ""die Verschlechterung von Frieden und Sicherheit in der ganzen Welt"".";"Z+ (abopflichtiger Inhalt);
        
    
Sipri-Bericht";Politik, Sipri-Bericht, Militär, Europa, Krieg in der Ukraine, USA, China, Russland;2024-04-22T00:05:16+02:00;2024-04-22T00:05:16+02:00;;ZEIT ONLINE,        AFP,        ces;false
d20d5961bca935315e0e3aec161445f6b1663ebf1438e4fb759e8f39f3cd1098;Ex-Präsident Bolsonaro versammelt Tausende Anhänger in Rio de Janeiro;https://www.zeit.de/politik/ausland/2024-04/brasilien-jair-bolsonaro-copacabana-kundgebung;"Am Copacabana-Strand ruft Jair Bolsonaro zur ""Verteidigung der Meinungsfreiheit"" auf. Brasiliens Justiz geht wegen Falschinformation gegen Konten auf der Plattform X vor.";"Z+ (abopflichtiger Inhalt);
        
    
Brasilien";Politik, Brasilien, Jair Bolsonaro, Rio de Janeiro, Brasilien, Elon Musk, Amnestie, Ermittlung, Alexandre de Moraes, Copacabana-Strand;2024-04-21T23:40:22+02:00;2024-04-21T23:40:22+02:00;;ZEIT ONLINE,        dpa,        lip;false
fa18e327581dde389b05531d5e4f9c3f2b92e425087b12f8331427ca26d31caa;Initiative gegen Antisemitismus fordert Rücktritt von Polizeichef;https://www.zeit.de/politik/ausland/2024-04/london-propalaestinensische-demonstrationen-polizeichef-forderung-ruecktritt-antisemitismus;In London gibt es seit Beginn des Gaza-Kriegs immer wieder propalästinensische Proteste. Die Polizei steht in der Kritik, Jüdinnen und Juden nicht genügend zu schützen.;"Z+ (abopflichtiger Inhalt);
        
    
Propalästinensische Demonstrationen in London";Politik, Propalästinensische Demonstrationen in London, London, Demonstration, Polizei, Antisemitismus, Großbritannien, Protest, Mark Rowley;2024-04-21T23:35:39+02:00;2024-04-21T23:35:39+02:00;;ZEIT ONLINE,        dpa,        ces;false
2593a7e6da018c7c5f047787cc729aa5ca0b07348129d042947eca2a57bba969;Separatistisches Linksbündnis erzielt im Baskenland Rekordergebnis;https://www.zeit.de/politik/ausland/2024-04/baskenland-parlamentswahl-separatisten-erfolg;Im Baskenland hat das separatistische Bündnis EH Bildu sein bestes Wahlergebnis geholt. Regieren wird es nach der Parlamentswahl voraussichtlich trotzdem nicht.;"Z+ (abopflichtiger Inhalt);
        
    
Parlamentswahl im Baskenland";Politik, Parlamentswahl im Baskenland, Baskenland, Parlamentswahl, Separatismus, Spanien, PSOE, Pedro Sanchez;2024-04-21T22:33:59+02:00;2024-04-21T22:33:59+02:00;;ZEIT ONLINE,        dpa,        svj;false
04fcfd25764537307a9e75767c4275011232d1e3ab64f170609444edd6d848e7;Mehr als 30 Tote nach Angriffen auf Rafah;https://www.zeit.de/politik/ausland/2024-04/nahost-gazastreifen-rafah-israel-angriff-tote;Kliniken im Gazastreifen berichten von mehr als 30 durch Angriffe getötete Menschen. Darunter sollen auch Kinder sein. Das israelische Militär äußerte sich bisher nicht.;"Z+ (abopflichtiger Inhalt);
        
    
Nahost";Politik, Nahost, Nahost, Israel, Gazastreifen, Hamas, Benjamin Netanjahu, Militär, Rafah;2024-04-21T22:19:17+02:00;2024-04-21T22:19:17+02:00;;ZEIT ONLINE,        dpa,        AFP,        iso;false
b1b4762e966581d8fd903a899c62575d474cf2b443e15981dba842bf00f8ce50;Krieg gegen die Ukraine: So ist die Lage;https://www.zeit.de/news/2024-04/21/krieg-gegen-die-ukraine-so-ist-die-lage;Hier finden Sie Informationen zu dem Thema „Russische Invasion“. Lesen Sie jetzt „Krieg gegen die Ukraine: So ist die Lage“.;"Z+ (abopflichtiger Inhalt);
        
    
Russische Invasion";News, Russische Invasion, Rustem Umjerow, Mike Johnson, Joe Biden, Wladimir Putin, Wolodymyr Selenskyj, Dmitri Peskow, Kiew, USA, Amerika, Russland;2024-04-21T22:08:38+02:00;2024-04-21T22:08:38+02:00;;dpa;false
de2e8fe49f2f5416cbd03031e174fff1d2781c605fc80e78145e3695416f39de;Felix Burda Award wirbt für bessere Darmkrebsvorsorge;https://www.zeit.de/news/2024-04/21/felix-burda-award-wirbt-fuer-bessere-darmkrebsvorsorge;Hier finden Sie Informationen zu dem Thema „Wissenschaft“. Lesen Sie jetzt „Felix Burda Award wirbt für bessere Darmkrebsvorsorge“.;"Z+ (abopflichtiger Inhalt);
        
    
Wissenschaft";News, Wissenschaft, Verona Pooth, Hubert Burda, San Diego, Darmkrebsvorsorge, Award, Verleihung;2024-04-21T22:00:52+02:00;2024-04-21T22:00:52+02:00;;dpa Berlin/Brandenburg;false
45bd9c24c59ffbb0165a8126431b828e5d9b48adad004bf8d0e1d6979af2f0dd;"""Wir müssen schneller und einfacher werden""";https://www.zeit.de/wirtschaft/2024-04/bundeskanzler-olaf-scholz-hannover-messe-energiewende;"Kanzler Scholz hat die Hannover Messe eröffnet und Kritik aus der Industrie zurückgewiesen. Deutschlands Konjunktur bessere sich. Nun müsse Bürokratie abgebaut werden.
";"Z+ (abopflichtiger Inhalt);
        
    
Olaf Scholz";Wirtschaft, Olaf Scholz, Olaf Scholz, Hannover, Energiewende, Ursula von der Leyen, Norwegen, Wasserstoff, Jonas Gahr Støre;2024-04-21T21:58:22+02:00;2024-04-21T21:58:22+02:00;;ZEIT ONLINE,        dpa,        Reuters,        iso;false
a10c21707c9880985af61693c1e805bb4c54f7a4e1231bd89d19e9bba18c607a;Trinken, um zu vergessen;https://www.zeit.de/kultur/film/2024-04/polizeiruf-110-halle-der-dicke-liebt-obduktionsbericht;"Bachkantaten und Kreuzigungsposen: Der zweite ""Polizeiruf"" aus Halle über den Mord an einer Schülerin kommt sehr gravitätisch daher. ";"Z+ (abopflichtiger Inhalt);
        
    
""Polizeiruf 110"" Halle";"Kultur, ""Polizeiruf 110"" Halle, Fernsehserie, Ermittlung, Straftat, Kriminalität, Halle, Peter Kurth";2024-04-21T21:47:26+02:00;2024-04-21T21:47:26+02:00;Matthias Dell;;false
