Hash;Title;Link;Description;Category;KeyWords;Published;LastUpdated;Author;Source;Paywall
0ce37adb030bc45087927da2f309c7221a1cffbba275e115ffa2c4cddea42552;Ukrainischer Minister soll sich Grundstücke angeeignet haben;https://www.zeit.de/news/2024-04/23/ukrainischer-minister-soll-sich-grundstuecke-angeeignet-haben;Hier finden Sie Informationen zu dem Thema „Korruption“. Lesen Sie jetzt „Ukrainischer Minister soll sich Grundstücke angeeignet haben“.;"Z+ (abopflichtiger Inhalt);
        
    
Korruption";News, Korruption, Mykola Solskyj, Grundstück, Korruption;2024-04-23T10:55:47+02:00;2024-04-23T10:55:47+02:00;;dpa;false
4b77b6bd5c2565978d18f1d61b79e844084447468ee4b1c96dc4948c859562c9;Bilder des Tages;https://www.zeit.de/news/2024-04/23/bilder-des-tages;Hier finden Sie Informationen zu dem Thema „Fotografie“. Lesen Sie jetzt „Bilder des Tages“.;"Z+ (abopflichtiger Inhalt);
        
    
Fotografie";News, Fotografie, Stadtderby;2024-04-23T10:55:22+02:00;2024-04-23T10:55:22+02:00;;dpa;false
c7a3f0d88d09f8f8bf74bb81004f1ec72fd92d186eb7a059ff3367d9ce3fa32a;Scholz: Wir navigieren gut durch die wirtschaftliche Lage;https://www.zeit.de/news/2024-04/23/scholz-wir-navigieren-gut-durch-die-wirtschaftliche-lage;Hier finden Sie Informationen zu dem Thema „Bankentag“. Lesen Sie jetzt „Scholz: Wir navigieren gut durch die wirtschaftliche Lage“.;"Z+ (abopflichtiger Inhalt);
        
    
Bankentag";News, Bankentag, Olaf Scholz, Berlin, Bundesverband deutscher Banken, SPD, Bankentag;2024-04-23T10:53:11+02:00;2024-04-23T10:53:11+02:00;;dpa;false
3558d5ff4e0253e3358ede03b2e9f9ba15764ef88f3e5d6303e1c40ecaa460ba;Mutmaßlicher China-Spion in EU-Politiker-Umfeld gefasst;https://www.zeit.de/news/2024-04/23/mutmasslicher-china-spion-in-eu-politiker-umfeld-gefasst;Hier finden Sie Informationen zu dem Thema „Geheimdienste“. Lesen Sie jetzt „Mutmaßlicher China-Spion in EU-Politiker-Umfeld gefasst“.;"Z+ (abopflichtiger Inhalt);
        
    
Geheimdienste";News, Geheimdienste, Dresden, China, EU, Spionageverdacht, Geheimdienst;2024-04-23T10:49:36+02:00;2024-04-23T10:49:36+02:00;;dpa;false
c4ce34609ab8693dd5bdd6e6dc7c87f7d56ef549f231e2aec4b78aa8c2167e46;Heizungsbauer rechnen mit starkem Rückgang von Wärmepumpen;https://www.zeit.de/wirtschaft/2024-04/waermepumpen-heizung-installation-rekord-zahlen-verunsicherung-habeck-ampel;Nach dem Rekord an Wärmepumpeninstallationen 2023 dürften die Zahlen in diesem Jahr wieder zurückgehen. Die Branche sieht die Verunsicherung der Kunden als Hauptgrund.;Energiepolitik;Wirtschaft, Energiepolitik, Michael Hilpert, Bundesregierung, Bundeswirtschaftsministerium, Wärmepumpeninstallation, Wärmepumpe, Hauptgrund, Verunsicherung, Rückgang;2024-04-23T10:49:21+02:00;2024-04-23T10:49:21+02:00;;ZEIT ONLINE,        dpa,        sko;false
25e8beee28b9741d6732b1f7e647a3f3b1e5a7616e36e9f0685a0501ee871b61;US-Militärhilfe: Was die Milliarden Kiew bringen;https://www.zeit.de/news/2024-04/23/us-militaerhilfe-was-die-milliarden-kiew-bringen;Hier finden Sie Informationen zu dem Thema „Fragen & Antworten“. Lesen Sie jetzt „US-Militärhilfe: Was die Milliarden Kiew bringen“.;"Z+ (abopflichtiger Inhalt);
        
    
Fragen & Antworten";News, Fragen & Antworten, Joe Biden, Mark Warner, Patrick Ryder, Wolodymyr Selenskyj, Kiew, Donezk, Russland, USA, Iran, Nordkorea;2024-04-23T10:40:48+02:00;2024-04-23T10:40:48+02:00;;dpa;false
1da6920e7749c2fc2abea36c5ebe3af6213b653fcfc62cdd85dc788be6aaffce;Höcke soll Möglichkeit zur Aussage bekommen;https://www.zeit.de/news/2024-04/23/hoecke-soll-moeglichkeit-zur-aussage-bekommen;Hier finden Sie Informationen zu dem Thema „Extremismus“. Lesen Sie jetzt „Höcke soll Möglichkeit zur Aussage bekommen“.;"Z+ (abopflichtiger Inhalt);
        
    
Extremismus";News, Extremismus, Björn Höcke, Thüringen, NSDAP, Alternative für Deutschland, Staatsanwaltschaft;2024-04-23T10:40:46+02:00;2024-04-23T10:40:46+02:00;;dpa;false
6acb95e700cf0ed87dfc62299ca1de47ec441119e5c0a7b7b3f8079770c2221e;Faeser sieht Krah in Verantwortung für Spionageverdächtigen;https://www.zeit.de/politik/2024-04/festnahme-spionage-mitarbeiter-maximilian-krah-afd-faeser-notz-beunruhigt;"Bundesinnenministerin Nancy Faeser bezeichnet die neuen Spionagevorwürfe als ""äußerst schwerwiegend"". China streitet die Vorwürfe ab. Politiker fordern Konsequenzen.";"Z+ (abopflichtiger Inhalt);
        
    
Maximilian Krah";Politik, Maximilian Krah, Maximilian Krah, Nancy Faeser, Konstantin von Notz, Ronny Hartmann, Germany, Magdeburg, China, Alternative für Deutschland, Einflussnahme, Festnahme;2024-04-23T10:39:35+02:00;2024-04-23T10:39:35+02:00;;ZEIT ONLINE,        AFP,        dpa,        sko;false
f884815fa7bf07c999aee303f1c3f2ea37e4044387e99ec53439817f4a42caf9;Schüler fordern Meldestellen wegen Zunahme an Gewalttaten;https://www.zeit.de/news/2024-04/23/schueler-fordern-meldestellen-wegen-zunahme-an-gewalttaten;Hier finden Sie Informationen zu dem Thema „Kriminalität“. Lesen Sie jetzt „Schüler fordern Meldestellen wegen Zunahme an Gewalttaten“.;"Z+ (abopflichtiger Inhalt);
        
    
Kriminalität";News, Kriminalität, Meldestelle, Gewalttat, Zunahme, Kriminalität;2024-04-23T10:39:22+02:00;2024-04-23T10:39:22+02:00;;dpa Baden-Württemberg;false
fdc4b1a21cb773a382decd68c52aca347a5029d8b506263ca912f94e2ec6949f;Stoltenberg besucht Luftwaffe in Rostock-Laage;https://www.zeit.de/news/2024-04/23/stoltenberg-besucht-luftwaffe-in-rostock-laage;Hier finden Sie Informationen zu dem Thema „Nato-Generalsekretär“. Lesen Sie jetzt „Stoltenberg besucht Luftwaffe in Rostock-Laage“.;"Z+ (abopflichtiger Inhalt);
        
    
Nato-Generalsekretär";News, Nato-Generalsekretär, Jens Stoltenberg, Rostock-Laage, Laage, Rostock, Nato, Luftwaffe, Luftwaffenstützpunkt;2024-04-23T10:33:08+02:00;2024-04-23T10:33:08+02:00;;dpa Mecklenburg-Vorpommern;false
c68ed4ddd2a7920eeb37e86d39d1db828bc7fe716e2feee96dc5f750c8830ddb;Nominierte für Deutschen Sachbuchpreis stehen fest;https://www.zeit.de/news/2024-04/23/nominierte-fuer-deutschen-sachbuchpreis-stehen-fest;Hier finden Sie Informationen zu dem Thema „Auszeichnungen“. Lesen Sie jetzt „Nominierte für Deutschen Sachbuchpreis stehen fest“.;"Z+ (abopflichtiger Inhalt);
        
    
Auszeichnungen";News, Auszeichnungen, Sachbuchpreis, Klimawandel;2024-04-23T10:32:05+02:00;2024-04-23T10:32:05+02:00;;dpa;false
0229a2f74a1827cf426d3a35442eab3a7934d7691074e5a158546eb14a46ee55;Möbelhersteller Hülsta droht Betriebseinstellung;https://www.zeit.de/news/2024-04/23/moebelhersteller-huelsta-droht-betriebseinstellung;Hier finden Sie Informationen zu dem Thema „Einzelhandel“. Lesen Sie jetzt „Möbelhersteller Hülsta droht Betriebseinstellung“.;"Z+ (abopflichtiger Inhalt);
        
    
Einzelhandel";News, Einzelhandel, Westfalen, Stadtlohn, Hüls, Hülsta-Werke Hüls, Betriebseinstellung, Einzelhandel, Insolvenz, Möbel;2024-04-23T10:30:43+02:00;2024-04-23T10:30:43+02:00;;dpa Nordrhein-Westfalen;false
395a680e0ffd411e500d082eee339d69a2a57950c98a7d612da28d35ca85cf84;Kinderpornografie? Prozess gegen Lehrerin im September;https://www.zeit.de/news/2024-04/23/kinderpornografie-prozess-gegen-lehrerin-im-september;Hier finden Sie Informationen zu dem Thema „Kriminalität“. Lesen Sie jetzt „Kinderpornografie? Prozess gegen Lehrerin im September“.;Kriminalität;News, Kriminalität, Montabaur, Koblenz, Amtsgericht, Staatsanwaltschaft, Kriminalität, Sexualisierte Gewalt an Kindern;2024-04-23T10:28:55+02:00;2024-04-23T10:28:55+02:00;;dpa Rheinland-Pfalz/Saarland;false
a0ee142beeb895a05a4ca006982b6d225a38c98b7927f40096848d2e9e4d473a;Fast alle Ermittlungen zu rechtsextremen Vorfällen eingestellt;https://www.zeit.de/gesellschaft/schule/2024-04/brandenburg-rassismus-schule-burg-ermittlungen-einstellen;An einer Schule in Burg zeigten Schüler vor einem Jahr den Hitlergruß, schmierten Hakenkreuze, verhielten sich rassistisch. Fünf von sieben Verfahren wurden eingestellt.;"Z+ (abopflichtiger Inhalt);
        
    
Schule in Brandenburg";Gesellschaft, Schule in Brandenburg, Brandenburg, Staatsanwaltschaft, Ermittlung, Hitlergruß;2024-04-23T10:28:54+02:00;2024-04-23T10:28:54+02:00;;ZEIT ONLINE,        AFP,        lkk;false
3f7432a01e19076ead753d6d7137d4bdcfe80c76ebe0ab9aa66bcac22ab50846;Prozess um zerstückelte Leiche endet mit Haftstrafen;https://www.zeit.de/news/2024-04/23/prozess-um-zerstueckelte-leiche-endet-mit-haftstrafen;Hier finden Sie Informationen zu dem Thema „Kriminalität“. Lesen Sie jetzt „Prozess um zerstückelte Leiche endet mit Haftstrafen“.;"Z+ (abopflichtiger Inhalt);
        
    
Kriminalität";News, Kriminalität, Stralsund, Haftstrafe, Landgericht, Kriminalität, Herbst;2024-04-23T10:28:23+02:00;2024-04-23T10:28:23+02:00;;dpa;false
ac4a000fe9c3de4d34e4a1a0d78421e71935665aded2bb082d97db619b21e7a8;IEA: China-Importe können E-Auto-Preise in Europa drücken;https://www.zeit.de/news/2024-04/23/iea-china-importe-koennen-e-auto-preise-in-europa-druecken;Hier finden Sie Informationen zu dem Thema „Elektromobilität“. Lesen Sie jetzt „IEA: China-Importe können E-Auto-Preise in Europa drücken“.;"Z+ (abopflichtiger Inhalt);
        
    
Elektromobilität";News, Elektromobilität, Europa, Paris, China, Elektroauto, Ladestelle, Elektromobilität;2024-04-23T10:26:21+02:00;2024-04-23T10:26:21+02:00;;dpa;false
a90fbccce11c88dd8ffd7d3190e3cef478d3a8405d5ce6db646c552eaff6a9c8;Radfahrer gerät in Schienen und prallt gegen Tram: tot;https://www.zeit.de/news/2024-04/23/radfahrer-geraet-in-schienen-und-prallt-gegen-tram-tot;Hier finden Sie Informationen zu dem Thema „Unfall“. Lesen Sie jetzt „Radfahrer gerät in Schienen und prallt gegen Tram: tot“.;"Z+ (abopflichtiger Inhalt);
        
    
Unfall";News, Unfall, Polizei, Unfall, Tram;2024-04-23T10:24:32+02:00;2024-04-23T10:24:32+02:00;;dpa Berlin/Brandenburg;false
9a75b906c30019a5bd6ed5237cc34a4a585d0eff02a6570175bd89defa234a05;"SPD kritisiert FDP-Wirtschaftsplan als ""Angriff auf die Fleißigen""";https://www.zeit.de/politik/2024-04/spd-fdp-12-punkte-plan-sozialleistungen;"Wirtschaftspolitik auf Kosten der arbeitenden Mitte sei ""der falsche Weg"", erwidert die SPD auf den 12-Punkte-Plan der FDP. Sie legt konkrete Gegenargumente vor.";"Z+ (abopflichtiger Inhalt);
        
    
12-Punkte-Plan";Politik, 12-Punkte-Plan, FDP, SPD, Gegenargument, Angriff, Wirtschaftspolitik;2024-04-23T10:18:45+02:00;2024-04-23T10:18:45+02:00;;ZEIT ONLINE,        kzi;false
1a373c03766dfe7750d2262ec9726bb070b97dde943bb1f186cad9f10c44debf;Täter nach Geldautomatensprengungen auf der Flucht;https://www.zeit.de/news/2024-04/23/taeter-nach-geldautomatensprengungen-auf-der-flucht;Hier finden Sie Informationen zu dem Thema „Kriminalität“. Lesen Sie jetzt „Täter nach Geldautomatensprengungen auf der Flucht“.;"Z+ (abopflichtiger Inhalt);
        
    
Kriminalität";News, Kriminalität, Polizei, LKA, Geldautomatensprengung, Kriminalität, Geldautomat;2024-04-23T10:17:03+02:00;2024-04-23T10:17:03+02:00;;dpa Baden-Württemberg;false
455832199719d7b59994aafb0042f820a5e7ebc27fac506f5e8e6430a301facc;Hunderte Einsatzkräfte suchen nach vermisstem Sechsjährigen;https://www.zeit.de/news/2024-04/23/hunderte-einsatzkraefte-suchen-nach-vermisstem-sechsjaehrigen;Hier finden Sie Informationen zu dem Thema „Notfall“. Lesen Sie jetzt „Hunderte Einsatzkräfte suchen nach vermisstem Sechsjährigen“.;Notfall;News, Notfall, Bremervörde, Polizei, Einsatzkraft, Notfall;2024-04-23T10:15:07+02:00;2024-04-23T10:15:07+02:00;;dpa Niedersachsen;false
133299c225ba3b280741ae501dfc7f3665deedaacb4b4b013b95e64225f66c74;Im Zweifel für den Verbrenner;https://www.zeit.de/mobilitaet/2024-04/gebrauchte-e-autos-preise-vergleich-verbrenner;Das Angebot an elektrischen Gebrauchtwagen ist inzwischen groß, und die Preise sind eingebrochen. Warum entscheiden sich viele Kunden trotzdem für einen Verbrenner?;"Z+ (abopflichtiger Inhalt);
        
    
Gebrauchte E-Autos";Mobilitaet, Gebrauchte E-Autos, Gebrauchtwagen, Elektroauto, Elektromobilität, Autoindustrie, Umweltschutz, Bundesregierung;2024-04-23T10:11:28+02:00;2024-04-23T10:11:28+02:00;Antonia Schaefer;;false
7c94f11e873452ff961245cbbbfaad463c8b2e5daa9af2c1b5c58b51feb725e1;Maschinenbauer seltener von Produktpiraterie betroffen;https://www.zeit.de/news/2024-04/23/maschinenbauer-seltener-von-produktpiraterie-betroffen;Hier finden Sie Informationen zu dem Thema „Industrie“. Lesen Sie jetzt „Maschinenbauer seltener von Produktpiraterie betroffen“.;"Z+ (abopflichtiger Inhalt);
        
    
Industrie";News, Industrie, Hannover, VDMA, Produktpiraterie;2024-04-23T10:10:10+02:00;2024-04-23T10:10:10+02:00;;dpa Niedersachsen;false
dd6ee234e360cf56f9725154584b9321d43443f61a8a2644dd474d9349684f9a;Ahrtal-Ermittlung: Experte sieht kaum Chancen für Beschwerde;https://www.zeit.de/news/2024-04/23/ende-der-ahrtal-ermittlungen-beschwerde-von-hinterbliebenen;Hier finden Sie Informationen zu dem Thema „Flutkatastrophe“. Lesen Sie jetzt „Ahrtal-Ermittlung: Experte sieht kaum Chancen für Beschwerde“.;"Z+ (abopflichtiger Inhalt);
        
    
Flutkatastrophe";News, Flutkatastrophe, Ralph Orth, Christian Hecken, Koblenz, Ahrtal, Ahr, Staatsanwaltschaft, Flutkatastrophe im Ahrtal, Beschwerde, Flutkatastrophe, Generalstaatsanwaltschaft;2024-04-23T10:07:38+02:00;2024-04-23T10:07:38+02:00;;dpa Rheinland-Pfalz/Saarland;false
8a5b15fa776198364e22c0685b652827f48cb2b0be89c38efcfc33b820daecf7;Studie: Stimmungstief und Rechtsruck bei junger Generation;https://www.zeit.de/news/2024-04/23/studie-stimmungstief-und-rechtsruck-bei-junger-generation;Hier finden Sie Informationen zu dem Thema „Jugend im Krisenmodus“. Lesen Sie jetzt „Studie: Stimmungstief und Rechtsruck bei junger Generation“.;"Z+ (abopflichtiger Inhalt);
        
    
Jugend im Krisenmodus";News, Jugend im Krisenmodus, Simon Schnetzer, Klaus Hurrelmann, Kilian Hampel, Alternative für Deutschland, SPD, TikTok, Bundestagswahl, Rechtsruck, Stimmungstief, Krisenmodus;2024-04-23T10:06:22+02:00;2024-04-23T10:06:22+02:00;;dpa;false
2a70a47179605304256bd093e8613976429c00ce1928f54237ceba236cc6d4dd;Prozess um Zerstückelung: Männer zu Haftstrafen verurteilt;https://www.zeit.de/news/2024-04/23/prozess-um-zerstueckelung-maenner-zu-haftstrafen-verurteilt;Hier finden Sie Informationen zu dem Thema „Vorpommern-Rügen“. Lesen Sie jetzt „Prozess um Zerstückelung: Männer zu Haftstrafen verurteilt“.;"Z+ (abopflichtiger Inhalt);
        
    
Vorpommern-Rügen";News, Vorpommern-Rügen, Zerstückelung, Haftstrafe, Fußfessel, Herbst;2024-04-23T10:00:33+02:00;2024-04-23T10:00:33+02:00;;dpa Mecklenburg-Vorpommern;false
b2d54769bab0704c6b1d8b80a0686954400141198a8a7d2235c5475d9b7e0698;Russland soll ukrainische Siedlung bei Awdijiwka eingenommen haben;https://www.zeit.de/politik/ausland/karte-ukraine-krieg-russland-frontverlauf-truppenbewegungen;Westlich der Stadt Awdijiwka rücken russische Truppen weiter vor. Die Stadt Tschassiw Jar wird von mehreren Seiten angegriffen.;"Z+ (abopflichtiger Inhalt);
        
    
Ukraine-Karte aktuell";Politik, Ukraine-Karte aktuell, Krieg in der Ukraine, Russland, Donezk, Militär, Streitkräfte, Ukraine;2024-04-23T10:00:08+02:00;2024-04-23T10:00:08+02:00;Yevgeniya ShcherbakovaDominik LenzeTimo StukenbergSascha VenohrAnnick EhmannChristian EndtDavid SchachJulius TrögerBenja Zehr;;false
c01dc4a5c04e4b73805271b927458b35fd8e4ce8f202c0619b203017d8c38472;Dem Jenischpark geht es schlecht – sagt eine Diagnose aus dem All;https://www.zeit.de/hamburg/2024-04/elbvertiefung-23-04-2024;In Hamburg ist man überrascht. Außerdem: Tschentscher überraschend zu Besuch in Kiew, Cum-Ex-Chefermittlerin kündigt und übt Kritik;"Z+ (abopflichtiger Inhalt);
        
    
Jenischpark";Hamburg, Jenischpark, Jonas Walzberg, Florian Zinnecker, Peter Tschentscher, Vitali Klitschko, Norbert Kühn, Hamburg, Kiew, Westfield, Jenischpark, HafenCity;2024-04-23T10:00:03+02:00;2024-04-23T10:00:03+02:00;Florian Zinnecker;;false
16dd6ca6cd6e9a131dde687f01259b82e6943b8cb7b9061fbbb18bc7e47beea7;Neues Wahlrecht: Verfassungskonform oder nicht?;https://www.zeit.de/news/2024-04/23/neues-wahlrecht-verfassungskonform-oder-nicht;Hier finden Sie Informationen zu dem Thema „Fragen & Antworten“. Lesen Sie jetzt „Neues Wahlrecht: Verfassungskonform oder nicht?“.;"Z+ (abopflichtiger Inhalt);
        
    
Fragen & Antworten";News, Fragen & Antworten, Karlsruhe, Berlin, Bundesverfassungsgericht, FDP, Bundestag, CDU, CSU, SPD, Bundestagswahl, Wahlrecht;2024-04-23T09:58:36+02:00;2024-04-23T09:58:36+02:00;;dpa;false
b18b1b830379ed3e4220b4b31ca9f6dc53de64f5f637b0a4aa0dea4e2b8629a5;Ampel-Vertreter zuversichtlich vor Wahlrechts-Verhandlung;https://www.zeit.de/news/2024-04/23/ampel-vertreter-zuversichtlich-vor-wahlrechts-verhandlung;Hier finden Sie Informationen zu dem Thema „Reform“. Lesen Sie jetzt „Ampel-Vertreter zuversichtlich vor Wahlrechts-Verhandlung“.;"Z+ (abopflichtiger Inhalt);
        
    
Reform";News, Reform, Konstantin Kuhle, Karlsruhe, Bundesverfassungsgericht, FDP, Bundestag, Ampelkoalition, Wahlrecht;2024-04-23T09:57:51+02:00;2024-04-23T09:57:51+02:00;;dpa Bayern;false
808dc67410c5c5c5a7b09b156dc11d2718228ddcae7132ae6841c10bdbef35c0;Kohlenmonoxid in Wohnung: Drei Bewohner im Krankenhaus;https://www.zeit.de/news/2024-04/23/kohlenmonoxid-in-wohnung-drei-bewohner-im-krankenhaus;Hier finden Sie Informationen zu dem Thema „Dortmund “. Lesen Sie jetzt „Kohlenmonoxid in Wohnung: Drei Bewohner im Krankenhaus“.;"Z+ (abopflichtiger Inhalt);
        
    
Dortmund";News, Dortmund , Dortmund, Feuerwehr, Kohlenmonoxid, Feuerwehrwagen, Blaulicht;2024-04-23T09:52:24+02:00;2024-04-23T09:52:24+02:00;;dpa Nordrhein-Westfalen;false
0fc556ea1a489f874deb56dd71adb262e0571c225327ac8a9509ec63e206e9e2;"Nordkorea probt mit Raketen für ""nuklearen Gegenangriff""";https://www.zeit.de/news/2024-04/23/nordkorea-probt-mit-raketen-fuer-nuklearen-gegenangriff;"Hier finden Sie Informationen zu dem Thema „Konflikte“. Lesen Sie jetzt „Nordkorea probt mit Raketen für ""nuklearen Gegenangriff""“.";"Z+ (abopflichtiger Inhalt);
        
    
Konflikte";News, Konflikte, Kim Jong Un, Nordkorea, USA, Südkorea, Gegenangriff, Rakete, Raketenübung, Militär;2024-04-23T09:52:08+02:00;2024-04-23T09:52:08+02:00;;dpa;false
a85ecd57d911f0b6fa90fdc012e5fb4adf05b50f5a29a0fbb79b446f3413389a;"Frauenanteil in vielen klassischen ""Männerberufen"" steigt";https://www.zeit.de/arbeit/2024-04/maennerberufe-frauenanteil-zuwachs-girls-day-boys-day;Informatik, Forschung und Entwicklung: In Jobs mit hohem Männeranteil bleiben Frauen unterrepräsentiert. In den vergangenen zehn Jahren legten die Quoten jedoch zu.;Geschlechterunterschiede;Geschlechterunterschied, Männerberuf, Männeranteil, Informatik, Frauenanteil;2024-04-23T09:52:00+02:00;2024-04-23T09:52:00+02:00;;ZEIT ONLINE,        Reuters,        dpa,        lkk;false
258edb9f1680e4ac1c30c012a33594acf25bbc9750dbede6afa6c27e86e26a74;Als Frau lieber zu einer Ärztin?;https://www.zeit.de/news/2024-04/23/als-frau-lieber-zu-einer-aerztin;Hier finden Sie Informationen zu dem Thema „Gesundheit“. Lesen Sie jetzt „Als Frau lieber zu einer Ärztin?“.;"Z+ (abopflichtiger Inhalt);
        
    
Gesundheit";News, Gesundheit, Ute Seeland, Universität Tokio, Sterberate;2024-04-23T09:49:18+02:00;2024-04-23T09:49:18+02:00;;dpa;false
415f16be6a32f9e42873feadf67c8df7f91dc0dac9767ae7017c93af4e0879bc;Kliniken in Not können Hilfe über Kreditprogramm beantragen;https://www.zeit.de/news/2024-04/23/kliniken-in-not-koennen-hilfe-ueber-kreditprogramm-beantragen;Hier finden Sie Informationen zu dem Thema „Finanzierung“. Lesen Sie jetzt „Kliniken in Not können Hilfe über Kreditprogramm beantragen“.;"Z+ (abopflichtiger Inhalt);
        
    
Finanzierung";News, Finanzierung, Brandenburg, ILB, Kreditprogramm, Klinik;2024-04-23T09:48:11+02:00;2024-04-23T09:48:11+02:00;;dpa Berlin/Brandenburg;false
09e9d9ae1af29879636d8ca919ef4ce77102397dea4fb5a627c5eb1194a1251d;Medienbericht: VfB Stuttgart gibt Dahoud im Sommer wieder ab;https://www.zeit.de/news/2024-04/23/medienbericht-vfb-stuttgart-gibt-dahoud-im-sommer-wieder-ab;Hier finden Sie Informationen zu dem Thema „Transfer“. Lesen Sie jetzt „Medienbericht: VfB Stuttgart gibt Dahoud im Sommer wieder ab“.;"Z+ (abopflichtiger Inhalt);
        
    
Transfer";News, Transfer, Mahmoud Dahoud, Stuttgart, VfB Stuttgart, Sommer;2024-04-23T09:46:32+02:00;2024-04-23T09:46:32+02:00;;dpa Baden-Württemberg;false
7a0342a4be4512474260f68fd03b985aeb80abc63868fc9b621e7b875a1a2f4c;Zwei Geldautomatensprengungen: Täter auf der Flucht;https://www.zeit.de/news/2024-04/23/zwei-geldautomatensprengungen-taeter-auf-der-flucht;Hier finden Sie Informationen zu dem Thema „Landkreis Würzburg“. Lesen Sie jetzt „Zwei Geldautomatensprengungen: Täter auf der Flucht“.;"Z+ (abopflichtiger Inhalt);
        
    
Landkreis Würzburg";News, Landkreis Würzburg, Landkreis Würzburg, Polizei, LKA, Geldautomatensprengung, Geldautomat;2024-04-23T09:46:05+02:00;2024-04-23T09:46:05+02:00;;dpa Bayern;false
d17a1b6dce89e17438935ae1a36e486a914d045daf6a92936c74e5d7a43e943a;Mitarbeiter von EU-Politiker festgenommen: Wohl China-Spion;https://www.zeit.de/news/2024-04/23/mitarbeiter-von-eu-politiker-festgenommen-wohl-china-spion;Hier finden Sie Informationen zu dem Thema „Geheimdienst“. Lesen Sie jetzt „Mitarbeiter von EU-Politiker festgenommen: Wohl China-Spion“.;"Z+ (abopflichtiger Inhalt);
        
    
Geheimdienst";News, Geheimdienst, Maximilian Krah, Dresden, China, EU, Geheimdienst, Spionage;2024-04-23T09:44:11+02:00;2024-04-23T09:44:11+02:00;;dpa Sachsen;false
5bf558fca11cbbf816fd4b5a4a25507d27ab010d57f871fba484eeca7bf21b86;Obduktion von toter Frau aus Bachbett am Vormittag;https://www.zeit.de/news/2024-04/23/obduktion-von-toter-frau-aus-bachbett-am-vormittag;Hier finden Sie Informationen zu dem Thema „Kitzingen“. Lesen Sie jetzt „Obduktion von toter Frau aus Bachbett am Vormittag“.;"Z+ (abopflichtiger Inhalt);
        
    
Kitzingen";News, Kitzingen, Kitzingen, Iphofen, Bachbett, Obduktion;2024-04-23T09:42:45+02:00;2024-04-23T09:42:45+02:00;;dpa Bayern;false
189cd9a19f50e85b28cd7858bf2d2473ff37afcbe1844033a1d6779a34c65f5c;Mehr Schweine geschlachtet in NRW;https://www.zeit.de/news/2024-04/23/mehr-schweine-geschlachtet-in-nrw;Hier finden Sie Informationen zu dem Thema „Fleischkonsum“. Lesen Sie jetzt „Mehr Schweine geschlachtet in NRW“.;"Z+ (abopflichtiger Inhalt);
        
    
Fleischkonsum";News, Fleischkonsum, NRW, Nordrhein-Westfalen, Tönnies, Fleischkonsum, Fleischunternehmen, Kühlhaus;2024-04-23T09:39:44+02:00;2024-04-23T09:39:44+02:00;;dpa Nordrhein-Westfalen;false
18e539606e0b17c407c3b0d345a4d7c95ad1ddaa254c9852953f81c84aedd81e;Britisches Parlament verabschiedet umstrittenes Ruanda-Gesetz;https://www.zeit.de/politik/ausland/2024-04/britisches-parlament-verabschiedet-umstrittenes-ruanda-gesetz;Migranten, die mit Booten in Großbritannien ankommen, können künftig nach Ruanda abgeschoben werden. Premier Rishi Sunak hofft auf erste Abschiebeflüge in zehn Wochen.;"Z+ (abopflichtiger Inhalt);
        
    
Asylgesetz";Politik, Asylgesetz, Großbritannien, Ruanda, Asylpolitik, Migration, Abschiebung;2024-04-23T09:39:02+02:00;2024-04-23T09:39:02+02:00;;ZEIT ONLINE,        AFP,        dpa,        lip,        sko;false
e78304367d0e0ee6112f103f455a6ffc12fd6eaafcfd920a3a763fd080370576;"SPD-Generalsekretär Kühnert: ""Bündnis bleibt das richtige""";https://www.zeit.de/news/2024-04/23/spd-generalsekretaer-kuehnert-buendnis-bleibt-das-richtige;"Hier finden Sie Informationen zu dem Thema „Regierungsbündnis“. Lesen Sie jetzt „SPD-Generalsekretär Kühnert: ""Bündnis bleibt das richtige""“.";"Z+ (abopflichtiger Inhalt);
        
    
Regierungsbündnis";News, Regierungsbündnis, Kevin Kühnert, FDP, SPD, Regierungsbündnis, Ampelkoalition;2024-04-23T09:28:20+02:00;2024-04-23T09:28:20+02:00;;dpa;false
f6e8528418578bbe9a0e5b92dea5557f5272ec339c886e1fcecd7129972b2ca5;Behrens übt Kritik an Solidaritätsdemos für RAF-Terroristin;https://www.zeit.de/news/2024-04/23/behrens-uebt-kritik-an-solidaritaetsdemos-fuer-raf-terroristin;Hier finden Sie Informationen zu dem Thema „Innenministerin“. Lesen Sie jetzt „Behrens übt Kritik an Solidaritätsdemos für RAF-Terroristin“.;"Z+ (abopflichtiger Inhalt);
        
    
Innenministerin";News, Innenministerin, Daniela Behrens, Daniela Klette, Niedersachsen, RAF, Solidaritätsdemo, Kritik;2024-04-23T09:27:13+02:00;2024-04-23T09:27:13+02:00;;dpa Niedersachsen;false
33500a20e4e362addbdc092f08c719fdb0b9802f423f3cd339d610aba941793b;"Kultfilm ""Priscilla"" soll Sequel bekommen";https://www.zeit.de/news/2024-04/23/kultfilm-priscilla-soll-sequel-bekommen;"Hier finden Sie Informationen zu dem Thema „Roadmovie“. Lesen Sie jetzt „Kultfilm ""Priscilla"" soll Sequel bekommen“.";"Z+ (abopflichtiger Inhalt);
        
    
Roadmovie";News, Roadmovie, Guy Pearce, Queen, Australien, Kultfilm, Sequel, Roadmovie;2024-04-23T09:26:01+02:00;2024-04-23T09:26:01+02:00;;dpa;false
54ec1185e2a477e7852d33c2ecc2af3e6a7ea6e16918390ab53876fac1f6c5f1;Zweiter Verhandlungstag im Prozess gegen Höcke begonnen;https://www.zeit.de/news/2024-04/22/im-hoecke-prozess-aussage-des-angeklagten-erwartet;Hier finden Sie Informationen zu dem Thema „SA-Parolen“. Lesen Sie jetzt „Zweiter Verhandlungstag im Prozess gegen Höcke begonnen“.;"Z+ (abopflichtiger Inhalt);
        
    
SA-Parolen";News, SA-Parolen, Björn Höcke, Alternative für Deutschland, Staatsanwaltschaft;2024-04-23T11:01:15+02:00;2024-04-23T11:01:15+02:00;;dpa Thüringen;false
