Hash;Title;Link;Description;Category;KeyWords;Published;LastUpdated;Author;Source;Paywall
b46e3773f373f878bd6ece5cce59904f6a9163e319b1109e92010fda72df2700;Linke sieht Richtungswahl - Gysi warnt vor Rechtsruck;https://www.zeit.de/news/2024-06/07/linke-sieht-richtungswahl-gysi-warnt-vor-rechtsruck;Hier finden Sie Informationen zu dem Thema „Europawahl“. Lesen Sie jetzt „Linke sieht Richtungswahl - Gysi warnt vor Rechtsruck“.;"Z+ (abopflichtiger Inhalt);
        
    
Europawahl";News, Europawahl, Gregor Gysi, Potsdam, Europa, Die Linke, Bundestag, Europawahl, Rechtsruck, Richtungswahl, Europawahlkampf;2024-06-07T18:31:07+02:00;2024-06-07T18:31:07+02:00;;dpa Berlin/Brandenburg;false
4c1a756bef8b730368d8f94861a945bfdb810860cd0878ede87bfcc42666e4c2;Hochschule in Hamburg und Marine in Rostock dabei;https://www.zeit.de/news/2024-06/07/hochschule-in-hamburg-und-marine-in-rostock-dabei;Hier finden Sie Informationen zu dem Thema „Tag der Bundeswehr “. Lesen Sie jetzt „Hochschule in Hamburg und Marine in Rostock dabei“.;"Z+ (abopflichtiger Inhalt);
        
    
Tag der Bundeswehr";News, Tag der Bundeswehr , Hamburg, Rostock, Erfurt, Bundeswehr, Tag der Bundeswehr, Korvette, Marinestützpunkt;2024-06-07T18:28:11+02:00;2024-06-07T18:28:11+02:00;;dpa Hamburg/Schleswig-Holstein;false
77e79dbb4a40bd77b94912e38f352a645cb69c062b1bcd7ff55e25deabbd9d97;Dax fällt leicht zurück;https://www.zeit.de/news/2024-06/07/dax-vor-us-arbeitsmarktdaten-kaum-bewegt;Hier finden Sie Informationen zu dem Thema „Börse in Frankfurt“. Lesen Sie jetzt „Dax fällt leicht zurück“.;"Z+ (abopflichtiger Inhalt);
        
    
Börse in Frankfurt";News, Börse in Frankfurt, Frankfurt, Dax;2024-06-07T18:22:45+02:00;2024-06-07T18:22:45+02:00;;dpa;false
98a8467a055c31747619ce4eeadcfc88e9fb56d4e6a5a213919eab957984d7fe;Eon: Bis 27.000 Haushalte zeitweise ohne Strom: Hochwassers;https://www.zeit.de/news/2024-06/07/eon-bis-27-000-haushalte-zeitweise-ohne-strom-hochwassers;Hier finden Sie Informationen zu dem Thema „Unwetter“. Lesen Sie jetzt „Eon: Bis 27.000 Haushalte zeitweise ohne Strom: Hochwassers“.;"Z+ (abopflichtiger Inhalt);
        
    
Unwetter";News, Unwetter, Haushalt, Umspannwerk, Betriebsgebäude, Hochwasser, Unwetter;2024-06-07T18:22:38+02:00;2024-06-07T18:22:38+02:00;;dpa Bayern;false
dc0997a325e1b891ef339477911a435eb50478665afa3f9421573ebb9fa46812;"""Da habe ich Angst vor""";https://www.zeit.de/2024/25/magdeburg-intel-chip-fabriken-stimmung-sachsen-anhalt;Intel will bei Magdeburg zwei große Chipfabriken errichten. Die Versprechen sind groß – die Sorgen der Anwohner sind es auch.;"Z+ (abopflichtiger Inhalt);
        
    
Intel in Magdeburg";Wirtschaft, Intel in Magdeburg, Computer, Software, Magdeburg, Brandenburg, Sachsen-Anhalt, Intel;2024-06-07T18:21:03+02:00;2024-06-07T18:21:03+02:00;Benjamin Fischer;Aus der        ZEIT Nr. 25/2024;false
d9f2f5207d5e1c3e88712659fe4eb97268515dc86f924f2d6e5b39c8678b09a6;Wonder Woman;https://www.zeit.de/zeit-geschichte/2024/03/wikinger-frauen-kriegerinnen-dna-archaeologie-grab-birka;Eine DNA-Analyse von Knochenresten versetzt Archäologen in Aufruhr: In einem der schillerndsten Kriegergräber der Wikinger liegt eine Frau. Wer war sie?;"Z+ (abopflichtiger Inhalt);
        
    
Wikingerfrauen";Wissen, Wikingerfrauen, Archäologie, Wikinger, DNA-Analyse, Forschung, Frauen, Schweden;2024-06-07T18:19:53+02:00;2024-06-07T18:19:53+02:00;Nils Klawitter;Aus        ZEIT Geschichte Nr. 03/2024;false
0aa906c4ef00fafe3d4f1a843ca4cf0b77c333beb286bd8e177de7c16ee537ee;Berichte: Stuttgarts Torhüter Nübel nicht im EM-Kader;https://www.zeit.de/news/2024-06/07/berichte-stuttgarts-torhueter-nuebel-nicht-im-em-kader;Hier finden Sie Informationen zu dem Thema „Fußball“. Lesen Sie jetzt „Berichte: Stuttgarts Torhüter Nübel nicht im EM-Kader“.;"Z+ (abopflichtiger Inhalt);
        
    
Fußball";News, Fußball, Alexander Nübel, Julian Nagelsmann, Manuel Neuer, Stuttgart, Griechenland, FC Bayern München, TSG 1899 Hoffenheim, Uefa, Fußball-EM, Fußball;2024-06-07T18:19:53+02:00;2024-06-07T18:19:53+02:00;;dpa Baden-Württemberg;false
b46fae1b7dc36a5a544037f4f140389eb7ba30413fc30328767c705cd4653288;"""Goldener Spatz"" für Checker Tobi - Doku-Abenteuer gewinnt";https://www.zeit.de/news/2024-06/07/goldener-spatz-fuer-checker-tobi-doku-abenteuer-gewinnt;"Hier finden Sie Informationen zu dem Thema „Medien“. Lesen Sie jetzt „""Goldener Spatz"" für Checker Tobi - Doku-Abenteuer gewinnt“.";"Z+ (abopflichtiger Inhalt);
        
    
Medien";News, Medien, Johannes Honsell, Erfurt, Deutsches Kinder-Medien-Festival Goldener Spatz, Kinderjury;2024-06-07T18:18:08+02:00;2024-06-07T18:18:08+02:00;;dpa Thüringen;false
75739add74f890f8f5ecbdfe064d4328f8e618a006719767287032427b4f9a62;Billie war hier;https://www.zeit.de/kultur/musik/2024-06/billie-eilish-musik-berlin-plakette;Billie Eilish kommt nach Berlin und weiht am Billie-Eilish-Spot eine Billie-Eilish-Plakette ein. Sektkorken knallen nicht, aber immerhin ein paar Sicherungen durch.;"Z+ (abopflichtiger Inhalt);
        
    
Billie Eilish";Kultur, Billie Eilish, Popmusik, Musik, Album, Berlin, Jugendliche, Billie Eilish;2024-06-07T18:15:29+02:00;2024-06-07T18:15:29+02:00;Daniel GerhardtMarcus Glahn;;false
7f30fcda64be4d826ad65e65a29df78845b4653d1ccd5c72cd841fcdb1f3a483;Balci kritisiert Umgang mit Islamismus;https://www.zeit.de/news/2024-06/07/balci-kritisiert-umgang-mit-islamismus;Hier finden Sie Informationen zu dem Thema „Integrationsbeauftragte“. Lesen Sie jetzt „Balci kritisiert Umgang mit Islamismus“.;"Z+ (abopflichtiger Inhalt);
        
    
Integrationsbeauftragte";News, Integrationsbeauftragte, Güner Balci, Annalena Baerbock, Berlin, Neukölln, Mannheim, Islamismus, Attentat;2024-06-07T18:14:20+02:00;2024-06-07T18:14:20+02:00;;dpa Berlin/Brandenburg;false
0aa906c4ef00fafe3d4f1a843ca4cf0b77c333beb286bd8e177de7c16ee537ee;Berichte: Stuttgarts Torhüter Nübel nicht im EM-Kader;https://www.zeit.de/news/2024-06/07/kader-ohne-nuebel-aber-nagelsmann-entscheidung-offen;Hier finden Sie Informationen zu dem Thema „Nationalmannschaft“. Lesen Sie jetzt „Berichte: Stuttgarts Torhüter Nübel nicht im EM-Kader“.;"Z+ (abopflichtiger Inhalt);
        
    
Nationalmannschaft";News, Nationalmannschaft, Alexander Nübel, Rocco Reitz, Julian Nagelsmann, Griechenland, Mönchengladbach, Uefa, Fußball, Bundestrainer, Fußballnationalmannschaft;2024-06-07T18:11:54+02:00;2024-06-07T18:11:54+02:00;;dpa Sport;false
0fd2b1e90b75adf6132eb51903cc7c71379c26ac19e7c77e5b4030ac1339f01c;Werder Bremen holt Hansa-Kapitän Kolke;https://www.zeit.de/news/2024-06/07/werder-bremen-holt-hansa-kapitaen-kolke;Hier finden Sie Informationen zu dem Thema „Bundesliga“. Lesen Sie jetzt „Werder Bremen holt Hansa-Kapitän Kolke“.;"Z+ (abopflichtiger Inhalt);
        
    
Bundesliga";News, Bundesliga, Markus Kolke, Michael Zetterer, Rostock, Bremen, SV Werder Bremen, Bundesliga;2024-06-07T18:11:30+02:00;2024-06-07T18:11:30+02:00;;dpa Mecklenburg-Vorpommern;false
9add9e0344d9b8c2d71be4d0f6255522327cc34877351b8062b02fd9a2edee7f;Löser gewinnt erste Prüfung der Springreiterinnen in Balve;https://www.zeit.de/news/2024-06/07/loeser-gewinnt-erste-pruefung-der-springreiterinnen-in-balve;Hier finden Sie Informationen zu dem Thema „Pferdesport“. Lesen Sie jetzt „Löser gewinnt erste Prüfung der Springreiterinnen in Balve“.;"Z+ (abopflichtiger Inhalt);
        
    
Pferdesport";News, Pferdesport, Emilia Löser, Balve, Pferdesport;2024-06-07T18:03:20+02:00;2024-06-07T18:03:20+02:00;;dpa Nordrhein-Westfalen;false
138d3f586c0bd6bbe739f7488861e3dece77276b72ca07d0c525f1a17322e56c;Deutschland schiebt deutlich mehr Menschen ab;https://www.zeit.de/politik/deutschland/2024-06/bundesinnenministerium-abschiebungen-anstieg;Zwischen Januar und April 2024 wurden laut Bundesinnenministerium mehr als 6.000 Menschen aus Deutschland abgeschoben. Das waren 30 Prozent mehr als im Vorjahreszeitraum.;"Z+ (abopflichtiger Inhalt);
        
    
Bundesinnenministerium";Politik, Bundesinnenministerium, Abschiebung, Bundesinnenministerium, Syrien, Afghanistan, Migration, Asylrecht, Europa;2024-06-07T18:02:02+02:00;2024-06-07T18:02:02+02:00;;ZEIT ONLINE,        dpa,        als;false
440aa4c001c11ba512988f12708654b7dec9a6ddc5ef057f14aeee545aae3417;"""Mannheim steht zusammen"" Gedenken an Messerangriff";https://www.zeit.de/news/2024-06/07/mannheim-steht-zusammen-gedenken-an-messerangriff;"Hier finden Sie Informationen zu dem Thema „Kundgebung“. Lesen Sie jetzt „""Mannheim steht zusammen"" Gedenken an Messerangriff“.";"Z+ (abopflichtiger Inhalt);
        
    
Kundgebung";News, Kundgebung, Mannheim, Neckar, Alternative für Deutschland, Messerangriff, Kundgebung, Trauer;2024-06-07T17:55:37+02:00;2024-06-07T17:55:37+02:00;;dpa Baden-Württemberg;false
c6a14c14510b4caf1aa41b7053e459fdcfca537e8616d6d2e13cb27c8adfee79;Kretschmer trifft neue Patenkinder;https://www.zeit.de/news/2024-06/07/kretschmer-trifft-neue-patenkinder;Hier finden Sie Informationen zu dem Thema „Elf Drillige und ein Quartett“. Lesen Sie jetzt „Kretschmer trifft neue Patenkinder“.;"Z+ (abopflichtiger Inhalt);
        
    
Elf Drillige und ein Quartett";News, Elf Drillige und ein Quartett, Michael Kretschmer, Rötha, Leipzig, Plohn, Drillingstreffen;2024-06-07T17:53:07+02:00;2024-06-07T17:53:07+02:00;;dpa Sachsen;false
16f4ae346a98e9a3c9b3066c23742e0380ae0ad853edd7243abc064fc59c7466;Premierminister Modi erhält Unterstützung für dritte Amtszeit;https://www.zeit.de/politik/ausland/2024-06/nerandra-modi-indien-premierminister-dritte-amtszeit;Eine Koalition aus 15 Parteien wählte den indischen Premierminister Narendra Modi zu ihrem Anführer. Präsidentin Droupadi Murmu beauftragt ihn mit der Regierungsbildung.;"Z+ (abopflichtiger Inhalt);
        
    
Indien";Politik, Indien, Narendra Modi, Indien, Premierminister, Hinduismus, Neu-Delhi, Opposition;2024-06-07T17:49:43+02:00;2024-06-07T17:49:43+02:00;;ZEIT ONLINE,        AFP,        lkk;false
59043b9b2e256f669f5254f11b5496f56ae29771561c81ac38962d733245177f;Schweriner IHK-Chef fordert von Politik Mut zur Veränderung;https://www.zeit.de/news/2024-06/07/schweriner-ihk-chef-fordert-von-politik-mut-zur-veraenderung;Hier finden Sie Informationen zu dem Thema „Konjunktur“. Lesen Sie jetzt „Schweriner IHK-Chef fordert von Politik Mut zur Veränderung“.;"Z+ (abopflichtiger Inhalt);
        
    
Konjunktur";News, Konjunktur, Matthias Belke, Schwerin, IHK;2024-06-07T17:48:41+02:00;2024-06-07T17:48:41+02:00;;dpa Mecklenburg-Vorpommern;false
80a22e2dac4c1f287552760eedbd25b0a86069dd19d0ae0711b39d5fb8859c19;Schwerer Unfall mit mehrsitzigem Fahrrad;https://www.zeit.de/news/2024-06/07/schwerer-unfall-mit-mehrsitzigem-fahrrad;Hier finden Sie Informationen zu dem Thema „Weingarten“. Lesen Sie jetzt „Schwerer Unfall mit mehrsitzigem Fahrrad“.;"Z+ (abopflichtiger Inhalt);
        
    
Weingarten";News, Weingarten, Weingarten, Unfall, Rettungswagen, Fahrrad;2024-06-07T17:48:09+02:00;2024-06-07T17:48:09+02:00;;dpa Baden-Württemberg;false
d6909943455d990feae3da0b4f89b88e6a93d163901c28ee1adf786b8c97cfa3;Clubszene: Studie zeigt Ideen für Verbesserungen auf;https://www.zeit.de/news/2024-06/07/clubszene-studie-zeigt-ideen-fuer-verbesserungen-auf;Hier finden Sie Informationen zu dem Thema „Berlin“. Lesen Sie jetzt „Clubszene: Studie zeigt Ideen für Verbesserungen auf“.;"Z+ (abopflichtiger Inhalt);
        
    
Berlin";News, Berlin, Berlin, Clubszene;2024-06-07T17:46:38+02:00;2024-06-07T17:46:38+02:00;;dpa Berlin/Brandenburg;false
52762fa6f4f6dd1547e3422862990bb6bc651ea5fb48c25c963382c83dac97da;Drei Jahre Haft für Senioren-Betreuerin wegen Betrugs;https://www.zeit.de/news/2024-06/07/drei-jahre-haft-fuer-senioren-betreuerin-wegen-betrugs;Hier finden Sie Informationen zu dem Thema „Gericht“. Lesen Sie jetzt „Drei Jahre Haft für Senioren-Betreuerin wegen Betrugs“.;"Z+ (abopflichtiger Inhalt);
        
    
Gericht";News, Gericht, Frankfurt, Betrug, Landgericht, Senioren;2024-06-07T17:45:51+02:00;2024-06-07T17:45:51+02:00;;dpa Hessen;false
7a1329d2c3992cf5f2515e0d0a545d23ffeae80ce957b53cb195536503ea4ea9;Zwei Polizeibeamte in Wolfsburg bei Einsatz verletzt;https://www.zeit.de/news/2024-06/07/zwei-polizeibeamte-in-wolfsburg-bei-einsatz-verletzt;Hier finden Sie Informationen zu dem Thema „Kriminalität“. Lesen Sie jetzt „Zwei Polizeibeamte in Wolfsburg bei Einsatz verletzt“.;"Z+ (abopflichtiger Inhalt);
        
    
Kriminalität";News, Kriminalität, Wolfsburg, Polizei, Einsatzfahrzeug, Blaulicht, Kriminalität;2024-06-07T17:44:03+02:00;2024-06-07T17:44:03+02:00;;dpa Niedersachsen;false
64e1d2765987c89f600d2800737ddaa73b53e05051a9f0e904fa05aec8444942;Minister: Pflichtversicherung gegen Elementarschäden;https://www.zeit.de/news/2024-06/07/minister-pflichtversicherung-gegen-elementarschaeden;Hier finden Sie Informationen zu dem Thema „Hochwasser“. Lesen Sie jetzt „Minister: Pflichtversicherung gegen Elementarschäden“.;"Z+ (abopflichtiger Inhalt);
        
    
Hochwasser";News, Hochwasser, Ingmar Jung, Landwirtschaftsminister, Bad Dürkheim, CDU, Deutsche Presse-Agentur, Elementarschaden, Pflichtversicherung, Hochwasser;2024-06-07T17:43:50+02:00;2024-06-07T17:43:50+02:00;;dpa Hessen;false
4924b71429318684811909b9f86f001b36e4f5e37ab3712454ba844eb9fe591b;FTI storniert alle Pauschalreisen bis 5. Juli;https://www.zeit.de/news/2024-06/07/reiseveranstalter-fti-pauschalreisen-bis-5-juli-storniert;Hier finden Sie Informationen zu dem Thema „Tourismus“. Lesen Sie jetzt „FTI storniert alle Pauschalreisen bis 5. Juli“.;"Z+ (abopflichtiger Inhalt);
        
    
Tourismus";News, Tourismus, Axel Bierbach, München, FTI Touristik, Reisen, Pauschalreise, Reisesicherungsfonds, Reisekonzern, Reiseveranstalter;2024-06-07T17:42:27+02:00;2024-06-07T17:42:27+02:00;;dpa;false
ad6f1f51165252bc54034618b55edd04eb8b9d829e6de3e2df57050199e89a79;Russland rüstet sich für jahrzehntelange Kriegswirtschaft;https://www.zeit.de/news/2024-06/07/russland-ruestet-sich-fuer-jahrzehntelange-kriegswirtschaft;Hier finden Sie Informationen zu dem Thema „Wirtschaftsforum“. Lesen Sie jetzt „Russland rüstet sich für jahrzehntelange Kriegswirtschaft“.;"Z+ (abopflichtiger Inhalt);
        
    
Wirtschaftsforum";News, Wirtschaftsforum, Wladimir Putin, Dilma Rousseff, Denis Manturow, Russland, St. Petersburger, USA, Moskau, St. Petersburg, Kriegswirtschaft, Wirtschaftsforum;2024-06-07T17:41:45+02:00;2024-06-07T17:41:45+02:00;;dpa;false
04f699d95c27f92eebe295f052989cb4e86ba49dc78904600618f9a7ed63665b;Barrierefreier Campingplatz am Störmthaler See geplant;https://www.zeit.de/news/2024-06/07/barrierefreier-campingplatz-am-stoermthaler-see-geplant;Hier finden Sie Informationen zu dem Thema „Inklusion“. Lesen Sie jetzt „Barrierefreier Campingplatz am Störmthaler See geplant“.;"Z+ (abopflichtiger Inhalt);
        
    
Inklusion";News, Inklusion, Großpösna, Campingplatz, Inklusion;2024-06-07T17:39:44+02:00;2024-06-07T17:39:44+02:00;;dpa Sachsen;false
caa66650737ae854a0a6a2cee4dd9975352dae64ab663e45793628a469d8dfae;"""Demo-Rave"" und Kundgebungen vor der Europawahl";https://www.zeit.de/news/2024-06/07/demo-rave-und-kundgebungen-vor-der-europawahl;"Hier finden Sie Informationen zu dem Thema „Frankfurt“. Lesen Sie jetzt „""Demo-Rave"" und Kundgebungen vor der Europawahl“.";"Z+ (abopflichtiger Inhalt);
        
    
Frankfurt";News, Frankfurt, Frankfurt, Römerberg, Europawahl, Kundgebung, Schlusskundgebung;2024-06-07T17:39:27+02:00;2024-06-07T17:39:27+02:00;;dpa Hessen;false
e9da14586bf8fb982057e1ad27894d2123fbb1185134ea37739b0826c67f2c20;SPD-Spitze kommt zum Wahlkampf-Abschluss nach Duisburg;https://www.zeit.de/news/2024-06/07/spd-spitze-kommt-zum-wahlkampf-abschluss-nach-duisburg;Hier finden Sie Informationen zu dem Thema „Parteien“. Lesen Sie jetzt „SPD-Spitze kommt zum Wahlkampf-Abschluss nach Duisburg“.;"Z+ (abopflichtiger Inhalt);
        
    
Parteien";News, Parteien, Olaf Scholz, Duisburg, SPD, Europawahl, Wahlkampfauftritt, Wahlkampf;2024-06-07T17:37:03+02:00;2024-06-07T17:37:03+02:00;;dpa Nordrhein-Westfalen;false
3cb54e16d3a30ba0cfdfb731cfd9efc00ce53e6624419b60dae58a94db3923d5;Abschiebung von Afghanen: Taliban offen für Zusammenarbeit;https://www.zeit.de/news/2024-06/07/abschiebung-von-afghanen-taliban-offen-fuer-zusammenarbeit;Hier finden Sie Informationen zu dem Thema „Schwerstkriminelle“. Lesen Sie jetzt „Abschiebung von Afghanen: Taliban offen für Zusammenarbeit“.;"Z+ (abopflichtiger Inhalt);
        
    
Schwerstkriminelle";News, Schwerstkriminelle, Kabul, Afghanistan, Taliban, SPD, Zusammenarbeit, Abschiebestopp, Machtübernahme, Abschiebung, Islamisten;2024-06-07T17:36:18+02:00;2024-06-07T17:36:18+02:00;;dpa;false
2d60c79fdd8e10a25470ecb7cac0683b2162526d1e70269860a2df5a8071bfe8;FTI storniert alle Pauschalreisen bis zum 5. Juli;https://www.zeit.de/wirtschaft/unternehmen/2024-06/fti-pauschalreisen-storno-insolvenz-juli;Die Insolvenz des drittgrößten europäischen Reiseveranstalters trifft weitere Kunden: Alle Reisen bis zum 5. Juli fallen aus. Für die Zeit danach sei eine Lösung möglich.;"Z+ (abopflichtiger Inhalt);
        
    
Insolvenzverfahren";Wirtschaft, Insolvenzverfahren, Reisen, Insolvenz, Unternehmen, München, Flugzeug, Stornierung;2024-06-07T17:36:15+02:00;2024-06-07T17:36:15+02:00;;ZEIT ONLINE,        dpa,        Reuters,        AFP,        voi;false
5e8a7310e52e2ccde9e389da229d52dce86d8ec38b56e1898e3991b3636bec0f;Protest gegen Rechtsextremismus vor Europawahl;https://www.zeit.de/news/2024-06/07/protest-gegen-rechtsextremismus-vor-europawahl;Hier finden Sie Informationen zu dem Thema „10.000 angemeldet“. Lesen Sie jetzt „Protest gegen Rechtsextremismus vor Europawahl“.;"Z+ (abopflichtiger Inhalt);
        
    
10.000 angemeldet";News, 10.000 angemeldet, Berlin, Europawahl, Rechtsextremismus;2024-06-07T17:34:03+02:00;2024-06-07T17:34:03+02:00;;dpa Berlin/Brandenburg;false
01d5a744cc7c50c7eb938acf3d3b4d2ca9461d6b84de1a5d7b6d818615a68b9b;Demonstrationen für Demokratie in Stuttgart und Heidelberg;https://www.zeit.de/news/2024-06/07/demonstrationen-fuer-demokratie-in-stuttgart-und-heidelberg;Hier finden Sie Informationen zu dem Thema „Wahlen“. Lesen Sie jetzt „Demonstrationen für Demokratie in Stuttgart und Heidelberg“.;"Z+ (abopflichtiger Inhalt);
        
    
Wahlen";News, Wahlen, Stuttgart, Heidelberg, Schlossplatz, Baden-Württemberg, Alternative für Deutschland, DGB, Demonstration, Rechtsextremismus;2024-06-07T17:32:47+02:00;2024-06-07T17:32:47+02:00;;dpa Baden-Württemberg;false
5ef76feda77a4aaafd7f1440dfdc599390f073b114a48a6c67c9483eb3791d1e;Frostschäden bei Obst und Wein;https://www.zeit.de/news/2024-06/07/frostschaeden-bei-obst-und-wein;Hier finden Sie Informationen zu dem Thema „Land prüft Hilfen“. Lesen Sie jetzt „Frostschäden bei Obst und Wein“.;"Z+ (abopflichtiger Inhalt);
        
    
Land prüft Hilfen";News, Land prüft Hilfen, Susanna Karawanskij, Thüringen, Frostschaden, Nachtfrost, Blütenblatt;2024-06-07T17:32:13+02:00;2024-06-07T17:32:13+02:00;;dpa Thüringen;false
07bff929b88fa2d1f96098511e2688369f84ba3d646149e0d7ce448f4c4992f2;Sonne satt für Rock am Ring und Rock im Park;https://www.zeit.de/news/2024-06/07/sonne-satt-fuer-rock-am-ring-und-rock-im-park;Hier finden Sie Informationen zu dem Thema „Festivalsommer “. Lesen Sie jetzt „Sonne satt für Rock am Ring und Rock im Park“.;"Z+ (abopflichtiger Inhalt);
        
    
Festivalsommer";News, Festivalsommer , Nürnberg, Nürburg, Eifel, Nürburgring, Green Day, 1. FC Nürnberg, Billy Talent, Kraftklub, Rock im Park, Rock am Ring;2024-06-07T17:31:19+02:00;2024-06-07T17:31:19+02:00;;dpa;false
12d24f579610ffb97b0d7d5ae294961d4764b5ed2434ced4eadc293c683c817e;46 Jahre nach Mord an Studentin: Verdächtiger ausgeliefert;https://www.zeit.de/news/2024-06/07/46-jahre-nach-mord-an-studentin-verdaechtiger-ausgeliefert;Hier finden Sie Informationen zu dem Thema „USA“. Lesen Sie jetzt „46 Jahre nach Mord an Studentin: Verdächtiger ausgeliefert“.;"Z+ (abopflichtiger Inhalt);
        
    
USA";News, USA, USA, Bayern, Schweinfurt, Amtsgericht, Staatsanwaltschaft, Mord, Landgericht;2024-06-07T17:30:00+02:00;2024-06-07T17:30:00+02:00;;dpa Bayern;false
4022cf1b082f90b15d134412e97f93456bf93db0e3f1ea5b1d814ce98cd66a12;Mann soll Schülerinnen mit Waffe bedroht haben;https://www.zeit.de/news/2024-06/07/mann-soll-schuelerinnen-mit-waffe-bedroht-haben;Hier finden Sie Informationen zu dem Thema „Kehl“. Lesen Sie jetzt „Mann soll Schülerinnen mit Waffe bedroht haben“.;"Z+ (abopflichtiger Inhalt);
        
    
Kehl";News, Kehl, Kehl, Polizei;2024-06-07T17:27:58+02:00;2024-06-07T17:27:58+02:00;;dpa Baden-Württemberg;false
c317c728caa78f5b304d0a9dcc3676b4df7124b8ca762a463bcbefcbb1ffd4f1;Erneut Prozess wegen Holocaust-Leugnung in Hamburg gestartet;https://www.zeit.de/news/2024-06/06/95-jaehrige-haverbeck-wegen-holocaust-leugnung-vor-gericht;Hier finden Sie Informationen zu dem Thema „Amtsgericht Hamburg“. Lesen Sie jetzt „Erneut Prozess wegen Holocaust-Leugnung in Hamburg gestartet“.;"Z+ (abopflichtiger Inhalt);
        
    
Amtsgericht Hamburg";News, Amtsgericht Hamburg, Ursula Haverbeck, Auschwitz, Bahngleis;2024-06-07T17:25:49+02:00;2024-06-07T17:25:49+02:00;;dpa Hamburg/Schleswig-Holstein;false
e67dbb27ebdb1bb315f37cb6be00032d0019db46d375cce96a8a7428d33e333c;Bienenschwarm verirrt sich in Fußgängerzone;https://www.zeit.de/news/2024-06/07/bienenschwarm-verirrt-sich-in-fussgaengerzone;Hier finden Sie Informationen zu dem Thema „Offenburg“. Lesen Sie jetzt „Bienenschwarm verirrt sich in Fußgängerzone“.;"Z+ (abopflichtiger Inhalt);
        
    
Offenburg";News, Offenburg, Offenburg, Feuerwehr, Fußgängerzone, Bienenvolk;2024-06-07T17:21:04+02:00;2024-06-07T17:21:04+02:00;;dpa Baden-Württemberg;false
ba2727f54fe2a1281f5626a330772a7915ae22a7dd829248e27d0dfd719fffd4;Mutmaßlicher Tankstellenräuber in U-Haft;https://www.zeit.de/news/2024-06/07/mutmasslicher-tankstellenraeuber-in-u-haft;Hier finden Sie Informationen zu dem Thema „Ravensburg“. Lesen Sie jetzt „Mutmaßlicher Tankstellenräuber in U-Haft“.;"Z+ (abopflichtiger Inhalt);
        
    
Ravensburg";News, Ravensburg, Ravensburg, Polizei, Motorhaube, Streifenwagen;2024-06-07T17:15:57+02:00;2024-06-07T17:15:57+02:00;;dpa Baden-Württemberg;false
ed5eb082ac58cc85fda89ca03afca68739651dbc1da77ba8e51e201a68c226ee;"Matthäus in Sorge um Gladbach: Im ""grauen Niemandsland""";https://www.zeit.de/news/2024-06/07/matthaeus-in-sorge-um-gladbach-im-grauen-niemandsland;"Hier finden Sie Informationen zu dem Thema „Bundesliga“. Lesen Sie jetzt „Matthäus in Sorge um Gladbach: Im ""grauen Niemandsland""“.";"Z+ (abopflichtiger Inhalt);
        
    
Bundesliga";News, Bundesliga, Lothar Matthäus, Gladbach, Mönchengladbach, Borussia Mönchengladbach, Bundesliga, Niemandsland;2024-06-07T17:14:54+02:00;2024-06-07T17:14:54+02:00;;dpa Nordrhein-Westfalen;false
d873e960f657a034706aa68a97952ca8bc83f916945937fd20cafc2d50f62818;Milliardenschaden durch Hochwasser: Entspannung in Sicht;https://www.zeit.de/news/2024-06/07/umweltminister-zu-hochwasser-leider-noch-keine-entwarnung;Hier finden Sie Informationen zu dem Thema „Unwetter“. Lesen Sie jetzt „Milliardenschaden durch Hochwasser: Entspannung in Sicht“.;"Z+ (abopflichtiger Inhalt);
        
    
Unwetter";News, Unwetter, Thorsten Glauber, Donau, Bayern, Hochwasser, Unwetter, Hochwasserlage;2024-06-07T17:14:32+02:00;2024-06-07T17:14:32+02:00;;dpa Bayern;false
b4b5068e6ae7e9bdc72e1ecbc6cf7c52c83b6d2dd0d6827334b0687fd251b351;Feuer in Asklepios-Klinik Altona: 61-Jährige in Gewahrsam;https://www.zeit.de/news/2024-06/07/grosseinsatz-wegen-mehrerer-feuer-in-asklepios-klinik-altona;Hier finden Sie Informationen zu dem Thema „Brände“. Lesen Sie jetzt „Feuer in Asklepios-Klinik Altona: 61-Jährige in Gewahrsam“.;"Z+ (abopflichtiger Inhalt);
        
    
Brände";News, Brände, Altona, Feuerwehr, Brandbekämpfung, Einsatzfahrzeug, Blaulicht, Großeinsatz;2024-06-07T17:13:49+02:00;2024-06-07T17:13:49+02:00;;dpa Hamburg/Schleswig-Holstein;false
9b4cb7ab7c7b37ce387153d84b2d9ad52ba52d50d0e85593fde46f91324ccc43;"Prinz William bei ""Hochzeit des Jahres"" gesichtet";https://www.zeit.de/news/2024-06/07/prinz-william-bei-hochzeit-des-jahres-gesichtet;"Hier finden Sie Informationen zu dem Thema „Royals “. Lesen Sie jetzt „Prinz William bei ""Hochzeit des Jahres"" gesichtet“.";"Z+ (abopflichtiger Inhalt);
        
    
Royals";News, Royals , Olivia Henson, Hugh Grosvenor, Prinz William, König Charles, Prinz Harry, Meghan Markle, Westminster, Chester;2024-06-07T17:12:28+02:00;2024-06-07T17:12:28+02:00;;dpa;false
ecf40bfe7db79e5f0a9af6ee7b56fadadaaf8390f0cf95bedd0d25f62d368c46;Kinder- und Jugend-Kultur-Preis für junge Theatermacherin;https://www.zeit.de/news/2024-06/07/kinder-und-jugend-kultur-preis-fuer-junge-theatermacherin;Hier finden Sie Informationen zu dem Thema „Auszeichnung in Magdeburg“. Lesen Sie jetzt „Kinder- und Jugend-Kultur-Preis für junge Theatermacherin“.;"Z+ (abopflichtiger Inhalt);
        
    
Auszeichnung in Magdeburg";News, Auszeichnung in Magdeburg, Johanna Steudel, Magdeburg, Sachsen-Anhalt, Auszeichnung;2024-06-07T17:08:38+02:00;2024-06-07T17:08:38+02:00;;dpa Sachsen;false
ccb7761d67a23fbfdc6a9e7f0c05364c02b4dbaa4c305e74bd23b64deab13f28;"Joachim Llambi wird neuer ""Riverboat""-Moderator";https://www.zeit.de/news/2024-06/07/joachim-llambi-wird-neuer-riverboat-moderator;"Hier finden Sie Informationen zu dem Thema „MDR-Talkshow“. Lesen Sie jetzt „Joachim Llambi wird neuer ""Riverboat""-Moderator“.";"Z+ (abopflichtiger Inhalt);
        
    
MDR-Talkshow";News, MDR-Talkshow, Joachim Llambi, MDR;2024-06-07T17:05:33+02:00;2024-06-07T17:05:33+02:00;;dpa Sachsen;false
