Hash;Title;Link;Description;Category;KeyWords;Published;LastUpdated;Author;Source;Paywall
625caae7511716b8063c18b69dae962774f41e939eaa6701bc08a6f202d693e9;Seehund-Quartett des Kieler Aquariums wieder komplett;https://www.zeit.de/news/2024-06/07/seehund-quartett-des-kieler-aquariums-wieder-komplett;Hier finden Sie Informationen zu dem Thema „Tiere“. Lesen Sie jetzt „Seehund-Quartett des Kieler Aquariums wieder komplett“.;"Z+ (abopflichtiger Inhalt);
        
    
Tiere";News, Tiere, Aquarium, Seehundgruppe, Tiere;2024-06-07T13:00:46+02:00;2024-06-07T13:00:46+02:00;;dpa Hamburg/Schleswig-Holstein;false
fd2f6f63157654b4eb84530fe7ecbd41a22872a9467f1eb18885302f613b5870;Der Plan für die Generalprobe: Nagelsmann hat EM-Elf im Kopf;https://www.zeit.de/news/2024-06/07/der-plan-fuer-die-generalprobe-nagelsmann-hat-em-elf-im-kopf;Hier finden Sie Informationen zu dem Thema „Nationalmannschaft“. Lesen Sie jetzt „Der Plan für die Generalprobe: Nagelsmann hat EM-Elf im Kopf“.;"Z+ (abopflichtiger Inhalt);
        
    
Nationalmannschaft";News, Nationalmannschaft, Antonio Rüdiger, Toni Kroos, Julian Nagelsmann, Leroy Sané, Griechenland, Brasilien, Armenien, Oman, Katar, Herzogenaurach;2024-06-07T12:59:50+02:00;2024-06-07T12:59:50+02:00;;dpa Sport;false
4dee0bc3785e3a4664922d6e8865ca6732db8639b546e9efc3f50a067454d557;DRK fordert im Land bessere Ausstattung für Wasserrettung;https://www.zeit.de/news/2024-06/07/drk-fordert-im-land-bessere-ausstattung-fuer-wasserrettung;Hier finden Sie Informationen zu dem Thema „Katastrophenschutz“. Lesen Sie jetzt „DRK fordert im Land bessere Ausstattung für Wasserrettung“.;"Z+ (abopflichtiger Inhalt);
        
    
Katastrophenschutz";News, Katastrophenschutz, Sachsen-Anhalt, DRK, Wasserrettung, Katastrophenschutz, Ausstattung, Einsatzfahrzeug;2024-06-07T12:59:38+02:00;2024-06-07T12:59:38+02:00;;dpa Sachsen;false
22cbe6d9e9b1baccaa8a0e34072cb2cca5b16d8478f2556eea4b4c383b75dda2;Bayerns Innenminister vor EM: Keine Hinweise auf Gefährder;https://www.zeit.de/news/2024-06/07/bayerns-innenminister-vor-em-keine-hinweise-auf-gefaehrder;Hier finden Sie Informationen zu dem Thema „Sicherheit“. Lesen Sie jetzt „Bayerns Innenminister vor EM: Keine Hinweise auf Gefährder“.;"Z+ (abopflichtiger Inhalt);
        
    
Sicherheit";News, Sicherheit, Joachim Herrmann, Bayern, München, Fußball-EM, Sicherheit, Drohne;2024-06-07T12:57:43+02:00;2024-06-07T12:57:43+02:00;;dpa Bayern;false
00606110ec380f7520c9a79bf0fae7eb5c94e662e91adeab809af2ee3dae9a14;Ost-Regierungschefs treffen sich am 18. Juni mit Scholz;https://www.zeit.de/news/2024-06/07/ost-regierungschefs-treffen-sich-am-18-juni-mit-scholz;Hier finden Sie Informationen zu dem Thema „Ministerpräsidenten“. Lesen Sie jetzt „Ost-Regierungschefs treffen sich am 18. Juni mit Scholz“.;"Z+ (abopflichtiger Inhalt);
        
    
Ministerpräsidenten";News, Ministerpräsidenten, Olaf Scholz, SPD;2024-06-07T12:57:34+02:00;2024-06-07T12:57:34+02:00;;dpa Berlin/Brandenburg;false
70533b3ff19aa6d30cfe7a004a7086361baa165dfe8047317a745d3c7e471b83;Topteams zurück im Finale: Bayern gegen Alba Favorit;https://www.zeit.de/news/2024-06/07/topteams-zurueck-im-finale-bayern-gegen-alba-favorit;Hier finden Sie Informationen zu dem Thema „BBL-Playoffs“. Lesen Sie jetzt „Topteams zurück im Finale: Bayern gegen Alba Favorit“.;"Z+ (abopflichtiger Inhalt);
        
    
BBL-Playoffs";News, BBL-Playoffs, Johannes Thiemann, Andreas Obst, Bayern, Ulm, Berlin, München, BBL, FC Bayern München, NBA, Alba Berlin;2024-06-07T12:54:03+02:00;2024-06-07T12:54:03+02:00;;dpa Sport;false
fed44e057dbbcd2074df220badc771458f407da57566d1d2d85e5527508b8001;Schweigeminute: Polizei gedenkt des getöteten Kollegen;https://www.zeit.de/news/2024-06/07/schweigeminute-polizei-gedenkt-des-getoeteten-kollegen;Hier finden Sie Informationen zu dem Thema „Extremismus“. Lesen Sie jetzt „Schweigeminute: Polizei gedenkt des getöteten Kollegen“.;"Z+ (abopflichtiger Inhalt);
        
    
Extremismus";News, Extremismus, Rouven Laur, Mannheim, Polizei, Schweigeminute, Extremismus, Polizeiauto;2024-06-07T12:53:44+02:00;2024-06-07T12:53:44+02:00;;dpa Berlin/Brandenburg;false
9a6b2437f4939dd37e91027fb8b236c2d0a9b8a34e201ac87fd4197c513e1f27;Rekord: Neugebauer bejubelt Zehnkampf-Sieg in den USA;https://www.zeit.de/news/2024-06/07/rekord-neugebauer-bejubelt-zehnkampf-sieg-in-den-usa;Hier finden Sie Informationen zu dem Thema „Leichtathletik“. Lesen Sie jetzt „Rekord: Neugebauer bejubelt Zehnkampf-Sieg in den USA“.;"Z+ (abopflichtiger Inhalt);
        
    
Leichtathletik";News, Leichtathletik, Leo Neugebauer, USA, Paris, Eugene, Oregon, Olympia, Olympische Spiele, Leichtathletik, Rekord, Zehnkampf;2024-06-07T12:51:05+02:00;2024-06-07T12:51:05+02:00;;dpa Sport;false
c8b6a2737e442538ff138e5a31bdf43ac11f7f1a106d55a992c7cf8ff73016a2;Polizei ermittelt nach Farbattacken auf die SPD in Berlin;https://www.zeit.de/news/2024-06/07/polizei-ermittelt-nach-farbattacken-auf-die-spd-in-berlin;Hier finden Sie Informationen zu dem Thema „Parteizentralen“. Lesen Sie jetzt „Polizei ermittelt nach Farbattacken auf die SPD in Berlin“.;"Z+ (abopflichtiger Inhalt);
        
    
Parteizentralen";News, Parteizentralen, Berlin, Wilhelmstraße, Berlin-Kreuzberg, Polizei, SPD, Farbattacke, Parteizentrale, Farbanschlag;2024-06-07T12:51:04+02:00;2024-06-07T12:51:04+02:00;;dpa Berlin/Brandenburg;false
562639d9b021906b465f16c06aa583144c2339e5d6ae212a3c9fd7cb2cd5b586;Über 40 Schwerstkriminelle könnten abgeschoben werden;https://www.zeit.de/news/2024-06/07/ueber-40-schwerstkriminelle-koennten-abgeschoben-werden;Hier finden Sie Informationen zu dem Thema „Migration“. Lesen Sie jetzt „Über 40 Schwerstkriminelle könnten abgeschoben werden“.;"Z+ (abopflichtiger Inhalt);
        
    
Migration";News, Migration, Marion Gentges, Afghanistan, Baden-Württemberg, Migration, Flughafenzaun, Abschiebung;2024-06-07T12:50:36+02:00;2024-06-07T12:50:36+02:00;;dpa Baden-Württemberg;false
6996d9cd9ba04469c74ea02a0f71167bb969149c06d225257f2e0c827d516cd5;Rügen: Bundesgericht lehnt Eilanträge gegen LNG-Terminal ab;https://www.zeit.de/news/2024-06/07/ruegen-bundesgericht-lehnt-eilantraege-gegen-lng-terminal-ab;Hier finden Sie Informationen zu dem Thema „Energieversorgung“. Lesen Sie jetzt „Rügen: Bundesgericht lehnt Eilanträge gegen LNG-Terminal ab“.;"Z+ (abopflichtiger Inhalt);
        
    
Energieversorgung";News, Energieversorgung, Ostsee, Mukran, Binz, LNG, Eilantrag, Bundesgericht, Energieversorgung, Flüssigerdgas, Regelbetrieb;2024-06-07T12:49:05+02:00;2024-06-07T12:49:05+02:00;;dpa Mecklenburg-Vorpommern;false
99698427c93c5c4bc63bd5e6ecddfd3db0f1deaf2f8e64a702d297b4522d3521;Verfassungsschutz beobachtet bayerischen AfD-Politiker;https://www.zeit.de/news/2024-06/07/verfassungsschutz-beobachtet-bayerischen-afd-politiker;Hier finden Sie Informationen zu dem Thema „Extremismus“. Lesen Sie jetzt „Verfassungsschutz beobachtet bayerischen AfD-Politiker“.;"Z+ (abopflichtiger Inhalt);
        
    
Extremismus";News, Extremismus, Franz Schmid, Katharina Schulze, Verfassungsschutz, Alternative für Deutschland, Extremismus;2024-06-07T12:49:04+02:00;2024-06-07T12:49:04+02:00;;dpa;false
2578bbb33e3680922f9bf1cce21dd314a2049e0cfdfd88df0e68213fcf8b2123;Tiktok-Challenge: Der gefährliche Wunsch nach Aufmerksamkeit;https://www.zeit.de/news/2024-06/07/tiktok-challenge-experten-warnen-vor-gefaehrlichen-mutproben;Hier finden Sie Informationen zu dem Thema „Medien“. Lesen Sie jetzt „Tiktok-Challenge: Der gefährliche Wunsch nach Aufmerksamkeit“.;"Z+ (abopflichtiger Inhalt);
        
    
Medien";News, Medien, Hessen, TikTok, Mutprobe, Smartphone, Videoplattform;2024-06-07T12:47:27+02:00;2024-06-07T12:47:27+02:00;;dpa Hessen;false
88132fa4ea9b63a129163586fa9e1f63f6604973f56edaa74577971468d6562e;Die Staatsdienerin;https://www.zeit.de/2024/25/brigitte-bierlein-kanzlerin-tod-oesterreich-ibiza-affaere;Brigitte Bierlein war immer die Erste. Als Österreichs Bundeskanzlerin und auch, als es darum ging, die Politik nach dem Ibiza-Skandal zu beruhigen. Ein Nachruf;"Z+ (abopflichtiger Inhalt);
        
    
Brigitte Bierlein";Politik, Brigitte Bierlein, Österreich, Alexander Van der Bellen, Ibiza, ÖVP, FPÖ, Brigitte Bierlein;2024-06-07T12:47:24+02:00;2024-06-07T12:47:24+02:00;Christina Pausackl;Aus der        ZEIT Nr. 25/2024;false
da8a20630b2fa3aecc72340455c94c458fc1430945a565457363603ad3f7c517;Zentralrat der Juden kritisiert Verhalten der TU-Präsidentin;https://www.zeit.de/news/2024-06/07/zentralrat-der-juden-kritisiert-verhalten-der-tu-praesidentin;Hier finden Sie Informationen zu dem Thema „Hochschule“. Lesen Sie jetzt „Zentralrat der Juden kritisiert Verhalten der TU-Präsidentin“.;"Z+ (abopflichtiger Inhalt);
        
    
Hochschule";News, Hochschule, Geraldine Rauch, Berlin, Gazastreifen, TU, Zentralrat der Juden in Deutschland, Kritik;2024-06-07T12:46:53+02:00;2024-06-07T12:46:53+02:00;;dpa Berlin/Brandenburg;false
3f87aba70bbd834fefe2847d5877ced0b2d8a46695779d88af8947c8a917e3da;Mannheims OB zeigt sich vor Demos am Nachmittag besorgt;https://www.zeit.de/news/2024-06/07/mannheims-ob-zeigt-sich-vor-demos-am-nachmittag-besorgt;Hier finden Sie Informationen zu dem Thema „Extremismus“. Lesen Sie jetzt „Mannheims OB zeigt sich vor Demos am Nachmittag besorgt“.;"Z+ (abopflichtiger Inhalt);
        
    
Extremismus";News, Extremismus, Christian Specht, Mannheim, CDU, Alternative für Deutschland, Extremismus, Kundgebung;2024-06-07T12:46:35+02:00;2024-06-07T12:46:35+02:00;;dpa Baden-Württemberg;false
7bb71c17ff8d158d25b32a22e07d834756a8d6040592f7097692fd2d2f47a1fd;Wolodymyr Selenskyj wird Rede im Bundestag halten;https://www.zeit.de/politik/ausland/2024-06/ukraine-praesident-wolodymyr-selenskyj-rede-bundestag;Der ukrainische Präsident wird in der kommenden Woche in Berlin erwartet. Nach einer Rede im Bundestag nimmt er an der zweitägigen Ukraine-Wiederaufbaukonferenz teil.;"Z+ (abopflichtiger Inhalt);
        
    
Krieg in der Ukraine";Politik, Krieg in der Ukraine, Wolodymyr Selenskyj, Bundestag, Krieg in der Ukraine, Berlin, Bundesregierung, Ukraine;2024-06-07T12:46:09+02:00;2024-06-07T12:46:09+02:00;;ZEIT ONLINE,        dpa,        voi;false
b70fa2cb4d2c5e22c8a2669f98b76b3dccc3a5498b3c2337dc475d794f0ce19c;Landpartie in Brandenburg: Leben auf dem Dorf im Fokus;https://www.zeit.de/news/2024-06/07/landpartie-in-brandenburg-leben-auf-dem-dorf-im-fokus;Hier finden Sie Informationen zu dem Thema „Agrar“. Lesen Sie jetzt „Landpartie in Brandenburg: Leben auf dem Dorf im Fokus“.;"Z+ (abopflichtiger Inhalt);
        
    
Agrar";News, Agrar, Brandenburg, Landpartie, Samenbildung, Färberwaid;2024-06-07T12:45:40+02:00;2024-06-07T12:45:40+02:00;;dpa Berlin/Brandenburg;false
8cbfbc3bf25c0fd45c6983c124e19bcae9eea54e96dd61294c0c7a09350c6e06;Stilles Gedenken: Mannheim erinnert an getöteten Polizisten;https://www.zeit.de/news/2024-06/06/steinmeier-bei-gedenkminute-mehrere-demos-geplant;Hier finden Sie Informationen zu dem Thema „Messerattacke“. Lesen Sie jetzt „Stilles Gedenken: Mannheim erinnert an getöteten Polizisten“.;"Z+ (abopflichtiger Inhalt);
        
    
Messerattacke";News, Messerattacke, Rouven Laur, Frank-Walter Steinmeier, Mannheim, Alternative für Deutschland, Gedenkminute;2024-06-07T12:45:25+02:00;2024-06-07T12:45:25+02:00;;dpa Baden-Württemberg;false
ebf45a161b15237b61736207bae46d53a1d9724c2aa765ee04c1961fa97deeed;Antrag nicht umgesetzt: SPD-Fraktion beantragt Missbilligung;https://www.zeit.de/news/2024-06/07/antrag-nicht-umgesetzt-spd-fraktion-beantragt-missbilligung;Hier finden Sie Informationen zu dem Thema „Landtag“. Lesen Sie jetzt „Antrag nicht umgesetzt: SPD-Fraktion beantragt Missbilligung“.;"Z+ (abopflichtiger Inhalt);
        
    
Landtag";News, Landtag, SPD, Verkehrsministerium, CDU, Deutsche Presse-Agentur, Missbilligung, Landtag, Arbeitsauftrag, Fachkräftemangel;2024-06-07T12:43:59+02:00;2024-06-07T12:43:59+02:00;;dpa Hamburg/Schleswig-Holstein;false
0169b016dd926325b528426515d1b24ff6aafda7af2f918f8eb62a92ab1db74e;Seehunde im Wattenmeer werden gezählt;https://www.zeit.de/news/2024-06/07/seehunde-im-wattenmeer-werden-gezaehlt;Hier finden Sie Informationen zu dem Thema „Naturschutz“. Lesen Sie jetzt „Seehunde im Wattenmeer werden gezählt“.;"Z+ (abopflichtiger Inhalt);
        
    
Naturschutz";News, Naturschutz, Wattenmeer, Seehund, Naturschutz, Kegelrobbe, Kleinflugzeug, Sandbank;2024-06-07T12:42:38+02:00;2024-06-07T12:42:38+02:00;;dpa Niedersachsen;false
5bf88d7e337e621c2895a473d648b3bfc6c936a74623b53f7c425775b6fa0e1f;Früherer Kirchenmitarbeiter steht unter Missbrauchsverdacht;https://www.zeit.de/news/2024-06/07/frueherer-kirchenmitarbeiter-steht-unter-missbrauchsverdacht;Hier finden Sie Informationen zu dem Thema „Bremen“. Lesen Sie jetzt „Früherer Kirchenmitarbeiter steht unter Missbrauchsverdacht“.;"Z+ (abopflichtiger Inhalt);
        
    
Bremen";News, Bremen, Bremen, Polizei, Staatsanwaltschaft, Missbrauchsverdacht, Polizeifahrzeug, Karosserie;2024-06-07T12:41:39+02:00;2024-06-07T12:41:39+02:00;;dpa Niedersachsen;false
c1953c42931ae98a63ea9532b1b9848c1337384851774a3c2fd3e5535bd8c43d;So wollte der Kreml-Sender RT die deutschen Debatten beeinflussen;https://www.zeit.de/politik/deutschland/2024-06/russische-propaganda-rt-de-russland-afd-deutsche-parteien;"Ein internes Dokument zeigt, wie das russische Propagandamedium RT DE auf deutsche Parteien blickte. Das Thema AfD, heißt es darin, sei ein ""Heimspiel"".";"Z+ (abopflichtiger Inhalt);
        
    
Russische Propaganda";Politik, Russische Propaganda  , Russland, Propaganda, Alternative für Deutschland, Bündnis 90/Die Grünen, CDU, SPD;2024-06-07T12:40:52+02:00;2024-06-07T12:40:52+02:00;Luisa Hommerich;;false
9f58a6385b778d87f363296d6fa456fd2489395a4b2fbb92e8066fe39c9e0e4f;Export legt im April zu;https://www.zeit.de/news/2024-06/07/export-legt-im-april-zu;Hier finden Sie Informationen zu dem Thema „Außenhandel“. Lesen Sie jetzt „Export legt im April zu“.;"Z+ (abopflichtiger Inhalt);
        
    
Außenhandel";News, Außenhandel, Destatis, Außenhandel;2024-06-07T12:37:32+02:00;2024-06-07T12:37:32+02:00;;dpa;false
229f539c4f5cf825c007c95f7cc7b04ede5389befb0ef1a0872f07f325b09ed8;Prozess gegen Zverev eingestellt: Einigung mit Ex-Freundin;https://www.zeit.de/news/2024-06/07/prozess-gegen-zverev-eingestellt-einigung-mit-ex-freundin;Hier finden Sie Informationen zu dem Thema „Amtsgericht Tiergarten“. Lesen Sie jetzt „Prozess gegen Zverev eingestellt: Einigung mit Ex-Freundin“.;"Z+ (abopflichtiger Inhalt);
        
    
Amtsgericht Tiergarten";News, Amtsgericht Tiergarten, Barbara Lüders, Alexander Zverev, Brenda Patea, Berlin, Amtsgericht Tiergarten, Staatsanwaltschaft, Körperverletzung;2024-06-07T12:29:51+02:00;2024-06-07T12:29:51+02:00;;dpa Berlin/Brandenburg;false
9ccaa87d7b651cd3aac651c84155729b39e706f70819a3b19b6b351d481a8927;Eene meene muh und …;https://www.zeit.de/sport/2024-06/em-kader-nationalmannschaft-dfb-gruenflaeche;Deutschland hat ein Problem: Ein Nationalspieler ist im EM-Kader zu viel. Unser Kolumnist hat ein paar Tipps, wie der Pechvogel gefunden werden kann.;"Z+ (abopflichtiger Inhalt);
        
    
EM-Kader";Sport, EM-Kader, Julian Nagelsmann, Fußballnationalmannschaft, Fußball-EM, DFB, Uefa, Trainer;2024-06-07T12:29:18+02:00;2024-06-07T12:29:18+02:00;Christian Spiller;;false
f51339f96cf2f9c47d2e5398b89ff0c94ac66655b744d52984edf18d833741e1;Rheinland-Pfalz-Tag 2025 in Neustadt an der Weinstraße;https://www.zeit.de/news/2024-06/07/rheinland-pfalz-tag-2025-in-neustadt-an-der-weinstrasse;Hier finden Sie Informationen zu dem Thema „Freizeit“. Lesen Sie jetzt „Rheinland-Pfalz-Tag 2025 in Neustadt an der Weinstraße“.;"Z+ (abopflichtiger Inhalt);
        
    
Freizeit";News, Freizeit, Malu Dreyer, Marc Weigel, Neustadt an der Weinstraße, Neustadt (dosse), Rheinland-Pfalz, Rheinland-Pfalz-Tag, Freizeit;2024-06-07T12:29:07+02:00;2024-06-07T12:29:07+02:00;;dpa Rheinland-Pfalz/Saarland;false
2489a0a82e538c0d64ba8e7ecc48a96b27453603d4cac97cc73f1b4b543be3bd;Suche nach Valeriia in Döbeln wird fortgesetzt;https://www.zeit.de/news/2024-06/05/polizei-sucht-weiter-nach-vermisster-schuelerin-in-doebeln;Hier finden Sie Informationen zu dem Thema „Sachsen“. Lesen Sie jetzt „Suche nach Valeriia in Döbeln wird fortgesetzt“.;"Z+ (abopflichtiger Inhalt);
        
    
Sachsen";News, Sachsen, Döbeln, Polizei;2024-06-07T12:28:51+02:00;2024-06-07T12:28:51+02:00;;dpa;false
0d7611513f2dfd50ac27ecabdf7250d17af12282d8947bd2ece3c1992797cb1a;Bamberg holt zweiten Neuzugang: Guard Watson-Boye kommt;https://www.zeit.de/news/2024-06/07/bamberg-holt-zweiten-neuzugang-guard-watson-boye-kommt;Hier finden Sie Informationen zu dem Thema „Basketball“. Lesen Sie jetzt „Bamberg holt zweiten Neuzugang: Guard Watson-Boye kommt“.;"Z+ (abopflichtiger Inhalt);
        
    
Basketball";News, Basketball, Ibrahim Watson-Boye, Bamberg, Neuzugang, Basketball;2024-06-07T12:27:00+02:00;2024-06-07T12:27:00+02:00;;dpa Bayern;false
e246644af0bdca175eaccc0f17d949480e56f41a688893712d9b468f02c0702f;Das Ruhrgebiet sieht blau;https://www.zeit.de/gesellschaft/zeitgeschehen/2024-06/afd-ruhrgebiet-westen-nrw-duisburg-europawahl-gelsenkirchen;Die meisten AfD-Hochburgen liegen im Osten Deutschlands. Doch auch in Duisburg hat sich die Partei etabliert – und könnte bei der Europawahl weiter profitieren.;"Z+ (abopflichtiger Inhalt);
        
    
AfD im Westen";Gesellschaft, AfD im Westen, Duisburg, Gelsenkirchen, Alternative für Deutschland, Ruhr, Nordrhein-Westfalen, Europawahl;2024-06-07T12:26:26+02:00;2024-06-07T12:26:26+02:00;Marc Latsch;;false
80771e0b9d4250816895469b25aac74f46bda046d1ea6d64ec084a60e4405775;Stichflamme wegen Pipeline-Entleerung zu sehen;https://www.zeit.de/news/2024-06/07/stichflamme-wegen-pipeline-entleerung-zu-sehen;Hier finden Sie Informationen zu dem Thema „Hochwasser“. Lesen Sie jetzt „Stichflamme wegen Pipeline-Entleerung zu sehen“.;"Z+ (abopflichtiger Inhalt);
        
    
Hochwasser";News, Hochwasser, Umspannwerk, Hochwasser;2024-06-07T12:25:51+02:00;2024-06-07T12:25:51+02:00;;dpa Baden-Württemberg;false
2b5bc9726e2a80b9fdaf2b06ba3669ff7c195a56e3c094cab2d43a4568d3213c;Wetter besorgt Imke: Durchwachsene Ernte im Frühjahr;https://www.zeit.de/news/2024-06/07/wetter-besorgt-imke-durchwachsene-ernte-im-fruehjahr;Hier finden Sie Informationen zu dem Thema „Umwelt“. Lesen Sie jetzt „Wetter besorgt Imke: Durchwachsene Ernte im Frühjahr“.;"Z+ (abopflichtiger Inhalt);
        
    
Umwelt";News, Umwelt, Thomas Hock, Rheinland-Pfalz, Ernte, Blütenstängel, Nektar, Wetter;2024-06-07T12:23:28+02:00;2024-06-07T12:23:28+02:00;;dpa Rheinland-Pfalz/Saarland;false
d849429f74ad19fabb368dfc08ff3f14e51d2dfd419c9440023d753eec8e0d5c;Köln verlängert mit U17-Weltmeister Harchaoui;https://www.zeit.de/news/2024-06/07/koeln-verlaengert-mit-u17-weltmeister-harchaoui;Hier finden Sie Informationen zu dem Thema „2. Bundesliga“. Lesen Sie jetzt „Köln verlängert mit U17-Weltmeister Harchaoui“.;"Z+ (abopflichtiger Inhalt);
        
    
2. Bundesliga";News, 2. Bundesliga, Frankreich, Köln, Bundesliga;2024-06-07T12:17:39+02:00;2024-06-07T12:17:39+02:00;;dpa Nordrhein-Westfalen;false
488eed5012f3159ecb54b094735fd52f9e064f582823bfd6da5f10bfa6e1a8b2;Über 1000 Teilnehmer bei Gedenken an getöteten Polizisten;https://www.zeit.de/news/2024-06/07/ueber-1000-teilnehmer-bei-gedenken-an-getoeteten-polizisten;Hier finden Sie Informationen zu dem Thema „Mannheimer Messerattacke“. Lesen Sie jetzt „Über 1000 Teilnehmer bei Gedenken an getöteten Polizisten“.;"Z+ (abopflichtiger Inhalt);
        
    
Mannheimer Messerattacke";News, Mannheimer Messerattacke, Mannheim, Messerattacke, Gedenkminute;2024-06-07T12:16:59+02:00;2024-06-07T12:16:59+02:00;;dpa Baden-Württemberg;false
dc00a2d9c2484473b4976af175841d5d9f63615d5a86322355437ea663d0adad;"""Das größte Friedensprojekt, seit Menschen vom Baum geklettert sind""";https://www.zeit.de/politik/deutschland/2024-06/europawahl-eu-bundestag-debatte-afd;Die Bundestagsfraktionen betonen vor der Europawahl die Bedeutung der EU. Mehrere Abgeordnete übten dabei harte Kritik an der AfD.;"Z+ (abopflichtiger Inhalt);
        
    
Europawahl";Politik, Europawahl, Europa, Bundestag, Alternative für Deutschland, Europawahl, Bundestagsfraktion, Demokratie;2024-06-07T12:16:39+02:00;2024-06-07T12:16:39+02:00;;ZEIT ONLINE,        dpa,        AFP,        ale;false
a9aac9d89a2a7747d6b5d8526d73d6e2fdf53c5fa11dc7d1c0f55518245b0d43;Lastwagenfahrer nach Panne von Transporter erfasst: tot;https://www.zeit.de/news/2024-06/07/lastwagenfahrer-nach-panne-von-transporter-erfasst-tot;Hier finden Sie Informationen zu dem Thema „Unfall“. Lesen Sie jetzt „Lastwagenfahrer nach Panne von Transporter erfasst: tot“.;"Z+ (abopflichtiger Inhalt);
        
    
Unfall";News, Unfall, Polizei, Transporter, Unfall;2024-06-07T12:15:27+02:00;2024-06-07T12:15:27+02:00;;dpa Bayern;false
cc28e13fcd1985bef161e82c596092ae191cdea1a165680e13b0187604dd8bb6;Ausländische Pflege-Azubis: Land stockt Unterstützung auf;https://www.zeit.de/news/2024-06/07/auslaendische-pflege-azubis-land-stockt-unterstuetzung-auf;Hier finden Sie Informationen zu dem Thema „Gesundheit“. Lesen Sie jetzt „Ausländische Pflege-Azubis: Land stockt Unterstützung auf“.;"Z+ (abopflichtiger Inhalt);
        
    
Gesundheit";News, Gesundheit, Pflegefachkraft, Kompressionsstrumpf;2024-06-07T12:13:15+02:00;2024-06-07T12:13:15+02:00;;dpa Thüringen;false
c746188c0e9a09aaa70fbdcddcd64cfa9a7bd96309a79810180be83fc789982f;Klimawandel verschlimmerte Hochwasser;https://www.zeit.de/news/2024-06/07/klimawandel-verschlimmerte-hochwasser;Hier finden Sie Informationen zu dem Thema „Analyse“. Lesen Sie jetzt „Klimawandel verschlimmerte Hochwasser“.;"Z+ (abopflichtiger Inhalt);
        
    
Analyse";News, Analyse, Baar-Ebenhausen, Süddeutschland, Bayern, Climameter, El Niño, Klimawandel, Schnellanalyse, Hochwasser, Starkregen, Überschwemmung;2024-06-07T12:11:20+02:00;2024-06-07T12:11:20+02:00;;dpa;false
8bdbb33549f4ef9a9795b9811b869ff75d0381a3ad89f12ae849924e7c623979;Sechster Spieler verlässt Ludwigsburg: Jonathan Bähre geht;https://www.zeit.de/news/2024-06/07/sechster-spieler-verlaesst-ludwigsburg-jonathan-baehre-geht;Hier finden Sie Informationen zu dem Thema „Basketball“. Lesen Sie jetzt „Sechster Spieler verlässt Ludwigsburg: Jonathan Bähre geht“.;"Z+ (abopflichtiger Inhalt);
        
    
Basketball";News, Basketball, Jonathan Bähre, Justin Simon, Ludwigsburg, Basketball;2024-06-07T12:10:43+02:00;2024-06-07T12:10:43+02:00;;dpa Baden-Württemberg;false
9a5dba379bf0f85046cb5110861abafd706bd370118b366b8c1bdd72c60188c5;Ehrenamtsgesetz: Weniger Bürokratie und mehr Geld;https://www.zeit.de/news/2024-06/07/ehrenamtsgesetz-weniger-buerokratie-und-mehr-geld;Hier finden Sie Informationen zu dem Thema „Landtag“. Lesen Sie jetzt „Ehrenamtsgesetz: Weniger Bürokratie und mehr Geld“.;"Z+ (abopflichtiger Inhalt);
        
    
Landtag";News, Landtag, Erfurt, FDP, CDU, Alternative für Deutschland, Ehrenamtsgesetz, Bürokratie, Landtag, Ehrenamt, Geld;2024-06-07T12:07:14+02:00;2024-06-07T12:07:14+02:00;;dpa Thüringen;false
199f879ac6d3e9cba825adb89436be9a17e204fbd0616965b16b340ce8159d89;Darauf keinen Drink!;https://www.zeit.de/familie/2024-06/alkohol-kinder-jugendliche-eltern-vorbild;"Kindergeburtstag, die Stimmung ist nett, die Eltern trinken Alkohol. Leider ist das keine gute Idee. Denn es könnte die Kleinen irgendwann in Schwierigkeiten bringen.
";"Z+ (abopflichtiger Inhalt);
        
    
Alkohol in der Familie";Familie, Alkohol in der Familie, Familie, Kinder, Jugendliche, Alkohol, Alkoholsucht;2024-06-07T11:59:57+02:00;2024-06-07T11:59:57+02:00;Wenke Husmann;;false
32110717c989fa993a22795ae5d4d4f7f3bf4b10ed4a4e441ced929693553510;Selenskyj wird am Dienstag Rede im Bundestag halten;https://www.zeit.de/news/2024-06/07/selenskyj-wird-am-dienstag-rede-im-bundestag-halten;Hier finden Sie Informationen zu dem Thema „Präsident der Ukraine“. Lesen Sie jetzt „Selenskyj wird am Dienstag Rede im Bundestag halten“.;"Z+ (abopflichtiger Inhalt);
        
    
Präsident der Ukraine";News, Präsident der Ukraine, Wolodymyr Selenskyj, Berlin, Bundestag, Bundesregierung, Angriffskrieg, Krieg in der Ukraine;2024-06-07T11:58:49+02:00;2024-06-07T11:58:49+02:00;;dpa;false
5de2008b8371b69250c9a96e1df86dd39acb9fd52bd57793a7c08066f0c99bb0;Mann flüchtet in Auto - Ermittlung wegen versuchten Mordes;https://www.zeit.de/news/2024-06/07/mann-fluechtet-auto-ermittlung-wegen-versuchtem-mord;Hier finden Sie Informationen zu dem Thema „Schwaben“. Lesen Sie jetzt „Mann flüchtet in Auto - Ermittlung wegen versuchten Mordes“.;"Z+ (abopflichtiger Inhalt);
        
    
Schwaben";News, Schwaben, Polizei, Mord, Polizeistreife, Ermittlung, Blaulicht, Auto, Fahrrad;2024-06-07T11:57:48+02:00;2024-06-07T11:57:48+02:00;;dpa Baden-Württemberg;false
8d93b07aa14bac872cf6a92c9bea3b13651b994fbc88658aa975ebf681128bc8;Pkw fährt Schlangenlinien: Fahrer hatte 3,17 Promille;https://www.zeit.de/news/2024-06/07/pkw-faehrt-schlangenlinien-fahrer-hatte-3-17-promille;Hier finden Sie Informationen zu dem Thema „Verkehr“. Lesen Sie jetzt „Pkw fährt Schlangenlinien: Fahrer hatte 3,17 Promille“.;"Z+ (abopflichtiger Inhalt);
        
    
Verkehr";News, Verkehr, Polizei, Schlangenlinie, Verkehr, Verkehrskontrolle;2024-06-07T11:56:45+02:00;2024-06-07T11:56:45+02:00;;dpa Rheinland-Pfalz/Saarland;false
