Hash;Title;Link;Description;Category;KeyWords;Published;LastUpdated;Author;Source;Paywall
f996e3e6d158a8f2c437a4ab4a06c00dc57a384e328a139d7c31846d91086436;EU fordert Israel offiziell zu Ende der Rafah-Offensive auf;https://www.zeit.de/politik/ausland/2023-12/news-israel-gaza-krieg-live;Der Einsatz in Rafah könne Israels Beziehungen zur EU stark beschädigen, warnt der Europäische Auswärtige Dienst. Er fordert ein Ende der Offensive. Das Liveblog;"Z+ (abopflichtiger Inhalt);
        
    

Liveblog:Krieg in Israel und Gaza";Politik, Krieg in Israel und Gaza, Israel, Hamas, Gazastreifen, Palästinensergebiet, Hilfsorganisation, Nahostkonflikt;2024-05-15T10:58:34+02:00;2024-05-15T10:58:34+02:00;Carl FriedrichsSarah Kohler;;false
7ab6e3ed4e6a8fd104e93f130eefd694c007a7e7e49d8e48f7434fd139680882;Nominierungsserie geht weiter: Andrich, Groß und Kimmich bei EM dabei;https://www.zeit.de/sport/2024-05/fussball-em-kader-nominierung-dfb-nagelsmann-spieler;"Verkündung in einer großen Show? Das war einmal. Vor der Heim-EM macht der DFB den Kader seit Sonntag Spieler für Spieler öffentlich – zuletzt am Set von ""GZSZ"".";"Z+ (abopflichtiger Inhalt);
        
    
Fußball-Europameisterschaft";Sport, Fußball-Europameisterschaft, Fußball-EM, Nationalelf, DFB, Julian Nagelsmann, Fußball, Profisport, Europameisterschaft, Kai Havertz, Leroy Sané, Maximilian Mittelstädt;2024-05-15T10:56:19+02:00;2024-05-15T10:56:19+02:00;;ZEIT ONLINE,        dpa,        SID,        dho,        dar;false
6b0cff3247983299e1897bc7ae82190714878c3d0dd67f09cc082c0f9023afeb;Ärztekammer: Verbot von Lachgas-Verkauf an Minderjährige;https://www.zeit.de/news/2024-05/15/aerztekammer-verbot-von-lachgas-verkauf-an-minderjaehrige;Hier finden Sie Informationen zu dem Thema „Drogen“. Lesen Sie jetzt „Ärztekammer: Verbot von Lachgas-Verkauf an Minderjährige“.;"Z+ (abopflichtiger Inhalt);
        
    
Drogen";News, Drogen, Niedersachsen, Ärztekammer, Verbot, Lachgas, Partydroge, Luftballon, Drogen;2024-05-15T10:55:49+02:00;2024-05-15T10:55:49+02:00;;dpa Niedersachsen;false
7bb0386b4168452ecfd7ac5e1d5a63e045d1cfc85134ae63444ce1be141c35ed;EU-Chefdiplomat: Israel soll Militäreinsatz in Rafah beenden;https://www.zeit.de/news/2024-05/15/eu-chefdiplomat-israel-soll-militaereinsatz-in-rafah-beenden;Hier finden Sie Informationen zu dem Thema „Krieg in Nahost“. Lesen Sie jetzt „EU-Chefdiplomat: Israel soll Militäreinsatz in Rafah beenden“.;"Z+ (abopflichtiger Inhalt);
        
    
Krieg in Nahost";News, Krieg in Nahost, Josep Borrell, Rafah, EU, Militäreinsatz;2024-05-15T10:52:55+02:00;2024-05-15T10:52:55+02:00;;dpa;false
448dbb81fe2893ba67dbd953cf90bad61a489a1c135cc879f737f2bce0193e5b;Gemeinsamer EU-Klimaschutz könnte laut Ifo 248 Milliarden Euro sparen;https://www.zeit.de/wissen/2024-05/klimaschutz-eu-gemeinsame-politik-studie-ifo-milliarden-sparen;66 Milliarden Euro könnte allein Deutschland laut einer Studie durch gemeinsame EU-Klimapolitik sparen. Je schneller die EU klimaneutral werde, desto billiger sei es.;"Z+ (abopflichtiger Inhalt);
        
    
Klimaschutzstudie";Wissen, Klimaschutzstudie, Klimapolitik, Europäische Union, Emissionshandel, Strompreis, Studie, Klimakrise;2024-05-15T10:48:19+02:00;2024-05-15T10:48:19+02:00;;ZEIT ONLINE,        sko;false
7e3d63ee88e6929cd5cc77670c16ff8d17444261d0d8afa953a9502c773e4393;Tote bei Unruhen in Neukaledonien;https://www.zeit.de/news/2024-05/15/zwei-tote-bei-unruhen-in-neukaledonien;Hier finden Sie Informationen zu dem Thema „Fanzösisches Überseegebiet “. Lesen Sie jetzt „Tote bei Unruhen in Neukaledonien“.;"Z+ (abopflichtiger Inhalt);
        
    
Fanzösisches Überseegebiet";News, Fanzösisches Überseegebiet , Gérald Darmanin, Neukaledonien, Nouméa, Überseegebiet, Kletterwand, Unruhen;2024-05-15T10:45:58+02:00;2024-05-15T10:45:58+02:00;;dpa;false
87bd703a13e2ddb5549054aad5932007b7c55279356e8f17eb96c8de5a75fcd3;Waldbrände in Kanada führen zu Evakuierungen;https://www.zeit.de/news/2024-05/15/waldbraende-in-kanada-fuehren-zu-evakuierungen;Hier finden Sie Informationen zu dem Thema „Notfälle“. Lesen Sie jetzt „Waldbrände in Kanada führen zu Evakuierungen“.;"Z+ (abopflichtiger Inhalt);
        
    
Notfälle";News, Notfälle, Kanada, Manitoba, Flin Flon, Alberta, Fort Mcmurray, CBC, Waldbrand, Evakuierung, Notfall, Sicherheit;2024-05-15T10:45:11+02:00;2024-05-15T10:45:11+02:00;;dpa;false
f910137ed7de05d11db7ee9c4bc323503049e4d2187b6d7cb027106f9a07c761;Fifa führt 2026 Club-WM für Frauen-Teams ein;https://www.zeit.de/sport/2024-05/fifa-fuehrt-club-wm-fuer-frauen-ein;In anderthalb Jahren wird die erste Club-Weltmeisterschaft für Frauen-Fußballmannschaften stattfinden. Anschließend soll das  Turnier alle vier Jahre ausgerichtet werden.;"Z+ (abopflichtiger Inhalt);
        
    
Fußball";Sport, Fußball, Fifa, Fußball, Turnier;2024-05-15T10:44:30+02:00;2024-05-15T10:44:30+02:00;Christopher Trinks;;false
99d68ff0f1f2a8bdcc95cd6712ab9a80e5d39981188159c087ad67f61c77926e;Trump-Anwalt nimmt Cohen ins Verhör;https://www.zeit.de/news/2024-05/14/cohen-trump-wollte-schweigegeldzahlung;Hier finden Sie Informationen zu dem Thema „Schweigegeld-Prozess“. Lesen Sie jetzt „Trump-Anwalt nimmt Cohen ins Verhör“.;"Z+ (abopflichtiger Inhalt);
        
    
Schweigegeld-Prozess";News, Schweigegeld-Prozess, Michael Cohen, Donald Trump, Stormy Daniels, Trump zu Cohen, David Pecker, New York, USA, Staatsanwaltschaft, The National Enquirer, Präsidentschaftswahl;2024-05-15T10:44:14+02:00;2024-05-15T10:44:14+02:00;;dpa;false
cd1c1924fcb40ae8fa8829119254d91f468798284a6968a096b47d112e4656c6;Bombenentschärfung in Barmstedt am Freitag;https://www.zeit.de/news/2024-05/15/bombenentschaerfung-in-barmstedt-am-freitag;Hier finden Sie Informationen zu dem Thema „Kommunen“. Lesen Sie jetzt „Bombenentschärfung in Barmstedt am Freitag“.;"Z+ (abopflichtiger Inhalt);
        
    
Kommunen";News, Kommunen, Barmstedt, Bombenentschärfung, Kommune, Kampfmittelräumarbeit, Baggerarbeit;2024-05-15T10:35:52+02:00;2024-05-15T10:35:52+02:00;;dpa Hamburg/Schleswig-Holstein;false
4a82761edef95d5a6619698f322b0edf790d39df7d0e47c77a1d8ce0ff1e1144;Weil: Konsequente Strafen für demokratiefeindliche Taten;https://www.zeit.de/news/2024-05/15/weil-konsequente-strafen-fuer-demokratiefeindliche-taten;Hier finden Sie Informationen zu dem Thema „Landtag“. Lesen Sie jetzt „Weil: Konsequente Strafen für demokratiefeindliche Taten“.;"Z+ (abopflichtiger Inhalt);
        
    
Landtag";News, Landtag, Stephan Weil, Niedersachsen, Landtag;2024-05-15T10:33:59+02:00;2024-05-15T10:33:59+02:00;;dpa Niedersachsen;false
bb777db68ee1060f77a949a45e0a25488376eb3bbe9e1c8e483354d4b666a7a9;100 philippinische Boote fahren aus Protest zu umstrittenem Atoll;https://www.zeit.de/gesellschaft/2024-05/china-philippinen-atoll-fischer-protest-boote;China beansprucht ein Atoll westlich der Philippinen und verdrängt Schiffe anderer Länder aus dem Gebiet. Fischer protestieren dagegen mit einer gemeinsamen Fahrt.;"Z+ (abopflichtiger Inhalt);
        
    
Südchinesisches Meer";Gesellschaft, Südchinesisches Meer, Asien, China, Philippinen, Protest, Schifffahrt, Wasserstraße;2024-05-15T10:33:29+02:00;2024-05-15T10:33:29+02:00;;ZEIT ONLINE,        dpa,        ale;false
33ec495eaca6ea115ebcee87460d8a323077420b7b3f81f5bc63b0ec4481dada;Hapag-Lloyd hoffnungsvoll für Gesamtjahr;https://www.zeit.de/news/2024-05/15/hapag-lloyd-hoffnungsvoll-fuer-gesamtjahr;Hier finden Sie Informationen zu dem Thema „Schifffahrt“. Lesen Sie jetzt „Hapag-Lloyd hoffnungsvoll für Gesamtjahr“.;"Z+ (abopflichtiger Inhalt);
        
    
Schifffahrt";News, Schifffahrt, Berlin, Hamburg, Hapag-Lloyd, Gesamtjahr, Schifffahrt, Containerreederei;2024-05-15T10:31:47+02:00;2024-05-15T10:31:47+02:00;;dpa Hamburg/Schleswig-Holstein;false
56f0898f8d2b150129ff5f4b32eaf55b194d3031115edb76f3b3315dd147c95f;Gute Zeiten, schlechte Zeiten: Auch Kimmich im EM-Kader;https://www.zeit.de/news/2024-05/15/kroos-brueder-verkuenden-em-teilnahme-von-andrich;Hier finden Sie Informationen zu dem Thema „Nationalmannschaft“. Lesen Sie jetzt „Gute Zeiten, schlechte Zeiten: Auch Kimmich im EM-Kader“.;"Z+ (abopflichtiger Inhalt);
        
    
Nationalmannschaft";News, Nationalmannschaft, Robert Andrich, Toni Kroos, Gil Manzano, Felix Kroos, Julian Nagelsmann, Spanien, DFB, Nationalmannschaft;2024-05-15T10:31:41+02:00;2024-05-15T10:31:41+02:00;;dpa;false
9d16c098df0b02e5b7b2c7576ed6a732b5503847d3f9313c7b1e2ca55a02bfaa;Hunderte Bratwürste und Rostbrätel aus Stand gestohlen;https://www.zeit.de/news/2024-05/15/hunderte-bratwuerste-und-rostbraetel-aus-stand-gestohlen;Hier finden Sie Informationen zu dem Thema „Unstrut-Hainich-Kreis“. Lesen Sie jetzt „Hunderte Bratwürste und Rostbrätel aus Stand gestohlen“.;"Z+ (abopflichtiger Inhalt);
        
    
Unstrut-Hainich-Kreis";News, Unstrut-Hainich-Kreis, Unstrut-Hainich-Kreis, Polizei, Bratwurst, Holzkohlegrill;2024-05-15T10:29:30+02:00;2024-05-15T10:29:30+02:00;;dpa Thüringen;false
56f0898f8d2b150129ff5f4b32eaf55b194d3031115edb76f3b3315dd147c95f;Gute Zeiten, schlechte Zeiten: Auch Kimmich im EM-Kader;https://www.zeit.de/news/2024-05/15/gute-zeiten-schlechte-zeiten-auch-kimmich-im-em-kader;Hier finden Sie Informationen zu dem Thema „Nationalmannschaft“. Lesen Sie jetzt „Gute Zeiten, schlechte Zeiten: Auch Kimmich im EM-Kader“.;"Z+ (abopflichtiger Inhalt);
        
    
Nationalmannschaft";News, Nationalmannschaft, Joshua Kimmich, Julian Nagelsmann, FC Bayern München, Nationalmannschaft;2024-05-15T10:27:58+02:00;2024-05-15T10:27:58+02:00;;dpa Bayern;false
801f51fe85012ef6f9a8d3c25cc4d4561f8c51cb67e60b09977844a5c9374e4b;Hoffnung und Zweifel: Gruppen-Coming-out bewegt den Fußball;https://www.zeit.de/news/2024-05/15/hoffnung-und-zweifel-gruppen-coming-out-bewegt-den-fussball;Hier finden Sie Informationen zu dem Thema „Gesellschaft“. Lesen Sie jetzt „Hoffnung und Zweifel: Gruppen-Coming-out bewegt den Fußball“.;"Z+ (abopflichtiger Inhalt);
        
    
Gesellschaft";News, Gesellschaft, Marcus Urban, Christian Rudolph, Thomas Hitzlsperger, Fußball-Bundesliga, ARD, Queer Football Fanclubs, Bundesliga, Fußball, Homophobie, Regenbogenfahne;2024-05-15T10:26:31+02:00;2024-05-15T10:26:31+02:00;;dpa Sport;false
fdedbc9d26782393e79b08825ccb43354c4e2b3f70ff80eec426afcc02ab7d21;Ministerium: Kein Cannabis-Anbau im Kleingarten;https://www.zeit.de/news/2024-05/15/ministerium-kein-cannabis-anbau-im-kleingarten;Hier finden Sie Informationen zu dem Thema „Drogen“. Lesen Sie jetzt „Ministerium: Kein Cannabis-Anbau im Kleingarten“.;"Z+ (abopflichtiger Inhalt);
        
    
Drogen";News, Drogen, Berlin, BMG, Deutsche Presse-Agentur, Cannabis, Kleingarten, Drogen;2024-05-15T10:23:41+02:00;2024-05-15T10:23:41+02:00;;dpa;false
3e8646c7c2ea23699241a31fd07442518a8415cc81b12248ef5716425aaf5430;Künstler in Verfahren um Söder-Graffito freigesprochen;https://www.zeit.de/news/2024-05/15/kuenstler-in-verfahren-um-soeder-graffito-freigesprochen;Hier finden Sie Informationen zu dem Thema „Urteil“. Lesen Sie jetzt „Künstler in Verfahren um Söder-Graffito freigesprochen“.;"Z+ (abopflichtiger Inhalt);
        
    
Urteil";News, Urteil, Markus Söder, Nürnberg, CSU, Graffito, Künstlername;2024-05-15T10:23:28+02:00;2024-05-15T10:23:28+02:00;;dpa Bayern;false
2102b656dd00b231dba03fd9326b2f7de7a0115cd78e134cd87d648b1b4c5e12;Tesla-Camp: Kosten für Anwälte werden nicht veröffentlicht;https://www.zeit.de/news/2024-05/15/tesla-camp-kosten-fuer-anwaelte-werden-nicht-veroeffentlicht;Hier finden Sie Informationen zu dem Thema „Demonstration“. Lesen Sie jetzt „Tesla-Camp: Kosten für Anwälte werden nicht veröffentlicht“.;"Z+ (abopflichtiger Inhalt);
        
    
Demonstration";News, Demonstration, Brandenburg, Grünheide, Berlin-Brandenburg, Innenministerium, Tesla Factory, Polizei, Baumhaus;2024-05-15T10:23:07+02:00;2024-05-15T10:23:07+02:00;;dpa Berlin/Brandenburg;false
eaf5bf3d70c660f68d4c4c78bd5fd425228b1245cbe2c7582d40a8bf201ebfab;"""Bild"": Shapourzadeh wird neuer Sportchef bei Hansa Rostock";https://www.zeit.de/news/2024-05/15/bild-shapourzadeh-wird-neuer-sportchef-bei-hansa-rostock;"Hier finden Sie Informationen zu dem Thema „2. Bundesliga“. Lesen Sie jetzt „""Bild"": Shapourzadeh wird neuer Sportchef bei Hansa Rostock“.";"Z+ (abopflichtiger Inhalt);
        
    
2. Bundesliga";News, 2. Bundesliga, Amir Shapourzadeh, Kristian Walter, Osnabrück, Rostock, Hansa Rostock, Bundesliga;2024-05-15T10:19:16+02:00;2024-05-15T10:19:16+02:00;;dpa Mecklenburg-Vorpommern;false
954a81fa60defffee4636cb9d60a3cb94766dd7695375400f49d3905928e8d74;"Kooperation mit Tiktok: Umstritten, aber bringt ""Reichweite""";https://www.zeit.de/news/2024-05/15/kooperation-mit-tiktok-umstritten-aber-bringt-reichweite;"Hier finden Sie Informationen zu dem Thema „Sport und Social Media“. Lesen Sie jetzt „Kooperation mit Tiktok: Umstritten, aber bringt ""Reichweite""“.";"Z+ (abopflichtiger Inhalt);
        
    
Sport und Social Media";News, Sport und Social Media, Dennis Schröder, Paris, USA, DFB, Deutscher Fußball-Bund, ByteDance Ltd., CSU, TikTok, Olympia, Fußball-EM;2024-05-15T10:14:04+02:00;2024-05-15T10:14:04+02:00;;dpa Sport;false
5214a5aef57e4c84130b9f641934f340d209dd7dedc8ded0f88cf6ab9c623bb5;Bundesbank beerdigt Neubaupläne;https://www.zeit.de/news/2024-05/15/bundesbank-beerdigt-neubauplaene;Hier finden Sie Informationen zu dem Thema „Umbau am Standort Frankfurt“. Lesen Sie jetzt „Bundesbank beerdigt Neubaupläne“.;"Z+ (abopflichtiger Inhalt);
        
    
Umbau am Standort Frankfurt";News, Umbau am Standort Frankfurt, Angela Gröne, Frankfurt, Frankfurt am Main, Hessen, Deutsche Bundesbank, Neubauplan, Umbau, Hauptverwaltung, Büroneubau, Standort;2024-05-15T10:08:55+02:00;2024-05-15T10:08:55+02:00;;dpa Hessen;false
aaad336afddc6103354b4d84a2b1f02e67165cd85b5244ca444ecdea38df8ff5;81-Jähriger fällt von Traktor und wird eingeklemmt;https://www.zeit.de/news/2024-05/15/81-jaehriger-faellt-von-traktor-und-wird-eingeklemmt;Hier finden Sie Informationen zu dem Thema „Amberg-Sulzbach“. Lesen Sie jetzt „81-Jähriger fällt von Traktor und wird eingeklemmt“.;"Z+ (abopflichtiger Inhalt);
        
    
Amberg-Sulzbach";News, Amberg-Sulzbach, Traktor, Luftrettung, Rettungshubschrauber;2024-05-15T10:07:27+02:00;2024-05-15T10:07:27+02:00;;dpa Bayern;false
02ec0f0d2e1065465eebacd265b2e41a9e236fc673b5e7133e278dfd9384671e;Rückkehr zum SC für die Zukunft nicht ausgeschlossen;https://www.zeit.de/news/2024-05/15/rueckkehr-zum-sc-fuer-die-zukunft-nicht-ausgeschlossen;Hier finden Sie Informationen zu dem Thema „Bundesliga“. Lesen Sie jetzt „Rückkehr zum SC für die Zukunft nicht ausgeschlossen“.;"Z+ (abopflichtiger Inhalt);
        
    
Bundesliga";News, Bundesliga, Christian Streich, Freiburg, SC Freiburg, Bundesliga;2024-05-15T10:06:06+02:00;2024-05-15T10:06:06+02:00;;dpa Baden-Württemberg;false
2e0b00181a2f89f6770415546e3e232b3d8ff0b6ed09c544739a498ed5024966;Filmfestspiele in Cannes eröffnet;https://www.zeit.de/news/2024-05/14/greta-gerwig-weitere-gespraeche-ueber-metoo-sind-wichtig;Hier finden Sie Informationen zu dem Thema „Goldene Palme“. Lesen Sie jetzt „Filmfestspiele in Cannes eröffnet“.;"Z+ (abopflichtiger Inhalt);
        
    
Goldene Palme";News, Goldene Palme, Greta Gerwig, Judith Godrèche, Frankreich, Cannes, Internationale Filmfestspiele von Cannes;2024-05-15T10:01:44+02:00;2024-05-15T10:01:44+02:00;;dpa;false
0daf152ab27b88897c6a4afd486b209bdd954e16aa15647c1720d6b32de13e2f;CSD in Wittenberge wegen Geldsorgen abgesagt;https://www.zeit.de/news/2024-05/15/csd-in-wittenberge-wegen-geldsorgen-abgesagt;Hier finden Sie Informationen zu dem Thema „Demonstrationen“. Lesen Sie jetzt „CSD in Wittenberge wegen Geldsorgen abgesagt“.;"Z+ (abopflichtiger Inhalt);
        
    
Demonstrationen";News, Demonstrationen, Wittenberge, Christopher Street Day, Geldsorge, Demonstration, Geld;2024-05-15T10:01:21+02:00;2024-05-15T10:01:21+02:00;;dpa Berlin/Brandenburg;false
d05444762f88508bb7fcf517b23a31ce9577208389effac5998c08dcf108f166;6800 Jahre altes Skelett in Niederbayern ausgegraben;https://www.zeit.de/news/2024-05/15/6800-jahre-altes-skelett-in-niederbayern-ausgegraben;Hier finden Sie Informationen zu dem Thema „Archäologie“. Lesen Sie jetzt „6800 Jahre altes Skelett in Niederbayern ausgegraben“.;"Z+ (abopflichtiger Inhalt);
        
    
Archäologie";News, Archäologie, Florian Eibl, Niederbayern, Exing, Eichendorf, Landkreis Dingolfing-Landau, Skelett, Archäologie, Grabbeigabe;2024-05-15T10:01:19+02:00;2024-05-15T10:01:19+02:00;;dpa;false
3cb31bf3644625bb82c5a796088e66b85e4ebf9ebb8a918eeb15637a55798e8c;Ist der Sichtschutz am Drob Inn zynisch? Die Geschäftsführerin der Drogenberatung;https://www.zeit.de/hamburg/2024-05/elbvertiefung-15-05-2024;Termin für Rathaus-Empfang des FC St. Pauli steht fest, Freibadsaison beginnt, Tickets für die Lange Nacht der ZEIT, Wie uns der HSV gerade zu besseren Menschen macht.;"Z+ (abopflichtiger Inhalt);
        
    
Drob Inn am Hauptbahnhof";Hamburg, Drob Inn am Hauptbahnhof , Mariam Lau, Cem Özdemir, Michel Friedman, Anne Kunze, Daniel Müller, Florence Gaub, Harald Martenstein, Jochen Wegner, Christoph Amend, Louis Klamroth;2024-05-15T10:00:04+02:00;2024-05-15T10:00:04+02:00;Florian Zinnecker;;false
4a9d16578c1bd946a4a6e83584cf5b1606749f26b4f13553661fd44c1f5f32d4;USA wollen Israel wohl neue Waffen liefern;https://www.zeit.de/news/2024-05/15/usa-wollen-israel-wohl-neue-waffen-liefern;Hier finden Sie Informationen zu dem Thema „Krieg in Nahost“. Lesen Sie jetzt „USA wollen Israel wohl neue Waffen liefern“.;"Z+ (abopflichtiger Inhalt);
        
    
Krieg in Nahost";News, Krieg in Nahost, Benny Gantz, António Guterres, Stéphane Dujarric, Joe Biden, Jake Sullivan, Daniel Hagari, Farhan Haq, USA, Nahost, Gazastreifen;2024-05-15T09:59:40+02:00;2024-05-15T09:59:40+02:00;;dpa;false
1caca73420930498e25429997b7a793c6348aeda0cccfd0f5bd42d52eef63714;Dax-Anleger hoffen auf US-Inflationszahlen;https://www.zeit.de/news/2024-05/14/dax-auf-konsoliderungskurs;Hier finden Sie Informationen zu dem Thema „Börse in Frankfurt“. Lesen Sie jetzt „Dax-Anleger hoffen auf US-Inflationszahlen“.;"Z+ (abopflichtiger Inhalt);
        
    
Börse in Frankfurt";News, Börse in Frankfurt, Jochen Stanzl, Frankfurt, Rekordhoch, Aktienindex, Dax;2024-05-15T09:53:49+02:00;2024-05-15T09:53:49+02:00;;dpa;false
568606c5af49e0f45ecd8fb71688091505e3e9ce22773c4db07cc042333ccf28;Rushdie: Künstler sind Zielscheibe autoritärer Regierungen;https://www.zeit.de/news/2024-05/15/rushdie-kuenstler-sind-zielscheibe-autoritaerer-regierungen;Hier finden Sie Informationen zu dem Thema „Demokratie“. Lesen Sie jetzt „Rushdie: Künstler sind Zielscheibe autoritärer Regierungen“.;"Z+ (abopflichtiger Inhalt);
        
    
Demokratie";News, Demokratie, Salman Rushdie, Frankfurter Buchmesse, Sicherheit;2024-05-15T09:53:48+02:00;2024-05-15T09:53:48+02:00;;dpa;false
b6e474b7eef6091613e30a42b1e2dd933ed36ab89bf63c48db70f490884a27d8;Gericht: Wirecard-Musterverfahren wird nicht aufgeteilt;https://www.zeit.de/news/2024-05/15/gericht-wirecard-musterverfahren-wird-nicht-aufgeteilt;Hier finden Sie Informationen zu dem Thema „Prozesse“. Lesen Sie jetzt „Gericht: Wirecard-Musterverfahren wird nicht aufgeteilt“.;"Z+ (abopflichtiger Inhalt);
        
    
Prozesse";News, Prozesse, Markus Braun, Wirecard, Bayerisches Oberstes Landesgericht, Strafprozess, Musterverfahren, Sommer;2024-05-15T09:53:12+02:00;2024-05-15T09:53:12+02:00;;dpa Bayern;false
4b77b6bd5c2565978d18f1d61b79e844084447468ee4b1c96dc4948c859562c9;Bilder des Tages;https://www.zeit.de/news/2024-05/15/bilder-des-tages;Hier finden Sie Informationen zu dem Thema „Fotografie“. Lesen Sie jetzt „Bilder des Tages“.;"Z+ (abopflichtiger Inhalt);
        
    
Fotografie";News, Fotografie, Sprengladung;2024-05-15T09:52:59+02:00;2024-05-15T09:52:59+02:00;;dpa;false
b1b4762e966581d8fd903a899c62575d474cf2b443e15981dba842bf00f8ce50;Krieg gegen die Ukraine: So ist die Lage;https://www.zeit.de/news/2024-05/15/krieg-gegen-die-ukraine-so-ist-die-lage;Hier finden Sie Informationen zu dem Thema „Russische Invasion“. Lesen Sie jetzt „Krieg gegen die Ukraine: So ist die Lage“.;"Z+ (abopflichtiger Inhalt);
        
    
Russische Invasion";News, Russische Invasion, Wolodymyr Selenskyj, Antony Blinken, Russland, Kiew, Charkiw, Facebook, Treffen, Luftangriff, Angriffskrieg, Invasion;2024-05-15T09:52:09+02:00;2024-05-15T09:52:09+02:00;;dpa;false
35027c7dd7d22c9e346762d5f9e62ecc79a950eaa1d63d42c7add376a8f57ae4;Gewitter und Starkregen: Dauerregen zum Wochenende;https://www.zeit.de/news/2024-05/15/gewitter-und-starkregen-dauerregen-zum-wochenende;Hier finden Sie Informationen zu dem Thema „Wetter“. Lesen Sie jetzt „Gewitter und Starkregen: Dauerregen zum Wochenende“.;"Z+ (abopflichtiger Inhalt);
        
    
Wetter";News, Wetter, Kirchheim, Gewitter, Dauerregen, Gewitterzelle, Südwesten, Starkregen, Wetter;2024-05-15T09:51:33+02:00;2024-05-15T09:51:33+02:00;;dpa Baden-Württemberg;false
cf8888da186c8cc96295ef4e5227424312143f250531caa362e6b3cc20c4b6c9;Medien: Schweizer Stamm neuer Dynamo-Trainer;https://www.zeit.de/news/2024-05/15/medien-schweizer-stamm-neuer-dynamo-trainer;Hier finden Sie Informationen zu dem Thema „Dynamo Dresden“. Lesen Sie jetzt „Medien: Schweizer Stamm neuer Dynamo-Trainer“.;"Z+ (abopflichtiger Inhalt);
        
    
Dynamo Dresden";News, Dynamo Dresden, Thomas Stamm, Freiburg, Dynamo Dresden;2024-05-15T09:50:24+02:00;2024-05-15T09:50:24+02:00;;dpa Baden-Württemberg;false
175ab1e18c0d0a070ecfe69631fce846cb6a6ef483392ce9cb1a1377d88563af;Olympia-Dritte Scheder beendet Karriere;https://www.zeit.de/news/2024-05/15/olympia-dritte-scheder-beendet-karriere;Hier finden Sie Informationen zu dem Thema „Turnen“. Lesen Sie jetzt „Olympia-Dritte Scheder beendet Karriere“.;"Z+ (abopflichtiger Inhalt);
        
    
Turnen";News, Turnen, Sophie Scheder, Olympia;2024-05-15T09:48:18+02:00;2024-05-15T09:48:18+02:00;;dpa Sachsen;false
06ac3d89cdef61523ff85ab4bc1b6612334bd4feec3ad54d4485ebc5134966b5;Russische Truppen nehmen Dorf nahe Grenzstadt ein;https://www.zeit.de/politik/ausland/karte-ukraine-krieg-russland-frontverlauf-truppenbewegungen;Während die Grenzstadt Wowtschansk geräumt wird, dringen russische Truppen in Dörfer in der Nähe ein. Sie nehmen nun die Orte Buhruwatka und Lypzi ins Visier.;"Z+ (abopflichtiger Inhalt);
        
    
Ukraine-Karte aktuell";Politik, Ukraine-Karte aktuell, Krieg in der Ukraine, Russland, Ukraine, Militär, Donezk, Charkiw;2024-05-15T09:47:11+02:00;2024-05-15T09:47:11+02:00;Dominik LenzeYevgeniya ShcherbakovaSascha VenohrAnnick EhmannChristian EndtDavid SchachJulius TrögerBenja Zehr;;false
5d0aad7c58392095a7ea17b75ef7dcb3378de92f4ec2dc2129ff7991914c51da;Heike Winzent: Ernsthafte Bedrohung unserer Demokratie;https://www.zeit.de/news/2024-05/15/heike-winzent-ernsthafte-bedrohung-unserer-demokratie;Hier finden Sie Informationen zu dem Thema „Saar-Landtagspräsidentin“. Lesen Sie jetzt „Heike Winzent: Ernsthafte Bedrohung unserer Demokratie“.;"Z+ (abopflichtiger Inhalt);
        
    
Saar-Landtagspräsidentin";News, Saar-Landtagspräsidentin, Saar, Winzent, Bedrohung, Landtag, Angriffe auf Politiker;2024-05-15T09:47:07+02:00;2024-05-15T09:47:07+02:00;;dpa Rheinland-Pfalz/Saarland;false
ceaafae2c947964fa38d882c4a9bb8e229697be9aefa7369b531de89a29886ef;Biden spottet über Trumps Desinfektionsmittel-Idee;https://www.zeit.de/news/2024-05/15/biden-spottet-ueber-trumps-desinfektionsmittel-idee;Hier finden Sie Informationen zu dem Thema „US-Wahl“. Lesen Sie jetzt „Biden spottet über Trumps Desinfektionsmittel-Idee“.;"Z+ (abopflichtiger Inhalt);
        
    
US-Wahl";News, US-Wahl, Joe Biden, Donald Trump, Desinfektionsmittel, Coronavirus;2024-05-15T09:45:40+02:00;2024-05-15T09:45:40+02:00;;dpa;false
eb5cd19c4548dcfba36b9041ed555d030b136116ba3ab29f7e4cec05f6c62d96;Mehr Menschen verunglücken mit E-Scootern: Fünf Tote;https://www.zeit.de/news/2024-05/15/mehr-menschen-verungluecken-mit-e-scootern-fuenf-tote;Hier finden Sie Informationen zu dem Thema „Unfälle“. Lesen Sie jetzt „Mehr Menschen verunglücken mit E-Scootern: Fünf Tote“.;"Z+ (abopflichtiger Inhalt);
        
    
Unfälle";News, Unfälle, Unfall, E-Scooter;2024-05-15T09:40:03+02:00;2024-05-15T09:40:03+02:00;;dpa Nordrhein-Westfalen;false
0947d8f654234c04c27fba8788805ba6211fad550facee82dd46a780139647d6;Zoo Stralsund sucht seinen Steppenadler Milow;https://www.zeit.de/news/2024-05/15/zoo-stralsund-sucht-seinen-steppenadler-milow;Hier finden Sie Informationen zu dem Thema „Tiere“. Lesen Sie jetzt „Zoo Stralsund sucht seinen Steppenadler Milow“.;"Z+ (abopflichtiger Inhalt);
        
    
Tiere";News, Tiere, Stralsund, Milow, Steppenadler, Ravensberg, Tiere;2024-05-15T09:33:08+02:00;2024-05-15T09:33:08+02:00;;dpa Mecklenburg-Vorpommern;false
4ded89e00fdbf1ac0b3299dea23953427b1e2af7705d3d92a0b2b9482daacde1;Hamburg meldet Wiederkaufsrecht für Elbtowergrundstück an;https://www.zeit.de/news/2024-05/15/hamburg-meldet-wiederkaufsrecht-fuer-elbtowergrundstueck-an;Hier finden Sie Informationen zu dem Thema „Immobilien“. Lesen Sie jetzt „Hamburg meldet Wiederkaufsrecht für Elbtowergrundstück an“.;"Z+ (abopflichtiger Inhalt);
        
    
Immobilien";News, Immobilien, Karen Pein, Andreas Kleinau, Hamburg, HafenCity, NDR, SPD, Wiederkaufsrecht, Elbtowergrundstück, Elbtower, Immobilie;2024-05-15T09:32:03+02:00;2024-05-15T09:32:03+02:00;;dpa Hamburg/Schleswig-Holstein;false
