Hash;Title;Link;Description;Category;KeyWords;Published;LastUpdated;Author;Source;Paywall
9911e77c59f7581c8cb823ba05de6364cd4c53062cb1dca27e9afaf59ba252b8;Überstunden für 44 Prozent der Beschäftigten in Deutschland üblich;https://www.zeit.de/arbeit/2025-03/ueberstunden-umfrage-deutscher-gewerkschaftsbund-beschaeftigte-bezahlung;Eine Umfrage des DGB gibt Einblick, wer wie oft Mehrarbeit leistet und was dahintersteckt. Die Gewerkschaften richten einen Appell an die künftigen Koalitionspartner. ;Deutscher Gewerkschaftsbund;Arbeit, Deutscher Gewerkschaftsbund, DGB, Überstunde, Arbeitszeit, Arbeitnehmer, Gewerkschaft, Arbeitsplatz;2025-03-22T07:10:48+01:00;2025-03-22T07:10:48+01:00;;ZEIT ONLINE,        dpa;false
f80d88e19aa816503e247448bdcca5f97e492b543e019ba863457dfd864ee67d;Städte aus Mecklenburg-Vorpommern bei der Earth Hour dabei;https://www.zeit.de/news/2025-03/22/staedte-aus-mecklenburg-vorpommern-bei-der-earth-hour-dabei;Hier finden Sie Informationen zu dem Thema „Aktion für Klimaschutz“. Lesen Sie jetzt „Städte aus Mecklenburg-Vorpommern bei der Earth Hour dabei“.;Aktion für Klimaschutz;News, Aktion für Klimaschutz, Schwerin, Wismar, Rostock, Mecklenburg-Vorpommern, Earth Hour, Klimaschutz;2025-03-22T07:00:42+01:00;2025-03-22T07:00:42+01:00;;dpa Mecklenburg-Vorpommern;false
17ed542db268e91bd0c7e1dfbc9fe4512aa25e1b1fa55c0e4ec167b03d6eff6e;Earth Hour in Schleswig-Holstein: Licht aus für das Klima;https://www.zeit.de/news/2025-03/22/earth-hour-in-schleswig-holstein-licht-aus-fuer-das-klima;Hier finden Sie Informationen zu dem Thema „Klimaschutz“. Lesen Sie jetzt „Earth Hour in Schleswig-Holstein: Licht aus für das Klima“.;Klimaschutz;News, Klimaschutz, Schleswig-Holstein, Lübeck, WWF, Earth Hour, Klimaschutz;2025-03-22T07:00:41+01:00;2025-03-22T07:00:41+01:00;;dpa Hamburg/Schleswig-Holstein;false
0b4a307403eed8e748265956b71cfdb16e186438fc0673ae4ca2d18ff4c22e3e;Earth Hour in Hamburg: Eine Stunde Dunkelheit für das Klima;https://www.zeit.de/news/2025-03/22/earth-hour-in-hamburg-eine-stunde-dunkelheit-fuer-das-klima;Hier finden Sie Informationen zu dem Thema „Klimaschutz“. Lesen Sie jetzt „Earth Hour in Hamburg: Eine Stunde Dunkelheit für das Klima“.;Klimaschutz;News, Klimaschutz, Hamburg, Earth Hour, Dunkelheit, Klimaschutz;2025-03-22T07:00:40+01:00;2025-03-22T07:00:40+01:00;;dpa Hamburg/Schleswig-Holstein;false
8840c69974f158a39097003b83c724c738b9a1b9b6b74538fbc9cc7746a091bf;Mensapreise bleiben weitestgehend stabil;https://www.zeit.de/news/2025-03/22/mensapreise-bleiben-weitestgehend-stabil;Hier finden Sie Informationen zu dem Thema „Hochschulen“. Lesen Sie jetzt „Mensapreise bleiben weitestgehend stabil“.;Hochschulen;News, Hochschulen, Göttingen, Hannover, Niedersachsen, Bremen, Deutsche Presse-Agentur, Mensapreis;2025-03-22T07:00:38+01:00;2025-03-22T07:00:38+01:00;;dpa Niedersachsen;false
be936f7229c426a269d230e44c1a67e7368ccb26ab77f095b9ccdd8c38f91c2b;Tate-Brüder sind wieder in Rumänien;https://www.zeit.de/gesellschaft/2025-03/tate-brueder-andrew-tristan-zurueck-in-rumaenien;Andrew und Tristan Tate sind wegen eines Termins im Strafverfahren von den USA nach Rumänien gereist. Wegen laufender Ermittlungen müssen sie sich regelmäßig melden.;Missbrauchsvorwürfe;Gesellschaft, Missbrauchsvorwürfe, Gerichtsverfahren, Rumänien, Vergewaltigung, Ermittlung, Polizei, Straftat;2025-03-22T06:38:31+01:00;2025-03-22T06:38:31+01:00;eca;ZEIT ONLINE,        Reuters,        							eca;false
c2206a9080c4a0103459e8db0831e16831877aa9b1659d0374c0da72d3b14fde;Auto überschlägt sich auf Autobahn - Fahrer verletzt;https://www.zeit.de/news/2025-03/22/auto-ueberschlaegt-sich-auf-autobahn-fahrer-verletzt;Hier finden Sie Informationen zu dem Thema „Unfälle“. Lesen Sie jetzt „Auto überschlägt sich auf Autobahn - Fahrer verletzt“.;Unfälle;News, Unfälle, Unfall, Autobahn, Auto;2025-03-22T06:25:54+01:00;2025-03-22T06:25:54+01:00;;dpa Rheinland-Pfalz/Saarland;false
c4a97ae6995366af43e5cfc16eb7e19b28a9eb48cf7219f18e39282570e81177;Ein undankbarer Job;https://www.zeit.de/2025/08/forschungsstelle-koloniales-erbe-postkolonialismus-wissenschaft-afd;Hamburg wollte sein koloniales Erbe vorbildlich aufarbeiten. Jetzt aber wird die zuständige Forschungsstelle geschlossen. Die AfD verbucht das als ihren Sieg.;"Z+ (abopflichtiger Inhalt);
        
    Forschungsstelle für koloniales Erbe";Hamburg, Forschungsstelle für koloniales Erbe, Hamburg, Kolonialismus, Forschung, Geschichte, Katharina Fegebank, Alternative für Deutschland;2025-03-22T06:02:57+01:00;2025-03-22T06:02:57+01:00;Oskar Piegsa;Aus der        ZEIT Nr. 08/2025;false
cda313c3244eae93f6b1b7a60974065435748320c46238c31c53fbec64d233e1;Ökostrom-Produktion wächst - Wemag treibt Netzausbau voran;https://www.zeit.de/news/2025-03/22/oekostrom-produktion-waechst-wemag-treibt-netzausbau-voran;Hier finden Sie Informationen zu dem Thema „Netzausbau für mehr Ökostrom“. Lesen Sie jetzt „Ökostrom-Produktion wächst - Wemag treibt Netzausbau voran“.;Netzausbau für mehr Ökostrom;News, Netzausbau für mehr Ökostrom, Tim Stieger, Wemag Netz, Schwerin, Ökostrom, Netzausbau;2025-03-22T06:00:41+01:00;2025-03-22T06:00:41+01:00;;dpa Mecklenburg-Vorpommern;false
0403f74dd1ce91990f366fac5a64d2e338bb153a95a2f5f55d4ff7b80c6068a1;Aue im Fokus: Kann KI den belasteten Fluss retten?;https://www.zeit.de/news/2025-03/22/aue-im-fokus-kann-ki-den-belasteten-fluss-retten;Hier finden Sie Informationen zu dem Thema „Wasserqualität“. Lesen Sie jetzt „Aue im Fokus: Kann KI den belasteten Fluss retten?“.;Wasserqualität;News, Wasserqualität, Elke Freimuth, Oste, Landkreis Cuxhaven, Wasserqualität;2025-03-22T06:00:38+01:00;2025-03-22T06:00:38+01:00;;dpa Niedersachsen;false
f9163548b22920b8f720f6a14acdad629650f3a3d8af1bb088f8be624a64d666;Kümmert euch um euren eigenen Dreck;https://www.zeit.de/kultur/2025-03/muell-stadtreinigung-muellabfuhr-berlin-streik;Wenn die Müllabfuhr streikt, neigt manch Bürger zur Schnappatmung. Dabei sollte man die Schönheit des Streikmülls würdigen – und sich in mediterraner Gelassenheit üben.;"Z+ (abopflichtiger Inhalt);
        
    Müll";Kultur, Müll, Müll, Streik, Berlin;2025-03-22T05:59:26+01:00;2025-03-22T05:59:26+01:00;Ann-Kristin Tlusty;;false
84d082c8890e2bb9031e2d4592fd44943366b5ed7edd5a493aeeec7a17cf58f9;Wir sind doch noch wer;https://www.zeit.de/2025/12/deutsche-wirtschaft-unternehmen-produktion-vetter;Deutschlands Wirtschaft kann mehr, als viele Menschen im Land ihr zutrauen. Im Ausland weiß man das – und investiert sogar hierzulande.;"Z+ (abopflichtiger Inhalt);
        
    Deutsche Wirtschaft";Wirtschaft, Deutsche Wirtschaft, Unternehmen, Wirtschaftskrise, Produktion, Zoll, Bundesregierung, Wirtschaftspolitik;2025-03-22T05:54:34+01:00;2025-03-22T05:54:34+01:00;Jens Tönnesmann;Aus der        ZEIT Nr. 12/2025;false
5554e8ee6de41454d60d7ea914bc4229940f346181c0a73fb1abafd44ee6e3f5;"""Komplett anders"": TV-Innovation bei Diegos Abschiedsspiel";https://www.zeit.de/news/2025-03/22/komplett-anders-tv-innovation-bei-diegos-abschiedsspiel;"Hier finden Sie Informationen zu dem Thema „Fußball“. Lesen Sie jetzt „""Komplett anders"": TV-Innovation bei Diegos Abschiedsspiel“.";Fußball;News, Fußball, Weserstadion, British Sky Broadcasting Group, Bundesliga, Abschiedsspiel, Fußball, Kamera;2025-03-22T05:43:38+01:00;2025-03-22T05:43:38+01:00;;dpa Niedersachsen;false
e1fe196d952cc722af1005afa68d4873a5a632fbe1b467b164fc2dd8ca03b875;Koalitionsentscheidung der SPD erwartet;https://www.zeit.de/news/2025-03/22/koalitionsentscheidung-der-spd-erwartet;Hier finden Sie Informationen zu dem Thema „Regierungsbildung in Hamburg“. Lesen Sie jetzt „Koalitionsentscheidung der SPD erwartet“.;Regierungsbildung in Hamburg;News, Regierungsbildung in Hamburg, Melanie Leonhard, Peter Tschentscher, Hamburg, Berlin, SPD, CDU, Bundesregierung, Alternative für Deutschland, Bürgerschaftswahl, Koalitionsentscheidung;2025-03-22T05:30:37+01:00;2025-03-22T05:30:37+01:00;;dpa Hamburg/Schleswig-Holstein;false
92c18d27e593e44f1a42d547c10fa9b940d3d8e7575eaede5d6aa3d7433eb959;Mann ohne Masterplan: Hugo Egon Balder wird 75;https://www.zeit.de/news/2025-03/22/mann-ohne-masterplan-hugo-egon-balder-wird-75;Hier finden Sie Informationen zu dem Thema „Moderator“. Lesen Sie jetzt „Mann ohne Masterplan: Hugo Egon Balder wird 75“.;Moderator;News, Moderator, Hugo Egon Balder, Giller, Deutsche Presse-Agentur, Nachkriegsfilm;2025-03-22T05:30:37+01:00;2025-03-22T05:30:37+01:00;;dpa;false
918e08a66228044f799df3866aace88019395ffaa8b5e4c44d2fe8f5eb7bf903;Tankleck – Literweise Kraftstoff läuft aus;https://www.zeit.de/news/2025-03/22/tankleck-literweise-kraftstoff-laeuft-aus;Hier finden Sie Informationen zu dem Thema „Umwelt“. Lesen Sie jetzt „Tankleck – Literweise Kraftstoff läuft aus“.;Umwelt;News, Umwelt, Tankleck, Kraftstoff, Westerwaldkreis, Autobahnparkplatz;2025-03-22T05:20:26+01:00;2025-03-22T05:20:26+01:00;;dpa Rheinland-Pfalz/Saarland;false
0c1663f9174e6fdd07e6a640300907d615da968031fbfbe77dc18736b983c5f1;Trump entzieht Sicherheitsfreigaben, Migranten verlieren Schutzstatus;https://www.zeit.de/politik/ausland/2025-03/us-ueberblick-trump-harris-clinton-sicherheitsfreigaben-migranten-schutzstatus;530.000 Migranten könnte bald die Abschiebung drohen. Biden, Blinken, Harris und Clinton verlieren ihren Zugang zu Geheimdienstinformationen. Der US-Überblick am Morgen;Der US-Überblick am Morgen;Politik, Der US-Überblick am Morgen, US-Regierung, Migration, Abschiebung, Donald Trump, USA, Joe Biden;2025-03-22T05:16:55+01:00;2025-03-22T05:16:55+01:00;eca;ZEIT ONLINE,        Reuters,        dpa,        							eca;false
af1b6e7476d425609308cf03f3d16ae0e71afc8511f3654afdb8fd3350959515;Boxer George Foreman ist tot;https://www.zeit.de/sport/2025-03/boxen-george-foreman-gestorben-schwergewicht;Er verlor seinen Weltmeistertitel gegen Muhammad Ali und legte Jahrzehnte später ein furioses Comeback hin. Mit 76 Jahren ist der US-Boxer George Foreman gestorben.;"""Rumble in the Jungle""";"Sport, ""Rumble in the Jungle"", George Foreman, Boxen, Leistungssport, Tod, Muhammad Ali, Profisport";2025-03-22T05:08:31+01:00;2025-03-22T05:08:31+01:00;sue;ZEIT ONLINE,        Reuters,        AFP,        dpa,        							sue;false
96a72b6bfa14a976f363af31c2e0f496a4ae345f3ec6936723f7531a73ec8c53;Honecker und die Queen - neues Musical von Prinzen-Sänger;https://www.zeit.de/news/2025-03/22/honecker-und-die-queen-neues-musical-von-prinzen-saenger;Hier finden Sie Informationen zu dem Thema „Kultur“. Lesen Sie jetzt „Honecker und die Queen - neues Musical von Prinzen-Sänger“.;Kultur;News, Kultur, Tobias Künzel, Mark Underwood, Erich Honecker, Queen, London;2025-03-22T05:00:44+01:00;2025-03-22T05:00:44+01:00;;dpa Sachsen;false
3e1e17ce5d383fc26918bf3bb90c1ef1af430087a105da9a36926350c775869d;Licht aus: NRW beteiligt sich an Earth Hour;https://www.zeit.de/news/2025-03/22/licht-aus-nrw-beteiligt-sich-an-earth-hour;Hier finden Sie Informationen zu dem Thema „Klima- und Umweltschutz“. Lesen Sie jetzt „Licht aus: NRW beteiligt sich an Earth Hour“.;Klima- und Umweltschutz;News, Klima- und Umweltschutz, NRW, Nordrhein-Westfalen, Earth Hour, Umweltschutz;2025-03-22T05:00:42+01:00;2025-03-22T05:00:42+01:00;;dpa Nordrhein-Westfalen;false
268160a76057f19ba57457333dadd743a7aa57ddda7909075df34786f57ac6b8;Cannabis-Straftaten gehen um mehr als die Hälfte zurück;https://www.zeit.de/news/2025-03/22/cannabis-straftaten-gehen-um-mehr-als-die-haelfte-zurueck;Hier finden Sie Informationen zu dem Thema „Nach Teillegalisierung“. Lesen Sie jetzt „Cannabis-Straftaten gehen um mehr als die Hälfte zurück“.;Nach Teillegalisierung;News, Nach Teillegalisierung, Nordrhein-Westfalen, Innenministerium, Cannabis, Teillegalisierung, Straftat, Kriminalstatistik;2025-03-22T05:00:41+01:00;2025-03-22T05:00:41+01:00;;dpa Nordrhein-Westfalen;false
23ed753f4cf8d18c8f9c04c989735e6c3f97fcf9eef74239dacd2b9646903bde;Plan für hauptamtliche Bürgermeister auch in Dörfern;https://www.zeit.de/news/2025-03/22/plan-fuer-hauptamtliche-buergermeister-auch-in-doerfern;Hier finden Sie Informationen zu dem Thema „Ehrenbeamte“. Lesen Sie jetzt „Plan für hauptamtliche Bürgermeister auch in Dörfern“.;Ehrenbeamte;News, Ehrenbeamte, Sabine Sütterlin-Waack, Schleswig-Holstein;2025-03-22T05:00:41+01:00;2025-03-22T05:00:41+01:00;;dpa Hamburg/Schleswig-Holstein;false
e9999b775565f435be08e0ca8eef97afc428bc10695a880bc4c35e612f73de19;Polizei und Stadt Leipzig auf den Spuren von Bärlauch-Dieben;https://www.zeit.de/news/2025-03/22/polizei-und-stadt-leipzig-auf-den-spuren-von-baerlauch-dieben;Hier finden Sie Informationen zu dem Thema „Bärlauch“. Lesen Sie jetzt „Polizei und Stadt Leipzig auf den Spuren von Bärlauch-Dieben“.;Bärlauch;News, Bärlauch, Leipzig, Polizei, Bärlauch, Stadtwald;2025-03-22T05:00:40+01:00;2025-03-22T05:00:40+01:00;;dpa Sachsen;false
37b32125b2b462282d710aca048f15e81bd14b08117716a240d332e79573b40f;Seit Cannabis-Gesetz in knapp 180 Fällen Straferlass;https://www.zeit.de/news/2025-03/22/seit-cannabis-gesetz-in-knapp-180-faellen-straferlass;Hier finden Sie Informationen zu dem Thema „Kriminalität“. Lesen Sie jetzt „Seit Cannabis-Gesetz in knapp 180 Fällen Straferlass“.;Kriminalität;News, Kriminalität, Berlin, Staatsanwaltschaft, Deutsche Presse-Agentur, Cannabis, Straferlass, Legalisierung, Kriminalität;2025-03-22T04:45:37+01:00;2025-03-22T04:45:37+01:00;;dpa Berlin/Brandenburg;false
e270d34da672b21e19346e1a7b5496ec355c04341ca9543800977b99d2e35de5;Finanzpaket steht - Forderungen zur Verteilung;https://www.zeit.de/news/2025-03/22/finanzpaket-steht-forderungen-zur-verteilung;Hier finden Sie Informationen zu dem Thema „Ausgabe der Zusatz-Milliarden“. Lesen Sie jetzt „Finanzpaket steht - Forderungen zur Verteilung“.;Ausgabe der Zusatz-Milliarden;News, Ausgabe der Zusatz-Milliarden, Helmut Dedy, Daniel Günther, Schleswig-Holstein, RedaktionsNetzwerk Deutschland, CDU, Deutscher Bundestag, Bundesrat, Finanzpaket, Sondervermögen, Bundesratsbeschluss;2025-03-22T04:30:38+01:00;2025-03-22T04:30:38+01:00;;dpa;false
d1ee427203f5bf1d9683ee3a139ce70aeb75edca1be8842f2bd9340cacd5df15;Waldbrandgefahr früh im Jahr schon hoch;https://www.zeit.de/news/2025-03/22/waldbrandgefahr-frueh-im-jahr-schon-hoch;Hier finden Sie Informationen zu dem Thema „Sonne und kein Regen“. Lesen Sie jetzt „Waldbrandgefahr früh im Jahr schon hoch“.;Sonne und kein Regen;News, Sonne und kein Regen, Sachsen-Anhalt, Waldbrandgefahr, Warnstufe, Landeszentrum, Wald;2025-03-22T04:30:38+01:00;2025-03-22T04:30:38+01:00;;dpa Sachsen;false
9f3471fb50b226cc051f4bd5180c84b4dca4cc6fe4783e5520a8eae889fff426;Wie sich der TV-Gerätehersteller Loewe neu aufstellt;https://www.zeit.de/news/2025-03/22/wie-sich-der-tv-geraetehersteller-loewe-neu-aufstellt;Hier finden Sie Informationen zu dem Thema „Traditionsunternehmen“. Lesen Sie jetzt „Wie sich der TV-Gerätehersteller Loewe neu aufstellt“.;Traditionsunternehmen;News, Traditionsunternehmen, Aslan Khabliev, Loewe, Traditionsunternehmen, Insolvenz;2025-03-22T04:30:37+01:00;2025-03-22T04:30:37+01:00;;dpa;false
85cb2718d0b0c7d25c6365c2eada15470a0657ecd823639304311b1a404ba03e;Ausstellung in Halle erzählt besondere Pandemie-Schicksale;https://www.zeit.de/news/2025-03/22/ausstellung-in-halle-erzaehlt-besondere-pandemie-schicksale;Hier finden Sie Informationen zu dem Thema „Während Corona“. Lesen Sie jetzt „Ausstellung in Halle erzählt besondere Pandemie-Schicksale“.;Während Corona;News, Während Corona, Stadtmuseum, Seeleute, Coronavirus, Geflüchtete;2025-03-22T04:30:35+01:00;2025-03-22T04:30:35+01:00;;dpa Sachsen;false
9a608424d9f25e9cf33bebea7dce56288bec6c8738640e588b9bdd9b7b2b8680;"Wo in Bayern zur ""Earth Hour"" die Lichter ausgehen";https://www.zeit.de/news/2025-03/22/wo-in-bayern-zur-earth-hour-die-lichter-ausgehen;"Hier finden Sie Informationen zu dem Thema „Klimaschutz“. Lesen Sie jetzt „Wo in Bayern zur ""Earth Hour"" die Lichter ausgehen“.";Klimaschutz;News, Klimaschutz, Bayern, WWF, Earth Hour, Klimaschutz;2025-03-22T04:00:42+01:00;2025-03-22T04:00:42+01:00;;dpa Bayern;false
bd8947ac3f41abe862b886dcd8445c63b8873918fce3959490581a704c60c6d9;Künstlername bringt Thomas Anders an Kasse in Erklärungsnot;https://www.zeit.de/news/2025-03/22/kuenstlername-bringt-thomas-anders-an-kasse-in-erklaerungsnot;Hier finden Sie Informationen zu dem Thema „Popsänger“. Lesen Sie jetzt „Künstlername bringt Thomas Anders an Kasse in Erklärungsnot“.;Popsänger;News, Popsänger, Thomas Anders, Berlin, KaDeWe, Künstlername, Künstlernamen;2025-03-22T04:00:42+01:00;2025-03-22T04:00:42+01:00;;dpa Rheinland-Pfalz/Saarland;false
d8fa04394caea7e83b274cf3269893dd9d6d76047e0bc4a5075b57350da684a1;Kommunalwahlen werfen im Landtag Schatten voraus;https://www.zeit.de/news/2025-03/22/kommunalwahlen-werfen-im-landtag-schatten-voraus;Hier finden Sie Informationen zu dem Thema „Plenarwoche“. Lesen Sie jetzt „Kommunalwahlen werfen im Landtag Schatten voraus“.;Plenarwoche;News, Plenarwoche, Thomas Hare, Horst Niemeyer, Mann, Plenarwoche, Kommunalwahl, Landtag, Auszählungsverfahren;2025-03-22T04:00:41+01:00;2025-03-22T04:00:41+01:00;;dpa Hessen;false
c132314ab85ce8b6aebdb9a0e5c2d168560127ef7a402af052cc0e416359536d;Topjobs in Ministerien zur Hälfte mit Ostdeutschen besetzt;https://www.zeit.de/news/2025-03/22/topjobs-in-ministerien-zur-haelfte-mit-ostdeutschen-besetzt;Hier finden Sie Informationen zu dem Thema „Gesellschaft“. Lesen Sie jetzt „Topjobs in Ministerien zur Hälfte mit Ostdeutschen besetzt“.;Gesellschaft;News, Gesellschaft, Thüringen, Deutsche Presse-Agentur, Justizministerium, BMBF, Innenministerium, CDU, Topjob, Staatskanzlei;2025-03-22T04:00:41+01:00;2025-03-22T04:00:41+01:00;;dpa Thüringen;false
88c7938a53beee37203603f02163350176d2c854b1fac6d7432fcb60e3fcc862;Weitere Sperrungen auf der Rheintalbahn ab Ostern;https://www.zeit.de/news/2025-03/22/weitere-sperrungen-auf-der-rheintalbahn-ab-ostern;Hier finden Sie Informationen zu dem Thema „Zugverkehr“. Lesen Sie jetzt „Weitere Sperrungen auf der Rheintalbahn ab Ostern“.;Zugverkehr;News, Zugverkehr, Karlsruhe, Basel, Freiburg, Schweiz, Rastatt, Baden-Baden, Deutsche Bahn, Ostern, Karfreitag, Rheintalbahn;2025-03-22T04:00:40+01:00;2025-03-22T04:00:40+01:00;;dpa Baden-Württemberg;false
5a22328067550282e1169c8647de2f7ec5583a4977317ad01689fd6364294ec6;Kopfläuse im Winter - Darum steigen die Zahlen;https://www.zeit.de/news/2025-03/22/kopflaeuse-im-winter-darum-steigen-die-zahlen;Hier finden Sie Informationen zu dem Thema „Gesundheit“. Lesen Sie jetzt „Kopfläuse im Winter - Darum steigen die Zahlen“.;Gesundheit;News, Gesundheit, Sigmaringen, Landkreis Sigmaringen, Landkreis Göppingen, Südwest Presse, Kopflaus, Winterjackenzeit, Lieblingsmonat, Lebensbedingung, Winter, Familie;2025-03-22T04:00:38+01:00;2025-03-22T04:00:38+01:00;;dpa Baden-Württemberg;false
3fa02d5b200aed0d9cd306f405978b95be3d2c6b0d761b6e5b2da33db393e3fd;Grünen-Politiker von Notz: Merz sollte Verhandler abberufen;https://www.zeit.de/news/2025-03/22/gruenen-politiker-von-notz-merz-sollte-verhandler-abberufen;Hier finden Sie Informationen zu dem Thema „Russisches Gas“. Lesen Sie jetzt „Grünen-Politiker von Notz: Merz sollte Verhandler abberufen“.;Russisches Gas;News, Russisches Gas, Konstantin von Notz, Friedrich Merz, Jan Heinisch, Thomas Bareiß, Russland, Europa, CDU, Deutsche Presse-Agentur, Nord Stream 2, Krieg in der Ukraine;2025-03-22T03:55:38+01:00;2025-03-22T03:55:38+01:00;;dpa;false
4f1170f4d9f675781edc9a2e383031765d4ce1ef595ae081a8d36e5c965b8136;Venusgrotte von Schloss Linderhof wird wiedereröffnet;https://www.zeit.de/news/2025-03/22/venusgrotte-von-schloss-linderhof-wird-wiedereroeffnet;Hier finden Sie Informationen zu dem Thema „Denkmäler“. Lesen Sie jetzt „Venusgrotte von Schloss Linderhof wird wiedereröffnet“.;Denkmäler;News, Denkmäler, Markus Söder, Albert Füracker, Ettal, Herrenchiemsee, Stuttgart, BMF, Deutsche Presse-Agentur, CSU, Bund der Steuerzahler, Venusgrotte;2025-03-22T03:45:39+01:00;2025-03-22T03:45:39+01:00;;dpa Bayern;false
ac433f1fc92d47010ab538311c4b4e885df23a27b65405483d1faeb724158581;Champagner-Laune lässt nach;https://www.zeit.de/news/2025-03/22/champagner-laune-laesst-nach;Hier finden Sie Informationen zu dem Thema „Prickelnde Weine“. Lesen Sie jetzt „Champagner-Laune lässt nach“.;Prickelnde Weine;News, Prickelnde Weine, Christian Josephi, Champagne, Freixenet, Pandemiejahr, Champagner, Kaufkraft;2025-03-22T03:35:37+01:00;2025-03-22T03:35:37+01:00;;dpa;false
b065ae8be274954e20a7705cbd76169b4d34805d75d9192269814f96fd4f0816;Was Sie schon immer über Wildschweine wissen wollten;https://www.zeit.de/news/2025-03/22/was-sie-schon-immer-ueber-wildschweine-wissen-wollten;Hier finden Sie Informationen zu dem Thema „Schwarzwild“. Lesen Sie jetzt „Was Sie schon immer über Wildschweine wissen wollten“.;Schwarzwild;News, Schwarzwild, Christoph Hildebrandt, Ulf Hohmann, Koblenz, Sankt Ingbert, Rheinland-Pfalz, Polizei, Wildschwein, Schwarzwild, Wildunfall, Wald;2025-03-22T03:35:36+01:00;2025-03-22T03:35:36+01:00;;dpa Rheinland-Pfalz/Saarland;false
4050d037f9e44d0c13e39afe1b66d4d84e67e5491ea9aca4b8c00aa6c4198832;Kunden konsumieren mit weniger Schuldgefühlen als vor Corona;https://www.zeit.de/news/2025-03/22/kunden-konsumieren-mit-weniger-schuldgefuehlen-als-vor-corona;Hier finden Sie Informationen zu dem Thema „Verbraucherverhalten“. Lesen Sie jetzt „Kunden konsumieren mit weniger Schuldgefühlen als vor Corona“.;Verbraucherverhalten;News, Verbraucherverhalten, Petra Süptitz, Reisen, Verbraucherverhalten, Nachhaltigkeit, Coronavirus, Schuldgefühle;2025-03-22T03:30:40+01:00;2025-03-22T03:30:40+01:00;;dpa;false
f38b532c196cffe8a3d5da0db140d5d9202a08c44822b055488159ac312e11e2;Bayern-Fußballerinnen empfangen im Halbfinale Hoffenheim;https://www.zeit.de/news/2025-03/22/bayern-fussballerinnen-empfangen-im-halbfinale-hoffenheim;Hier finden Sie Informationen zu dem Thema „DFB-Pokal“. Lesen Sie jetzt „Bayern-Fußballerinnen empfangen im Halbfinale Hoffenheim“.;DFB-Pokal;News, DFB-Pokal, Hoffenheim, Deutscher Fußball-Bund, FC Bayern München, Halbfinale, Finale;2025-03-22T03:30:37+01:00;2025-03-22T03:30:37+01:00;;dpa Bayern;false
fb388d2adb0a31e4cee969f44df3e40dfb600d0ef3c3122943bb2a4a11fcf2f9;Hoffenheims Frauen hoffen auf Pokal-Coup in München;https://www.zeit.de/news/2025-03/22/hoffenheims-frauen-hoffen-auf-pokal-coup-in-muenchen;Hier finden Sie Informationen zu dem Thema „Halbfinale im DFB-Pokal“. Lesen Sie jetzt „Hoffenheims Frauen hoffen auf Pokal-Coup in München“.;Halbfinale im DFB-Pokal;News, Halbfinale im DFB-Pokal, Selina Cerci, Hoffenheim, München, Deutscher Fußball-Bund, TSG 1899 Hoffenheim, FC Bayern München, Halbfinale;2025-03-22T03:30:36+01:00;2025-03-22T03:30:36+01:00;;dpa Baden-Württemberg;false
312be50901a1c0d78bbb16dcd323671c1eeade426e52beac9275c0580f2d2501;Waldbrandsaison in Rheinland-Pfalz hat begonnen;https://www.zeit.de/news/2025-03/22/waldbrandsaison-in-rheinland-pfalz-hat-begonnen;Hier finden Sie Informationen zu dem Thema „Einschätzung Wetterdienst“. Lesen Sie jetzt „Waldbrandsaison in Rheinland-Pfalz hat begonnen“.;Einschätzung Wetterdienst;News, Einschätzung Wetterdienst, Rheinland-Pfalz, Hessen, DWD, Waldbrandsaison, Waldbrandgefahr, Trockenheit;2025-03-22T03:30:36+01:00;2025-03-22T03:30:36+01:00;;dpa Rheinland-Pfalz/Saarland;false
5bcd43db4ed8be8e16b51d6535b7b00d3d192c2d69a18cfa50da7c547f74ed82;500.000 Euro Schaden bei Brand in Lagerhalle;https://www.zeit.de/news/2025-03/22/500-000-euro-schaden-bei-brand-in-lagerhalle;Hier finden Sie Informationen zu dem Thema „Ursache unklar“. Lesen Sie jetzt „500.000 Euro Schaden bei Brand in Lagerhalle“.;Ursache unklar;News, Ursache unklar, Polizei, Lagerhalle, Auto;2025-03-22T03:30:07+01:00;2025-03-22T03:30:07+01:00;;dpa Baden-Württemberg;false
838fed5eefb3ee2bdea5259bf0095dd08046ea5ca630bb0395da0337e74c4abe;Krankenkassen rufen künftige Regierung zu raschen Reformen auf;https://www.zeit.de/gesundheit/2025-03/gesetzliche-krankenkassen-warnung-gkv-spitzenverband-bundesregierung;"Ohne schnelles Handeln gingen die Zusatzbeiträge ""über kurz oder lang durch die Decke"", warnen die gesetzlichen Krankenkassen. Union und SPD müssten die Brisanz erkennen.";GKV-Spitzenverband;Gesundheit, GKV-Spitzenverband, Krankenkasse, Krankenversicherung, Reform, Zusatzbeitrag, Bundesregierung, Gesundheitspolitik;2025-03-22T03:00:41+01:00;2025-03-22T03:00:41+01:00;sue;ZEIT ONLINE,        Reuters,        							sue;false
f189d0e28d1454bbce308a9d561bf4b379f3c082e7254d8c0591eb27dafdfd7a;"Gedenken an Opfer des ""Todesmarsches"" Frankfurt-Hünfeld";https://www.zeit.de/news/2025-03/22/gedenken-an-opfer-des-todesmarsches-frankfurt-huenfeld;"Hier finden Sie Informationen zu dem Thema „Geschichte“. Lesen Sie jetzt „Gedenken an Opfer des ""Todesmarsches"" Frankfurt-Hünfeld“.";Geschichte;News, Geschichte, Mann, Frankfurt-Hünfeld, Frankfurt, Hünfeld, Fulda, Buchenwald, Katzbach, Todesmarsch;2025-03-22T03:00:38+01:00;2025-03-22T03:00:38+01:00;;dpa Hessen;false
82994436845b48ef3ae0a7d151fb2176fd06755af6b88c8f41781e3c9c0b14ee;Deutschland, Frankreich und Großbritannien dringen auf Waffenruhe;https://www.zeit.de/politik/ausland/2025-03/gaza-krieg-deutschland-frankreich-grossbritannien-waffenruhe-forderung;"Die drei europäischen Staaten bezeichnen die erneuten israelischen Angriffe im Gazastreifen als ""dramatischen Rückschritt"". Sie seien entsetzt über die zivilen Opfer.";Gazakrieg;Politik, Gazakrieg, Nahostkonflikt, Waffenruhe, Israel, Gazastreifen, Hamas, Militär;2025-03-22T02:45:21+01:00;2025-03-22T02:45:21+01:00;eca;ZEIT ONLINE,        AFP,        Reuters,        							eca;false
