Hash;Title;Link;Description;Category;KeyWords;Published;LastUpdated;Author;Source;Paywall
3186d7ee76c84c87f9eb4756be2f7e8afc1fc31fc5fdd88a51a2572b982a2bb6;Urteil wegen Pflegebetrugs in Millionenhöhe rechtskräftig;https://www.zeit.de/news/2025-07/31/urteil-wegen-pflegebetrugs-in-millionenhoehe-rechtskraeftig;Hier finden Sie Informationen zu dem Thema „Haftstrafe bestätigt“. Lesen Sie jetzt „Urteil wegen Pflegebetrugs in Millionenhöhe rechtskräftig“.;Haftstrafe bestätigt;News, Haftstrafe bestätigt, Nürnberg, Pflegebetrug, Millionenhöhe, Haftstrafe;2025-07-31T12:43:48+02:00;2025-07-31T12:43:48+02:00;;dpa Bayern;false
0b26744bba048b9fac0a690c8bca71bc8acff6f70e615fee6596276f102b19a1;Israelische Ranger besuchen Naturwacht Brandenburg;https://www.zeit.de/news/2025-07/31/israelische-ranger-besuchen-naturwacht-brandenburg;Hier finden Sie Informationen zu dem Thema „World Ranger Day“. Lesen Sie jetzt „Israelische Ranger besuchen Naturwacht Brandenburg“.;World Ranger Day;News, World Ranger Day, Brandenburg, Israel, Uckermark, Schorfheide, Unesco, Naturwacht, Naturschutzwacht;2025-07-31T12:41:35+02:00;2025-07-31T12:41:35+02:00;;dpa Berlin/Brandenburg;false
13955d867da9d079a87257e4dd77790554514249c415e6e1528cc26a1c250095;Werbung für Beauty-Eingriffe – BGH klärt Grenzen;https://www.zeit.de/news/2025-07/31/bgh-keine-vorher-nachher-werbung-fuer-hyaluron-spritzung;Hier finden Sie Informationen zu dem Thema „Medizin-Influencer vor Gericht“. Lesen Sie jetzt „Werbung für Beauty-Eingriffe – BGH klärt Grenzen“.;Medizin-Influencer vor Gericht;News, Medizin-Influencer vor Gericht, Bundesgerichtshof, Schönheitsbehandlung, Schönheitseingriff;2025-07-31T12:41:31+02:00;2025-07-31T12:41:31+02:00;;dpa;false
a9c3b196bfe275c2ac0116fed735f00047fac5d3f37a187095c8dbd1a37f2856;Prozessauftakt: Vater soll Töchter sexuell missbraucht haben;https://www.zeit.de/news/2025-07/31/prozessauftakt-vater-soll-toechter-sexuell-missbraucht-haben;Hier finden Sie Informationen zu dem Thema „Kindesmissbrauch“. Lesen Sie jetzt „Prozessauftakt: Vater soll Töchter sexuell missbraucht haben“.;Kindesmissbrauch;News, Kindesmissbrauch, Neubrandenburg, Prozessauftakt, Kindesmissbrauch, Sexueller Missbrauch;2025-07-31T12:39:28+02:00;2025-07-31T12:39:28+02:00;;dpa Hamburg/Schleswig-Holstein;false
45481914b4ce9c5f926feb34dfd9cc77d5a74b68bb50d9d39b84b678ddb6407a;"Sepp Müller: ""Werden als starkes Team auftreten""";https://www.zeit.de/news/2025-07/31/sepp-mueller-werden-als-starkes-team-auftreten;"Hier finden Sie Informationen zu dem Thema „Gut ein Jahr bis zur Wahl“. Lesen Sie jetzt „Sepp Müller: ""Werden als starkes Team auftreten""“.";Gut ein Jahr bis zur Wahl;News, Gut ein Jahr bis zur Wahl, Sepp Müller, Reiner Haseloff, Wittenberg, Sachsen-Anhalt, CDU, CDU/CSU-Bundestagsfraktion, Landtagswahl;2025-07-31T12:33:54+02:00;2025-07-31T12:33:54+02:00;;dpa Sachsen;false
beec270c5cbd26a7f94507abbad3d9fd489f6b12b37049ebbb582e174dc17c79;Absteiger Kiel mit Ambition: Nicht sabbeln, sondern machen;https://www.zeit.de/news/2025-07/31/absteiger-kiel-mit-ambition-nicht-sabbeln-sondern-machen;Hier finden Sie Informationen zu dem Thema „2. Fußball-Bundesliga“. Lesen Sie jetzt „Absteiger Kiel mit Ambition: Nicht sabbeln, sondern machen“.;2. Fußball-Bundesliga;News, 2. Fußball-Bundesliga, David Zec, Marcel Rapp, Shuto Machino, Holstein, Holstein Kiel, Fußball-Bundesliga, Bundesliga, Absteiger, Ambition, Gegentor;2025-07-31T12:30:36+02:00;2025-07-31T12:30:36+02:00;;dpa Hamburg/Schleswig-Holstein;false
242dae243ed8159eb52c3197484887d4c7f2338e553121b67ef0f43f0712bffa;Inflationsrate unverändert bei 1,8 Prozent;https://www.zeit.de/news/2025-07/31/inflationsrate-unveraendert-bei-1-8-prozent;Hier finden Sie Informationen zu dem Thema „Statistisches Landesamt“. Lesen Sie jetzt „Inflationsrate unverändert bei 1,8 Prozent“.;Statistisches Landesamt;News, Statistisches Landesamt, Rheinland-Pfalz, Landesamt, Inflation;2025-07-31T12:30:01+02:00;2025-07-31T12:30:01+02:00;;dpa Rheinland-Pfalz/Saarland;false
6291a83df39a54f137df361e029aa490674d9c5ea033dae6a3ab47c1cc137d72;Wo die Männer unter sich bleiben;https://www.zeit.de/sport/2025-07/weibliche-fuehrungskraefte-fussball-initiative-bundesliga-luise-gottberg;Eine Initiative will die Zahl der weiblichen Führungskräfte im Fußball erhöhen. Ihr aktueller Bericht stellt fest: Die Bundesliga macht keinen Millimeter Fortschritt.;Weibliche Führungskräfte im Fußball;Sport, Weibliche Führungskräfte im Fußball, Fußball-Bundesliga, Fußball, Frauen, Mann, Gleichstellung, Katja Kraus;2025-07-31T12:26:17+02:00;2025-07-31T12:26:17+02:00;Oliver Fritsch;;false
23a21d8ed282f320d5ec6d2b8a55b8eacf51e332fef39e1428799a44ce133cdd;DRK fordert Pflichtunterricht an Schulen zu Wiederbelebung;https://www.zeit.de/news/2025-07/31/drk-fordert-pflichtunterricht-an-schulen-zu-wiederbelebung;Hier finden Sie Informationen zu dem Thema „Erfolgreiche Modellprojekte“. Lesen Sie jetzt „DRK fordert Pflichtunterricht an Schulen zu Wiederbelebung“.;Erfolgreiche Modellprojekte;News, Erfolgreiche Modellprojekte, Manuela Schwesig, Dänemark, Mecklenburg-Vorpommern, DRK, Rotes Kreuz, SPD, Pflichtunterricht, Wiederbelebung, Modellprojekt, Reanimationsunterricht;2025-07-31T12:24:42+02:00;2025-07-31T12:24:42+02:00;;dpa Mecklenburg-Vorpommern;false
c9046ca6e21d2d9bf580cc4566f94a569af1e8bf30069fac3345330aa1688a64;Vergewaltigung im Wald - Junger Mann steht vor Gericht;https://www.zeit.de/news/2025-07/31/vergewaltigung-im-wald-prozess-startet;Hier finden Sie Informationen zu dem Thema „Kriminalität“. Lesen Sie jetzt „Vergewaltigung im Wald - Junger Mann steht vor Gericht“.;Kriminalität;News, Kriminalität, Kriminalität, Vergewaltigung, Wald;2025-07-31T12:19:02+02:00;2025-07-31T12:19:02+02:00;;dpa Hessen;false
bf44b1b264e4857ee0967aae13857c92a75c374a70c2fbde10ae664c39143a70;Datenschützer erhalten mehr Beschwerden;https://www.zeit.de/news/2025-07/31/datenschuetzer-erhalten-mehr-beschwerden;Hier finden Sie Informationen zu dem Thema „Private Kameras im Fokus“. Lesen Sie jetzt „Datenschützer erhalten mehr Beschwerden“.;Private Kameras im Fokus;News, Private Kameras im Fokus, Niedersachsen, Datenschützer, Beschwerde, Kamera;2025-07-31T12:17:41+02:00;2025-07-31T12:17:41+02:00;;dpa Niedersachsen;false
f7b6fdbfabc02f9f614e69dc6c0a133174b488b099c29da006e20704c754c218;Mehr Arbeitslose, mehr Pleiten;https://www.zeit.de/news/2025-07/31/truebe-aussichten-fuer-den-bayerischen-arbeitsmarkt;Hier finden Sie Informationen zu dem Thema „Wirtschaftskrise“. Lesen Sie jetzt „Mehr Arbeitslose, mehr Pleiten“.;Wirtschaftskrise;News, Wirtschaftskrise, Bayern, Bundesagentur für Arbeit, Regionaldirektion, Wirtschaftsflaute, Statistik;2025-07-31T12:15:37+02:00;2025-07-31T12:15:37+02:00;;dpa Bayern;false
235d549cb3b8c55d2124f6c897f7963860b01d7df017fc3d27c2f36becbd41dc;Verletzte in Döbeln: Stinkspray war wohl die Ursache;https://www.zeit.de/news/2025-07/31/verletzte-in-doebeln-stinkspray-war-wohl-die-ursache;Hier finden Sie Informationen zu dem Thema „Feuerwehreinsatz“. Lesen Sie jetzt „Verletzte in Döbeln: Stinkspray war wohl die Ursache“.;Feuerwehreinsatz;News, Feuerwehreinsatz, Döbeln, Landkreis Mittelsachsen, Polizei, Stinkspray, Feuerwehreinsatz, Atemwegsreizung;2025-07-31T12:15:35+02:00;2025-07-31T12:15:35+02:00;;dpa Sachsen;false
b6c0fd2ffb95f3d4d8f337686264683ca7a2b838e7c96de43ef8fba41e1854fb;Warum Werbeblocker so umstritten sind;https://www.zeit.de/news/2025-07/31/warum-werbeblocker-so-umstritten-sind;Hier finden Sie Informationen zu dem Thema „Bundesgerichtshof“. Lesen Sie jetzt „Warum Werbeblocker so umstritten sind“.;Bundesgerichtshof;News, Bundesgerichtshof, Philipp-Christian Thomale, Karlsruhe, Javascript, Axel Springer, Bundesgerichtshof, EuGH, Adblock Plus, Werbeblocker, Konflikt, Software;2025-07-31T12:11:05+02:00;2025-07-31T12:11:05+02:00;;dpa;false
966b4c83b8f72e5f676ed709bbbecce33378cddd05d6263a9c17bb3d11ce9aa7;US-Zölle belasten Lufthansa Technik;https://www.zeit.de/news/2025-07/31/us-zoelle-belasten-lufthansa-technik;Hier finden Sie Informationen zu dem Thema „Luftverkehr“. Lesen Sie jetzt „US-Zölle belasten Lufthansa Technik“.;Luftverkehr;News, Luftverkehr, Christian Leifeld, Deutsche Lufthansa, Luftverkehr, Zulieferkosten, Kostendruck, US-Zölle;2025-07-31T12:08:59+02:00;2025-07-31T12:08:59+02:00;;dpa Hamburg/Schleswig-Holstein;false
e2c3c032723408313a15e90256571ede4ba7740bca23b277cbbda1f7ae4d4ce3;Neunjähriger bei Fahrradunfall verletzt;https://www.zeit.de/news/2025-07/31/neunjaehriger-bei-fahrradunfall-verletzt;Hier finden Sie Informationen zu dem Thema „Verkehr“. Lesen Sie jetzt „Neunjähriger bei Fahrradunfall verletzt“.;Verkehr;News, Verkehr, Offenbach, Fahrradunfall, Verkehr;2025-07-31T12:07:52+02:00;2025-07-31T12:07:52+02:00;;dpa Hessen;false
dacdbca821b3c356486517339fda7318ba0494e6991b4897081d1e866c3006b0;15 Vögel wohl durch Giftköder getötet - Polizei ermittelt;https://www.zeit.de/news/2025-07/31/15-voegel-wohl-durch-giftkoeder-getoetet-polizei-ermittelt;Hier finden Sie Informationen zu dem Thema „Niederbayern“. Lesen Sie jetzt „15 Vögel wohl durch Giftköder getötet - Polizei ermittelt“.;Niederbayern;News, Niederbayern, Niederbayern, Polizei, Tiere, Wald;2025-07-31T12:05:37+02:00;2025-07-31T12:05:37+02:00;;dpa Bayern;false
c7cae82f34a2329065b020075c3db201a9dbc373f3cd255128bbf8479c29ec78;Netzwerk soll Gewalttaten von psychisch Kranken verhindern;https://www.zeit.de/news/2025-07/31/netzwerk-soll-gewalttaten-von-psychisch-kranken-verhindern;Hier finden Sie Informationen zu dem Thema „Prävention“. Lesen Sie jetzt „Netzwerk soll Gewalttaten von psychisch Kranken verhindern“.;Prävention;News, Prävention, Gewalttat, Prävention, Netzwerk, Hauptbahnhof, Messerangriff;2025-07-31T12:05:25+02:00;2025-07-31T12:05:25+02:00;;dpa Hamburg/Schleswig-Holstein;false
3459d6ce931034255c0edc8bcde29cb549ccad3bee94bd8709047a51a9f5c777;Tödliche Messerattacke in Beelitz: Mann muss in Psychiatrie;https://www.zeit.de/news/2025-07/31/toedliche-messerattacke-in-beelitz-mann-muss-in-psychiatrie;Hier finden Sie Informationen zu dem Thema „Kriminalität“. Lesen Sie jetzt „Tödliche Messerattacke in Beelitz: Mann muss in Psychiatrie“.;Kriminalität;News, Kriminalität, Beelitz, Potsdam, Wermelskirchen, Messerattacke, Psychiatrie, Kriminalität;2025-07-31T12:04:09+02:00;2025-07-31T12:04:09+02:00;;dpa Berlin/Brandenburg;false
31e577dbf98c9b7303319c5ee08f8bbca741402421ed1939e84ee59a8c624725;"""Bei unseren Ermittlungen herrscht völliger Stillstand""";https://www.zeit.de/politik/ausland/2025-07/oleksandr-klymenko-korruption-wolodymyr-selenykyj-behoerden-ukraine;Was heißt es, in der Ukraine gegen Korruption vorzugehen? Hier erzählt ein Behördenchef, gegen wie viele Abgeordnete er ermittelt. Und welchen Angriffen er ausgesetzt ist;Oleksandr Klymenko;Politik, Oleksandr Klymenko, Korruption, Krieg in der Ukraine, Ermittlung, Wolodymyr Selenskyj, Whistleblower, Russland;2025-07-31T12:01:58+02:00;2025-07-31T12:01:58+02:00;Olivia Kortas;;false
c4f02f91384239fffb7ba3ed324a99e380a7529bcc562c26ab695a41a20e5ce1;Michael Ballweg von Betrugsvorwurf freigesprochen;https://www.zeit.de/gesellschaft/2025-07/querdenken-michael-ballweg-betrug-steuerhinterziehung-urteil;Ein Gericht hat den Gründer der Querdenken-Bewegung vom Vorwurf des Betrugs freigesprochen. Schuldig ist Ballweg laut dem Urteil aber der Steuerhinterziehung.;Querdenken;Gesellschaft, Querdenken, Querdenken, Steuerhinterziehung, Betrug, Justiz, Landgericht, Stuttgart;2025-07-31T11:59:10+02:00;2025-07-31T11:59:10+02:00;ale;DIE ZEIT,        dpa,        							ale;false
bb2055bc30141060521ef3049408e71a86130b8f3217862957d13e8c700d8c30;Triathlon in Frankfurt: Einschränkungen im ÖPNV;https://www.zeit.de/news/2025-07/31/triathlon-in-frankfurt-einschraenkungen-im-oepnv;Hier finden Sie Informationen zu dem Thema „Stadtverkehr“. Lesen Sie jetzt „Triathlon in Frankfurt: Einschränkungen im ÖPNV“.;Stadtverkehr;News, Stadtverkehr, Frankfurt, Düsseldorfer Straße, Hugo-Junkers-Straße, Einschränkung, Stadtverkehr, Triathlon;2025-07-31T11:56:24+02:00;2025-07-31T11:56:24+02:00;;dpa Hessen;false
441f6679aab42babe4cac8b503e5976aed9223620b637510af8f925adc526cb6;Deutsche Bahn bestätigt Millionenverlust im ersten Halbjahr;https://www.zeit.de/mobilitaet/2025-07/deutsche-bahn-verlust-erstes-halbjahr;Die Bahn bestätigt, im ersten Halbjahr 760 Millionen Euro Verlust gemacht zu haben. Im Vergleich zum Vorjahr ist das eine Verbesserung um eine Milliarde Euro.;Zugverkehr;Mobilitaet, Zugverkehr, Fernverkehr, Umsatz, Infrastruktur, Deutsche Bahn, Aktien, Unternehmen;2025-07-31T11:56:18+02:00;2025-07-31T11:56:18+02:00;ljk;DIE ZEIT,        AFP,        							ljk;false
4e2c6cd4b913b8c52a8e3f6dcf3660fa7f08712bfb8609562835351e036091fe;Autozulieferer ZF schreibt erneut rote Zahlen;https://www.zeit.de/news/2025-07/31/autozulieferer-zf-schreibt-erneut-rote-zahlen;Hier finden Sie Informationen zu dem Thema „Autokrise“. Lesen Sie jetzt „Autozulieferer ZF schreibt erneut rote Zahlen“.;Autokrise;News, Autokrise, Michael Frick, ZF Friedrichshafen, Autokrise, Konzernverlust;2025-07-31T11:55:32+02:00;2025-07-31T11:55:32+02:00;;dpa;false
053f554c3abd65b29a1a206d3c0219907c6363dbaa90c6207d6f107eab63eeab;Nach Gewinnsprung: Lufthansa auf Kurs zu Jahreszielen;https://www.zeit.de/news/2025-07/31/lufthansa-haelt-nach-gewinnsprung-an-jahreszielen-fest;Hier finden Sie Informationen zu dem Thema „Erstes Halbjahr erfolgreich“. Lesen Sie jetzt „Nach Gewinnsprung: Lufthansa auf Kurs zu Jahreszielen“.;Erstes Halbjahr erfolgreich;News, Erstes Halbjahr erfolgreich, Deutsche Lufthansa, Jahreszielen, Gewinnsprung, Ticketnachfrage, Luftverkehr, Treibstoffkosten;2025-07-31T11:52:52+02:00;2025-07-31T11:52:52+02:00;;dpa;false
ae53339267d1f5f4ab121b01b68cc94b5c853ec39c2693b2a150834a1971d476;Mit Sprengstoff hantiert - Funde nach Explosion in Marzahn;https://www.zeit.de/news/2025-07/31/explosion-in-marzahn-polizei-findet-sprengstoff-zutaten;Hier finden Sie Informationen zu dem Thema „Blaulicht“. Lesen Sie jetzt „Mit Sprengstoff hantiert - Funde nach Explosion in Marzahn“.;Blaulicht;News, Blaulicht, Marzahn, Berlin-Marzahn, Berlin, Polizei, Explosion, Blaulicht;2025-07-31T11:50:15+02:00;2025-07-31T11:50:15+02:00;;dpa Berlin/Brandenburg;false
ba3e9981a5ab22b624e4838ed5e18589b8c06c3c100a300df0a6fd5f14ee70a2;Weniger Straftaten bei Fußballspielen in Niedersachsen;https://www.zeit.de/news/2025-07/31/weniger-straftaten-bei-fussballspielen-in-niedersachsen;Hier finden Sie Informationen zu dem Thema „Fußball“. Lesen Sie jetzt „Weniger Straftaten bei Fußballspielen in Niedersachsen“.;Fußball;News, Fußball, Daniela Behrens, Niedersachsen, Polizei, Straftat, Fußballspiel, Fußball, Profiliga, Digitalisierung;2025-07-31T11:49:39+02:00;2025-07-31T11:49:39+02:00;;dpa Niedersachsen;false
fb216e12184a63305d7471883a5f19ef188d5d0d4ed8b894f95f6923d0dd5730;Arbeitslosigkeit in Sachsen-Anhalt im Juli gestiegen;https://www.zeit.de/news/2025-07/31/arbeitslosigkeit-in-sachsen-anhalt-im-juli-gestiegen;Hier finden Sie Informationen zu dem Thema „Arbeitsmarkt“. Lesen Sie jetzt „Arbeitslosigkeit in Sachsen-Anhalt im Juli gestiegen“.;Arbeitsmarkt;News, Arbeitsmarkt, Sachsen-Anhalt, Bundesagentur für Arbeit, Arbeitslosigkeit, Regionaldirektion;2025-07-31T11:48:13+02:00;2025-07-31T11:48:13+02:00;;dpa Sachsen;false
0130250d8137b52d7e0cd5079ad9d03e80ee26e6d4e483052b418ddf55c6e02d;Torwartfrage bei Holstein Kiel noch nicht entschieden;https://www.zeit.de/news/2025-07/31/torwartfrage-bei-holstein-kiel-noch-nicht-entschieden;Hier finden Sie Informationen zu dem Thema „2. Fußball-Bundesliga“. Lesen Sie jetzt „Torwartfrage bei Holstein Kiel noch nicht entschieden“.;2. Fußball-Bundesliga;News, 2. Fußball-Bundesliga, Marcel Rapp, Holstein Kiel, Fußball-Bundesliga, Bundesliga, Torwartfrage;2025-07-31T11:45:06+02:00;2025-07-31T11:45:06+02:00;;dpa Hamburg/Schleswig-Holstein;false
31fde8608f6c6ae0aff5eb3030b98e10f0a75a8eff7b96858e59b8de27f9e218;"""Das ist Spitzensport"" - Feuerwehrleute suchen Meister";https://www.zeit.de/news/2025-07/31/das-ist-spitzensport-feuerwehrleute-suchen-meister;"Hier finden Sie Informationen zu dem Thema „Feuerwehrsport“. Lesen Sie jetzt „""Das ist Spitzensport"" - Feuerwehrleute suchen Meister“.";Feuerwehrsport;News, Feuerwehrsport, Silvia Oestreicher, Laura Wolf, Fred Langkabel, Tschechien, Österreich, Torgau, Feuerwehr, Feuerwehrsport, Spitzensport;2025-07-31T11:42:49+02:00;2025-07-31T11:42:49+02:00;;dpa Sachsen;false
937042ffcb2f6f32b707af98303afd44119ee8e870c453299d8a1031da525a70;Zahl der Unwetteropfer um Peking steigt auf mindestens 60;https://www.zeit.de/news/2025-07/31/zahl-der-unwetteropfer-um-peking-steigt-auf-mindestens-60;Hier finden Sie Informationen zu dem Thema „Regen in China“. Lesen Sie jetzt „Zahl der Unwetteropfer um Peking steigt auf mindestens 60“.;Regen in China;News, Regen in China, Peking, China, Chengde, Hebei, Miyun;2025-07-31T11:40:11+02:00;2025-07-31T11:40:11+02:00;;dpa;false
61091e746b80704c64ea191d45105abc438e1dd5bfa8595b411a25c8aa16dbf9;Chinesischer Internetkonzern JD will MediaMarkt und Saturn übernehmen;https://www.zeit.de/wirtschaft/unternehmen/2025-07/mediamarkt-saturn-uebernahme-china-jd-com;Der Mutterkonzern der Elektronikhändler MediaMarkt und Saturn soll künftig mehrheitlich JD.com gehören. Märkte und Beschäftigte sollen vorerst erhalten bleiben.;Ceconomy-Übernahme;Wirtschaft, Ceconomy-Übernahme, Übernahme, Großunternehmen, Einzelhandel, Gewerkschaft, China, Arbeitsplatz;2025-07-31T11:37:29+02:00;2025-07-31T11:37:29+02:00;lk;DIE ZEIT,        Reuters,        AFP,        							lk;false
d58d0c47013f63d33b9ef95d3617251700acc6c536a36832bfb4c74c774965c4;Litauens Regierungschef tritt wegen Korruptionsvorwürfen zurück;https://www.zeit.de/politik/ausland/2025-07/litauen-regierungschef-gintautas-paluckas-ruecktritt;Der litauische Ministerpräsident Paluckas gibt seinen Posten ab. Ermittlungen gegen seine Geschäftsbeziehungen sorgten zuvor für einen Koalitionsstreit.;Gintautas Paluckas;Politik, Gintautas Paluckas, Litauen, Ministerpräsident, Korruption, Geldstrafe, Osteuropa;2025-07-31T11:37:17+02:00;2025-07-31T11:37:17+02:00;ale;DIE ZEIT,        Reuters,        AFP,        AP,        							ale;false
f57149d3f9f4df87fa92ef562f1c42e2763dd5a517a61059f34779dc0d4682bc;Flusskrebse krabbeln durch S-Bahn – Polizei greift ein;https://www.zeit.de/news/2025-07/31/flusskrebse-krabbeln-durch-s-bahn-polizei-greift-ein;Hier finden Sie Informationen zu dem Thema „Köln“. Lesen Sie jetzt „Flusskrebse krabbeln durch S-Bahn – Polizei greift ein“.;Köln;News, Köln, Köln, Köln Hauptbahnhof, Polizei, Bundespolizei, Flusskrebs;2025-07-31T11:34:47+02:00;2025-07-31T11:34:47+02:00;;dpa Nordrhein-Westfalen;false
76719181002451ff1a8e9e00fe8c352f17716d43d4bb0fea693ab104d81a4e77;Ferienjobs: 7 Tipps für Schüler und Studenten;https://www.zeit.de/news/2025-07/23/ferienjobs-7-tipps-fuer-schueler-und-studenten;Hier finden Sie Informationen zu dem Thema „Sommerferien“. Lesen Sie jetzt „Ferienjobs: 7 Tipps für Schüler und Studenten“.;Sommerferien;News, Sommerferien, Baden-Württemberg, Bundesagentur für Arbeit, Ferienjob, Sommerferien, Regionaldirektion;2025-07-31T11:34:33+02:00;2025-07-31T11:34:33+02:00;;dpa Baden-Württemberg;false
438582c7297b1a797731810003db160a9343a1ca9e07a262e32b33c26473f78f;"""Querdenken""-Chef Ballweg von Betrugsvorwurf freigesprochen";https://www.zeit.de/news/2025-07/31/querdenken-chef-ballweg-von-betrugsvorwurf-freigesprochen;"Hier finden Sie Informationen zu dem Thema „Kriminalität“. Lesen Sie jetzt „""Querdenken""-Chef Ballweg von Betrugsvorwurf freigesprochen“.";Kriminalität;News, Kriminalität, News;2025-07-31T11:31:00+02:00;2025-07-31T11:31:00+02:00;;dpa;false
3c8b6d0369d1880691f96f4b7d711c1e2d33e1cfee4602a97cb0e7c3a7ac5c04;Auto prallt mit Schulbus zusammen - ein Schwerverletzter;https://www.zeit.de/news/2025-07/31/auto-prallt-mit-schulbus-zusammen-ein-schwerverletzter;Hier finden Sie Informationen zu dem Thema „Verkehr“. Lesen Sie jetzt „Auto prallt mit Schulbus zusammen - ein Schwerverletzter“.;Verkehr;News, Verkehr, Pretzfeld, Schulbus, Verkehr, Unfall, Auto;2025-07-31T11:30:48+02:00;2025-07-31T11:30:48+02:00;;dpa Bayern;false
c4748b352b25badb0f3b43217da78f9d4a69ac116020966e4ab8f37bdaf8bf1c;"Opfer verliert Auge - wenige Hinweise nach ""Aktenzeichen XY""";https://www.zeit.de/news/2025-07/31/opfer-verliert-auge-wenige-hinweise-nach-aktenzeichen-xy;"Hier finden Sie Informationen zu dem Thema „Tätersuche“. Lesen Sie jetzt „Opfer verliert Auge - wenige Hinweise nach ""Aktenzeichen XY""“.";Tätersuche;News, Tätersuche, Braunschweig, Aktenzeichen XY, Tätersuche, Fernsehbericht;2025-07-31T11:27:30+02:00;2025-07-31T11:27:30+02:00;;dpa Niedersachsen;false
14b7516601b67fe1020af69bb086ee8f09b13cba4199f8a708469bdaf33b393d;Immer weniger Heiratswillige in Thüringen;https://www.zeit.de/news/2025-07/31/immer-weniger-heiratswillige-in-thueringen;Hier finden Sie Informationen zu dem Thema „Statistik“. Lesen Sie jetzt „Immer weniger Heiratswillige in Thüringen“.;Statistik;News, Statistik, Thüringen, Standesamt, Statistik;2025-07-31T11:25:52+02:00;2025-07-31T11:25:52+02:00;;dpa Thüringen;false
a2db6dc1264f58d36fafcf4598d847018c9d70cafe10aea779b0c0ae2ef31b78;Heimaufsicht Sachsen-Anhalt: Mehr Mängel in der Pflege;https://www.zeit.de/news/2025-07/31/heimaufsicht-sachsen-anhalt-mehr-maengel-in-der-pflege;Hier finden Sie Informationen zu dem Thema „Kontrollen und Beschwerden“. Lesen Sie jetzt „Heimaufsicht Sachsen-Anhalt: Mehr Mängel in der Pflege“.;Kontrollen und Beschwerden;News, Kontrollen und Beschwerden, Sachsen-Anhalt, Pflege, Beschwerde, Landesverwaltungsamt, Fachkräftemangel;2025-07-31T11:23:01+02:00;2025-07-31T11:23:01+02:00;;dpa Sachsen;false
e401bad799241dc1070ed57f264cbdf50986f0c05bf9ea1caa986a2f70f3b258;Mehr junge Menschen melden sich arbeitslos;https://www.zeit.de/news/2025-07/31/mehr-junge-menschen-melden-sich-arbeitslos;Hier finden Sie Informationen zu dem Thema „Arbeitsmarkt“. Lesen Sie jetzt „Mehr junge Menschen melden sich arbeitslos“.;Arbeitsmarkt;News, Arbeitsmarkt, Heidrun Schulz, Saarland, Rheinland-Pfalz, Bundesagentur für Arbeit, Regionaldirektion;2025-07-31T11:20:20+02:00;2025-07-31T11:20:20+02:00;;dpa Rheinland-Pfalz/Saarland;false
e97fe27f11c40ba8410b42bf65d17f0b3d8077ad3c17a24c57f51f849d981fe3;Mehr als 200 Künstler fordern Ende der Waffenexporte an Israel;https://www.zeit.de/kultur/2025-07/israel-waffenlieferung-brief-kuenstler-ski-aggu;Ski Aggu, Meret Becker, Joko: Zahlreiche Kulturschaffende haben einen offenen Brief an Kanzler Merz unterzeichnet. Darin fordern sie einen härteren Umgang mit Israel.;Gazastreifen;Kultur, Gazastreifen, Friedrich Merz, Gazastreifen, Waffenlieferung, Israel, Meret Becker, Joko Winterscheidt, Bundesregierung;2025-07-31T11:17:09+02:00;2025-07-31T11:17:09+02:00;kzi;DIE ZEIT,        dpa,        AFP,        							kzi;false
2617e18f7248c64eda3c3a748c4050069916660f1a09905a5b2dd4f9e7cf2d6e;Basketball-Pokal-Derby Bremerhaven gegen Oldenburg in Bremen;https://www.zeit.de/news/2025-07/31/basketball-pokal-derby-bremerhaven-gegen-oldenburg-in-bremen;Hier finden Sie Informationen zu dem Thema „Basketball“. Lesen Sie jetzt „Basketball-Pokal-Derby Bremerhaven gegen Oldenburg in Bremen“.;Basketball;News, Basketball, Bremerhaven, Oldenburg, Bremen, Eisbären Bremerhaven, EWE Baskets Oldenburg, BB, Basketball, Nordclub;2025-07-31T11:16:38+02:00;2025-07-31T11:16:38+02:00;;dpa Niedersachsen;false
04629475fb1ae075db14dbbf4ae14c3de359131e0abd51a3421d0df02d32cf6c;Verbraucherpreise ziehen leicht an;https://www.zeit.de/news/2025-07/31/verbraucherpreise-ziehen-leicht-an;Hier finden Sie Informationen zu dem Thema „Inflationsrate“. Lesen Sie jetzt „Verbraucherpreise ziehen leicht an“.;Inflationsrate;News, Inflationsrate, Wiesbaden, Hessen, Verbraucherpreis, Inflation;2025-07-31T11:14:31+02:00;2025-07-31T11:14:31+02:00;;dpa Hessen;false
d1794466728d46af554524b319c9c0a867b86e1feda156420f2d2a5852f5bdbc;Lange Staus zu Ferienstart - gibt es Alternativen?;https://www.zeit.de/news/2025-07/28/adac-warnt-vor-langen-staus-zu-ferienbeginn;Hier finden Sie Informationen zu dem Thema „Reiseverkehr“. Lesen Sie jetzt „Lange Staus zu Ferienstart - gibt es Alternativen?“.;Reiseverkehr;News, Reiseverkehr, Alexander Kreipl, Österreich, Schweiz, Kroatien, Italien, Salzburg, ADAC, Mariä Himmelfahrt, Ferienbeginn, Reiseverkehr;2025-07-31T11:14:14+02:00;2025-07-31T11:14:14+02:00;;dpa Bayern;false
689e11bdeda39ef4f59559375b5d819122b336fd531e1a1bf4ff36e071ffa691;Opfer mit Baseballschlägern traktiert – vier Männer in Haft;https://www.zeit.de/news/2025-07/31/opfer-mit-baseballschlaegern-traktiert-vier-maenner-in-haft;Hier finden Sie Informationen zu dem Thema „Mannheim“. Lesen Sie jetzt „Opfer mit Baseballschlägern traktiert – vier Männer in Haft“.;Mannheim;News, Mannheim, Mann, Mannheim, Staatsanwaltschaft;2025-07-31T11:02:27+02:00;2025-07-31T11:02:27+02:00;;dpa Baden-Württemberg;false
d863cc2d536ec6db54f053433a6b57e380802e5e7a7648b01e829ee718b1cb65;Zahl der arbeitslosen Menschen ist im Juli leicht gestiegen;https://www.zeit.de/arbeit/2025-07/arbeitslosigkeit-juli-gestiegen-bundesagentur-fuer-arbeit;Zu Beginn der Sommerpause haben sich mehr Menschen arbeitssuchend gemeldet als im Juni. Zudem melden Unternehmen laut Bundesagentur-Chefin Nahles nur wenige neue Stellen.;Arbeitslosigkeit;Arbeit, Arbeitslosigkeit, Arbeitslosigkeit, Arbeitsmarkt, Andrea Nahles, Bundesagentur für Arbeit, Ausbildungsmarkt, Bürgergeld;2025-07-31T10:59:12+02:00;2025-07-31T10:59:12+02:00;ljk;DIE ZEIT,        AFP,        							ljk;false
