Hash;Title;Link;Description;Category;KeyWords;Published;LastUpdated;Author;Source;Paywall
d6a91a9cc24c06ed9fd498cdd8e5f87ca346ae9c28782b806de24d23b878eedd;Gewalt im Westjordanland: USA sanktionieren Siedlergruppe;https://www.zeit.de/news/2024-11/18/gewalt-im-westjordanland-usa-sanktionieren-siedlergruppe;Hier finden Sie Informationen zu dem Thema „Nahost“. Lesen Sie jetzt „Gewalt im Westjordanland: USA sanktionieren Siedlergruppe“.;"Z+ (abopflichtiger Inhalt);
        
    
Nahost";News, Nahost, Westjordanland, USA, Nahost, Finanzministerium der Vereinigten Staaten, Siedlergruppe;2024-11-18T18:25:02+01:00;2024-11-18T18:25:02+01:00;;dpa;false
a07de32ac85afdcbd297dede3b76846b937d5748cd56060e39a1c2ed0834466e;Polizei holt Tesla-Gegner von Bäumen - Einsatz geht weiter;https://www.zeit.de/news/2024-11/18/polizei-holt-tesla-gegner-von-baeumen-einsatz-geht-weiter;Hier finden Sie Informationen zu dem Thema „Kampfmittel-Suche geplant“. Lesen Sie jetzt „Polizei holt Tesla-Gegner von Bäumen - Einsatz geht weiter“.;"Z+ (abopflichtiger Inhalt);
        
    
Kampfmittel-Suche geplant";News, Kampfmittel-Suche geplant, Elon Musk, Beate Kardel, Grünheide, Berlin, Polizei, Protestcamp, Wald;2024-11-18T18:16:30+01:00;2024-11-18T18:16:30+01:00;;dpa Berlin/Brandenburg;false
577ff14b58754199da88e00b124070e3c8ff08b945973784f0bbbd3c70ad1982;Kunst und Kommerz;https://www.zeit.de/kultur/2024-11/andy-warhol-donald-trump-kunstwerke-auktion-new-york;"Andy Warhol hat einst den Trump Tower in New York gemalt. Doch Trump kaufte die Bilder nicht, woraufhin Warhol ihn ""billig"" nannte. Nun wird einer der Drucke versteigert.";"Z+ (abopflichtiger Inhalt);
        
    
Andy Warhol und Donald Trump";Kultur, Andy Warhol und Donald Trump, Kunst, Auktion, New York, Andy Warhol, Donald Trump;2024-11-18T18:08:53+01:00;2024-11-18T18:08:53+01:00;Tobias Timm;;false
4d0e9ae5c467434b18942dabb42bd2b6323419ded21e4393ac3bb57249f28efa;Eine Tote bei Frontalzusammenstoß in Köln;https://www.zeit.de/news/2024-11/18/eine-tote-bei-frontalzusammenstoss-in-koeln;Hier finden Sie Informationen zu dem Thema „Schwerer Verkehrsunfall“. Lesen Sie jetzt „Eine Tote bei Frontalzusammenstoß in Köln“.;"Z+ (abopflichtiger Inhalt);
        
    
Schwerer Verkehrsunfall";News, Schwerer Verkehrsunfall, Köln, Polizei, Feuerwehr, Frontalzusammenstoß, Verkehrsunfall, Kleinwagen, Auto;2024-11-18T18:07:25+01:00;2024-11-18T18:07:25+01:00;;dpa Nordrhein-Westfalen;false
87e76c7a1f943962bd3c91186dba2db3af56bd49079dcc6e040beac49d70ca67;Der Westen macht schon wieder den gleichen Fehler;https://www.zeit.de/politik/ausland/2024-11/us-raketen-freigabe-ukraine-russland-militaerhilfe;Die Erlaubnis, US-Raketen auf Ziele in Russland zu schießen, stärkt die Ukraine. Doch könnte die Freigabe zu spät kommen und ist zudem taktisch schlecht vorbereitet.;"Z+ (abopflichtiger Inhalt);
        
    
ATACMS-Freigabe";Politik, ATACMS-Freigabe, Russland, Krieg in der Ukraine, USA, Rakete, Waffenlieferung;2024-11-18T18:07:09+01:00;2024-11-18T18:07:09+01:00;Maxim KireevDr. Hauke Friederichs;;false
f463efc96d199ee074daeae16e5a91501283752d8df24e04f5cfa150a88b8158;Trotz VW-Krise - Finanztochter bleibt Filmfest-Sponsor;https://www.zeit.de/news/2024-11/18/trotz-vw-krise-finanztochter-bleibt-filmfest-sponsor;Hier finden Sie Informationen zu dem Thema „Filmfestival“. Lesen Sie jetzt „Trotz VW-Krise - Finanztochter bleibt Filmfest-Sponsor“.;"Z+ (abopflichtiger Inhalt);
        
    
Filmfestival";News, Filmfestival, Udo Kier, Braunschweig, Volkswagen Financial Services, Filmfestival, Besucherzuwachs, Krise, Kino;2024-11-18T18:06:21+01:00;2024-11-18T18:06:21+01:00;;dpa Niedersachsen;false
32e8c27958b07d9bfbdcf208616211d3bc2c75dcefb45de310d3f2b88895b7d5;Pkw und Straßenbahn stoßen zusammen - sechsstelliger Schaden;https://www.zeit.de/news/2024-11/18/pkw-und-strassenbahn-stossen-zusammen-sechsstelliger-schaden;Hier finden Sie Informationen zu dem Thema „Verkehrsunfall“. Lesen Sie jetzt „Pkw und Straßenbahn stoßen zusammen - sechsstelliger Schaden“.;"Z+ (abopflichtiger Inhalt);
        
    
Verkehrsunfall";News, Verkehrsunfall, Polizei, Straßenbahn, Verkehrsunfall, Auto;2024-11-18T18:03:58+01:00;2024-11-18T18:03:58+01:00;;dpa Baden-Württemberg;false
dedc068bffb38550376729b0d2f24cccd7d1f34e6ed8665cc4774ddf7c1d510f;Rettungswagen verliert zwei Räder – Mordkommission ermittelt;https://www.zeit.de/news/2024-11/18/rettungswagen-verliert-zwei-raeder-mordkommission-ermittelt;Hier finden Sie Informationen zu dem Thema „Kriminalität“. Lesen Sie jetzt „Rettungswagen verliert zwei Räder – Mordkommission ermittelt“.;"Z+ (abopflichtiger Inhalt);
        
    
Kriminalität";News, Kriminalität, Polizei, Rettungswagen, Mordkommission, Radbolzen, Kriminalität;2024-11-18T17:57:59+01:00;2024-11-18T17:57:59+01:00;;dpa Nordrhein-Westfalen;false
0ebe059b5bea9d22466a41a6a299d3c6d2ce2fd47482f5bbf2c765dce957db03;Bauern im Elsass demonstrieren - Verkehrseinschränkungen;https://www.zeit.de/news/2024-11/18/bauern-im-elsass-demonstrieren-verkehrsprobleme-erwartet;Hier finden Sie Informationen zu dem Thema „Landwirtschaft“. Lesen Sie jetzt „Bauern im Elsass demonstrieren - Verkehrseinschränkungen“.;"Z+ (abopflichtiger Inhalt);
        
    
Landwirtschaft";News, Landwirtschaft, Emmanuel Macron, Elsaß, Straßburg, Ba-Rhin, Bas-Rhin, Frankreich, EU, Mercosur, FDSEA, Verkehrsproblem;2024-11-18T17:57:54+01:00;2024-11-18T17:57:54+01:00;;dpa Baden-Württemberg;false
b471c7f748a0756509a55df85e740a81f4d8cf9ff21e7b6676307813f11b763c;Neues Erzbergwerk soll 2027 Produktion aufnehmen;https://www.zeit.de/news/2024-11/18/neues-erzbergwerk-soll-2027-produktion-aufnehmen;Hier finden Sie Informationen zu dem Thema „Rohstoffe“. Lesen Sie jetzt „Neues Erzbergwerk soll 2027 Produktion aufnehmen“.;"Z+ (abopflichtiger Inhalt);
        
    
Rohstoffe";News, Rohstoffe, Thomas Reissner, Klaus Grund, Bernhard Cramer, Erzgebirge, Pöhla, Geyer, Mittweida, Europa, China, Vietnam;2024-11-18T17:55:39+01:00;2024-11-18T17:55:39+01:00;;dpa Sachsen;false
b28a90188a4830462d28590215647080495cfcef89780deebefc8cb84edd4b85;SPD und BSW für weniger Bürokratie und mehr Digitalisierung;https://www.zeit.de/news/2024-11/18/spd-und-bsw-fuer-weniger-buerokratie-und-mehr-digitalisierung;Hier finden Sie Informationen zu dem Thema „Koalitionsgespräche“. Lesen Sie jetzt „SPD und BSW für weniger Bürokratie und mehr Digitalisierung“.;"Z+ (abopflichtiger Inhalt);
        
    
Koalitionsgespräche";News, Koalitionsgespräche, Brandenburg, SPD, Bürokratie, Koalitionsgespräch, Digitalisierung, Koalition;2024-11-18T17:54:50+01:00;2024-11-18T17:54:50+01:00;;dpa Berlin/Brandenburg;false
63a07c288686890755c4c3d761c79c66800ce67bfd080a0416c8346e47e89c50;Witwe von Ex-Daimler-Chef Helga Reuter tot;https://www.zeit.de/news/2024-11/18/witwe-von-ex-daimler-chef-helga-reuter-tot;Hier finden Sie Informationen zu dem Thema „Todesfälle“. Lesen Sie jetzt „Witwe von Ex-Daimler-Chef Helga Reuter tot“.;"Z+ (abopflichtiger Inhalt);
        
    
Todesfälle";News, Todesfälle, Helga Reuter, Stuttgart, Daimler, Todesfall;2024-11-18T17:53:55+01:00;2024-11-18T17:53:55+01:00;;dpa Baden-Württemberg;false
3fe8632d09208bc10c332f34d7fb6098d32dead2f0c400d1d8671c487b3065c4;Schockanruf: Seniorin um 30.000 Euro betrogen;https://www.zeit.de/news/2024-11/18/schockanruf-seniorin-um-30-000-euro-betrogen;Hier finden Sie Informationen zu dem Thema „Kriminalität“. Lesen Sie jetzt „Schockanruf: Seniorin um 30.000 Euro betrogen“.;"Z+ (abopflichtiger Inhalt);
        
    
Kriminalität";News, Kriminalität, Polizei, Schockanruf, Kriminalität;2024-11-18T17:47:56+01:00;2024-11-18T17:47:56+01:00;;dpa Thüringen;false
769e5c65edb651207fb8c1799b5f67d80ff453b8aed03dfaa1e35ac51d153276;Nationalspieler Pavlovic nach Operation bei Bayern zurück;https://www.zeit.de/news/2024-11/18/nationalspieler-pavlovic-nach-operation-bei-bayern-zurueck;Hier finden Sie Informationen zu dem Thema „Fußball-Bundesliga“. Lesen Sie jetzt „Nationalspieler Pavlovic nach Operation bei Bayern zurück“.;"Z+ (abopflichtiger Inhalt);
        
    
Fußball-Bundesliga";News, Fußball-Bundesliga, Aleksandar Pavlovic, Bayern, München, Fußball-Bundesliga, FC Bayern München, Schlüsselbeinbruch, Mannschaftstraining, Operation;2024-11-18T17:35:51+01:00;2024-11-18T17:35:51+01:00;;dpa Bayern;false
47c85609e55f6dca2dccfe158cb4ae5eb1926e7ea6a822a0c59e591263710a5c;Weltrekordjäger starten Rekordversuche in Hamburg;https://www.zeit.de/news/2024-11/18/weltrekordjaeger-starten-rekordversuche-in-hamburg;Hier finden Sie Informationen zu dem Thema „Guinness World Records Day“. Lesen Sie jetzt „Weltrekordjäger starten Rekordversuche in Hamburg“.;"Z+ (abopflichtiger Inhalt);
        
    
Guinness World Records Day";News, Guinness World Records Day, Joe Alexander, Muhamed Kahrimanovic, Palina Glebova, Hamburg, Rekordversuch;2024-11-18T17:30:44+01:00;2024-11-18T17:30:44+01:00;;dpa Hamburg/Schleswig-Holstein;false
424b7ccc3c09bc749461f9b2706db8b9b46e5f79bbe4a7581efecdb1e24dd3d5;Genehmigung für Wolfsabschuss im Kreis Leer gestoppt;https://www.zeit.de/news/2024-11/18/genehmigung-fuer-wolfsabschuss-im-kreis-leer-vorerst-gestoppt;Hier finden Sie Informationen zu dem Thema „Nutztiere gerissen“. Lesen Sie jetzt „Genehmigung für Wolfsabschuss im Kreis Leer gestoppt“.;"Z+ (abopflichtiger Inhalt);
        
    
Nutztiere gerissen";News, Nutztiere gerissen, Oldenburg, Leer, Verwaltungsgericht, Wolfsabschuss, Nutztier, Genehmigung, Abschussgenehmigung, Landkreis;2024-11-18T17:25:24+01:00;2024-11-18T17:25:24+01:00;;dpa Niedersachsen;false
10cb6db40aec5586db6101f34c230a537fb2760300eb6ddfe848044dcd3f041e;Trump bestätigt Pläne für Militäreinsatz bei Abschiebungen;https://www.zeit.de/news/2024-11/18/trump-bestaetigt-plaene-fuer-militaereinsatz-bei-abschiebungen;Hier finden Sie Informationen zu dem Thema „Machtwechsel in den USA“. Lesen Sie jetzt „Trump bestätigt Pläne für Militäreinsatz bei Abschiebungen“.;"Z+ (abopflichtiger Inhalt);
        
    
Machtwechsel in den USA";News, Machtwechsel in den USA, Donald Trump, USA, Republikaner (USA), Abschiebung, Machtwechsel, Massenabschiebung, Militäreinsatz, Militär;2024-11-18T17:25:00+01:00;2024-11-18T17:25:00+01:00;;dpa;false
fe4e13d7f549e8036aad5dabdd5611d1b79b6a126e8d50d9fe3df17d6157c958;Mehr Freiheit für Lebensmittelläden ohne Personal;https://www.zeit.de/news/2024-11/18/mehr-freiheit-fuer-lebensmittellaeden-ohne-personal;Hier finden Sie Informationen zu dem Thema „Einkauf auf dem Land“. Lesen Sie jetzt „Mehr Freiheit für Lebensmittelläden ohne Personal“.;"Z+ (abopflichtiger Inhalt);
        
    
Einkauf auf dem Land";News, Einkauf auf dem Land, Sachsen-Anhalt, Lebensmittelladen, Lebensmittelgeschäft, Freiheit;2024-11-18T17:22:19+01:00;2024-11-18T17:22:19+01:00;;dpa Sachsen;false
1031e425afd2fc669b7248b63310cd13b6d3e37baa6393283e1a834430047804;Zentrum für Quantencomputer in Hamburg eröffnet;https://www.zeit.de/news/2024-11/18/zentrum-fuer-quantencomputer-in-hamburg-eroeffnet;Hier finden Sie Informationen zu dem Thema „Forschung“. Lesen Sie jetzt „Zentrum für Quantencomputer in Hamburg eröffnet“.;"Z+ (abopflichtiger Inhalt);
        
    
Forschung";News, Forschung, Hamburg, Deutsches Zentrum für Luft- und Raumfahrt, DLR, Quantencomputer;2024-11-18T17:10:26+01:00;2024-11-18T17:10:26+01:00;;dpa Hamburg/Schleswig-Holstein;false
02199bac0f489c5826c16701d063fce10128634232ed058e0ebff38584fca2c3;Deutschland geht von Drohnenhilfe Chinas für Russland aus;https://www.zeit.de/news/2024-11/18/deutschland-geht-von-drohnenhilfe-chinas-fuer-russland-aus;Hier finden Sie Informationen zu dem Thema „Krieg in der Ukraine“. Lesen Sie jetzt „Deutschland geht von Drohnenhilfe Chinas für Russland aus“.;"Z+ (abopflichtiger Inhalt);
        
    
Krieg in der Ukraine";News, Krieg in der Ukraine, China, Russland, Krieg in der Ukraine;2024-11-18T17:08:08+01:00;2024-11-18T17:08:08+01:00;;dpa;false
4e5b8e19e750a05c538cc8f574aaab40a2c71cc8bf3c0f614cc76498cf991b28;Missbrauchsopfer legen Null-Toleranz-Regelung für die Kirche vor;https://www.zeit.de/gesellschaft/2024-11/kirche-missbrauch-geistliche-strafen;Betroffene von Missbrauch durch Geistliche fordern vom Vatikan weltweit einheitliche Strafen für Täter. Bei bewiesener Schuld sollen sie dauerhaft Ämterverbot erhalten.;"Z+ (abopflichtiger Inhalt);
        
    
Ending Clergy Abuse";Gesellschaft, Ending Clergy Abuse, Katholische Kirche, Rom, Sexueller Missbrauch, Missbrauch, Strafe;2024-11-18T17:06:52+01:00;2024-11-18T17:06:52+01:00;ale;ZEIT ONLINE,        KNA,        							ale;false
0522d944ef265bb2035c3125199e36b24c00c3f4b5690c363b65d307285db695;Die Sirene Gottes;https://www.zeit.de/2024/48/archaeologie-signalhorn-karl-der-grosse-rolandslied;Der Held Roland soll mit seinem Horn das Abendland gerettet haben. Tausend Jahre später taucht eine Scherbe auf – erklärt sie, wie sich die Menschen damals warnten?;"Z+ (abopflichtiger Inhalt);
        
    
Archäologie";Wissen, Archäologie, Archäologie, Ausgrabung, Mittelalter, Karl der Große, Geschichte;2024-11-18T17:02:25+01:00;2024-11-18T17:02:25+01:00;Wolfgang Bauer;Aus der        ZEIT Nr. 48/2024;false
0da3aa4673c52bf3b4f5580bb698a408e2b933845e53c59936510c246f016c4b;BGH zu Facebook-Fall: 100 Euro Schadenersatz nach Datenleck?;https://www.zeit.de/news/2024-11/18/nutzerfreundliches-bgh-urteil-nach-datenraub-bei-facebook;Hier finden Sie Informationen zu dem Thema „Urteil zu Massenverfahren“. Lesen Sie jetzt „BGH zu Facebook-Fall: 100 Euro Schadenersatz nach Datenleck?“.;"Z+ (abopflichtiger Inhalt);
        
    
Urteil zu Massenverfahren";News, Urteil zu Massenverfahren, Karlsruhe, Bundesgerichtshof, Facebook, Meta, Datenraub, Massenverfahren, Datenschutzvorfall, DSGVO;2024-11-18T17:01:06+01:00;2024-11-18T17:01:06+01:00;;dpa;false
e2758d2fe2ef7dade143d0d959b9d1f15e00922267a0b2686aea77a56b98e251;"""Schwertschwanz aus Bayern"" - Flugsaurier-Fund in Solnhofen";https://www.zeit.de/news/2024-11/18/schwertschwanz-aus-bayern-flugsaurier-fund-in-solnhofen;"Hier finden Sie Informationen zu dem Thema „Evolution“. Lesen Sie jetzt „""Schwertschwanz aus Bayern"" - Flugsaurier-Fund in Solnhofen“.";"Z+ (abopflichtiger Inhalt);
        
    
Evolution";News, Evolution, David Hone, Queen, Bayern, Solnhofen, Großer Kopf, Mary University, Schwertschwanz, Flugsaurierart, Flugsaurier, Fachnamen;2024-11-18T17:00:35+01:00;2024-11-18T17:00:35+01:00;;dpa;false
c0926a3a411631817c2278044f46751aa519d7f01bee3052562352ad06c0aa76;Das unheimliche Gedächtnis der Fettzellen;https://www.zeit.de/gesundheit/2024-11/gewicht-abnehmen-jojo-effekt-genetik-uebergewicht;Eine Studie zeigt, dass sich Körperzellen merken, ob wir einmal übergewichtig waren. Erklärt das den Jo-Jo-Effekt? ;"Z+ (abopflichtiger Inhalt);
        
    
Abnehmen";Gesundheit, Abnehmen, Übergewicht, Gedächtnis, Genetik, Fitness, Ernährung;2024-11-18T17:00:12+01:00;2024-11-18T17:00:12+01:00;Sina Metz;;false
44dfcd491550e8f5067571a92d1e623ec9f8440764eccd586e73db38b09289f4;Polizei-Einsatz im Tesla-Protestcamp geht am Dienstag weiter;https://www.zeit.de/news/2024-11/18/polizei-einsatz-im-tesla-protestcamp-geht-am-dienstag-weiter;Hier finden Sie Informationen zu dem Thema „Kampfmittel-Erkundung“. Lesen Sie jetzt „Polizei-Einsatz im Tesla-Protestcamp geht am Dienstag weiter“.;"Z+ (abopflichtiger Inhalt);
        
    
Kampfmittel-Erkundung";News, Kampfmittel-Erkundung, Grünheide, Berlin, Polizei, Baumhaus;2024-11-18T16:59:47+01:00;2024-11-18T16:59:47+01:00;;dpa Berlin/Brandenburg;false
fd5b1c0180cbe290497533a968cbd839ba8b54bf3be8629ec91dc941e132fee7;Neue Sicherungsmaßnahmen an zwei Dresdner Brücken notwendig;https://www.zeit.de/news/2024-11/18/neue-sicherungsmassnahmen-an-zwei-dresdner-bruecken-notwendig;Hier finden Sie Informationen zu dem Thema „Nach Einsturz der Carolabrücke“. Lesen Sie jetzt „Neue Sicherungsmaßnahmen an zwei Dresdner Brücken notwendig“.;"Z+ (abopflichtiger Inhalt);
        
    
Nach Einsturz der Carolabrücke";News, Nach Einsturz der Carolabrücke, Dresden, Nossener Brücke, Budapester Straße, Sicherungsmaßnahme, Einsturz, Teileinsturz, Sonderprüfung;2024-11-18T16:58:38+01:00;2024-11-18T16:58:38+01:00;;dpa Sachsen;false
4eeeba79f4f4a5905188934d2a1aed7c1809f88ec86ed032a3354bf70d151eed;61 Menschen bei Reizstoff-Attacke in Berufsschule verletzt;https://www.zeit.de/news/2024-11/18/61-menschen-bei-reizstoff-attacke-in-berufsschule-verletzt;Hier finden Sie Informationen zu dem Thema „Großeinsatz“. Lesen Sie jetzt „61 Menschen bei Reizstoff-Attacke in Berufsschule verletzt“.;"Z+ (abopflichtiger Inhalt);
        
    
Großeinsatz";News, Großeinsatz, Polizei, Berufsschule, Reizstoff, Großeinsatz;2024-11-18T16:57:44+01:00;2024-11-18T16:57:44+01:00;;dpa Niedersachsen;false
e3a2f60c67d4a81582e0cfd94c10af61db80842774db07aa1861115009b7e9bc;Winter auf Stippvisite - Schnee im Sauerland;https://www.zeit.de/news/2024-11/18/winter-auf-stippvisite-schnee-im-sauerland;Hier finden Sie Informationen zu dem Thema „Glättegefahr“. Lesen Sie jetzt „Winter auf Stippvisite - Schnee im Sauerland“.;"Z+ (abopflichtiger Inhalt);
        
    
Glättegefahr";News, Glättegefahr, Sauerland, Nordrhein-Westfalen, Glättegefahr, Stippvisite, Winter, Wetter;2024-11-18T16:56:48+01:00;2024-11-18T16:56:48+01:00;;dpa Nordrhein-Westfalen;false
659734b1a757c45777e4c67842955bd2a3b581f8b8f4b070b9fb44c6a7587e36;Ein bisschen Gras im Glas;https://www.zeit.de/wirtschaft/2024-11/cannabis-getraenke-thc-cbd-hanf-minnesota-usa;Im US-Bundesstaat Minnesota boomen Getränke, die statt Alkohol den Cannabiswirkstoff THC enthalten. Das Erfolgsrezept? Ein milder Rausch, aber ohne Kater am Morgen.;"Z+ (abopflichtiger Inhalt);
        
    
Cannabisgetränke";Wirtschaft, Cannabisgetränke, Minnesota, USA, Cannabis, Alkohol, Getränk, Brauerei;2024-11-18T16:55:23+01:00;2024-11-18T16:55:23+01:00;Caspar von Au;;false
cdb39e2bce50f9b422e2a6ce16e77219a2b387a51d16577863b7eca4c3a63374;Junge Männer stürzen bei Flucht vor Polizei in Schacht;https://www.zeit.de/news/2024-11/18/jugendliche-stuerzen-in-schacht-schwer-verletzt;Hier finden Sie Informationen zu dem Thema „Notfälle“. Lesen Sie jetzt „Junge Männer stürzen bei Flucht vor Polizei in Schacht“.;"Z+ (abopflichtiger Inhalt);
        
    
Notfälle";News, Notfälle, Polizei, Notfall;2024-11-18T16:50:27+01:00;2024-11-18T16:50:27+01:00;;dpa Rheinland-Pfalz/Saarland;false
5d340a08075aa60e2f7b2df02ce30e2ca80f4666eb2692c72ae8ff72aec4b94a;"""Viele Wechsel"": Nagelsmann wird gegen Ungarn viel rotieren";https://www.zeit.de/news/2024-11/18/viele-wechsel-nagelsmann-wird-gegen-ungarn-viel-rotieren;"Hier finden Sie Informationen zu dem Thema „Fußball-Nationalmannschaft“. Lesen Sie jetzt „""Viele Wechsel"": Nagelsmann wird gegen Ungarn viel rotieren“.";"Z+ (abopflichtiger Inhalt);
        
    
Fußball-Nationalmannschaft";News, Fußball-Nationalmannschaft, Alexander Nübel, Joshua Kimmich, Julian Nagelsmann, Nico Schlotterbeck, Ungarn, Budapest, ZDF, Nations League, Bundestrainer, Fußballnationalmannschaft;2024-11-18T16:49:54+01:00;2024-11-18T16:49:54+01:00;;dpa Sport;false
cbe7273822d025427f97a676b7bad93aa285db9236d140fb866ffdcab15b0e8d;Odenwaldschule: Mahnmal für Opfer vorgestellt;https://www.zeit.de/news/2024-11/18/mahnmal-fuer-opfer-sexueller-gewalt-an-der-odenwaldschule;Hier finden Sie Informationen zu dem Thema „Missbrauch“. Lesen Sie jetzt „Odenwaldschule: Mahnmal für Opfer vorgestellt“.;"Z+ (abopflichtiger Inhalt);
        
    
Missbrauch";News, Missbrauch, Ulrich Kühnhold, Heppenheim, Odenwaldschule, Mahnmal, Missbrauch;2024-11-18T16:49:09+01:00;2024-11-18T16:49:09+01:00;;dpa Hessen;false
30553edf85c4d44d329ee575ff6cbb2981441d76a236e773ac81249f1d56ca96;48.000 Unterschriften gegen Abschiebung von Pflegern;https://www.zeit.de/news/2024-11/18/48-000-unterschriften-gegen-abschiebung-von-pflegern;Hier finden Sie Informationen zu dem Thema „Online-Petition“. Lesen Sie jetzt „48.000 Unterschriften gegen Abschiebung von Pflegern“.;"Z+ (abopflichtiger Inhalt);
        
    
Online-Petition";News, Online-Petition, Wilstedt, Rotenburg, Abschiebung;2024-11-18T16:49:03+01:00;2024-11-18T16:49:03+01:00;;dpa Niedersachsen;false
75ae87d6e1c0e6b3ec5e7e396c01e879bd85b4212dab19ac25d8b7edfff209df;Schweitzer für schnelles Ende der Debatte um Kandidatur;https://www.zeit.de/news/2024-11/18/schweitzer-fuer-schnelles-ende-der-debatte-um-kandidatur;Hier finden Sie Informationen zu dem Thema „SPD“. Lesen Sie jetzt „Schweitzer für schnelles Ende der Debatte um Kandidatur“.;"Z+ (abopflichtiger Inhalt);
        
    
SPD";News, SPD, Alexander Schweitzer, Olaf Scholz, Boris Pistorius, SWR, SPD, Kandidatur;2024-11-18T16:47:22+01:00;2024-11-18T16:47:22+01:00;;dpa Rheinland-Pfalz/Saarland;false
dc876317dc4f9a5009a825de3f5e4706f12d7e530eb095fcc1e0b460ddff535d;CSU nennt bereits erste Namen für Kabinettsposten;https://www.zeit.de/politik/deutschland/2024-11/csu-landwirtschaftsministerium-bundestagswahl-guenther-felssner;Landesbauernpräsident Felßner als Agrarminister: Die CSU reklamiert Posten in einer künftigen Regierung für sich. Auch für Landesgruppenchef Dobrindt gibt es Pläne.;"Z+ (abopflichtiger Inhalt);
        
    
Bundestagswahl";Politik, Bundestagswahl, Unionsfraktion, Markus Söder, Alexander Dobrindt, CSU, Bundestagswahl, Neuwahl;2024-11-18T16:46:47+01:00;2024-11-18T16:46:47+01:00;dar;ZEIT ONLINE,        AFP,        Reuters,        							dar;false
ac824e50521a9dc73af2908745018747fd1bfff4c499676c54670c03f543dbf3;Frau tot im Bett - Haftbefehl gegen Partner;https://www.zeit.de/news/2024-11/18/frau-tot-im-bett-haftbefehl-gegen-partner;Hier finden Sie Informationen zu dem Thema „Kriminalität“. Lesen Sie jetzt „Frau tot im Bett - Haftbefehl gegen Partner“.;"Z+ (abopflichtiger Inhalt);
        
    
Kriminalität";News, Kriminalität, Hammelburg, Polizei, Haftbefehl, Kriminalität;2024-11-18T16:44:48+01:00;2024-11-18T16:44:48+01:00;;dpa Bayern;false
4c1a04b2dc824df097b9a36b7017f35285ab84b2bb8fd684726722996824862f;"Nagelsmann erwägt Radikal-Rotation: Keine ""Zeittoleranz""";https://www.zeit.de/news/2024-11/18/nagelsmann-keine-leistungsdelle-durch-rotation-in-ungarn;"Hier finden Sie Informationen zu dem Thema „Fußball-Nationalmannschaft“. Lesen Sie jetzt „Nagelsmann erwägt Radikal-Rotation: Keine ""Zeittoleranz""“.";"Z+ (abopflichtiger Inhalt);
        
    
Fußball-Nationalmannschaft";News, Fußball-Nationalmannschaft, Julian Nagelsmann, Oliver Baumann, Jonathan Tah, Ungarn, Budapest, Bosnien-Herzegowina, ZDF, Deutscher Fußball-Bund, Länderspiel, Nations League;2024-11-18T16:43:51+01:00;2024-11-18T16:43:51+01:00;;dpa Sport;false
601c727308d859d5966f047f68e45b1db1de425d3aef46144edb531a49c8b5de;Prozess um gefälschte Abnehmspritzen wird verlängert;https://www.zeit.de/news/2024-11/18/prozess-um-gefaelschte-abnehmspritzen-in-oesterreich;Hier finden Sie Informationen zu dem Thema „Selbstinjektionen“. Lesen Sie jetzt „Prozess um gefälschte Abnehmspritzen wird verlängert“.;"Z+ (abopflichtiger Inhalt);
        
    
Selbstinjektionen";News, Selbstinjektionen, Mann, Österreich, Salzburg, Steyr, Linz, Staatsanwaltschaft, Abnehmspritze, Selbstinjektion, Ozempic;2024-11-18T16:42:20+01:00;2024-11-18T16:42:20+01:00;;dpa Bayern;false
2ff5a32592c92faa887c0a5379e08d5fb3f32a7bea8a98ba193febd5be989e0e;Landesregierung geht wegen Haushaltslöchern in Klausur;https://www.zeit.de/news/2024-11/18/landesregierung-geht-wegen-haushaltsloechern-in-klausur;Hier finden Sie Informationen zu dem Thema „Haushaltslöcher“. Lesen Sie jetzt „Landesregierung geht wegen Haushaltslöchern in Klausur“.;"Z+ (abopflichtiger Inhalt);
        
    
Haushaltslöcher";News, Haushaltslöcher, Reinhard Meyer, SPD, Haushaltsloch, Landesregierung, Klausur, Zensus, Herbststeuerschätzung, Schulden;2024-11-18T16:42:16+01:00;2024-11-18T16:42:16+01:00;;dpa Mecklenburg-Vorpommern;false
f41fe9db80b2165367555a949b199a4c7f0bcb440673b7293ec0a736af272462;Mann bei Streit mit Messer verletzt - 25-Jähriger in U-Haft;https://www.zeit.de/news/2024-11/18/mann-bei-streit-mit-messer-verletzt-25-jaehriger-in-u-haft;Hier finden Sie Informationen zu dem Thema „Kriminalität“. Lesen Sie jetzt „Mann bei Streit mit Messer verletzt - 25-Jähriger in U-Haft“.;"Z+ (abopflichtiger Inhalt);
        
    
Kriminalität";News, Kriminalität, Nehren, Landkreis Tübingen, Polizei;2024-11-18T16:41:44+01:00;2024-11-18T16:41:44+01:00;;dpa Baden-Württemberg;false
2d3485b2d4adcfaf7affb6dd4eb25e7432118389245c7b4ed3c01613ae133fe8;Gefährliche Partnerschaft;https://www.zeit.de/2024/48/sanktionen-gegen-russland-suedkorea-batteriefabrik;Südkorea hat die Ausfuhr von Batterien nach Russland verboten. Doch Unternehmen aus dem Land helfen in Kaliningrad, sie selbst zu produzieren und aufzurüsten.;"Z+ (abopflichtiger Inhalt);
        
    
Staatskonzern Rosatom";Wirtschaft, Staatskonzern Rosatom, Russland, Südkorea, Lithium-Ionen-Akku, Technologie, Sanktion, Nordkorea;2024-11-18T16:41:01+01:00;2024-11-18T16:41:01+01:00;Ingo Malcher;Aus der        ZEIT Nr. 48/2024;false
f30d17951dd3df5d0071ada0ba5ac1fca2873a8bd478e8223397f537466276b9;Bayerische Wirtschaft fordert Fahrplan für CO2-Speicher;https://www.zeit.de/news/2024-11/18/bayerische-wirtschaft-fordert-fahrplan-fuer-co2-speicher;Hier finden Sie Informationen zu dem Thema „Klimaschutz in der Industrie“. Lesen Sie jetzt „Bayerische Wirtschaft fordert Fahrplan für CO2-Speicher“.;"Z+ (abopflichtiger Inhalt);
        
    
Klimaschutz in der Industrie";News, Klimaschutz in der Industrie, Bertram Brossardt, Fahrplan, Klimaschutz, Speicherung, Kohlenstoff, CO2 - Speicher;2024-11-18T16:40:53+01:00;2024-11-18T16:40:53+01:00;;dpa Bayern;false
