Hash;Title;Link;Description;Category;KeyWords;Published;LastUpdated;Author;Source;Paywall
c73a4de70854e82693166c18695c8652f103b20bb4169377cc808773f48517c4;Streit um Kita-Finanzierung vor Landesverfassungsgericht;https://www.zeit.de/news/2025-10/30/streit-um-kita-finanzierung-vor-landesverfassungsgericht;Hier finden Sie Informationen zu dem Thema „Verfassungsklage“. Lesen Sie jetzt „Streit um Kita-Finanzierung vor Landesverfassungsgericht“.;Verfassungsklage;News, Verfassungsklage, Greifswald, Landkreis Vorpommern-Greifswald, Landesverfassungsgericht, Verfassungsklage;2025-10-30T16:01:30+01:00;2025-10-30T16:01:30+01:00;;dpa Mecklenburg-Vorpommern;false
ea9671aed548c9e9b61e037859df804b1d2f93d30619ee1d55820d2a969a46c7;Missbrauch: Strengere Regeln und Bitte um Verzeihung;https://www.zeit.de/news/2025-10/30/kommission-sieht-fehlverhalten-bei-frueheren-bischoefen;Hier finden Sie Informationen zu dem Thema „Aufarbeitung in der Kirche“. Lesen Sie jetzt „Missbrauch: Strengere Regeln und Bitte um Verzeihung“.;Aufarbeitung in der Kirche;News, Aufarbeitung in der Kirche, Hubert Paul, Bertram Meier, Augsburg, Missbrauch, Bistum, Missbrauchsfall, Aufarbeitungskommission;2025-10-30T16:01:07+01:00;2025-10-30T16:01:07+01:00;;dpa Bayern;false
dbebd3955d2261fdb8a9b7d989e0779125a29a1bf389a06a70840554be305e3b;Heizung läuft nicht - Wohnkomplex in Göttingen unbewohnbar?;https://www.zeit.de/news/2025-10/30/heizung-laeuft-nicht-wohnkomplex-in-goettingen-unbewohnbar;Hier finden Sie Informationen zu dem Thema „Verwahrlostes Gebäude“. Lesen Sie jetzt „Heizung läuft nicht - Wohnkomplex in Göttingen unbewohnbar?“.;Verwahrlostes Gebäude;News, Verwahrlostes Gebäude, Sven Adam, Göttingen, Verwaltungsgericht, Amtsgericht, Wohnkomplex, Heizung, Hochhauskomplex;2025-10-30T16:00:23+01:00;2025-10-30T16:00:23+01:00;;dpa Niedersachsen;false
35898773080cb1d10fa8065df7030b00e62584b2cf8d1b2d05651105c6957817;Stallpflicht wegen Vogelgrippe in vielen Kreisen;https://www.zeit.de/news/2025-10/30/stallpflicht-wegen-vogelgrippe-in-vielen-kreisen;Hier finden Sie Informationen zu dem Thema „Tierseuche“. Lesen Sie jetzt „Stallpflicht wegen Vogelgrippe in vielen Kreisen“.;Tierseuche;News, Tierseuche, Saarland, Hessen, Stallpflicht, Vogelgrippe, Tierseuche, Landkreis;2025-10-30T15:58:36+01:00;2025-10-30T15:58:36+01:00;;dpa Hessen;false
9be1329014954e0a31ea735c89997f43f2acf9157ea8179c39a0386239b6f5d2;Finanzminister: Kosten für Luftverkehr müssen sinken;https://www.zeit.de/news/2025-10/30/finanzminister-kosten-fuer-luftverkehr-muessen-sinken;Hier finden Sie Informationen zu dem Thema „Luftverkehr“. Lesen Sie jetzt „Finanzminister: Kosten für Luftverkehr müssen sinken“.;Luftverkehr;News, Luftverkehr, Christian Piwarz, Deutsche Lufthansa, CDU, Luftverkehr;2025-10-30T15:57:15+01:00;2025-10-30T15:57:15+01:00;;dpa Sachsen;false
8eaf7faf71075c6b5350ff58e402bac0eed979d48fa7ffc0279e35796203f908;Rettende Infusion? Neuer Rekord für Bayerns Finanzausgleich;https://www.zeit.de/news/2025-10/30/bayerns-finanzausgleich-klettert-auf-fast-13-milliarden-euro;Hier finden Sie Informationen zu dem Thema „Kommunale Finanzen“. Lesen Sie jetzt „Rettende Infusion? Neuer Rekord für Bayerns Finanzausgleich“.;Kommunale Finanzen;News, Kommunale Finanzen, Albert Füracker, Bayern, CSU, Finanzausgleich, Finanzen;2025-10-30T15:55:55+01:00;2025-10-30T15:55:55+01:00;;dpa Bayern;false
81c233a1ded126f13b2e0ccc57060eadc5a0969e41a70aa8da3c19322e60b095;EZB in Lauerstellung: Keine weitere Zinssenkung in Sicht;https://www.zeit.de/news/2025-10/30/ezb-bleibt-in-lauerstellung-leitzinsen-unveraendert;Hier finden Sie Informationen zu dem Thema „Geldpolitik in Krisenzeiten“. Lesen Sie jetzt „EZB in Lauerstellung: Keine weitere Zinssenkung in Sicht“.;Geldpolitik in Krisenzeiten;News, Geldpolitik in Krisenzeiten, Florenz, Frankfurt, Frankreich, EZB, Fed, Lauerstellung, Krisenzeit, Leitzins, Geldpolitik, Einlagenzins;2025-10-30T15:55:39+01:00;2025-10-30T15:55:39+01:00;;dpa;false
177039f59aa49e80e1ce36ad8a36d8925258404435dada040181c2deb5980316;23-Jähriger mit gefälschten Diplomatenkennzeichen erwischt;https://www.zeit.de/news/2025-10/30/23-jaehriger-mit-gefaelschten-diplomatenkennzeichen-erwischt;Hier finden Sie Informationen zu dem Thema „Weingarten“. Lesen Sie jetzt „23-Jähriger mit gefälschten Diplomatenkennzeichen erwischt“.;Weingarten;News, Weingarten, Weingarten, Diplomatenkennzeichen;2025-10-30T15:53:29+01:00;2025-10-30T15:53:29+01:00;;dpa Baden-Württemberg;false
0c234fda0f599a1a2ef4eaa9f89e68e9d35ff28b5d357da61e6aa12d0e49fdba;Freihafenelbbrücke nach Schiffsunfall weiter gesperrt;https://www.zeit.de/news/2025-10/30/freihafenelbbruecke-nach-schiffsunfall-weiter-gesperrt;Hier finden Sie Informationen zu dem Thema „Elbquerung“. Lesen Sie jetzt „Freihafenelbbrücke nach Schiffsunfall weiter gesperrt“.;Elbquerung;News, Elbquerung, Hamburg, Freihafenelbbrücke, Schiffsunfall, Elbquerung, Containerschiff, Kollision, Fahrzeug, Schiff;2025-10-30T15:50:46+01:00;2025-10-30T15:50:46+01:00;;dpa Hamburg/Schleswig-Holstein;false
43706c60f9658c6668b1fc5736ffc38ccda9dc62e2ea8a670d0a5c43b3c62dad;Bauarbeiten: Nicht alle Züge des RE98 fahren;https://www.zeit.de/news/2025-10/30/bauarbeiten-nicht-alle-zuege-des-re98-fahren;Hier finden Sie Informationen zu dem Thema „Bahn“. Lesen Sie jetzt „Bauarbeiten: Nicht alle Züge des RE98 fahren“.;Bahn;News, Bahn, Frankfurt;2025-10-30T15:48:35+01:00;2025-10-30T15:48:35+01:00;;dpa Hessen;false
9e513f5befc7c8ee54bdd8349ab147aeaec5ee80db91eb426b2b73a5a6348e62;Entwicklungsministerin wirbt um Investitionen in die Ukraine;https://www.zeit.de/news/2025-10/30/deutsche-ukraine-hilfe-entwicklungsministerin-in-kiew;Hier finden Sie Informationen zu dem Thema „Hilfe für Wiederaufbau“. Lesen Sie jetzt „Entwicklungsministerin wirbt um Investitionen in die Ukraine“.;Hilfe für Wiederaufbau;News, Hilfe für Wiederaufbau, Reem Alabali Radovan, Alabali Radovan, Kyjiw, Krieg in der Ukraine;2025-10-30T15:47:08+01:00;2025-10-30T15:47:08+01:00;;dpa;false
e6621976b0f7c368998b0403aadf377211ebe74b065c166ed46717a57d236f85;Nach Feuer in Stuttgart: Bewohner festgenommen;https://www.zeit.de/news/2025-10/30/nach-feuer-in-stuttgart-bewohner-festgenommen;Hier finden Sie Informationen zu dem Thema „Brandstiftung“. Lesen Sie jetzt „Nach Feuer in Stuttgart: Bewohner festgenommen“.;Brandstiftung;News, Brandstiftung, Stuttgart, Polizei, Brandstiftung, Einsatzkraft;2025-10-30T15:46:34+01:00;2025-10-30T15:46:34+01:00;;dpa Baden-Württemberg;false
ec931772216a4fd54bd7937ccf8d7e4a8d4e7d11858e0fa035d9cfb63069cb16;Polizei hebt Cannabis-Bande in Niedersachsen und NRW aus;https://www.zeit.de/news/2025-10/30/durchsuchungen-wegen-cannabis-kriminalitaet;Hier finden Sie Informationen zu dem Thema „In Niedersachsen und NRW“. Lesen Sie jetzt „Polizei hebt Cannabis-Bande in Niedersachsen und NRW aus“.;In Niedersachsen und NRW;News, In Niedersachsen und NRW, NRW, Niedersachsen, Cannabis, Durchsuchung, Cannabisplantage;2025-10-30T15:45:33+01:00;2025-10-30T15:45:33+01:00;;dpa Niedersachsen;false
f8db39a170897f4c7339232818df97fe6f4d17f4fd944e4e21ebcaa499b01d9c;Auto kracht in Ausstellungswagen – 100.000 Euro Schaden;https://www.zeit.de/news/2025-10/30/auto-kracht-in-ausstellungswagen-100-000-euro-schaden;Hier finden Sie Informationen zu dem Thema „Unfall“. Lesen Sie jetzt „Auto kracht in Ausstellungswagen – 100.000 Euro Schaden“.;Unfall;News, Unfall, Polizei, Ausstellungswagen, Unfall, Auto;2025-10-30T15:45:08+01:00;2025-10-30T15:45:08+01:00;;dpa Mecklenburg-Vorpommern;false
0f842b873f31a7330d230dab295ba166561d5291b7de3be2e84994404a66851d;Chemikalien und Müll: Aufräumarbeiten im Drogenlabor dauern;https://www.zeit.de/news/2025-10/30/drogenlabor-entdeckt-habe-so-etwas-noch-nie-gesehen;Hier finden Sie Informationen zu dem Thema „Lagerhalle in Nauen“. Lesen Sie jetzt „Chemikalien und Müll: Aufräumarbeiten im Drogenlabor dauern“.;Lagerhalle in Nauen;News, Lagerhalle in Nauen, Henner Grote, Mann, Berlin-Brandenburg, Berlin, Brandenburg, Landkreis Havelland, Polizei, Staatsanwaltschaft, Drogenlabor, Chemikalie;2025-10-30T15:44:42+01:00;2025-10-30T15:44:42+01:00;;dpa Berlin/Brandenburg;false
2feb410cb5b43104c69d128f298363ca9958c440b5b4ec1006a258f566cac91f;Umbau zum Gesundheitszentrum: Müller lobt Projekt in Seelow;https://www.zeit.de/news/2025-10/30/umbau-zum-gesundheitszentrum-mueller-lobt-projekt-in-seelow;Hier finden Sie Informationen zu dem Thema „Klinik-Landschaft ändert sich“. Lesen Sie jetzt „Umbau zum Gesundheitszentrum: Müller lobt Projekt in Seelow“.;Klinik-Landschaft ändert sich;News, Klinik-Landschaft ändert sich, Britta Müller, Seelow, Brandenburg, Krankenhaus Seelow, Bündnis Sahra Wagenknecht, Gesundheitszentrum, Umbau, Gesundheitscampus;2025-10-30T15:42:11+01:00;2025-10-30T15:42:11+01:00;;dpa Berlin/Brandenburg;false
da895e401dd7cba68a003ba9f46439ccf0c9fb83d92f89d0b76d15369843c7ff;"FCA-Coach Wagner sieht ""rauen Wind"" als Chance zum Reifen";https://www.zeit.de/news/2025-10/30/fca-coach-wagner-sieht-rauen-wind-als-chance-zum-reifen;"Hier finden Sie Informationen zu dem Thema „Fußball-Bundesliga“. Lesen Sie jetzt „FCA-Coach Wagner sieht ""rauen Wind"" als Chance zum Reifen“.";Fußball-Bundesliga;News, Fußball-Bundesliga, Sandro Wagner, Borussia Dortmund, FC Augsburg, Fußball-Bundesliga, Bundesliga, Reifen;2025-10-30T15:37:05+01:00;2025-10-30T15:37:05+01:00;;dpa Bayern;false
c839c551b8f4503c332eb7e1f0a83b0989092bd6fe5503c9bc4dcbb38d860483;Mehr Geld für Kultur in NRW;https://www.zeit.de/news/2025-10/30/mehr-geld-fuer-kultur-in-nrw;Hier finden Sie Informationen zu dem Thema „Haushalt“. Lesen Sie jetzt „Mehr Geld für Kultur in NRW“.;Haushalt;News, Haushalt, Ina Brandes, NRW, Kulturrat NRW, Haushalt, Kulturhaushalt, Geld;2025-10-30T15:37:01+01:00;2025-10-30T15:37:01+01:00;;dpa Nordrhein-Westfalen;false
2cb434126bc7cd94c90844260bfc70606c0210dfe4d1d7e6c4c8d78fdee08640;Warmer Oktober in Sachsen-Anhalt;https://www.zeit.de/news/2025-10/30/warmer-oktober-in-sachsen-anhalt;Hier finden Sie Informationen zu dem Thema „Bilanz des DWD“. Lesen Sie jetzt „Warmer Oktober in Sachsen-Anhalt“.;Bilanz des DWD;News, Bilanz des DWD, Sachsen-Anhalt, DWD;2025-10-30T15:35:18+01:00;2025-10-30T15:35:18+01:00;;dpa Sachsen;false
ca306fb48f291e2ad36f3d2859f3e6d6e366185318c1035af12ed1817c1dfeb5;Vogelgrippe trifft Linum hart - Betriebe in Alarmstimmung;https://www.zeit.de/news/2025-10/30/vogelgrippe-trifft-linum-hart-betriebe-in-alarmstimmung;Hier finden Sie Informationen zu dem Thema „Geflügelpest in Brandenburg“. Lesen Sie jetzt „Vogelgrippe trifft Linum hart - Betriebe in Alarmstimmung“.;Geflügelpest in Brandenburg;News, Geflügelpest in Brandenburg, Hanka Mittelstädt, Linum, Brandenburg, Berlin, SPD, Vogelgrippe, Alarmstimmung, Kranich, Herbst, Krise;2025-10-30T15:34:38+01:00;2025-10-30T15:34:38+01:00;;dpa Berlin/Brandenburg;false
5c7d807559c57054639b2ceaaacce1e91c02f6eb89457682ab9f7c83f0c4f856;Eigene Oma angezündet - Haftstrafe für Totschlag;https://www.zeit.de/news/2025-10/30/eigene-oma-angezuendet-haftstrafe-fuer-totschlag;Hier finden Sie Informationen zu dem Thema „Kriminalität“. Lesen Sie jetzt „Eigene Oma angezündet - Haftstrafe für Totschlag“.;Kriminalität;News, Kriminalität, Landshut, Haftstrafe, Totschlag, Brandbeschleuniger, Desinfektionsmittel, Kriminalität, Großmutter;2025-10-30T15:34:06+01:00;2025-10-30T15:34:06+01:00;;dpa;false
62032c44d8bc9d8b37b017ac65d0aa45dd80756545e113b2fb7dd874aa38fffc;Rohstoffagentur sieht deutsche Rüstungspläne in Gefahr;https://www.zeit.de/news/2025-10/30/rohstoffagentur-sieht-deutsche-ruestungsplaene-in-gefahr;Hier finden Sie Informationen zu dem Thema „China schränkt Ausfuhren ein“. Lesen Sie jetzt „Rohstoffagentur sieht deutsche Rüstungspläne in Gefahr“.;China schränkt Ausfuhren ein;News, China schränkt Ausfuhren ein, China, Buchholz, Rohstoffagentur, Rüstungsplan, Ausfuhr, Rüstungsindustrie, Rüstung;2025-10-30T15:33:56+01:00;2025-10-30T15:33:56+01:00;;dpa Niedersachsen;false
ea8a7ddbf21af77705bec220e27adc460b1ece4f25a910200a8d329c7a9532bb;Saalfeld-Rudolstadt stoppt Geflügelverkauf wegen Vogelgrippe;https://www.zeit.de/news/2025-10/30/saalfeld-rudolstadt-stoppt-gefluegelverkauf-wegen-vogelgrippe;Hier finden Sie Informationen zu dem Thema „Geflügelpest“. Lesen Sie jetzt „Saalfeld-Rudolstadt stoppt Geflügelverkauf wegen Vogelgrippe“.;Geflügelpest;News, Geflügelpest, Saalfeld-Rudolstadt, Geflügelverkauf, Geflügelpest, Allgemeinverfügung, Verkaufsverbot, Geflügel, Virus, Tiere, Vogelgrippe;2025-10-30T15:30:41+01:00;2025-10-30T15:30:41+01:00;;dpa Thüringen;false
963fcf96d735f9c69d76dcb348358d6da7316fe1d3dc08fc6b92e41fe892466d;Auto, Bahn, D-Ticket - die Beschlüsse der Verkehrsminister;https://www.zeit.de/news/2025-10/30/verkehrsminister-wollen-mehr-geld-fuer-infrastruktur;Hier finden Sie Informationen zu dem Thema „Nahverkehr“. Lesen Sie jetzt „Auto, Bahn, D-Ticket - die Beschlüsse der Verkehrsminister“.;Nahverkehr;News, Nahverkehr, Bayern, Nahverkehr, Infrastruktur, Verkehrsinfrastruktur, Verkehrsministerkonferenz, Geld, Deutschlandticket;2025-10-30T15:28:34+01:00;2025-10-30T15:28:34+01:00;;dpa;false
57d2f0dd17527d007b1b7532378e0bc165f16d3b6cd0b2bc36dba48fa0ea7d1a;"VW-Konzernchef Blume: ""Wir kümmern uns um Zwickau""";https://www.zeit.de/news/2025-10/30/kretschmer-vw-standort-in-zwickau-hat-eine-zukunft;"Hier finden Sie Informationen zu dem Thema „Industrie“. Lesen Sie jetzt „VW-Konzernchef Blume: ""Wir kümmern uns um Zwickau""“.";Industrie;News, Industrie, Michael Kretschmer, Zwickau, Sachsen;2025-10-30T15:28:26+01:00;2025-10-30T15:28:26+01:00;;dpa Sachsen;false
1b79bffdf697139d3fb5d16439d3296ff68b5c745ee968b3db5203ced55c034f;Alle Männer bloß Neandertaler;https://www.zeit.de/2025/46/artificial-angels-grimes-musikvideo-avatar-elon-musk;Die Musikerin Grimes hat ein seltsames Musikvideo veröffentlicht. Darin schießt sie gemeinsam mit einem Erotik-Avatar auf Männer. Ihr Ex Elon Musk ist indirekt präsent. ;"Z+ (abopflichtiger Inhalt);
        
    ""Artificial Angels""";"Kultur, ""Artificial Angels"", Popmusik, Musik, künstliche Intelligenz, Elon Musk";2025-10-30T15:27:35+01:00;2025-10-30T15:27:35+01:00;Jens Balzer;Aus der        ZEIT Nr. 46/2025;false
a2f9217d4a07824ed4e6a92503bbdad7d989e7d782b0979d3b277ab83b008450;Brisantes Dresden-Duell: Hertha mahnt zu Besonnenheit;https://www.zeit.de/news/2025-10/30/leitl-vor-dresden-duell-spielen-fussball-und-nichts-anderes;Hier finden Sie Informationen zu dem Thema „2. Fußball-Bundesliga“. Lesen Sie jetzt „Brisantes Dresden-Duell: Hertha mahnt zu Besonnenheit“.;2. Fußball-Bundesliga;News, 2. Fußball-Bundesliga, Stefan Leitl, Sachsen, Dresden, Hertha BSC, Dynamo Dresden, Fußball-Bundesliga, Fußball;2025-10-30T15:25:49+01:00;2025-10-30T15:25:49+01:00;;dpa Berlin/Brandenburg;false
8cb21c6419f72b8025dafcdb3279d28ffd00c6adc4cffc71c9d5b2eeacefd3c0;Bahn übernimmt LEAG-Ausbildungswerkstatt in der Lausitz;https://www.zeit.de/news/2025-10/30/bahn-uebernimmt-leag-ausbildungswerkstatt-in-der-lausitz;Hier finden Sie Informationen zu dem Thema „Perspektiven für Azubis“. Lesen Sie jetzt „Bahn übernimmt LEAG-Ausbildungswerkstatt in der Lausitz“.;Perspektiven für Azubis;News, Perspektiven für Azubis, Lausitz, Jänschwalde, Cottbus, DB, Deutsche Bahn, Perspektive, Ausbildungswerkstatt, ICE;2025-10-30T15:24:47+01:00;2025-10-30T15:24:47+01:00;;dpa Berlin/Brandenburg;false
a8486378f0e78e741a1bed9ddd625364292f29757e71d04c47da6232e04eecf7;Sandell verlässt Rhein-Neckar Löwen nach einem Jahr wieder;https://www.zeit.de/news/2025-10/30/sandell-verlaesst-rhein-neckar-loewen-nach-einem-jahr-wieder;Hier finden Sie Informationen zu dem Thema „Handball-Bundesliga“. Lesen Sie jetzt „Sandell verlässt Rhein-Neckar Löwen nach einem Jahr wieder“.;Handball-Bundesliga;News, Handball-Bundesliga, Lukas Sandell, Rhein-Neckar Löwen, Handball-Bundesliga;2025-10-30T15:23:54+01:00;2025-10-30T15:23:54+01:00;;dpa Baden-Württemberg;false
c8d5ee32021e86dcbaad49f6372b6aae92953b129ce129ecfefd1ed5a04d9bb8;Trotz stabiler Erlöse: Eintracht macht Millionen-Verlust;https://www.zeit.de/news/2025-10/30/trotz-stabiler-erloese-eintracht-macht-millionen-verlust;Hier finden Sie Informationen zu dem Thema „Fußball-Bundesliga“. Lesen Sie jetzt „Trotz stabiler Erlöse: Eintracht macht Millionen-Verlust“.;Fußball-Bundesliga;News, Fußball-Bundesliga, Julien Zamberk, Frankfurt, Hessen, Eintracht Frankfurt, Fußball-Bundesliga, Rekordniveau, Erfolg;2025-10-30T15:23:44+01:00;2025-10-30T15:23:44+01:00;;dpa Hessen;false
30e48680c88cc120b046cbbac6521d51d2c3069d295bf9f816d6f80d5cb3ebb9;Trüb statt golden war der Oktober in Berlin und Brandenburg;https://www.zeit.de/news/2025-10/30/trueb-statt-golden-war-der-oktober-in-berlin-und-brandenburg;Hier finden Sie Informationen zu dem Thema „Deutscher Wetterdienst“. Lesen Sie jetzt „Trüb statt golden war der Oktober in Berlin und Brandenburg“.;Deutscher Wetterdienst;News, Deutscher Wetterdienst, Berlin, Brandenburg, DWD;2025-10-30T15:21:34+01:00;2025-10-30T15:21:34+01:00;;dpa Berlin/Brandenburg;false
837dbe7ea07da18bfedc5a0fa0e658dedd3237c5a9f81c422d089bfb0ca141da;Mehr als 700 Behandlungsfehler in Bayern festgestellt;https://www.zeit.de/news/2025-10/30/mehr-als-700-behandlungsfehler-in-bayern-festgestellt;Hier finden Sie Informationen zu dem Thema „Gesundheitsversorgung“. Lesen Sie jetzt „Mehr als 700 Behandlungsfehler in Bayern festgestellt“.;Gesundheitsversorgung;News, Gesundheitsversorgung, Bayern, Behandlungsfehler, Gesundheitsversorgung;2025-10-30T15:19:20+01:00;2025-10-30T15:19:20+01:00;;dpa Bayern;false
0dd235ee6b08487a0c9d6019db6deee7e6132a9fac0612065f29c2aa93d25b47;Missbrauch-Studie: Marx und Ackermann bitten um Verzeihung;https://www.zeit.de/news/2025-10/30/bericht-zu-missbrauch-in-amtszeiten-von-marx-und-ackermann;Hier finden Sie Informationen zu dem Thema „Missbrauch und Kirche“. Lesen Sie jetzt „Missbrauch-Studie: Marx und Ackermann bitten um Verzeihung“.;Missbrauch und Kirche;News, Missbrauch und Kirche, Stephan Ackermann, Kardinal Marx, Trier, Universität Trier, Missbrauch, Amtszeit, Zwischenbericht;2025-10-30T15:18:49+01:00;2025-10-30T15:18:49+01:00;;dpa Bayern;false
cfd0f3a144bb72ee8765fa31b4270581fc298568ec8a33c7554b5328d0bd79ce;Marx räumt Fehler ein und bittet um Verzeihung;https://www.zeit.de/news/2025-10/30/marx-raeumt-fehler-ein-und-bittet-um-verzeihung;Hier finden Sie Informationen zu dem Thema „Missbrauch und Kirche“. Lesen Sie jetzt „Marx räumt Fehler ein und bittet um Verzeihung“.;Missbrauch und Kirche;News, Missbrauch und Kirche, Marx Fehler, Trier, Verzeihung, Missbrauch;2025-10-30T15:15:30+01:00;2025-10-30T15:15:30+01:00;;dpa Bayern;false
ff2be895a5e1ccffe24a18a2078f764d2a9c325bf1d8a2f1bc267e6a38b90c9c;Auf dem Weg in den Postpopulismus?;https://www.zeit.de/politik/ausland/2025-10/parlamentswahl-niederlande-geert-wilders-pvv-rechtspopulismus-gxe;In den Niederlanden verliert Geert Wilders an Zustimmung, während die Liberalen bei der Wahl deutlich zulegen. Aber: Geschlagen ist die Rechte deshalb noch lange nicht.;Parlamentswahl in den Niederlanden;Politik, Parlamentswahl in den Niederlanden, Geert Wilders, Niederlande, Rechtspopulismus, Politische Rechte, Rechtsextremismus, Asylpolitik;2025-10-30T15:11:38+01:00;2025-10-30T15:11:38+01:00;Ulrich Ladurner;;false
20257a3ab4db9c91253fe1a1e9aebc093b1995434355c3f742b67c1eebb8b0b0;In Topform gegen den Lieblingsgegner: Aber Steffen warnt;https://www.zeit.de/news/2025-10/30/in-topform-gegen-den-lieblingsgegner-aber-steffen-warnt;Hier finden Sie Informationen zu dem Thema „Werder Bremen“. Lesen Sie jetzt „In Topform gegen den Lieblingsgegner: Aber Steffen warnt“.;Werder Bremen;News, Werder Bremen, Horst Steffen, Mainz, SV Werder Bremen, 1. FSV Mainz 05, Erfolg;2025-10-30T15:11:18+01:00;2025-10-30T15:11:18+01:00;;dpa Niedersachsen;false
cf2fc519b7c600190b8fac6a84bb74eaeee686a5e4ae17afab3289defbafdfd1;"Wenn Ärzten Fehler passieren – ""Spitze des Eisbergs""";https://www.zeit.de/news/2025-10/30/kassen-gutachter-ermitteln-rund-3-700-behandlungsfehler;"Hier finden Sie Informationen zu dem Thema „Gesundheitswesen“. Lesen Sie jetzt „Wenn Ärzten Fehler passieren – ""Spitze des Eisbergs""“.";Gesundheitswesen;News, Gesundheitswesen, Stefan Gronemeyer, Behandlungsfehler, Gesundheitswesen, Todesfall;2025-10-30T15:10:33+01:00;2025-10-30T15:10:33+01:00;;dpa;false
a60652764452fdc583b5df635786da31cd94115ba567741e69551f1e8ba789ba;Dynamo-Coach vor Berlin-Spiel: Kulisse keine Last;https://www.zeit.de/news/2025-10/30/dynamo-coach-vor-berlin-spiel-kulisse-keine-last;Hier finden Sie Informationen zu dem Thema „2. Fußball-Bundesliga“. Lesen Sie jetzt „Dynamo-Coach vor Berlin-Spiel: Kulisse keine Last“.;2. Fußball-Bundesliga;News, 2. Fußball-Bundesliga, Thomas Stamm, Dresden, Berlin, Olympiastadion Berlin, Hertha BSC, Dynamo Dresden, Hertha BSC Berlin, Fußball-Bundesliga;2025-10-30T15:07:56+01:00;2025-10-30T15:07:56+01:00;;dpa Berlin/Brandenburg;false
cb39a25ece1b84431820994f7df090e2d77b856b86dbcc5a353aae1715629a91;Sportwagen rast in Heck von 26-Jähriger;https://www.zeit.de/news/2025-10/30/sportwagen-rast-in-heck-von-26-jaehriger;Hier finden Sie Informationen zu dem Thema „Karlsruhe“. Lesen Sie jetzt „Sportwagen rast in Heck von 26-Jähriger“.;Karlsruhe;News, Karlsruhe, Karlsruhe, Ferrari, Sportwagen, Unfall, Auto;2025-10-30T15:07:49+01:00;2025-10-30T15:07:49+01:00;;dpa Baden-Württemberg;false
8d7f8d9d8eec04ace234696bff669b0d07a070696f32a3bcd369ca10eec0f06d;Christian Streich schließt Rückkehr als Trainer nicht aus;https://www.zeit.de/news/2025-10/30/christian-streich-schliesst-rueckkehr-als-trainer-nicht-aus;Hier finden Sie Informationen zu dem Thema „Früherer Bundesliga-Trainer“. Lesen Sie jetzt „Christian Streich schließt Rückkehr als Trainer nicht aus“.;Früherer Bundesliga-Trainer;News, Früherer Bundesliga-Trainer, Christian Streich, Julian Schuster, Freiburg, SC Freiburg, Bundesliga, Europa League;2025-10-30T15:07:28+01:00;2025-10-30T15:07:28+01:00;;dpa Baden-Württemberg;false
a1fb4afc54bf616c2eb4ce30c8140b82bcf23c47bf55fd239f6866fac28889a5;Inflation lässt nach - aber weiter über zwei Prozent;https://www.zeit.de/news/2025-10/30/inflation-laesst-nach-aber-weiter-ueber-zwei-prozent;Hier finden Sie Informationen zu dem Thema „Verbraucherpreise im Oktober“. Lesen Sie jetzt „Inflation lässt nach - aber weiter über zwei Prozent“.;Verbraucherpreise im Oktober;News, Verbraucherpreise im Oktober, EZB, Verbraucherpreis, Inflation, Lebensmittel;2025-10-30T15:03:31+01:00;2025-10-30T15:03:31+01:00;;dpa;false
4600a40c2162e3d414e65f9d27d7426914cbd0a7e9db6890ae233ae01008f170;"Klose fordert ""Serie"" beim FCN - Abfuhr für Kapitän Knoche";https://www.zeit.de/news/2025-10/30/klose-ansage-an-1-fc-nuernberg-muessen-serie-starten;"Hier finden Sie Informationen zu dem Thema „2. Fußball-Bundesliga“. Lesen Sie jetzt „Klose fordert ""Serie"" beim FCN - Abfuhr für Kapitän Knoche“.";2. Fußball-Bundesliga;News, 2. Fußball-Bundesliga, Miroslav Klose, Kaiserslautern, 1. FC Nürnberg, Fußball-Bundesliga, Saisonverlauf;2025-10-30T15:02:17+01:00;2025-10-30T15:02:17+01:00;;dpa Bayern;false
efc42ded4414eb1d26bd76adb84bb8f92200370a1f08116ec91b2920c95b615f;Lkw auf A61 im Hunsrück umgestürzt - Fahrer schwer verletzt;https://www.zeit.de/news/2025-10/30/lastwagen-auf-a61-im-hunsrueck-umgestuerzt-fahrbahn-blockiert;Hier finden Sie Informationen zu dem Thema „Unfall“. Lesen Sie jetzt „Lkw auf A61 im Hunsrück umgestürzt - Fahrer schwer verletzt“.;Unfall;News, Unfall, Hunsrück, Unfall, Fahrbahn;2025-10-30T14:59:10+01:00;2025-10-30T14:59:10+01:00;;dpa Rheinland-Pfalz/Saarland;false
bc4b42ac47ee1510278e7637e77e52df4d624c5af4c9f0673cf4f5ea054a2faa;Mann soll auf Partner der Ex-Freundin eingestochen haben;https://www.zeit.de/news/2025-10/30/mann-soll-auf-partner-der-ex-freundin-eingestochen-haben;Hier finden Sie Informationen zu dem Thema „Lebensgefährlich verletzt“. Lesen Sie jetzt „Mann soll auf Partner der Ex-Freundin eingestochen haben“.;Lebensgefährlich verletzt;News, Lebensgefährlich verletzt, Polizei;2025-10-30T14:58:41+01:00;2025-10-30T14:58:41+01:00;;dpa Nordrhein-Westfalen;false
5ce74450386aa5f9bf6c7b86083fe805ae9818bd4a038f97d9c6bbb148fe5e9f;Geflügel-Stallpflicht soll ab Samstag im Raum Trier gelten;https://www.zeit.de/news/2025-10/30/gefluegel-stallpflicht-soll-ab-samstag-im-raum-trier-gelten;Hier finden Sie Informationen zu dem Thema „Tierseuche“. Lesen Sie jetzt „Geflügel-Stallpflicht soll ab Samstag im Raum Trier gelten“.;Tierseuche;News, Tierseuche, Trier, Trier-Saarburg, Koblenz, Rheinland-Pfalz, BMU, Friedrich-Loeffler-Institut, Tierseuche, Vogelgrippe, Veterinäramt, Stallpflicht;2025-10-30T14:58:22+01:00;2025-10-30T14:58:22+01:00;;dpa Rheinland-Pfalz/Saarland;false
1c2ee47cabbe00ebe5c72e1e206a4ae900608d220db3af5ee2fe3ee95dca7388;Gericht: Preiserhöhung für Prime-Kunden unwirksam;https://www.zeit.de/news/2025-10/30/gericht-preiserhoehung-fuer-prime-kunden-unwirksam;Hier finden Sie Informationen zu dem Thema „Rechtsstreit“. Lesen Sie jetzt „Gericht: Preiserhöhung für Prime-Kunden unwirksam“.;Rechtsstreit;News, Rechtsstreit, Amazon, Oberlandesgericht Düsseldorf, Verbraucherzentrale, Rechtsstreit, Preiserhöhung, Preisanpassungsklausel;2025-10-30T14:58:14+01:00;2025-10-30T14:58:14+01:00;;dpa;false
