Hash;Title;Link;Description;Category;KeyWords;Published;LastUpdated;Author;Source;Paywall
1bf6efdb039e2fbd567d2cda1e4ca759ed77d14d1ead20749e2c0432fbd50ee9;Prognose: Kälte treibt Heizkosten in Thüringen in die Höhe;https://www.zeit.de/news/2026-01/14/prognose-kaelte-treibt-heizkosten-in-thueringen-in-die-hoehe;Hier finden Sie Informationen zu dem Thema „Bundesweit auf Platz fünf“. Lesen Sie jetzt „Prognose: Kälte treibt Heizkosten in Thüringen in die Höhe“.;Bundesweit auf Platz fünf;News, Bundesweit auf Platz fünf, Thüringen, Techem, Heizkosten, Kälte, Prognose;2026-01-14T10:44:05+01:00;2026-01-14T10:44:05+01:00;;dpa Thüringen;false
81a112c8774ec4370831181afdb12849a76ba23774ad701a95c59eb5b8ae4bac;Audi beendet schwieriges Jahr mit leichtem Aufwind;https://www.zeit.de/news/2026-01/14/audi-beendet-schwieriges-jahr-mit-leichtem-aufwind;Hier finden Sie Informationen zu dem Thema „Autoindustrie“. Lesen Sie jetzt „Audi beendet schwieriges Jahr mit leichtem Aufwind“.;Autoindustrie;News, Autoindustrie, Marco Schubert, USA, China, Audi, BMW, Mercedes-Benz, Autoindustrie, Auto;2026-01-14T10:43:55+01:00;2026-01-14T10:43:55+01:00;;dpa;false
0adde6bc474f2ed7d81c9c9f1ade725f34716089c41360f4d29cb0b1f655b534;Aufnahme von Geflüchteten schafft neue Arbeitsplätze;https://www.zeit.de/wirtschaft/2026-01/zuwanderung-unternehmen-arbeitsplaetze-gewerbeanmeldungen-gxe;Kommen Geflüchtete nach Deutschland, entstehen laut ifo Institut mehr Unternehmen und Arbeitsplätze. Denn der Zuzug sorge für neue Geschäftsmodelle.;ifo-Untersuchung;Wirtschaft, ifo-Untersuchung, Arbeitsplatz, Migration, Arbeitsmarkt, Einwanderung, Geflüchtete, Unternehmen;2026-01-14T10:43:44+01:00;2026-01-14T10:43:44+01:00;mns;DIE ZEIT,        Reuters,        KNA,        							mns;false
486155eeae46a289d281bfb8f9dcb221ed606758abbb72cd2e2fc7e5249ad7b5;"""Was leisten Bilder? Und für wen?""";https://www.zeit.de/2026/01/mark-sealy-phototriennale-2026-hamburg-fotografie;Mark Sealy ist der neue Leiter der Phototriennale in Hamburg. Er sagt: Die Menschen hier könnten noch einen Anstoß vertragen, sich stärker aufeinander einzulassen.;"Z+ (abopflichtiger Inhalt);
        
    Mark Sealy";Hamburg, Mark Sealy, Hamburg, Deichtorhallen, Fotografie, Kunst, Geschichte, Mark Sealy;2026-01-14T10:42:10+01:00;2026-01-14T10:42:10+01:00;Oskar Piegsa;Aus der        ZEIT Nr. 01/2026;false
83a42ee5fd973c1eb133c4acbe0efa2efb806fd205818dce7760912e95b541d7;Statistik: Immer weniger Geburten in Sachsen-Anhalt;https://www.zeit.de/news/2026-01/14/statistik-immer-weniger-geburten-in-sachsen-anhalt;Hier finden Sie Informationen zu dem Thema „Kinder“. Lesen Sie jetzt „Statistik: Immer weniger Geburten in Sachsen-Anhalt“.;Kinder;News, Kinder, Sachsen-Anhalt, Geburtenzahl, Geburt, Statistik;2026-01-14T10:38:38+01:00;2026-01-14T10:38:38+01:00;;dpa Sachsen;false
7dec59dd0c2c01d6078dfc51ff7031642aec71e562385539ee3e3576cb21be2d;Teenager wird vermisst - wollte wohl nach Sizilien radeln;https://www.zeit.de/news/2026-01/14/teenager-wird-vermisst-wollte-wohl-nach-sizilien-radeln;Hier finden Sie Informationen zu dem Thema „Vermisstenfall“. Lesen Sie jetzt „Teenager wird vermisst - wollte wohl nach Sizilien radeln“.;Vermisstenfall;News, Vermisstenfall, Sizilien, Bruchsal, Polizei, Vermisstenfall, Teenager;2026-01-14T10:33:15+01:00;2026-01-14T10:33:15+01:00;;dpa Baden-Württemberg;false
7604275e42b4d2d9488ce5a0f6446278d3a002a611adcba0bf523af7dc972dda;Tod in Badewanne – drei Jahre Haft für Mutter gefordert;https://www.zeit.de/news/2026-01/14/tod-in-badewanne-drei-jahre-haft-fuer-mutter-gefordert;Hier finden Sie Informationen zu dem Thema „Plädoyers“. Lesen Sie jetzt „Tod in Badewanne – drei Jahre Haft für Mutter gefordert“.;Plädoyers;News, Plädoyers, Staatsanwaltschaft, Badewanne, Plädoyer;2026-01-14T10:32:37+01:00;2026-01-14T10:32:37+01:00;;dpa Thüringen;false
aa0e2e4a3f903472958174abb42dd0b32b88ab24e2de373f81a6178c942b0cc1;Torhüter Portner verlässt SC Magdeburg zum Saisonende;https://www.zeit.de/news/2026-01/14/torhueter-portner-verlaesst-sc-magdeburg-zum-saisonende;Hier finden Sie Informationen zu dem Thema „Handball-Bundesliga“. Lesen Sie jetzt „Torhüter Portner verlässt SC Magdeburg zum Saisonende“.;Handball-Bundesliga;News, Handball-Bundesliga, Sergey Hernandez, Nikola Portner, Magdeburg, SC Magdeburg, Handball-Bundesliga, Champions League;2026-01-14T10:30:03+01:00;2026-01-14T10:30:03+01:00;;dpa Sachsen;false
23411946cdf5a362470a9c19d503219950ed1fb816cc0f6d3987807422371c8e;Anteil von Frauen in deutschen Vorständen stagniert;https://www.zeit.de/wirtschaft/unternehmen/2026-01/fauenanteil-in-vorstaenden-stagniert-diw-managerinnen-gxe;In den Vorständen großer Unternehmen in Deutschland sind Frauen nach wie vor die Ausnahme. Das DIW sieht in der jüngsten Entwicklung ein Warnsignal.;Deutsches Institut für Wirtschaftsforschung;Wirtschaft, Deutsches Institut für Wirtschaftsforschung, DIW, Vorstand, Unternehmen, Frauen, Statistik;2026-01-14T10:28:36+01:00;2026-01-14T10:28:36+01:00;bam;DIE ZEIT,        dpa,        							bam;false
4af3d7b95dd820d367acce573a11f08cd1cc20bfb827028e1dfb231f8ac6b17d;Unfall in Schwaben: Fahrschulauto reißt Telefonleitung ab;https://www.zeit.de/news/2026-01/14/unfall-in-schwaben-fahrschulauto-reisst-telefonleitung-ab;Hier finden Sie Informationen zu dem Thema „Unfall“. Lesen Sie jetzt „Unfall in Schwaben: Fahrschulauto reißt Telefonleitung ab“.;Unfall;News, Unfall, Unfall, Fahrschulauto, Telefonleitung;2026-01-14T10:24:23+01:00;2026-01-14T10:24:23+01:00;;dpa Bayern;false
6dfd76d6b79e1efe17778a293f806fae386dfffcadb363473e17ff78858061a4;Außerirdisch erfolgreich;https://www.zeit.de/2026/03/erich-von-daeniken-autor-erinnerungen-an-die-zukunft-aliens;Die Alienbücher des Erich von Däniken verkauften sich vor 50 Jahren millionenfach. Nun ist er gestorben. Heute kann man sagen: Die Bücher lehrten einiges für die Zukunft.;"Z+ (abopflichtiger Inhalt);
        
    Erich von Däniken";Wissen, Erich von Däniken, Erich von Däniken, Autor, Außerirdische, Science Fiction, Bestseller, Literatur;2026-01-14T10:24:05+01:00;2026-01-14T10:24:05+01:00;Dr. Sibylle Anderl;Aus der        ZEIT Nr. 03/2026;false
3db72ad95526bae41d637c3741cd5044b5dc8e8f650a5a5ff626fbdbab1bde7a;"Heidenheims Schmidt deutlich: ""Verdient Letzter""";https://www.zeit.de/news/2026-01/14/heidenheims-schmidt-deutlich-verdient-letzter;"Hier finden Sie Informationen zu dem Thema „Bundesliga“. Lesen Sie jetzt „Heidenheims Schmidt deutlich: ""Verdient Letzter""“.";Bundesliga;News, Bundesliga, Diant Ramaj, Frank Schmidt, Heidenheim, 1. FSV Mainz 05, 1. FC Heidenheim, Bundesliga, Fußball-Bundesliga;2026-01-14T10:21:52+01:00;2026-01-14T10:21:52+01:00;;dpa Baden-Württemberg;false
364f19f5d921ab70d94e9d64f9112a0c900e018824c39adb3d437153b89bf310;RWE erhält Zuschlag in britischer Offshore-Auktion;https://www.zeit.de/news/2026-01/14/rwe-erhaelt-zuschlag-in-britischer-offshore-auktion;Hier finden Sie Informationen zu dem Thema „Windparks“. Lesen Sie jetzt „RWE erhält Zuschlag in britischer Offshore-Auktion“.;Windparks;News, Windparks, Großbritannien, RWE, Windpark, Zuschlag, Energiekonzern, Offshore, Auktion;2026-01-14T10:19:06+01:00;2026-01-14T10:19:06+01:00;;dpa Nordrhein-Westfalen;false
97571a74a6b90fd9ab11b70daa181b1ea8a1db8853f160e830667d7323ccd31b;Prognose: Sachsen auf Platz zwei bei steigenden Heizkosten;https://www.zeit.de/news/2026-01/14/prognose-sachsen-auf-platz-zwei-bei-steigenden-heizkosten;Hier finden Sie Informationen zu dem Thema „Kosten“. Lesen Sie jetzt „Prognose: Sachsen auf Platz zwei bei steigenden Heizkosten“.;Kosten;News, Kosten, Sachsen, Techem, Heizkosten, Prognose;2026-01-14T10:18:34+01:00;2026-01-14T10:18:34+01:00;;dpa Sachsen;false
36c1de8aaa9f45174076a6c7ec983b89f4984db530e9b98e76075d3b8c4da168;Erneut Warnstreik an Frankfurter Uniklinik;https://www.zeit.de/news/2026-01/14/erneut-warnstreik-an-frankfurter-uniklinik;Hier finden Sie Informationen zu dem Thema „Gesundheit“. Lesen Sie jetzt „Erneut Warnstreik an Frankfurter Uniklinik“.;Gesundheit;News, Gesundheit, Frankfurt, Ver.di, Uniklinik, Uniklinikum, Warnstreik;2026-01-14T10:16:26+01:00;2026-01-14T10:16:26+01:00;;dpa Hessen;false
1e17dd9ac169f2d48e462675543cc68643a459cf4a8b24a947159c84f4b39e55;Vollsperrung der A24 sorgt erneut für Verkehrsbehinderungen;https://www.zeit.de/news/2026-01/14/a24-erneut-zwischen-hagenow-und-woebbelin-voll-gesperrt;Hier finden Sie Informationen zu dem Thema „Autobahn“. Lesen Sie jetzt „Vollsperrung der A24 sorgt erneut für Verkehrsbehinderungen“.;Autobahn;News, Autobahn, Hagenow, Wöbbelin, Landkreis Ludwigslust-Parchim, Anschlussstelle, Autobahn;2026-01-14T10:06:35+01:00;2026-01-14T10:06:35+01:00;;dpa Mecklenburg-Vorpommern;false
d8ef3de4a3c1a4875ef4c95b24ab4355437eb4eedc8874cd349f9941b3178fe1;Berlins Justizsenatorin fordert stärkere Beobachtung von Linksextremen;https://www.zeit.de/politik/deutschland/2026-01/stromausfall-berlin-anschlag-linksextreme-felor-badenberg-gxe;Felor Badenberg will nach dem Anschlag auf das Berliner Stromnetz den Verfassungsschutz stärken. Die Justizsenatorin fordert mehr Befugnisse und mehr Personal. ;Stromausfall in Berlin;Politik, Stromausfall in Berlin, Berlin, Verfassungsschutz, CDU, Stromversorgung, Linksextremismus, Justiz;2026-01-14T10:01:03+01:00;2026-01-14T10:01:03+01:00;yer;DIE ZEIT,        dpa,        							yer;false
e9566e5a7720c43e9d1e8c9d3f260dfaa542b2d2f8eacaa306e2d4c1ce1e076c;DIW: Frauenanteil in Vorständen stagniert;https://www.zeit.de/news/2026-01/14/diw-frauenanteil-in-vorstaenden-stagniert;Hier finden Sie Informationen zu dem Thema „Gleichstellung in Unternehmen“. Lesen Sie jetzt „DIW: Frauenanteil in Vorständen stagniert“.;Gleichstellung in Unternehmen;News, Gleichstellung in Unternehmen, DIW, Gleichstellung, Vorstandsetage, Frauenanteil, Herbst, Dax;2026-01-14T10:00:05+01:00;2026-01-14T10:00:05+01:00;;dpa;false
6aa045b4a8e6fd77bfeaee8cfddc2cb6a40503861978e4b79957642448c0077f;Mysteriöse Umstände: Verlorene Polizeimunition aufgetaucht;https://www.zeit.de/news/2026-01/14/mysterioese-umstaende-verlorene-polizeimunition-aufgetaucht;Hier finden Sie Informationen zu dem Thema „90 Schuss für Maschinengewehr“. Lesen Sie jetzt „Mysteriöse Umstände: Verlorene Polizeimunition aufgetaucht“.;90 Schuss für Maschinengewehr;News, 90 Schuss für Maschinengewehr, Polizei, Innenministerium, Polizeimunition, Maschinengewehr, Umstand, Waffenmagazin;2026-01-14T09:52:10+01:00;2026-01-14T09:52:10+01:00;;dpa Sachsen;false
47aadbb53b72c0544f88cefb4380874c01fea4bbad0cdefc14b967011f23067c;US-Luxus-Warenhauskonzern Saks Global meldet Insolvenz an;https://www.zeit.de/news/2026-01/14/us-luxus-warenhauskonzern-saks-global-meldet-insolvenz-an;Hier finden Sie Informationen zu dem Thema „Geschäft mit Luxusgütern“. Lesen Sie jetzt „US-Luxus-Warenhauskonzern Saks Global meldet Insolvenz an“.;Geschäft mit Luxusgütern;News, Geschäft mit Luxusgütern, USA, Saks Fifth Avenue, Neiman Marcus, Luxusgut, Restrukturierungsverfahren, Insolvenz, Gläubigerschutz;2026-01-14T09:51:26+01:00;2026-01-14T09:51:26+01:00;;dpa;false
bb01de685ee131a2ad3f580bf149dafa274c95f23d6a4f34faba0070e2ce3798;Alois Rainer verteidigt geplanten leichteren Abschuss von Wölfen;https://www.zeit.de/politik/deutschland/2026-01/bundesjagdgesetz-abschuss-wolf-alois-rainer-bundestag-gxe;Der Bundestag debattiert heute darüber, ob er den Wolf in das deutsche Jagdgesetz aufnimmt. Bundeslandwirtschaftsminister Alois Rainer spricht sich dafür aus.;Bundesjagdgesetz;Politik, Bundesjagdgesetz, Alois Rainer, CSU, Tierschutz, Deutscher Bundestag, Bundesregierung, Bundesrat;2026-01-14T09:44:30+01:00;2026-01-14T09:44:30+01:00;wlk;DIE ZEIT,        AFP,        dpa,        							wlk;false
eb664ed36ba5f72c27ef751aa4d7a532d21b35defc7a84f132bb113d763a1d75;Zwei Verletzte bei Feuer im Mehrfamilienhaus in Hamburg;https://www.zeit.de/news/2026-01/14/zwei-verletzte-bei-feuer-im-mehrfamilienhaus-in-hamburg;Hier finden Sie Informationen zu dem Thema „Brände“. Lesen Sie jetzt „Zwei Verletzte bei Feuer im Mehrfamilienhaus in Hamburg“.;Brände;News, Brände, Hamburg, Hamburg-Lurup, Polizei, Brand;2026-01-14T09:39:18+01:00;2026-01-14T09:39:18+01:00;;dpa Hamburg/Schleswig-Holstein;false
819b602e86e8d58f27e938cced0cf2527519ccae9a3c3095545c05301aaac354;Frankreich eröffnet Konsulat auf Grönland;https://www.zeit.de/politik/ausland/2026-01/groenland-frankreich-usa-konsulat-gxe;Als Zeichen gegen die US-Annexionsdrohungen richtet Frankreich ein Konsulat ein. Auch bei US-Republikanern gibt es Widerstand gegen Donald Trumps Pläne.;US-Besitzansprüche auf Grönland;Politik, US-Besitzansprüche auf Grönland, Frankreich, Grönland, Donald Trump, USA, Washington, Nato;2026-01-14T09:35:50+01:00;2026-01-14T09:35:50+01:00;kzi;DIE ZEIT,        dpa,        Reuters,        							kzi;false
823a6ef2d23021a04c5b8f91995a749b2b259f38b29e12285ec38e98bb023e6f;"""Alleingänge gefährden den Fortbestand der Nato""";https://www.zeit.de/2026/03/nato-russland-usa-arktis-groenland-gipfel-ankara;Eine Annexion Grönlands liefe den Interessen der USA zuwider: Boris Pistorius über neue Einflusssphären, schwindende Gewissheiten und die aktuelle Lage.;"Z+ (abopflichtiger Inhalt);
        
    Gastbeitrag von Boris Pistorius";Politik, Gastbeitrag von Boris Pistorius, Boris Pistorius, Grönland, USA, Russland, Nato, Verteidigungspolitik;2026-01-14T09:31:31+01:00;2026-01-14T09:31:31+01:00;Boris Pistorius;Aus der        ZEIT Nr. 03/2026;false
d00c6d6ede90d618dd9168151deecb38853321f94098c5670ee92cf492d1a674;Prognose: Heizkosten in Sachsen-Anhalt steigen deutlich;https://www.zeit.de/news/2026-01/14/prognose-heizkosten-in-sachsen-anhalt-steigen-deutlich;Hier finden Sie Informationen zu dem Thema „Energiekosten“. Lesen Sie jetzt „Prognose: Heizkosten in Sachsen-Anhalt steigen deutlich“.;Energiekosten;News, Energiekosten, Sachsen-Anhalt, Techem, Heizkosten, Energiekosten, Prognose;2026-01-14T09:31:12+01:00;2026-01-14T09:31:12+01:00;;dpa Sachsen;false
1c4d7fd13eb552211d7dc993ddf69ae1f89ab5f722a88428ee065b748c3da5ef;Empörung über Karikatur zu tödlichem Brand in der Schweiz;https://www.zeit.de/news/2026-01/13/empoerung-ueber-karikatur-zu-toedlichem-brand-in-der-schweiz;Hier finden Sie Informationen zu dem Thema „Crans-Montana“. Lesen Sie jetzt „Empörung über Karikatur zu tödlichem Brand in der Schweiz“.;Crans-Montana;News, Crans-Montana, Schweiz, Crans-Montana, Charlie Hebdo, Facebook, Karikatur, Satiremagazin, Brandkatastrophe;2026-01-14T09:20:15+01:00;2026-01-14T09:20:15+01:00;;dpa;false
e8f4d5b6f79934c44ec5a18dcc2776987f685145d985f7c1ac47008cb7ec262e;Unfall auf A3 - etwa 1.000 Liter Diesel ausgelaufen;https://www.zeit.de/news/2026-01/14/unfall-auf-a3-etwa-1-000-liter-diesel-ausgelaufen;Hier finden Sie Informationen zu dem Thema „Unfälle“. Lesen Sie jetzt „Unfall auf A3 - etwa 1.000 Liter Diesel ausgelaufen“.;Unfälle;News, Unfälle, Unfall;2026-01-14T09:15:38+01:00;2026-01-14T09:15:38+01:00;;dpa Hessen;false
8edc5afa1a1b20d61470af8f7ee593fae8a963fbe228b61a683a4d0e14470e59;Utopisches Denken - Millionenförderung für Zukunftsforschung;https://www.zeit.de/news/2026-01/14/utopisches-denken-millionenfoerderung-fuer-zukunftsforschung;Hier finden Sie Informationen zu dem Thema „Geisteswissenschaften“. Lesen Sie jetzt „Utopisches Denken - Millionenförderung für Zukunftsforschung“.;Geisteswissenschaften;News, Geisteswissenschaften, Gerda Henkel, Millionenförderung, Zukunftsforschung, Geisteswissenschaft;2026-01-14T09:15:04+01:00;2026-01-14T09:15:04+01:00;;dpa Nordrhein-Westfalen;false
9778f2cf1214e185987682c6dfbd1d655ec029067dc62fd15248d7d4e528dd07;Ukrainische Truppen wehren Angreifer im Norden von Sumy ab;https://www.zeit.de/politik/ausland/karte-ukraine-krieg-russland-frontverlauf-truppenbewegungen;Erneut haben ukrainische Einheiten alle Angriffe entlang der Frontlinie bei Sumy zurückgeschlagen – auch Attacken im Norden, die Russland als neue Offensive darstellt. ;Ukrainekarte aktuell;Politik, Ukrainekarte aktuell, Krieg in der Ukraine, Russland, Donezk, Charkiw, Militär, Streitkräfte;2026-01-15T10:09:44+01:00;2026-01-15T10:09:44+01:00;Christina FelschenTimo StukenbergElizabeth RushtonPauline PieperJustus WilkeJulius TrögerBenja Zehr;;false
65b07c600599ffe6e343aace1dbebc796b42ff8e1dfd34267ea4137262898d93;Polizei nimmt gesuchten Mann am Frankfurter Flughafen fest;https://www.zeit.de/news/2026-01/14/polizei-nimmt-gesuchten-mann-am-frankfurter-flughafen-fest;Hier finden Sie Informationen zu dem Thema „Festnahme“. Lesen Sie jetzt „Polizei nimmt gesuchten Mann am Frankfurter Flughafen fest“.;Festnahme;News, Festnahme, Frankfurt, Flughafen Frankfurt, Polizei, Bundespolizei, Festnahme, Vergewaltigung;2026-01-14T09:10:39+01:00;2026-01-14T09:10:39+01:00;;dpa Hessen;false
114f26605319b6f793f2d04ef2b71550ad602931cefae2a30dcc69025c42d5df;Unheilig sagt erneut zwei Konzerte kurzfristig ab;https://www.zeit.de/news/2026-01/14/unheilig-sagt-erneut-zwei-konzerte-kurzfristig-ab;Hier finden Sie Informationen zu dem Thema „Oberhausen“. Lesen Sie jetzt „Unheilig sagt erneut zwei Konzerte kurzfristig ab“.;Oberhausen;News, Oberhausen, Oberhausen;2026-01-14T09:08:35+01:00;2026-01-14T09:08:35+01:00;;dpa Hamburg/Schleswig-Holstein;false
c2257e62c79d662e1733e5c9059e59990dd1c1c75b490c47e790ac42b6301479;Mann schwebt nach Rettung aus Teltowkanal in Lebensgefahr;https://www.zeit.de/news/2026-01/14/mann-schwebt-nach-rettung-aus-teltowkanal-in-lebensgefahr;Hier finden Sie Informationen zu dem Thema „Rettungseinsatz“. Lesen Sie jetzt „Mann schwebt nach Rettung aus Teltowkanal in Lebensgefahr“.;Rettungseinsatz;News, Rettungseinsatz, Teltowkanal, Rettungseinsatz, Lebensgefahr, Rettung;2026-01-14T09:00:58+01:00;2026-01-14T09:00:58+01:00;;dpa Berlin/Brandenburg;false
2a71b19f8f32807a9d76ce73e27f42985548bf71c0205d7bab6188a47246d501;Sterberate in Deutschland leicht rückläufig;https://www.zeit.de/gesundheit/2026-01/sterberate-deutschland-lebenserwartung-statistischen-bundesamtes-gxe;Vorläufigen Zahlen zufolge sind im vergangenen Jahr in Deutschland rund eine Million Menschen gestorben. Damit liegt die Zahl leicht unter dem Vorjahreswert.;Lebenserwartung;Gesundheit, Lebenserwartung, Lebenserwartung, Alter, Statistisches Bundesamt, Statistik;2026-01-14T08:47:24+01:00;2026-01-14T08:47:24+01:00;mns;DIE ZEIT,        KNA,        							mns;false
e210c28f9206d62997318d21b169a7e82a41482a6327bb99863b1f2b7743abda;Röwekamp: Vorfälle in Zweibrücken erschweren Rekrutierung;https://www.zeit.de/news/2026-01/14/roewekamp-vorfaelle-in-zweibruecken-erschweren-rekrutierung;Hier finden Sie Informationen zu dem Thema „Fallschirmjäger“. Lesen Sie jetzt „Röwekamp: Vorfälle in Zweibrücken erschweren Rekrutierung“.;Fallschirmjäger;News, Fallschirmjäger, Thomas Röwekamp, Zweibrücken, CDU, Bundeswehr, Rekrutierung, Drogenmissbrauch, Rechtsextremismus;2026-01-14T08:41:00+01:00;2026-01-14T08:41:00+01:00;;dpa Rheinland-Pfalz/Saarland;false
8882a0d3e85c01afc2e6569bfddfaab4ab113dc226788ac8eb450069c49700fb;Überflüssige Bundesländer? Bovenschulte verteidigt Bremen;https://www.zeit.de/news/2026-01/14/ueberfluessige-bundeslaender-bovenschulte-verteidigt-bremen;Hier finden Sie Informationen zu dem Thema „Nach Söder-Aussagen“. Lesen Sie jetzt „Überflüssige Bundesländer? Bovenschulte verteidigt Bremen“.;Nach Söder-Aussagen;News, Nach Söder-Aussagen, Markus Söder, Andreas Bovenschulte, Bremen, CSU;2026-01-14T08:38:47+01:00;2026-01-14T08:38:47+01:00;;dpa Niedersachsen;false
f440093a18fa72db12381278f2aa6860f2c6a6e9f6bb19f093dc0ed91b230ef3;ABC-Klassen ab 2028 – GEW sieht Personalproblem in NRW;https://www.zeit.de/news/2026-01/14/abc-klassen-ab-2028-gew-sieht-personalproblem-in-nrw;Hier finden Sie Informationen zu dem Thema „Bildungschancen“. Lesen Sie jetzt „ABC-Klassen ab 2028 – GEW sieht Personalproblem in NRW“.;Bildungschancen;News, Bildungschancen, Ayla Celik, NRW, GEW, Gewerkschaft Erziehung und Wissenschaft, Personalproblem, Bildungschance, Bildungsgewerkschaft, Sprachförderbedarf;2026-01-14T08:37:44+01:00;2026-01-14T08:37:44+01:00;;dpa Nordrhein-Westfalen;false
59a3f245c3a4652f3b225aead06df95320fa6cd6d7e489f78ac88291d7ff1afe;Ärgert Sie die Erbschaftsteuer?;https://www.zeit.de/geld/2026-01/steuerpolitik-erbschaftssteuer-vermoegen-erfahrungen-aufruf;Der Staat kassiert, wenn Menschen ein Vermögen hinterlassen. Mussten Sie auch schon zahlen? Und finden Sie die Steuer zu hoch – oder zu niedrig?;Steuerpolitik;Geld, Steuerpolitik, Erbschaftsteuer, Steuer, Erbschaft, Vermögen, Steuerpolitik, Finanzen;2026-01-14T08:35:39+01:00;2026-01-14T08:35:39+01:00;;;false
4a17b2b8bf25dd427788420d904d9cf0eca7d946ee3178a9e0c7a46c21aa56f9;Trotz Zollstreits: Chinas Außenhandel mit Rekordüberschuss;https://www.zeit.de/news/2026-01/14/chinas-aussenhandel-erreicht-2025-rekordueberschuss;Hier finden Sie Informationen zu dem Thema „Welthandel“. Lesen Sie jetzt „Trotz Zollstreits: Chinas Außenhandel mit Rekordüberschuss“.;Welthandel;News, Welthandel, China, Rekordüberschuss, Außenhandel, Importe;2026-01-14T08:30:05+01:00;2026-01-14T08:30:05+01:00;;dpa;false
423a24a27ff6696be858b51e0cf3a1b1b95b204f3c2d7d7cdc381b930e8d7846;Justizsenatorin: Linksextreme Szene stärker beobachten;https://www.zeit.de/news/2026-01/14/justizsenatorin-linksextreme-szene-staerker-beobachten;Hier finden Sie Informationen zu dem Thema „Extremismus“. Lesen Sie jetzt „Justizsenatorin: Linksextreme Szene stärker beobachten“.;Extremismus;News, Extremismus, Felor Badenberg, Berlin, Verfassungsschutz, Extremismus, Linksextremismus, Stromversorgung;2026-01-14T08:29:57+01:00;2026-01-14T08:29:57+01:00;;dpa Berlin/Brandenburg;false
974edd00920e86a84c103b763f9d0253c2cd21841963826c5874c5934bd3666d;Betrug bei Online-Verkauf: Frau verliert fast 2.000 Euro;https://www.zeit.de/news/2026-01/14/betrug-bei-online-verkauf-frau-verliert-fast-2-000-euro;Hier finden Sie Informationen zu dem Thema „Kriminalität“. Lesen Sie jetzt „Betrug bei Online-Verkauf: Frau verliert fast 2.000 Euro“.;Kriminalität;News, Kriminalität, Bad Berka, Polizei, Betrug, Kriminalität;2026-01-14T08:28:02+01:00;2026-01-14T08:28:02+01:00;;dpa Thüringen;false
9cc8c3a059940f814f6bce34f99838bdca278d95c3f1c384ad03974921d9b25d;USA fordern ihre Staatsbürger zur sofortigen Ausreise aus dem Iran auf;https://www.zeit.de/politik/ausland/2026-01/proteste-iran-usa-ausreise-donald-trump-gxe;"""Verlassen Sie den Iran jetzt"", heißt es in einer Mitteilung der US-Behörden an US-Bürger. Präsident Donald Trump bekräftigt seine Drohungen gegen das iranische Regime.";Proteste im Iran;Politik, Proteste im Iran, Iran, USA, Donald Trump, Demonstration, US-Regierung, Teheran;2026-01-14T08:25:22+01:00;2026-01-14T08:25:22+01:00;yer;DIE ZEIT,        dpa,        							yer;false
32ddfecd492ec8aa64716f486ee675f7d8425c296ef27cb0135a117270726b8f;Dieses Mal ist es anders;https://www.zeit.de/kultur/2026-01/iran-proteste-regime-wasserkrise-lebensmittel;Bisher demonstrierten die Menschen im Iran für Freiheit und Demokratie, nun protestieren sie aus purer Not. Das brutale Regime kämpft gegen sie – ums eigene Überleben.;"Z+ (abopflichtiger Inhalt);
        
    Proteste im Iran";Kultur, Proteste im Iran, Iran, Teheran, Protest, Demonstration, Wirtschaftskrise, Inflation;2026-01-14T08:21:23+01:00;2026-01-14T08:21:23+01:00;Natalie Amiri;;false
287e95e523df717ef30df2c586a4bdbd689e1dc009a84eb363c906da6867b50a;"Bellingham-Attacke nach Alonso-Aus: ""Haufen Scheiße""";https://www.zeit.de/news/2026-01/14/bellingham-attacke-nach-alonso-aus-haufen-scheisse;"Hier finden Sie Informationen zu dem Thema „Real Madrid“. Lesen Sie jetzt „Bellingham-Attacke nach Alonso-Aus: ""Haufen Scheiße""“.";Real Madrid;News, Real Madrid, Jude Bellingham, Xabi Alonso, Real Madrid, Borussia Dortmund, Haufen;2026-01-14T08:14:46+01:00;2026-01-14T08:14:46+01:00;;dpa Sport;false
783463e15dec7293c27e62b86667f0fed95f8f6533af68326ed9f899b06e6fce;"Lies: SPD-Pläne für Erbschaftsteuer sind ""gute Grundlage""";https://www.zeit.de/news/2026-01/14/lies-spd-plaene-fuer-erbschaftsteuer-sind-gute-grundlage;"Hier finden Sie Informationen zu dem Thema „Steuern“. Lesen Sie jetzt „Lies: SPD-Pläne für Erbschaftsteuer sind ""gute Grundlage""“.";Steuern;News, Steuern, Olaf Lie, Niedersachsen, SPD, Deutscher Bundestag, Erbschaftsteuer, Grundlage, Steuer;2026-01-14T08:13:54+01:00;2026-01-14T08:13:54+01:00;;dpa Niedersachsen;false
60929117aa5d280189d707c875d7a45b1f5721d9ee11a9fd2f37725e96c09091;Wildunfall stoppt Bahnverkehr zwischen Erfurt und Weimar;https://www.zeit.de/news/2026-01/14/wildunfall-stoppt-bahnverkehr-zwischen-erfurt-und-weimar;Hier finden Sie Informationen zu dem Thema „Unfälle“. Lesen Sie jetzt „Wildunfall stoppt Bahnverkehr zwischen Erfurt und Weimar“.;Unfälle;News, Unfälle, Erfurt, Weimar, Wildunfall, Bahnverkehr, Unfall, Bahnstrecke, Tiere;2026-01-14T08:00:34+01:00;2026-01-14T08:00:34+01:00;;dpa Thüringen;false
efcd45afaec592d609bf11933f3843f310e2c5ab8e2f711f1b14391a0562b320;NBA-Meister Oklahoma besiegt Angstgegner;https://www.zeit.de/news/2026-01/14/nba-meister-oklahoma-besiegt-angstgegner;Hier finden Sie Informationen zu dem Thema „Basketball“. Lesen Sie jetzt „NBA-Meister Oklahoma besiegt Angstgegner“.;Basketball;News, Basketball, Oklahoma, San Antonio, NBA, Oklahoma City Thunder, San Antonio Spurs, Basketball, Basketball-Superstar, Erfolg;2026-01-14T07:57:20+01:00;2026-01-14T07:57:20+01:00;;dpa Sport;false
