Hash;Title;Link;Description;Category;KeyWords;Published;LastUpdated;Author;Source;Paywall
b1d0506499e6a4d6f00b0381538fdaf84f56b69059181a90b3193945bee07804;"CSU setzt nach Bundestagswahl auf ""Zukunfts-SPD"" ohne Scholz";https://www.zeit.de/news/2024-11/18/csu-setzt-nach-bundestagswahl-auf-zukunfts-spd-ohne-scholz;"Hier finden Sie Informationen zu dem Thema „Neuwahl“. Lesen Sie jetzt „CSU setzt nach Bundestagswahl auf ""Zukunfts-SPD"" ohne Scholz“.";"Z+ (abopflichtiger Inhalt);
        
    
Neuwahl";News, Neuwahl, Markus Söder, München, CSU, SPD, Deutscher Bundestag, Bundestagswahl, Bürgergeld, Koalition;2024-11-18T12:21:02+01:00;2024-11-18T12:21:02+01:00;;dpa Bayern;false
8526a8a52322e98177571f9d4896b0474d718eacc557497ee888d7aec2fd8d3f;Sto streicht Jahresziele zusammen;https://www.zeit.de/news/2024-11/18/sto-streicht-jahresziele-zusammen;Hier finden Sie Informationen zu dem Thema „Bauzulieferer“. Lesen Sie jetzt „Sto streicht Jahresziele zusammen“.;"Z+ (abopflichtiger Inhalt);
        
    
Bauzulieferer";News, Bauzulieferer, Sto, Jahresziel, Nachholeffekten;2024-11-18T12:21:02+01:00;2024-11-18T12:21:02+01:00;;dpa Baden-Württemberg;false
49fed574a567e8963536a1ff2807475170621496df902be1ec7e1460219bf3aa;Kimmich wächst als Kapitän: Entpuppung eines Anführers;https://www.zeit.de/news/2024-11/18/kimmich-waechst-als-kapitaen-entpuppung-eines-anfuehrers;Hier finden Sie Informationen zu dem Thema „Fußball-Nationalmannschaft“. Lesen Sie jetzt „Kimmich wächst als Kapitän: Entpuppung eines Anführers“.;"Z+ (abopflichtiger Inhalt);
        
    
Fußball-Nationalmannschaft";News, Fußball-Nationalmannschaft, Joshua Kimmich, Julian Nagelsmann, Budapest, Bosnien-Herzegowina, Ungarn, ZDF, Deutscher Fußball-Bund, Länderspiel, Nations League, Entpuppung;2024-11-18T12:20:56+01:00;2024-11-18T12:20:56+01:00;;dpa Sport;false
ead015bcb7b48e8ef5e9fe6ef58c82c9d8fc48dfb6c6273bba5e3a066f9f0eb3;Heinz: Staatsanwaltschaften sollen 100 neue Stellen bekommen;https://www.zeit.de/news/2024-11/18/heinz-staatsanwaltschaften-sollen-100-neue-stellen-bekommen;Hier finden Sie Informationen zu dem Thema „Justiz“. Lesen Sie jetzt „Heinz: Staatsanwaltschaften sollen 100 neue Stellen bekommen“.;"Z+ (abopflichtiger Inhalt);
        
    
Justiz";News, Justiz, Christian Heinz, Heinz, Deutsche Presse-Agentur, CDU, Staatsanwaltschaft;2024-11-18T12:20:03+01:00;2024-11-18T12:20:03+01:00;;dpa Hessen;false
f65824c039cdd3ad7ada862779546998692e14b862208e196f965d50606e0a80;Zahl der Toten durch Flutkatastrophe steigt auf 227;https://www.zeit.de/gesellschaft/zeitgeschehen/2024-11/spanien-flut-valencia-tote-vermisste;Bei den Überschwemmungen im Osten Spaniens Ende Oktober sind mehr Menschen gestorben, als bisher bekannt war. 13 Personen werden weiterhin vermisst. ;"Z+ (abopflichtiger Inhalt);
        
    
Spanien";Gesellschaft, Spanien, Spanien, Valencia, Flutkatastrophe, Flut, Unwetter, Überschwemmung;2024-11-18T12:19:52+01:00;2024-11-18T12:19:52+01:00;ale;ZEIT ONLINE,        dpa,        							ale;false
ac82001bfb8f8fce4d7543bf59769b7a73994abfe85ccc802c3a9a146d1a5edd;Nervosität und Sky-Probleme vor dem Neustart der TV-Auktion;https://www.zeit.de/news/2024-11/18/nervositaet-und-sky-probleme-vor-dem-neustart-der-tv-auktion;Hier finden Sie Informationen zu dem Thema „Fußball im Fernsehen“. Lesen Sie jetzt „Nervosität und Sky-Probleme vor dem Neustart der TV-Auktion“.;"Z+ (abopflichtiger Inhalt);
        
    
Fußball im Fernsehen";News, Fußball im Fernsehen, Marco Klewenhagen, Großbritannien, DFL, DAZN, Nervosität, Fußball, Auktion, Geld;2024-11-18T12:19:50+01:00;2024-11-18T12:19:50+01:00;;dpa Sport;false
7155f3a9bcbf5b2b450b1de06fe4eb87c2f966d0079fb019ef0ddd26feb895cf;Windiges Wetter und Dauerregen im Schwarzwald;https://www.zeit.de/news/2024-11/18/windiges-wetter-und-dauerregen-im-schwarzwald;Hier finden Sie Informationen zu dem Thema „Vorhersage“. Lesen Sie jetzt „Windiges Wetter und Dauerregen im Schwarzwald“.;"Z+ (abopflichtiger Inhalt);
        
    
Vorhersage";News, Vorhersage, Schwarzwald, Baden-Württemberg, Dauerregen, Vorhersage, Wetter;2024-11-18T12:17:04+01:00;2024-11-18T12:17:04+01:00;;dpa Baden-Württemberg;false
9b59c21e9c2dfa387a740ce6da4f0ffe2485ff740dca6b77eb99955fef5c1d6b;Sylt ist für die kommende Sturmflutsaison gewappnet;https://www.zeit.de/news/2024-11/18/sylt-ist-fuer-die-kommende-sturmflutsaison-gewappnet;Hier finden Sie Informationen zu dem Thema „Küstenschutz“. Lesen Sie jetzt „Sylt ist für die kommende Sturmflutsaison gewappnet“.;"Z+ (abopflichtiger Inhalt);
        
    
Küstenschutz";News, Küstenschutz, Sylt, Landesbetrieb für Küstenschutz, Nationalpark und Meeresschutz Schleswig-Holstein, Sturmflutsaison, Sandaufspülung, Urlaubsinsel, Küstenschutz;2024-11-18T12:15:48+01:00;2024-11-18T12:15:48+01:00;;dpa Hamburg/Schleswig-Holstein;false
1a462f30a19870ded3907d359c5bba6f7c108f03276542e3b6d4747b90f976de;Im Land der Sinnermania;https://www.zeit.de/sport/2024-11/jannik-sinner-tennis-italien-atp-finals-doping;Italien liebt den derzeit besten Tennisprofi Jannik Sinner wie sonst nur seine Fußballer. Nun gewinnt er auch die ATP-Finals – über das Thema Doping wird geschwiegen.;"Z+ (abopflichtiger Inhalt);
        
    
Jannik Sinner";Sport, Jannik Sinner, Tennis, ATP-Turnier, Profisport, Italien, Doping;2024-11-18T12:14:16+01:00;2024-11-18T12:14:16+01:00;Jannik Schneider;;false
3a150c3116750bf3ddcc65bbf77f412d4622dfd15179c9c186e0bd7923c5af9a;Mehr als 450 Aussteller bei Freizeitmesse in Leipzig;https://www.zeit.de/news/2024-11/18/mehr-als-450-aussteller-bei-freizeitmesse-in-leipzig;Hier finden Sie Informationen zu dem Thema „Freizeitmesse“. Lesen Sie jetzt „Mehr als 450 Aussteller bei Freizeitmesse in Leipzig“.;"Z+ (abopflichtiger Inhalt);
        
    
Freizeitmesse";News, Freizeitmesse, Alexander Ege, Leipzig, Stuttgart, Freizeitmesse, Caravaning, Fahrzeug;2024-11-18T12:12:56+01:00;2024-11-18T12:12:56+01:00;;dpa Sachsen;false
6190f2f1667af62c2b8f914778dc323557f1c036eb3a568877be51b904d0f617;"Trainer Ilzer sieht Hoffenheim als ""Topchance""";https://www.zeit.de/news/2024-11/18/trainer-ilzer-sieht-hoffenheim-als-topchance;"Hier finden Sie Informationen zu dem Thema „Fußball-Bundesliga“. Lesen Sie jetzt „Trainer Ilzer sieht Hoffenheim als ""Topchance""“.";"Z+ (abopflichtiger Inhalt);
        
    
Fußball-Bundesliga";News, Fußball-Bundesliga, Christian Ilzer, Hoffenheim, Zuzenhausen, Graz, Österreich, Fußball-Bundesliga, TSG 1899 Hoffenheim, Bundesliga, Topchance;2024-11-18T12:10:30+01:00;2024-11-18T12:10:30+01:00;;dpa Sport;false
97837f6774d86d9c7943ca01be3f4fe6ad1802bbc4190d3b033b1c5fdb579b9b;Bundesregierung geht davon aus, dass China Drohnen an Russland liefert;https://www.zeit.de/politik/ausland/2024-11/ukraine-krieg-russland-china-drohnen-lieferung;"Eine Fabrik in China produziert laut Geheimdienstinformationen Drohnen für Russland. ""Das muss und wird Konsequenzen haben"", sagt Außenministerin Annalena Baerbock.";"Z+ (abopflichtiger Inhalt);
        
    
Ukrainekrieg";Politik, Ukrainekrieg, Annalena Baerbock, China, Russland, Drohne, Krieg in der Ukraine, Waffenlieferung;2024-11-18T12:08:36+01:00;2024-11-18T12:08:36+01:00;als;ZEIT ONLINE,        dpa,        							als;false
a123cacb0c08121f7180badc6cb271c76f2ffb67bb0bd179e2ffaa7b77456db0;Osnabrück holt ehemaligen Trainer Flottmann als Assistent;https://www.zeit.de/news/2024-11/18/osnabrueck-holt-ehemaligen-trainer-flottmann-als-assistent;Hier finden Sie Informationen zu dem Thema „3. Liga“. Lesen Sie jetzt „Osnabrück holt ehemaligen Trainer Flottmann als Assistent“.;"Z+ (abopflichtiger Inhalt);
        
    
3. Liga";News, 3. Liga, Heiko Flottmann, Osnabrück, VfL Osnabrück;2024-11-18T12:07:41+01:00;2024-11-18T12:07:41+01:00;;dpa Niedersachsen;false
29065eb14c12516c056266cb74318889b57394e0b524fd14b402bbcf8edc9d8e;Neuer Kampfhubschrauber nach elf Monaten ausgeliefert;https://www.zeit.de/news/2024-11/18/neuer-kampfhubschrauber-nach-elf-monaten-ausgeliefert;Hier finden Sie Informationen zu dem Thema „Bundeswehr-Milliardenauftrag“. Lesen Sie jetzt „Neuer Kampfhubschrauber nach elf Monaten ausgeliefert“.;"Z+ (abopflichtiger Inhalt);
        
    
Bundeswehr-Milliardenauftrag";News, Bundeswehr-Milliardenauftrag, Boris Pistorius, Donauwörth, Airbus S. A. S., Bundeswehr, SPD, Kampfhubschrauber, Militär, Hubschrauber;2024-11-18T12:06:56+01:00;2024-11-18T12:06:56+01:00;;dpa Bayern;false
e1a94a8f434920aed039cd6aea03a3934483fab0d78f9aab3ce719009aea1ae8;Schnelle Messer-Verbote am Kottbusser Tor und Görlitzer Park;https://www.zeit.de/news/2024-11/18/bald-messer-verbote-am-kottbusser-tor-und-goerlitzer-park;Hier finden Sie Informationen zu dem Thema „Kriminalität“. Lesen Sie jetzt „Schnelle Messer-Verbote am Kottbusser Tor und Görlitzer Park“.;"Z+ (abopflichtiger Inhalt);
        
    
Kriminalität";News, Kriminalität, Christian Hochgrebe, Barbara Slowik, Kreuzberg, Görlitzer Park, Berliner Senat, SPD, Verbotszone, Kriminalität;2024-11-18T12:00:40+01:00;2024-11-18T12:00:40+01:00;;dpa Berlin/Brandenburg;false
5340b6041a8f61e218af7a3e61af83bec3360e42389224c613c931744436d856;"Geyer kritisiert ""Ränkespiele"" bei Dynamo Dresden";https://www.zeit.de/news/2024-11/18/geyer-kritisiert-raenkespiele-bei-dynamo-dresden;"Hier finden Sie Informationen zu dem Thema „Unruhe im Vorstand“. Lesen Sie jetzt „Geyer kritisiert ""Ränkespiele"" bei Dynamo Dresden“.";"Z+ (abopflichtiger Inhalt);
        
    
Unruhe im Vorstand";News, Unruhe im Vorstand, Eduard Geyer, Holger Scholze, Geyer, Dresden, Dynamo Dresden, Ränkespiel;2024-11-18T11:55:14+01:00;2024-11-18T11:55:14+01:00;;dpa Sachsen;false
b79037ab54cfb6468f63683946fdbd69b0008f35c35d393e3ae148ec5525204b;Saga und Quantum übernehmen Paloma-Viertel;https://www.zeit.de/news/2024-11/18/saga-und-quantum-uebernehmen-paloma-viertel;Hier finden Sie Informationen zu dem Thema „Wohnungsbau“. Lesen Sie jetzt „Saga und Quantum übernehmen Paloma-Viertel“.;"Z+ (abopflichtiger Inhalt);
        
    
Wohnungsbau";News, Wohnungsbau, Hamburg, Spielbudenplatz, Quantum, Wohnungsbau, Brachfläche;2024-11-18T11:52:58+01:00;2024-11-18T11:52:58+01:00;;dpa Hamburg/Schleswig-Holstein;false
dcdeeed645b4fae50b843e0577685bdcf19c16b8011d1127099c9f7f70d0c4b0;Huthi-Miliz verschickt Droh-Mails an deutsche Reedereien;https://www.zeit.de/wirtschaft/2024-11/huthi-miliz-droh-mails-deutsche-redereien;Schifffahrtsbetriebe, die israelische Häfen anlaufen und in Meeren nahe Jemen unterwegs sind, haben Drohungen erhalten. Viele deutsche Reedereien umfahren das Rote Meer. ;"Z+ (abopflichtiger Inhalt);
        
    
Jemen";Wirtschaft, Jemen, Drohung, Huthi, Schifffahrt, Nahostkonflikt, Israel, Jemen;2024-11-18T11:52:21+01:00;2024-11-18T11:52:21+01:00;dar;ZEIT ONLINE,        dpa,        AFP,        							dar;false
4c6acc636dec839db67becd98789a68e1a2b63b4f0c94dd65872e6e3e716ef7d;Wanderer stirbt in den Alpen bei Sturz in die Tiefe;https://www.zeit.de/news/2024-11/17/wander-stirbt-in-den-alpen-bei-sturz-in-die-tiefe;Hier finden Sie Informationen zu dem Thema „Unglück in den Bergen“. Lesen Sie jetzt „Wanderer stirbt in den Alpen bei Sturz in die Tiefe“.;"Z+ (abopflichtiger Inhalt);
        
    
Unglück in den Bergen";News, Unglück in den Bergen, Alpen, Baden-Württemberg, Unglück;2024-11-18T11:49:06+01:00;2024-11-18T11:49:06+01:00;;dpa Baden-Württemberg;false
336b2d5ba8777865ed0d2b4aae05d548eb5a0fd053afd7602c3c5e05ddf5c11f;Chef der Berliner Wasserbetriebe geht vorzeitig;https://www.zeit.de/news/2024-11/18/chef-der-berliner-wasserbetriebe-geht-vorzeitig;Hier finden Sie Informationen zu dem Thema „Versorgungsunternehmen“. Lesen Sie jetzt „Chef der Berliner Wasserbetriebe geht vorzeitig“.;"Z+ (abopflichtiger Inhalt);
        
    
Versorgungsunternehmen";News, Versorgungsunternehmen, Christoph Donner, Berliner Wasserbetriebe, Versorgungsunternehmen;2024-11-18T11:48:37+01:00;2024-11-18T11:48:37+01:00;;dpa Berlin/Brandenburg;false
5249444465f24d1206693d5a5666b43ce0cab5affde9b2b864c052d5e2819830;Oberschenkel-Fund in Berliner Park - Leiche fehlt weiterhin;https://www.zeit.de/news/2024-11/18/oberschenkel-fund-in-berliner-park-leiche-fehlt-weiterhin;Hier finden Sie Informationen zu dem Thema „Ungeklärter Kriminalfall“. Lesen Sie jetzt „Oberschenkel-Fund in Berliner Park - Leiche fehlt weiterhin“.;"Z+ (abopflichtiger Inhalt);
        
    
Ungeklärter Kriminalfall";News, Ungeklärter Kriminalfall, Berlin, Staatsanwaltschaft, Kriminalfall, Oberschenkel;2024-11-18T11:45:09+01:00;2024-11-18T11:45:09+01:00;;dpa Berlin/Brandenburg;false
f9962be4e98f052835fc2f86b890ff79e3f6fe47174cf749d033e7a3e62e901c;"Handball-Chef über Missbrauch: ""Haben strukturelles Problem""";https://www.zeit.de/news/2024-11/18/handball-chef-ueber-missbrauch-haben-strukturelles-problem;"Hier finden Sie Informationen zu dem Thema „Handball“. Lesen Sie jetzt „Handball-Chef über Missbrauch: ""Haben strukturelles Problem""“.";"Z+ (abopflichtiger Inhalt);
        
    
Handball";News, Handball, Andreas Michelmann, André Fuhr, Katholische Kirche, DHB, Missbrauch, Handball;2024-11-18T11:44:20+01:00;2024-11-18T11:44:20+01:00;;dpa Nordrhein-Westfalen;false
48d0651de3cc0cc1c3cad254adaf35de1559bc8c726a1b3044f65480f8822f20;Polizei holt Tesla-Gegner in Grünheide von Baumhäusern;https://www.zeit.de/news/2024-11/18/polizei-holt-tesla-gegner-in-gruenheide-von-baumhaeusern;Hier finden Sie Informationen zu dem Thema „Tesla-Erweiterung“. Lesen Sie jetzt „Polizei holt Tesla-Gegner in Grünheide von Baumhäusern“.;"Z+ (abopflichtiger Inhalt);
        
    
Tesla-Erweiterung";News, Tesla-Erweiterung, Grünheide, Polizei, Baumhaus, Sondierungsarbeit, Wald;2024-11-18T11:44:02+01:00;2024-11-18T11:44:02+01:00;;dpa Berlin/Brandenburg;false
030bbd4bb0d5d9ddc7f4deaadaff1530b67b5062c7897cf69cdd647cb3344919;Zahl der Toten nach Unwettern in Spanien jetzt bei 227;https://www.zeit.de/news/2024-11/18/zahl-der-toten-nach-unwettern-in-spanien-jetzt-bei-227;Hier finden Sie Informationen zu dem Thema „Immer noch Vermisste“. Lesen Sie jetzt „Zahl der Toten nach Unwettern in Spanien jetzt bei 227“.;"Z+ (abopflichtiger Inhalt);
        
    
Immer noch Vermisste";News, Immer noch Vermisste, Spanien, Valencia, X, Unwetter, Überschwemmung;2024-11-18T11:43:21+01:00;2024-11-18T11:43:21+01:00;;dpa;false
c37a987eb18c19bd6113cf6c3f1c4493ab5ba5abd1ec7657e0535a0c9560bde2;Linke-Chefin warnt vor Wahlkampf nach amerikanischem Vorbild;https://www.zeit.de/news/2024-11/18/linke-chefin-warnt-vor-wahlkampf-nach-amerikanischem-vorbild;Hier finden Sie Informationen zu dem Thema „Bundestagswahl“. Lesen Sie jetzt „Linke-Chefin warnt vor Wahlkampf nach amerikanischem Vorbild“.;"Z+ (abopflichtiger Inhalt);
        
    
Bundestagswahl";News, Bundestagswahl, Ines Schwerdtner, Deutsche Presse-Agentur, Die Linke, Bundestagswahl, Bundestagswahlkampf, Wahlkampf;2024-11-18T11:42:01+01:00;2024-11-18T11:42:01+01:00;;dpa Sachsen;false
41acc7d164928a7be5e6cdede53f607cb7debbdc1f1aaba19eeb4679156601b8;Zahl der Solaranlagen in Thüringen regelrecht explodiert;https://www.zeit.de/news/2024-11/17/zahl-der-solaranlagen-in-thueringen-regelrecht-explodiert;Hier finden Sie Informationen zu dem Thema „Solarstrom“. Lesen Sie jetzt „Zahl der Solaranlagen in Thüringen regelrecht explodiert“.;"Z+ (abopflichtiger Inhalt);
        
    
Solarstrom";News, Solarstrom, Thüringen, Solaranlage, Solarstrom;2024-11-18T11:40:31+01:00;2024-11-18T11:40:31+01:00;;dpa Thüringen;false
4c61448160cf148ce9535c8206e756ceac36bc49fe0868d76848249128ba618b;Verhandlung zu Ex-Gleichstellungsbeauftragten im April;https://www.zeit.de/news/2024-11/18/verhandlung-zu-ex-gleichstellungsbeauftragten-im-april;Hier finden Sie Informationen zu dem Thema „Erfurter Personalie“. Lesen Sie jetzt „Verhandlung zu Ex-Gleichstellungsbeauftragten im April“.;"Z+ (abopflichtiger Inhalt);
        
    
Erfurter Personalie";News, Erfurter Personalie, Mary-Ellen Witzmann, Erfurt, Verhandlung;2024-11-18T11:37:19+01:00;2024-11-18T11:37:19+01:00;;dpa Thüringen;false
1a9f87d650da8892a41aa42de4214f67bcd800a60df180cc82e4cc96fe2d2cc2;Koalition streitet über Vergabegesetz in Sachsen-Anhalt;https://www.zeit.de/news/2024-11/18/koalition-streitet-ueber-vergabegesetz-in-sachsen-anhalt;Hier finden Sie Informationen zu dem Thema „Wirtschaftspolitik“. Lesen Sie jetzt „Koalition streitet über Vergabegesetz in Sachsen-Anhalt“.;"Z+ (abopflichtiger Inhalt);
        
    
Wirtschaftspolitik";News, Wirtschaftspolitik, Guido Heuer, Sachsen-Anhalt, FDP, CDU, Vergabegesetz, Wirtschaftspolitik, Kommune, Koalition, Kritik, Krise;2024-11-18T11:36:04+01:00;2024-11-18T11:36:04+01:00;;dpa Sachsen;false
dd23cc06c7d50dc132bad89a082944291a9b7fbb33ac5ca52c5c08d05547f1c2;Commerzbank betont Eigenständigkeit;https://www.zeit.de/news/2024-11/18/commerzbank-betont-eigenstaendigkeit;Hier finden Sie Informationen zu dem Thema „Banken-Hochzeit?“. Lesen Sie jetzt „Commerzbank betont Eigenständigkeit“.;"Z+ (abopflichtiger Inhalt);
        
    
Banken-Hochzeit?";News, Banken-Hochzeit?, Bettina Orlopp, Frankfurt, Commerzbank, Unicredit, Eigenständigkeit, Begehrlichkeit;2024-11-18T11:35:06+01:00;2024-11-18T11:35:06+01:00;;dpa Hessen;false
784f38d31076e48d2efd1f434e145a1e5671f3a7d90b533a5aa2a09bccc491b4;Krankenhauskosten in Sachsen-Anhalt steigen um 5,4 Prozent;https://www.zeit.de/news/2024-11/18/krankenhauskosten-in-sachsen-anhalt-steigen-um-5-4-prozent;Hier finden Sie Informationen zu dem Thema „Gesundheit“. Lesen Sie jetzt „Krankenhauskosten in Sachsen-Anhalt steigen um 5,4 Prozent“.;"Z+ (abopflichtiger Inhalt);
        
    
Gesundheit";News, Gesundheit, Sachsen-Anhalt, Krankenhauskosten;2024-11-18T11:32:26+01:00;2024-11-18T11:32:26+01:00;;dpa Sachsen;false
2774b981a8e4636a9215fb6fb27c99e4f9d063486c54ad06849fdeff4a69b8a0;Verbraucherzentrale mahnt Jugendschutz bei E-Zigaretten an;https://www.zeit.de/news/2024-11/18/verbraucherzentrale-mahnt-jugendschutz-bei-e-zigaretten-an;Hier finden Sie Informationen zu dem Thema „Vapes“. Lesen Sie jetzt „Verbraucherzentrale mahnt Jugendschutz bei E-Zigaretten an“.;"Z+ (abopflichtiger Inhalt);
        
    
Vapes";News, Vapes, Heike Silber, Stuttgart, Verbraucherzentrale, Verbraucherzentrale Baden-Württemberg, Jugendschutz, Zigarette;2024-11-18T11:31:22+01:00;2024-11-18T11:31:22+01:00;;dpa Baden-Württemberg;false
217b8e457e8ccc29d4b54495a7fcaeccea05fabcf7d9f824d78f3e182bc20e54;Ein Toter nach Brand in Offenburg;https://www.zeit.de/news/2024-11/18/ein-toter-nach-brand-in-offenburg;Hier finden Sie Informationen zu dem Thema „Feuer“. Lesen Sie jetzt „Ein Toter nach Brand in Offenburg“.;"Z+ (abopflichtiger Inhalt);
        
    
Feuer";News, Feuer, Offenburg, Ortenaukreis, Feuerwehr, Polizei, Kellerwohnung;2024-11-18T11:24:59+01:00;2024-11-18T11:24:59+01:00;;dpa Baden-Württemberg;false
c1346459d0eb869791a849d7ca060e658dbdce70ef629a8ec0b398329cb45a2d;Taifun wütet auf Philippinen - Acht Tote;https://www.zeit.de/news/2024-11/18/taifun-wuetet-auf-philippinen-acht-tote;Hier finden Sie Informationen zu dem Thema „Unwetter“. Lesen Sie jetzt „Taifun wütet auf Philippinen - Acht Tote“.;"Z+ (abopflichtiger Inhalt);
        
    
Unwetter";News, Unwetter, Philippinen, Taifun, Supertaifun, Unwetter;2024-11-18T11:21:47+01:00;2024-11-18T11:21:47+01:00;;dpa;false
c55e340d2476f5466251bce459e12fe1a5b337534fd2cb110e0939edbe0550bb;Mord an Ex-Freundin - Verurteilter legt Revision ein;https://www.zeit.de/news/2024-11/18/mord-an-ex-freundin-verurteilter-legt-revision-ein;Hier finden Sie Informationen zu dem Thema „Urteil muss überprüft werden“. Lesen Sie jetzt „Mord an Ex-Freundin - Verurteilter legt Revision ein“.;"Z+ (abopflichtiger Inhalt);
        
    
Urteil muss überprüft werden";News, Urteil muss überprüft werden, Bayreuth, Mord, Freiheitsstrafe;2024-11-18T11:21:40+01:00;2024-11-18T11:21:40+01:00;;dpa Bayern;false
9cc57c029b9ebe8240723bfd58d3b6d5c1c687b03b09e45cd4b7a515dba63be6;Tod einer 90-Jährigen - Nachbar schweigt zu Mordvorwürfen;https://www.zeit.de/news/2024-11/18/tod-einer-90-jaehrigen-nachbar-schweigt-zu-mordvorwuerfen;Hier finden Sie Informationen zu dem Thema „Prozessbeginn in Bonn“. Lesen Sie jetzt „Tod einer 90-Jährigen - Nachbar schweigt zu Mordvorwürfen“.;"Z+ (abopflichtiger Inhalt);
        
    
Prozessbeginn in Bonn";News, Prozessbeginn in Bonn, Bonn, Königswinter, Mordvorwurf, Prozessbeginn;2024-11-18T11:19:05+01:00;2024-11-18T11:19:05+01:00;;dpa Nordrhein-Westfalen;false
ccf870dadd070531160835831a4b4a5c51c2c975489b0740a7ab68fc2cee2e46;Dreijährige setzt Notruf in Jena ab - Polizeieinsatz;https://www.zeit.de/news/2024-11/18/dreijaehrige-setzt-notruf-in-jena-ab-polizeieinsatz;Hier finden Sie Informationen zu dem Thema „Kurioses“. Lesen Sie jetzt „Dreijährige setzt Notruf in Jena ab - Polizeieinsatz“.;"Z+ (abopflichtiger Inhalt);
        
    
Kurioses";News, Kurioses, Jena, Polizei, Polizeieinsatz, Auto;2024-11-18T11:18:30+01:00;2024-11-18T11:18:30+01:00;;dpa Thüringen;false
0771a74fbdbbacbc99fef048c55d97fc818228b479d67c0932f07f47501efb1b;Mann flüchtet mit 140 Kilometern pro Stunde vor Polizei;https://www.zeit.de/news/2024-11/18/mann-fluechtet-mit-140-kilometern-pro-stunde-vor-polizei;Hier finden Sie Informationen zu dem Thema „Kriminalität“. Lesen Sie jetzt „Mann flüchtet mit 140 Kilometern pro Stunde vor Polizei“.;"Z+ (abopflichtiger Inhalt);
        
    
Kriminalität";News, Kriminalität, Oberpfalz, Polizei, Kriminalität, Auto;2024-11-18T11:16:17+01:00;2024-11-18T11:16:17+01:00;;dpa Bayern;false
8e640f9f4511abe8f24c5027640db408c6149e7396311afe6ff7c4a905af1325;BUND klagt gegen Fangerlaubnis in Nordsee-Schutzgebiet;https://www.zeit.de/news/2024-11/18/bund-klagt-gegen-fangerlaubnis-in-nordsee-schutzgebiet;Hier finden Sie Informationen zu dem Thema „Fischerei“. Lesen Sie jetzt „BUND klagt gegen Fangerlaubnis in Nordsee-Schutzgebiet“.;"Z+ (abopflichtiger Inhalt);
        
    
Fischerei";News, Fischerei, Olaf Bandt, Nordsee, Hamburg, Spanien, BUND, Bund für Umwelt und Naturschutz, Verwaltungsgericht, Bundesregierung, Fangerlaubnis, Fischerei;2024-11-18T11:16:12+01:00;2024-11-18T11:16:12+01:00;;dpa Hamburg/Schleswig-Holstein;false
ab62139f1ad1905120d5a8030ab7ca9909047042b182666daa75e1c0cc8b3c2f;Bayern-Stars spielen gegen Augsburg auf neuem Rasen;https://www.zeit.de/news/2024-11/18/bayern-stars-spielen-gegen-augsburg-auf-neuem-rasen;Hier finden Sie Informationen zu dem Thema „Fußball-Bundesliga“. Lesen Sie jetzt „Bayern-Stars spielen gegen Augsburg auf neuem Rasen“.;"Z+ (abopflichtiger Inhalt);
        
    
Fußball-Bundesliga";News, Fußball-Bundesliga, Augsburg, Allianz Arena, Fußball-Bundesliga, FC Bayern München, FC Augsburg, Bundesliga;2024-11-18T11:09:39+01:00;2024-11-18T11:09:39+01:00;;dpa Bayern;false
b0a6ad2154cdb10a0cb48af6e2f93b99495a26e35fe1eff5e542a847f74d2360;EZB-Vize: Handelskonflikte Gefahr für Euro-Wirtschaft;https://www.zeit.de/news/2024-11/18/ezb-vize-handelskonflikte-gefahr-fuer-euro-wirtschaft;Hier finden Sie Informationen zu dem Thema „Konjunktur“. Lesen Sie jetzt „EZB-Vize: Handelskonflikte Gefahr für Euro-Wirtschaft“.;"Z+ (abopflichtiger Inhalt);
        
    
Konjunktur";News, Konjunktur, Donald Trump, Luis de Guindos, Frankfurt, EZB, Handelskonflikt, Euroraum;2024-11-18T11:04:04+01:00;2024-11-18T11:04:04+01:00;;dpa;false
fd3d318f188ad033a6927c715dfd362510179a9b13c1ba42146031c64ea9fdf7;Haushaltsabfälle in Sachsen-Anhalt auf Vorjahresniveau;https://www.zeit.de/news/2024-11/18/haushaltsabfaelle-in-sachsen-anhalt-auf-vorjahresniveau;Hier finden Sie Informationen zu dem Thema „Abfall“. Lesen Sie jetzt „Haushaltsabfälle in Sachsen-Anhalt auf Vorjahresniveau“.;"Z+ (abopflichtiger Inhalt);
        
    
Abfall";News, Abfall, Sachsen-Anhalt, Haushaltsabfall, Vorjahresniveau, Abfall;2024-11-18T11:02:45+01:00;2024-11-18T11:02:45+01:00;;dpa Sachsen;false
d2b53d8fd8e5c5953d96cf12698bd81c31b69415ee72581be45c0006a6ca3e45;Frau in Berlin erstochen - Ex-Mann wegen Mordes angeklagt;https://www.zeit.de/news/2024-11/18/frau-in-berlin-erstochen-ex-mann-wegen-mordes-angeklagt;Hier finden Sie Informationen zu dem Thema „Femizid“. Lesen Sie jetzt „Frau in Berlin erstochen - Ex-Mann wegen Mordes angeklagt“.;"Z+ (abopflichtiger Inhalt);
        
    
Femizid";News, Femizid, Berlin, Berlin-Zehlendorf, Staatsanwaltschaft, Mord, Femizid;2024-11-18T10:55:35+01:00;2024-11-18T10:55:35+01:00;;dpa Berlin/Brandenburg;false
016ddf060c78648f488cd465fce8a68b7821fcb12e360cecdb7655a93fda1f8b;Unfall mit sechs Toten: Ursache weiter unklar;https://www.zeit.de/news/2024-11/18/unfall-mit-sechs-toten-ursache-weiter-unklar;Hier finden Sie Informationen zu dem Thema „Auto im Gegenverkehr“. Lesen Sie jetzt „Unfall mit sechs Toten: Ursache weiter unklar“.;"Z+ (abopflichtiger Inhalt);
        
    
Auto im Gegenverkehr";News, Auto im Gegenverkehr, Münsterland, Polizei, Unfall, Gegenverkehr, Auto;2024-11-18T10:54:23+01:00;2024-11-18T10:54:23+01:00;;dpa Nordrhein-Westfalen;false
67db170e6908ed1d68940b64e26dc6bddd264c5ada875b0ec6505f89846bdc3e;Polizei-Einsatz im Tesla-Protestcamp in Grünheide;https://www.zeit.de/news/2024-11/18/polizei-einsatz-im-tesla-protestcamp-in-gruenheide;Hier finden Sie Informationen zu dem Thema „Tesla-Erweiterung“. Lesen Sie jetzt „Polizei-Einsatz im Tesla-Protestcamp in Grünheide“.;"Z+ (abopflichtiger Inhalt);
        
    
Tesla-Erweiterung";News, Tesla-Erweiterung, Grünheide, Polizei, Protestcamp, Sondierungsfläche, Wald;2024-11-18T10:53:55+01:00;2024-11-18T10:53:55+01:00;;dpa Berlin/Brandenburg;false
