Hash;Title;Link;Description;Category;KeyWords;Published;LastUpdated;Author;Source;Paywall
48303a47bbb04141eb8bb401db53d150af886a548402baa3b4c630fe79146ce3;Österreich prüft Entzug der Staatsbürgerschaft von Jan Marsalek;https://www.zeit.de/politik/ausland/2025-10/jan-marsalek-wirecard-oesterreich-staatsbuergerschaft;Der frühere Wirecard-Manager Jan Marsalek arbeitet Medienberichten zufolge für den russischen Geheimdienst. Nun könnte ihm dafür die Staatsbürgerschaft entzogen werden.;Wirecard;Politik, Wirecard, Jan Marsalek, Österreich, Wirecard, Geheimdienst, Staatsbürgerschaft, Entzug;2025-10-07T11:02:59+02:00;2025-10-07T11:02:59+02:00;lk;DIE ZEIT,        Reuters,        							lk;false
04b9ea33779633ab769260c924b6991a9d904d7ba40647667b6f79c0151c8aba;Landeselternrat kritisiert AfD-Vorstoß zu Lehrkräften;https://www.zeit.de/news/2025-10/07/landeselternrat-kritisiert-afd-vorstoss-zu-lehrkraeften;Hier finden Sie Informationen zu dem Thema „Schulen“. Lesen Sie jetzt „Landeselternrat kritisiert AfD-Vorstoß zu Lehrkräften“.;Schulen;News, Schulen, Sachsen-Anhalt, Alternative für Deutschland;2025-10-07T11:01:17+02:00;2025-10-07T11:01:17+02:00;;dpa Sachsen;false
0c07c71c9af1cbd093ec6c1d01dbf9be4cf9ce83f3efa744b438353730400d5c;Gutachten führt Baumgartners Absturz auf menschliches Versagen zurück;https://www.zeit.de/sport/2025-10/felix-baumgartner-absturz-technisches-gutachten;Der Gleitschirm des Extremsportlers Felix Baumgartner, mit dem er abstürzte und starb, war laut technischem Gutachten einwandfrei. Das Verfahren soll eingestellt werden.;Felix Baumgartner;Sport, Felix Baumgartner, Felix Baumgartner, Raffaelle Iannella, Italien, Fermo, Staatsanwaltschaft, Absturz, Gleitschirm;2025-10-07T11:00:17+02:00;2025-10-07T11:00:17+02:00;akm;DIE ZEIT,        dpa,        							akm;false
080ca7489e969f5ea1b1973ed952ed4ed0962c2fb1abeeedefcfc8678adca086;Bundeskanzler Merz trifft Bremer Senat in Bremerhaven;https://www.zeit.de/news/2025-10/07/bundeskanzler-merz-trifft-bremer-senat-in-bremerhaven;Hier finden Sie Informationen zu dem Thema „Land Bremen“. Lesen Sie jetzt „Bundeskanzler Merz trifft Bremer Senat in Bremerhaven“.;Land Bremen;News, Land Bremen, Friedrich Merz, Bremerhaven, Bremen, CDU, Senat;2025-10-07T10:58:43+02:00;2025-10-07T10:58:43+02:00;;dpa Niedersachsen;false
f377bf08062eb494b0f6edc02eba1dcc1e69fe70ae9c7ab2038204528430766c;Impfungen am 8. Oktober bis spät am Abend möglich;https://www.zeit.de/news/2025-10/07/impfungen-am-8-oktober-bis-spaet-am-abend-moeglich;Hier finden Sie Informationen zu dem Thema „Start der Impfsaison“. Lesen Sie jetzt „Impfungen am 8. Oktober bis spät am Abend möglich“.;Start der Impfsaison;News, Start der Impfsaison, Impfung, Impfsaison, Apotheke, Coronavirus;2025-10-07T10:54:44+02:00;2025-10-07T10:54:44+02:00;;dpa;false
833fbd036fd264464b736a73c161f849b6949368ad6721733f134bfe6d317d79;Berliner Senat will Drohnenabwehr stärken;https://www.zeit.de/news/2025-10/07/berliner-senat-will-drohnenabwehr-staerken;Hier finden Sie Informationen zu dem Thema „Luftverkehr“. Lesen Sie jetzt „Berliner Senat will Drohnenabwehr stärken“.;Luftverkehr;News, Luftverkehr, Iris Spranger, Berlin, Berliner Senat, Europameisterschaft, Drohnenabwehr, Luftverkehr, Abwehrtechnik, Drohne;2025-10-07T10:51:59+02:00;2025-10-07T10:51:59+02:00;;dpa Berlin/Brandenburg;false
ea9f8f78adc6bdbf30df4821da75b3f453b8fbed33708b92d3a0a5f32a6cb96c;Journalist Franz Josef Wagner ist tot;https://www.zeit.de/kultur/2025-10/franz-josef-wagner-gestorben-bild-kolumnist;"Jahrzehntelang prägte er den deutschen Boulevardjournalismus. Nun ist ""Bild""-Kolumnist Franz Josef Wagner im Alter von 82 Jahren gestorben.";Franz Josef Wagner;Kultur, Franz Josef Wagner, Franz Josef Wagner, Bildzeitung, Boulevardjournalismus;2025-10-07T10:51:35+02:00;2025-10-07T10:51:35+02:00;yer;DIE ZEIT,        							yer;false
29b72c9e2be3a957495eea6d292ea98cf0b1adc94e40d262e0bdf1300033f51b;Französischer Ex-Premier fordert vorgezogene Präsidentschaftswahl;https://www.zeit.de/politik/ausland/2025-10/frankreich-regierungskrise-edouard-philippe-praesidentschaftswahl;Wegen der Regierungskrise in Frankreich verlangt Ex-Premierminister Édouard Philippe frühere Präsidentschaftswahlen. Zuerst solle aber der Haushalt beschlossen werden.;Regierungskrise in Frankreich;Politik, Regierungskrise in Frankreich, Edouard Philippe, Frankreich, Haushalt, Premierminister, Präsidentschaft, Emmanuel Macron;2025-10-07T10:48:57+02:00;2025-10-07T10:48:57+02:00;maw;DIE ZEIT,        AFP,        							maw;false
84b16f60d0a5fc178ef3873f3f4b071880e84948ae167762857e0134939b4ebf;Unbekannte besprühen Kieler Landtag mit Pro-Gaza-Parolen;https://www.zeit.de/news/2025-10/07/unbekannte-bespruehen-kieler-landtag-mit-pro-gaza-parolen;Hier finden Sie Informationen zu dem Thema „Kriminalität“. Lesen Sie jetzt „Unbekannte besprühen Kieler Landtag mit Pro-Gaza-Parolen“.;Kriminalität;News, Kriminalität, Israel, Gazastreifen, Deutsche Presse-Agentur, Landtag, Kriminalität;2025-10-07T10:48:53+02:00;2025-10-07T10:48:53+02:00;;dpa Hamburg/Schleswig-Holstein;false
11906f43570d38c7964ef787dd8d60751abec6037e2a8bdaf2ba28250689613e;Mann prallt mit Auto gegen Lastwagen - Ehefrau stirbt;https://www.zeit.de/news/2025-10/07/mann-prallt-mit-auto-gegen-lastwagen-ehefrau-stirbt;Hier finden Sie Informationen zu dem Thema „Fahrer schwerst verletzt“. Lesen Sie jetzt „Mann prallt mit Auto gegen Lastwagen - Ehefrau stirbt“.;Fahrer schwerst verletzt;News, Fahrer schwerst verletzt, Österreich, Polizei, Auto, Grenze;2025-10-07T10:48:23+02:00;2025-10-07T10:48:23+02:00;;dpa Bayern;false
7bacde5cdfd218cee1186f0952f9e97e211a95a2222ae1018a30926e725850e5;Prozess um Armbrust-Mord in Klinik gestartet;https://www.zeit.de/news/2025-10/07/prozess-um-armbrust-mord-in-klinik-gestartet;Hier finden Sie Informationen zu dem Thema „Justiz“. Lesen Sie jetzt „Prozess um Armbrust-Mord in Klinik gestartet“.;Justiz;News, Justiz, Zwesten, Kassel, Schwalm-Eder-Kreis, Erbstreitigkeit;2025-10-07T10:48:15+02:00;2025-10-07T10:48:15+02:00;;dpa Hessen;false
ddee5881ad07b3cd1788161fba5672e63cb948dcfa23cfb240fbfcf06d898191;Pflegerin findet toten Menschen und Spuren eines Brandes;https://www.zeit.de/news/2025-10/07/pflegerin-findet-toten-menschen-und-spuren-eines-brandes;Hier finden Sie Informationen zu dem Thema „Brand bereits aus“. Lesen Sie jetzt „Pflegerin findet toten Menschen und Spuren eines Brandes“.;Brand bereits aus;News, Brand bereits aus, Brandspur;2025-10-07T10:47:27+02:00;2025-10-07T10:47:27+02:00;;dpa Hamburg/Schleswig-Holstein;false
4115325d34526266758b4c656a916262a757b81d2ad4e66e0ca1649049e1df00;Dachgeschossbrand verursacht großen Schaden;https://www.zeit.de/news/2025-10/07/dachgeschossbrand-verursacht-grossen-schaden;Hier finden Sie Informationen zu dem Thema „Wetteraukreis“. Lesen Sie jetzt „Dachgeschossbrand verursacht großen Schaden“.;Wetteraukreis;News, Wetteraukreis, Wetteraukreis, Dachgeschossbrand, Dachgeschoss;2025-10-07T10:47:03+02:00;2025-10-07T10:47:03+02:00;;dpa Hessen;false
84f8963731c1710908f51859586c9662e12320ac371ec710496a1fda332b852e;Unternehmer Reinhold Würth trauert um seine Tochter;https://www.zeit.de/news/2025-10/07/unternehmer-reinhold-wuerth-trauert-um-seine-tochter;Hier finden Sie Informationen zu dem Thema „Todesfall“. Lesen Sie jetzt „Unternehmer Reinhold Würth trauert um seine Tochter“.;Todesfall;News, Todesfall, Reinhold Würth, Marion Würth, Todesfall;2025-10-07T10:45:27+02:00;2025-10-07T10:45:27+02:00;;dpa Baden-Württemberg;false
95b0190a2778c6048946e11dc085bf3019e8a2c593faee336b42b0f1691e7e89;"""Bild""-Kolumnist Franz Josef Wagner gestorben";https://www.zeit.de/news/2025-10/07/bild-kolumnist-franz-josef-wagner-gestorben;"Hier finden Sie Informationen zu dem Thema „Medien“. Lesen Sie jetzt „""Bild""-Kolumnist Franz Josef Wagner gestorben“.";Medien;News, Medien, Franz Josef Wagner, Bildzeitung, Springer-Verlag;2025-10-07T10:45:16+02:00;2025-10-07T10:45:16+02:00;;dpa;false
5fbaf9efacec1637ad7ebc905633993f066346acb71fc5de1fc06c357ea35187;Blockade und propalästinensische Parolen bei Oberbaumbrücke;https://www.zeit.de/news/2025-10/07/blockade-und-propalaestinensische-parolen-bei-oberbaumbruecke;Hier finden Sie Informationen zu dem Thema „Festnahmen“. Lesen Sie jetzt „Blockade und propalästinensische Parolen bei Oberbaumbrücke“.;Festnahmen;News, Festnahmen, Florian Nath, Berlin-Friedrichshain, Polizei, Oberbaumbrücke, Blockade;2025-10-07T10:45:13+02:00;2025-10-07T10:45:13+02:00;;dpa Berlin/Brandenburg;false
3ca0c2ca5e209bc7769bbf86110ccb4fedd695b4c31d954b59f13fdf3756dd0b;"Eltern: Schüler sind keine ""verschmutzenden Schmarotzer""";https://www.zeit.de/news/2025-10/07/cdu-buergermeister-fordert-schueler-zum-putzen-von-schulen-auf;"Hier finden Sie Informationen zu dem Thema „Finanznot der Kommunen“. Lesen Sie jetzt „Eltern: Schüler sind keine ""verschmutzenden Schmarotzer""“.";Finanznot der Kommunen;News, Finanznot der Kommunen, Richard Arnold, Schwäbisch Gmünd, CDU, Finanznot, Kommune, Putzen, Reinigung;2025-10-07T10:42:18+02:00;2025-10-07T10:42:18+02:00;;dpa Baden-Württemberg;false
ff40a8871f72f4cada410f8a2aa3225b2a61eb296740cf90c35baafb0f05c99c;Rehlinger: Viele neue Investitionen für das Saarland;https://www.zeit.de/news/2025-10/07/rehlinger-viele-neue-investitionen-fuer-das-saarland;Hier finden Sie Informationen zu dem Thema „Landtag“. Lesen Sie jetzt „Rehlinger: Viele neue Investitionen für das Saarland“.;Landtag;News, Landtag, Anke Rehlinger, Saarland, SPD, Investition, Landtag, Zukunftsinvestition, Stahl, Auto;2025-10-07T10:42:01+02:00;2025-10-07T10:42:01+02:00;;dpa Rheinland-Pfalz/Saarland;false
43ba135bc3cba73df94c416a8fcd6a169ac260398c910f641bc4f0b80659fd27;Autofahrer stirbt nach Unfall;https://www.zeit.de/news/2025-10/07/autofahrer-stirbt-nach-unfall;Hier finden Sie Informationen zu dem Thema „Tödlicher Unfall“. Lesen Sie jetzt „Autofahrer stirbt nach Unfall“.;Tödlicher Unfall;News, Tödlicher Unfall, Unfall;2025-10-07T10:37:24+02:00;2025-10-07T10:37:24+02:00;;dpa Baden-Württemberg;false
a4fe3c4d73d64b276cdb6f2de171748bae4c5fe043971e13d1d7a6415b243707;Neuauszählung der Stichwahlstimmen in Mülheim hat begonnen;https://www.zeit.de/news/2025-10/07/neuauszaehlung-der-stichwahlstimmen-in-muelheim-hat-begonnen;Hier finden Sie Informationen zu dem Thema „Zählpanne bei Kommunalwahl“. Lesen Sie jetzt „Neuauszählung der Stichwahlstimmen in Mülheim hat begonnen“.;Zählpanne bei Kommunalwahl;News, Zählpanne bei Kommunalwahl, Nadia Khalaf, Mülheim, Mülheim an der Ruhr, Kommunalwahl, Neuauszählung, Stichwahlstimme, Zählpanne, Stichwahlabend, Oberbürgermeisterwahl, Stichwahl;2025-10-07T10:36:50+02:00;2025-10-07T10:36:50+02:00;;dpa Nordrhein-Westfalen;false
678cdcba8809b18665a512762614f48bf9734fbcb45dd74fb5ae6df1cecec95c;AfD-Fraktion trennt sich von Sicherheitsmitarbeiter;https://www.zeit.de/news/2025-10/07/afd-fraktion-trennt-sich-von-sicherheitsmitarbeiter;Hier finden Sie Informationen zu dem Thema „Bundestag“. Lesen Sie jetzt „AfD-Fraktion trennt sich von Sicherheitsmitarbeiter“.;Bundestag;News, Bundestag, Friedrichshafen, Alternative für Deutschland, Deutscher Bundestag, Sicherheit;2025-10-07T10:36:41+02:00;2025-10-07T10:36:41+02:00;;dpa Baden-Württemberg;false
d7d4c72606b240452ef9cef8f609ac9ccd42b2713d0d737ed26166178e23c360;Schaden von rund halber Million Euro bei Gebäude-Einsturz;https://www.zeit.de/news/2025-10/07/schaden-von-rund-halber-million-euro-bei-gebaeude-einsturz;Hier finden Sie Informationen zu dem Thema „Explosion“. Lesen Sie jetzt „Schaden von rund halber Million Euro bei Gebäude-Einsturz“.;Explosion;News, Explosion, Landkreis Karlsruhe, Explosion;2025-10-07T10:35:43+02:00;2025-10-07T10:35:43+02:00;;dpa Baden-Württemberg;false
d39fee1e97baa2f6a2d87f576d3f6536b84ea5b247f8fc180424faea0b4060ee;Polizei schlägt gegen mutmaßliche Telefonbetrüger-Bande zu;https://www.zeit.de/news/2025-10/07/polizei-schlaegt-gegen-mutmassliche-telefonbetrueger-bande-zu;Hier finden Sie Informationen zu dem Thema „Masche mit Anrufen“. Lesen Sie jetzt „Polizei schlägt gegen mutmaßliche Telefonbetrüger-Bande zu“.;Masche mit Anrufen;News, Masche mit Anrufen, Mann, Nordrhein-Westfalen, Polizei, Staatsanwaltschaft, Durchsuchung, Geld;2025-10-07T10:35:10+02:00;2025-10-07T10:35:10+02:00;;dpa Nordrhein-Westfalen;false
aa530c1c2967cc6f2f56490fda56f71d3e22c29cd45bb439e094c8c69aed8ffe;Dierks verlangt entschiedenes Eintreten gegen Antisemitismus;https://www.zeit.de/news/2025-10/07/dierks-verlangt-entschiedenes-eintreten-gegen-antisemitismus;Hier finden Sie Informationen zu dem Thema „Gedenken an Terroropfer“. Lesen Sie jetzt „Dierks verlangt entschiedenes Eintreten gegen Antisemitismus“.;Gedenken an Terroropfer;News, Gedenken an Terroropfer, Alexander Dierks, Israel, Dresden, Gazastreifen, Hamas, Antisemitismus, Massaker;2025-10-07T10:33:20+02:00;2025-10-07T10:33:20+02:00;;dpa Sachsen;false
c512fb9265886e006273594e5e58a0139831c17584e43751819cd8b1290fc2de;Muskelfaserrisse: Barylla und Collins fallen in Aue aus;https://www.zeit.de/news/2025-10/07/muskelfaserrisse-barylla-und-collins-fallen-in-aue-aus;Hier finden Sie Informationen zu dem Thema „3. Fußball-Liga“. Lesen Sie jetzt „Muskelfaserrisse: Barylla und Collins fallen in Aue aus“.;3. Fußball-Liga;News, 3. Fußball-Liga, Anthony Barylla, FC Erzgebirge Aue, Muskelfaserriss;2025-10-07T10:33:03+02:00;2025-10-07T10:33:03+02:00;;dpa Sachsen;false
fd1a17a7edbb4867e0a1b1f575ba391c9ef26714f2daa6659689467e1972161b;Ferrari bei Regen auf der Autobahn 5 verunglückt;https://www.zeit.de/news/2025-10/07/ferrari-bei-regen-auf-der-autobahn-5-verunglueckt;Hier finden Sie Informationen zu dem Thema „Verkehrsunfall“. Lesen Sie jetzt „Ferrari bei Regen auf der Autobahn 5 verunglückt“.;Verkehrsunfall;News, Verkehrsunfall, Achern, Appenweier, Ferrari, Verkehrsunfall, Autobahn, Auto;2025-10-07T10:31:04+02:00;2025-10-07T10:31:04+02:00;;dpa Baden-Württemberg;false
f5ba7101e0a053f8aee3c9bc037eaa2258b9583a1cb60227f664f164aee7a8cf;"Klein sieht Lebensqualität von Juden ""extrem eingeschränkt""";https://www.zeit.de/gesellschaft/2025-10/felix-klein-antisemitismus;Der Antisemitismusbeauftragte Felix Klein hat sich besorgt über die Situation von Juden in Deutschland gezeigt. Die jüdische Minderheit müsse besser geschützt werden.;Antisemitismusbeauftragter;Gesellschaft, Antisemitismusbeauftragter, Bundesregierung, Judentum, Gazastreifen, Alltag, Antisemitismus, Lebensqualität;2025-10-07T10:30:01+02:00;2025-10-07T10:30:01+02:00;lk;DIE ZEIT,        epd,        AFP,        							lk;false
a438d87b57d9f879c090bd4be19279abfc08a7cfc82fddbe00aa5fc689808bcd;Baumgartner-Absturz auf menschliches Versagen zurückzuführen;https://www.zeit.de/news/2025-10/07/baumgartner-absturz-auf-menschliches-versagen-zurueckzufuehren;Hier finden Sie Informationen zu dem Thema „Gleitschirm-Absturz in Italien“. Lesen Sie jetzt „Baumgartner-Absturz auf menschliches Versagen zurückzuführen“.;Gleitschirm-Absturz in Italien;News, Gleitschirm-Absturz in Italien, Felix Baumgartner, Raffaelle Iannella, Italien, Gleitschirm, Absturz;2025-10-07T10:26:20+02:00;2025-10-07T10:26:20+02:00;;dpa;false
6e5bea23a9394d56efdba8f97300d47110ce3b392e57ef426c20f25c389298f6;Scheibe bei jüdischer Familie mit Gedenkstein zerstört;https://www.zeit.de/news/2025-10/07/scheibe-bei-juedischer-familie-mit-gedenkstein-zerstoert;Hier finden Sie Informationen zu dem Thema „Staatsschutz ermittelt“. Lesen Sie jetzt „Scheibe bei jüdischer Familie mit Gedenkstein zerstört“.;Staatsschutz ermittelt;News, Staatsschutz ermittelt, Bad Wünnenberg, Kreis Paderborn, Westfalen, Polizei, Landsmannschaft im CC Sorabia-Westfalen zu Münster, Gedenkstein, Staatsschutz, Familie;2025-10-07T10:24:57+02:00;2025-10-07T10:24:57+02:00;;dpa Nordrhein-Westfalen;false
ee3566a51c429d95c31866b35d89e4b4bbb7c70184d45f5dd2fd804c4e3e80f2;Neue Luchs-Dame soll im Harz für Nachwuchs sorgen;https://www.zeit.de/news/2025-10/07/neue-luchs-dame-soll-im-harz-fuer-nachwuchs-sorgen;Hier finden Sie Informationen zu dem Thema „Europäisches Zuchtprogramm“. Lesen Sie jetzt „Neue Luchs-Dame soll im Harz für Nachwuchs sorgen“.;Europäisches Zuchtprogramm;News, Europäisches Zuchtprogramm, Harz, Zuchtprogramm, Luchs, Krieg in der Ukraine;2025-10-07T10:19:26+02:00;2025-10-07T10:19:26+02:00;;dpa Niedersachsen;false
76ad3a2577ec873832ca67f648e6b2d797ea181a5be1e6bce064090037cfc7a1;Mordprozess 31 Jahre nach der Tat in Bielefeld gestartet;https://www.zeit.de/news/2025-10/07/mordprozess-31-jahre-nach-der-tat-in-bielefeld-gestartet;Hier finden Sie Informationen zu dem Thema „Nach Jugendstrafrecht“. Lesen Sie jetzt „Mordprozess 31 Jahre nach der Tat in Bielefeld gestartet“.;Nach Jugendstrafrecht;News, Nach Jugendstrafrecht, Heinz-Georg S., Bielefeld, Cold Case, Mordprozess, Jugendstrafrecht, Bargeld;2025-10-07T10:14:06+02:00;2025-10-07T10:14:06+02:00;;dpa Nordrhein-Westfalen;false
cc859df6ad773f9fa2a939c775661aa923cbeb294fb107063b4129f027b6a13a;Fegebank: Gedanken bei Opfern des brutalen Hamas-Überfalls;https://www.zeit.de/news/2025-10/07/fegebank-gedanken-bei-opfern-des-brutalen-hamas-ueberfalls;Hier finden Sie Informationen zu dem Thema „Mahnwache und Gedenken“. Lesen Sie jetzt „Fegebank: Gedanken bei Opfern des brutalen Hamas-Überfalls“.;Mahnwache und Gedenken;News, Mahnwache und Gedenken, Katharina Fegebank, Hamburg, Gazastreifen, Hamas, Mahnwache, Überfall, Massaker;2025-10-07T10:12:13+02:00;2025-10-07T10:12:13+02:00;;dpa Hamburg/Schleswig-Holstein;false
dac22a4ca6fabf36b1dec2ed918c6fb60ebe177706b495d920619dab0d7332ae;Jens Spahn geht in den nächsten Jahren von Rente mit 70 aus;https://www.zeit.de/politik/deutschland/2025-10/rente-deutschland-jens-spahn-gxe;Unionsfraktionschef Spahn hält ein höheres Rentenalter in Deutschland für unvermeidlich. Aktuelle Forderungen von Bundeswirtschaftsministerin Reiche hält er für verfrüht.;Rente in Deutschland;Politik, Rente in Deutschland, Deutscher Bundestag, Jens Spahn, CDU, Rente, Alter;2025-10-07T10:10:03+02:00;2025-10-07T10:10:03+02:00;akm;DIE ZEIT,        dpa,        AFP,        							akm;false
e0961c769f2476593b7a8471d804da519c06b5730f9d15e47412b028e3c73a71;"""Nicht genug Rauch"" – ""Du klingst wie Hamas""";https://www.zeit.de/kultur/2025-10/israelische-gesellschaft-gleichgueltigkeit-gazakrieg-angst-palaestinenser;Israelis haben über Jahrzehnte gelernt, sich von den Palästinensern emotional abzukapseln. Doch seit dem 7. Oktober 2023 erlebt unsere Autorin eine neue Gleichgültigkeit.;"Z+ (abopflichtiger Inhalt);
        
    Israelische Gesellschaft";Kultur, Israelische Gesellschaft, Tel Aviv, Libanon, Israel, Westjordanland, Gaza, Gazastreifen, Hamas, Facebook, Haaretz, Instagram;2025-10-07T10:04:11+02:00;2025-10-07T10:04:11+02:00;Sarah Levy;;false
f07b574b5edb8384149a9c7fa7b51df221c11cb32ece01feb553c22da2396cd3;Drei Schwerverletzte bei Unfall in Osthessen;https://www.zeit.de/news/2025-10/07/drei-schwerverletzte-bei-unfall-in-osthessen;Hier finden Sie Informationen zu dem Thema „Polizeieinsatz“. Lesen Sie jetzt „Drei Schwerverletzte bei Unfall in Osthessen“.;Polizeieinsatz;News, Polizeieinsatz, Osthessen, Fulda, Neuhof, Polizei, Unfall, Polizeieinsatz, Fahrzeug;2025-10-07T09:59:24+02:00;2025-10-07T09:59:24+02:00;;dpa Hessen;false
5ebe1fa27c8d5593a3bbf220ee1d526ffd9b808f964113830244a0f92529cc76;Rohrhersteller scheitert mit Beschwerde gegen Insolvenz;https://www.zeit.de/news/2025-10/07/rohrhersteller-scheitert-mit-beschwerde-gegen-insolvenz;Hier finden Sie Informationen zu dem Thema „Keine Geschäftstätigkeit“. Lesen Sie jetzt „Rohrhersteller scheitert mit Beschwerde gegen Insolvenz“.;Keine Geschäftstätigkeit;News, Keine Geschäftstätigkeit, Angela Merkel, Mukran, Stralsund, Bogenn, Amtsgericht Stralsund, Amtsgericht, Beschwerde, Geschäftstätigkeit, Insolvenzverfahren, Insolvenz;2025-10-07T09:56:47+02:00;2025-10-07T09:56:47+02:00;;dpa Mecklenburg-Vorpommern;false
6d3e5be770a20c3c98af63e09def3f7e3954b41b606428172d963d35057c7818;Keine Lombardei-Rundfahrt: Lipowitz beendet Saison vorzeitig;https://www.zeit.de/news/2025-10/07/keine-lombardei-rundfahrt-lipowitz-beendet-saison-vorzeitig;Hier finden Sie Informationen zu dem Thema „Radsport“. Lesen Sie jetzt „Keine Lombardei-Rundfahrt: Lipowitz beendet Saison vorzeitig“.;Radsport;News, Radsport, Kanada, Tour de France, Lipowitz, Radsport, Drittplatzierte, Radprofi;2025-10-07T09:54:15+02:00;2025-10-07T09:54:15+02:00;;dpa Baden-Württemberg;false
e39aabcb63cd195b6d9e0b2c45d93fc62192668e1ae1adb4ba310c5a4820dd51;Bezahldienst Wero bald für Online-Einkäufe verfügbar;https://www.zeit.de/news/2025-10/07/bezahldienst-wero-bald-fuer-online-einkaeufe-verfuegbar;Hier finden Sie Informationen zu dem Thema „Digitales Bezahlen“. Lesen Sie jetzt „Bezahldienst Wero bald für Online-Einkäufe verfügbar“.;Digitales Bezahlen;News, Digitales Bezahlen, Stefan Proßer, München, Bankenverbund, Herbst;2025-10-07T09:46:57+02:00;2025-10-07T09:46:57+02:00;;dpa Bayern;false
e0d13659b06c455a8fcc1e4d27b6a5ba314f35966953369070e2743ea37239b3;"Saar-Landtagspräsidentin: ""Antisemitismus bedroht uns alle""";https://www.zeit.de/news/2025-10/07/saar-landtagspraesidentin-antisemitismus-bedroht-uns-alle;"Hier finden Sie Informationen zu dem Thema „Landtag“. Lesen Sie jetzt „Saar-Landtagspräsidentin: ""Antisemitismus bedroht uns alle""“.";Landtag;News, Landtag, Israel, Hamas, SPD, Landtag, Antisemitismus;2025-10-07T09:45:09+02:00;2025-10-07T09:45:09+02:00;;dpa Rheinland-Pfalz/Saarland;false
2acbb8d8fcb2f6b2f588165d9f6e1169c39272dc958fb7e7d7fe7378119f4ee4;Rettungshubschrauber stürzt auf Autobahn in Kalifornien;https://www.zeit.de/news/2025-10/07/rettungshubschrauber-stuerzt-auf-autobahn-in-kalifornien;Hier finden Sie Informationen zu dem Thema „Notfall“. Lesen Sie jetzt „Rettungshubschrauber stürzt auf Autobahn in Kalifornien“.;Notfall;News, Notfall, Kalifornien, Rettungshubschrauber, Notfall, Autobahn, Helikopter;2025-10-07T09:42:49+02:00;2025-10-07T09:42:49+02:00;;dpa;false
7c7251a220ca909af779c9402dc6d1e49614b7d90014ab240de75a7b7aeffd28;Wasen-Schlägerei: Zehn Festnahmen nach Tumult im Festzelt;https://www.zeit.de/news/2025-10/07/wasen-schlaegerei-zehn-festnahmen-nach-tumult-im-festzelt;Hier finden Sie Informationen zu dem Thema „Schlägerei“. Lesen Sie jetzt „Wasen-Schlägerei: Zehn Festnahmen nach Tumult im Festzelt“.;Schlägerei;News, Schlägerei, Cannstatter Wasen, Festzelt, Schlägerei, Tumult, Schaustellerfamilie;2025-10-07T09:42:02+02:00;2025-10-07T09:42:02+02:00;;dpa Baden-Württemberg;false
e60f30b06d9ce95d8e5a29699e1253224591aad31afcc5684b5d177ac7455b47;Letzte Vorbereitungen an Rennbahn in Oberhof vor Saisonstart;https://www.zeit.de/news/2025-10/07/letzte-vorbereitungen-an-rennbahn-in-oberhof-vor-saisonstart;Hier finden Sie Informationen zu dem Thema „Wintersport“. Lesen Sie jetzt „Letzte Vorbereitungen an Rennbahn in Oberhof vor Saisonstart“.;Wintersport;News, Wintersport, Ronny Knoll, Rennbahn, Saisonstart, Wintersport, Bobbahn, Eis;2025-10-07T09:35:45+02:00;2025-10-07T09:35:45+02:00;;dpa Thüringen;false
4b77b6bd5c2565978d18f1d61b79e844084447468ee4b1c96dc4948c859562c9;Bilder des Tages;https://www.zeit.de/news/2025-10/07/bilder-des-tages;Hier finden Sie Informationen zu dem Thema „Fotografie“. Lesen Sie jetzt „Bilder des Tages“.;Fotografie;News, Fotografie, News;2025-10-07T09:29:32+02:00;2025-10-07T09:29:32+02:00;;dpa;false
4dc5ed71927394f79c8ea7db8c80728812bc1586d9a76ef7977e1188039e290e;Kita-Praktikant soll Kindern Gewalt-Video gezeigt haben;https://www.zeit.de/news/2025-10/07/kita-praktikant-soll-kindern-gewalt-video-gezeigt-haben;Hier finden Sie Informationen zu dem Thema „Kindertagesstätte“. Lesen Sie jetzt „Kita-Praktikant soll Kindern Gewalt-Video gezeigt haben“.;Kindertagesstätte;News, Kindertagesstätte, Sauerland, Polizei, Kindertagesstätte;2025-10-07T09:29:20+02:00;2025-10-07T09:29:20+02:00;;dpa Nordrhein-Westfalen;false
7921dcd0d578fcc0d8e4e29ec976379a65f2667bb7a4c2d7af7cb8a2108de088;"Weimer erinnert an ""Tag des Schmerzes"" in Israel";https://www.zeit.de/news/2025-10/07/weimer-erinnert-an-tag-des-schmerzes-in-israel;"Hier finden Sie Informationen zu dem Thema „Zwei Jahre nach dem Massaker“. Lesen Sie jetzt „Weimer erinnert an ""Tag des Schmerzes"" in Israel“.";Zwei Jahre nach dem Massaker;News, Zwei Jahre nach dem Massaker, Wolfram Weimer, Israel, Hamas, Schmerz, Massaker;2025-10-07T09:27:52+02:00;2025-10-07T09:27:52+02:00;;dpa;false
1621a70a649c757d97e02c92d3427937d9ee57e9ba6020ec9bad6df5b9c6f85c;Tunnelsperrungen auf A17 Richtung Tschechien;https://www.zeit.de/news/2025-10/07/tunnelsperrungen-auf-a17-richtung-tschechien;Hier finden Sie Informationen zu dem Thema „Verkehr“. Lesen Sie jetzt „Tunnelsperrungen auf A17 Richtung Tschechien“.;Verkehr;News, Verkehr, Tschechien, Prag, Tunnelsperrung, Verkehr, Instandsetzungsarbeit, Tunnel;2025-10-07T09:17:06+02:00;2025-10-07T09:17:06+02:00;;dpa Sachsen;false
9cfd6f1fb2865938e7688e9b7d74aaeb72fb26edc9eef8202a2f98a2005ff480;Wie Erben gerechter werden könnte;https://www.zeit.de/wirtschaft/2025-09/erbschaftsteuer-abgaben-vermoegen-reform-familie;Wer drei Wohnungen vererbt, muss Steuern zahlen. Ab 300 Wohnungen fällt keine mehr an. Fair? Viele Experten sagen: Nein. Und haben Ideen, wie es besser ginge. ;"Z+ (abopflichtiger Inhalt);
        
    Erbschaftsteuer";Wirtschaft, Erbschaftsteuer, Bundesverfassungsgericht, Statistisches Bundesamt, DIW, Erbschaftsteuer, Erbschaft, Geld;2025-10-07T09:16:03+02:00;2025-10-07T09:16:03+02:00;Tim Schellenbach;;false
