Hash;Title;Link;Description;Category;KeyWords;Published;LastUpdated;Author;Source;Paywall
6e0fd8c39811bd51ce92fd1e60d39d10e62c20e8f46cdee193afaadd652ae967;Nach Hurrikan: Sänger Shaggy bringt Hilfsgüter nach Jamaika;https://www.zeit.de/news/2025-10/31/nach-hurrikan-saenger-shaggy-bringt-hilfsgueter-nach-jamaika;Hier finden Sie Informationen zu dem Thema „Musik“. Lesen Sie jetzt „Nach Hurrikan: Sänger Shaggy bringt Hilfsgüter nach Jamaika“.;Musik;News, Musik, Jamaika, Kingston, St. Elizabeth, Instagram, Hurrikan, Hilfsgut;2025-10-31T16:32:06+01:00;2025-10-31T16:32:06+01:00;;dpa;false
9cd9416ee315c62863066b1b91385856db7b6ca67f6e446b8d4aa17c2be6fdb9;Bürgerbegehren gegen Bebauung von Gleisflächen gescheitert;https://www.zeit.de/news/2025-10/31/buergerbegehren-gegen-bebauung-von-gleisflaechen-gescheitert;Hier finden Sie Informationen zu dem Thema „Stuttgart 21“. Lesen Sie jetzt „Bürgerbegehren gegen Bebauung von Gleisflächen gescheitert“.;Stuttgart 21;News, Stuttgart 21, Stuttgart, Stuttgart 21, Gleisfläche, Bürgerbegehren, Bebauung, Hauptbahnhof;2025-10-31T16:29:28+01:00;2025-10-31T16:29:28+01:00;;dpa Baden-Württemberg;false
198a2f1ffa7032b7c7476a5575019a4a1837ee6012e2fbf670f3b3b97ca74337;"""Ein sehr großes Ding"" - Ermittler heben Drogenlabor aus";https://www.zeit.de/news/2025-10/31/ein-sehr-grosses-ding-ermittler-heben-drogenlabor-aus;"Hier finden Sie Informationen zu dem Thema „Drogenkriminalität“. Lesen Sie jetzt „""Ein sehr großes Ding"" - Ermittler heben Drogenlabor aus“.";Drogenkriminalität;News, Drogenkriminalität, Christian Lanninger, Henner Grote, Mann, Berlin, Brandenburg, Drogenlabor, Drogenkriminalität, Drogenlager, Zollfahndungsamt, Drogen;2025-10-31T16:23:42+01:00;2025-10-31T16:23:42+01:00;;dpa Berlin/Brandenburg;false
20a76aa06845120e5c756d58f2c30dc23e9a1aa230c637ac9bee166c512eb021;Leichenfund bei Feuer in Leipziger Wohnhaus;https://www.zeit.de/news/2025-10/31/leichenfund-bei-feuer-in-leipziger-wohnhaus;Hier finden Sie Informationen zu dem Thema „Brand“. Lesen Sie jetzt „Leichenfund bei Feuer in Leipziger Wohnhaus“.;Brand;News, Brand, Leipzig, Polizei, Leichenfund, Löscharbeit;2025-10-31T16:22:31+01:00;2025-10-31T16:22:31+01:00;;dpa Sachsen;false
b4372cc9f4c9d660c0330e2e821b13badb7fdc055dcec8e11a92df1687b77df1;Vogelgrippe: Auch Hausgeflügel betroffen;https://www.zeit.de/news/2025-10/31/vogelgrippe-auch-hausgefluegel-betroffen;Hier finden Sie Informationen zu dem Thema „Geflügelpest“. Lesen Sie jetzt „Vogelgrippe: Auch Hausgeflügel betroffen“.;Geflügelpest;News, Geflügelpest, Mainz, Rheinland-Pfalz, Friedrich-Loeffler-Institut, Geflügelpest, Hausgeflügel, Hausgeflügelbestand, Landesuntersuchungsamt;2025-10-31T16:21:53+01:00;2025-10-31T16:21:53+01:00;;dpa Rheinland-Pfalz/Saarland;false
359accfe6cea61ecbb303c86b27376d37cdd9ce33fdd38ac336d35cde7cd1088;Jetzt mal was anderes;https://www.zeit.de/2025/46/rhetorik-politiker-politikersprech-phrasen-reden-sagen-gxe;Bevor der Gesprächsfaden abreißt, besser eine Brücke bauen. Nur bloß nicht vergessen, die Menschen dabei mitzunehmen. Nichts ist so konstant wie die politische Floskel.;Rhetorik von Politikern;Politik, Rhetorik von Politikern, Rhetorik, Sprache, Frank-Walter Steinmeier, Kommunikation, Sozialdemokratie, Bundespräsident;2025-10-31T16:20:38+01:00;2025-10-31T16:20:38+01:00;Peter Dausend;Aus der        ZEIT Nr. 46/2025;false
ef04634f0562f614b1bcb003ae09ebac88a98b43a178109dbb1cc7f3ad7d7730;"""Ich warne davor, immer Weimarer Verhältnisse heraufzubeschwören""";https://www.zeit.de/2025/46/volker-kutscher-westend-gereon-rath-krimi;Ein letztes Mal lässt Volker Kutscher seinen Kommissar Gereon Rath auftreten. Ein Gespräch über seine Krimiserie und die Abgründe der deutschen Geschichte.;"Z+ (abopflichtiger Inhalt);
        
    Volker Kutscher";Kultur, Volker Kutscher, Autor, Kriminalroman, Belletristik, Fernsehserie, Weimarer Republik, Kriminalfilm;2025-10-31T16:19:17+01:00;2025-10-31T16:19:17+01:00;Leon Lindenberger;Aus der        ZEIT Nr. 46/2025;false
d534463a1ef706e999b2b71460ae6e20a5db8b3969c62d1dc2d04abbe384716c;Wer druckt solchen Blödsinn?;https://www.zeit.de/2025/46/printausgabe-der-postillon-satire-stefan-sichermann;"Wenigstens dieser eine Nürnberger, Stefan Sichermann, nimmt die Welt nicht ernst. Sein Onlinemagazin ""Der Postillon"" gibt’s jetzt als Zeitung. Ein Besuch im Homeoffice";"Z+ (abopflichtiger Inhalt);
        
    Printausgabe von ""Der Postillon""";"Kultur, Printausgabe von ""Der Postillon"", Satire, Berichterstattung, Journalismus, Nürnberg, Comedy";2025-10-31T16:17:56+01:00;2025-10-31T16:17:56+01:00;Arno Makowsky;Aus der        ZEIT Nr. 46/2025;false
91c3890689afb4c4a791bc3188d6a38469713ab939070320b256094203ffdb05;Dutzende Schweine sterben bei Großbrand im Stall;https://www.zeit.de/news/2025-10/31/grossbrand-schweinestall-steht-komplett-in-flammen;Hier finden Sie Informationen zu dem Thema „Brände“. Lesen Sie jetzt „Dutzende Schweine sterben bei Großbrand im Stall“.;Brände;News, Brände, Polizei, Großbrand, Schweinestall, Brand;2025-10-31T16:10:51+01:00;2025-10-31T16:10:51+01:00;;dpa Mecklenburg-Vorpommern;false
dd638145694eb66d0b4d2790aa7a21358984d746e69789182e61c5da6ceb3321;Neue Sicherheitsvorkehrungen für Louvre noch in diesem Jahr;https://www.zeit.de/news/2025-10/31/neue-sicherheitsvorkehrungen-fuer-louvre-noch-in-diesem-jahr;Hier finden Sie Informationen zu dem Thema „Nach Schmuck-Diebstahl“. Lesen Sie jetzt „Neue Sicherheitsvorkehrungen für Louvre noch in diesem Jahr“.;Nach Schmuck-Diebstahl;News, Nach Schmuck-Diebstahl, Rachida Dati, Frankreich, Louvre, Sicherheitsvorkehrung, Diebstahl, Schmuck, Fahrzeug, Sicherheit;2025-10-31T16:09:03+01:00;2025-10-31T16:09:03+01:00;;dpa;false
10a7f268a2150d9f748ecc8fcda0aac23f62cd16dfc77faeef3e384b5b5f41b2;Urteil nach Schüssen vor Landgericht bereits im November;https://www.zeit.de/news/2025-10/31/urteil-nach-schuessen-vor-landgericht-bereits-im-november;Hier finden Sie Informationen zu dem Thema „Prozess vor Abschluss“. Lesen Sie jetzt „Urteil nach Schüssen vor Landgericht bereits im November“.;Prozess vor Abschluss;News, Prozess vor Abschluss, Bielefeld, Deutsche Presse-Agentur, Landgericht;2025-10-31T16:07:45+01:00;2025-10-31T16:07:45+01:00;;dpa Nordrhein-Westfalen;false
3f997d176df124a515e679db106c3bf480e96e3af0de77745f425ec4a8fa3d71;Zustellfahrzeug fährt Rentnerin um - Hubschrauber im Einsatz;https://www.zeit.de/news/2025-10/31/zustellfahrzeug-faehrt-rentnerin-um-hubschrauber-im-einsatz;Hier finden Sie Informationen zu dem Thema „Unfälle“. Lesen Sie jetzt „Zustellfahrzeug fährt Rentnerin um - Hubschrauber im Einsatz“.;Unfälle;News, Unfälle, Zustellfahrzeug, Unfall, Hubschrauber;2025-10-31T16:04:46+01:00;2025-10-31T16:04:46+01:00;;dpa Thüringen;false
1ab08c3228aa643d04dcf1d84562b02041ac43c89ddd81b41405cac30b708470;Bayern startet in die Herbstferien - wo es voll wird;https://www.zeit.de/news/2025-10/31/bayern-startet-in-die-herbstferien-wo-es-voll-wird;Hier finden Sie Informationen zu dem Thema „Urlaub“. Lesen Sie jetzt „Bayern startet in die Herbstferien - wo es voll wird“.;Urlaub;News, Urlaub, Bayern, München, Nürnberg, ADAC, Herbstferien;2025-10-31T16:03:45+01:00;2025-10-31T16:03:45+01:00;;dpa Bayern;false
2738bf1f2a22529d4545d5bf04af7ea93e8dc68615bd8be7344e1b9f4ec654e4;Bus mit 30 Fahrgästen und Auto krachen zusammen;https://www.zeit.de/news/2025-10/31/bus-mit-30-fahrgaesten-und-auto-krachen-zusammen;Hier finden Sie Informationen zu dem Thema „Stuttgart“. Lesen Sie jetzt „Bus mit 30 Fahrgästen und Auto krachen zusammen“.;Stuttgart;News, Stuttgart, Stuttgart, Reisebus, Auto;2025-10-31T16:02:56+01:00;2025-10-31T16:02:56+01:00;;dpa Baden-Württemberg;false
9a3dacf35c520949d1a49638bf1f20ebc706ab050c604e333ae32d6ecaa5283a;Auto fällt in Aufzugschacht;https://www.zeit.de/news/2025-10/31/auto-faellt-in-aufzugschacht;Hier finden Sie Informationen zu dem Thema „Kurioses“. Lesen Sie jetzt „Auto fällt in Aufzugschacht“.;Kurioses;News, Kurioses, Aufzugschacht, Auto;2025-10-31T16:00:40+01:00;2025-10-31T16:00:40+01:00;;dpa Hessen;false
a71ed93b3e89913baeb1687db80ee91aace01ea019f69ce431d49efab3610143;Wer wird die Nummer 1? Spannender Kampf um Fürther Tor;https://www.zeit.de/news/2025-10/31/wer-wird-die-nummer-1-spannender-kampf-um-fuerther-tor;Hier finden Sie Informationen zu dem Thema „DFB-Pokal“. Lesen Sie jetzt „Wer wird die Nummer 1? Spannender Kampf um Fürther Tor“.;DFB-Pokal;News, DFB-Pokal, Thomas Kleine, Pelle Boevink, Timo Schlieck, Fürth, Paderborn, Deutscher Fußball-Bund, SpVgg Greuther Fürth, SC Paderborn;2025-10-31T16:00:24+01:00;2025-10-31T16:00:24+01:00;;dpa Bayern;false
44b0292d85b435332933b0f1c707b7ac37137a15f14fd6d29d63f424da25d2c5;Santiano wieder an der Charts-Spitze;https://www.zeit.de/news/2025-10/31/santiano-wieder-an-der-charts-spitze;Hier finden Sie Informationen zu dem Thema „Hitliste“. Lesen Sie jetzt „Santiano wieder an der Charts-Spitze“.;Hitliste;News, Hitliste, Taylor Swift, Schleswig-Holstein, Santiano, Hitliste;2025-10-31T15:58:14+01:00;2025-10-31T15:58:14+01:00;;dpa Hamburg/Schleswig-Holstein;false
e0d6232d9a7c47d31772771b2914c1442f2f44439713ca903dd5d05fc97aa559;Ukraine liefert erstmals mutmaßlichen russischen Kriegsverbrecher aus;https://www.zeit.de/politik/ausland/ukraine-krieg-news-liveblog;Ein russischer Soldat wird von der Ukraine an Litauen ausgeliefert. Die EU-Kommission will Importverbote für ukrainische Lebensmittel abbauen. Das Liveblog;Liveblog:                     Krieg gegen die Ukraine;Politik, Krieg gegen die Ukraine, Krieg in der Ukraine, Wolodymyr Selenskyj, Waffenruhe, Wladimir Putin, Russland, Sanktion, Friedrich Merz;2025-11-01T08:11:01+00:00;2025-11-01T08:11:01+00:00;Iven Yorick FenkerTimo StukenbergDavid Rech;;false
cd288c7fa5c814dfd73b41ae4fb76f00b524a9497076755a153d8c0c41f50fca;Frau steigt in laufenden Oldtimer und rast davon;https://www.zeit.de/news/2025-10/31/frau-steigt-in-laufenden-oldtimer-und-rast-davon;Hier finden Sie Informationen zu dem Thema „Herrenberg“. Lesen Sie jetzt „Frau steigt in laufenden Oldtimer und rast davon“.;Herrenberg;News, Herrenberg, Herrenberg, Böblingen, Polizei, Fahrzeug, Reifen;2025-10-31T15:54:02+01:00;2025-10-31T15:54:02+01:00;;dpa Baden-Württemberg;false
50857eae529e7960b72f814f5ba0294046a239a5975dd33b0b3c73591c247667;Jens Spahn verärgert über Aussagen aus der SPD in Stadtbild-Debatte;https://www.zeit.de/politik/deutschland/2025-10/jens-spahn-stadtbild-kritik-spd;In der Stadtbild-Debatte mahnt Jens Spahn die SPD zu mehr Einigkeit in der Koalition. Bundeskanzler Friedrich Merz sei bewusst falsch verstanden worden.;Stadtbild-Debatte;Politik, Stadtbild-Debatte, Bundesregierung, SPD, Jens Spahn, Friedrich Merz, Koalition;2025-10-31T15:49:25+01:00;2025-10-31T15:49:25+01:00;yer;DIE ZEIT,        dpa,        							yer;false
a47eacc6e4fa4fd2f03594e2b2618acf258091870fe9fdfec0019f33da841787;Elf Menschen im Achtsitzer – Polizei stoppt überladenes Auto;https://www.zeit.de/news/2025-10/31/elf-menschen-im-achtsitzer-polizei-stoppt-ueberladenes-auto;Hier finden Sie Informationen zu dem Thema „Meckenbeuren“. Lesen Sie jetzt „Elf Menschen im Achtsitzer – Polizei stoppt überladenes Auto“.;Meckenbeuren;News, Meckenbeuren, Meckenbeuren, Polizei, Auto;2025-10-31T15:46:22+01:00;2025-10-31T15:46:22+01:00;;dpa Baden-Württemberg;false
396e00f23e4ee9ceb3c791d359a4d9e92f452b472ac7a8308b8a59a3396b91b6;"150 Zombies tanzen zu ""Thriller"" im Hamburger Hauptbahnhof";https://www.zeit.de/news/2025-10/31/150-zombies-tanzen-zu-thriller-im-hamburger-hauptbahnhof;"Hier finden Sie Informationen zu dem Thema „Halloween“. Lesen Sie jetzt „150 Zombies tanzen zu ""Thriller"" im Hamburger Hauptbahnhof“.";Halloween;News, Halloween, Michael Jackson, Hauptbahnhof, Zombie, Halloween, Thriller;2025-10-31T15:42:51+01:00;2025-10-31T15:42:51+01:00;;dpa;false
6d5b259b37b02ca23158712180cee465834b45f9b94068fcf8c8d8b125a0145e;"1860 empfängt Topteam Cottbus: Nicht ""einlullen"" lassen";https://www.zeit.de/news/2025-10/31/1860-empfaengt-topteam-cottbus-nicht-einlullen-lassen;"Hier finden Sie Informationen zu dem Thema „3. Fußball-Liga“. Lesen Sie jetzt „1860 empfängt Topteam Cottbus: Nicht ""einlullen"" lassen“.";3. Fußball-Liga;News, 3. Fußball-Liga, Claus-Dieter Wollitz, Markus Kauczinski, Cottbus, TSV 1860 München, Energie Cottbus, Topteam;2025-10-31T15:41:33+01:00;2025-10-31T15:41:33+01:00;;dpa Bayern;false
334e28515435c03cef39e0ad8e1f5a5fa57170a8b484ab77990eae6bcf8b7073;Linke diskutiert beim Parteitag über Nahostkonflikt;https://www.zeit.de/news/2025-10/31/linke-diskutiert-beim-parteitag-ueber-nahostkonflikt;Hier finden Sie Informationen zu dem Thema „Linke-Parteitag“. Lesen Sie jetzt „Linke diskutiert beim Parteitag über Nahostkonflikt“.;Linke-Parteitag;News, Linke-Parteitag, Kerstin Wolter, Berlin, Israel, Gazastreifen, BDS, Deutscher Bundestag, Landesparteitag, Palästinasolidarität, Parteitag, Nahostkonflikt;2025-10-31T15:38:36+01:00;2025-10-31T15:38:36+01:00;;dpa Berlin/Brandenburg;false
cad1e845c742ba3f9c4c69762095f635345b8ad53af90abb7c065c57bea36b89;Ilzer vor Wolfsburg-Spiel: Wollen maximal erfolgreich sein;https://www.zeit.de/news/2025-10/31/ilzer-vor-wolfsburg-spiel-wollen-maximal-erfolgreich-sein;Hier finden Sie Informationen zu dem Thema „Bundesliga“. Lesen Sie jetzt „Ilzer vor Wolfsburg-Spiel: Wollen maximal erfolgreich sein“.;Bundesliga;News, Bundesliga, Christian Ilzer, Wolfsburg, TSG 1899 Hoffenheim, VfL Wolfsburg, DAZN, Bundesliga;2025-10-31T15:34:48+01:00;2025-10-31T15:34:48+01:00;;dpa Baden-Württemberg;false
5d11d47a98e3ae528d5520337152f22b6512e2015194f2ac09ff39f3aa521268;"Merz lädt zu ""Stahlgipfel"" - Mahnungen aus NRW";https://www.zeit.de/news/2025-10/31/merz-laedt-zu-stahlgipfel-mahnungen-aus-nrw;"Hier finden Sie Informationen zu dem Thema „Spitzentreffen“. Lesen Sie jetzt „Merz lädt zu ""Stahlgipfel"" - Mahnungen aus NRW“.";Spitzentreffen;News, Spitzentreffen, Friedrich Merz, Lars Klingbeil, Katherina Reiche, Bärbel Bas, Mona Neubaur, NRW, Berlin, Nordrhein-Westfalen, SPD, CDU;2025-10-31T15:33:45+01:00;2025-10-31T15:33:45+01:00;;dpa Nordrhein-Westfalen;false
274648e345ab5fb355f14f517de135f433a0de18961a5837ef3af0621e255e82;Wende in den Niederlanden - Linksliberale siegen;https://www.zeit.de/news/2025-10/31/vorlaeufiges-ergebnis-linksliberale-gewinnen-in-niederlanden;Hier finden Sie Informationen zu dem Thema „Niederlande-Wahl“. Lesen Sie jetzt „Wende in den Niederlanden - Linksliberale siegen“.;Niederlande-Wahl;News, Niederlande-Wahl, Niederlande;2025-10-31T15:33:15+01:00;2025-10-31T15:33:15+01:00;;dpa;false
7a6eac2b208c58e77213be4c6a75bd2c1d5491063b29713925d26a9cb309557b;Bei der Maintalbahn steht Ersatzverkehr mit Bussen an;https://www.zeit.de/news/2025-10/31/bei-der-maintalbahn-steht-ersatzverkehr-mit-bussen-an;Hier finden Sie Informationen zu dem Thema „Bauarbeiten“. Lesen Sie jetzt „Bei der Maintalbahn steht Ersatzverkehr mit Bussen an“.;Bauarbeiten;News, Bauarbeiten, Unterfranken, Aschaffenburg, Miltenberg, Main, Maintalbahn, Ersatzverkehr, Pendler;2025-10-31T15:32:56+01:00;2025-10-31T15:32:56+01:00;;dpa Bayern;false
39c9c1840c335713fd6c54fe8d217c374523077ea6922bfc9dbd58529b85f4c6;Kanu des Manitu? Kulturstaatsminister will mehr Blockbuster;https://www.zeit.de/news/2025-10/31/kanu-des-manitu-kulturstaatssekretaer-will-mehr-blockbuster;Hier finden Sie Informationen zu dem Thema „Filmförderung“. Lesen Sie jetzt „Kanu des Manitu? Kulturstaatsminister will mehr Blockbuster“.;Filmförderung;News, Filmförderung, Wolfram Weimer, Walt Disney, Netflix, Filmförderung, Blockbuster, Filmwirtschaft, Kanu, Kino;2025-10-31T15:32:36+01:00;2025-10-31T15:32:36+01:00;;dpa Baden-Württemberg;false
48b54f9c326eaff8098ef414c075f2393245d6c18397839836488ebd49db08e2;Pilotstudie untersucht Artenvielfalt im Rhein;https://www.zeit.de/news/2025-10/31/pilotstudie-untersucht-artenvielfalt-im-rhein;Hier finden Sie Informationen zu dem Thema „Umweltschutz“. Lesen Sie jetzt „Pilotstudie untersucht Artenvielfalt im Rhein“.;Umweltschutz;News, Umweltschutz, Worms, Rhein, Rheinland-Pfalz, Eder, Pilotstudie, Umweltschutz, Ökosystem, Mikroplastik, Pestizid, Schadstoff;2025-10-31T15:26:57+01:00;2025-10-31T15:26:57+01:00;;dpa Rheinland-Pfalz/Saarland;false
6803352d75f0a129c9aa1860c7a1d84cdbff339374d02085b56d9cff753fb821;Weniger Kita-Kinder, aber mehr Personal;https://www.zeit.de/news/2025-10/31/mehr-erzieher-fuer-weniger-kinder;Hier finden Sie Informationen zu dem Thema „Geburtenrückgang“. Lesen Sie jetzt „Weniger Kita-Kinder, aber mehr Personal“.;Geburtenrückgang;News, Geburtenrückgang, Statistisches Bundesamt, Geburtenrückgang, Kindertagesbetreuung, Tageseltern;2025-10-31T15:24:45+01:00;2025-10-31T15:24:45+01:00;;dpa;false
3b06486598d476ac0ab2ab6179006f7b3868f2fbe850ffbccde19bea18b535bb;Inflation in Eurozone schwächt sich ab;https://www.zeit.de/wirtschaft/2025-10/inflation-oktober-2025-abgeschwaecht;Die Inflation im Euroraum lag im Oktober voraussichtlich bei 2,1 Prozent. Damit ist sie fast bei der Zielmarke angekommen, die die Europäische Zentralbank anstrebt.;Teuerungsrate;Wirtschaft, Teuerungsrate, Europa, Inflation, EZB, Geldmarkt, Eurozone, Teuerungsrate;2025-10-31T15:24:32+01:00;2025-10-31T15:24:32+01:00;dar;DIE ZEIT,        dpa,        							dar;false
77e8976b9b982bc476f5850a2e4b68304228a4305138fee26f6358685d2edeca;"Prozess nach Todesfahrt: ""Getrieben von starker Wut""";https://www.zeit.de/news/2025-10/31/40-jaehriger-steht-nach-todesfahrt-von-mannheim-vor-gericht;"Hier finden Sie Informationen zu dem Thema „Landgericht Mannheim“. Lesen Sie jetzt „Prozess nach Todesfahrt: ""Getrieben von starker Wut""“.";Landgericht Mannheim;News, Landgericht Mannheim, Mannheim, Ludwigshafen, Staatsanwaltschaft, Todesfahrt, Landgericht, Mord, Auto;2025-10-31T15:19:28+01:00;2025-10-31T15:19:28+01:00;;dpa;false
e6eff827da5a4256552bcfb9a12b07ec553a4c278ca2dbcfd944c4566ea3f5c9;"Ole Werner zum Gegner Stuttgart: ""Der Beste seit Bayern""";https://www.zeit.de/news/2025-10/31/ole-werner-zum-gegner-stuttgart-der-beste-seit-bayern;"Hier finden Sie Informationen zu dem Thema „Fußball-Bundesliga“. Lesen Sie jetzt „Ole Werner zum Gegner Stuttgart: ""Der Beste seit Bayern""“.";Fußball-Bundesliga;News, Fußball-Bundesliga, Ole Werner, Stuttgart, RB Leipzig, VfB Stuttgart, Fußball-Bundesliga, Bundesliga, Startrekord;2025-10-31T15:12:30+01:00;2025-10-31T15:12:30+01:00;;dpa Baden-Württemberg;false
ed5cc56c07952fed9fc6214de0842deab484870f5ef277806f7778e46ccf4d31;Renten könnten wieder um 3,7 Prozent steigen;https://www.zeit.de/news/2025-10/31/rente-koennte-2026-um-3-7-prozent-steigen;Hier finden Sie Informationen zu dem Thema „Altersbezüge“. Lesen Sie jetzt „Renten könnten wieder um 3,7 Prozent steigen“.;Altersbezüge;News, Altersbezüge, Altersbezug, Rente;2025-10-31T15:07:57+01:00;2025-10-31T15:07:57+01:00;;dpa;false
74ce0d0f10349ff086fdee9b9a0561dd608ff1fb0102f90521694144f13f3bb1;"Vogelgrippe in Hessen breitet sich ""sehr dynamisch"" aus";https://www.zeit.de/news/2025-10/31/vogelgrippe-in-hessen-breitet-sich-sehr-dynamisch-aus;"Hier finden Sie Informationen zu dem Thema „Tierseuche“. Lesen Sie jetzt „Vogelgrippe in Hessen breitet sich ""sehr dynamisch"" aus“.";Tierseuche;News, Tierseuche, Wiesbaden, Hessen, BMELV, Deutsche Presse-Agentur, Vogelgrippe, Tierseuche, Tiere;2025-10-31T15:07:00+01:00;2025-10-31T15:07:00+01:00;;dpa Hessen;false
8dbf364ae78e23c8b4a2437f9b534e8c5fc162865d79b0cfdae29debdf24f8ee;Ex-Gladbacher Seoane kehrt als Trainer nach Bern zurück;https://www.zeit.de/news/2025-10/31/ex-gladbacher-seoane-kehrt-als-trainer-nach-bern-zurueck;Hier finden Sie Informationen zu dem Thema „Fußball“. Lesen Sie jetzt „Ex-Gladbacher Seoane kehrt als Trainer nach Bern zurück“.;Fußball;News, Fußball, Gerardo Seoane, Giorgio Contini, Bern, Mönchengladbach, Borussia Mönchengladbach, Young Boys Bern, Bundesliga, Fußball, Sommer;2025-10-31T15:04:12+01:00;2025-10-31T15:04:12+01:00;;dpa Nordrhein-Westfalen;false
2a43192624b32199d5d126c488d82304b0a2c96540919dc1684499655f38df28;Fahrer entdeckt bei gekauftem SUV Bremsklötze aus Holz;https://www.zeit.de/news/2025-10/31/fahrer-entdeckt-bei-gekauftem-suv-bremskloetze-aus-holz;Hier finden Sie Informationen zu dem Thema „Ludwigsburg“. Lesen Sie jetzt „Fahrer entdeckt bei gekauftem SUV Bremsklötze aus Holz“.;Ludwigsburg;News, Ludwigsburg, Ludwigsburg, Polizei, Auto;2025-10-31T15:03:01+01:00;2025-10-31T15:03:01+01:00;;dpa Baden-Württemberg;false
9d8a08db77fd83e87192d00548f241af81170c9a51e28fec7d54c7cfe0866220;Frau fährt mit Auto in Verkaufsraum von Tankstelle;https://www.zeit.de/news/2025-10/31/frau-faehrt-mit-auto-in-verkaufsraum-von-tankstelle;Hier finden Sie Informationen zu dem Thema „Kurioser Unfall“. Lesen Sie jetzt „Frau fährt mit Auto in Verkaufsraum von Tankstelle“.;Kurioser Unfall;News, Kurioser Unfall, Polizei, Verkaufsraum, Unfall, Auto, Tankstelle;2025-10-31T15:02:30+01:00;2025-10-31T15:02:30+01:00;;dpa Niedersachsen;false
5eb0067da39cf99c2697156ede7a8911236f53b47dd976f25be6b3044f7fede1;Die Entprinzung;https://www.zeit.de/politik/ausland/2025-10/andrew-prinz-koenig-charles-iii-adel-titel-britische-justiz;Titel weg und raus aus dem Schloss: König Charles III. hat ein royales Urteil über seinen Bruder Andrew gefällt. Aber was tut jetzt die eigentliche britische Justiz?;"Z+ (abopflichtiger Inhalt);
        
    Andrew";Politik, Andrew, König Charles III., Familie, Windsor, Jeffrey Epstein, London, Teenager;2025-10-31T15:01:40+01:00;2025-10-31T15:01:40+01:00;Jochen Bittner;;false
7d263cf2d0dee8f49cbb6436ed3c8e5eeca6523a4b5446567d56c0cc3c1afac7;"""Müssen cool bleiben"": Bochum steht vor wegweisendem Duell";https://www.zeit.de/news/2025-10/31/muessen-cool-bleiben-bochum-steht-vor-wegweisendem-duell;"Hier finden Sie Informationen zu dem Thema „2. Fußball-Bundesliga“. Lesen Sie jetzt „""Müssen cool bleiben"": Bochum steht vor wegweisendem Duell“.";2. Fußball-Bundesliga;News, 2. Fußball-Bundesliga, Uwe Rösler, Magdeburg, Bochum, VfL Bochum, Fußball-Bundesliga;2025-10-31T14:59:14+01:00;2025-10-31T14:59:14+01:00;;dpa Nordrhein-Westfalen;false
b8560200b60eb858320f6a554b0f15bcdb3acc1159ba3cbfd6c6135b5d3830fe;Raumfahrtfirma OHB baut künftig Satellitenteile in Sachsen;https://www.zeit.de/news/2025-10/31/raumfahrtfirma-ohb-baut-kuenftig-satellitenteile-in-sachsen;Hier finden Sie Informationen zu dem Thema „Satelliten statt Radios“. Lesen Sie jetzt „Raumfahrtfirma OHB baut künftig Satellitenteile in Sachsen“.;Satelliten statt Radios;News, Satelliten statt Radios, Michael Kretschmer, Sachsen, Schöneck, Vogtland, Raumfahrtkonzern, OHB, Technisat, Satellitenteil, Satellit, Elektronik;2025-10-31T14:58:53+01:00;2025-10-31T14:58:53+01:00;;dpa Niedersachsen;false
4a696b040f48d5031e48e0babd1ad8841b4b5c66dda8f1e168e7ecff9f786d7d;Schaf verletzt Siebenjährigen in Schwaben;https://www.zeit.de/news/2025-10/31/schaf-verletzt-siebenjaehrigen-in-schwaben;Hier finden Sie Informationen zu dem Thema „Angriff beim Fußball“. Lesen Sie jetzt „Schaf verletzt Siebenjährigen in Schwaben“.;Angriff beim Fußball;News, Angriff beim Fußball, Fußball, Angriff;2025-10-31T14:56:55+01:00;2025-10-31T14:56:55+01:00;;dpa Bayern;false
d5bf5150fae10d2dae72ed6aa8520619d1eda024ad4276d73b37e1016c1d5b28;Anlasslose Chatkontrolle auf Missbrauchsinhalte kommt vorerst nicht;https://www.zeit.de/digital/datenschutz/2025-10/chatkontrolle-eu-kindesmissbrauch-datenschutz;Die EU-Kommission wollte Onlineplattformen verpflichten, private Chatnachrichten auf Darstellungen von Kindesmissbrauch zu durchsuchen. Doch dafür gibt es keine Mehrheit.;Datenschutz;Digital, Datenschutz, Europäische Union, Kindesmissbrauch, Datenschutz, Chat;2025-10-31T14:56:12+01:00;2025-10-31T14:56:12+01:00;yer;DIE ZEIT,        dpa,        AFP,        							yer;false
ce7add861a7a2425a5cfeb5c99eaa739f6b1bf3bb64a9075dba3ee23d419fe10;Das denkt Union-Coach Baumgart über die Stürmerflaute;https://www.zeit.de/news/2025-10/31/das-denkt-union-coach-baumgart-ueber-die-stuermerflaute;Hier finden Sie Informationen zu dem Thema „Fußball-Bundesliga“. Lesen Sie jetzt „Das denkt Union-Coach Baumgart über die Stürmerflaute“.;Fußball-Bundesliga;News, Fußball-Bundesliga, Steffen Baumgart, Danilho Doekhi, Freiburg, Stadion An der Alten Försterei, CDU/CSU, 1. FC Union Berlin, SC Freiburg, Fußball-Bundesliga, Stürmerflaute, Stürmertor;2025-10-31T14:55:00+01:00;2025-10-31T14:55:00+01:00;;dpa Baden-Württemberg;false
78ef877487fe8d216cc60e5695e59664c29ebf2e1374d27844a62a2029070c75;"Jamaika nach Hurrikan ""Melissa"": ""Apokalyptische"" Zustände";https://www.zeit.de/news/2025-10/31/jamaika-meldet-19-tote-durch-hurrikan-melissa;"Hier finden Sie Informationen zu dem Thema „Verheerender Wirbelsturm“. Lesen Sie jetzt „Jamaika nach Hurrikan ""Melissa"": ""Apokalyptische"" Zustände“.";Verheerender Wirbelsturm;News, Verheerender Wirbelsturm, Dana Morris Dixon, Jamaika, Haiti, Karibik, Hurrikan;2025-10-31T14:54:35+01:00;2025-10-31T14:54:35+01:00;;dpa;false
b1c0e32cb08ad0ac2afceeaf969b41a5ac61c8bc57d7e890253f09408a2d683d;Fan-Plakat, interne Sitzung: Wolfsburg im Krisen-Modus;https://www.zeit.de/news/2025-10/31/fan-plakat-interne-sitzung-wolfsburg-im-krisen-modus;Hier finden Sie Informationen zu dem Thema „Fußball-Bundesliga“. Lesen Sie jetzt „Fan-Plakat, interne Sitzung: Wolfsburg im Krisen-Modus“.;Fußball-Bundesliga;News, Fußball-Bundesliga, Sebastian Schindzielorz, Paul Simonis, Wolfsburg, VfL Wolfsburg, Fußball-Bundesliga, Bundesliga, Krise, Ordnung;2025-10-31T14:52:29+01:00;2025-10-31T14:52:29+01:00;;dpa Niedersachsen;false
