Hash;Title;Link;Description;Category;KeyWords;Published;LastUpdated;Author;Source;Paywall
f82ee02834f26abba067e71678321b888ac1669a81f5a6566233b6509dceabcb;Zehntausende Lücken auf Halbjahreszeugnissen in Thüringen;https://www.zeit.de/news/2024-03/17/zehntausende-luecken-auf-halbjahreszeugnissen-in-thueringen;Hier finden Sie Informationen zu dem Thema „Schulen“. Lesen Sie jetzt „Zehntausende Lücken auf Halbjahreszeugnissen in Thüringen“.;Schulen;News, Schulen, Thüringen, Gera, BMBF, Deutsche Presse-Agentur, Halbjahreszeugnis, Schultisch, Zeugnisnote;2024-03-17T18:13:02+01:00;2024-03-17T18:13:02+01:00;;dpa Thüringen;false
5a0c76ae41db05f1f11f6c21a711c781e05dcf182ae8137d2532235b9a6ea0ec;MDR: Thüringer Millionenforderungen wegen ausgefallener Züge;https://www.zeit.de/news/2024-03/17/mdr-thueringer-millionenforderungen-wegen-ausgefallener-zuege;Hier finden Sie Informationen zu dem Thema „Verkehr“. Lesen Sie jetzt „MDR: Thüringer Millionenforderungen wegen ausgefallener Züge“.;Verkehr;News, Verkehr, Thüringen, MDR, DB, Millionenforderung, Verkehr, Servicemangel, Geld;2024-03-17T18:11:41+01:00;2024-03-17T18:11:41+01:00;;dpa Thüringen;false
baf68016f4fc33c543441546d0be7a027899072155df590bf97b11e7fc2b1575;EU will Milliarden in Beziehungen mit Ägypten investieren;https://www.zeit.de/news/2024-03/17/eu-will-milliarden-in-beziehungen-mit-aegypten-investieren;Hier finden Sie Informationen zu dem Thema „Nordafrika“. Lesen Sie jetzt „EU will Milliarden in Beziehungen mit Ägypten investieren“.;Nordafrika;News, Nordafrika, Abdel Fattah al-Sisi, Ägypten, Kairo, Tobruk, Kreta, Gazastreifen, EU, Europäische Kommission, Zusammenarbeit, Milliardensumme;2024-03-17T18:10:07+01:00;2024-03-17T18:10:07+01:00;;dpa;false
46ddd4783745e68e11828f9dd31318207910c42b30f808e8a2521694ec4a2e50;1. FC Magdeburg wie ein Absteiger: 0:7 in Karlsruhe;https://www.zeit.de/news/2024-03/17/1-fc-magdeburg-wie-ein-absteiger-0-7-in-karlsruhe;Hier finden Sie Informationen zu dem Thema „2. Bundesliga“. Lesen Sie jetzt „1. FC Magdeburg wie ein Absteiger: 0:7 in Karlsruhe“.;2. Bundesliga;News, 2. Bundesliga, Amara Conde, Jamie Lawrence, Marcel Franke, Paul Nebel, Igor Matanovic, Christian Titz, Karlsruhe, Magdeburg, 1. FC Magdeburg, Karlsruher SC;2024-03-17T18:09:53+01:00;2024-03-17T18:09:53+01:00;;dpa Sachsen;false
459ed8a5faa00430a8933b5273bc3dd76ebe3a0ff4a9f05167ebff3de8c902c7;Nawalnaja betritt russisches Botschaftsgelände in Berlin;https://www.zeit.de/news/2024-03/17/nawalnaja-betritt-russisches-botschaftsgelaende-in-berlin;Hier finden Sie Informationen zu dem Thema „Demonstrationen“. Lesen Sie jetzt „Nawalnaja betritt russisches Botschaftsgelände in Berlin“.;Demonstrationen;News, Demonstrationen, Wladimir Putin, Alexej Nawalny, Berlin, Botschaftsgelände, Demonstration;2024-03-17T18:06:06+01:00;2024-03-17T18:06:06+01:00;;dpa Berlin/Brandenburg;false
9a634b5914f0ffdf8567e67d9eb744c22a774cbe5b420d6f29ebf1cc7d57930b;Wirtz überragt: Leverkusen weiter auf dem Weg zum Titel;https://www.zeit.de/news/2024-03/17/3-2-in-freiburg-leverkusen-weiter-auf-dem-weg-zum-titel;Hier finden Sie Informationen zu dem Thema „Bundesliga“. Lesen Sie jetzt „Wirtz überragt: Leverkusen weiter auf dem Weg zum Titel“.;Bundesliga;News, Bundesliga, Florian Wirtz, Patrik Schick, Yannik Keitel, Freiburg, Hlozek, Leverkusen, Bayer 04 Leverkusen, SC Freiburg, Fußball-Bundesliga, Europa League;2024-03-17T17:56:41+01:00;2024-03-17T17:56:41+01:00;;dpa Baden-Württemberg;false
02a954eb2594c68a3502749d707634b7d2b4839aa211e7fc1a548a7833a48bb7;Hannovers Basketballerinnen gewinnen deutschen Pokal;https://www.zeit.de/news/2024-03/17/hannovers-basketballerinnen-gewinnen-deutschen-pokal;Hier finden Sie Informationen zu dem Thema „Basketball-Bundesliga“. Lesen Sie jetzt „Hannovers Basketballerinnen gewinnen deutschen Pokal“.;Basketball-Bundesliga;News, Basketball-Bundesliga, Hannover, Saarlouis, Nördlingen, BB, Pokal, Luchs, Basketball;2024-03-17T17:55:44+01:00;2024-03-17T17:55:44+01:00;;dpa Niedersachsen;false
9a634b5914f0ffdf8567e67d9eb744c22a774cbe5b420d6f29ebf1cc7d57930b;Wirtz überragt: Leverkusen weiter auf dem Weg zum Titel;https://www.zeit.de/news/2024-03/17/wirtz-ueberragt-leverkusen-weiter-auf-dem-weg-zum-titel;Hier finden Sie Informationen zu dem Thema „26. Spieltag“. Lesen Sie jetzt „Wirtz überragt: Leverkusen weiter auf dem Weg zum Titel“.;26. Spieltag;News, 26. Spieltag, Xabi Alonso, Florian Wirtz, Patrik Schick, Yannik Keitel, Freiburg, Hlozek, Leverkusen, Bayer, Bayer 04 Leverkusen, SC Freiburg;2024-03-17T17:53:13+01:00;2024-03-17T17:53:13+01:00;;dpa Sport;false
9a634b5914f0ffdf8567e67d9eb744c22a774cbe5b420d6f29ebf1cc7d57930b;Wirtz überragt: Leverkusen weiter auf dem Weg zum Titel;https://www.zeit.de/news/2024-03/17/leverkusen-unbeirrt-auf-titelkurs-3-2-in-freiburg;Hier finden Sie Informationen zu dem Thema „Bundesliga“. Lesen Sie jetzt „Wirtz überragt: Leverkusen weiter auf dem Weg zum Titel“.;Bundesliga;News, Bundesliga, Xabi Alonso, Freiburg, Leverkusen, Bayer 04 Leverkusen, SC Freiburg, Bundesliga, Titelkurs;2024-03-17T17:51:14+01:00;2024-03-17T17:51:14+01:00;;dpa Baden-Württemberg;false
e53a9efe34ed62af2dfd90eacf28823560754a86032ab9c427274f495bec1dbe;RMV legt Zwischenergebnisse für Regionaltangente Ost vor;https://www.zeit.de/news/2024-03/17/rmv-legt-zwischenergebnisse-fuer-regionaltangente-ost-vor;Hier finden Sie Informationen zu dem Thema „Verkehr“. Lesen Sie jetzt „RMV legt Zwischenergebnisse für Regionaltangente Ost vor“.;Verkehr;News, Verkehr, Frankfurt, Deutsche Bahn, Regionaltangente, Zwischenergebnis, Schienenring, Verkehr, Nahverkehrszug;2024-03-17T17:48:55+01:00;2024-03-17T17:48:55+01:00;;dpa Hessen;false
8ca693a04170c338ab6f547adca1bf16d8b627e2060794f5e77aea8961623113;Im Prozess gegen 80-Jährigen werden Plädoyers erwartet;https://www.zeit.de/news/2024-03/17/im-prozess-gegen-80-jaehrigen-werden-plaedoyers-erwartet;Hier finden Sie Informationen zu dem Thema „Prozess“. Lesen Sie jetzt „Im Prozess gegen 80-Jährigen werden Plädoyers erwartet“.;Prozess;News, Prozess, Wiesbaden, Staatsanwaltschaft, Plädoyer, Hinweistafel, Landgericht;2024-03-17T17:47:08+01:00;2024-03-17T17:47:08+01:00;;dpa Hessen;false
814f27a0369ac99ff9bddc79d569e458303e57173b65652830e2fdcd9e0a4977;"Internetauftritte als ""Officer"" untersagt: Polizist klagt";https://www.zeit.de/news/2024-03/17/internetauftritte-als-officer-untersagt-polizist-klagt;"Hier finden Sie Informationen zu dem Thema „Justiz“. Lesen Sie jetzt „Internetauftritte als ""Officer"" untersagt: Polizist klagt“.";Justiz;News, Justiz, Verwaltungsgericht, Internetauftritt;2024-03-17T17:46:32+01:00;2024-03-17T17:46:32+01:00;;dpa Berlin/Brandenburg;false
a331eb87f54af9ffe7945ccc5b8fc32b364cb1dd027efa64d21a755d0bc077da;"""Geld spielt keine Rolle""";https://www.zeit.de/2024/12/qatar-philharmonic-orchestra-kurt-meister-olaf-scholz;Vom Bayerischen Staatsorchester wechselte Kurt Meister in den Wüstenstaat, zum Qatar Philharmonic Orchestra. Jetzt lässt er auch Disney-Soundtracks für Scheichs spielen.;Qatar Philharmonic Orchestra;Entdecken, Qatar Philharmonic Orchestra, Orchester, Katar, Menschenrechte, Homosexualität, BR, Doha, Kurt Meister;2024-03-17T17:45:38+01:00;2024-03-17T17:45:38+01:00;Bernhard HecklerFlorian Zinnecker;;true
a932c4d18a4b4f401694c0e364cbd157d5b4b5bd4a03de224072fc1ba15f7830;Handballerinnen gewinnen Hinspiel um Viertelfinaleinzug;https://www.zeit.de/news/2024-03/17/handballerinnen-gewinnen-hinspiel-um-viertelfinaleinzug;Hier finden Sie Informationen zu dem Thema „Champions League“. Lesen Sie jetzt „Handballerinnen gewinnen Hinspiel um Viertelfinaleinzug“.;Champions League;News, Champions League, Xenia Smits, Bietigheim, Champions League, Viertelfinaleinzug;2024-03-17T17:45:20+01:00;2024-03-17T17:45:20+01:00;;dpa Baden-Württemberg;false
bd6084b22e90076f9c62290a7d28f7d462cb2f50ee2a13d6cc4d83ec6d498d77;Einbrecher schlagen mit Besenstiel: Ein Schwerverletzter;https://www.zeit.de/news/2024-03/17/einbrecher-schlagen-mit-besenstiel-ein-schwerverletzter;Hier finden Sie Informationen zu dem Thema „Kriminalität“. Lesen Sie jetzt „Einbrecher schlagen mit Besenstiel: Ein Schwerverletzter“.;Kriminalität;News, Kriminalität, Polizei, Besenstiel, Blaulicht, Polizeifahrzeug, Kriminalität;2024-03-17T17:45:12+01:00;2024-03-17T17:45:12+01:00;;dpa Berlin/Brandenburg;false
bf304fad496b9bd0939edf0db363ff1a07f16b99d2865f61787babb31e637d3c;Spezialkräfte: Terroranschlag bei EM simuliert;https://www.zeit.de/news/2024-03/17/spezialkraefte-terroranschlag-bei-em-simuliert;Hier finden Sie Informationen zu dem Thema „Rettungsdienst“. Lesen Sie jetzt „Spezialkräfte: Terroranschlag bei EM simuliert“.;Rettungsdienst;News, Rettungsdienst, Joachim Herrmann, Österreich, Oberpfalz, Bayern, Mittelfranken, Rosenberg, Polizei, Bundeswehr, CSU, Fußball-EM;2024-03-17T17:43:52+01:00;2024-03-17T17:43:52+01:00;;dpa Bayern;false
9c78a90f84cc3e409950031dbcf0f836d0a0a1c230fe188815442b9c47629a63;Experten wollen Strände nach Winterstürmen auf Sylt prüfen;https://www.zeit.de/news/2024-03/17/experten-wollen-straende-nach-winterstuermen-auf-sylt-pruefen;Hier finden Sie Informationen zu dem Thema „Naturschutz“. Lesen Sie jetzt „Experten wollen Strände nach Winterstürmen auf Sylt prüfen“.;Naturschutz;News, Naturschutz, Sylt, Westerland, Wintersturm, Naturschutz, Strand, Winter;2024-03-17T17:43:32+01:00;2024-03-17T17:43:32+01:00;;dpa Hamburg/Schleswig-Holstein;false
fe2a373c7f4ecc45dbf4e5cfb7514ca96555760c0949d3d6a650e2f8e69d2e79;Mehr Straftaten in Bayern;https://www.zeit.de/news/2024-03/17/mehr-straftaten-in-bayern;Hier finden Sie Informationen zu dem Thema „Polizei“. Lesen Sie jetzt „Mehr Straftaten in Bayern“.;Polizei;News, Polizei, Bayern, Schleswig-Holstein, Polizei, Straftat, Kriminalstatistik, Streifenwagen, Blaulicht;2024-03-17T17:42:32+01:00;2024-03-17T17:42:32+01:00;;dpa Bayern;false
4723e621d96e0940bcb8663426aa17cc86ba9318ba0d2b1fc0a04556194755bf;Habeck bei Wasserstoffkonferenz in Hamburg;https://www.zeit.de/news/2024-03/17/habeck-bei-wasserstoffkonferenz-in-hamburg;Hier finden Sie Informationen zu dem Thema „Energie“. Lesen Sie jetzt „Habeck bei Wasserstoffkonferenz in Hamburg“.;Energie;News, Energie, Robert Habeck, Hamburg, Kanada, Wasserstoffkonferenz, Wasserstoffabkommen, Unterzeichnung, Beziehung;2024-03-17T17:42:06+01:00;2024-03-17T17:42:06+01:00;;dpa Hamburg/Schleswig-Holstein;false
119f957fb219e89606531e579468511a99e9c8176e929ce7129d3825f18c37a2;Obacht, da kommt was;https://www.zeit.de/2024/12/demokratie-berlinale-afd-buchmesse-kultur;Ansichten, die einem nicht passen, gelten schnell als undemokratisch. Die Leipziger Buchmesse wird zeigen, wie viel Freiheit abweichenden Positionen zugestanden wird.;Demokratie;Kultur, Demokratie, Leipziger Buchmesse, Literatur, Rechtsextremismus, Antisemitismus, Demokratie, Berlinale, Islamisches Zentrum Hamburg, Bundestag, Obacht, Erfolg;2024-03-17T17:41:47+01:00;2024-03-17T17:41:47+01:00;Jens Jessen;;true
7187f462034d329391d099a9159bfdd1f697e2b5d4d7a911d0e006ed28b32a05;Prozess um tödlichen Raserunfall beginnt erneut;https://www.zeit.de/news/2024-03/17/prozess-um-toedlichen-raserunfall-beginnt-erneut;Hier finden Sie Informationen zu dem Thema „Prozess“. Lesen Sie jetzt „Prozess um tödlichen Raserunfall beginnt erneut“.;Prozess;News, Prozess, Daniela Gabler, München, Amtsgericht, Landgericht München, Raserunfall;2024-03-17T17:41:08+01:00;2024-03-17T17:41:08+01:00;;dpa Bayern;false
edf173d5df8d64dfdcc32ea333a73cec973ec44aa412eaaf1764565f65de20e6;Hamburg Towers mit deutlicher Niederlage in Würzburg;https://www.zeit.de/news/2024-03/17/hamburg-towers-mit-deutlicher-niederlage-in-wuerzburg;Hier finden Sie Informationen zu dem Thema „Basketball-Bundesliga“. Lesen Sie jetzt „Hamburg Towers mit deutlicher Niederlage in Würzburg“.;Basketball-Bundesliga;News, Basketball-Bundesliga, Würzburg, Hamburg, Hamburg Towers, BB, Veolia, Playoff, Niederlage;2024-03-17T17:40:29+01:00;2024-03-17T17:40:29+01:00;;dpa Hamburg/Schleswig-Holstein;false
42a92ef761e89941abe713ebec2765788f737c661d9feb0b2589fcd7877e2d5e;Krankenkassen um fünf Millionen Euro betrogen?;https://www.zeit.de/news/2024-03/17/krankenkassen-um-fuenf-millionen-euro-betrogen;Hier finden Sie Informationen zu dem Thema „Prozess“. Lesen Sie jetzt „Krankenkassen um fünf Millionen Euro betrogen?“.;Prozess;News, Prozess, Strafjustizzentrum, Landgericht, Krankenkasse;2024-03-17T17:39:48+01:00;2024-03-17T17:39:48+01:00;;dpa Bayern;false
8c3e127c09265b90297888119ce5bef5551e864e6a56c6c1824456c2e9267205;Trainer Hasenhüttl wird beim VfL Wolfsburg vorgestellt;https://www.zeit.de/news/2024-03/17/trainer-hasenhuettl-wird-beim-vfl-wolfsburg-vorgestellt;Hier finden Sie Informationen zu dem Thema „Fußball“. Lesen Sie jetzt „Trainer Hasenhüttl wird beim VfL Wolfsburg vorgestellt“.;Fußball;News, Fußball, Ralph Hasenhüttl, Niko Kovač, Southampton, VfL Wolfsburg, Fußball;2024-03-17T17:38:15+01:00;2024-03-17T17:38:15+01:00;;dpa Niedersachsen;false
e92b9fa97c6ac00a2ace8cb67007ab23cf72d48ac07e8c188ec5f14d8bec5fa1;Vertreter sprechen über Hochwasser und Umweltthemen;https://www.zeit.de/news/2024-03/17/vertreter-sprechen-ueber-hochwasser-und-umweltthemen;Hier finden Sie Informationen zu dem Thema „Umwelt“. Lesen Sie jetzt „Vertreter sprechen über Hochwasser und Umweltthemen“.;Umwelt;News, Umwelt, Neckar, Oberrhein, Mannheim, Rhein, Umweltthema, Hochwasser, Hochwasserschutz;2024-03-17T17:37:55+01:00;2024-03-17T17:37:55+01:00;;dpa Baden-Württemberg;false
a9bf9c96a90e95ba7da45643aac21f09d7e98f6e2c87ee70225aac0b496cc5f4;Urteil gegen psychisch Kranken nach Tötung erwartet;https://www.zeit.de/news/2024-03/17/urteil-gegen-psychisch-kranken-nach-toetung-erwartet;Hier finden Sie Informationen zu dem Thema „Urteil“. Lesen Sie jetzt „Urteil gegen psychisch Kranken nach Tötung erwartet“.;Urteil;News, Urteil, Wiesloch, Rhein-Neckar-Kreis, Spurensicherung, Tötung;2024-03-17T17:36:16+01:00;2024-03-17T17:36:16+01:00;;dpa Baden-Württemberg;false
8b2a9e3efc166a2b3eb41db080474cfd49b0058e68cd0ed80660bf4371b7b52e;Microsoft stellt Pläne für Rechenzentren vor;https://www.zeit.de/news/2024-03/17/microsoft-stellt-plaene-fuer-rechenzentren-vor;Hier finden Sie Informationen zu dem Thema „Internet“. Lesen Sie jetzt „Microsoft stellt Pläne für Rechenzentren vor“.;Internet;News, Internet, Marianne Janik, Microsoft, Rechenzentrum;2024-03-17T17:36:13+01:00;2024-03-17T17:36:13+01:00;;dpa Nordrhein-Westfalen;false
f3d2f2ca6dc8476ffa4b06e57e0436e402c9ca52fbf9514f31cb4bef1a477fb3;BR Volleys starten mit souveränem Sieg ins Viertelfinale;https://www.zeit.de/news/2024-03/17/br-volleys-starten-mit-souveraenem-sieg-ins-viertelfinale;Hier finden Sie Informationen zu dem Thema „Volleyball“. Lesen Sie jetzt „BR Volleys starten mit souveränem Sieg ins Viertelfinale“.;Volleyball;News, Volleyball, Joel Banks, Berlin, Karlsruhe, BR, Bundesliga, Volley, Volleyball;2024-03-17T17:31:37+01:00;2024-03-17T17:31:37+01:00;;dpa Berlin/Brandenburg;false
9ee809d69206ff5b95e3b6f14bfba2f7bdc20f0f873e6b6805c4752de588b0c4;Ralph Hasenhüttl wird neuer Trainer von VfL Wolfsburg;https://www.zeit.de/sport/2024-03/fussball-ralph-hasenhuettl-niko-kova-wolfburg;Nur wenige Stunden nachdem sich Wolfsburg von Trainer Niko Kovač getrennt hat, verkündet der Verein seinen Nachfolger. Ralph Hasenhüttl wird den Posten übernehmen.;Fußball;Sport, Fußball, Champions League, RB Leipzig, Niko Kovač, VfL Wolfsburg, Fußball, Wolfsburg, Ralph Hasenhüttl;2024-03-17T17:19:52+01:00;2024-03-17T17:19:52+01:00;;ZEIT ONLINE,        dpa,        edd;false
7fa30c0c61926c8a6bae7b8e7b902d721365af7b2eb62ce4fa55c0ac1e9494e3;21-Jähriger durch Stichwaffe verletzt;https://www.zeit.de/news/2024-03/17/21-jaehriger-durch-stichwaffe-verletzt;Hier finden Sie Informationen zu dem Thema „Auseinandersetzung“. Lesen Sie jetzt „21-Jähriger durch Stichwaffe verletzt“.;Auseinandersetzung;News, Auseinandersetzung, Polizei, Stichwaffe, Auseinandersetzung, Blaulicht, Polizeifahrzeug;2024-03-17T17:19:00+01:00;2024-03-17T17:19:00+01:00;;dpa Niedersachsen;false
32187b66af80d275b102f8aaf32b737cdc5c0f645d9a3a66ea3822f4ff2ffb0c;24-Jährige rassistisch beleidigt und verletzt;https://www.zeit.de/news/2024-03/17/24-jaehrige-rassistisch-beleidigt-und-verletzt;Hier finden Sie Informationen zu dem Thema „Kriminalität“. Lesen Sie jetzt „24-Jährige rassistisch beleidigt und verletzt“.;Kriminalität;News, Kriminalität, Polizei, Einsatzfahrzeug, Kriminalität;2024-03-17T17:12:19+01:00;2024-03-17T17:12:19+01:00;;dpa Berlin/Brandenburg;false
77536a7531de1526e47db48fb2b469466cd83997e5aa2264ed08ea9ade588462;Räuber überfällt Tankstelle;https://www.zeit.de/news/2024-03/17/raeuber-ueberfaellt-tankstelle;Hier finden Sie Informationen zu dem Thema „Kriminalität“. Lesen Sie jetzt „Räuber überfällt Tankstelle“.;Kriminalität;News, Kriminalität, Polizei, Fototermin, Polizeifahrzeug, Eifelort, Kriminalität, Tankstelle;2024-03-17T17:09:32+01:00;2024-03-17T17:09:32+01:00;;dpa Rheinland-Pfalz/Saarland;false
9ce8ffe198c44dfa81bf903ff028ee3488d9802663c546eb9bfcda7d0253f945;Mutter und Tochter bei Auffahrunfall schwer verletzt;https://www.zeit.de/news/2024-03/17/mutter-und-tochter-bei-auffahrunfall-schwer-verletzt;Hier finden Sie Informationen zu dem Thema „Unfall“. Lesen Sie jetzt „Mutter und Tochter bei Auffahrunfall schwer verletzt“.;Unfall;News, Unfall, Polizei, Auffahrunfall, Unfall, Dachschild, Einsatzwagen, Auto;2024-03-17T17:07:55+01:00;2024-03-17T17:07:55+01:00;;dpa Baden-Württemberg;false
078410894708614f4b166e80abe221bcf1792a83222731b4684741749d1968b1;TikTok, der politische Brutkasten;https://www.zeit.de/kultur/2024-03/tiktok-verbot-usa-wahlkampf-europa-social-media;Obama profitierte von Facebook, Trump hetzte auf Twitter. Nun ist TikTok das Netzwerk der Stunde. Wie die chinesische Plattform weltweit zum Faktor bei Wahlen wird.;Social Media;Kultur, Social Media, TikTok, USA, Social Media, Pakistan, Indonesien, El Salvador;2024-03-17T17:05:28+01:00;2024-03-17T17:05:28+01:00;Götz HamannSonja Peteranderl;;false
bed14315b73dbe95eed5b762e2fc4c866dba391464363ac58c4279eefe834652;"""Wir klettern nicht gegen Felsen, sondern mit ihm""";https://www.zeit.de/sport/2024-03/bergsteigen-sachsen-immaterielles-kulturerbe-elbsandsteingebirge;Das Bergsteigen in Sachsen ist in die Liste des immateriellen Kulturerbes aufgenommen worden. Weil es ganz anders ist als in anderen Regionen – oder der Kletterhalle.;Bergsteigen in Sachsen;Sport, Bergsteigen in Sachsen, Nationalpark, Sachsen, Bergsteigen, Freizeit, Amateursport, Naturschutz, Sächsische Schweiz, Elbsandsteingebirge;2024-03-17T17:03:04+01:00;2024-03-17T17:03:04+01:00;Marie-Luise Grauel;;false
af551c10a7a262941f39d9b53b6a116d86775dfc49b01c555f343d1678885769;Zwei Verletzte durch Wohnungsbrand in Duisburger Innenstadt;https://www.zeit.de/news/2024-03/17/zwei-verletzte-durch-wohnungsbrand-in-duisburger-innenstadt;Hier finden Sie Informationen zu dem Thema „Feuerwehreinsatz“. Lesen Sie jetzt „Zwei Verletzte durch Wohnungsbrand in Duisburger Innenstadt“.;Feuerwehreinsatz;News, Feuerwehreinsatz, Feuerwehr, Wohnungsbrand, Feuerwehreinsatz, Innenstadt, Notrufnummer;2024-03-17T17:01:58+01:00;2024-03-17T17:01:58+01:00;;dpa Nordrhein-Westfalen;false
de9497fadd112b00fb6f4b5a12615bfa9c0c49cdd33e0c86d2b021a2ba3235fe;Schützen wollen mit AfD-Mitgliedern nichts zu tun haben;https://www.zeit.de/news/2024-03/17/schuetzen-wollen-mit-afd-mitgliedern-nichts-zu-tun-haben;Hier finden Sie Informationen zu dem Thema „Brauchtum“. Lesen Sie jetzt „Schützen wollen mit AfD-Mitgliedern nichts zu tun haben“.;Brauchtum;News, Brauchtum, Emil Vogt, St. Sebastianus, Alternative für Deutschland, Brauchtum, Schützenbruderschaft, Schützenhalle;2024-03-17T17:00:06+01:00;2024-03-17T17:00:06+01:00;;dpa Nordrhein-Westfalen;false
6bc7c301ada1be927c18189407a6ddcdd28e4b8a8a586bf9b5eb7ab452b7e625;Was man für die Haut tun kann, bevor sie alt ist;https://www.zeit.de/zett/2024-02/hautpflege-skincare-routine-tipps-anti-aging-1-hautton-5-1;Muss man schon mit Mitte 20 Botox spritzen oder jeden Abend Retinol benutzen? Fünf Expert:innen erklären, welche Skincaretipps übertrieben sind – und welche richtig gut.;Hautpflege;Kosmetik, Pflege, Vitamin, Konsum, Alltag, Freizeit;2024-03-17T16:57:57+01:00;2024-03-17T16:57:57+01:00;Rebecca Habtemariam;;false
268de18427a8a60e29966db28c2c9db81441f291f69db2b7ce2860cc70f0ade5;Wenige Teilnehmer bei Demo für Daniela Klette vor Gefängnis;https://www.zeit.de/news/2024-03/17/ex-raf-terroristin-zwei-demonstrationen-in-vechta-gestartet;Hier finden Sie Informationen zu dem Thema „Ex-RAF-Terroristin“. Lesen Sie jetzt „Wenige Teilnehmer bei Demo für Daniela Klette vor Gefängnis“.;Ex-RAF-Terroristin;News, Ex-RAF-Terroristin, Daniela Klette, Vechta, RAF, Polizei, Demonstration, Justizvollzugsanstalt;2024-03-17T16:56:31+01:00;2024-03-17T16:56:31+01:00;;dpa Berlin/Brandenburg;false
d100d2de58bf139945d59b44295caddd65076e50a73e7b551da22cb86ad990e9;Wolfsburg im Abstiegskampf: Hasenhüttl ersetzt Kovac;https://www.zeit.de/news/2024-03/17/medien-kovac-aus-in-wolfsburg-beschlossen;Hier finden Sie Informationen zu dem Thema „Bundesliga“. Lesen Sie jetzt „Wolfsburg im Abstiegskampf: Hasenhüttl ersetzt Kovac“.;Bundesliga;News, Bundesliga, Niko Kovač, Wolfsburg, VfL Wolfsburg, Bundesliga;2024-03-17T16:56:06+01:00;2024-03-17T16:56:06+01:00;;dpa;false
80701da75f6ac12b7b80de5c473017104eb35b9005a3d413fd1621b5d9d8e3ae;Demos gegen Rechtsextremismus und Antisemitismus;https://www.zeit.de/news/2024-03/17/demos-gegen-rechtsextremismus-und-antisemitismus;Hier finden Sie Informationen zu dem Thema „Demonstration“. Lesen Sie jetzt „Demos gegen Rechtsextremismus und Antisemitismus“.;Demonstration;News, Demonstration, Saarland, Saarbrücken, Alternative für Deutschland, Polizei, Demonstration, Antisemitismus, Aktionsbündnis, Islamfeindlichkeit, Rechtsextremismus;2024-03-17T16:46:39+01:00;2024-03-17T16:46:39+01:00;;dpa Rheinland-Pfalz/Saarland;false
9b4436e2189b4333554b5eb4fc97e57d9f2c23afbd20a9d503a20525e541eb9d;Karlsruher SC feiert eingestellten Clubrekord;https://www.zeit.de/news/2024-03/17/karlsruher-sc-nach-magdeburger-fehlern-zur-stelle;Hier finden Sie Informationen zu dem Thema „2. Bundesliga“. Lesen Sie jetzt „Karlsruher SC feiert eingestellten Clubrekord“.;2. Bundesliga;News, 2. Bundesliga, Karlsruher SC, Fußball-Bundesliga, 1. FC Magdeburg, Bundesliga, Traumstart;2024-03-17T16:44:29+01:00;2024-03-17T16:44:29+01:00;;dpa Baden-Württemberg;false
da638d2091b3788b13191aa7ad4b1431cb07d85e5311958ad8543dcb1c0b1578;"""Wunderschöner Sonntag"": Hertha siegt offensiv gegen Schalke";https://www.zeit.de/news/2024-03/17/turbulentes-5-2-hertha-siegt-gegen-schalke;"Hier finden Sie Informationen zu dem Thema „2. Bundesliga“. Lesen Sie jetzt „""Wunderschöner Sonntag"": Hertha siegt offensiv gegen Schalke“.";2. Bundesliga;News, 2. Bundesliga, Tomas Kalas, Schalke, Hertha BSC, Hertha BSC Berlin, FC Schalke 04;2024-03-17T16:44:05+01:00;2024-03-17T16:44:05+01:00;;dpa Berlin/Brandenburg;false
9a52d88517dc4974a2b5e89b88de417574038ac31e633a588b0583a11c0a93be;Polnische Bauern blockieren Grenzübergang nach Deutschland;https://www.zeit.de/wirtschaft/2024-03/bauernproteste-autobahnblockade-deutsch-polnische-grenze;Weil ihnen EU-Umweltauflagen zu streng sind, haben polnische Bauern erneut eine Autobahn Richtung Deutschland blockiert. Die Aktion soll noch bis Mittwoch dauern.;Bauernproteste;Wirtschaft, Bauernproteste, Polen, Landwirtschaft, Europäische Union, Protest, Agrarpolitik, Autobahn, EU;2024-03-17T16:42:38+01:00;2024-03-17T16:42:38+01:00;;ZEIT ONLINE,        AFP,        lak;false
aa5d690fff1c5d0be2c392c5d6138999e8cfe9895c7ce2e0cabc8e1e2b36333b;Mit viel Mühe: Bremerhaven gewinnt erstes DEL-Viertelfinale;https://www.zeit.de/news/2024-03/17/mit-viel-muehe-bremerhaven-gewinnt-erstes-del-viertelfinale;Hier finden Sie Informationen zu dem Thema „Eishockey“. Lesen Sie jetzt „Mit viel Mühe: Bremerhaven gewinnt erstes DEL-Viertelfinale“.;Eishockey;News, Eishockey, Thomas Popiesch, Bremerhaven, Ingolstadt, DEL, Eishockey;2024-03-17T16:40:41+01:00;2024-03-17T16:40:41+01:00;;dpa Niedersachsen;false
c7427f97a5ddee0b445fd9daa652e1848baa05673ba8b0072808d9fe6cae2b92;Hasenhüttl folgt auf Kovac und wird neuer Wolfsburg-Trainer;https://www.zeit.de/news/2024-03/17/hasenhuettl-folgt-auf-kovac-und-wird-neuer-wolfsburg-trainer;Hier finden Sie Informationen zu dem Thema „Bundesliga“. Lesen Sie jetzt „Hasenhüttl folgt auf Kovac und wird neuer Wolfsburg-Trainer“.;Bundesliga;News, Bundesliga, Ralph Hasenhüttl, Niko Kovač, Wolfsburg, Niedersachsen, VfL Wolfsburg, Fußball-Bundesliga, Bundesliga;2024-03-17T16:40:08+01:00;2024-03-17T16:40:08+01:00;;dpa Sport;false
c7427f97a5ddee0b445fd9daa652e1848baa05673ba8b0072808d9fe6cae2b92;Hasenhüttl folgt auf Kovac und wird neuer Wolfsburg-Trainer;https://www.zeit.de/news/2024-03/17/ralph-hasenhuettl-ist-neuer-trainer-des-vfl-wolfsburg;Hier finden Sie Informationen zu dem Thema „Bundesliga“. Lesen Sie jetzt „Hasenhüttl folgt auf Kovac und wird neuer Wolfsburg-Trainer“.;Bundesliga;News, Bundesliga, Ralph Hasenhüttl, VfL Wolfsburg, Fußball;2024-03-17T16:39:32+01:00;2024-03-17T16:39:32+01:00;;dpa Niedersachsen;false
