Hash;Title;Link;Description;Category;KeyWords;Published;LastUpdated;Author;Source;Paywall
7784a083ec9aaf2d32ab146c1123f7f5d8b0207728e52325f09196ad28054795;Zahl der Ärzte aus dem Ausland mehr als verdoppelt;https://www.zeit.de/gesundheit/2026-02/aerzte-ausland-anteil-deutschland;Jeder achte Mediziner hatte 2024 keinen deutschen Pass, jeder vierte war ein Zuwanderer. Zehn Jahre zuvor kamen noch weniger als halb so viele Ärzte aus dem Ausland.;Statistisches Bundesamt;Gesundheit, Statistisches Bundesamt, Gesundheit;2026-02-24T10:10:31+01:00;2026-02-24T10:10:31+01:00;cga;DIE ZEIT,        dpa,        Reuters,        							cga;false
a62bd0575d96abb89654e0c1c3b5fd81451523115ae87c9b5bfc3470bdf29031;Nach Havarie kann Schiff bald weiterfahren;https://www.zeit.de/news/2026-02/24/nach-havarie-kann-schiff-bald-weiterfahren;Hier finden Sie Informationen zu dem Thema „Schifffahrt“. Lesen Sie jetzt „Nach Havarie kann Schiff bald weiterfahren“.;Schifffahrt;News, Schifffahrt, Andernach, Schifffahrt, Güterschiff, Schweißarbeit, Havarie, Schiff;2026-02-24T10:09:36+01:00;2026-02-24T10:09:36+01:00;;dpa Rheinland-Pfalz/Saarland;false
8fc583dfb871360a90641b9745d7c6619c9366f2f7522549340d9e9682176743;ÖPNV-Warnstreik in Sachsen, Sachsen-Anhalt und Thüringen;https://www.zeit.de/news/2026-02/24/oepnv-warnstreik-in-sachsen-sachsen-anhalt-und-thueringen;Hier finden Sie Informationen zu dem Thema „Verdi“. Lesen Sie jetzt „ÖPNV-Warnstreik in Sachsen, Sachsen-Anhalt und Thüringen“.;Verdi;News, Verdi, Sachsen, Thüringen, Sachsen-Anhalt, Ver.di, Warnstreik, Pendler;2026-02-24T10:08:39+01:00;2026-02-24T10:08:39+01:00;;dpa Sachsen;false
7d8061e120bf0f545fc64cba0d42cc3569165f9347b28573c7d9a712cf894452;Nach Messerangriff an Schule: Opfer erhält Unterstützung;https://www.zeit.de/news/2026-02/24/nach-messerangriff-an-schule-opfer-erhaelt-unterstuetzung;Hier finden Sie Informationen zu dem Thema „Schulen“. Lesen Sie jetzt „Nach Messerangriff an Schule: Opfer erhält Unterstützung“.;Schulen;News, Schulen, Bretten, Baden-Württemberg, Landkreis Karlsruhe, LKA, Polizei, Messerangriff;2026-02-24T10:08:39+01:00;2026-02-24T10:08:39+01:00;;dpa Baden-Württemberg;false
dbf100956a0529b0f7402dcb9188845d1d9b852879b14fc01506f819769f79a3;Warnstreiks im NRW-Nahverkehr am Freitag und Samstag;https://www.zeit.de/news/2026-02/24/verdi-ruft-zu-warnstreik-im-nahverkehr-auf;Hier finden Sie Informationen zu dem Thema „Tarifkonflikt mit Folgen“. Lesen Sie jetzt „Warnstreiks im NRW-Nahverkehr am Freitag und Samstag“.;Tarifkonflikt mit Folgen;News, Tarifkonflikt mit Folgen, Ver.di, Nahverkehr, Warnstreik;2026-02-24T10:06:35+01:00;2026-02-24T10:06:35+01:00;;dpa Nordrhein-Westfalen;false
18573f50631509d3701c1e59f3985810560155c0fab319f5bda21fbec49b0651;Ver.di ruft für Freitag und Samstag zu Warnstreiks im Nahverkehr auf;https://www.zeit.de/arbeit/2026-02/verdi-ruft-fuer-freitag-und-samstag-zu-warnstreiks-im-nahverkehr-auf;Lesen Sie jetzt „Ver.di ruft für Freitag und Samstag zu Warnstreiks im Nahverkehr auf“.;;Arbeit, Verdi, Nahverkehr, Warnstreik;2026-02-24T10:05:10+01:00;2026-02-24T10:05:10+01:00;;;false
786612a814cf080e202373b085b9711d8cebff324e74ca0d9966be3e5142a63d;Verdi ruft zu bundesweiten Warnstreiks im ÖPNV auf;https://www.zeit.de/news/2026-02/24/verdi-ruft-zu-bundesweiten-warnstreiks-im-oepnv-auf;Hier finden Sie Informationen zu dem Thema „Ausfälle bei Bus und Bahn“. Lesen Sie jetzt „Verdi ruft zu bundesweiten Warnstreiks im ÖPNV auf“.;Ausfälle bei Bus und Bahn;News, Ausfälle bei Bus und Bahn, Christine Behle, Hamburg-Holstein, Baden-Württemberg, Niedersachsen, Ver.di, Ausfall, Warnstreik;2026-02-24T10:04:31+01:00;2026-02-24T10:04:31+01:00;;dpa;false
1874e6b275efe840476c56bdced739467ee95c73b92f2667440a39edf6fb7313;Was man zu den ÖPNV-Warnstreiks Ende der Woche wissen muss;https://www.zeit.de/news/2026-02/24/was-man-zu-den-oepnv-warnstreiks-ende-der-woche-wissen-muss;Hier finden Sie Informationen zu dem Thema „Ausfälle bei Bus und Bahn“. Lesen Sie jetzt „Was man zu den ÖPNV-Warnstreiks Ende der Woche wissen muss“.;Ausfälle bei Bus und Bahn;News, Ausfälle bei Bus und Bahn, Ver.di, Ausfall, Warnstreik, Wetter;2026-02-24T10:03:04+01:00;2026-02-24T10:03:04+01:00;;dpa;false
75bddca5ed8938aacb3cf8916b84cf055c949439b8c611ba840f4c8dd8daa649;Zwei Tage Warnstreik im Nahverkehr in 13 Städten Bayerns;https://www.zeit.de/news/2026-02/24/zwei-tage-warnstreik-im-nahverkehr-in-13-staedten-bayerns;Hier finden Sie Informationen zu dem Thema „Tarifkonflikt“. Lesen Sie jetzt „Zwei Tage Warnstreik im Nahverkehr in 13 Städten Bayerns“.;Tarifkonflikt;News, Tarifkonflikt, Bayern, Ver.di, Nahverkehr, Warnstreik;2026-02-24T10:01:25+01:00;2026-02-24T10:01:25+01:00;;dpa Bayern;false
3857d7b18c92372462eb0d0b8d58cc00688c0fad591c40ac968c205d410a8f6c;Verdi ruft in Berlin zu zweitägigem ÖPNV-Warnstreik auf;https://www.zeit.de/news/2026-02/24/verdi-ruft-in-berlin-zu-zweitaegigem-oepnv-warnstreik-auf;Hier finden Sie Informationen zu dem Thema „Tarifverhandlungen bei der BVG“. Lesen Sie jetzt „Verdi ruft in Berlin zu zweitägigem ÖPNV-Warnstreik auf“.;Tarifverhandlungen bei der BVG;News, Tarifverhandlungen bei der BVG, Berlin, BVG, Ver.di, Deutsche Bahn, Tarifverhandlung, Ausstand, Warnstreik;2026-02-24T10:00:33+01:00;2026-02-24T10:00:33+01:00;;dpa Berlin/Brandenburg;false
5eb8ab113234930c06557ddc9ec59e36ef917b1526c41dd513f1d5f5fe105655;Verdi ruft zu bundesweiten Warnstreiks im Nahverkehr auf;https://www.zeit.de/news/2026-02/24/verdi-ruft-zu-bundesweiten-warnstreiks-im-nahverkehr-auf;Hier finden Sie Informationen zu dem Thema „Tarife“. Lesen Sie jetzt „Verdi ruft zu bundesweiten Warnstreiks im Nahverkehr auf“.;Tarife;News, Tarife, Ver.di, Nahverkehr, Warnstreik;2026-02-24T10:00:24+01:00;2026-02-24T10:00:24+01:00;;dpa;false
ef1648a9a921905cd889b7616ae5754f55fd48c4396b09ae3f8d22633d66048c;Warnstreik im Bremer Nahverkehr: Was Fahrgäste wissen müssen;https://www.zeit.de/news/2026-02/24/warnstreik-im-bremer-nahverkehr-was-fahrgaeste-wissen-muessen;Hier finden Sie Informationen zu dem Thema „Ausfälle bei Bus und Bahn“. Lesen Sie jetzt „Warnstreik im Bremer Nahverkehr: Was Fahrgäste wissen müssen“.;Ausfälle bei Bus und Bahn;News, Ausfälle bei Bus und Bahn, Bremen, Niedersachsen, BSAG, Ver.di, Bremer Straßenbahn AG, Nahverkehr, Ausfall, Warnstreik, Auto;2026-02-24T10:00:07+01:00;2026-02-24T10:00:07+01:00;;dpa Niedersachsen;false
464ac458b177bba387fb938a99767462eb0e57ae8c71181ceddd6b68457b0032;Zwei Jungen in Barßel vermisst – Suche läuft weiter;https://www.zeit.de/news/2026-02/24/zwei-jungen-in-barssel-vermisst-suche-laeuft-weiter;Hier finden Sie Informationen zu dem Thema „Kinder verschwunden“. Lesen Sie jetzt „Zwei Jungen in Barßel vermisst – Suche läuft weiter“.;Kinder verschwunden;News, Kinder verschwunden, Barßel, Cloppenburg, Landkreis Cloppenburg, Polizei, Verbrechen;2026-02-24T09:59:50+01:00;2026-02-24T09:59:50+01:00;;dpa Niedersachsen;false
4b77b6bd5c2565978d18f1d61b79e844084447468ee4b1c96dc4948c859562c9;Bilder des Tages;https://www.zeit.de/news/2026-02/24/bilder-des-tages;Hier finden Sie Informationen zu dem Thema „Fotografie“. Lesen Sie jetzt „Bilder des Tages“.;Fotografie;News, Fotografie, News;2026-02-24T09:58:39+01:00;2026-02-24T09:58:39+01:00;;dpa;false
4666f8d4c3ca49024894b824fccf8eaeb8942fd29eb47ace21f8f22818988927;Mobilfunkfirma O2 schwächelt - Verlust von 1&1 wiegt schwer;https://www.zeit.de/news/2026-02/24/mobilfunkfirma-o2-schwaechelt-verlust-von-1-1-wiegt-schwer;Hier finden Sie Informationen zu dem Thema „Handynetz“. Lesen Sie jetzt „Mobilfunkfirma O2 schwächelt - Verlust von 1&1 wiegt schwer“.;Handynetz;News, Handynetz, München, Vodafone, 1&1, Telefónica, Mobilfunkfirma, Handynetz, Wegfall, Umsatz, Geld;2026-02-24T09:49:27+01:00;2026-02-24T09:49:27+01:00;;dpa;false
7ca4956ef29b7cccfef3d15fdeb10b0e14737cc275321cd06e2e3c689decddaf;KI bei der Polizei: Land setzt auf Lösung aus dem Bund;https://www.zeit.de/news/2026-02/24/ki-bei-der-polizei-land-setzt-auf-loesung-aus-dem-bund;Hier finden Sie Informationen zu dem Thema „Datenanalysen“. Lesen Sie jetzt „KI bei der Polizei: Land setzt auf Lösung aus dem Bund“.;Datenanalysen;News, Datenanalysen, Oliver Stegert, Magdeburg, Sachsen-Anhalt, Polizei, Innenministerium, SPD, Palantir, Datenanalyse;2026-02-24T09:46:47+01:00;2026-02-24T09:46:47+01:00;;dpa Sachsen;false
9033b5f2c027eef9ea847716cd7a455423529da822cc2cff2291bb5c74d31872;Zwei Männer wegen Einbruch und Diebstahl festgenommen;https://www.zeit.de/news/2026-02/24/zwei-maenner-wegen-einbruch-und-diebstahl-festgenommen;Hier finden Sie Informationen zu dem Thema „Kriminalität“. Lesen Sie jetzt „Zwei Männer wegen Einbruch und Diebstahl festgenommen“.;Kriminalität;News, Kriminalität, Mann, Neumünster, Einbruch, Diebstahl, Kriminalität;2026-02-24T09:40:31+01:00;2026-02-24T09:40:31+01:00;;dpa Hamburg/Schleswig-Holstein;false
00503df7afe9ff32c5a75427baeb7054dffd727656b93cd057b824ece09c3b8a;Mehr verletzte Polizisten trotz weniger Angriffen;https://www.zeit.de/news/2026-02/24/mehr-verletzte-polizisten-trotz-weniger-angriffen;Hier finden Sie Informationen zu dem Thema „Gewalt gegen Einsatzkräfte“. Lesen Sie jetzt „Mehr verletzte Polizisten trotz weniger Angriffen“.;Gewalt gegen Einsatzkräfte;News, Gewalt gegen Einsatzkräfte, Christopher Vogt, Andreas Breitner, Schleswig-Holstein, Lübeck, Pinneberg, Neumünster, FDP, Polizei, Deutsche Presse-Agentur, Feuerwehr;2026-02-24T09:36:22+01:00;2026-02-24T09:36:22+01:00;;dpa Hamburg/Schleswig-Holstein;false
c0fd2a96344eb911c7203813055689c0acab5cd64d8eab22e42a4b6b82f92264;Frontalcrash: Polizei vermutet Übermüdung;https://www.zeit.de/news/2026-02/24/frontalcrash-polizei-vermutet-uebermuedung;Hier finden Sie Informationen zu dem Thema „Unfall im Ortsbereich“. Lesen Sie jetzt „Frontalcrash: Polizei vermutet Übermüdung“.;Unfall im Ortsbereich;News, Unfall im Ortsbereich, Wiesloch, Rhein-Neckar-Kreis, Polizei, Frontalcrash, Ortsbereich, Unfall, Frontalzusammenstoß, Auto;2026-02-24T09:35:47+01:00;2026-02-24T09:35:47+01:00;;dpa Baden-Württemberg;false
d8fb07a40c1e01415020b207ce5cb8ab3c2ba60ffa456d891cddc53c74447143;"Gebet für Ukraine: ""Gewalt wird nicht das letzte Wort haben""";https://www.zeit.de/news/2026-02/24/gebet-fuer-ukraine-gewalt-wird-nicht-das-letzte-wort-haben;"Hier finden Sie Informationen zu dem Thema „Jahrestag des Angriffs“. Lesen Sie jetzt „Gebet für Ukraine: ""Gewalt wird nicht das letzte Wort haben""“.";Jahrestag des Angriffs;News, Jahrestag des Angriffs, Karl Jüsten, Anne Gidion, Frank-Walter Steinmeier, Gebet, Angriff, Jahrestag, Krieg in der Ukraine;2026-02-24T09:34:44+01:00;2026-02-24T09:34:44+01:00;;dpa Berlin/Brandenburg;false
23dafce5ddc65869767c16a288b460cb4f6f73b40d1a5fe480d039fe2a36c9f9;München muss am Mittleren Ring vorläufig zurück zu Tempo 30;https://www.zeit.de/news/2026-02/24/muenchen-muss-am-mittleren-ring-vorlaeufig-zurueck-zu-tempo-30;Hier finden Sie Informationen zu dem Thema „Verkehr“. Lesen Sie jetzt „München muss am Mittleren Ring vorläufig zurück zu Tempo 30“.;Verkehr;News, Verkehr, München, Verwaltungsgericht, Bayerischer Verwaltungsgerichtshof, Deutsche Umwelthilfe e.V., Verkehr;2026-02-24T09:34:04+01:00;2026-02-24T09:34:04+01:00;;dpa Bayern;false
d3eb468e248a6dce47428bc2033c74fe8ad321d9a22b0340f5b1341eab7a1022;Mann bei Auffahrunfall in Ingolstadt schwer verletzt;https://www.zeit.de/news/2026-02/24/mann-bei-auffahrunfall-in-ingolstadt-schwer-verletzt;Hier finden Sie Informationen zu dem Thema „Verkehrsunfall“. Lesen Sie jetzt „Mann bei Auffahrunfall in Ingolstadt schwer verletzt“.;Verkehrsunfall;News, Verkehrsunfall, Ingolstadt, Münchener Straße, Auffahrunfall, Verkehrsunfall, Auto;2026-02-24T09:31:35+01:00;2026-02-24T09:31:35+01:00;;dpa Bayern;false
3d136bcd6a1eb3c79c354b11a9d39331af796efbdea0ac4f5c66a7d084a7cdcb;Wenn auch Omas Herz bricht;https://www.zeit.de/familie/2026-02/kontakt-enkelkinder-grosseltern-trennung-eltern;Trennungen treffen nicht nur Eltern und ihre Kinder, auch Großeltern leiden unter weniger Kontakt. Besonders häufig betroffen sind die Eltern der Väter. ;"Z+ (abopflichtiger Inhalt);
        
    Kontakt zu Enkelkindern";Familie, Kontakt zu Enkelkindern, Familie, Väter, Mütter, Niederlande, Studie;2026-02-24T09:31:09+01:00;2026-02-24T09:31:09+01:00;Lukas Weyell;;false
bb65a4fc519ca4757fe6354e518ac2fe4b06621d5c4fdeca846b68b2c1030fbe;"Leben ohne Internet: Anteil der ""Offliner"" sinkt";https://www.zeit.de/news/2026-02/24/leben-ohne-internet-anteil-der-offliner-sinkt;"Hier finden Sie Informationen zu dem Thema „Noch nie online gewesen“. Lesen Sie jetzt „Leben ohne Internet: Anteil der ""Offliner"" sinkt“.";Noch nie online gewesen;News, Noch nie online gewesen, Wiesbaden, Statistisches Bundesamt, Europäische Union, Offliner, Tischbuchung, Ticketkauf, Streaming;2026-02-24T09:29:18+01:00;2026-02-24T09:29:18+01:00;;dpa;false
df047c6f5d0c08c1ce723b08bcbe83801007b70642c976f7d9adc3911a59f5ca;Fresenius Medical Care verdient dank Sparkurs deutlich mehr;https://www.zeit.de/news/2026-02/24/fresenius-medical-care-verdient-dank-sparkurs-deutlich-mehr;Hier finden Sie Informationen zu dem Thema „Dialyseanbieter“. Lesen Sie jetzt „Fresenius Medical Care verdient dank Sparkurs deutlich mehr“.;Dialyseanbieter;News, Dialyseanbieter, FMC, Fresenius SE, Fresenius Medical Care, Dialysekonzern, Gewinnsprung, Umsatz, Sparkurs;2026-02-24T09:24:21+01:00;2026-02-24T09:24:21+01:00;;dpa Hessen;false
d219b00a6c106d18bac2f115efeca63f68910aef3532cc75f6e5da5ac3c8ba03;"Tod in der ""Liebeszelle"" - Ehemann legt Revision ein";https://www.zeit.de/news/2026-02/24/tod-in-der-liebeszelle-ehemann-legt-revision-ein;"Hier finden Sie Informationen zu dem Thema „Sachsen-Anhalt“. Lesen Sie jetzt „Tod in der ""Liebeszelle"" - Ehemann legt Revision ein“.";Sachsen-Anhalt;News, Sachsen-Anhalt, Stendal, Sachsen-Anhalt, Liebeszelle;2026-02-24T09:22:30+01:00;2026-02-24T09:22:30+01:00;;dpa Sachsen;false
b3b2adc95ad3b4025df80cd99d5cd0275c434cfe7deb50932f2a4457af785c74;Immer mehr Ärzte kommen aus dem Ausland;https://www.zeit.de/news/2026-02/24/immer-mehr-aerzte-kommen-aus-dem-ausland;Hier finden Sie Informationen zu dem Thema „Zuwanderung“. Lesen Sie jetzt „Immer mehr Ärzte kommen aus dem Ausland“.;Zuwanderung;News, Zuwanderung, Statistisches Bundesamt, Zuwanderung;2026-02-24T09:22:02+01:00;2026-02-24T09:22:02+01:00;;dpa;false
499fbee6d10af19f0cc0eef36d362daa2fd29b4be0d7cae7fa690091da79e294;Protest: IAV-Beschäftigte bangen um ihre Jobs;https://www.zeit.de/news/2026-02/24/protest-iav-beschaeftigte-bangen-um-ihre-jobs;Hier finden Sie Informationen zu dem Thema „Auto-Industrie“. Lesen Sie jetzt „Protest: IAV-Beschäftigte bangen um ihre Jobs“.;Auto-Industrie;News, Auto-Industrie, Erzgebirge, IG Metall, IAV, Beschäftigungssicherung, Auto, Konflikt, Metall;2026-02-24T09:15:04+01:00;2026-02-24T09:15:04+01:00;;dpa Sachsen;false
f817cb8b0c4d47ee9d2e7a6066fabb8fefe1c1b9b76ee7489c2416be1efe7d83;Ukraine erobert mehrere Siedlungen bei Oleksandriwka zurück;https://www.zeit.de/politik/ausland/ukraine-russland-frontverlauf-krieg-karte-aktuell;"Die ukrainische Armee hat in den Regionen Dnipropetrowsk und Saporischschja mehrere Orte eingenommen. Russland rückt in Richtung Kostjantyniwka vor.
";Ukrainekarte aktuell;Politik, Ukrainekarte aktuell, Krieg in der Ukraine, Russland, Militär, Streitkräfte, Donezk, Charkiw;2026-02-24T09:13:22+01:00;2026-02-24T09:13:22+01:00;Timo StukenbergElizabeth RushtonJustus WilkeChristina FelschenPauline PieperJulius TrögerBenja Zehr;;false
2528f4bcee30652564b34c431fd28ee4e91a8573e0b7cff55b245eab2cd5b1d3;Pistorius rügt Nähe Trumps zu Putin;https://www.zeit.de/news/2026-02/24/pistorius-ruegt-naehe-trumps-zu-putin;Hier finden Sie Informationen zu dem Thema „Ukraine-Krieg“. Lesen Sie jetzt „Pistorius rügt Nähe Trumps zu Putin“.;Ukraine-Krieg;News, Ukraine-Krieg, Trump zu Putin, Boris Pistorius, Donald Trump, Wladimir Putin, Alaska, Deutschlandfunk, SPD, Krieg in der Ukraine;2026-02-24T09:03:44+01:00;2026-02-24T09:03:44+01:00;;dpa;false
b2e63a194f0c79738f766b75e768b47ddfab524aac96eafbc42ed8a13d4a109c;Tausende Kinder weniger in Sachsen Kitas;https://www.zeit.de/news/2026-02/24/tausende-kinder-weniger-in-sachsen-kitas;Hier finden Sie Informationen zu dem Thema „Kindertagesstätten“. Lesen Sie jetzt „Tausende Kinder weniger in Sachsen Kitas“.;Kindertagesstätten;News, Kindertagesstätten, Conrad Clemens, Sachsen, Kindertagesstätte;2026-02-24T09:02:34+01:00;2026-02-24T09:02:34+01:00;;dpa Sachsen;false
644ec5afefb9ba176558be54f26584ebe1f82856f63856d83044402f42d25aa3;So gedenken die Gerabronner ihres toten Bürgermeisters;https://www.zeit.de/news/2026-02/24/gedenken-an-gerabronner-buergermeister-mauchi;Hier finden Sie Informationen zu dem Thema „Tödlicher Unfall“. Lesen Sie jetzt „So gedenken die Gerabronner ihres toten Bürgermeisters“.;Tödlicher Unfall;News, Tödlicher Unfall, Christian Mauch, Gerabronn, Landkreis Schwäbisch Hall, Unfall, Traueranzeige, Familie, Auto;2026-02-24T08:53:23+01:00;2026-02-24T08:53:23+01:00;;dpa Baden-Württemberg;false
cc9b83069724f0555081a2b581025f464061a8089b1b6512dd5620beacbaf9b7;50-Jähriger stirbt nach rätselhaftem Unfall auf Parkplatz;https://www.zeit.de/news/2026-02/24/50-jaehriger-stirbt-nach-raetselhaftem-unfall-auf-parkplatz;Hier finden Sie Informationen zu dem Thema „Nach Polizeiermittlungen“. Lesen Sie jetzt „50-Jähriger stirbt nach rätselhaftem Unfall auf Parkplatz“.;Nach Polizeiermittlungen;News, Nach Polizeiermittlungen, Polizei, Unfall, Polizeiermittlung;2026-02-24T08:52:25+01:00;2026-02-24T08:52:25+01:00;;dpa Baden-Württemberg;false
94aed42baff4b5b48d4d791dadece0dd743d471c48438a7ed60679fea4dcd44f;NRW verspricht Ukraine weitere Hilfe;https://www.zeit.de/news/2026-02/24/nrw-verspricht-ukraine-weitere-hilfe;Hier finden Sie Informationen zu dem Thema „Jahrestag Ukraine-Krieg“. Lesen Sie jetzt „NRW verspricht Ukraine weitere Hilfe“.;Jahrestag Ukraine-Krieg;News, Jahrestag Ukraine-Krieg, Mona Neubaur, Hendrik Wüst, NRW, Russland, Europa, Nordrhein-Westfalen, Dnjepropetrowsk, X, Jahrestag, Krieg in der Ukraine;2026-02-24T08:36:24+01:00;2026-02-24T08:36:24+01:00;;dpa Nordrhein-Westfalen;false
7055a976eea3847941ee229e0bdcae030ea62b0a3ce6b25bcc1646cd5e1086ce;Tödlicher Verkehrsunfall in Berlin;https://www.zeit.de/news/2026-02/24/toedlicher-verkehrsunfall-in-berlin;Hier finden Sie Informationen zu dem Thema „Unfälle“. Lesen Sie jetzt „Tödlicher Verkehrsunfall in Berlin“.;Unfälle;News, Unfälle, Berlin, Verkehrsunfall, Unfall;2026-02-24T08:35:11+01:00;2026-02-24T08:35:11+01:00;;dpa Berlin/Brandenburg;false
d12072a1318ee9851f7b2ae21685a3236f4ad49f2cfc88e07a64805a0af9a181;Fahrradfahrerin in Landau mit Böller aus Auto beworfen;https://www.zeit.de/news/2026-02/24/fahrradfahrerin-in-landau-mit-boeller-aus-auto-beworfen;Hier finden Sie Informationen zu dem Thema „Kriminalität“. Lesen Sie jetzt „Fahrradfahrerin in Landau mit Böller aus Auto beworfen“.;Kriminalität;News, Kriminalität, Landau, Polizei, Böller, Kriminalität, Auto;2026-02-24T08:34:10+01:00;2026-02-24T08:34:10+01:00;;dpa Rheinland-Pfalz/Saarland;false
03367269f48c3683158fe22cd2d574bdf064e17e8bebe2eb80f6a514bc0f4e40;Wolodymyr Selenskyj sieht Unabhängigkeit der Ukraine gewahrt;https://www.zeit.de/politik/ausland/ukraine-krieg-news-liveblog;Zum vierten Jahrestag der russischen Invasion erinnert Selenskyj an den Abwehrkampf der ersten Tage. Die Ukraine bleibe dank ihres Widerstands unabhängig. Das Liveblog;Liveblog:                     Krieg gegen die Ukraine;Politik, Krieg gegen die Ukraine, Krieg in der Ukraine, Marco Rubio, Florida, Waffenruhe, Russland, Polen;2026-02-24T09:00:22+00:00;2026-02-24T09:00:22+00:00;Ulrike TschirnerJohanna SetheAlexander Eydlin;;false
305d31a19d59947adefb1091001fef7067b9d28e67789183aeb9329c43ab1be5;Papa ist dann mal weg;https://www.zeit.de/familie/2026-02/arbeitszeiten-eltern-vaeter-muetter-wsi-gleichstellungsreport;Eine Studie zeigt, dass die meisten Mütter Teilzeit arbeiten, weil sich junge Väter auf den Job konzentrieren. Wer weniger Teilzeitarbeit fordert, muss Männer überzeugen.;"Z+ (abopflichtiger Inhalt);
        
    Arbeitszeiten von Eltern";Familie, Arbeitszeiten von Eltern, Arbeitsteilung, Mütter, Teilzeitarbeit, Väter, Familie;2026-02-24T08:31:23+01:00;2026-02-24T08:31:23+01:00;Wenke HusmannTillmann PrüferDana Hajek;;false
b9f9eb0e2e0650eee0f7ffc01691d28f902613c960f32424170995293d0f69ef;MTU erhöht Dividende nach Gewinnsprung kräftig;https://www.zeit.de/news/2026-02/24/mtu-erhoeht-dividende-nach-gewinnsprung-kraeftig;Hier finden Sie Informationen zu dem Thema „Triebwerksbauer“. Lesen Sie jetzt „MTU erhöht Dividende nach Gewinnsprung kräftig“.;Triebwerksbauer;News, Triebwerksbauer, Johannes Bussmann, MTU, Gewinnsprung, Dividende;2026-02-24T08:28:51+01:00;2026-02-24T08:28:51+01:00;;dpa;false
f4e9f39082c9fdbb7f92875bccf4ace9f09fe80663a9fbd9676d4bf7dae4e2ff;Nahverkehr in Hessen bestreikt – Pendler müssen umplanen;https://www.zeit.de/news/2026-02/24/nahverkehr-in-hessen-bestreikt-pendler-muessen-umplanen;Hier finden Sie Informationen zu dem Thema „Tarife“. Lesen Sie jetzt „Nahverkehr in Hessen bestreikt – Pendler müssen umplanen“.;Tarife;News, Tarife, Frankfurt, Wiesbaden, Marburg, Hessen, Kassel, Ver.di, Nahverkehr, Ausstand, Pendler, Warnstreik;2026-02-24T08:26:27+01:00;2026-02-24T08:26:27+01:00;;dpa Hessen;false
82ea79464752dca9cf17ba8a604d175fe8da3fc96582ddb52a82dc1953faea27;Pacquiao gegen Mayweather: Rückkampf nach elf Jahren;https://www.zeit.de/news/2026-02/24/pacquiao-gegen-mayweather-rueckkampf-nach-elf-jahren;Hier finden Sie Informationen zu dem Thema „Boxen“. Lesen Sie jetzt „Pacquiao gegen Mayweather: Rückkampf nach elf Jahren“.;Boxen;News, Boxen, Floyd Mayweather, Manny Pacquiao, Las Vegas, Netflix, Rückkampf, Streaming;2026-02-24T08:22:27+01:00;2026-02-24T08:22:27+01:00;;dpa Sport;false
6ab78b5c002a71d71ee2a1ef3e90f1191e68bb2eda9b564f104ebe5261f0cf6f;Großbrand auf Schrottplatz in Essen-Katernberg;https://www.zeit.de/news/2026-02/24/grossbrand-auf-schrottplatz-in-essen-katernberg;Hier finden Sie Informationen zu dem Thema „Brände“. Lesen Sie jetzt „Großbrand auf Schrottplatz in Essen-Katernberg“.;Brände;News, Brände, Esse-Katernberg, Feuerwehr, Großbrand, Schrottplatz, Brand;2026-02-24T08:20:52+01:00;2026-02-24T08:20:52+01:00;;dpa Nordrhein-Westfalen;false
9a4f6d2b2a5c23ff1ebada7f1739dc51aa876e5ff1dcce4b8b97aac73a27c1a3;Donald Trumps Umfragewerte fallen auf Tiefststand;https://www.zeit.de/politik/ausland/2026-02/usa-donald-trump-umfragen-state-of-the-union;In der Nacht zum Mittwoch hält Trump die jährliche Rede zur Lage der Nation, in der er für seine Politik werben will. Umfragen zeigen: Er braucht viel Überzeugungsarbeit.;US-Präsident;Politik, US-Präsident, Donald Trump, Joe Biden, USA, CNN, Tiefstwert, Umfragewert, Umfrage, Überzeugungsarbeit, Kritik;2026-02-24T08:14:05+01:00;2026-02-24T08:14:05+01:00;ale;DIE ZEIT,        							ale;false
b17a16b7e5363c86ab46e428f5667efe0940f325d43927322547e51de41c0d8a;Beine über Bahnsteigkante gebaumelt - Mann von Zug erfasst;https://www.zeit.de/news/2026-02/24/beine-ueber-bahnsteigkante-gebaumelt-mann-von-zug-erfasst;Hier finden Sie Informationen zu dem Thema „Unfälle“. Lesen Sie jetzt „Beine über Bahnsteigkante gebaumelt - Mann von Zug erfasst“.;Unfälle;News, Unfälle, Bundespolizei, Unfall, Hauptbahnhof;2026-02-24T08:11:18+01:00;2026-02-24T08:11:18+01:00;;dpa Niedersachsen;false
b3575232325e37798a48f139cb1ff0927630c4aa9a56e3ff6c9c0c5f29fbbdc9;Sauna brennt im DFB-Campus in Frankfurt;https://www.zeit.de/news/2026-02/24/sauna-brennt-im-dfb-campus-in-frankfurt;Hier finden Sie Informationen zu dem Thema „Brände“. Lesen Sie jetzt „Sauna brennt im DFB-Campus in Frankfurt“.;Brände;News, Brände, Frankfurt, Deutscher Fußball-Bund, Sauna, Brand;2026-02-24T08:10:52+01:00;2026-02-24T08:10:52+01:00;;dpa Hessen;false
d79f685295c6b3c4612fa446f9fd6ec33ec406d0546386dcb6310b85b0f26cd8;DFB-Vertreter wollen politische Diskussionen aus WM raushalten;https://www.zeit.de/sport/2026-02/fussball-wm-dfb-politik-andreas-rettig-rudi-voeller;DFB-Chef Andreas Rettig will politische Debatten während der Fußball-WM von der deutschen Mannschaft fernhalten. Rudi Völler lehnt einen Boykott der Spiele in den USA ab.;Fußball-WM in den USA, Mexico und Kanada;Sport, Fußball-WM in den USA, Mexico und Kanada , Andreas Rettig, Rudi Völler, USA, Kanada, Katar, Deutscher Fußball-Bund, Fußball-WM, Boykott, Sommer;2026-02-24T08:00:42+01:00;2026-02-24T08:00:42+01:00;jse;DIE ZEIT,        dpa,        SID,        							jse;false
d209a146fd26dfe3b3d5124006c2665e77d1e33723156b9177603e4bf856e93e;Freunde-Finder: Berliner Urteil schränkt Facebook ein;https://www.zeit.de/news/2026-02/24/freunde-finder-berliner-urteil-schraenkt-facebook-ein;Hier finden Sie Informationen zu dem Thema „Soziale Netzwerke“. Lesen Sie jetzt „Freunde-Finder: Berliner Urteil schränkt Facebook ein“.;Soziale Netzwerke;News, Soziale Netzwerke, Facebook, Meta, Kontaktdaten, Social Media;2026-02-24T07:49:43+01:00;2026-02-24T07:49:43+01:00;;dpa Berlin/Brandenburg;false
bed96c38231419f56a1ff7b1db62bd8542885cea6c874493e7b7194858e8f036;Zoll stoppt tonnenweise gefälschte Kinderbettwäsche;https://www.zeit.de/news/2026-02/24/zoll-stoppt-tonnenweise-gefaelschte-kinderbettwaesche;Hier finden Sie Informationen zu dem Thema „Markenrecht“. Lesen Sie jetzt „Zoll stoppt tonnenweise gefälschte Kinderbettwäsche“.;Markenrecht;News, Markenrecht, Kinderbettwäsche, Markenrecht, Sicherheitsstandard, Sicherheit;2026-02-24T07:47:41+01:00;2026-02-24T07:47:41+01:00;;dpa Bayern;false
