Hash;Title;Link;Description;Category;KeyWords;Published;LastUpdated;Author;Source;Paywall
946dc4ff10a6d02a17e46a09ea98725316cc1c879b04e99a8d2d8bc731206ec8;Deutsche Wirtschaft im Schlussquartal 2025 gewachsen;https://www.zeit.de/news/2026-01/15/deutsche-wirtschaft-im-schlussquartal-2025-gewachsen;Hier finden Sie Informationen zu dem Thema „Konjunktur“. Lesen Sie jetzt „Deutsche Wirtschaft im Schlussquartal 2025 gewachsen“.;Konjunktur;News, Konjunktur, Schlussquartal;2026-01-15T10:04:14+01:00;2026-01-15T10:04:14+01:00;;dpa;false
2a58d2d706a604a766dbc7b7626ac432dd955b63ba2871a1b2a4f9872249fc65;Was es heißt, Tochter eines Vergewaltigers zu sein;https://www.zeit.de/kultur/literatur/2026-01/ich-kaempfe-fuer-die-wahrheit-caroline-darian-gisele-pelicot-missbrauchsprozess-avignon;In ihrem neuen Buch schildert Caroline Darian ihre Sicht auf den Prozess von Avignon. Damit tritt sie aus dem Schatten ihrer Mutter Gisèle Pelicot.;"Z+ (abopflichtiger Inhalt);
        
    ""Ich kämpfe für die Wahrheit"" von Caroline Darian";"Kultur, ""Ich kämpfe für die Wahrheit"" von Caroline Darian, Schriftstellerin, Avignon, Frankreich, Drogen, Vergewaltigung, Sachbuch";2026-01-15T10:04:05+01:00;2026-01-15T10:04:05+01:00;Jolinde Hüchtker;;false
ac2385deeee01d5b2a7008c531227ecf7376e90e6d5c1e6ea8a0570f09221015;Fall Liana - Ermittler streben Sicherungsverwahrung an;https://www.zeit.de/news/2026-01/15/fall-liana-ermittler-streben-sicherungsverwahrung-an;Hier finden Sie Informationen zu dem Thema „Tod einer 16-Jährigen“. Lesen Sie jetzt „Fall Liana - Ermittler streben Sicherungsverwahrung an“.;Tod einer 16-Jährigen;News, Tod einer 16-Jährigen, Friedland, Göttingen, Geisleden, Staatsanwaltschaft, Sicherungsverwahrung, Sicherungsverfahren, Antragsschrift;2026-01-15T10:03:17+01:00;2026-01-15T10:03:17+01:00;;dpa Niedersachsen;false
68d60b4cd6f5996ab242705818896d3544731bce7faba48887b4550199099506;Konjunktur: Deutsche Wirtschaft 2025 leicht gewachsen;https://www.zeit.de/wirtschaft/2026-01/konjunktur-deutsche-wirtschaft-2025-leicht-gewachsen;Lesen Sie jetzt „Konjunktur: Deutsche Wirtschaft 2025 leicht gewachsen“.;;Wirtschaft, Wirtschaft;2026-01-15T10:02:09+01:00;2026-01-15T10:02:09+01:00;;;false
565434e239ecdbf32b8d3f9d1221f40e902671fd2c0da0bf2103dca1d65aae90;Deutsche Wirtschaft 2025 leicht gewachsen;https://www.zeit.de/news/2026-01/15/deutsche-wirtschaft-2025-leicht-gewachsen;Hier finden Sie Informationen zu dem Thema „Konjunktur“. Lesen Sie jetzt „Deutsche Wirtschaft 2025 leicht gewachsen“.;Konjunktur;News, Konjunktur, News;2026-01-15T10:01:48+01:00;2026-01-15T10:01:48+01:00;;dpa;false
5716fbbb1b633023298d646f9e62fb04a46ebd53808ddda9b6415b58dace44cd;Eltern können Kurzvideos auf Youtube stärker einschränken;https://www.zeit.de/news/2026-01/15/eltern-koennen-kurzvideos-auf-youtube-staerker-einschraenken;Hier finden Sie Informationen zu dem Thema „Soziale Medien“. Lesen Sie jetzt „Eltern können Kurzvideos auf Youtube stärker einschränken“.;Soziale Medien;News, Soziale Medien, YouTube, Kurzvideo, Videoplattform, Shorts;2026-01-15T10:00:14+01:00;2026-01-15T10:00:14+01:00;;dpa;false
95cd5d0d88a925025a921a0654ae2deb9160bd6bdb6500d43e8f51609e250c41;Es gibt fast doppelt so viele deutsche Gamesfirmen wie 2018;https://www.zeit.de/news/2026-01/15/es-gibt-fast-doppelt-so-viele-deutsche-gamesfirmen-wie-2018;Hier finden Sie Informationen zu dem Thema „Computer- und Videospiele“. Lesen Sie jetzt „Es gibt fast doppelt so viele deutsche Gamesfirmen wie 2018“.;Computer- und Videospiele;News, Computer- und Videospiele, Keen Games, Gamesfirma, Computer, Videospiel, Computerspiel;2026-01-15T10:00:07+01:00;2026-01-15T10:00:07+01:00;;dpa;false
d7c9772af835a28b46138b93abb76a9191a433fc9ecc073937cedfb75b113fab;Weniger Rindfleisch aus unterster Haltungsform-Stufe;https://www.zeit.de/news/2026-01/15/weniger-rindfleisch-aus-unterster-haltungsform-stufe;Hier finden Sie Informationen zu dem Thema „Verbraucher“. Lesen Sie jetzt „Weniger Rindfleisch aus unterster Haltungsform-Stufe“.;Verbraucher;News, Verbraucher, Berlin, Internationale Grüne Woche Berlin, Branchenangabe, Tierhaltungsstandard;2026-01-15T10:00:05+01:00;2026-01-15T10:00:05+01:00;;dpa;false
ead591313a94fcfb56df15d1979136ed8f6b93d6cfc3db40df3e8cfb746e5dd2;Leipziger Messe erwirtschaftet 110 Millionen Euro Umsatz;https://www.zeit.de/news/2026-01/15/leipziger-messe-erwirtschaftet-110-millionen-euro-umsatz;Hier finden Sie Informationen zu dem Thema „Leipziger Messe“. Lesen Sie jetzt „Leipziger Messe erwirtschaftet 110 Millionen Euro Umsatz“.;Leipziger Messe;News, Leipziger Messe, Leipzig, Leipziger Messe, Umsatz;2026-01-15T10:00:04+01:00;2026-01-15T10:00:04+01:00;;dpa Sachsen;false
91def0c30871bf79a5ac766b8a0004d96fa2a7291110f36064e8b7ed0722cd33;Bärbel Bas wirbt für Unterstützung von geplanter Grundsicherung;https://www.zeit.de/politik/deutschland/2026-01/deutscher-bundestag-buergergeld-reform-grundsicherung-baerbel-bas-kritik-sozialverbaende;Bundessozialministerin Bärbel Bas hat die geplante Bürgergeldreform im Bundestag verteidigt. Kritik und Warnungen kamen von Sozialverbänden und dem Kinderhilfswerk.;Bürgergeldreform;Politik, Bürgergeldreform, Grundsicherung, Sozialverband, Diakonie, Kinderhilfswerk, Rückschritt, Kritik;2026-01-15T09:57:24+01:00;2026-01-15T09:57:24+01:00;lgi;DIE ZEIT,        AFP,        epd,        							lgi;false
d27e32d677b98bc96115ed14a8a4568fb1511da49d264e764a14f95ff566c6d0;"Spott und Hohn nach Real-Blamage - Coach: ""Eine Tragödie""";https://www.zeit.de/news/2026-01/15/wirklich-beschaemend-reals-neustart-endet-im-debakel;"Hier finden Sie Informationen zu dem Thema „Fußball in Spanien“. Lesen Sie jetzt „Spott und Hohn nach Real-Blamage - Coach: ""Eine Tragödie""“.";Fußball in Spanien;News, Fußball in Spanien, Xabi Alonso, Jefté Betancor, Kylian Mbappé, Spanien, Real Madrid, Debakel, Fußball;2026-01-15T09:54:45+01:00;2026-01-15T09:54:45+01:00;;dpa Sport;false
d36251082c05e539a8fbdf5cbeee522e4b5c63483fa8243d797bbf146dd7daa4;ISS-Crew vorzeitig zurück auf der Erde – medizinische Gründe;https://www.zeit.de/news/2026-01/15/iss-crew-vorzeitig-zurueck-auf-der-erde-medizinische-gruende;Hier finden Sie Informationen zu dem Thema „Raumfahrt“. Lesen Sie jetzt „ISS-Crew vorzeitig zurück auf der Erde – medizinische Gründe“.;Raumfahrt;News, Raumfahrt, Internationale Raumstation, NASA;2026-01-15T09:50:17+01:00;2026-01-15T09:50:17+01:00;;dpa;false
9af738b0c6c229f537d587cb79a5b8a98d2f8c0e300f32a66b81819ce2490f74;SPD stellt sich gegen strengere Regeln für medizinisches Cannabis;https://www.zeit.de/politik/deutschland/2026-01/umgang-cannabis-gesundheitswesen-spd-cdu;Nach Plänen von Nina Warken soll Cannabis nur noch nach persönlichem Arztkontakt verschrieben werden. Die SPD sieht darin Eingriffe in Ärzte- und Patientenfreiheit.;Umgang mit Cannabis;Politik, Umgang mit Cannabis, Nina Warken, Carmen Wegge, SPD, Cannabis, Arztkontakt, Patientenfreiheit;2026-01-15T09:47:50+01:00;2026-01-15T09:47:50+01:00;mns;DIE ZEIT,        KNA,        AFP,        							mns;false
81586aaeeea15afc9e324f0f493bd97ff6a21faf68c5ba405617795ef74dc1cc;Bundesregierung plant Recht auf Reparatur für Elektrogeräte;https://www.zeit.de/politik/deutschland/2026-01/reparaturrecht-elektrogeraete-gesetzesentwurf-bundesregierung;Bundesverbraucherschutzministerin Stefanie Hubig hat einen Gesetzesentwurf für ein Reparaturrecht vorgelegt. Die SPD-Politikerin will damit eine EU-Richtlinie umsetzen. ;Stefanie Hubig;Politik, Stefanie Hubig, Stefanie Hubig, SPD, Elektrogerät, Gesetzesentwurf, Reparaturrecht, Reparatur;2026-01-15T09:46:14+01:00;2026-01-15T09:46:14+01:00;ngo;DIE ZEIT,        AFP,        							ngo;false
98e901db8d69321014728d20891e0bb9f76cd416cfeac2d17df270e19f6f6b33;Block-Prozess: Verhandlungstermin fällt wegen Krankheit aus;https://www.zeit.de/news/2026-01/15/block-prozess-verhandlungstermin-faellt-wegen-krankheit-aus;Hier finden Sie Informationen zu dem Thema „Justiz“. Lesen Sie jetzt „Block-Prozess: Verhandlungstermin fällt wegen Krankheit aus“.;Justiz;News, Justiz, Eugen Block, Christina Block, Hamburg, Dänemark, Verhandlungstermin;2026-01-15T09:42:02+01:00;2026-01-15T09:42:02+01:00;;dpa Hamburg/Schleswig-Holstein;false
e84e4588048ef5aa5faeab7feb201bd5e4b7b545d0c54873ef34bb27f03fe36f;Union und Grüne begrüßen Entsendung deutscher Soldaten nach Grönland;https://www.zeit.de/politik/2026-01/groenland-bundeswehr-soldaten-reaktion-union-gruene;"Die Grünen befürworten den ""symbolischen Beistand"" der Bundeswehr für Dänemark. Aus Unionssicht geht Deutschland durch die Entsendung von Soldaten auf US-Interessen ein.";Grönland-Konflikt;Politik, Grönland-Konflikt, Donald Trump, Grönland, Dänemark, USA, Bündnis 90/Die Grünen, Bundeswehrpräsenz, Beistand;2026-01-15T09:39:44+01:00;2026-01-15T09:39:44+01:00;mga;DIE ZEIT,        AFP,        							mga;false
316417c5802184f04334cde474ce29e3e7aaf29a682a427a59ad1f83c8c31989;Algen machen Popcorn bunt – Hochschule zeigt neue Produkte;https://www.zeit.de/news/2026-01/15/algen-machen-popcorn-bunt-hochschule-zeigt-neue-produkte;Hier finden Sie Informationen zu dem Thema „Farbiges Popcorn & Co.“. Lesen Sie jetzt „Algen machen Popcorn bunt – Hochschule zeigt neue Produkte“.;Farbiges Popcorn & Co.;News, Farbiges Popcorn & Co., Carola Griehl, Berlin, Internationale Grüne Woche Berlin, Popcorn, Alge, Algenforschung;2026-01-15T09:30:07+01:00;2026-01-15T09:30:07+01:00;;dpa Sachsen;false
03a5916cc52beabbf7ae372eaae8d004611c20871937424eaa84e7a84e6b141b;Schwertransporter mit Rotorblatt verunglückt - Vollsperrung;https://www.zeit.de/news/2026-01/15/unfall-mit-schwertransporter-b294-gesperrt;Hier finden Sie Informationen zu dem Thema „Landkreis Calw“. Lesen Sie jetzt „Schwertransporter mit Rotorblatt verunglückt - Vollsperrung“.;Landkreis Calw;News, Landkreis Calw, Landkreis Calw, Polizei, Unfall, Schwertransporter, Rotorblatt, Bundesstraße;2026-01-15T09:22:42+01:00;2026-01-15T09:22:42+01:00;;dpa Baden-Württemberg;false
1911bd82a7549a8318a0ea2f06bb7c3fadf1a9d9c077e0b28bb387d08f84eb22;Polizei will bei Tumulten in Leipzig konsequent einschreiten;https://www.zeit.de/news/2026-01/15/polizei-will-bei-tumulten-in-leipzig-konsequent-einschreiten;Hier finden Sie Informationen zu dem Thema „Demonstrationen“. Lesen Sie jetzt „Polizei will bei Tumulten in Leipzig konsequent einschreiten“.;Demonstrationen;News, Demonstrationen, Armin Schuster, Leipzig, Polizei, CDU, Deutsche Presse-Agentur, Verfassungsschutz, Tumult, Demonstration, Straftat, Rechtsordnung;2026-01-15T09:21:58+01:00;2026-01-15T09:21:58+01:00;;dpa Sachsen;false
502686c3b401737abbbcfce5bf612ee20c488742c9b4b92bbfdd2ef217417ce7;Früherer IS-Kämpfer in Halle verurteilt;https://www.zeit.de/news/2026-01/15/frueherer-is-kaempfer-in-halle-verurteilt;Hier finden Sie Informationen zu dem Thema „Prozesse“. Lesen Sie jetzt „Früherer IS-Kämpfer in Halle verurteilt“.;Prozesse;News, Prozesse, IS;2026-01-15T09:18:58+01:00;2026-01-15T09:18:58+01:00;;dpa Sachsen;false
99a1b70191409173d2057334da47de6765c4fab34455773392f9b396c08df122;Krause übernimmt bei Südwestmetall – Fokus auf Tarifrunde;https://www.zeit.de/news/2026-01/15/krause-uebernimmt-bei-suedwestmetall-fokus-auf-tarifrunde;Hier finden Sie Informationen zu dem Thema „Metall- und Elektroindustrie“. Lesen Sie jetzt „Krause übernimmt bei Südwestmetall – Fokus auf Tarifrunde“.;Metall- und Elektroindustrie;News, Metall- und Elektroindustrie, Peter Sebastian Krause, Joachim Schulz, Stuttgart, Südwestmetall, Tarifrunde, Elektroindustrie, Metall;2026-01-15T09:18:15+01:00;2026-01-15T09:18:15+01:00;;dpa Baden-Württemberg;false
5760cfda96bd47b2710991823dd38d4dd45fc9aa0b129a08fc2443c7d9881db9;"""Als Bürgerliche lehnen wir das ab""";https://www.zeit.de/2026/03/brandmauer-cdu-afd-andreas-roedder;Der CDU-Vordenker Andreas Rödder hält den bisherigen Umgang mit der AfD für einen Fehler. Für ein Verbotsverfahren zeigt er sich aber offen.;"Z+ (abopflichtiger Inhalt);
        
    Brandmauer";Politik, Brandmauer, CDU, Alternative für Deutschland, Rechtsextremismus, Demokratie, Deutscher Bundestag, Politische Rechte;2026-01-15T09:16:01+01:00;2026-01-15T09:16:01+01:00;Tina HildebrandtRobert Pausch;Aus der        ZEIT Nr. 03/2026;false
656ed23526930c42bbc5e7e7a9f37f8f4307d6b2aec53553ffa47d4bffbdeb91;Auto prallt gegen Räumfahrzeug – Fahrer schwer verletzt;https://www.zeit.de/news/2026-01/15/auto-prallt-gegen-raeumfahrzeug-fahrer-schwer-verletzt;Hier finden Sie Informationen zu dem Thema „Unfälle“. Lesen Sie jetzt „Auto prallt gegen Räumfahrzeug – Fahrer schwer verletzt“.;Unfälle;News, Unfälle, Polizei, Räumfahrzeug, Unfall, Überholversuch, Auto;2026-01-15T09:15:35+01:00;2026-01-15T09:15:35+01:00;;dpa Baden-Württemberg;false
3459e7bf70256fdc90b80c8ef95563726c3e214b290c1ea4bf2108da1a10590e;Sparkasse Gelsenkirchen-Buer öffnet nach Einbruch Foyer;https://www.zeit.de/news/2026-01/15/sparkasse-gelsenkirchen-buer-oeffnet-nach-einbruch-foyer;Hier finden Sie Informationen zu dem Thema „Geldautomaten wieder verfügbar“. Lesen Sie jetzt „Sparkasse Gelsenkirchen-Buer öffnet nach Einbruch Foyer“.;Geldautomaten wieder verfügbar;News, Geldautomaten wieder verfügbar, Gelsenkirchen, Polizei, Geldautomat, Einbruch, Selbstbedienungsbereich;2026-01-15T09:15:00+01:00;2026-01-15T09:15:00+01:00;;dpa;false
5e0d4c3ab9134ee3e88ab918b161b74ab12be79efba8330f166261f776787c86;Elbtunnel Richtung Süden für drei Stunden nur einspurig;https://www.zeit.de/news/2026-01/15/elbtunnel-richtung-sueden-fuer-drei-stunden-nur-einspurig;Hier finden Sie Informationen zu dem Thema „Winterwetter“. Lesen Sie jetzt „Elbtunnel Richtung Süden für drei Stunden nur einspurig“.;Winterwetter;News, Winterwetter, die Autobahn GmbH des Bundes, Elbtunnel, Reinigung;2026-01-15T09:13:33+01:00;2026-01-15T09:13:33+01:00;;dpa Hamburg/Schleswig-Holstein;false
96f20815980281732170bbf2f9b8a25eacb928420050bc66bd88c589621aad03;Weinkonsum in Deutschland erneut gesunken;https://www.zeit.de/news/2026-01/15/weinkonsum-in-deutschland-erneut-gesunken;Hier finden Sie Informationen zu dem Thema „Weinkrise“. Lesen Sie jetzt „Weinkonsum in Deutschland erneut gesunken“.;Weinkrise;News, Weinkrise, Weinkonsum, Weinkrise, Weininstitut;2026-01-15T09:08:40+01:00;2026-01-15T09:08:40+01:00;;dpa Rheinland-Pfalz/Saarland;false
c6518a0d80ba794b9d132657b07055f13ec101624897517dc83ae3a955f7d37b;Getöteter Schwan am Werdersee gefunden;https://www.zeit.de/news/2026-01/15/getoeteter-schwan-am-werdersee-gefunden;Hier finden Sie Informationen zu dem Thema „Tiere“. Lesen Sie jetzt „Getöteter Schwan am Werdersee gefunden“.;Tiere;News, Tiere, Polizei, Tiere;2026-01-15T09:07:24+01:00;2026-01-15T09:07:24+01:00;;dpa Niedersachsen;false
56cbdcd76c0912bc59a171a57c2bddb474f744c1c59e217204af8027fab861fc;Preise für Nahrungsmittel im Großhandel stark gestiegen;https://www.zeit.de/wirtschaft/2026-01/grosshandel-preise-anstieg-nahrungsmittel-gxe;Erstmals seit zwei Jahren meldet das Statistische Bundesamt einen Anstieg der Großhandelspreise. Vor allem Kaffee, Tee, Kakao und Gewürze verteuerten sich 2025 deutlich.;Statistisches Bundesamt;Wirtschaft, Statistisches Bundesamt, Großhandel, Lebensmittel, Lebensmittelpreise, Statistisches Bundesamt, Kakao, Statistik;2026-01-15T09:06:04+01:00;2026-01-15T09:06:04+01:00;mns;DIE ZEIT,        Reuters,        							mns;false
bbc4b3aca6296000d0201fd4fef1d32db1063ce7697900beb63fc3a061e83996;Versorgungskammer hält Verzinsung trotz US-Problemen stabil;https://www.zeit.de/news/2026-01/15/versorgungskammer-haelt-verzinsung-trotz-us-problemen-stabil;Hier finden Sie Informationen zu dem Thema „Altersvorsorge“. Lesen Sie jetzt „Versorgungskammer hält Verzinsung trotz US-Problemen stabil“.;Altersvorsorge;News, Altersvorsorge, USA, Bayerische Versorgungskammer, Versorgungskammer, Verzinsung, Nettoverzinsung, Altersvorsorge;2026-01-15T09:01:21+01:00;2026-01-15T09:01:21+01:00;;dpa Bayern;false
26a2f4f26b5ad82024aa6fbbe48e84cd2efc51fe7bbbe6d1e0c46baac3a4768e;Schulze: Es gibt Interessenten für Domo;https://www.zeit.de/news/2026-01/15/schulze-es-gibt-interessenten-fuer-domo;Hier finden Sie Informationen zu dem Thema „Chemie-Standort“. Lesen Sie jetzt „Schulze: Es gibt Interessenten für Domo“.;Chemie-Standort;News, Chemie-Standort, Sven Schulze, Domo, Leuna, Sachsen-Anhalt, MDR, CDU, Weiterbetrieb, Geld;2026-01-15T09:00:51+01:00;2026-01-15T09:00:51+01:00;;dpa Sachsen;false
3de5fe1436b09cf13c52617204175ff8adb500eb03152c2eba0830b02ef56f79;Grippewelle hat sich flächendeckend im Land ausgebreitet;https://www.zeit.de/news/2026-01/15/grippewelle-hat-sich-flaechendeckend-im-land-ausgebreitet;Hier finden Sie Informationen zu dem Thema „Influenza“. Lesen Sie jetzt „Grippewelle hat sich flächendeckend im Land ausgebreitet“.;Influenza;News, Influenza, Koblenz, Rheinland-Pfalz, Deutsche Presse-Agentur, Grippewelle, Influenza, Landesuntersuchungsamt;2026-01-15T09:00:04+01:00;2026-01-15T09:00:04+01:00;;dpa Rheinland-Pfalz/Saarland;false
ff554ca204127516f261c377e7b9a3dddbb49c8a0f1aad7980483a4b8ef878ef;Baden-Württemberg buhlt um Emirates-Flüge nach Stuttgart;https://www.zeit.de/news/2026-01/15/baden-wuerttemberg-buhlt-um-emirates-fluege-nach-stuttgart;Hier finden Sie Informationen zu dem Thema „Luftverkehr“. Lesen Sie jetzt „Baden-Württemberg buhlt um Emirates-Flüge nach Stuttgart“.;Luftverkehr;News, Luftverkehr, Nicole Hoffmeister-Kraut, Stuttgart, Baden-Württemberg, CDU, Luftverkehr, Emirat;2026-01-15T08:55:41+01:00;2026-01-15T08:55:41+01:00;;dpa Baden-Württemberg;false
17d101078d5889eddbf0caf006ce6b2069605b203b6e94f876eca4f3305eb761;Gletscher-Eis für die Nachwelt: Archiv am Südpol eröffnet;https://www.zeit.de/news/2026-01/15/gletscher-eis-fuer-die-nachwelt-archiv-am-suedpol-eroeffnet;Hier finden Sie Informationen zu dem Thema „Schutzort und Archiv für Eis“. Lesen Sie jetzt „Gletscher-Eis für die Nachwelt: Archiv am Südpol eröffnet“.;Schutzort und Archiv für Eis;News, Schutzort und Archiv für Eis, Südpol, Antarktis, Alpen, Anden, Kaukasus, Schutzort, Nachwelt, Archiv, Eis;2026-01-15T08:55:13+01:00;2026-01-15T08:55:13+01:00;;dpa;false
07a67c422e710c260986e34ac72fbc0199f9052f902a2d031a6348e58f16da79;Schwertransport: Lkw steckt auf Autobahn 60 fest;https://www.zeit.de/news/2026-01/15/schwertransport-lkw-steckt-auf-autobahn-60-fest;Hier finden Sie Informationen zu dem Thema „Unfälle“. Lesen Sie jetzt „Schwertransport: Lkw steckt auf Autobahn 60 fest“.;Unfälle;News, Unfälle, Polizei, Schwertransport, Unfall, Autobahn;2026-01-15T08:47:34+01:00;2026-01-15T08:47:34+01:00;;dpa Rheinland-Pfalz/Saarland;false
a960472db489cd21b9a05171ddb011affa6f64cb47ca8461a8034b24fa02d563;Drei Verletzte bei Zusammenstoß zweier Autos in Gera;https://www.zeit.de/news/2026-01/15/drei-verletzte-bei-zusammenstoss-zweier-autos-in-gera;Hier finden Sie Informationen zu dem Thema „Verkehr“. Lesen Sie jetzt „Drei Verletzte bei Zusammenstoß zweier Autos in Gera“.;Verkehr;News, Verkehr, Gera, Zusammenstoß, Verkehr, Auto;2026-01-15T08:45:44+01:00;2026-01-15T08:45:44+01:00;;dpa Thüringen;false
9101d5b446f352bc61b11c6bb259fcc640f7f3981bfef844bafbbe0e17868e25;Ehemalige BSW-Abgeordnete gründen neue Gruppe in Brandenburger Landtag;https://www.zeit.de/politik/deutschland/2026-01/brandenburg-ehemalige-bsw-abgeordnete-gruenden-gruppe-gxe;Nach dem Ende der Koalition aus SPD und BSW haben drei Ex-BSW-Abgeordnete sich zu einer Gruppe zusammengeschlossen. Ziel sei die Stabilität des Landes Brandenburg.;Brandenburg;Politik, Brandenburg, Brandenburg, Landtag, Bündnis Sahra Wagenknecht, SPD;2026-01-15T08:44:59+01:00;2026-01-15T08:44:59+01:00;mga;DIE ZEIT,        dpa,        							mga;false
c1cb9e8932a7d269d9da09774bd437bdaf84d466b1114c5baf3ad488e3667961;Schweizer Wettbewerbshüter ermitteln gegen Microsoft;https://www.zeit.de/news/2026-01/15/schweizer-wettbewerbshueter-ermitteln-gegen-microsoft;Hier finden Sie Informationen zu dem Thema „Hohe Preise“. Lesen Sie jetzt „Schweizer Wettbewerbshüter ermitteln gegen Microsoft“.;Hohe Preise;News, Hohe Preise, Microsoft, Wettbewerbskommission;2026-01-15T08:43:43+01:00;2026-01-15T08:43:43+01:00;;dpa;false
004ea23f09c5dc0e2f6ac31aa3d3ae7e8285e634d8ef3cbd54bb6fef21dd6533;"1. FC Magdeburg vor ""spannenden Wochen""";https://www.zeit.de/news/2026-01/15/1-fc-magdeburg-vor-spannenden-wochen;"Hier finden Sie Informationen zu dem Thema „Fußball“. Lesen Sie jetzt „1. FC Magdeburg vor ""spannenden Wochen""“.";Fußball;News, Fußball, Petrik Sander, Braunschweig, Magdeburg, 1. FC Magdeburg, Fußball, Abstiegsrelegationsplatz, Winterpause, Transfermarkt;2026-01-15T08:40:21+01:00;2026-01-15T08:40:21+01:00;;dpa Sachsen;false
057f39351ab688a5a8f8f0b6c4427dc85f6a210389eaec68afa5f5a480114255;Auto erfasst Fußgänger - Mann schwer verletzt;https://www.zeit.de/news/2026-01/15/auto-erfasst-fussgaenger-mann-schwer-verletzt;Hier finden Sie Informationen zu dem Thema „Schwaben“. Lesen Sie jetzt „Auto erfasst Fußgänger - Mann schwer verletzt“.;Schwaben;News, Schwaben, Auto;2026-01-15T08:39:31+01:00;2026-01-15T08:39:31+01:00;;dpa Bayern;false
bb4a21f3e79786f2dac911c9d9fc930293d3e6c2a9c0f7b00cd5a4e1cead9f75;Endlagersuche - Landesamt sieht Niedersachsen in der Auswahl;https://www.zeit.de/news/2026-01/15/endlagersuche-landesamt-sieht-niedersachsen-in-der-auswahl;Hier finden Sie Informationen zu dem Thema „Atommüll“. Lesen Sie jetzt „Endlagersuche - Landesamt sieht Niedersachsen in der Auswahl“.;Atommüll;News, Atommüll, Niedersachsen, Bundesgesellschaft für Endlagerung, LBEG, Hannoversche Allgemeine Zeitung, Endlagersuche, Landesamt, Atommüll, Landesbergbauamt, Standortregion, Endlager;2026-01-15T08:34:25+01:00;2026-01-15T08:34:25+01:00;;dpa Niedersachsen;false
9b421bd3fda4c512be0daa1f872ee802e1c83ce0a299f57e130f8784e7471e5f;Mann bei Wohnungsbrand in Cottbus schwer verletzt;https://www.zeit.de/news/2026-01/15/mann-bei-wohnungsbrand-in-cottbus-schwer-verletzt;Hier finden Sie Informationen zu dem Thema „Brände“. Lesen Sie jetzt „Mann bei Wohnungsbrand in Cottbus schwer verletzt“.;Brände;News, Brände, Cottbus, Feuerwehr, Wohnungsbrand, Brand;2026-01-15T08:33:56+01:00;2026-01-15T08:33:56+01:00;;dpa Berlin/Brandenburg;false
12110dddeff417368e750ec60df43ee57ee449c66568bfd0bfb12e201413ac35;Nach Zugunglück: Kran stürzt auf Schnellstraße bei Bangkok;https://www.zeit.de/news/2026-01/15/nach-zugunglueck-kran-stuerzt-auf-schnellstrasse-bei-bangkok;Hier finden Sie Informationen zu dem Thema „Unfälle“. Lesen Sie jetzt „Nach Zugunglück: Kran stürzt auf Schnellstraße bei Bangkok“.;Unfälle;News, Unfälle, Bangkok, Thailand, Samut Sakhon, Polizei, Unfall, Schnellstraße, Baukran, Zugunglück, Auto;2026-01-15T08:32:59+01:00;2026-01-15T08:32:59+01:00;;dpa;false
1dc69495efbe2b25d2288894ba1c4c777c53249aa143c66d6407d1ad3631aa3f;Unfall auf A19 sorgt für stundenlange Vollsperrung;https://www.zeit.de/news/2026-01/15/unfall-auf-a19-sorgt-fuer-stundenlange-vollsperrung;Hier finden Sie Informationen zu dem Thema „Unfälle“. Lesen Sie jetzt „Unfall auf A19 sorgt für stundenlange Vollsperrung“.;Unfälle;News, Unfälle, Unfall, Vollsperrung, Auto;2026-01-15T08:31:09+01:00;2026-01-15T08:31:09+01:00;;dpa Mecklenburg-Vorpommern;false
f8623437a7cfe2a31a3ccfcb14ed51e3675cb4a476bd8f8892d250270f644c36;Gewerkschaften drohen mit Ausweitung von Warnstreiks;https://www.zeit.de/wirtschaft/2026-01/warnstreiks-gewerkschaften-verdi-oeffentlichen-dienst-gxe;In Potsdam werden die Tarifverhandlungen für Beschäftigte der Länder fortgesetzt. Gewerkschafter schließen weitere Streiks nicht aus.;Tarifstreit;Wirtschaft, Tarifstreit , Potsdam, öffentlicher Dienst, Ver.di, Streik, Warnstreik;2026-01-15T08:27:17+01:00;2026-01-15T08:27:17+01:00;mns;DIE ZEIT,        dpa,        							mns;false
e26dbef31a7d65421d21ef55ce55c3d6a68c3abd05bb321880c00ce941711c8d;Unfall beim Abbiegen - sechs Menschen schwer verletzt;https://www.zeit.de/news/2026-01/15/unfall-beim-abbiegen-sechs-menschen-schwer-verletzt;Hier finden Sie Informationen zu dem Thema „Zollernalbkreis“. Lesen Sie jetzt „Unfall beim Abbiegen - sechs Menschen schwer verletzt“.;Zollernalbkreis;News, Zollernalbkreis, Zollernalbkreis, Unfall, Auto;2026-01-15T08:23:26+01:00;2026-01-15T08:23:26+01:00;;dpa Baden-Württemberg;false
75fd4f12f7bfe860f7e522161a0c900bc0ab572ac1c7ab3bb5d1277da5790559;Eine Person nach Brand in Rochlitz vermisst;https://www.zeit.de/news/2026-01/15/eine-person-nach-brand-in-rochlitz-vermisst;Hier finden Sie Informationen zu dem Thema „Brände“. Lesen Sie jetzt „Eine Person nach Brand in Rochlitz vermisst“.;Brände;News, Brände, Rochlitz, Wohnhausbrand, Brand;2026-01-15T08:23:14+01:00;2026-01-15T08:23:14+01:00;;dpa Sachsen;false
d5a9c3d2d9b8d7ba748ad6b6fca2e83c9eff108af8dbdc613e3c19ef504243d6;Linienbus kippt um - Fahrer schwer verletzt;https://www.zeit.de/news/2026-01/15/linienbus-kippt-um-fahrer-schwer-verletzt;Hier finden Sie Informationen zu dem Thema „Unfall in Aalen“. Lesen Sie jetzt „Linienbus kippt um - Fahrer schwer verletzt“.;Unfall in Aalen;News, Unfall in Aalen, Polizei, Linienbus, Unfall;2026-01-15T08:15:42+01:00;2026-01-15T08:15:42+01:00;;dpa Baden-Württemberg;false
f8afcbeaad2e61c6014c3e4ec6fffb3aa709f0061e5b322bebb3db11a13b4586;Telefonbetrüger prellen Ehepaar um Goldmünzen und Schmuck;https://www.zeit.de/news/2026-01/15/telefonbetrueger-prellen-ehepaar-um-goldmuenzen-und-schmuck;Hier finden Sie Informationen zu dem Thema „Kriminalität“. Lesen Sie jetzt „Telefonbetrüger prellen Ehepaar um Goldmünzen und Schmuck“.;Kriminalität;News, Kriminalität, Goldmünze, Ehepaar, Kriminalität, Schmuck;2026-01-15T08:13:11+01:00;2026-01-15T08:13:11+01:00;;dpa Hessen;false
