Hash;Title;Link;Description;Category;KeyWords;Published;LastUpdated;Author;Source;Paywall
c5412983887eba2aca28e160bba7bc4602d4e8f4f70349499fecf2ffde96825f;BR Volleys gehen optimistisch ins zweite Viertelfinalspiel;https://www.zeit.de/news/2024-03/18/br-volleys-gehen-optimistisch-ins-zweite-viertelfinalspiel;Hier finden Sie Informationen zu dem Thema „Volleyball“. Lesen Sie jetzt „BR Volleys gehen optimistisch ins zweite Viertelfinalspiel“.;Volleyball;News, Volleyball, Joel Banks, Johannes Tille, Berlin, Karlsruhe, BR, Volley, Viertelfinalspiel, Volleyball;2024-03-18T10:00:34+01:00;2024-03-18T10:00:34+01:00;;dpa Berlin/Brandenburg;false
943cc8f09da394a5c426b11b8f9c98fa60605686da56a42349813e9b038c0af3;China gratuliert Wladimir Putin zur Bestätigung im Amt;https://www.zeit.de/politik/ausland/2024-03/russland-praesidentschaftswahl-wladimir-putin-china-eu;Nur wenige Länder haben Putin bislang zur Wiederwahl gratuliert, darunter China und Nordkorea. Klare Worte aus dem Westen kommen vor allem aus Osteuropa.;Russland;Politik, Russland, Wladimir Putin, Xi Jinping, Sven Wolters, Michael Thumann, Kim Jong Un, Frank-Walter Steinmeier, China, Russland, Nordkorea, Osteuropa;2024-03-18T10:00:24+01:00;2024-03-18T10:00:24+01:00;;ZEIT ONLINE,        ale;false
ed754717ea537cbda40eda3bd8dfdfda8dd1df7567bb5ddf6284af745234acac;Baby von toter Frau gefunden: Tatverdächtige festgenommen;https://www.zeit.de/news/2024-03/18/baby-von-toter-frau-gefunden-tatverdaechtige-festgenommen;Hier finden Sie Informationen zu dem Thema „Hockenheim“. Lesen Sie jetzt „Baby von toter Frau gefunden: Tatverdächtige festgenommen“.;Hockenheim;News, Hockenheim, Hockenheim, Rhein-Neckar-Kreis, Polizei, Staatsanwaltschaft, Rheindamm;2024-03-18T09:58:20+01:00;2024-03-18T09:58:20+01:00;;dpa Baden-Württemberg;false
ed754717ea537cbda40eda3bd8dfdfda8dd1df7567bb5ddf6284af745234acac;Baby von toter Frau gefunden: Tatverdächtige festgenommen;https://www.zeit.de/news/2024-03/15/baby-von-toter-frau-gefunden-tatverdaechtige-festgenommen;Hier finden Sie Informationen zu dem Thema „Kriminalität“. Lesen Sie jetzt „Baby von toter Frau gefunden: Tatverdächtige festgenommen“.;Kriminalität;News, Kriminalität, Rhein-Neckar-Kreis, Rheindamm, Kriminalität;2024-03-18T09:56:56+01:00;2024-03-18T09:56:56+01:00;;dpa Baden-Württemberg;false
103949f46a62f096091dcecd5d6896f8328bc32e36fdabd5fa23901f430f4142;"""Dune: Part Two"" erfolgreicher als erster Teil";https://www.zeit.de/news/2024-03/18/dune-part-two-erfolgreicher-als-erster-teil;"Hier finden Sie Informationen zu dem Thema „Box-Office“. Lesen Sie jetzt „""Dune: Part Two"" erfolgreicher als erster Teil“.";Box-Office;News, Box-Office, Denis Villeneuve, Chalamet;2024-03-18T09:54:02+01:00;2024-03-18T09:54:02+01:00;;dpa;false
8d905376dde4bf4ca26dd323e0fe4b771ca668dfde457b895e8dfa0463b6e3ea;Dax bleibt etwas unter 18.000 Punkten;https://www.zeit.de/news/2024-03/15/dax-nahezu-unveraendert;Hier finden Sie Informationen zu dem Thema „Börse in Frankfurt“. Lesen Sie jetzt „Dax bleibt etwas unter 18.000 Punkten“.;Börse in Frankfurt;News, Börse in Frankfurt, Frankfurt, DAX, Handelsauftakt, Aktienindex, Dax, Aktien;2024-03-18T09:51:11+01:00;2024-03-18T09:51:11+01:00;;dpa;false
9df9df79267a4d00320bbb65811eeaaf10dcac357852e3cc7e58d5b578ba521c;Rückgang bei Genehmigungen für neue Wohnungen geht weiter;https://www.zeit.de/wirtschaft/2024-03/wohnungsbau-baugenehmigung-rueckgang-kosten-investoren;Wer jetzt kein Haus hat, baut sich auch erstmal keins. Der Rückgang bei neu genehmigten Wohnungen geht weiter. Teure Materialien und Finanzierung schrecken Investoren ab.;Wohnungsbau;Wirtschaft, Wohnungsbau, Immobilienmarkt, Wohnungsbau, Bauindustrie, Unternehmen, Statistik, Rohstoff, Olaf Scholz, Destatis, Rückgang, Genehmigung;2024-03-18T09:37:52+01:00;2024-03-18T09:37:52+01:00;;ZEIT ONLINE,        Reuters;false
37d843772142314113c724f5fe84bb83b8f9fc0eb4850983ce3b8d99728eb0f6;Menschen in Kuba protestieren gegen Strom- und Lebensmittelknappheit;https://www.zeit.de/politik/ausland/2024-03/kuba-proteste-strom-lebensmittel-preise;Seit Wochen leiden Menschen in Kuba unter Stromausfällen und fehlenden Lebensmitteln, nun gehen sie dagegen auf die Straße. Ihr Präsident warnt vor Einflussnahme der USA.;Wirtschaftskrise;Politik, Wirtschaftskrise, Kuba, Inflation, Protest, USA, Wirtschaftskrise, Stromversorgung, Nahrungsmittel, Miguel Díaz-Canel, Santiago, X;2024-03-18T09:36:38+01:00;2024-03-18T09:36:38+01:00;;ZEIT ONLINE,        AFP,        dpa,        Reuters,        caf;false
af2c3562460a73a65f0d1723c943a786fda16bb413420006f6f2ce6bc6c342ae;Zahl der Gewaltfälle an Schulen steigt;https://www.zeit.de/news/2024-03/18/verband-der-schulleiter-mehr-waffen-zur-schule-mitgebracht;Hier finden Sie Informationen zu dem Thema „Messer im Ranzen“. Lesen Sie jetzt „Zahl der Gewaltfälle an Schulen steigt“.;Messer im Ranzen;News, Messer im Ranzen, Sven Winkler, Schulleiterverband, Umgangston;2024-03-18T09:34:35+01:00;2024-03-18T09:34:35+01:00;;dpa;false
b497b34371d89e4154655975b1b791e8f0085612b7bc56b33143e75037e3abd0;Fahrrad und E-Roller auf den Gleisen behindern S-Bahn;https://www.zeit.de/news/2024-03/18/fahrrad-und-e-roller-auf-den-gleisen-behindern-s-bahn;Hier finden Sie Informationen zu dem Thema „Hamburg“. Lesen Sie jetzt „Fahrrad und E-Roller auf den Gleisen behindern S-Bahn“.;Hamburg;News, Hamburg, S-Bahn Hamburg, Stuttgart 21, Verkehrsbeeinträchtigung, Fahrrad, E-Roller;2024-03-18T09:30:53+01:00;2024-03-18T09:30:53+01:00;;dpa Hamburg/Schleswig-Holstein;false
d03d3bf7371371c193888dc9018b4f47638659ad580f8aa59d06cbe31d4c1663;Drehbuchautor David Seidler gestorben;https://www.zeit.de/news/2024-03/18/drehbuchautor-david-seidler-gestorben;"Hier finden Sie Informationen zu dem Thema „""The King's Speech""“. Lesen Sie jetzt „Drehbuchautor David Seidler gestorben“.";"""The King's Speech""";"News, ""The King's Speech"", David Seidler, Neuseeland, Originaldrehbuch";2024-03-18T09:30:06+01:00;2024-03-18T09:30:06+01:00;;dpa;false
47fc3f1637721cc5dde984b17d3c3950d38803dc177df76fad5f3f08b472dc3e;Kreml will Putin als haushohen Wahlsieger feiern;https://www.zeit.de/news/2024-03/18/kreml-will-putin-als-haushohen-wahlsieger-feiern;Hier finden Sie Informationen zu dem Thema „Russland“. Lesen Sie jetzt „Kreml will Putin als haushohen Wahlsieger feiern“.;Russland;News, Russland, Wladimir Putin, Russland, Moskau, Nato, Präsidentenwahl, Vierteljahrhundert, Krieg in der Ukraine, Kritik, Konflikt;2024-03-18T09:27:04+01:00;2024-03-18T09:27:04+01:00;;dpa;false
21644eee45e02928fc3a113da4e1ccf262b285257ac9cb2bdd32ba1ccb84f01b;"Peter Kraus: ""Sugar Baby"" wird 85";https://www.zeit.de/news/2024-03/17/peter-kraus-sugar-baby-wird-85;"Hier finden Sie Informationen zu dem Thema „Musik“. Lesen Sie jetzt „Peter Kraus: ""Sugar Baby"" wird 85“.";Musik;News, Musik, Peter Kraus, Sugar Baby, Günther Sigl, Joscho Stephan, Elvis Presley, Gamlitz, Deutsche Presse-Agentur, Spider Murphy Gang;2024-03-18T09:23:05+01:00;2024-03-18T09:23:05+01:00;;dpa;false
36e8bfea3a8a8126d7d2e0a00da7a15e3c6d2f7c2773fbe739262381f46f6d54;Schweizer Polizei nimmt Rechtsextremen Martin Sellner fest;https://www.zeit.de/politik/ausland/2024-03/rechtsextreme-treffen-martin-sellner-identitaere-aargau;Im Schweizer Kanton Aargau hat die Polizei ein Treffen Rechtsextremer aufgelöst. Dabei wurde der Kopf der Identitären Bewegung festgesetzt – und des Landes verwiesen.;Identitäre Bewegung;Politik, Identitäre Bewegung, Verhaftung, Rechtsextremismus, Identitäre Bewegung, Martin Sellner, Schweiz, Polizei, Aargau, Treffen, Rechtsextrem, Rechtsextreme;2024-03-18T09:22:46+01:00;2024-03-18T09:22:46+01:00;;ZEIT ONLINE,        AP,        AFP,        dho;false
4b89f344dd091f6d839e3b1fe43afa75bb53d83e542dda9ba313fc8b4fc37547;"Quoten-Erfolg für Münster-""Tatort""";https://www.zeit.de/news/2024-03/18/quoten-erfolg-fuer-muenster-tatort;"Hier finden Sie Informationen zu dem Thema „Krimireihe“. Lesen Sie jetzt „Quoten-Erfolg für Münster-""Tatort""“.";Krimireihe;News, Krimireihe, Karl-Friedrich Boerne, Jan Josef Liefers, Silke Haller, Frank Thiel, Axel Prahl, Münster, ARD, Tatort, Krimireihe, Erfolg;2024-03-18T09:19:29+01:00;2024-03-18T09:19:29+01:00;;dpa;false
8cedb5b10c513518c968b44153cdabddd4ba97256a98822f4a18b203f8cd64a5;IOC entscheidet: Olympia-Eröffnung mit Russlands Sportlern?;https://www.zeit.de/news/2024-03/18/ioc-entscheidet-olympia-eroeffnung-mit-russlands-sportlern;Hier finden Sie Informationen zu dem Thema „Olympische Spiele“. Lesen Sie jetzt „IOC entscheidet: Olympia-Eröffnung mit Russlands Sportlern?“.;Olympische Spiele;News, Olympische Spiele, Thomas Bach, Wladimir Putin, Oleg Matyzin, Matwij Bidny, Russland, Paris, Lausanne, Belarus, IOC, Internationales Olympisches Komitee;2024-03-18T09:17:40+01:00;2024-03-18T09:17:40+01:00;;dpa Sport;false
4b77b6bd5c2565978d18f1d61b79e844084447468ee4b1c96dc4948c859562c9;Bilder des Tages;https://www.zeit.de/news/2024-03/18/bilder-des-tages;Hier finden Sie Informationen zu dem Thema „Fotografie“. Lesen Sie jetzt „Bilder des Tages“.;Fotografie;News, Fotografie, Luftangriff;2024-03-18T09:13:54+01:00;2024-03-18T09:13:54+01:00;;dpa;false
831d252b677f218d0614b4ebd247b5f72abd32afbbbd7e144ada8724832478da;Tote und Verletzte bei Kämpfen in Krankenhaus in Gaza-Stadt;https://www.zeit.de/politik/ausland/2024-03/nahostkrieg-israel-militaer-krankenhaus-gaza-hamas;Hamas-Kämpfer sollen israelische Soldaten vom Al-Schifa-Krankenhaus aus angegriffen haben. Ein israelischer Gegenangriff löste in der Klinik offenbar einen Brand aus.;Nahostkrieg;Politik, Nahostkrieg, Israel, Militär, Gazastreifen, Schifa-Krankenhaus, Hamas, Nahostkrieg, Bodentruppe, Kampf;2024-03-18T09:12:52+01:00;2024-03-18T09:12:52+01:00;;ZEIT ONLINE,        dpa,        Reuters,        ale;false
590a403507b30af07493d38dfef3db158535e1c45f62087469dc1c0d4d103154;Hannover Rück: Deutschlandchef Pickel geht;https://www.zeit.de/news/2024-03/18/hannover-rueck-deutschlandchef-pickel-geht;Hier finden Sie Informationen zu dem Thema „Versicherungen“. Lesen Sie jetzt „Hannover Rück: Deutschlandchef Pickel geht“.;Versicherungen;News, Versicherungen, Thorsten Steinmann, Michael Pickel, Hannover, Rück SE, Swiss Re;2024-03-18T09:12:44+01:00;2024-03-18T09:12:44+01:00;;dpa Niedersachsen;false
fa1ce7b183ae46f59c3ce87f88316e6776449abdad67cb64ef5b7d9598c98e69;Angstlust und Erotik im Halbschatten;https://www.zeit.de/2024/12/pratermuseum-wien-vergnuegungspark-geschichte;Alles dreht sich, alles bewegt sich: Nahe dem Riesenrad eröffnet in Wien das Pratermuseum. Es zeigt den Vergnügungspark als Ort der Aufklärung und für Grenzerfahrungen.;Pratermuseum in Wien;Kultur, Pratermuseum in Wien, Wien, Geschichte, Erotik, Österreich, Theater, Joseph Roth;2024-03-18T09:11:53+01:00;2024-03-18T09:11:53+01:00;Thomas Mießgang;;true
574446f0c2001dcd8ba4fff8bea1b42d6d98f9f308a27819d9b36aaea7b9076b;Wetter in NRW: Milde Temperaturen und gelegentlich Regen;https://www.zeit.de/news/2024-03/18/wetter-in-nrw-milde-temperaturen-und-gelegentlich-regen;Hier finden Sie Informationen zu dem Thema „Düsseldorf“. Lesen Sie jetzt „Wetter in NRW: Milde Temperaturen und gelegentlich Regen“.;Düsseldorf;News, Düsseldorf, NRW, Düsseldorf, Nordrhein-Westfalen, Temperatur, Wetter;2024-03-18T09:05:44+01:00;2024-03-18T09:05:44+01:00;;dpa Nordrhein-Westfalen;false
e3c644e155156f9a50f9bfd1a6147ae2ef9e09c030e7d130f3f8657a2626e86b;Baugenehmigungen auch zu Jahresbeginn gesunken;https://www.zeit.de/news/2024-03/18/baugenehmigungen-auch-zu-jahresbeginn-gesunken;Hier finden Sie Informationen zu dem Thema „Immobilien“. Lesen Sie jetzt „Baugenehmigungen auch zu Jahresbeginn gesunken“.;Immobilien;News, Immobilien, Baugenehmigung, Immobilie;2024-03-18T09:03:11+01:00;2024-03-18T09:03:11+01:00;;dpa;false
df1ea05f80cc6d11349a5e22e9b76164e5656d7b515b9ff74216d16cfe927628;Haus in Wilster abgebrannt: Polizei vermutet Brandstiftung;https://www.zeit.de/news/2024-03/18/haus-in-wilster-abgebrannt-polizei-vermutet-brandstiftung;Hier finden Sie Informationen zu dem Thema „Kreis Steinburg“. Lesen Sie jetzt „Haus in Wilster abgebrannt: Polizei vermutet Brandstiftung“.;Kreis Steinburg;News, Kreis Steinburg, Wilster, Kreis Steinburg, Polizei, Feuerwehr, Brandstiftung;2024-03-18T08:58:45+01:00;2024-03-18T08:58:45+01:00;;dpa Hamburg/Schleswig-Holstein;false
8ee3d0f21ff3d14f24fe8cf17105609d248fe058bf137f95f99b770e23e9ddbb;Junger Iraker in Meißen rassistisch beleidigt und geschlagen;https://www.zeit.de/news/2024-03/18/junger-iraker-in-meissen-rassistisch-beleidigt-und-geschlagen;Hier finden Sie Informationen zu dem Thema „Extremismus“. Lesen Sie jetzt „Junger Iraker in Meißen rassistisch beleidigt und geschlagen“.;Extremismus;News, Extremismus, Irak, Meißen, Polizei, Extremismus, Polizeistreife, Blaulicht;2024-03-18T08:52:53+01:00;2024-03-18T08:52:53+01:00;;dpa Sachsen;false
056b6cf13b45e22436eb01a75c4689b9c4e7506eb52280baae7197ddecdbfa3e;Feuerwehr findet Leiche in brennender Wohnung;https://www.zeit.de/news/2024-03/18/feuerwehr-findet-leiche-in-brennender-wohnung;Hier finden Sie Informationen zu dem Thema „Märkischer Kreis“. Lesen Sie jetzt „Feuerwehr findet Leiche in brennender Wohnung“.;Märkischer Kreis;News, Märkischer Kreis, Märkischer Kreis, Feuerwehr, Feuerwehrwagen, Blaulicht;2024-03-18T08:51:21+01:00;2024-03-18T08:51:21+01:00;;dpa Nordrhein-Westfalen;false
d45a74f6abb90c2936d0b94a55cc65ad77ddf5de9ecd5460b52c8c2956356dca;Häuser in Winningen brennen;https://www.zeit.de/news/2024-03/18/haeuser-in-winningen-brennen;Hier finden Sie Informationen zu dem Thema „Mayen-Koblenz“. Lesen Sie jetzt „Häuser in Winningen brennen“.;Mayen-Koblenz;News, Mayen-Koblenz, Winningen, Feuerwehr, Polizei, Einsatzfahrzeug;2024-03-18T08:49:57+01:00;2024-03-18T08:49:57+01:00;;dpa Rheinland-Pfalz/Saarland;false
4c340bd79d2e20c2bff5636ecc1a03dcbd9a55e844a320ea4407c60d9112a661;Unfall mit Kleinbus: Kindergartenkinder an Bord;https://www.zeit.de/news/2024-03/18/unfall-mit-kleinbus-kindergartenkinder-an-bord;Hier finden Sie Informationen zu dem Thema „Unterallgäu“. Lesen Sie jetzt „Unfall mit Kleinbus: Kindergartenkinder an Bord“.;Unterallgäu;News, Unterallgäu, Unterallgäu, Polizei, Unfall, Kleinbus;2024-03-18T08:48:11+01:00;2024-03-18T08:48:11+01:00;;dpa Bayern;false
c0a343b7ed98d76e988508add67ad895c51706af2cc0427dbc18238ff8a468cf;Sie warten auf den Rausch;https://www.zeit.de/wirtschaft/2024-03/cannabis-legalisierung-podcast-wirtschaft-demecan;Die Bundesregierung will Cannabis teilweise legalisieren, doch es hakt. Für Firmen wie Demecan, die medizinisches Cannabis produzieren, wäre das ein gutes Geschäft.;"Podcast: Ist das eine Blase? /
                        Wirtschaftspodcast";Wirtschaft, Wirtschaftspodcast, Cannabis, Drogenpolitik, Drogen, Bundesregierung;2024-03-18T08:43:59+01:00;2024-03-18T08:43:59+01:00;Carla NeuhausZacharias Zacharakis;;false
d0e2322a2b08ca2353d034be242c2108235c5bb1576eca50f6af41777917d2c4;Steigende Fluggastzahlen in NRW noch unter Vor-Corona-Level;https://www.zeit.de/news/2024-03/18/steigende-fluggastzahlen-in-nrw-noch-unter-vor-corona-level;Hier finden Sie Informationen zu dem Thema „Statistik“. Lesen Sie jetzt „Steigende Fluggastzahlen in NRW noch unter Vor-Corona-Level“.;Statistik;News, Statistik, NRW, Osnabrück, Flughafen Düsseldorf International, Nordrhein-Westfalen, Münster, Paderborn, Lippstadt, Niederrhein, Weeze, Düsseldorf;2024-03-18T08:42:10+01:00;2024-03-18T08:42:10+01:00;;dpa Nordrhein-Westfalen;false
600254ef15cbf02e58b3ad563d4667e06a9205e8d80cec1579daa774011522da;Neue Woche bringt Sonne, milde Temperaturen und etwas Regen;https://www.zeit.de/news/2024-03/18/neue-woche-bringt-sonne-milde-temperaturen-und-etwas-regen;Hier finden Sie Informationen zu dem Thema „Wetter“. Lesen Sie jetzt „Neue Woche bringt Sonne, milde Temperaturen und etwas Regen“.;Wetter;News, Wetter, Rheinland-Pfalz, Temperatur, Wetter;2024-03-18T08:40:57+01:00;2024-03-18T08:40:57+01:00;;dpa Rheinland-Pfalz/Saarland;false
7b123df431d61409a8b159a753017ee69e8f65af7068bc18ba527955f56b68ae;Umsätze bei Industriebetrieben in SH leicht gestiegen;https://www.zeit.de/news/2024-03/18/umsaetze-bei-industriebetrieben-in-sh-leicht-gestiegen;Hier finden Sie Informationen zu dem Thema „Konjunktur“. Lesen Sie jetzt „Umsätze bei Industriebetrieben in SH leicht gestiegen“.;Konjunktur;News, Konjunktur, Schleswig-Holstein, Umsatz, Industriebetrieb, Eurozone;2024-03-18T08:39:49+01:00;2024-03-18T08:39:49+01:00;;dpa Hamburg/Schleswig-Holstein;false
dfdc46787c9c252fe0a4b269ae99a4c500367309bf095111d1aaa0bb91b2f925;"Quoten: 12,7 Millionen schalten Münster-""Tatort"" ein";https://www.zeit.de/news/2024-03/18/quoten-12-7-millionen-schalten-muenster-tatort-ein;"Hier finden Sie Informationen zu dem Thema „Fernsehen“. Lesen Sie jetzt „Quoten: 12,7 Millionen schalten Münster-""Tatort"" ein“.";Fernsehen;News, Fernsehen, Frank Thiel, Karl-Friedrich Boerne, Münster, WDR, ARD, Tatort;2024-03-18T08:38:26+01:00;2024-03-18T08:38:26+01:00;;dpa Nordrhein-Westfalen;false
52863b51f93ae0ae7f7b7db2378c818f99806be5175dea52778f7356a994989e;Einsatz an brennender Lagerhalle in Berlin dauert an;https://www.zeit.de/news/2024-03/18/einsatz-an-brennender-lagerhalle-in-berlin-dauert-an;Hier finden Sie Informationen zu dem Thema „Brände“. Lesen Sie jetzt „Einsatz an brennender Lagerhalle in Berlin dauert an“.;Brände;News, Brände, Berlin, Feuerwehr, Lagerhalle, Feuerwehrkraft, Brand;2024-03-18T08:33:08+01:00;2024-03-18T08:33:08+01:00;;dpa Berlin/Brandenburg;false
8255ccfb4ace9f2e15ccfb0ffb8abbed402df29b6d286cf7f1e9842d1d05d4fc;Hannover Rück hebt nach Rekordgewinn die Dividende an;https://www.zeit.de/news/2024-03/18/hannover-rueck-hebt-nach-rekordgewinn-die-dividende-an;Hier finden Sie Informationen zu dem Thema „Versicherungen“. Lesen Sie jetzt „Hannover Rück hebt nach Rekordgewinn die Dividende an“.;Versicherungen;News, Versicherungen, Hannover, Rück SE, Rekordgewinn, Dividende, Sonderdividende;2024-03-18T08:32:06+01:00;2024-03-18T08:32:06+01:00;;dpa Niedersachsen;false
260fdaab99d7e1cffaa3f0c45e11ae1709e475de49f66cd270f0831255630159;"Klopp-Frust vor TV-Kamera: ""Dumme Frage""";https://www.zeit.de/news/2024-03/18/klopp-nicht-sauer-wegen-verpasster-titelchance;"Hier finden Sie Informationen zu dem Thema „FA Cup“. Lesen Sie jetzt „Klopp-Frust vor TV-Kamera: ""Dumme Frage""“.";FA Cup;News, FA Cup, Jürgen Klopp, Liverpool, FC Liverpool, Manchester United, Titelchance;2024-03-18T08:31:49+01:00;2024-03-18T08:31:49+01:00;;dpa Sport;false
82745b667f07a4eaa5aebc208bf8967b7e39219704ca4bc8d37cf189dfc42b87;Milde Temperaturen in der neuen Woche;https://www.zeit.de/news/2024-03/18/milde-temperaturen-in-der-neuen-woche;Hier finden Sie Informationen zu dem Thema „Wetter“. Lesen Sie jetzt „Milde Temperaturen in der neuen Woche“.;Wetter;News, Wetter, Hessen, Temperatur, Wetter;2024-03-18T08:26:22+01:00;2024-03-18T08:26:22+01:00;;dpa Hessen;false
7e9236ddb5ac96e935ba5a7683709cfb50ccfe81217f2f6bc04e97504961201d;29-Jähriger nach Überfall im Krankenhaus;https://www.zeit.de/news/2024-03/18/29-jaehriger-nach-ueberfall-im-krankenhaus;Hier finden Sie Informationen zu dem Thema „Kriminalität“. Lesen Sie jetzt „29-Jähriger nach Überfall im Krankenhaus“.;Kriminalität;News, Kriminalität, Polizei, Überfall, Polizeiauto, Kriminalität;2024-03-18T08:24:56+01:00;2024-03-18T08:24:56+01:00;;dpa Berlin/Brandenburg;false
f3f177c22a03c876bcb5f52423a5dd79128de67a8f0b2db622a959880003d408;Betriebsratswahlen bei Tesla: Arbeitsbedingungen kritisiert;https://www.zeit.de/news/2024-03/17/tesla-beschaeftigte-waehlen-betriebsrat;Hier finden Sie Informationen zu dem Thema „IG Metall“. Lesen Sie jetzt „Betriebsratswahlen bei Tesla: Arbeitsbedingungen kritisiert“.;IG Metall;News, IG Metall, Grünheide, IG Metall, Betriebsrat, Tesla Factory, Metall, Auto;2024-03-18T08:23:49+01:00;2024-03-18T08:23:49+01:00;;dpa Berlin/Brandenburg;false
185d1f8337cafdf34d6a5d258530ca0f1c4bf8c0bbbb47bbfb1ecfd4dd269eee;Tod mehrerer Schafe: Chance auf Wolfsabschuss schlecht;https://www.zeit.de/news/2024-03/18/tod-mehrerer-schafe-chance-auf-wolfsabschuss-schlecht;Hier finden Sie Informationen zu dem Thema „Tiere“. Lesen Sie jetzt „Tod mehrerer Schafe: Chance auf Wolfsabschuss schlecht“.;Tiere;News, Tiere, Ingo Stoll, Pöglitz, Wolfsabschuss, Tiere;2024-03-18T08:22:54+01:00;2024-03-18T08:22:54+01:00;;dpa Mecklenburg-Vorpommern;false
da3a94620c76a841a0bf820c0dbdfa8cfbdae4f716b5cfa9cd323b964c0b8635;Ukraine rückt wohl bei Donezk vor, Angriff auf russische Ölraffinerie;https://www.zeit.de/politik/ausland/karte-ukraine-krieg-russland-frontverlauf-truppenbewegungen;Südwestlich von Donezk haben ukrainische Streitkräfte offenbar Gelände gewonnen. Dem Geheimdienst SBU ist anscheinend eine Attacke auf russischem Territorium gelungen.;Ukraine-Karte aktuell;Politik, Ukraine-Karte aktuell, Krieg in der Ukraine, Russland, Ukraine, Militär, Streitkräfte, Donezk, Awdijiwka;2024-03-18T08:17:48+01:00;2024-03-18T08:17:48+01:00;Dominik LenzeYevgeniya ShcherbakovaJohann StephanowitzTimo StukenbergSascha VenohrAnnick EhmannChristian EndtDavid SchachJulius TrögerBenja Zehr;;false
5aeaefb96fb69fa93836a05ea615e9a1dd0db63ba9d9d190f60c95ec81a6a9d9;Bislang 16 Tuberkulose-Fälle in diesem Jahr gemeldet;https://www.zeit.de/news/2024-03/18/bislang-16-tuberkulose-faelle-in-diesem-jahr-gemeldet;Hier finden Sie Informationen zu dem Thema „Gesundheit“. Lesen Sie jetzt „Bislang 16 Tuberkulose-Fälle in diesem Jahr gemeldet“.;Gesundheit;News, Gesundheit, Sachsen-Anhalt, Klinikum Neukölln, Vivantes;2024-03-18T08:15:13+01:00;2024-03-18T08:15:13+01:00;;dpa Sachsen;false
df3652c7008508a61f7f8f6de27a824f9b469552b4c870eab49970788eeac8fc;Taucher in Eschweiler vermisst: Suche mit Spezialkräften;https://www.zeit.de/news/2024-03/18/taucher-in-eschweiler-vermisst-suche-mit-spezialkraeften;Hier finden Sie Informationen zu dem Thema „Notfälle“. Lesen Sie jetzt „Taucher in Eschweiler vermisst: Suche mit Spezialkräften“.;Notfälle;News, Notfälle, Eschweiler, Feuerwehr, Polizei, Spezialkraft, Notfall, Auto;2024-03-18T08:13:57+01:00;2024-03-18T08:13:57+01:00;;dpa Nordrhein-Westfalen;false
2a91c411c2f1737367ce9b3fb43f19a9e88d1c7b437ef4640968fc7dd1056e3a;Regen und Gewitter zum Wochenstart in Niedersachsen erwartet;https://www.zeit.de/news/2024-03/18/regen-und-gewitter-zum-wochenstart-in-niedersachsen-erwartet;Hier finden Sie Informationen zu dem Thema „Wetter“. Lesen Sie jetzt „Regen und Gewitter zum Wochenstart in Niedersachsen erwartet“.;Wetter;News, Wetter, Niedersachsen, Bremen, Gewitter, Wetter;2024-03-18T08:12:50+01:00;2024-03-18T08:12:50+01:00;;dpa Niedersachsen;false
1b50b767397f2b956808b7b45c0cfba1d2bff17546b755151b1d9f8143be78a5;Brand in Hamburger Wohnhaus: Vier Menschen verletzt;https://www.zeit.de/news/2024-03/18/brand-in-hamburger-wohnhaus-vier-menschen-verletzt;Hier finden Sie Informationen zu dem Thema „Notfälle“. Lesen Sie jetzt „Brand in Hamburger Wohnhaus: Vier Menschen verletzt“.;Notfälle;News, Notfälle, Hamburg, Feuerwehr, Notfall, Fahrzeug;2024-03-18T08:11:58+01:00;2024-03-18T08:11:58+01:00;;dpa Hamburg/Schleswig-Holstein;false
d287c99f47fc59d43f544359c7952b86e41d258f938051caf3eac1cd0273383b;Polizeistatistik: Gewalttaten an Berliner Schulen nehmen zu;https://www.zeit.de/news/2024-03/18/polizeistatistik-gewalttaten-an-berliner-schulen-nehmen-zu;Hier finden Sie Informationen zu dem Thema „Kriminalität“. Lesen Sie jetzt „Polizeistatistik: Gewalttaten an Berliner Schulen nehmen zu“.;Kriminalität;News, Kriminalität, Berlin, Kreuzberg, Polizei, Deutsche Presse-Agentur, Polizeistatistik, Gewalttat, Notruf, Kriminalität, Corona;2024-03-18T08:10:56+01:00;2024-03-18T08:10:56+01:00;;dpa Berlin/Brandenburg;false
d9200f41d32452c56a46d63d4c1b6a84b020a0b15af67f42f5d915f76d6ea15d;Verkehrseinschränkungen auf Berlins Straßen;https://www.zeit.de/news/2024-03/18/verkehrseinschraenkungen-auf-berlins-strassen;Hier finden Sie Informationen zu dem Thema „Bau“. Lesen Sie jetzt „Verkehrseinschränkungen auf Berlins Straßen“.;Bau;News, Bau, Berlin, Wiener Straße, Kreuzberg, Glogauer Straße, Liegnitzer Straße, Kaiserdamm, Verkehrseinschränkung, Umleitung, Verkehrsinformationszentrale;2024-03-18T08:09:08+01:00;2024-03-18T08:09:08+01:00;;dpa Berlin/Brandenburg;false
828689afcfc1ebd7a6e738938e8b397b848246576ae22542535196aa63ce6010;Online-Angebote der Bibliotheken stärker genutzt;https://www.zeit.de/news/2024-03/18/online-angebote-der-bibliotheken-staerker-genutzt;Hier finden Sie Informationen zu dem Thema „Internet“. Lesen Sie jetzt „Online-Angebote der Bibliotheken stärker genutzt“.;Internet;News, Internet, Thomas Pleye, Sachsen-Anhalt, Onleihe, Landesverwaltungsamt, Corona;2024-03-18T08:08:06+01:00;2024-03-18T08:08:06+01:00;;dpa Sachsen;false
324aa934cf847752bca6636ceb2f4333327e5bcac9dfff0d6a34f79cd196be65;Brand in Mehrfamilienhaus in Leipzig-Paunsdorf;https://www.zeit.de/news/2024-03/18/brand-in-mehrfamilienhaus-in-leipzig-paunsdorf;Hier finden Sie Informationen zu dem Thema „Notfälle“. Lesen Sie jetzt „Brand in Mehrfamilienhaus in Leipzig-Paunsdorf“.;Notfälle;News, Notfälle, Leipzig-Paunsdorf, Leipzig, Paunsdorf, Feuerwehr, Polizei, Notfall, Einsatzfahrzeug;2024-03-18T08:06:50+01:00;2024-03-18T08:06:50+01:00;;dpa Sachsen;false
