Hash;Title;Link;Description;Category;KeyWords;Published;LastUpdated;Author;Source;Paywall
720388f7564b42872d6dd5144ffbdb45c5cda0fc6579f10aca2981e8ded5dfa9;Tödlicher Unfall mit Polizeiauto – Gericht verwarnt Beamten;https://www.zeit.de/news/2025-02/27/toedlicher-unfall-mit-polizeiauto-gericht-verwarnt-beamten;Hier finden Sie Informationen zu dem Thema „Verkehrsunfälle“. Lesen Sie jetzt „Tödlicher Unfall mit Polizeiauto – Gericht verwarnt Beamten“.;Verkehrsunfälle;News, Verkehrsunfälle, Berlin-Marzahn, Amtsgericht Tiergarten, Polizei, Unfall, Polizeiauto, Verkehrsunfall, Tötung;2025-02-27T18:24:26+01:00;2025-02-27T18:24:26+01:00;;dpa Berlin/Brandenburg;false
cb726abb86e5ac8a8ed6ff53035fecc57e46f474266cac87dba4ace173eaa36c;Rostocker FKK-Regel: Keine Badehose am Nacktstrand;https://www.zeit.de/news/2025-02/27/tourismusverband-neue-fkk-regeln-bringen-mehr-klarheit;"Hier finden Sie Informationen zu dem Thema „""FKK only""“. Lesen Sie jetzt „Rostocker FKK-Regel: Keine Badehose am Nacktstrand“.";"""FKK only""";"News, ""FKK only"", Tobias Woitendorf, Warnemünde, Tourismusverband, Klarheit, Strandbereich, Textilstrand, FKK";2025-02-27T18:22:40+01:00;2025-02-27T18:22:40+01:00;;dpa Hamburg/Schleswig-Holstein;false
0a6e1726fe52fb1663a52c90f325a266e26faaeef9eb01d58269ca2ac01efe6a;Warnstreik stoppt Schiffe, Fähren, Flieger – und Premieren;https://www.zeit.de/news/2025-02/27/elbe-wegen-warnstreiks-fuer-containerschiffe-dicht;Hier finden Sie Informationen zu dem Thema „Tarifverhandlungen“. Lesen Sie jetzt „Warnstreik stoppt Schiffe, Fähren, Flieger – und Premieren“.;Tarifverhandlungen;News, Tarifverhandlungen, Elbe, Containerschiff, Containerschiffsverkehr, Warnstreik;2025-02-27T18:19:24+01:00;2025-02-27T18:19:24+01:00;;dpa Hamburg/Schleswig-Holstein;false
873fbb65fcac356d6483c937b6e1b5d598f14411ed502c5d31817e8069433719;Mehr Hilfe bei Corona-Impfschäden;https://www.zeit.de/news/2025-02/27/mehr-hilfe-bei-corona-impfschaeden;Hier finden Sie Informationen zu dem Thema „Corona-Folgen“. Lesen Sie jetzt „Mehr Hilfe bei Corona-Impfschäden“.;Corona-Folgen;News, Corona-Folgen, Saskia Ludwig, Brandenburg, SPD, Bündnis Sahra Wagenknecht, CDU, Alternative für Deutschland, Langzeitfolge, Spezialambulanz, Koalitionsfraktion, Corona-Impfschäden;2025-02-27T18:18:20+01:00;2025-02-27T18:18:20+01:00;;dpa Berlin/Brandenburg;false
47a2468b3ac0e6cbd2b81c97d0840c9bef471832afc77902a77e5ad095a14635;Mann soll Polizistin bei Kontrolle angefahren haben;https://www.zeit.de/news/2025-02/27/mann-soll-polizistin-bei-kontrolle-angefahren-haben;Hier finden Sie Informationen zu dem Thema „Landkreis Göttingen“. Lesen Sie jetzt „Mann soll Polizistin bei Kontrolle angefahren haben“.;Landkreis Göttingen;News, Landkreis Göttingen, Landkreis Göttingen, Polizei, Auto;2025-02-27T18:10:14+01:00;2025-02-27T18:10:14+01:00;;dpa Niedersachsen;false
9aa1aa430f024f5070d218d207ef3fce789d01c97a04e088a324e421b71a6709;"""Brechstange"" hilft nicht: Kombiniererinnen ohne WM-Medaille";https://www.zeit.de/news/2025-02/27/kombiniererinnen-bei-wm-auftakt-ohne-medaille;"Hier finden Sie Informationen zu dem Thema „Nordische Ski-WM in Trondheim“. Lesen Sie jetzt „""Brechstange"" hilft nicht: Kombiniererinnen ohne WM-Medaille“.";Nordische Ski-WM in Trondheim;News, Nordische Ski-WM in Trondheim, Nathalie Armbruster, Jenny Nowak, Yuna Kasai, Gyda Westvold Hansen, Haruka Kasai, Westvold Hansen, Trondheim, Japan, Ski-WM, Medaille;2025-02-27T18:09:31+01:00;2025-02-27T18:09:31+01:00;;dpa Sport;false
d2c11f4b8f948c7fb0bb80dc33d17e862d4f61f67885627cbb9ed0cac0c90ee6;PKK-Anführer ruft zum Ende des bewaffneten Kampfes gegen Türkei auf;https://www.zeit.de/politik/ausland/2025-02/pkk-anfuehrer-ruft-zum-ende-des-bewaffneten-kampfes-gegen-tuerkei-auf;Der inhaftierte PKK-Anführer Abdullah Öcalan hat seine Anhänger dazu aufgerufen, die Waffen niederzulegen. Die in der Türkei verbotene Partei müsse sich auflösen.;Abdullah Öcalan;Politik, Abdullah Öcalan, PKK, Abdullah Gül, Türkei, Recep Tayyip Erdogan, Gefängnis, Irak;2025-02-27T18:06:42+01:00;2025-02-27T18:06:42+01:00;akm;ZEIT ONLINE,        dpa,        AFP,        							akm;false
dea1c5c533c1d9fdfb198f808ea247deba66d774236af1411a69d28cad341f24;Mindestens elf Tote nach Explosionen bei Kundgebung im Kongo;https://www.zeit.de/politik/ausland/2025-02/kongo-m23-rebellen-explusionen-tote;Bei einem Treffen von Anführern der M23-Miliz mit Bewohnern ist es zu Explosionen gekommen. M23 gibt der Regierung die Schuld, die weist die Vorwürfe zurück.;Demokratischen Republik Kongo;Politik, Demokratischen Republik Kongo, Kongo, Kinshasa, Goma, Ruanda, Rebellion, Explosion;2025-02-27T18:02:39+01:00;2025-02-27T18:02:39+01:00;akm;ZEIT ONLINE,        dpa,        AP,        							akm;false
1c9d469554c07d420af981150ee1e86691e0cecd7d230b65eab438cca6b8e0e9;Landtag lehnt Anpassungen beim Ostseeschutz für Fischerei ab;https://www.zeit.de/news/2025-02/27/fuer-fischerei-fdp-fordert-anpassungen-des-ostseeschutzes;Hier finden Sie Informationen zu dem Thema „Ostsee“. Lesen Sie jetzt „Landtag lehnt Anpassungen beim Ostseeschutz für Fischerei ab“.;Ostsee;News, Ostsee, Anne Riecke, Ostsee, Schleswig-Holstein, FDP, Ostseeschutz, Fischerei, Ostseeküste, Aktionsplan;2025-02-27T18:01:38+01:00;2025-02-27T18:01:38+01:00;;dpa Hamburg/Schleswig-Holstein;false
cbe00e5b34a0ef071d3bd4180a304dc97e2d5596e9bfecb0b3a63613c4cdcbb7;Vorerst keine höhere Besoldung für hessische Beamte;https://www.zeit.de/news/2025-02/27/vorerst-keine-hoehere-besoldung-fuer-hessische-beamte;Hier finden Sie Informationen zu dem Thema „Landtag“. Lesen Sie jetzt „Vorerst keine höhere Besoldung für hessische Beamte“.;Landtag;News, Landtag, Hessen, Besoldung, Landtag, Spargrund, Besoldungserhöhung;2025-02-27T18:00:34+01:00;2025-02-27T18:00:34+01:00;;dpa Hessen;false
611c54592724f56bbe0e6b60a3e8b3e9d184e41ea5345b6f0a463c84faadeb3f;Verdi: 460.000 Briefe und 25.000 Pakete blieben liegen;https://www.zeit.de/news/2025-02/27/verdi-460-000-briefe-und-25-000-pakete-blieben-liegen;Hier finden Sie Informationen zu dem Thema „Warnstreik bei der Post“. Lesen Sie jetzt „Verdi: 460.000 Briefe und 25.000 Pakete blieben liegen“.;Warnstreik bei der Post;News, Warnstreik bei der Post, Neustrelitz, Mecklenburg-Vorpommern, Ver.di, Warnstreik;2025-02-27T17:59:05+01:00;2025-02-27T17:59:05+01:00;;dpa Mecklenburg-Vorpommern;false
6b1be285ebbc53d077e4ee64c9d3bfc8f0a0cf19d632bace57d0d30a6c0dc2d6;Frau soll Fahrscheinkontrolleure geschlagen haben;https://www.zeit.de/news/2025-02/27/frau-soll-fahrscheinkontrolleure-geschlagen-haben;Hier finden Sie Informationen zu dem Thema „Vorfall in Stuttgart“. Lesen Sie jetzt „Frau soll Fahrscheinkontrolleure geschlagen haben“.;Vorfall in Stuttgart;News, Vorfall in Stuttgart, Stuttgart, Fahrkartenkontrolle;2025-02-27T17:55:33+01:00;2025-02-27T17:55:33+01:00;;dpa Baden-Württemberg;false
c35954c83c46e2cd0ebcb05d07237cb7dc8e8e70ef3ead90594d4c3008d472e1;Asphaltschicht-Erneuerung - Sperrungen am Mönchhof-Dreieck;https://www.zeit.de/news/2025-02/27/asphaltschicht-erneuerung-sperrungen-am-moenchhof-dreieck;Hier finden Sie Informationen zu dem Thema „Verkehr“. Lesen Sie jetzt „Asphaltschicht-Erneuerung - Sperrungen am Mönchhof-Dreieck“.;Verkehr;News, Verkehr, Würzburg, Darmstadt, Sperrung, Verkehr, Asphaltdeckschicht;2025-02-27T17:51:43+01:00;2025-02-27T17:51:43+01:00;;dpa Hessen;false
e1dbd64a0e9f55bc082f7d0a662fa27af9a68206412bf53d07745e22ce9c7926;Leben Sie im Osten und haben nicht die AfD gewählt?;https://www.zeit.de/politik/deutschland/2025-02/afd-ostdeutschland-bundestagswahlen-aufruf;Im Osten ist die AfD schon lange eine feste Größe, jetzt auch stärkste Kraft. Wie geht es denen, die dort leben, aber die Partei ablehnen? Schreiben Sie uns. ;Alternative für Deutschland;Politik, Alternative für Deutschland, Alternative für Deutschland, Ostdeutschland, Bundestagswahl, Rechtsextremismus, Demonstration, Christopher Street Day;2025-02-27T17:50:23+01:00;2025-02-27T17:50:23+01:00;Janis Dietz;;false
8e29b184c88038d15fdd1832eb844c74acc28f10cf21af8d881854836962c4f0;MV-Tourismusbranche hat Corona-Tief überwunden;https://www.zeit.de/news/2025-02/27/mv-tourismusbranche-hat-corona-tief-ueberwunden;Hier finden Sie Informationen zu dem Thema „Tourismus“. Lesen Sie jetzt „MV-Tourismusbranche hat Corona-Tief überwunden“.;Tourismus;News, Tourismus, Manuela Schwesig, Fleesensee, Göhren-Lebbin, Mecklenburg-Vorpommern, SPD, Tourismus, Übernachtungszahl, Tourismusbranche, Coronavirus;2025-02-27T17:49:34+01:00;2025-02-27T17:49:34+01:00;;dpa Mecklenburg-Vorpommern;false
dbd2b3e47ab734289c41a094f5c8fc8f2d2c5cbe089fea8177283a187f6589de;Drei neue FSME-Risikogebiete in Deutschland;https://www.zeit.de/news/2025-02/27/drei-neue-fsme-risikogebiete-in-deutschland;Hier finden Sie Informationen zu dem Thema „Von Zecken übertragene Viren“. Lesen Sie jetzt „Drei neue FSME-Risikogebiete in Deutschland“.;Von Zecken übertragene Viren;News, Von Zecken übertragene Viren, Augsburg, Brandenburg, Landkreis Elbe-Elster, Landkreis Celle, RKI, Zecke, Risikogebiet, FSME;2025-02-27T17:48:25+01:00;2025-02-27T17:48:25+01:00;;dpa;false
9a25a783e1edf7bdbe7f4bbebc0acfde5d93b6d5ec24fc1a533f2b0369cd462e;So schlagen sich die Topsmartphones aus China;https://www.zeit.de/digital/mobil/2025-02/oppo-find-x8-xiaomi-14t-pro-smartphone-vergleich-test;Es muss nicht immer Samsung oder Apple sein: Oppo und Xiaomi liefern mit neuen Smartphones ein Akkumonster und einen Preis-Leistungs-Kracher. Wir haben sie getestet.;Oppo vs. Xiaomi;Digital, Oppo vs. Xiaomi, Smartphone, China, künstliche Intelligenz, Software, Technologie, Google;2025-02-27T17:47:52+01:00;2025-02-27T17:47:52+01:00;Eike Kühl;;false
9d132db7132442bc2a74c85413560e937b50bb49559ae930fe625643a3b4f367;Schließen die Türkei und die PKK jetzt Frieden?;https://www.zeit.de/politik/ausland/2025-02/tuerkei-kurden-pkk-oecalan-erdogan-verhandlungen-faq;Verhaftungen, Repression, Tote: Seit Jahrzehnten bekämpfen sich der türkische Staat und die PKK. Kann Abdullah Öcalans Aufruf zum Gewaltverzicht den Konflikt beenden?;Türkisch-kurdischer Konflikt;Politik, Türkisch-kurdischer Konflikt, Türkei, PKK, Kurden, Abdullah Öcalan, Mustafa Kemal Atatürk, Syrien, Irak, Istanbul, Verhaftung, Militär;2025-02-27T17:46:56+01:00;2025-02-27T17:46:56+01:00;Mathis Gann;;false
359879d8bdb90cb8bfc661a837e316940ab07fb88e29860ee9fde964c0a10c9a;Ausfahrt an der Anschlussstelle Eutin der A1 wird gesperrt;https://www.zeit.de/news/2025-02/27/ausfahrt-an-der-anschlussstelle-eutin-der-a1-wird-gesperrt;Hier finden Sie Informationen zu dem Thema „Nächtliche Umleitung“. Lesen Sie jetzt „Ausfahrt an der Anschlussstelle Eutin der A1 wird gesperrt“.;Nächtliche Umleitung;News, Nächtliche Umleitung, Eutin, Anschlussstelle, Umleitung, Großraumtransport;2025-02-27T17:41:59+01:00;2025-02-27T17:41:59+01:00;;dpa Hamburg/Schleswig-Holstein;false
1dd4f3f8f41a756f1ddce0eb94d23558c959315a98f090c04764903f6d1049b1;Arbeitgeber und Elternrat kritisieren Verdi-Warnstreiks;https://www.zeit.de/news/2025-02/27/arbeitgeber-und-elternrat-kritisieren-verdi-warnstreiks;Hier finden Sie Informationen zu dem Thema „Tarifkonflikt“. Lesen Sie jetzt „Arbeitgeber und Elternrat kritisieren Verdi-Warnstreiks“.;Tarifkonflikt;News, Tarifkonflikt, Carola Freier, Ver.di, Warnstreiktag, Personennahverkehr, Gangart, Warnstreik, Tarifkonflikt;2025-02-27T17:41:11+01:00;2025-02-27T17:41:11+01:00;;dpa Mecklenburg-Vorpommern;false
16776964ff4b00852318ddbf079b4408cc4dbc0e02b105ac8c6d2ccfe738f36f;Zweifache Mutter erstochen - Lebensgefährte vor Gericht;https://www.zeit.de/news/2025-02/27/zweifache-mutter-erstochen-lebensgefaehrte-vor-gericht;Hier finden Sie Informationen zu dem Thema „Strafprozess“. Lesen Sie jetzt „Zweifache Mutter erstochen - Lebensgefährte vor Gericht“.;Strafprozess;News, Strafprozess, Krefeld, Strafprozess;2025-02-27T17:30:41+01:00;2025-02-27T17:30:41+01:00;;dpa Nordrhein-Westfalen;false
d47c0ff44d3dc4bef67e4c49455b3663264908bb37d0145cbefc775ef0e5f52f;Nach tödlicher Messerattacke - äußert sich der Angeklagte?;https://www.zeit.de/news/2025-02/27/nach-toedlicher-messerattacke-aeussert-sich-der-angeklagte;Hier finden Sie Informationen zu dem Thema „Landgericht Hildesheim“. Lesen Sie jetzt „Nach tödlicher Messerattacke - äußert sich der Angeklagte?“.;Landgericht Hildesheim;News, Landgericht Hildesheim, Sarstedt, Hildesheim, Messerattacke, Landgericht, Geflüchtetenunterkunft;2025-02-27T17:30:37+01:00;2025-02-27T17:30:37+01:00;;dpa Niedersachsen;false
41e2c0e38bd0ae68e55517de714a98218110ba62b78d57354dc77dfdb56538fb;Gericht entscheidet über Volksbegehren gegen XXL-Landtag;https://www.zeit.de/news/2025-02/27/gericht-entscheidet-ueber-volksbegehren-gegen-xxl-landtag;Hier finden Sie Informationen zu dem Thema „Wahlrecht“. Lesen Sie jetzt „Gericht entscheidet über Volksbegehren gegen XXL-Landtag“.;Wahlrecht;News, Wahlrecht, FDP, Innenministerium, Volksbegehren, Wahlrecht, Verfassungsgerichtshof;2025-02-27T17:30:37+01:00;2025-02-27T17:30:37+01:00;;dpa Baden-Württemberg;false
62188c4f0ede39efad890bbc8fe629ab33b84203a80c491567255877da3e6113;Zwickau bekräftigt Werbeverbot für die Bundeswehr;https://www.zeit.de/news/2025-02/27/zwickau-bekraeftigt-werbeverbot-fuer-die-bundeswehr;Hier finden Sie Informationen zu dem Thema „Kommunalpolitik“. Lesen Sie jetzt „Zwickau bekräftigt Werbeverbot für die Bundeswehr“.;Kommunalpolitik;News, Kommunalpolitik, Constance Arndt, Zwickau, Bundeswehr, Bündnis Sahra Wagenknecht, Werbeverbot, Kommunalpolitik, Kritik, Sondersitzung, Fahrzeug;2025-02-27T17:29:57+01:00;2025-02-27T17:29:57+01:00;;dpa Sachsen;false
0d1bd7b3144d1173f23a606cafbb8036d1770088dd0341b202d2f5b602625c67;FC St. Pauli: Endet die Torflaute gegen den BVB?;https://www.zeit.de/news/2025-02/27/fc-st-pauli-endet-die-torflaute-gegen-den-bvb;Hier finden Sie Informationen zu dem Thema „Fußball-Bundesliga“. Lesen Sie jetzt „FC St. Pauli: Endet die Torflaute gegen den BVB?“.;Fußball-Bundesliga;News, Fußball-Bundesliga, Alexander Blessin, BVB, FC St. Pauli, Fußball-Bundesliga, Bundesliga, Torflaute;2025-02-27T17:26:26+01:00;2025-02-27T17:26:26+01:00;;dpa Hamburg/Schleswig-Holstein;false
43d385c9b264cf2b1dec263a413aec48393859566cb549a926d48b2fd63a338e;Eintracht verlängert mit U21-Nationalspieler Brown;https://www.zeit.de/news/2025-02/27/eintracht-verlaengert-mit-u21-nationalspieler-brown;Hier finden Sie Informationen zu dem Thema „Fußball-Bundesliga“. Lesen Sie jetzt „Eintracht verlängert mit U21-Nationalspieler Brown“.;Fußball-Bundesliga;News, Fußball-Bundesliga, Nathaniel Brown, Fußball-Bundesliga, Eintracht Frankfurt, Bundesliga, Sommer;2025-02-27T17:25:07+01:00;2025-02-27T17:25:07+01:00;;dpa Hessen;false
a2fadd96fffd969b3d6d91c38623622b43960237d2430320915fec5355374218;Bezos-Partnerin will mit Frauen ins All - Katy Perry dabei;https://www.zeit.de/news/2025-02/27/bezos-partnerin-will-mit-frauen-ins-all-katy-perry-dabei;Hier finden Sie Informationen zu dem Thema „All-Tourismus“. Lesen Sie jetzt „Bezos-Partnerin will mit Frauen ins All - Katy Perry dabei“.;All-Tourismus;News, All-Tourismus, Katy Perry, Jeff Bezos, William Shatner, Gayle King, Sánchez, Amazon, Blue Origin;2025-02-27T17:20:38+01:00;2025-02-27T17:20:38+01:00;;dpa;false
026b6790370fa2b85492b29995fbbd2f9912f746d4bdb528744447d90b526773;Versprühtes Pfefferspray sorgt für Einsätze an zwei Schulen;https://www.zeit.de/news/2025-02/27/verspruehtes-pfefferspray-sorgt-fuer-grossen-einsatz-an-schule;Hier finden Sie Informationen zu dem Thema „Einsatz an Schule“. Lesen Sie jetzt „Versprühtes Pfefferspray sorgt für Einsätze an zwei Schulen“.;Einsatz an Schule;News, Einsatz an Schule, Friedland, Mecklenburg-Vorpommern, Polizei, Pfefferspray, Reizgas;2025-02-27T17:17:30+01:00;2025-02-27T17:17:30+01:00;;dpa Mecklenburg-Vorpommern;false
68ea9a338bc6eb00e7cf3e8eec15e4ec5d3d9ac79e94dc6112c1bb083eaa788a;Hier gibt's nichts zu erpressen;https://www.zeit.de/2025/09/rohstoffe-ukraine-donald-trump-deal-militaerhilfen;Donald Trump macht der Ukraine einen Deal: Zugang zu Rohstoffen als Ersatz für erhaltene Militärhilfen. Nun gibt es Zweifel: Hat die Ukraine die Seltenen Erden überhaupt?;Rohstoffe der Ukraine;Wirtschaft, Rohstoffe der Ukraine, Donald Trump, Wolodymyr Selenskyj, USA, Russland, Rohstoff, Krieg in der Ukraine;2025-02-27T17:14:06+01:00;2025-02-27T17:14:06+01:00;Ingo Malcher;Aus der        ZEIT Nr. 09/2025;false
0409d7132dbb5bf20ad270450c45b1d3b8ecdec03681cd3b2f4c2224bf8ced42;Aus Maßregelvollzug geflohener Mann zurückgebracht;https://www.zeit.de/news/2025-02/27/aus-massregelvollzug-geflohener-mann-zurueckgebracht;Hier finden Sie Informationen zu dem Thema „Kranker Straftäter“. Lesen Sie jetzt „Aus Maßregelvollzug geflohener Mann zurückgebracht“.;Kranker Straftäter;News, Kranker Straftäter, Wunstorf, Hannover, Polizei, Maßregelvollzug;2025-02-27T17:12:40+01:00;2025-02-27T17:12:40+01:00;;dpa Niedersachsen;false
8bd5de6a52ba561ca4c3336e85571271b395ca29f18b3d751d4d00225e782e0a;"""Eine gesunde Portion linker Populismus gehört dazu""";https://www.zeit.de/digital/internet/2025-02/die-linke-tiktok-heidi-reichinnek-wahlkampf-bundestagswahl;Linken-Politikerin Heidi Reichinnek ist ein Star bei TikTok. Warum gelingt ihr, was bei anderen peinlich ist? Der Architekt ihres Accounts erklärt den Erfolg.  ;"Z+ (abopflichtiger Inhalt);
        
    Die Linke auf TikTok";Digital, Die Linke auf TikTok, Heidi Reichinnek, Die Linke, TikTok, Populismus, Alternative für Deutschland, Deutscher Bundestag, Olaf Scholz, Alice Weidel;2025-02-27T17:12:27+01:00;2025-02-27T17:12:27+01:00;Meike Laaff;;false
fc38e7bcfd6e45fa386a79cc12efb689bb424cf58bea8a5ed21470dcf50c102c;Millionenerbe und falsches Testament - Pflegerin verurteilt;https://www.zeit.de/news/2025-02/27/millionenerbe-und-falsches-testament-pflegerin-verurteilt;Hier finden Sie Informationen zu dem Thema „Betrugsprozess“. Lesen Sie jetzt „Millionenerbe und falsches Testament - Pflegerin verurteilt“.;Betrugsprozess;News, Betrugsprozess, Passau, Staatsanwaltschaft, Betrugsprozess, Testament, Bankguthaben, Gold;2025-02-27T17:10:06+01:00;2025-02-27T17:10:06+01:00;;dpa Bayern;false
04cbe8f8c504a97bff338d76001c8880d6d00cc28ef859cbbc647ee58d613283;HSV- und Werder-Fußballerinnen stellen Zuschauerrekord auf;https://www.zeit.de/news/2025-02/27/hsv-und-werder-fussballerinnen-stellen-zuschauerrekord-auf;Hier finden Sie Informationen zu dem Thema „DFB-Pokal“. Lesen Sie jetzt „HSV- und Werder-Fußballerinnen stellen Zuschauerrekord auf“.;DFB-Pokal;News, DFB-Pokal, HSV, Deutscher Fußball-Bund, Hamburger SV, SV Werder Bremen, VfL Wolfsburg, Zuschauerrekord;2025-02-27T17:05:19+01:00;2025-02-27T17:05:19+01:00;;dpa Hamburg/Schleswig-Holstein;false
3cf73e330be6b461c80bb0ba85c08682632e6364c268f7e334f91472687c6f22;Überfall auf Jugendclub - kein Hinweis auf politisches Motiv;https://www.zeit.de/news/2025-02/27/ueberfall-auf-jugendclub-kein-hinweis-auf-politisches-motiv;Hier finden Sie Informationen zu dem Thema „Kriminalität“. Lesen Sie jetzt „Überfall auf Jugendclub - kein Hinweis auf politisches Motiv“.;Kriminalität;News, Kriminalität, Berlin-Friedrichshain, Polizei, Überfall, Jugendclub, Kriminalität;2025-02-27T17:05:06+01:00;2025-02-27T17:05:06+01:00;;dpa Berlin/Brandenburg;false
2c095429662201c6a95c1f5c019935e1882fe00591ca293d757cc5d863434f4b;"""Pseudo-Fragesteller genießen ihre Monologe""";https://www.zeit.de/2025/09/fragen-stellen-psychologie-verhalten;So ein nettes Gespräch! Dieses Gefühl entsteht oft, wenn Menschen in einer Unterhaltung ihre eigenen Fragen beantworten. Nur nicht beim Gegenüber, zeigt eine neue Studie.;"Z+ (abopflichtiger Inhalt);
        
    Fragen stellen";Wissen, Fragen stellen, Verhaltensforschung, Studie, Psyche, Forschung, Kommunikation, Psychologie;2025-02-27T17:03:51+01:00;2025-02-27T17:03:51+01:00;Stefanie Kara;Aus der        ZEIT Nr. 09/2025;false
d5d24e5cd4a21436d34fb2dd3f65c0d0d27bad63e6aa28c962c311d75b334649;Sein Gehirn erstarrte in der Hitzewolke zu Glas;https://www.zeit.de/wissen/umwelt/2025-02/vulkanausbruch-vesuv-gehirn-pompeji-archaeologie;Als der Vesuv einst vor Neapel ausbrach, begrub heiße Asche die Römerstadt Herculaneum. Jetzt fanden Archäologen im Schädel eines Verschütteten etwas Hartes, Dunkles.;"Z+ (abopflichtiger Inhalt);
        
    Vulkanausbruch am Vesuv";Wissen, Vulkanausbruch am Vesuv, Vulkan, Vesuv, Archäologie, Neapel, Pompeji, Vulkanausbruch, Rom, Herculaneum;2025-02-27T17:03:04+01:00;2025-02-27T17:03:04+01:00;Dagny Lüdemann;;false
5551320a962bd1323a29f6ff1a3f62029e16521612521a8858270df7dc0d22f9;Zu viel Nitrat im Grundwasser: Bundesgericht verhandelt;https://www.zeit.de/news/2025-02/27/zu-viel-nitrat-im-grundwasser-bundesgericht-verhandelt;Hier finden Sie Informationen zu dem Thema „Belastung des Grundwassers“. Lesen Sie jetzt „Zu viel Nitrat im Grundwasser: Bundesgericht verhandelt“.;Belastung des Grundwassers;News, Belastung des Grundwassers, Leipzig, Niedersachsen, Nordrhein-Westfalen, Ems, BVerwG, Deutsche Umwelthilfe e.V., OVG, Grundwasser, Nitrat, Bundesgericht;2025-02-27T17:02:28+01:00;2025-02-27T17:02:28+01:00;;dpa Niedersachsen;false
301a18dfb82809b90b62e9e96209af01f8d9d49d8d3d9630e59caea17da1a47a;Trotz Zustimmung zur AfD: BSW-Politiker bleibt in Fraktion;https://www.zeit.de/news/2025-02/27/bsw-abgeordneter-stimmt-fuer-afd-antrag-fraktion-beraet;Hier finden Sie Informationen zu dem Thema „Geheimdienst“. Lesen Sie jetzt „Trotz Zustimmung zur AfD: BSW-Politiker bleibt in Fraktion“.;Geheimdienst;News, Geheimdienst, Niels-Olaf Lüders, Brandenburg, RBB, Bündnis Sahra Wagenknecht, Alternative für Deutschland, Geheimdienst, SPD, Deutsche Presse-Agentur, Verfassungsschutz, Fraktion;2025-02-27T17:00:34+01:00;2025-02-27T17:00:34+01:00;;dpa Berlin/Brandenburg;false
687411a02753633f5ae2c5e1f114006fb3b318e85072b8bdbbf5330be163a09b;101 neue Polizeianwärter für Sachsen-Anhalt;https://www.zeit.de/news/2025-02/27/101-neue-polizeianwaerter-fuer-sachsen-anhalt;Hier finden Sie Informationen zu dem Thema „Ausbildung“. Lesen Sie jetzt „101 neue Polizeianwärter für Sachsen-Anhalt“.;Ausbildung;News, Ausbildung, Mann, Sachsen-Anhalt, Polizei, Innenministerium;2025-02-27T16:57:03+01:00;2025-02-27T16:57:03+01:00;;dpa Sachsen;false
9047ddf018e505ddd2e966d77c42874a43856301f5d89ef929254dfaa3a61e7c;AfD unterliegt vor Gericht im Streit mit Verfassungsschutz;https://www.zeit.de/news/2025-02/27/afd-unterliegt-vor-gericht-im-streit-mit-verfassungsschutz;Hier finden Sie Informationen zu dem Thema „Urteil“. Lesen Sie jetzt „AfD unterliegt vor Gericht im Streit mit Verfassungsschutz“.;Urteil;News, Urteil, Bundesinnenministerium, Alternative für Deutschland, Verfassungsschutz, Verwaltungsgericht, Verfassungsschutzbericht, Personenpotenzial;2025-02-27T16:55:01+01:00;2025-02-27T16:55:01+01:00;;dpa Berlin/Brandenburg;false
de002df1e01d59b166b40852aa85de5562d6be3112d28908888b62c369198303;EU-Hilfen für Bauern wegen Tierseuche beantragt;https://www.zeit.de/news/2025-02/27/eu-hilfen-fuer-bauern-wegen-tierseuche-beantragt;Hier finden Sie Informationen zu dem Thema „Landwirtschaft“. Lesen Sie jetzt „EU-Hilfen für Bauern wegen Tierseuche beantragt“.;Landwirtschaft;News, Landwirtschaft, Cem Özdemir, Brandenburg, Berlin, EU, Tierseuche, Bundesagrarministerium, Klauenseuche, Milchviehbetrieb, Überwachungszone, Landwirtschaft;2025-02-27T16:54:34+01:00;2025-02-27T16:54:34+01:00;;dpa Berlin/Brandenburg;false
a2de5151bf95a9b9b9e928a7a6eb1fdb9b91a28002069b4813d429f2421e34a7;Deutscher mehr als 40 Jahre nach DDR-Flucht festgenommen;https://www.zeit.de/news/2025-02/27/deutscher-mehr-als-40-jahre-nach-ddr-flucht-festgenommen;Hier finden Sie Informationen zu dem Thema „Kurioser Fall“. Lesen Sie jetzt „Deutscher mehr als 40 Jahre nach DDR-Flucht festgenommen“.;Kurioser Fall;News, Kurioser Fall, Tschechien, Riesengebirge, DDR, Polizei;2025-02-27T16:48:07+01:00;2025-02-27T16:48:07+01:00;;dpa;false
ca87f47302945703dedc05f77bfcdd45732381998ac7387010362b3dc8498b6b;Pharmabranche warnt vor Fachkräftemangel in MINT-Fächern;https://www.zeit.de/news/2025-02/27/pharmabranche-warnt-vor-fachkraeftemangel-in-mint-faechern;Hier finden Sie Informationen zu dem Thema „Bildung“. Lesen Sie jetzt „Pharmabranche warnt vor Fachkräftemangel in MINT-Fächern“.;Bildung;News, Bildung, Berlin, Verband forschender Arzneimittelhersteller, Pharmabranche, Innovationskraft, Fachkräftemangel, MINT;2025-02-27T16:47:53+01:00;2025-02-27T16:47:53+01:00;;dpa;false
877987901d4f6834b2c246fadc64dfb7bb36ce795ab26a258dc5f3564a02f4ad;Anklage gegen mutmaßlichen Attentäter von Solingen erhoben;https://www.zeit.de/gesellschaft/zeitgeschehen/2025-02/bundesgeneralanwaltschaft-anklage-mutmasslicher-taeter-solingen-anschlag;Die Bundesanwaltschaft hat den mutmaßlichen Attentäter in Solingen unter anderem wegen Mordes angeklagt. Die Behörde wirft dem Syrer zudem Mitgliedschaft im IS vor.;Bundesanwaltschaft;Gesellschaft, Bundesanwaltschaft, Solingen, Bundesanwaltschaft, Islamischer Staat, Syrien, Terrorismus, Gerichtsverfahren;2025-02-27T16:46:22+01:00;2025-02-27T16:46:22+01:00;voi;ZEIT ONLINE,        dpa,        AFP,        							voi;false
1d893fd51bbecd1bd6a667dd5e34dafae85d438feeb90fbedca7e73ccecf419e;"Krankenstand bei ""Let's Dance"" steigt: Auch Biedermann fehlt";https://www.zeit.de/news/2025-02/27/krankenstand-bei-let-s-dance-steigt-auch-biedermann-fehlt;"Hier finden Sie Informationen zu dem Thema „Show“. Lesen Sie jetzt „Krankenstand bei ""Let's Dance"" steigt: Auch Biedermann fehlt“.";Show;News, Show, Jeanette Biedermann, RTL, Let's Dance, Krankenstand;2025-02-27T16:42:28+01:00;2025-02-27T16:42:28+01:00;;dpa;false
