Hash;Title;Link;Description;Category;KeyWords;Published;LastUpdated;Author;Source;Paywall
441a5cc46af40522329c899a8de9d06dbe7bc9bd0190ae68dd9a3b149e9cf260;US-Heimatschutzministerin will ICE-Agenten zum Superbowl schicken;https://www.zeit.de/politik/ausland/2025-10/bad-bunny-kristi-noem-super-bowl-ice;Kristi Noem will die Einwanderungspolizei ICE beim nächsten Superbowl einsetzen. Dort tritt der Latin-Star Bad Bunny auf, der sich gegen das ICE positioniert hatte.;Auftritt von Bad Bunny;Politik, Auftritt von Bad Bunny, Super Bowl, Musiker, NFL, USA, Einwanderung, Migration;2025-10-05T13:42:05+02:00;2025-10-05T13:42:05+02:00;jap;DIE ZEIT,        							jap;false
b35687cb1179db897d5cf2d8b98e9124181a444449f0e895ff857649d3cd9e48;Tote bei russischen Angriffen auf Ukraine - Polen reagiert;https://www.zeit.de/news/2025-10/05/russland-greift-ukraine-erneut-mit-drohnen-und-raketen-an;Hier finden Sie Informationen zu dem Thema „Ukraine-Krieg“. Lesen Sie jetzt „Tote bei russischen Angriffen auf Ukraine - Polen reagiert“.;Ukraine-Krieg;News, Ukraine-Krieg, Russland, Luftwaffe, Rakete, Flugzeugbombe, Marschflugkörper, Angriffskrieg, Krieg in der Ukraine, Drohne, Militär;2025-10-05T13:33:24+02:00;2025-10-05T13:33:24+02:00;;dpa;false
ccdad5a1c51139468175349d75d4e72871bf79814c5728ae16c0987e4e504f33;Das Beinheben im Stütz;https://www.zeit.de/sport/2025-10/beinheben-im-stuetz-fitnessuebung-personal-trainer;Der Herbst eignet sich perfekt für Outdoor-Fitness. Unser Coach des Vertrauens gibt Ihnen alle nötigen Tipps für einen Besuch auf dem Fitnessspielplatz.;"Z+ (abopflichtiger Inhalt);
        
    Unser Personal Trainer";Sport, Unser Personal Trainer, Fitness, Fitnesstraining, Amateursport, Wetter;2025-10-05T13:31:26+02:00;2025-10-05T13:31:26+02:00;;;false
8c0c86f443c7d20a6e456f2e889851bbb11236effa44b581be7b84309426c8fc;Bilder aus dem Breisgau;https://www.zeit.de/2025/42/black-forest-labs-start-up-frieburg-ki-bildgeneration;Deutschlands größte KI-Hoffnung sitzt im Schwarzwald: Selbst der Facebook-Konzern kauft die KI des Start-ups Black Forest Labs. Was kann es, was andere nicht können?;"Z+ (abopflichtiger Inhalt);
        
    Black Forest Labs";Digital, Black Forest Labs, künstliche Intelligenz, Start-up, Technologie, Software, Mark Zuckerberg, Freiburg;2025-10-05T13:29:59+02:00;2025-10-05T13:29:59+02:00;Nicolas Killian;Aus der        ZEIT Nr. 42/2025;false
22944c08ad3a6bb6432a339d4fd2bbe70731c7e8bd6d143bb685cf89f86dffaf;Trauerbeflaggung am Jahrestag des Hamas-Überfalls auf Israel;https://www.zeit.de/news/2025-10/05/trauerbeflaggung-am-jahrestag-des-hamas-ueberfalls-auf-israel;Hier finden Sie Informationen zu dem Thema „7. Oktober“. Lesen Sie jetzt „Trauerbeflaggung am Jahrestag des Hamas-Überfalls auf Israel“.;7. Oktober;News, 7. Oktober, Israel, Mecklenburg-Vorpommern, Gazastreifen, Hamas, Innenministerium, Trauerbeflaggung, Jahrestag;2025-10-05T13:29:20+02:00;2025-10-05T13:29:20+02:00;;dpa Mecklenburg-Vorpommern;false
5ab662c12ff541592b7b7524127101d3252418fb280613793e24f1ce35688f7c;Zum Wochenbeginn weiter kühl und regnerisch;https://www.zeit.de/news/2025-10/05/zum-wochenbeginn-weiter-kuehl-und-regnerisch;Hier finden Sie Informationen zu dem Thema „Wetter“. Lesen Sie jetzt „Zum Wochenbeginn weiter kühl und regnerisch“.;Wetter;News, Wetter, Nordrhein-Westfalen, Westfalen, Wetter;2025-10-05T13:29:16+02:00;2025-10-05T13:29:16+02:00;;dpa Nordrhein-Westfalen;false
0f3402bb9f868f84c12d91ec248b96ebce002c134a7b114446f1c4d231d41a5d;Unser täglich Brot gibt uns Harry;https://www.zeit.de/2025/42/harry-brot-baeckerei-supermaerkte-handwerk;Harry ist der mächtigste Bäcker des Landes: Das Unternehmen beliefert immer mehr Supermärkte mit Brot. Geht das nur auf Kosten der Handwerksbäcker?;"Z+ (abopflichtiger Inhalt);
        
    Harry-Brot";Wirtschaft, Harry-Brot, Harry Harry, Johann Hinrich Harry, Frank Kleiner, Schenefeld, Hamburg, Hamburg-Altona, Holthausen, ZEIT, NGG, Rewe;2025-10-05T13:27:24+02:00;2025-10-05T13:27:24+02:00;Marcus Rohwetter;Aus der        ZEIT Nr. 42/2025;false
140deb79ec4491d069d4537f69cea1106a461378c73cb1a98876855af389a219;Handtasche geraubt - Reizgas ins Gesicht gesprüht;https://www.zeit.de/news/2025-10/05/handtasche-geraubt-reizgas-ins-gesicht-gesprueht;Hier finden Sie Informationen zu dem Thema „Kriminalität“. Lesen Sie jetzt „Handtasche geraubt - Reizgas ins Gesicht gesprüht“.;Kriminalität;News, Kriminalität, Polizei, Reizgas, Handtasche, Kriminalität;2025-10-05T13:26:55+02:00;2025-10-05T13:26:55+02:00;;dpa Berlin/Brandenburg;false
cde50a5d33f7f002258b4341b4ffb7f27176cf6bca0f400acbe980a1fc549040;SEK-Einsatz in Neukölln;https://www.zeit.de/news/2025-10/05/sek-einsatz-in-neukoelln;Hier finden Sie Informationen zu dem Thema „Kriminalität“. Lesen Sie jetzt „SEK-Einsatz in Neukölln“.;Kriminalität;News, Kriminalität, Neukölln, Berlin-Neukölln, Polizei, Spezialeinsatzkommando, Kriminalität;2025-10-05T13:23:57+02:00;2025-10-05T13:23:57+02:00;;dpa Berlin/Brandenburg;false
ea807ec150ff724e2ca7b5259c6281b454245f0d39a03dff4c2ae19295483733;Polizei ermittelt: Mann schießt mit Armbrust auf Jugendliche;https://www.zeit.de/news/2025-10/05/polizei-ermittelt-mann-schiesst-mit-armbrust-auf-jugendliche;Hier finden Sie Informationen zu dem Thema „Kriminalität“. Lesen Sie jetzt „Polizei ermittelt: Mann schießt mit Armbrust auf Jugendliche“.;Kriminalität;News, Kriminalität, Wiesbaden, Polizei, Kriminalität;2025-10-05T13:23:44+02:00;2025-10-05T13:23:44+02:00;;dpa Hessen;false
96ad4ce33aeaced27698fef64f60b2d40c614f9b24e91a54a0bf17f24d9a0b84;Köfte nicht besser sein;https://www.zeit.de/zeit-magazin/wochenmarkt/2025-09/fellah-koeftesi-bulgur-rezept-cute-little-fairy-sonntagsessen;"Schon mal Fellah Köftesi, also Bulgurklößchen mit scharfer Tomatensoße, gegessen? Das Formen erfordert etwas Zeit, die Rezeptautorin sagt: ""Sehen Sie es als Therapie.""";"Z+ (abopflichtiger Inhalt);
        
    Fellah Köftesi";vegetarische Rezepte, Türkische Küche, Hauptgerichte, Beilage, kochen;2025-10-05T13:22:01+02:00;2025-10-05T13:22:01+02:00;Eva Biringer;;false
a0a1cecadbb83ac137492a7ec5239c6133e9b375943b0e9be7514467515a8361;Sturmflut an der deutschen Nordseeküste erwartet;https://www.zeit.de/news/2025-10/05/sturmflut-an-der-deutschen-nordseekueste-erwartet;Hier finden Sie Informationen zu dem Thema „Wetter“. Lesen Sie jetzt „Sturmflut an der deutschen Nordseeküste erwartet“.;Wetter;News, Wetter, Nordseeküste, Sturmflut, Sturmtief, Sturmflutwarnung, Wetter;2025-10-05T13:21:05+02:00;2025-10-05T13:21:05+02:00;;dpa Hamburg/Schleswig-Holstein;false
ac15f550c9adbaf9903ca323388c84ed0cb70ac109f809a1b6d344cc0d2d78f3;Mann schießt auf Geschäft - Hintergrund wohl Familienstreit;https://www.zeit.de/news/2025-10/05/mann-schiesst-auf-geschaeft-hintergrund-wohl-familienstreit;Hier finden Sie Informationen zu dem Thema „Kriminalität“. Lesen Sie jetzt „Mann schießt auf Geschäft - Hintergrund wohl Familienstreit“.;Kriminalität;News, Kriminalität, Köln, Polizei, Familienstreit, Hintergrund, Kriminalität;2025-10-05T13:19:57+02:00;2025-10-05T13:19:57+02:00;;dpa Nordrhein-Westfalen;false
d91efef7717c72fb3d34518b30f2f02f25b09345c196136166f5c1a9915820df;Illegales Autorennen? Zwei Kinder bei Kollision verletzt;https://www.zeit.de/news/2025-10/05/illegales-autorennen-zwei-kinder-bei-kollision-verletzt;Hier finden Sie Informationen zu dem Thema „Unfälle“. Lesen Sie jetzt „Illegales Autorennen? Zwei Kinder bei Kollision verletzt“.;Unfälle;News, Unfälle, Bergheim, Rhein-Erft-Kreis, Autorennen, Kollision, Unfall, Auto;2025-10-05T13:17:42+02:00;2025-10-05T13:17:42+02:00;;dpa Nordrhein-Westfalen;false
ad444b47384b16ffe3f120826b70cd3d2a59d52165458a0b12e3fcb52dc036d8;Sturmflut erreicht Nordseeküste;https://www.zeit.de/news/2025-10/05/sturmflut-erreicht-nordseekueste;Hier finden Sie Informationen zu dem Thema „Wetter“. Lesen Sie jetzt „Sturmflut erreicht Nordseeküste“.;Wetter;News, Wetter, Sylt, Nordseeküste, Sturmflut, Pegelstand, Küstenregion, Wetter, Hochwasser;2025-10-05T13:16:21+02:00;2025-10-05T13:16:21+02:00;;dpa Hamburg/Schleswig-Holstein;false
72667046d3b5e64a8c278f4d42086a67c8b903abeaf6ef1c2ea06cdcee8930d5;"""Wir glücklich, Fans glücklich"": Osnabrück im Aufwind";https://www.zeit.de/news/2025-10/05/wir-gluecklich-fans-gluecklich-osnabrueck-im-aufwind;"Hier finden Sie Informationen zu dem Thema „3. Fußball-Liga“. Lesen Sie jetzt „""Wir glücklich, Fans glücklich"": Osnabrück im Aufwind“.";3. Fußball-Liga;News, 3. Fußball-Liga, Osnabrück, Mannheim, Bielefeld, VfL Osnabrück, Herbst, Sommer;2025-10-05T13:13:31+02:00;2025-10-05T13:13:31+02:00;;dpa Niedersachsen;false
4f6765166bf0b463cfee103ed308dbb24fd2cc7403060003aa91c47e80a7f99d;Erntedankfest mit guten Erträgen;https://www.zeit.de/news/2025-10/05/erntedankfest-mit-guten-ertraegen;Hier finden Sie Informationen zu dem Thema „Landwirtschaft“. Lesen Sie jetzt „Erntedankfest mit guten Erträgen“.;Landwirtschaft;News, Landwirtschaft, Colette Boos-John, Thadäus König, Thüringen, CDU, Erntedankfest, Ertrag, Landwirtschaft, Bauernmarkt;2025-10-05T13:10:19+02:00;2025-10-05T13:10:19+02:00;;dpa Thüringen;false
3b1b75036c88bfee35a803f88b9a60172d27db92cc4063daec384d34201b7061;Iran sieht sich nicht länger an Verträge mit IAEA gebunden;https://www.zeit.de/politik/ausland/2025-10/iran-iaea-abbas-araghtschi;"Der iranische Außenminister nennt die Internationale Atomenergie-Organisation ""nicht mehr relevant"". Gegen sein Land waren UN-Sanktionen wieder in Kraft getreten.";Internationale Atomenergie-Organisation;Politik, Internationale Atomenergie-Organisation, Iran, IAEO, Atomprogramm, Vereinte Nationen, Sanktion, Ajatollah Said Ali Chamenei, Kairo, Teheran;2025-10-05T13:06:12+02:00;2025-10-05T13:06:12+02:00;jap;DIE ZEIT,        AFP,        							jap;false
8846c75cb148eebf59489e8801bb24cf73b5caf8aab6d1e3b5f4a11d17e33799;Senatorin für Umwelt, Klima und Wissenschaft gesucht;https://www.zeit.de/news/2025-10/05/senatorin-fuer-umwelt-klima-und-wissenschaft-gesucht;Hier finden Sie Informationen zu dem Thema „Bremen“. Lesen Sie jetzt „Senatorin für Umwelt, Klima und Wissenschaft gesucht“.;Bremen;News, Bremen, Kathrin Moosdorf, Irene Strebl, Andreas Bovenschulte, Bremen, SPD, X;2025-10-05T13:05:24+02:00;2025-10-05T13:05:24+02:00;;dpa Niedersachsen;false
a62b1b0b0b611a4097b9a2957a844766378e9bf1279dc7aae9ce097e61b96db7;Kinderwagen und Lagerhalle brennen in St. Ingbert;https://www.zeit.de/news/2025-10/05/kinderwagen-und-lagerhalle-brennen-in-st-ingbert;Hier finden Sie Informationen zu dem Thema „Brände“. Lesen Sie jetzt „Kinderwagen und Lagerhalle brennen in St. Ingbert“.;Brände;News, Brände, St. Ingbert, Feuerwehr, Lagerhalle, Kinderwagen, Brand;2025-10-05T13:04:42+02:00;2025-10-05T13:04:42+02:00;;dpa Rheinland-Pfalz/Saarland;false
eb229c144bff1b5f21a0d281cfc66766c368ed119e6c891b8a564f342bd9061c;Nach Cyberattacke am Flughafen BER läuft IT-System wieder;https://www.zeit.de/news/2025-10/05/nach-cyberattacke-am-flughafen-ber-laeuft-it-system-wieder;Hier finden Sie Informationen zu dem Thema „Luftverkehr“. Lesen Sie jetzt „Nach Cyberattacke am Flughafen BER läuft IT-System wieder“.;Luftverkehr;News, Luftverkehr, Aerospace, BER, Deutsche Presse-Agentur, Cyberattacke, Cyberangriff, Luftverkehr, Hauptstadtflughafen, Passagierabfertigung, Flughafen BER, Automat;2025-10-05T13:03:56+02:00;2025-10-05T13:03:56+02:00;;dpa Berlin/Brandenburg;false
ef622254a4e12c1960fae782fe8b84a1fb82e01d66ab707549edeee52c841c44;Streit in Pension – Mann wird lebensgefährlich verletzt;https://www.zeit.de/news/2025-10/05/streit-in-pension-mann-wird-lebensgefaehrlich-verletzt;Hier finden Sie Informationen zu dem Thema „Festnahme“. Lesen Sie jetzt „Streit in Pension – Mann wird lebensgefährlich verletzt“.;Festnahme;News, Festnahme, Mann, Landkreis Weißenburg-Gunzenhausen, Polizei, Festnahme;2025-10-05T13:00:42+02:00;2025-10-05T13:00:42+02:00;;dpa Bayern;false
df2a51ecb6d24f8ab0dec8ad6e9136851a4fce5117307c0793dce9cd5b25982c;Feuer vor CSU-Parteizentrale - Staatsschutz ermittelt;https://www.zeit.de/news/2025-10/05/feuer-vor-csu-parteizentrale-staatsschutz-ermittelt;Hier finden Sie Informationen zu dem Thema „Politische Kriminalität“. Lesen Sie jetzt „Feuer vor CSU-Parteizentrale - Staatsschutz ermittelt“.;Politische Kriminalität;News, Politische Kriminalität, München, CSU, Polizei, Staatsschutz, Parteizentrale, Kriminalität;2025-10-05T12:56:57+02:00;2025-10-05T12:56:57+02:00;;dpa Bayern;false
437f28acece6981c7b690bbda2db03668b47023fcb166a506694dd36010ae245;Gewerkschaft will Stahlwerk und Mercedes-Werk erhalten;https://www.zeit.de/news/2025-10/05/gewerkschaft-will-stahlwerk-und-mercedes-werk-erhalten;Hier finden Sie Informationen zu dem Thema „Wirtschaftskrise“. Lesen Sie jetzt „Gewerkschaft will Stahlwerk und Mercedes-Werk erhalten“.;Wirtschaftskrise;News, Wirtschaftskrise, Jan Otto, Berlin, Brandenburg, Ludwigsfelde, Eisenhüttenstadt, IG Metall, Arcelormittal, RBB, Mercedes-Benz, ArcelorMittal;2025-10-05T12:55:26+02:00;2025-10-05T12:55:26+02:00;;dpa Berlin/Brandenburg;false
a05948d3db930566ed8a80c4b789b20c38c415b090f5e543fda19c6e1272941f;Pfefferspray-Angriff auf Feier – drei Gäste leicht verletzt;https://www.zeit.de/news/2025-10/05/pfefferspray-angriff-auf-feier-drei-gaeste-leicht-verletzt;Hier finden Sie Informationen zu dem Thema „Polizeieinsatz“. Lesen Sie jetzt „Pfefferspray-Angriff auf Feier – drei Gäste leicht verletzt“.;Polizeieinsatz;News, Polizeieinsatz, Polizei, Polizeieinsatz, Stadthalle, Pfefferspray;2025-10-05T12:51:32+02:00;2025-10-05T12:51:32+02:00;;dpa Bayern;false
65e60cb0968a71f1f685a9cd1e919d1121d04b6dd07f00671b7cbe51765ff934;Autofahrerin prallt gegen Hauswand – Zwei Frauen verletzt;https://www.zeit.de/news/2025-10/05/autofahrerin-prallt-gegen-hauswand-zwei-frauen-verletzt;Hier finden Sie Informationen zu dem Thema „Unfälle“. Lesen Sie jetzt „Autofahrerin prallt gegen Hauswand – Zwei Frauen verletzt“.;Unfälle;News, Unfälle, Hauswand, Unfall, Auto;2025-10-05T12:47:59+02:00;2025-10-05T12:47:59+02:00;;dpa Rheinland-Pfalz/Saarland;false
d65cc2b8353861261577050971da5d63c28885a3e9b663b08838fee8e73d5f0a;76-Jähriger löscht Feuer in Wohnung;https://www.zeit.de/news/2025-10/05/76-jaehriger-loescht-feuer-in-wohnung;Hier finden Sie Informationen zu dem Thema „Brände“. Lesen Sie jetzt „76-Jähriger löscht Feuer in Wohnung“.;Brände;News, Brände, Walsleben, Landkreis Ostprignitz-Ruppin, Polizei, Brand;2025-10-05T12:46:32+02:00;2025-10-05T12:46:32+02:00;;dpa Berlin/Brandenburg;false
5965be79dd5afd06d4187b0b754b91037c7cdf4b40bc9d52523e93b9a6dde115;Hamburger Michel feiert Erntedank mit Brot und eigenem Honig;https://www.zeit.de/news/2025-10/05/hamburger-michel-feiert-erntedank-mit-brot-und-eigenem-honig;Hier finden Sie Informationen zu dem Thema „Evangelisch-lutherische Kirche“. Lesen Sie jetzt „Hamburger Michel feiert Erntedank mit Brot und eigenem Honig“.;Evangelisch-lutherische Kirche;News, Evangelisch-lutherische Kirche, Andreas Dressel, St. Michaelis, Brot, Erntedank;2025-10-05T12:43:32+02:00;2025-10-05T12:43:32+02:00;;dpa Hamburg/Schleswig-Holstein;false
b27937fad6c82d5d5e896d1643788a771a1a72b5de174bf756dc205621644dc7;Söders Helgoland-Reise kostete Bayern 16.000 Euro;https://www.zeit.de/news/2025-10/05/soeders-helgoland-reise-kostete-bayern-16-000-euro;Hier finden Sie Informationen zu dem Thema „Bayerns Ministerpräsident“. Lesen Sie jetzt „Söders Helgoland-Reise kostete Bayern 16.000 Euro“.;Bayerns Ministerpräsident;News, Bayerns Ministerpräsident, Markus Söder, Florian von Brunn, Bayern, Helgoland, CSU, SPD, Staatskanzlei;2025-10-05T12:41:41+02:00;2025-10-05T12:41:41+02:00;;dpa Bayern;false
5ab3242452bf2bb4df214074c15312d9f7d7ece4066a3fcbf176cfe17d244858;Betrunkener flüchtet vor Polizei - Festnahme nach Verfolgung;https://www.zeit.de/news/2025-10/05/betrunkener-fluechtet-vor-polizei-festnahme-nach-verfolgung;Hier finden Sie Informationen zu dem Thema „Kriminalität“. Lesen Sie jetzt „Betrunkener flüchtet vor Polizei - Festnahme nach Verfolgung“.;Kriminalität;News, Kriminalität, Koblenz, Polizei, Verfolgung, Kriminalität, Festnahme, Auto;2025-10-05T12:40:00+02:00;2025-10-05T12:40:00+02:00;;dpa Rheinland-Pfalz/Saarland;false
ce7d08c247df5203686a7fb2b0c066b528ba1849aec72d71eff48d8dad105f67;Sturm stoppt Fährverkehr und stört Landeserntedankfest;https://www.zeit.de/news/2025-10/05/sturm-stoppt-faehrverkehr-und-stoert-landeserntedankfest;Hier finden Sie Informationen zu dem Thema „Wetter“. Lesen Sie jetzt „Sturm stoppt Fährverkehr und stört Landeserntedankfest“.;Wetter;News, Wetter, Wismar, Rostock, Gedser, Mecklenburg-Vorpommern, Landeserntedankfest, Fährverkehr, Bühnenprogramm, Wetter, Schiff;2025-10-05T12:37:31+02:00;2025-10-05T12:37:31+02:00;;dpa Mecklenburg-Vorpommern;false
b097867bfcb61e3f07d616b2e5027d9f47c2f34a63f317c0528b8e42d81bf441;IT-System am Flughafen BER nach Cyberattacke repariert;https://www.zeit.de/news/2025-10/05/it-system-am-flughafen-ber-nach-cyberattacke-repariert;Hier finden Sie Informationen zu dem Thema „Luftverkehr“. Lesen Sie jetzt „IT-System am Flughafen BER nach Cyberattacke repariert“.;Luftverkehr;News, Luftverkehr, Aerospace, BER, Deutsche Presse-Agentur, Cyberattacke, Cyberangriff, Luftverkehr, Hauptstadtflughafen, Passagierabfertigung, Flughafen BER;2025-10-05T12:35:40+02:00;2025-10-05T12:35:40+02:00;;dpa;false
1d582f907e439a19dda299e2d39465021ceb17af9245141d8e742efbe38100d7;Georgiens Regierungschef droht Oppositionellen mit Festnahmen;https://www.zeit.de/politik/ausland/2025-10/georgien-russland-proteste-irakli-kobachidse;In Georgien droht Premier Kobachidse der Opposition mit Verhaftungen und einem Verbot. Zuvor hatte die Polizei Proteste in der Hauptstadt Tbilissi gewaltsam aufgelöst.;Proteste in Tbilissi;Politik, Proteste in Tbilissi, Georgien, Tbilissi, Polizei, Protest, Opposition, Verhaftung, Russland;2025-10-05T12:33:26+02:00;2025-10-05T12:33:26+02:00;lk;DIE ZEIT,        AFP,        Reuters,        							lk;false
1dd7b588d9bc92b913af0f15986705c4bf1bc63644364a0169604bacff88487e;Projekt soll Wassermanagement für Landwirtschaft verbessern;https://www.zeit.de/news/2025-10/05/projekt-soll-wassermanagement-fuer-landwirtschaft-verbessern;Hier finden Sie Informationen zu dem Thema „Anpassung ans Klima“. Lesen Sie jetzt „Projekt soll Wassermanagement für Landwirtschaft verbessern“.;Anpassung ans Klima;News, Anpassung ans Klima, Colette Boos-John, Thüringen, CDU, Wassermanagement, Dürrephase, Landwirtschaft, Gartenbau, Starkregen;2025-10-05T12:33:12+02:00;2025-10-05T12:33:12+02:00;;dpa Thüringen;false
ba0989470a61e880c6f44bfebe7ee13b79b9c50485c52a208ff8d1438040fac8;Pilzsucher finden Revolver im Wald;https://www.zeit.de/news/2025-10/05/pilzsucher-finden-revolver-im-wald;Hier finden Sie Informationen zu dem Thema „Vollkommen verrostet“. Lesen Sie jetzt „Pilzsucher finden Revolver im Wald“.;Vollkommen verrostet;News, Vollkommen verrostet, Polizei, Revolver, Wald;2025-10-05T12:32:50+02:00;2025-10-05T12:32:50+02:00;;dpa Sachsen;false
d60514e366696b7ffcc0eea4b8e96418b9db57d74a3b8d16fe0b5b0842740ac3;In Narva könnte Putin die Nato überfallen – manche hoffen hier darauf;https://www.zeit.de/politik/2025-09/narva-estland-russland-grenze-eu-propaganda;Nur ein Fluss trennt das estnische Narva von Putins Reich. Die Behörden bereiten den Ernstfall vor. Doch einige sagen, Russlands Krieg sei hier längst schon angekommen.;"Z+ (abopflichtiger Inhalt);
        
    Estland";Politik, Estland, Estland, Russland, Krieg in der Ukraine, Nato, EU, Drohne, Europa, Tallinn, Finnland, Sowjetunion;2025-10-05T12:31:11+02:00;2025-10-05T12:31:11+02:00;Alexander KauschanskiLea Greub;;false
15740066fd9019ee46de19b3976109c22958c6a48ab282aa589d5ffa58eba960;Stürmisches Wetter in Sachsen;https://www.zeit.de/news/2025-10/05/stuermisches-wetter-in-sachsen;Hier finden Sie Informationen zu dem Thema „Wetter“. Lesen Sie jetzt „Stürmisches Wetter in Sachsen“.;Wetter;News, Wetter, Sachsen, Polizei, Sturmtief, Wetter;2025-10-05T12:29:56+02:00;2025-10-05T12:29:56+02:00;;dpa Sachsen;false
083453fc6d6f62eb303fbd9cfb9cc56ecad8bc27e8ef715c0ca98faf9ff231c4;43-Jähriger droht mit Messer und wird mit Taser überwältigt;https://www.zeit.de/news/2025-10/05/43-jaehriger-droht-mit-messer-und-wird-mit-taser-ueberwaeltigt;Hier finden Sie Informationen zu dem Thema „Kriminalität“. Lesen Sie jetzt „43-Jähriger droht mit Messer und wird mit Taser überwältigt“.;Kriminalität;News, Kriminalität, Frankfurt, Polizei, Einsatzkraft, Kriminalität;2025-10-05T12:20:08+02:00;2025-10-05T12:20:08+02:00;;dpa Hessen;false
6b5fddec37d79c5532091bd66f467cecfdbc082c9eb8792266fe2eb462ca146f;Elf Baggerschaufeln von Baustelle gestohlen;https://www.zeit.de/news/2025-10/05/elf-baggerschaufeln-von-baustelle-gestohlen;Hier finden Sie Informationen zu dem Thema „Kriminalität“. Lesen Sie jetzt „Elf Baggerschaufeln von Baustelle gestohlen“.;Kriminalität;News, Kriminalität, Polizei, Baggerschaufel, Baustelle, Zweitschlüssel, Kriminalität;2025-10-05T12:15:57+02:00;2025-10-05T12:15:57+02:00;;dpa Baden-Württemberg;false
77d82a77e8e899b0550e5b2becbbd6ede9e68c93a1e24874f9ae1b58721f5d32;Windböe sperrt Handwerker im 13. Stock von Neubau ein;https://www.zeit.de/news/2025-10/05/windboee-sperrt-handwerker-im-13-stock-von-neubau-ein;Hier finden Sie Informationen zu dem Thema „Kurioser Einsatz“. Lesen Sie jetzt „Windböe sperrt Handwerker im 13. Stock von Neubau ein“.;Kurioser Einsatz;News, Kurioser Einsatz, München, Feuerwehr, Windböe, Neubau, Böe;2025-10-05T12:12:26+02:00;2025-10-05T12:12:26+02:00;;dpa Bayern;false
041cca3d85bd9e32791e66e8f7701bf356428b98a1d6f26dbee6a4fcdff6ff12;"Junge Leipziger spielen in Dortmund ""Männer-Fußball""";https://www.zeit.de/news/2025-10/05/junge-leipziger-spielen-in-dortmund-maenner-fussball;"Hier finden Sie Informationen zu dem Thema „Fußball-Bundesliga“. Lesen Sie jetzt „Junge Leipziger spielen in Dortmund ""Männer-Fußball""“.";Fußball-Bundesliga;News, Fußball-Bundesliga, Marcel Schäfer, Ole Werner, Christoph Baumgartner, Mann, München, Dortmund, Borussia Dortmund, RB Leipzig, Fußball-Bundesliga, Bundesliga;2025-10-05T12:11:35+02:00;2025-10-05T12:11:35+02:00;;dpa Sachsen;false
e15683d6fdf6ec50078505742d3587d27bde3265eb8a142ccd81225d0f71d703;Eine Woche nach Titeltriumph: Márquez verletzt nach Sturz;https://www.zeit.de/news/2025-10/05/eine-woche-nach-titeltriumph-m-rquez-verletzt-nach-sturz;Hier finden Sie Informationen zu dem Thema „MotoGP“. Lesen Sie jetzt „Eine Woche nach Titeltriumph: Márquez verletzt nach Sturz“.;MotoGP;News, MotoGP, Marc Márquez, Madrid, Titeltriumph;2025-10-05T12:11:30+02:00;2025-10-05T12:11:30+02:00;;dpa Sport;false
d90d907d5f2f40331cc3525278884c24d4899850913def24f718d4c6b49a30dc;Wer muss an die Waffe?;https://www.zeit.de/zeit-geschichte/2025/05/wehrpflicht-motivation-soldaten-historie-bundeswehr;Einst war die Wehrpflicht ein Versprechen für Bürgerrechte, dann ein Relikt der Vergangenheit. Nun könnte sie wiederkehren. Und mit ihr die Frage: Was motiviert Soldaten?;"Z+ (abopflichtiger Inhalt);
        
    Wehrpflicht";Wissen, Wehrpflicht, Wehrpflicht, Geschichte, Bundeswehr, Militär, Verteidigungspolitik;2025-10-05T12:10:53+02:00;2025-10-05T12:10:53+02:00;Ute Planert;Aus        ZEIT Geschichte Nr. 05/2025;false
9b7528ec2cede2c6b43a5c8b7568728cc91170272d9339c509e254768226e38c;Polizei beendet Geburtstagsfeier;https://www.zeit.de/news/2025-10/05/polizei-beendet-geburtstagsfeier;Hier finden Sie Informationen zu dem Thema „Ungebetene Gäste“. Lesen Sie jetzt „Polizei beendet Geburtstagsfeier“.;Ungebetene Gäste;News, Ungebetene Gäste, Eggersdorf, Petershagen, Märkisch-Oderland, Polizei, Geburtstagsfeier, Geburtstagsparty;2025-10-05T12:08:17+02:00;2025-10-05T12:08:17+02:00;;dpa Berlin/Brandenburg;false
429fed2cf57e073dbc3f47f49580773893a0796dbae8a1969fc6f7ca81234a17;Sechsjähriger stirbt auf S-Bahngleisen – Ermittlungen laufen;https://www.zeit.de/news/2025-10/05/sechsjaehriger-stirbt-auf-s-bahngleisen-ermittlungen-laufen;Hier finden Sie Informationen zu dem Thema „Unfälle“. Lesen Sie jetzt „Sechsjähriger stirbt auf S-Bahngleisen – Ermittlungen laufen“.;Unfälle;News, Unfälle, Wilhelmsburg, Bundespolizei, Unfall, Ermittlung;2025-10-05T12:03:21+02:00;2025-10-05T12:03:21+02:00;;dpa Hamburg/Schleswig-Holstein;false
4ab82e3f8cfb5a17719314327a4daf914773d50985b5ba311018e590f45a2bee;Einheitsfest: Rehlinger zieht positive Bilanz;https://www.zeit.de/news/2025-10/05/einheitsfest-rehlinger-zieht-positive-bilanz;Hier finden Sie Informationen zu dem Thema „Tag der Deutschen Einheit“. Lesen Sie jetzt „Einheitsfest: Rehlinger zieht positive Bilanz“.;Tag der Deutschen Einheit;News, Tag der Deutschen Einheit, Anke Rehlinger, Saarbrücken, Saarland, SPD, Tag der Deutschen Einheit, Einheitsfest;2025-10-05T11:59:32+02:00;2025-10-05T11:59:32+02:00;;dpa Rheinland-Pfalz/Saarland;false
9e694ed75cf86af564389f2dc25727086e6ca742539b41cd7eaf5794241b4291;Bundesjustizministerin plant Gesetz für Speicherung von IP-Adressen;https://www.zeit.de/politik/deutschland/2025-10/stefanie-hubig-vorratsdatenspeicherung-ip-adressen;Um gegen Missbrauchsdarstellungen vorzugehen, müssen aus Sicht von Stefanie Hubig IP-Adressen gespeichert werden. Dafür will die Ministerin ein Gesetz vorlegen.;Darstellungen sexualisierter Gewalt gegen Kinder;Politik, Darstellungen sexualisierter Gewalt gegen Kinder, Vorratsdatenspeicherung, Missbrauch, Internet, Stefanie Hubig, EuGH, Sexualisierte Gewalt an Kindern;2025-10-05T11:58:21+02:00;2025-10-05T11:58:21+02:00;jap;DIE ZEIT,        AFP,        							jap;false
