Hash;Title;Link;Description;Category;KeyWords;Published;LastUpdated;Author;Source;Paywall
93bc2558f2f50fe9d9e296ec3bf9e8c4f188ba5b945e2e123c25f347fc82ec20;Was sie stört? Der teure Lebensstil ihrer Chefs;https://www.zeit.de/arbeit/2025-05/zahnmedizinische-fachkraefte-gesundheitswesen-fachkraeftemangel-gehalt;Viele Zahnärzte finden keine Fachangestellten mehr. Denn die sind oft frustriert – wegen steiler Hierarchien und weil ihre Chefs ein Vielfaches mehr verdienen als sie.;"Z+ (abopflichtiger Inhalt);
        
    Zahnmedizinische Fachkräfte";Arbeit, Zahnmedizinische Fachkräfte, Fachkräftemangel, Gesundheitswesen, Arzt, Arbeitsbedingung, Mindestlohn, Gehalt;2025-05-24T10:58:12+02:00;2025-05-24T10:58:12+02:00;Katja Diepenbruck;;false
0e889ae737d144e655e34f60d1f8a10e70a75c2ac044d968fad6c84f800aebb9;Dieser Mann will Nordstream kaufen;https://www.zeit.de/2025/21/stephen-lynch-nordstream-gaspipeline-usa-russland;Der US-Investor Stephen Lynch traf deutsche Beamte, um Nord Stream zu übernehmen. Vielleicht sollten die sich ansehen, welche Geschäfte er in Russland gemacht hat.;"Z+ (abopflichtiger Inhalt);
        
    Stephen Lynch";Wirtschaft, Stephen Lynch, Ostsee, Pipeline, Gasversorgung, Russland, Bundesregierung, Auktion;2025-05-24T10:57:52+02:00;2025-05-24T10:57:52+02:00;Ingo Malcher;Aus der        ZEIT Nr. 21/2025;false
8ddaa5b2b790bf9f6190b6b2cc546d77cbd0951e437c68fc8e6f4ecf40a6e3aa;Im Fußball gewinnen immer die Reichen? Nicht in Deutschland!;https://www.zeit.de/sport/2025-05/underdogs-fussball-arminia-bielefeld-dfb-pokal-finale;Warum steht regelmäßig ein Drittligist im Pokalfinale? Zwei Hypothesen – eine schöne, eine weniger schöne. ;"Z+ (abopflichtiger Inhalt);
        
    DFB-Pokalfinale";Sport, DFB-Pokalfinale, DFB-Pokal, Fußball, Arminia Bielefeld, Bayer 04 Leverkusen, Deutscher Fußball-Bund;2025-05-24T10:57:05+02:00;2025-05-24T10:57:05+02:00;Oliver Fritsch;;false
a73285113e91ef9562d27317c15aafa7b9266f0c11c605d30bcfc6dfc3c80276;Abgeschobene Chilenen berichten von Misshandlungen in US-Haft;https://www.zeit.de/politik/ausland/2025-05/usa-migration-abschiebung-chile-misshanldung-trump;Nach ihrer Abschiebung nach Chile erheben die Betroffenen schwere Vorwürfe gegen US-Haftanstalten. Sie berichten von Kälte, Hunger und rassistischen Vorfällen.;Abschiebungen in den USA;Politik, Abschiebungen in den USA, USA, Chile, Misshandlung, Kälte;2025-05-24T10:55:22+02:00;2025-05-24T10:55:22+02:00;ore;ZEIT ONLINE,        epd,        							ore;false
56e7dfce398ad0bbdee358702b65857f641178782a9d480212a26c5fbb9c2884;Mann stellt sich selbst nach Schüssen mit Schreckschusswaffe;https://www.zeit.de/news/2025-05/24/mann-stellt-sich-selbst-nach-schuessen-mit-schreckschusswaffe;Hier finden Sie Informationen zu dem Thema „Polizeieinsatz“. Lesen Sie jetzt „Mann stellt sich selbst nach Schüssen mit Schreckschusswaffe“.;Polizeieinsatz;News, Polizeieinsatz, Göppingen, Polizei, Schreckschusswaffe, Polizeieinsatz;2025-05-24T10:53:57+02:00;2025-05-24T10:53:57+02:00;;dpa Baden-Württemberg;false
884e8b7ce5814db8ac342a4c06ed82b37e1ccee13bd8a2ccd3a6780137b077fb;Wagner-Nachfolger: Hübner wird Assistent von Nagelsmann;https://www.zeit.de/news/2025-05/24/wagner-nachfolger-huebner-wird-assistent-von-nagelsmann;Hier finden Sie Informationen zu dem Thema „Nationalmannschaft“. Lesen Sie jetzt „Wagner-Nachfolger: Hübner wird Assistent von Nagelsmann“.;Nationalmannschaft;News, Nationalmannschaft, Benjamin Hübner, Sandro Wagner, Julian Nagelsmann, Hoffenheim, Deutscher Fußball-Bund, Fußball-WM, Nationalmannschaft, Erfolg, Fußballnationalmannschaft;2025-05-24T10:53:38+02:00;2025-05-24T10:53:38+02:00;;dpa Baden-Württemberg;false
b916e5f83a4bd6b62b1063f2d826f3debb88761bb245a685a71d4f39d47f5582;Mann sticht nach Streit vor Disco zu - zwei Verletzte;https://www.zeit.de/news/2025-05/24/mann-sticht-nach-streit-vor-disco-zu-zwei-verletzte;Hier finden Sie Informationen zu dem Thema „Gewaltkriminalität mit Messer“. Lesen Sie jetzt „Mann sticht nach Streit vor Disco zu - zwei Verletzte“.;Gewaltkriminalität mit Messer;News, Gewaltkriminalität mit Messer, Krefeld, Gewaltkriminalität, Disco;2025-05-24T10:48:37+02:00;2025-05-24T10:48:37+02:00;;dpa Nordrhein-Westfalen;false
99eeff39ad45f3b7430b6e60fbe1c60aa00b1c5c1b311dacd6591f10848984d0;AfD stellt weitere Kandidaten für Landtagswahl auf;https://www.zeit.de/news/2025-05/24/afd-stellt-weitere-kandidaten-fuer-landtagswahl-auf;Hier finden Sie Informationen zu dem Thema „Parteien“. Lesen Sie jetzt „AfD stellt weitere Kandidaten für Landtagswahl auf“.;Parteien;News, Parteien, Magdeburg, Alternative für Deutschland, Landtagswahl, Parteitag;2025-05-24T10:48:23+02:00;2025-05-24T10:48:23+02:00;;dpa Sachsen;false
aeaf20d30c0f62046a843e9b9b3f4443eef213c28aea4bfd40b80efc15ceb0c4;Autofahrer müssen rund um Himmelfahrt mit viel Stau rechnen;https://www.zeit.de/news/2025-05/24/autofahrer-muessen-rund-um-himmelfahrt-mit-viel-stau-rechnen;Hier finden Sie Informationen zu dem Thema „Staurisiko“. Lesen Sie jetzt „Autofahrer müssen rund um Himmelfahrt mit viel Stau rechnen“.;Staurisiko;News, Staurisiko, Staurisiko, Himmelfahrt, Stau;2025-05-24T10:41:34+02:00;2025-05-24T10:41:34+02:00;;dpa Berlin/Brandenburg;false
84a30bb13f9c1ea1b04da92af198d9c9424e6edde37ef0f8628281728c1936b7;Verdacht auf Schwarzarbeit in Görlitzer Restaurant;https://www.zeit.de/news/2025-05/24/verdacht-auf-schwarzarbeit-in-goerlitzer-restaurant;Hier finden Sie Informationen zu dem Thema „Finanzkontrolle“. Lesen Sie jetzt „Verdacht auf Schwarzarbeit in Görlitzer Restaurant“.;Finanzkontrolle;News, Finanzkontrolle, Dresden, Görlitz, Schwarzarbeit, Finanzkontrolle, Hauptzollamt, Restaurant;2025-05-24T10:36:36+02:00;2025-05-24T10:36:36+02:00;;dpa Sachsen;false
7937b1b7bd757083bec3cb97e3438f85cd92080b651e1f7f74cb1d368a677667;Es wird nass in Rheinland-Pfalz und im Saarland;https://www.zeit.de/news/2025-05/24/es-wird-nass-in-rheinland-pfalz-und-im-saarland;Hier finden Sie Informationen zu dem Thema „Wetter“. Lesen Sie jetzt „Es wird nass in Rheinland-Pfalz und im Saarland“.;Wetter;News, Wetter, Saarland, Rheinland-Pfalz, DWD, Wetter;2025-05-24T10:30:27+02:00;2025-05-24T10:30:27+02:00;;dpa Rheinland-Pfalz/Saarland;false
be1de114deb8bb06d74124e822233284362bf353b10ae98b4094d3d08553de4e;DGB: Lage auch auf Saar-Wohnungsmarkt angespannt;https://www.zeit.de/news/2025-05/24/dgb-lage-auch-auf-saar-wohnungsmarkt-angespannt;Hier finden Sie Informationen zu dem Thema „Bezahlbare Mieten“. Lesen Sie jetzt „DGB: Lage auch auf Saar-Wohnungsmarkt angespannt“.;Bezahlbare Mieten;News, Bezahlbare Mieten, Saarland, Saarbrücken, Ahr, DGB, Miete, Immobilienmarkt;2025-05-24T10:21:19+02:00;2025-05-24T10:21:19+02:00;;dpa Rheinland-Pfalz/Saarland;false
918bcd2fa5a7f54a130226944ef20d7e8a5321836fc3b8f92f2940e640b9dbbb;600.000 Euro Schaden bei Brand in Mehrfamilienhaus;https://www.zeit.de/news/2025-05/24/600-000-euro-schaden-bei-brand-in-mehrfamilienhaus;Hier finden Sie Informationen zu dem Thema „Feuerwehreinsatz“. Lesen Sie jetzt „600.000 Euro Schaden bei Brand in Mehrfamilienhaus“.;Feuerwehreinsatz;News, Feuerwehreinsatz, Villingen-Schwenningen, Polizei, Feuerwehreinsatz, Feuer;2025-05-24T10:19:53+02:00;2025-05-24T10:19:53+02:00;;dpa Baden-Württemberg;false
b53a81cc44151a594704cd583a4201c4563e6a5912bd4812ba84c418e11447a5;Russland startet neuen Großangriff auf Raum Kyjiw;https://www.zeit.de/politik/ausland/2025-05/grosser-luftangriff-kyjiw-russland-krieg-selenskyj;Mit 250 Langstreckendrohnen und ballistischen Raketen hat Russland die Ukraine attackiert. Wolodymyr Selenskyj fordert zusätzliche Wirtschaftssanktionen.;Krieg gegen die Ukraine;Politik, Krieg gegen die Ukraine, Krieg in der Ukraine, Wolodymyr Selenskyj, Kyjiw, Russland, Sanktion;2025-05-24T10:14:18+02:00;2025-05-24T10:14:18+02:00;bam;ZEIT ONLINE,        AFP,        Reuters,        							bam;false
d18bdfc59faf2be8d923658fe84f80f3b9b7a6f1babde6056b00472ddb501dd7;Bundeswehr-Konvoi auch durch Brandenburg unterwegs;https://www.zeit.de/news/2025-05/24/bundeswehr-konvoi-auch-durch-brandenburg-unterwegs;Hier finden Sie Informationen zu dem Thema „Militär-Kolonnen“. Lesen Sie jetzt „Bundeswehr-Konvoi auch durch Brandenburg unterwegs“.;Militär-Kolonnen;News, Militär-Kolonnen, Brandenburg, Husum, Bundeswehr, Spezialpionierregiment, Übungstätigkeit, Militär, Fahrzeug;2025-05-24T10:10:57+02:00;2025-05-24T10:10:57+02:00;;dpa Berlin/Brandenburg;false
2507072e53485572cecd9ea10083d14c892653c036b70eb27a64c6236f99921e;Waldhof Mannheim trennt sich von sieben Spielern;https://www.zeit.de/news/2025-05/24/waldhof-mannheim-trennt-sich-von-sieben-spielern;Hier finden Sie Informationen zu dem Thema „Abgänge“. Lesen Sie jetzt „Waldhof Mannheim trennt sich von sieben Spielern“.;Abgänge;News, Abgänge, Waldhof, Mannheim, SV Waldhof Mannheim, Klassenerhalt;2025-05-24T10:09:59+02:00;2025-05-24T10:09:59+02:00;;dpa Baden-Württemberg;false
c287de98ec43d9cdc537c2ce79182a411bfdbaece73f0d9b46c14d2d447ed126;Drei Menschen bei Brand in Mehrparteienhaus leicht verletzt;https://www.zeit.de/news/2025-05/24/drei-menschen-bei-brand-in-mehrparteienhaus-leicht-verletzt;Hier finden Sie Informationen zu dem Thema „Brände“. Lesen Sie jetzt „Drei Menschen bei Brand in Mehrparteienhaus leicht verletzt“.;Brände;News, Brände, Mehrparteienhaus, Brand;2025-05-24T10:07:01+02:00;2025-05-24T10:07:01+02:00;;dpa Rheinland-Pfalz/Saarland;false
4028e3c841d8768bd862addbcea186dd7f28199595081cf94aa4bf8f82f975af;Hunderte Zurückweisungen an deutschen Grenzen binnen zwei Wochen;https://www.zeit.de/politik/deutschland/2025-05/migration-grenze-kontrolle-zurueckweisung-fluechtlinge-asyl;Zu Alexander Dobrindts ersten Amtshandlungen zählte die Verschärfung der Grenzkontrollen. Seit Beginn der neuen Regelung wurden 1.676 Menschen zurückgewiesen.;Migration;Politik, Migration, Bundesinnenministerium, Alexander Dobrindt, Bundespolizei, Asylpolitik, Migration;2025-05-24T10:05:23+02:00;2025-05-24T10:05:23+02:00;ore;ZEIT ONLINE,        AFP,        							ore;false
df23dc2bf5a39410cbac41d1967f70b51a43bcddb12a8c6cfb9714f01e514f3f;Löscharbeiten nach Brand in Reifenhandel beendet;https://www.zeit.de/news/2025-05/24/loescharbeiten-nach-brand-in-reifenhandel-beendet;Hier finden Sie Informationen zu dem Thema „Feuerwehreinsatz“. Lesen Sie jetzt „Löscharbeiten nach Brand in Reifenhandel beendet“.;Feuerwehreinsatz;News, Feuerwehreinsatz, Polizei, Löscharbeit, Reifenhandel, Feuerwehreinsatz;2025-05-24T10:03:59+02:00;2025-05-24T10:03:59+02:00;;dpa Bayern;false
f488a27d67c44c3547c034233fb2fc3db179228298ed57e50b37c973df0748fb;"""Das ist weder fair noch klug""";https://www.zeit.de/politik/deutschland/2025-05/katharina-droege-kritik-staatsbuergerschaftsrecht-alexander-dobrindt;"Das Bundesinnenministerium will die ""Turboeinbürgerung"" nach drei Jahren wieder abschaffen. Grünenfraktionschefin Katharina Dröge warnt: Das schade der Wirtschaft.";Katharina Dröge;Politik, Katharina Dröge, Einbürgerung, Alexander Dobrindt, Asylpolitik, Migration, Bündnis 90/Die Grünen, Bundesinnenministerium;2025-05-24T10:03:00+02:00;2025-05-24T10:03:00+02:00;Ferdinand Otto;;false
13944c17bdaeed3f2748aa68a3bd7c2fa94e3876a63ee8e7a023601e5b4f04fe;Lasst mich heulen!;https://www.zeit.de/sport/2025-05/fussball-fan-trauer-schmerz;Sein Lieblingsverein scheitert dramatisch. Unser Autor ist eine Woche lang schlecht drauf. Und fragt sich, ob das kindisch ist – oder total legitim. ;"Z+ (abopflichtiger Inhalt);
        
    Fußballfans";Sport, Fußballfans, Fußball, Emotion, Fußball-Bundesliga;2025-05-24T10:02:28+02:00;2025-05-24T10:02:28+02:00;Christian Spiller;;false
f1aefc68aeb6cc399faed7e92f77c2acaf8772898d8f77437bf79edd45337607;"""Grenzenziehen kann auch Türen öffnen""";https://www.zeit.de/zeit-wissen/2025/03/soziale-beziehungen-grenzenziehen-gemeinschaft-kenia;In Konflikten wirken klare Linien manchmal so, als zögen wir eine Mauer hoch. Dabei gilt das Gegenteil: Man zeigt etwas von sich. Und andere lernen, was wir brauchen.;"Z+ (abopflichtiger Inhalt);
        
    Soziale Beziehungen";Wissen, Soziale Beziehungen, Kommunikation, Familie, Psychologie, Beziehung, Kenia;2025-05-24T10:01:44+02:00;2025-05-24T10:01:44+02:00;Faith Linyonyi;Aus        ZEIT Wissen Nr. 03/2025;false
bdcc3fd46a516eac70875d0911484ba6de82f94d41cc61493686ec8024d8dcd8;Viel Regen und wenig Sonne in der Hauptstadtregion;https://www.zeit.de/news/2025-05/24/viel-regen-und-wenig-sonne-in-der-hauptstadtregion;Hier finden Sie Informationen zu dem Thema „Wetter“. Lesen Sie jetzt „Viel Regen und wenig Sonne in der Hauptstadtregion“.;Wetter;News, Wetter, Berlin, Brandenburg, Hauptstadtregion, Wetter;2025-05-24T10:01:08+02:00;2025-05-24T10:01:08+02:00;;dpa Berlin/Brandenburg;false
51dd8f7eac1b2368eb07c18c3e387406ccf679fe48505e2910928201eea3f141;Willkommen in der Mannosphäre;https://www.zeit.de/2025/21/misogynie-politik-mannosphaere-usa-diversitaet;Die US-Regierung hat genug von Feminismus. Influencer propagieren Frauenhass. Wie es so weit kommen konnte – und warum die neue Breitbeinigkeit auch bei uns zu spüren ist;"Z+ (abopflichtiger Inhalt);
        
    Misogynie in der Politik";Politik, Misogynie in der Politik, Diversity Management, Mann, Feminismus, Diskriminierung;2025-05-24T10:00:56+02:00;2025-05-24T10:00:56+02:00;Mariam Lau;Aus der        ZEIT Nr. 21/2025;false
0e90a62c0055cec7da10cab914819c5f538e37d112790849b7de8cbd67fb7d31;18-Jähriger bei Unfall lebensgefährlich verletzt;https://www.zeit.de/news/2025-05/24/18-jaehriger-bei-unfall-lebensgefaehrlich-verletzt;Hier finden Sie Informationen zu dem Thema „Unfälle“. Lesen Sie jetzt „18-Jähriger bei Unfall lebensgefährlich verletzt“.;Unfälle;News, Unfälle, Bohmte, Landkreis Osnabrück, Unfall;2025-05-24T09:58:02+02:00;2025-05-24T09:58:02+02:00;;dpa Niedersachsen;false
ea3b621af93f2c2cb62dcd83c1c2697cf2aa06cd9f7e0abc1748c4cf7647f841;Grüne warnen: Nicht an Hilfsangeboten für Jugendliche sparen;https://www.zeit.de/news/2025-05/24/gruene-warnen-nicht-an-hilfsangeboten-fuer-jugendliche-sparen;Hier finden Sie Informationen zu dem Thema „Kriminalität“. Lesen Sie jetzt „Grüne warnen: Nicht an Hilfsangeboten für Jugendliche sparen“.;Kriminalität;News, Kriminalität, Vasili Franco, Hilfsangebot, Kriminalität;2025-05-24T09:51:52+02:00;2025-05-24T09:51:52+02:00;;dpa Berlin/Brandenburg;false
113292ded627ade39b9b4f395a179baa4e1f69845abce7a8bfacaa85cc797461;"Grüne warnen vor ""Spartherapie"" bei Gesundheitsversorgung";https://www.zeit.de/news/2025-05/24/gruene-warnen-vor-spartherapie-bei-gesundheitsversorgung;"Hier finden Sie Informationen zu dem Thema „Sachsen“. Lesen Sie jetzt „Grüne warnen vor ""Spartherapie"" bei Gesundheitsversorgung“.";Sachsen;News, Sachsen, Franziska Schubert, Sachsen, Bündnis 90/Die Grünen, CDU, SPD, Spartherapie, Gesundheitsversorgung;2025-05-24T09:43:31+02:00;2025-05-24T09:43:31+02:00;;dpa Sachsen;false
466e88030218523b4ca841de00d9746ee211df91b9e361bc1ed5703497479f5f;Fünf Menschen bei Unfall auf A63 verletzt;https://www.zeit.de/news/2025-05/24/fuenf-menschen-bei-unfall-auf-a63-verletzt;Hier finden Sie Informationen zu dem Thema „Unfall“. Lesen Sie jetzt „Fünf Menschen bei Unfall auf A63 verletzt“.;Unfall;News, Unfall, Mainz, Unfall, Fahrzeug, Auto;2025-05-24T09:36:15+02:00;2025-05-24T09:36:15+02:00;;dpa Rheinland-Pfalz/Saarland;false
bba72e7b2eeb3dbc9c1a8699ea2c39a1aaef4c08343e8540dd5d8b8effe6f338;Russland greift Ukraine mit 250 Drohnen und 14 Raketen an;https://www.zeit.de/politik/ausland/ukraine-krieg-news-liveblog;Bei schweren russischen Angriffen auf Kyjiw sind mindestens 14 Menschen verletzt worden. Ein großer Gefangenenaustausch soll heute fortgesetzt werden. Das Liveblog;Liveblog:                     Ukrainekrieg;Politik, Ukrainekrieg, Wolodymyr Selenskyj, Krieg in der Ukraine, Russland, Waffenruhe, Wladimir Putin, Donald Trump;2025-05-24T08:53:33+00:00;2025-05-24T08:53:33+00:00;Omid RezaeeIsabelle DanielJustus Wilke;;false
99309198e33b1a4915de3d86e56668858b68bcf6562c607c1b9968819ffae016;"""Dem Himmel so nah"" - Wolken-Ausstellung in Emder Kunsthalle";https://www.zeit.de/news/2025-05/24/dem-himmel-so-nah-wolken-ausstellung-in-emder-kunsthalle;"Hier finden Sie Informationen zu dem Thema „Kunst in Ostfriesland“. Lesen Sie jetzt „""Dem Himmel so nah"" - Wolken-Ausstellung in Emder Kunsthalle“.";Kunst in Ostfriesland;News, Kunst in Ostfriesland, Kristin Schrader, Ostfriesland, Kunsthalle Emden, Kunsthalle;2025-05-24T09:33:44+02:00;2025-05-24T09:33:44+02:00;;dpa Niedersachsen;false
af227ef5cac3ba93b43ea2761881a10229e25db0a948a3e22805e013d0f8cc7d;Medien: Jonathan Tah gibt FC Bayern Zusage für Wechsel;https://www.zeit.de/news/2025-05/24/medien-jonathan-tah-gibt-fc-bayern-zusage-fuer-wechsel;Hier finden Sie Informationen zu dem Thema „Fußball-Bundesliga“. Lesen Sie jetzt „Medien: Jonathan Tah gibt FC Bayern Zusage für Wechsel“.;Fußball-Bundesliga;News, Fußball-Bundesliga, Jonathan Tah, München, Bayern, FC Bayern München, Fußball-Bundesliga, Zusage;2025-05-24T09:19:47+02:00;2025-05-24T09:19:47+02:00;;dpa Bayern;false
6be2be86634fba255e4430f38b991d7259a1c94f4093887b1e0468e671295efa;Zimmermann verliert Kampf um WM im Leichtgewicht;https://www.zeit.de/news/2025-05/24/zimmermann-verliert-kampf-um-wm-im-leichtgewicht;Hier finden Sie Informationen zu dem Thema „Boxen“. Lesen Sie jetzt „Zimmermann verliert Kampf um WM im Leichtgewicht“.;Boxen;News, Boxen, Natalie Zimmermann, Terri Harper, Doncaster, Großbritannien;2025-05-24T09:14:11+02:00;2025-05-24T09:14:11+02:00;;dpa Hamburg/Schleswig-Holstein;false
4254af272a21132b89932e03feacd980383d1a7c7bd53f75d61cf358cad93f92;Feuer in Mehrfamilienhaus: achtjähriges Kind verletzt;https://www.zeit.de/news/2025-05/24/feuer-in-mehrfamilienhaus-achtjaehriges-kind-verletzt;Hier finden Sie Informationen zu dem Thema „Feuerwehr“. Lesen Sie jetzt „Feuer in Mehrfamilienhaus: achtjähriges Kind verletzt“.;Feuerwehr;News, Feuerwehr, Feuerwehr, Polizei;2025-05-24T09:00:33+02:00;2025-05-24T09:00:33+02:00;;dpa Mecklenburg-Vorpommern;false
45bad1d2e124682972c98f9628bab4697aa94bdc37bdf0204d39b7fc68627c76;15-Jährige flüchtet mit Auto vor Polizei;https://www.zeit.de/news/2025-05/24/15-jaehrige-fluechtet-mit-auto-vor-polizei;Hier finden Sie Informationen zu dem Thema „Verfolgungsfahrt“. Lesen Sie jetzt „15-Jährige flüchtet mit Auto vor Polizei“.;Verfolgungsfahrt;News, Verfolgungsfahrt, St. Georgen, Schwarzwald, Polizei, Verfolgungsfahrt, Autohaus, Auto, Fahrzeug;2025-05-24T08:48:09+02:00;2025-05-24T08:48:09+02:00;;dpa Baden-Württemberg;false
daf2f73e345fe7fc3eacbf876a54fdc3d9571f79c0a74ec60af97ffe8b415959;Aubrey Plaza erstmals auf rotem Teppich nach Tod von Ehemann;https://www.zeit.de/news/2025-05/24/aubrey-plaza-erstmals-auf-rotem-teppich-nach-tod-von-ehemann;Hier finden Sie Informationen zu dem Thema „Filmfestspiele Cannes“. Lesen Sie jetzt „Aubrey Plaza erstmals auf rotem Teppich nach Tod von Ehemann“.;Filmfestspiele Cannes;News, Filmfestspiele Cannes, Aubrey Plaza, Jeff Baena, Cannes, Internationale Filmfestspiele von Cannes;2025-05-24T08:46:56+02:00;2025-05-24T08:46:56+02:00;;dpa;false
1651d7c25c8e8483b3c3607049843888dcec89ad2c8de98b199a39180ada28ce;Verkehr am Hamburger Hauptbahnhof läuft wieder planmäßig;https://www.zeit.de/gesellschaft/zeitgeschehen/2025-05/messerangriff-hamburger-bahnhof-verkehr-normal;Am Morgen nach der Messerattacke mit 18 Verletzten fahren die Züge im Hamburger Hauptbahnhof wieder nach Plan. Ermittler waren bis in die Nacht vor Ort.;Nach Messerangriff;Gesellschaft, Nach Messerangriff, Hamburg, Polizei, Verkehr, Zugverkehr;2025-05-24T08:37:58+02:00;2025-05-24T08:37:58+02:00;bam;ZEIT ONLINE,        dpa,        							bam;false
5b398f4950b1f1bf9a27380384e21a4304f074dcbd2e54169e898689b679a9b7;Führender Oppositionspolitiker vor Wahlen in Venezuela festgenommen;https://www.zeit.de/politik/ausland/2025-05/venezuela-opposition-juan-palbo-guanipa-nicolas-madoro-wahlen;Im autoritär regierten Venezuela stehen Parlaments- und Regionalwahlen an. Im Vorfeld hat die Regierung nun den Oppositionspolitiker Juan Pablo Guanipa festnehmen lassen.;Venezuela;Politik, Venezuela, Venezuela, Opposition, Autoritätsstaat, Festnahme, Juan Pablo Guanipa, Diosdado Cabello;2025-05-24T08:29:33+02:00;2025-05-24T08:29:33+02:00;ore;ZEIT ONLINE,        AFP,        dpa,        							ore;false
a6363a7392f9a052d57289ada67f2a3d5cb9f9873f079fee4ddcdc5df954015a;Russische Truppen erobern weiteren Ort in Region Donezk;https://www.zeit.de/politik/ausland/karte-ukraine-krieg-russland-frontverlauf-truppenbewegungen;Russische Soldaten haben offenbar den ostukrainischen Ort Odradne eingenommen. Im Kampf um die Stadt Torezk rückten hingegen ukrainische Einheiten vor.;Ukrainekarte aktuell;Politik, Ukrainekarte aktuell, Krieg in der Ukraine, Russland, Militär, Donezk, Luhansk, Kursk, Charkiw;2025-05-24T08:20:29+02:00;2025-05-24T08:20:29+02:00;Timo StukenbergChristina FelschenElizabeth RushtonJustus WilkePauline PieperYevgeniya ShcherbakovaDominik LenzeJulius TrögerBenja Zehr;;false
68211fad3ddc1adfc2d0f4f855c87b5a8072908bbe31e524fc514662b9516610;Edmonton gleicht Halbfinal-Serie gegen Dallas aus;https://www.zeit.de/news/2025-05/24/edmonton-gleicht-halbfinal-serie-gegen-dallas-aus;Hier finden Sie Informationen zu dem Thema „NHL-Playoffs“. Lesen Sie jetzt „Edmonton gleicht Halbfinal-Serie gegen Dallas aus“.;NHL-Playoffs;News, NHL-Playoffs, Leon Draisaitl, Ryan Nugent-Hopkins, Edmonton, Kanada, NHL, Edmonton Oilers, Dallas Stars, Finale;2025-05-24T08:12:47+02:00;2025-05-24T08:12:47+02:00;;dpa Sport;false
dee874eefaeb85101bf15982a837a54b57623f52e47c84cc22d76dfc51b56a96;Verkehr im Hamburger Hauptbahnhof wieder normal;https://www.zeit.de/news/2025-05/24/verkehr-im-hamburger-hauptbahnhof-wieder-normal;Hier finden Sie Informationen zu dem Thema „Gewalttat“. Lesen Sie jetzt „Verkehr im Hamburger Hauptbahnhof wieder normal“.;Gewalttat;News, Gewalttat, Polizei, Hauptbahnhof, Verkehr, Gewalttat, Messerangriff;2025-05-24T07:43:13+02:00;2025-05-24T07:43:13+02:00;;dpa Hamburg/Schleswig-Holstein;false
6d80bfe921f5c1a409e15d68e9fbe3895cf7674cc98943a425a09a2080005c34;EU-Handelspolitiker droht USA mit Gegenzöllen;https://www.zeit.de/wirtschaft/2025-05/eu-usa-zollstreit-donald-trump-ifo;Die EU setzt im Zollstreit mit Donald Trump weiter auf Verhandlungen – schließt aber auch Gegenmaßnahmen nicht aus. Das ifo Institut warnt vor starken Exportrückgängen.;Zollstreit;Wirtschaft, Zollstreit, Europäische Union, USA, Donald Trump, US-Zölle, Handelsstreit;2025-05-24T07:42:21+02:00;2025-05-24T07:42:21+02:00;akm;ZEIT ONLINE,        Reuters,        AFP,        							akm;false
f1520d4c4de81b7f139a7468e4254a62376065026040e143fee5c9d259342d4d;260 Bergleute aus unterirdischem Schacht in Goldmine befreit;https://www.zeit.de/gesellschaft/zeitgeschehen/2025-05/suedafrika-goldmine-bergleute-schacht-rettung;Mehr als 24 Stunden mussten Hunderte Bergleute in einer Goldmine ausharren, weil ihr Fahrstuhl defekt war. Bei einem mehrstündigen Einsatz konnten alle gerettet werden.;Südafrika;Gesellschaft, Südafrika, Südafrika, Bergbau, Minenunglück, Rettung, Gold;2025-05-24T07:32:55+02:00;2025-05-24T07:32:55+02:00;kj;ZEIT ONLINE,        AFP,        							kj;false
ad20c9bebce91bed8c44e0cdcd64e97366d8819f88b77ff3c77d13e1ff84a05b;DFB-Pokalfinale: Was spricht für den VfB, was für Bielefeld?;https://www.zeit.de/news/2025-05/24/dfb-pokalfinale-was-spricht-fuer-den-vfb-was-fuer-bielefeld;Hier finden Sie Informationen zu dem Thema „Bielefeld gegen Stuttgart“. Lesen Sie jetzt „DFB-Pokalfinale: Was spricht für den VfB, was für Bielefeld?“.;Bielefeld gegen Stuttgart;News, Bielefeld gegen Stuttgart, Sebastian Hoeneß, Stuttgart, Bielefeld, Ostwestfalen, Arminia Bielefeld, ZDF, Deutscher Fußball-Bund, VfB Stuttgart, Endspiel;2025-05-24T07:20:37+02:00;2025-05-24T07:20:37+02:00;;dpa Baden-Württemberg;false
26dd152afb646998171ff18ec0b3b03243a946e5bef8088b2ebf91f015d64ac8;Eltern sind weniger zufrieden, aber empfinden mehr Sinn;https://www.zeit.de/gesellschaft/2025-05/studie-elter-zufriedenheit-sinn-leben;Eltern sind oft weniger zufrieden als Kinderlose, empfinden ihr Leben aber als sinnstiftender. Vor allem Frauen spüren die Belastung je nach Lebenslage stärker.;Internationale Studie;Gesellschaft, Internationale Studie, Eltern, Familie, Kinder, Alltag, Zufriedenheit;2025-05-24T06:45:30+02:00;2025-05-24T06:45:30+02:00;akm;ZEIT ONLINE,        dpa,        							akm;false
b1285f2000dccfb633b8b769d9ce926faa1f501f4ece5e65cfefa33c057765e3;Antisemitismusbeauftragter fordert Debatte über deutsche Staatsräson;https://www.zeit.de/politik/deutschland/2025-05/antisemitismusbeauftragter-fordert-debatte-ueber-deutsche-staatsraeson;Deutsche Solidarität mit Israel dürfe keine Rechtfertigung für alles sein, sagt der Antisemitismusbeauftragte. Klare Grenzen sieht er beim Genozidvorwurf.;Israel und Deutschland;Politik, Israel und Deutschland, Israel, Bundesregierung, Gazastreifen, Hamas, Solidarität;2025-05-24T06:39:49+02:00;2025-05-24T06:39:49+02:00;eca;ZEIT ONLINE,        KNA,        dpa,        							eca;false
c5af31be17848e1927ad27f93623bad98d9f9defc23392254ddc32321b911a0e;Ausstellung Bluehouse auf Helgoland öffnet später;https://www.zeit.de/news/2025-05/24/ausstellung-bluehouse-auf-helgoland-oeffnet-spaeter;Hier finden Sie Informationen zu dem Thema „Neue Attraktion“. Lesen Sie jetzt „Ausstellung Bluehouse auf Helgoland öffnet später“.;Neue Attraktion;News, Neue Attraktion, Eva-Maria Brodte, Helgoland, Bremerhaven, Nordsee, Deutsche Presse-Agentur, Alfred-Wegener-Institut, Bluehouse, Attraktion;2025-05-24T06:30:39+02:00;2025-05-24T06:30:39+02:00;;dpa Hamburg/Schleswig-Holstein;false
