Hash;Title;Link;Description;Category;KeyWords;Published;LastUpdated;Author;Source;Paywall
fa31d79028c2b28f6b8540e2cc47f272cb8ee8c665d78a61492d08c188fee9a6;Eisbären Berlin verlieren Spitzenspiel in Ingolstadt mit 1:3;https://www.zeit.de/news/2025-02/26/eisbaeren-berlin-verlieren-spitzenspiel-in-ingolstadt-mit-1-3;Hier finden Sie Informationen zu dem Thema „Deutsche Eishockey Liga“. Lesen Sie jetzt „Eisbären Berlin verlieren Spitzenspiel in Ingolstadt mit 1:3“.;Deutsche Eishockey Liga;News, Deutsche Eishockey Liga, Ingolstadt, Eisbären Berlin, DEL, ERC Ingolstadt, Spitzenspiel, Eishockey, Hauptrundensieg, Nachholspiel, Eis;2025-02-26T22:09:21+01:00;2025-02-26T22:09:21+01:00;;dpa Berlin/Brandenburg;false
d8e62fbf635358e95eb551f10692a37ac757f5540f416882d45239ee0db8b394;Kontrollgremium von Verfassungsschutz wird kleiner;https://www.zeit.de/news/2025-02/26/kontrollgremium-von-verfassungsschutz-wird-kleiner;Hier finden Sie Informationen zu dem Thema „Geheimdienst“. Lesen Sie jetzt „Kontrollgremium von Verfassungsschutz wird kleiner“.;Geheimdienst;News, Geheimdienst, Verfassungsschutz, Geheimdienst, SPD, Bündnis Sahra Wagenknecht, Alternative für Deutschland, CDU, PKK, Kontrollgremium, Koalitionsfraktion, Landtag;2025-02-26T22:03:38+01:00;2025-02-26T22:03:38+01:00;;dpa Berlin/Brandenburg;false
de6299f36d73cd5098e1ef5ef63415da95db7c728a62700acb1fca9a0e4f4275;Weil mahnt künftige Koalitionäre zu fairem Umgang;https://www.zeit.de/news/2025-02/26/weil-mahnt-kuenftige-koalitionaere-zu-fairem-umgang;Hier finden Sie Informationen zu dem Thema „Koalitionsverhandlungen“. Lesen Sie jetzt „Weil mahnt künftige Koalitionäre zu fairem Umgang“.;Koalitionsverhandlungen;News, Koalitionsverhandlungen, Stephan Weil, Niedersachsen, Phoenix, SPD, Koalitionsverhandlung, Koalition;2025-02-26T22:02:01+01:00;2025-02-26T22:02:01+01:00;;dpa Niedersachsen;false
e0b4e7e7ba2e631da806667b196506665662702683e40ed4bb2fcff281461cb8;Schüsse, Verletzte und eine Fahndung am Landgericht;https://www.zeit.de/news/2025-02/26/grosseinsatz-der-polizei-am-landgericht-in-bielefeld;Hier finden Sie Informationen zu dem Thema „Kriminalität“. Lesen Sie jetzt „Schüsse, Verletzte und eine Fahndung am Landgericht“.;Kriminalität;News, Kriminalität, Bielefeld, Polizei, Landgericht, Kriminalität, Großeinsatz;2025-02-26T21:53:29+01:00;2025-02-26T21:53:29+01:00;;dpa;false
32ad57005c6ee393e97742f493bf8e435ca70c2872813743375eeddcd050f13e;Schauspielerin Michelle Trachtenberg gestorben;https://www.zeit.de/kultur/film/2025-02/gossip-girl-michelle-trachtenberg-tot;"Bekannt war Michelle Trachtenberg unter anderem durch Rollen in den Serien ""Gossip Girl"" und ""Buffy"". Mit 39 Jahren ist die Schauspielerin nun in New York verstorben.";"""Gossip Girl"" und ""Buffy""";"Kultur, ""Gossip Girl"" und ""Buffy"", Fernsehen, Fernsehserie, New York";2025-02-26T21:31:04+01:00;2025-02-26T21:31:04+01:00;mmh;ZEIT ONLINE,        AP,        dpa,        Reuters,        							mmh;false
3d37517a81e6d68b18a4a0920c73d50626610f2b477db133323d31f6f169520d;Gaskartusche explodiert? Mann stirbt bei Verpuffung;https://www.zeit.de/news/2025-02/26/gaskartusche-explodiert-mann-stirbt-bei-verpuffung;Hier finden Sie Informationen zu dem Thema „Unfälle“. Lesen Sie jetzt „Gaskartusche explodiert? Mann stirbt bei Verpuffung“.;Unfälle;News, Unfälle, Feuerwehr, Gaskartusche, Verpuffung, Unfall;2025-02-26T21:21:09+01:00;2025-02-26T21:21:09+01:00;;dpa Hessen;false
afccfd449d6cfa4b130efec4387efe4035e07e912bc00fafc88409f426bdbf5d;Vierte BVG-Tarifrunde bringt Annäherung;https://www.zeit.de/news/2025-02/26/bvg-annaeherung-in-vierter-tarifrunde;Hier finden Sie Informationen zu dem Thema „16.000 Beschäftigte“. Lesen Sie jetzt „Vierte BVG-Tarifrunde bringt Annäherung“.;16.000 Beschäftigte;News, 16.000 Beschäftigte, BVG, Ver.di, Tarifrunde, Annäherung, Verhandlungsrunde, Tarifstreit, Warnstreik;2025-02-26T21:15:25+01:00;2025-02-26T21:15:25+01:00;;dpa Berlin/Brandenburg;false
7fbffcdf602b33ad9a3e74509b91562058a70032c8ed1262b17569b61211c492;EU-Kommission will Lieferkettengesetz verschieben;https://www.zeit.de/politik/ausland/2025-02/eu-kommission-lieferkettengesetz-unternehmen-auflagen;Die Umsetzung des EU-Lieferkettengesetzes startet nach Protesten aus der Wirtschaft erst im Juni 2028. Die EU-Kommission lockert zudem einige Vorgaben und Konsequenzen.;Europäische Union;Politik, Europäische Union, EU-Kommission, Lieferkettengesetz, Europäische Union, Unternehmen, Menschenrechte, Umweltschutz, Ökonomie;2025-02-26T21:14:16+01:00;2025-02-26T21:14:16+01:00;isommh;ZEIT ONLINE,        AFP,        							iso					,        							mmh;false
bf546a2392583b9b8d6a1074868e2d92cb5bd8f0052714bad356ec96cb279225;US-Medien: Serien-Star Michelle Trachtenberg (39) gestorben;https://www.zeit.de/news/2025-02/26/us-medien-serien-star-michelle-trachtenberg-39-gestorben;Hier finden Sie Informationen zu dem Thema „Todesfall“. Lesen Sie jetzt „US-Medien: Serien-Star Michelle Trachtenberg (39) gestorben“.;Todesfall;News, Todesfall, Michelle Trachtenberg, NYPD, Gossip Girl, Todesfall;2025-02-26T21:14:07+01:00;2025-02-26T21:14:07+01:00;;dpa;false
72b42e214a650c590d938379daa80f89d0833ab8de2984a1eb1e9ed60afb8d71;Stadion gesperrt: Rostock-Gastspiel in Unterhaching abgesagt;https://www.zeit.de/news/2025-02/26/stadion-gesperrt-rostock-gastspiel-in-unterhaching-abgesagt;Hier finden Sie Informationen zu dem Thema „Spielabsage“. Lesen Sie jetzt „Stadion gesperrt: Rostock-Gastspiel in Unterhaching abgesagt“.;Spielabsage;News, Spielabsage, Unterhaching, Rostock, SpVgg Unterhaching, Hansa Rostock, Deutscher Fußball-Bund, Polizei, Spielabsage, Sicherheitskonzept, Sportpark;2025-02-26T21:13:04+01:00;2025-02-26T21:13:04+01:00;;dpa Bayern;false
a01414c6347e7fb3a84447dfe3bf792df266962c5948db9da0115c5c6157b5ff;Münchens OB bucht bereits Balkon für Bayern-Meisterparty;https://www.zeit.de/news/2025-02/26/muenchens-ob-bucht-bereits-balkon-fuer-bayern-meisterparty;Hier finden Sie Informationen zu dem Thema „125 Jahre FC Bayern“. Lesen Sie jetzt „Münchens OB bucht bereits Balkon für Bayern-Meisterparty“.;125 Jahre FC Bayern;News, 125 Jahre FC Bayern, Dieter Reiter, Uli Hoeneß, Jan-Christian Dreesen, Gianni Infantino, DFB-Präsident, München, FC Bayern München, Fußball-Bundesliga, Fifa, Meisterfeier;2025-02-26T21:11:15+01:00;2025-02-26T21:11:15+01:00;;dpa Bayern;false
41c878158b29e34ff4fa1b9f288b5d018d9393bfab4c6ed5987df20348ee7ecb;Rostock lehnt Prüfauftrag für Verpackungssteuer ab;https://www.zeit.de/news/2025-02/26/rostock-lehnt-pruefauftrag-fuer-verpackungssteuer-ab;Hier finden Sie Informationen zu dem Thema „Antrag gescheitert“. Lesen Sie jetzt „Rostock lehnt Prüfauftrag für Verpackungssteuer ab“.;Antrag gescheitert;News, Antrag gescheitert, Rostock, Tübingen, FDP, Verpackungssteuer, Prüfauftrag;2025-02-26T20:54:55+01:00;2025-02-26T20:54:55+01:00;;dpa Mecklenburg-Vorpommern;false
bc40561f6d826959a078ed6cbc3bbc890d9fe93a179e3ee12e60e74605547b6f;Auto prallt gegen Wohnhaus – Fahrer schwer verletzt;https://www.zeit.de/news/2025-02/26/auto-prallt-gegen-wohnhaus-fahrer-schwer-verletzt;Hier finden Sie Informationen zu dem Thema „Crash“. Lesen Sie jetzt „Auto prallt gegen Wohnhaus – Fahrer schwer verletzt“.;Crash;News, Crash, Ammerland, Polizei, Hauswand, Auto;2025-02-26T20:49:01+01:00;2025-02-26T20:49:01+01:00;;dpa Niedersachsen;false
05988f0d30c9a59a391f6cc070a67c9835d4fe22edb7eef9ae51f45828365f82;Neue ÖPNV-Tarifrunde - Warnstreiks teilweise ausgesetzt;https://www.zeit.de/news/2025-02/26/neue-oepnv-tarifrunde-warnstreiks-teilweise-ausgesetzt;Hier finden Sie Informationen zu dem Thema „Tarifkonflikt“. Lesen Sie jetzt „Neue ÖPNV-Tarifrunde - Warnstreiks teilweise ausgesetzt“.;Tarifkonflikt;News, Tarifkonflikt, Sascha Bähring, Mecklenburg-Vorpommern, Ver.di, Tarifstreit, Personennahverkehr, Streikdrohung, Arbeitgeberseite, Verhandlungstermin, Warnstreik, Tarifkonflikt;2025-02-26T20:47:31+01:00;2025-02-26T20:47:31+01:00;;dpa Mecklenburg-Vorpommern;false
c3991d678217a2b4c2473783be93fac1e088d968544e1e4e9c62d4d4ccff9fc4;Könnte knapp werden;https://www.zeit.de/hamburg/2025-02/koalition-hamburg-rot-gruen-wahl-buergerschaft;Bisher dümpelte der Hamburger Wahlkampf vor sich hin. Jetzt gerät die  rot-grüne Mehrheit doch ins Wanken. Der Höhenflug der Linken ist dafür nicht der einzige Grund. ;"Z+ (abopflichtiger Inhalt);
        
    Koalition in Hamburg";Hamburg, Koalition in Hamburg, Hamburg, Bürgerschaftswahl, Bündnis 90/Die Grünen, SPD, Hamburgische Bürgerschaft;2025-02-26T20:43:11+01:00;2025-02-26T20:43:11+01:00;Annika Lasarzik;;false
b610fe323d9a0e894973cbbbf6943b843b1f2a3e241065f37e3a276f04b02b04;"""Gratulation Habibi, von Herzen!""";https://www.zeit.de/politik/deutschland/2025-02/ferat-kocak-die-linke-berlin-neukoelln-direktmandat;Ferat Koçak von der Linkspartei zieht für Neukölln in den Bundestag. Er konnte die postmigrantische Community zur Wahl motivieren. Er hat erkannt: Neukölln ist überall.;"Z+ (abopflichtiger Inhalt);
        
    Ferat Koçak";Politik, Ferat Koçak, Neukölln, Berlin, Direktmandat, Bundestagswahl, Die Linke, Migration;2025-02-26T20:36:04+01:00;2025-02-26T20:36:04+01:00;Tim GeyerHanna Wiedemann;;false
f9f2637a2d55372fc721934392fa275004227281536f6ef79787a022f0f97633;Für ihren Pazifismus würden sie sogar mit der AfD stimmen;https://www.zeit.de/politik/deutschland/2025-02/linke-aussenpolitik-pazifismus-waffenlieferungen-ukraine-heidi-reichinnek;Die Linkspartei gibt sich modern, folgt aber außenpolitisch alten Dogmen. Ihre verklärte Russlandpolitik bekommt vor allem die Ukraine zu spüren. Das muss sich ändern.;Linke Außenpolitik;Politik, Linke Außenpolitik, Die Linke, Russland, Außenpolitik, Krieg in der Ukraine, Heidi Reichinnek, Jan van Aken;2025-02-26T20:33:49+01:00;2025-02-26T20:33:49+01:00;Anastasia Tikhomirova;;false
9527f3637b201a6bd5171a1f4f24c8ad640a60cd0845c865739057a0bdcaac5f;Emotionaler Abschied zweier Bürgerschafts-Urgesteine;https://www.zeit.de/news/2025-02/26/emotionaler-abschied-zweier-buergerschafts-urgesteine;Hier finden Sie Informationen zu dem Thema „Bürgerschaft“. Lesen Sie jetzt „Emotionaler Abschied zweier Bürgerschafts-Urgesteine“.;Bürgerschaft;News, Bürgerschaft, Mathias Petersen, Norbert Hackbusch, SPD, Bürgerschaft;2025-02-26T20:22:55+01:00;2025-02-26T20:22:55+01:00;;dpa Hamburg/Schleswig-Holstein;false
3294b18468debac546cf6b3cc3fdaaa1471061969672b18334c4582fd474c1d6;Höchststrafe für Islamisten wegen Dreifachmord in Nizza;https://www.zeit.de/news/2025-02/26/hoechststrafe-fuer-islamisten-wegen-dreifachmord-in-nizza;Hier finden Sie Informationen zu dem Thema „Terrorprozess“. Lesen Sie jetzt „Höchststrafe für Islamisten wegen Dreifachmord in Nizza“.;Terrorprozess;News, Terrorprozess, Nizza, Paris, Staatsanwaltschaft, Dreifachmord, Höchststrafe, Terrorprozess, Basilika, Islamisten, Muslime;2025-02-26T20:12:38+01:00;2025-02-26T20:12:38+01:00;;dpa;false
9807fe5381a06138a7579ca6812a22d1b2a0495fd8eb3080ff34cb5855401da2;Bequemlichkeit is over;https://www.zeit.de/kultur/2025-02/neue-bundesregierung-chance-westen-donald-trump-europa;Solange Trump regiert, gibt es den vereinten Westen nicht. Das ist schade, das ist sogar gefährlich, aber vor allem ist es Deutschlands große Chance. Also los jetzt.;"Z+ (abopflichtiger Inhalt);
        
    Neue Bundesregierung";Kultur, Neue Bundesregierung, Bundestagswahl, Europa, Donald Trump, Bundesregierung, USA, Bundesrepublik Deutschland;2025-02-26T20:12:11+01:00;2025-02-26T20:12:11+01:00;Timothy Garton Ash;;false
ef202129b898f193a9be30594290546161027aea21e29a77c22dbe87404eb5aa;Frankfurt schaltet wieder Ramadan-Beleuchtung an;https://www.zeit.de/news/2025-02/26/frankfurt-schaltet-wieder-ramadan-beleuchtung-an;Hier finden Sie Informationen zu dem Thema „Religion“. Lesen Sie jetzt „Frankfurt schaltet wieder Ramadan-Beleuchtung an“.;Religion;News, Religion, Nargess Eskandari-Grünberg, Frankfurt, Frankfurt am Main, Köln, Fastenmonat, Ramadan;2025-02-26T20:07:09+01:00;2025-02-26T20:07:09+01:00;;dpa Hessen;false
81d6dd523aaab9040fe4a8504b410e27d4d822c556337670e06f4ff4c91a6ee1;Umsatz im MV-Gastgewerbe bleibt hinter Vorjahreswert zurück;https://www.zeit.de/news/2025-02/26/umsatz-im-mv-gastgewerbe-bleibt-hinter-vorjahreswert-zurueck;Hier finden Sie Informationen zu dem Thema „Gastgewerbe“. Lesen Sie jetzt „Umsatz im MV-Gastgewerbe bleibt hinter Vorjahreswert zurück“.;Gastgewerbe;News, Gastgewerbe, Mecklenburg-Vorpommern, Umsatz, Vorjahreswert, Gastgewerbe;2025-02-26T19:58:24+01:00;2025-02-26T19:58:24+01:00;;dpa Mecklenburg-Vorpommern;false
9e1be4027e488ea9edba0a094ce6c164dfc7e19fdd28830f3eaf99a2db0205b2;Bürgerschaft beendet Cum-Ex-Untersuchung;https://www.zeit.de/news/2025-02/26/buergerschaft-beendet-cum-ex-untersuchung;Hier finden Sie Informationen zu dem Thema „Cum-Ex-Skandal“. Lesen Sie jetzt „Bürgerschaft beendet Cum-Ex-Untersuchung“.;Cum-Ex-Skandal;News, Cum-Ex-Skandal, Olaf Scholz, Peter Tschentscher, Norbert Hackbusch, Christian Olearius, Farid Müller, Hamburg, Schleswig-Holstein, Warburg, HSH Nordbank, SPD;2025-02-26T19:53:14+01:00;2025-02-26T19:53:14+01:00;;dpa Hamburg/Schleswig-Holstein;false
e6b1d076e5639e0873dc1ef413f5ff7717058d5c47da94dc1b506733f500f1bd;Amazon plant Millionen-Investition im Salzlandkreis;https://www.zeit.de/news/2025-02/26/amazon-plant-millionen-investition-im-salzlandkreis;Hier finden Sie Informationen zu dem Thema „Logistik“. Lesen Sie jetzt „Amazon plant Millionen-Investition im Salzlandkreis“.;Logistik;News, Logistik, Könnern, Amazon, Salzlandkreis, Logistikzentrum, Schwindhammer, Logistik;2025-02-26T19:43:12+01:00;2025-02-26T19:43:12+01:00;;dpa Sachsen;false
f7f2bb77ee036447f35242528ed192882ef335fa8a2a5d14d0ae2f0af2cd18aa;"Trump will Zölle auf EU-Importe ""sehr bald"" ankündigen";https://www.zeit.de/wirtschaft/2025-02/handelsstreit-donald-trump-zoelle-eu-produkte;Nach seiner ersten Kabinettssitzung konkretisiert Donald Trump seine Zollpläne ein wenig. Zölle auf mexikanische und kanadische Waren sollen ab Anfang April gelten.;Handelsstreit;Wirtschaft, Handelsstreit, Donald Trump, USA, Zoll, Import, Europäische Union;2025-02-26T19:42:01+01:00;2025-02-26T19:42:01+01:00;iso;ZEIT ONLINE,        							iso;false
ef79724ee0267736477e163bef5f8524eb11ee4a953421eb1f8050e5d61f292a;Trump: Ukraine kann Nato-Beitritt vergessen;https://www.zeit.de/news/2025-02/26/medien-usa-und-ukraine-vereinbaren-details-zu-rohstoff-deal;Hier finden Sie Informationen zu dem Thema „Russischer Angriffskrieg“. Lesen Sie jetzt „Trump: Ukraine kann Nato-Beitritt vergessen“.;Russischer Angriffskrieg;News, Russischer Angriffskrieg, Donald Trump, Olaf Scholz, Wolodymyr Selenskyj, Emmanuel Macron, USA, Russland, Washington, Kyjiw, Financial Times, EU;2025-02-26T19:34:07+01:00;2025-02-26T19:34:07+01:00;;dpa;false
9cda1073a98ffd5cf5afb62b8de072f68feb375edfb16354fd7a6ff272e60d98;Welternährungsprogramm setzt Hilfen für Camp in Nord-Darfur aus;https://www.zeit.de/gesellschaft/zeitgeschehen/2025-02/krieg-im-sudan-welternaehrungsprogramm-aussetzen-hilfen-drohende-hungersnot;Wegen anhaltender Kämpfe muss das Welternährungsprogramm seine Hilfen im Vertriebenenlager Samsam im Sudan aussetzen. Dort drohen Zehntausende Menschen zu verhungern.;Krieg im Sudan;Gesellschaft, Krieg im Sudan, Sudan, Darfur, World Food Programme, Hungersnot;2025-02-26T19:24:23+01:00;2025-02-26T19:24:23+01:00;mmh;ZEIT ONLINE,        AP,        Reuters,        							mmh;false
e5398003fc7ec9be925081051239658a41090ae9ce191def17745693ee036ec5;Frankreich droht Algerien mit Aufkündigung von Sonderstatus;https://www.zeit.de/news/2025-02/26/frankreich-droht-algerien-mit-aufkuendigung-von-sonderstatus;Hier finden Sie Informationen zu dem Thema „Nach Terrortat“. Lesen Sie jetzt „Frankreich droht Algerien mit Aufkündigung von Sonderstatus“.;Nach Terrortat;News, Nach Terrortat, François Bayrou, Emmanuel Macron, Frankreich, Algerien, Paris, Algier, Aufkündigung, Sonderstatus, Terrortat, Premierminister;2025-02-26T19:20:59+01:00;2025-02-26T19:20:59+01:00;;dpa;false
f2ac6f8f8735d9f7824425c0870ea99228600c9ba568c7b2bc01e676e8a46caa;Ein Denkmal für die eigene Eitelkeit;https://www.zeit.de/kultur/2025-02/ki-video-gaza-donald-trump-plaene-soziale-medien;Donald Trump verwandelt den Gazastreifen per KI in eine obszöne Stockfoto-Utopie. Das Video liegt irgendwo zwischen Propaganda, Shitpost und kolonialer Fantasie.;"Z+ (abopflichtiger Inhalt);
        
    ""Trump Gaza""";"Kultur, ""Trump Gaza"", Donald Trump, Gazastreifen, Benjamin Netanjahu, künstliche Intelligenz, Israel, USA";2025-02-26T19:13:49+01:00;2025-02-26T19:13:49+01:00;Titus Blome;;false
88700d028ed5df80484c08f12fcf48dc61f1641d472c4fbe119af3d798652bac;Ducksch fehlt Werder wegen Oberschenkelblessur;https://www.zeit.de/news/2025-02/26/ducksch-fehlt-werder-wegen-oberschenkelblessur;Hier finden Sie Informationen zu dem Thema „Fußball-Bundesliga“. Lesen Sie jetzt „Ducksch fehlt Werder wegen Oberschenkelblessur“.;Fußball-Bundesliga;News, Fußball-Bundesliga, Marvin Ducksch, Fußball-Bundesliga, SV Werder Bremen, Oberschenkelblessur, Muskelverletzung, Oberschenkel;2025-02-26T19:12:47+01:00;2025-02-26T19:12:47+01:00;;dpa Niedersachsen;false
86c70e0f0d8653841bef1837da0ac3079d22c52dbcee301ad205aa2cf2c79d65;Keine Opposition ist Mist;https://www.zeit.de/kultur/2025-02/robert-habeck-bundestag-opposition-bundesregierung-franz-muentefering;Robert Habeck fliegt aus der Regierung und möchte keine führende Rolle im neuen Bundestag. Das passt leider gut zur Geringschätzung von Oppositionsarbeit in Deutschland.;Robert Habeck;Kultur, Robert Habeck, Robert Habeck, Opposition, Deutscher Bundestag, Franz Müntefering, Bundestagswahl, Bündnis 90/Die Grünen;2025-02-26T19:05:54+01:00;2025-02-26T19:05:54+01:00;Christiane Grefe;;false
61d6971a5e20e5056d4f383297453028a559e7ec8e18ee50e36aafa5e16b1b98;Weil lässt erneute Kandidatur für SPD-Landesvorsitz offen;https://www.zeit.de/news/2025-02/26/weil-laesst-erneute-kandidatur-fuer-spd-landesvorsitz-offen;Hier finden Sie Informationen zu dem Thema „Niedersachsen“. Lesen Sie jetzt „Weil lässt erneute Kandidatur für SPD-Landesvorsitz offen“.;Niedersachsen;News, Niedersachsen, Stephan Weil, Niedersachsen, SPD, Kandidatur;2025-02-26T19:05:32+01:00;2025-02-26T19:05:32+01:00;;dpa Niedersachsen;false
e8e1b318bce4bf0f584b7b89a6502c601873332a0b43e11c02a5555859920d90;Polnische Retter befreien Buckelwal aus Fischernetz;https://www.zeit.de/news/2025-02/26/polnische-retter-befreien-buckelwal-aus-fischernetz;Hier finden Sie Informationen zu dem Thema „Ostseeküste“. Lesen Sie jetzt „Polnische Retter befreien Buckelwal aus Fischernetz“.;Ostseeküste;News, Ostseeküste, Ostsee, Buckelwal, Ostseeküste, Fischereistützpunkt, Umweltschützer;2025-02-26T19:05:02+01:00;2025-02-26T19:05:02+01:00;;dpa;false
d06e7f6a90a148111fe72159560791d5adab13f7006104506cc33f9fba7926fc;Verdächtige nach Überfällen mit Machete ermittelt;https://www.zeit.de/news/2025-02/26/verdaechtige-nach-ueberfaellen-mit-machete-ermittelt;Hier finden Sie Informationen zu dem Thema „Kriminalität“. Lesen Sie jetzt „Verdächtige nach Überfällen mit Machete ermittelt“.;Kriminalität;News, Kriminalität, Mann, Polizei, Überfall, Machete, Kriminalität;2025-02-26T19:02:14+01:00;2025-02-26T19:02:14+01:00;;dpa Hamburg/Schleswig-Holstein;false
331d5223d5423476970c391a204f01fb46d2e79f9ea60d6342c881aff5e36415;Polizei bringt große Mengen Drogen zur Müllverbrennung;https://www.zeit.de/news/2025-02/26/polizei-bringt-grosse-mengen-drogen-zur-muellverbrennung;Hier finden Sie Informationen zu dem Thema „Kampf gegen Drogen“. Lesen Sie jetzt „Polizei bringt große Mengen Drogen zur Müllverbrennung“.;Kampf gegen Drogen;News, Kampf gegen Drogen, Polizei, Kokain, Müllverbrennung, Müllverbrennungsanlage, Drogen;2025-02-26T18:51:40+01:00;2025-02-26T18:51:40+01:00;;dpa Hamburg/Schleswig-Holstein;false
aeef1df59c67ce91198123654e100dcb9583e541ab7c48d1ba99942d456d07a0;Morddrohungen gegen Schauspielerin Uschi Glas;https://www.zeit.de/news/2025-02/26/morddrohungen-gegen-schauspielerin-uschi-glas;Hier finden Sie Informationen zu dem Thema „Engagement gegen Judenhass“. Lesen Sie jetzt „Morddrohungen gegen Schauspielerin Uschi Glas“.;Engagement gegen Judenhass;News, Engagement gegen Judenhass, Uschi Glas, Morddrohung, Antisemitismus;2025-02-26T18:49:19+01:00;2025-02-26T18:49:19+01:00;;dpa Bayern;false
b885c4f58d3fc6a0398f9641f63d4e64b5b4f464c322a93554e943b82b771b95;Vatikan: Franziskus geht es etwas besser;https://www.zeit.de/news/2025-02/26/vatikan-franziskus-verbrachte-ruhige-nacht;Hier finden Sie Informationen zu dem Thema „Kranker Papst“. Lesen Sie jetzt „Vatikan: Franziskus geht es etwas besser“.;Kranker Papst;News, Kranker Papst, Papst Franziskus, Katholische Kirche, Lungenentzündung, Vatikan;2025-02-26T18:48:43+01:00;2025-02-26T18:48:43+01:00;;dpa;false
0ce8b236f6c324b4d6d9bb0d1c5609612c63f0843f7f172d79c36f63ef6cf92b;Ministerin will keine Abstriche an der Gesundheitsversorgung;https://www.zeit.de/news/2025-02/26/ministerin-will-keine-abstriche-an-der-gesundheitsversorgung;Hier finden Sie Informationen zu dem Thema „Krankenhausreform“. Lesen Sie jetzt „Ministerin will keine Abstriche an der Gesundheitsversorgung“.;Krankenhausreform;News, Krankenhausreform, Britta Müller, Brandenburg, Hennigsdorf, Bündnis Sahra Wagenknecht, SPD, Abstrich, Gesundheitsversorgung, Krankenhausreform;2025-02-26T18:30:12+01:00;2025-02-26T18:30:12+01:00;;dpa Berlin/Brandenburg;false
e108b2f2ef55fde75a7a3b724bbf7f6dc6d3ee942ca36bdeaf545a6d4d32ed0d;"""Schmeiß etwas Schlamm auf den Teppich""";https://www.zeit.de/kultur/film/2025-02/like-a-complete-unknown-bob-dylan-timothee-chalamet-musikfilm;"Kann man Bob Dylan spielen? In dem Film ""Like A Complete Unknown"" unternimmt Timothée Chalamet einen maximal tollen Versuch.";"Z+ (abopflichtiger Inhalt);
        
    ""Like A Complete Unknown""";"Kultur, ""Like A Complete Unknown"", Musik, Spielfilm, Bob Dylan, Woody Guthrie, Kino, Oscarverleihung, Joan Baez, New York";2025-02-26T18:25:21+01:00;2025-02-26T18:25:21+01:00;Jens Balzer;;false
a1d0596d35acc50370288e2cdb1a76789384e16f11c9b604f5833bf1051acaef;Im grünen Bereich;https://www.zeit.de/hamburg/2025-02/hamburger-verkehrspolitik-autos-fahrradfahrer-strassenverkehr-daten;Autofahrer würden in Hamburg von einer grünen Verkehrspolitik systematisch ausgebremst, behauptet die CDU im Wahlkampf. Eine Datenanalyse zeigt: Das stimmt nicht.;"Z+ (abopflichtiger Inhalt);
        
    Hamburger Verkehrspolitik";Hamburg, Hamburger Verkehrspolitik, Hamburg, Straßenverkehr, Autofahrer, Energiewende, CDU, Autobahn;2025-02-26T18:22:04+01:00;2025-02-26T18:22:04+01:00;Frank Drieschner;;false
e9e95d76eef81558f53e1b43c38986ac409c206c0fe6e6189b955cf1e7947e57;Der Markt hat geregelt;https://www.zeit.de/2025/09/christian-lindner-fdp-wahlverlust-liberalismus-ruecktritt;Da sind keine Tränen, keine Bestürzung: Die FDP fliegt aus dem Bundestag. Und muss jetzt hoffen auf einen wie Christian Lindner, der die Partei durch dunkle Jahre führt.;Christian Lindner;Politik, Christian Lindner, Christian Lindner, FDP, Bundestagswahl, Liberalismus, Deutscher Bundestag, Wolfgang Kubicki;2025-02-26T18:18:09+01:00;2025-02-26T18:18:09+01:00;Paul Middelhoff;Aus der        ZEIT Nr. 09/2025;false
4fc7ce8e6396bce92f2d2ce930746f6bab2feb934f73f4ebac93aef2bf84b789;Herausforderer Norris nach Stromausfall in der Wüste top;https://www.zeit.de/news/2025-02/26/18-jahre-alter-antonelli-der-schnellste-hamilton-fuenfter;Hier finden Sie Informationen zu dem Thema „Formel 1“. Lesen Sie jetzt „Herausforderer Norris nach Stromausfall in der Wüste top“.;Formel 1;News, Formel 1, Andrea Kimi Antonelli, Lewis Hamilton, Liam Lawson, Max Verstappen, Mercedes, Bahrain, Formel 1, Red Bull, Auftakttag, Silberpfeil;2025-02-26T18:18:02+01:00;2025-02-26T18:18:02+01:00;;dpa Sport;false
d42e7df208dbf79f30bc3b9d5dbdc72a0a974f77c9a0f5d801fd67f143183e9d;Hamburger Polizei verhaftet mutmaßlichen Räuber;https://www.zeit.de/news/2025-02/26/hamburger-polizei-verhaftet-mutmasslichen-raeuber;Hier finden Sie Informationen zu dem Thema „Kriminalität“. Lesen Sie jetzt „Hamburger Polizei verhaftet mutmaßlichen Räuber“.;Kriminalität;News, Kriminalität, Hamburg-Billstedt, Billstedt, Polizei, Überfall, Kriminalität, Auto;2025-02-26T18:17:34+01:00;2025-02-26T18:17:34+01:00;;dpa Hamburg/Schleswig-Holstein;false
595af3f39c6c870817da215e16666ff5cff2525c48c073404e9fbfd377a4313d;Katholische Bischöfe tagen in Passau;https://www.zeit.de/news/2025-02/25/bayerns-katholische-bischoefe-tagen-in-passau;Hier finden Sie Informationen zu dem Thema „Kirche“. Lesen Sie jetzt „Katholische Bischöfe tagen in Passau“.;Kirche;News, Kirche, Bayern, Passau, Frühjahrsvollversammlung;2025-02-26T18:13:32+01:00;2025-02-26T18:13:32+01:00;;dpa Bayern;false
03a4718f8389fd519e1aed5451ab2ce363ffa192b21e121717d3d71c0927a696;Messer-Banner: Minister schreibt Wutbrief an 1. FC Köln;https://www.zeit.de/news/2025-02/26/messer-banner-minister-schreibt-wutbrief-an-1-fc-koeln;Hier finden Sie Informationen zu dem Thema „2. Fußball-Bundesliga“. Lesen Sie jetzt „Messer-Banner: Minister schreibt Wutbrief an 1. FC Köln“.;2. Fußball-Bundesliga;News, 2. Fußball-Bundesliga, Herbert Reul, Christian Keller, Nordrhein-Westfalen, 1. FC Köln, Fußball-Bundesliga, CDU, Deutsche Presse-Agentur, Wutbrief;2025-02-26T18:11:34+01:00;2025-02-26T18:11:34+01:00;;dpa Nordrhein-Westfalen;false
