Hash;Title;Link;Description;Category;KeyWords;Published;LastUpdated;Author;Source;Paywall
1053245e5a9677dd937df3c0ae7829cacbd80133718945b6142049c2a86d8d23;Berlin führt neuartiges Masterstudium im Lehramt ein;https://www.zeit.de/news/2025-06/16/berlin-fuehrt-neuartiges-masterstudium-im-lehramt-ein;Hier finden Sie Informationen zu dem Thema „Lehrkräftemangel“. Lesen Sie jetzt „Berlin führt neuartiges Masterstudium im Lehramt ein“.;Lehrkräftemangel;News, Lehrkräftemangel, Berlin, Masterstudium, Lehrkräftemangel, Lehramt;2025-06-16T12:23:48+02:00;2025-06-16T12:23:48+02:00;;dpa Berlin/Brandenburg;false
cf8fc1e8cad1e2ab93a1dfa7c618e4033ddc5cedd87bae11cbac096017c7df3e;Wird Donald Trump in diesen Krieg hineingezogen?;https://www.zeit.de/politik/ausland/2025-06/krieg-nahost-donald-trump-israel-iran-usa;Der US-Präsident will sein Land aus Israels Angriff auf den Iran heraushalten. Auch, weil er seine Basis nicht verärgern will. Aber vielleicht wird er gezwungen.;"Z+ (abopflichtiger Inhalt);
        
    Krieg in Nahost";Politik, Krieg in Nahost, Nahost, Donald Trump, Benjamin Netanjahu, Israel, Iran, USA;2025-06-16T12:23:41+02:00;2025-06-16T12:23:41+02:00;Carsten Luther;;false
27e646ef49478d4e341c0fceed06e3162b4de367e4bb0d5f8e867a62b3fed706;Knapp 40.000 Besucher bei Aktionstagen im Hamburger Bahnhof;https://www.zeit.de/news/2025-06/16/knapp-40-000-besucher-bei-aktionstagen-im-hamburger-bahnhof;Hier finden Sie Informationen zu dem Thema „Tage der offenen Tür“. Lesen Sie jetzt „Knapp 40.000 Besucher bei Aktionstagen im Hamburger Bahnhof“.;Tage der offenen Tür;News, Tage der offenen Tür, Aktionstag, Bahnhof;2025-06-16T12:20:34+02:00;2025-06-16T12:20:34+02:00;;dpa Berlin/Brandenburg;false
4f7dadc9961b114aabe6adb6bd4e35ac517d424a33eaaa085a918709eba14ef4;Hasspost gegen Bundespräsidenten: Zu Geldstrafe verurteilt;https://www.zeit.de/news/2025-06/16/hasspost-gegen-bundespraesidenten-zu-geldstrafe-verurteilt;Hier finden Sie Informationen zu dem Thema „Gericht“. Lesen Sie jetzt „Hasspost gegen Bundespräsidenten: Zu Geldstrafe verurteilt“.;Gericht;News, Gericht, Orlamünde, Hasspost, Geldstrafe, Bundespräsident, Verunglimpfung;2025-06-16T12:16:50+02:00;2025-06-16T12:16:50+02:00;;dpa Thüringen;false
658c57462614cf85f25d8b3a3d710d2e5242a08bc9d06c7e670ed43422e428ea;Mehr Freiheit beim Familiennamen - mehr Arbeit für das Amt;https://www.zeit.de/news/2025-06/16/mehr-freiheit-beim-familiennamen-mehr-arbeit-fuer-das-amt;Hier finden Sie Informationen zu dem Thema „Gesellschaft“. Lesen Sie jetzt „Mehr Freiheit beim Familiennamen - mehr Arbeit für das Amt“.;Gesellschaft;News, Gesellschaft, Andrea Hart, Darmstadt, Kassel, Standesamt, Namensrecht, Nachname, Freiheit;2025-06-16T12:16:31+02:00;2025-06-16T12:16:31+02:00;;dpa Hessen;false
7e450df822a24a3b28b0aef6d008054f17bf040ac65bdaa9886e6f14175e4879;Medien: VfL Osnabrück vor Einigung mit Trainer Schultz;https://www.zeit.de/news/2025-06/16/medien-vfl-osnabrueck-vor-einigung-mit-trainer-schultz;Hier finden Sie Informationen zu dem Thema „3. Fußball-Liga“. Lesen Sie jetzt „Medien: VfL Osnabrück vor Einigung mit Trainer Schultz“.;3. Fußball-Liga;News, 3. Fußball-Liga, Timo Schultz, Marco Antwerpen, Osnabrück, VfL Osnabrück, Bundesliga;2025-06-16T12:14:12+02:00;2025-06-16T12:14:12+02:00;;dpa Hamburg/Schleswig-Holstein;false
bffd3cff23cbcb796e93e54af33298ab0845fe41b8874facf3c28e06e18a7759;Grundwasser in Brandenburg und Berlin wird knapper;https://www.zeit.de/news/2025-06/16/grundwasser-wird-in-vielen-regionen-brandenburgs-knapper;Hier finden Sie Informationen zu dem Thema „Umweltorganisation“. Lesen Sie jetzt „Grundwasser in Brandenburg und Berlin wird knapper“.;Umweltorganisation;News, Umweltorganisation, Brandenburg, Bund für Umwelt und Naturschutz, BUND, Grundwasser, Umweltorganisation, Grundwasserstress;2025-06-16T12:10:00+02:00;2025-06-16T12:10:00+02:00;;dpa Berlin/Brandenburg;false
b61a77af77ee0ffc4afe4d80906ad8278ba4ccbdece8b3134fb0d1401def7e83;Mann gewinnt über eine Million Euro bei Lottospiel;https://www.zeit.de/news/2025-06/16/mann-gewinnt-ueber-eine-million-euro-bei-lottospiel;Hier finden Sie Informationen zu dem Thema „Glücksspiel“. Lesen Sie jetzt „Mann gewinnt über eine Million Euro bei Lottospiel“.;Glücksspiel;News, Glücksspiel, Landkreis Biberach, Lotto Baden-Württemberg, Lottospiel, Glücksspiel, Lottogewinn;2025-06-16T12:08:10+02:00;2025-06-16T12:08:10+02:00;;dpa Baden-Württemberg;false
4f557d8a1b35336fa1d3d3656bc31ca1fdcd59924c733c5cb1ab32807bfc4464;Lufthansa-Maschine muss wegen Bombendrohung zurückkehren;https://www.zeit.de/mobilitaet/2025-06/bundespolizei-lufthansa-flugzeug-bombendrohung-indien-abbruch;Auf dem Weg von Frankfurt nach Indien hat ein Lufthansa-Flugzeug seine Reise abgebrochen. Grund war nach Angaben der Bundespolizei eine Bombendrohung.;Bundespolizei;Mobilitaet, Bundespolizei, Bundespolizei, Frankfurt am Main, Indien, Deutsche Lufthansa, Flugzeug, Flugsicherheit;2025-06-16T12:05:11+02:00;2025-06-16T12:05:11+02:00;mmh;ZEIT ONLINE,        dpa,        AFP,        							mmh;false
912ba1324c78206eca77b2e588d1f2fd4c3c86feb5306f7a4f944b9d2e222900;Campingplätze erfreuen sich großer Beliebtheit;https://www.zeit.de/news/2025-06/16/campingplaetze-erfreuen-sich-grosser-beliebtheit;Hier finden Sie Informationen zu dem Thema „Alternative zum Hotel“. Lesen Sie jetzt „Campingplätze erfreuen sich großer Beliebtheit“.;Alternative zum Hotel;News, Alternative zum Hotel, NRW, Düsseldorf, Campingplatz, Beliebtheit, Landesstatistikamt;2025-06-16T12:02:46+02:00;2025-06-16T12:02:46+02:00;;dpa Nordrhein-Westfalen;false
cf93b5e31ad21cb9a55fe5cb9f734e50bed5e78dc7392e0eb4f2e350779b1d88;Abriss der maroden Ringbrücke in Magdeburg hat begonnen;https://www.zeit.de/news/2025-06/16/abriss-der-maroden-ringbruecke-in-magdeburg-hat-begonnen;Hier finden Sie Informationen zu dem Thema „Brückenschäden“. Lesen Sie jetzt „Abriss der maroden Ringbrücke in Magdeburg hat begonnen“.;Brückenschäden;News, Brückenschäden, Magdeburg, Ringbrücke, Brückenschaden, Abriss, Abrissarbeit;2025-06-16T12:01:11+02:00;2025-06-16T12:01:11+02:00;;dpa Sachsen;false
c28e96db61b67464fe564bfaf7aef0281e68f67184b6db40bbde8cfed92e816a;Einbrecher stehlen Fahrräder im Wert von rund 300.000 Euro;https://www.zeit.de/news/2025-06/16/einbrecher-stehlen-fahrraeder-im-wert-von-rund-300-000-euro;Hier finden Sie Informationen zu dem Thema „Polizei sucht Zeugen“. Lesen Sie jetzt „Einbrecher stehlen Fahrräder im Wert von rund 300.000 Euro“.;Polizei sucht Zeugen;News, Polizei sucht Zeugen, Velpke, Landkreis Helmstedt, Polizei, Fahrradgeschäft, Fahrrad;2025-06-16T11:58:51+02:00;2025-06-16T11:58:51+02:00;;dpa Niedersachsen;false
20a48a6f02f51a28d9c96462ca3925671fb73052d27aaa4a1e29a817d418d72d;"""Yvonne"" beschert bestes Ferienwetter - erst Sonntag Regen";https://www.zeit.de/news/2025-06/16/yvonne-beschwert-bestes-ferienwetter-erst-sonntag-regen;"Hier finden Sie Informationen zu dem Thema „Wetterbericht“. Lesen Sie jetzt „""Yvonne"" beschert bestes Ferienwetter - erst Sonntag Regen“.";Wetterbericht;News, Wetterbericht, Kai-Uwe Nerding, Baden-Württemberg, Wetterbericht, Sonnencreme, Wetter;2025-06-16T11:58:18+02:00;2025-06-16T11:58:18+02:00;;dpa Baden-Württemberg;false
79eccd4892f82789695cf00ba9e390445bd8928198428944ffc4017606e9f2cf;"""Schreibe wie ein 15-Jähriger!""";https://www.zeit.de/2025/25/pruefungen-schulen-jugendliche-abgaben-kuenstliche-intelligenz;Lehrer benutzen KI-Detektoren, um Schüler zu entlarven – und Schüler beauftragen KI, um Täuschungen einzubauen. Wie soll Schule da noch funktionieren? Ein Frontbesuch.;"Z+ (abopflichtiger Inhalt);
        
    Prüfungen an Schulen";Familie, Prüfungen an Schulen, Schule, künstliche Intelligenz, Lehrer, Schüler, Jugendliche, ChatGPT;2025-06-16T11:56:58+02:00;2025-06-16T11:56:58+02:00;Ulf Schönert;Aus der        ZEIT Nr. 25/2025;false
5e460be12c760f8e50661dcf70360380659bfd5919815cdfaf16a7d51540825c;Masse statt Klasse? Was KI für die Musikbranche bedeutet;https://www.zeit.de/news/2025-06/13/masse-statt-klasse-was-ki-fuer-die-musikbranche-bedeutet;Hier finden Sie Informationen zu dem Thema „Schwierige Lage für Musiker“. Lesen Sie jetzt „Masse statt Klasse? Was KI für die Musikbranche bedeutet“.;Schwierige Lage für Musiker;News, Schwierige Lage für Musiker, Christopher Annen, Matthias Hornschuh, Helene Fischer, Sängerin, Großbritannien, Deezer, Musikbranche, Songtext, Computer, Streaming;2025-06-16T11:56:11+02:00;2025-06-16T11:56:11+02:00;;dpa;false
10fde6946889c668ca81c28c5bdcf32ace9a73ccecfead55c0c09106e9ee7455;Österreichische Regierung kündigt strengeres Waffengesetz an;https://www.zeit.de/politik/ausland/2025-06/verschaerfung-waffengesetz-oesterreich-nach-amoklauf;Die österreichische Bundesregierung plant ein Maßnahmenpaket, das den Waffenbesitz künftig strenger regeln soll. Schon am Mittwoch will sie die Neuregelung beschließen.;Amoklauf in Graz;Politik, Amoklauf in Graz, Österreich, Graz, Waffenbesitz, Tötungsdelikt, Schule, Polizei;2025-06-16T11:53:01+02:00;2025-06-16T11:53:01+02:00;jse;ZEIT ONLINE,        Reuters,        							jse;false
61880abbabd6ebd889a36580295e97e759dbb53276006248111cb85bfbc1a417;Ein paar Krabben sind auch in die Suppe gekrabbelt;https://www.zeit.de/zeit-magazin/wochenmarkt/2025-06/tomatensuppe-krabbenfleisch-paprika-rezept-wochenmarkt;Schon als Kind hat unsere Autorin in der Bretagne Krabben direkt beim Fischer gekauft. Sie kommen zusammen mit Paprika in eine äußerst aromatische Tomatensuppe. ;"Z+ (abopflichtiger Inhalt);
        
    Tomatensuppe mit Krabbenfleisch";Suppen;2025-06-16T11:47:51+02:00;2025-06-16T11:47:51+02:00;Sarah Golbaz;;false
eb451371db7906eb85d29543dfe154723b8265580dc174b1de18627041710d52;Erneut Entschärfung einer Fliegerbombe in Kiel;https://www.zeit.de/news/2025-06/16/erneut-entschaerfung-einer-fliegerbombe-in-kiel;Hier finden Sie Informationen zu dem Thema „Kriegsfolgen“. Lesen Sie jetzt „Erneut Entschärfung einer Fliegerbombe in Kiel“.;Kriegsfolgen;News, Kriegsfolgen, Kiel, Fliegerbombe, Entschärfung, Kriegsfolge, Weltkriegsbombe, Wohnanschrift;2025-06-16T11:45:41+02:00;2025-06-16T11:45:41+02:00;;dpa Hamburg/Schleswig-Holstein;false
d475374f98c059f01d7dc9cb5e89bfb7c2aaddb15af765390aa31c4d7ba6a21b;Kretschmer regt Bürokratie-Moratorium an;https://www.zeit.de/news/2025-06/16/kretschmer-regt-buerokratie-moratorium-an;Hier finden Sie Informationen zu dem Thema „Entbürokratisierung“. Lesen Sie jetzt „Kretschmer regt Bürokratie-Moratorium an“.;Entbürokratisierung;News, Entbürokratisierung, Michael Kretschmer, Sachsen, Dresden, CDU, Deutsche Presse-Agentur, Infineon Technologies, Entbürokratisierung, Bürokratieabbau, Handlungsbedarf;2025-06-16T11:43:54+02:00;2025-06-16T11:43:54+02:00;;dpa Sachsen;false
271241faee72b506c4538a41e7bf9f8fd1a5f123741d72db399921b36feadb28;Erneut Einbrüche in Schulen im Raum Nürnberg;https://www.zeit.de/news/2025-06/16/erneut-einbrueche-in-schulen-im-raum-nuernberg;Hier finden Sie Informationen zu dem Thema „Kriminalität“. Lesen Sie jetzt „Erneut Einbrüche in Schulen im Raum Nürnberg“.;Kriminalität;News, Kriminalität, Nürnberg, Erlangen-Höchstadt, Höchstadt, Franken, Mittelfranken, Polizei, Einbruch, Kriminalität, Bargeld;2025-06-16T11:39:55+02:00;2025-06-16T11:39:55+02:00;;dpa Bayern;false
e9ca6171eb43b2c05005c1e6a8032cb544e0262b8794d3dcd5fba7d15888662e;Für Urlaub wird am häufigsten gespart;https://www.zeit.de/news/2025-06/16/fuer-urlaub-wird-am-haeufigsten-gespart;Hier finden Sie Informationen zu dem Thema „Umfrage zum Konsumverhalten“. Lesen Sie jetzt „Für Urlaub wird am häufigsten gespart“.;Umfrage zum Konsumverhalten;News, Umfrage zum Konsumverhalten, idealo.de, Deutsche Presse-Agentur, Konsumverhalten, Umfrage, Altersvorsorge, Geld, Gastronomie;2025-06-16T11:39:32+02:00;2025-06-16T11:39:32+02:00;;dpa;false
4f3fa9efa9cb076eb365404e1cc95e156746631f54e5491e0097946225eebed2;Höchststrafe für syrischen Arzt wegen Verbrechen gegen Menschlichkeit;https://www.zeit.de/gesellschaft/zeitgeschehen/2025-06/syrien-arzt-urteil-verbrechen-gegen-menschichkeit;Ein Arzt hatte 2011 und 2012 in einem Krankenhaus und in einem Gefängnis in Syrien Menschen misshandelt. Ein deutsches Gericht verhängte nun eine lebenslange Haftstrafe.;Oberlandesgericht Frankfurt am Main;Gesellschaft, Oberlandesgericht Frankfurt am Main, Gericht, Misshandlung, Arzt, Syrien, Gefängnis, Frankfurt am Main;2025-06-16T11:34:27+02:00;2025-06-16T11:34:27+02:00;voi;ZEIT ONLINE,        AFP,        dpa,        							voi;false
88ce330103d25fa3402bbdbdecc3482412e6e730a24af5b32979835565fa1263;UNRWA-Chef erinnert an das Leiden in Gaza;https://www.zeit.de/news/2025-06/16/un-regierungen-muessen-wegen-gaza-aufwachen-und-etwas-tun;Hier finden Sie Informationen zu dem Thema „Gaza-Krieg“. Lesen Sie jetzt „UNRWA-Chef erinnert an das Leiden in Gaza“.;Gaza-Krieg;News, Gaza-Krieg, Volker Türk, Israel Türk, Nahost, Genf, USA, Gazastreifen, UN, Hamas, Menschenrechte;2025-06-16T11:29:41+02:00;2025-06-16T11:29:41+02:00;;dpa;false
456eb46246c25fa37aad8eead809fbf35dbf0797aa8eb638dd27d971bae019bb;Seniorin im Schlaf überfallen;https://www.zeit.de/news/2025-06/16/seniorin-im-schlaf-ueberfallen;Hier finden Sie Informationen zu dem Thema „Kriminalität“. Lesen Sie jetzt „Seniorin im Schlaf überfallen“.;Kriminalität;News, Kriminalität, Mudersbach, Landkreis Altenkirchen, Polizei, Kriminalität;2025-06-16T11:29:20+02:00;2025-06-16T11:29:20+02:00;;dpa Rheinland-Pfalz/Saarland;false
28a210d49ac63fe12206534280feec3703a39e69051ce0bc9a2fb028695f9131;Türsteher der amerikanischen Klassengesellschaft;https://www.zeit.de/wirtschaft/2025-06/harvard-university-eliteuniversitaet-finanzierung-donald-trump-kritik;Die Empörung ist groß darüber, dass US-Präsident Trump die altehrwürdige Harvard-Universität angreift. Wie sehr sie aber die Ungleichheit befördert, wird ausgeblendet.;"Z+ (abopflichtiger Inhalt);
        
    Harvard University";Wirtschaft, Harvard University, Harvard University, Hochschule, Soziale Ungleichheit, Bildung, Soziologie, Donald Trump, USA, Oberster Gerichtshof;2025-06-16T11:24:58+02:00;2025-06-16T11:24:58+02:00;Heike Buchter;;false
b7ec0d54435d7aa52878a64e2798d641a602b65620c97c8d39750c326d3b5db3;KSC holt neuen Direktor Profifußball;https://www.zeit.de/news/2025-06/16/ksc-holt-neuen-direktor-profifussball;Hier finden Sie Informationen zu dem Thema „2. Fußball-Bundesliga“. Lesen Sie jetzt „KSC holt neuen Direktor Profifußball“.;2. Fußball-Bundesliga;News, 2. Fußball-Bundesliga, Timon Pauls, Mario Eggimann, Karlsruher SC, Hertha BSC Berlin, Fußball-Bundesliga, Profifußball;2025-06-16T11:24:25+02:00;2025-06-16T11:24:25+02:00;;dpa Baden-Württemberg;false
fd0b12eca26eff6fa2d856cf359514b8824ddc24edfdfb0b719170ab91acc551;Rolle von Günther bei Northvolt-Förderung im Visier;https://www.zeit.de/news/2025-06/16/rolle-von-guenther-bei-northvolt-foerderung-im-visier;Hier finden Sie Informationen zu dem Thema „Insolventer Batteriehersteller“. Lesen Sie jetzt „Rolle von Günther bei Northvolt-Förderung im Visier“.;Insolventer Batteriehersteller;News, Insolventer Batteriehersteller, Daniel Günther, Northvolt, SPD, CDU, Förderprozess, Aufarbeitung;2025-06-16T11:12:50+02:00;2025-06-16T11:12:50+02:00;;dpa Hamburg/Schleswig-Holstein;false
5e20c1bb348f8979d11ffb54c105b318a4a10a342b0077ddeb8bf42f404d9895;Bayern-Fußballerinnen holen Torhüterin aus der Schweiz;https://www.zeit.de/news/2025-06/16/bayern-fussballerinnen-holen-torhueterin-aus-der-schweiz;Hier finden Sie Informationen zu dem Thema „Bundesliga“. Lesen Sie jetzt „Bayern-Fußballerinnen holen Torhüterin aus der Schweiz“.;Bundesliga;News, Bundesliga, Anna Klink, Schweiz, FC Bayern München, Bundesliga;2025-06-16T11:09:59+02:00;2025-06-16T11:09:59+02:00;;dpa Bayern;false
16787ae0256badba84af8d67d5aa25349a15eccf7006cc79a5066a6c2b595e6a;Giffey schließt Spitzenkandidatur nicht aus;https://www.zeit.de/news/2025-06/16/giffey-schliesst-spitzenkandidatur-nicht-aus;Hier finden Sie Informationen zu dem Thema „Berliner SPD“. Lesen Sie jetzt „Giffey schließt Spitzenkandidatur nicht aus“.;Berliner SPD;News, Berliner SPD, Raed Saleh, Franziska Giffey, Berlin, Tagesspiegel, SPD, Spitzenkandidatur, Abgeordnetenhaus;2025-06-16T11:07:33+02:00;2025-06-16T11:07:33+02:00;;dpa Berlin/Brandenburg;false
05ce9d432ab3e00251906a996ef91014dab9edfa4288a6a577eb4b35aa704b2b;Jüdisches Museum besucht Schulen in Brandenburg;https://www.zeit.de/news/2025-06/16/juedisches-museum-besucht-schulen-in-brandenburg;Hier finden Sie Informationen zu dem Thema „Judentum“. Lesen Sie jetzt „Jüdisches Museum besucht Schulen in Brandenburg“.;Judentum;News, Judentum, Hetty Berg, Brandenburg, Brandenburg an der Havel, Fürstenwalde, Eichwalde, Berlin, Jüdisches Museum Berlin, Judentum, Deutschlandtour, Tourbus;2025-06-16T11:02:02+02:00;2025-06-16T11:02:02+02:00;;dpa Berlin/Brandenburg;false
30df49ae6d9646cde8dc20af0f156c0308b02046a3a162ff45d86ebb1ef078de;Mehr Gehen, weniger Schmerzen im Rücken;https://www.zeit.de/news/2025-06/16/mehr-gehen-weniger-schmerzen-im-ruecken;Hier finden Sie Informationen zu dem Thema „Prävention durch Bewegung“. Lesen Sie jetzt „Mehr Gehen, weniger Schmerzen im Rücken“.;Prävention durch Bewegung;News, Prävention durch Bewegung, Schmerz, Prävention, Rückenschmerz, Langzeitstudie;2025-06-16T10:55:56+02:00;2025-06-16T10:55:56+02:00;;dpa;false
607ea0607fc51dee29e7765aec13067ed32edf1dfe415407a44adcc6d1639c47;Fünf Fehler, die Eltern beim Taschengeld vermeiden sollten;https://www.zeit.de/2025/25/taschengeld-eltern-kinder-geld-konsum-fehler;Wer als Kind lernt, mit Geld umzugehen, häuft später seltener Schulden an. Doch wie viel Taschengeld ist genug – und darf man es zur Strafe streichen?;"Z+ (abopflichtiger Inhalt);
        
    Taschengeld";Arbeit, Taschengeld, Geld sparen, Kinder, Eltern, Konsum, Schulden, PayPal;2025-06-16T10:54:37+02:00;2025-06-16T10:54:37+02:00;Hannah Scherkamp;Aus der        ZEIT Nr. 25/2025;false
5cefd8836b0818d0fa17391973ae0aaf8a7e6fff8f837e0e023a8f4147a2ed57;Lufthansa-Flieger muss wegen Bombendrohung umkehren;https://www.zeit.de/news/2025-06/16/lufthansa-flieger-muss-wegen-bombendrohung-umkehren;Hier finden Sie Informationen zu dem Thema „Indien-Flug“. Lesen Sie jetzt „Lufthansa-Flieger muss wegen Bombendrohung umkehren“.;Indien-Flug;News, Indien-Flug, Frankfurt am Main, Indien, Frankfurt, Deutsche Lufthansa, Bundespolizei, Deutsche Presse-Agentur, Bombendrohung;2025-06-16T10:47:29+02:00;2025-06-16T10:47:29+02:00;;dpa Hessen;false
d8a4dde9d2192ccaeee3636072326bf72c3f114a48676008e52f4173561381e3;Kommunen setzen Rechte von Behinderten nicht ausreichend um;https://www.zeit.de/politik/deutschland/2025-06/kommunen-setzen-behindertenrechte-nicht-ausreichend-um;Nur wenige Kommunen kümmern sich hinreichend um Behindertenrechte wie Barrierefreiheit. Das zeigt eine Studie der Universität Siegen und des Instituts für Menschenrechte.;Inklusion;Politik, Inklusion, Inklusion, Menschen mit Behinderung, Barrierefreiheit, Studie, Vereinte Nationen, Gleichberechtigung;2025-06-16T10:46:33+02:00;2025-06-16T10:46:33+02:00;jse;ZEIT ONLINE,        KNA,        							jse;false
56f15a353ea9816d4600ac5f4e57b4dd9d6ffb331f20a5a68832b282e5eae7a3;Junge tot in Kanal gefunden - Unglücksfall vermutet;https://www.zeit.de/news/2025-06/16/junge-tot-in-kanal-gefunden-ungluecksfall-vermutet;Hier finden Sie Informationen zu dem Thema „Notfälle“. Lesen Sie jetzt „Junge tot in Kanal gefunden - Unglücksfall vermutet“.;Notfälle;News, Notfälle, Nürnberg, Rhein-Main-Donau-Kanal, Polizei, Unglücksfall, Notfall;2025-06-16T10:46:08+02:00;2025-06-16T10:46:08+02:00;;dpa Bayern;false
6706b262cddc9c2762c7c72ce4ea3dd206de9b8b839dd069aef1756bacfeca83;Iran richtet Mann wegen angeblicher Spionage für Israel hin;https://www.zeit.de/politik/ausland/2025-06/iran-hinrichtung-spionage-israel-schnellverfahren;"Im Iran ist ein angeblicher Agent des israelischen Geheimdienstes hingerichtet worden. Der Justizchef des Landes droht ""Kollaborateuren"" mit Schnellverfahren.";Israel-Iran-Krieg;Politik, Israel-Iran-Krieg, Iran, Israel, Spionage, Todesstrafe, Gericht, Justiz, Nahostkrieg;2025-06-16T10:45:58+02:00;2025-06-16T10:45:58+02:00;ak;ZEIT ONLINE,        dpa,        AFP,        Reuters,        							ak;false
90708772aeccabfc99750cdad843b9bc54279a997ea4676a252a8123149fdfc7;"Norris am Tiefpunkt: ""McLaren-Knall"" als WM-Entscheidung?";https://www.zeit.de/news/2025-06/16/norris-am-tiefpunkt-mclaren-knall-als-wm-entscheidung;"Hier finden Sie Informationen zu dem Thema „Formel 1“. Lesen Sie jetzt „Norris am Tiefpunkt: ""McLaren-Knall"" als WM-Entscheidung?“.";Formel 1;News, Formel 1, Nico Rosberg, Max Verstappen, Kanada, Mclaren Group Limited, Formel-1, Mundo Deportivo, Formel 1, Tiefpunkt;2025-06-16T10:45:40+02:00;2025-06-16T10:45:40+02:00;;dpa Sport;false
b65c51269d39ed1e698840575452fd7193d9ac43fa742916a435e6f4504065c6;Hessens Metallindustrie verliert weiter Jobs;https://www.zeit.de/news/2025-06/16/hessens-metallindustrie-verliert-weiter-jobs;Hier finden Sie Informationen zu dem Thema „Quartalsbilanz“. Lesen Sie jetzt „Hessens Metallindustrie verliert weiter Jobs“.;Quartalsbilanz;News, Quartalsbilanz, Quartalsbilanz, Metallindustrie, Elektroindustrie, Stellenabbau, Metall;2025-06-16T10:42:44+02:00;2025-06-16T10:42:44+02:00;;dpa Hessen;false
e8723a82ec56ba26ecdeaceaf0e963110ff5cd5bfe57a7ca7f33810cdfff6385;Bellingham sofort gefordert: Hohe Dortmunder Ansprüche;https://www.zeit.de/news/2025-06/16/bellingham-sofort-gefordert-hohe-dortmunder-ansprueche;Hier finden Sie Informationen zu dem Thema „Club-WM“. Lesen Sie jetzt „Bellingham sofort gefordert: Hohe Dortmunder Ansprüche“.;Club-WM;News, Club-WM, Jobe Bellingham, Jude Bellingham, Sebastian Kehl, Julian Brandt, Niko Kovač, Emre Can, Nico Schlotterbeck, New York, Amerika, East Rutherford;2025-06-16T10:40:36+02:00;2025-06-16T10:40:36+02:00;;dpa Sport;false
d73f816b0e9c98f381d5adb52e67ed2b54103fa05fd60b774fcd55dd1e1f6e5e;Keine größeren Schäden nach Warnung vor Gewitterwochenende;https://www.zeit.de/news/2025-06/16/keine-groesseren-schaeden-nach-warnung-vor-gewitterwochenende;Hier finden Sie Informationen zu dem Thema „Wetter“. Lesen Sie jetzt „Keine größeren Schäden nach Warnung vor Gewitterwochenende“.;Wetter;News, Wetter, Baden-Württemberg, Polizei, Gewitterwochenende, Wetter, Starkregen;2025-06-16T10:40:34+02:00;2025-06-16T10:40:34+02:00;;dpa Baden-Württemberg;false
640c12f13a120dc4ab2d3dd8d2e41076fb99dc21765d33ffd7dc02b4f48ae9ba;Haseloff: Würde bei AfD-Regierung über Wegzug nachdenken;https://www.zeit.de/news/2025-06/16/haseloff-wuerde-bei-afd-regierung-ueber-wegzug-nachdenken;Hier finden Sie Informationen zu dem Thema „Sachsen-Anhalt“. Lesen Sie jetzt „Haseloff: Würde bei AfD-Regierung über Wegzug nachdenken“.;Sachsen-Anhalt;News, Sachsen-Anhalt, Reiner Haseloff, Sachsen-Anhalt, Alternative für Deutschland, CDU, Wegzug;2025-06-16T10:33:21+02:00;2025-06-16T10:33:21+02:00;;dpa;false
77888ac60b82229215177d90918d889c3626ef107228d7d7c2b86ecbe366548b;Glühwürmchen schwärmen wieder aus;https://www.zeit.de/news/2025-06/16/gluehwuermchen-schwaermen-wieder-aus;Hier finden Sie Informationen zu dem Thema „Natur“. Lesen Sie jetzt „Glühwürmchen schwärmen wieder aus“.;Natur;News, Natur, Tarja Richter, Hilpoltstein, LBV, Glühwürmchen, Sommernacht;2025-06-16T10:29:45+02:00;2025-06-16T10:29:45+02:00;;dpa Bayern;false
750f080e04e20375e6dd56b075defecd6d11ec8bbd7f4cacd49387549bdf9d87;Weiteres Talent für Kloses 1. FC Nürnberg;https://www.zeit.de/news/2025-06/16/weiteres-talent-fuer-kloses-1-fc-nuernberg;Hier finden Sie Informationen zu dem Thema „2. Fußball-Bundesliga“. Lesen Sie jetzt „Weiteres Talent für Kloses 1. FC Nürnberg“.;2. Fußball-Bundesliga;News, 2. Fußball-Bundesliga, Kristian Mandic, Miroslav Klose, 1. FC Nürnberg, Fußball-Bundesliga;2025-06-16T10:27:25+02:00;2025-06-16T10:27:25+02:00;;dpa Bayern;false
6681f4f039d4a7508e7398d27b840b2698963d2686a7488f3e6b1be4c0a73e1f;Pietro Lombardi und Laura Maria Rypa lassen Sohn taufen;https://www.zeit.de/news/2025-06/16/pietro-lombardi-und-laura-maria-rypa-lassen-sohn-taufen;Hier finden Sie Informationen zu dem Thema „Kirche“. Lesen Sie jetzt „Pietro Lombardi und Laura Maria Rypa lassen Sohn taufen“.;Kirche;News, Kirche, Pietro Lombardi, Laura Maria Rypa, Instagram;2025-06-16T10:26:52+02:00;2025-06-16T10:26:52+02:00;;dpa Nordrhein-Westfalen;false
f7f91e2f044bb4ebb0bf0ca75fddbe9e937070684fbec05b0deaf30d21bafa7b;Wollte Bolsonaro sich zurück an die Macht putschen?;https://www.zeit.de/politik/ausland/2025-06/prozess-brasilien-jair-bolsonaro-putschversuch-us-regierung;Ein Strafverfahren spaltet Brasilien: Ex-Präsident Bolsonaro soll einen Umsturz geplant haben. Rückendeckung bekommt er ausgerechnet aus den USA – von Trumps Regierung.;Prozess in Brasilien;Politik, Prozess in Brasilien, Jair Bolsonaro, Brasilien, Putsch, Gerichtsverfahren, USA, Oberster Gerichtshof;2025-06-16T10:22:56+02:00;2025-06-16T10:22:56+02:00;Alexander Kauschanski;;false
9ec36163792cb610ef6d1cdcdd62e8cff0a0d3fcb828e2f496512a493db2bce7;Stimmt das eigentlich, dass jetzt die Bagger rollen?;https://www.zeit.de/mobilitaet/2025-06/sondervermoegen-fuer-infrastruktur-bauen-kommunen-investition;500 Milliarden Euro für die Infrastruktur klingen super. Doch damit Bahn, Straßen und Schulen besser werden, muss erst einmal jemand mit dem Geld etwas anfangen können.;Sondervermögen für Infrastruktur;Mobilitaet, Sondervermögen für Infrastruktur, Infrastruktur, Lars Klingbeil, SPD, CDU, Finanzen, Bundesregierung;2025-06-16T10:20:50+02:00;2025-06-16T10:20:50+02:00;Jona SpreterTimo Lenzen;;false
