Hash;Title;Link;Description;Category;KeyWords;Published;LastUpdated;Author;Source;Paywall
55c12a1d17b2e70310c715920cec83b69a4cb7edc6995b5b90b9f46ce639378d;ESC prüft Stimmregeln nach starkem Zuspruch für Israel;https://www.zeit.de/kultur/musik/2025-05/israel-esc-yuval-raphael-eurovision-song-contest;Die European Broadcasting Union überprüft nach dem Erfolg Israels beim ESC die Abstimmungsregeln. Auch Werbekampagnen stehen auf dem Prüfstand.;Eurovision Song Contest;Kultur, Eurovision Song Contest, Eurovision Song Contest, Basel, Israel, Werbekampagne;2025-05-23T15:27:57+02:00;2025-05-23T15:27:57+02:00;ore;ZEIT ONLINE,        dpa,        							ore;false
6f8f657167fea1e84affac9fad1b06d933e0a8acc432f0814a0680d5bb9cb331;Sänger Terenzi im Prozess um Körperverletzung freigesprochen;https://www.zeit.de/news/2025-05/23/saenger-marc-terenzi-freigesprochen;Hier finden Sie Informationen zu dem Thema „Leute“. Lesen Sie jetzt „Sänger Terenzi im Prozess um Körperverletzung freigesprochen“.;Leute;News, Leute, Marc Terenzi, Lena Dammann, Verena Kerth, Körperverletzung, Sicherheit;2025-05-23T15:22:38+02:00;2025-05-23T15:22:38+02:00;;dpa;false
30974822daf4ab9637962a70ad81ff83f3eb45c9a0ed859b1608502e7426901b;Wirtschaft kritisiert Grenzkontrollen;https://www.zeit.de/news/2025-05/23/wirtschaft-kritisiert-grenzkontrollen;Hier finden Sie Informationen zu dem Thema „Migrationspolitik“. Lesen Sie jetzt „Wirtschaft kritisiert Grenzkontrollen“.;Migrationspolitik;News, Migrationspolitik, München, Gößl, Berchtesgadener Land, IHK, CSU, Migrationspolitik, Lieferverkehr, Verschärfung, Umsatzverlust, Grenzkontrolle;2025-05-23T15:22:14+02:00;2025-05-23T15:22:14+02:00;;dpa Bayern;false
b788f9c77bf8c79c43bf71c39a4907d6b69a15da1de5ae28b0923adc96980a0c;278 Millionen Euro für mehr Städtebau in Bayerns Kommunen;https://www.zeit.de/news/2025-05/23/278-millionen-euro-fuer-mehr-staedtebau-in-bayerns-kommunen;Hier finden Sie Informationen zu dem Thema „Geld von Bund und Land“. Lesen Sie jetzt „278 Millionen Euro für mehr Städtebau in Bayerns Kommunen“.;Geld von Bund und Land;News, Geld von Bund und Land, Christian Bernreiter, Bayern, München, Städtebau, Kommune, Geld;2025-05-23T15:20:22+02:00;2025-05-23T15:20:22+02:00;;dpa Bayern;false
2b57a1030b17ddda3a75dc8e044f4f701289abf9f647f3fc3273bf965cdf8b7e;"Die dänische Minderheit feiert ihre ""Årsmøde""";https://www.zeit.de/news/2025-05/23/die-daenische-minderheit-feiert-ihre-rsm-de;"Hier finden Sie Informationen zu dem Thema „Minderheiten“. Lesen Sie jetzt „Die dänische Minderheit feiert ihre ""Årsmøde""“.";Minderheiten;News, Minderheiten, Südschleswig, Dänemark, Flensburg, Kaffeetafel, Jahrestreffen, Minderheit, Familienfest;2025-05-23T15:18:55+02:00;2025-05-23T15:18:55+02:00;;dpa Hamburg/Schleswig-Holstein;false
f081a6b7cd769cec9c5c34bf79c5933b9f470e0aea1c2b4e114f8e29305c4c24;Gericht erlaubt Nutzung von Facebook-Daten für KI-Training;https://www.zeit.de/news/2025-05/23/gericht-erlaubt-nutzung-von-facebook-daten-fuer-ki-training;Hier finden Sie Informationen zu dem Thema „Datenschutz“. Lesen Sie jetzt „Gericht erlaubt Nutzung von Facebook-Daten für KI-Training“.;Datenschutz;News, Datenschutz, AI, Facebook, Oberlandesgericht Köln, Meta, Verbraucherzentrale, Instagram, Datenschutz, Nutzung, Nutzerbeitrag, Eilverfahren;2025-05-23T15:15:56+02:00;2025-05-23T15:15:56+02:00;;dpa Nordrhein-Westfalen;false
0a8010af14ab097b215f73de2b467c45675840ae06bb6b66479d88b66ccdbff3;Krise beim Hamburg Ballett - Ensemble wird anonym befragt;https://www.zeit.de/news/2025-05/23/krise-beim-hamburg-ballett-ensemble-wird-anonym-befragt;Hier finden Sie Informationen zu dem Thema „Ballett“. Lesen Sie jetzt „Krise beim Hamburg Ballett - Ensemble wird anonym befragt“.;Ballett;News, Ballett, Carsten Brosda, Demis Volpi, Hamburg, Ensemble, Hamburger Ballett, Ballett, Krise;2025-05-23T15:15:20+02:00;2025-05-23T15:15:20+02:00;;dpa Hamburg/Schleswig-Holstein;false
18a009080e732b9edabd7c77501aeff7061194fd6e10c46d65338e6f2b4ce8da;Verteidiger Ochojski verlässt Jahn Regensburg;https://www.zeit.de/news/2025-05/23/verteidiger-ochojski-verlaesst-jahn-regensburg;Hier finden Sie Informationen zu dem Thema „3. Liga“. Lesen Sie jetzt „Verteidiger Ochojski verlässt Jahn Regensburg“.;3. Liga;News, 3. Liga, Nico Ochojski, Jahn Regensburg, Jahnelf;2025-05-23T15:13:48+02:00;2025-05-23T15:13:48+02:00;;dpa Bayern;false
4d8e5d5f78b01034db691fc426af2dac366f760cbd5dacbf1d96ad6ff5c85cb1;Spaziergänger findet Leiche im Wald;https://www.zeit.de/news/2025-05/23/spaziergaenger-findet-leiche-im-wald;Hier finden Sie Informationen zu dem Thema „Grausiger Fund“. Lesen Sie jetzt „Spaziergänger findet Leiche im Wald“.;Grausiger Fund;News, Grausiger Fund, Wald;2025-05-23T15:13:29+02:00;2025-05-23T15:13:29+02:00;;dpa Niedersachsen;false
e030274b04f3d42b345e82233c42c32ebab4f95224aeeb6045e170eb800d3186;Über 200 Tiere in Wohnhaus - Veterinäramt schreitet ein;https://www.zeit.de/news/2025-05/23/ueber-200-tiere-in-wohnhaus-veterinaeramt-schreitet-ein;Hier finden Sie Informationen zu dem Thema „Landkreis Kronach“. Lesen Sie jetzt „Über 200 Tiere in Wohnhaus - Veterinäramt schreitet ein“.;Landkreis Kronach;News, Landkreis Kronach, Landkreis Kronach, Veterinäramt, Tiere, Katze;2025-05-23T15:10:46+02:00;2025-05-23T15:10:46+02:00;;dpa Bayern;false
fe7a057b2f6d6cc0fe2f7d1d3db4e224db999284407d11adea9bd0acc675cc16;Was Geflüchteten mit dem neuen EU-Plan droht;https://www.zeit.de/politik/ausland/2025-05/abschiebungen-drittatsaaten-migration-asylsuchende-eu-grundrechte;Flüchtlinge könnten künftig in Länder abgeschoben werden, in denen sie noch nie waren. Dort hätte die EU kaum Kontrolle. Dabei gibt es bessere Lösungen.;Abschiebungen in Drittstaaten;Politik, Abschiebungen in Drittstaaten, Europa, EU-Kommission, Europäisches Parlament, Friedrich Merz, Abschiebung, Asyl;2025-05-23T15:09:35+02:00;2025-05-23T15:09:35+02:00;Alexander Kauschanski;;false
3e1c8d0678a8060ad0c16c30db028d0c2201bcf503e33c50b15eac640e9aa99c;Gewalt und Messer bei Kindern und Jugendlichen;https://www.zeit.de/news/2025-05/23/gewalt-und-messer-bei-kindern-und-jugendlichen;Hier finden Sie Informationen zu dem Thema „Messerangriffe“. Lesen Sie jetzt „Gewalt und Messer bei Kindern und Jugendlichen“.;Messerangriffe;News, Messerangriffe, Thomas Bliesener, Barbara Slowik, Marc Allroggen, Berlin, NRW, Remscheid, Bundesinnenministerium, Polizei, Kriminologisches Forschungsinstitut Niedersachsen, BKA;2025-05-23T15:08:27+02:00;2025-05-23T15:08:27+02:00;;dpa;false
640428009ec027967f46ad9822451e6eb31ba90956500efe3521e470e2f68a70;Einer wie wir?;https://www.zeit.de/2025/21/papst-leo-xiv-predigt-vatikan-katholische-kirche;Leo XIV. hält sich beim Predigen am Manuskript fest, wirkt manchmal schüchtern und trifft beim Singen nicht alle Töne. Genau darin liegt sein Charme.;"Z+ (abopflichtiger Inhalt);
        
    Papst Leo XIV.";Gesellschaft, Papst Leo XIV. , Glaube, Papst Leo, Vatikanstadt, Katholische Kirche, Gottesdienst;2025-05-23T15:08:11+02:00;2025-05-23T15:08:11+02:00;Christina Rietz;Erschienen in Christ & Welt;false
699bb692c5c94f9588b22889a41812d2198fca129f2595cf114e86b8f36fd158;"Dobrindt will ""Turboeinbürgerung"" der Ampel abschaffen";https://www.zeit.de/politik/deutschland/2025-05/alexander-dobrindt-csu-turbo-einbuergerung-migration-gesetzesentwurf;Staatsbürgerschaft nach drei Jahren: Damit wollte die Ampel gut integrierte Migranten belohnen. Der neue Bundesinnenminister will diese Reform schnell wieder abräumen.;Bundesinnenministerium;Politik, Bundesinnenministerium, Alexander Dobrindt, Bundesinnenministerium, CSU, Migration, Einbürgerung, Asylpolitik;2025-05-23T15:07:23+02:00;2025-05-23T15:07:23+02:00;Ferdinand Otto;;false
4b77b6bd5c2565978d18f1d61b79e844084447468ee4b1c96dc4948c859562c9;Bilder des Tages;https://www.zeit.de/news/2025-05/23/bilder-des-tages;Hier finden Sie Informationen zu dem Thema „Fotografie“. Lesen Sie jetzt „Bilder des Tages“.;Fotografie;News, Fotografie, News;2025-05-23T15:07:08+02:00;2025-05-23T15:07:08+02:00;;dpa;false
1723c161b2fcb863d0a3b5058c02ff72943ddf861d0f120f96898689c7bc23ce;Rhein für höhere Strafen für Verbrechen mit K.-o.-Tropfen;https://www.zeit.de/news/2025-05/23/rhein-fuer-hoehere-strafen-fuer-verbrechen-mit-k-o-tropfen;Hier finden Sie Informationen zu dem Thema „Justiz“. Lesen Sie jetzt „Rhein für höhere Strafen für Verbrechen mit K.-o.-Tropfen“.;Justiz;News, Justiz, Hessen, Rhein, CDU, Verbrechen;2025-05-23T15:05:21+02:00;2025-05-23T15:05:21+02:00;;dpa Hessen;false
fa8ec7acc3615668b6b84df1d0f96a3a09a274f968523baa83df12a099746830;73-Jährige ortet Grabschmuck-Dieb mit GPS-Tracker;https://www.zeit.de/news/2025-05/23/73-jaehrige-ortet-grabschmuck-dieb-mit-gps-tracker;Hier finden Sie Informationen zu dem Thema „Diebstahl“. Lesen Sie jetzt „73-Jährige ortet Grabschmuck-Dieb mit GPS-Tracker“.;Diebstahl;News, Diebstahl, Landkreis Passau, Polizei, Grabschmuck, Blumenschale;2025-05-23T15:00:10+02:00;2025-05-23T15:00:10+02:00;;dpa Bayern;false
61a86e310ebce72acf19a219889e735d4f0d9e076b17be1a920c7710793f88ed;EU vermutet Spionageangriff Irans auf deutsche Abgeordnete;https://www.zeit.de/news/2025-05/23/eu-vermutet-spionageangriff-irans-auf-deutsche-abgeordnete;Hier finden Sie Informationen zu dem Thema „Europäisches Parlament“. Lesen Sie jetzt „EU vermutet Spionageangriff Irans auf deutsche Abgeordnete“.;Europäisches Parlament;News, Europäisches Parlament, Hannah Neumann, Roberta Metsola, Iran, EU, Europäisches Parlament, EU-Parlament, Deutsche Presse-Agentur, Spionageangriff, Cyberattacke, Spionage;2025-05-23T14:55:50+02:00;2025-05-23T14:55:50+02:00;;dpa;false
982a0c441806423793f0ef1f11f2fde6a22341cefc09ea864f9ee45719e96fd1;Iranische Hacker nehmen deutsche EU-Abgeordnete ins Visier;https://www.zeit.de/politik/ausland/2025-05/iran-eu-parlament-cyberangriff-hacker-hannah-neumann-abgeordnete;Die Grünen-Politikerin Hannah Neumann ist Ziel eines iranischen Cyberangriffs geworden. Die EU-Abgeordnete fordert eine diplomatische Reaktion.;Hannah Neumann;Politik, Hannah Neumann, Hackerangriff, Hacker, Iran, Bündnis 90/Die Grünen, Europäisches Parlament;2025-05-23T14:54:55+02:00;2025-05-23T14:54:55+02:00;ore;ZEIT ONLINE,        AFP,        dpa,        							ore;false
42ee5847c95d37ba7f799f09da717cff553ee961b527167314b22c3c01100916;Goldpreis legt stark zu - Zölle und Sorgen über US-Schulden;https://www.zeit.de/news/2025-05/23/goldpreis-legt-deutlich-zu-sorgen-ueber-us-verschuldung;"Hier finden Sie Informationen zu dem Thema „Sicherer ""Anlagehafen""“. Lesen Sie jetzt „Goldpreis legt stark zu - Zölle und Sorgen über US-Schulden“.";"Sicherer ""Anlagehafen""";"News, Sicherer ""Anlagehafen"", USA, Goldpreis, Anlagehafen, Edelmetall, Gold";2025-05-23T14:51:49+02:00;2025-05-23T14:51:49+02:00;;dpa;false
dc3501fa5d8591d74feb60783068fb8bf328e3eae797204f509f7ce071a73dba;Blaue Flagge für 27 Badestellen und sechs Häfen in MV;https://www.zeit.de/news/2025-05/23/blaue-flagge-fuer-27-badestellen-und-sechs-haefen-in-mv;Hier finden Sie Informationen zu dem Thema „Auszeichnungen“. Lesen Sie jetzt „Blaue Flagge für 27 Badestellen und sechs Häfen in MV“.;Auszeichnungen;News, Auszeichnungen, Heiligendamm, Mecklenburg-Vorpommern, Badestelle, Auszeichnung, Badewasserqualität, Erfolg;2025-05-23T14:51:27+02:00;2025-05-23T14:51:27+02:00;;dpa Mecklenburg-Vorpommern;false
c5f9a969fe66a4c6436a4e2b8aa73fe418b1bc15359dd20456eac3b411f5859b;Pflegekraft unter Verdacht: Seniorin Treppe hinabgestoßen?;https://www.zeit.de/news/2025-05/23/pflegekraft-unter-verdacht-seniorin-treppe-hinabgestossen;Hier finden Sie Informationen zu dem Thema „Körperverletzung“. Lesen Sie jetzt „Pflegekraft unter Verdacht: Seniorin Treppe hinabgestoßen?“.;Körperverletzung;News, Körperverletzung, Pflegekraft, Körperverletzung;2025-05-23T14:49:55+02:00;2025-05-23T14:49:55+02:00;;dpa Nordrhein-Westfalen;false
3d40dbfec93b67e715e3e9053fee9a5653c1ffa77debfbacd2e53f16de031867;Angriff auf Mitschüler: Verdächtiger 13-Jähriger gefasst;https://www.zeit.de/news/2025-05/23/angriff-auf-mitschueler-verdaechtiger-13-jaehriger-gefasst;Hier finden Sie Informationen zu dem Thema „Tat an Grundschule“. Lesen Sie jetzt „Angriff auf Mitschüler: Verdächtiger 13-Jähriger gefasst“.;Tat an Grundschule;News, Tat an Grundschule, Angriff, Grundschule, Attacke;2025-05-23T14:48:17+02:00;2025-05-23T14:48:17+02:00;;dpa;false
b9eae3f0cf38223d93055ed957cc8625ad5c20cc9d0676ef4bffeca12d8854ab;Angst vor Trumps Zöllen kurbelt deutsche Wirtschaft an;https://www.zeit.de/news/2025-05/23/wirtschaft-waechst-doppelt-so-stark-wie-erwartet;Hier finden Sie Informationen zu dem Thema „Zwischenhoch im Quartal“. Lesen Sie jetzt „Angst vor Trumps Zöllen kurbelt deutsche Wirtschaft an“.;Zwischenhoch im Quartal;News, Zwischenhoch im Quartal, Ruth Brand, Donald Trump, USA, Statistisches Bundesamt, Konjunkturflaute, Auto;2025-05-23T14:44:34+02:00;2025-05-23T14:44:34+02:00;;dpa;false
51b1021484f77ae97b3d736ca1ceaad59674682be68a4f7684dd287696fa3fbe;Marktbeobachter: Banane wird nicht zur Mangelware;https://www.zeit.de/news/2025-05/23/marktbeobachter-banane-wird-nicht-zur-mangelware;Hier finden Sie Informationen zu dem Thema „Lebensmittel“. Lesen Sie jetzt „Marktbeobachter: Banane wird nicht zur Mangelware“.;Lebensmittel;News, Lebensmittel, Philipp Hennerkes, Michael Koch, Panama, Banane, Mangelware, Bananenangebot, Lebensmittel;2025-05-23T14:43:10+02:00;2025-05-23T14:43:10+02:00;;dpa;false
0f083220b015284e965eebb83a88957381283b8501bc3166817a49ae9927b319;Bamberg Baskets mit erstem Neuzugang;https://www.zeit.de/news/2025-05/23/bamberg-baskets-mit-erstem-neuzugang;Hier finden Sie Informationen zu dem Thema „Basketball“. Lesen Sie jetzt „Bamberg Baskets mit erstem Neuzugang“.;Basketball;News, Basketball, Daniel Keppeler, Bamberg, Neuzugang, Basketball;2025-05-23T14:40:51+02:00;2025-05-23T14:40:51+02:00;;dpa Bayern;false
6309bc4fbe3c47452f6271df76f6ec5e3bd3bd5e81d2c69da269567b59c7e7b7;Wohl sechs Tote bei Absturz in San Diego - auch Musikmanager;https://www.zeit.de/news/2025-05/22/usa-kleinflugzeug-stuerzt-in-wohngebiet-in-san-diego;Hier finden Sie Informationen zu dem Thema „Luftverkehr“. Lesen Sie jetzt „Wohl sechs Tote bei Absturz in San Diego - auch Musikmanager“.;Luftverkehr;News, Luftverkehr, USA, San Diego, Kleinflugzeug, Wohngebiet, Luftverkehr;2025-05-23T14:37:58+02:00;2025-05-23T14:37:58+02:00;;dpa;false
c4f369d4c500625590b9ead9f08580ff0c727a22ca921554463f3077e4269f73;Urteil gegen Krankenschwester wegen Diebstahls rechtskräftig;https://www.zeit.de/news/2025-05/23/urteil-gegen-krankenschwester-wegen-diebstahls-rechtskraeftig;Hier finden Sie Informationen zu dem Thema „Kriminalität im Krankenhaus“. Lesen Sie jetzt „Urteil gegen Krankenschwester wegen Diebstahls rechtskräftig“.;Kriminalität im Krankenhaus;News, Kriminalität im Krankenhaus, Diebstahl, Kriminalität;2025-05-23T14:37:08+02:00;2025-05-23T14:37:08+02:00;;dpa Hamburg/Schleswig-Holstein;false
5805d7c001b7815a5426b7162a48ccd70dfb6afcd989080e26394819bf2389d4;Fahrer überschlägt sich mit Auto und stirbt;https://www.zeit.de/news/2025-05/23/fahrer-ueberschlaegt-sich-mit-auto-und-stirbt;Hier finden Sie Informationen zu dem Thema „Unfälle“. Lesen Sie jetzt „Fahrer überschlägt sich mit Auto und stirbt“.;Unfälle;News, Unfälle, Unfall, Auto;2025-05-23T14:36:19+02:00;2025-05-23T14:36:19+02:00;;dpa Niedersachsen;false
3357e0e716579aa655f7dcd92b4973a8b303dd1360da8a22b9e378181bb0aaed;Preis-Streit beendet: Edeka verkauft bald wieder Kellogg's;https://www.zeit.de/news/2025-05/23/preis-streit-beendet-edeka-verkauft-bald-wieder-kellogg-s;Hier finden Sie Informationen zu dem Thema „Frühstück“. Lesen Sie jetzt „Preis-Streit beendet: Edeka verkauft bald wieder Kellogg's“.;Frühstück;News, Frühstück, EDEKA, Kellanova, Lieferstopp, Cornflakes;2025-05-23T14:30:39+02:00;2025-05-23T14:30:39+02:00;;dpa;false
c68f0bf42214bdd89068c30dda9ead91ca0929e9996af1312eb3a92f9151aade;EU zahlt Landwirten 4,8 Millionen Euro für Seuchen-Schäden;https://www.zeit.de/news/2025-05/23/eu-zahlt-landwirten-4-8-millionen-euro-fuer-seuchen-schaeden;Hier finden Sie Informationen zu dem Thema „Maul- und Klauenseuche“. Lesen Sie jetzt „EU zahlt Landwirten 4,8 Millionen Euro für Seuchen-Schäden“.;Maul- und Klauenseuche;News, Maul- und Klauenseuche, Alois Rainer, Brandenburg, Bundeslandwirtschaftsministerium, EU, Klauenseuche, Geld, Tiere;2025-05-23T14:29:30+02:00;2025-05-23T14:29:30+02:00;;dpa Berlin/Brandenburg;false
35dbfcbbcde8442a8a9a2d2d2ee96264b636803b113925da1bc8098070ca2fa5;"""Ein Mann, der mehrere Frauen gleichzeitig und parallel betrügt""";https://www.zeit.de/gesellschaft/2025-05/betrug-beziehung-liebe-misstrauen-videopodcast;Was tun, wenn man herausfindet, dass der eigene Liebhaber ein Liebesbetrüger ist? Drei Frauen wollen sich rächen.;Betrug in der Beziehung;Gesellschaft, Betrug in der Beziehung, Beziehung, Betrug;2025-05-23T14:26:36+02:00;2025-05-23T14:26:36+02:00;Sabine RückertAndreas Sentker;;false
2b534b44bb1b6d5901a321e2441e628fb249f1d6c1e4cc1e0449e832b23c24f6;Letzte frostige Mai-Nacht im Südwesten erwartet;https://www.zeit.de/news/2025-05/23/letzte-frostige-mai-nacht-im-suedwesten-erwartet;Hier finden Sie Informationen zu dem Thema „Wetterumschwung“. Lesen Sie jetzt „Letzte frostige Mai-Nacht im Südwesten erwartet“.;Wetterumschwung;News, Wetterumschwung, Schwäbische Alb, Südwestalb, DWD, Südwesten, Wetterumschwung, Wetter;2025-05-23T14:24:29+02:00;2025-05-23T14:24:29+02:00;;dpa Baden-Württemberg;false
d034bc1e39d789cf36b38168dc92bac92eb77d4464d93297d77fa430a2a17c6e;Früherer Münchner Rekordtorschütze verlässt den EHC;https://www.zeit.de/news/2025-05/23/frueherer-muenchner-rekordtorschuetze-verlaesst-den-ehc;Hier finden Sie Informationen zu dem Thema „Deutsche Eishockey Liga“. Lesen Sie jetzt „Früherer Münchner Rekordtorschütze verlässt den EHC“.;Deutsche Eishockey Liga;News, Deutsche Eishockey Liga, München, EHC Red Bull München, DEL, Red Bull, Eishockey, Eis;2025-05-23T14:20:47+02:00;2025-05-23T14:20:47+02:00;;dpa Bayern;false
cd96b3fb89105527510a23439af680055d64fe4b11e55e68242e96300dd8ad1b;Landgericht weist AfD-Klagen gegen Linke-Politiker zurück;https://www.zeit.de/news/2025-05/23/landgericht-weist-afd-klagen-gegen-linke-politiker-zurueck;Hier finden Sie Informationen zu dem Thema „Politiker vor Gericht“. Lesen Sie jetzt „Landgericht weist AfD-Klagen gegen Linke-Politiker zurück“.;Politiker vor Gericht;News, Politiker vor Gericht, Dirk Bruhn, Schwerin, Mecklenburg-Vorpommern, Alternative für Deutschland, Landgericht;2025-05-23T14:18:53+02:00;2025-05-23T14:18:53+02:00;;dpa Mecklenburg-Vorpommern;false
1229c62b8658479fdd7adddce19ba14f3cefa13aa2dd0fead8e4722e15da6564;Ermittlungen nach Stromschlag am Bahnhof;https://www.zeit.de/news/2025-05/23/ermittlungen-nach-stromschlag-am-bahnhof;Hier finden Sie Informationen zu dem Thema „Böbingen“. Lesen Sie jetzt „Ermittlungen nach Stromschlag am Bahnhof“.;Böbingen;News, Böbingen, Mann, Böbingen, Ostalbkreis, Polizei, Bundespolizei, Stromschlag, Ermittlung, Bahnhof, Körperverletzung;2025-05-23T14:18:40+02:00;2025-05-23T14:18:40+02:00;;dpa Baden-Württemberg;false
5387dcf9e1f8d66727fe873f12e8d3f049411ec478395df96177977a98c12dd9;Zahl der Kampfmittelräumungen ist gestiegen;https://www.zeit.de/news/2025-05/23/zahl-der-kampfmittelraeumungen-ist-gestiegen;Hier finden Sie Informationen zu dem Thema „Jahresbericht für 2024“. Lesen Sie jetzt „Zahl der Kampfmittelräumungen ist gestiegen“.;Jahresbericht für 2024;News, Jahresbericht für 2024, Daniela Behrens, Hannover, Nordsee, Niedersachsen, Innenministerium, Kampfmittelbeseitigungsdienst, Kampfmittelräumung, Jahresbericht, Arbeitsaufkommen;2025-05-23T14:14:12+02:00;2025-05-23T14:14:12+02:00;;dpa Niedersachsen;false
0300e4021b4e087c06a3fc013c199f6fe791f7af6bfd2e6d22431a85907d9971;Sparpläne: Sozialverbände warnen vor langfristigen Folgen;https://www.zeit.de/news/2025-05/23/sparplaene-sozialverbaende-warnen-vor-langfristigen-folgen;Hier finden Sie Informationen zu dem Thema „Doppelhaushalt“. Lesen Sie jetzt „Sparpläne: Sozialverbände warnen vor langfristigen Folgen“.;Doppelhaushalt;News, Doppelhaushalt, Markus Schlimbach, Michael Richter, Andrea Hübler, Sachsen, DGB, Sozialverband, Doppelhaushalt, Sparplan;2025-05-23T14:10:41+02:00;2025-05-23T14:10:41+02:00;;dpa Sachsen;false
f2e311a41c6eb338cb4b0b6b8bd89ba3d861baad1f623a6625afd4dc2cfe46d7;Hundeverkauf auf der Straße – Minister plädieren für Verbot;https://www.zeit.de/news/2025-05/23/hundeverkauf-auf-der-strasse-minister-plaedieren-fuer-verbot;Hier finden Sie Informationen zu dem Thema „Tierschutz“. Lesen Sie jetzt „Hundeverkauf auf der Straße – Minister plädieren für Verbot“.;Tierschutz;News, Tierschutz, Felor Badenberg, Berlin, Hundeverkauf, Verbot, Tierschutz, Verbraucherschutzministerkonferenz, Katze, Tiere;2025-05-23T14:04:39+02:00;2025-05-23T14:04:39+02:00;;dpa Berlin/Brandenburg;false
41a97be4939a7052effd5dc110a3d04640cec1c6ef8671a570bda903d4caece3;Der fliegende Rucksack;https://www.zeit.de/sport/2025-05/fitnessuebung-sit-ups-mit-rucksack-personal-trainer;Diese Übung macht so viel mehr Spaß als der klassische Sit-up. Sie lässt nicht nur einen Rucksack als Sportgerät hochleben – sondern auch Ihren Körper.;"Z+ (abopflichtiger Inhalt);
        
    Fitnessübung";Sport, Fitnessübung, Fitnesstraining, Fitness, Fitnessstudio;2025-05-23T14:01:44+02:00;2025-05-23T14:01:44+02:00;;;false
dd4337a91da782e63ed3894cb436e48a9ab6bb472b2873c8bd913fdcbef5aa19;So viel Angst darf man um sein Kind haben;https://www.zeit.de/familie/2025-05/kindererziehung-sorge-angst-eltern-psyche;Wenn Eltern sich um ihre Kinder sorgen, ist das gut. Wenn ihre Sorge keine Grenzen kennt, wird es gefährlich, sagen Experten – und erklären, wie man Ängste im Zaum hält.;"Z+ (abopflichtiger Inhalt);
        
    Kindererziehung";Familie, Kindererziehung, Eltern, Kindererziehung, Angst, Familie, Alltag, Psychologie;2025-05-23T14:00:34+02:00;2025-05-23T14:00:34+02:00;Ines Schipperges;;false
aa7ef0988c474b6dc3011248fd132f38d64a3f9771afa7401708e17da604a1ee;Trump will 50-Prozent-Zölle auf EU-Waren ab Juni;https://www.zeit.de/news/2025-05/23/trump-will-50-prozent-zoelle-auf-eu-waren-ab-juni;Hier finden Sie Informationen zu dem Thema „Handel“. Lesen Sie jetzt „Trump will 50-Prozent-Zölle auf EU-Waren ab Juni“.;Handel;News, Handel, Donald Trump, EU;2025-05-23T14:00:01+02:00;2025-05-23T14:00:01+02:00;;dpa;false
7bdb2520ea55fbe7fb789adb3ea355a1cd5f7b16327a9d9ed25b676c2b55074b;Tourismusbranche mit leichtem Rückgang zum Jahresstart;https://www.zeit.de/news/2025-05/23/tourismusbranche-mit-leichtem-rueckgang-zum-jahresstart;Hier finden Sie Informationen zu dem Thema „Urlaub im Norden“. Lesen Sie jetzt „Tourismusbranche mit leichtem Rückgang zum Jahresstart“.;Urlaub im Norden;News, Urlaub im Norden, Schleswig-Holstein, Ostsee, Jahresstart, Rückgang, Rekordjahr, Tourismusbranche;2025-05-23T13:58:05+02:00;2025-05-23T13:58:05+02:00;;dpa Hamburg/Schleswig-Holstein;false
ec7169b78328279763e337e3ad955649ff8dfca818c3454cef766508030aa91b;Mit Piepsen und Blinken gegen Wildunfälle auf Gleisen;https://www.zeit.de/news/2025-05/23/mit-piepsen-und-blinken-wildunfaelle-auf-gleisen-vermeiden;Hier finden Sie Informationen zu dem Thema „Bahn“. Lesen Sie jetzt „Mit Piepsen und Blinken gegen Wildunfälle auf Gleisen“.;Bahn;News, Bahn, Köln, Wildunfall, Pieps, Landesjagdverband, ICE, Sommer;2025-05-23T13:58:04+02:00;2025-05-23T13:58:04+02:00;;dpa Hessen;false
530177a66e70f76ee5d00ca364686c32fe9c0430c726f9c70dece6df8d3f3063;Hier wird was geleistet!;https://www.zeit.de/kultur/2025-05/leistung-bundesregierung-arbeitszeit-wirtschaftspolitik-konjunktur;"Kaum sind sie im Amt, reden der Kanzler und sein Vize von ""Leistung"". Die soll sich wieder lohnen. Das Schöne aber an Leistung ist: Sie lässt sich so schlecht ermitteln.";"Z+ (abopflichtiger Inhalt);
        
    Leistung";Kultur, Leistung, Wirtschaftspolitik, Arbeitsplatz, Konjunktur, Friedrich Merz, Lars Klingbeil;2025-05-23T13:56:49+02:00;2025-05-23T13:56:49+02:00;Dirk Peitz;;false
5352effd9a6e061c21401c836fc98fc27592aae1f41f266cfb734c87ed194a78;Schrecklich egal;https://www.zeit.de/kultur/2025-05/angriff-bielefeld-aufmerksamkeit-terrorismus-islamismus;Die Gewalttat von Bielefeld hat verhältnismäßig wenig Aufmerksamkeit erregt. Das ist kein Zeichen von Abstumpfung – sondern ein Phänomen, das den Terrorismus schwächt.;"Z+ (abopflichtiger Inhalt);
        
    Angriff in Bielefeld";Kultur, Angriff in Bielefeld, Bielefeld, Terrorismus, Islamismus, Bewusstsein, Aufmerksamkeit;2025-05-23T13:55:29+02:00;2025-05-23T13:55:29+02:00;Florian Eichel;;false
7a0436414e2cd8def5f5da599fff0fd18c4a8361af942e25721932ec5e94552a;Werden Cent-Münzen auch bei uns abgeschafft?;https://www.zeit.de/news/2025-05/23/werden-cent-muenzen-auch-bei-uns-abgeschafft;Hier finden Sie Informationen zu dem Thema „Aus für den US-Penny“. Lesen Sie jetzt „Werden Cent-Münzen auch bei uns abgeschafft?“.;Aus für den US-Penny;News, Aus für den US-Penny, USA, BMF, Deutsche Bundesbank, Bargeld, Geld;2025-05-23T13:55:06+02:00;2025-05-23T13:55:06+02:00;;dpa;false
4f77011a68354b080186f6ba1bebd89fe7996c3bdb094153e0fbb0c872f0bf74;Neo Rauch zeigt seine Werke aus der Kinderzeit;https://www.zeit.de/news/2025-05/23/neo-rauch-zeigt-seine-werke-aus-der-kinderzeit;Hier finden Sie Informationen zu dem Thema „Kunst“. Lesen Sie jetzt „Neo Rauch zeigt seine Werke aus der Kinderzeit“.;Kunst;News, Kunst, Neo Rauch, Aschersleben, Kinderzeit, Grafikstiftung;2025-05-23T13:54:13+02:00;2025-05-23T13:54:13+02:00;;dpa Sachsen;false
