Hash;Title;Link;Description;Category;KeyWords;Published;LastUpdated;Author;Source;Paywall
fc16c88924a8ad7df94a54027863a5a36d72eb3e382f02e475b385edbf7904cc;Zwei deutsche Autohersteller haben jetzt sogar einen Vorteil;https://www.zeit.de/wirtschaft/2025-07/zoll-deal-eu-usa-autoindustrie-elektromobilitaet-konzerne;Der Zolldeal trifft die deutschen Autokonzerne mitten in der Umbauphase zur E-Mobilität. Wer keine Werke in den USA hat, hofft nun auf Sonderregeln mit der US-Regierung. ;"Z+ (abopflichtiger Inhalt);
        
    Zolldeal zwischen der EU und den USA";Wirtschaft, Zolldeal zwischen der EU und den USA, Europäische Union, USA, US-Zölle, Autoindustrie, Elektromobilität;2025-07-30T19:58:57+02:00;2025-07-30T19:58:57+02:00;Fabian Franke;;false
b3cce1f4834edeedc4e14b9a8874fb4b929486e5e0ab12c385073c1e8df0e7a5;"""Kompromisse können andere machen""";https://www.zeit.de/politik/deutschland/2025-07/gruene-jugend-jette-nietzard-kandidatur-vorsitz;Jette Nietzard will nicht erneut für den Bundesvorsitz der Grünen Jugend kandidieren. Wechselt sie jetzt auch die Partei? Das erklärt sie im Videointerview.;Grüne Jugend;Politik, Grüne Jugend, Bündnis 90/Die Grünen, Jette Nietzard, Jugendliche, Kandidatur, Grüne Jugend;2025-07-30T19:50:44+02:00;2025-07-30T19:50:44+02:00;Julian Stopa;;false
7c41711bd35de743c8c95733d73554760581b7ffdf3e26ffaa8e801f2ae92d30;Bahnstrecke Dortmund-Hamm nach Entschärfung wieder frei;https://www.zeit.de/news/2025-07/30/bahnstrecke-dortmund-hamm-wegen-entschaerfung-gesperrt;Hier finden Sie Informationen zu dem Thema „Zweiter Weltkrieg“. Lesen Sie jetzt „Bahnstrecke Dortmund-Hamm nach Entschärfung wieder frei“.;Zweiter Weltkrieg;News, Zweiter Weltkrieg, Dortmund, Hamm, Zweiter Weltkrieg, Bahnstrecke, Entschärfung;2025-07-30T19:45:09+02:00;2025-07-30T19:45:09+02:00;;dpa Nordrhein-Westfalen;false
d9a1a3872bd9533e48b9c31a4f0ca204f181d3080f7cbb3da24308367b8ca0ba;Schlichtung soll Lösung für Hildesheimer Bosch-Werk bringen;https://www.zeit.de/news/2025-07/30/schlichtung-soll-loesung-fuer-hildesheimer-bosch-werk-bringen;Hier finden Sie Informationen zu dem Thema „Krise in der Autoindustrie“. Lesen Sie jetzt „Schlichtung soll Lösung für Hildesheimer Bosch-Werk bringen“.;Krise in der Autoindustrie;News, Krise in der Autoindustrie, Hildesheim, IG Metall, Robert Bosch, Autoindustrie, Krise, Metall;2025-07-30T19:37:42+02:00;2025-07-30T19:37:42+02:00;;dpa Niedersachsen;false
1bc7fe8373bc865683925a8212d65b03a6feb61551aa11dad876606bae233465;"""Berge werden als natürliche Grabstätte respektiert""";https://www.zeit.de/wissen/umwelt/2025-07/bergrettung-risiko-bergsteigen-laura-dahlmeier-richard-lehner;Kein Bergretter solle für sie sein Leben riskieren. Das war Laura Dahlmeiers ausdrücklicher Wunsch. Warum Rettungen so schwierig sind, erklärt Bergretter Richard Lehner.;"Z+ (abopflichtiger Inhalt);
        
    Bergrettung";Wissen, Bergrettung, Bergsteigen, Wandern, Klettern, Pakistan, Laura Dahlmeier;2025-07-30T19:33:32+02:00;2025-07-30T19:33:32+02:00;Alina Hüsemann;;false
120d9254d816d700119f7e6e1a09d72e83aa7429d82d6119b82c1d62eebc2844;ZF und Betriebsrat: Gespräche über Zukunft von Krisensparte;https://www.zeit.de/news/2025-07/30/zf-und-betriebsrat-gespraeche-ueber-zukunft-von-krisensparte;Hier finden Sie Informationen zu dem Thema „Autozulieferer“. Lesen Sie jetzt „ZF und Betriebsrat: Gespräche über Zukunft von Krisensparte“.;Autozulieferer;News, Autozulieferer, Achim Dietrich, Barbara Resch, Friedrichshafen, IG Metall, Betriebsrat, Krisensparte, Kernsparte, Metall;2025-07-30T19:30:28+02:00;2025-07-30T19:30:28+02:00;;dpa Baden-Württemberg;false
5f50ac3b67026084fc3b3b3126ab84bca6b0db98ca8f7032333457782ca5b250;Palästina-Parole – Berliner Gericht spricht Aktivistin frei;https://www.zeit.de/news/2025-07/30/palaestina-parole-berliner-gericht-spricht-aktivistin-frei;Hier finden Sie Informationen zu dem Thema „Demonstrationen“. Lesen Sie jetzt „Palästina-Parole – Berliner Gericht spricht Aktivistin frei“.;Demonstrationen;News, Demonstrationen, Philipp Berkholz, Berlin, Palästinensergebiet, Gazastreifen, Amtsgericht Tiergarten, Hamas, Instagram, Demonstration, Körperverletzung, Protestbewegung;2025-07-30T19:29:41+02:00;2025-07-30T19:29:41+02:00;;dpa Berlin/Brandenburg;false
057a41186963c003ca66419ef020a659b5af05ce9a20bdd543e6609fbf590812;Eijsink löst Titzrath als HHLA-Chef ab;https://www.zeit.de/news/2025-07/30/eijsink-loest-titzrath-als-hhla-chef-ab;Hier finden Sie Informationen zu dem Thema „Personalwechsel“. Lesen Sie jetzt „Eijsink löst Titzrath als HHLA-Chef ab“.;Personalwechsel;News, Personalwechsel, Hamburg, HHLA, Personalwechsel, Logistik;2025-07-30T19:22:52+02:00;2025-07-30T19:22:52+02:00;;dpa Hamburg/Schleswig-Holstein;false
3027a1ae3485cf4958ac2b65696ebe69e3d104900b2cb73c3ea6bb5315a740a7;Museum Barberini bleibt wegen Störung an Klimatechnik zu;https://www.zeit.de/news/2025-07/30/museum-barberini-wegen-technischen-defekts-geschlossen;Hier finden Sie Informationen zu dem Thema „Kunst“. Lesen Sie jetzt „Museum Barberini bleibt wegen Störung an Klimatechnik zu“.;Kunst;News, Kunst, Museum Barberini;2025-07-30T19:19:30+02:00;2025-07-30T19:19:30+02:00;;dpa Berlin/Brandenburg;false
e0c63dca7a3b928fd1bda27cbafabf2ca29c3bc399fbe7c56d59d40a125f12a0;Im Club sind alle linientreu;https://www.zeit.de/kultur/film/2025-07/rave-on-film-aaron-altaras-nikias-chryssos-viktor-jakovleski;"Der Spielfilm ""Rave On"" zeigt das Berliner Nachtleben als tieftraurige Angelegenheit. Ein DJ sucht darin nach seinem Idol – und vielleicht auch nach einem Ausweg.";"Z+ (abopflichtiger Inhalt);
        
    ""Rave On""";"Kultur, ""Rave On"", Regisseur, Kino, Techno, Nachtleben, Diskothek, Berlin";2025-07-30T19:19:26+02:00;2025-07-30T19:19:26+02:00;Daniel Moersener;;false
bf79152ae08eae511bf79183cb6acef1a5e0d051d9081e61d1fd8651b64dbf41;"""Wahrscheinlich werden wir beide gerade ausspioniert""";https://www.zeit.de/kultur/film/2025-07/david-duchovny-fernsehserie-akte-x-verschwoerung-mythen;"In ""Akte X"" spürte er Aliens nach, mit einer Dokuserie deckt er nun geheime Regierungsprojekte auf. Warum kann David Duchovny nicht von den Verschwörungstheorien lassen?";"Z+ (abopflichtiger Inhalt);
        
    David Duchovny";Kultur, David Duchovny, Fernsehen, Fernsehserie, Filmindustrie, Außerirdische, Dokumentation, Sexualität, FBI;2025-07-30T19:18:33+02:00;2025-07-30T19:18:33+02:00;Aida Baghernejad;;false
a9e076500ecf68f797f4fe957b780dd7212800ebf0037d55ce6107e2ccda18cf;"Trump: Zölle und ""Strafe"" für Russland-Energiepartner Indien";https://www.zeit.de/news/2025-07/30/trump-zoelle-und-strafe-fuer-russland-energiepartner-indien;"Hier finden Sie Informationen zu dem Thema „Zölle“. Lesen Sie jetzt „Trump: Zölle und ""Strafe"" für Russland-Energiepartner Indien“.";Zölle;News, Zölle, Donald Trump, Indien, Russland, Zoll, Krieg in der Ukraine;2025-07-30T19:14:24+02:00;2025-07-30T19:14:24+02:00;;dpa;false
d9ba20ee0fa8e21862c2a76331a4dfb07c4f0b88bbf4a0da3cc5721665761e88;Demokratie-Mobil kommt nach Spremberg;https://www.zeit.de/news/2025-07/30/demokratie-mobil-kommt-nach-spremberg;Hier finden Sie Informationen zu dem Thema „Rechtsextremismus-Debatte“. Lesen Sie jetzt „Demokratie-Mobil kommt nach Spremberg“.;Rechtsextremismus-Debatte;News, Rechtsextremismus-Debatte, Spremberg, Brandenburg, Rechtsextremismus;2025-07-30T18:57:10+02:00;2025-07-30T18:57:10+02:00;;dpa Berlin/Brandenburg;false
3fb315501725f8b9b54f2b86ebd0854b9617f80ade5a0a5195d4fd99333650fa;Dieb bedroht Sicherheitsdienst mit Messer;https://www.zeit.de/news/2025-07/30/dieb-bedroht-sicherheitsdienst-mit-messer;Hier finden Sie Informationen zu dem Thema „Bremen“. Lesen Sie jetzt „Dieb bedroht Sicherheitsdienst mit Messer“.;Bremen;News, Bremen, Bremen, Bundespolizei, Hauptbahnhof, Sicherheitskräfte;2025-07-30T18:57:02+02:00;2025-07-30T18:57:02+02:00;;dpa Niedersachsen;false
6d3ef97dc4a67d08857e61743d074f56e37dd188495e294e035a9b1cae323165;Polizei verhindert Verbrechen durch Festnahmen;https://www.zeit.de/news/2025-07/30/polizei-verhindert-verbrechen-durch-festnahmen;Hier finden Sie Informationen zu dem Thema „Schusswaffe“. Lesen Sie jetzt „Polizei verhindert Verbrechen durch Festnahmen“.;Schusswaffe;News, Schusswaffe, Mann, Polizei, Schusswaffe, Verbrechen;2025-07-30T18:49:14+02:00;2025-07-30T18:49:14+02:00;;dpa Rheinland-Pfalz/Saarland;false
2c0b432f75e11a4caa0091759cc67c0ca6cd6120785998f538e497fd4f27702f;Kindermörder beantragt Haftentlassung;https://www.zeit.de/news/2025-07/30/kindermoerder-beantragt-haftentlassung;Hier finden Sie Informationen zu dem Thema „Fall Metzler“. Lesen Sie jetzt „Kindermörder beantragt Haftentlassung“.;Fall Metzler;News, Fall Metzler, Magnus Gäfgen, Jakob von Metzler, Frankfurt, Kassel, Focus, Staatsanwaltschaft, Haftentlassung, Entführung, Ermordung;2025-07-30T18:48:46+02:00;2025-07-30T18:48:46+02:00;;dpa;false
4f8b83f48b2cbd545a8b5c5ce7cdf28a09d1c165dee7d608a8c75e4ef7bc1de7;Schwimmende Notunterkunft für Geflüchtete schließt;https://www.zeit.de/news/2025-07/30/schwimmende-notunterkunft-fuer-gefluechtete-schliesst;Hier finden Sie Informationen zu dem Thema „Notunterkunft“. Lesen Sie jetzt „Schwimmende Notunterkunft für Geflüchtete schließt“.;Notunterkunft;News, Notunterkunft, Donau, Regensburg, Iran, Syrien, Notunterkunft, Geflüchtete, Geflüchtetenunterkunft, Schiff;2025-07-30T18:41:29+02:00;2025-07-30T18:41:29+02:00;;dpa Bayern;false
990166e3326902648f16e53a0711096ef3f1ae4d15dc6d5f355553573490fa8b;Auto auf A8 ausgebrannt - Fahrtrichtung Stuttgart gesperrt;https://www.zeit.de/news/2025-07/30/auto-auf-a8-brennt-beide-richtungen-gesperrt;Hier finden Sie Informationen zu dem Thema „Brände“. Lesen Sie jetzt „Auto auf A8 ausgebrannt - Fahrtrichtung Stuttgart gesperrt“.;Brände;News, Brände, Enzkreis, Auto, Brand;2025-07-30T18:37:13+02:00;2025-07-30T18:37:13+02:00;;dpa Baden-Württemberg;false
f2f1c67778cb636ae998075453e6d515f61d65e17e8f470ce893a8719abc86c2;Israels letzte Freunde;https://www.zeit.de/2025/32/israelpolitik-gazastreifen-humanitaere-katastrophe-hilfslieferungen-friedrich-merz;Weder stoppt Deutschland die militärische Unterstützung Israels, noch unterstützt es Sanktionen. Doch das Grauen im Gazastreifen setzt Kanzler Friedrich Merz unter Druck.;Israelpolitik;Politik, Israelpolitik , Gazastreifen, Hungersnot, Benjamin Netanjahu, Israel, Friedrich Merz, Nahost, Großbritannien, Jordanien, Bundesregierung, IStGH;2025-07-30T18:30:48+02:00;2025-07-30T18:30:48+02:00;Tina Hildebrandt;Aus der        ZEIT Nr. 32/2025;false
e3eee19d7cd700b5c364911b0775ed7be0f9d40766e772647903a0583a5c77a6;Motorrad und Traktor stoßen zusammen - ein Mensch tot;https://www.zeit.de/news/2025-07/30/motorrad-und-traktor-stossen-zusammen-ein-mensch-tot;Hier finden Sie Informationen zu dem Thema „Tödlicher Verkehrsunfall“. Lesen Sie jetzt „Motorrad und Traktor stoßen zusammen - ein Mensch tot“.;Tödlicher Verkehrsunfall;News, Tödlicher Verkehrsunfall, Polizei, Motorrad, Traktor, Verkehrsunfall;2025-07-30T18:30:34+02:00;2025-07-30T18:30:34+02:00;;dpa Berlin/Brandenburg;false
44002f1bf8439c4c787c2391035b8b892cab37f44d8eb881c597f2b0d0419f3d;Zu einfach;https://www.zeit.de/2025/32/luftbruecke-gazastreifen-friedrich-merz-hungersnot-lebensmittel;Die Lage in Israel ist komplex, der deutsche Einfluss gering. Dennoch müssen den mahnenden Worten des Bundeskanzlers Konsequenzen folgen.;Luftbrücke in den Gazastreifen;Politik, Luftbrücke in den Gazastreifen, Friedrich Merz, Israel, Gazastreifen, Hungersnot, Lebensmittel, Bundesregierung, Frankreich, Hamas;2025-07-30T18:30:31+02:00;2025-07-30T18:30:31+02:00;Heinrich Wefing;Aus der        ZEIT Nr. 32/2025;false
da6b0f9140d7ac49ef383e97c5621e2eb29c1ee462ed258eb355254ce4ee620a;Frau bringt Sprenggranate zur Polizeiinspektion;https://www.zeit.de/news/2025-07/30/polizeiinspektion-wegen-moeglicher-explosionsgefahr-geraeumt;Hier finden Sie Informationen zu dem Thema „Gelände abgesperrt“. Lesen Sie jetzt „Frau bringt Sprenggranate zur Polizeiinspektion“.;Gelände abgesperrt;News, Gelände abgesperrt, Polizei, Polizeiinspektion, Explosionsgefahr;2025-07-30T18:28:26+02:00;2025-07-30T18:28:26+02:00;;dpa Bayern;false
3f03250a8ab7b07b84cdaadcc948671a49a6607989ea06f4316b050173c2df50;Ex-Biathletin Laura Dahlmeier stirbt bei Bergunglück;https://www.zeit.de/news/2025-07/30/hoffen-auf-ein-wunder-laura-dahlmeier-wird-weiter-gesucht;Hier finden Sie Informationen zu dem Thema „Tödlicher Bergunfall“. Lesen Sie jetzt „Ex-Biathletin Laura Dahlmeier stirbt bei Bergunglück“.;Tödlicher Bergunfall;News, Tödlicher Bergunfall, Laura Dahlmeier, Laila Peak, Karakorum-Gebirge, Pakistan, Deutsche Presse-Agentur;2025-07-30T18:27:13+02:00;2025-07-30T18:27:13+02:00;;dpa;false
e308c879d2c9a2a8875ef9b0f1c59210005f80a436185b050a4ddd2b5809de9d;Falsche Polizisten stoppen richtige Polizistin - Festnahme;https://www.zeit.de/news/2025-07/30/falsche-polizisten-stoppen-richtige-polizistin-festnahme;Hier finden Sie Informationen zu dem Thema „Betrug“. Lesen Sie jetzt „Falsche Polizisten stoppen richtige Polizistin - Festnahme“.;Betrug;News, Betrug, Mann, Seligenstadt, Offenbach, Polizei, Betrug, Festnahme, Auto;2025-07-30T18:26:10+02:00;2025-07-30T18:26:10+02:00;;dpa Hessen;false
89492146f0adc237d074b274325fc71393adb33c3252380dd3b54d97eac4c896;Kokain-Schmuggel: Festnahmen und Durchsuchungen;https://www.zeit.de/news/2025-07/30/kokain-schmuggel-festnahmen-und-durchsuchungen;Hier finden Sie Informationen zu dem Thema „Kriminalität“. Lesen Sie jetzt „Kokain-Schmuggel: Festnahmen und Durchsuchungen“.;Kriminalität;News, Kriminalität, Mann, Großbritannien, Hamburg, Hamburg-Hammerbrook, Seevetal, Winsen, Lüneburg, Niedersachsen, Polizei, Kokain;2025-07-30T18:25:12+02:00;2025-07-30T18:25:12+02:00;;dpa Hamburg/Schleswig-Holstein;false
5e8528de73bfd7b078900545b8deef0729eea703faa5bb54837ea4ade781edbb;Flugverkehr über Großbritannien vorübergehend gestört;https://www.zeit.de/mobilitaet/2025-07/flugverkehr-london-grossbritannien-gestoert-technischer-fehler-flugsicherheit;Der britische Flugsicherungsdienst meldete technische Probleme im Flugverkehr. Flugzeuge mussten am Boden bleiben. Später hieß es, das Problem sei behoben.;Großbritannien;Mobilitaet, Großbritannien, London, Flughafen, Flugverkehr, Technologie, X, Störung;2025-07-30T18:23:47+02:00;2025-07-30T18:23:47+02:00;voi;DIE ZEIT,        dpa,        Reuters,        							voi;false
a2b14d4dbf8525020bac8ceeb678c4571b02417cb83841a200bd3faf68ae1c37;Weniger Besucher in Berliner Freibädern;https://www.zeit.de/news/2025-07/30/weniger-besucher-in-berliner-freibaedern;Hier finden Sie Informationen zu dem Thema „Freibad-Saison“. Lesen Sie jetzt „Weniger Besucher in Berliner Freibädern“.;Freibad-Saison;News, Freibad-Saison, Wannsee, Freibad, Saisonstart, Strandbad, Wetter;2025-07-30T18:18:46+02:00;2025-07-30T18:18:46+02:00;;dpa Berlin/Brandenburg;false
2408003f954c21d1de99e2af40eff8831f31af0e906f1b0b97ef45c297886750;Großeinsatz gegen Waldbrand westlich von Madrid;https://www.zeit.de/news/2025-07/30/grosseinsatz-gegen-waldbrand-westlich-von-madrid;Hier finden Sie Informationen zu dem Thema „Iberische Halbinsel“. Lesen Sie jetzt „Großeinsatz gegen Waldbrand westlich von Madrid“.;Iberische Halbinsel;News, Iberische Halbinsel, Madrid, Ávila, Spanien, Großeinsatz, Waldbrand, Wald;2025-07-30T18:17:32+02:00;2025-07-30T18:17:32+02:00;;dpa;false
bdd88ab0040e59097ab0c711177c3356b65c609fb62f84de659523361c8554a3;"Verfahren gegen Frau im ""Reichsbürger""-Prozess abgetrennt";https://www.zeit.de/news/2025-07/30/verfahren-gegen-frau-im-reichsbuerger-prozess-abgetrennt;"Hier finden Sie Informationen zu dem Thema „Reichsbürger-Prozess“. Lesen Sie jetzt „Verfahren gegen Frau im ""Reichsbürger""-Prozess abgetrennt“.";Reichsbürger-Prozess;News, Reichsbürger-Prozess, München, OLG;2025-07-30T18:15:50+02:00;2025-07-30T18:15:50+02:00;;dpa Bayern;false
b919db8ea3c748e6bcd563d9f1bf545c8278e7ce0bd7c2f75f6e7436ee978ecf;Flugverkehr über Großbritannien gestört;https://www.zeit.de/news/2025-07/30/flugverkehr-ueber-london-massiv-gestoert;Hier finden Sie Informationen zu dem Thema „Technisches Problem“. Lesen Sie jetzt „Flugverkehr über Großbritannien gestört“.;Technisches Problem;News, Technisches Problem, London, Großbritannien, Flugverkehr;2025-07-30T18:15:17+02:00;2025-07-30T18:15:17+02:00;;dpa;false
ce8d0b79b9ea684de362bcef363caaea8f5aa17308719f1dbfda45b5898f0088;Ballenpresse brennt: Schaden fast in Millionenhöhe;https://www.zeit.de/news/2025-07/30/ballenpresse-brennt-schaden-fast-in-millionenhoehe;Hier finden Sie Informationen zu dem Thema „Brände“. Lesen Sie jetzt „Ballenpresse brennt: Schaden fast in Millionenhöhe“.;Brände;News, Brände, Grosselfingen, Polizei, Ballenpresse, Millionenhöhe, Papierhalle, Entsorgungsbetrieb, Brand;2025-07-30T18:14:59+02:00;2025-07-30T18:14:59+02:00;;dpa Baden-Württemberg;false
121f5803a3899cd6964d97609a3a1b9d7b92826d74e6515f4bcb8e7162cd1506;Ändert sich jetzt die Position der USA zum Gazakrieg?;https://www.zeit.de/politik/ausland/2025-07/gaza-krieg-hungersnot-donald-trump-israel-gxe;Donald Trump ist besorgt über Bilder aus Gaza – und kritisiert Israel. Das passt nicht zur bisherigen Rolle der USA. Nun wird sich zeigen, wie ernst der Sinneswandel ist.;Krieg in Gaza;Politik, Krieg in Gaza, Israel, Donald Trump, Benjamin Netanjahu, Gazastreifen, USA, Hungersnot, Nahost, UN, Hamas, AA;2025-07-30T18:03:21+02:00;2025-07-30T18:03:21+02:00;Johanna Roth;;false
885df57c75e77cd01bf3a29805a9f822c145067e7dab874aa4e76115eab24a05;Ulmer Basketballer holen erfahrenen Guard Brown;https://www.zeit.de/news/2025-07/30/ulmer-basketballer-holen-erfahrenen-guard-brown;Hier finden Sie Informationen zu dem Thema „Basketball-Bundesliga“. Lesen Sie jetzt „Ulmer Basketballer holen erfahrenen Guard Brown“.;Basketball-Bundesliga;News, Basketball-Bundesliga, Bryce Brown, Ulm, BB, Ratiopharm Ulm;2025-07-30T18:02:51+02:00;2025-07-30T18:02:51+02:00;;dpa Baden-Württemberg;false
3cc9d1ac3d5e4a9f55145bafcceecc885124adcd27c457e2cb81332ca7ce2b74;"""Andere gehen Holz hacken"" - Höchststrafe für Feuermord";https://www.zeit.de/news/2025-07/30/urteil-fuer-vierfachen-solinger-feuermord-erwartet;"Hier finden Sie Informationen zu dem Thema „Brandstiftungen“. Lesen Sie jetzt „""Andere gehen Holz hacken"" - Höchststrafe für Feuermord“.";Brandstiftungen;News, Brandstiftungen, Seda Başay-Yildiz, Daniel S., Solingen, Polizei, Feuermord, Brandstiftung, Familie;2025-07-30T18:01:50+02:00;2025-07-30T18:01:50+02:00;;dpa;false
483bbe87ab9b9aacdd6193411be9d85aacd69712d3ae051eb6481b3f212be756;Mentale Probleme: Niners-Kapitän Richter beendet Karriere;https://www.zeit.de/news/2025-07/30/mentale-probleme-niners-kapitaen-richter-beendet-karriere;Hier finden Sie Informationen zu dem Thema „Basketball“. Lesen Sie jetzt „Mentale Probleme: Niners-Kapitän Richter beendet Karriere“.;Basketball;News, Basketball, Jonas Richter, BV Chemnitz 99, YouTube, Basketball;2025-07-30T18:00:19+02:00;2025-07-30T18:00:19+02:00;;dpa Sachsen;false
9eff6b4a360208129d10010d29d9aafab6e26e8ae75006cf8e6131c7a1db6b3c;Manche Gefahr erkennt nur der Mensch;https://www.zeit.de/2025/32/zugunglueck-riedlingen-erdrutsch-extremwetter-bahn-klimawandel;Das Zugunglück in Riedlingen zeigt: Die Bahn muss sich auf mehr Hitze, Sturm und Starkregen einstellen. Was getan werden kann, damit Züge auch in Zukunft sicher fahren.;Zugunglück in Riedlingen;Wissen, Zugunglück in Riedlingen , Riedlingen, Erdrutsch, Baden-Württemberg, Fernverkehr, Deutsche Bahn, Extremwetter;2025-07-30T17:56:17+02:00;2025-07-30T17:56:17+02:00;Dr. Dirk Asendorpf;Aus der        ZEIT Nr. 32/2025;false
13a1e6fe4035bbd8d38892ecc2d667040ccd9b451915e9c17777db7ab9c96324;Schönheitswunsch mit grausigen Folgen;https://www.zeit.de/gesellschaft/2025-07/toedliche-penisvergroesserung-spritzen-verbrechen-video-podcast;Martin hat nur einen Wunsch: einen größeren Penis. Im Internet trifft er auf einen Mann, der ihm genau das verspricht – eine Begegnung mit katastrophalen Folgen.;​Illegale Penisvergrößerung;Gesellschaft, ​Illegale Penisvergrößerung, Mann, Internet, Schönheitsoperation, Geschlecht;2025-07-30T17:48:10+02:00;2025-07-30T17:48:10+02:00;Anne KunzeDaniel Müller;;false
e8d4ca3f29ecd7d0e2b05a944e8de8c6341f5bc7adf9f874593175e604751c4b;Brandenburg strebt zügige Umsetzung des Milliardenpakets an;https://www.zeit.de/news/2025-07/30/brandenburg-will-zuegige-umsetzung-des-milliardenpakets;Hier finden Sie Informationen zu dem Thema „Sondervermögen Infrastruktur“. Lesen Sie jetzt „Brandenburg strebt zügige Umsetzung des Milliardenpakets an“.;Sondervermögen Infrastruktur;News, Sondervermögen Infrastruktur, Brandenburg, Deutsche Presse-Agentur, Milliardenpaket, Sondervermögen, Infrastruktur;2025-07-30T17:40:10+02:00;2025-07-30T17:40:10+02:00;;dpa Berlin/Brandenburg;false
fdad85a8cf59dda09b9506eb2d7d74b7a075799bc36f441a2251ea31fdb243b9;Netzagentur beendet Streit um doppelten Glasfaserausbau;https://www.zeit.de/news/2025-07/30/netzagentur-beendet-streit-um-doppelten-glasfaserausbau;Hier finden Sie Informationen zu dem Thema „Breitbandausbau“. Lesen Sie jetzt „Netzagentur beendet Streit um doppelten Glasfaserausbau“.;Breitbandausbau;News, Breitbandausbau, Deutsche Telekom, Bundesnetzagentur, Glasfaserausbau, Netzagentur, Breitbandausbau, Monitoringstelle, Wettbewerbsverhalten, Glasfasernetz, Telekommunikationsriese;2025-07-30T17:36:53+02:00;2025-07-30T17:36:53+02:00;;dpa;false
d8aa02afcb49b380ce6970e568f7f165758464f3cbd1763505b626f41f2dcd5f;Mehr Geld vom Bund für Justiz-Stellen und Digitalisierung;https://www.zeit.de/news/2025-07/30/mehr-geld-vom-bund-fuer-justiz-stellen-und-digitalisierung;"Hier finden Sie Informationen zu dem Thema „""Pakt für den Rechtsstaat""“. Lesen Sie jetzt „Mehr Geld vom Bund für Justiz-Stellen und Digitalisierung“.";"""Pakt für den Rechtsstaat""";"News, ""Pakt für den Rechtsstaat"", Stefanie Hubig, Bundesregierung, SPD, Rechtsstaat, Pakt, Geld, Digitalisierung";2025-07-30T17:35:30+02:00;2025-07-30T17:35:30+02:00;;dpa Sachsen;false
f2061ad28ed51ac3030e67da8c976dc92f36ef3f9f17320bb6862f183f93d495;Ein Leben am Limit: Laura Dahlmeier stirbt bei Bergunglück;https://www.zeit.de/news/2025-07/30/rettungsaktion-fuer-dahlmeier-was-wir-wissen-und-was-nicht;Hier finden Sie Informationen zu dem Thema „Tragischer Unfall in Pakistan“. Lesen Sie jetzt „Ein Leben am Limit: Laura Dahlmeier stirbt bei Bergunglück“.;Tragischer Unfall in Pakistan;News, Tragischer Unfall in Pakistan, Laura Dahlmeier, Karakorum-Gebirge, Oberbayern, Pakistan, ZDF, Rettungsaktion, Bergunfall;2025-07-30T17:35:09+02:00;2025-07-30T17:35:09+02:00;;dpa;false
8ea8eec07a78bdceebb67b4de36cba248b526e8cdde26aba0f1cf8567f722fc9;Vergewaltigung im Wald: Prozess startet;https://www.zeit.de/news/2025-07/30/vergewaltigung-im-wald-prozess-startet;Hier finden Sie Informationen zu dem Thema „Kriminalität“. Lesen Sie jetzt „Vergewaltigung im Wald: Prozess startet“.;Kriminalität;News, Kriminalität, Kriminalität, Vergewaltigung, Wald;2025-07-30T17:30:38+02:00;2025-07-30T17:30:38+02:00;;dpa Hessen;false
deec542a2985fe8e585e7a3f1a3400ed63179e080372ef1483f2b737ababa785;Arzt von Mordvorwurf freigesprochen;https://www.zeit.de/news/2025-07/30/arzt-von-mordvorwurf-freigesprochen;Hier finden Sie Informationen zu dem Thema „Gericht“. Lesen Sie jetzt „Arzt von Mordvorwurf freigesprochen“.;Gericht;News, Gericht, Regensburg, Staatsanwaltschaft, Mordvorwurf, Strafkammer, Mord;2025-07-30T17:28:25+02:00;2025-07-30T17:28:25+02:00;;dpa Bayern;false
87539dcfe23b9508adc6cce7c92166a188c98dd46f5cf60bd00c6cf2ec2d520c;Unbekannte Substanz - mehrere Verletzte in Döbeln;https://www.zeit.de/news/2025-07/30/unbekannte-substanz-mehrere-verletzte-in-doebeln;Hier finden Sie Informationen zu dem Thema „Feuerwehreinsatz“. Lesen Sie jetzt „Unbekannte Substanz - mehrere Verletzte in Döbeln“.;Feuerwehreinsatz;News, Feuerwehreinsatz, Döbeln, Landkreis Mittelsachsen, Polizei, Feuerwehr, Feuerwehreinsatz, Atemwegsreizung;2025-07-30T17:22:44+02:00;2025-07-30T17:22:44+02:00;;dpa Sachsen;false
abf31dc7b93bd808057ccc6792739730fd6d691978385c3f07f30fbd74b19df9;Brauer-Tarifkonflikt im Norden ist geschlichtet;https://www.zeit.de/news/2025-07/30/brauer-tarifkonflikt-im-norden-ist-geschlichtet;Hier finden Sie Informationen zu dem Thema „Lebensmittel“. Lesen Sie jetzt „Brauer-Tarifkonflikt im Norden ist geschlichtet“.;Lebensmittel;News, Lebensmittel, Hamburg, Lübz, Carlsberg, NGG, Tarifkonflikt, Lebensmittel, Brauerei, Geld;2025-07-30T17:17:49+02:00;2025-07-30T17:17:49+02:00;;dpa Hamburg/Schleswig-Holstein;false
c48cf069bb56ff052f5857636da644af83e8398add9b3aad3b1a788a132c117b;"Ex-FBI-Mann kritisiert späte Festnahme von ""White Tiger""";https://www.zeit.de/news/2025-07/30/ex-fbi-mann-kritisiert-spaete-festnahme-von-white-tiger;"Hier finden Sie Informationen zu dem Thema „Pädokriminelle“. Lesen Sie jetzt „Ex-FBI-Mann kritisiert späte Festnahme von ""White Tiger""“.";Pädokriminelle;News, Pädokriminelle, Hamburg, USA, FBI, LKA, Bundespolizei, Staatsanwaltschaft, Polizei, Treffen, Mord, Festnahme;2025-07-30T17:16:15+02:00;2025-07-30T17:16:15+02:00;;dpa Hamburg/Schleswig-Holstein;false
