Hash;Title;Link;Description;Category;KeyWords;Published;LastUpdated;Author;Source;Paywall
1fa3b9c35ae16e29702e0b436b41426fffb2301f48a4004829efccb386030f30;Er will’s nicht gewesen sein;https://www.zeit.de/2024/48/christoph-groener-group-insolvenz-bauindustrie-immobilienmarkt;Der Bauunternehmer Christoph Gröner meldet für sein Unternehmen Insolvenz an. Die Schuld dafür sieht er bei den Medien. Und bereitet sich schon auf die nächste Runde vor.;"Z+ (abopflichtiger Inhalt);
        
    
Christoph Gröner";Wirtschaft, Christoph Gröner, Insolvenz, Immobilienmarkt, Ronald Pofalla, Günther Oettinger, Rüdiger Grube, Leipzig;2024-11-14T18:13:35+01:00;2024-11-14T18:13:35+01:00;Florian Kaufmann;Aus der        ZEIT Nr. 48/2024;false
9a4f715f5a1fbe5681cf9bfb72e1d4107a2847f96a2e4c3dd46fb2393db11980;Innensenatorin: Verbotszonen und Führerschein-Entzug;https://www.zeit.de/news/2024-11/14/innensenatorin-verbotszonen-und-fuehrerschein-entzug;Hier finden Sie Informationen zu dem Thema „Anstieg von Messerangriffen“. Lesen Sie jetzt „Innensenatorin: Verbotszonen und Führerschein-Entzug“.;"Z+ (abopflichtiger Inhalt);
        
    
Anstieg von Messerangriffen";News, Anstieg von Messerangriffen, Iris Spranger, Berlin, SPD, Polizei, Verbotszone, Messerangriff, Nichteignung;2024-11-14T18:11:25+01:00;2024-11-14T18:11:25+01:00;;dpa Berlin/Brandenburg;false
b36299b9aad1346ee87bac1c5096507acb1b51c8f9e692f790a4e4f996379022;"U21 mit Kölner Urbig im Tor in die ""Standortbestimmung""";https://www.zeit.de/news/2024-11/14/u21-mit-koelner-urbig-im-tor-in-die-standortbestimmung;"Hier finden Sie Informationen zu dem Thema „Deutscher Fußball-Bund“. Lesen Sie jetzt „U21 mit Kölner Urbig im Tor in die ""Standortbestimmung""“.";"Z+ (abopflichtiger Inhalt);
        
    
Deutscher Fußball-Bund";News, Deutscher Fußball-Bund, Noah Atubolu, Leandro Morgalla, Antonio Di Salvo, Jonas Urbig, Di Salvo, Felix Gebhardt, Youssoufa Moukoko, Paul Wanner, Dänemark, Frankreich;2024-11-14T18:04:46+01:00;2024-11-14T18:04:46+01:00;;dpa Nordrhein-Westfalen;false
21b31b326f50d88f5540fcf3582379c4803137365ed57ca2861b44b9c7ee84b6;Wegner auf USA-Reise: Können von New York lernen;https://www.zeit.de/news/2024-11/14/wegner-auf-usa-reise-koennen-von-new-york-lernen;Hier finden Sie Informationen zu dem Thema „Stadtentwicklung“. Lesen Sie jetzt „Wegner auf USA-Reise: Können von New York lernen“.;"Z+ (abopflichtiger Inhalt);
        
    
Stadtentwicklung";News, Stadtentwicklung, Kai Wegner, New York, Berlin, USA, Boston, Los Angeles, CDU, Stadtentwicklung;2024-11-14T18:02:47+01:00;2024-11-14T18:02:47+01:00;;dpa Berlin/Brandenburg;false
c8c9978f2f84bbf13456a70a38175970a088454a69cb0a9f4d9aa4639b21e1d8;Iqony-Großbatterie soll Ökostrom für die Bahn speichern;https://www.zeit.de/news/2024-11/14/iqony-grossbatterie-soll-oekostrom-fuer-die-bahn-speichern;Hier finden Sie Informationen zu dem Thema „Energiewende“. Lesen Sie jetzt „Iqony-Großbatterie soll Ökostrom für die Bahn speichern“.;"Z+ (abopflichtiger Inhalt);
        
    
Energiewende";News, Energiewende, Duisburg, Walsum, DB, Deutsche Bahn, Ökostrom, Kraftwerksstandort, Energieunternehmen, Energiewende, ICE;2024-11-14T18:01:47+01:00;2024-11-14T18:01:47+01:00;;dpa Nordrhein-Westfalen;false
7ec537b9cb1e657cdcbeddb39eab156bdd65b970100c964ebd52d92e79859f25;Missbrauch in Jugendeinrichtungen - Anerkennung für Opfer;https://www.zeit.de/news/2024-11/14/missbrauch-in-jugendeinrichtungen-anerkennung-fuer-opfer;Hier finden Sie Informationen zu dem Thema „Anerkennung des Leids“. Lesen Sie jetzt „Missbrauch in Jugendeinrichtungen - Anerkennung für Opfer“.;"Z+ (abopflichtiger Inhalt);
        
    
Anerkennung des Leids";News, Anerkennung des Leids, Würzburg, Jugendeinrichtung, Missbrauch, Anerkennung, Anerkennungsleistung;2024-11-14T17:56:26+01:00;2024-11-14T17:56:26+01:00;;dpa Bayern;false
71debc5f825b399a84b0d8b3c74d5aa4cbea4a05d74ede6e50cbc05780a7b361;Abgeordnete wollen Schwangerschaftsabbrüche entkriminalisieren;https://www.zeit.de/politik/deutschland/2024-11/abgeordnete-wollen-abtreibungen-erleichtern;Schwangerschaftsabbrüche sind in Deutschland nicht legal. Eine Gruppe von Parlamentariern will das noch vor der Bundestagswahl ändern. ;"Z+ (abopflichtiger Inhalt);
        
    
Schwangerschaftsabbruch";Politik, Schwangerschaftsabbruch, Schwangerschaftsabbruch, Bärbel Bas, SPD, BMG, Deutscher Bundestag, Bundestagswahl;2024-11-14T17:55:36+01:00;2024-11-14T17:55:36+01:00;Jonas E. Koch;;false
766f2b837eff07ce0f3c03745e02cded98728dd80e3c6208e32b66c53e8c533b;Linke: 8. Mai 2025 soll einmalig Feiertag sein;https://www.zeit.de/news/2024-11/14/linke-8-mai-2025-soll-einmalig-feiertag-sein;Hier finden Sie Informationen zu dem Thema „Geschichte“. Lesen Sie jetzt „Linke: 8. Mai 2025 soll einmalig Feiertag sein“.;"Z+ (abopflichtiger Inhalt);
        
    
Geschichte";News, Geschichte, Christian Schaft, Erfurt, Europa, Die Linke, Alternative für Deutschland, SPD, Tag der Befreiung, Feiertag, Nationalsozialismus;2024-11-14T17:53:49+01:00;2024-11-14T17:53:49+01:00;;dpa Thüringen;false
d3be32ac69427c06b438de7d1221ff96bdc93c14984bac9b060e5d7d51e6a9bf;Expertin: Robben-Todesserie seit Reusen-Entfernung vorbei;https://www.zeit.de/news/2024-11/14/expertin-robben-todesserie-seit-reusen-entfernung-vorbei;Hier finden Sie Informationen zu dem Thema „Tote Meeressäuger“. Lesen Sie jetzt „Expertin: Robben-Todesserie seit Reusen-Entfernung vorbei“.;"Z+ (abopflichtiger Inhalt);
        
    
Tote Meeressäuger";News, Tote Meeressäuger, Judith Denker, Vorpommern, Stralsund, Deutsches Meeresmuseum, Deutsche Presse-Agentur, Meeressäuger, Todesserie, Kegelrobbe, Totfund, Fischerreuse;2024-11-14T17:51:51+01:00;2024-11-14T17:51:51+01:00;;dpa;false
c406483675dfaf9d2909f9e45966a1eb715a021f89fd0c56e0ca719480262fec;Senior wird nach Brand in Wohnhaus tot entdeckt;https://www.zeit.de/news/2024-11/14/senior-wird-nach-brand-in-wohnhaus-tot-entdeckt;Hier finden Sie Informationen zu dem Thema „Ursache unklar“. Lesen Sie jetzt „Senior wird nach Brand in Wohnhaus tot entdeckt“.;"Z+ (abopflichtiger Inhalt);
        
    
Ursache unklar";News, Ursache unklar, Unterfranken, Polizei;2024-11-14T17:50:18+01:00;2024-11-14T17:50:18+01:00;;dpa Bayern;false
40640e17c4f54788c07234d2af74594329609a67122dc205d59f93bff1dcb152;Land will Künstliche Intelligenz für die Verwaltung;https://www.zeit.de/news/2024-11/14/land-will-kuenstliche-intelligenz-fuer-die-verwaltung;Hier finden Sie Informationen zu dem Thema „KI“. Lesen Sie jetzt „Land will Künstliche Intelligenz für die Verwaltung“.;"Z+ (abopflichtiger Inhalt);
        
    
KI";News, KI, Christian Pegel, Schwerin, Baden-Württemberg, künstliche Intelligenz;2024-11-14T17:47:53+01:00;2024-11-14T17:47:53+01:00;;dpa Mecklenburg-Vorpommern;false
5a899175de0ed513e4093f9921b4b7fb2ac10bfa6dd01df81940d16bb0a9bed9;Richteraffäre: Beurteilung wird aufgehoben;https://www.zeit.de/news/2024-11/14/richteraffaere-beurteilung-wird-aufgehoben;Hier finden Sie Informationen zu dem Thema „NRW-Justiz“. Lesen Sie jetzt „Richteraffäre: Beurteilung wird aufgehoben“.;"Z+ (abopflichtiger Inhalt);
        
    
NRW-Justiz";News, NRW-Justiz, NRW, Richteraffäre, Beurteilung, Oberverwaltungsgericht;2024-11-14T17:45:42+01:00;2024-11-14T17:45:42+01:00;;dpa Nordrhein-Westfalen;false
04d159be8256eb5c40bc006842a50a103c57cde9e9f8f5aeb80a44c0021a532c;Drei Brandenburger Abgeordnete für Antrag zu AfD-Verbot;https://www.zeit.de/news/2024-11/14/drei-brandenburger-abgeordnete-fuer-antrag-zu-afd-verbot;Hier finden Sie Informationen zu dem Thema „Parteienverbot“. Lesen Sie jetzt „Drei Brandenburger Abgeordnete für Antrag zu AfD-Verbot“.;"Z+ (abopflichtiger Inhalt);
        
    
Parteienverbot";News, Parteienverbot, Maja Wallstein, Michael Kellner, Anke Domscheit-Berg, Brandenburg, Bundesverfassungsgericht, Alternative für Deutschland, SPD, Deutscher Bundestag, Parteienverbot, Verbotsantrag;2024-11-14T17:34:46+01:00;2024-11-14T17:34:46+01:00;;dpa Berlin/Brandenburg;false
a897bd0f909b80449385ac4137aea9fc73eeacc3d54efd4e6b4d2233f6e17bec;Gegen illegales Parken vor Airport: Standstreifen gesperrt;https://www.zeit.de/news/2024-11/14/gegen-illegales-parken-vor-airport-standstreifen-gesperrt;Hier finden Sie Informationen zu dem Thema „In Düsseldorf“. Lesen Sie jetzt „Gegen illegales Parken vor Airport: Standstreifen gesperrt“.;"Z+ (abopflichtiger Inhalt);
        
    
In Düsseldorf";News, In Düsseldorf, Düsseldorf, Flughafen Düsseldorf International, Rheinische Post, Standstreifen, Warnbake, Auto;2024-11-14T17:33:54+01:00;2024-11-14T17:33:54+01:00;;dpa Nordrhein-Westfalen;false
077803298b43a0d08f30f0252f9da90dfbb915e43f2d832a54924be4e54ab9d7;Verletzt: Ekitiké kehrt vorzeitig zur Eintracht zurück;https://www.zeit.de/news/2024-11/14/verletzt-ekitik-kehrt-vorzeitig-zur-eintracht-zurueck;Hier finden Sie Informationen zu dem Thema „Fußball“. Lesen Sie jetzt „Verletzt: Ekitiké kehrt vorzeitig zur Eintracht zurück“.;"Z+ (abopflichtiger Inhalt);
        
    
Fußball";News, Fußball, Fußball;2024-11-14T17:31:52+01:00;2024-11-14T17:31:52+01:00;;dpa Hessen;false
d3420b5263ec14ed2275ec7ad25cbb48d3bb1bb957dd9a60ecb469652ce9a532;KI und digitale Transformation: Steinmeier besucht Südwesten;https://www.zeit.de/news/2024-11/14/ki-und-digitale-transformation-steinmeier-besucht-suedwesten;Hier finden Sie Informationen zu dem Thema „Digitalisierung“. Lesen Sie jetzt „KI und digitale Transformation: Steinmeier besucht Südwesten“.;"Z+ (abopflichtiger Inhalt);
        
    
Digitalisierung";News, Digitalisierung, Frank-Walter Steinmeier, Tübingen, Baden-Württemberg, Robert Bosch, Südwesten, Transformation, Digitalisierung, Finale, künstliche Intelligenz;2024-11-14T17:30:40+01:00;2024-11-14T17:30:40+01:00;;dpa Baden-Württemberg;false
2ab9e5a99685ac5d8ceea45854c4edaaf0996bde8b887f23d2befc9b1a281425;Transporter in Mannheimer Innenstadt ausgebrannt;https://www.zeit.de/news/2024-11/14/transporter-in-mannheimer-innenstadt-vollstaendig-ausgebrannt;Hier finden Sie Informationen zu dem Thema „Feuer“. Lesen Sie jetzt „Transporter in Mannheimer Innenstadt ausgebrannt“.;"Z+ (abopflichtiger Inhalt);
        
    
Feuer";News, Feuer, Polizei, Transporter, Innenstadt;2024-11-14T17:26:54+01:00;2024-11-14T17:26:54+01:00;;dpa Baden-Württemberg;false
f780508203f81d7f5628c6f3be1251d42916a38e6cffe757cca09000835862b4;Lungenkrebs-Gefahr: Strahlenschützer warnen vor Radon;https://www.zeit.de/news/2024-11/14/lungenkrebs-gefahr-strahlenschuetzer-warnen-vor-radon;Hier finden Sie Informationen zu dem Thema „Gesundheit“. Lesen Sie jetzt „Lungenkrebs-Gefahr: Strahlenschützer warnen vor Radon“.;"Z+ (abopflichtiger Inhalt);
        
    
Gesundheit";News, Gesundheit, Inge Paulini, Salzgitter, Bundesamt für Strahlenschutz, Lungenkrebsverlauf;2024-11-14T17:26:16+01:00;2024-11-14T17:26:16+01:00;;dpa;false
433bd79e653971f4eaa14cc87ce214d53a07e4af8cc7a17480883a577ea230dd;Rüstungsproduzent Diehl setzt langfristig auf Troisdorf;https://www.zeit.de/news/2024-11/14/ruestungsproduzent-diehl-setzt-langfristig-auf-troisdorf;Hier finden Sie Informationen zu dem Thema „Munitionsproduktion“. Lesen Sie jetzt „Rüstungsproduzent Diehl setzt langfristig auf Troisdorf“.;"Z+ (abopflichtiger Inhalt);
        
    
Munitionsproduktion";News, Munitionsproduktion, Überlingen, Troisdorf, Bonn, Dynamit Nobel, Munitionsproduktion, Rüstungskonzern, Krieg in der Ukraine;2024-11-14T17:21:17+01:00;2024-11-14T17:21:17+01:00;;dpa Baden-Württemberg;false
d8cba36355e6bf1871c0fbfe65efe1493f0c5fb32054554532c231ac668edb5e;Çağla Ilk wird Intendantin am Maxim Gorki Theater in Berlin;https://www.zeit.de/news/2024-11/14/a-la-ilk-wird-intendantin-am-maxim-gorki-theater-in-berlin;Hier finden Sie Informationen zu dem Thema „Personalien“. Lesen Sie jetzt „Çağla Ilk wird Intendantin am Maxim Gorki Theater in Berlin“.;"Z+ (abopflichtiger Inhalt);
        
    
Personalien";News, Personalien, Çağla Ilk, Maxim Gorki, Shermin Langhoff, Berlin, Venedig, Maxim Gorki Theater, Biennale;2024-11-14T17:15:25+01:00;2024-11-14T17:15:25+01:00;;dpa;false
8f4a28c80c800b724c50df0bccec245faa289a3f0eb3dddfb194d152e5f2bff3;Matthias Miersch will SPD-Parteitag am 11. Januar ansetzen;https://www.zeit.de/politik/deutschland/2024-11/ampel-aus-regierungskrise-ampelkoalition-liveblog;Matthias Miersch schlägt einen Termin für den SPD-Parteitag vor. Parteichefin Saskia Esken will an Olaf Scholz als Kanzlerkandidaten festhalten. Das Liveblog;Neuwahl in Deutschland;Politik, Neuwahl in Deutschland, Olaf Scholz, FDP, SPD, Deutscher Bundestag, Bundestagswahlkampf, Ampelkoalition, Robert Habeck, Christian Lindner, Bundesregierung, Bundeskanzleramt;2024-11-15T07:27:25+00:00;2024-11-15T07:27:25+00:00;Jona SpreterEric VoigtAnja Keinath;;false
e8ce9979577c98cf5697c846b5caaec15968711224510e5647e533fcba50f751;FC Bayern absolviert Winter-Vorbereitung in München;https://www.zeit.de/news/2024-11/14/fc-bayern-absolviert-winter-vorbereitung-in-muenchen;Hier finden Sie Informationen zu dem Thema „Bundesliga“. Lesen Sie jetzt „FC Bayern absolviert Winter-Vorbereitung in München“.;"Z+ (abopflichtiger Inhalt);
        
    
Bundesliga";News, Bundesliga, München, FC Bayern München, Fußball-Bundesliga, Bundesliga, Trainingslager, Winter;2024-11-14T17:07:22+01:00;2024-11-14T17:07:22+01:00;;dpa Bayern;false
271c2ff422b37eb306fb319a9c61776904645bf99a0f44b7b333d3ab44994ccf;Tarifabschluss Metall und Elektro gilt jetzt auch in NRW;https://www.zeit.de/news/2024-11/14/tarifabschluss-metall-und-elektro-gilt-jetzt-auch-in-nrw;Hier finden Sie Informationen zu dem Thema „Mehr Lohn“. Lesen Sie jetzt „Tarifabschluss Metall und Elektro gilt jetzt auch in NRW“.;"Z+ (abopflichtiger Inhalt);
        
    
Mehr Lohn";News, Mehr Lohn, NRW, Hamburg, Nordrhein-Westfalen, Düsseldorf, IG Metall, Tarifabschluss, Elektroindustrie, Metall, Tarifkonflikt;2024-11-14T17:06:21+01:00;2024-11-14T17:06:21+01:00;;dpa Nordrhein-Westfalen;false
5d77ed643e31d39cedf035f2384cea669ee4676d525353bc66e7c3fb0928bb8a;Satiremagazin kauft Portal von US-Verschwörungstheoretiker Alex Jones;https://www.zeit.de/politik/ausland/2024-11/infowars-an-satiremagazin-verkauft;Weil der US-Verschwörungstheoretiker Alex Jones pleite ist, wurde sein rechtes Portal Infowars zwangsversteigert. Käufer ist ausgerechnet ein Satiremagazin.;"Z+ (abopflichtiger Inhalt);
        
    
Infowars";Politik, Infowars, Journalismus, Satire, USA, Medienbranche, Rechtspopulismus, Insolvenz;2024-11-14T17:05:47+01:00;2024-11-14T17:05:47+01:00;jko;ZEIT ONLINE,        AP,        							jko;false
62a6878b9dcd6ed91d0a03a0c1fdc6f7b9adaf64aeaf0cbe07671e2466cf1430;Niedersachsen stellt sich auf häufigere Hochwasser ein;https://www.zeit.de/news/2024-11/14/umweltminister-beraet-ueber-lehren-aus-weihnachts-hochwasser;Hier finden Sie Informationen zu dem Thema „Katastrophenschutz“. Lesen Sie jetzt „Niedersachsen stellt sich auf häufigere Hochwasser ein“.;"Z+ (abopflichtiger Inhalt);
        
    
Katastrophenschutz";News, Katastrophenschutz, Christian Meyer, Niedersachsen, Lehre, Hochwassergipfel, Hochwasser, Hochwasserschutz;2024-11-14T17:05:40+01:00;2024-11-14T17:05:40+01:00;;dpa Niedersachsen;false
42d1483af1f4db1d7e88f60eec1d5e1fb0c6dcd98bd56efb5da315a8917790fe;"Forscher: Einzelgänger-Delfin ""Delle"" führt viele Gespräche";https://www.zeit.de/news/2024-11/14/forscher-einzelgaenger-delfin-delle-fuehrt-viele-gespraeche;"Hier finden Sie Informationen zu dem Thema „Ostsee“. Lesen Sie jetzt „Forscher: Einzelgänger-Delfin ""Delle"" führt viele Gespräche“.";"Z+ (abopflichtiger Inhalt);
        
    
Ostsee";News, Ostsee, Ulrich Karlowski, Ostsee, Dänemark, Lübecker Bucht, Facebook, Solitärdelfin, Küstenbewohner;2024-11-14T17:01:24+01:00;2024-11-14T17:01:24+01:00;;dpa Hamburg/Schleswig-Holstein;false
b39fe6da49c7063ca8adc837a1f6e0678962eb5254ecb2761c2a727d0c512ec5;"""Die Inflation ist ein gieriges Biest""";https://www.zeit.de/2024/48/joachim-nagel-bundesbankchef-wirtschaftskrise-inflation-ampel-aus;Mitten in der Wirtschaftskrise zerbricht die Ampel, die USA wählen mit Trump einen Protektionisten. Bundesbankchef Joachim Nagel zur Frage, wie schlimm es wird. ;"Z+ (abopflichtiger Inhalt);
        
    
Joachim Nagel";Wirtschaft, Joachim Nagel, Deutsche Bundesbank, Wirtschaftskrise, USA, Ampel-Aus, Inflation, Bundesregierung, Joachim Nagel;2024-11-14T17:00:14+01:00;2024-11-14T17:00:14+01:00;Roman PletterDr. Kolja Rudzio;Aus der        ZEIT Nr. 48/2024;false
e8d2062889d44286ef78393b477459bc881f30fa230ad13b6a8cc3550c8e5bb1;Wilderer töten in Ostsachsen mehrere Schwäne;https://www.zeit.de/news/2024-11/14/wilderer-toeten-in-ostsachsen-mehrere-schwaene;Hier finden Sie Informationen zu dem Thema „Kriminalität“. Lesen Sie jetzt „Wilderer töten in Ostsachsen mehrere Schwäne“.;"Z+ (abopflichtiger Inhalt);
        
    
Kriminalität";News, Kriminalität, Ostsachsen, Schwan, Kriminalität;2024-11-14T16:58:36+01:00;2024-11-14T16:58:36+01:00;;dpa Sachsen;false
6dc8623a082271837129fb5e8a4d4139dd791e31afc68fe97e584f00d321a13c;Stadtwerke legen Maßnahmen für Klimaneutralität fest;https://www.zeit.de/news/2024-11/14/stadtwerke-legen-massnahmen-fuer-klimaneutralitaet-fest;Hier finden Sie Informationen zu dem Thema „Dekarbonisierung“. Lesen Sie jetzt „Stadtwerke legen Maßnahmen für Klimaneutralität fest“.;"Z+ (abopflichtiger Inhalt);
        
    
Dekarbonisierung";News, Dekarbonisierung, Klimaneutralität, Stadtwerke, Energieministerium;2024-11-14T16:56:32+01:00;2024-11-14T16:56:32+01:00;;dpa Hamburg/Schleswig-Holstein;false
f48816004bb9ac0b8a789172894d8b205d27e2774c5b7fd020673f94d2e794e4;Daten zu Treibhausgas-Ausstoß in MV mehrere Jahre alt;https://www.zeit.de/news/2024-11/14/daten-zu-treibhausgas-ausstoss-in-mv-mehrere-jahre-alt;Hier finden Sie Informationen zu dem Thema „Klimaschutz“. Lesen Sie jetzt „Daten zu Treibhausgas-Ausstoß in MV mehrere Jahre alt“.;"Z+ (abopflichtiger Inhalt);
        
    
Klimaschutz";News, Klimaschutz, Till Backhaus, Mecklenburg-Vorpommern, SPD, Bündnis 90/Die Grünen, Klimaschutz;2024-11-14T16:56:08+01:00;2024-11-14T16:56:08+01:00;;dpa Mecklenburg-Vorpommern;false
7d409682cca04ea82c9f38c558ce7cccc7bfbfd5c4fbc8ddbb0019b6824e1e29;Herdenschutz vor Wölfen soll auf ganz NRW ausgeweitet werden;https://www.zeit.de/news/2024-11/14/herdenschutz-vor-woelfen-soll-auf-ganz-nrw-ausgeweitet-werden;Hier finden Sie Informationen zu dem Thema „Tierschutz“. Lesen Sie jetzt „Herdenschutz vor Wölfen soll auf ganz NRW ausgeweitet werden“.;"Z+ (abopflichtiger Inhalt);
        
    
Tierschutz";News, Tierschutz, Oliver Krischer, NRW, FDP, CDU, EU, Herdenschutz, Tierschutz, Regierungsfraktion;2024-11-14T16:54:42+01:00;2024-11-14T16:54:42+01:00;;dpa Nordrhein-Westfalen;false
5a08119cd215788470c93e2b7f026ee508aa83581b36a63c1e36b57958205c65;Mietstreit gipfelt in Schüssen - Zwei Tote in Esslingen;https://www.zeit.de/news/2024-11/14/zwei-tote-und-ein-verletzter-in-esslingen;Hier finden Sie Informationen zu dem Thema „Großeinsatz“. Lesen Sie jetzt „Mietstreit gipfelt in Schüssen - Zwei Tote in Esslingen“.;"Z+ (abopflichtiger Inhalt);
        
    
Großeinsatz";News, Großeinsatz, Esslingen, Polizei, Polizeieinsatz;2024-11-14T16:52:09+01:00;2024-11-14T16:52:09+01:00;;dpa;false
0e55b27e823823554cf75f0c9ed1f0fbd1f907de41d721d9d8dc71a325469dc3;Sicherheitspaket soll kommendes Jahr 93,1 Millionen kosten;https://www.zeit.de/news/2024-11/14/sicherheitspaket-soll-kommendes-jahr-91-5-millionen-kosten;Hier finden Sie Informationen zu dem Thema „Terrorismus“. Lesen Sie jetzt „Sicherheitspaket soll kommendes Jahr 93,1 Millionen kosten“.;"Z+ (abopflichtiger Inhalt);
        
    
Terrorismus";News, Terrorismus, Herbert Reul, Hendrik Wüst, NRW, Solingen, CDU, Sicherheitspaket, Terrorismus, Terroranschlag;2024-11-14T16:49:36+01:00;2024-11-14T16:49:36+01:00;;dpa Nordrhein-Westfalen;false
af788469e2e759ddc03450af0457192f5cb8593dd821a03dd1d2b44bb9c26bea;Unter Trump-Musk-Vance wird KI gefährlicher;https://www.zeit.de/digital/2024-11/donald-trump-jd-vance-elon-musk-ki-newsletter;J. D. Vance und Elon Musk halten künstliche Intelligenz für die wichtigste Technologie unserer Zeit. Warnungen vor Risiken werden mit ihrem Einfluss auf Trump verhallen. ;"Z+ (abopflichtiger Inhalt);
        
    
Donald Trump und KI";Digital, Donald Trump und KI, künstliche Intelligenz, Donald Trump, James David Vance, Elon Musk, USA, ChatGPT;2024-11-14T16:49:24+01:00;2024-11-14T16:49:24+01:00;Jakob  von Lindern;;false
aa5e2b4042d49f5e2cca5281ef2f6a48823fcf296c5b7b79fcc2abeae5a4b2f9;12-Jähriger soll 13-Jährigen mit Messer verletzt haben;https://www.zeit.de/news/2024-11/14/12-jaehriger-soll-13-jaehrigen-mit-messer-verletzt-haben;Hier finden Sie Informationen zu dem Thema „Kriminalität“. Lesen Sie jetzt „12-Jähriger soll 13-Jährigen mit Messer verletzt haben“.;"Z+ (abopflichtiger Inhalt);
        
    
Kriminalität";News, Kriminalität, Wetzlar, Polizei, Kriminalität;2024-11-14T16:49:20+01:00;2024-11-14T16:49:20+01:00;;dpa Hessen;false
4b08ade2b4e784385a19a58e83c0b3bd87bca2baeb066c29e28b2a54c3d83f92;Mutmaßlicher Callcenter-Betrüger ausgeliefert;https://www.zeit.de/news/2024-11/14/mutmasslicher-callcenter-betrueger-ausgeliefert;Hier finden Sie Informationen zu dem Thema „Netzwerk zerschlagen“. Lesen Sie jetzt „Mutmaßlicher Callcenter-Betrüger ausgeliefert“.;"Z+ (abopflichtiger Inhalt);
        
    
Netzwerk zerschlagen";News, Netzwerk zerschlagen, Kosovo, Nordmazedonien, Netzwerk, Landeskriminalamt, Callcenter, Geld;2024-11-14T16:48:14+01:00;2024-11-14T16:48:14+01:00;;dpa Baden-Württemberg;false
61ea59bafd7d7ae364426ec0355e4e7b843d7c3f13c30cfd9f879b2211839a32;Schwarz Gruppe kooperiert umfassend mit Google;https://www.zeit.de/news/2024-11/14/schwarz-gruppe-kooperiert-umfassend-mit-google;Hier finden Sie Informationen zu dem Thema „Cloud-Computing“. Lesen Sie jetzt „Schwarz Gruppe kooperiert umfassend mit Google“.;"Z+ (abopflichtiger Inhalt);
        
    
Cloud-Computing";News, Cloud-Computing, Schwarz, Lidl, Kaufland, Amazon, Google Inc., Rechenzentrum, Einzelhandelskette, Beziehung;2024-11-14T16:43:52+01:00;2024-11-14T16:43:52+01:00;;dpa;false
a889ed97bc0618a63cae01c17fcd1fa7948f3ccf1ab9eda412067b69912e35ff;Verband: Exponate in Museen oft illegal in DDR enteignet;https://www.zeit.de/news/2024-11/14/verband-exponate-in-museen-oft-illegal-in-ddr-enteignet;Hier finden Sie Informationen zu dem Thema „Kultur“. Lesen Sie jetzt „Verband: Exponate in Museen oft illegal in DDR enteignet“.;"Z+ (abopflichtiger Inhalt);
        
    
Kultur";News, Kultur, DDR, Brandenburg, Exponat;2024-11-14T16:43:21+01:00;2024-11-14T16:43:21+01:00;;dpa Berlin/Brandenburg;false
d40ff840875a882ceb733bb72a7838b252e4df53d48e6ca1a1f826a740f98db0;Streit eskaliert: Zwei Zähne weg und Tür mit Säge beschädigt;https://www.zeit.de/news/2024-11/14/streit-eskaliert-zwei-zaehne-weg-und-tuer-mit-saege-beschaedigt;Hier finden Sie Informationen zu dem Thema „Nachbarschaftsstreit“. Lesen Sie jetzt „Streit eskaliert: Zwei Zähne weg und Tür mit Säge beschädigt“.;"Z+ (abopflichtiger Inhalt);
        
    
Nachbarschaftsstreit";News, Nachbarschaftsstreit, Gummersbach, Polizei, Nachbarschaftsstreit, Zahn;2024-11-14T16:43:17+01:00;2024-11-14T16:43:17+01:00;;dpa Nordrhein-Westfalen;false
84ddf93d5c48c19fc783ca07491fd8b0e93feef2340f1e165c1d29e422828d04;Frostschäden - EU-Krisenhilfe Obst- und Weinbau startet;https://www.zeit.de/news/2024-11/14/frostschaeden-eu-krisenhilfe-obst-und-weinbau-startet;Hier finden Sie Informationen zu dem Thema „Ernteausfälle“. Lesen Sie jetzt „Frostschäden - EU-Krisenhilfe Obst- und Weinbau startet“.;"Z+ (abopflichtiger Inhalt);
        
    
Ernteausfälle";News, Ernteausfälle, EU, Frostschaden, Weinbau, Ernteausfall;2024-11-14T16:39:04+01:00;2024-11-14T16:39:04+01:00;;dpa Sachsen;false
c708b7f64ae56b8dc32507ab0ed5f47c507c61b0ebe3232dc29763c8d9e8f403;6:1 im Testspiel: Dynamo Dresden souverän gegen Erfurt;https://www.zeit.de/news/2024-11/14/6-1-im-testspiel-dynamo-dresden-souveraen-gegen-erfurt;Hier finden Sie Informationen zu dem Thema „Fußball-Testspiel“. Lesen Sie jetzt „6:1 im Testspiel: Dynamo Dresden souverän gegen Erfurt“.;"Z+ (abopflichtiger Inhalt);
        
    
Fußball-Testspiel";News, Fußball-Testspiel, Erfurt, Dynamo Dresden, FC Rot-Weiß Erfurt, Testspiel, Regionalligist;2024-11-14T16:38:01+01:00;2024-11-14T16:38:01+01:00;;dpa Sachsen;false
e08f675e0ec89310d6e340e1a0639763975ab0bc8c177af2fc45a0135c943808;Linkin Park spielen vier Konzerte in Deutschland;https://www.zeit.de/news/2024-11/14/linkin-park-spielen-vier-konzerte-in-deutschland;Hier finden Sie Informationen zu dem Thema „Bühnen-Comeback“. Lesen Sie jetzt „Linkin Park spielen vier Konzerte in Deutschland“.;"Z+ (abopflichtiger Inhalt);
        
    
Bühnen-Comeback";News, Bühnen-Comeback, Hannover, Berlin, Frankfurt am Main, Düsseldorf, Linkin Park;2024-11-14T16:36:30+01:00;2024-11-14T16:36:30+01:00;;dpa;false
4dec8ac1b8549cd233e4c5dddc706f90a2b0f95e3b146b72a1aa72e5ea740cdd;Polizei fasst Verdächtigen nach mehreren Feuern in Weißensee;https://www.zeit.de/news/2024-11/14/polizei-fasst-verdaechtigen-nach-mehreren-feuern-in-weissensee;Hier finden Sie Informationen zu dem Thema „Kriminalität“. Lesen Sie jetzt „Polizei fasst Verdächtigen nach mehreren Feuern in Weißensee“.;"Z+ (abopflichtiger Inhalt);
        
    
Kriminalität";News, Kriminalität, Weißensee, Berlin-Weißensee, Polizei, Feuer, Kriminalität;2024-11-14T16:33:37+01:00;2024-11-14T16:33:37+01:00;;dpa Berlin/Brandenburg;false
