Hash;Title;Link;Description;Category;KeyWords;Published;LastUpdated;Author;Source;Paywall
926eac754690cc01641d66c7438bfb2384898988e69be2b485d6a59aef292806;16-Jähriger bei Motorradunfall schwer verletzt;https://www.zeit.de/news/2025-05/23/16-jaehriger-bei-motorradunfall-schwer-verletzt;Hier finden Sie Informationen zu dem Thema „Polizei“. Lesen Sie jetzt „16-Jähriger bei Motorradunfall schwer verletzt“.;Polizei;News, Polizei, Polizei, Motorradunfall, Unfall;2025-05-23T08:21:02+02:00;2025-05-23T08:21:02+02:00;;dpa Niedersachsen;false
7204d43fc7d939ee2ca60d5ad490c8e68e4449920e0130fc8681c0dae03ddb21;Regen in Nordrhein-Westfalen - am Freitag auch Gewitter;https://www.zeit.de/news/2025-05/23/regen-in-nordrhein-westfalen-am-freitag-auch-gewitter;Hier finden Sie Informationen zu dem Thema „Wetterbericht“. Lesen Sie jetzt „Regen in Nordrhein-Westfalen - am Freitag auch Gewitter“.;Wetterbericht;News, Wetterbericht, Nordrhein-Westfalen, Gewitter, Wetterbericht;2025-05-23T08:15:49+02:00;2025-05-23T08:15:49+02:00;;dpa Nordrhein-Westfalen;false
69d25012a7fbb58e76e7734d36e4595599dd0d9d6e9ab0f2f89bd9e98c289fe9;A6 bei Mannheim nach Unfall wieder frei;https://www.zeit.de/news/2025-05/23/a6-nach-unfall-teilweise-gesperrt;Hier finden Sie Informationen zu dem Thema „Unfälle“. Lesen Sie jetzt „A6 bei Mannheim nach Unfall wieder frei“.;Unfälle;News, Unfälle, Polizei, Unfall, Auto;2025-05-23T08:08:48+02:00;2025-05-23T08:08:48+02:00;;dpa Baden-Württemberg;false
437f85077f3928a5bf0451e292cb6277a5c6224f4b1b8e09576e94e5f7d8494c;Wirtschaft im ersten Quartal stärker gewachsen: 0,4 Prozent;https://www.zeit.de/news/2025-05/23/wirtschaft-im-ersten-quartal-staerker-gewachsen-0-4-prozent;Hier finden Sie Informationen zu dem Thema „Konjunktur“. Lesen Sie jetzt „Wirtschaft im ersten Quartal stärker gewachsen: 0,4 Prozent“.;Konjunktur;News, Konjunktur, News;2025-05-23T08:03:36+02:00;2025-05-23T08:03:36+02:00;;dpa;false
de53cec7581a712cf9b46d56eb38f3a525882dc5ea18f4de57622ec9cacdc9c1;300.000 Euro Schaden bei Brand in Merseburg;https://www.zeit.de/news/2025-05/23/300-000-euro-schaden-bei-brand-in-merseburg;Hier finden Sie Informationen zu dem Thema „Brände“. Lesen Sie jetzt „300.000 Euro Schaden bei Brand in Merseburg“.;Brände;News, Brände, Merseburg, Polizei, Brand;2025-05-23T07:59:41+02:00;2025-05-23T07:59:41+02:00;;dpa Sachsen;false
33bc2f26b8a1f2b8264caec52349bc65364ef1c81536d5fdaef26cd3e5dd32c0;Jugendliche liefern sich Verfolgungsfahrt mit Polizei;https://www.zeit.de/news/2025-05/23/jugendliche-liefern-sich-verfolgungsfahrt-mit-polizei;Hier finden Sie Informationen zu dem Thema „Einsatz auf der A1“. Lesen Sie jetzt „Jugendliche liefern sich Verfolgungsfahrt mit Polizei“.;Einsatz auf der A1;News, Einsatz auf der A1, Mann, Wuppertal, Dortmund, Polizei, Verfolgungsfahrt, Mietwagen;2025-05-23T07:46:05+02:00;2025-05-23T07:46:05+02:00;;dpa Nordrhein-Westfalen;false
5ab3ec2bb27d1142dd4ed48b41906c9ae4069b54925da1bc85a41af8580a2a24;Gefängnis wegen der VW-Dieselaffäre? - Urteil erwartet;https://www.zeit.de/news/2025-05/23/gefaengnis-wegen-der-vw-dieselaffaere-urteil-erwartet;Hier finden Sie Informationen zu dem Thema „Betrugsprozess“. Lesen Sie jetzt „Gefängnis wegen der VW-Dieselaffäre? - Urteil erwartet“.;Betrugsprozess;News, Betrugsprozess, Martin Winterkorn, Braunschweig, USA, Volkswagen, VW, Staatsanwaltschaft, Betrugsprozess, Gefängnis, Betrug, Kamera;2025-05-23T07:42:19+02:00;2025-05-23T07:42:19+02:00;;dpa;false
89ec7cbdead247b7bb6c253d208d24ca7f255518054083afddebd7bc16d812b3;Ein Zweitschlag auf San Francisco. Danach eingelegte Gurken;https://www.zeit.de/politik/ausland/2025-05/stalin-kult-russland-moskau-denkmal-5vor8;Ein Mann ist Kult in Putins Russland: Stalin. Im Moskauer Museumsbunker wird ihm gehuldigt. Hier simuliert man mit den Besuchern einen Angriff auf die USA.;Stalin-Kult in Russland;Politik, Stalin-Kult in Russland, Russland, Moskau, Wladimir Putin, Sowjetunion, Josef Stalin;2025-05-23T07:40:00+02:00;2025-05-23T07:40:00+02:00;Michael Thumann;;false
fabdc69c663746c86e3485b89dcdbfca7ce2f34d07b3dce82f1fe75f74771524;Die Wahrheit über den konstanten Cashflow;https://www.zeit.de/geld/2025-05/passives-einkommen-social-media-coaches-geldverbesserer;Wie schön das klingt: passives Einkommen. Nix tun und dabei verdienen. Wer nebenbei 2.000 Euro im Monat einnehmen will, braucht Kapital – oder muss sehr kreativ sein.;"Z+ (abopflichtiger Inhalt);
        
    Passives Einkommen";Geld, Passives Einkommen, Geldanlage, Reichtum, Vermögen, Berufswahl, Soziale Medien, Einkommen;2025-05-23T07:33:40+02:00;2025-05-23T07:33:40+02:00;Thomas KehlLaura Städtler;;false
8a5d70f0c64f5ae8e1ab1c87e76c0da9f582004ce31dccf2f516ead3e1216bbb;Mehrere Brände in Bückeburg - Polizei vermutet Brandstiftung;https://www.zeit.de/news/2025-05/23/mehrere-braende-in-bueckeburg-polizei-vermutet-brandstiftung;Hier finden Sie Informationen zu dem Thema „Kriminalität“. Lesen Sie jetzt „Mehrere Brände in Bückeburg - Polizei vermutet Brandstiftung“.;Kriminalität;News, Kriminalität, Bückeburg, Landkreis Schaumburg, Polizei, Brandstiftung, Kriminalität, Brand;2025-05-23T07:28:53+02:00;2025-05-23T07:28:53+02:00;;dpa Niedersachsen;false
7966f324ad1d85607beb9d19b8542d461eee2a663af136ccdcf1726cc4edf5fb;Brand in Mehrfamilienhaus - sechs Menschen verletzt;https://www.zeit.de/news/2025-05/23/haus-nach-brand-in-offenbach-unbewohnbar;Hier finden Sie Informationen zu dem Thema „250.000 Euro Sachschaden“. Lesen Sie jetzt „Brand in Mehrfamilienhaus - sechs Menschen verletzt“.;250.000 Euro Sachschaden;News, 250.000 Euro Sachschaden, Offenbach, Feuerwehr, Brand;2025-05-23T07:17:40+02:00;2025-05-23T07:17:40+02:00;;dpa Hessen;false
5e91e4d6fb96970fcdfc326617927cd1fa60fa704f87551b740971c496decec4;Mindestens vier Tote bei schweren Überschwemmungen in Australien;https://www.zeit.de/gesellschaft/zeitgeschehen/2025-05/australien-hochwasser-ueberschwemmungen-tote-ostkueste;Tot aufgefunden in Häusern und Autos: Im Osten Australiens sind bei Überschwemmungen mindestens vier Menschen gestorben. Tausende Rettungskräfte machen sich bereit.;Hochwasser;Gesellschaft, Hochwasser, Australien, Überschwemmung, Unwetter, Naturkatastrophe;2025-05-23T07:16:27+02:00;2025-05-23T07:16:27+02:00;sko;ZEIT ONLINE,        AFP,        dpa,        							sko;false
262d42b78f21ad832c3c65fa3bf672bfc7c682a81b24f9f9507491de087455d3;Schauer und Gewitter in Sachsen erwartet;https://www.zeit.de/news/2025-05/23/schauer-und-gewitter-in-sachsen-erwartet;Hier finden Sie Informationen zu dem Thema „Wetter“. Lesen Sie jetzt „Schauer und Gewitter in Sachsen erwartet“.;Wetter;News, Wetter, Sachsen, DWD, Gewitter, Wetter;2025-05-23T07:11:46+02:00;2025-05-23T07:11:46+02:00;;dpa Sachsen;false
70526d39dc021ce7ef79a2ef25f76c0fba29d8f3c513f0ac604c712e8dd384db;Ungemütliches Wetter in Thüringen erwartet;https://www.zeit.de/news/2025-05/23/ungemuetliches-wetter-in-thueringen-erwartet;Hier finden Sie Informationen zu dem Thema „Wetter“. Lesen Sie jetzt „Ungemütliches Wetter in Thüringen erwartet“.;Wetter;News, Wetter, Thüringen, Wetter;2025-05-23T07:09:43+02:00;2025-05-23T07:09:43+02:00;;dpa Thüringen;false
bc5387dfd88913a525297e2822ec303d33bd31c88bbb7009c8eb32b200e1a117;Gewitter und Schauer in Sachsen-Anhalt;https://www.zeit.de/news/2025-05/23/gewitter-und-schauer-in-sachsen-anhalt;Hier finden Sie Informationen zu dem Thema „Wetter“. Lesen Sie jetzt „Gewitter und Schauer in Sachsen-Anhalt“.;Wetter;News, Wetter, Sachsen-Anhalt, Gewitter, Wetter;2025-05-23T07:04:33+02:00;2025-05-23T07:04:33+02:00;;dpa Sachsen;false
590e37afc41a471594c54cfa6f20678ac570e300b7f031e77cd92720187ab68d;Nach Naziparolen: Sylter Club wappnet sich für Pfingstpartys;https://www.zeit.de/news/2025-05/23/nach-naziparolen-sylter-club-wappnet-sich-fuer-pfingstpartys;Hier finden Sie Informationen zu dem Thema „Sylt-Video“. Lesen Sie jetzt „Nach Naziparolen: Sylter Club wappnet sich für Pfingstpartys“.;Sylt-Video;News, Sylt-Video, Olaf Scholz, Tom Kinder, Gigi D'Agostino, Sylt, Polizei, SPD, Pfingsten, Naziparole, Party;2025-05-23T07:00:38+02:00;2025-05-23T07:00:38+02:00;;dpa Hamburg/Schleswig-Holstein;false
0c4c1efa1c4e8b987552e2da8a741d826889bf7680fab31ce0f251f70cca4977;Wildtierhilfe Lüneburger Heide: 400 Tiere, wenig Personal;https://www.zeit.de/news/2025-05/23/wildtierhilfe-lueneburger-heide-400-tiere-wenig-personal;Hier finden Sie Informationen zu dem Thema „Tierschutz“. Lesen Sie jetzt „Wildtierhilfe Lüneburger Heide: 400 Tiere, wenig Personal“.;Tierschutz;News, Tierschutz, Dorian Engelhardt, Soltau, Lüneburger Heide, Tierschutz, Rehkitz, Tiere;2025-05-23T07:00:36+02:00;2025-05-23T07:00:36+02:00;;dpa Niedersachsen;false
55f0c41d9246dcf179e41b8df6e19b1acc88e0ee6a06b3de1b1b46e03a49c229;Wechselhaftes Wetter in Bayern erwartet;https://www.zeit.de/news/2025-05/23/wechselhaftes-wetter-in-bayern-erwartet;Hier finden Sie Informationen zu dem Thema „Wetter“. Lesen Sie jetzt „Wechselhaftes Wetter in Bayern erwartet“.;Wetter;News, Wetter, Bayern, Alpen, Wetter;2025-05-23T06:57:20+02:00;2025-05-23T06:57:20+02:00;;dpa Bayern;false
66e6aa377109abc76fa3fd1af9a10c45ad1374b146853ea7e1b906fb04fbe1ff;"Deutscher Schwimm-Verband kritisiert ""Enhanced Games""";https://www.zeit.de/sport/2025-05/deutscher-schwimmverband-jan-pommer-enhanced-games-kritik;"Bei den ""Enhanced Games"" sollen kommendes Jahr gedopte Sportler gegeneinander antreten. Der DSV kritisiert das als Kommerz und spricht von ""perversen Menschenversuchen"".";Doping;Sport, Doping, schwimmen, Profisport, Doping, Menschenversuch, DSV, Jan Pommer;2025-05-23T06:43:16+02:00;2025-05-23T06:43:16+02:00;sue;ZEIT ONLINE,        SID,        							sue;false
67f4943f8cc817646bb95c3aa67dda74841ea502a2eea5c99445f534d9067399;Shootingstar Paul Mescal spricht über seine Depression;https://www.zeit.de/news/2025-05/23/shootingstar-paul-mescal-spricht-ueber-seine-depression;Hier finden Sie Informationen zu dem Thema „Filmfestpiele Cannes“. Lesen Sie jetzt „Shootingstar Paul Mescal spricht über seine Depression“.;Filmfestpiele Cannes;News, Filmfestpiele Cannes, Paul Mescal, Cannes, Brokeback Mountain, Filmdreh, Liebe, Kino;2025-05-23T06:33:35+02:00;2025-05-23T06:33:35+02:00;;dpa;false
9b9864c1eb196401c265be616be9ad771c37b00588b71a6f2fac96cab76409d8;Orgeln im Hamburger Michel bekommen Frühjahrskur;https://www.zeit.de/news/2025-05/23/orgeln-im-hamburger-michel-bekommen-fruehjahrskur;Hier finden Sie Informationen zu dem Thema „Handwerk in der Kirche“. Lesen Sie jetzt „Orgeln im Hamburger Michel bekommen Frühjahrskur“.;Handwerk in der Kirche;News, Handwerk in der Kirche, Reiner Janke, St. Michaelis, Frühjahrskur, Orgel;2025-05-23T06:30:40+02:00;2025-05-23T06:30:40+02:00;;dpa Hamburg/Schleswig-Holstein;false
c7f8badcef6aadaa29ebe4a6be55f82776dc511c9c97054777679d7ecff0fbd1;60er-Leben mit Röhrenfernseher und Wählscheibentelefon;https://www.zeit.de/news/2025-05/23/60er-leben-mit-roehrenfernseher-und-waehlscheibentelefon;Hier finden Sie Informationen zu dem Thema „Nostalgie“. Lesen Sie jetzt „60er-Leben mit Röhrenfernseher und Wählscheibentelefon“.;Nostalgie;News, Nostalgie, Kitty Steiner, Katja Ebstein, Silke Schwarz, Gelsenkirchen, Düsseldorf, The Beatles, Wählscheibentelefon, Nostalgie, Frisur, Möbel;2025-05-23T06:30:39+02:00;2025-05-23T06:30:39+02:00;;dpa;false
742e7b8472dc2f5c7ec05b6f5ab0023a011936d4c296bc103653dfdec4352def;Schauer und kurze Gewitter in Hauptstadt und Umgebung;https://www.zeit.de/news/2025-05/23/schauer-und-kurze-gewitter-in-hauptstadt-und-umgebung;Hier finden Sie Informationen zu dem Thema „Wetteraussichten“. Lesen Sie jetzt „Schauer und kurze Gewitter in Hauptstadt und Umgebung“.;Wetteraussichten;News, Wetteraussichten, Gewitter, Wetteraussicht, Böe;2025-05-23T06:25:01+02:00;2025-05-23T06:25:01+02:00;;dpa Berlin/Brandenburg;false
ace7c69acbc8a28eb5dcf58198dc5b51d6e8b1fba3d9c2ba8ab3ad4cded4c62e;Schauer und Gewitter in Niedersachsen;https://www.zeit.de/news/2025-05/23/schauer-und-gewitter-in-niedersachsen;Hier finden Sie Informationen zu dem Thema „Wetter“. Lesen Sie jetzt „Schauer und Gewitter in Niedersachsen“.;Wetter;News, Wetter, Niedersachsen, Bremen, DWD, Gewitter, Wetter;2025-05-23T06:20:47+02:00;2025-05-23T06:20:47+02:00;;dpa Niedersachsen;false
ec19aec97558a0604885cc31a51b41aa492fe81685210d2094fbff48f54b24b1;Rekordschiedsrichter Brych plant Zukunft im Fußball;https://www.zeit.de/news/2025-05/23/rekordschiedsrichter-brych-plant-zukunft-im-fussball;Hier finden Sie Informationen zu dem Thema „Deutsche Fußball-Bund“. Lesen Sie jetzt „Rekordschiedsrichter Brych plant Zukunft im Fußball“.;Deutsche Fußball-Bund;News, Deutsche Fußball-Bund, Felix Brych, Deutscher Fußball-Bund, Deutsche Presse-Agentur, Bundesliga, Fußball;2025-05-23T06:06:36+02:00;2025-05-23T06:06:36+02:00;;dpa Bayern;false
3b5669cb3c52cf761832efcef5617b0cb93237009068c5d73a089ac44d023267;Brinkmann freut sich auf Pokal-Party und glaubt an Arminia;https://www.zeit.de/news/2025-05/23/brinkmann-freut-sich-auf-pokal-party-und-glaubt-an-arminia;Hier finden Sie Informationen zu dem Thema „DFB-Pokalfinale“. Lesen Sie jetzt „Brinkmann freut sich auf Pokal-Party und glaubt an Arminia“.;DFB-Pokalfinale;News, DFB-Pokalfinale, Ansgar Brinkmann, Berlin, Bielefeld, Arminia Bielefeld, Deutscher Fußball-Bund, Deutsche Presse-Agentur, Party;2025-05-23T06:03:35+02:00;2025-05-23T06:03:35+02:00;;dpa Baden-Württemberg;false
a258ddaac1229e540ba23cda6b71fa24726f5b935823fd75ce40978be8cf47b5;Sarah Connor singt über Hass im Netz und offene Beziehungen;https://www.zeit.de/news/2025-05/23/sarah-connor-singt-ueber-hass-im-netz-und-offene-beziehungen;Hier finden Sie Informationen zu dem Thema „Popmusik“. Lesen Sie jetzt „Sarah Connor singt über Hass im Netz und offene Beziehungen“.;Popmusik;News, Popmusik, Sarah Connor, Sängerin, Großbritannien, Popmusik;2025-05-23T06:01:35+02:00;2025-05-23T06:01:35+02:00;;dpa;false
18b45e7472076f3252b3ddd744f587478d06f4875e3fe78e7adaf80a4c870504;Versteckt im Mäppchen: E-Zigaretten in Schulen;https://www.zeit.de/news/2025-05/23/versteckt-im-maeppchen-e-zigaretten-in-schulen;Hier finden Sie Informationen zu dem Thema „Niedersachsen und Bremen“. Lesen Sie jetzt „Versteckt im Mäppchen: E-Zigaretten in Schulen“.;Niedersachsen und Bremen;News, Niedersachsen und Bremen, Niedersachsen, Bremen, Weser, Mäppchen, Zigarette;2025-05-23T06:00:40+02:00;2025-05-23T06:00:40+02:00;;dpa Niedersachsen;false
c784a6cb9dde293f084ea836c1ce47ac4a7d344dc64cac7b63cf3de01a7b91fe;"Studie: Was ein ""Zollkrieg"" mit den USA bedeuten würde";https://www.zeit.de/news/2025-05/23/studie-was-ein-zollkrieg-mit-den-usa-bedeuten-wuerde;"Hier finden Sie Informationen zu dem Thema „Außenhandel“. Lesen Sie jetzt „Studie: Was ein ""Zollkrieg"" mit den USA bedeuten würde“.";Außenhandel;News, Außenhandel, Donald Trump, USA, Stiftung Familienunternehmen, EU, Zollkrieg, Außenhandel, Zollkonflikt, Pharma;2025-05-23T06:00:36+02:00;2025-05-23T06:00:36+02:00;;dpa;false
98e8f0fbefcc8a22d1ab06648a88be42dcf0649da52c0af3c59d7e61bafd735c;Exzellent! Die Millionenförderung für Uni Hamburg geht weiter;https://www.zeit.de/hamburg/2025-05/elbvertiefung-23-05-2025;Die Elbvertiefung am Freitag – mit fünf Exzellenzclustern, einem AfD-Parteiausschluss, einem Verdacht auf Femizid und der Sehnsucht nach Ruhe ;Elbvertiefung: Der tägliche Newsletter aus Hamburg;Hamburg, Elbvertiefung: Der tägliche Newsletter aus Hamburg, Katharina Fegebank, Peter Tschentscher, Olga Petersen, Andrej Rubljow, Anouar B., Deborah S., Hamburg, Berlin, St. Pauli, Bonn;2025-05-23T06:00:07+02:00;2025-05-23T06:00:07+02:00;Oskar Piegsa;;false
331f1dbccbe7000073f0c6135267786f91653f001c03d7a719c7a5814cb66361;Polizei nimmt georgischen Oppositionsführer fest;https://www.zeit.de/politik/ausland/2025-05/georgien-gericht-festnahme-oppositionsfuehrer-japaridse;In Tbilissi ist der Oppositionelle Surab Japaridse festgenommen worden. Auch sieben weitere Politiker müssen vor Gericht, weil sie nicht vor einer Kommission erschienen.;Surab Japaridse;Politik, Surab Japaridse, Georgien, Parlamentswahl, Opposition, Protest, Russland;2025-05-23T05:48:40+02:00;2025-05-23T05:48:40+02:00;sbo;ZEIT ONLINE,        AP,        AFP,        							sbo;false
aa89d70d1f4750cee664af24c9826f06acb0b646a61619b17a1bd0c42a15ea73;In Beziehungsfragen: Sarah Connor hört schwulen Freunden zu;https://www.zeit.de/news/2025-05/23/in-beziehungsfragen-sarah-connor-hoert-schwulen-freunden-zu;Hier finden Sie Informationen zu dem Thema „Partnerschaft“. Lesen Sie jetzt „In Beziehungsfragen: Sarah Connor hört schwulen Freunden zu“.;Partnerschaft;News, Partnerschaft, Sarah Connor, Beziehungsfrage, Beziehung, Liebe;2025-05-23T05:45:37+02:00;2025-05-23T05:45:37+02:00;;dpa Berlin/Brandenburg;false
f9d72325aacf8ce8bb87cf673e8f1b8a64e6b0653eadd15b52ea82290fa13dd8;"Tipps zum ""Gartenwochenende"" in Thüringen";https://www.zeit.de/news/2025-05/23/tipps-zum-gartenwochenende-in-thueringen;"Hier finden Sie Informationen zu dem Thema „Gartenzauber“. Lesen Sie jetzt „Tipps zum ""Gartenwochenende"" in Thüringen“.";Gartenzauber;News, Gartenzauber, Kerstin Beckert, Thüringen, Gartenwochenende, Gartenzauber, Starkregenereignis, Regenwasser;2025-05-23T05:30:38+02:00;2025-05-23T05:30:38+02:00;;dpa Thüringen;false
996ee0428c27d527c5f51556199e5636f2293992221455fdcd175d71970dfed7;Schweres Erdbeben auf Sumatra - aber keine Tsunami-Warnung;https://www.zeit.de/news/2025-05/23/schweres-erdbeben-auf-sumatra-aber-keine-tsunami-warnung;Hier finden Sie Informationen zu dem Thema „Pazifischer Feuerring“. Lesen Sie jetzt „Schweres Erdbeben auf Sumatra - aber keine Tsunami-Warnung“.;Pazifischer Feuerring;News, Pazifischer Feuerring, Sumatra, Bengkulu, Tsunami, Feuerring, Geophysik, Erdbeben;2025-05-23T05:27:17+02:00;2025-05-23T05:27:17+02:00;;dpa;false
61ef9ceb96fd00f96b15920acce71ae0fa62494e297db1b87a4cb9effe129cca;Alleinverdiener? Hochriskant;https://www.zeit.de/geld/2025-04/hauptverdiener-familie-job-haushalt-gehalt;Drei von vier Familien haben ein Hauptverdienermodell. Was für ein Druck! Hängt viel oder alles an einem Job, ist es schwer, Geld und Liebe im Gleichgewicht zu halten.;"Z+ (abopflichtiger Inhalt);
        
    Hauptverdiener";Geld, Hauptverdiener, Einkommen, Familie, Arbeitnehmer, Geld sparen, Haushalt, Beziehung;2025-05-23T05:11:50+02:00;2025-05-23T05:11:50+02:00;Felicitas Wilke;;false
be49c204bb52fed9352ed1610ce2b72273df311b4630c1f9c4410bb9be5ddf4e;Was willst du wirklich?;https://www.zeit.de/campus/ratgeber/2025/01/entscheidungen-treffen-masterstudium-strategie-philip-meissner;Ein Strategieexperte erklärt, wie man lernt, sich besser zu entscheiden. Und warum das oft so schwerfällt.;"Z+ (abopflichtiger Inhalt);
        
    Entscheidungen treffen";Campus, Entscheidungen treffen, Entscheid;2025-05-23T05:11:15+02:00;2025-05-23T05:11:15+02:00;Anne-Lena Leidenberger;;false
f9b6a44d2b692de9c4ec8813b4464a9eab34cc3bad7d7017a00f75021953a920;Sorry, die Verspätung reicht nicht;https://www.zeit.de/2025/21/flugverspaetungen-entschaedigung-fluggastrechte-airlines;Entschädigungen für verspätete Flüge könnten in vielen Fällen bald ausfallen. Airlines freuen sich schon auf ein neues Gesetz aus Brüssel.;"Z+ (abopflichtiger Inhalt);
        
    Flugverspätungen";Mobilitaet, Flugverspätungen, Jan-Fredrik Arnold, Brüssel, EuGH, EU-Kommission, Verspätung, Entschädigung, Geld;2025-05-23T05:10:33+02:00;2025-05-23T05:10:33+02:00;Jonas Schulze Pals;Aus der        ZEIT Nr. 21/2025;false
14f53e3b8cdd169ca6ae41f85210fca6bd16c1729c7c4c0e685b4a2162252e61;Nach Sylter-Skandalvideo: Safe-Places im Club zu Pfingsten;https://www.zeit.de/news/2025-05/23/nach-sylter-skandalvideo-safe-places-im-club-zu-pfingsten;Hier finden Sie Informationen zu dem Thema „Sylt-Video“. Lesen Sie jetzt „Nach Sylter-Skandalvideo: Safe-Places im Club zu Pfingsten“.;Sylt-Video;News, Sylt-Video, Tom Kinder, Sylt, Deutsche Presse-Agentur, Staatsanwaltschaft, Pfingsten, Skandalvideo, Party;2025-05-23T05:00:42+02:00;2025-05-23T05:00:42+02:00;;dpa Hamburg/Schleswig-Holstein;false
d6f801d4704edb924a281542f3088ccbd39308f62960b61c575ac79b5713831b;Waldbrand glimmt weiter - Zusammenhang mit anderen Bränden?;https://www.zeit.de/news/2025-05/23/waldbrand-glimmt-weiter-zusammenhang-mit-anderen-braenden;Hier finden Sie Informationen zu dem Thema „Brand im Tennenloher Forst“. Lesen Sie jetzt „Waldbrand glimmt weiter - Zusammenhang mit anderen Bränden?“.;Brand im Tennenloher Forst;News, Brand im Tennenloher Forst, Sebastian Weber, Feuerwehr, Glutnest, Kreisbrandinspektion, Waldbrand;2025-05-23T05:00:41+02:00;2025-05-23T05:00:41+02:00;;dpa Bayern;false
724cad32b25d923d81a381adb290a88c6eeb9aa864e23cc89744671edadabf6d;Ermittler: Wohl keine Bestechung bei Staatskanzlei-Sanierung;https://www.zeit.de/news/2025-05/23/ermittler-wohl-keine-bestechung-bei-staatskanzlei-sanierung;Hier finden Sie Informationen zu dem Thema „Nach Razzia beim BLB“. Lesen Sie jetzt „Ermittler: Wohl keine Bestechung bei Staatskanzlei-Sanierung“.;Nach Razzia beim BLB;News, Nach Razzia beim BLB, Staatsanwaltschaft, LKA, Deloitte, Bestechung, Liegenschaftsbetrieb, Staatskanzlei, Razzia;2025-05-23T05:00:38+02:00;2025-05-23T05:00:38+02:00;;dpa Nordrhein-Westfalen;false
a02865f883b72f6825826bc8af7032f7ce267e8b7014bf956d6a87256e09a2ff;Sudan hat laut US-Angaben Chemiewaffen eingesetzt;https://www.zeit.de/politik/ausland/2025-05/sudan-buergerkrieg-us-aussenministerium-chemiewaffen;Seit zwei Jahren herrscht im Sudan Bürgerkrieg, Zehntausende starben. Das US-Außenministerium hat nach eigenen Angaben den Einsatz verbotener Chemiewaffen festgestellt.;Bürgerkrieg;Politik, Bürgerkrieg, Sudan, Außenministerium der Vereinigten Staaten, Chemiewaffen, Bürgerkrieg, Menschenrechte;2025-05-23T04:39:35+02:00;2025-05-23T04:39:35+02:00;sbo;ZEIT ONLINE,        AFP,        							sbo;false
306c0f9356aeeaed0e11b002390ce9ec62bd6163b7f1d805de6e31f4ddb6fb8c;Zahl der Abschiebungen im ersten Quartal mit steigender Tendenz;https://www.zeit.de/politik/deutschland/2025-05/abschiebungen-migration-erstes-quartal-bundesregierung;Aus Deutschland sind von Januar bis März laut einem Bericht 6.151 Menschen abgeschoben worden. Rund 1.700 davon wurden in andere EU-Staaten gebracht. ;Migration;Politik, Migration, Bundesregierung, Deutscher Bundestag, Abschiebung, Migration, Asylpolitik;2025-05-23T04:37:28+02:00;2025-05-23T04:37:28+02:00;sue;ZEIT ONLINE,        							sue;false
bf0883dffa02ee79448c82c765cc692c53eaaf357b77e3f0d8e6a2270ccf2843;Messerstechereien von Kindern - Welche Folgen hat das?;https://www.zeit.de/news/2025-05/23/messerstechereien-von-kindern-welche-folgen-hat-das;Hier finden Sie Informationen zu dem Thema „Strafmündigkeit in Deutschland“. Lesen Sie jetzt „Messerstechereien von Kindern - Welche Folgen hat das?“.;Strafmündigkeit in Deutschland;News, Strafmündigkeit in Deutschland, Berlin, Remscheid, Polizei, Messerstecherei, Strafmündigkeit;2025-05-23T04:30:42+02:00;2025-05-23T04:30:42+02:00;;dpa Berlin/Brandenburg;false
6a6a15e1e0ca666a91e2e564d611a4a80b4a6b4f8a77a492f7bbe525bb5de1cf;Sind Hunde die besseren Kinder? In bestimmter Hinsicht schon;https://www.zeit.de/news/2025-05/23/sind-hunde-die-besseren-kinder-in-bestimmter-hinsicht-schon;Hier finden Sie Informationen zu dem Thema „Geliebte Fellnasen“. Lesen Sie jetzt „Sind Hunde die besseren Kinder? In bestimmter Hinsicht schon“.;Geliebte Fellnasen;News, Geliebte Fellnasen, Laura Gillet, Fellnase, Familie, Tiere;2025-05-23T04:30:39+02:00;2025-05-23T04:30:39+02:00;;dpa;false
6fcba335324ebcddfabf349b269ed38626cf73813de92d30dac7eb4721f3210e;Erste Kommunen wollen nächtliches Verbot für Mähroboter;https://www.zeit.de/news/2025-05/23/erste-kommunen-wollen-naechtliches-verbot-fuer-maehroboter;Hier finden Sie Informationen zu dem Thema „Zum Schutz von Igeln“. Lesen Sie jetzt „Erste Kommunen wollen nächtliches Verbot für Mähroboter“.;Zum Schutz von Igeln;News, Zum Schutz von Igeln, Magdeburg, Halle, Sachsen-Anhalt, Deutsche Presse-Agentur, Kommune, Verbot, Igel, Fahrverbot, Tiere;2025-05-23T04:30:39+02:00;2025-05-23T04:30:39+02:00;;dpa Sachsen;false
cc7a008276cfd1a82166bdf41b8c24df5fa1b73f6f68b315085b17f14c6bdb27;Run auf die Hütten - Wochenenden schon teils ausgebucht;https://www.zeit.de/news/2025-05/23/run-auf-die-huetten-wochenenden-schon-teils-ausgebucht;Hier finden Sie Informationen zu dem Thema „Wanderslust“. Lesen Sie jetzt „Run auf die Hütten - Wochenenden schon teils ausgebucht“.;Wanderslust;News, Wanderslust, Miriam Roth, DAV, Deutscher Alpenverein, Wandersaison, Coronavirus;2025-05-23T04:30:38+02:00;2025-05-23T04:30:38+02:00;;dpa Bayern;false
5e1d35b886a8e0fba44521f0d6b152edb3ea226ad2a920b619ac1e855c2a2115;"""Cavalleria rusticana/Pagliacci"" - Harmlose Premiere";https://www.zeit.de/news/2025-05/23/cavalleria-rusticana-pagliacci-harmlose-premiere;"Hier finden Sie Informationen zu dem Thema „Bayerische Staatsoper“. Lesen Sie jetzt „""Cavalleria rusticana/Pagliacci"" - Harmlose Premiere“.";Bayerische Staatsoper;News, Bayerische Staatsoper, Pietro Mascagni, Ruggero Leoncavallo, Francesco Micheli, München, Staatsoper, Doppeloper, Oper;2025-05-23T04:13:26+02:00;2025-05-23T04:13:26+02:00;;dpa Bayern;false
dd136ece552f1b7bf0ad16081624c57bee32030d8cbc49b751b5b78a7ed3b196;Mutmaßlicher Täter des Angriffs in Washington wegen Mordes angeklagt;https://www.zeit.de/politik/ausland/2025-05/angriff-washington-anklage-terrorakt-hassverbrechen;Nach dem tödlichen Angriff in Washington, D. C. führt die Staatsanwaltschaft Mordermittlungen. Die Tat wird zudem als Hassverbrechen und möglicher Terrorakt untersucht.;USA;Politik, USA, USA, Washington, D. C., Ermittlung, Terrorismus, Antisemitismus;2025-05-23T04:03:57+02:00;2025-05-23T04:03:57+02:00;sbo;ZEIT ONLINE,        Reuters,        							sbo;false
