Hash;Title;Link;Description;Category;KeyWords;Published;LastUpdated;Author;Source;Paywall
6c388bbab76f4d65c45d160fd8ed2d436061c3fb81b20975d54bc4e36f930d41;Inflationsrate im April bleibt bei 2,2 Prozent;https://www.zeit.de/wirtschaft/2024-05/inflationsrate-april-bleibt-bei-2-komma-2-prozent;Seit Jahresbeginn hat die Inflation abgenommen, doch von März auf April ist sie nicht mehr gefallen. Hohe Preise belasten Haushalte – und sie könnten weiter steigen.;"Z+ (abopflichtiger Inhalt);
        
    
Verbraucherpreise";Wirtschaft, Verbraucherpreise, Verbraucherpreis, Inflation, Haushalt, Energieversorgung, Lebensmittelpreise, Konsum;2024-05-14T09:20:26+02:00;2024-05-14T09:20:26+02:00;;ZEIT ONLINE,        dpa,        caf;false
2e6492846e61e8fc750866a7aa6da2bb6618dc407f96d54a7387d75adf8744f7;Die fetten Geschäfte kommen erst noch;https://www.zeit.de/wirtschaft/unternehmen/2024-05/deutsche-ruestungsindustrie-fehlende-auftraege-angst-russland-einkaeufe-usa;Rüstungsunternehmen klagen über die lahme Beschaffung in Deutschland. Dabei sind ihre Auftragsbücher voll. Vier Thesen zu einer Branche, der es gut geht wie lange nicht.;"Z+ (abopflichtiger Inhalt);
        
    
Deutsche Rüstungsindustrie";Wirtschaft, Deutsche Rüstungsindustrie, Rüstungsindustrie, Bundeswehr, Rheinmetall, Bundesregierung, Boris Pistorius, Nato;2024-05-14T09:18:00+02:00;2024-05-14T09:18:00+02:00;Dr. Hauke Friederichs1. Die deutsche Rüstungsindustrie klagt auf hohem Niveau2. Die Branche ist schon jetzt gut ausgelastet3. Der Rüstungsboom gefährdet die Sicherheit der Ukraine4. Die fetten Jahre kommen erst noch;;false
f7294216a2e2232c936591c9522011e870cb16451f60cffa1dd0f68af6b2a346;13-Jähriger fährt mit Mamas Auto zu Treffen mit Freunden;https://www.zeit.de/news/2024-05/14/13-jaehriger-faehrt-mit-mamas-auto-zu-treffen-mit-freunden;Hier finden Sie Informationen zu dem Thema „Suhl“. Lesen Sie jetzt „13-Jähriger fährt mit Mamas Auto zu Treffen mit Freunden“.;"Z+ (abopflichtiger Inhalt);
        
    
Suhl";News, Suhl, Polizei, Treffen, Streifenwagen, Auto;2024-05-14T09:12:47+02:00;2024-05-14T09:12:47+02:00;;dpa Thüringen;false
1ed1011036ef7cc9ab848399f1f30ea66863f1b9f11133b98aaef42b19b517ea;Mehr Menschen in NRW brauchen Grundsicherung im Alter;https://www.zeit.de/news/2024-05/14/mehr-menschen-in-nrw-brauchen-grundsicherung-im-alter;Hier finden Sie Informationen zu dem Thema „Unterstützung“. Lesen Sie jetzt „Mehr Menschen in NRW brauchen Grundsicherung im Alter“.;"Z+ (abopflichtiger Inhalt);
        
    
Unterstützung";News, Unterstützung, NRW, Grundsicherung;2024-05-14T09:11:28+02:00;2024-05-14T09:11:28+02:00;;dpa Nordrhein-Westfalen;false
c7cbf027572917432ee5cdcd8d68c15a77ddab74cf683619ab423b7fe0e3145d;Weniger Bachelor- und mehr Masterabschlüsse in Sachsen;https://www.zeit.de/news/2024-05/14/weniger-bachelor-und-mehr-masterabschluesse-in-sachsen;Hier finden Sie Informationen zu dem Thema „Hochschulbildung“. Lesen Sie jetzt „Weniger Bachelor- und mehr Masterabschlüsse in Sachsen“.;"Z+ (abopflichtiger Inhalt);
        
    
Hochschulbildung";News, Hochschulbildung, Sachsen, Masterabschluss, Hochschulbildung, Hochschultür;2024-05-14T09:09:46+02:00;2024-05-14T09:09:46+02:00;;dpa Sachsen;false
ecc0ab039d1120a84505dba6c107f7109b6a5461a5ff0ba603c985a20771720d;Ruhigere Märkte lassen EnBW-Ergebnis schrumpfen;https://www.zeit.de/news/2024-05/14/ruhigere-maerkte-lassen-enbw-ergebnis-schrumpfen;Hier finden Sie Informationen zu dem Thema „Energiebranche“. Lesen Sie jetzt „Ruhigere Märkte lassen EnBW-Ergebnis schrumpfen“.;"Z+ (abopflichtiger Inhalt);
        
    
Energiebranche";News, Energiebranche, Thomas Kusterer, Energiebranche, Energieversorgungsunternehmen;2024-05-14T09:06:12+02:00;2024-05-14T09:06:12+02:00;;dpa Baden-Württemberg;false
8999d8f2ff039577f8432df46e75f9f45a43ae29ec20d07ecdc297c4ebec4889;Jede dritte staatliche Hochschule wird von Frau geleitet;https://www.zeit.de/news/2024-05/14/jede-dritte-staatliche-hochschule-wird-von-frau-geleitet;Hier finden Sie Informationen zu dem Thema „Analyseergebnisse“. Lesen Sie jetzt „Jede dritte staatliche Hochschule wird von Frau geleitet“.;"Z+ (abopflichtiger Inhalt);
        
    
Analyseergebnisse";News, Analyseergebnisse, CHE, Universität zu Köln, Analyseergebnis;2024-05-14T09:04:50+02:00;2024-05-14T09:04:50+02:00;;dpa Nordrhein-Westfalen;false
8c729adc3d6380b471f72897fcc750e0f8f2d2e923b1dbcda4e4f9af46e396e2;Verwirrter Mann verletzt sich selbst;https://www.zeit.de/news/2024-05/14/verwirrter-mann-verletzt-sich-selbst;Hier finden Sie Informationen zu dem Thema „Frankfurt am Main“. Lesen Sie jetzt „Verwirrter Mann verletzt sich selbst“.;"Z+ (abopflichtiger Inhalt);
        
    
Frankfurt am Main";News, Frankfurt am Main, Frankfurt am Main, Frankfurt;2024-05-14T09:03:00+02:00;2024-05-14T09:03:00+02:00;;dpa Hessen;false
d45faaa522438a33135257b6986bd3db583e6ddfa2072848e4b0db4bac59be76;Porsche SE bestätigt Prognose trotz mehr Schulden;https://www.zeit.de/news/2024-05/14/porsche-se-bestaetigt-prognose-trotz-mehr-schulden;Hier finden Sie Informationen zu dem Thema „VW-Dachgesellschaft“. Lesen Sie jetzt „Porsche SE bestätigt Prognose trotz mehr Schulden“.;"Z+ (abopflichtiger Inhalt);
        
    
VW-Dachgesellschaft";News, VW-Dachgesellschaft, Porsche, VW, Prognose, Stellwand, Schulden;2024-05-14T08:52:48+02:00;2024-05-14T08:52:48+02:00;;dpa Baden-Württemberg;false
c179f88af32888ad7317c2f1eb3436fccfefa3a3b3ad9ec6dc04d7724fed7dd9;Inflation verharrt im April bei 2,2 Prozent;https://www.zeit.de/news/2024-05/14/inflation-verharrt-im-april-bei-2-2-prozent;Hier finden Sie Informationen zu dem Thema „Verbraucherpreise“. Lesen Sie jetzt „Inflation verharrt im April bei 2,2 Prozent“.;"Z+ (abopflichtiger Inhalt);
        
    
Verbraucherpreise";News, Verbraucherpreise, Destatis, Verbraucherpreis, Lebensmittel;2024-05-14T08:50:22+02:00;2024-05-14T08:50:22+02:00;;dpa;false
b3c3cfa19a6075ce9b97e768e41b67391e205fbeb1c9d6441bebe357027eb8cc;Frau in Magdeburg angeschossen - Täter weiter flüchtig;https://www.zeit.de/news/2024-05/13/frau-in-magdeburg-angeschossen-polizeieinsatz-laeuft;Hier finden Sie Informationen zu dem Thema „Sachsen-Anhalt“. Lesen Sie jetzt „Frau in Magdeburg angeschossen - Täter weiter flüchtig“.;"Z+ (abopflichtiger Inhalt);
        
    
Sachsen-Anhalt";News, Sachsen-Anhalt, Magdeburg, Madgeburg, Sachsen-Anhalt, Polizei, Polizeieinsatz;2024-05-14T08:48:51+02:00;2024-05-14T08:48:51+02:00;;dpa;false
4acc9b4a1869e534fe8f74a93620b6d9fb42edb45a981204e936a2306e9eed0b;Leiche auf Feldweg entdeckt: Polizei vermutet Reitunfall;https://www.zeit.de/news/2024-05/14/leiche-auf-feldweg-entdeckt-polizei-vermutet-reitunfall;Hier finden Sie Informationen zu dem Thema „Main-Kinzig-Kreis“. Lesen Sie jetzt „Leiche auf Feldweg entdeckt: Polizei vermutet Reitunfall“.;"Z+ (abopflichtiger Inhalt);
        
    
Main-Kinzig-Kreis";News, Main-Kinzig-Kreis, Main-Kinzig, Polizei, Reitunfall, Einsatzwagen;2024-05-14T08:48:22+02:00;2024-05-14T08:48:22+02:00;;dpa Hessen;false
c0e81ede0f714f91fa88fe7173e0e7f026fd1077237bb3fbdbd2f6a79cee25a6;Dürr verdient operativ mehr als erwartet;https://www.zeit.de/news/2024-05/14/duerr-verdient-operativ-mehr-als-erwartet;Hier finden Sie Informationen zu dem Thema „Ludwigsburg“. Lesen Sie jetzt „Dürr verdient operativ mehr als erwartet“.;"Z+ (abopflichtiger Inhalt);
        
    
Ludwigsburg";News, Ludwigsburg, Ludwigsburg, Dürr, Hauptsitz;2024-05-14T08:46:40+02:00;2024-05-14T08:46:40+02:00;;dpa Baden-Württemberg;false
2b451cccd03c27bd42eef97285a03166bbdd758f1f3d16e44d5806b91570c5e4;Nach Schüssen auf Frau in Magdeburg: Täter weiter flüchtig;https://www.zeit.de/news/2024-05/14/nach-schuessen-auf-frau-in-magdeburg-taeter-weiter-fluechtig;Hier finden Sie Informationen zu dem Thema „Ermittlungen“. Lesen Sie jetzt „Nach Schüssen auf Frau in Magdeburg: Täter weiter flüchtig“.;"Z+ (abopflichtiger Inhalt);
        
    
Ermittlungen";News, Ermittlungen, Magdeburg, Polizei, Ermittlung;2024-05-14T08:45:09+02:00;2024-05-14T08:45:09+02:00;;dpa Sachsen;false
39bc4617d3b99239b1f55366d0096ac91ab0b7dd7f992c66bf6295c8dc8b6caf;Mit zerbrochener Flasche attackiert: Haftbefehl;https://www.zeit.de/news/2024-05/14/mit-zerbrochener-flasche-attackiert-haftbefehl;Hier finden Sie Informationen zu dem Thema „Mannheim “. Lesen Sie jetzt „Mit zerbrochener Flasche attackiert: Haftbefehl“.;"Z+ (abopflichtiger Inhalt);
        
    
Mannheim";News, Mannheim , Mannheim, Polizei, Haftbefehl, Streifenwagen, Blaulicht;2024-05-14T08:41:35+02:00;2024-05-14T08:41:35+02:00;;dpa Baden-Württemberg;false
23198ca93f9194b11f6e84f8a2dbd87a4197f7e1a95373a3e96b1bd6b8326d0c;Zahl der Binnenvertriebenen so hoch wie nie zuvor;https://www.zeit.de/gesellschaft/2024-05/binnenvertriebene-weltweit-zahl-hoechstwert;Kriege, Katastrophen und Gewalt: Weltweit sind im vergangenen Jahr 75,9 Millionen Menschen innerhalb ihres Heimatlandes auf der Flucht gewesen. So viele wie nie zuvor.;"Z+ (abopflichtiger Inhalt);
        
    
Flucht";Gesellschaft, Flucht, Geflüchtete, Sudan, Kongo, Vereinte Nationen, UNHCR, Gazastreifen;2024-05-14T08:35:05+02:00;2024-05-14T08:35:05+02:00;;ZEIT ONLINE,        dpa,        AFP,        voi;false
b10ca23b5423b3f3da06240d16f19ef832eece5e84f9c2ad0950f926216ff824;Fliegerbombe aus dem Zweiten Weltkrieg in Barmstedt entdeckt;https://www.zeit.de/news/2024-05/14/fliegerbombe-aus-dem-zweiten-weltkrieg-in-barmstedt-entdeckt;Hier finden Sie Informationen zu dem Thema „Kampfmittelbeseitigung“. Lesen Sie jetzt „Fliegerbombe aus dem Zweiten Weltkrieg in Barmstedt entdeckt“.;"Z+ (abopflichtiger Inhalt);
        
    
Kampfmittelbeseitigung";News, Kampfmittelbeseitigung, Barmstedt, Polizei, Zweiter Weltkrieg, Fliegerbombe, Kampfmittelbeseitigung;2024-05-14T08:34:46+02:00;2024-05-14T08:34:46+02:00;;dpa Hamburg/Schleswig-Holstein;false
65377126b45cd79b14d7c8a669e24d32327162f7cf15f264ce8d2c57746066e9;Verbraucherzentrale verzichtet auf Klage gegen Temu;https://www.zeit.de/wirtschaft/2024-05/verbraucherzentrale-verzichtet-auf-klage-gegen-temu;Unklare Rabatte, manipulative Hinweise: Temu tut viel, um Verbraucherinnen zum Kauf zu drängen. Wegen einer drohenden Klage will das Unternehmen aus China das nun ändern.;"Z+ (abopflichtiger Inhalt);
        
    
Onlinehändler Temu";Wirtschaft, Onlinehändler Temu, Online-Dienst, Konsum, China, Verbraucherschutz, Logistik, Behörde;2024-05-14T08:33:33+02:00;2024-05-14T08:33:33+02:00;;ZEIT ONLINE,        dpa,        caf;false
052a666ba2a642b80e2b5f411f6ed59519873453c2509acc96e0b82d0be5afd7;Wende gut, alles gut;https://www.zeit.de/politik/deutschland/2024-05/politikwende-zeitenwende-agrarwende-5vor8;Erst die Zeiten und die Energie, nun auch noch die Wirtschaft und der Haushalt – alles soll sich wenden. Warum der Begriff in der Politik gerade jetzt so beliebt ist.;"Z+ (abopflichtiger Inhalt);
        
    
Fünf vor 8:00 / Politikwende";Politik, Politikwende, Verkehrswende, Energiewende, FDP, Wirtschaftspolitik, Agrarpolitik, Bundeskanzler;2024-05-14T08:26:54+02:00;2024-05-14T08:26:54+02:00;Lenz Jacobsen;;false
373df0756bd188e9f006a4c26d2536b55515fefd3100a55249031831eb99cf30;76-Jährige von Bus erfasst und schwer verletzt;https://www.zeit.de/news/2024-05/14/76-jaehrige-von-bus-erfasst-und-schwer-verletzt;Hier finden Sie Informationen zu dem Thema „Berlin“. Lesen Sie jetzt „76-Jährige von Bus erfasst und schwer verletzt“.;"Z+ (abopflichtiger Inhalt);
        
    
Berlin";News, Berlin, Berlin, Rettungswagen;2024-05-14T08:21:13+02:00;2024-05-14T08:21:13+02:00;;dpa Berlin/Brandenburg;false
93015e29ca2496fcd98f079c062091d96e78de94f2ac2a472b5644d183eb805f;Zwei Autofahrer bei frontalem Zusammenstoß verletzt;https://www.zeit.de/news/2024-05/14/zwei-autofahrer-bei-frontalem-zusammenstoss-verletzt;Hier finden Sie Informationen zu dem Thema „Schmalkalden-Meiningen“. Lesen Sie jetzt „Zwei Autofahrer bei frontalem Zusammenstoß verletzt“.;"Z+ (abopflichtiger Inhalt);
        
    
Schmalkalden-Meiningen";News, Schmalkalden-Meiningen, Schmalkalden-Meiningen, Polizei, Zusammenstoß, Dienstauto, Blaulicht, Auto;2024-05-14T08:19:29+02:00;2024-05-14T08:19:29+02:00;;dpa Thüringen;false
b281d220bd7ee50ac41045a630aca9b70ab0156fc4cc1c853968ecf32b3d40c7;Leer stehendes Haus abgebrannt: etwa 150.000 Euro Schaden;https://www.zeit.de/news/2024-05/14/leer-stehendes-gebaeude-in-abgebrannt-sechsstelliger-schaden;Hier finden Sie Informationen zu dem Thema „Ostallgäu“. Lesen Sie jetzt „Leer stehendes Haus abgebrannt: etwa 150.000 Euro Schaden“.;"Z+ (abopflichtiger Inhalt);
        
    
Ostallgäu";News, Ostallgäu, Ostallgäu, Leer, Feuerwehr, Löschfahrzeug;2024-05-14T08:17:39+02:00;2024-05-14T08:17:39+02:00;;dpa Bayern;false
92c6cf7e89aa9f989e252634098059a4f26f6d54b4cef636381e2f0d07b8b361;Nach viel Sonnenschein kommt Regen aus Südwesten;https://www.zeit.de/news/2024-05/14/nach-viel-sonnenschein-kommt-regen-aus-suedwesten;Hier finden Sie Informationen zu dem Thema „Wetter“. Lesen Sie jetzt „Nach viel Sonnenschein kommt Regen aus Südwesten“.;"Z+ (abopflichtiger Inhalt);
        
    
Wetter";News, Wetter, Südwest, Südwesten, Wetter;2024-05-14T08:16:33+02:00;2024-05-14T08:16:33+02:00;;dpa Nordrhein-Westfalen;false
c6089ef90628fea7da964e9db9a3105ef4a0daefee07ab43cc2fd82541674727;Wechselkursbelastungen: Bayer blickt verhaltener auf 2024;https://www.zeit.de/news/2024-05/14/wechselkursbelastungen-bayer-blickt-verhaltener-auf-2024;Hier finden Sie Informationen zu dem Thema „Pharmakonzern“. Lesen Sie jetzt „Wechselkursbelastungen: Bayer blickt verhaltener auf 2024“.;"Z+ (abopflichtiger Inhalt);
        
    
Pharmakonzern";News, Pharmakonzern, Leverkusen, Bayer, Wechselkursbelastung, Pharmakonzern;2024-05-14T08:14:49+02:00;2024-05-14T08:14:49+02:00;;dpa Nordrhein-Westfalen;false
71c78334492c7ce386680a3dbb86d52aba9fd1fdf9db5710500ec320fb7a4527;Zwei Verletzte bei Unfall von Kastenwagen und Motorrad;https://www.zeit.de/news/2024-05/14/zwei-verletzte-bei-unfall-von-kastenwagen-und-motorrad;Hier finden Sie Informationen zu dem Thema „Rettungseinsatz“. Lesen Sie jetzt „Zwei Verletzte bei Unfall von Kastenwagen und Motorrad“.;"Z+ (abopflichtiger Inhalt);
        
    
Rettungseinsatz";News, Rettungseinsatz, Polizei, Unfall, Kastenwagen, Rettungseinsatz, Motorrad, Notarztwagen;2024-05-14T08:01:36+02:00;2024-05-14T08:01:36+02:00;;dpa Hessen;false
d687c7eaef398d2e0648c2a5fdacd52cf31d524e90bad621d06c5867404b8bdb;"""Star Wars""-Schöpfer George Lucas wird 80";https://www.zeit.de/news/2024-05/14/star-wars-schoepfer-george-lucas-wird-80;"Hier finden Sie Informationen zu dem Thema „Film“. Lesen Sie jetzt „""Star Wars""-Schöpfer George Lucas wird 80“.";"Z+ (abopflichtiger Inhalt);
        
    
Film";News, Film, George Lucas, Mellody Hobson, Steven Spielberg, Francis Ford Coppola, Los Angeles, Hollywood, San Francisco, Cannes, Walt Disney, Lucasfilm;2024-05-14T07:59:04+02:00;2024-05-14T07:59:04+02:00;;dpa;false
408bc8eb9259e0e930c987118d15a1289ee842c47c281adab3f33850a4f0ddfa;Europaminister: Europawahl darf keine Protestwahl werden;https://www.zeit.de/news/2024-05/14/europaminister-europawahl-darf-keine-protestwahl-werden;Hier finden Sie Informationen zu dem Thema „Bürgerbeteiligung“. Lesen Sie jetzt „Europaminister: Europawahl darf keine Protestwahl werden“.;"Z+ (abopflichtiger Inhalt);
        
    
Bürgerbeteiligung";News, Bürgerbeteiligung, Eric Beißwenger, Europa, Europawahl, Protestwahl, Bürgerbeteiligung;2024-05-14T07:46:50+02:00;2024-05-14T07:46:50+02:00;;dpa Bayern;false
d1ce611400e2aafbf24be2cbc37faa0bfdf759cd9d9ba251c0f56f902c256bcc;Bus stößt mit Motorrad zusammen: Biker schwer verletzt;https://www.zeit.de/news/2024-05/14/bus-stoesst-mit-motorrad-zusammen-biker-schwer-verletzt;Hier finden Sie Informationen zu dem Thema „Rottal-Inn“. Lesen Sie jetzt „Bus stößt mit Motorrad zusammen: Biker schwer verletzt“.;"Z+ (abopflichtiger Inhalt);
        
    
Rottal-Inn";News, Rottal-Inn, Rottal-Inn, Polizei, Motorrad;2024-05-14T07:43:07+02:00;2024-05-14T07:43:07+02:00;;dpa Bayern;false
91e2135289a686da1cb0a6fca978f2902085b071868dea3f3322da222a34bae2;200 Strohballen brennen im Landkreis Osnabrück;https://www.zeit.de/news/2024-05/14/200-strohballen-brennen-im-landkreis-osnabrueck;Hier finden Sie Informationen zu dem Thema „Feuerwehreinsatz“. Lesen Sie jetzt „200 Strohballen brennen im Landkreis Osnabrück“.;"Z+ (abopflichtiger Inhalt);
        
    
Feuerwehreinsatz";News, Feuerwehreinsatz, Landkreis Osnabrück, Feuerwehr, Polizei, Strohballen, Feuerwehreinsatz;2024-05-14T07:41:36+02:00;2024-05-14T07:41:36+02:00;;dpa Niedersachsen;false
65976a14394c2d91585ff33b106a65927ae9bcfe11ea39cc8d1c52ff4603ecd1;Vulkanische Schlammströme auf Sumatra: Zahl der Toten steigt;https://www.zeit.de/news/2024-05/14/vulkanische-schlammstroeme-auf-sumatra-zahl-der-toten-steigt;Hier finden Sie Informationen zu dem Thema „Unwetter“. Lesen Sie jetzt „Vulkanische Schlammströme auf Sumatra: Zahl der Toten steigt“.;"Z+ (abopflichtiger Inhalt);
        
    
Unwetter";News, Unwetter, Sumatra, Indonesien, Schlammstrom, Rettungskraft, Sturzflut, Unwetter;2024-05-14T07:40:55+02:00;2024-05-14T07:40:55+02:00;;dpa;false
206958ab9584ea7bea7c6ab31c285fc663ae2a1ba05dd10299a321873dce78a6;Nächster Millionen-Deal: DFB verlängert mit Sponsor VW;https://www.zeit.de/news/2024-05/14/naechster-millionen-deal-dfb-verlaengert-mit-generalsponsor-vw;Hier finden Sie Informationen zu dem Thema „Nationalmannschaft“. Lesen Sie jetzt „Nächster Millionen-Deal: DFB verlängert mit Sponsor VW“.;"Z+ (abopflichtiger Inhalt);
        
    
Nationalmannschaft";News, Nationalmannschaft, Bernd Neuendorf, Berlin, VW, NIKE, DFB, Deutsche Presse-Agentur, Deutscher Fußball-Bund, Fußball, Krise;2024-05-14T07:40:16+02:00;2024-05-14T07:40:16+02:00;;dpa Niedersachsen;false
58ef7450ac7d72999b1cff0b17732d194c0589e2133258a71e776cc28244c486;Kretschmann und Kretschmer für oberirdische Stromtrassen;https://www.zeit.de/news/2024-05/14/kretschmann-und-kretschmer-fuer-oberirdische-stromtrassen;Hier finden Sie Informationen zu dem Thema „Energie“. Lesen Sie jetzt „Kretschmann und Kretschmer für oberirdische Stromtrassen“.;"Z+ (abopflichtiger Inhalt);
        
    
Energie";News, Energie, Winfried Kretschmann, Michael Kretschmer, Stromtrasse, Erdverkabelung, Stromautobahn, Geld sparen, Geld;2024-05-14T07:35:17+02:00;2024-05-14T07:35:17+02:00;;dpa;false
2068e2f8f7c47063f577d113941d3ce104a7b110dcdece0dada93e2fb541df43;Illegaler Müll kostet Berlin mehr als zehn Millionen Euro;https://www.zeit.de/news/2024-05/14/illegaler-muell-kostet-berlin-mehr-als-zehn-millionen-euro;Hier finden Sie Informationen zu dem Thema „Abfallentsorgung“. Lesen Sie jetzt „Illegaler Müll kostet Berlin mehr als zehn Millionen Euro“.;"Z+ (abopflichtiger Inhalt);
        
    
Abfallentsorgung";News, Abfallentsorgung, Berlin, Köpenicker Straße, Kreuzberg, Neukölln, Steglitz-Zehlendorf, BSR, CDU, Müll, Abfallentsorgung;2024-05-14T07:28:24+02:00;2024-05-14T07:28:24+02:00;;dpa Berlin/Brandenburg;false
518da9761143efeba2e04b045ab53353a8e6abd294d94ce8fb0cea2b4abb75d5;Frauenanteil in Dax-Aufsichtsräten steigt erneut leicht an;https://www.zeit.de/wirtschaft/unternehmen/2024-05/dax-aufsichtsraete-frauen-anteil-nicht-in-fuehrungspositionen;Viele Konzerne überschreiten mittlerweile die für Aufsichtsräte vorgeschriebene Frauenquote von 30 Prozent. Doch Führungspositionen bleiben vorwiegend männlich besetzt.;"Z+ (abopflichtiger Inhalt);
        
    
Gleichstellung in der Wirtschaft";Wirtschaft, Gleichstellung in der Wirtschaft, Frauenquote, Gleichstellung, Frauen, Ökonomie, Gleichberechtigung, Feminismus;2024-05-14T07:16:11+02:00;2024-05-14T07:16:11+02:00;;ZEIT ONLINE,        dpa,        caf;false
6694840e80781f63a3948933a3ae1d04b60646b58fe90c9363b1fb219bdd0381;Pfingstferien: Oft tankt es sich am Urlaubsziel billiger;https://www.zeit.de/news/2024-05/14/pfingstferien-oft-tankt-es-sich-am-urlaubsziel-billiger;Hier finden Sie Informationen zu dem Thema „Kraftstoffpreise“. Lesen Sie jetzt „Pfingstferien: Oft tankt es sich am Urlaubsziel billiger“.;"Z+ (abopflichtiger Inhalt);
        
    
Kraftstoffpreise";News, Kraftstoffpreise, Luxemburg, Polen, Tschechien, Österreich, Schweiz, Italien, Slowenien, Kroatien, EU-Kommission, Urlaubsziel;2024-05-14T07:11:51+02:00;2024-05-14T07:11:51+02:00;;dpa;false
24db9b0dccd6e333109389c1e1acd09ca63a620c1a4994a4bb4f1d93aa7ff1f8;Angeschlagener Vizeweltmeister hofft auf Sturm-Rückkehr;https://www.zeit.de/news/2024-05/14/angeschlagener-vizeweltmeister-hofft-auf-sturm-rueckkehr;Hier finden Sie Informationen zu dem Thema „Eishockey-WM“. Lesen Sie jetzt „Angeschlagener Vizeweltmeister hofft auf Sturm-Rückkehr“.;"Z+ (abopflichtiger Inhalt);
        
    
Eishockey-WM";News, Eishockey-WM, Nico Sturm, Magentasport, NHL, Eishockey-WM, Eis;2024-05-14T07:03:11+02:00;2024-05-14T07:03:11+02:00;;dpa Sport;false
0263ee1485f13a497036a5b81462428bfe2d05a85b0a6d68886313fe1001d297;EM-Tickets auch für Debütant Pavlovic und Nummer eins Neuer;https://www.zeit.de/news/2024-05/14/em-tickets-auch-fuer-debuetant-pavlovic-und-nummer-eins-neuer;Hier finden Sie Informationen zu dem Thema „Nationalmannschaft“. Lesen Sie jetzt „EM-Tickets auch für Debütant Pavlovic und Nummer eins Neuer“.;"Z+ (abopflichtiger Inhalt);
        
    
Nationalmannschaft";News, Nationalmannschaft, Aleksandar Pavlovic, Frauke Ludowig, Jonathan Tah, Rashid Hamid, Manuel Neuer, Julian Nagelsmann, Bayern, Frankreich, Niederlande, Nürnberg;2024-05-14T07:00:55+02:00;2024-05-14T07:00:55+02:00;;dpa;false
db19e6b30a38fbfc75b1f0ce76d097a59c2a1bde66f4ba38f0fd01bed5a7e59f;Faktencheck: Rohmilch für Schwangere?;https://www.zeit.de/news/2024-05/14/faktencheck-rohmilch-fuer-schwangere;Hier finden Sie Informationen zu dem Thema „Recherche“. Lesen Sie jetzt „Faktencheck: Rohmilch für Schwangere?“.;"Z+ (abopflichtiger Inhalt);
        
    
Recherche";News, Recherche, Faktencheck, Rohmilch, Verzehr, Lebensmittel;2024-05-14T07:00:51+02:00;2024-05-14T07:00:51+02:00;;dpa;false
221523bab589445c6c6ab11f3a03abfa89b2527966a4f53ddf90baf07f072fc1;Zahl der Binnenvertriebenen weltweit auf Rekordhöhe;https://www.zeit.de/news/2024-05/14/zahl-der-binnenvertriebenen-weltweit-auf-rekordhoehe;Hier finden Sie Informationen zu dem Thema „Migration“. Lesen Sie jetzt „Zahl der Binnenvertriebenen weltweit auf Rekordhöhe“.;"Z+ (abopflichtiger Inhalt);
        
    
Migration";News, Migration, Goma, UNHCR, Rekordhöhe, Migration, Flüchtlingslager;2024-05-14T06:50:13+02:00;2024-05-14T06:50:13+02:00;;dpa;false
837ad1239c89ad10c5a4477b7cd6383228fb263e4767463a79c0f2fa37a253fd;Notarzteinsatz führt zu Sperrung auf S-Bahnring am Morgen;https://www.zeit.de/news/2024-05/14/notarzteinsatz-fuehrt-zu-sperrung-auf-s-bahnring-am-morgen;Hier finden Sie Informationen zu dem Thema „Verkehr“. Lesen Sie jetzt „Notarzteinsatz führt zu Sperrung auf S-Bahnring am Morgen“.;"Z+ (abopflichtiger Inhalt);
        
    
Verkehr";News, Verkehr, Notarzteinsatz, Sperrung, Verkehr;2024-05-14T06:50:08+02:00;2024-05-14T06:50:08+02:00;;dpa Berlin/Brandenburg;false
db3903562136457715ddfaabe9e498f2e0e54b03fcb83026d9a9806563025aa2;Zahl der Migranten an der Grenze Mexikos zu den USA halbiert;https://www.zeit.de/politik/ausland/2024-05/grenze-mexiko-usa-rueckgang-migranten;Zehntausende Migranten durchquerten im vergangenen Jahr Mexiko in Richtung US-Grenze. Mexikos Präsident spricht nun von einem deutlichen Rückgang der Fluchtbewegung.;"Z+ (abopflichtiger Inhalt);
        
    
Mexiko";Politik, Mexiko, Mexiko, Migration, USA, Präsident, Geflüchtete, Präsidentschaft;2024-05-14T06:45:22+02:00;2024-05-14T06:45:22+02:00;;ZEIT ONLINE,        AFP,        lp;false
024628a6787d8f39c1b9b67f8980c392dc5139ee7c031218c42af27b3d53aa2a;Neues ChatGPT führt Unterhaltungen - und singt;https://www.zeit.de/news/2024-05/13/openai-laesst-chatgpt-mit-nutzern-sprechen;Hier finden Sie Informationen zu dem Thema „Künstliche Intelligenz“. Lesen Sie jetzt „Neues ChatGPT führt Unterhaltungen - und singt“.;"Z+ (abopflichtiger Inhalt);
        
    
Künstliche Intelligenz";News, Künstliche Intelligenz, Amazon, OpenAI, Google Inc., Chatbot, Sprachassistent, Smartphone, Unterhaltung, Entwicklerfirma, ChatGPT, künstliche Intelligenz;2024-05-14T06:40:19+02:00;2024-05-14T06:40:19+02:00;;dpa;false
e3c906beeadcf8ca65a12c9d38861fa6acbd450c238f55349a240e1e2eade30e;Delivery Hero verkauft Foodpanda-Geschäft in Taiwan an Uber;https://www.zeit.de/news/2024-05/14/delivery-hero-verkauft-foodpanda-geschaeft-in-taiwan-an-uber;Hier finden Sie Informationen zu dem Thema „Essenslieferdienst“. Lesen Sie jetzt „Delivery Hero verkauft Foodpanda-Geschäft in Taiwan an Uber“.;"Z+ (abopflichtiger Inhalt);
        
    
Essenslieferdienst";News, Essenslieferdienst, Taiwan, Delivery Hero;2024-05-14T06:33:01+02:00;2024-05-14T06:33:01+02:00;;dpa Berlin/Brandenburg;false
ac7fcf2ac138140e34146b3eb76042739a81b9d16e7d8fb6a69e0daff493ee07;Verkehrseinschränkungen auf Berlins Straßen am Dienstag;https://www.zeit.de/news/2024-05/14/verkehrseinschraenkungen-auf-berlins-strassen-am-dienstag;Hier finden Sie Informationen zu dem Thema „Verkehrsinformationszentrale“. Lesen Sie jetzt „Verkehrseinschränkungen auf Berlins Straßen am Dienstag“.;"Z+ (abopflichtiger Inhalt);
        
    
Verkehrsinformationszentrale";News, Verkehrsinformationszentrale, Berlin, Verkehrseinschränkung, Verkehrsinformationszentrale, Gefahrzeichen, Piktogramm;2024-05-14T06:21:09+02:00;2024-05-14T06:21:09+02:00;;dpa Berlin/Brandenburg;false
