Hash;Title;Link;Description;Category;KeyWords;Published;LastUpdated;Author;Source;Paywall
3e85ccfc0da34ca01f4960e827bcd35addab672d50fb1f2a09165bb31a78ef09;Eriksens erstes Tor: Wolfsburg schlägt Nordrivalen St. Pauli;https://www.zeit.de/news/2026-01/14/eriksens-erstes-tor-wolfsburg-schlaegt-nordrivalen-st-pauli;Hier finden Sie Informationen zu dem Thema „Fußball-Bundesliga“. Lesen Sie jetzt „Eriksens erstes Tor: Wolfsburg schlägt Nordrivalen St. Pauli“.;Fußball-Bundesliga;News, Fußball-Bundesliga, Christian Eriksen, Eric Smith, Jackson Irvine, Kamil Grabara, Wolfsburg, St. Pauli, München, VfL Wolfsburg, FC St. Pauli, Fußball-Bundesliga;2026-01-14T20:26:07+01:00;2026-01-14T20:26:07+01:00;;dpa Hamburg/Schleswig-Holstein;false
384d6ee083c8304b5d0f2bed633fa995b945a224c61a18716f040ebfd58c56db;Nicht dabei sein ist alles;https://www.zeit.de/hamburg/2026-01/olympia-bewerbung-hamburg-kritik-gegenkampagne;Hamburg hofft auf die Olympischen Spiele. Ganz Hamburg? Nein – jetzt haben die Olympia-Kritiker ihre Gegenkampagne gestartet. Sie waren damit schon einmal erfolgreich.;"Z+ (abopflichtiger Inhalt);
        
    Olympia-Bewerbung";Hamburg, Olympia-Bewerbung, Olympische Spiele, Hamburg, Elbe, Hamburger Senat, Volksentscheid, G20;2026-01-14T20:12:42+01:00;2026-01-14T20:12:42+01:00;Annika Lasarzik;;false
4b6b75a573a9a74620f73175053cbe3dcd1eb4b9800be5ee5f4e987c4268eb13;Dänemark: Keine Einigung mit USA bei Grönland-Krisengespräch;https://www.zeit.de/news/2026-01/14/daenemark-keine-einigung-mit-usa-bei-groenland-krisengespraech;Hier finden Sie Informationen zu dem Thema „Regierung“. Lesen Sie jetzt „Dänemark: Keine Einigung mit USA bei Grönland-Krisengespräch“.;Regierung;News, Regierung, Dänemark, USA, Grönland, Krisengespräch;2026-01-14T20:09:57+01:00;2026-01-14T20:09:57+01:00;;dpa;false
04f15565988ada08dcfb564d43996c35ce8da79c714346a99fcf05e1fd6d31f7;Mit Todesmut;https://www.zeit.de/2026/03/proteste-iran-demonstrationen-regime-reza-pahlavi-donald-trump;Es ist heldenhaft, wie sich die Iraner dem Regime entgegenstellen. Später einmal wird man uns fragen: Wo wart ihr?;"Z+ (abopflichtiger Inhalt);
        
    Proteste im Iran";Politik, Proteste im Iran, Iran, Teheran, Protest, USA, Europäische Union, Demonstration;2026-01-14T20:03:41+01:00;2026-01-14T20:03:41+01:00;Ulrich Ladurner;Aus der        ZEIT Nr. 03/2026;false
d4563f865b25d98ca294a7cfc946519b6cfe93bc0bec3dcf04803861a78e7355;Hamburg hat die Wahl - Ende Mai Referendum zu Olympia;https://www.zeit.de/news/2026-01/14/tschentscher-hofft-auf-klare-mehrheit-fuer-olympia-referendum;Hier finden Sie Informationen zu dem Thema „Referendum“. Lesen Sie jetzt „Hamburg hat die Wahl - Ende Mai Referendum zu Olympia“.;Referendum;News, Referendum, Peter Tschentscher, Pierre Rabadan, Hamburg, Paris, Olympia, Olympische Spiele, Referendum;2026-01-14T19:53:27+01:00;2026-01-14T19:53:27+01:00;;dpa Hamburg/Schleswig-Holstein;false
fc786df0ff7afdf327b91b44762a378ebe38f7970c4bbfb3a4cd691b4685d302;Welches Gesetz Merz streichen würde;https://www.zeit.de/news/2026-01/14/welches-gesetz-merz-streichen-wuerde;Hier finden Sie Informationen zu dem Thema „Wirtschaftslage“. Lesen Sie jetzt „Welches Gesetz Merz streichen würde“.;Wirtschaftslage;News, Wirtschaftslage, Friedrich Merz, CDU, Neujahrsempfang, Wirtschaftslage;2026-01-14T19:48:48+01:00;2026-01-14T19:48:48+01:00;;dpa Sachsen;false
b05d90ead2ac18a3cb12aa8d640d1ff09727da4a237895e9f07115241da74758;Mainzer Hong wieder bei Ex-Club - Schopp geht ins Ausland;https://www.zeit.de/news/2026-01/14/mainzer-hong-setzt-leihe-bei-ex-club-in-belgien-fort;Hier finden Sie Informationen zu dem Thema „Fußball-Bundesliga“. Lesen Sie jetzt „Mainzer Hong wieder bei Ex-Club - Schopp geht ins Ausland“.;Fußball-Bundesliga;News, Fußball-Bundesliga, Belgien, FC Nantes, 1. FSV Mainz 05, Fußball-Bundesliga, Bundesliga, Saisonbeginn;2026-01-14T19:47:51+01:00;2026-01-14T19:47:51+01:00;;dpa Rheinland-Pfalz/Saarland;false
734b3126fd0a21e2d4970b28c04f8a3bb8b30321de1eef19929fbe6d0294e9b1;Selenskyj ruft Ausnahmezustand im Energiesektor aus;https://www.zeit.de/politik/ausland/ukraine-krieg-news-liveblog;"Hilfsstellen für Betroffene von Stromausfällen sollen verstärkt, Ausgangssperren angepasst werden. Die Folgen russischer Angriffe seien ""ernst"", warnt Selenskyj. Liveblog";Liveblog:                     Krieg gegen die Ukraine;Politik, Krieg gegen die Ukraine, Krieg in der Ukraine, Marco Rubio, Florida, Waffenruhe, Russland, Polen;2026-01-15T06:19:36+00:00;2026-01-15T06:19:36+00:00;Katharina JamesChristina FelschenMarla  Noss;;false
0f7e449c24def76f4a7d5b59e1bb18986f03e993c91fa43092bffdbb1a1d1d16;Schulze kündigt neue Entwicklung nach Domo-Insolvenz an;https://www.zeit.de/news/2026-01/14/schulze-kuendigt-neue-entwicklung-nach-domo-insolvenz-an;Hier finden Sie Informationen zu dem Thema „Industrie unter Druck“. Lesen Sie jetzt „Schulze kündigt neue Entwicklung nach Domo-Insolvenz an“.;Industrie unter Druck;News, Industrie unter Druck, Sven Schulze, Reiner Haseloff, Domo, Brandenburg, Leuna, Premnitz, Sachsen-Anhalt, Chemicals, Handwerkskammer, CDU;2026-01-14T19:43:49+01:00;2026-01-14T19:43:49+01:00;;dpa Berlin/Brandenburg;false
bdbd0aac32f953243db5537f76ab551ae2a16f9894f44f1e93585432bd95335e;Merz wirft SPD wegen Debatte um Erbschaftsteuer Verunsicherung vor;https://www.zeit.de/politik/deutschland/2026-01/bundeskanzler-friedrich-merz-erbschaftsteuer-absage;Vor Wirtschaftsvertretern hat Merz die SPD-Vorschläge zur Erbschaftsteuer abgelehnt. Er verwies aber auf mögliche Folgen eines baldigen Bundesverfassungsgerichtsurteils.;Bundeskanzler;Politik, Bundeskanzler, Erbschaftsteuer, Friedrich Merz, Bundesverfassungsgericht, SPD, CDU, Steuerpolitik;2026-01-14T19:39:50+01:00;2026-01-14T19:39:50+01:00;svj;DIE ZEIT,        dpa,        Reuters,        AFP,        							svj;false
30d19f13fceb6245d97a2a364909b5a94add057fe408518141fdb415b1fb9f48;Fahrer überholt auf Standstreifen und zeigt Mittelfinger;https://www.zeit.de/news/2026-01/14/fahrer-ueberholt-auf-standstreifen-und-zeigt-mittelfinger;Hier finden Sie Informationen zu dem Thema „Verkehr“. Lesen Sie jetzt „Fahrer überholt auf Standstreifen und zeigt Mittelfinger“.;Verkehr;News, Verkehr, Polizei, Standstreifen, Mittelfinger, Verkehr;2026-01-14T19:38:45+01:00;2026-01-14T19:38:45+01:00;;dpa Rheinland-Pfalz/Saarland;false
f5eff141d6ca78f7dae3ee3e2808fdb7cc1009bfd38dfee1494c327b17e7f9fe;Merz wirft SPD wegen Erbschaftsteuer Verunsicherung vor;https://www.zeit.de/news/2026-01/14/merz-wirft-spd-wegen-erbschaftsteuer-verunsicherung-vor;Hier finden Sie Informationen zu dem Thema „Wirtschaftslage“. Lesen Sie jetzt „Merz wirft SPD wegen Erbschaftsteuer Verunsicherung vor“.;Wirtschaftslage;News, Wirtschaftslage, Friedrich Merz, SPD, CDU, Neujahrsempfang, Erbschaftsteuer, Verunsicherung, Wirtschaftslage;2026-01-14T19:38:21+01:00;2026-01-14T19:38:21+01:00;;dpa;false
d4e928df8f961f70be4211942c542f5f4ea2a9f65415c9c5ba46a340682d13af;USA wollen Vergabe von Einwanderungsvisa für 75 Länder stoppen;https://www.zeit.de/politik/ausland/2026-01/usa-migrationspolitik-visa-vergabe-stopp;Die US-Regierung will Antragsteller abweisen, die mutmaßlich Sozialleistungen erhalten würden. Der Vergabeprozess wird überprüft, Anträge vorerst auf Eis gelegt.;US-Migrationspolitik;Politik, US-Migrationspolitik, US-Regierung, Visum, Migration, USA, Fox News, Ausländerpolitik;2026-01-14T19:34:31+01:00;2026-01-14T19:34:31+01:00;ale;DIE ZEIT,        Reuters,        AP,        							ale;false
ff332185d006930f18c887138c777b6221d5f8700d8568f83882a0569670a9ed;Aktivisten: Mehr als 3.400 Demonstranten im Iran getötet;https://www.zeit.de/news/2026-01/14/trump-droht-iran-erneut-mit-hartem-eingreifen-der-usa;Hier finden Sie Informationen zu dem Thema „Lage im Iran“. Lesen Sie jetzt „Aktivisten: Mehr als 3.400 Demonstranten im Iran getötet“.;Lage im Iran;News, Lage im Iran, Donald Trump, Iran, USA, Teheran, Detroit, Republikaner (USA), CBS News;2026-01-14T19:25:29+01:00;2026-01-14T19:25:29+01:00;;dpa;false
08565d29c99361a9e3c67ace8fa5135eca6d601d53859d93a20b23f2dd0e525a;Elon Musk bestreitet KI-Generierung von sexualisierten Kinderbildern;https://www.zeit.de/digital/2026-01/ki-chatbot-grok-elon-musk-sexualisiserte-bilder-minderjaehrige;Nutzer können Elon Musks Chatbot Grok dazu auffordern, freizügige Bilder von Menschen zu generieren – auch von Kindern. Der Milliardär will davon keine Kenntnis haben.;KI-Chatbot Grok;Digital, KI-Chatbot Grok, Elon Musk, X, künstliche Intelligenz, Chatbot, Sexualisierte Gewalt an Kindern;2026-01-14T19:25:28+01:00;2026-01-14T19:25:28+01:00;skö;DIE ZEIT,        Reuters,        							skö;false
f7fae62f65ecce3ab3b72f6b7d2151814b9d9537a02480d0b30c09d0a2fe9c9c;Merz kritisiert Umgang mit Bas auf Arbeitgebertag;https://www.zeit.de/news/2026-01/14/merz-kritisiert-umgang-mit-bas-auf-arbeitgebertag;Hier finden Sie Informationen zu dem Thema „Wirtschaftslage“. Lesen Sie jetzt „Merz kritisiert Umgang mit Bas auf Arbeitgebertag“.;Wirtschaftslage;News, Wirtschaftslage, Friedrich Merz, Bärbel Bas, CDU, SPD, Neujahrsempfang, Arbeitgebertag, Wirtschaftslage;2026-01-14T19:25:18+01:00;2026-01-14T19:25:18+01:00;;dpa Sachsen;false
14a293705bb010127aa7e8d3eaf0d0004e8d5faddd814caa10d60c5d60dd5fde;Werder Bremen trennt sich endgültig von Naby Keita;https://www.zeit.de/news/2026-01/14/werder-bremen-trennt-sich-endgueltig-von-naby-keita;Hier finden Sie Informationen zu dem Thema „Fußball-Bundesliga“. Lesen Sie jetzt „Werder Bremen trennt sich endgültig von Naby Keita“.;Fußball-Bundesliga;News, Fußball-Bundesliga, Naby Keïta, SV Werder Bremen, Fußball-Bundesliga, Bundesliga;2026-01-14T19:15:21+01:00;2026-01-14T19:15:21+01:00;;dpa Niedersachsen;false
2835f8622fa65fe65b7d28c7ca8cd621c338b985df5da9c5565a64b9dc459462;Umfrage: Viele Mütter würden länger arbeiten;https://www.zeit.de/news/2026-01/14/umfrage-viele-muetter-wuerden-laenger-arbeiten;Hier finden Sie Informationen zu dem Thema „Fachkräftemangel“. Lesen Sie jetzt „Umfrage: Viele Mütter würden länger arbeiten“.;Fachkräftemangel;News, Fachkräftemangel, Prognos, Deutsche Presse-Agentur, Umfrage, Mütter, Fachkräftemangel, Teilzeitarbeit;2026-01-14T19:11:14+01:00;2026-01-14T19:11:14+01:00;;dpa;false
fe8fe39be8d14ecb2de42049b375f2aa132b303448ea8ef7b321281fd10c5c8f;Kritik an erleichtertem Abschuss von Wölfen;https://www.zeit.de/news/2026-01/14/wie-geht-es-weiter-fuer-den-wolf-bundestag-beraet;Hier finden Sie Informationen zu dem Thema „Tiere“. Lesen Sie jetzt „Kritik an erleichtertem Abschuss von Wölfen“.;Tiere;News, Tiere, Alois Rainer, Cem Özdemir, Russland, Deutscher Bundestag, CSU, Bundesregierung, ARD, CDU, SPD, Problemwolf;2026-01-14T19:08:55+01:00;2026-01-14T19:08:55+01:00;;dpa;false
08baa059841bb37f162676e19ae77b6bf457bfef8c7e824e8287fb1f711b18ac;Merz räumt Fehler bei Kommunikation der Koalition ein;https://www.zeit.de/news/2026-01/14/merz-raeumt-fehler-bei-kommunikation-der-koalition-ein;Hier finden Sie Informationen zu dem Thema „Wirtschaftslage“. Lesen Sie jetzt „Merz räumt Fehler bei Kommunikation der Koalition ein“.;Wirtschaftslage;News, Wirtschaftslage, Friedrich Merz, CDU, Neujahrsempfang, Kommunikation, Koalition, Wirtschaftslage;2026-01-14T19:08:24+01:00;2026-01-14T19:08:24+01:00;;dpa Sachsen;false
87240851e948b4c12fce622ef5f6c4c9bd95c42610d5435497c4e9459852db2d;Frankreichs Regierung übersteht erneut Minderheitsvoten;https://www.zeit.de/politik/ausland/2026-01/frankreich-regierung-misstrauensvotum;Obwohl Frankreich gegen den Mercosur-Deal votiert hatte, initiierte die Opposition in Paris nach der EU-Zustimmung Misstrauensabstimmungen. Sie erhielten keine Mehrheit. ;Mercosur-Abkommen;Politik, Mercosur-Abkommen, Frankreich, Paris, Misstrauensvotum, Mercosur, Europäische Union, Rassemblement National;2026-01-14T19:02:47+01:00;2026-01-14T19:02:47+01:00;svj;DIE ZEIT,        dpa,        							svj;false
d07501e1a212d134214f8def9a910a9b797378039d971367a23b66b6181f2e3c;Der Schlaks aus dem Ghetto gegen den Greis mit der Macht;https://www.zeit.de/politik/ausland/2026-01/wahlen-uganda-bobi-wine-yoweri-museveni-praesidentschaft;Uganda wählt und viele träumen von einem Sieg des populären Musikers Bobi Wine. Doch seine Anhänger fürchten die Gewalt des Regimes von Altherrscher Yoweri Museveni.;Wahlen in Uganda;Politik, Wahlen in Uganda, Yoweri Museveni, Uganda, Wahlkampf, Korruption, Afrika, Musiker;2026-01-14T19:02:13+01:00;2026-01-14T19:02:13+01:00;Andrea Böhm;;false
f7304c22c2365bcff9db0106d8af6a28465f310aac86d533e3aa5bd4c578e58b;Jetzt wird Trump selbst der AfD suspekt;https://www.zeit.de/politik/deutschland/2026-01/afd-donald-trump-distanz-alice-weidel-tino-chrupalla-venezuela-groenland;Bisher umschmeichelte die AfD Donald Trump bedingungslos. Doch seit der Grönland-Debatte merkt die Partei: Zu viel Maga könnte ihr schaden. ;US-Republikaner;Politik, US-Republikaner, Alternative für Deutschland, Donald Trump, Grönland, Alice Weidel, Tino Chrupalla, Politische Rechte;2026-01-14T19:01:09+01:00;2026-01-14T19:01:09+01:00;Tilman Steffen;;false
b18c910d41084ad93eb7f9a262f344c8a2dce72b7ebdd56c951b47d10b059f90;Internationale Ermittler schalten bekannten Cybercrime-Dienst ab;https://www.zeit.de/gesellschaft/zeitgeschehen/2026-01/betrug-hacking-cyberkriminalitaet-redvds-polizei;Die Plattform RedVDS diente rund 13.000 Nutzern als Grundlage für Betrug im Netz und Hacking-Angriffe. Jetzt haben deutsche Behörden den Dienst gesperrt. ;Cyberkriminalität;Gesellschaft, Cyberkriminalität, Betrug, Kriminalität, Polizei, Hackerangriff, Kryptowährung, Internet;2026-01-14T18:58:47+01:00;2026-01-14T18:58:47+01:00;wlk;DIE ZEIT,        Reuters,        AFP,        dpa,        							wlk;false
42cc7f5dc16184e3a35083611392e82fd309d967a8d6c68927c53dcd5843f8eb;Hunderte demonstrieren in Berlin für Freiheit im Iran;https://www.zeit.de/news/2026-01/14/hunderte-demonstrieren-in-berlin-fuer-freiheit-im-iran;Hier finden Sie Informationen zu dem Thema „Massenproteste im Iran“. Lesen Sie jetzt „Hunderte demonstrieren in Berlin für Freiheit im Iran“.;Massenproteste im Iran;News, Massenproteste im Iran, Berlin, Iran, Massenprotest, Freiheit;2026-01-14T18:55:12+01:00;2026-01-14T18:55:12+01:00;;dpa Berlin/Brandenburg;false
93ac8411bad9e5d33d650efd466d3f9e6b736df6882c672b454aaa9a22146ac5;Vogelgrippe: Stallpflicht für Geflügel am Rhein bleibt;https://www.zeit.de/news/2026-01/14/vogelgrippe-stallpflicht-fuer-gefluegel-am-rhein-bleibt;Hier finden Sie Informationen zu dem Thema „Verlängerung der Maßnahme“. Lesen Sie jetzt „Vogelgrippe: Stallpflicht für Geflügel am Rhein bleibt“.;Verlängerung der Maßnahme;News, Verlängerung der Maßnahme, Landwirtschaftsminister, Rhein, Stallpflicht, Geflügel, Vogelgrippe;2026-01-14T18:51:47+01:00;2026-01-14T18:51:47+01:00;;dpa Baden-Württemberg;false
0aa5d2b33c18084e2f710f8e684ad0a8f95571f80724fe793779b0896d7975ea;Von der Leyen wieder mit Misstrauensvotum konfrontiert;https://www.zeit.de/news/2026-01/14/von-der-leyen-wieder-mit-misstrauensvotum-konfrontiert;Hier finden Sie Informationen zu dem Thema „Europäisches Parlament“. Lesen Sie jetzt „Von der Leyen wieder mit Misstrauensvotum konfrontiert“.;Europäisches Parlament;News, Europäisches Parlament, Ursula von der Leyen, Roberta Metsola, Marine Le Pen, Straßburg, Europa, Brasilien, Argentinien, Uruguay, Paraguay, Europäisches Parlament;2026-01-14T18:49:17+01:00;2026-01-14T18:49:17+01:00;;dpa;false
addb92e13c5b559e556b6e51d7fe57ae74cd2b93c4100bea5a8f8ba92b6c7a8e;USA verkünden Beginn von zweiter Phase des Gaza-Friedensplans;https://www.zeit.de/politik/ausland/2025-10/krieg-gaza-israel-hamas-liveblog;Die Waffenruhe im Gazastreifen trat im Oktober 2025 in Kraft. Jetzt soll die zweite Phase inklusive einer Demilitarisierung des Küstengebiets beginnen. Das Liveblog;Liveblog:                     Krieg in Gaza;Politik, Krieg in Gaza, Israel, Gazastreifen, Nahost, Hamas, Benjamin Netanjahu, Militär;2026-01-15T06:22:51+00:00;2026-01-15T06:22:51+00:00;Johanna SetheEric Voigt;;false
8fbaae97683e209973c82cfe2f4df005d1d0143cfcd50216707dd53abad3d8f8;"Merz zu Haseloff: ""Du wirst mir fehlen""";https://www.zeit.de/news/2026-01/14/merz-zu-haseloff-du-wirst-mir-fehlen;"Hier finden Sie Informationen zu dem Thema „Neuer Ministerpräsident“. Lesen Sie jetzt „Merz zu Haseloff: ""Du wirst mir fehlen""“.";Neuer Ministerpräsident;News, Neuer Ministerpräsident, Merz zu Haseloff, Friedrich Merz, Reiner Haseloff, Sven Schulze, Sachsen-Anhalt, CDU, Neujahrsempfang, Landtagswahl;2026-01-14T18:46:34+01:00;2026-01-14T18:46:34+01:00;;dpa Sachsen;false
01227ff53b8ffcfe7cd41f8636541511d40036835916dcaeba8579a1d0e3e909;Großrazzia gegen Schwarzarbeit in Nagelstudios;https://www.zeit.de/news/2026-01/14/grossrazzia-gegen-schwarzarbeit-in-nagelstudios;Hier finden Sie Informationen zu dem Thema „Schleuserkriminalität“. Lesen Sie jetzt „Großrazzia gegen Schwarzarbeit in Nagelstudios“.;Schleuserkriminalität;News, Schleuserkriminalität, Stuttgart, Nordrhein-Westfalen, Baden-Württemberg, Hessen, Düsseldorf, Köln, Dortmund, Landkreis Darmstadt-Dieburg, Bundespolizei, Staatsanwaltschaft;2026-01-14T18:43:33+01:00;2026-01-14T18:43:33+01:00;;dpa Baden-Württemberg;false
f2455bea7cd7b1b9c290c875a0d6f6dc2dc5cb2f1d9a4407c4f721ada6dc9d29;Vom Sockel holen, was da gar nicht mehr steht;https://www.zeit.de/kultur/2026-01/klaus-lederer-und-die-staatsstreicher-richard-wagner;Berlins linker Ex-Kultursenator Klaus Lederer beschäftigt sich auf einer Kleinkunstbühne mit Richard Wagner. Ist das lustig?;"Z+ (abopflichtiger Inhalt);
        
    Klaus Lederer & Die Staatsstreicher";Kultur, Klaus Lederer & Die Staatsstreicher, Berlin, Oper, Richard Wagner, Kulturbetrieb, Kunst, Klaus Lederer;2026-01-14T18:43:17+01:00;2026-01-14T18:43:17+01:00;Thomas E. Schmidt;;false
dedce38cf6f922ed93cee6928289da3f1d2b24398d8586a67bcfe331fdbfb1dc;Essen fast fertig;https://www.zeit.de/2026/03/kartoffeln-berlin-morgenpost-osterland-agrar-4000-tonnen;In Berlin sind 4.000 Tonnen Erdäpfel aus Sachsen zu verschenken. Was ist da passiert – und wer schlägt zu?;"Z+ (abopflichtiger Inhalt);
        
    Kartoffeln in Berlin";Kultur, Kartoffeln in Berlin, Lebensmittel, Ernte, Gemüse, Landwirtschaft, Berlin, Sachsen, Matthias Claudius;2026-01-14T18:43:08+01:00;2026-01-14T18:43:08+01:00;Elisabeth von Thadden;Aus der        ZEIT Nr. 03/2026;false
afeffcf718762d825b76e5b834a0015b589cfdad2b24f335d3a29cc4ee2ea59b;Warum wir Stillen radikal neu denken müssen;https://www.zeit.de/familie/2026-01/stillen-baby-frauen-feminismus;Ein Baby zu stillen, soll die natürlichste Sache der Welt sein. Nicht unbedingt, denn das Narrativ um die Mutterbrust dient vor allem dazu, Frauen unter Druck zu setzen.;"Z+ (abopflichtiger Inhalt);
        
    Stillen";Familie, Stillen, Mütter, Feminismus, Frauen, WHO, Babynahrung;2026-01-14T18:42:33+01:00;2026-01-14T18:42:33+01:00;Lisa Kreuzmann;;false
1b2ab80a0a99454d5ebbe7d997d3e4988407d6aa959635cc526bf2522a46813d;Personal verlässt US-Militärstützpunkt in Katar;https://www.zeit.de/news/2026-01/14/personal-soll-us-militaerstuetzpunkt-in-katar-verlassen;Hier finden Sie Informationen zu dem Thema „Proteste im Iran“. Lesen Sie jetzt „Personal verlässt US-Militärstützpunkt in Katar“.;Proteste im Iran;News, Proteste im Iran, Katar, Iran, USA, Al-Udeid, Doha, Militär;2026-01-14T18:34:48+01:00;2026-01-14T18:34:48+01:00;;dpa;false
46ebdd400bf13f257f05b40ca52ca1611874ada604edd6ea35ce97928cf8bdb4;Brandsätze an Kirche geworfen - Verdächtiger gefasst;https://www.zeit.de/news/2026-01/14/wurfbrandsaetze-auf-kirche-verdaechtiger-gefasst;Hier finden Sie Informationen zu dem Thema „Brandstiftung“. Lesen Sie jetzt „Brandsätze an Kirche geworfen - Verdächtiger gefasst“.;Brandstiftung;News, Brandstiftung, Wurfbrandsatz, Brandstiftung;2026-01-14T18:31:52+01:00;2026-01-14T18:31:52+01:00;;dpa Rheinland-Pfalz/Saarland;false
80085e279a46aeca0d478054a234806516eb4783f17547832a52b5af64c697f5;Straftäter nach Syrien und Afghanistan abgeschoben;https://www.zeit.de/news/2026-01/14/straftaeter-nach-syrien-und-afghanistan-abgeschoben;Hier finden Sie Informationen zu dem Thema „Migration“. Lesen Sie jetzt „Straftäter nach Syrien und Afghanistan abgeschoben“.;Migration;News, Migration, Syrien, Afghanistan, Bundesinnenministerium, Bundespolizei, Flughafen München, Migration, Körperverletzung;2026-01-14T18:28:38+01:00;2026-01-14T18:28:38+01:00;;dpa Niedersachsen;false
e74a0dcee20e4e04c32e0df3430edaa3fe9207447d73c26a48d60967f38c03e8;Schalkes Matriciani meldet sich nach Kreuzband-Operation;https://www.zeit.de/news/2026-01/14/schalkes-matriciani-meldet-sich-nach-kreuzband-operation;Hier finden Sie Informationen zu dem Thema „Schwere Verletzung“. Lesen Sie jetzt „Schalkes Matriciani meldet sich nach Kreuzband-Operation“.;Schwere Verletzung;News, Schwere Verletzung, Schalke, Verletzung, Kreuzband;2026-01-14T18:26:51+01:00;2026-01-14T18:26:51+01:00;;dpa Nordrhein-Westfalen;false
5ef677b6163af99752d741df16c1fc06b96fcf63f01f9facf42b29aadc21ffca;Erneut verurteilter Straftäter nach Afghanistan abgeschoben;https://www.zeit.de/news/2026-01/14/erneut-verurteilter-straftaeter-nach-afghanistan-abgeschoben;Hier finden Sie Informationen zu dem Thema „Migration“. Lesen Sie jetzt „Erneut verurteilter Straftäter nach Afghanistan abgeschoben“.;Migration;News, Migration, München, Kabul, Afghanistan, Migration, Vergewaltigung;2026-01-14T18:26:13+01:00;2026-01-14T18:26:13+01:00;;dpa Bayern;false
cd649e5b70ce08b3b10cda6427728e38223a86fc275dc8dd20f38b9cfdcace20;Jüdisches Leben am Rhein: Von Schum bis heute;https://www.zeit.de/news/2026-01/14/juedisches-leben-am-rhein-von-schum-bis-heute;Hier finden Sie Informationen zu dem Thema „5 Jahre Welterbe Schum-Stätten“. Lesen Sie jetzt „Jüdisches Leben am Rhein: Von Schum bis heute“.;5 Jahre Welterbe Schum-Stätten;News, 5 Jahre Welterbe Schum-Stätten, Alexander Schweitzer, Schum, Speyer, Worms, Mainz, Alpen, Pfalz, Rhein, Rheinland-Pfalz, Heide;2026-01-14T18:24:33+01:00;2026-01-14T18:24:33+01:00;;dpa Rheinland-Pfalz/Saarland;false
9d83ff45f837d4ab97af2cbe8722db52ee6ab60d767cd3a539282afed8b1a50b;"""Wacklige Beine"": Hase/Volodin nach EM-Kurzprogramm Zweiter";https://www.zeit.de/news/2026-01/14/wacklige-beine-hase-volodin-nach-em-kurzprogramm-zweiter;"Hier finden Sie Informationen zu dem Thema „Wintersport“. Lesen Sie jetzt „""Wacklige Beine"": Hase/Volodin nach EM-Kurzprogramm Zweiter“.";Wintersport;News, Wintersport, Minerva Hase, Eiskunstlauf-Europameisterschaft, Olympische Spiele, Wintersport, Eis;2026-01-14T18:23:37+01:00;2026-01-14T18:23:37+01:00;;dpa Sport;false
b88014179361dc6c91af2da55fe2b281a88e9a01a5890ffdf20d270e05757646;Zoo Dresden mit mehr Gästen und pelzigen Zugängen;https://www.zeit.de/news/2026-01/14/zoo-dresden-mit-mehr-gaesten-und-pelzigen-zugaengen;Hier finden Sie Informationen zu dem Thema „Inventur im Zoo“. Lesen Sie jetzt „Zoo Dresden mit mehr Gästen und pelzigen Zugängen“.;Inventur im Zoo;News, Inventur im Zoo, Dresden, Inventur, Tiere, Todesfall;2026-01-14T18:20:46+01:00;2026-01-14T18:20:46+01:00;;dpa Sachsen;false
9fa64820b161c20318debf769da3177cc8dc9a1c168e58cfb19a4f42b4caf4d2;Thyssenkrupp Steel: IG Metall lehnt weiteren Stellenabbau ab;https://www.zeit.de/news/2026-01/14/thyssenkrupp-steel-ig-metall-lehnt-weiteren-stellenabbau-ab;Hier finden Sie Informationen zu dem Thema „Jindal will Stahlsparte kaufen“. Lesen Sie jetzt „Thyssenkrupp Steel: IG Metall lehnt weiteren Stellenabbau ab“.;Jindal will Stahlsparte kaufen;News, Jindal will Stahlsparte kaufen, Knut Giesler, IG Metall, ThyssenKrupp, Thyssenkrupp Steel Europe, Rheinische Post, Stahlsparte, Stellenabbau, Metall;2026-01-14T18:19:40+01:00;2026-01-14T18:19:40+01:00;;dpa Nordrhein-Westfalen;false
4266b682d119b76e9c68a686df74a1a3d44d9afe0b54c90fef7f6f2ac4518a52;Nach Millionen-Coup: Sparkasse öffnet SB-Bereich;https://www.zeit.de/news/2026-01/14/nach-millionen-coup-sparkasse-oeffnet-sb-bereich;Hier finden Sie Informationen zu dem Thema „Nach spektakulärem Einbruch“. Lesen Sie jetzt „Nach Millionen-Coup: Sparkasse öffnet SB-Bereich“.;Nach spektakulärem Einbruch;News, Nach spektakulärem Einbruch, Gelsenkirchen, Polizei, Einbruch, Selbstbedienungsbereich, Geldinstitut;2026-01-14T18:17:05+01:00;2026-01-14T18:17:05+01:00;;dpa Nordrhein-Westfalen;false
65333950a2700c585a40eb43d77a0b8bacafa5166f513d960fa67d699822f83c;USA: Umsetzung von Gaza-Friedensplan geht in nächste Phase;https://www.zeit.de/news/2026-01/14/usa-umsetzung-von-gaza-friedensplan-geht-in-naechste-phase;Hier finden Sie Informationen zu dem Thema „Nahost“. Lesen Sie jetzt „USA: Umsetzung von Gaza-Friedensplan geht in nächste Phase“.;Nahost;News, Nahost, USA, Gazastreifen;2026-01-14T18:15:34+01:00;2026-01-14T18:15:34+01:00;;dpa;false
ef0dfc0e96b1dc218cc5f0e34e328d37a3d9fb24df509b84c8471e4bbc59c4ae;Achtjähriger Junge in Frankfurt vermisst;https://www.zeit.de/news/2026-01/14/achtjaehriger-junge-in-frankfurt-vermisst;Hier finden Sie Informationen zu dem Thema „Notfälle“. Lesen Sie jetzt „Achtjähriger Junge in Frankfurt vermisst“.;Notfälle;News, Notfälle, Frankfurt, Polizei, Notfall;2026-01-14T18:14:34+01:00;2026-01-14T18:14:34+01:00;;dpa Hessen;false
f872d3aa78622001f46e3f5cb916d735bd3ab56cffe124b8c2ebd531020fb7e1;Rund 200 Menschen bei Iran-Kundgebung in Erfurt;https://www.zeit.de/news/2026-01/14/rund-200-menschen-bei-iran-kundgebung-in-erfurt;Hier finden Sie Informationen zu dem Thema „Protest“. Lesen Sie jetzt „Rund 200 Menschen bei Iran-Kundgebung in Erfurt“.;Protest;News, Protest, Erfurt, Iran;2026-01-14T18:11:30+01:00;2026-01-14T18:11:30+01:00;;dpa Thüringen;false
