Hash;Title;Link;Description;Category;KeyWords;Published;LastUpdated;Author;Source;Paywall
2a615026c53cea3de5237f90bafb0d2ae07394c4ce556af3bea2515a7ad07db9;Gesprengter Geldautomat – zwei Tatverdächtige festgenommen;https://www.zeit.de/news/2026-02/23/gesprengter-geldautomat-zwei-tatverdaechtige-festgenommen;Hier finden Sie Informationen zu dem Thema „Ermittlungen“. Lesen Sie jetzt „Gesprengter Geldautomat – zwei Tatverdächtige festgenommen“.;Ermittlungen;News, Ermittlungen, Geldautomat, Ermittlung;2026-02-23T12:31:35+01:00;2026-02-23T12:31:35+01:00;;dpa Mecklenburg-Vorpommern;false
f72062c9c080233060c5ca3d4971e0fe8c1a6a31558c93bf64cfcf69a8aca07c;Totes Frühchen im Pizzakarton beschäftigt Gericht;https://www.zeit.de/news/2026-02/23/prozess-mutter-soll-totes-baby-ins-gefrierfach-gelegt-haben;Hier finden Sie Informationen zu dem Thema „Prozessauftakt“. Lesen Sie jetzt „Totes Frühchen im Pizzakarton beschäftigt Gericht“.;Prozessauftakt;News, Prozessauftakt, Totschlag;2026-02-23T12:30:27+01:00;2026-02-23T12:30:27+01:00;;dpa Niedersachsen;false
d4a9e48acfb906483e03e7f517a299d7d5656101ef071736f14c4b300bfa1af5;Hohe Lohnkosten setzen Gastgewerbe weiter unter Druck;https://www.zeit.de/news/2026-02/23/hohe-lohnkosten-setzen-gastgewerbe-weiter-unter-druck;Hier finden Sie Informationen zu dem Thema „Gaststätten“. Lesen Sie jetzt „Hohe Lohnkosten setzen Gastgewerbe weiter unter Druck“.;Gaststätten;News, Gaststätten, Michael Schmidt, Stefanie Pötzsch, Magdeburg, Sachsen-Anhalt, Hotel- und Gaststättenverband, DEHOGA, Gastgewerbe, Lohnkosten, Gaststätte, Mehrwertsteuer;2026-02-23T12:29:56+01:00;2026-02-23T12:29:56+01:00;;dpa Sachsen;false
eb9586001676de804b129e12dbc290ec58e08c5fa70479415d26fd8cc244e8c6;Trotz jüngster Angleichung: Frauen in MV verdienen weniger;https://www.zeit.de/news/2026-02/23/trotz-juengster-angleichung-frauen-in-mv-verdienen-weniger;Hier finden Sie Informationen zu dem Thema „Symbolischer Equal Pay Day“. Lesen Sie jetzt „Trotz jüngster Angleichung: Frauen in MV verdienen weniger“.;Symbolischer Equal Pay Day;News, Symbolischer Equal Pay Day, Pay Gap, Mann, Mecklenburg-Vorpommern, Equal Pay Day, Angleichung, Lohnlücke, Gender;2026-02-23T12:29:12+01:00;2026-02-23T12:29:12+01:00;;dpa Mecklenburg-Vorpommern;false
f0b8a4480f2d6079cdb3f953e8bc709be2cf5d7c321e76eac49f5b9bb1650aed;Millioneninvestitionen in Autobahnen - Auch Brücken im Fokus;https://www.zeit.de/news/2026-02/23/millioneninvestitionen-in-autobahnen-auch-bruecken-im-fokus;Hier finden Sie Informationen zu dem Thema „Modernisierung“. Lesen Sie jetzt „Millioneninvestitionen in Autobahnen - Auch Brücken im Fokus“.;Modernisierung;News, Modernisierung, Rheinland-Pfalz, die Autobahn GmbH des Bundes, Millioneninvestition, Modernisierung, Autobahn, Straßenbauprojekt;2026-02-23T12:28:47+01:00;2026-02-23T12:28:47+01:00;;dpa Rheinland-Pfalz/Saarland;false
0cd783e0a6d85a80ef9b8d874043b6393499bc047c012f8beb5709377ee943ae;Russische Sabotage? Prozess gegen Verdächtige ab Mitte März;https://www.zeit.de/news/2026-02/23/russische-sabotage-prozess-gegen-verdaechtige-ab-mitte-maerz;Hier finden Sie Informationen zu dem Thema „Bundesanwaltschaft“. Lesen Sie jetzt „Russische Sabotage? Prozess gegen Verdächtige ab Mitte März“.;Bundesanwaltschaft;News, Bundesanwaltschaft, Stuttgart, Russland, Köln, Bundesanwaltschaft, Sabotage, Spionage, Krieg in der Ukraine;2026-02-23T12:24:28+01:00;2026-02-23T12:24:28+01:00;;dpa Baden-Württemberg;false
64fd3ffc8619b35d455a384b1043bffbb6de48b7fd9dfbfb771277da7ad4c194;Weiterer Landkreis bei Projekt gegen Einsamkeit dabei;https://www.zeit.de/news/2026-02/23/weiterer-landkreis-bei-projekt-gegen-einsamkeit-dabei;Hier finden Sie Informationen zu dem Thema „Senioren“. Lesen Sie jetzt „Weiterer Landkreis bei Projekt gegen Einsamkeit dabei“.;Senioren;News, Senioren, Landkreis, Einsamkeit, Landesprogramm, Senioren;2026-02-23T12:18:58+01:00;2026-02-23T12:18:58+01:00;;dpa Thüringen;false
6f7f3b819717008b6a07856cb83656e4cb1d6b1a1a0b59aa8042989e5f6b0f9f;IHK: Ohne Zuwanderung fehlen 200.000 Arbeitskräfte bis 2035;https://www.zeit.de/news/2026-02/23/ihk-ohne-zuwanderung-fehlen-200-000-arbeitskraefte-bis-2035;Hier finden Sie Informationen zu dem Thema „Migration“. Lesen Sie jetzt „IHK: Ohne Zuwanderung fehlen 200.000 Arbeitskräfte bis 2035“.;Migration;News, Migration, Susanne Herre, IHK, IHK Region Stuttgart, Zuwanderung, Migration;2026-02-23T12:06:35+01:00;2026-02-23T12:06:35+01:00;;dpa Baden-Württemberg;false
be5a36b09f3133125e17b4a521cbb9f01cd885428b56298576b48b8649f96e5f;Müllpresse landet im Graben – 21-Jähriger verletzt;https://www.zeit.de/news/2026-02/23/muellpresse-landet-im-graben-21-jaehriger-verletzt;Hier finden Sie Informationen zu dem Thema „Unfälle“. Lesen Sie jetzt „Müllpresse landet im Graben – 21-Jähriger verletzt“.;Unfälle;News, Unfälle, Müllpresse, Unfall;2026-02-23T12:05:43+01:00;2026-02-23T12:05:43+01:00;;dpa Niedersachsen;false
7e643e9c107e831a4a15ca438bc4c12779e480ed73afe7cdbd775f7b6079bdf0;Reformgruppen fordern Erneuerung statt Kulturkampf;https://www.zeit.de/news/2026-02/23/bischoefe-suchen-dickhaeuter-mit-spagat-kuensten;Hier finden Sie Informationen zu dem Thema „Bischofskonferenz tagt“. Lesen Sie jetzt „Reformgruppen fordern Erneuerung statt Kulturkampf“.;Bischofskonferenz tagt;News, Bischofskonferenz tagt, Hugh Grant, Thomas Schüller, Georg Bätzing, Michael Gerber, Daniel Bogner, Würzburg, Rom, Westfälische Wilhelms-Universität, Katholische Kirche, Deutsche Presse-Agentur;2026-02-23T12:05:20+01:00;2026-02-23T12:05:20+01:00;;dpa Bayern;false
6119204ee6863f4214686ce969ee4f7cdca33b88fdd73c990599e7ad853d126a;"""Aktenzeichen XY"" behandelt diese Fälle aus dem Südwesten";https://www.zeit.de/news/2026-02/23/naechtlicher-ueberfall-auf-paar-beschaeftigt-aktenzeichen-xy;"Hier finden Sie Informationen zu dem Thema „Ungelöste Fälle“. Lesen Sie jetzt „""Aktenzeichen XY"" behandelt diese Fälle aus dem Südwesten“.";Ungelöste Fälle;News, Ungelöste Fälle, Mann, Karlsruhe, ZDF, Polizei, Aktenzeichen XY, Überfall;2026-02-23T12:03:59+01:00;2026-02-23T12:03:59+01:00;;dpa Baden-Württemberg;false
38c4dfec2a311c2aeeea0a9bee84b2b8390dc0b0fd1388e70813144c11bdbc7e;Mehr Extremisten steigen aus – Zahl der Fälle verdoppelt;https://www.zeit.de/news/2026-02/23/mehr-extremisten-steigen-aus-zahl-der-faelle-verdoppelt;Hier finden Sie Informationen zu dem Thema „Extremismus“. Lesen Sie jetzt „Mehr Extremisten steigen aus – Zahl der Fälle verdoppelt“.;Extremismus;News, Extremismus, Juliane Nagel, Extremismus, Aussteigerprogramm, Rechtsextrem, Neonazi;2026-02-23T12:03:57+01:00;2026-02-23T12:03:57+01:00;;dpa Sachsen;false
1d5536da80f560bad37a79374ad8f8809ba1b5e5bd52018b94cac8c68d2e3f85;In Bayern leben so viele Schafe wie nirgends in Deutschland;https://www.zeit.de/news/2026-02/23/in-bayern-leben-so-viele-schafe-wie-nirgends-in-deutschland;Hier finden Sie Informationen zu dem Thema „Tierbestand“. Lesen Sie jetzt „In Bayern leben so viele Schafe wie nirgends in Deutschland“.;Tierbestand;News, Tierbestand, Bayern, Tierbestand;2026-02-23T12:01:37+01:00;2026-02-23T12:01:37+01:00;;dpa Bayern;false
8ba1ad35f92556c24735a5d8b40c12fa97dd5977f4474dd6376c4867f2ea51ac;Mehr Verletzte bei Busunfall - Autofahrer außer Lebensgefahr;https://www.zeit.de/news/2026-02/23/mehr-verletzte-bei-busunfall-autofahrer-ausser-lebensgefahr;Hier finden Sie Informationen zu dem Thema „Rettungseinsatz“. Lesen Sie jetzt „Mehr Verletzte bei Busunfall - Autofahrer außer Lebensgefahr“.;Rettungseinsatz;News, Rettungseinsatz, Berlin-Gatow, Polizei, Busunfall, Rettungseinsatz, Lebensgefahr, Auto;2026-02-23T11:59:45+01:00;2026-02-23T11:59:45+01:00;;dpa Berlin/Brandenburg;false
cb26d38c381ce734b9e2ac18a650eeb95cb251dad2ab5e00d84617ab805418d2;Coup gegen Stuttgart: Suhl will kein Pokal-Favorit sein;https://www.zeit.de/news/2026-02/23/coup-gegen-stuttgart-suhl-will-kein-pokal-favorit-sein;Hier finden Sie Informationen zu dem Thema „Volleyball-Finale in Mannheim“. Lesen Sie jetzt „Coup gegen Stuttgart: Suhl will kein Pokal-Favorit sein“.;Volleyball-Finale in Mannheim;News, Volleyball-Finale in Mannheim, Laszlo Hollosy, Konstantin Bitter, Stuttgart, Suhl, Mannheim, VfB Suhl, MTV Stuttgart, Finale;2026-02-23T11:59:34+01:00;2026-02-23T11:59:34+01:00;;dpa Thüringen;false
01d03c6cf34ffd04794107002f0241f2d0752a7147d91ceffa4f171ae7b625b1;Rob Jetten als niederländischer Regierungschef vereidigt;https://www.zeit.de/politik/ausland/2026-02/niederlande-rob-jetten-vereidigt-d66-regierung-gxe;Der Linksliberale Rob Jetten ist der jüngste Ministerpräsident der niederländischen Geschichte. Seine Regierung hat in beiden Parlamentskammern keine Mehrheit.;Niederlande;Politik, Niederlande, Niederlande, Ministerpräsident, Parlamentswahl, Geert Wilders, Parlament, Politische Linke;2026-02-23T11:55:46+01:00;2026-02-23T11:55:46+01:00;ale;DIE ZEIT,        dpa,        AP,        							ale;false
2f5ed336fbe84383439c60b772ee766df4c6bdae5fbe8344f0ed6941441b5343;Ministerium: Impfung gegen Newcastle-Krankheit wirksam;https://www.zeit.de/news/2026-02/23/ministerium-impfung-gegen-newcastle-krankheit-wirksam;Hier finden Sie Informationen zu dem Thema „Ausbruch in Putenhaltung“. Lesen Sie jetzt „Ministerium: Impfung gegen Newcastle-Krankheit wirksam“.;Ausbruch in Putenhaltung;News, Ausbruch in Putenhaltung, Oder-Spree, Putenhaltung, Impfung, Ausbruch, Putenmastbestand;2026-02-23T11:53:32+01:00;2026-02-23T11:53:32+01:00;;dpa Berlin/Brandenburg;false
5d85f5c23acf5fec2750260d2972b04adf5eec440a915ccc460a595b50bf19cc;AfD erwartet weitere Veröffentlichungen von Überkreuzanstellungen;https://www.zeit.de/politik/deutschland/2026-02/afd-anstellungen-familie-vetternwirtschaft-gesetz-gxe;Der AfD-Bundesvorsitzende Gottschalk vermutet weitere Beschäftigungen von Freunden oder Familie in seiner Partei. Der Bundeskanzler erwägt eine Gesetzesverschärfung.;Vorwürfe der Vetternwirtschaft;Politik, Vorwürfe der Vetternwirtschaft, Alternative für Deutschland, Arbeitsplatz, Familie, Bundesregierung;2026-02-23T11:50:26+01:00;2026-02-23T11:50:26+01:00;yiliyf;DIE ZEIT,        dpa,        							yil					,        							iyf;false
525fa4d7104e8ec2c4e8fb67e4c663565219f02382c01e80a3b84e885601c680;28-Jähriger greift Familie mit Messer an - Mutter stirbt;https://www.zeit.de/news/2026-02/23/polizeieinsatz-nach-messerangriff-in-boehl-iggelheim;Hier finden Sie Informationen zu dem Thema „Kriminalität“. Lesen Sie jetzt „28-Jähriger greift Familie mit Messer an - Mutter stirbt“.;Kriminalität;News, Kriminalität, Böhl-Iggelheim, Polizei, Messerangriff, Polizeieinsatz, Kriminalität;2026-02-23T11:49:47+01:00;2026-02-23T11:49:47+01:00;;dpa Rheinland-Pfalz/Saarland;false
4985f9bdba0a0f2b42076eea8ed1fdb7abe02aa8eb14a28a30ac88da4bdf3726;Hochwassergefahr – noch ruhige Lage an Flusspegeln;https://www.zeit.de/news/2026-02/23/hochwassergefahr-noch-ruhige-lage-an-flusspegeln;Hier finden Sie Informationen zu dem Thema „Wetter“. Lesen Sie jetzt „Hochwassergefahr – noch ruhige Lage an Flusspegeln“.;Wetter;News, Wetter, Sachsen-Anhalt, Flusspegel, Hochwasservorhersagezentrale, Pegelstand, Hochwassergefahr, Wetter;2026-02-23T11:47:49+01:00;2026-02-23T11:47:49+01:00;;dpa Sachsen;false
c33a82aa77069bbaa6b81fec2bbc7fd576c46bb54729199d9ae6c77d9498f785;Telefonbetrüger erbeuten über 200.000 Euro in Oberbayern;https://www.zeit.de/news/2026-02/23/telefonbetrueger-erbeuten-ueber-200-000-euro-in-oberbayern;Hier finden Sie Informationen zu dem Thema „Trickanrufe“. Lesen Sie jetzt „Telefonbetrüger erbeuten über 200.000 Euro in Oberbayern“.;Trickanrufe;News, Trickanrufe, Oberbayern, Trickanruf, Bargeld;2026-02-23T11:44:30+01:00;2026-02-23T11:44:30+01:00;;dpa Bayern;false
b98dcd4bc68f13f07171f356efa0952f1027103e538905a77c46f7f64388b774;Auto überschlägt sich und landet auf Tram-Gleisen;https://www.zeit.de/news/2026-02/22/auto-ueberschlaegt-sich-und-landet-auf-tram-gleisen;Hier finden Sie Informationen zu dem Thema „Verkehrsunfall“. Lesen Sie jetzt „Auto überschlägt sich und landet auf Tram-Gleisen“.;Verkehrsunfall;News, Verkehrsunfall, Polizei, Verkehrsunfall, Auto;2026-02-23T11:43:23+01:00;2026-02-23T11:43:23+01:00;;dpa Berlin/Brandenburg;false
0c2b6465fc2fc6de168dec93853c34aff83d4ab68bd7386340c208eedf7d9bef;Festnahme nach Messerangriff auf 40-Jährigen in Hamburg;https://www.zeit.de/news/2026-02/23/festnahme-nach-messerangriff-auf-40-jaehrigen-in-hamburg;Hier finden Sie Informationen zu dem Thema „Kriminalität“. Lesen Sie jetzt „Festnahme nach Messerangriff auf 40-Jährigen in Hamburg“.;Kriminalität;News, Kriminalität, Hamburg, Polizei, Messerangriff, Kriminalität, Festnahme;2026-02-23T11:42:02+01:00;2026-02-23T11:42:02+01:00;;dpa Hamburg/Schleswig-Holstein;false
f5fb84fc96ff0df296e275739862beb5c15ba304192362774699a69e24d5ebc4;So oft klingelte das Kinder- und Jugendsorgentelefon 2025;https://www.zeit.de/news/2026-02/23/so-oft-klingelte-das-kinder-und-jugendsorgentelefon-2025;Hier finden Sie Informationen zu dem Thema „Hilfsangebote“. Lesen Sie jetzt „So oft klingelte das Kinder- und Jugendsorgentelefon 2025“.;Hilfsangebote;News, Hilfsangebote, Ludwig Steinert, Thüringen, Jugendsorgentelefon, Hilfsangebot;2026-02-23T11:38:01+01:00;2026-02-23T11:38:01+01:00;;dpa Thüringen;false
96997c2537d8729300a99ede57728a6ef06757976d1f7f2ad9366dff302a1026;Jetzt wird’s kribbelig für Heuschnupfen-Geplagte;https://www.zeit.de/news/2026-02/23/jetzt-wird-s-kribbelig-fuer-heuschnupfen-geplagte;Hier finden Sie Informationen zu dem Thema „Pollenflug“. Lesen Sie jetzt „Jetzt wird’s kribbelig für Heuschnupfen-Geplagte“.;Pollenflug;News, Pollenflug, Christina Endler, Baden-Württemberg, DWD, Pollenflug, Leidenszeit, Wetter;2026-02-23T11:32:44+01:00;2026-02-23T11:32:44+01:00;;dpa Baden-Württemberg;false
fee8db92a7064516eac603f7802c2e3f6664ed13157518123aeccb6fcc2ad273;80-Jährige stirbt bei Feuer in Mehrfamilienhaus;https://www.zeit.de/news/2026-02/23/80-jaehrige-stirbt-bei-feuer-in-mehrfamilienhaus;Hier finden Sie Informationen zu dem Thema „Brände“. Lesen Sie jetzt „80-Jährige stirbt bei Feuer in Mehrfamilienhaus“.;Brände;News, Brände, Wohnungsbrand, Brand;2026-02-23T11:22:41+01:00;2026-02-23T11:22:41+01:00;;dpa Bayern;false
72dccc3768342ff57363e50ca5eec12a389bf8fa9d59197cc6f50125566824ce;Wie Forscher das Rätsel um eine schwere Corona-Impfnebenwirkung lösten;https://www.zeit.de/gesundheit/2026-02/impfnebenwirkungen-astrazeneca-thrombosen-vitt-immunreaktion;Es war eine dramatische Episode der Pandemie: In seltenen Fällen verursachten Coronaimpfstoffe tödliche Thrombosen. Nun ist klar, warum. Das ist wichtig – gerade jetzt.;"Z+ (abopflichtiger Inhalt);
        
    Impfnebenwirkungen";Gesundheit, Impfnebenwirkungen, Forschung, Impfung, Impfstoff, Coronavirus, AstraZeneca;2026-02-23T11:19:50+01:00;2026-02-23T11:19:50+01:00;Kai KupferschmidtGretchen VogelAnnick Ehmann;;false
1f932f5e6f52606726c5d6ce5be1e4592b65649aa9d6e3e2ee7937cdaf432d17;Geheimnisverrat im Landtag? Ermittlungen wegen Fall Liana;https://www.zeit.de/news/2026-02/23/geheimnisverrat-im-landtag-ermittlungen-wegen-fall-liana;Hier finden Sie Informationen zu dem Thema „Ermittlungen“. Lesen Sie jetzt „Geheimnisverrat im Landtag? Ermittlungen wegen Fall Liana“.;Ermittlungen;News, Ermittlungen, Friedland, Staatsanwaltschaft, Niedersächsischer Landtag, Geheimnisverrat, Landtag, Ermittlung, Innenausschuss, Tötung, Asyl;2026-02-23T11:19:17+01:00;2026-02-23T11:19:17+01:00;;dpa Niedersachsen;false
41a44b5fee81bfa68d99a7ba2994aa8cf69910eda4edd92c47d0d2acc122308d;Aktivisten an A100 – Stadtautobahn kurz gesperrt;https://www.zeit.de/news/2026-02/23/aktivisten-an-a100-stadtautobahn-kurz-gesperrt;Hier finden Sie Informationen zu dem Thema „Blockadeaktion“. Lesen Sie jetzt „Aktivisten an A100 – Stadtautobahn kurz gesperrt“.;Blockadeaktion;News, Blockadeaktion, Berlin, Neukölln, Polizei, Stadtautobahn, Blockadeaktion;2026-02-23T11:10:36+01:00;2026-02-23T11:10:36+01:00;;dpa Berlin/Brandenburg;false
8513c4280acf187ca59bc3506aa53b6788bf8aa6b2a5597552b5f35d5828c97c;Polizei findet sechsstellige Bargeldsumme bei Kontrolle;https://www.zeit.de/news/2026-02/23/polizei-findet-sechsstellige-bargeldsumme-bei-kontrolle;Hier finden Sie Informationen zu dem Thema „Grenzkontrollen“. Lesen Sie jetzt „Polizei findet sechsstellige Bargeldsumme bei Kontrolle“.;Grenzkontrollen;News, Grenzkontrollen, Polizei, Bargeld, Grenzkontrolle;2026-02-23T11:09:45+01:00;2026-02-23T11:09:45+01:00;;dpa Bayern;false
5e1e1a1ccb0d1f7a95ac2b4b94d8b6787ae97a1363142d0954d95ddf1c30f731;Lange Bauarbeiten - Saarbrücker Stadtautobahn wird saniert;https://www.zeit.de/news/2026-02/23/lange-bauarbeiten-saarbruecker-stadtautobahn-wird-saniert;Hier finden Sie Informationen zu dem Thema „Bauprojekte“. Lesen Sie jetzt „Lange Bauarbeiten - Saarbrücker Stadtautobahn wird saniert“.;Bauprojekte;News, Bauprojekte, Saarbrücken, Saarbrücken-Schönbach, Saarbrücken-Gersweiler, Schönbach, die Autobahn GmbH des Bundes, Stadtautobahn, Bauprojekt;2026-02-23T11:09:41+01:00;2026-02-23T11:09:41+01:00;;dpa Rheinland-Pfalz/Saarland;false
128fc661a6b29e397e13b17efbf8ee347958b7cbe275bf85057bd460fdf9275b;Etliche Flüge an die US-Ostküste gestrichen;https://www.zeit.de/news/2026-02/23/etliche-fluege-an-die-us-ostkueste-gestrichen;Hier finden Sie Informationen zu dem Thema „Extrem-Wetter“. Lesen Sie jetzt „Etliche Flüge an die US-Ostküste gestrichen“.;Extrem-Wetter;News, Extrem-Wetter, Frankfurt, Blizzard, Wetter;2026-02-23T11:07:51+01:00;2026-02-23T11:07:51+01:00;;dpa Hessen;false
c5b31cd2fc1fa8ff01493de6224fd6d484185e3382bb8538296a7e5488d8a017;BBC erklärt rassistischen Zwischenruf bei Bafta-Verleihung;https://www.zeit.de/news/2026-02/23/bbc-erklaert-rassistischen-zwischenruf-bei-bafta-verleihung;Hier finden Sie Informationen zu dem Thema „Preisverleihung in London“. Lesen Sie jetzt „BBC erklärt rassistischen Zwischenruf bei Bafta-Verleihung“.;Preisverleihung in London;News, Preisverleihung in London, Delroy Lindo, Michael B. Jordan, BBC, Preisverleihung, Filmpreis, Verleihung, Drama;2026-02-23T11:03:36+01:00;2026-02-23T11:03:36+01:00;;dpa;false
30394e570504cdaa61d57d8c674ea7e704d52c1ad339936ccef9ef5456e023e5;Brand in Berufsbildungswerk in Britz – keine Verletzten;https://www.zeit.de/news/2026-02/23/brand-in-berufsbildungswerk-in-britz-keine-verletzten;Hier finden Sie Informationen zu dem Thema „Feuerwehreinsatz“. Lesen Sie jetzt „Brand in Berufsbildungswerk in Britz – keine Verletzten“.;Feuerwehreinsatz;News, Feuerwehreinsatz, Britz, Feuerwehr, Berufsbildungswerk, Feuerwehreinsatz, Berufsbildungszentrum;2026-02-23T11:02:17+01:00;2026-02-23T11:02:17+01:00;;dpa Berlin/Brandenburg;false
fa8b0f2c823ed32cb429af18eb8bce1ea849ff688c87162571eec6c6c1ffafe3;DOSB-Vorstandschef wehrt sich gegen harte Kritik an der Olympiabilanz;https://www.zeit.de/sport/2026-02/olympia-winterspiele-dosb-deutschland-otto-fricke-gxe;"Deutschlands fünfter Platz sei ""keine Glanzleistung"", sagt DOSB-Chef Otto Fricke. Zugleich kritisiert er ""Couchsportler"", die das deutsche Abschneiden schlechtredeten.";Olympia 2026;Sport, Olympia 2026, Olympische Winterspiele, Deutscher Olympischer Sportbund, Olympia, Otto Fricke, Vorstand, Italien, Mailand;2026-02-23T11:01:40+01:00;2026-02-23T11:01:40+01:00;ale;DIE ZEIT,        dpa,        							ale;false
87c2c1c80461383df57e3c57851e7a7d2963fcd02842192cb374fb6ccc104109;Zehn Ausfälle: Melsungen setzt im Europacup auf die Jugend;https://www.zeit.de/news/2026-02/23/zehn-ausfaelle-melsungen-setzt-im-europacup-auf-die-jugend;Hier finden Sie Informationen zu dem Thema „Handball“. Lesen Sie jetzt „Zehn Ausfälle: Melsungen setzt im Europacup auf die Jugend“.;Handball;News, Handball, Melsungen, Vardar, Skopje, MT Melsungen, Europacup, Ausfall, Handball, Hauptrundenspiel;2026-02-23T11:01:28+01:00;2026-02-23T11:01:28+01:00;;dpa Hessen;false
c6ceb4222d1e6637aabbac05746ab76010931ca32aabd9667271281bfea8d69e;Niederlande: Regierung vereidigt - Jetten ist Regierungschef;https://www.zeit.de/news/2026-02/23/niederlande-regierung-vereidigt-jetten-ist-regierungschef;Hier finden Sie Informationen zu dem Thema „Minderheitsregierung“. Lesen Sie jetzt „Niederlande: Regierung vereidigt - Jetten ist Regierungschef“.;Minderheitsregierung;News, Minderheitsregierung, Rob Jetten, Geert Wilders, Willem-Alexander, Niederlande, Den Haag, Robert Bosch, Parlamentswahl, Minderheitsregierung, Koalition;2026-02-23T10:59:57+01:00;2026-02-23T10:59:57+01:00;;dpa;false
7a636a2a308115b335d90ba5ab553ffcb0766a8fe48dafe1bed518953f481608;Ifo sieht Signale für Aufschwung in deutscher Wirtschaft;https://www.zeit.de/news/2026-02/23/ifo-sieht-signale-fuer-aufschwung-in-deutscher-wirtschaft;Hier finden Sie Informationen zu dem Thema „Konjunktur“. Lesen Sie jetzt „Ifo sieht Signale für Aufschwung in deutscher Wirtschaft“.;Konjunktur;News, Konjunktur, Aufschwung;2026-02-23T10:58:48+01:00;2026-02-23T10:58:48+01:00;;dpa;false
dbed008155f59f074277c83e20673f9d410408a001b64c717a5c975e8f317161;Raubüberfall in Dreieich: drei Bewohner verletzt;https://www.zeit.de/news/2026-02/23/raubueberfall-in-dreieich-drei-bewohner-verletzt;Hier finden Sie Informationen zu dem Thema „Kriminalität“. Lesen Sie jetzt „Raubüberfall in Dreieich: drei Bewohner verletzt“.;Kriminalität;News, Kriminalität, Dreieich, Polizei, Raubüberfall, Kriminalität;2026-02-23T10:58:34+01:00;2026-02-23T10:58:34+01:00;;dpa Hessen;false
9261e7b6e66bec1d2d9f7bb8b2bedb8a44a9c582d0c9dc2116483188b228a507;Falscher Polizist erbeutet 30.000 Euro nach Schockanruf;https://www.zeit.de/news/2026-02/23/falscher-polizist-erbeutet-30-000-euro-nach-schockanruf;Hier finden Sie Informationen zu dem Thema „Kriminalität“. Lesen Sie jetzt „Falscher Polizist erbeutet 30.000 Euro nach Schockanruf“.;Kriminalität;News, Kriminalität, Polizei, Schockanruf, Kriminalität;2026-02-23T10:55:27+01:00;2026-02-23T10:55:27+01:00;;dpa Rheinland-Pfalz/Saarland;false
3788d24e914938a7c0e404f89b64f27e3c19ff860027b140d8c783ec49e9c2bd;Goethe-Gymnasium setzt seit Jahren auf striktes Handyverbot;https://www.zeit.de/news/2026-02/20/goethe-gymnasium-setzt-seit-jahren-auf-striktes-handyverbot;Hier finden Sie Informationen zu dem Thema „Social Media“. Lesen Sie jetzt „Goethe-Gymnasium setzt seit Jahren auf striktes Handyverbot“.;Social Media;News, Social Media, Frank Scherler, Ksenija Bekeris, Shahin Philipp Morid, Shahin Philipp, Leonie Bollmann, Philip Steder, Julia Willie Hamburg, Schleswig-Holstein, Hamburg, Niedersachsen;2026-02-23T10:53:35+01:00;2026-02-23T10:53:35+01:00;;dpa Hamburg/Schleswig-Holstein;false
d806493e784e6641b2d05255f31d473c02a874e00e707eccb3af603a2bc957b3;BDI-Präsident fordert Festhalten an US-Zollabkommen;https://www.zeit.de/politik/2026-02/us-zoelle-bdi-praesident-peter-leibinger-zollabkommen-eu-gxe;Die EU müsse das Zollabkommen mit den USA ratifizieren, sonst drohe Unsicherheit, fordert der BDI-Präsident. Im Europaparlament regt sich jedoch Widerstand.;US-Zölle;Politik, US-Zölle, Bundesverband der Deutschen Industrie, US-Zölle, Europäische Union, USA, Donald Trump, Europäisches Parlament;2026-02-23T10:50:09+01:00;2026-02-23T10:50:09+01:00;dar;DIE ZEIT,        dpa,        							dar;false
25f9c209092126096ea00234d98d5a5bdf0bb5b341b5548e93c83fb67c8bac39;Deutsche Wirtschaft blickt etwas positiver in die Zukunft;https://www.zeit.de/wirtschaft/unternehmen/2026-02/ifo-geschaeftsklima-index-stimmung-unternehmen-deutschland-gxe;Die Wirtschaft in Deutschland startete mit Wachstum ins neue Jahr. Das wirkt sich laut dem ifo-Geschäftsklimaindex positiv auf die Stimmung in den Unternehmen aus.;Ifo-Geschäftsklimaindex;Wirtschaft, Ifo-Geschäftsklimaindex, Ifo-Index, Ökonomie, Wirtschaftswachstum, Unternehmen, Bruttoinlandsprodukt, Statistik;2026-02-23T10:49:46+01:00;2026-02-23T10:49:46+01:00;hap;DIE ZEIT,        Reuters,        							hap;false
e1f110e0b489491d8023d9a2956973ae841ecc038d055e8d6a8e1396fb85ea13;Koffer mit Leiche: Viele offene Fragen vor dem Prozess;https://www.zeit.de/news/2026-02/23/koffer-mit-leiche-anklage-gegen-bekannten-erhoben;Hier finden Sie Informationen zu dem Thema „Ermittlungen laufen weiter“. Lesen Sie jetzt „Koffer mit Leiche: Viele offene Fragen vor dem Prozess“.;Ermittlungen laufen weiter;News, Ermittlungen laufen weiter, Filderstadt, Stuttgart, Staatsanwaltschaft, Anklage, Ermittlung;2026-02-23T10:47:54+01:00;2026-02-23T10:47:54+01:00;;dpa Baden-Württemberg;false
9eb743046e54877423bfd431944c6c754d2c9a6d422d0f1594375d86ee16a398;Leere Gasspeicher - Grüne fordern Bericht von Aiwanger;https://www.zeit.de/news/2026-02/23/leere-gasspeicher-gruene-fordern-bericht-von-aiwanger;Hier finden Sie Informationen zu dem Thema „Landtag“. Lesen Sie jetzt „Leere Gasspeicher - Grüne fordern Bericht von Aiwanger“.;Landtag;News, Landtag, Hubert Aiwanger, Martin Stümpfig, Bayern, München, Bundeswirtschaftsministerium, CSU, Bundesregierung, Gasspeicher, Landtag, Füllstand;2026-02-23T10:47:26+01:00;2026-02-23T10:47:26+01:00;;dpa Bayern;false
eeb7e1496b0f85814e3dba1829bbd954af252871dbee2ff4c9c1eba5d017b16e;Polizei: Streits heute eher mit Schusswaffen ausgetragen;https://www.zeit.de/news/2026-02/23/polizei-streits-heute-eher-mit-schusswaffen-ausgetragen;Hier finden Sie Informationen zu dem Thema „Kriminalität“. Lesen Sie jetzt „Polizei: Streits heute eher mit Schusswaffen ausgetragen“.;Kriminalität;News, Kriminalität, Barbara Slowik, Berlin, Polizei, Schusswaffe, Streit, Kriminalität;2026-02-23T10:46:57+01:00;2026-02-23T10:46:57+01:00;;dpa Berlin/Brandenburg;false
