Hash;Title;Link;Description;Category;KeyWords;Published;LastUpdated;Author;Source;Paywall
a6ddff50fa48debe48f7bde3c3d27b00ee35e1b5d0b128b6f4f7defc5905f996;Meryl Streep zu Festivalbeginn in Cannes mit Ehrenpalme ausgezeichnet;https://www.zeit.de/kultur/film/2024-05/cannes-filmfestival-meryl-streep-ehrenpalme;Mit der Verleihung der Goldenen Ehrenpalme an Meryl Streep ist das diesjährige Filmfestival von Cannes eröffnet worden. Überschattet wird das Filmfest von MeToo-Debatten.;"Z+ (abopflichtiger Inhalt);
        
    
Cannes";Kultur, Cannes, Filmfestspiele von Cannes, Meryl Streep, Auszeichnung, Film, Kino, Cannes;2024-05-14T20:58:08+02:00;2024-05-14T20:58:08+02:00;;ZEIT ONLINE,        dpa,        AFP,        dar;false
f756eed319b77b10772306b91fa294651af4c3447b77c05ba6c09425aa753030;"Erster bemannter ""Starliner""-Testflug nochmal verschoben";https://www.zeit.de/news/2024-05/14/erster-bemannter-starliner-testflug-nochmal-verschoben;"Hier finden Sie Informationen zu dem Thema „Raumfahrt“. Lesen Sie jetzt „Erster bemannter ""Starliner""-Testflug nochmal verschoben“.";"Z+ (abopflichtiger Inhalt);
        
    
Raumfahrt";News, Raumfahrt, Cape Canaveral, NASA, Boeing, Starliner, Testflug;2024-05-14T20:57:53+02:00;2024-05-14T20:57:53+02:00;;dpa;false
415222cfa93e3e53f0a04943beb0ea90bd2fda6fda8a8ee6a621f55a31252972;CDU will regieren: Achse mit CSU in Bayern;https://www.zeit.de/news/2024-05/14/cdu-su-wollen-zusammenarbeit-thueringen-bayern-verbessern;Hier finden Sie Informationen zu dem Thema „Parteien“. Lesen Sie jetzt „CDU will regieren: Achse mit CSU in Bayern“.;"Z+ (abopflichtiger Inhalt);
        
    
Parteien";News, Parteien, Markus Söder, Mario Voigt, Bayern, Thüringen, Sachsen, CDU, CSU, Zusammenarbeit;2024-05-14T20:36:43+02:00;2024-05-14T20:36:43+02:00;;dpa Bayern;false
73aaa077464aa00b3ded913e9de5eaf219ec025fe4ee563c00367a95272aa269;Google verbessert Suchmaschine mit KI-Funktionen;https://www.zeit.de/news/2024-05/14/google-verbessert-suchmaschine-mit-ki-funktionen;Hier finden Sie Informationen zu dem Thema „Netzwelt“. Lesen Sie jetzt „Google verbessert Suchmaschine mit KI-Funktionen“.;"Z+ (abopflichtiger Inhalt);
        
    
Netzwelt";News, Netzwelt, Liz Reid, Sundar Pichai, USA, Google, Google Inc., Google I/O, Suchmaschine, Netzwelt, Software;2024-05-14T20:35:31+02:00;2024-05-14T20:35:31+02:00;;dpa;false
5163c02d0c6eea9934b5e5db26270a0b99bc152a62d5a5c8e61b2c030bfd2238;SPD-Fraktion wählt nächste Woche neue Spitze;https://www.zeit.de/news/2024-05/14/spd-fraktion-waehlt-naechste-woche-neue-spitze;Hier finden Sie Informationen zu dem Thema „Abgeordnetenhaus“. Lesen Sie jetzt „SPD-Fraktion wählt nächste Woche neue Spitze“.;"Z+ (abopflichtiger Inhalt);
        
    
Abgeordnetenhaus";News, Abgeordnetenhaus, Raed Saleh, Jerôme Lombard, Franziska Giffey, Berlin, SPD, Abgeordnetenhaus;2024-05-14T20:33:58+02:00;2024-05-14T20:33:58+02:00;;dpa Berlin/Brandenburg;false
9965a6d0f67573bea5e78ba64dde5a698df2a9ef2cb6e808983c7644310aed73;Björn Höcke wegen NS-Ausspruchs zu Geldstrafe verurteilt;https://www.zeit.de/politik/deutschland/2024-05/bjoern-hoecke-wegen-ns-ausspruch-zu-geldstrafe-verurteilt;Höcke beteuerte, die Herkunft einer von ihm gerufenen SA-Parole nicht gekannt zu haben. Das Gericht glaubte ihm nicht – nun muss er eine fünfstellige Summe zahlen.;"Z+ (abopflichtiger Inhalt);
        
    
AfD-Politiker";Politik, AfD-Politiker, Björn Höcke, AfD, Geldstrafe, Gericht, Nationalsozialismus, Rechtsextremismus;2024-05-14T20:33:37+02:00;2024-05-14T20:33:37+02:00;;ZEIT ONLINE,        dpa,        AFP,        dho,        ale,        dar;false
98c9dbf19ec5cee10ced13abeaf68cc8c804ff9f223b646fc027df720f873bb8;"""Grundsätzlich gilt: Gewalt ist ein Erfolgsmodell""";https://www.zeit.de/arbeit/2024-04/konfliktcoach-pflege-sicherheit-schulung-daniel-lautenschlag;Früher schulte er Türsteher, wie sie mit aggressiven Menschen umgehen – heute Pflegekräfte und Ärzte: Ein Deeskalationstrainer berichtet, welche Strategien helfen. ;Konfliktsituationen in der Pflege;Altenpflege, Krankenhaus, Pflegeheim, Pflege, Arzt, Körperverletzung;2024-05-14T20:25:36+02:00;2024-05-14T20:25:36+02:00;Henrik Rampe;;true
a8fd4596ecf785b83fe0e27808ecea903ba9492e3214ba7509fdbd03df9a0825;Mann monologisiert, Frau hört zu;https://www.zeit.de/kultur/2024-05/sexismus-wissenschaft-frauen-forschung-gleichstellung;"Selbst in Fächern, in denen es viel Forschung von Frauen gibt, reden Männer am liebsten über Männer – und vor allem sich selbst. Dagegen helfen nur neue Resonanzräume.
";"Z+ (abopflichtiger Inhalt);
        
    
Sexismus in der Wissenschaft";Kultur, Sexismus in der Wissenschaft, Sexismus, Frauen, Forschung, Männer, Ungleichheit, Gleichberechtigung, Gleichstellung;2024-05-14T20:11:45+02:00;2024-05-14T20:11:45+02:00;Isabelle Graw;;false
11b74767f878897c0be8d4c45621cf27d990a2e7ee53a55d89ccbfb63d30871c;"Watzke froh über Völler: ""Habe viel auf die Fresse gekriegt""";https://www.zeit.de/news/2024-05/14/watzke-froh-ueber-voeller-habe-viel-auf-die-fresse-gekriegt;"Hier finden Sie Informationen zu dem Thema „Fußball“. Lesen Sie jetzt „Watzke froh über Völler: ""Habe viel auf die Fresse gekriegt""“.";"Z+ (abopflichtiger Inhalt);
        
    
Fußball";News, Fußball, Hans-Joachim Watzke, Rudi Völler, BVB, Fußball;2024-05-14T20:11:34+02:00;2024-05-14T20:11:34+02:00;;dpa Nordrhein-Westfalen;false
91405b764011538445c319f7a80e3c519070748d3627a6c5daba7358e0140b0f;"Laut ""Sport-Bild"": Frimpong tendiert zu einem Wechsel";https://www.zeit.de/news/2024-05/14/laut-sport-bild-frimpong-tendiert-zu-einem-wechsel;"Hier finden Sie Informationen zu dem Thema „Bundesliga“. Lesen Sie jetzt „Laut ""Sport-Bild"": Frimpong tendiert zu einem Wechsel“.";"Z+ (abopflichtiger Inhalt);
        
    
Bundesliga";News, Bundesliga, Jeremie Frimpong, Nicola Zalewski, Leverkusen, Rom, Bundesliga;2024-05-14T20:01:53+02:00;2024-05-14T20:01:53+02:00;;dpa Nordrhein-Westfalen;false
d1aa3842740344cb58cfefe9e3245773e9232f4804b2706cdceddd7e0c5fd3fe;Berufungsgericht bestätigt Kommentarverbot gegen Donald Trump;https://www.zeit.de/politik/ausland/2024-05/donald-trump-schweigegeldprozess-kommentarverbot;Im Schweigegeldprozess darf Donald Trump sich nicht zu bestimmten Prozessbeteiligten äußern. Mit seiner Berufung gegen diesen Beschluss ist der Ex-Präsident gescheitert.;"Z+ (abopflichtiger Inhalt);
        
    
Früherer US-Präsident";Politik, Früherer US-Präsident, Donald Trump, Gerichtsverfahren, Justiz, Meinungsfreiheit, New York, USA;2024-05-14T19:59:13+02:00;2024-05-14T19:59:13+02:00;;ZEIT ONLINE,        AP,        svj;false
c2f88a59ec61dc3cd8b0dce14455ba2dd45c07a396fbb1ebe909baea9d9d51e2;Kanadische Literaturnobelpreisträgerin Alice Munro gestorben;https://www.zeit.de/news/2024-05/14/kanadische-literaturnobelpreistraegerin-alice-munro-gestorben;Hier finden Sie Informationen zu dem Thema „Literatur“. Lesen Sie jetzt „Kanadische Literaturnobelpreisträgerin Alice Munro gestorben“.;"Z+ (abopflichtiger Inhalt);
        
    
Literatur";News, Literatur, Alice Munro, Nobelpreis für Literatur;2024-05-14T19:52:42+02:00;2024-05-14T19:52:42+02:00;;dpa;false
d7ff49ee1806e202fde12c9cf8c6eaf5bd85c313863dc0a6923243214714b3d1;DFL mit zwei Terminen: Übergabe der Zweitliga-Meisterschale;https://www.zeit.de/news/2024-05/14/dfl-mit-zwei-terminen-uebergabe-der-zweitliga-meisterschale;Hier finden Sie Informationen zu dem Thema „2. Bundesliga“. Lesen Sie jetzt „DFL mit zwei Terminen: Übergabe der Zweitliga-Meisterschale“.;"Z+ (abopflichtiger Inhalt);
        
    
2. Bundesliga";News, 2. Bundesliga, Marcel Rapp, Schleswig-Holstein, St. Pauli, DFL, CDU, Holstein Kiel, Bundesliga, Übergabe, Meisterschale, Herbst;2024-05-14T19:43:42+02:00;2024-05-14T19:43:42+02:00;;dpa Hamburg/Schleswig-Holstein;false
199aa32c9893f6850eda15da5845b895e1f8ee601ba1a0eac3f0674a92b0ef9f;Ins Gefängnis für Europa;https://www.zeit.de/politik/ausland/2024-05/proteste-georgien-lazare-grigoriadis-agentengesetz-russland;Lazare Grigoriadis ist Symbolfigur der Proteste in Tbilissi. Die Demonstranten wollen nicht nur das russische Gesetz verhindern. Sie fordern eine Zukunft in Freiheit.;"Z+ (abopflichtiger Inhalt);
        
    
Proteste in Georgien";Politik, Proteste in Georgien, Georgien, Tbilissi, Russland, Demonstration, Protest, Europa, Einflussnahme;2024-05-14T19:37:15+02:00;2024-05-14T19:37:15+02:00;Luise GlumTako Robakidze;;false
d250a9378f8884f6d430f8db3beed4c67d06128e9552010db6167be2e8d609af;Literaturnobelpreisträgerin Alice Munro ist tot;https://www.zeit.de/kultur/literatur/2024-05/literaturnobelpreistraegerin-alice-munro-ist-tot;Sie war eine der angesehensten Autorinnen von Kurzgeschichten. Nun ist die kanadische Literaturnobelpreisträgerin Alice Munro im Alter von 92 Jahren gestorben.  ;"Z+ (abopflichtiger Inhalt);
        
    
Kanada";Kultur, Kanada, Alice Munro, Schriftstellerin, Literatur, Belletristik, Nobelpreis für Literatur, Tod;2024-05-14T19:32:30+02:00;2024-05-14T19:32:30+02:00;;ZEIT ONLINE,        AP,        AFP,        dar;false
e5f5bebd905b80ba0fdc16c36862dafe95d132a16570b1df4bfe84575774b304;Mihalic hält Ruf nach AfD-Verbot für voreilig;https://www.zeit.de/news/2024-05/14/mihalic-haelt-ruf-nach-afd-verbot-fuer-voreilig;Hier finden Sie Informationen zu dem Thema „Grünen-Innenpolitikerin“. Lesen Sie jetzt „Mihalic hält Ruf nach AfD-Verbot für voreilig“.;"Z+ (abopflichtiger Inhalt);
        
    
Grünen-Innenpolitikerin";News, Grünen-Innenpolitikerin, Irene Mihalic, Berlin, Münster, Alternative für Deutschland, Bündnis 90/Die Grünen, Verfassungsschutz, Bundestag;2024-05-14T19:31:19+02:00;2024-05-14T19:31:19+02:00;;dpa Berlin/Brandenburg;false
4b39af6766160bf65e2ca1c690322a8882d599c9baf6f49cf817b7f16aec14c7;FDP-Fraktion bringt Gesetzentwurf zum Bürokratieabbau ein;https://www.zeit.de/news/2024-05/14/fdp-fraktion-bringt-gesetzentwurf-zum-buerokratieabbau-ein;Hier finden Sie Informationen zu dem Thema „Partei“. Lesen Sie jetzt „FDP-Fraktion bringt Gesetzentwurf zum Bürokratieabbau ein“.;"Z+ (abopflichtiger Inhalt);
        
    
Partei";News, Partei, Stefan Naas, Hessen, Bürokratieabbau, Gesetzentwurf, Expertengremium;2024-05-14T19:28:25+02:00;2024-05-14T19:28:25+02:00;;dpa Hessen;false
43b3ab7d39bc1349f16856f5879f521a93781d9f187e2ab4615dbe85743ff619;Rushdie: Schweigegeld-Prozess könnte Trump in Haft bringen;https://www.zeit.de/news/2024-05/14/rushdie-schweigegeld-prozess-koennte-trump-in-haft-bringen;Hier finden Sie Informationen zu dem Thema „Autor“. Lesen Sie jetzt „Rushdie: Schweigegeld-Prozess könnte Trump in Haft bringen“.;"Z+ (abopflichtiger Inhalt);
        
    
Autor";News, Autor, Salman Rushdie, Stormy Daniels, Donald Trump, New York, Schweigegeldzahlung;2024-05-14T19:27:22+02:00;2024-05-14T19:27:22+02:00;;dpa Berlin/Brandenburg;false
d285e85a84b03ecf8647ca6a7f80e7ae1eeb8bd806d518731489eabfb77ccccc;Unfall mit Straßenbahn: Autofahrerin verletzt;https://www.zeit.de/news/2024-05/14/unfall-mit-strassenbahn-autofahrerin-verletzt;Hier finden Sie Informationen zu dem Thema „Ludwigshafen“. Lesen Sie jetzt „Unfall mit Straßenbahn: Autofahrerin verletzt“.;"Z+ (abopflichtiger Inhalt);
        
    
Ludwigshafen";News, Ludwigshafen, Ludwigshafen, Polizei, Unfall, Straßenbahn, Rettungswagen, Auto;2024-05-14T19:19:27+02:00;2024-05-14T19:19:27+02:00;;dpa Rheinland-Pfalz/Saarland;false
7ec713d857f8f442502c56d08bbbc0e40e316e58c48b930ef11bbb3cb6e5f765;Polizei ermittelt nach Tod von Senioren;https://www.zeit.de/news/2024-05/14/polizei-ermittelt-nach-tod-von-senioren;Hier finden Sie Informationen zu dem Thema „Notfall“. Lesen Sie jetzt „Polizei ermittelt nach Tod von Senioren“.;"Z+ (abopflichtiger Inhalt);
        
    
Notfall";News, Notfall, Polizei, Notfall, Senioren;2024-05-14T19:17:10+02:00;2024-05-14T19:17:10+02:00;;dpa Baden-Württemberg;false
68e662bd8740fbc7c05d4443ece89a9dca74de6e3157f65adee9b1382cc3d74d;Schüsse von Nürnberg: Befangenheitsantrag gegen Richter;https://www.zeit.de/news/2024-05/14/schuesse-von-nuernberg-befangenheitsantrag-gegen-richter;Hier finden Sie Informationen zu dem Thema „Prozess“. Lesen Sie jetzt „Schüsse von Nürnberg: Befangenheitsantrag gegen Richter“.;"Z+ (abopflichtiger Inhalt);
        
    
Prozess";News, Prozess, Nürnberg, Staatsanwaltschaft, Befangenheitsantrag, Strafkammer;2024-05-14T19:16:04+02:00;2024-05-14T19:16:04+02:00;;dpa Bayern;false
da69e32d3b0e6c2b2e009c9fc87c8a67029aa1a80f3cde306dce80f5bfec72e0;Schleuser-Bande: Zweiter Verdächtiger in Haft;https://www.zeit.de/news/2024-05/14/ermittlungen-gegen-schleuser-zweiter-verdaechtiger-in-haft;Hier finden Sie Informationen zu dem Thema „Razzia“. Lesen Sie jetzt „Schleuser-Bande: Zweiter Verdächtiger in Haft“.;"Z+ (abopflichtiger Inhalt);
        
    
Razzia";News, Razzia, Ermittlung, Schleuserbande, Schleuserkriminalität, Razzia;2024-05-14T19:13:59+02:00;2024-05-14T19:13:59+02:00;;dpa Nordrhein-Westfalen;false
40aa617645b380f60f3a151da1668bdd40ca6411b67ea071e69b5cc7b1b9142e;Fürstner löst Schlicke als Fürther Nachwuchschef ab;https://www.zeit.de/news/2024-05/14/fuerstner-loest-schlicke-als-fuerther-nachwuchschef-ab;Hier finden Sie Informationen zu dem Thema „Fußball“. Lesen Sie jetzt „Fürstner löst Schlicke als Fürther Nachwuchschef ab“.;"Z+ (abopflichtiger Inhalt);
        
    
Fußball";News, Fußball, Stephan Fürstner, Fürth, SpVgg Greuther Fürth, Fußball;2024-05-14T19:04:30+02:00;2024-05-14T19:04:30+02:00;;dpa Bayern;false
fdec048c060d00441ea23d78fd4e5f4ab9219e31b78dd4c51520a4ae80709f3d;"""Ich kann ja nicht jeden Tag erschüttert sein""";https://www.zeit.de/politik/deutschland/2024-05/franziska-giffey-senatorin-berlin-angriffe-politiker;Jüngst wurde Franziska Giffey von einem Bürger körperlich angegriffen. Hier erzählt die Berliner Senatorin erstmals ausführlich, was die Attacke mit ihr gemacht hat.;"Z+ (abopflichtiger Inhalt);
        
    
Franziska Giffey";Politik, Franziska Giffey, Franziska Giffey, Angriffe auf Politiker, Berlin, SPD, Matthias Ecke, Attacke;2024-05-14T19:02:45+02:00;2024-05-14T19:02:45+02:00;Jana Hensel;DIE ZEIT Nr. 22/2024;false
dc3d9edcd0d8bb90dcb214f2dc07d7f961b56b408d80d4f2f3b55869e64b5b41;Solange Gas fließt, bleibt die EU unglaubwürdig;https://www.zeit.de/wirtschaft/2024-05/russland-sanktionen-eu-gas-finanzierung-krieg;Noch immer kauft die EU in Russland Gas und füllt so Wladimir Putins Kriegskasse mit Milliarden. Kaum zu glauben, dass sie erst jetzt über Sanktionen nachdenkt.;"Z+ (abopflichtiger Inhalt);
        
    
Sanktionen gegen Russland";Wirtschaft, Sanktionen gegen Russland , Russland, Europäische Union, Sanktion, Gasversorgung, Krieg in der Ukraine, Europa;2024-05-14T18:52:12+02:00;2024-05-14T18:52:12+02:00;Anja Stehle;;false
52a6ad903f9a424da4de5b6be87ecbebd9b1b57ccbfcc08ee7844d162bbdbb23;Zweimaliger Wimbledon-Champion Murray kommt nach Stuttgart;https://www.zeit.de/news/2024-05/14/zweimaliger-wimbledon-champion-murray-kommt-nach-stuttgart;Hier finden Sie Informationen zu dem Thema „Tennis“. Lesen Sie jetzt „Zweimaliger Wimbledon-Champion Murray kommt nach Stuttgart“.;"Z+ (abopflichtiger Inhalt);
        
    
Tennis";News, Tennis, Andy Murray, Alexander Bublik, Stuttgart, Wimbledon, Tennisball, Wildcard, Teilnehmerfeld, Weissenhof;2024-05-14T18:50:45+02:00;2024-05-14T18:50:45+02:00;;dpa Baden-Württemberg;false
15d3de0b1c7006e08ed42513e4aaf2fa301b1e033ae3c8650e8918283fa43fc6;Streit in Köpenick eskaliert: SEK rückt an;https://www.zeit.de/news/2024-05/14/streit-in-koepenick-eskaliert-sek-rueckt-an;Hier finden Sie Informationen zu dem Thema „Kriminalität“. Lesen Sie jetzt „Streit in Köpenick eskaliert: SEK rückt an“.;"Z+ (abopflichtiger Inhalt);
        
    
Kriminalität";News, Kriminalität, Köpenick, Polizei, Kriminalität, Fahrzeug;2024-05-14T18:49:55+02:00;2024-05-14T18:49:55+02:00;;dpa Berlin/Brandenburg;false
4669dff026fc5be8aaeb007a72cc13bb283b2ea9afb90e2d8fe969caac0e9eda;Pro-Palästina-Protestcamp darf vor Uni bleiben;https://www.zeit.de/news/2024-05/14/pro-palaestina-protestcamp-darf-vor-uni-bleiben;Hier finden Sie Informationen zu dem Thema „Verwaltungsgerichtshof“. Lesen Sie jetzt „Pro-Palästina-Protestcamp darf vor Uni bleiben“.;"Z+ (abopflichtiger Inhalt);
        
    
Verwaltungsgerichtshof";News, Verwaltungsgerichtshof, München, Palästinensergebiet, Gazastreifen, LMU, Bayerischer Verwaltungsgerichtshof, Verwaltungsgericht, Verwaltungsgerichtshof;2024-05-14T18:49:45+02:00;2024-05-14T18:49:45+02:00;;dpa Bayern;false
de8e6f49bfbf0ee342db16811ad56af1774cf0b85192cb6a16c12463ad23efd1;Sexueller Missbrauch: Haftstrafe für Ex-Vize-Bürgermeister;https://www.zeit.de/news/2024-05/14/sexueller-missbrauch-haftstrafe-fuer-ex-vize-buergermeister;Hier finden Sie Informationen zu dem Thema „Kriminalität“. Lesen Sie jetzt „Sexueller Missbrauch: Haftstrafe für Ex-Vize-Bürgermeister“.;"Z+ (abopflichtiger Inhalt);
        
    
Kriminalität";News, Kriminalität, Daniel Wolski, Lünen, Treffen, Haftstrafe, Missbrauch, Kriminalität, Auto;2024-05-14T18:49:18+02:00;2024-05-14T18:49:18+02:00;;dpa;false
3c0c29e1a699ee8a4ad0259368af462f463964f7deed6368f85fc0b35a56cfb4;Brand in Schule im Westerwaldkreis;https://www.zeit.de/news/2024-05/14/brand-in-schule-im-westerwaldkreis;Hier finden Sie Informationen zu dem Thema „Feuerwehreinsatz“. Lesen Sie jetzt „Brand in Schule im Westerwaldkreis“.;"Z+ (abopflichtiger Inhalt);
        
    
Feuerwehreinsatz";News, Feuerwehreinsatz, Feuerwehr, Westerwaldkreis, Feuerwehreinsatz, Einsatzfahrzeug, Blaulicht;2024-05-14T18:39:36+02:00;2024-05-14T18:39:36+02:00;;dpa Rheinland-Pfalz/Saarland;false
de8e6f49bfbf0ee342db16811ad56af1774cf0b85192cb6a16c12463ad23efd1;Sexueller Missbrauch: Haftstrafe für Ex-Vize-Bürgermeister;https://www.zeit.de/news/2024-05/14/haftstrafe-fuer-ehemaligen-vize-buergermeister;Hier finden Sie Informationen zu dem Thema „Prozesse“. Lesen Sie jetzt „Sexueller Missbrauch: Haftstrafe für Ex-Vize-Bürgermeister“.;"Z+ (abopflichtiger Inhalt);
        
    
Prozesse";News, Prozesse, Daniel Wolski, Haftstrafe, Missbrauch, Landgericht;2024-05-14T18:39:33+02:00;2024-05-14T18:39:33+02:00;;dpa Nordrhein-Westfalen;false
c70f1d6803b6be779ce12afb25fc3cdfab1f6422318fb73ffd1e09a0d9c23141;Porsche feiert Start der Elektromobilität im Leipziger Werk;https://www.zeit.de/news/2024-05/14/porsche-feiert-start-der-elektromobilitaet-im-leipziger-werk;Hier finden Sie Informationen zu dem Thema „Auto“. Lesen Sie jetzt „Porsche feiert Start der Elektromobilität im Leipziger Werk“.;"Z+ (abopflichtiger Inhalt);
        
    
Auto";News, Auto, Winfried Kretschmann, Oliver Blume, Michael Kretschmer, Volker Wissing, Leipzig, Baden-Württemberg, Porsche, CDU, Porsche Macan, Elektromobilität;2024-05-14T18:38:27+02:00;2024-05-14T18:38:27+02:00;;dpa Sachsen;false
e07efd6fb58887ec616d0e31552ca05a578895662c392fe199eb802882a7735e;Gesetzesvorhaben zum Kauf von Agrarland gescheitert;https://www.zeit.de/news/2024-05/14/gesetzesvorhaben-zum-kauf-von-agrarland-gescheitert;Hier finden Sie Informationen zu dem Thema „Agrarminiterium“. Lesen Sie jetzt „Gesetzesvorhaben zum Kauf von Agrarland gescheitert“.;"Z+ (abopflichtiger Inhalt);
        
    
Agrarminiterium";News, Agrarminiterium, Axel Vogel, Landwirtschaftsminister, Brandenburg, Bündnis 90/Die Grünen, Landtagswahl, Agrarland, Gesetzesvorhaben, Agrarstrukturgesetz, Kritik;2024-05-14T18:36:58+02:00;2024-05-14T18:36:58+02:00;;dpa Berlin/Brandenburg;false
77dc3dd36aecf554c068ef3fb43f060416b38067d8c98b6239d338e3bacbd1f7;Staatsanwaltschaft fordert Bewährungsstrafe für Höcke;https://www.zeit.de/news/2024-05/14/staatsanwaltschaft-fordert-bewaehrungsstrafe-fuer-hoecke;Hier finden Sie Informationen zu dem Thema „AfD-Politiker“. Lesen Sie jetzt „Staatsanwaltschaft fordert Bewährungsstrafe für Höcke“.;"Z+ (abopflichtiger Inhalt);
        
    
AfD-Politiker";News, AfD-Politiker, Björn Höcke, Benedikt Bernzen, Merseburg, Sachsen-Anhalt, Staatsanwaltschaft, Alternative für Deutschland, Bewährungsstrafe, Schlussvortrag, Freiheitsstrafe;2024-05-14T18:28:14+02:00;2024-05-14T18:28:14+02:00;;dpa Sachsen;false
18b2185c9520f93ff0722b35e2a1f69cddb13a0112a404188106cfdb56bf0029;"""Europäisch denken und handeln"": Lewis ruft zur Wahl auf";https://www.zeit.de/news/2024-05/14/europaeisch-denken-und-handeln-lewis-ruft-zur-wahl-auf;"Hier finden Sie Informationen zu dem Thema „Uniper-Chef“. Lesen Sie jetzt „""Europäisch denken und handeln"": Lewis ruft zur Wahl auf“.";"Z+ (abopflichtiger Inhalt);
        
    
Uniper-Chef";News, Uniper-Chef, Michael Lewis, Europa, Europawahl, Uniper;2024-05-14T18:25:31+02:00;2024-05-14T18:25:31+02:00;;dpa Nordrhein-Westfalen;false
9a026b11b99dc40260222ad4d2107e073c8b87817e9b45819e57a973dd9d4685;Streit mit der Telekom: Meta verliert vor Gericht;https://www.zeit.de/news/2024-05/14/streit-mit-der-telekom-meta-verliert-vor-gericht;Hier finden Sie Informationen zu dem Thema „Facebook-Mutter“. Lesen Sie jetzt „Streit mit der Telekom: Meta verliert vor Gericht“.;"Z+ (abopflichtiger Inhalt);
        
    
Facebook-Mutter";News, Facebook-Mutter, Europa, Deutsche Telekom, Meta, Facebook, Instagram, WhatsApp, Smartphone, Nutzungsentgelt, Transport, Erfolg;2024-05-14T18:24:16+02:00;2024-05-14T18:24:16+02:00;;dpa Nordrhein-Westfalen;false
8b560d629addfd217d7e85498d2044f3b32d4688454486d273ddb39991adcbd2;Streit um Klavier: Mann mit Schreckschusswaffe bedroht;https://www.zeit.de/news/2024-05/14/streit-um-klavier-mann-mit-schreckschusswaffe-bedroht;Hier finden Sie Informationen zu dem Thema „Polizeieinsatz“. Lesen Sie jetzt „Streit um Klavier: Mann mit Schreckschusswaffe bedroht“.;"Z+ (abopflichtiger Inhalt);
        
    
Polizeieinsatz";News, Polizeieinsatz, Hannover, Bundespolizei, Schreckschusswaffe, Klavier, Polizeieinsatz, Polizeifahrzeug, Hauptbahnhof;2024-05-14T18:22:28+02:00;2024-05-14T18:22:28+02:00;;dpa Niedersachsen;false
77dc3dd36aecf554c068ef3fb43f060416b38067d8c98b6239d338e3bacbd1f7;Staatsanwaltschaft fordert Bewährungsstrafe für Höcke;https://www.zeit.de/news/2024-05/14/staatsanwaltschaft-bewaehrungsstrafe-fuer-afd-politiker-hoecke;Hier finden Sie Informationen zu dem Thema „Prozess“. Lesen Sie jetzt „Staatsanwaltschaft fordert Bewährungsstrafe für Höcke“.;"Z+ (abopflichtiger Inhalt);
        
    
Prozess";News, Prozess, Björn Höcke, Benedikt Bernzen, Merseburg, Staatsanwaltschaft, Alternative für Deutschland, Bewährungsstrafe, Schlussvortrag, Freiheitsstrafe;2024-05-14T18:21:48+02:00;2024-05-14T18:21:48+02:00;;dpa Thüringen;false
e24b48d4bd68236efd8e3d546bfe0684294f38c523c5e9327df69104b5ab9251;Ermittlungen nach Angriff auf Schäubles Grab;https://www.zeit.de/news/2024-05/14/schaeubles-grab-geschaendet-ermittlungen-laufen-weiter;Hier finden Sie Informationen zu dem Thema „Kriminalität“. Lesen Sie jetzt „Ermittlungen nach Angriff auf Schäubles Grab“.;"Z+ (abopflichtiger Inhalt);
        
    
Kriminalität";News, Kriminalität, Wolfgang Schäuble, Offenburg, Staatsanwaltschaft, CDU, SPD, Ermittlung, Trauerfeier, Trauer;2024-05-14T18:21:10+02:00;2024-05-14T18:21:10+02:00;;dpa Baden-Württemberg;false
8059ea8025390e6d79d8781865e997d8cfbf5cab14bb76460a780a70a2713cbb;Volle Straßen an Pfingsten: Kurzurlauber und Karnevalisten;https://www.zeit.de/news/2024-05/14/volle-strassen-an-pfingsten-kurzurlauber-und-karnevalisten;Hier finden Sie Informationen zu dem Thema „Feiertage“. Lesen Sie jetzt „Volle Straßen an Pfingsten: Kurzurlauber und Karnevalisten“.;"Z+ (abopflichtiger Inhalt);
        
    
Feiertage";News, Feiertage, Berlin, Kreuzberg, Pfingsten, Karneval der Kulturen, Feiertag, Pfingstwochenende;2024-05-14T18:19:54+02:00;2024-05-14T18:19:54+02:00;;dpa Berlin/Brandenburg;false
5cefd9cd9c839a9f5804d688d98bddbc6033d978ef2d136b9e270ec567ea15ff;Höchste Auszeichnung Greifswalds verliehen;https://www.zeit.de/news/2024-05/14/hoechste-auszeichnung-greifswalds-verliehen;Hier finden Sie Informationen zu dem Thema „Kunst“. Lesen Sie jetzt „Höchste Auszeichnung Greifswalds verliehen“.;"Z+ (abopflichtiger Inhalt);
        
    
Kunst";News, Kunst, Caspar David Friedrich, Birte Frenssen, Greifswald, Auszeichnung;2024-05-14T18:17:59+02:00;2024-05-14T18:17:59+02:00;;dpa Mecklenburg-Vorpommern;false
5687ff37f9dc7add71e079e5ba7882da2fbbd8f463614cbffa76552b94e6e131;Freispruch: Tödliche Messerstiche waren Notwehr;https://www.zeit.de/news/2024-05/14/freispruch-toedliche-messerstiche-waren-notwehr;Hier finden Sie Informationen zu dem Thema „Prozesse“. Lesen Sie jetzt „Freispruch: Tödliche Messerstiche waren Notwehr“.;"Z+ (abopflichtiger Inhalt);
        
    
Prozesse";News, Prozesse, Düsseldorf, Amtsgericht, Messerstich, Freispruch, Notwehr, Landgericht;2024-05-14T18:15:19+02:00;2024-05-14T18:15:19+02:00;;dpa Nordrhein-Westfalen;false
cdb65176b7a631b13a6d27c87a6f64f9abffddc1d3a14f6ee812ee280f0ed0da;Was mache ich hier?;https://www.zeit.de/kultur/film/2024-05/auf-trockenen-graesern-nuri-bilge-ceylan-tuerkei-film;"Großes Erzählkino, politisches Stimmungsbild und Zustandsbeschreibung der Türkei: In seinem Film ""Auf trockenen Gräsern"" zeigt Nuri Bilge Ceylan seine gespaltene Heimat.";"Z+ (abopflichtiger Inhalt);
        
    
""Auf trockenen Gräsern""";"Kultur, ""Auf trockenen Gräsern"", Filmrezension, Film, Kino, Regisseur, Türkei, Nuri Bilge Ceylan";2024-05-14T18:07:43+02:00;2024-05-14T18:07:43+02:00;Anke Leweke;;false
