Hash;Title;Link;Description;Category;KeyWords;Published;LastUpdated;Author;Source;Paywall
a7b2fcd25e012f806514786a6d89e8ddcce6abb9011a3603273167265e311b14;"Kovac reagiert auf Kruse-Kritik: ""Das geht gar nicht""";https://www.zeit.de/news/2024-03/17/kovac-reagiert-auf-kruse-kritik-das-geht-gar-nicht;"Hier finden Sie Informationen zu dem Thema „Bundesliga“. Lesen Sie jetzt „Kovac reagiert auf Kruse-Kritik: ""Das geht gar nicht""“.";Bundesliga;News, Bundesliga, Niko Kovač, Wolfsburg, VfL Wolfsburg, FC Augsburg, Bundesliga, Kritik;2024-03-17T09:38:06+01:00;2024-03-17T09:38:06+01:00;;dpa Niedersachsen;false
e9880c947c13b47bf05f97826ef4e43141fc0e69d4a9271258d89da31058c062;Katrin Göring-Eckardt fordert Korrektur der Schuldenbremse;https://www.zeit.de/wirtschaft/2024-03/bundestagsvizepraesidentin-katrin-goering-eckardt-schuldenbremse;"Die Unsicherheit über Bundesgeld sorgt laut Katrin Göring-Eckardt überall in Deutschland für Probleme. Die Ampel solle daher ""die starren Schuldenregeln aufbrechen"".";Bundestagsvizepräsidentin;Wirtschaft, Bundestagsvizepräsidentin, Katrin Göring-Eckardt, Bundestag, Schuldenbremse, Ampelkoalition, FDP, Bundeshaushalt;2024-03-17T09:37:37+01:00;2024-03-17T09:37:37+01:00;;ZEIT ONLINE,        dpa,        svj;false
2f9b8e071f44ffc3b15fddc5e66168f3067b43fb140fd8acc767710dee250e8c;SC Potsdam im Viertelfinale vor unangenehmer Aufgabe;https://www.zeit.de/news/2024-03/17/sc-potsdam-im-viertelfinale-vor-unangenehmer-aufgabe;Hier finden Sie Informationen zu dem Thema „Volleyball“. Lesen Sie jetzt „SC Potsdam im Viertelfinale vor unangenehmer Aufgabe“.;Volleyball;News, Volleyball, Raquel Lazaro, Greta Kiss, Potsdam, SC Potsdam, Volleyball, Punktgewinn;2024-03-17T09:37:03+01:00;2024-03-17T09:37:03+01:00;;dpa Berlin/Brandenburg;false
7fb916fb404fb56c9541b4cdada892e216f0a303b1b02ce428e9558a17336b0b;Vogt fordert wegen Bahn Reform des Streikrechts;https://www.zeit.de/news/2024-03/16/vogt-fordert-wegen-bahn-reform-des-streikrechts;Hier finden Sie Informationen zu dem Thema „Tarife“. Lesen Sie jetzt „Vogt fordert wegen Bahn Reform des Streikrechts“.;Tarife;News, Tarife, Christopher Vogt, Claus Weselsky, Schleswig-Holstein, FDP, GDL, Streikrecht, Tarifkonflikt;2024-03-17T09:35:09+01:00;2024-03-17T09:35:09+01:00;;dpa Hamburg/Schleswig-Holstein;false
8f6f96f47564d44a58908205ada6d544b15e84678288a5600688f89c912e30ad;Betrunkener fährt Schlangenlinien und gegen Leitplanken;https://www.zeit.de/news/2024-03/17/betrunkener-faehrt-schlangenlinien-und-gegen-leitplanken;Hier finden Sie Informationen zu dem Thema „Kriminalität“. Lesen Sie jetzt „Betrunkener fährt Schlangenlinien und gegen Leitplanken“.;Kriminalität;News, Kriminalität, Polizei, Schlangenlinie, Leitplanke, Blaulicht, Kriminalität;2024-03-17T09:33:12+01:00;2024-03-17T09:33:12+01:00;;dpa Bayern;false
abb8244a8e6d36675fa7ac0f47cb286814cbfb613267a0cda4ce7d631649368c;30 Jahre Zentrum für Niederdeutsch in Leck;https://www.zeit.de/news/2024-03/17/30-jahre-zentrum-fuer-niederdeutsch-in-leck;Hier finden Sie Informationen zu dem Thema „Kultur“. Lesen Sie jetzt „30 Jahre Zentrum für Niederdeutsch in Leck“.;Kultur;News, Kultur, Hermann Neuton Paulsen, Johannes Callsen, Niederdeutsch, Modellschule;2024-03-17T09:33:10+01:00;2024-03-17T09:33:10+01:00;;dpa Hamburg/Schleswig-Holstein;false
f4e76c7ec88de0adef11340337bb523ca66be93724c5ed223bc4382a5bfb1058;Eine musikalische Zeremonienmeisterin aus Marokko;https://www.zeit.de/news/2024-03/17/eine-musikalische-zeremonienmeisterin-aus-marokko;Hier finden Sie Informationen zu dem Thema „Reflektor-Festival“. Lesen Sie jetzt „Eine musikalische Zeremonienmeisterin aus Marokko“.;Reflektor-Festival;News, Reflektor-Festival, Hind Ennaira, André Heller, Florian Boesch, Franz Schubert, Marokko;2024-03-17T09:23:43+01:00;2024-03-17T09:23:43+01:00;;dpa Hamburg/Schleswig-Holstein;false
ee2f958678cea8f946d0b04462539a91e524b39a75097d321507d081d5ab1aa9;Falsche Geldanlage: Seniorin um 150.000 Euro betrogen;https://www.zeit.de/news/2024-03/17/falsche-geldanlage-seniorin-um-150-000-euro-betrogen;Hier finden Sie Informationen zu dem Thema „Kriminalität“. Lesen Sie jetzt „Falsche Geldanlage: Seniorin um 150.000 Euro betrogen“.;Kriminalität;News, Kriminalität, Geldanlage, Smartphone, Kriminalität;2024-03-17T09:23:32+01:00;2024-03-17T09:23:32+01:00;;dpa Sachsen;false
5bdeacffa199e95acf7bb51ceab11c678bf95256b05972ddbe53df535eb77f74;14-jähriger Radfahrer von abbiegendem Auto schwer verletzt;https://www.zeit.de/news/2024-03/17/14-jaehriger-radfahrer-von-abbiegendem-auto-schwer-verletzt;Hier finden Sie Informationen zu dem Thema „Unfälle“. Lesen Sie jetzt „14-jähriger Radfahrer von abbiegendem Auto schwer verletzt“.;Unfälle;News, Unfälle, Polizei, Unfall, Blaulicht, Auto;2024-03-17T09:20:01+01:00;2024-03-17T09:20:01+01:00;;dpa Baden-Württemberg;false
531fe8f2088a7668728c8ee07db884d38d1698bca8481e6c5074f3e86d215d6c;Fürther Negativserie geht weiter;https://www.zeit.de/news/2024-03/16/fuerther-negativserie-geht-weiter-rostock-gewinnt-1-0;Hier finden Sie Informationen zu dem Thema „2. Bundesliga“. Lesen Sie jetzt „Fürther Negativserie geht weiter“.;2. Bundesliga;News, 2. Bundesliga, Markus Kolke, Nico Neidhart, Rostock, SpVgg Greuther Fürth, Hansa Rostock, Bundesliga, Negativserie;2024-03-17T09:19:44+01:00;2024-03-17T09:19:44+01:00;;dpa Bayern;false
89dada0596ac791086751f131fb8bb0a2e6f3f1665679bef0c8345b29ba40ce3;"Nicht ""von Brücke springen"": Bochums Frust vor der Pause";https://www.zeit.de/news/2024-03/17/nicht-von-bruecke-springen-bochums-frust-vor-der-pause;"Hier finden Sie Informationen zu dem Thema „Bundesliga“. Lesen Sie jetzt „Nicht ""von Brücke springen"": Bochums Frust vor der Pause“.";Bundesliga;News, Bundesliga, Bo Henriksen, Thomas Letsch, Bochum, Mainz, VfL Bochum, 1. FSV Mainz 05, Bundesliga, Frust;2024-03-17T09:18:42+01:00;2024-03-17T09:18:42+01:00;;dpa Nordrhein-Westfalen;false
d7c5e458672c644068dd15259f462de3cf29b133a23d5ef718ae1bde84df5318;Köln fliegt ins Trainingslager nach Alicante;https://www.zeit.de/news/2024-03/17/koeln-fliegt-ins-trainingslager-nach-alicante;Hier finden Sie Informationen zu dem Thema „Fußball“. Lesen Sie jetzt „Köln fliegt ins Trainingslager nach Alicante“.;Fußball;News, Fußball, Mark Uth, Timo Schultz, Alicante, Köln, Leipzig, 1. FC Köln, RB Leipzig, Trainingslager, Fußball;2024-03-17T09:18:29+01:00;2024-03-17T09:18:29+01:00;;dpa Nordrhein-Westfalen;false
41bc725b896d90b2ce9be020fb5669502e218e17ba51433576834508e7d90656;"Sondersitzung: ""Ungereimtheiten"" um Angriff in Duisburg";https://www.zeit.de/news/2024-03/17/sondersitzung-ungereimtheiten-um-angriff-in-duisburg;"Hier finden Sie Informationen zu dem Thema „Landtag“. Lesen Sie jetzt „Sondersitzung: ""Ungereimtheiten"" um Angriff in Duisburg“.";Landtag;News, Landtag, Duisburg, FDP, SPD, Staatsanwaltschaft, Ungereimtheit, Landtag, Angriff, Messerangriff, Tatort, Rechtsausschuss;2024-03-17T09:17:08+01:00;2024-03-17T09:17:08+01:00;;dpa Nordrhein-Westfalen;false
d17275f2abec7862817220200ee28afa2d867e7a37349acc7b5068184f354c19;Rund 25 Schafe ohne Besitzer auf Straße unterwegs;https://www.zeit.de/news/2024-03/17/rund-25-schafe-ohne-besitzer-auf-strasse-unterwegs;Hier finden Sie Informationen zu dem Thema „Tiere“. Lesen Sie jetzt „Rund 25 Schafe ohne Besitzer auf Straße unterwegs“.;Tiere;News, Tiere, Polizei, Schafherde, Tiere;2024-03-17T09:14:28+01:00;2024-03-17T09:14:28+01:00;;dpa Rheinland-Pfalz/Saarland;false
fbf9b6bcdb48c681b7631a85151f7d5ab2c98c20334d0c5d0048cb28b562cdd8;Land macht Millionenplus durch Erbschaften;https://www.zeit.de/news/2024-03/17/land-macht-millionenplus-durch-erbschaften;Hier finden Sie Informationen zu dem Thema „Verwaltung“. Lesen Sie jetzt „Land macht Millionenplus durch Erbschaften“.;Verwaltung;News, Verwaltung, Niedersachsen, Millionenplus, Erbschaft, Erbschaftsteuererklärung;2024-03-17T09:13:50+01:00;2024-03-17T09:13:50+01:00;;dpa Niedersachsen;false
f5bfbb6d575c2185a5490ad3624e7ca99d2c4876b03cd00e5253e01c854497fa;Joyn-Chefin: Unsere Türen stehen offen für alle Partner;https://www.zeit.de/news/2024-03/17/joyn-chefin-unsere-tueren-stehen-offen-fuer-alle-partner;Hier finden Sie Informationen zu dem Thema „Medien“. Lesen Sie jetzt „Joyn-Chefin: Unsere Türen stehen offen für alle Partner“.;Medien;News, Medien, Katharina Frömsdorf, Berlin, RTL, Deutsche Presse-Agentur, Streaming;2024-03-17T09:13:30+01:00;2024-03-17T09:13:30+01:00;;dpa Bayern;false
c74a958c6cfd034e25efcc9dc66e04a361c0eca550135658c139a053145965ec;Unbekannte rauben 71-Jähriger die Handtasche;https://www.zeit.de/news/2024-03/17/unbekannte-rauben-71-jaehriger-die-handtasche;Hier finden Sie Informationen zu dem Thema „Kriminalität“. Lesen Sie jetzt „Unbekannte rauben 71-Jähriger die Handtasche“.;Kriminalität;News, Kriminalität, Offenbach, Polizei, Handtasche, Motorhaube, Streifenwagen, Kriminalität;2024-03-17T09:12:45+01:00;2024-03-17T09:12:45+01:00;;dpa Hessen;false
c36bcfb4fd9156ec43e565440157881601df349cbe88bf6a3944d16a57cf91a9;Heiter und wolkig in Sachsen: Nachts Frost;https://www.zeit.de/news/2024-03/17/heiter-und-wolkig-in-sachsen-nachts-frost;Hier finden Sie Informationen zu dem Thema „Wetter“. Lesen Sie jetzt „Heiter und wolkig in Sachsen: Nachts Frost“.;Wetter;News, Wetter, Sachsen, Ostsachsen, Wetter;2024-03-17T09:12:21+01:00;2024-03-17T09:12:21+01:00;;dpa Sachsen;false
1449199c5f982d84dd0e2ad3a5db61e19a0457defc9dedd9b8a7bfb9713f14ad;Mix aus Sonne und Wolken in Thüringen;https://www.zeit.de/news/2024-03/17/mix-aus-sonne-und-wolken-in-thueringen;Hier finden Sie Informationen zu dem Thema „Wetter“. Lesen Sie jetzt „Mix aus Sonne und Wolken in Thüringen“.;Wetter;News, Wetter, Thüringen, Wetter;2024-03-17T09:11:40+01:00;2024-03-17T09:11:40+01:00;;dpa Thüringen;false
74bb5096bf6ec1ad7d225c1487d431f6c20290fb5ac350de4fd5bff5d9ef2ef1;Niedersachsen sagt Inseln Hilfe bei Stränden zu;https://www.zeit.de/news/2024-03/17/niedersachsen-sagt-inseln-hilfe-bei-straenden-zu;Hier finden Sie Informationen zu dem Thema „Nach Sturmflutschäden“. Lesen Sie jetzt „Niedersachsen sagt Inseln Hilfe bei Stränden zu“.;Nach Sturmflutschäden;News, Nach Sturmflutschäden, Damp, Niedersachsen, Ostfriesisch Insel, Norderney, Baltrum, Wangerooge, Nordseeküste, Sturmflutschaden, Strand, Sturmflutsaison;2024-03-17T09:10:51+01:00;2024-03-17T09:10:51+01:00;;dpa Hamburg/Schleswig-Holstein;false
4694a8a9700acc28a4178a27b976bcfe1684eadac56784521042fbcf465b6400;Jagdverband gegen Schonzeitverkürzungen;https://www.zeit.de/news/2024-03/17/jagdverband-gegen-schonzeitverkuerzungen;Hier finden Sie Informationen zu dem Thema „Verbände“. Lesen Sie jetzt „Jagdverband gegen Schonzeitverkürzungen“.;Verbände;News, Verbände, Hubert Aiwanger, Fläming, Freie Wähler, Schonzeitverkürzung, Jagdverband, Rehwild, Schonzeit, Naturpark, Jagdministerium;2024-03-17T09:10:27+01:00;2024-03-17T09:10:27+01:00;;dpa Bayern;false
53d5b3ebf8e451b8281ea6f86ad6e4e2c371844ff786115cd81df08a4e13b54e;"Pavlovic über Goretzka: ""Er ist nicht sauer auf mich""";https://www.zeit.de/news/2024-03/17/pavlovic-ueber-goretzka-er-ist-nicht-sauer-auf-mich;"Hier finden Sie Informationen zu dem Thema „Bundesliga“. Lesen Sie jetzt „Pavlovic über Goretzka: ""Er ist nicht sauer auf mich""“.";Bundesliga;News, Bundesliga, Aleksandar Pavlovic, Leon Goretzka, Christoph Freund, Julian Nagelsmann, München, Bayern, Bundesliga;2024-03-17T09:09:48+01:00;2024-03-17T09:09:48+01:00;;dpa Bayern;false
90ab3844a037111a5609944df3e72b97c59afda3639392eaf0f7865437e7ad32;Fachleute beobachten seltenere Brutvögel;https://www.zeit.de/news/2024-03/17/fachleute-beobachten-seltenere-brutvoegel;Hier finden Sie Informationen zu dem Thema „Tiere“. Lesen Sie jetzt „Fachleute beobachten seltenere Brutvögel“.;Tiere;News, Tiere, Ulrich Maurer, Donau, Baden-Württemberg, Moorfrosch, Fachleute, Vögelvorkommen, Brutvogelart, Tiere;2024-03-17T09:07:29+01:00;2024-03-17T09:07:29+01:00;;dpa Baden-Württemberg;false
d1460be306fff4f13cf50fc04f68d69fe23823e7d0bdc90c25a215ec066d4a2f;Turner Toba verpasst Medaille beim DTB-Pokal;https://www.zeit.de/news/2024-03/17/turner-toba-verpasst-medaille-beim-dtb-pokal;Hier finden Sie Informationen zu dem Thema „Turnen“. Lesen Sie jetzt „Turner Toba verpasst Medaille beim DTB-Pokal“.;Turnen;News, Turnen, Pascal Brendel, Andreas Toba, Stuttgart, Medaille, Doppelsalto, Königsgerät, Finale, Metall;2024-03-17T09:06:53+01:00;2024-03-17T09:06:53+01:00;;dpa Baden-Württemberg;false
a39fa070ae5d8e4179fa2860901b0d8364c2d08436f310270a8fd3f3a1e6d1fb;Bundestrainer Nagelsmann erwischt VfB-Duo mit Anruf im Bett;https://www.zeit.de/news/2024-03/17/bundestrainer-nagelsmann-erwischt-vfb-duo-mit-anruf-im-bett;Hier finden Sie Informationen zu dem Thema „Bundesliga“. Lesen Sie jetzt „Bundestrainer Nagelsmann erwischt VfB-Duo mit Anruf im Bett“.;Bundesliga;News, Bundesliga, Waldemar Anton, Julian Nagelsmann, Stuttgart, VfB Stuttgart, Bundesliga, Bundestrainer;2024-03-17T09:06:16+01:00;2024-03-17T09:06:16+01:00;;dpa Baden-Württemberg;false
b6684f24ae518b8b5e45279dfb964d489b3e47d607ee2724f404f8137bd0f432;Hamburg beklagt mangelndes Engagement für Seehäfen;https://www.zeit.de/news/2024-03/17/hamburg-beklagt-mangelndes-engagement-fuer-seehaefen;Hier finden Sie Informationen zu dem Thema „Handel“. Lesen Sie jetzt „Hamburg beklagt mangelndes Engagement für Seehäfen“.;Handel;News, Handel, Melanie Leonhard, Hamburg, SPD, Deutsche Presse-Agentur, Bundesregierung, Seehafen, Eurogate, Hafenstrategie, Containerschiff;2024-03-17T09:06:01+01:00;2024-03-17T09:06:01+01:00;;dpa Hamburg/Schleswig-Holstein;false
2b5124fc29530d67e7ab677c8e700cb59b3642474e40010aab64788c80adce9e;Expertin: Digitales Weiterleben kann Trauer behindern;https://www.zeit.de/news/2024-03/17/expertin-digitales-weiterleben-kann-trauer-behindern;Hier finden Sie Informationen zu dem Thema „Gesellschaft“. Lesen Sie jetzt „Expertin: Digitales Weiterleben kann Trauer behindern“.;Gesellschaft;News, Gesellschaft, Jessica Heesen, Universität Tübingen, Uni Tübingen, Medienethik, Forschungsschwerpunkt, Trauer;2024-03-17T09:05:26+01:00;2024-03-17T09:05:26+01:00;;dpa Baden-Württemberg;false
36c29d4866a1d0cbc5a1b32158f2ebff45841097af14058103cd4bbd0084ebad;Meeresmuseum Stralsund: Tiermodelle erobern die Baustelle;https://www.zeit.de/news/2024-03/17/meeresmuseum-stralsund-tiermodelle-erobern-die-baustelle;Hier finden Sie Informationen zu dem Thema „Museen“. Lesen Sie jetzt „Meeresmuseum Stralsund: Tiermodelle erobern die Baustelle“.;Museen;News, Museen, Diana Meyen, Stralsund, Meeresmuseum, Tiermodell, Baustelle, Walhai;2024-03-17T09:03:50+01:00;2024-03-17T09:03:50+01:00;;dpa Mecklenburg-Vorpommern;false
af1b8efd79d50065bb6e62736ba0780f5bdf59356bcf83b43447a9624bee7d9b;Autounfall mit drei Schwerverletzten;https://www.zeit.de/news/2024-03/17/autounfall-mit-drei-schwerverletzten;Hier finden Sie Informationen zu dem Thema „Verkehr“. Lesen Sie jetzt „Autounfall mit drei Schwerverletzten“.;Verkehr;News, Verkehr, Autounfall, Verkehr, Einsatzfahrt, Rettungswagen;2024-03-17T09:03:31+01:00;2024-03-17T09:03:31+01:00;;dpa Baden-Württemberg;false
dc1f0929370f7d387f33a7ec840a605f278ecdd360758d9dc8b3e2083ae19b83;Drei Verletzte nach Unfall in Stuttgarter Tunnel;https://www.zeit.de/news/2024-03/16/mehrere-verletzte-nach-unfall-in-stuttgarter-tunnel;Hier finden Sie Informationen zu dem Thema „Verkehr“. Lesen Sie jetzt „Drei Verletzte nach Unfall in Stuttgarter Tunnel“.;Verkehr;News, Verkehr, Stuttgart, Unfall, Tunnel, Verkehr, Rettungswagen;2024-03-17T09:02:57+01:00;2024-03-17T09:02:57+01:00;;dpa Baden-Württemberg;false
b0a8b978f96065d65a6183699a85b88a9a7a7aaac7730263dff3bd2e117834bd;"Pokal-Held Brünker: ""Jahrhundertspiel für beide Lager""";https://www.zeit.de/news/2024-03/17/pokal-held-bruenker-jahrhundertspiel-fuer-beide-lager;"Hier finden Sie Informationen zu dem Thema „Fußball“. Lesen Sie jetzt „Pokal-Held Brünker: ""Jahrhundertspiel für beide Lager""“.";Fußball;News, Fußball, Kai Brünker, Saarbrücken, Kaiserslautern, 1. FC Kaiserslautern, DFB, DFB-Pokal, Jahrhundertspiel, Fußball;2024-03-17T09:01:51+01:00;2024-03-17T09:01:51+01:00;;dpa Rheinland-Pfalz/Saarland;false
1377aed14cca0cf43cfc358cec276df6ba2f0129282dd05a1fc6552f3c8fdff8;"Rechtsstreit: SWR will ""Newszone""-App reaktivieren";https://www.zeit.de/news/2024-03/17/rechtsstreit-swr-will-newszone-app-reaktivieren;"Hier finden Sie Informationen zu dem Thema „Medien“. Lesen Sie jetzt „Rechtsstreit: SWR will ""Newszone""-App reaktivieren“.";Medien;News, Medien, Stuttgart, SWR, Südwestrundfunk, Deutsche Presse-Agentur, Rechtsstreit, Newszone, Eis;2024-03-17T09:01:04+01:00;2024-03-17T09:01:04+01:00;;dpa Baden-Württemberg;false
e16073ec0d15c8516f6dfb38eb668ab363b1e863a687069b3324a53407e9c7d5;2700 Akten müssen bei Cannabis-Legalisierung geprüft werden;https://www.zeit.de/news/2024-03/17/2700-akten-muessen-bei-cannabis-legalisierung-geprueft-werden;Hier finden Sie Informationen zu dem Thema „Gesundheit“. Lesen Sie jetzt „2700 Akten müssen bei Cannabis-Legalisierung geprüft werden“.;Gesundheit;News, Gesundheit, Saarland, Nordrhein-Westfalen, Deutscher Richterbund, Cannabis, Strafakte;2024-03-17T09:00:17+01:00;2024-03-17T09:00:17+01:00;;dpa Rheinland-Pfalz/Saarland;false
d4e528704c62692b416a8d9d6217cd90caee0073c2c03502b5e3666df8790c0a;"""Bücher sind der sicherste Ort""";https://www.zeit.de/2024/12/lana-lux-geordnete-verhaeltnisse-roman;Lana Lux hat ein wahnsinnig gutes Buch über eine obsessive Liebe geschrieben, die im Mord endet. Warum schaut sie so gern in den Abgrund? Eine Begegnung ;Lana Lux;Kultur, Lana Lux, Schriftstellerin, Literatur, Beziehung, Frauen, Straftat, Sowjetunion, Lana Lux;2024-03-17T08:59:59+01:00;2024-03-17T08:59:59+01:00;Maja Beckers;;true
101cd64075672ef4b22f225ccdac015c91bf19e5c3c238490f33d00779829bb8;Deutlicher Anstieg bei wohnungslosen Jugendlichen;https://www.zeit.de/news/2024-03/17/deutlicher-anstieg-bei-wohnungslosen-jugendlichen;Hier finden Sie Informationen zu dem Thema „Soziales“. Lesen Sie jetzt „Deutlicher Anstieg bei wohnungslosen Jugendlichen“.;Soziales;News, Soziales, Mainz, Rheinland-Pfalz, FW, Wohnungslosigkeit;2024-03-17T08:59:48+01:00;2024-03-17T08:59:48+01:00;;dpa Rheinland-Pfalz/Saarland;false
3dbd647cb9a75eb985f29f84f39292a32f41169df017095678cfa99b4934d467;Cannabis-Legalisierung: Prüfung von knapp 10.000 Akten;https://www.zeit.de/news/2024-03/17/cannabis-legalisierung-pruefung-von-knapp-10-000-akten;Hier finden Sie Informationen zu dem Thema „Gesundheit“. Lesen Sie jetzt „Cannabis-Legalisierung: Prüfung von knapp 10.000 Akten“.;Gesundheit;News, Gesundheit, Nordrhein-Westfalen, Rheinland-Pfalz, Deutscher Richterbund, Cannabis, Strafakte;2024-03-17T08:58:58+01:00;2024-03-17T08:58:58+01:00;;dpa Rheinland-Pfalz/Saarland;false
52ceec5f77d766773dc3f30de6f612bffd4570d6b9321dc3bf14dd127e5ba13a;Hannover 96 erneut sieglos - 1:1 gegen Kaiserslautern;https://www.zeit.de/news/2024-03/17/hannover-96-erneut-sieglos-1-1-gegen-kaiserslautern;Hier finden Sie Informationen zu dem Thema „2. Bundesliga“. Lesen Sie jetzt „Hannover 96 erneut sieglos - 1:1 gegen Kaiserslautern“.;2. Bundesliga;News, 2. Bundesliga, Friedhelm Funkel, Kenny Prince Redondo, Kaiserslautern, Lautern, Niedersachsen, Hannover 96, Fußball-Bundesliga, 1. FC Kaiserslautern, Bundesliga;2024-03-17T08:55:48+01:00;2024-03-17T08:55:48+01:00;;dpa Niedersachsen;false
d6c19ae7fa7d9d5c607e40c712e1d4bfc8c093dabbea7884f1d2efc7e00a66c9;Beginn der Fahrradsaison: Erst checken, dann radeln;https://www.zeit.de/news/2024-03/17/beginn-der-fahrradsaison-erst-checken-dann-radeln;Hier finden Sie Informationen zu dem Thema „Freizeit“. Lesen Sie jetzt „Beginn der Fahrradsaison: Erst checken, dann radeln“.;Freizeit;News, Freizeit, Robert Wöhler, Rheinland-Pfalz, ADFC, Polizei, LKA, Fahrradsaison, Fahrradweg, Freizeit, Wetter, Fahrrad;2024-03-17T08:55:23+01:00;2024-03-17T08:55:23+01:00;;dpa Rheinland-Pfalz/Saarland;false
c88e8029e9b29154ee315e9c20dd0484a441af8983ce5425138a6379c3e55285;Wolkig und trocken zum Wochenstart in Berlin und Brandenburg;https://www.zeit.de/news/2024-03/17/wolkig-und-trocken-zum-wochenstart-in-berlin-und-brandenburg;Hier finden Sie Informationen zu dem Thema „Wetter“. Lesen Sie jetzt „Wolkig und trocken zum Wochenstart in Berlin und Brandenburg“.;Wetter;News, Wetter, Berlin, Brandenburg, Oderbruch, Wetter;2024-03-17T08:55:08+01:00;2024-03-17T08:55:08+01:00;;dpa Berlin/Brandenburg;false
3884056ac893455bd7128efc4ae9d8e9c1e37c990cc9eee9f6b7e933265cb8b7;München und Straubing starten erfolgreich in DEL-Playoffs;https://www.zeit.de/news/2024-03/16/straubing-fuehrt-in-den-del-playoffs-gegen-schwenningen;Hier finden Sie Informationen zu dem Thema „Eishockey“. Lesen Sie jetzt „München und Straubing starten erfolgreich in DEL-Playoffs“.;Eishockey;News, Eishockey, Tom Pokel, Straubing, Schwenningen, DEL, Straubing Tigers, Eishockey;2024-03-17T08:54:19+01:00;2024-03-17T08:54:19+01:00;;dpa Baden-Württemberg;false
22faf830e9f37ebc729002bcc23cf859f8c95a29a1e84d3ca27934f3d62e397b;Runder Tisch zu queerfeindlicher Hasskriminalität geplant;https://www.zeit.de/news/2024-03/17/runder-tisch-zu-queerfeindlicher-hasskriminalitaet-geplant;Hier finden Sie Informationen zu dem Thema „Soziales“. Lesen Sie jetzt „Runder Tisch zu queerfeindlicher Hasskriminalität geplant“.;Soziales;News, Soziales, Cansel Kiziltepe, Berlin, SPD, Hasskriminalität, Regenbogenfahne, Sicherheitsbehörde, Queerfeindlichkeit, Queerness;2024-03-17T08:52:34+01:00;2024-03-17T08:52:34+01:00;;dpa Berlin/Brandenburg;false
462475e8bc462c56b360a21bd36a2b49be17f6e7372724a8c1e7f52cc3b3aa09;Mann stirbt nach Auffahrunfall auf Autobahn;https://www.zeit.de/news/2024-03/17/mann-stirbt-nach-auffahrunfall-auf-autobahn;Hier finden Sie Informationen zu dem Thema „Verkehr“. Lesen Sie jetzt „Mann stirbt nach Auffahrunfall auf Autobahn“.;Verkehr;News, Verkehr, Auffahrunfall, Verkehr, Einsatzfahrt, Autobahn, Rettungswagen, Auto;2024-03-17T08:51:59+01:00;2024-03-17T08:51:59+01:00;;dpa Bayern;false
0ec3951e846b2aa0037c56ad00ed7e3f8e94cf3fb9f3694f85789986bc5b855c;Cannabis-Legalisierung: Prüfung von 29.000 Akten;https://www.zeit.de/news/2024-03/17/cannabis-legalisierung-pruefung-von-29-000-akten;Hier finden Sie Informationen zu dem Thema „Gesundheit“. Lesen Sie jetzt „Cannabis-Legalisierung: Prüfung von 29.000 Akten“.;Gesundheit;News, Gesundheit, München, Justizministerium, Cannabis, Strafakte;2024-03-17T08:51:33+01:00;2024-03-17T08:51:33+01:00;;dpa Bayern;false
89c7a9389542942b8a916d33df8cc1e3b4883bdb8c9562597f0819189c038975;83-Jähriger stürzt mit E-Scooter und wird schwer verletzt;https://www.zeit.de/news/2024-03/17/83-jaehriger-stuerzt-mit-e-scooter-und-wird-schwer-verletzt;Hier finden Sie Informationen zu dem Thema „Unfälle“. Lesen Sie jetzt „83-Jähriger stürzt mit E-Scooter und wird schwer verletzt“.;Unfälle;News, Unfälle, München, Unfall, Leuchtschrift, E-Scooter;2024-03-17T08:50:28+01:00;2024-03-17T08:50:28+01:00;;dpa Bayern;false
df68c4a11fb974b89a5ced210d53ffc1206cc9ec17712a89fd0926dc7a2583d3;Fachkräftemangel: Mansoori setzt auf Frauen und Migranten;https://www.zeit.de/news/2024-03/17/fachkraeftemangel-mansoori-setzt-auf-frauen-und-migranten;Hier finden Sie Informationen zu dem Thema „Arbeitsmarkt“. Lesen Sie jetzt „Fachkräftemangel: Mansoori setzt auf Frauen und Migranten“.;Arbeitsmarkt;News, Arbeitsmarkt, Hessen, Wiesbaden, SPD, Deutsche Presse-Agentur, Fachkräftemangel;2024-03-17T08:49:54+01:00;2024-03-17T08:49:54+01:00;;dpa Hessen;false
7bbe5818d3dcfcb929d453eba1830ba38429ac2fa8b82b8e5f445eb7ab890881;Bad Nauheimer Heilwald startet in erste Saison;https://www.zeit.de/news/2024-03/17/bad-nauheimer-heilwald-startet-in-erste-saison;Hier finden Sie Informationen zu dem Thema „Gesundheit“. Lesen Sie jetzt „Bad Nauheimer Heilwald startet in erste Saison“.;Gesundheit;News, Gesundheit, Steffen Schneider, Bad Nauheim, Heilwald, Barfußpfad, Kurbetrieb;2024-03-17T08:48:55+01:00;2024-03-17T08:48:55+01:00;;dpa Hessen;false
e5084cbc35e56df8aa1d675b162506fd1b35bbd10783163e24e551fe063b0c82;Spargelsaison naht: Immer weniger Anbaufläche;https://www.zeit.de/news/2024-03/17/spargelsaison-naht-immer-weniger-anbauflaeche;Hier finden Sie Informationen zu dem Thema „Agrar“. Lesen Sie jetzt „Spargelsaison naht: Immer weniger Anbaufläche“.;Agrar;News, Agrar, Patrick Wolter, Laura Heinl, Hohenseeden, Parchen, Spargelsaison, Anbaufläche, Agrargenossenschaft, Spargel, Spargelfeld, Mindestlohn;2024-03-17T08:48:01+01:00;2024-03-17T08:48:01+01:00;;dpa Sachsen;false
f773d93c466acd85003911dee3d470a6f28db662d5e713b3e7505c36903fd465;Cannabis-Legalisierung: Prüfung von mehr als 34 000 Akten;https://www.zeit.de/news/2024-03/17/cannabis-legalisierung-pruefung-von-mehr-als-34-000-akten;Hier finden Sie Informationen zu dem Thema „Gesundheit“. Lesen Sie jetzt „Cannabis-Legalisierung: Prüfung von mehr als 34 000 Akten“.;Gesundheit;News, Gesundheit, Justizminister, Nordrhein-Westfalen, Hessen, Deutscher Richterbund, Cannabis, Strafakte;2024-03-17T08:47:41+01:00;2024-03-17T08:47:41+01:00;;dpa Hessen;false
a6c9c3e5e571a6f4d829bb5174e7c63d79ce3efc611fc407f3aa54a50c2b4c78;Bundestagsvize für Korrektur der Schuldenbremse;https://www.zeit.de/news/2024-03/17/bundestagsvize-fuer-korrektur-der-schuldenbremse;Hier finden Sie Informationen zu dem Thema „Parteien“. Lesen Sie jetzt „Bundestagsvize für Korrektur der Schuldenbremse“.;Parteien;News, Parteien, Katrin Göring-Eckardt, Bündnis 90 / Die Grünen, Bundestag, Schuldenbremse, Korrektur;2024-03-17T08:46:03+01:00;2024-03-17T08:46:03+01:00;;dpa Thüringen;false
