Hash;Title;Link;Description;Category;KeyWords;Published;LastUpdated;Author;Source;Paywall
65bd00f2d9530c5f9e0a7a3b8499a2280c586f4e1f6fcfceeee63e458bb8b59e;Das hält der Acker nicht aus;https://www.zeit.de/2025/42/hitze-landwirtschaft-monokulturen-anbau-klima;Eine neue Studie zeigt: Riesige Ackerflächen heizen sich genauso stark auf wie Betonwüsten in Städten. Doch die Landwirtschaft könnte ihre Flächen kühl halten.;"Z+ (abopflichtiger Inhalt);
        
    Hitze in der Landwirtschaft";Wissen, Hitze in der Landwirtschaft, Landwirtschaft, Hitze, Klimawandel, Ernte, Brand, Erderwärmung;2025-10-06T17:45:10+02:00;2025-10-06T17:45:10+02:00;Clara Suchy;Aus der        ZEIT Nr. 42/2025;false
96ef6f23a6ef716e7b802c97606b913fe1e711ce8b93b5d353117a0964694be8;Supreme Court lehnt Berufungsantrag von Epstein-Komplizin ab;https://www.zeit.de/politik/ausland/2025-10/ghislaine-maxwell-jeffrey-epstein-berufung-supreme-court;Ghislaine Maxwell sitzt wegen sexueller Ausbeutung Minderjähriger in Haft. Gegen ihre Verurteilung setzte sie sich vor dem obersten Gerichtshof zur Wehr – erfolglos.;Fall Jeffrey Epstein;Politik, Fall Jeffrey Epstein, Jeffrey Epstein, Ausbeutung, Oberster Gerichtshof, New York, USA, Gericht;2025-10-06T17:43:40+02:00;2025-10-06T17:43:40+02:00;mga;DIE ZEIT,        Reuters,        							mga;false
3337a0d7cb07e5051addbf2613c01157a40f4c4f6aab7c43fc1899ae37544421;Rostocker Basketballer holen Amaize-Ersatz;https://www.zeit.de/news/2025-10/06/rostocker-basketballer-holen-amaize-ersatz;Hier finden Sie Informationen zu dem Thema „Basketball“. Lesen Sie jetzt „Rostocker Basketballer holen Amaize-Ersatz“.;Basketball;News, Basketball, Basketball;2025-10-06T17:38:25+02:00;2025-10-06T17:38:25+02:00;;dpa Mecklenburg-Vorpommern;false
e9e4f284b6b9bad2900cd33bfe6534d745ba40cebb4fd35e6832a43db2c39e1f;"""Wir haben im ersten Halbjahr 84 Millionen Euro Verlust gemacht""";https://www.zeit.de/arbeit/2025-09/salzgitter-ag-gunnar-groebler-stahlindustrie-zoelle-verteidigung;Billige Importe, hohe Zölle, die Stahlindustrie leidet. Hier erklärt der Chef von Salzgitter, ob die Branche noch eine Zukunft hat und wann der grüne Stahl endlich kommt.;"Z+ (abopflichtiger Inhalt);
        
    Salzgitter AG";Arbeit, Salzgitter AG, Salzgitter AG, Stahlindustrie, Salzgitter, Zoll, US-Zölle, CO2, Wasserstoff;2025-10-06T17:35:48+02:00;2025-10-06T17:35:48+02:00;Marc Widmann;;false
8ce81554da37a9841bda8a55e91ab8219842f8dcc07c59228ea960bdd0497301;Auf der Autobahn: Frau rettet gestürzten Motorradfahrer;https://www.zeit.de/news/2025-10/06/auf-der-autobahn-frau-rettet-gestuerzten-motorradfahrer;Hier finden Sie Informationen zu dem Thema „Verkehr“. Lesen Sie jetzt „Auf der Autobahn: Frau rettet gestürzten Motorradfahrer“.;Verkehr;News, Verkehr, Autobahn, Verkehr, Auto;2025-10-06T17:31:17+02:00;2025-10-06T17:31:17+02:00;;dpa Bayern;false
9254f3ecc5ced41b66830f1dc0b9be15e895935a28afa3e68af97a05daa3f6ae;Fakten? Egal!;https://www.zeit.de/2025/42/volksabstimmungen-schweiz-falschinformationen-propaganda-demokratie;Nirgendwo hat das Volk so oft das letzte Wort wie in der Schweiz. Doch wie lässt sich politische Meinungsbildung schützen, wenn bei Abstimmungen regelmäßig gelogen wird?;"Z+ (abopflichtiger Inhalt);
        
    Volksabstimmungen";Wissen, Volksabstimmungen, Volksabstimmung, Desinformation, Schweiz, Direkte Demokratie, Demokratie, Propaganda;2025-10-06T17:30:27+02:00;2025-10-06T17:30:27+02:00;Sarah JäggiMarlon Rusch;Aus der        ZEIT Nr. 42/2025;false
97f32a532d283b444173f090c94bb1004ee17881e2c1bf6632a6b8b19c0baa6f;Maisteig, Würstchen, Soße und: TikTok;https://www.zeit.de/zeit-magazin/2025-09/streetfood-kottbusser-tor-soziale-medien-test;Mitten in Berlin-Kreuzberg ist eine neue deutsche Imbisskultur entstanden. Geschmack zählt, Aussehen auch. So wollen die Gründer erst TikTok erobern und dann die Welt.;Streetfood am Kotti;Kreuzberg, Berlin, Lebensmittel, Soziale Medien, TikTok, Instagram;2025-10-06T17:29:25+02:00;2025-10-06T17:29:25+02:00;Anne Waak;;false
c16c9765c0909c097637b755832de9c21ed590e2bece3ca086ca8083269556ec;Handy am Steuer? Polizei kontrolliert vermehrt;https://www.zeit.de/news/2025-10/06/handy-am-steuer-polizei-kontrolliert-vermehrt;Hier finden Sie Informationen zu dem Thema „Verkehrssicherheit“. Lesen Sie jetzt „Handy am Steuer? Polizei kontrolliert vermehrt“.;Verkehrssicherheit;News, Verkehrssicherheit, Hannover, Focus, Polizei, Verkehrssicherheit, Musiktitel;2025-10-06T17:21:34+02:00;2025-10-06T17:21:34+02:00;;dpa Niedersachsen;false
c390f6b513f855bde7d8957ec63757fdb48dd0e3f41a7f87fecfed90c8871dac;Brandenburgs Feuerwehren bestellen Einsatzfahrzeuge online;https://www.zeit.de/news/2025-10/06/brandenburgs-feuerwehren-bestellen-einsatzfahrzeuge-online;Hier finden Sie Informationen zu dem Thema „Brand- und Katastrophenschutz“. Lesen Sie jetzt „Brandenburgs Feuerwehren bestellen Einsatzfahrzeuge online“.;Brand- und Katastrophenschutz;News, Brand- und Katastrophenschutz, René Wilke, Brandenburg, Potsdam, Einsatzfahrzeug, Feuerwehr, Katastrophenschutz, Fahrzeug;2025-10-06T17:17:23+02:00;2025-10-06T17:17:23+02:00;;dpa Berlin/Brandenburg;false
13d1540176448c698a531bf05148e2bc60c08cb3c30881ff8c167662a5b01430;Chicago schafft Verbotszonen für ICE-Einsätze;https://www.zeit.de/news/2025-10/06/chicago-schafft-verbotszonen-fuer-ice-einsaetze;Hier finden Sie Informationen zu dem Thema „Kriminalität“. Lesen Sie jetzt „Chicago schafft Verbotszonen für ICE-Einsätze“.;Kriminalität;News, Kriminalität, Brandon Johnson, Chicago, Verbotszone, Migrationsbehörde, Kriminalität, ICE;2025-10-06T17:14:09+02:00;2025-10-06T17:14:09+02:00;;dpa;false
c3de3681171bae4d289994a54c9cabffa1c65dd96606b97f0532d49f3d2fb681;"""Zu gut für die Tonne"" - Appell für mehr Nachhaltigkeit";https://www.zeit.de/news/2025-10/06/zu-gut-fuer-die-tonne-appell-fuer-mehr-nachhaltigkeit;"Hier finden Sie Informationen zu dem Thema „Ressourcen schonen“. Lesen Sie jetzt „""Zu gut für die Tonne"" - Appell für mehr Nachhaltigkeit“.";Ressourcen schonen;News, Ressourcen schonen, Jacqueline Bernhardt, Mecklenburg-Vorpommern, Nachhaltigkeit, Ressource;2025-10-06T17:07:46+02:00;2025-10-06T17:07:46+02:00;;dpa Mecklenburg-Vorpommern;false
158bf3ac87b276192ca59d62c32135a9e45f7c02125b42baf2eac630563e97e4;Gewerkschaft der Polizei fordert Konzept zur Drohnenabwehr;https://www.zeit.de/news/2025-10/06/gewerkschaft-der-polizei-fordert-konzept-zur-drohnenabwehr;Hier finden Sie Informationen zu dem Thema „Drohnenflüge“. Lesen Sie jetzt „Gewerkschaft der Polizei fordert Konzept zur Drohnenabwehr“.;Drohnenflüge;News, Drohnenflüge, Hessen, GDP, Bundespolizei, Bundeswehr, Polizei, Drohnenabwehr, Drohnenflug, Drohnensichtung, Sicherheit, Drohne;2025-10-06T17:07:08+02:00;2025-10-06T17:07:08+02:00;;dpa Hessen;false
6222c5c05e637bbfe2809a495a7c03c5e61dbde4cc0242d3d1e3d002cc6eae92;Pflegeeinrichtungen erhalten Preis für Notfall-Konzept;https://www.zeit.de/news/2025-10/06/pflegeeinrichtungen-erhalten-preis-fuer-notfall-konzept;Hier finden Sie Informationen zu dem Thema „Altenpflegepreis“. Lesen Sie jetzt „Pflegeeinrichtungen erhalten Preis für Notfall-Konzept“.;Altenpflegepreis;News, Altenpflegepreis, Stefanie Drese, Stralsund, SPD, Pflegeeinrichtung, Altenpflegepreis, Wohlfahrtseinrichtung;2025-10-06T17:06:06+02:00;2025-10-06T17:06:06+02:00;;dpa Mecklenburg-Vorpommern;false
46b9cd2b477a6c6119d4b8e99da466e82b45d83ad0c5451c892dd4bf4f05152b;Große Schleusen am Nord-Ostsee-Kanal gesperrt;https://www.zeit.de/news/2025-10/06/grosse-schleusen-am-nord-ostsee-kanal-gesperrt;Hier finden Sie Informationen zu dem Thema „Schifffahrt“. Lesen Sie jetzt „Große Schleusen am Nord-Ostsee-Kanal gesperrt“.;Schifffahrt;News, Schifffahrt, Brunsbüttel, Nord-Ostsee-Kanal, Schleuse, Schifffahrt, Schleusenkammer;2025-10-06T17:02:37+02:00;2025-10-06T17:02:37+02:00;;dpa Hamburg/Schleswig-Holstein;false
62b6f0a650a289ac1ab65c28c3bab0586cea2c7ba541dfd0c10992369fc07bc4;Hunderte Anrufe wegen des Sirenen-Fehlalarms in Hamburg;https://www.zeit.de/news/2025-10/06/hunderte-anrufe-wegen-des-sirenen-fehlalarms-in-hamburg;Hier finden Sie Informationen zu dem Thema „Notfälle“. Lesen Sie jetzt „Hunderte Anrufe wegen des Sirenen-Fehlalarms in Hamburg“.;Notfälle;News, Notfälle, Hamburg, Elbe, Polizei, Notfall, Bedienungsfehler, Notrufleitung;2025-10-06T16:59:43+02:00;2025-10-06T16:59:43+02:00;;dpa Hamburg/Schleswig-Holstein;false
501caba32bef178f2451754cb830925285c59b06665222f334460da3a0f873f1;Reizgas auf Schultoilette versprüht - 40 Schüler verletzt;https://www.zeit.de/news/2025-10/06/reizgas-auf-schultoilette-versprueht-40-schueler-verletzt;Hier finden Sie Informationen zu dem Thema „Ostwestfalen“. Lesen Sie jetzt „Reizgas auf Schultoilette versprüht - 40 Schüler verletzt“.;Ostwestfalen;News, Ostwestfalen, Ostwestfalen, Borgentreich, Höxter, Polizei, Reizgas, Schultoilette, Hubschrauber;2025-10-06T16:58:17+02:00;2025-10-06T16:58:17+02:00;;dpa Nordrhein-Westfalen;false
7232f3809a043ac9d5263dc1fe0126089773efec150be50e356d62c3cc3f174f;Kretschmer zieht positives Fazit nach Asienreise;https://www.zeit.de/news/2025-10/06/kretschmer-zieht-positives-fazit-nach-asienreise;Hier finden Sie Informationen zu dem Thema „Internationale Beziehungen“. Lesen Sie jetzt „Kretschmer zieht positives Fazit nach Asienreise“.;Internationale Beziehungen;News, Internationale Beziehungen, Michael Kretschmer, Sachsen, Asien, Taiwan, Japan, Singapur, CDU, Asienreise;2025-10-06T16:57:58+02:00;2025-10-06T16:57:58+02:00;;dpa Sachsen;false
4e0f23c7133b2bdb00f658c0448fc848ada17d1eb2a7835f2d464be7333d24af;13 Wege, wie du an der Uni Anschluss findest;https://www.zeit.de/campus/2025/44/freunde-finden-ersti-tipps-uni-anschluss;Der Start an der Uni kann überwältigend sein: eine neue Welt voller neuer Menschen. Was gegen Einsamkeit hilft, wie du besser lernst und Freunde fürs Leben findest.;"Z+ (abopflichtiger Inhalt);
        
    Freunde finden";Campus, Freunde finden, Freundschaft, Hochschule, Wohngemeinschaft, Einsamkeit, Alltag, Jugendliche;2025-10-06T16:55:37+02:00;2025-10-06T16:55:37+02:00;Christoph FarkasAnnika Karoline SchleithoffMirjam PrellNadja KirstenAnne-Lena LeidenbergerStella Lueneberg;Aus        ZEIT Campus Nr. 04/2025;false
8c228fc8b0817ee5870a91adaef0a46689c1d7a64fb061bf11f27201ee509596;Der Ulf in uns;https://www.zeit.de/kultur/film/2025-10/alphamaennchen-netflix-serie-maennlichkeit-comedy;"In der Netflixserie ""Alphamännchen"" schaffen vier verunsicherte Männer das Patriarchat ab. Nicht ganz freiwillig und nicht immer humorvoll. Aber mit erfreulichen Folgen.";"""Alphamännchen""";"Kultur, ""Alphamännchen"", Netflix, Mann, Streaming, Ulf Poschardt, Comedy, Fernsehserie";2025-10-06T16:55:00+02:00;2025-10-06T16:55:00+02:00;Annett Scheffel;;false
ba3cf6b9c8b08bafeed5a371a4c77c867a027439fd3cf7c1b59048b2d4363e60;Reifendiebe fliehen ohne Erfolg;https://www.zeit.de/news/2025-10/06/reifendiebe-fliehen-ohne-erfolg;Hier finden Sie Informationen zu dem Thema „Kriminalität“. Lesen Sie jetzt „Reifendiebe fliehen ohne Erfolg“.;Kriminalität;News, Kriminalität, Mann, Steglitz-Zehlendorf, Polizei, Reifendiebstahl, Kriminalität, Erfolg, Reifen;2025-10-06T16:54:31+02:00;2025-10-06T16:54:31+02:00;;dpa Berlin/Brandenburg;false
1b026b7a0bb69f5bff323d87f02c7c35a176828f2c6dcb862a9b4c3bf1a6e3cf;Bauarbeiten beeinträchtigen Bahnverkehr in Franken;https://www.zeit.de/news/2025-10/06/bauarbeiten-beeintraechtigen-bahnverkehr-in-franken;Hier finden Sie Informationen zu dem Thema „Strecke Würzburg-Treuchtlingen“. Lesen Sie jetzt „Bauarbeiten beeinträchtigen Bahnverkehr in Franken“.;Strecke Würzburg-Treuchtlingen;News, Strecke Würzburg-Treuchtlingen, Franken, Würzburg-Treuchtlingen, Würzburg-Ansbach-Treuchtlingen, Gunzenhausen, Würzburg, Treuchtlingen, Ansbach, Landkreis Weißenburg-Gunzenhausen, DB, Deutsche Bahn;2025-10-06T16:51:56+02:00;2025-10-06T16:51:56+02:00;;dpa Bayern;false
acb3c1a9006a45482036c6d5d4163a5c8c7ddb633a7b62b397a9c70a9567fd3f;"Metten ruft ""Dicke Sauerländer Bockwurst"" zurück";https://www.zeit.de/news/2025-10/06/metten-ruft-dicke-sauerlaender-bockwurst-zurueck;"Hier finden Sie Informationen zu dem Thema „Lebensmittelwarnung“. Lesen Sie jetzt „Metten ruft ""Dicke Sauerländer Bockwurst"" zurück“.";Lebensmittelwarnung;News, Lebensmittelwarnung, Bockwurst, Lebensmittelwarnung, Fleisch;2025-10-06T16:43:46+02:00;2025-10-06T16:43:46+02:00;;dpa;false
e3bc4c6efca2d2c6df6d05e0b3bdc9480c28f2731394bb9a482a6ecb7ec51656;Berufungsprozess im Fall Pelicot in Frankreich gestartet;https://www.zeit.de/news/2025-10/06/berufungsprozess-im-fall-pelicot-in-frankreich-startet;Hier finden Sie Informationen zu dem Thema „Missbrauch“. Lesen Sie jetzt „Berufungsprozess im Fall Pelicot in Frankreich gestartet“.;Missbrauch;News, Missbrauch, Frankreich, Nîmes, Berufungsprozess, Missbrauch, Vergewaltigung;2025-10-06T16:42:37+02:00;2025-10-06T16:42:37+02:00;;dpa;false
3879a83fe49f4fd5e60b006347e8f58f307181f280326c13c3a8a8e6f4f96683;Schleuser setzen drei junge Syrer in Grenzgebiet aus;https://www.zeit.de/news/2025-10/06/schleuser-setzen-drei-junge-syrer-in-grenzgebiet-aus;Hier finden Sie Informationen zu dem Thema „Migration“. Lesen Sie jetzt „Schleuser setzen drei junge Syrer in Grenzgebiet aus“.;Migration;News, Migration, Kiefersfelden, Polizei, Grenzgebiet, Migration, Grenze;2025-10-06T16:42:28+02:00;2025-10-06T16:42:28+02:00;;dpa Bayern;false
f14e7f2caf5386d8b054d05f0c3ec648cd2c3e13671d2e31235ee76f64c69332;Ein Toter nach Wohnungsbrand in Harvestehude;https://www.zeit.de/news/2025-10/06/ein-toter-nach-wohnungsbrand-in-harvestehude;Hier finden Sie Informationen zu dem Thema „Feuer in Hamburg“. Lesen Sie jetzt „Ein Toter nach Wohnungsbrand in Harvestehude“.;Feuer in Hamburg;News, Feuer in Hamburg, Harvestehude, Hamburg, LKA Hamburg, Polizei, LKA, Wohnungsbrand;2025-10-06T16:37:06+02:00;2025-10-06T16:37:06+02:00;;dpa Hamburg/Schleswig-Holstein;false
c2f5d8143a6a17e69f11248a098fae5845a3acd6052b5ccc9109373720cc9ecd;18-Jähriger mit Stichverletzungen in Kronberg gefunden;https://www.zeit.de/news/2025-10/06/18-jaehriger-mit-stichverletzungen-in-kronberg-gefunden;Hier finden Sie Informationen zu dem Thema „Kriminalität“. Lesen Sie jetzt „18-Jähriger mit Stichverletzungen in Kronberg gefunden“.;Kriminalität;News, Kriminalität, Polizei, Stichverletzung, Kriminalität;2025-10-06T16:32:32+02:00;2025-10-06T16:32:32+02:00;;dpa Hessen;false
e28f19ed5a1d5573c772ae46cdaf0780f533011a2c9d6229938a9650f294b47d;IStGH verurteilt erstmals Milizenführer für Kriegsverbrechen in Darfur;https://www.zeit.de/politik/ausland/2025-10/internationaler-strafgerichtshof-sudan-darfur-verurteilung-kriegsverbrechen-abd-al-rahman-gxe;Abd-Al-Rahman ist vom Weltstrafgericht zu Kriegsverbrechen im Sudan vor 20 Jahren verurteilt worden. Er soll Anführer einer berüchtigten Reitermiliz gewesen sein.;Internationaler Strafgerichtshof;Politik, Internationaler Strafgerichtshof, IStGH, Sudan, Darfur, Kriegsverbrechen, Bürgerkrieg, Folter;2025-10-06T16:31:49+02:00;2025-10-06T16:31:49+02:00;mmh;DIE ZEIT,        Reuters,        dpa,        AP,        							mmh;false
48d69c8315595f7492c2d4e16664dedee5fa3bc9d021fadeda8b5b5c5825499a;Erneuter Kreuzbandriss bei Stuttgarts Truchanovičius;https://www.zeit.de/news/2025-10/06/erneuter-kreuzbandriss-bei-stuttgarts-truchanovi-ius;Hier finden Sie Informationen zu dem Thema „Handball-Bundesliga“. Lesen Sie jetzt „Erneuter Kreuzbandriss bei Stuttgarts Truchanovičius“.;Handball-Bundesliga;News, Handball-Bundesliga, Stuttgart, Handball-Bundesliga, TV Bissendorf-Holte, Kreuzbandriss;2025-10-06T16:31:25+02:00;2025-10-06T16:31:25+02:00;;dpa Baden-Württemberg;false
d70ce1d06dc696963c625fc22a7e0c7f0028e9f287060221397fde403244582e;Baywa zieht Prognose zurück;https://www.zeit.de/news/2025-10/06/baywa-zieht-prognose-zurueck;Hier finden Sie Informationen zu dem Thema „Mischkonzern“. Lesen Sie jetzt „Baywa zieht Prognose zurück“.;Mischkonzern;News, Mischkonzern, Donald Trump, USA, Baywa, Mischkonzern, Prognose, Jahresprognose, Krise, Big Beautiful Bill;2025-10-06T16:26:02+02:00;2025-10-06T16:26:02+02:00;;dpa Bayern;false
3c7f3fb89ab465b400f2da95db4d698dfa24483ec489ee4cac8072fca9cf7d6d;Schlichtungsversuch eskaliert - Männer bewusstlos geschlagen;https://www.zeit.de/news/2025-10/06/schlichtungsversuch-eskaliert-maenner-bewusstlos-geschlagen;Hier finden Sie Informationen zu dem Thema „Am Bahnhof in Emsdetten“. Lesen Sie jetzt „Schlichtungsversuch eskaliert - Männer bewusstlos geschlagen“.;Am Bahnhof in Emsdetten;News, Am Bahnhof in Emsdetten, Mann, Emsdetten, Bundespolizei, Schlichtungsversuch, Bahnhof;2025-10-06T16:26:01+02:00;2025-10-06T16:26:01+02:00;;dpa Nordrhein-Westfalen;false
1cdfbd7fa482d09dcc487a5a489cf9b6bcef124d43e12dc2a9e81b4531cbb871;Land will Landwirtschafts-Neueinsteiger fördern;https://www.zeit.de/news/2025-10/06/land-will-landwirtschafts-neueinsteiger-foerdern;Hier finden Sie Informationen zu dem Thema „Programm vorgestellt“. Lesen Sie jetzt „Land will Landwirtschafts-Neueinsteiger fördern“.;Programm vorgestellt;News, Programm vorgestellt, Miriam Staudte, Hannover, BMELV, Hofübernahme, Betriebsübernahme, Landesregierung, Familie;2025-10-06T16:24:59+02:00;2025-10-06T16:24:59+02:00;;dpa Niedersachsen;false
4d1d73feae6e7bd6aa75cab7b456a4dfe71a8436e1333753fde7934e149604eb;Supreme Court lehnt Antrag von Epstein-Vertrauter Maxwell ab;https://www.zeit.de/news/2025-10/06/supreme-court-lehnt-antrag-von-epstein-vertrauter-maxwell-ab;Hier finden Sie Informationen zu dem Thema „Epstein-Affäre“. Lesen Sie jetzt „Supreme Court lehnt Antrag von Epstein-Vertrauter Maxwell ab“.;Epstein-Affäre;News, Epstein-Affäre, Jeffrey Epstein, Ghislaine Maxwell, USA, Staatsanwaltschaft, Supreme Court, Oberster Gerichtshof;2025-10-06T16:24:24+02:00;2025-10-06T16:24:24+02:00;;dpa;false
a9af6918168ad5f9d69da6f8ee1f283512b2862ecd5b7998a1463124abfd86ed;Etwa 93 Tonnen Müll auf Oktoberfest-Gelände;https://www.zeit.de/news/2025-10/06/etwa-93-tonnen-muell-auf-oktoberfest-gelaende;Hier finden Sie Informationen zu dem Thema „Wiesn“. Lesen Sie jetzt „Etwa 93 Tonnen Müll auf Oktoberfest-Gelände“.;Wiesn;News, Wiesn, Oktoberfest, Müll, Festgelände;2025-10-06T16:22:58+02:00;2025-10-06T16:22:58+02:00;;dpa Bayern;false
b4882109059fddc238db0adee0726b8e0351ff673e82e7c94af99d3cc798bdd3;Einsatz bei Streitgespräch mit AfD kostete gut 400.000 Euro;https://www.zeit.de/news/2025-10/06/einsatz-bei-streitgespraech-mit-afd-kostete-gut-400-000-euro;Hier finden Sie Informationen zu dem Thema „Tübingen“. Lesen Sie jetzt „Einsatz bei Streitgespräch mit AfD kostete gut 400.000 Euro“.;Tübingen;News, Tübingen, Boris Palmer, Tübingen, Alternative für Deutschland, SPD, Südwest Presse, Innenministerium, Polizei, Streitgespräch, Polizeieinsatz;2025-10-06T16:20:43+02:00;2025-10-06T16:20:43+02:00;;dpa Baden-Württemberg;false
30dd7a424687a43fc5893b829999ff12883c245e82d222732547778da0d7aab2;Schwere Vorwürfe der Gaza-Flotten-Aktivisten gegen Israel;https://www.zeit.de/news/2025-10/06/schwere-vorwuerfe-der-gaza-flotten-aktivisten-gegen-israel;Hier finden Sie Informationen zu dem Thema „Nahost“. Lesen Sie jetzt „Schwere Vorwürfe der Gaza-Flotten-Aktivisten gegen Israel“.;Nahost;News, Nahost, Lubna Tuma, Mann, Ada Colau, Nahost, Gazastreifen, Instagram, Menschenrechte, Global Sumud Flotilla;2025-10-06T16:18:01+02:00;2025-10-06T16:18:01+02:00;;dpa;false
f726adc6ea8d589876e0f7ccfc36c1fe630b1904a91dc0e3bbc9b31e1c5c32f4;Iran entlastet Deutsch-Franzosen von Spionagevorwürfen;https://www.zeit.de/gesellschaft/2025-10/iran-deutsch-franzose-lennart-monterlos-festnahme-freispruch;Ein Gericht in Teheran hat einen 19-jährigen Radtouristen vom Vorwurf der Spionage freigesprochen. Der Deutsch-Franzose war im Juni festgenommen worden.;Iran;Gesellschaft, Iran, Iran, Teheran, Frankreich, Spionage, Verhaftung, Gericht;2025-10-06T16:17:48+02:00;2025-10-06T16:17:48+02:00;maw;DIE ZEIT,        AFP,        Reuters,        dpa,        							maw;false
7ade9bfb53f0122985753f48cea6a97859cf09ff95b6c68a2889caf2d797eb84;Streit in Grünen-Fraktion – Terpe soll Fraktionsvize werden;https://www.zeit.de/news/2025-10/06/streit-in-gruenen-fraktion-terpe-soll-fraktionsvize-werden;Hier finden Sie Informationen zu dem Thema „MV-Grüne“. Lesen Sie jetzt „Streit in Grünen-Fraktion – Terpe soll Fraktionsvize werden“.;MV-Grüne;News, MV-Grüne, Harald Terpe, Constanze Oehlrich, Hannes Damm, Schwerin;2025-10-06T16:17:34+02:00;2025-10-06T16:17:34+02:00;;dpa Mecklenburg-Vorpommern;false
f47857b6403af735404f148b3c24f73f07605bdd74db70624be417915c73388d;Medizin-Nobelpreis für Immunforscher aus Japan und den USA;https://www.zeit.de/news/2025-10/06/beginn-der-nobelpreis-saison-medizin-macht-den-anfang;Hier finden Sie Informationen zu dem Thema „Bedeutendste Mediziner-Ehrung“. Lesen Sie jetzt „Medizin-Nobelpreis für Immunforscher aus Japan und den USA“.;Bedeutendste Mediziner-Ehrung;News, Bedeutendste Mediziner-Ehrung, Alfred Nobel, Stockholm, Auszeichnung, Nobelversammlung, Nobelpreis;2025-10-06T16:16:02+02:00;2025-10-06T16:16:02+02:00;;dpa;false
762965106f07e080cf326019896735ab79909327573e6c9adb92ff461ba86206;Porsche verliert erneut im Streit um Betriebsrats-Gehalt;https://www.zeit.de/news/2025-10/06/porsche-verliert-erneut-im-streit-um-betriebsrats-gehalt;Hier finden Sie Informationen zu dem Thema „Rechtsstreit“. Lesen Sie jetzt „Porsche verliert erneut im Streit um Betriebsrats-Gehalt“.;Rechtsstreit;News, Rechtsstreit, Chemnitz, Leipzig, Porsche, Porsche Leipzig, Rechtsstreit, Lofski, Gehaltskürzung;2025-10-06T16:13:36+02:00;2025-10-06T16:13:36+02:00;;dpa Sachsen;false
573afc0995de2af007c41660e429e54e9a77640d289797d6c10d721e57aae514;Schleswig-Holstein will Weg für Handy-Blitzer freimachen;https://www.zeit.de/news/2025-10/06/schleswig-holstein-will-weg-fuer-handy-blitzer-freimachen;Hier finden Sie Informationen zu dem Thema „Handy am Steuer“. Lesen Sie jetzt „Schleswig-Holstein will Weg für Handy-Blitzer freimachen“.;Handy am Steuer;News, Handy am Steuer, Sabine Sütterlin-Waack, Schleswig-Holstein, Flensburg, CDU, Flensburger Tageblatt, Monocam;2025-10-06T16:10:35+02:00;2025-10-06T16:10:35+02:00;;dpa Hamburg/Schleswig-Holstein;false
2955c3d469ad7827243fa562128cbf535c359692f0224192b328d974d086d4bd;5.000 Euro Belohnung im ungelösten Kindes-Mordfall von 1973;https://www.zeit.de/news/2025-10/06/5-000-euro-belohnung-im-ungeloesten-kindes-mordfall-von-1973;Hier finden Sie Informationen zu dem Thema „Kriminalität“. Lesen Sie jetzt „5.000 Euro Belohnung im ungelösten Kindes-Mordfall von 1973“.;Kriminalität;News, Kriminalität, Berlin, Neukölln, Britz, Polizei, Aktenzeichen XY, Belohnung, Mord, Kriminalität;2025-10-06T16:04:45+02:00;2025-10-06T16:04:45+02:00;;dpa Berlin/Brandenburg;false
4e036646a8c8d1af2e07b90279f0728208414b8cc896bc4dc477eab769c24f65;Autofahrer steuert vorsätzlich auf Fußgänger zu;https://www.zeit.de/news/2025-10/06/autofahrer-steuert-vorsaetzlich-auf-fussgaenger-zu;Hier finden Sie Informationen zu dem Thema „Bremerhaven“. Lesen Sie jetzt „Autofahrer steuert vorsätzlich auf Fußgänger zu“.;Bremerhaven;News, Bremerhaven, Bremerhaven, Bremerhaven-Lehe, Polizei, Auto;2025-10-06T16:02:56+02:00;2025-10-06T16:02:56+02:00;;dpa Niedersachsen;false
c552fbb5f0b1c8619309d7232fbdc03d096a1bb1cf07de8ad0e108ce105c855a;Anzahl der Raucher weltweit geht laut WHO zurück;https://www.zeit.de/gesundheit/2025-10/rauchen-e-zigaretten-vapen-gefahren-who;Die Zahl der Raucherinnen und Raucher sinkt, sagt die Weltgesundheitsorganisation. Zugleich warnt sie vor einem alarmierenden Trend, insbesondere unter Jugendlichen.;Rauchen;Gesundheit, Rauchen, Nikotin, Statistik, WHO, E-Zigarette, Drogen, Jugendliche;2025-10-06T16:00:02+02:00;2025-10-06T16:00:02+02:00;mga;DIE ZEIT,        dpa,        KNA,        							mga;false
356487c98f766e3e17f23e89ed026e8ef6f4bf9aaca4e08e185bca272861cfa4;Dass jeder Tropfen nach Hause kommt;https://www.zeit.de/2025/42/7-oktober-2023-hamas-israel-leichen-bergung;Simcha Greiniman war einer der Ersten am Ort des Hamas-Massakers: Er barg Leichen und ihre Überreste. Wie lebt er heute damit, unvorstellbarem Grauen begegnet zu sein?;7. Oktober;Politik, 7. Oktober, Israel, Hamas, Trauer, Familie, NGO, Gazastreifen;2025-10-06T15:59:38+02:00;2025-10-06T15:59:38+02:00;Jan Roß;Aus der        ZEIT Nr. 42/2025;false
3c0f90108e4a601778f0bb1c3171b8f81261025332f155f64b913f893aaaf12a;"Schiffsunglück auf der Elbe: ""Wir haben viel Glück gehabt""";https://www.zeit.de/news/2025-10/06/19-verletzte-passagiere-schiffsfuehrerin-vor-gericht;"Hier finden Sie Informationen zu dem Thema „Prozesse“. Lesen Sie jetzt „Schiffsunglück auf der Elbe: ""Wir haben viel Glück gehabt""“.";Prozesse;News, Prozesse, Hamburg, Hadag, Amtsgericht, Staatsanwaltschaft, Körperverletzung, Schiff;2025-10-06T15:58:39+02:00;2025-10-06T15:58:39+02:00;;dpa Hamburg/Schleswig-Holstein;false
60a1c646651c1c19572944534a108b92ea12832bc9e92b06b7530ac7ef473fa6;Nach Bombendrohung: Neuer Brief sorgt für Polizeieinsatz;https://www.zeit.de/news/2025-10/06/nach-bombendrohung-neuer-brief-sorgt-fuer-polizeieinsatz;Hier finden Sie Informationen zu dem Thema „München“. Lesen Sie jetzt „Nach Bombendrohung: Neuer Brief sorgt für Polizeieinsatz“.;München;News, München, München, Polizei, Bombendrohung, Polizeieinsatz, Großbrand;2025-10-06T15:57:02+02:00;2025-10-06T15:57:02+02:00;;dpa Bayern;false
