Hash;Title;Link;Description;Category;KeyWords;Published;LastUpdated;Author;Source;Paywall
15a04f7ac8fa8aed43a4c1c708bcb12f0c570985fe601c6ad7bb7ac87ed655fe;"Russland sieht Deutschland laut BfV ""mitunter als Feind Nummer eins""";https://www.zeit.de/politik/2026-03/verfassungsschutz-sinan-selen-deutschland-feind-russland-hybride-angriffe-spionage-gxe;"Verfassungsschutzpräsident Sinan Selen warnt vor ""mehr Risikoappetit"" bei hybriden Angriffen auf Deutschland. Die größte Bedrohung gehe von Russland aus, sagte er.";Verfassungsschutz;Politik, Verfassungsschutz, Verfassungsschutz, Russland, Sinan Selen, KGB, diplomatische Beziehung, Spionage;2026-03-19T13:19:41+01:00;2026-03-19T13:19:41+01:00;lgi;DIE ZEIT,        dpa,        							lgi;false
4c5c48f16d81960476f1fd6b609f5af2863114bf0fdb6794c6dd44dd41ef22c8;Mehr als 100 Schauplätze beim Tag der Industriekultur;https://www.zeit.de/news/2026-03/19/mehr-als-100-schauplaetze-beim-tag-der-industriekultur;Hier finden Sie Informationen zu dem Thema „Lebendige Geschichte“. Lesen Sie jetzt „Mehr als 100 Schauplätze beim Tag der Industriekultur“.;Lebendige Geschichte;News, Lebendige Geschichte, Sachsen-Anhalt, Industriekultur, Schauplatz;2026-03-19T13:16:50+01:00;2026-03-19T13:16:50+01:00;;dpa Sachsen;false
45e4c76365fa60fffcc01fde98a4525e8d7fc0cc32916057a4113923eee5647e;1&1 kommt beim Ausbau seines Handynetzes voran;https://www.zeit.de/news/2026-03/19/1-1-kommt-beim-ausbau-seines-handynetzes-voran;Hier finden Sie Informationen zu dem Thema „Konkurrent der Telekom“. Lesen Sie jetzt „1&1 kommt beim Ausbau seines Handynetzes voran“.;Konkurrent der Telekom;News, Konkurrent der Telekom, Ralph Dommermuth, Montabaur, Vodafone, 1&1, Deutsche Telekom, Bundesnetzagentur, Handynetz, Ausbau;2026-03-19T13:15:32+01:00;2026-03-19T13:15:32+01:00;;dpa;false
1e7b7c2f973025b0b3606bc89656e798c7709e96ae9005207407529682c49374;BSW wieder in Kommission für Verfassungsschutz vertreten;https://www.zeit.de/news/2026-03/19/bsw-wieder-in-kommission-fuer-verfassungsschutz-vertreten;Hier finden Sie Informationen zu dem Thema „Geheimdienst“. Lesen Sie jetzt „BSW wieder in Kommission für Verfassungsschutz vertreten“.;Geheimdienst;News, Geheimdienst, Niels-Olaf Lüders, Brandenburg, Bündnis Sahra Wagenknecht, Verfassungsschutz, Geheimdienst, Alternative für Deutschland, SPD, CDU, Kontrollkommission;2026-03-19T13:14:10+01:00;2026-03-19T13:14:10+01:00;;dpa Berlin/Brandenburg;false
bd6e5fa204243502595db7b33982efcba2f19294224352c0a6e5a14df996c2c6;Fall Fabian: Frist für Prozessbeginn bis 6. Mai;https://www.zeit.de/news/2026-03/19/fall-fabian-frist-fuer-prozessbeginn-bis-6-mai;Hier finden Sie Informationen zu dem Thema „Mecklenburg-Vorpommern“. Lesen Sie jetzt „Fall Fabian: Frist für Prozessbeginn bis 6. Mai“.;Mecklenburg-Vorpommern;News, Mecklenburg-Vorpommern, Rostock, Mecklenburg-Vorpommern, Prozessbeginn, Mordanklage;2026-03-19T13:13:40+01:00;2026-03-19T13:13:40+01:00;;dpa Mecklenburg-Vorpommern;false
ea0dbf4fe99234b131379a5cab2cf7984ea0de98f2682af2a231303615d56ffa;Öl- und Gaspreise nach Angriffen am Golf erneut gestiegen;https://www.zeit.de/wirtschaft/2026-03/krieg-iran-ernergieinfrastruktur-erdgas-oel-preisanstieg-gxe;Nach Angriffen auf Energieinfrastruktur in der Golfregion kosteten Öl und Gas am Morgen erneut deutlich mehr. Der Preis für Erdgas stieg zeitweise um mehr als 30 Prozent.;Irankrieg;Wirtschaft, Irankrieg, Iran, Saudi-Arabien, Gaspreis, Erdgas, Ölpreis;2026-03-19T13:11:57+01:00;2026-03-19T13:11:57+01:00;jse;DIE ZEIT,        AFP,        dpa,        Reuters,        							jse;false
91d200d6bc46c1c99d4e2cfdddf615e70d2949c7acd22ecfc194aad9fb4463b8;Autozulieferer ZF macht 2,1 Milliarden Euro Verlust;https://www.zeit.de/news/2026-03/19/das-sind-die-groessten-baustellen-beim-autozulieferer-zf;Hier finden Sie Informationen zu dem Thema „Bilanz“. Lesen Sie jetzt „Autozulieferer ZF macht 2,1 Milliarden Euro Verlust“.;Bilanz;News, Bilanz, Friedrichshafen, Bodensee, INA Holding Schaeffler, Continental AG, Baustelle, Jahreszahl, Schulden, Elektromobilität, Krise, Auto;2026-03-19T13:06:52+01:00;2026-03-19T13:06:52+01:00;;dpa;false
5648035202b133ddc24810cf97e8b1e879ea25b599e7f02af1594ea0ed2270a3;Wolf im Jagdrecht: Um Abschuss gibt es Streit in Brandenburg;https://www.zeit.de/news/2026-03/19/wolf-im-jagdrecht-um-abschuss-gibt-es-streit-in-brandenburg;Hier finden Sie Informationen zu dem Thema „Sonderregelungen“. Lesen Sie jetzt „Wolf im Jagdrecht: Um Abschuss gibt es Streit in Brandenburg“.;Sonderregelungen;News, Sonderregelungen, Brandenburg, BUND, Jagdrecht, Sonderregelung, Wölfe, Tiere;2026-03-19T13:03:18+01:00;2026-03-19T13:03:18+01:00;;dpa Berlin/Brandenburg;false
5695dee93602f77faf619bc6845913cdbb91665727e6c4892b9d43c83457e884;Startschuss für neues Kraftwerk in Schkopau gefallen;https://www.zeit.de/news/2026-03/19/startschuss-fuer-neues-kraftwerk-in-schkopau-gefallen;Hier finden Sie Informationen zu dem Thema „Energie“. Lesen Sie jetzt „Startschuss für neues Kraftwerk in Schkopau gefallen“.;Energie;News, Energie, Schkopau, Saalekreis, Sachsen-Anhalt, Kraftwerk, Dampfturbinenkraftwerk, Chemiepark, Pförtnergebäude, Landesverwaltungsamt, Teilgenehmigung;2026-03-19T12:59:57+01:00;2026-03-19T12:59:57+01:00;;dpa Sachsen;false
1b5e48b707bf30cb6bfceb5dd1492d0658aceb6e37a2cdd03a8024ad3a1bbfd0;Rheinland-Pfalz wählt: Was rund um den 22. März wichtig ist;https://www.zeit.de/news/2026-03/16/rheinland-pfalz-waehlt-was-rund-um-den-22-maerz-wichtig-ist;Hier finden Sie Informationen zu dem Thema „Kopf-an-Kopf-Rennen“. Lesen Sie jetzt „Rheinland-Pfalz wählt: Was rund um den 22. März wichtig ist“.;Kopf-an-Kopf-Rennen;News, Kopf-an-Kopf-Rennen, Malu Dreyer, Alexander Schweitzer, Gordon Schnieder, Volker Wissing, Mainz, Rheinland-Pfalz, Rheinland, Eifel, FDP, SPD;2026-03-19T12:58:15+01:00;2026-03-19T12:58:15+01:00;;dpa Rheinland-Pfalz/Saarland;false
fe4412d92d36214b85b0c41b908e2c36b552a83f01037407455e170d92933066;"Studie zeigt ""verfestigtes"" rassistisches Denken in Deutschland";https://www.zeit.de/gesellschaft/2026-03/rassismus-deutschland-kulturen-ethnien-studie-gxe;Laut einer Studie glauben viele Menschen an angeblich naturgegebene Unterschiede zwischen Ethnien. Zwei Drittel der Befragten halten bestimmte Kulturen für besser.;Rassismus in Deutschland;Gesellschaft, Rassismus in Deutschland, Rassismus, Diskriminierung, Forschung, Studie, Bundesregierung, Islam;2026-03-19T12:57:24+01:00;2026-03-19T12:57:24+01:00;cga;DIE ZEIT,        epd,        KNA,        AFP,        							cga;false
1168fcc012b6abfd3e24013b33b9ab7533eaa40fdf136521251a7d2392246994;"Mord an Professor: ""Anderer Täter eher unwahrscheinlich""";https://www.zeit.de/news/2026-03/19/mord-an-professor-anderer-taeter-eher-unwahrscheinlich;"Hier finden Sie Informationen zu dem Thema „42 Jahre alter Mordfall“. Lesen Sie jetzt „Mord an Professor: ""Anderer Täter eher unwahrscheinlich""“.";42 Jahre alter Mordfall;News, 42 Jahre alter Mordfall, Hilden, Italien, Düsseldorf, Bottrop, Mord, Mordfall;2026-03-19T12:57:12+01:00;2026-03-19T12:57:12+01:00;;dpa Nordrhein-Westfalen;false
0b36c48e122c87f78cdb1cb3f775f8d51df543ddd0fdceaa758a9416a488abfb;Landtag gibt grünes Licht für leichtere Jagd auf Wölfe;https://www.zeit.de/news/2026-03/19/landtag-gibt-gruenes-licht-fuer-leichtere-jagd-auf-woelfe;Hier finden Sie Informationen zu dem Thema „Umstrittene Reform“. Lesen Sie jetzt „Landtag gibt grünes Licht für leichtere Jagd auf Wölfe“.;Umstrittene Reform;News, Umstrittene Reform, Hubert Aiwanger, Bayern, CSU, Freie Wähler, FW, Landtag, Jagdgesetz, Wölfe, Kritik;2026-03-19T12:53:10+01:00;2026-03-19T12:53:10+01:00;;dpa Bayern;false
147fb1bfbc2b8fc08389a44ff5407e1b0608021afa1aab36971e15829b925274;"Erstmals ""Nobelpreis der Mathematik"" für Deutschen";https://www.zeit.de/news/2026-03/19/erstmals-nobelpreis-der-mathematik-fuer-deutschen;"Hier finden Sie Informationen zu dem Thema „Abelpreis“. Lesen Sie jetzt „Erstmals ""Nobelpreis der Mathematik"" für Deutschen“.";Abelpreis;News, Abelpreis, Gerd Faltings, Harald V., Oslo, Bonn, Akademie der Wissenschaften, Max-Planck-Institut, Rheinische Friedrich-Wilhelms-Universität Bonn, Abelpreis, Mathematik, Nobelpreis;2026-03-19T12:50:18+01:00;2026-03-19T12:50:18+01:00;;dpa;false
2c2ba43824de690d784ad10fa202af985b98df2094de8aaf30ab633b52f764d8;"Allofs vor Wolfsburg gegen Werder: ""Mir blutet das Herz""";https://www.zeit.de/news/2026-03/19/allofs-vor-wolfsburg-gegen-werder-mir-blutet-das-herz;"Hier finden Sie Informationen zu dem Thema „Bundesliga-Abstiegsduell“. Lesen Sie jetzt „Allofs vor Wolfsburg gegen Werder: ""Mir blutet das Herz""“.";Bundesliga-Abstiegsduell;News, Bundesliga-Abstiegsduell, Klaus Allofs, Wolfsburg, Bremen, VfL Wolfsburg, Bundesliga, Fußball-Bundesliga;2026-03-19T12:50:05+01:00;2026-03-19T12:50:05+01:00;;dpa Niedersachsen;false
d5ea132e7bee0bf3f4416ac38acbdd788501eda173a4e2abcfe77b5440663c75;Koalition in MV uneins bei Social-Media-Verbot bis 14 Jahre;https://www.zeit.de/news/2026-03/19/koalition-in-mv-uneins-bei-social-media-verbot-bis-14-jahre;Hier finden Sie Informationen zu dem Thema „Kinder und Social Media“. Lesen Sie jetzt „Koalition in MV uneins bei Social-Media-Verbot bis 14 Jahre“.;Kinder und Social Media;News, Kinder und Social Media, Manuela Schwesig, Christian Albrecht, Mecklenburg-Vorpommern, SPD, CDU, Verbot, Koalition, Social-Media-Verbot, Soziale Medien, Sommer;2026-03-19T12:46:38+01:00;2026-03-19T12:46:38+01:00;;dpa Mecklenburg-Vorpommern;false
d0bf26bf6728c531d0d2138fdc5fa0d31035ff45090df1b5bb41f80376e3a081;VfB Lübeck verzichtet nach Krawallen auf Fans;https://www.zeit.de/news/2026-03/19/vfb-luebeck-verzichtet-nach-krawallen-auf-fans;Hier finden Sie Informationen zu dem Thema „Fußball-Regionalliga“. Lesen Sie jetzt „VfB Lübeck verzichtet nach Krawallen auf Fans“.;Fußball-Regionalliga;News, Fußball-Regionalliga, Lübeck, Schöningen, FSV Schöningen, VfB Lübeck, Fußball-Regionalliga, Krawall, Fanunterstützung, Elmstadion, Gästeblock, Ausschreitung;2026-03-19T12:45:22+01:00;2026-03-19T12:45:22+01:00;;dpa Hamburg/Schleswig-Holstein;false
60e4a594461621843b3e53e53f9088a9f633dba0c1b37a6c3f950dbac64a3354;Warnstreiks legen in mehreren Ländern den Nahverkehr lahm;https://www.zeit.de/news/2026-03/19/verdi-will-in-mehreren-bundeslaendern-den-oepnv-bestreiken;Hier finden Sie Informationen zu dem Thema „Tarifstreits“. Lesen Sie jetzt „Warnstreiks legen in mehreren Ländern den Nahverkehr lahm“.;Tarifstreits;News, Tarifstreits, Hamburg, Bayern, München, Nordrhein-Westfalen, Sachsen-Anhalt, Ver.di, Nahverkehr, Tarifverhandlung, Warnstreik;2026-03-19T12:42:25+01:00;2026-03-19T12:42:25+01:00;;dpa;false
3f19140ba67e92f03b22bf08c3fb00d6f35e34c7b044dabf1ff4a70c6f271e39;DRF Luftrettung bleibt in Dresden und Bautzen im Einsatz;https://www.zeit.de/news/2026-03/19/drf-luftrettung-bleibt-in-dresden-und-bautzen-im-einsatz;Hier finden Sie Informationen zu dem Thema „Luftrettung“. Lesen Sie jetzt „DRF Luftrettung bleibt in Dresden und Bautzen im Einsatz“.;Luftrettung;News, Luftrettung, Dresden, Bautzen, DRF, Luftrettung;2026-03-19T12:31:39+01:00;2026-03-19T12:31:39+01:00;;dpa Sachsen;false
17b25f15982f13adfe0309d14c417360840d812eae9830bef80ff75207d76fa5;Berliner Apotheken schließen am Montag aus Protest;https://www.zeit.de/news/2026-03/19/berliner-apotheken-schliessen-am-montag-aus-protest;Hier finden Sie Informationen zu dem Thema „Gesundheit“. Lesen Sie jetzt „Berliner Apotheken schließen am Montag aus Protest“.;Gesundheit;News, Gesundheit, Berlin, Apotheke;2026-03-19T12:30:38+01:00;2026-03-19T12:30:38+01:00;;dpa Berlin/Brandenburg;false
c37b93229d7b39c5c10ed7dd32ff25fce9e6f7869dd69334b66ce93d715ce44b;Iran-Krieg trübt Aussichten bei Villeroy & Boch;https://www.zeit.de/news/2026-03/19/iran-krieg-truebt-aussichten-bei-villeroy-boch;Hier finden Sie Informationen zu dem Thema „Keramik“. Lesen Sie jetzt „Iran-Krieg trübt Aussichten bei Villeroy & Boch“.;Keramik;News, Keramik, Markus Warncke, Gabi Schupp, Villeroy & Boch, Keramik, Golfregion, Ertragseinbuße;2026-03-19T12:26:14+01:00;2026-03-19T12:26:14+01:00;;dpa Rheinland-Pfalz/Saarland;false
7bd39a3021f9451a3bfc9c2a1239a944309a87383643e05a7dded11299e4f68e;So viele Gastronomie-Pleiten wie seit 2011 nicht;https://www.zeit.de/news/2026-03/19/so-viele-gastronomie-pleiten-wie-seit-2011-nicht;Hier finden Sie Informationen zu dem Thema „Insolvenzen“. Lesen Sie jetzt „So viele Gastronomie-Pleiten wie seit 2011 nicht“.;Insolvenzen;News, Insolvenzen, Patrik-Ludwig Hantzsch, Insolvenz, Creditreform, Wirtschaftsauskunftei, Gastronomie, Restaurant;2026-03-19T12:26:12+01:00;2026-03-19T12:26:12+01:00;;dpa;false
05460477cf92ecf2b6d649bc0375bdf2f7d7588aa6f01317a243ce16abeeb785;"Kane kontert Vinícius Júnior: ""Wir fürchten niemanden""";https://www.zeit.de/news/2026-03/19/kane-kontert-vin-cius-j-nior-wir-fuerchten-niemanden;"Hier finden Sie Informationen zu dem Thema „Champions League“. Lesen Sie jetzt „Kane kontert Vinícius Júnior: ""Wir fürchten niemanden""“.";Champions League;News, Champions League, Vinícius Júnior, Harry Kane, Jan-Christian Dreesen, Max Eberl, Vincent Kompany, Dayot Upamecano, Europa, England, Liverpool, Bergamo;2026-03-19T12:25:41+01:00;2026-03-19T12:25:41+01:00;;dpa Bayern;false
3ff9670ddd641ff9560e7668d9f34f6438bad7b7b0aecf6243ee7332f0779b3f;Zahl der Erwerbstätigen im Nordosten weiter gesunken;https://www.zeit.de/news/2026-03/19/zahl-der-erwerbstaetigen-im-nordosten-weiter-gesunken;Hier finden Sie Informationen zu dem Thema „Arbeitsplätze“. Lesen Sie jetzt „Zahl der Erwerbstätigen im Nordosten weiter gesunken“.;Arbeitsplätze;News, Arbeitsplätze, Mecklenburg-Vorpommern, Nordosten, Arbeitsplatz;2026-03-19T12:24:10+01:00;2026-03-19T12:24:10+01:00;;dpa Mecklenburg-Vorpommern;false
51387356c1a156ac318e9bc6c6602a51f8437df374e3bd2a1900a87561ee250b;"BfV sieht ""mehr Risikoappetit"" bei ausländischen Angreifern";https://www.zeit.de/news/2026-03/19/bfv-sieht-mehr-risikoappetit-bei-auslaendischen-angreifern;"Hier finden Sie Informationen zu dem Thema „Sabotage und Spionage“. Lesen Sie jetzt „BfV sieht ""mehr Risikoappetit"" bei ausländischen Angreifern“.";Sabotage und Spionage;News, Sabotage und Spionage, Sinan Selen, Russland, Estland, Verfassungsschutz, Risikoappetit, Sabotage, Spionage, Sicherheit;2026-03-19T12:22:17+01:00;2026-03-19T12:22:17+01:00;;dpa;false
f1c076a9577c7af35a6d043b5857e0b467b7324f9e121365b28fc7b4bcb1be4e;Polizei sucht vermisste 15-Jährige – Letzte Spur im Klinikum;https://www.zeit.de/news/2026-03/19/polizei-sucht-vermisste-15-jaehrige-letzte-spur-im-klinikum;Hier finden Sie Informationen zu dem Thema „Vermisstenfall“. Lesen Sie jetzt „Polizei sucht vermisste 15-Jährige – Letzte Spur im Klinikum“.;Vermisstenfall;News, Vermisstenfall, Neubrandenburg, Polizei, Vermisstenfall, Klinikum;2026-03-19T12:22:08+01:00;2026-03-19T12:22:08+01:00;;dpa Mecklenburg-Vorpommern;false
4081f520af55b244491872a9a717e374badb290bba01e8deaafef63e92c87481;Spandau 04 droht Abrutschen auf Platz drei nach Hauptrunde;https://www.zeit.de/news/2026-03/19/spandau-04-droht-abrutschen-auf-platz-drei-nach-hauptrunde;Hier finden Sie Informationen zu dem Thema „Wasserball“. Lesen Sie jetzt „Spandau 04 droht Abrutschen auf Platz drei nach Hauptrunde“.;Wasserball;News, Wasserball, Hannover, Wasserfreunde Spandau 04, Bundesliga, Hauptrunde, Wasserball, Playoff;2026-03-19T12:21:47+01:00;2026-03-19T12:21:47+01:00;;dpa Berlin/Brandenburg;false
41a2d2bb81f97344eb35cea929a00b3bc9ed13a9036d762fda3e97fa6e546bc8;Mehr als 55.600 Unterrichtsstunden in Thüringens Museen;https://www.zeit.de/news/2026-03/19/mehr-als-55-600-unterrichtsstunden-in-thueringens-museen;Hier finden Sie Informationen zu dem Thema „Museumslandschaft“. Lesen Sie jetzt „Mehr als 55.600 Unterrichtsstunden in Thüringens Museen“.;Museumslandschaft;News, Museumslandschaft, Franziska Zschäck, Timo Mappes, Thüringen, Unterrichtsstunde, Museumslandschaft, Museumsverband, Coronavirus;2026-03-19T12:21:32+01:00;2026-03-19T12:21:32+01:00;;dpa Thüringen;false
15878c88249feff37ec0bda701fe55f87c62744b6c34e8098ca528ae2e536c2b;Schleswig-Holstein übernimmt Schulden des Uniklinikums;https://www.zeit.de/news/2026-03/19/landtag-beschliesst-milliardenhilfe-fuer-das-uksh;Hier finden Sie Informationen zu dem Thema „Gesundheitspolitik“. Lesen Sie jetzt „Schleswig-Holstein übernimmt Schulden des Uniklinikums“.;Gesundheitspolitik;News, Gesundheitspolitik, Dorit Stenke, Schleswig-Holstein, Landtag, Gesundheitspolitik, Zukunftspakt;2026-03-19T12:17:33+01:00;2026-03-19T12:17:33+01:00;;dpa Hamburg/Schleswig-Holstein;false
ea78659c4f8d76139f1d8a0250baaf880029815719521579536653a60cb9a7f0;Bayern München holt Aseko aus Hannover zurück;https://www.zeit.de/news/2026-03/19/bayern-muenchen-holt-aseko-aus-hannover-zurueck;Hier finden Sie Informationen zu dem Thema „2. Fußball-Bundesliga“. Lesen Sie jetzt „Bayern München holt Aseko aus Hannover zurück“.;2. Fußball-Bundesliga;News, 2. Fußball-Bundesliga, Hannover, München, FC Bayern München, Hannover 96, Fußball-Bundesliga, Sommer;2026-03-19T12:16:28+01:00;2026-03-19T12:16:28+01:00;;dpa Bayern;false
df6202ca8ded8486261f4023844c549459794c83c775fb08a1dbc8f8482f39b0;Der Sonntagszopf der Neuenburger;https://www.zeit.de/gesellschaft/2026-03/taillaule-neuchateloise-brioche-zopf-essen-schweiz;Die Taillaule neuchâteloise ist halb Brioche, halb Brot. Sie erinnert an den Unabhängigkeitskampf der Neuenburger.;"Z+ (abopflichtiger Inhalt);
        
    Taillaule neuchâteloise";Gesellschaft, Taillaule neuchâteloise, Neuenburg, Ville, La Chaux-de-Fonds, Brot, Taillaule, Sonntagszopf, Unabhängigkeit, Brioche, Wandern;2026-03-19T12:15:00+01:00;2026-03-19T12:15:00+01:00;Heddi Nieuwsma;;false
f3634a6ff31c6e9b77a4e4dd004aa9e54492933fda59b942d67d030f4701588a;Hoffenheim ohne Schlüsselspieler Avdullahu in Leipzig;https://www.zeit.de/news/2026-03/19/hoffenheim-ohne-schluesselspieler-avdullahu-in-leipzig;Hier finden Sie Informationen zu dem Thema „Fußball-Bundesliga“. Lesen Sie jetzt „Hoffenheim ohne Schlüsselspieler Avdullahu in Leipzig“.;Fußball-Bundesliga;News, Fußball-Bundesliga, Christian Ilzer, Hoffenheim, Leipzig, Kosovo, Slowakei, TSG 1899 Hoffenheim, RB Leipzig, Fußball-Bundesliga, Bundesliga, Adduktorenbereich;2026-03-19T12:12:53+01:00;2026-03-19T12:12:53+01:00;;dpa Baden-Württemberg;false
9f3d436192f71ef5dafc609ab6f565614d789f9679f89535aa31c17dcf64cbb8;ESC: Kein Bedarf für Verschärfung des Sicherheitskonzepts;https://www.zeit.de/news/2026-03/19/esc-kein-bedarf-fuer-verschaerfung-des-sicherheitskonzepts;Hier finden Sie Informationen zu dem Thema „Song Contest“. Lesen Sie jetzt „ESC: Kein Bedarf für Verschärfung des Sicherheitskonzepts“.;Song Contest;News, Song Contest, Michael Krön, ORF, Eurovision Song Contest, Sicherheitskonzept, Verschärfung, Nachzuschärfe;2026-03-19T12:06:51+01:00;2026-03-19T12:06:51+01:00;;dpa;false
abe9fd5f91cf842ea19690e5b5df51364d53475f26177dc2ebd25b911788c7a9;Lebenslange Haft für Todesschüsse auf Hochzeit in Fürth;https://www.zeit.de/news/2026-03/19/lebenslange-haft-fuer-todesschuesse-auf-hochzeit-in-fuerth;Hier finden Sie Informationen zu dem Thema „Urteile“. Lesen Sie jetzt „Lebenslange Haft für Todesschüsse auf Hochzeit in Fürth“.;Urteile;News, Urteile, Gregor Zaar, Fürth, Nürnberg, Todesschuss, Hochzeitsfeier;2026-03-19T12:06:43+01:00;2026-03-19T12:06:43+01:00;;dpa;false
b644f0089dc4b426aabbfcc47179f87cd4224857fd853361c5297c7eb523743d;Wolf aus Landkreis Görlitz stirbt bei Unfall in Polen;https://www.zeit.de/news/2026-03/19/wolf-aus-landkreis-goerlitz-stirbt-bei-unfall-in-polen;Hier finden Sie Informationen zu dem Thema „Tiere“. Lesen Sie jetzt „Wolf aus Landkreis Görlitz stirbt bei Unfall in Polen“.;Tiere;News, Tiere, Polen, Großhennersdorf, Görlitz, Landkreis Görlitz, Unfall, Tiere;2026-03-19T12:06:20+01:00;2026-03-19T12:06:20+01:00;;dpa Sachsen;false
fd26b43035785758c60ab1a75a05e30f2c3f99b8bf7a568eaff2aa325f1c05a9;Nächste Niederlage für Umwelthilfe im Streit um Gäubahn;https://www.zeit.de/news/2026-03/19/naechste-niederlage-fuer-umwelthilfe-im-streit-um-gaeubahn;Hier finden Sie Informationen zu dem Thema „Verwaltungsgerichtshof“. Lesen Sie jetzt „Nächste Niederlage für Umwelthilfe im Streit um Gäubahn“.;Verwaltungsgerichtshof;News, Verwaltungsgerichtshof, Zürich, Stuttgart, Mannheim, Deutsche Umwelthilfe e.V., Verwaltungsgerichtshof, Tiefbahnhof, Niederlage;2026-03-19T12:03:12+01:00;2026-03-19T12:03:12+01:00;;dpa Baden-Württemberg;false
0e0edf0b96b2af705c2ac5908db4c51414ef07d559dbcb65bdca0f755d5617ec;"""Computer? Ich will mir meine Mathematik nicht kaputt machen lassen""";https://www.zeit.de/wissen/2026-03/abelpreis-gerd-faltings-mathematik-ki;Der Deutsche Gerd Faltings erhält den Abelpreis, quasi den Mathematik-Nobelpreis. Warum er am liebsten allein arbeitet und meint, dass KI uns am Ende wohl für doof hält;Gerd Faltings;Wissen, Gerd Faltings, Mathematik, Nobelpreis, Chatbot, künstliche Intelligenz;2026-03-19T12:00:21+01:00;2026-03-19T12:00:21+01:00;Christoph Drösser;;false
4a1e83a603cac17c8ac655994dd6464993987363e9eb25742bb40d43ab9f954a;Wieder Teilausfälle bei Bussen und Bahnen am Samstag möglich;https://www.zeit.de/news/2026-03/19/wieder-teilausfaelle-bei-bussen-und-bahnen-am-samstag-moeglich;Hier finden Sie Informationen zu dem Thema „Tarifkonflikt mit Folgen“. Lesen Sie jetzt „Wieder Teilausfälle bei Bussen und Bahnen am Samstag möglich“.;Tarifkonflikt mit Folgen;News, Tarifkonflikt mit Folgen, Nordrhein-Westfalen, Teilausfall, Tarifkonflikt, Warnstreik;2026-03-19T12:00:04+01:00;2026-03-19T12:00:04+01:00;;dpa Nordrhein-Westfalen;false
9853e64a2b08c53183af5920d573b7897aa209e62af1237aba1f0af9bca5b8d3;Hausärzte kritisieren Impfstoff-Bestellfrist;https://www.zeit.de/news/2026-03/19/hausaerzte-kritisieren-impfstoff-bestellfrist;Hier finden Sie Informationen zu dem Thema „Gesundheit“. Lesen Sie jetzt „Hausärzte kritisieren Impfstoff-Bestellfrist“.;Gesundheit;News, Gesundheit, Barbara Römer, Rheinland-Pfalz, PEI, Hausärzteverband, Grippeimpfstoff, Apotheke;2026-03-19T11:58:59+01:00;2026-03-19T11:58:59+01:00;;dpa Rheinland-Pfalz/Saarland;false
adf62cb2067697f5bdea3c9985c49a5aca7bc6b9cb05a9773876d6aec6150af4;Israels Armeechef warnt vor Siedlergewalt;https://www.zeit.de/politik/ausland/2026-03/israel-militaerchef-zamir-siedler-gewalt-westjordanland-gxe;Gewalttaten israelischer Siedler im Westjordanland haben seit dem Terrorangriff der Hamas zugenommen. Israels Armeechef warnt vor der Gefahr für die innere Sicherheit.;Westjordanland;Politik, Westjordanland, Westjordanland, Hamas, Israel, Militär, Terrorismus;2026-03-19T11:54:33+01:00;2026-03-19T11:54:33+01:00;man;DIE ZEIT,        KNA,        							man;false
97528c8d2ff96aa811816545335ece0478b6703ca4a04ce6c2d24e46ea5d8d08;USA rechnen 2027 nicht mit chinesischem Einmarsch in Taiwan;https://www.zeit.de/politik/ausland/2026-03/us-geheimdienst-china-taiwan-invasion-2027-gxe;Trotz steigender Spannungen plant China nach Erkenntnissen von US-Geheimdiensten im kommenden Jahr keinen Angriff auf Taiwan. Die Regierung in Peking habe andere Pläne.;China und Taiwan;Politik, China und Taiwan, Taiwan, China, USA, US-Geheimdienst, Territorium, Asien;2026-03-19T11:50:32+01:00;2026-03-19T11:50:32+01:00;edd;DIE ZEIT,        AFP,        							edd;false
fcce27c07356d1258be7045982e62d1688c01b190a4811e81231c17f6cd2cc92;Viktor Orbán will Milliardenkredit für die Ukraine weiter blockieren;https://www.zeit.de/politik/ausland/2026-03/streit-um-druschba-pipeline-viktor-orban-ungarn-ukraine-russland-oel-kredit-eu-blockade-gxe;Ungarns Regierungschef Viktor Orbán bleibt hart: Er will seine Blockade eines EU-Darlehens an die Ukraine erst überdenken, wenn wieder russisches Öl nach Ungarn fließt.;Ungarn und die Ukraine;Politik, Ungarn und die Ukraine, Viktor Orbán, Ungarn, Brüssel, Russland, Europäische Union, Krieg in der Ukraine;2026-03-19T11:50:05+01:00;2026-03-19T11:50:05+01:00;lgi;DIE ZEIT,        AFP,        Reuters,        							lgi;false
3ea639942613f2fc458fe7c0ec61abed24ee45351da26d9fddac315e237f2eaa;Auto kracht in Frontlader von Traktor;https://www.zeit.de/news/2026-03/19/auto-kracht-in-frontlader-von-traktor;Hier finden Sie Informationen zu dem Thema „Auf Staatsstraße“. Lesen Sie jetzt „Auto kracht in Frontlader von Traktor“.;Auf Staatsstraße;News, Auf Staatsstraße, Staatsstraße, Traktor, Auto;2026-03-19T11:49:36+01:00;2026-03-19T11:49:36+01:00;;dpa Bayern;false
0d0fa8ee57b1921fc1d0081dc5d69ea4efb242ed21e8ca27c315f1d742bc0aae;Ski-Historie winkt: Aicher vor Kugel-Showdown gegen Shiffrin;https://www.zeit.de/news/2026-03/19/ski-historie-winkt-aicher-vor-kugel-showdown-gegen-shiffrin;Hier finden Sie Informationen zu dem Thema „Weltcup-Finale“. Lesen Sie jetzt „Ski-Historie winkt: Aicher vor Kugel-Showdown gegen Shiffrin“.;Weltcup-Finale;News, Weltcup-Finale, Emma Aicher, Rosi Mittermaier, Katja Seizinger, Maria Riesch, Andreas Puelacher, Shiffrin, Generationenduell, Weltcup, Finale, Erfolg;2026-03-19T11:46:06+01:00;2026-03-19T11:46:06+01:00;;dpa Sport;false
400a45623ec2774cad2f237e4a064b7a9fcee5162aee7196a05daa8c8f02d8e9;Grüne laden CDU zu Sondierungsgesprächen in Baden-Württemberg ein;https://www.zeit.de/politik/deutschland/2026-03/baden-wuerttemberg-gruene-cdu-sondierung-gxe;Nach der Wahl war die Stimmung bei den Grünen und der CDU in Baden-Württemberg angeschlagen. Die Grünen mit Cem Özdemir wollen mit ihr erste Verhandlungen führen.;Baden-Württemberg;Politik, Baden-Württemberg, Cem Özdemir, Baden-Württemberg, CDU, Bündnis 90/Die Grünen, Sondierungsgespräch;2026-03-19T11:46:02+01:00;2026-03-19T11:46:02+01:00;edd;DIE ZEIT,        dpa,        							edd;false
