Hash;Title;Link;Description;Category;KeyWords;Published;LastUpdated;Author;Source;Paywall
c882a8d01accb1e914e0374a5b2df735865b29539ff95bd5e9668b1534d86af0;Zwei von drei Online-Shops sind nicht barrierefrei;https://www.zeit.de/news/2025-06/17/zwei-von-drei-online-shops-sind-nicht-barrierefrei;Hier finden Sie Informationen zu dem Thema „Trotz gesetzlicher Pflicht“. Lesen Sie jetzt „Zwei von drei Online-Shops sind nicht barrierefrei“.;Trotz gesetzlicher Pflicht;News, Trotz gesetzlicher Pflicht, Berlin, Google Inc., EU, Barrierefreiheitsstärkungsgesetz, Webshop, Menschen mit Behinderung;2025-06-17T11:00:36+02:00;2025-06-17T11:00:36+02:00;;dpa;false
e698947fc4f40ce47711bce0fe2086ee9681d6c001b69dbd914697c1836c065a;Daimler Truck und Volvo kooperieren bei Software;https://www.zeit.de/news/2025-06/17/daimler-truck-und-volvo-kooperieren-bei-software;Hier finden Sie Informationen zu dem Thema „Nutzfahrzeuge“. Lesen Sie jetzt „Daimler Truck und Volvo kooperieren bei Software“.;Nutzfahrzeuge;News, Nutzfahrzeuge, Göteborg, Volvo, Daimler, Daimler Truck, Fahrzeugplattform, Gemeinschaftsunternehmen, Software, Nutzfahrzeug;2025-06-17T10:59:58+02:00;2025-06-17T10:59:58+02:00;;dpa Baden-Württemberg;false
4b77b6bd5c2565978d18f1d61b79e844084447468ee4b1c96dc4948c859562c9;Bilder des Tages;https://www.zeit.de/news/2025-06/17/bilder-des-tages;Hier finden Sie Informationen zu dem Thema „Fotografie“. Lesen Sie jetzt „Bilder des Tages“.;Fotografie;News, Fotografie, News;2025-06-17T10:57:17+02:00;2025-06-17T10:57:17+02:00;;dpa;false
1827628e58e4702f3040f50bcd722455b6101f921ed4265ca4da6bc20bb76b32;Rettungswagen kippt um - vier Verletzte;https://www.zeit.de/news/2025-06/17/rettungswagen-kippt-um-vier-verletzte;Hier finden Sie Informationen zu dem Thema „Unfälle“. Lesen Sie jetzt „Rettungswagen kippt um - vier Verletzte“.;Unfälle;News, Unfälle, Kempten, Rettungswagen, Unfall, Auto;2025-06-17T10:55:24+02:00;2025-06-17T10:55:24+02:00;;dpa Baden-Württemberg;false
71489ba07d433b9dfa2c226cb8aa9e8d08cb1ea03e909d545edc4a95a2526868;Investitionen in den Klimaschutz bleiben stabil;https://www.zeit.de/wirtschaft/unternehmen/2025-06/klimaschutz-investition-unternehmen-klimagesetz-klimaziel;Für Klimaschutzmaßnahmen wollen Unternehmen elf Prozent ihrer Investitionen ausgeben. Sie bräuchten aber bessere Rahmenbedingungen, sagen Experten des ifo-Instituts.;ifo-Institut;Wirtschaft, ifo-Institut, Ifo Institut für Wirtschaftsforschung, Ifo-Institut für Wirtschaftsforschung, Klimainvestition, Klimaschutz, Rahmenbedingung, Investition;2025-06-17T10:53:12+02:00;2025-06-17T10:53:12+02:00;mks;ZEIT ONLINE,        Reuters,        AFP,        SID,        							mks;false
55861e6b4a4f1536b9647a46acf8ba6ee9df0bc505107f65eae6696e2faf0f36;Knapp die Hälfte aller Familien sind Ein-Kind-Familien;https://www.zeit.de/news/2025-06/17/knapp-die-haelfte-aller-familien-sind-ein-kind-familien;Hier finden Sie Informationen zu dem Thema „Gesellschaft“. Lesen Sie jetzt „Knapp die Hälfte aller Familien sind Ein-Kind-Familien“.;Gesellschaft;News, Gesellschaft, Wiesbaden, Hessen, Familie;2025-06-17T10:52:44+02:00;2025-06-17T10:52:44+02:00;;dpa Hessen;false
af533544fc7a43f9bc053c8b7811d831fbc46d341fabc3080f45b94bcb05caed;Bayern aufgepasst: Wilder Wut-Auftritt von Maradonas Erben;https://www.zeit.de/news/2025-06/17/achtung-bayern-wilde-szenen-der-boca-juniors-gegen-benfica;Hier finden Sie Informationen zu dem Thema „Fußball-Club-WM“. Lesen Sie jetzt „Bayern aufgepasst: Wilder Wut-Auftritt von Maradonas Erben“.;Fußball-Club-WM;News, Fußball-Club-WM, Max Eberl, Miami, Im Hard Rock Stadium, Argentinien, Bayern, Lissabon, Boca Juniors, Benfica Lissabon, FC Bayern München, Sat.1;2025-06-17T10:52:10+02:00;2025-06-17T10:52:10+02:00;;dpa Bayern;false
eec6ea14faf1132a6865d97e71ff47143dd19b705fc25476189faa436528ccb4;Serienvergewaltigungen und versuchter Mord: Mann angeklagt;https://www.zeit.de/news/2025-06/17/serienvergewaltigungen-und-versuchter-mord-mann-angeklagt;Hier finden Sie Informationen zu dem Thema „Frauen betäubt“. Lesen Sie jetzt „Serienvergewaltigungen und versuchter Mord: Mann angeklagt“.;Frauen betäubt;News, Frauen betäubt, Frankfurt, Landkreis Offenbach, Staatsanwaltschaft, Serienvergewaltigung, Mord, Körperverletzung;2025-06-17T10:49:48+02:00;2025-06-17T10:49:48+02:00;;dpa Hessen;false
2e2ac142afaeca21a628a969269967e970e6fd55b3898ac318c8d3026abed1d1;Kommunen fordern mehr Geld für Radwege;https://www.zeit.de/news/2025-06/17/kommunen-fordern-mehr-geld-fuer-radewege;Hier finden Sie Informationen zu dem Thema „Verkehr“. Lesen Sie jetzt „Kommunen fordern mehr Geld für Radwege“.;Verkehr;News, Verkehr, Stefan Hahn, NRW, Nordrhein-Westfalen, Deutsche Presse-Agentur, Kommune, Verkehr, Radweg, Geld, Sommer;2025-06-17T10:47:14+02:00;2025-06-17T10:47:14+02:00;;dpa Nordrhein-Westfalen;false
d66c8568373151d478863b894b2d6e0b799e50059760a7706d7356149b2e5b5e;Bundesverkehrsminister kündigt Konferenz zu Deutschlandticket an;https://www.zeit.de/mobilitaet/2025-06/deutschlandticket-finanzierung-sozialvertraeglich-ab-2026;Patrick Schnieder sieht Handlungsbedarf bei der Finanzierung des Deutschlandtickets. Das Ticket soll nach seinen Worten auch nach 2025 weiter bestehen bleiben.;ÖPNV;Mobilitaet, ÖPNV, Patrick Schnieder, Volker Wissing, CDU, Handlungsbedarf, Deutschlandticket;2025-06-17T10:45:41+02:00;2025-06-17T10:45:41+02:00;hap;ZEIT ONLINE,        AFP,        							hap;false
3964491d696e0d327f5fe625e86ecc19a36930433628c00b57b4344506449343;"""Abstrakte Bedrohungslage"" - Regensburger CSD wird umgeplant";https://www.zeit.de/news/2025-06/17/abstrakte-bedrohungslage-regensburger-csd-wird-umgeplant;"Hier finden Sie Informationen zu dem Thema „Demonstrationen“. Lesen Sie jetzt „""Abstrakte Bedrohungslage"" - Regensburger CSD wird umgeplant“.";Demonstrationen;News, Demonstrationen, Alexander Irmisch, Regensburg, Polizei, Deutsche Presse-Agentur, LKA, Christopher Street Day, Bedrohungslage, Gefährdungslage, Drohschreiben, Sicherheit;2025-06-17T10:44:01+02:00;2025-06-17T10:44:01+02:00;;dpa Bayern;false
77f9489e802ddc15cee281ce47cd7507276c033d83ddb322b04eb36e42ed92d1;Test gegen Atalanta Bergamo: Leipzigs Vorbereitung steht;https://www.zeit.de/news/2025-06/17/test-gegen-atalanta-bergamo-leipzigs-vorbereitung-steht;Hier finden Sie Informationen zu dem Thema „Fußball-Bundesliga“. Lesen Sie jetzt „Test gegen Atalanta Bergamo: Leipzigs Vorbereitung steht“.;Fußball-Bundesliga;News, Fußball-Bundesliga, Leipzig, Atalanta Bergamo Calcio, RB Leipzig, Fußball-Bundesliga, Bundesliga, Saisoneröffnung;2025-06-17T10:43:42+02:00;2025-06-17T10:43:42+02:00;;dpa Sachsen;false
a3debdd32c23d1f04ef829630531fb06c23d88256112e0975d01381a62617876;Wie sicher fühlen Sie sich als queere Person?;https://www.zeit.de/community/2025-05/queerness-deutschland-alltag-diskriminierung-akzeptanz;2024 wurden so viele queerfeindliche Straftaten registriert wie nie zuvor. Wie erleben Sie als queere Person das gesellschaftliche Klima? Schreiben Sie uns.;Queerfeindlichkeit in Deutschland;Community, Queerfeindlichkeit in Deutschland, Queerness, Queerfeindlichkeit, Diskriminierung, Gleichberechtigung, Sexualität, Alltag;2025-06-17T10:41:04+02:00;2025-06-17T10:41:04+02:00;;;false
08577788cdbd0808fa965a6b30c00a2b1b963bd977e8e0b6b8af6d2505825648;St. Pauli mit Auswärtsspiel im eigenen Stadion?;https://www.zeit.de/news/2025-06/17/st-pauli-mit-auswaertsspiel-im-eigenen-stadion;Hier finden Sie Informationen zu dem Thema „DFB-Pokal“. Lesen Sie jetzt „St. Pauli mit Auswärtsspiel im eigenen Stadion?“.;DFB-Pokal;News, DFB-Pokal, Julia Karsten-Plambeck, St. Pauli, Norderstedt, Millerntor, Millerntor-Stadion, Edmund-Plambeck-Stadion, Deutscher Fußball-Bund, FC St. Pauli, Auswärtsspiel, Erstrundenspiel;2025-06-17T10:39:28+02:00;2025-06-17T10:39:28+02:00;;dpa Hamburg/Schleswig-Holstein;false
e83cd1e5dfcbf1c7e36fce4af9431f5c6aa77cf8d66ca6f2038873f4c188245f;Hilfswerke warnen Bundesregierung vor Kürzungen im Kampf gegen Hunger;https://www.zeit.de/gesellschaft/2025-06/armut-hunger-entwicklungshilfe-gelder-hilfsorganisationen;Deutschland hat 2024 die 0,7-Prozent-Quote für Entwicklungshilfe verfehlt, in diesem Jahr steht noch weniger Geld bereit. Hilfsorganisationen warnen vor fatalen Folgen.;Entwicklungszusammenarbeit;Gesellschaft, Entwicklungszusammenarbeit, Bundesregierung, Welthungerhilfe, Hilfswerk, Hilfsorganisation, Kürzung, Geld;2025-06-17T10:39:18+02:00;2025-06-17T10:39:18+02:00;mns;ZEIT ONLINE,        dpa,        							mns;false
0c6e1635242a88426196ad5280951de030e41c2fcfc0f2256d416188cec9ee15;Suche nach möglichem Raubtier: Behörden stimmen sich ab;https://www.zeit.de/news/2025-06/17/suche-nach-grosskatze-im-sueden-sachsen-anhalts-geht-weiter;Hier finden Sie Informationen zu dem Thema „Raubtier“. Lesen Sie jetzt „Suche nach möglichem Raubtier: Behörden stimmen sich ab“.;Raubtier;News, Raubtier, Sachsen-Anhalt, Saalekreis, Raubtier, Tiere;2025-06-17T10:37:15+02:00;2025-06-17T10:37:15+02:00;;dpa;false
ec56d5e6ab20561760ffb1d7498e9787b3380a987e1a32e8e9430a9fcb3b5be2;"Der Therapeut der Superreichen sagt: ""Zu viel Geld macht krank""";https://www.zeit.de/2025/25/therapie-zuerichsee-milliardaere-klinik-psyche-behandlung;Mit einem Milliarden-Vermögen in die Therapie-Suite für 100.000 Euro die Woche: Solche Probleme hätte man gern? Nach einem Besuch am Zürichsee weiß man: Hätte man nicht.;"Z+ (abopflichtiger Inhalt);
        
    Therapie am Zürichsee";Entdecken, Therapie am Zürichsee, psychische Störung, Reichtum, Vermögen, Psychotherapie, Familie, Zürich;2025-06-17T10:36:42+02:00;2025-06-17T10:36:42+02:00;Xifan Yang;Aus der        ZEIT Nr. 25/2025;false
a62f7638d36b79ac126a80cfad225d63156bef6f4779e85d0d457bda72165e28;Russischer Angriff auf Kiew tötet mindestens 14 Menschen;https://www.zeit.de/news/2025-06/17/russischer-angriff-auf-kiew-toetet-mindestens-14-menschen;Hier finden Sie Informationen zu dem Thema „Ukraine-Krieg“. Lesen Sie jetzt „Russischer Angriff auf Kiew tötet mindestens 14 Menschen“.;Ukraine-Krieg;News, Ukraine-Krieg, Timur Tkatschenko, Kyjiw, Odessa, Angriff, Trümmer, Krieg in der Ukraine, Drohne;2025-06-17T10:34:19+02:00;2025-06-17T10:34:19+02:00;;dpa;false
2bef2b1bb00db0f23e7ffdb3ebd1a5274bac1d0ce2bddde7b7f3edf08dcd1b3e;Greuther Fürth holt niederländischen Torwart;https://www.zeit.de/news/2025-06/17/greuther-fuerth-holt-niederlaendischen-torwart;Hier finden Sie Informationen zu dem Thema „2. Fußball-Bundesliga“. Lesen Sie jetzt „Greuther Fürth holt niederländischen Torwart“.;2. Fußball-Bundesliga;News, 2. Fußball-Bundesliga, Pelle Boevink, SpVgg Greuther Fürth, Fußball-Bundesliga;2025-06-17T10:34:13+02:00;2025-06-17T10:34:13+02:00;;dpa Bayern;false
8308bd585e75b0f37a81099860683b93e585fede73ba7479485d43888a0296f2;Frau mit Alkoholwert von 5,4 Promille gefunden;https://www.zeit.de/news/2025-06/17/frau-mit-alkoholwert-von-5-4-promille-gefunden;Hier finden Sie Informationen zu dem Thema „Von Polizei aufgegriffen“. Lesen Sie jetzt „Frau mit Alkoholwert von 5,4 Promille gefunden“.;Von Polizei aufgegriffen;News, Von Polizei aufgegriffen, Speyer, Polizei, Alkoholwert, Polizeistreife;2025-06-17T10:33:26+02:00;2025-06-17T10:33:26+02:00;;dpa Baden-Württemberg;false
39b25ddd0f7c5e0310573918ee509f9e0f2f312d0f33d9eddef137c3f85a177f;Eintracht holt Schweizer Toptalent Noemi Ivelj;https://www.zeit.de/news/2025-06/17/eintracht-holt-schweizer-toptalent-noemi-ivelj;Hier finden Sie Informationen zu dem Thema „Transfers“. Lesen Sie jetzt „Eintracht holt Schweizer Toptalent Noemi Ivelj“.;Transfers;News, Transfers, Noemi Ivelj, Zürich, Schweiz, Eintracht Frankfurt;2025-06-17T10:26:50+02:00;2025-06-17T10:26:50+02:00;;dpa Hessen;false
59cedd7c0e3bfcbdccaeb752d0ba1d87f85cd45d411753174beb8daeaca5c2a3;Diakonie sieht Nachteile der Digitalisierung in Jobcentern;https://www.zeit.de/news/2025-06/17/diakonie-sieht-nachteile-der-digitalisierung-in-jobcentern;Hier finden Sie Informationen zu dem Thema „Digitalisierung“. Lesen Sie jetzt „Diakonie sieht Nachteile der Digitalisierung in Jobcentern“.;Digitalisierung;News, Digitalisierung, Dietrich Bauer, Sachsen, Diakonie, Jobcenter, Nachteil, Digitalisierung;2025-06-17T10:24:30+02:00;2025-06-17T10:24:30+02:00;;dpa Sachsen;false
ce6a36cd33c0ae91863823213196229cc6b82669340ed945ee79d3fdccf2fab1;Lehrer in Erfurt soll Schülerin missbraucht haben;https://www.zeit.de/news/2025-06/17/lehrer-in-erfurt-soll-schuelerin-missbraucht-haben;Hier finden Sie Informationen zu dem Thema „Kriminalität“. Lesen Sie jetzt „Lehrer in Erfurt soll Schülerin missbraucht haben“.;Kriminalität;News, Kriminalität, Erfurt, Staatsanwaltschaft, Kriminalität, Sexueller Missbrauch;2025-06-17T10:24:15+02:00;2025-06-17T10:24:15+02:00;;dpa Thüringen;false
95065174c75617ecaeaf1c3edf59b5a06f8f4faaaac138180b2adae028498e24;Sanierungskurs bei KTM bestätigt - 30 Prozent für Gläubiger;https://www.zeit.de/news/2025-06/17/sanierungskurs-bei-ktm-bestaetigt-30-prozent-fuer-glaeubiger;Hier finden Sie Informationen zu dem Thema „Motorsport-Marke“. Lesen Sie jetzt „Sanierungskurs bei KTM bestätigt - 30 Prozent für Gläubiger“.;Motorsport-Marke;News, Motorsport-Marke, Europa, Ried im Innkreis, Mobility, KTM, Sanierungskurs, Sanierungsverfahren, Motorsport;2025-06-17T10:21:11+02:00;2025-06-17T10:21:11+02:00;;dpa Bayern;false
4f0619c81279b0d7901def85e4c38749942d357c516ba97b75aef33866da8529;Depardieu muss sich erneut vor Gericht verantworten;https://www.zeit.de/news/2025-06/17/depardieu-muss-sich-erneut-vor-gericht-verantworten;Hier finden Sie Informationen zu dem Thema „Streit in Rom“. Lesen Sie jetzt „Depardieu muss sich erneut vor Gericht verantworten“.;Streit in Rom;News, Streit in Rom, Gérard Depardieu, Rino Barillari, Rom, Frankreich, Italien;2025-06-17T10:20:20+02:00;2025-06-17T10:20:20+02:00;;dpa;false
d66c2ca70a84029cc6503e6fea61e690a7b8a5d834b3b0cc20b999a7dce9e386;Herthas Vorbereitungsprogramm fast komplett;https://www.zeit.de/news/2025-06/17/herthas-vorbereitungsprogramm-fast-komplett;Hier finden Sie Informationen zu dem Thema „Zweite Fußball-Liga“. Lesen Sie jetzt „Herthas Vorbereitungsprogramm fast komplett“.;Zweite Fußball-Liga;News, Zweite Fußball-Liga, Kitzbühel, Bröndby, Alpen, Hertha BSC, Hertha BSC Berlin, Vorbereitungsprogramm;2025-06-17T10:14:09+02:00;2025-06-17T10:14:09+02:00;;dpa Berlin/Brandenburg;false
96d1e8b6789f57ae60c324c1bc73ecec844569f053cf961449e100d4cf857468;Mehr als fünf Millionen Menschen arbeiten im öffentlichen Dienst;https://www.zeit.de/wirtschaft/2025-06/oeffentlicher-dienst-waechst-auf-mehr-als-5-millionen-beschaeftigte;Der öffentliche Dienst in Deutschland wächst weiter. Die größten Zuwächse gab es laut Statistischem Bundesamt im Bildungssektor und in der Kinderbetreuung.;Arbeit;Wirtschaft, Arbeit, öffentlicher Dienst, Bildung, Lehrer, Kinderbetreuung, Arbeitnehmer, Statistisches Bundesamt;2025-06-17T10:10:41+02:00;2025-06-17T10:10:41+02:00;hap;ZEIT ONLINE,        dpa,        Reuters,        							hap;false
d59c2940390da40fefd545d6adee2f82144623de78c0c269a994e0afe210a979;Ältere Menschen sind deutlich stärker verschuldet als jüngere;https://www.zeit.de/wirtschaft/2025-06/schulden-statistik-aeltere-menschen;Senioren in Deutschland haben im Schnitt deutlich höhere Schulden als jüngere Menschen. Um sie abzubezahlen, müssten sie einen Großteil ihres Nettoeinkommens aufwenden.;Statistisches Bundesamt;Wirtschaft, Statistisches Bundesamt, Schulden, Senioren, Einkommen, Finanzen, Vermögen, Statistisches Bundesamt;2025-06-17T10:07:44+02:00;2025-06-17T10:07:44+02:00;mns;ZEIT ONLINE,        Reuters,        epd,        KNA,        							mns;false
0d20df5e44c237373d8c85c079e80dbb3bc80d2fa3089c3aa48202f2e3bcb023;Hessentag ist auch Jobbörse für tausende Schüler;https://www.zeit.de/news/2025-06/17/hessentag-ist-auch-jobboerse-fuer-tausende-schueler;Hier finden Sie Informationen zu dem Thema „Feste“. Lesen Sie jetzt „Hessentag ist auch Jobbörse für tausende Schüler“.;Feste;News, Feste, Fritzlar, Hessen, Polizei, Bundeswehr, Deutsche Presse-Agentur, Hessentag, Jobbörse, Nachwuchsgewinnung, US-Zölle;2025-06-17T10:02:05+02:00;2025-06-17T10:02:05+02:00;;dpa Hessen;false
85d2e68de39267256b2b0f975a1a47085f60cab5b2196ada0774289fa7f827fb;"""Kontrolle verloren"": Sabalenka entschuldigt sich bei Gauff";https://www.zeit.de/news/2025-06/17/kontrolle-verloren-sabalenka-entschuldigt-sich-bei-gauff;"Hier finden Sie Informationen zu dem Thema „Tennis“. Lesen Sie jetzt „""Kontrolle verloren"": Sabalenka entschuldigt sich bei Gauff“.";Tennis;News, Tennis, Aryna Sabalenka, Coco Gauff, French Open, Finale;2025-06-17T10:02:03+02:00;2025-06-17T10:02:03+02:00;;dpa Berlin/Brandenburg;false
3ffd2cdb0a026b3671fee3ce27622266bb05b23c1bbd8bda3359b6050c63638a;Offshore-Windfläche in Nordsee an Total Energies versteigert;https://www.zeit.de/news/2025-06/17/offshore-windflaeche-in-nordsee-an-total-energies-versteigert;Hier finden Sie Informationen zu dem Thema „Windenergie im Meer“. Lesen Sie jetzt „Offshore-Windfläche in Nordsee an Total Energies versteigert“.;Windenergie im Meer;News, Windenergie im Meer, Stefan Thimm, Nordsee, Bundesnetzagentur, Windenergie, Zahlungsangebot, Gigawatt, Offshore;2025-06-17T09:56:52+02:00;2025-06-17T09:56:52+02:00;;dpa Hamburg/Schleswig-Holstein;false
4f0c9fad340aa6bc41134ce88202aa3822f8f20fbbf6242773d06f61be7525e2;Eulenfreundschaft;https://www.zeit.de/2025/25/spike-george-eulen-fontenelle-forest-social-media;Unser Autor verfolgt das Schicksal zweier Eulen, denen das Leben übel mitgespielt hat. Statt sich zurückzuziehen, schauen sie interessiert auf die Dinge dieser Welt.;"Z+ (abopflichtiger Inhalt);
        
    Spike und George";Entdecken, Spike und George, Tiere, Freundschaft, Nebraska, Naturschutz, Instagram, Beziehung;2025-06-17T09:55:35+02:00;2025-06-17T09:55:35+02:00;David Hugendick;Aus der        ZEIT Nr. 25/2025;false
9d30999ae7d435e31035603b15788bc654e99889704b03c6e5f28c564b97caff;Gefahr durch UV-Strahlung steigt;https://www.zeit.de/news/2025-06/17/gefahr-durch-uv-strahlung-steigt;Hier finden Sie Informationen zu dem Thema „Wetter“. Lesen Sie jetzt „Gefahr durch UV-Strahlung steigt“.;Wetter;News, Wetter, Kai-Uwe Nerding, DWD, Südwesten, Gesundheitsgefahr, Wetter;2025-06-17T09:47:55+02:00;2025-06-17T09:47:55+02:00;;dpa Baden-Württemberg;false
24ee26d76f9b9d08aefceb7926709bc4d1c3ec6709713d8970ef92d30ebe84ab;Palästinenser: Dutzende Tote nahe Hilfszentrum in Gaza;https://www.zeit.de/news/2025-06/17/palaestinenser-dutzende-tote-nahe-hilfszentrum-in-gaza;Hier finden Sie Informationen zu dem Thema „Gaza-Krieg“. Lesen Sie jetzt „Palästinenser: Dutzende Tote nahe Hilfszentrum in Gaza“.;Gaza-Krieg;News, Gaza-Krieg, USA, Gazastreifen, Hilfszentrum, Militär;2025-06-17T09:44:10+02:00;2025-06-17T09:44:10+02:00;;dpa;false
7c0fedd1cb4fa8f8bf47eb60a0ffc581af9b60498af5e34284ccff9014510cff;Keine Einigung im Millionenstreit zwischen Hertha und Bobic;https://www.zeit.de/news/2025-06/17/keine-einigung-im-millionenstreit-zwischen-hertha-und-bobic;Hier finden Sie Informationen zu dem Thema „2. Fußball-Bundesliga“. Lesen Sie jetzt „Keine Einigung im Millionenstreit zwischen Hertha und Bobic“.;2. Fußball-Bundesliga;News, 2. Fußball-Bundesliga, Fredi Bobic, Hertha BSC, Hertha BSC Berlin, Fußball-Bundesliga, Millionenstreit;2025-06-17T09:43:21+02:00;2025-06-17T09:43:21+02:00;;dpa Berlin/Brandenburg;false
6ea7e80225beb8f1fec4605a59084e3b5ab2a447e4cd83998b8165a27384baec;"Pierre Sanoussi-Bliss übernimmt Rolle bei ""Unter uns""";https://www.zeit.de/news/2025-06/17/pierre-sanoussi-bliss-uebernimmt-rolle-bei-unter-uns;"Hier finden Sie Informationen zu dem Thema „Gastauftritt“. Lesen Sie jetzt „Pierre Sanoussi-Bliss übernimmt Rolle bei ""Unter uns""“.";Gastauftritt;News, Gastauftritt, Pierre Sanoussi-Bliss, Adam Wolter, RTL, Ich bin ein Star – Holt mich hier raus!, Gastauftritt;2025-06-17T09:40:36+02:00;2025-06-17T09:40:36+02:00;;dpa;false
abace293249459a40e8c061ca09e9bdf8f4b0513966a4aa7f8f7f94912be1fff;Israel meldet Tötung von wichtigem Kommandeur der Revolutionsgarden;https://www.zeit.de/politik/ausland/2025-06/israel-iran-krieg-nahost-liveblog;Israels Militär hat nach eigenen Angaben den ranghohen iranischen General Ali Schadmani getötet. Menschen in Teheran folgen offenbar Evakuierungsaufruf. Das Liveblog;Liveblog:                     Israel-Iran-Krieg;Politik, Israel-Iran-Krieg, Iran, Benjamin Netanjahu, Israel, Nahost, Gazastreifen, Hamas, Waffenruhe;2025-06-17T08:32:56+00:00;2025-06-17T08:32:56+00:00;Maline HofmannHannah PrasuhnMarla  NossLeon Ginzel;;false
f1b85e291d6a363732f39c412ee60f414992d31294feaee6d86948bdcb8c6028;Drei Schwerverletzte bei illegalem Straßenrennen;https://www.zeit.de/news/2025-06/17/drei-schwerverletzte-bei-illegalem-strassenrennen;Hier finden Sie Informationen zu dem Thema „Weit über Tempolimit“. Lesen Sie jetzt „Drei Schwerverletzte bei illegalem Straßenrennen“.;Weit über Tempolimit;News, Weit über Tempolimit, Limburg, Landkreis Limburg-Weilburg, Polizei, Straßenrennen, Tempolimit, Auto;2025-06-17T09:33:58+02:00;2025-06-17T09:33:58+02:00;;dpa Hessen;false
5ebc026753876ed425983a42bf08a972728ad0140fbf6e6fc19ec1530be75837;"Basketball-EM: ""Perfektionistin"" Fiebich soll es richten";https://www.zeit.de/news/2025-06/17/basketball-em-perfektionistin-fiebich-soll-es-richten;"Hier finden Sie Informationen zu dem Thema „Vorrunde in Hamburg“. Lesen Sie jetzt „Basketball-EM: ""Perfektionistin"" Fiebich soll es richten“.";Vorrunde in Hamburg;News, Vorrunde in Hamburg, Leonie Fiebich, Marie Gülich, Lisa Thomaidis, Dirk Nowitzki, Hamburg, New York, Piräus, WNBA, Basketball-Europameisterschaft, Vorrunde;2025-06-17T09:33:01+02:00;2025-06-17T09:33:01+02:00;;dpa Hamburg/Schleswig-Holstein;false
927aab48e924653ece8fcf1e4996f8f78e8532c1f06f9c868ca54baf2293eda8;Teilzeitquote in Deutschland eine der höchsten in der EU;https://www.zeit.de/news/2025-06/17/teilzeitquote-in-deutschland-eine-der-hoechsten-in-der-eu;Hier finden Sie Informationen zu dem Thema „Arbeit“. Lesen Sie jetzt „Teilzeitquote in Deutschland eine der höchsten in der EU“.;Arbeit;News, Arbeit, Wiesbaden, Niederlande, Österreich, EU, Statistisches Bundesamt, Bundesregierung, Teilzeitquote, Teilzeitarbeit;2025-06-17T09:30:31+02:00;2025-06-17T09:30:31+02:00;;dpa;false
86e83c6ec96d0855184ff0ac96cf7c2eb00a71f1a1164cd60f8158ddcb44c7ac;Landratsamt warnt vor trübem Trinkwasser in Bad Herrenalb;https://www.zeit.de/news/2025-06/17/landratsamt-warnt-vor-trueben-trinkwasser-in-bad-herrenalb;Hier finden Sie Informationen zu dem Thema „Abkochgebot“. Lesen Sie jetzt „Landratsamt warnt vor trübem Trinkwasser in Bad Herrenalb“.;Abkochgebot;News, Abkochgebot, Bad Herrenalb, Calw, Landratsamt, Abkochgebot, Trinkwasser;2025-06-17T09:27:36+02:00;2025-06-17T09:27:36+02:00;;dpa Baden-Württemberg;false
72d37a5defa5c05a0ac8e1999bcb037bf3409ff9f3c8fd95031b5b027d2952a1;CSD in Regensburg wird wegen Bedrohungslage umgeplant;https://www.zeit.de/gesellschaft/zeitgeschehen/2025-06/csd-regensburg-umplanung-bedrohungslage;Die Organisatoren des Christopher Street Days in Regensburg haben nach eigenen Angaben ein Drohschreiben erhalten. Der Umzug findet deshalb anders statt als geplant.;Christopher Street Day;Gesellschaft, Christopher Street Day, Christopher Street Day, Regensburg, Demonstration, Ermittlung, Drohung, Queerness;2025-06-17T09:26:14+02:00;2025-06-17T09:26:14+02:00;hap;ZEIT ONLINE,        dpa,        							hap;false
5c595a9d1f6c2ba591025d51bbc60b4a8fac74a599cc3b42c0b0ab09037205a1;Es kann nur einen geben;https://www.zeit.de/2025/25/thermomix-tm7-kuechenmaschine-wettkampf-qualitaet-preis-hype;"Selbst Kochstars wie ""Sally"" kämpfen mit eigenen Geräten gegen den Thermomix – um den einen Platz auf der Kücheninsel. Es gewinnt nur, wer die Kunden wirklich versteht.";"Z+ (abopflichtiger Inhalt);
        
    Thermomix TM7";kochen, Verbraucherschutz, Technologie, Stiftung Warentest, Rezept, Alltag;2025-06-17T09:25:48+02:00;2025-06-17T09:25:48+02:00;Simon LangemannRicarda Richter;Aus der        ZEIT Nr. 25/2025;false
df7b44ebab96a5494a1eba2a7019f472d511bb7e37a8b4485b0895a1a2eb1bfa;Deutsche arbeiten überdurchschnittlich oft in Teilzeit;https://www.zeit.de/arbeit/2025-06/teilzeitbeschaeftigungen-quote-statstisches-bundesamt-deutschland;Deutschland hat mit 29 Prozent eine der höchsten Teilzeitquoten Europas. Auch bei den Geschlechterunterschieden sticht Deutschland im europaweiten Vergleich heraus.;Teilzeitquote;Arbeit, Teilzeitquote, Teilzeitarbeit, Arbeitnehmer, Frauen, Arbeitsmarkt, Gleichberechtigung, Europa;2025-06-17T09:22:14+02:00;2025-06-17T09:22:14+02:00;mns;ZEIT ONLINE,        AFP,        Reuters,        							mns;false
85a83896c2b3252e17522dacb96ed50c6fc74465b715ce88d4cbd684f83fd6f0;In Niedersachsen weiter warm und bewölkt;https://www.zeit.de/news/2025-06/17/in-niedersachsen-weiter-warm-und-bewoelkt;Hier finden Sie Informationen zu dem Thema „Wetter“. Lesen Sie jetzt „In Niedersachsen weiter warm und bewölkt“.;Wetter;News, Wetter, Niedersachsen, Bremen, Wetter;2025-06-17T09:15:23+02:00;2025-06-17T09:15:23+02:00;;dpa Niedersachsen;false
84f619f7514e40dba34d348ee086861c62bdfb19c748db8fec32a4382c0f7593;Motorrad überschlägt sich - Fahrer schwer verletzt;https://www.zeit.de/news/2025-06/17/motorrad-ueberschlaegt-sich-fahrer-schwer-verletzt;Hier finden Sie Informationen zu dem Thema „Unfall“. Lesen Sie jetzt „Motorrad überschlägt sich - Fahrer schwer verletzt“.;Unfall;News, Unfall, Motorrad, Unfall;2025-06-17T09:14:03+02:00;2025-06-17T09:14:03+02:00;;dpa Hessen;false
