Hash;Title;Link;Description;Category;KeyWords;Published;LastUpdated;Author;Source;Paywall
bff513729e866b50507872f3ae6f3010a9ed0f31b77e3032c3e9ec1faa0a8b1c;Bayern spielt im Halbfinale des DFB-Pokals gegen Leverkusen;https://www.zeit.de/sport/2026-02/dfb-pokal-auslosung-bayern-muenchen-freiburg-stuttgart-leverkusen;Der Rekordsieger Bayern München muss im Halbfinale des DFB-Pokals auswärts gegen Leverkusen spielen. Im anderen Spiel trifft Titelverteidiger Stuttgart auf Freiburg.;DFB-Pokal;Sport, DFB-Pokal, DFB-Pokal, DFB, VfB Stuttgart, Bayer 04 Leverkusen, FC Bayern München, RB Leipzig;2026-02-22T20:14:23+01:00;2026-02-22T20:14:23+01:00;tlfbam;DIE ZEIT,        SID,        dpa,        							tlf					,        							bam;false
d9810e24870c687e0a00f3c26197ddca6f068fad6824f09488c6727af3a1833e;St. Pauli setzt sich im Abstiegskampf gegen Bremen durch;https://www.zeit.de/sport/2026-02/freiburg-moenchengladbach-st-pauli-bremen-bundesliga-23-spieltag-sonntag;Der VfB verliert beinahe gegen den Tabellenletzten. Bremen und St. Pauli wechseln die Tabellenplätze, Mönchengladbach verliert gegen Freiburg. Die Spielberichte;Bundesliga, 23. Spieltag – Sonntag;Sport, Bundesliga, 23. Spieltag – Sonntag, SV Werder Bremen, FC St. Pauli, Borussia Mönchengladbach, SC Freiburg, Fußball-Bundesliga, VfB Stuttgart, 1. FC Heidenheim;2026-02-22T20:06:01+01:00;2026-02-22T20:06:01+01:00;bamtlf;DIE ZEIT,        dpa,        SID,        							bam					,        							tlf;false
22d466b38dd8f816ac3d104b304f41f00b591932bd68ef518b6ec462f9cadba6;Wir brüllen heimlich;https://www.zeit.de/2026/08/kindererziehung-gewaltfrei-anschreien-eltern-paedagogik;Moderne Eltern verwenden viel Kraft darauf, ihren Kindern gegenüber auf keinen Fall laut zu werden. Das ist großartig, aber auch irre – und vielleicht gar nicht nötig.;"Z+ (abopflichtiger Inhalt);
        
    Moderne Kindererziehung";Familie, Moderne Kindererziehung, Kindererziehung, Pädagogik, Kinder, Eltern, Mütter, Väter;2026-02-22T20:01:35+01:00;2026-02-22T20:01:35+01:00;Johannes Gernert;Aus der        ZEIT Nr. 08/2026;false
333e5554d9b9c3f480066c3df1ad71b487e7bb7d025d5beb0954ec8f891e4ec7;Füchse Berlin mit Arbeitssieg beim Bergischen HC;https://www.zeit.de/news/2026-02/22/fuechse-berlin-mit-arbeitssieg-beim-bergischen-hc;Hier finden Sie Informationen zu dem Thema „Handball-Bundesliga“. Lesen Sie jetzt „Füchse Berlin mit Arbeitssieg beim Bergischen HC“.;Handball-Bundesliga;News, Handball-Bundesliga, Tim Freihöfer, Lasse Ludwig, Tabellensechzehnten, Düsseldorf, Füchse Berlin, Bergischer HC, Handball-Bundesliga, Arbeitssieg;2026-02-22T20:01:12+01:00;2026-02-22T20:01:12+01:00;;dpa Berlin/Brandenburg;false
3acec58456714146f6554c25664a6d8c05b614bb738c5ac8c02f40cf8f0aa02f;Hundehalter geraten aneinander;https://www.zeit.de/news/2026-02/22/hundehalter-geraten-aneinander;Hier finden Sie Informationen zu dem Thema „Polizeieinsatz“. Lesen Sie jetzt „Hundehalter geraten aneinander“.;Polizeieinsatz;News, Polizeieinsatz, Landkreis Mainz-Bingen, Polizei, Polizeieinsatz, Tiere;2026-02-22T20:00:46+01:00;2026-02-22T20:00:46+01:00;;dpa Rheinland-Pfalz/Saarland;false
4b77b6bd5c2565978d18f1d61b79e844084447468ee4b1c96dc4948c859562c9;Bilder des Tages;https://www.zeit.de/news/2026-02/22/bilder-des-tages;Hier finden Sie Informationen zu dem Thema „Fotografie“. Lesen Sie jetzt „Bilder des Tages“.;Fotografie;News, Fotografie, News;2026-02-22T19:41:06+01:00;2026-02-22T19:41:06+01:00;;dpa;false
229f608d79cfdc7c21a18b46d156a518050c5c0d01f608f3c130b9d6bd640b56;"Münchner jubeln beim Matthäus-Besuch - ""Bayern wird Meister""";https://www.zeit.de/news/2026-02/22/muenchner-jubeln-beim-matthaeus-besuch-bayern-wird-meister;"Hier finden Sie Informationen zu dem Thema „Bundesliga der Fußballerinnen“. Lesen Sie jetzt „Münchner jubeln beim Matthäus-Besuch - ""Bayern wird Meister""“.";Bundesliga der Fußballerinnen;News, Bundesliga der Fußballerinnen, Jovana Damnjanovic, Stina Johannes, Giulia Gwinn, Wolfsburg, Bayern, VfL Wolfsburg, FC Bayern München, Deutscher Fußball-Bund, Bundesliga, Champions League;2026-02-22T19:38:37+01:00;2026-02-22T19:38:37+01:00;;dpa Bayern;false
423b651230deaab4e0d8a4a22fdf57d0c1db874ae05688835dd1a9dc5871afc8;Newcastle-Krankheit bei Putenmastbestand ausgebrochen;https://www.zeit.de/news/2026-02/22/newcastle-krankheit-bei-putenmastbestand-ausgebrochen;Hier finden Sie Informationen zu dem Thema „Tierseuche“. Lesen Sie jetzt „Newcastle-Krankheit bei Putenmastbestand ausgebrochen“.;Tierseuche;News, Tierseuche, Brandenburg, Oder-Spree, Putenmastbestand, Tierseuche, Bekämpfungsmaßnahme, Tiere;2026-02-22T19:36:34+01:00;2026-02-22T19:36:34+01:00;;dpa Berlin/Brandenburg;false
b0802aa9075f14c87a42cd0b4957742c4964f6a5fee37f4b83b27395b2154137;Torwartfehler im Krisengipfel: St. Pauli besiegt Werder;https://www.zeit.de/news/2026-02/22/torwartfehler-im-krisengipfel-st-pauli-besiegt-werder;Hier finden Sie Informationen zu dem Thema „Fußball-Bundesliga“. Lesen Sie jetzt „Torwartfehler im Krisengipfel: St. Pauli besiegt Werder“.;Fußball-Bundesliga;News, Fußball-Bundesliga, Daniel Thioune, Hauke Wahl, Nikola Vasilj, Jovan Milošević, St. Pauli, FC St. Pauli, SV Werder Bremen, Fußball-Bundesliga, Torwartfehler, Krisengipfel;2026-02-22T19:26:05+01:00;2026-02-22T19:26:05+01:00;;dpa Hamburg/Schleswig-Holstein;false
67c3184f52387448b39b298602ca73f2cab8f24d9c82b42c442a1a4a6cc5830a;Bambergs Basketballern gelingt Pokal-Coup - Frust bei Bayern;https://www.zeit.de/news/2026-02/22/bamberger-basketballer-gewinnen-pokal;Hier finden Sie Informationen zu dem Thema „Top Four in München“. Lesen Sie jetzt „Bambergs Basketballern gelingt Pokal-Coup - Frust bei Bayern“.;Top Four in München;News, Top Four in München, München, Bamberg, Pokal;2026-02-22T19:20:18+01:00;2026-02-22T19:20:18+01:00;;dpa Bayern;false
1fe68eee3d81b504b63644b53cb887f25b33025dbf6f0fdac58b6ceb59b60adb;"Freiburg beim VfB: Schuster will ""Trauma"" verarbeiten";https://www.zeit.de/news/2026-02/22/freiburg-beim-vfb-schuster-will-trauma-verarbeiten;"Hier finden Sie Informationen zu dem Thema „DFB-Pokal“. Lesen Sie jetzt „Freiburg beim VfB: Schuster will ""Trauma"" verarbeiten“.";DFB-Pokal;News, DFB-Pokal, Matthias Ginter, Julian Schuster, Freiburg, Stuttgart, Deutscher Fußball-Bund, VfB Stuttgart, SC Freiburg, Trauma, Revanchegedanke;2026-02-22T19:13:40+01:00;2026-02-22T19:13:40+01:00;;dpa Baden-Württemberg;false
4b51f86d2a1285adb0ce1d6d72d97fec9259c3fea13847a843df2eb3cf89b0a3;Blizzard-Warnung: Wintersturm im Nordosten der USA erwartet;https://www.zeit.de/news/2026-02/22/blizzard-warnung-wintersturm-im-nordosten-der-usa-erwartet;Hier finden Sie Informationen zu dem Thema „Unwetter“. Lesen Sie jetzt „Blizzard-Warnung: Wintersturm im Nordosten der USA erwartet“.;Unwetter;News, Unwetter, Zohran Mamdani, USA, New York, Wintersturm, Nordosten, Eiseskälte, Unwetter;2026-02-22T19:13:25+01:00;2026-02-22T19:13:25+01:00;;dpa;false
c6d3d135d65720f168d270bdf5bdd79e4c82f172ed5bba9c0c2697e3e5e33df3;500 Passagiere sitzen wegen Schnee nachts in Flugzeugen fest;https://www.zeit.de/news/2026-02/22/500-passagiere-sitzen-wegen-schnee-nachts-in-flugzeugen-fest;Hier finden Sie Informationen zu dem Thema „München“. Lesen Sie jetzt „500 Passagiere sitzen wegen Schnee nachts in Flugzeugen fest“.;München;News, München, München, Deutsche Lufthansa, Flugzeug, Winter;2026-02-22T19:13:08+01:00;2026-02-22T19:13:08+01:00;;dpa;false
f6845afaa3e65d184599c4bfeb5f54565cc9c4e704affd3b4768ce1c83fc9724;Videoanruf von Trump: US-Cracks Eishockey-Olympiasieger;https://www.zeit.de/news/2026-02/22/kanada-entzaubert-usa-gewinnt-eishockey-turnier-bei-olympia;Hier finden Sie Informationen zu dem Thema „Sieg über Kanada“. Lesen Sie jetzt „Videoanruf von Trump: US-Cracks Eishockey-Olympiasieger“.;Sieg über Kanada;News, Sieg über Kanada, Kanada, USA, Eishockey-Turnier, Olympia, Finale;2026-02-22T19:04:02+01:00;2026-02-22T19:04:02+01:00;;dpa Sport;false
049dada82d3bd5992716674efc0743b6cbd5d26870e56b5d8cf8e7513f25728a;Gibt es eigentlich gute Orthopäden?;https://www.zeit.de/2026/08/orthopaedie-individuelle-gesundheitsleistungen-stammzelltherapie-tobias-renkawitz;Tobias Renkawitz ist einer der renommiertesten Gelenkspezialisten. Was er über unsere schlechten Erfahrungen mit seinen Kollegen denkt – und über teure Trendtherapien.;"Z+ (abopflichtiger Inhalt);
        
    Orthopädie";Gesundheit, Orthopädie, Regensburg, Universität Regensburg, Arzt, Medikament, Heidelberg;2026-02-22T19:01:11+01:00;2026-02-22T19:01:11+01:00;Ragnhild SchweitzerJan Schweitzer;Aus der        ZEIT Nr. 08/2026;false
7ee96345d276f990d0aad3afe329b147282acf96858ec43a62303de5b203b9b4;Alba Berlin verliert nach Krimi Pokalfinale gegen Bamberg;https://www.zeit.de/news/2026-02/22/alba-berlin-verliert-nach-krimi-pokalfinale-gegen-bamberg;Hier finden Sie Informationen zu dem Thema „Top Four“. Lesen Sie jetzt „Alba Berlin verliert nach Krimi Pokalfinale gegen Bamberg“.;Top Four;News, Top Four, Malte Delow, Bamberg, München, Alba Berlin, BB, Pokalfinale, Pokalsieg, Finale;2026-02-22T18:52:23+01:00;2026-02-22T18:52:23+01:00;;dpa Berlin/Brandenburg;false
9eb86934e123f047b53cdb6068fbe13be0995f2cdd90b6f5155049dd5e82d56e;Koalition auf Zielgeraden bei Gesprächen über Heizungsgesetz;https://www.zeit.de/news/2026-02/22/koalition-auf-zielgeraden-bei-gespraechen-ueber-heizungsgesetz;Hier finden Sie Informationen zu dem Thema „Koalition“. Lesen Sie jetzt „Koalition auf Zielgeraden bei Gesprächen über Heizungsgesetz“.;Koalition;News, Koalition, Jens Spahn, Matthias Miersch, CDU/CSU, SPD, Heizungsgesetz, Zielgerade, Koalition;2026-02-22T18:50:21+01:00;2026-02-22T18:50:21+01:00;;dpa;false
5f425b1e81431b8679ec917606e00f320aeecc63efc31c8e8408739073773ddd;Cottbus schießt sich nach vorn und Aue tiefer in den Keller;https://www.zeit.de/news/2026-02/22/cottbus-schiesst-sich-nach-vorn-und-aue-tiefer-in-den-keller;Hier finden Sie Informationen zu dem Thema „3. Fußball-Liga“. Lesen Sie jetzt „Cottbus schießt sich nach vorn und Aue tiefer in den Keller“.;3. Fußball-Liga;News, 3. Fußball-Liga, Claus-Dieter Wollitz, Marcel Bär, Martin Männel, Cottbus, Erzgebirge, Energie Cottbus, FC Erzgebirge Aue, Abstiegsschlamassel, Erfolg;2026-02-22T18:45:41+01:00;2026-02-22T18:45:41+01:00;;dpa Berlin/Brandenburg;false
7a071c0d22b27007a440eabc8b4270994318ee83c4dd95cbf273f3a65231c7f4;Sicherheitskräfte erschießen Mann bei Trump-Anwesen;https://www.zeit.de/news/2026-02/22/sicherheitskraefte-erschiessen-mann-bei-trump-anwesen;Hier finden Sie Informationen zu dem Thema „Notfälle“. Lesen Sie jetzt „Sicherheitskräfte erschießen Mann bei Trump-Anwesen“.;Notfälle;News, Notfälle, Donald Trump, Sicherheitskräfte, Notfall, Privatanwesen;2026-02-22T18:45:35+01:00;2026-02-22T18:45:35+01:00;;dpa;false
3ec43986e2b0ab0a9567dccdad9d51a0e9556622e27d539fd4cc59c9a3fac34f;Auf dem Bussen: Promi-Chirurg Mang hält Fastenpredigt;https://www.zeit.de/news/2026-02/22/auf-dem-bussen-promi-chirurg-mang-haelt-fastenpredigt;Hier finden Sie Informationen zu dem Thema „Prediger für einen Tag“. Lesen Sie jetzt „Auf dem Bussen: Promi-Chirurg Mang hält Fastenpredigt“.;Prediger für einen Tag;News, Prediger für einen Tag, Werner Mang, Bodenseeklinik, Fastenpredigt, Facelift;2026-02-22T18:42:34+01:00;2026-02-22T18:42:34+01:00;;dpa Baden-Württemberg;false
588ae2afae5e5949c122184621b5275eb090503084b2e10af97bcdf1c46a1154;Wirtz fällt mit Rückenproblemen aus - Liverpool gewinnt 1:0;https://www.zeit.de/news/2026-02/22/droht-eine-pause-wirtz-verletzt-sich-beim-aufwaermen;Hier finden Sie Informationen zu dem Thema „Fußball in England“. Lesen Sie jetzt „Wirtz fällt mit Rückenproblemen aus - Liverpool gewinnt 1:0“.;Fußball in England;News, Fußball in England, Florian Wirtz, Fußballnationalmannschaft;2026-02-22T18:42:30+01:00;2026-02-22T18:42:30+01:00;;dpa Sport;false
61bbb0d9ad11804caf19f5862e10a44e6a0bab9b22d1cc910110811008279cf5;Mutter von fünf Kindern erstochen - Partner in Haft;https://www.zeit.de/news/2026-02/22/frau-bei-messerangriff-in-hagen-getoetet;Hier finden Sie Informationen zu dem Thema „Kriminalität“. Lesen Sie jetzt „Mutter von fünf Kindern erstochen - Partner in Haft“.;Kriminalität;News, Kriminalität, Hagen, Messerangriff, Kriminalität;2026-02-22T18:39:48+01:00;2026-02-22T18:39:48+01:00;;dpa Nordrhein-Westfalen;false
8a90b6bf2feb1f207a842f3e41c260b162735a5e3206f66e0a21ac157ede5df8;Minister aus Somaliland bietet USA Bodenschätze und Stützpunkte an;https://www.zeit.de/politik/ausland/2026-02/ostafrika-somaliland-angebot-zugriff-usa-bodenschaetze-militaerstuetzpunkte;"Nach Anerkennung seiner Unabhängigkeit durch Israel strebt Somaliland auch eine Nähe zu den USA an. Ein Minister verspricht den USA ""exklusiven"" Zugang.";Ostafrika;Politik, Ostafrika, USA, Somalia, Militär, Stützpunkt, Rohstoff, Ostafrika;2026-02-22T18:35:10+01:00;2026-02-22T18:35:10+01:00;vvö;DIE ZEIT,        AFP,        							vvö;false
5d90dc03ddd3512cd3150dd31ae76281b986bd9584904c1f3770037b34f706d5;Deutschland beendet Olympia auf Platz fünf im Medaillenspiegel;https://www.zeit.de/sport/2026-02/olympische-winterspiele-medaillenspiegel-deutschland;Acht Goldmedaillen haben die deutschen Athleten bei diesen Spielen gewonnen – vier weniger als vor vier Jahren. Der Deutsche Olympische Sportbund ist dennoch zufrieden.;Olympische Winterspiele;Sport, Olympische Winterspiele, Olympische Winterspiele, Deutscher Olympischer Sportbund, Wintersport, Olympia, Norwegen, Profisport;2026-02-22T18:19:13+01:00;2026-02-22T18:19:13+01:00;fa;DIE ZEIT,        dpa,        							fa;false
c0080aee1de3b7ac387c058b60478c9a99fd04f308cbb962e58844deb26f2ff4;Nach Rohrbruch in Hamburg – Haushalte haben wieder Wasser;https://www.zeit.de/news/2026-02/22/leitung-platzt-mehrere-haushalte-in-hamburg-ohne-wasser;Hier finden Sie Informationen zu dem Thema „Notfälle“. Lesen Sie jetzt „Nach Rohrbruch in Hamburg – Haushalte haben wieder Wasser“.;Notfälle;News, Notfälle, Hamburg, Haushalt, Notfall;2026-02-22T18:19:03+01:00;2026-02-22T18:19:03+01:00;;dpa Hamburg/Schleswig-Holstein;false
aec5989ae526bed9a1e9ebbd687fdc6e8a816dd9328c462eb422963c3a025328;Torwartpatzer leitet klaren Bayern-Sieg gegen Wolfsburg ein;https://www.zeit.de/news/2026-02/22/torwartpatzer-leitet-klaren-bayern-sieg-gegen-wolfsburg-ein;Hier finden Sie Informationen zu dem Thema „Bundesliga der Fußballerinnen“. Lesen Sie jetzt „Torwartpatzer leitet klaren Bayern-Sieg gegen Wolfsburg ein“.;Bundesliga der Fußballerinnen;News, Bundesliga der Fußballerinnen, Lothar Matthäus, Jovana Damnjanovic, Stina Johannes, Klara Bühl, Wolfsburg, Bayern, FC Bayern München, VfL Wolfsburg, Bundesliga, Meistertitel;2026-02-22T18:17:18+01:00;2026-02-22T18:17:18+01:00;;dpa Bayern;false
7ba571ea7ae4796e08d5fbc2c36ab568d95816b7d180cdc5287bf43af2a88b2d;Die 13 Säulen des asiatischen Kochens;https://www.zeit.de/zeit-magazin/wochenmarkt/2026-02/asiatische-kueche-zutaten-sojasauce-reisessig;Jenseits der hellen Sojasoße: Mit diesen Würzmitteln legen Sie die Grundlage, um aus all Ihren Vorräten zahllose ost- und südostasiatische Gerichte zu kochen.;"Z+ (abopflichtiger Inhalt);
        
    Asiatische Küche";Asien, kochen, Nudeln;2026-02-22T18:11:24+01:00;2026-02-22T18:11:24+01:00;Sissi Chen;;false
7b2a017501f29eecc04205aa37db36ccce8ae489ad8a923dc07aa3230e314582;"""Dass man kein Auto hatte, war normal. Wir waren gut zu Fuß""";https://www.zeit.de/2026/09/jahrgang-1946-nachkriegszeit-kindheit-80-geburtstag;Die beste Zeit ihres Lebens? Die Rente, sagen die Männer. Ihre Fünfziger, sagen die Frauen. Fünf Babyboomer über Umbrüche, Herzschrittmacher und narzisstische Enkel;"Z+ (abopflichtiger Inhalt);
        
    Jahrgang 1946";Entdecken, Jahrgang 1946, Familie, Geschichte, Lebensstil, Alter, Zweiter Weltkrieg;2026-02-22T18:10:44+01:00;2026-02-22T18:10:44+01:00;Silke WeberLea Marlen Balzer;Aus der        ZEIT Nr. 09/2026;false
ff6b2381f4e435a8336dfdcb75e685c053cc5431e48d4832e35ebca25e2cd38c;EU-Kommission pocht auf vereinbarte Obergrenze bei US-Zöllen;https://www.zeit.de/news/2026-02/22/eu-kommission-pocht-auf-vereinbarte-obergrenze-bei-us-zoellen;Hier finden Sie Informationen zu dem Thema „Nach Trump-Ankündigungen“. Lesen Sie jetzt „EU-Kommission pocht auf vereinbarte Obergrenze bei US-Zöllen“.;Nach Trump-Ankündigungen;News, Nach Trump-Ankündigungen, Donald Trump, USA, Europäische Union, EU-Kommission, Zollobergrenze;2026-02-22T18:06:04+01:00;2026-02-22T18:06:04+01:00;;dpa;false
8576979b376e4db929c02d39e21dc91c8c75f0062e7acdb5d5bacaa803bc251a;"""Lieber Jochen, das alles mag für Dich unglaublich klingen...""";https://www.zeit.de/2026/09/zukunft-computer-geschichte-ki-smartphone-e-mail;Eine seltsame E-Mail aus dem Jahr 2106 offenbart, wie Computer sich weiterentwickeln werden: Sie lenken dann nicht nur den Verkehr, sondern auch China und die USA.;"Z+ (abopflichtiger Inhalt);
        
    Zukunft des Computers";Digital, Zukunft des Computers, Zukunftsvision, künstliche Intelligenz, Computer, China, USA;2026-02-22T18:00:11+01:00;2026-02-22T18:00:11+01:00;Jochen Wegner;Aus der        ZEIT Nr. 09/2026;false
ccd28e2856aa33ed954dfac2a2049b0d1d11b99b8201be11f8c4a5520fa24e43;Letzte Medaillen vergeben – USA holen Gold im Eishockey;https://www.zeit.de/sport/2026-01/olympische-winterspiele-italien-live;Die USA schlagen Kanada im Eishockey-Finale in der Overtime. Die deutschen Bobpiloten holen Gold und Silber im Viererbob. Das Liveblog zum Nachlesen;Olympische Winterspiele;Sport, Olympische Winterspiele, Olympische Winterspiele, Biathlon, Mailand, Profisport, Sportler, Wintersport;2026-02-22T17:57:14+01:00;2026-02-22T17:57:14+01:00;Maxim NägeleFabian AlbrechtVeronika Völlinger;;false
77d1f6674fa6f60822d5049ed343447f2fbe6c1e8294eaa3db3af840f0cc2f32;Schaden an Oberleitung am Hamburger Hauptbahnhof behoben;https://www.zeit.de/news/2026-02/22/schaden-an-oberleitung-am-hamburger-hauptbahnhof;Hier finden Sie Informationen zu dem Thema „Störung“. Lesen Sie jetzt „Schaden an Oberleitung am Hamburger Hauptbahnhof behoben“.;Störung;News, Störung, Deutsche Presse-Agentur, Hauptbahnhof, Oberleitung, Störung, Oberleitungsschaden;2026-02-22T17:53:44+01:00;2026-02-22T17:53:44+01:00;;dpa Hamburg/Schleswig-Holstein;false
399a3969db807c0cda9cd0fbc0c714c961a4b5968ba0a93e1e54c20b5133a278;Mann am Tor von Donald Trumps Anwesen erschossen;https://www.zeit.de/politik/ausland/2026-02/mar-a-lago-donald-trump-secret-service-eindringling-erschossen-gxe;An Trumps Residenz in Florida hat der Secret Service nach eigenen Angaben einen womöglich bewaffneten Eindringling erschossen. Trump war währenddessen nicht vor Ort.;Mar-a-Lago;Politik, Mar-a-Lago, Donald Trump, Präsidentschaft, Florida, USA, FBI;2026-02-22T17:49:21+01:00;2026-02-22T17:49:21+01:00;vvö;DIE ZEIT,        Reuters,        AP,        							vvö;false
1b54feb021b7e0d15c403458646ee94393c1343702a51be1dcb0b1cdd2ea7b49;Mann attackiert Frau in Kreuzberg - Staatsschutz ermittelt;https://www.zeit.de/news/2026-02/22/mann-attackiert-frau-in-kreuzberg-staatsschutz-ermittelt;Hier finden Sie Informationen zu dem Thema „Kriminalität“. Lesen Sie jetzt „Mann attackiert Frau in Kreuzberg - Staatsschutz ermittelt“.;Kriminalität;News, Kriminalität, Kreuzberg, Polizei, Staatsschutz, Attacke, Kriminalität;2026-02-22T17:44:48+01:00;2026-02-22T17:44:48+01:00;;dpa Berlin/Brandenburg;false
ac455091259d74483ab14900ecde77946a09fca55e87e285c798e8ed55b6559e;"""Das ist zu wenig"": Gladbach stürzt noch tiefer in die Krise";https://www.zeit.de/news/2026-02/22/ginter-stuerzt-gladbach-noch-tiefer-in-die-krise;"Hier finden Sie Informationen zu dem Thema „Fußball-Bundesliga“. Lesen Sie jetzt „""Das ist zu wenig"": Gladbach stürzt noch tiefer in die Krise“.";Fußball-Bundesliga;News, Fußball-Bundesliga, Matthias Ginter, Igor Matanovic, Rocco Reitz, Philipp Sander, Eugen Polanski, Hans Meyer, Gladbach, Freiburg, Breisgau, Borussia Mönchengladbach;2026-02-22T17:44:14+01:00;2026-02-22T17:44:14+01:00;;dpa Baden-Württemberg;false
39d44cf0d5a203012ec1e3aeafbcb71f49570c2d7126827173bc60ab0ea3f516;"Zentralrat der Juden: Schau betont ""schmerzliche Aktualität""";https://www.zeit.de/news/2026-02/22/zentralrat-der-juden-schau-betont-schmerzliche-aktualitaet;"Hier finden Sie Informationen zu dem Thema „Bundesweit einzige Ausstellung“. Lesen Sie jetzt „Zentralrat der Juden: Schau betont ""schmerzliche Aktualität""“.";Bundesweit einzige Ausstellung;News, Bundesweit einzige Ausstellung, Josef Schuster, Braunschweig, Zentralrat der Juden in Deutschland, Aktualität;2026-02-22T17:43:09+01:00;2026-02-22T17:43:09+01:00;;dpa Niedersachsen;false
0c19a4bc6031e351d2f284de1660264a39f22ee1543d25a18e502b139f550581;"""Und dann fiel ich in ein Loch""";https://www.zeit.de/campus/2026-02/psychische-erkrankungen-depressionen-erschoepfung-hilfe;Auf einen Olympiasieg folgen Empfänge und Feiern – und manchmal große Leere. Die Sportschützin Nina Christen und andere Prominente erzählen, was ihnen in Krisen half.;"Z+ (abopflichtiger Inhalt);
        
    Psychische Erkrankungen";Campus, Psychische Erkrankungen, Psychotherapie, Depression, Burn-out;2026-02-22T17:37:56+01:00;2026-02-22T17:37:56+01:00;Torben BeckerTimo PosseltAlexander Schreiber;;false
f83923efb413ecbc67937e3226e3dcf48fa4264dbfd21a5a928d54034dbe8a73;Weniger Kurse, schneller in den Arbeitsmarkt;https://www.zeit.de/politik/deutschland/2026-02/alexander-dobrindt-asylbewerber-arbeitsmarkt-jobs-wartezeit-verkuerzung;Bundesinnenminister Alexander Dobrindt will Integrationskurse kürzen und Asylbewerbern das Arbeiten erleichtern. Seltsam unterschiedliche Signale? Keineswegs.;Alexander Dobrindt;Politik, Alexander Dobrindt, Alexander Dobrindt, Asylpolitik, Integration, Arbeitsmarkt, Migration, Asyl;2026-02-22T17:35:39+01:00;2026-02-22T17:35:39+01:00;Tilman Steffen;;false
e0b8099473d65928bfe22845f32d62e938003713f8f03fec90a7284d5c879631;Lawinenlage brisant: Sieben Tote in Österreich;https://www.zeit.de/news/2026-02/22/lawinenlage-brisant-sieben-tote-in-oesterreich;Hier finden Sie Informationen zu dem Thema „Wetter“. Lesen Sie jetzt „Lawinenlage brisant: Sieben Tote in Österreich“.;Wetter;News, Wetter, Westen Ungarn, Österreich, Alpen, Arlberg, Sölden, Salzburg, Bayern, Slowenien, Tirol, Hohe Tatra;2026-02-22T17:33:23+01:00;2026-02-22T17:33:23+01:00;;dpa;false
e4b38e0364e021bdc574794d6b2baedc7e83d55570c07b295303f2f6d90ba12a;Pokal-Kracher Bayer gegen Bayern - VfB empfängt Freiburg;https://www.zeit.de/news/2026-02/22/pokal-kracher-bayer-gegen-bayern-vfb-empfaengt-freiburg;Hier finden Sie Informationen zu dem Thema „Fußball“. Lesen Sie jetzt „Pokal-Kracher Bayer gegen Bayern - VfB empfängt Freiburg“.;Fußball;News, Fußball, Freiburg, Leverkusen, FC Bayern München, Fußball, Halbfinale, Endspiel;2026-02-22T17:23:53+01:00;2026-02-22T17:23:53+01:00;;dpa Baden-Württemberg;false
f5db7db580a88d52939b71697299f4b038fcf0e9a54d7e3831fd5ee539923920;Fähre zwischen Rügen und Hiddensee fährt wieder;https://www.zeit.de/news/2026-02/22/faehre-zwischen-ruegen-und-hiddensee-faehrt-wieder;"Hier finden Sie Informationen zu dem Thema „""Vitte""“. Lesen Sie jetzt „Fähre zwischen Rügen und Hiddensee fährt wieder“.";"""Vitte""";"News, ""Vitte"", Hiddensee, Vitte, Fährverkehr, Fähre";2026-02-22T17:21:37+01:00;2026-02-22T17:21:37+01:00;;dpa Mecklenburg-Vorpommern;false
c0d58aa8da249866476c80cfc9d7e60d151f6e0447ce1191e22681ad2c7ac175;HSV Hamburg nach sechs Pleiten wieder erfolgreich;https://www.zeit.de/news/2026-02/22/hsv-hamburg-nach-sechs-pleiten-wieder-erfolgreich;Hier finden Sie Informationen zu dem Thema „Handball-Bundesliga“. Lesen Sie jetzt „HSV Hamburg nach sechs Pleiten wieder erfolgreich“.;Handball-Bundesliga;News, Handball-Bundesliga, Nicolaj Jörgensen, Hamburg, Melsungen, Hamburger SV, Handball-Bundesliga, MT Melsungen, Bundesliga;2026-02-22T17:20:40+01:00;2026-02-22T17:20:40+01:00;;dpa Hamburg/Schleswig-Holstein;false
0e8bce5d8fa95fed1558ee70436a913f5767d53af2cb3454c5c2d7bae7a4e94c;Vier Schwerverletzte bei Frontalzusammenstoß in Pforzheim;https://www.zeit.de/news/2026-02/22/vier-schwerverletzte-bei-frontalzusammenstoss-in-pforzheim;Hier finden Sie Informationen zu dem Thema „Unfall“. Lesen Sie jetzt „Vier Schwerverletzte bei Frontalzusammenstoß in Pforzheim“.;Unfall;News, Unfall, Pforzheim, Polizei, Frontalzusammenstoß, Unfall, Auto;2026-02-22T17:17:13+01:00;2026-02-22T17:17:13+01:00;;dpa Baden-Württemberg;false
fbe7d83a875977a0cbc8359b100eab575edf7ab93f0d75aa9d07cc8ee0ba73bb;Zwölf Verletzte bei Busunfall - Mann in Lebensgefahr;https://www.zeit.de/news/2026-02/22/zwoelf-verletzte-bei-busunfall-mann-in-lebensgefahr;Hier finden Sie Informationen zu dem Thema „Rettungseinsatz“. Lesen Sie jetzt „Zwölf Verletzte bei Busunfall - Mann in Lebensgefahr“.;Rettungseinsatz;News, Rettungseinsatz, Berlin-Gatow, Busunfall, Rettungseinsatz, Lebensgefahr, Feuerwehrangabe, Auto;2026-02-22T17:12:26+01:00;2026-02-22T17:12:26+01:00;;dpa;false
53401f7380143e66d5d698bea95fade286b49ce93f42d4027caaf602bc7a591f;Sieg in Münster: FCK wahrt Mini-Chance im Aufstiegskampf;https://www.zeit.de/news/2026-02/22/sieg-in-muenster-fck-wahrt-mini-chance-im-aufstiegskampf;Hier finden Sie Informationen zu dem Thema „2. Fußball-Bundesliga“. Lesen Sie jetzt „Sieg in Münster: FCK wahrt Mini-Chance im Aufstiegskampf“.;2. Fußball-Bundesliga;News, 2. Fußball-Bundesliga, Torsten Lieberknecht, Marlon Ritter, Jannis Heuer, Kaiserslautern, Münster, 1. FC Kaiserslautern, SC Preußen 06 e.V. Münster, Fußball-Bundesliga, Aufstiegskampf, Auswärtssieg;2026-02-22T17:12:09+01:00;2026-02-22T17:12:09+01:00;;dpa Rheinland-Pfalz/Saarland;false
