Hash;Title;Link;Description;Category;KeyWords;Published;LastUpdated;Author;Source;Paywall
180f6cf347ea609377599dbe31ba5f2d8e4777353b7cf9133d27d5461ae50e1c;"Polizei mit positiver ""Blitzermarathon""-Bilanz";https://www.zeit.de/news/2024-04/22/polizei-mit-positiver-blitzermarathon-bilanz;"Hier finden Sie Informationen zu dem Thema „Verkehr“. Lesen Sie jetzt „Polizei mit positiver ""Blitzermarathon""-Bilanz“.";"Z+ (abopflichtiger Inhalt);
        
    
Verkehr";News, Verkehr, Wiesbaden, Flensburg, Hessen, Polizei, Blitzermarathon, Verkehr, Blitzwagen, Polizeiwagen, Fahrzeug;2024-04-22T21:02:41+02:00;2024-04-22T21:02:41+02:00;;dpa Hessen;false
4061088f53a59d1d28c2f3f513ced4c69fe66bf118d01107a7b216c249e9fa49;Der aufständische Präsident;https://www.zeit.de/2024/17/jefferson-davis-buergerkrieg-usa-suedstaaten;Im Amerikanischen Bürgerkrieg kämpfte Jefferson Davis vier Jahre lang gegen die eigene Regierung. Vor Gericht kam er nie – wovon nun Donald Trump profitieren könnte. ;"Z+ (abopflichtiger Inhalt);
        
    
Jefferson Davis";Wissen, Jefferson Davis, Bürgerkrieg, USA, Donald Trump, Republikaner (USA), Washington, Gericht;2024-04-22T20:34:47+02:00;2024-04-22T20:34:47+02:00;Ronald D. Gerste;Aus der        ZEIT Nr. 17/2024;false
7ab1e8f08d8b93175b23e7896f62e89e6dfe70bd4d37fdf25f9c02f829aa66d2;Bayern-Spielerinnen für soziales Engagement gewürdigt;https://www.zeit.de/news/2024-04/22/bayern-spielerinnen-fuer-soziales-engagement-gewuerdigt;Hier finden Sie Informationen zu dem Thema „DFB-Preis“. Lesen Sie jetzt „Bayern-Spielerinnen für soziales Engagement gewürdigt“.;"Z+ (abopflichtiger Inhalt);
        
    
DFB-Preis";News, DFB-Preis, Sepp Herberger, Bernd Neuendorf, DFB-Präsident, Aichach, Bayern, DFB, FC Bayern München, Deutsche Telekom;2024-04-22T20:34:45+02:00;2024-04-22T20:34:45+02:00;;dpa Bayern;false
3a50bffd4840945db79c8fc4c8b0308168e6c440b7542c5cfca1f7aaa46d6860;Der Alleinunterhalter des deutschen Indie-Pop;https://www.zeit.de/kultur/musik/2024-04/bernd-begemann-indie-pop-album-milieu;Der Entertainer Bernd Begemann ist nach neun Jahren mit einer neuen Platte zurück. Die Songs sind wie gewohnt lakonisch, wehmütig, spöttisch. Doch etwas ist anders. ;"Z+ (abopflichtiger Inhalt);
        
    
Bernd Begemann";Kultur, Bernd Begemann, Musiker, Album, Popmusik, Konzert, Musik, Hamburg;2024-04-22T20:22:07+02:00;2024-04-22T20:22:07+02:00;Tobias Lentzler;;false
7af119599381e4956f54861c49130992ade560377e49add0e23bf096645de974;Organisation fischt 10.000 Tonnen Plastikmüll aus Gewässern;https://www.zeit.de/wissen/forschungswelten-neue-energien/2024-04/ocean-cleanup-meeresverschmutzung;The Ocean Cleanup hat sich dem Sammeln von Plastikmüll mit Fangnetzen verschrieben. Man habe Zuversicht, dass die Ozeane gesäubert werden könnten, sagte der Gründer.;"Z+ (abopflichtiger Inhalt);
        
    
Umweltverschmutzung";Wissen, Umweltverschmutzung , Umweltverschmutzung, Plastik, Klimapolitik, Guatemala, Pazifik, Plastikmüll;2024-04-22T20:17:39+02:00;2024-04-22T20:17:39+02:00;;ZEIT ONLINE,        dpa,        AFP,        alu;false
5ffd7f93cd2bca874488c88f78ac04305460bc3e886c376de43ff005e3c1f0bd;Scholz wirft Putin Vereinnahmung von Immanuel Kant vor;https://www.zeit.de/politik/ausland/2024-04/scholz-rede-putin-kant-300-geburtstag;"Russlands Präsident beruft sich gern auf Immanuel Kant. Dazu habe er ""nicht die geringste Berechtigung"" sagt Olaf Scholz zum 300. Geburtstag des Königsberger Philosophen.";"Z+ (abopflichtiger Inhalt);
        
    
300. Geburtstag von Immanuel Kant";Politik, 300. Geburtstag von Immanuel Kant, Immanuel Kant, Olaf Scholz, Wladimir Putin, Russland, Berlin, SPD, Vereinnahmung;2024-04-22T20:14:59+02:00;2024-04-22T20:14:59+02:00;;ZEIT ONLINE,        KNA,        Reuters,        voi;false
5cab458893a3a5ce4bedce979cfe8e6d1771351a32d47e53007a1059adc98b33;Steht israelischer Militäreinsatz in Rafah kurz bevor?;https://www.zeit.de/news/2024-04/22/israels-armee-rueckt-im-gaza-krieg-weiter-vor;Hier finden Sie Informationen zu dem Thema „Krieg in Nahost“. Lesen Sie jetzt „Steht israelischer Militäreinsatz in Rafah kurz bevor?“.;"Z+ (abopflichtiger Inhalt);
        
    
Krieg in Nahost";News, Krieg in Nahost, Daniel Hagari, Benjamin Netanjahu, Joe Biden, Benny Gantz, Antony Blinken, Joav Galant, Nahost, Israel, Ägypten, USA;2024-04-22T20:12:30+02:00;2024-04-22T20:12:30+02:00;;dpa;false
6de59308342a61c37879b319b4a4c623ca7b9b658d70c50deda033f26097db5e;Intendanz-Trio soll Nationaltheater Weimar leiten;https://www.zeit.de/news/2024-04/22/intendanz-trio-soll-nationaltheater-weimar-leiten;Hier finden Sie Informationen zu dem Thema „Personalien“. Lesen Sie jetzt „Intendanz-Trio soll Nationaltheater Weimar leiten“.;"Z+ (abopflichtiger Inhalt);
        
    
Personalien";News, Personalien, Dorian Dreher, Timon Jansen, Valentin Schwarz, Weimar, Deutsches Nationaltheater Weimar, Nationaltheater, Intendanz, Sommer;2024-04-22T20:08:52+02:00;2024-04-22T20:08:52+02:00;;dpa Thüringen;false
cbd110356050e7c4af8bf82a3ba8a303a9b7ac7c079968af10de8a489fd1838e;Weiter Parlamentsstreit um britischen Asylpakt mit Ruanda;https://www.zeit.de/news/2024-04/22/sunak-werden-gerichtshof-fuer-menschenrechte-ignorieren;Hier finden Sie Informationen zu dem Thema „London“. Lesen Sie jetzt „Weiter Parlamentsstreit um britischen Asylpakt mit Ruanda“.;"Z+ (abopflichtiger Inhalt);
        
    
London";News, London, Rishi Sunak, Ruanda, Großbritannien, London, Asylpakt, Gerichtshof, Menschenrechte, Asyl;2024-04-22T20:04:29+02:00;2024-04-22T20:04:29+02:00;;dpa;false
48f3d45d0a2d8cf258409b84f830715ab2cc47433a96050c31aa213099f0c3e8;Hypoport profitiert von privater Immobilienfinanzierung;https://www.zeit.de/news/2024-04/22/hypoport-profitiert-von-privater-immobilienfinanzierung;Hier finden Sie Informationen zu dem Thema „Berlin“. Lesen Sie jetzt „Hypoport profitiert von privater Immobilienfinanzierung“.;"Z+ (abopflichtiger Inhalt);
        
    
Berlin";News, Berlin, Berlin, Prenzlauer Berg, Hypoport, Immobilienfinanzierung;2024-04-22T19:53:45+02:00;2024-04-22T19:53:45+02:00;;dpa Berlin/Brandenburg;false
1908f4eeb655791fb908d88cff928f390ed7fa5288de1ddcc1e0479953652c91;77-jähriger Radfahrer stirbt nach Unfall auf B6 in Leipzig;https://www.zeit.de/news/2024-04/22/77-jaehriger-radfahrer-stirbt-nach-unfall-auf-b6-in-leipzig;Hier finden Sie Informationen zu dem Thema „Verkehr“. Lesen Sie jetzt „77-jähriger Radfahrer stirbt nach Unfall auf B6 in Leipzig“.;"Z+ (abopflichtiger Inhalt);
        
    
Verkehr";News, Verkehr, Leipzig, Polizei, Unfall, Verkehr, Fahrrad;2024-04-22T19:47:20+02:00;2024-04-22T19:47:20+02:00;;dpa Sachsen;false
c8df0362f048cd17de08d2bfc90adb1e6c0a70f3c18329526e01768fb1cc1178;Scholz: Frieden um jeden Preis wäre keiner;https://www.zeit.de/news/2024-04/22/scholz-frieden-um-jeden-preis-waere-keiner;Hier finden Sie Informationen zu dem Thema „Berlin“. Lesen Sie jetzt „Scholz: Frieden um jeden Preis wäre keiner“.;"Z+ (abopflichtiger Inhalt);
        
    
Berlin";News, Berlin, Olaf Scholz, Immanuel Kant, Berlin, Russland, SPD, Festveranstaltung, Krieg in der Ukraine;2024-04-22T19:46:37+02:00;2024-04-22T19:46:37+02:00;;dpa Berlin/Brandenburg;false
8a6a06bd7df8f3687ec8ad9ccb15075038df6291f3b956d0fc444cd8249401ca;Deutschlands Antwort auf Microsoft;https://www.zeit.de/2024/17/software-deutschland-digitalisierung-microsoft-bmi;Um die Verwaltung unabhängiger zu machen von dem US-Konzern, lässt die Bundesregierung eine eigene Bürosoftware programmieren. Aber wird sie jemals fertig?;"Z+ (abopflichtiger Inhalt);
        
    
Software";Digital, Software, Bundesregierung, Software, Microsoft, Digitalisierung, Koalitionsvertrag, Bundesinnenministerium;2024-04-22T19:40:20+02:00;2024-04-22T19:40:20+02:00;Johanna Jürgens;Aus der        ZEIT Nr. 17/2024;false
1a814d20d29a69803b62718e4ae70d2107b30268ac237350bd12b284b3a41089;Durchsuchungen bei mutmaßlichen Drogenhändlern;https://www.zeit.de/news/2024-04/22/durchsuchungen-bei-mutmasslichen-drogenhaendlern;Hier finden Sie Informationen zu dem Thema „Polizeieinsatz“. Lesen Sie jetzt „Durchsuchungen bei mutmaßlichen Drogenhändlern“.;"Z+ (abopflichtiger Inhalt);
        
    
Polizeieinsatz";News, Polizeieinsatz, Südhessen, Offenbach, Rhein-Main, Polizei, Kokain, Durchsuchung, Polizeieinsatz, Blaulicht, Polizeiwagen;2024-04-22T19:38:24+02:00;2024-04-22T19:38:24+02:00;;dpa Hessen;false
d937dbcfd5ced08e7c63180f3384a9c2528d10a0d1ddf1240329b1cc301c07b1;Zug mit 600 Fahrgästen fährt über Platten auf Gleisen;https://www.zeit.de/news/2024-04/22/zug-mit-600-fahrgaesten-faehrt-ueber-platten-auf-gleisen;Hier finden Sie Informationen zu dem Thema „Bahn“. Lesen Sie jetzt „Zug mit 600 Fahrgästen fährt über Platten auf Gleisen“.;"Z+ (abopflichtiger Inhalt);
        
    
Bahn";News, Bahn, Polizei, Bahngleis;2024-04-22T19:38:16+02:00;2024-04-22T19:38:16+02:00;;dpa Niedersachsen;false
dc0506de494fb29bf8542db8e698016fa9bbdf9966cce3c52e2ce796f221a57e;Großer Ampel-Krach um FDP-Papier bleibt aus;https://www.zeit.de/news/2024-04/22/fdp-will-konzept-zur-wirtschaftswende-beschliessen-spd-empoert;Hier finden Sie Informationen zu dem Thema „Arbeit“. Lesen Sie jetzt „Großer Ampel-Krach um FDP-Papier bleibt aus“.;"Z+ (abopflichtiger Inhalt);
        
    
Arbeit";News, Arbeit, FDP, SPD, Bürgergeld, Kritik, Koalition, Rente, Ampelkoalition;2024-04-22T19:37:40+02:00;2024-04-22T19:37:40+02:00;;dpa;false
6a5b799d5c8e5bc0f3768a64e2883f733ce7281b1dd549987f661c86690c6057;Merz: CDU-Debatte über Islam ist noch nicht zu Ende;https://www.zeit.de/news/2024-04/22/merz-cdu-debatte-ueber-islam-ist-noch-nicht-zu-ende;Hier finden Sie Informationen zu dem Thema „Muslime in Deutschland“. Lesen Sie jetzt „Merz: CDU-Debatte über Islam ist noch nicht zu Ende“.;"Z+ (abopflichtiger Inhalt);
        
    
Muslime in Deutschland";News, Muslime in Deutschland, Friedrich Merz, Berlin, CDU, Deutsche Presse-Agentur, Muslime, Parteitag;2024-04-22T19:35:42+02:00;2024-04-22T19:35:42+02:00;;dpa;false
333ca130d66fb5f0ad266549218db578c701febe918840fd547c606aac84124d;"Doping-Wirbel: ""Glaubwürdigkeitskrise des Weltsports""";https://www.zeit.de/news/2024-04/22/dopingjaeger-verteidigen-sich-in-affaere-um-chinas-schwimmer;"Hier finden Sie Informationen zu dem Thema „Sportpolitik“. Lesen Sie jetzt „Doping-Wirbel: ""Glaubwürdigkeitskrise des Weltsports""“.";"Z+ (abopflichtiger Inhalt);
        
    
Sportpolitik";News, Sportpolitik, China, Tokio, Welt-Anti-Doping-Agentur, ARD, Olympia, Sportpolitik, Affäre, Positivtest, Gold;2024-04-22T19:16:56+02:00;2024-04-22T19:16:56+02:00;;dpa Sport;false
30b404581875b1c84fea78dc12d24968e2e2879f90b070c9a5db61701c97416b;Fünf Verletzte bei Unfall an Stauende auf Autobahn 27;https://www.zeit.de/news/2024-04/22/fuenf-verletzte-bei-unfall-an-stauende-auf-autobahn-27;Hier finden Sie Informationen zu dem Thema „Achim“. Lesen Sie jetzt „Fünf Verletzte bei Unfall an Stauende auf Autobahn 27“.;"Z+ (abopflichtiger Inhalt);
        
    
Achim";News, Achim, Polizei, Unfall, Autobahn, Auto;2024-04-22T19:10:22+02:00;2024-04-22T19:10:22+02:00;;dpa Niedersachsen;false
6ba87ca58b6679ce4e399a0a300631873ae9419b9c4d4fd18b8918cf11f0c32c;Borussia Mönchengladbach nach Corona wieder in Gewinnerzone;https://www.zeit.de/news/2024-04/22/borussia-moenchengladbach-nach-corona-wieder-in-gewinnerzone;Hier finden Sie Informationen zu dem Thema „Bundesliga“. Lesen Sie jetzt „Borussia Mönchengladbach nach Corona wieder in Gewinnerzone“.;"Z+ (abopflichtiger Inhalt);
        
    
Bundesliga";News, Bundesliga, Stephan Schippers, Borussia Mönchengladbach, Bundesliga, Gewinnerzone, Überschuss, Corona;2024-04-22T19:07:19+02:00;2024-04-22T19:07:19+02:00;;dpa Nordrhein-Westfalen;false
b536f366dc2db8b04e5477d9dc7b8eb96db2a5b1c71c2d5b071189a8c5819b2a;SPD-Vorstand reagiert mit Beschluss auf Forderungen nach Sozialabbau;https://www.zeit.de/politik/deutschland/2024-04/spd-bundesvorstand-beschluss-sozialversicherung-rente-arbeitnehmer;"Nachdem die FDP eine ""Wirtschaftswende"" auf Kosten der Sozialpolitik vorschlug, äußert sich nun die SPD. Ein Beschluss verteidigt Sozialstaat und Arbeitnehmerrechte.";"Z+ (abopflichtiger Inhalt);
        
    
Debatte um Sozialleistungen";Politik, Debatte um Sozialleistungen, SPD, Sozialpolitik, Rente, Arbeitnehmer, Unionsfraktion, Alternative für Deutschland;2024-04-22T18:56:06+02:00;2024-04-22T18:56:06+02:00;Mathis Gann;;false
a2e7200bf4977707cf74fc3f5fa2281772b8f0e014f87d6f77b48fcdc981e5ff;"""Exekutionscharakter"": Lange Haft für Mord an 26-Jährigem";https://www.zeit.de/news/2024-04/22/exekutionscharakter-lange-haft-fuer-mord-an-26-jaehrigem;"Hier finden Sie Informationen zu dem Thema „Hamburg“. Lesen Sie jetzt „""Exekutionscharakter"": Lange Haft für Mord an 26-Jährigem“.";"Z+ (abopflichtiger Inhalt);
        
    
Hamburg";News, Hamburg, Hamburg, Hamburg-Borgfelde, Exekutionscharakter, Mord;2024-04-22T18:52:58+02:00;2024-04-22T18:52:58+02:00;;dpa Hamburg/Schleswig-Holstein;false
452cebfd9d673468239b5e408846cdb9e43c1d3a266e07fcfa5b757616f0a419;Sozialbehörde startet neue Wohnprojekte für Obdachlose;https://www.zeit.de/news/2024-04/20/sozialbehoerde-startet-neue-wohnprojekte-fuer-obdachlose;Hier finden Sie Informationen zu dem Thema „Soziales“. Lesen Sie jetzt „Sozialbehörde startet neue Wohnprojekte für Obdachlose“.;"Z+ (abopflichtiger Inhalt);
        
    
Soziales";News, Soziales, Niendorf, Sozialbehörde, Wohnprojekt, Wollberg, Pflegeeinrichtung, Spezialangebot, Kamera;2024-04-22T18:52:33+02:00;2024-04-22T18:52:33+02:00;;dpa Hamburg/Schleswig-Holstein;false
41da87263c5e2c2d46a9fce449c4e0a9b444685e97159c1b865bb19fdf23bc15;Staatsanwaltschaft wirft Donald Trump kriminelle Verschwörung vor;https://www.zeit.de/politik/ausland/2024-04/donald-trump-strafprozess-schweigegeld-plaedoyer;Im Strafprozess gegen Donald Trump wurden die Auftaktplädoyers gehalten. Die Anklage unterstellt ihm ein Komplott. Der Ex-Präsident sieht sich als Opfer einer Hexenjagd. ;"Z+ (abopflichtiger Inhalt);
        
    
Schweigegeldprozess";Politik, Schweigegeldprozess, Donald Trump, Gericht, New York, USA, Manhattan, Republikaner (USA);2024-04-22T18:40:18+02:00;2024-04-22T18:40:18+02:00;;ZEIT ONLINE,        AP,        dpa,        AFP,        mga;false
5b527b544bbbeb4519157e3a9d9d20779497d3be4fa1d4d1a9685b4bc549c18b;Zwei Männer wegen mutmaßlicher Spionage für China in U-Haft;https://www.zeit.de/news/2024-04/22/drei-deutsche-wegen-mutmasslicher-spionage-fuer-china-festgenommen;Hier finden Sie Informationen zu dem Thema „Bundesanwaltschaft“. Lesen Sie jetzt „Zwei Männer wegen mutmaßlicher Spionage für China in U-Haft“.;"Z+ (abopflichtiger Inhalt);
        
    
Bundesanwaltschaft";News, Bundesanwaltschaft, China, Bundesanwaltschaft, Kriminalität, Spionage;2024-04-22T18:37:27+02:00;2024-04-22T18:37:27+02:00;;dpa Nordrhein-Westfalen;false
5b527b544bbbeb4519157e3a9d9d20779497d3be4fa1d4d1a9685b4bc549c18b;Zwei Männer wegen mutmaßlicher Spionage für China in U-Haft;https://www.zeit.de/news/2024-04/22/drei-deutsche-wegen-spionage-fuer-china-festgenommen;Hier finden Sie Informationen zu dem Thema „Geheimdienste“. Lesen Sie jetzt „Zwei Männer wegen mutmaßlicher Spionage für China in U-Haft“.;"Z+ (abopflichtiger Inhalt);
        
    
Geheimdienste";News, Geheimdienste, China, Düsseldorf, Bad Homburg, Bundesanwaltschaft, Geheimdienst, Symbolbild, Spionage;2024-04-22T18:36:20+02:00;2024-04-22T18:36:20+02:00;;dpa;false
2ec471976e1a99550038a00f4fcb9148f14a65878270356878a684e45d6bb912;Rolf Königs zum Ehrenpräsidenten von Mönchengladbach ernannt;https://www.zeit.de/news/2024-04/22/rolf-koenigs-zum-ehrenpraesidenten-von-moenchengladbach-ernannt;Hier finden Sie Informationen zu dem Thema „Bundesliga“. Lesen Sie jetzt „Rolf Königs zum Ehrenpräsidenten von Mönchengladbach ernannt“.;"Z+ (abopflichtiger Inhalt);
        
    
Bundesliga";News, Bundesliga, Rolf Königs, Mönchengladbach, Borussia Mönchengladbach, Bundesliga, Mitgliederversammlung;2024-04-22T18:36:19+02:00;2024-04-22T18:36:19+02:00;;dpa Nordrhein-Westfalen;false
5b527b544bbbeb4519157e3a9d9d20779497d3be4fa1d4d1a9685b4bc549c18b;Zwei Männer wegen mutmaßlicher Spionage für China in U-Haft;https://www.zeit.de/news/2024-04/22/drei-deutsche-wegen-mutmasslicher-spionage-festgenommen;Hier finden Sie Informationen zu dem Thema „Kriminalität“. Lesen Sie jetzt „Zwei Männer wegen mutmaßlicher Spionage für China in U-Haft“.;"Z+ (abopflichtiger Inhalt);
        
    
Kriminalität";News, Kriminalität, Bundesanwaltschaft, Geheimdienst, Handschelle, Spionage;2024-04-22T18:35:59+02:00;2024-04-22T18:35:59+02:00;;dpa Hessen;false
19ed72f9a47936d82354f5f969a484184648c61ba0e52a1f76d9971bccc71599;"Christoph Daum: HSV-Verpflichtung von Baumgart ""Fehler""";https://www.zeit.de/news/2024-04/22/christoph-daum-hsv-verpflichtung-von-baumgart-fehler;"Hier finden Sie Informationen zu dem Thema „Bundesliga“. Lesen Sie jetzt „Christoph Daum: HSV-Verpflichtung von Baumgart ""Fehler""“.";"Z+ (abopflichtiger Inhalt);
        
    
Bundesliga";News, Bundesliga, Christoph Daum, Steffen Baumgart, HSV, Hamburger SV, Bundesliga, Dokumentarfilm;2024-04-22T18:34:05+02:00;2024-04-22T18:34:05+02:00;;dpa Hamburg/Schleswig-Holstein;false
0cde9f7709cc4016cc93deccdf9a26d412faf6477becc54e856b5bc334997808;Lebenslange Haft für Mord vor 45 Jahren gefordert;https://www.zeit.de/news/2024-04/22/lebenslange-haft-fuer-mord-vor-45-jahren-gefordert;Hier finden Sie Informationen zu dem Thema „Cold Case“. Lesen Sie jetzt „Lebenslange Haft für Mord vor 45 Jahren gefordert“.;"Z+ (abopflichtiger Inhalt);
        
    
Cold Case";News, Cold Case, München, Amtsgericht, Staatsanwaltschaft, Landgericht München, Polizei, Cold Case, Mord, Silvester;2024-04-22T18:26:18+02:00;2024-04-22T18:26:18+02:00;;dpa Bayern;false
ac39bc64e868ff8b47079c6963fc380d6358e751de8ce810812962ffb707b4eb;Kabinett trifft sich in der Sächsischen Schweiz;https://www.zeit.de/news/2024-04/22/kabinett-trifft-sich-in-der-saechsischen-schweiz;Hier finden Sie Informationen zu dem Thema „Landesregierung“. Lesen Sie jetzt „Kabinett trifft sich in der Sächsischen Schweiz“.;"Z+ (abopflichtiger Inhalt);
        
    
Landesregierung";News, Landesregierung, Wolfram Günther, Sachsen, Sächsische Schweiz, Landesregierung;2024-04-22T18:21:21+02:00;2024-04-22T18:21:21+02:00;;dpa Sachsen;false
1cb9cb476cca579bec9ff667d229b7b4889fb765bdd2f7c1bd7da52e5aac8db0;EU-Kommission leitet Verfahren gegen TikTok ein;https://www.zeit.de/news/2024-04/22/eu-kommission-leitet-verfahren-gegen-tiktok-ein;Hier finden Sie Informationen zu dem Thema „Online-Plattform “. Lesen Sie jetzt „EU-Kommission leitet Verfahren gegen TikTok ein“.;"Z+ (abopflichtiger Inhalt);
        
    
Online-Plattform";News, Online-Plattform , EU-Kommission, EU, TikTok;2024-04-22T18:18:33+02:00;2024-04-22T18:18:33+02:00;;dpa;false
c9f67155c63db94f5c5a109e5c7a4e9ca9ace0ab95e2d467993cbee668433346;Nach Raser-Unfall: 21-Jähriger muss neun Jahre in Haft;https://www.zeit.de/news/2024-04/22/nach-raser-unfall-21-jaehriger-muss-neun-jahre-in-haft;Hier finden Sie Informationen zu dem Thema „Baden-Württemberg“. Lesen Sie jetzt „Nach Raser-Unfall: 21-Jähriger muss neun Jahre in Haft“.;"Z+ (abopflichtiger Inhalt);
        
    
Baden-Württemberg";News, Baden-Württemberg, Baden-Württemberg;2024-04-22T18:17:18+02:00;2024-04-22T18:17:18+02:00;;dpa;false
5b527b544bbbeb4519157e3a9d9d20779497d3be4fa1d4d1a9685b4bc549c18b;Zwei Männer wegen mutmaßlicher Spionage für China in U-Haft;https://www.zeit.de/news/2024-04/22/zwei-maenner-wegen-mutmasslicher-spionage-fuer-china-in-u-haft;Hier finden Sie Informationen zu dem Thema „Kriminalität“. Lesen Sie jetzt „Zwei Männer wegen mutmaßlicher Spionage für China in U-Haft“.;"Z+ (abopflichtiger Inhalt);
        
    
Kriminalität";News, Kriminalität, China, Geheimdienst, Kriminalität, Spionage;2024-04-22T18:16:58+02:00;2024-04-22T18:16:58+02:00;;dpa;false
9eebf64e4a3f2d8ac8b8bddbb99b80be014e0d037a53f8eef3094b17745bbb40;Blutige Clan-Ausschreitungen: Messerstecher freigesprochen;https://www.zeit.de/news/2024-04/22/blutige-clan-ausschreitungen-messerstecher-freigesprochen;Hier finden Sie Informationen zu dem Thema „Essen“. Lesen Sie jetzt „Blutige Clan-Ausschreitungen: Messerstecher freigesprochen“.;"Z+ (abopflichtiger Inhalt);
        
    
Essen";News, Essen, Landgericht, Ausschreitung;2024-04-22T18:12:20+02:00;2024-04-22T18:12:20+02:00;;dpa Nordrhein-Westfalen;false
b44dff328920959f934374220d453e626e2d0ba5058d45c8c1ddf5dab4bfd6a0;Südkorea: Nordkorea feuert mehrere Raketen ab;https://www.zeit.de/news/2024-04/22/suedkorea-nordkorea-feuert-mehrere-raketen-ab;Hier finden Sie Informationen zu dem Thema „Konflikte“. Lesen Sie jetzt „Südkorea: Nordkorea feuert mehrere Raketen ab“.;"Z+ (abopflichtiger Inhalt);
        
    
Konflikte";News, Konflikte, Kim Myung, Stephen Whiting, Nordkorea, Südkorea, Pjöngjang, Seoul, Rakete, Waffentest, Militär;2024-04-22T18:11:55+02:00;2024-04-22T18:11:55+02:00;;dpa;false
57f7a8827c1be521bd9a8b462071615993ca4c64db7d6588e2dfdbe277cd7147;"""Gaspedal bis Boden durchgedrückt"": Mordurteil gegen Raser";https://www.zeit.de/news/2024-04/21/mord-am-steuer-raser-prozess-koennte-vor-abschluss-stehen;"Hier finden Sie Informationen zu dem Thema „Heilbronn“. Lesen Sie jetzt „""Gaspedal bis Boden durchgedrückt"": Mordurteil gegen Raser“.";"Z+ (abopflichtiger Inhalt);
        
    
Heilbronn";News, Heilbronn, Heilbronn, Mord, Auto;2024-04-22T18:03:09+02:00;2024-04-22T18:03:09+02:00;;dpa Baden-Württemberg;false
69102d1609bc5e358d787c359c808b35ca61c475c23eb69ffc542b451ced442b;Barenboim krank: Konzerte mit Philharmonikern betroffen;https://www.zeit.de/news/2024-04/22/barenboim-krank-konzerte-mit-philharmonikern-betroffen;Hier finden Sie Informationen zu dem Thema „Berlin“. Lesen Sie jetzt „Barenboim krank: Konzerte mit Philharmonikern betroffen“.;"Z+ (abopflichtiger Inhalt);
        
    
Berlin";News, Berlin, Daniel Barenboim, Berlin, Berliner Philharmoniker, Ehrenbürgerporträt;2024-04-22T17:59:52+02:00;2024-04-22T17:59:52+02:00;;dpa Berlin/Brandenburg;false
e18c9a9b97fe9826ff00a7d1b7ea2113015756220e389979a1b71f9c91683d94;Seenotretter helfen Seglern vor Norderney und Juist;https://www.zeit.de/news/2024-04/22/seenotretter-helfen-seglern-vor-norderney-und-juist;Hier finden Sie Informationen zu dem Thema „Dithmarschen“. Lesen Sie jetzt „Seenotretter helfen Seglern vor Norderney und Juist“.;"Z+ (abopflichtiger Inhalt);
        
    
Dithmarschen";News, Dithmarschen, Norderney, Juist, Dithmarschen, Wattenmeer, DGzRS, Seenotrettungsboot, Seegatt;2024-04-22T17:59:03+02:00;2024-04-22T17:59:03+02:00;;dpa Niedersachsen;false
e09caaaa66f0d1163d3ac3bdd0bfe8a85ef271e912e34abe1a177de5ee98baf9;Neue Pläne für ungenutztes Areal mit Goebbels-Villa;https://www.zeit.de/news/2024-04/22/neue-plaene-fuer-ungenutztes-areal-mit-goebbels-villa;Hier finden Sie Informationen zu dem Thema „Wandlitz“. Lesen Sie jetzt „Neue Pläne für ungenutztes Areal mit Goebbels-Villa“.;"Z+ (abopflichtiger Inhalt);
        
    
Wandlitz";News, Wandlitz, Joseph Goebbels, Wandlitz, Berlin, Bundespolizei, Luftaufnahme, Abrissplan;2024-04-22T17:58:00+02:00;2024-04-22T17:58:00+02:00;;dpa Berlin/Brandenburg;false
478ad1d404561eb68781f6c2494aaec2ae3e5b268adcb3ef157b2d8b70f36e5e;Ehrbare Kaufleute statt Ehrbarer Kaufmann - Umbenennung;https://www.zeit.de/news/2024-04/22/ehrbare-kaufleute-statt-ehrbarer-kaufmann-umbenennung;Hier finden Sie Informationen zu dem Thema „Wirtschaftsverein“. Lesen Sie jetzt „Ehrbare Kaufleute statt Ehrbarer Kaufmann - Umbenennung“.;"Z+ (abopflichtiger Inhalt);
        
    
Wirtschaftsverein";News, Wirtschaftsverein, Jochen Spethmann, Hamburg, Wirtschaftsverein, Umbenennung;2024-04-22T17:56:13+02:00;2024-04-22T17:56:13+02:00;;dpa Hamburg/Schleswig-Holstein;false
11b55030b4e48a24bf49c7d059f21469e07f9d45e9c2d4a8e074379df25e2091;CDU für besseren Betreuungsschlüssel bei Krippenkindern;https://www.zeit.de/news/2024-04/22/cdu-fuer-besseren-betreuungsschluessel-bei-krippenkindern;Hier finden Sie Informationen zu dem Thema „Schwerin“. Lesen Sie jetzt „CDU für besseren Betreuungsschlüssel bei Krippenkindern“.;"Z+ (abopflichtiger Inhalt);
        
    
Schwerin";News, Schwerin, Vanessa Schaffer, Anne Frank, Sebastian Ehlers, Simone Oldenburg, Schwerin, Mecklenburg-Vorpommern, CDU, Betreuungsschlüssel, Kindergruppe, Kindertagesstätte;2024-04-22T17:55:33+02:00;2024-04-22T17:55:33+02:00;;dpa Mecklenburg-Vorpommern;false
2f96f682a7fb5b5a797d0056d72299f385339357e718a54cb445de5cb27e368d;Mann lebensgefährlich verletzt: Suche nach Täter läuft;https://www.zeit.de/news/2024-04/22/mann-lebensgefaehrlich-verletzt-fahndung-mit-hubschrauber;Hier finden Sie Informationen zu dem Thema „Ermittlungen“. Lesen Sie jetzt „Mann lebensgefährlich verletzt: Suche nach Täter läuft“.;"Z+ (abopflichtiger Inhalt);
        
    
Ermittlungen";News, Ermittlungen, Polizei, Sucheinsatz, Polizeihubschrauber, Fahndung, Ermittlung, Hubschrauber;2024-04-22T17:55:26+02:00;2024-04-22T17:55:26+02:00;;dpa Hessen;false
ba23e79d0cff3019cf407261ab31a2ad0fb8c176811bd8e103ffb3988756f1c0;Friedrichshafen kann in eigener Halle Volleyball-Titel holen;https://www.zeit.de/news/2024-04/22/friedrichshafen-kann-in-eigener-halle-volleyball-titel-holen;Hier finden Sie Informationen zu dem Thema „Bundesliga“. Lesen Sie jetzt „Friedrichshafen kann in eigener Halle Volleyball-Titel holen“.;"Z+ (abopflichtiger Inhalt);
        
    
Bundesliga";News, Bundesliga, Mark Lebedew, Friedrichshafen, Berlin, VFB Friedrichshafen, VfB Friedrichshafen, Bundesliga;2024-04-22T17:53:41+02:00;2024-04-22T17:53:41+02:00;;dpa Baden-Württemberg;false
