Hash;Title;Link;Description;Category;KeyWords;Published;LastUpdated;Author;Source;Paywall
49c357192c510cdb6a5e71b85b12dd1b5ecd7deb19e642a59bb5ad70292b76e6;Erster Neuer beim FC Erzgebirge: Weinhauer kommt aus Jena;https://www.zeit.de/news/2025-03/23/erster-neuer-beim-fc-erzgebirge-weinhauer-kommt-aus-jena;Hier finden Sie Informationen zu dem Thema „Achillessehne gerissen“. Lesen Sie jetzt „Erster Neuer beim FC Erzgebirge: Weinhauer kommt aus Jena“.;Achillessehne gerissen;News, Achillessehne gerissen, Jena, FC Erzgebirge, FC Erzgebirge Aue, Achillessehne;2025-03-23T15:36:19+01:00;2025-03-23T15:36:19+01:00;;dpa Sachsen;false
0b2f5bae9bef03174c355f6bdfe1c3fc9aee156353f7d5037b42d6d3acc7096f;Ekrem İmamoğlu als Bürgermeister von Istanbul abgesetzt;https://www.zeit.de/politik/ausland/2025-03/imamoglu-tuerkei-festnahme-erdogan-protest;Das türkische Innenministerium hat den Istanbuler Bürgermeister Ekrem İmamoğlu suspendiert. Deutschland kritisiert seine Inhaftierung als Rückschlag für die Demokratie.;Türkei;Politik, Türkei, Türkei, Verhaftung, Recep Tayyip Erdogan, Bundesregierung, Opposition, Protest, AA;2025-03-23T15:35:50+01:00;2025-03-23T15:35:50+01:00;hrasc;ZEIT ONLINE,        dpa,        Reuters,        AFP,        							hra					,        							sc;false
d0c722bcc583530ca189963d326c905e3ca20cda4452af0aaceb5307a72d7cde;Polizei: Betrunkener will Beamte bespucken;https://www.zeit.de/news/2025-03/23/polizei-betrunkener-will-beamte-bespucken;Hier finden Sie Informationen zu dem Thema „Beschimpfungen“. Lesen Sie jetzt „Polizei: Betrunkener will Beamte bespucken“.;Beschimpfungen;News, Beschimpfungen, Polizei, Beschimpfung;2025-03-23T15:35:11+01:00;2025-03-23T15:35:11+01:00;;dpa Rheinland-Pfalz/Saarland;false
352fa8b74e67d04a8890e8f0a62d2e863ff7dd404eb122f872af94a150f4919d;Medien: Bayer Leverkusen auf Suche nach neuem Torwart;https://www.zeit.de/news/2025-03/23/medien-bayer-leverkusen-auf-suche-nach-neuem-torwart;Hier finden Sie Informationen zu dem Thema „Fußball-Bundesliga“. Lesen Sie jetzt „Medien: Bayer Leverkusen auf Suche nach neuem Torwart“.;Fußball-Bundesliga;News, Fußball-Bundesliga, Matej Kovar, Meret Kovar, Stefan Ortega, Leverkusen, Bayer 04 Leverkusen, Kölner Stadt-Anzeiger, Fußball-Bundesliga, Bundesliga, Torwartposition, Sommer;2025-03-23T15:29:29+01:00;2025-03-23T15:29:29+01:00;;dpa Nordrhein-Westfalen;false
3364c2851c6e2e559706958ce18ffa66d9b6b12b9c8df119795eb05c22629ef2;Drese wirbt für Widerspruchslösung bei Organspenden;https://www.zeit.de/news/2025-03/23/drese-wirbt-fuer-widerspruchsloesung-bei-organspenden;Hier finden Sie Informationen zu dem Thema „Organspenden“. Lesen Sie jetzt „Drese wirbt für Widerspruchslösung bei Organspenden“.;Organspenden;News, Organspenden, Stefanie Drese, Mecklenburg-Vorpommern, SPD, Widerspruchslösung, Organspende;2025-03-23T15:27:13+01:00;2025-03-23T15:27:13+01:00;;dpa Mecklenburg-Vorpommern;false
6c5efd308da6149a6ad504918e0e9c63dc07d3baa6484218aee0f551efef08ea;Wer denkt, steht unter Verdacht;https://www.zeit.de/wissen/2025-03/us-universitaeten-donald-trump-bildung-proteste-folgen;Donald Trump verachtet, wofür Amerikas Unis stehen. Ihm geht es um Deutungsmacht und Kontrolle. Sein Angriff auf die Columbia ist aber auch Rache für eine alte Kränkung.;"Z+ (abopflichtiger Inhalt);
        
    US-Universitäten";Wissen, US-Universitäten, USA, Hochschule, Bildung, Donald Trump, Forschung, Protest;2025-03-23T15:20:35+01:00;2025-03-23T15:20:35+01:00;Klaus Brinkbäumer;;false
51111c53ddf3752c1dd2af3bfe674d08c699dc9e5d7889cb753b5425864dc0cd;Papst nach fünf Wochen zurück im Vatikan;https://www.zeit.de/news/2025-03/23/papst-erstmals-wieder-an-der-oeffentlichkeit;Hier finden Sie Informationen zu dem Thema „Vatikan“. Lesen Sie jetzt „Papst nach fünf Wochen zurück im Vatikan“.;Vatikan;News, Vatikan, Papst Franziskus, Rom, Katholische Kirche, Vatikan;2025-03-23T15:20:13+01:00;2025-03-23T15:20:13+01:00;;dpa;false
4b017c9bfcfb2c6daffc17fa23187b0dbdd239c4cc1eae110a93cd7f61bc0007;Festnahme nach Ladendiebstahl im Supermarkt;https://www.zeit.de/news/2025-03/23/festnahme-nach-ladendiebstahl-im-supermarkt;Hier finden Sie Informationen zu dem Thema „Ertappt bei der Tat“. Lesen Sie jetzt „Festnahme nach Ladendiebstahl im Supermarkt“.;Ertappt bei der Tat;News, Ertappt bei der Tat, Polizei, Ladendiebstahl, Supermarkt, Festnahme;2025-03-23T15:15:01+01:00;2025-03-23T15:15:01+01:00;;dpa Rheinland-Pfalz/Saarland;false
f3bae3229551480d8d3632a815fe41c0a48aa80834661b29f71a1a922a20168d;Regen in Teilen Niedersachsens erwartet;https://www.zeit.de/news/2025-03/23/regen-in-teilen-niedersachsen-erwartet;Hier finden Sie Informationen zu dem Thema „Wetter“. Lesen Sie jetzt „Regen in Teilen Niedersachsens erwartet“.;Wetter;News, Wetter, Niedersachsen, Ostfriesland, DWD, Wetter;2025-03-23T15:11:38+01:00;2025-03-23T15:11:38+01:00;;dpa Niedersachsen;false
8fbc46d8c6c22e3beba61780f4b6019d4c5073634e9721c30cfeb6d40fb52bf4;BFC Dynamo im Halbfinale - Altglienicke im Glück;https://www.zeit.de/news/2025-03/23/bfc-dynamo-im-halbfinale-altglienicke-im-glueck;Hier finden Sie Informationen zu dem Thema „Fußball-Landespokal“. Lesen Sie jetzt „BFC Dynamo im Halbfinale - Altglienicke im Glück“.;Fußball-Landespokal;News, Fußball-Landespokal, Altglienicke, Croatia, Hohenschönhausen, BFC Dynamo, Halbfinale, Landespokal;2025-03-23T15:11:30+01:00;2025-03-23T15:11:30+01:00;;dpa Berlin/Brandenburg;false
6a13bfeb816b605256f3b46e6d009bff446cdb9068585b647b335fa0234dd89c;Hennig und Carl stark bei vermutlich letzter Johaug-Gala;https://www.zeit.de/news/2025-03/23/hennig-und-carl-stark-bei-vermutlich-letzter-johaug-gala;Hier finden Sie Informationen zu dem Thema „Weltcup“. Lesen Sie jetzt „Hennig und Carl stark bei vermutlich letzter Johaug-Gala“.;Weltcup;News, Weltcup, Therese Johaug, Astrid Oeyre Slind, Ebba Andersson, Katharina Hennig, Victoria Carl, Lahti, Weltcup, Finale;2025-03-23T15:11:11+01:00;2025-03-23T15:11:11+01:00;;dpa Sport;false
565d665fc73cfe914eac2be4d82c5de13334589c6d2ccd4bf2dd45a327cd59c2;Warum Misteln zum Problem werden;https://www.zeit.de/wissen/2025-03/misteln-baeume-verbreitung-gefaehrlich-bekaempfung-faq;Wenn gerade in den Bäumen grüne Bälle hängen, ist das kein gutes Zeichen: Misteln sind Parasiten. Warum sie sich stark verbreiten und welches Kulturgut nun gefährdet ist.;Misteln;Wissen, Misteln, Parasit, Landwirtschaft, Klimawandel, Biodiversität, Mistel;2025-03-23T15:10:24+01:00;2025-03-23T15:10:24+01:00;Anne-Kathrin OestmannWas sind Misteln und wo sind sie zu finden?Welche Pflanzen sind betroffen?Wie breiten sich Misteln aus?Warum können Misteln für Bäume gefährlich sein?Gibt es durch den Klimawandel mehr Misteln?Wie können Bäume geschützt werden?Haben Misteln einen Nutzen?;;false
bf23651c3dc3269260d1f9ea107fb6689837868e7f6a19bde8c2685b61674198;Istanbuler Bürgermeister Imamoglu abgesetzt;https://www.zeit.de/news/2025-03/23/istanbuler-buergermeister-imamoglu-abgesetzt;Hier finden Sie Informationen zu dem Thema „Türkei“. Lesen Sie jetzt „Istanbuler Bürgermeister Imamoglu abgesetzt“.;Türkei;News, Türkei, News;2025-03-23T15:10:17+01:00;2025-03-23T15:10:17+01:00;;dpa;false
9226fc2f2ee7e5d65a7564d236dbb504871fa1eca3f8d4b8dc2c4599cb0855e3;Der Mann und die Mikrowelle;https://www.zeit.de/digital/internet/2025-03/the-thinking-machine-stephen-witt-jensen-huang-nvidia-ki;Selbst seine Mutter glaubte nicht an den Erfolg: Ein neues Buch erzählt, wie der Nvidia-Gründer Jensen Huang zum KI-Vorreiter wurde – ohne viel über KI zu wissen.;"""The Thinking Machine"" von Stephen Witt";"Digital, ""The Thinking Machine"" von Stephen Witt, Nvidia, künstliche Intelligenz, Sachbuch, Zukunftsforschung, Technologie, Autor";2025-03-23T15:08:43+01:00;2025-03-23T15:08:43+01:00;Lisa Hegemann;;false
eea38f7e6e7fa058a66cad30a0550b152ccff625901b3625463e7f468b904177;Wanner reist nach Krankheit nicht zur U21 nach;https://www.zeit.de/news/2025-03/23/wanner-reist-nach-krankheit-nicht-zur-u21-nach;Hier finden Sie Informationen zu dem Thema „Härtetest gegen Spanien“. Lesen Sie jetzt „Wanner reist nach Krankheit nicht zur U21 nach“.;Härtetest gegen Spanien;News, Härtetest gegen Spanien, Paul Wanner, Jens Castrop, Di Salvo, Slowakei, Deutscher Fußball-Bund, Länderspiel;2025-03-23T15:06:59+01:00;2025-03-23T15:06:59+01:00;;dpa Baden-Württemberg;false
1bec35cdc764683ce38ac83ddc791452db4c198ee8175be44dc538f1b64eea82;Und plötzlich sehen die Eltern alt aus;https://www.zeit.de/familie/2025-03/eltern-kind-verhaeltnis-erwachsene-verantwortung-pasqualina-perrig-chiello;Sobald Kinder erwachsen werden, verändert sich das Verhältnis zur Mutter und dem Vater radikal. Das birgt Risiken – und die Chance auf eine neue Nähe, sagen Experten.;"Z+ (abopflichtiger Inhalt);
        
    Eltern-Kind-Verhältnis";Familie, Eltern-Kind-Verhältnis, Familie, Eltern, Väter, Mütter, Kinder;2025-03-23T15:06:37+01:00;2025-03-23T15:06:37+01:00;Franziska Wolffheim;;false
b0ede60476471feb12f210eae573450f7ad78e11c0d8a2264ff3f28a595f4a70;Mann mit Stichverletzungen liegt in Reinickendorfer Hausflur;https://www.zeit.de/news/2025-03/23/mann-mit-stichverletzungen-liegt-in-reinickendorfer-hausflur;Hier finden Sie Informationen zu dem Thema „Kriminalität“. Lesen Sie jetzt „Mann mit Stichverletzungen liegt in Reinickendorfer Hausflur“.;Kriminalität;News, Kriminalität, Reinickendorf, Polizei, Stichverletzung, Hausflur, Kriminalität;2025-03-23T15:03:19+01:00;2025-03-23T15:03:19+01:00;;dpa Berlin/Brandenburg;false
e3b50879c54e274294b7fe9bbefb35226e35dc01fa749d66d28fb69faa3da72d;US-Sondergesandter: Putin will nicht ganz Europa einnehmen;https://www.zeit.de/news/2025-03/23/russische-drohnen-treffen-kiew;Hier finden Sie Informationen zu dem Thema „Russischer Angriffskrieg“. Lesen Sie jetzt „US-Sondergesandter: Putin will nicht ganz Europa einnehmen“.;Russischer Angriffskrieg;News, Russischer Angriffskrieg, Vitali Klitschko, Timur Tkatschenko, Kyjiw, Telegram, Sondierung, Drohne, Krieg in der Ukraine, Militär;2025-03-23T15:03:05+01:00;2025-03-23T15:03:05+01:00;;dpa;false
415ed9d8d80e710d787ab6cfbfa8ee3b3c600c52ca9c97d7df59a25d12e46823;Mehrere Waldbrände in NRW – Tausende Quadratmeter in Flammen;https://www.zeit.de/news/2025-03/23/waldbrand-ueber-7-000-quadratmeter-in-flammen;Hier finden Sie Informationen zu dem Thema „Feuerwehr“. Lesen Sie jetzt „Mehrere Waldbrände in NRW – Tausende Quadratmeter in Flammen“.;Feuerwehr;News, Feuerwehr, Arnsberg, Hochsauerlandkreis, Feuerwehr, Waldbrand, Wald;2025-03-23T14:59:37+01:00;2025-03-23T14:59:37+01:00;;dpa Nordrhein-Westfalen;false
c2a0f14ab07cca7a92610ece310599a9fe7f9a7a3b717168f4a7475e5736db75;Mann wohl mit Axt angegriffen - 18-Jähriger tatverdächtig;https://www.zeit.de/news/2025-03/23/mann-wohl-mit-axt-angegriffen-18-jaehriger-tatverdaechtig;Hier finden Sie Informationen zu dem Thema „Polizei“. Lesen Sie jetzt „Mann wohl mit Axt angegriffen - 18-Jähriger tatverdächtig“.;Polizei;News, Polizei, Polizei;2025-03-23T14:58:13+01:00;2025-03-23T14:58:13+01:00;;dpa Sachsen;false
910c30845a1520587238b8f8b22c4a73caa632ca15bb3bc9f591f411ca9c1963;"Protest von Linken gegen ""Gemeinsam für Deutschland""-Demo";https://www.zeit.de/news/2025-03/23/protest-von-linken-gegen-gemeinsam-fuer-deutschland-demo;"Hier finden Sie Informationen zu dem Thema „Bundesweite Demonstrationen“. Lesen Sie jetzt „Protest von Linken gegen ""Gemeinsam für Deutschland""-Demo“.";Bundesweite Demonstrationen;News, Bundesweite Demonstrationen, Hannover, Polizei, Demonstration;2025-03-23T14:55:07+01:00;2025-03-23T14:55:07+01:00;;dpa Niedersachsen;false
d99c379cd0785e4121759e54a63970ccd3017fadf28fe555830402a056b2a882;Jugendliche spannen Band auf Straße: Autos stoßen zusammen;https://www.zeit.de/news/2025-03/23/jugendliche-spannen-band-auf-strasse-autos-stossen-zusammen;Hier finden Sie Informationen zu dem Thema „Kreis Reutlingen“. Lesen Sie jetzt „Jugendliche spannen Band auf Straße: Autos stoßen zusammen“.;Kreis Reutlingen;News, Kreis Reutlingen, Reutlingen, Polizei, Auto;2025-03-23T14:49:45+01:00;2025-03-23T14:49:45+01:00;;dpa Baden-Württemberg;false
ba51b295043bdcd0bff24d6acbb6f850281d23010051d055da9d30afd3caa1ed;Deutsche Biathletin Franziska Preuß gewinnt Gesamtweltcup;https://www.zeit.de/sport/2025-03/biathlon-franziska-preuss-gesamtweltcup-sieg;In einem spannenden Finale krönt Franziska Preuß ihre Saison mit dem Gesamtsieg. Kurz vor dem Ziel kommt es noch einmal zum direkten Kontakt mit ihrer Kontrahentin. ;Wintersport;Sport, Wintersport, Sportler, Biathlon, Wintersport, Profisport, Leistungssport, Winter;2025-03-23T14:49:38+01:00;2025-03-23T14:49:38+01:00;ljk;ZEIT ONLINE,        SID,        AFP,        dpa,        							ljk;false
a72aab30c5f3ac9d5b2272b8b626324e26963b7a0698f80d2bc64a9ee692e341;Fußgänger im Landkreis Kassel tödlich verletzt;https://www.zeit.de/news/2025-03/23/fussgaenger-im-landkreis-kassel-toedlich-verletzt;Hier finden Sie Informationen zu dem Thema „Tödlicher Unfall“. Lesen Sie jetzt „Fußgänger im Landkreis Kassel tödlich verletzt“.;Tödlicher Unfall;News, Tödlicher Unfall, Kassel, Landkreis, Unfall;2025-03-23T14:48:54+01:00;2025-03-23T14:48:54+01:00;;dpa Hessen;false
7957a9ed7c2b09e1fa000933f078747a6bc0ea1f609e69afa59e350f5badd576;"""Einfach irre"": Preuß gewinnt Gesamtweltcup mit Final-Drama";https://www.zeit.de/news/2025-03/23/biathletin-preuss-gewinnt-erstmals-gesamtweltcup;"Hier finden Sie Informationen zu dem Thema „Triumph am Holmenkollen“. Lesen Sie jetzt „""Einfach irre"": Preuß gewinnt Gesamtweltcup mit Final-Drama“.";Triumph am Holmenkollen;News, Triumph am Holmenkollen, Franziska Preuß, Laura Dahlmeier, Norwegen, Gesamtweltcup, Krönung, Finale, Familie;2025-03-23T14:45:27+01:00;2025-03-23T14:45:27+01:00;;dpa;false
a481d727940688c428bed17247b436404866421be283da0daf2783d805177d52;31-Jähriger greift Kontrahenten mit Glas an;https://www.zeit.de/news/2025-03/23/31-jaehriger-greift-kontrahenten-mit-glas-an;Hier finden Sie Informationen zu dem Thema „Kriminalität“. Lesen Sie jetzt „31-Jähriger greift Kontrahenten mit Glas an“.;Kriminalität;News, Kriminalität, Getränkeglas, Kriminalität;2025-03-23T14:40:33+01:00;2025-03-23T14:40:33+01:00;;dpa Bayern;false
08661d5414bfd1d309167d7eab7cf6348fd2d8b29a7315c2820ffae3689480f3;Rund 10.500 Besucher bei Messe für Skipper, Angler, Camper;https://www.zeit.de/news/2025-03/23/rund-10-500-besucher-bei-messe-fuer-skipper-angler-camper;Hier finden Sie Informationen zu dem Thema „Freizeit im Freien“. Lesen Sie jetzt „Rund 10.500 Besucher bei Messe für Skipper, Angler, Camper“.;Freizeit im Freien;News, Freizeit im Freien, Freizeit, Outdoor;2025-03-23T14:39:46+01:00;2025-03-23T14:39:46+01:00;;dpa Mecklenburg-Vorpommern;false
3129bfa17c101ed80fcd05c60bd6def27c4b40b97ba8d85db0ecca41f3998826;Boot kentert vor Wismar - 57-Jähriger stirbt;https://www.zeit.de/news/2025-03/23/boot-kentert-vor-wismar-ein-mann-stirbt;Hier finden Sie Informationen zu dem Thema „Kriminalität“. Lesen Sie jetzt „Boot kentert vor Wismar - 57-Jähriger stirbt“.;Kriminalität;News, Kriminalität, Wismar, Kriminalität;2025-03-23T14:38:17+01:00;2025-03-23T14:38:17+01:00;;dpa Mecklenburg-Vorpommern;false
1cd972b15738bf8766aa8b00858a4141e112a9636ff244dec89f2a8f322b9a68;Mann landet mit Auto in Kräutergarten und lässt es stehen;https://www.zeit.de/news/2025-03/23/mann-landet-mit-auto-in-kraeutergarten-und-laesst-es-stehen;Hier finden Sie Informationen zu dem Thema „Trunkenheitsfahrt“. Lesen Sie jetzt „Mann landet mit Auto in Kräutergarten und lässt es stehen“.;Trunkenheitsfahrt;News, Trunkenheitsfahrt, Röttingen, Landkreis Würzburg, Kräutergarten, Trunkenheitsfahrt, Auto;2025-03-23T14:38:16+01:00;2025-03-23T14:38:16+01:00;;dpa Bayern;false
3876e7dabc1fcb0d822d6b4320a7eea1bd02cdbe336d890bbbaadaf13794dedd;"""Mega happy"": Siebenkämpfer Steinforth gewinnt WM-Bronze";https://www.zeit.de/news/2025-03/23/siebenkaempfer-steinforth-gewinnt-wm-bronze;"Hier finden Sie Informationen zu dem Thema „Leichtathletik“. Lesen Sie jetzt „""Mega happy"": Siebenkämpfer Steinforth gewinnt WM-Bronze“.";Leichtathletik;News, Leichtathletik, Till Steinforth, Johannes Erm, Nanjing, Leichtathletik, Siebenkampf, Bronzemedaille, Titelkampf;2025-03-23T14:36:59+01:00;2025-03-23T14:36:59+01:00;;dpa Sport;false
6a71673cd699b11b41aeace50102d59fc1825b25d963e4e1b6f10940b09a8078;Thüringen will bei Technologie unabhängiger werden;https://www.zeit.de/news/2025-03/23/thueringen-will-bei-technologie-unabhaengiger-werden;Hier finden Sie Informationen zu dem Thema „Forschung“. Lesen Sie jetzt „Thüringen will bei Technologie unabhängiger werden“.;Forschung;News, Forschung, Thüringen, Erfurt, BMWi, CDU, Materialzulieferung, Technologie, Entwicklungsprojekt, Unternehmensverbund;2025-03-23T14:32:22+01:00;2025-03-23T14:32:22+01:00;;dpa Thüringen;false
57f1d378f0ec450061bbd98e764c59555228bbb489b7bb66ff1b70dd97893e46;Köpping: Tuberkulose-Prävention weiter sehr wichtig;https://www.zeit.de/news/2025-03/23/koepping-tuberkulose-praevention-weiter-sehr-wichtig;Hier finden Sie Informationen zu dem Thema „Infektionen“. Lesen Sie jetzt „Köpping: Tuberkulose-Prävention weiter sehr wichtig“.;Infektionen;News, Infektionen, Petra Köpping, Sachsen, SPD, Welttuberkulosetag, Infektion, Infektionskrankheit, Tuberkulose;2025-03-23T14:19:18+01:00;2025-03-23T14:19:18+01:00;;dpa Sachsen;false
4b17861cffe61c4e4e8a75cfa6bba1ef940cb547e0f9e2017d91e7cf77f3262c;Verzögerungen bei Fahrspur auf A100 in Richtung Norden;https://www.zeit.de/news/2025-03/23/verzoegerungen-bei-fahrspur-auf-a100-in-richtung-norden;Hier finden Sie Informationen zu dem Thema „Ringbahnbrücke“. Lesen Sie jetzt „Verzögerungen bei Fahrspur auf A100 in Richtung Norden“.;Ringbahnbrücke;News, Ringbahnbrücke, Fahrspur, Ringbahnbrücke, Verzögerung;2025-03-23T14:14:30+01:00;2025-03-23T14:14:30+01:00;;dpa Berlin/Brandenburg;false
7b578bd31fc5c5fcefaf12dab40a1303067bf11afce70229cc15fa6bbe2ff62a;Drei Tote nach russischem Drohnenangriff auf Kyjiw;https://www.zeit.de/gesellschaft/zeitgeschehen/2025-03/ukraine-kyjiw-drohnen-angriff-tote-russland;Statt der Energieinfrastruktur greift Russland nun offenbar vermehrt zivile Ziele in der Ukraine an. Bei Angriffen in der Nacht wurden in Kyjiw drei Menschen getötet.;Ukraine;Gesellschaft, Ukraine, Krieg in der Ukraine, Vitali Klitschko, Kyjiw, Russland, Drohne, Luftwaffe;2025-03-23T14:12:22+01:00;2025-03-23T14:12:22+01:00;ljk;ZEIT ONLINE,        dpa,        AFP,        							ljk;false
a3cee248ba38ed6f9d39a26116c48c15c5de2d8ace7b40db29732aad32de8909;Solidaritäts-Demo für Istanbuler Bürgermeister in Hannover;https://www.zeit.de/news/2025-03/23/solidaritaets-demo-fuer-istanbuler-buergermeister-in-hannover;Hier finden Sie Informationen zu dem Thema „Protest gegen Festnahme“. Lesen Sie jetzt „Solidaritäts-Demo für Istanbuler Bürgermeister in Hannover“.;Protest gegen Festnahme;News, Protest gegen Festnahme, Recep Tayyip Erdogan, Ekrem İmamoğlu, Hannover, Türkei, Festnahme;2025-03-23T14:01:32+01:00;2025-03-23T14:01:32+01:00;;dpa Niedersachsen;false
edf03979aa6e1f3e010dd50877a4e6db0ba82a55c3da9b2213bbadb90f9a5064;Bei Hausbrand in Wittenberg rund 450.000 Euro Schaden;https://www.zeit.de/news/2025-03/23/bei-hausbrand-in-wittenberg-rund-450-000-euro-schaden;Hier finden Sie Informationen zu dem Thema „Großeinsatz der Feuerwehr“. Lesen Sie jetzt „Bei Hausbrand in Wittenberg rund 450.000 Euro Schaden“.;Großeinsatz der Feuerwehr;News, Großeinsatz der Feuerwehr, Wittenberg, Feuerwehr, Polizei, Hausbrand, Großeinsatz;2025-03-23T14:01:16+01:00;2025-03-23T14:01:16+01:00;;dpa Sachsen;false
59ef556c26fcc867eb64140d9642f114c974b227fde5eba8d4b28b4af5ddf5ae;Franziska Preuß gewinnt Biathlon-Gesamtweltcup;https://www.zeit.de/news/2025-03/23/franziska-preuss-gewinnt-biathlon-gesamtweltcup;Hier finden Sie Informationen zu dem Thema „Triumph am Holmenkollen“. Lesen Sie jetzt „Franziska Preuß gewinnt Biathlon-Gesamtweltcup“.;Triumph am Holmenkollen;News, Triumph am Holmenkollen, News;2025-03-23T13:54:11+01:00;2025-03-23T13:54:11+01:00;;dpa;false
3914a263b14d7d22f04534c22965f4c0f6e5c879bde123ee1c05a77add7ba7d7;Zwei Frauen kommen bei Unfall auf A6 ums Leben;https://www.zeit.de/news/2025-03/23/zwei-menschen-sterben-bei-unfall-auf-a6;Hier finden Sie Informationen zu dem Thema „Hohenlohekreis“. Lesen Sie jetzt „Zwei Frauen kommen bei Unfall auf A6 ums Leben“.;Hohenlohekreis;News, Hohenlohekreis, Heilbronn, Bretzfeld, Hohenlohekreis, Polizei, Unfall, Verkehrsunfall, Auto;2025-03-23T13:49:21+01:00;2025-03-23T13:49:21+01:00;;dpa;false
c5fb8a3f959224bb156b0ed3961ceb16d968e4e9692eb0a013bf9fbb629de29b;Umzug der Theaterfiguren in Lübeck;https://www.zeit.de/news/2025-03/23/umzug-der-theaterfiguren-in-luebeck;Hier finden Sie Informationen zu dem Thema „Kultur“. Lesen Sie jetzt „Umzug der Theaterfiguren in Lübeck“.;Kultur;News, Kultur, Lübeck, Umzug, Hansemuseum, Figurentheater;2025-03-23T13:48:30+01:00;2025-03-23T13:48:30+01:00;;dpa Hamburg/Schleswig-Holstein;false
b295dca1e2156fcd78b3070a654cd6f77be4474a7c6e47f90f5c199e4dd97141;Rettungswagen-Fahrer bleibt bei Einsatz in Aufzug stecken;https://www.zeit.de/news/2025-03/23/rettungswagen-fahrer-bleibt-bei-einsatz-in-aufzug-stecken;Hier finden Sie Informationen zu dem Thema „München“. Lesen Sie jetzt „Rettungswagen-Fahrer bleibt bei Einsatz in Aufzug stecken“.;München;News, München, München, Feuerwehr, Aufzug;2025-03-23T13:47:26+01:00;2025-03-23T13:47:26+01:00;;dpa Bayern;false
2915d09013506052d9b9d2869b701879ea0f645b97eb286907c6b68e98ed5a9e;Einer von den Alten;https://www.zeit.de/kultur/film/2025-03/rolf-schimpf-tod-schauspieler-der-alte-krimiserie;"Die Karriere des Schauspielers Rolf Schimpf war geprägt vom späten Glück, den ""Alten"" in der gleichnamigen Krimireihe zu spielen. Nun ist Schimpf gestorben. Ein Nachruf";Rolf Schimpf;Kultur, Rolf Schimpf, Kriminalfilm, Tod, Fernsehproduktion, ZDF, Fernsehserie, Fernsehen;2025-03-23T13:47:05+01:00;2025-03-23T13:47:05+01:00;Georg Seeßlen;;false
fac769316ddc0f39f2476deca08e26dfadd52a5f1f33a5967cf9c1c12a1b3471;"""Der Alte"": Trauer um TV-Star Rolf Schimpf";https://www.zeit.de/news/2025-03/23/der-alte-kollegen-trauern-um-tv-star-rolf-schimpf;"Hier finden Sie Informationen zu dem Thema „Fernsehen“. Lesen Sie jetzt „""Der Alte"": Trauer um TV-Star Rolf Schimpf“.";Fernsehen;News, Fernsehen, Rolf Schimpf, Charles M. Huber, Pierre Sanoussi-Bliss, Deutsche Presse-Agentur, Trauer;2025-03-23T13:46:57+01:00;2025-03-23T13:46:57+01:00;;dpa;false
7e99aab0b57098e605405ee03ec82e20d3d9a9c1efae17f93427af18d37145a4;Auto fährt Schulkind an und flieht;https://www.zeit.de/news/2025-03/23/auto-faehrt-schulkind-an-und-flieht;Hier finden Sie Informationen zu dem Thema „Unfall“. Lesen Sie jetzt „Auto fährt Schulkind an und flieht“.;Unfall;News, Unfall, Unfall, Auto;2025-03-23T13:43:41+01:00;2025-03-23T13:43:41+01:00;;dpa Bayern;false
bbd6ed31f95da12bdb403e46522ecec32b1324d250b0577d9b94929f52aff037;Mann zieht Phosphorbombe aus der Aich;https://www.zeit.de/news/2025-03/23/mann-zieht-phosphorbombe-aus-der-aich;Hier finden Sie Informationen zu dem Thema „Bombenfund“. Lesen Sie jetzt „Mann zieht Phosphorbombe aus der Aich“.;Bombenfund;News, Bombenfund, Phosphorbombe, Bombenfund;2025-03-23T13:38:46+01:00;2025-03-23T13:38:46+01:00;;dpa Baden-Württemberg;false
2bc8a793899cfd611aaff89ce170c8c15005f3ffb77abfee48f754544497daf7;Erste Etappe der Koalitionsverhandlungen vor dem Abschluss;https://www.zeit.de/news/2025-03/23/erste-etappe-der-koalitionsverhandlungen-vor-dem-abschluss;Hier finden Sie Informationen zu dem Thema „Bundestag“. Lesen Sie jetzt „Erste Etappe der Koalitionsverhandlungen vor dem Abschluss“.;Bundestag;News, Bundestag, Carsten Linnemann, Boris Pistorius, Deutscher Bundestag, CDU, CSU, SPD, EU, Koalitionsverhandlung, Etappe, Verhandlungsteam;2025-03-23T13:31:28+01:00;2025-03-23T13:31:28+01:00;;dpa;false
9a3b303ad1cb64bdb8881478cc38adc9bdf2731ff88ce1c76570c04042081909;Beweisfindung per Röntgenbild: Dieb verschluckt Ohrringe;https://www.zeit.de/news/2025-03/23/beweisfindung-per-roentgenbild-dieb-verschluckt-ohrringe;Hier finden Sie Informationen zu dem Thema „Kurioser Diebstahl“. Lesen Sie jetzt „Beweisfindung per Röntgenbild: Dieb verschluckt Ohrringe“.;Kurioser Diebstahl;News, Kurioser Diebstahl, Orlando, Florida, Polizei, Beweisfindung, Röntgenbild, Ohrring, Diebstahl, Schmuck;2025-03-23T13:30:45+01:00;2025-03-23T13:30:45+01:00;;dpa;false
82ea0b168d4ee2c563f16516e8ae555adfb210ee87bd5d073f2a63420a21b8cc;Flucht vor Polizei endet mit Unfall;https://www.zeit.de/news/2025-03/23/flucht-vor-polizei-endet-mit-unfall;Hier finden Sie Informationen zu dem Thema „Verkehr“. Lesen Sie jetzt „Flucht vor Polizei endet mit Unfall“.;Verkehr;News, Verkehr, Polizei, Unfall, Verkehr, Polizeikontrolle;2025-03-23T13:29:22+01:00;2025-03-23T13:29:22+01:00;;dpa Hessen;false
1fb292a4e2e1b80b3cefc08a68e6334afce665781aa2bf76c01198d990aafae6;Der graue Block;https://www.zeit.de/2025/12/omas-gegen-rechts-demonstration-mutter;Die Omas gegen Rechts sind auf Demonstrationen berüchtigt und von Konservativen gefürchtet. Unser Autor wollte eine von ihnen genauer kennenlernen: seine Mutter.;"Z+ (abopflichtiger Inhalt);
        
    Omas gegen Rechts";Gesellschaft, Omas gegen Rechts, Bundestagswahl, Alternative für Deutschland, Demonstration, Frauentag, Menschenrechte, Omas gegen Rechts;2025-03-23T13:29:07+01:00;2025-03-23T13:29:07+01:00;Simon Wörpel;Aus der        ZEIT Nr. 12/2025;false
