Hash;Title;Link;Description;Category;KeyWords;Published;LastUpdated;Author;Source;Paywall
77b1e8e27e55e8094124e94d350f7fc446307d6dc5caf252c07b6d121d0ac080;Hamburgs teuerster Traum;https://www.zeit.de/2025/32/ausbau-des-hafens-hamburg-bauprojekt-containerumschlag-melanie-leonhard;Der Containerumschlag stagniert seit Jahren. Nun aber wird der Hafen ausgebaut. Eine gute Idee, findet Wirtschaftssenatorin Melanie Leonhard. Hat sie recht?;"Z+ (abopflichtiger Inhalt);
        
    Ausbau des Hafens";Hamburg, Ausbau des Hafens, Hamburg, Schifffahrt, Elbe, HafenCity, Nordsee, SPD;2025-07-31T18:57:29+02:00;2025-07-31T18:57:29+02:00;Kristina Läsker;Aus der        ZEIT Nr. 32/2025;false
6c160a5819d8f19ef5314761aadec21c56ceaa3b4f87cb3db76e3e94beb9b0df;So nicht!;https://www.zeit.de/politik/ausland/2025-07/palaestina-anerekennung-israel-zeitpunkt-diplomatie-krise;Die Zweistaatenlösung bleibt der einzige Weg, den Konflikt im Nahen Osten langfristig zu befrieden. Aber wer jetzt einen Staat Palästina anerkennt, stärkt nur die Hamas.;Palästina-Anerkennung;Politik, Palästina-Anerkennung, Emmanuel Macron, Kanada, Israel, Gazastreifen, Hamas, Zweistaatenlösung;2025-07-31T18:57:12+02:00;2025-07-31T18:57:12+02:00;Jan Roß;;false
ab761e9d633e95e6df5b8f274a096f45cb0e79687cff88fa5db3e5be1b69d39e;Was interessieren ihn seine Deals von gestern?;https://www.zeit.de/kultur/2025-07/energie-deal-usa-eu-energieimporte-zweifel;Der Deal mit Donald Trump wirkt wie ein Desaster für die EU. Doch vielleicht war es gar nicht so unklug von Ursula von der Leyen, auf Trumps Surrealpolitik einzugehen.;"Z+ (abopflichtiger Inhalt);
        
    Energie-Deal mit den USA";Kultur, Energie-Deal mit den USA, Europäische Union, Ursula von der Leyen, Donald Trump, USA, US-Zölle;2025-07-31T18:56:51+02:00;2025-07-31T18:56:51+02:00;Nils Markwardt;;false
834bccff04c07fe60a5abd1c8c7e5d33bb65f7e941ef79287534dac2f7b073bd;Gezündelt und gestürmt: FCS muss mehr als 62.000 Euro zahlen;https://www.zeit.de/news/2025-07/31/gezuendelt-und-gestuermt-fcs-muss-mehr-als-62-000-euro-zahlen;Hier finden Sie Informationen zu dem Thema „Pyrotechnik und Einlassstürme“. Lesen Sie jetzt „Gezündelt und gestürmt: FCS muss mehr als 62.000 Euro zahlen“.;Pyrotechnik und Einlassstürme;News, Pyrotechnik und Einlassstürme, Saarbrücken, Braunschweig, FCS, 1. FC Saarbrücken, Eintracht Braunschweig, Deutscher Fußball-Bund, Einlasssturm, Pyrotechnik;2025-07-31T18:51:00+02:00;2025-07-31T18:51:00+02:00;;dpa Rheinland-Pfalz/Saarland;false
da473700b41cef9cacfe2ce840abb9f7525af7724fa8ff62102aff1bf87182e7;Marktschwäche in Nordamerika macht Daimler Truck zu schaffen;https://www.zeit.de/news/2025-07/31/marktschwaeche-in-nordamerika-macht-daimler-truck-zu-schaffen;Hier finden Sie Informationen zu dem Thema „Nutzfahrzeuge“. Lesen Sie jetzt „Marktschwäche in Nordamerika macht Daimler Truck zu schaffen“.;Nutzfahrzeuge;News, Nutzfahrzeuge, Nordamerika, Daimler Truck, Marktschwäche, Jahresausblick, Nutzfahrzeug, Wirtschaftslage, US-Zölle, Dax;2025-07-31T18:50:47+02:00;2025-07-31T18:50:47+02:00;;dpa;false
be3a8fc187d26569c8f73797b78c84ed99e94abd42e921ac0c42b1d3bf3ad5e6;Medien: Herdenschutz vor Wölfen künftig in ganz NRW;https://www.zeit.de/news/2025-07/31/medien-herdenschutz-vor-woelfen-kuenftig-in-ganz-nrw;Hier finden Sie Informationen zu dem Thema „Debatte um Wölfe“. Lesen Sie jetzt „Medien: Herdenschutz vor Wölfen künftig in ganz NRW“.;Debatte um Wölfe;News, Debatte um Wölfe, Oliver Krischer, NRW, Nordrhein-Westfalen, Herdenschutz, Wolfsangriff, Wölfe;2025-07-31T18:49:37+02:00;2025-07-31T18:49:37+02:00;;dpa Nordrhein-Westfalen;false
4a0b4bcbf1f269683b3e065ac93950bd9fb700c4d411b186050cdabc826180e9;Museum Barberini öffnet wieder;https://www.zeit.de/news/2025-07/31/museum-barberini-oeffnet-wieder;Hier finden Sie Informationen zu dem Thema „Kunst“. Lesen Sie jetzt „Museum Barberini öffnet wieder“.;Kunst;News, Kunst, Potsdam, Museum Barberini, Klimatechnik;2025-07-31T18:49:13+02:00;2025-07-31T18:49:13+02:00;;dpa Berlin/Brandenburg;false
d47f6ad05fc5abd81f229ccfcea4c14c7ef3037a5a0e20ebc731f121a83b31ea;Die schlimmste Antwort in Talkshows;https://www.zeit.de/2025/32/nichtwissen-fernsehen-talkshows-antwort-meinungen-zuschauer;Wer zu einer Gesprächsrunde im Fernsehen eingeladen wird, muss alles wissen. So sehen das die Zuschauer. Dabei ist das Nichtwissen ein Qualitätsmerkmal für eine Talkshow.;Nichtwissen im Fernsehen;Entdecken, Nichtwissen im Fernsehen, Talkshow, Fernsehen, Streaming, Meinungsverschiedenheit, Zuschauerrolle, Anna Mayr;2025-07-31T18:46:02+02:00;2025-07-31T18:46:02+02:00;Anna Mayr;Aus der        ZEIT Nr. 32/2025;false
48942b2ef236bd4602dfa1d15034c1253517dcab11742a7a0c41070f7dbe3299;9.570 Meter unter dem Meer;https://www.zeit.de/2025/32/chemosynthese-tiefsee-tiere-gase-extremophile;In den entferntesten Regionen unserer Welt existiert Leben, das sich ganz anders ernährt als alles sonst bekannte. Und es ist weiter verbreitet als bisher gedacht.;Chemosynthese;Wissen, Chemosynthese, Tiefsee, Tauchboot, Meeresforschung, Meeresbiologie, Forschung, Tiere;2025-07-31T18:45:10+02:00;2025-07-31T18:45:10+02:00;Dr. Stefan Schmitt;Aus der        ZEIT Nr. 32/2025;false
7dfd1700b99539f78dda76168806ac3588810666865f84a88153e20a1f7ada98;Köln holt Bülter aus Hoffenheim;https://www.zeit.de/news/2025-07/31/1-fc-koeln-kurz-vor-verpflichtung-von-hoffenheims-buelter;Hier finden Sie Informationen zu dem Thema „Transfers“. Lesen Sie jetzt „Köln holt Bülter aus Hoffenheim“.;Transfers;News, Transfers, Lukas Kwasniok, Marius Bülter, Hoffenheim, Köln, 1. FC Köln, TSG 1899 Hoffenheim, Verpflichtung, Medizincheck;2025-07-31T18:42:19+02:00;2025-07-31T18:42:19+02:00;;dpa Baden-Württemberg;false
3f19ed504aa4d1cf632c5e419fbc7d19657bb6b85f0c7b82af9a7dc8cfad160b;Starkregen in Raum Rostock: Wasser in Straßen und Geschäften;https://www.zeit.de/news/2025-07/31/starkregen-in-bentwisch-wasser-auf-strassen-und-in-moebelhaus;Hier finden Sie Informationen zu dem Thema „Feuerwehr im Einsatz“. Lesen Sie jetzt „Starkregen in Raum Rostock: Wasser in Straßen und Geschäften“.;Feuerwehr im Einsatz;News, Feuerwehr im Einsatz, Bentwisch, Möbelhaus, Starkregen;2025-07-31T18:33:50+02:00;2025-07-31T18:33:50+02:00;;dpa Mecklenburg-Vorpommern;false
ad9069ef300453399996262308868b1862ec8c526746e476ecb2b9d0f043fb69;Bergsteiger Huber: Dahlmeier schwärmte vom Laila Peak;https://www.zeit.de/news/2025-07/31/bergsteiger-huber-dahlmeier-schwaermte-vom-laila-peak;Hier finden Sie Informationen zu dem Thema „Bergunglück in Pakistan“. Lesen Sie jetzt „Bergsteiger Huber: Dahlmeier schwärmte vom Laila Peak“.;Bergunglück in Pakistan;News, Bergunglück in Pakistan, Laila Peak, Thomas Huber, Laura Dahlmeier, Marina Krauss, Pakistan, BR, Bergunglück;2025-07-31T18:32:50+02:00;2025-07-31T18:32:50+02:00;;dpa Bayern;false
544e2b4432a23b9338c5120c4d18b88c1ad13cbd431683b9325bcac5fed51a58;Lange Haftstrafen im Prozess um tödlichen Raubüberfall;https://www.zeit.de/news/2025-07/31/lange-haftstrafen-im-prozess-um-toedlichen-raubueberfall;Hier finden Sie Informationen zu dem Thema „Tod von 99-Jährigem“. Lesen Sie jetzt „Lange Haftstrafen im Prozess um tödlichen Raubüberfall“.;Tod von 99-Jährigem;News, Tod von 99-Jährigem, Mann, St. Peter-Ording, Raubüberfall, Haftstrafe, Körperverletzung;2025-07-31T18:31:52+02:00;2025-07-31T18:31:52+02:00;;dpa Hamburg/Schleswig-Holstein;false
662ee153dcde74c56351e341f8749589026c985c98b6ae2918eba26d746f3a4c;Christopher Trimmel bleibt Union-Kapitän;https://www.zeit.de/news/2025-07/31/christopher-trimmel-bleibt-union-kapitaen;Hier finden Sie Informationen zu dem Thema „Fußball-Bundesliga“. Lesen Sie jetzt „Christopher Trimmel bleibt Union-Kapitän“.;Fußball-Bundesliga;News, Fußball-Bundesliga, Christopher Trimmel, Steffen Baumgart, Herzogenaurach, CDU/CSU, 1. FC Union Berlin, Fußball-Bundesliga, Bundesliga, Trainingslager;2025-07-31T18:29:04+02:00;2025-07-31T18:29:04+02:00;;dpa Berlin/Brandenburg;false
5f1189b6bed28b0846980a7f0086edc03fa76b3d77a0744d3eda5b46cfd7d57e;Regionalbahnen zwischen Eberswalde und Berlin fielen aus;https://www.zeit.de/news/2025-07/31/regionalbahnen-zwischen-eberswalde-und-berlin-fielen-aus;Hier finden Sie Informationen zu dem Thema „Bahn“. Lesen Sie jetzt „Regionalbahnen zwischen Eberswalde und Berlin fielen aus“.;Bahn;News, Bahn, Eberswalde, Berlin, Regionalbahn, Oberleitung, Regionalverkehr;2025-07-31T18:25:23+02:00;2025-07-31T18:25:23+02:00;;dpa Berlin/Brandenburg;false
47cbeb3a585d02a39e52300cfd7c9db576dc6d48b0dca08c894de8b731211ba0;USA und Mexiko kündigen 90-tägige Verlängerung von Handelsabkommen an;https://www.zeit.de/politik/ausland/2025-07/donald-trump-usa-mexiko-handelsabkommen;Die USA und Mexiko haben sich auf die Verlängerung eines bestehenden Handelsabkommens verständigt. Innerhalb von drei Monaten soll ein neues ausgehandelt werden.;US-Zollpolitik;Politik, US-Zollpolitik, USA, Mexiko, Donald Trump, US-Zölle, Handelsabkommen;2025-07-31T18:23:43+02:00;2025-07-31T18:23:43+02:00;lkiyf;DIE ZEIT,        Reuters,        							lk					,        							iyf;false
80f39a4f1732a9ffa58cbd39950ee6472732723a81ca902bfd1504bcab21c25c;Wegen Video der Pocher-Ohrfeige: Ordnungshaft für Fat Comedy;https://www.zeit.de/news/2025-07/31/wegen-video-der-pocher-ohrfeige-ordnungshaft-fuer-fat-comedy;Hier finden Sie Informationen zu dem Thema „Gerichtsbeschluss“. Lesen Sie jetzt „Wegen Video der Pocher-Ohrfeige: Ordnungshaft für Fat Comedy“.;Gerichtsbeschluss;News, Gerichtsbeschluss, Oliver Pocher, Oberlandesgericht Frankfurt, OLG, Ordnungshaft, Gerichtsbeschluss, Attacke;2025-07-31T18:18:17+02:00;2025-07-31T18:18:17+02:00;;dpa Hessen;false
df7989a6d8b61869222e9e89ed6b9e4ba842a11d63e21f5e9f48e9779a175779;Bayern sauer über unterschiedliche Bewertung zum Wolf;https://www.zeit.de/news/2025-07/31/bayern-sauer-ueber-unterschiedliche-bewertung-zum-wolf;Hier finden Sie Informationen zu dem Thema „Tiere“. Lesen Sie jetzt „Bayern sauer über unterschiedliche Bewertung zum Wolf“.;Tiere;News, Tiere, Wolf Bayern, Michaela Kaniber, Bayern, Bundesumweltministerium, CSU, Bundesamt für Naturschutz, Bewertung, Tiere, Wölfe;2025-07-31T18:15:28+02:00;2025-07-31T18:15:28+02:00;;dpa Bayern;false
3bda0f405452ecf568dba5a755eb8f26325658227c23df6c58884d54135d585c;Sag zum Abschied leise: Ich;https://www.zeit.de/sport/2025-07/thomas-mueller-abschied-usa;Abschiedsreden, Abschiedsgrüße, Abschiedsvideos: Thomas Müller kommt aus dem Servus-Sagen gar nicht mehr raus. Kann jetzt bitte mal Ruhe einkehren?;Thomas Müller;Sport, Thomas Müller, Fußball, Profisport, FC Bayern München, Thomas Müller, Nordamerika;2025-07-31T18:11:57+02:00;2025-07-31T18:11:57+02:00;Henning Sußebach;;false
a4b98f7f2397d3ed80916aaea6562d2684bcd4338fd5fa1628f38887cd722c68;Japankäfer breitet sich aus - Einschränkungen für Bürger;https://www.zeit.de/news/2025-07/31/japankaefer-breitet-sich-aus-einschraenkungen-fuer-buerger;Hier finden Sie Informationen zu dem Thema „Pflanzenschädling“. Lesen Sie jetzt „Japankäfer breitet sich aus - Einschränkungen für Bürger“.;Pflanzenschädling;News, Pflanzenschädling, Freiburg, Asien, Schweiz, Breisgau, Europäische Union, Pflanzenschädling, Einschränkung, Befallszone, Ausbreitung, Tiere;2025-07-31T18:06:23+02:00;2025-07-31T18:06:23+02:00;;dpa Baden-Württemberg;false
6892f025058758820d7468f959a01bb4729ebb6033d83db2ee932b67b56c0145;"ARD-Dauerbrenner: ""Sturm der Liebe"" wird 20";https://www.zeit.de/news/2025-07/31/sturm-der-liebe-wird-20;"Hier finden Sie Informationen zu dem Thema „Fernsehen“. Lesen Sie jetzt „ARD-Dauerbrenner: ""Sturm der Liebe"" wird 20“.";Fernsehen;News, Fernsehen, Sepp Schauer, Grünwald, München, ARD, Fernsehbranche, Liebe;2025-07-31T18:03:05+02:00;2025-07-31T18:03:05+02:00;;dpa;false
08da293910c34aacfaee475f3d40518a59d8f7eb98c4fee05afb2479fa510791;Wolgast: Neue Kurabgabe soll auch Straßen entlasten;https://www.zeit.de/news/2025-07/31/wolgast-neue-kurabgabe-soll-auch-strassen-entlasten;Hier finden Sie Informationen zu dem Thema „Tourismus“. Lesen Sie jetzt „Wolgast: Neue Kurabgabe soll auch Straßen entlasten“.;Tourismus;News, Tourismus, Martin Schröter, Wolgast, Usedom, Kurabgabe;2025-07-31T17:59:37+02:00;2025-07-31T17:59:37+02:00;;dpa Mecklenburg-Vorpommern;false
a7bd62cd3e8365ea59bf934853bfd1950a6c69d65ffa53957a1c592ea34e6b32;USA und Mexiko verlängern Zollregelung um 90 Tage;https://www.zeit.de/news/2025-07/31/trump-kanadas-palaestina-kurs-erschwert-zolleinigung;Hier finden Sie Informationen zu dem Thema „Handelsstreit“. Lesen Sie jetzt „USA und Mexiko verlängern Zollregelung um 90 Tage“.;Handelsstreit;News, Handelsstreit, Donald Trump, Mark Carney, Kanada, Palästinensergebiet, Zolleinigung, Handelskonflikt, Zollstreit;2025-07-31T17:51:38+02:00;2025-07-31T17:51:38+02:00;;dpa;false
a8be96ac1af160fb955cb5a98a89b3e38fe637e4540240d0da02fc743113ee52;Vermisster Mann tot in Bodensee gefunden;https://www.zeit.de/news/2025-07/31/vermisster-mann-tot-in-bodensee-gefunden;Hier finden Sie Informationen zu dem Thema „Ermittlungen wegen Badeunfall“. Lesen Sie jetzt „Vermisster Mann tot in Bodensee gefunden“.;Ermittlungen wegen Badeunfall;News, Ermittlungen wegen Badeunfall, Bodensee, Radolfzell am Bodensee, Badeunfall, Ermittlung;2025-07-31T17:48:26+02:00;2025-07-31T17:48:26+02:00;;dpa Baden-Württemberg;false
d382df91a46573f2c9d1489ff18d8a3aa2fa496fdf8f8d7b7d417d3c74841a5d;Weniger Minus ist für ihn auch schon ein Plus;https://www.zeit.de/wirtschaft/unternehmen/2025-07/deutsche-bahn-richard-lutz-bericht-milllionen-verlust;Die Deutsche Bahn macht nicht mehr ganz so viel Verlust. Konzernchef Richard Lutz verbucht das als Erfolg. Wohl auch, weil er um seinen Posten bangt.;Deutsche Bahn;Mobilitaet, Deutsche Bahn, Deutsche Bahn, Koalitionsvertrag, Infrastruktur, Finanzen, SPD, CDU;2025-07-31T17:47:04+02:00;2025-07-31T17:47:04+02:00;Jonas Schulze Pals;;false
276d4301ad7b93b325f85175bb50c46bfdd18e96ad61ca5422015d88fda04a8a;Microsoft erreicht vier Billionen Dollar Marktwert;https://www.zeit.de/wirtschaft/2025-07/microsoft-boerse-vier-billionen-marktwert;Vor wenigen Wochen knackte Nvidia erstmals die Vier-Billionen-Dollar-Marke an der Börse. Nun zog Microsoft nach. Die Aktie legte um mehr als sechs Prozent zu.;Börse;Wirtschaft, Börse, Microsoft, Nvidia, Aktien, Finanzen, Marktwert;2025-07-31T17:46:55+02:00;2025-07-31T17:46:55+02:00;dar;DIE ZEIT,        AFP,        							dar;false
77a98fe2c4a510ab2f0cb0dd9c3993d6e10093bcb861b19a0f20b0d267e606fb;Dynamo-Coach Stamm für ein Freundschaftsspiel gesperrt;https://www.zeit.de/news/2025-07/31/dynamo-coach-stamm-fuer-ein-freundschaftsspiel-gesperrt;Hier finden Sie Informationen zu dem Thema „Strafe durch DFB-Sportgericht“. Lesen Sie jetzt „Dynamo-Coach Stamm für ein Freundschaftsspiel gesperrt“.;Strafe durch DFB-Sportgericht;News, Strafe durch DFB-Sportgericht, Thomas Stamm, SV Ried, Deutscher Fußball-Bund, Dynamo Dresden, Freundschaftsspiel;2025-07-31T17:45:45+02:00;2025-07-31T17:45:45+02:00;;dpa Sachsen;false
5ad80d061a0a912a2a3d0f57162f1217a4bea5d622bb0732473b2a5eaea72d1c;A14-Abschnitt Lüderitz-Stendal wird später fertig;https://www.zeit.de/news/2025-07/31/a14-abschnitt-luederitz-stendal-wird-spaeter-fertig;Hier finden Sie Informationen zu dem Thema „Verkehr“. Lesen Sie jetzt „A14-Abschnitt Lüderitz-Stendal wird später fertig“.;Verkehr;News, Verkehr, Lüderitz-Stendal, Lüderitz, Stendal, die Autobahn GmbH des Bundes, Verkehr;2025-07-31T17:35:05+02:00;2025-07-31T17:35:05+02:00;;dpa Sachsen;false
55c05b1d2ac750258312b4193716939ff584e766149bf8356f4021ea39098d23;"""Die Bilder waren versteckt zwischen den Büchern im Regal""";https://www.zeit.de/familie/2025-07/verlust-vater-tod-toechter-trauer-geheimnisse-gxe;Nach dem Tod der Eltern kommt die Trauer – und manchmal überraschen Dinge, von denen man nichts wusste. Drei Frauen erzählen von den Geheimnissen ihrer Väter.;"Z+ (abopflichtiger Inhalt);
        
    Tod des Vaters";Familie, Tod des Vaters, Tod, Familie, Eltern, Vaterschaft, Beziehung, Emotion;2025-07-31T17:31:11+02:00;2025-07-31T17:31:11+02:00;Parvin Sadigh;;false
fd04fd94a3b5148101eb8712f6f6ec3cf08427822a98886898ba6886786a8f4f;Nach Abschiebung von Jesiden: Woidke will Fall aufarbeiten;https://www.zeit.de/news/2025-07/31/rund-30-000-unterschreiben-fuer-rueckkehr-jesidischer-familie;Hier finden Sie Informationen zu dem Thema „Abschiebung in Irak“. Lesen Sie jetzt „Nach Abschiebung von Jesiden: Woidke will Fall aufarbeiten“.;Abschiebung in Irak;News, Abschiebung in Irak, Irak, Lychen, Brandenburg, IS, Deutscher Bundestag, Verwaltungsgericht, Rückholung, Petition, Jesidischen, Familie;2025-07-31T17:29:44+02:00;2025-07-31T17:29:44+02:00;;dpa Berlin/Brandenburg;false
4f69e803004de8c2ef8f5bd12527a899c44c56e453046f5d41a32d6f48fe2375;Heroindealer soll Tod von drei Menschen verursacht haben;https://www.zeit.de/news/2025-07/31/heroindealer-soll-tod-von-drei-menschen-verursacht-haben;Hier finden Sie Informationen zu dem Thema „Drogentote in Kleinstadt“. Lesen Sie jetzt „Heroindealer soll Tod von drei Menschen verursacht haben“.;Drogentote in Kleinstadt;News, Drogentote in Kleinstadt, Cham, Polizei, Heroin, Kleinstadt, Drogentod;2025-07-31T17:28:41+02:00;2025-07-31T17:28:41+02:00;;dpa Bayern;false
8b01ebfbd20c039966f8cc15f975f4e68dc5d850f87e9fcf61e4e0f8c84a10ba;Verkehrsgeplagte Ortschaften planen Durchfahrverbote;https://www.zeit.de/news/2025-07/31/verkehrsgeplagte-ortschaften-planen-durchfahrverbote;Hier finden Sie Informationen zu dem Thema „Durchfahrverbote“. Lesen Sie jetzt „Verkehrsgeplagte Ortschaften planen Durchfahrverbote“.;Durchfahrverbote;News, Durchfahrverbote, Otto Lederer, Volker Wissing, München, Rosenheim, Salzburg, Bundesverkehrsministerium, CSU, Durchfahrverbot, Ortschaft, Ausweichverkehr;2025-07-31T17:27:31+02:00;2025-07-31T17:27:31+02:00;;dpa Bayern;false
30260adb635a46fc11016700fb659dba2291223c55964a728b0f52a647276abe;Zielfahnder verhaften mutmaßlichen Messerstecher;https://www.zeit.de/news/2025-07/31/zielfahnder-verhaften-mutmasslichen-messerstecher;Hier finden Sie Informationen zu dem Thema „Kriminalität“. Lesen Sie jetzt „Zielfahnder verhaften mutmaßlichen Messerstecher“.;Kriminalität;News, Kriminalität, St. Georg, Polizei, Messerangriff, Stadtteil, Kriminalität;2025-07-31T17:25:56+02:00;2025-07-31T17:25:56+02:00;;dpa Hamburg/Schleswig-Holstein;false
b712653cb3e1ef51ef4e2086ac766d0806822af2e0b5125699664c7600cedb91;Fünfeinhalb Jahre Haft für Millionenbetrug mit Corona-Tests;https://www.zeit.de/news/2025-07/31/fuenfeinhalb-jahre-haft-fuer-millionenbetrug-mit-corona-tests;Hier finden Sie Informationen zu dem Thema „Prozesse“. Lesen Sie jetzt „Fünfeinhalb Jahre Haft für Millionenbetrug mit Corona-Tests“.;Prozesse;News, Prozesse, Nordrhein, Mönchengladbach, Kassenärztliche Vereinigung, Millionenbetrug, Tatertrag, Strafkammer, Coronavirus, Geld, Auto;2025-07-31T17:22:29+02:00;2025-07-31T17:22:29+02:00;;dpa Nordrhein-Westfalen;false
751d9416fd3c0e69100377194b24d1405296bdaf310f0e209bc430ee3ec0348f;Polizei vermutet Sabotage nach Brand auf Bahnstrecke in NRW;https://www.zeit.de/gesellschaft/2025-07/duisburg-duesseldorf-nrw-brand-sabotage;Auf der Bahnstrecke zwischen Duisburg und Düsseldorf hat es gebrannt, die Strecke musste gesperrt werden. Die Polizei geht von Sabotage aus.;Deutsche Bahn;Gesellschaft, Deutsche Bahn, Deutsche Bahn, Duisburg, Düsseldorf, Nordrhein-Westfalen, Polizei, Sabotage;2025-07-31T17:20:36+02:00;2025-07-31T17:20:36+02:00;edd;DIE ZEIT,        dpa,        							edd;false
5101fdf3d4c7b182ecbd3b8ebb53a79d68aaef9b7af87c79bad4b9871ab093fc;Einschränkungen für Bürger wegen Japankäfern;https://www.zeit.de/news/2025-07/31/einschraenkungen-fuer-buerger-wegen-japankaefern;Hier finden Sie Informationen zu dem Thema „Gefährlicher Schädling“. Lesen Sie jetzt „Einschränkungen für Bürger wegen Japankäfern“.;Gefährlicher Schädling;News, Gefährlicher Schädling, Freiburg, Breisgau, Einschränkung, Schädling, Befallszone;2025-07-31T17:20:24+02:00;2025-07-31T17:20:24+02:00;;dpa Baden-Württemberg;false
6aa0912e956f9092b64bf536a9d571ca97783ae42518a3770d6397d7134fe856;Kliniken der Pfeifferschen Stiftungen nun bei Uniklinikum;https://www.zeit.de/news/2025-07/31/kliniken-der-pfeifferschen-stiftungen-nun-bei-uniklinikum;Hier finden Sie Informationen zu dem Thema „Krankenhäuser“. Lesen Sie jetzt „Kliniken der Pfeifferschen Stiftungen nun bei Uniklinikum“.;Krankenhäuser;News, Krankenhäuser, Magdeburg, Lostau, Uniklinikum, Klinik, Stiftung, Universitätsmedizin, Lungenklinik, Menschen mit Behinderung;2025-07-31T17:17:39+02:00;2025-07-31T17:17:39+02:00;;dpa Sachsen;false
006a8fd20d49135f4cb8bbf1d8d1763243a587ae93fa297f5338951f027ab61a;Hannover will Kinder aus Gaza und Israel aufnehmen;https://www.zeit.de/news/2025-07/31/hannover-will-kinder-aus-gaza-und-israel-aufnehmen;Hier finden Sie Informationen zu dem Thema „Humanitäre Initiative“. Lesen Sie jetzt „Hannover will Kinder aus Gaza und Israel aufnehmen“.;Humanitäre Initiative;News, Humanitäre Initiative, Belit Onay, Michael Fürst, Gerhard Wegner, Hannover, Gazastreifen, Initiative;2025-07-31T17:14:04+02:00;2025-07-31T17:14:04+02:00;;dpa Niedersachsen;false
289b52a38bad7ef9a40b9843808cd351a7b04430cd660738871f9f57b91f57d0;Klinik-Aus: Wittstock soll möglichst Medizinstandort bleiben;https://www.zeit.de/news/2025-07/31/klinik-aus-wittstock-soll-moeglichst-medizinstandort-bleiben;Hier finden Sie Informationen zu dem Thema „Krankenhausreform“. Lesen Sie jetzt „Klinik-Aus: Wittstock soll möglichst Medizinstandort bleiben“.;Krankenhausreform;News, Krankenhausreform, Britta Müller, Philipp Wacker, Wittstock, Dosse, Brandenburg, Bündnis Sahra Wagenknecht, CDU, Treffen, Medizinstandort, Krankenhausreform;2025-07-31T17:13:58+02:00;2025-07-31T17:13:58+02:00;;dpa Berlin/Brandenburg;false
16b5e3610d8fb05c05ece51d7972f6c3f061a5ad8c7920be309a102d8c4e8a98;Gewerkschaft oder nicht? AfD-naher Verein klagt gegen VW;https://www.zeit.de/news/2025-07/31/gewerkschaft-oder-nicht-verein-klagt-gegen-vw;Hier finden Sie Informationen zu dem Thema „Arbeitsgericht“. Lesen Sie jetzt „Gewerkschaft oder nicht? AfD-naher Verein klagt gegen VW“.;Arbeitsgericht;News, Arbeitsgericht, Braunschweig, VW, Alternative für Deutschland, Arbeitsgericht;2025-07-31T17:12:22+02:00;2025-07-31T17:12:22+02:00;;dpa Niedersachsen;false
ac03592b01a485516684743838bc82dd396cbb6b40926d1126f3c077dd289851;"""Das ist eine gigantische Verschwendung von Steuergeldern""";https://www.zeit.de/digital/internet/2025-07/alfred-kranstedt-behoerden-verwaltung-digitalisierung-technologie;Alfred Kranstedt ist der Mann, der Deutschlands Behörden digitalisieren soll. Klingt nach einem Job zum Verzweifeln? Ist es auch. Nicht nur alte Technik ist ein Problem.;"Z+ (abopflichtiger Inhalt);
        
    Alfred Kranstedt";Digital, Alfred Kranstedt, Technologie, Bürokratie, Digitalisierung, Steuer, Verwaltungsreform;2025-07-31T17:07:49+02:00;2025-07-31T17:07:49+02:00;Pauline Schinkels;;false
4c91000054a5f59b6d6ca0bca86dcc6d2430ecbf7625c0652a24887b70323e97;Landtagsabgeordneter Noetzel in Güstrow angegriffen;https://www.zeit.de/news/2025-07/31/landtagsabgeordneter-noetzel-in-guestrow-angegriffen;Hier finden Sie Informationen zu dem Thema „Mutmaßlich rechtsradikal“. Lesen Sie jetzt „Landtagsabgeordneter Noetzel in Güstrow angegriffen“.;Mutmaßlich rechtsradikal;News, Mutmaßlich rechtsradikal, Michael Noetzel, Güstrow, Polizei, Linksfraktion;2025-07-31T17:06:12+02:00;2025-07-31T17:06:12+02:00;;dpa Mecklenburg-Vorpommern;false
28c489eecc2986a20d4c4c2f849457fef36bb2720763742d61fd1f1be652eab8;Umweltminister begrüßt Einschätzung zur Wolfs-Entwicklung;https://www.zeit.de/news/2025-07/31/umweltminister-begruesst-einschaetzung-zur-wolfs-entwicklung;Hier finden Sie Informationen zu dem Thema „Tiere“. Lesen Sie jetzt „Umweltminister begrüßt Einschätzung zur Wolfs-Entwicklung“.;Tiere;News, Tiere, Christian Meyer, Niedersachsen, Schleswig-Holstein, Bremen, Nordrhein-Westfalen, Bundesregierung, Europäische Union, CDU, Erhaltungszustand, Tiere;2025-07-31T17:04:54+02:00;2025-07-31T17:04:54+02:00;;dpa Hamburg/Schleswig-Holstein;false
a7287783fea6ffa5df09a0f59f6a47edfe78072c493ca3a8204410ee9c771f57;Inflationsrate bleibt im Juli bei zwei Prozent;https://www.zeit.de/wirtschaft/2025-07/inflation-statistisches-bundesamt-teuerungsrate;Die Inflation in Deutschland ist bei zwei Prozent im Vergleich zum Vorjahreszeitraum geblieben. Im Vergleich zum Juni stiegen die Preise um 0,3 Prozent. ;Inflation;Wirtschaft, Inflation, Statistisches Bundesamt, Statistik, Verbraucherpreis, Inflation;2025-07-31T17:04:42+02:00;2025-07-31T17:04:42+02:00;edd;DIE ZEIT,        dpa,        Reuters,        AFP,        							edd;false
48fc43e9ec8814dfd295fd25d1fd8c3c20a337500f720bd916bf6bedfd9aba79;Tuberkulose bei Wildtieren im Wartburgkreis;https://www.zeit.de/news/2025-07/31/tuberkulose-bei-wildtieren-im-wartburgkreis;Hier finden Sie Informationen zu dem Thema „Krankheiten“. Lesen Sie jetzt „Tuberkulose bei Wildtieren im Wartburgkreis“.;Krankheiten;News, Krankheiten, Dermbach, Bad Salzungen, Wartburgkreis, Tuberkulose, Wildschwein, Tiere;2025-07-31T17:03:52+02:00;2025-07-31T17:03:52+02:00;;dpa Thüringen;false
