Hash;Title;Link;Description;Category;KeyWords;Published;LastUpdated;Author;Source;Paywall
cb1a2c5740d82aeb8c751d69651c02823c21a0d4b0ea970185041dfa92ac2a0d;Die Namen dieses Sommers lauten Anika, Théa, Lena & Linus;https://www.zeit.de/2025/19/solokuenstler-bands-festivals-musik-popkultur;Es ist keine gute Zeit für Bands. Auf den Festivalbühnen wird man vor allem nette Solosänger sehen. Dabei steht etwas Elementares auf dem Spiel.;"Z+ (abopflichtiger Inhalt);
        
    Solokünstler";Kultur, Solokünstler, Konzert, Musiker, Band, Popkultur, Musikindustrie, Musik;2025-05-15T18:25:35+02:00;2025-05-15T18:25:35+02:00;Marlene Knobloch;Aus der        ZEIT Nr. 19/2025;false
fd701daf98bf389e2a3fbc9059c64ccc04e490e6465a8c12504b6707834c9b00;Plötzlich sind die Moorleichen Klimaaktivisten;https://www.zeit.de/kultur/film/2025-05/tanz-der-titanen-politik-satire-film-cate-blanchett;"Die Horrorkomödie ""Tanz der Titanen"" spielt zwischen G7-Gipfel und Zombie-Apokalypse. Mittendrin: Cate Blanchett als deutsche Bundeskanzlerin.";"Z+ (abopflichtiger Inhalt);
        
    ""Tanz der Titanen""";"Kultur, ""Tanz der Titanen"", Cate Blanchett, G7-Gipfel, Kino, Filmindustrie, Satire, Filmrezension";2025-05-15T18:23:58+02:00;2025-05-15T18:23:58+02:00;Pauline Graf;;false
144e5b03bb133327ef9bda4f2e1f841a54d66ca74bbab43a0b8081fc6c103df2;Selenskyj nimmt nicht an Gesprächen mit russischer Delegation teil;https://www.zeit.de/politik/ausland/2025-05/istanbul-wolodymyr-selenskyj-keine-teilnahme-gespraeche-russische-delegation;Weder Putin noch ranghohe Politiker werden an Gesprächen in der Türkei teilnehmen. Selenskyj will daher nicht nach Istanbul kommen und schickt den Verteidigungsminister.;Istanbul;Politik, Istanbul, Krieg in der Ukraine, Wolodymyr Selenskyj, Wladimir Putin, Istanbul, Recep Tayyip Erdogan, Türkei;2025-05-15T18:13:22+02:00;2025-05-15T18:13:22+02:00;alemmh;ZEIT ONLINE,        AP,        dpa,        AFP,        							ale					,        							mmh;false
58292b6261660f5bc9a86a097612ace87b0275faaa2b9e08b090b03d5138672f;Niedrigwasser an der Elbe: Wasserstände sinken erneut;https://www.zeit.de/news/2025-05/15/niedrigwasser-an-der-elbe-wasserstaende-sinken-erneut;Hier finden Sie Informationen zu dem Thema „Flüsse und Trockenheit“. Lesen Sie jetzt „Niedrigwasser an der Elbe: Wasserstände sinken erneut“.;Flüsse und Trockenheit;News, Flüsse und Trockenheit, Elbe, Niedrigwasser, Wasserstand, Trockenheit;2025-05-15T18:13:10+02:00;2025-05-15T18:13:10+02:00;;dpa Sachsen;false
ce3903335f5e02d47b082bd8e5b2e2bc95a29c7ccc45e6ed89ca90adcf545fc7;Blessin bewertet St. Paulis Saison: Von 3+ zu 2+;https://www.zeit.de/news/2025-05/15/blessin-bewertet-st-paulis-saison-von-3-zu-2;Hier finden Sie Informationen zu dem Thema „Fußball-Bundesliga“. Lesen Sie jetzt „Blessin bewertet St. Paulis Saison: Von 3+ zu 2+“.;Fußball-Bundesliga;News, Fußball-Bundesliga, Alexander Blessin, St. Paulis, FC St. Pauli, Fußball-Bundesliga;2025-05-15T18:10:07+02:00;2025-05-15T18:10:07+02:00;;dpa Hamburg/Schleswig-Holstein;false
0bb706f658c19437b009e2129ce2773b128931566610b2282b8937908ea0d0ce;Niedersachsen baut berufliche Orientierung an Schulen aus;https://www.zeit.de/news/2025-05/15/niedersachsen-baut-berufliche-orientierung-an-schulen-aus;Hier finden Sie Informationen zu dem Thema „Bildung“. Lesen Sie jetzt „Niedersachsen baut berufliche Orientierung an Schulen aus“.;Bildung;News, Bildung, Julia Willie Hamburg, Niedersachsen, Orientierung;2025-05-15T18:04:15+02:00;2025-05-15T18:04:15+02:00;;dpa Niedersachsen;false
14455067a06ff52ecba022fa8918d0fc5c6e83c0c0eb53c9ee65b8a37f8268a9;Verstappen kontert Kritik an Nordschleifen-Spritztour;https://www.zeit.de/news/2025-05/15/verstappen-kontert-kritik-an-nordschleifen-spritztour;Hier finden Sie Informationen zu dem Thema „Wirbel um Formel-1-Weltmeister“. Lesen Sie jetzt „Verstappen kontert Kritik an Nordschleifen-Spritztour“.;Wirbel um Formel-1-Weltmeister;News, Wirbel um Formel-1-Weltmeister, Max Verstappen, Ralf Schumacher, Imola, Nürburgring, Formel-1, Nordschleife, Kritik, Formel-1-Weltmeister;2025-05-15T17:59:20+02:00;2025-05-15T17:59:20+02:00;;dpa Rheinland-Pfalz/Saarland;false
9e87e85ada16240bcccd3d7457c63ab7978dee350d3a3fd0dbd8e7ce68e5a93c;MV für rasche Umsetzung überregional wichtiger Bahnprojekte;https://www.zeit.de/news/2025-05/15/mv-fuer-rasche-umsetzung-ueberregional-wichtiger-bahnprojekte;Hier finden Sie Informationen zu dem Thema „Bahnangebote“. Lesen Sie jetzt „MV für rasche Umsetzung überregional wichtiger Bahnprojekte“.;Bahnangebote;News, Bahnangebote, Schwerin, Berlin, Usedom, Stralsund, Stettin, Mecklenburg-Vorpommern, SPD, Bahnprojekt, Bahnangebot;2025-05-15T17:49:34+02:00;2025-05-15T17:49:34+02:00;;dpa Mecklenburg-Vorpommern;false
3164a6fdbd039ec5cad55d7b0b1b5c92c813793579f81dc33a918108757c2d5d;Wie Unterhaching oder Mainz: FC Hansa braucht Fußball-Wunder;https://www.zeit.de/news/2025-05/15/wie-unterhaching-oder-mainz-fc-hansa-braucht-fussball-wunder;Hier finden Sie Informationen zu dem Thema „3. Fußball-Liga“. Lesen Sie jetzt „Wie Unterhaching oder Mainz: FC Hansa braucht Fußball-Wunder“.;3. Fußball-Liga;News, 3. Fußball-Liga, Daniel Brinkmann, Unterhaching, Mainz, Osnabrück, FC Hansa, Hansa Rostock, Hannover 96 II, Relegationsplatz;2025-05-15T17:46:11+02:00;2025-05-15T17:46:11+02:00;;dpa Mecklenburg-Vorpommern;false
74701b5bc9dc6a90e7816d5a2c3d22b003607d58d2c868a795889d2caf8925e8;Schreibschrift abschaffen? Kultusministerin dagegen;https://www.zeit.de/news/2025-05/15/schreibschrift-abschaffen-kultusministerin-dagegen;Hier finden Sie Informationen zu dem Thema „Schule“. Lesen Sie jetzt „Schreibschrift abschaffen? Kultusministerin dagegen“.;Schule;News, Schule, Julia Willie Hamburg, Niedersachsen, Schreibschrift;2025-05-15T17:45:24+02:00;2025-05-15T17:45:24+02:00;;dpa Niedersachsen;false
c5665fe9e24ef88f01fc2925d13f4a6c7d17f7aca0595c15c435d827a1ada6aa;Adidas-Chefaufseher Rabe darf noch ein Jahr weitermachen;https://www.zeit.de/news/2025-05/15/adidas-chefaufseher-rabe-darf-noch-ein-jahr-weitermachen;Hier finden Sie Informationen zu dem Thema „Adidas-Aufsichtsrat“. Lesen Sie jetzt „Adidas-Chefaufseher Rabe darf noch ein Jahr weitermachen“.;Adidas-Aufsichtsrat;News, Adidas-Aufsichtsrat, Bjørn Gulden, Thomas Rabe, Fürth, Adidas, Bertelsmann, Hauptversammlung, Medienkonzern, Gegenwind, Sportartikel, Kritik;2025-05-15T17:42:51+02:00;2025-05-15T17:42:51+02:00;;dpa Bayern;false
7932282469819686c2c45268e85722ae1790aff36aee9d9cd33da3e02430fe8f;Heil schlägt Braunschweigs OB für Parteivorstand vor;https://www.zeit.de/news/2025-05/15/heil-schlaegt-braunschweigs-ob-fuer-parteivorstand-vor;Hier finden Sie Informationen zu dem Thema „SPD“. Lesen Sie jetzt „Heil schlägt Braunschweigs OB für Parteivorstand vor“.;SPD;News, SPD, Hubertus Heil, Thorsten Kornblum, Braunschweig, Berlin, SPD, Parteivorstand;2025-05-15T17:40:29+02:00;2025-05-15T17:40:29+02:00;;dpa Niedersachsen;false
76d758e21598c8186f112990013cf9fb2cdc4be2477ac4c906bd8327d71c5f47;Warum die AfD gesichert rechtsextrem sein soll;https://www.zeit.de/politik/deutschland/2025-05/gutachten-verfassungsschutz-afd-rechtsextremismus-hochstufung;Das Gutachten des Verfassungsschutzes zur AfD ist nun öffentlich. Was genau bringt der Geheimdienst gegen die Partei vor? Ein Überblick;"Z+ (abopflichtiger Inhalt);
        
    Gutachten des Verfassungsschutzes";Politik, Gutachten des Verfassungsschutzes, Alternative für Deutschland, Rechtsextremismus, Verfassungsschutz, Björn Höcke, Maximilian Krah, Demokratie;2025-05-15T17:39:11+02:00;2025-05-15T17:39:11+02:00;Tilman SteffenChristian Parth;;false
5f7a08e5e9d4c32a1093d94de31979cecf6e067eef14fe29ab06ab38415b830a;Sexismus gegen Schiedsrichterin: Geldstrafe für Essen;https://www.zeit.de/news/2025-05/15/sexismus-gegen-schiedsrichterin-geldstrafe-fuer-essen;Hier finden Sie Informationen zu dem Thema „Entscheidung durch DFB“. Lesen Sie jetzt „Sexismus gegen Schiedsrichterin: Geldstrafe für Essen“.;Entscheidung durch DFB;News, Entscheidung durch DFB, Fabienne Michel, Deutscher Fußball-Bund, Rot-Weiss Essen, Sexismus, Geldstrafe;2025-05-15T17:39:10+02:00;2025-05-15T17:39:10+02:00;;dpa Nordrhein-Westfalen;false
d2913eeb8311dc161ca0a907507098644bbef1dc84cb9155105c4e57939f1129;Energiedienstleister VSE investiert 375 Millionen;https://www.zeit.de/news/2025-05/15/energiedienstleister-vse-investiert-375-millionen;Hier finden Sie Informationen zu dem Thema „Energie“. Lesen Sie jetzt „Energiedienstleister VSE investiert 375 Millionen“.;Energie;News, Energie, Netzinfrastruktur;2025-05-15T17:36:18+02:00;2025-05-15T17:36:18+02:00;;dpa Rheinland-Pfalz/Saarland;false
e05b581ecefee3b488113a0d9bf72021e348a46f21f269986f8cbc795a3a2706;Steuerschätzung: Sachsen will Last für Kommunen vermeiden;https://www.zeit.de/news/2025-05/15/steuerschaetzung-sachsen-will-last-fuer-kommunen-vermeiden;Hier finden Sie Informationen zu dem Thema „Finanzpolitik“. Lesen Sie jetzt „Steuerschätzung: Sachsen will Last für Kommunen vermeiden“.;Finanzpolitik;News, Finanzpolitik, Christian Hartmann, Sachsen, CDU, SPD, Steuerschätzung, Kommune, Mehrbelastung, Minderheitsregierung, Finanzpolitik, Schulden;2025-05-15T17:33:10+02:00;2025-05-15T17:33:10+02:00;;dpa Sachsen;false
6f0dd81301f1638f88675d849e829ae675c3d7ad25324dde1ce04e92a570b848;18 Kinder bei Vollbremsung von Schulbus leicht verletzt;https://www.zeit.de/news/2025-05/15/18-kinder-bei-vollbremsung-von-schulbus-leicht-verletzt;Hier finden Sie Informationen zu dem Thema „Verkehrsunfall“. Lesen Sie jetzt „18 Kinder bei Vollbremsung von Schulbus leicht verletzt“.;Verkehrsunfall;News, Verkehrsunfall, Malente-Gremsmühlen, Kreis Ostholstein, Polizei, Schulbus, Vollbremsung, Verkehrsunfall, Notbremsung;2025-05-15T17:25:32+02:00;2025-05-15T17:25:32+02:00;;dpa Hamburg/Schleswig-Holstein;false
6543f7f6d6181020be59dbbd2761cf3cae3ab3054e9bf5f590d93d274ff86f6b;Fliegerbombe entschärft - Gefängnis zuvor evakuiert;https://www.zeit.de/news/2025-05/15/fliegerbombe-gefunden-jva-muss-evakuiert-werden;Hier finden Sie Informationen zu dem Thema „Landkreis Berchtesgadener Land“. Lesen Sie jetzt „Fliegerbombe entschärft - Gefängnis zuvor evakuiert“.;Landkreis Berchtesgadener Land;News, Landkreis Berchtesgadener Land, Berchtesgadener Land, Bad Reichenhall, Fliegerbombe, Landkreis, Weltkriegsbombe;2025-05-15T17:22:48+02:00;2025-05-15T17:22:48+02:00;;dpa Bayern;false
1a11ad8da5ec69d4069eebb5f07b756552eb64b8defe998980195dafd5e30ff9;Mann will schwangere Freundin verbrennen - sieben Jahre Haft;https://www.zeit.de/news/2025-05/15/mann-will-schwangere-freundin-verbrennen-sieben-jahre-haft;Hier finden Sie Informationen zu dem Thema „Justiz“. Lesen Sie jetzt „Mann will schwangere Freundin verbrennen - sieben Jahre Haft“.;Justiz;News, Justiz, Gau-Algesheim, Bulgarien, Familie;2025-05-15T17:21:31+02:00;2025-05-15T17:21:31+02:00;;dpa Rheinland-Pfalz/Saarland;false
18abfa0eead7d44d476019fb0741cff8447515c9c2db596a9ec13175d7998988;88 neue Planstellen an Schulen im Saarland;https://www.zeit.de/news/2025-05/15/88-neue-planstellen-an-schulen-im-saarland;Hier finden Sie Informationen zu dem Thema „Bildung“. Lesen Sie jetzt „88 neue Planstellen an Schulen im Saarland“.;Bildung;News, Bildung, Saarland, Planstelle;2025-05-15T17:16:59+02:00;2025-05-15T17:16:59+02:00;;dpa Rheinland-Pfalz/Saarland;false
9cce8cb810d42121c061cc60d27ac962a6982a920c91f92f354fe49376ae6adc;AfD-Antrag auf Nationalhymne im Landtag abgelehnt;https://www.zeit.de/news/2025-05/15/afd-antrag-auf-nationalhymne-im-landtag-abgelehnt;Hier finden Sie Informationen zu dem Thema „Landtag“. Lesen Sie jetzt „AfD-Antrag auf Nationalhymne im Landtag abgelehnt“.;Landtag;News, Landtag, Wiesbaden, Alternative für Deutschland, Nationalhymne, Landtag, Plenarwoche, Freiheit;2025-05-15T17:16:44+02:00;2025-05-15T17:16:44+02:00;;dpa Hessen;false
cbdd88acecda5cca78a493dac2b401a43b5a8903a95891f0042c14a199d60de0;Senat stoppt Finanzierung der Planungen für Kiezblocks;https://www.zeit.de/news/2025-05/15/senat-stoppt-finanzierung-der-planungen-fuer-kiezblocks;Hier finden Sie Informationen zu dem Thema „Verkehrsberuhigung“. Lesen Sie jetzt „Senat stoppt Finanzierung der Planungen für Kiezblocks“.;Verkehrsberuhigung;News, Verkehrsberuhigung, Berliner Senat, Kiezblock, Verkehrsberuhigung, Senat, Finanzierung, Auto;2025-05-15T17:15:17+02:00;2025-05-15T17:15:17+02:00;;dpa Berlin/Brandenburg;false
0f26c3a38bee3d4e86c18b4a93fda797d846ec9def33d2d8e577d439c2348d40;Flughafen Köln/Bonn macht deutlich mehr Gewinn;https://www.zeit.de/news/2025-05/15/flughafen-koeln-bonn-macht-deutlich-mehr-gewinn;Hier finden Sie Informationen zu dem Thema „Luftverkehr“. Lesen Sie jetzt „Flughafen Köln/Bonn macht deutlich mehr Gewinn“.;Luftverkehr;News, Luftverkehr, Nordrhein-Westfalen, Köln, Bonn, Flughafen Köln/Bonn, Luftverkehr, Urlaubslust;2025-05-15T17:10:30+02:00;2025-05-15T17:10:30+02:00;;dpa Nordrhein-Westfalen;false
b0bb7f9577d60a2e60b5a3023bed59ce19570b69913cb2e5294f5def5e13d22d;Dauerstreit um SPD-Ministerin belastet Regierungspartei;https://www.zeit.de/news/2025-05/15/dauerstreit-um-spd-ministerin-belastet-regierungspartei;Hier finden Sie Informationen zu dem Thema „Debatte über Verfassungsschutz“. Lesen Sie jetzt „Dauerstreit um SPD-Ministerin belastet Regierungspartei“.;Debatte über Verfassungsschutz;News, Debatte über Verfassungsschutz, Katrin Lange, Dietmar Woidke, Jörg Müller, Brandenburg, Jusos, SPD, Verfassungsschutz, Alternative für Deutschland, Dauerstreit, Kritik;2025-05-15T17:09:42+02:00;2025-05-15T17:09:42+02:00;;dpa Berlin/Brandenburg;false
25bd077164606f9c2c30061774318267bb08eea01fb7a50028711f55e0b1b121;Steuerschätzung fällt bis 2029 deutlich niedriger aus;https://www.zeit.de/wirtschaft/2025-05/steuereinnahmen-niedrig-koalitionsvertrag-wirtschaftswachstum-steuer;Der Bund muss laut neuer Schätzung mit 33,3 Milliarden Euro weniger auskommen. Finanzminister Klingbeil setzt auf Modernisierung für ein höheres Wirtschaftswachstum.;Steuern;Wirtschaft, Steuern, Steuer, Lars Klingbeil, Wirtschaftswachstum, Koalitionsvertrag, Bundesregierung, Bundeshaushalt;2025-05-15T17:06:57+02:00;2025-05-15T17:06:57+02:00;ore;ZEIT ONLINE,        dpa,        							ore;false
6a02f92cb9609c47f3f42dc4480209573c19c274149364edbaf47417fbb690ed;Korruptionsprozess: Verdächtige Gelder, Aktenfotos und Hund;https://www.zeit.de/news/2025-05/15/korruptionsprozess-verdaechtige-gelder-aktenfotos-und-hund;Hier finden Sie Informationen zu dem Thema „Prozess gegen Staatsanwalt“. Lesen Sie jetzt „Korruptionsprozess: Verdächtige Gelder, Aktenfotos und Hund“.;Prozess gegen Staatsanwalt;News, Prozess gegen Staatsanwalt, Hannover, Landgericht Hannover, Korruptionsprozess, Aktenfoto, Ermittlungsakte, Smartphone, Geld;2025-05-15T17:06:53+02:00;2025-05-15T17:06:53+02:00;;dpa Niedersachsen;false
bf51ba688ca7b3c39f10a2fd7a904a2656cf9b635767557d4e0241d9288b2157;73-Jähriger stirbt nach Verkehrsunfall;https://www.zeit.de/news/2025-05/15/73-jaehriger-stirbt-nach-verkehrsunfall;Hier finden Sie Informationen zu dem Thema „Unfälle“. Lesen Sie jetzt „73-Jähriger stirbt nach Verkehrsunfall“.;Unfälle;News, Unfälle, Polizei, Verkehrsunfall, Unfall, Auto;2025-05-15T17:00:43+02:00;2025-05-15T17:00:43+02:00;;dpa Mecklenburg-Vorpommern;false
6b2b64c46e3b8a083b99193a9ef646d51fae27332486106a4107a45a4eb3ac82;Model Gisele Oppermann ist nach Brasilien ausgewandert;https://www.zeit.de/news/2025-05/15/model-gisele-oppermann-ist-nach-brasilien-ausgewandert;Hier finden Sie Informationen zu dem Thema „Leute“. Lesen Sie jetzt „Model Gisele Oppermann ist nach Brasilien ausgewandert“.;Leute;News, Leute, Gisele Oppermann, Brasilien;2025-05-15T17:00:36+02:00;2025-05-15T17:00:36+02:00;;dpa Niedersachsen;false
7ea9c97168d9ec00f01c65a7d938dcba120bad9287a5b7de83f8949e77bfcf8d;Serie von Waldbränden - zwei Verdächtige in U-Haft;https://www.zeit.de/news/2025-05/15/serie-von-waldbraenden-zwei-verdaechtige-in-u-haft;Hier finden Sie Informationen zu dem Thema „Feuer im Wald“. Lesen Sie jetzt „Serie von Waldbränden - zwei Verdächtige in U-Haft“.;Feuer im Wald;News, Feuer im Wald, Mann, Nettetal, Viersen, Krefeld, Freiwillige Feuerwehr, Staatsanwaltschaft, Feuerwehr, Waldbrand, Wald;2025-05-15T16:59:56+02:00;2025-05-15T16:59:56+02:00;;dpa Nordrhein-Westfalen;false
15074985cdc6fd08e0c007f85475f03472646fa04ce1ddff6a25270d03176bd0;Warum das Gute mehr Aufmerksamkeit braucht;https://www.zeit.de/2025/20/placeboeffekt-nocebo-erwartung-krankheit-medizin;Unsere Erwartungen können Schmerzen lindern – oder verstärken. Eine neue Studie zeigt: Wer vom Schlimmsten ausgeht, leidet mehr. Was dagegen helfen könnte.;Placeboeffekt;Gesundheit, Placeboeffekt, Gehirn, Psychologie, Arzt, Medikament;2025-05-15T16:59:17+02:00;2025-05-15T16:59:17+02:00;Ulrich Schnabel;Aus der        ZEIT Nr. 20/2025;false
a00cd286c7c46c1e8e3e101c18bf63647f51ef55c16a55453092c44ae4e31ae1;DHL macht Standort Florstadt zum Pharma-Drehkreuz für Europa;https://www.zeit.de/news/2025-05/15/dhl-macht-standort-florstadt-zum-pharma-drehkreuz-fuer-europa;Hier finden Sie Informationen zu dem Thema „Logistik“. Lesen Sie jetzt „DHL macht Standort Florstadt zum Pharma-Drehkreuz für Europa“.;Logistik;News, Logistik, Hendrik Venter, Florstadt, Europa, DHL, Logistikriese, Logistikzentrum, Pharma, Logistik;2025-05-15T16:55:29+02:00;2025-05-15T16:55:29+02:00;;dpa Hessen;false
f2a1ecf5d876e144997a957660f072ba097e465a40654d21da5b7c2f41d60cbc;Schätzung: Steuereinnahmen niedriger als erwartet;https://www.zeit.de/news/2025-05/15/schaetzung-steuereinnahmen-niedriger-als-erwartet;Hier finden Sie Informationen zu dem Thema „Öffentliche Haushalte“. Lesen Sie jetzt „Schätzung: Steuereinnahmen niedriger als erwartet“.;Öffentliche Haushalte;News, Öffentliche Haushalte, Doris Ahnen, Rheinland-Pfalz, SPD, Steuereinnahme, Schätzung, Haushalt;2025-05-15T16:54:50+02:00;2025-05-15T16:54:50+02:00;;dpa Rheinland-Pfalz/Saarland;false
06eb2f929dff854e360a2b2b310bd93ceb3c39f255fb43a194a0c110a587d25c;Billionen-Trip durch Nahost? Trumps Zahlen und viele Fragen;https://www.zeit.de/news/2025-05/15/katar-flugzeug-fuer-trump-ist-einfaches-regierungsgeschaeft;Hier finden Sie Informationen zu dem Thema „International“. Lesen Sie jetzt „Billionen-Trip durch Nahost? Trumps Zahlen und viele Fragen“.;International;News, International, Donald Trump, Mohammed bin Abdulrahman Al Thani, Katar, Regierungsgeschäft, Luxusflugzeug, Flugzeug, Kritik;2025-05-15T16:52:00+02:00;2025-05-15T16:52:00+02:00;;dpa;false
34838a3b1fc43fc8411596e4fdb7234d749b7ad67d52347f2f287ce78b6b3f36;Fußgänger angefahren - Verletzte außer Lebensgefahr;https://www.zeit.de/news/2025-05/15/fussgaenger-angefahren-verletzte-ausser-lebensgefahr;Hier finden Sie Informationen zu dem Thema „Landkreis Esslingen“. Lesen Sie jetzt „Fußgänger angefahren - Verletzte außer Lebensgefahr“.;Landkreis Esslingen;News, Landkreis Esslingen, Mann, Notzingen, Esslingen, Polizei, Landkreis, Lebensgefahr;2025-05-15T16:46:15+02:00;2025-05-15T16:46:15+02:00;;dpa Baden-Württemberg;false
38e7c0d0c27d2f107e899c0af42ba7afc0c8d08a0212f535dbbc6b062c73bf08;Gericht: Radsternfahrt nicht über Autobahn 96;https://www.zeit.de/news/2025-05/15/gericht-radsternfahrt-nicht-ueber-autobahn-96;Hier finden Sie Informationen zu dem Thema „Bis zu 10.000 Teilnehmende“. Lesen Sie jetzt „Gericht: Radsternfahrt nicht über Autobahn 96“.;Bis zu 10.000 Teilnehmende;News, Bis zu 10.000 Teilnehmende, München, ADFC, Verwaltungsgericht München, Bayerischer Verwaltungsgerichtshof, Verwaltungsgericht, Radsternfahrt, Autobahn, Fahrrad;2025-05-15T16:39:38+02:00;2025-05-15T16:39:38+02:00;;dpa Bayern;false
d55b0a9d4ddf7fb95bcb141006fc3d0bc4bfffee86d01790eb62b934b0140bf5;Demo zum Gedenktag Nakba muss doch am Südstern bleiben;https://www.zeit.de/news/2025-05/15/propalaestinensische-demonstrationen-zum-gedenktag-nakba;Hier finden Sie Informationen zu dem Thema „Nahost-Konflikt“. Lesen Sie jetzt „Demo zum Gedenktag Nakba muss doch am Südstern bleiben“.;Nahost-Konflikt;News, Nahost-Konflikt, Berlin-Kreuzberg, Polizei, Gedenktag, Demonstration, Nahostkonflikt;2025-05-15T16:39:00+02:00;2025-05-15T16:39:00+02:00;;dpa Berlin/Brandenburg;false
572441cb83e1a17ecb7c524a542c3d9ca9cb5db8c261899e7e492de314647cc0;Angeklagter Polizist spricht von Bedrohungslage;https://www.zeit.de/news/2025-05/15/angeklagter-polizist-spricht-von-bedrohungslage;Hier finden Sie Informationen zu dem Thema „Polizeischüsse“. Lesen Sie jetzt „Angeklagter Polizist spricht von Bedrohungslage“.;Polizeischüsse;News, Polizeischüsse, Düsseldorf, Landgericht Düsseldorf, Polizei, Bedrohungslage, Polizeischuss, Dienstwaffe;2025-05-15T16:36:47+02:00;2025-05-15T16:36:47+02:00;;dpa Nordrhein-Westfalen;false
666207c9ad97a02685f74e2088f7990bbc21f810ce832c95f6c47127349bafcf;Gewölbebrücke in Falkenberg wird dauerhaft gesperrt;https://www.zeit.de/news/2025-05/15/gewoelbebruecke-in-falkenberg-wird-dauerhaft-gesperrt;Hier finden Sie Informationen zu dem Thema „Brückensperrung“. Lesen Sie jetzt „Gewölbebrücke in Falkenberg wird dauerhaft gesperrt“.;Brückensperrung;News, Brückensperrung, Falkenberg, Gewölbebrücke, Brückensperrung;2025-05-15T16:36:36+02:00;2025-05-15T16:36:36+02:00;;dpa Sachsen;false
c372bc9b0414ad02ee91da1fd1b71fc9c59bf12d33c92204126ec6fc1fbc40e8;Ausschuss zur Wahl von Richtern nicht komplett;https://www.zeit.de/news/2025-05/15/ausschuss-zur-wahl-von-richtern-nicht-komplett;Hier finden Sie Informationen zu dem Thema „Landtag“. Lesen Sie jetzt „Ausschuss zur Wahl von Richtern nicht komplett“.;Landtag;News, Landtag, Thüringen, CDU, SPD, Alternative für Deutschland, Landtag, Ausschuss;2025-05-15T16:34:38+02:00;2025-05-15T16:34:38+02:00;;dpa Thüringen;false
2c19b5a9f240705aa22d0ae7c55ef2c0b28a90e3b490baaa5fd775b82e250f61;So soll Deutschland zur KI-Nation werden;https://www.zeit.de/digital/2025-05/thomas-jarzombek-bundesregierung-newsletter-kuenstliche-intelligenz;Mehr Rechenpower, mehr Geld vom Staat und Regulierung als Chance: Thomas Jarzombek, Staatssekretär im Digitalministerium, erklärt den Plan für künstliche Intelligenz.;Thomas Jarzombek;Digital, Thomas Jarzombek, künstliche Intelligenz, Bundesregierung, Digitalisierung, Technologie, ChatGPT, OpenAI;2025-05-15T16:34:10+02:00;2025-05-15T16:34:10+02:00;Jakob von Lindern;;false
c1456bd761c35ac53ae17acc606ce83157128e8efcaa218a0ac1cdead9d83545;Steuerschätzung verschärft Haushaltssorgen bis 2029;https://www.zeit.de/news/2025-05/15/klingbeil-will-schnell-reform-der-schuldenbremse-anstossen;Hier finden Sie Informationen zu dem Thema „Finanzen“. Lesen Sie jetzt „Steuerschätzung verschärft Haushaltssorgen bis 2029“.;Finanzen;News, Finanzen, Lars Klingbeil, Deutscher Bundestag, SPD, Schuldenbremse, Koalitionsvertrag;2025-05-15T16:33:15+02:00;2025-05-15T16:33:15+02:00;;dpa;false
bb0aab87653d912dc8b4a95408332dc718dcdb2554ac2e135c9396345bacb2f9;Leiche treibt im Neckar - Schwierige Bergung;https://www.zeit.de/news/2025-05/15/leiche-treibt-im-neckar-schwierige-bergung;Hier finden Sie Informationen zu dem Thema „Einsatz“. Lesen Sie jetzt „Leiche treibt im Neckar - Schwierige Bergung“.;Einsatz;News, Einsatz, Neckar, Ludwigsburg, Polizei, Bergung, Einsatzkraft;2025-05-15T16:32:32+02:00;2025-05-15T16:32:32+02:00;;dpa Baden-Württemberg;false
27724d161741c4f20f51f86d6b78f27c277cfc7d850e3f40c510fe3853f1bad0;Wie die Bundesliga Rollstuhlfahrer ausschließt;https://www.zeit.de/sport/2025-05/barrierefreiheit-stadion-inklusion-bundesliga-borussia-dortmund;Nicht ein einziger Bundesligist hält sich ans Gesetz und bietet genug Plätze für Rollstuhlfahrer. Mancher Verein baut sogar welche ab – weil sie zu wenig Geld bringen.;Barrierefreiheit im Stadion;Sport, Barrierefreiheit im Stadion, Barrierefreiheit, Fußball-Bundesliga, Fußball, Uefa, Borussia Dortmund;2025-05-15T16:30:01+02:00;2025-05-15T16:30:01+02:00;Matthias Wolf;;false
7f890a04fc9815cceefa9720b9e82f6592e531cf1734c3dbddb0c11fa584e0c0;Fahrer von Unfall mit drei Toten hatte Alkohol im Blut;https://www.zeit.de/news/2025-05/15/fahrer-von-unfall-mit-drei-toten-hatte-alkohol-im-blut;Hier finden Sie Informationen zu dem Thema „Freiburg“. Lesen Sie jetzt „Fahrer von Unfall mit drei Toten hatte Alkohol im Blut“.;Freiburg;News, Freiburg, Freiburg, Polizei, Staatsanwaltschaft, Unfall, Alkohol, Fahrzeug;2025-05-15T16:29:02+02:00;2025-05-15T16:29:02+02:00;;dpa Baden-Württemberg;false
4a7f02ff4884724f5f75c790c99639163744598a42725ed449cb07c4f9410384;Dobrindt: 45 Prozent mehr Zurückweisungen an den Grenzen;https://www.zeit.de/news/2025-05/15/dobrindt-zahl-der-zurueckweisungen-um-45-prozent-gestiegen;Hier finden Sie Informationen zu dem Thema „Migrationspolitik“. Lesen Sie jetzt „Dobrindt: 45 Prozent mehr Zurückweisungen an den Grenzen“.;Migrationspolitik;News, Migrationspolitik, Alexander Dobrindt, CSU, Bundespolizei, Zurückweisung, Migrationspolitik, Grenzkontrolle, Grenze;2025-05-15T16:28:39+02:00;2025-05-15T16:28:39+02:00;;dpa Bayern;false
a261f16aa560257f9663937fae7f6bccc015ce4d1c972870577d3c33b430a5e0;Mann schwer verletzt - Tatverdächtiger in U-Haft;https://www.zeit.de/news/2025-05/15/mann-schwer-verletzt-tatverdaechtiger-in-u-haft;Hier finden Sie Informationen zu dem Thema „Kriminalität“. Lesen Sie jetzt „Mann schwer verletzt - Tatverdächtiger in U-Haft“.;Kriminalität;News, Kriminalität, Bad Langensalza, Polizei, Kriminalität;2025-05-15T16:27:13+02:00;2025-05-15T16:27:13+02:00;;dpa Thüringen;false
