Hash;Title;Link;Description;Category;KeyWords;Published;LastUpdated;Author;Source;Paywall
b46e854abd4720661060015d2c4e0fb717cd30800269fb1129ecac7678e61410;Nach tödlichem Streit in Neuss: Opfer identifiziert;https://www.zeit.de/news/2025-10/06/nach-toedlichem-streit-in-neuss-opfer-identifiziert;Hier finden Sie Informationen zu dem Thema „Mögliches Tötungsdelikt“. Lesen Sie jetzt „Nach tödlichem Streit in Neuss: Opfer identifiziert“.;Mögliches Tötungsdelikt;News, Mögliches Tötungsdelikt, Neuss, Polizei, Tötungsdelikt;2025-10-06T11:15:30+02:00;2025-10-06T11:15:30+02:00;;dpa Nordrhein-Westfalen;false
53b3a18b7168aec18a3534cbe08c2efc0a60876c46c99b7038251169d24a0cef;Amnestie: Kein einziges Springmesser in Berlin abgegeben;https://www.zeit.de/news/2025-10/06/amnestie-kein-einziges-springmesser-in-berlin-abgegeben;Hier finden Sie Informationen zu dem Thema „Verbotene Messer“. Lesen Sie jetzt „Amnestie: Kein einziges Springmesser in Berlin abgegeben“.;Verbotene Messer;News, Verbotene Messer, Berlin, Amnestie, Waffenbehörde;2025-10-06T11:05:55+02:00;2025-10-06T11:05:55+02:00;;dpa Berlin/Brandenburg;false
3d4434c9b7d239343cdf700724bdaa3a60870f10f4f49b0148f968e5087c9a20;0:4 nach Tiki-Taka-Versuch: Bitterer Abend für Henriksen;https://www.zeit.de/news/2025-10/06/0-4-nach-tiki-taka-versuch-bitterer-abend-fuer-henriksen;Hier finden Sie Informationen zu dem Thema „Fußball-Bundesliga“. Lesen Sie jetzt „0:4 nach Tiki-Taka-Versuch: Bitterer Abend für Henriksen“.;Fußball-Bundesliga;News, Fußball-Bundesliga, Bo Henriksen, Josep Guardiola, Fußball-Bundesliga;2025-10-06T10:54:51+02:00;2025-10-06T10:54:51+02:00;;dpa Rheinland-Pfalz/Saarland;false
910a7ed4aa62947ea6e3324ea968e092bc6d205ee283c96b9747cbffeaf735a2;Bundeswirtschaftsministerin fordert Ausbau der Drohnenproduktion;https://www.zeit.de/politik/deutschland/2025-10/drohnen-abwehr-deutschland-bedrohung-reiche-pistorius-verteidigung;Deutschland müsse ein führender Produktionsstandort für Drohnen werden, fordert Reiche. Pistorius will Drohnenvorfälle im Nationalen Sicherheitsrat besprechen.;Drohnenabwehr;Politik, Drohnenabwehr, Verteidigungspolitik, Katherina Reiche, Drohne, Rüstungsindustrie, Sicherheitspolitik, Boris Pistorius;2025-10-06T10:52:56+02:00;2025-10-06T10:52:56+02:00;Johanna Sethe;;false
2c2c695f3c4adb1cd0a38005c20a04ccc1befb15dbb1c147ffc04d618099fcd5;Bande soll Autoräder im Millionenwert gestohlen haben;https://www.zeit.de/news/2025-10/06/bande-soll-autoraeder-im-millionenwert-gestohlen-haben;Hier finden Sie Informationen zu dem Thema „Diebstahl“. Lesen Sie jetzt „Bande soll Autoräder im Millionenwert gestohlen haben“.;Diebstahl;News, Diebstahl, Mann, Heilbronn, Ludwigsburg, Kripo, Autorad, Millionenwert, Diebstahl;2025-10-06T10:49:21+02:00;2025-10-06T10:49:21+02:00;;dpa Baden-Württemberg;false
118a028f7dbdc068b72bce0da486019f3b07f972c51e1bb2980678463d2b43a0;Zahl offener Strafverfahren erreicht Höchstwert;https://www.zeit.de/gesellschaft/2025-10/statistische-bundesamt-offene-strafverfahren-rekordwert-cannabis;Bei den deutschen Staatsanwaltschaften ist die Zahl offener Strafverfahren 2024 auf 950.900 gestiegen. Aufgrund der Cannabislegalisierung sanken Betäubungsmittelverstöße.;Statistisches Bundesamt;Gesellschaft, Statistisches Bundesamt, Justiz, Kriminalität, Straftat, Statistisches Bundesamt, Steuerhinterziehung, Cannabis;2025-10-06T10:49:03+02:00;2025-10-06T10:49:03+02:00;maw;DIE ZEIT,        dpa,        AFP,        							maw;false
02cb62dddea6df3b590adabb8f14d934cb10422f4a0285a9b89990567148a574;Ungarin erhält Fanny Mendelssohn Kompositionspreis;https://www.zeit.de/news/2025-10/06/ungarin-erhaelt-fanny-mendelssohn-kompositionspreis;Hier finden Sie Informationen zu dem Thema „Musikwettbewerb“. Lesen Sie jetzt „Ungarin erhält Fanny Mendelssohn Kompositionspreis“.;Musikwettbewerb;News, Musikwettbewerb, Abigél Varga, Felix Mendelssohn Bartholdy, Kompositionspreis, Musikwettbewerb;2025-10-06T10:43:09+02:00;2025-10-06T10:43:09+02:00;;dpa Sachsen;false
0e64ef0db8a86ad2ff9c3510c9f5f913ff854f95bf273a79076d9f2f6e8c6f54;"Alba vor Champions League: ""An Rhythmus gewöhnen""";https://www.zeit.de/news/2025-10/06/alba-vor-champions-league-an-rhythmus-gewoehnen;"Hier finden Sie Informationen zu dem Thema „Basketball“. Lesen Sie jetzt „Alba vor Champions League: ""An Rhythmus gewöhnen""“.";Basketball;News, Basketball, Elon Chalon, Himar Ojeda, Real Madrid, BB, Alba Berlin, Champions League, Basketball, Rhythmus;2025-10-06T10:42:49+02:00;2025-10-06T10:42:49+02:00;;dpa Berlin/Brandenburg;false
ced7d8509199ae4328343476c24a3472fe6fd29d00b0d9a0d82a817fb22fca7e;Antisemitische Straftaten in Hessen nach Hamas-Überfall hoch;https://www.zeit.de/news/2025-10/06/antisemitische-straftaten-in-hessen-nach-hamas-ueberfall-hoch;Hier finden Sie Informationen zu dem Thema „Jahrestag Hamas-Überfall“. Lesen Sie jetzt „Antisemitische Straftaten in Hessen nach Hamas-Überfall hoch“.;Jahrestag Hamas-Überfall;News, Jahrestag Hamas-Überfall, Hessen, Hamas, CDU, Straftat, Jahrestag, Überfall, Terrororganisation, Belletristik;2025-10-06T10:41:54+02:00;2025-10-06T10:41:54+02:00;;dpa Hessen;false
abd5efb224d4d552ad1b2e4e8126ba1be02231bab742a43d9eebaf874e032544;"""Das Land versinkt im Chaos""";https://www.zeit.de/politik/ausland/2025-10/frankreich-regierungskrise-jerome-fourquet-meinungsforschung-emmanuel-macron;Kaum im Amt ist Macrons Premier zurückgetreten. Der Meinungsforscher Jérôme Fourquet erklärt die Lage anhand von zwei dominierenden Gefühlen in der Gesellschaft.;"Z+ (abopflichtiger Inhalt);
        
    Politische Krise in Frankreich";Politik, Politische Krise in Frankreich, Frankreich, Sébastien Lecornu, Emmanuel Macron, Marine Le Pen, Bruno Le Maire, Rassemblement National, Sozialpolitik;2025-10-06T10:39:24+02:00;2025-10-06T10:39:24+02:00;Annika Joeres;;false
d35fddb87cc7f7e3b4718e278cc1ca003fd3085ae3af010c85e079b968ac2ac1;Der Mythos Drohnenwall;https://www.zeit.de/politik/ausland/2025-10/verteidigungspolitik-drohnenwall-abwehrsystem-europa-russland;EU-Kommission und Industrie fordern einen Drohnenwall zum Schutz gegen Russland. Warum das keine Lösung ist und wie sich die EU-Staaten stattdessen verteidigen können.;Verteidigungspolitik;Politik, Verteidigungspolitik, Europäische Union, Drohne, Verteidigungspolitik, Militär, Rüstungsindustrie, Russland;2025-10-06T10:38:00+02:00;2025-10-06T10:38:00+02:00;Dr. Hauke Friederichs;;false
d7c1f6555a056cf4e0ff8ee9518af7592ebf8dff42c8196417510c80d6782850;Neues Trainingsgelände der Polizei in Albersdorf eröffnet;https://www.zeit.de/news/2025-10/06/neues-trainingsgelaende-der-polizei-in-albersdorf-eroeffnet;Hier finden Sie Informationen zu dem Thema „Eröffnung durch Ministerinnen“. Lesen Sie jetzt „Neues Trainingsgelände der Polizei in Albersdorf eröffnet“.;Eröffnung durch Ministerinnen;News, Eröffnung durch Ministerinnen, Sabine Sütterlin-Waack, Silke Schneider, Albersdorf, Schleswig-Holstein, Kreis Dithmarschen, Polizei, Innenministerium, CDU, Trainingsgelände, Raumschießanlage;2025-10-06T10:35:52+02:00;2025-10-06T10:35:52+02:00;;dpa Hamburg/Schleswig-Holstein;false
74bf842a253ee7ed0ea677117ab00fed885e2f41c9181b82f2975c2c3e4dd6ae;Jagdschloss brennt: Schaden in Millionenhöhe;https://www.zeit.de/news/2025-10/06/feuer-in-golfclub-jagdschloss-steht-in-vollbrand;Hier finden Sie Informationen zu dem Thema „Landkreis Regensburg“. Lesen Sie jetzt „Jagdschloss brennt: Schaden in Millionenhöhe“.;Landkreis Regensburg;News, Landkreis Regensburg, Landkreis Regensburg, Vollbrand, Golfclub, Jagdschloss;2025-10-06T10:31:22+02:00;2025-10-06T10:31:22+02:00;;dpa Bayern;false
f5a7b2e7f884a0b1e49c7e33b7a15476b203ac7c857b06da549a0d3f7edce473;IHK-Umfrage: Unternehmen geben Rheinland-Pfalz mäßige Note;https://www.zeit.de/news/2025-10/06/ihk-umfrage-unternehmen-geben-rheinland-pfalz-maessige-note;Hier finden Sie Informationen zu dem Thema „Mehr als 200 Betriebe“. Lesen Sie jetzt „IHK-Umfrage: Unternehmen geben Rheinland-Pfalz mäßige Note“.;Mehr als 200 Betriebe;News, Mehr als 200 Betriebe, Rheinland-Pfalz, IHK, Innovationsstandort, Industrieumfrage;2025-10-06T10:24:11+02:00;2025-10-06T10:24:11+02:00;;dpa Rheinland-Pfalz/Saarland;false
43d92d944a520639bdb67521fe6e5e08248582d0b57a6172f0c7f00b21a1534d;Mann entdeckt Unfall und rettet 87-Jährigen;https://www.zeit.de/news/2025-10/06/mann-entdeckt-zufaellig-unfall-und-rettet-87-jaehrigen;Hier finden Sie Informationen zu dem Thema „Verkehr“. Lesen Sie jetzt „Mann entdeckt Unfall und rettet 87-Jährigen“.;Verkehr;News, Verkehr, Unfall, Verkehr;2025-10-06T10:14:46+02:00;2025-10-06T10:14:46+02:00;;dpa Bayern;false
144526a25854cc9dc6150334f4e33517d42f3428a5719c2f409ae955e457c8ce;Mehr antisemitische Proteste seit Hamas-Angriff auf Israel;https://www.zeit.de/gesellschaft/2025-10/antisemitismus-proteste-juden-deutschland;Seit dem Terrorangriff auf Israel vor zwei Jahren und dem Krieg im Gazastreifen berichten Juden in Deutschland von mehr Antisemitismus. Es gibt zudem mehr Proteste.;Rias-Bericht;Gesellschaft, Rias-Bericht, Israel, Judentum, Antisemitismus, Protest, Diskriminierung, Statistik;2025-10-06T10:14:26+02:00;2025-10-06T10:14:26+02:00;akm;DIE ZEIT,        dpa,        							akm;false
eb979fded68d125ad147da62a9aa740cd0b3d2fff8aed41f7e2640c44c9bd26a;"""Nicht jede erste Stelle ist der Traumjob""";https://www.zeit.de/2025/42/sebastian-dettmers-stepstone-berufseinstieg-jobs-ki;Wer gerade ins Berufsleben einsteigen will, muss sich gegen die KI durchsetzen. Stepstone-Chef Sebastian Dettmers weiß, wie das gelingt und welche Branchen sicher sind.;"Z+ (abopflichtiger Inhalt);
        
    Sebastian Dettmers";Arbeit, Sebastian Dettmers, Arbeitsplatz, Berufseinstieg, Bewerbung, künstliche Intelligenz, Arbeitslosigkeit, Fachkräftemangel;2025-10-06T10:13:50+02:00;2025-10-06T10:13:50+02:00;Carla NeuhausZacharias Zacharakis;Aus der        ZEIT Nr. 42/2025;false
fb72b1218963b255ed9c02c111ccff8db981bbece0180ef76b45b39bb90999b6;"Eisbären Berlin: Mit ""Kampfgeist"" zurück in der Erfolgsspur";https://www.zeit.de/news/2025-10/06/eisbaeren-berlin-mit-kampfgeist-zurueck-in-der-erfolgsspur;"Hier finden Sie Informationen zu dem Thema „Deutsche Eishockey Liga“. Lesen Sie jetzt „Eisbären Berlin: Mit ""Kampfgeist"" zurück in der Erfolgsspur“.";Deutsche Eishockey Liga;News, Deutsche Eishockey Liga, Markus Vikingstad, Jake Hildebrand, Serge Aubin, Ingolstadt, Eisbären Berlin, ERC Ingolstadt, DEL, Erfolgsspur, Eishockey;2025-10-06T10:13:16+02:00;2025-10-06T10:13:16+02:00;;dpa Berlin/Brandenburg;false
30611f7c63fad5a0bc8dafd7b8fbe21e21f42be0cd3fcf71b2eba711ceb928a4;Opfer des 7. Oktober im Fokus einer Ausstellung;https://www.zeit.de/news/2025-10/06/opfer-des-7-oktober-im-fokus-einer-ausstellung;Hier finden Sie Informationen zu dem Thema „Nova Music Festival Exhibition“. Lesen Sie jetzt „Opfer des 7. Oktober im Fokus einer Ausstellung“.;Nova Music Festival Exhibition;News, Nova Music Festival Exhibition, Kai Wegner, Berlin, New York, Tempelhof, Israel, Gazastreifen, Hamas, CDU, Musikfestival, Auto;2025-10-06T10:09:09+02:00;2025-10-06T10:09:09+02:00;;dpa Berlin/Brandenburg;false
f9e2c6081b78f33c74cda57b31148059b79535385404b2b149224ff4232bd0e2;McLaren vor dem Knall? Teamduell spitzt sich nach Crash zu;https://www.zeit.de/news/2025-10/06/mclaren-vor-dem-knall-teamduell-spitzt-sich-nach-crash-zu;Hier finden Sie Informationen zu dem Thema „Formel 1“. Lesen Sie jetzt „McLaren vor dem Knall? Teamduell spitzt sich nach Crash zu“.;Formel 1;News, Formel 1, Andrea Stella, Oscar Piastri, Lando Norris, Zak Brown, Max Verstappen, Singapur, Monza, Formel-1, Formel 1, Red Bull;2025-10-06T10:00:03+02:00;2025-10-06T10:00:03+02:00;;dpa Sport;false
1a436bdb40da485655f599dac1c83ff0786a4f9e9221870a6ee265805a90b7ad;Frankreichs Premierminister Lecornu tritt zurück;https://www.zeit.de/news/2025-10/06/frankreichs-premierminister-lecornu-tritt-zurueck;Hier finden Sie Informationen zu dem Thema „Regierung“. Lesen Sie jetzt „Frankreichs Premierminister Lecornu tritt zurück“.;Regierung;News, Regierung, Frankreich, Premierminister;2025-10-06T09:57:04+02:00;2025-10-06T09:57:04+02:00;;dpa;false
b1fc2288261b1fee17f5c4ad2b814dd328fe1241b0f8e863d458d4466e874fab;Kontrollwoche in Sachsen-Anhalt - Finger weg vom Handy;https://www.zeit.de/news/2025-10/06/kontrollwoche-in-sachsen-anhalt-finger-weg-vom-handysa;Hier finden Sie Informationen zu dem Thema „Verkehr“. Lesen Sie jetzt „Kontrollwoche in Sachsen-Anhalt - Finger weg vom Handy“.;Verkehr;News, Verkehr, Sachsen-Anhalt, Focus, Innenministerium, Kontrollwoche, Verkehr;2025-10-06T09:52:23+02:00;2025-10-06T09:52:23+02:00;;dpa Sachsen;false
8ffc2be4b1c27f2b3f1e6b94a87b73d5928413369e7b39afc8f3abd2e1cd8722;Knapp 951.000 offene Verfahren bei Staatsanwaltschaften;https://www.zeit.de/news/2025-10/06/knapp-951-000-offene-verfahren-bei-staatsanwaltschaften;Hier finden Sie Informationen zu dem Thema „Statistisches Bundesamt“. Lesen Sie jetzt „Knapp 951.000 offene Verfahren bei Staatsanwaltschaften“.;Statistisches Bundesamt;News, Statistisches Bundesamt, Statistisches Bundesamt, Staatsanwaltschaft;2025-10-06T09:46:51+02:00;2025-10-06T09:46:51+02:00;;dpa;false
dfae650595d2bc48a661c0ed268037845f11ff7ebcd8fb42e7df820d4b7d7328;Sie nutzen noch Windows 10? Oje;https://www.zeit.de/digital/internet/2025-10/windows-10-updates-microsoft-computer-sicherheit;Millionen Rechner in Deutschland laufen mit Windows 10. Ab Mitte Oktober werden sie nicht mehr ohne weiteres mit Softwareupdates versorgt. Wir erklären, was zu tun ist. ;"Z+ (abopflichtiger Inhalt);
        
    Windows 10";Digital, Windows 10, Microsoft, Software, Computer, Big Tech;2025-10-06T09:41:06+02:00;2025-10-06T09:41:06+02:00;Jan Bojaryn;;false
e7b0a2625402cff19eef93613f748c35f6e4dc9a7103697418a67b74fa6c939f;Konservative könnten sich aus Frankreichs neuer Regierung zurückziehen;https://www.zeit.de/politik/ausland/2025-10/frankreich-regierung-krise-konsvervative;Die ersten Ministerposten sind gerade verteilt, schon droht Frankreich die nächste Regierungskrise. Die Républicains sind unzufrieden, erste Stimmen fordern den Rückzug.;Frankreich;Politik, Frankreich, Frankreich, Emmanuel Macron, Misstrauensvotum, Protest, Opposition, Europa, Sébastien Lecornu;2025-10-06T09:38:19+02:00;2025-10-06T09:38:19+02:00;yer;DIE ZEIT,        AFP,        dpa,        Reuters,        							yer;false
e31e422fc0bc9914be671d688ca3769b1a95b4e215c095960a2873ae9a72237f;"Mislintat nach BVB-Aus: ""Ruf nicht so schlecht wie sein Ruf""";https://www.zeit.de/news/2025-10/06/mislintat-nach-bvb-aus-ruf-nicht-so-schlecht-wie-sein-ruf;"Hier finden Sie Informationen zu dem Thema „Fußball-Bundesliga“. Lesen Sie jetzt „Mislintat nach BVB-Aus: ""Ruf nicht so schlecht wie sein Ruf""“.";Fußball-Bundesliga;News, Fußball-Bundesliga, Sebastian Kehl, Borussia Dortmund, Fußball-Bundesliga, Kritik;2025-10-06T09:36:31+02:00;2025-10-06T09:36:31+02:00;;dpa Nordrhein-Westfalen;false
e8ad15b5d8d5ec426b10e4e6731dd68ce0ba724aaa897f8882a69037e6410f43;"""Das sind richtig geile Autos!""";https://www.zeit.de/wirtschaft/2025-10/carsten-schneider-bundesumweltminister-klimaschutz-verbrenner-aus;Als Umweltminister will Carsten Schneider die Energiewende entpolarisieren. Bürger überzeuge man mit finanziellen Anreizen, statt mit dem erhobenen Zeigefinger.;Carsten Schneider;Wirtschaft, Carsten Schneider, Carsten Schneider, Klimaschutz, Energiewende, Elektroauto, Umweltpolitik, Klimawandel, Bundesregierung;2025-10-06T09:32:40+02:00;2025-10-06T09:32:40+02:00;Eva Ricarda LautschMarlies Uken;;false
6ef90b0497cac3d0f46909a3c2ee8412125913ea78946033346f02cde9b84518;US-Richterin untersagt Verlegung der Nationalgarde nach Oregon;https://www.zeit.de/politik/ausland/2025-10/us-richterin-blockade-verlegung-nationalgarde-kalifornien-oregon;Der US-Präsident beorderte Soldaten aus Kalifornien nach Oregon. Beide Bundesstaaten klagten dagegen. Es gebe keinen Aufstand in Portland, sagt die Gouverneurin.;Trumps Militäreinsatz;Politik, Trumps Militäreinsatz, Donald Trump, Militär, Portland, Oregon, USA, Justiz;2025-10-06T09:30:51+02:00;2025-10-06T09:30:51+02:00;eca;DIE ZEIT,        dpa,        Reuters,        							eca;false
7524ed47226b9269386a0780f2ec53f03122a769a1a0f0e296a3082fe34f7d9e;Forderung nach längeren Grünphasen für Fußgänger;https://www.zeit.de/news/2025-10/06/forderung-nach-laengeren-gruenphasen-fuer-fussgaenger;Hier finden Sie Informationen zu dem Thema „Verkehrssicherheit“. Lesen Sie jetzt „Forderung nach längeren Grünphasen für Fußgänger“.;Verkehrssicherheit;News, Verkehrssicherheit, Cornelia Lüddemann, Rüdiger Erben, Sachsen-Anhalt, Mitteldeutsche Zeitung, Grünphase, Verkehrssicherheit, Fußgängerampel;2025-10-06T09:25:25+02:00;2025-10-06T09:25:25+02:00;;dpa Sachsen;false
778d0fb462a889a9052e5922af98c3e692b77c09bd5c838f4abc9705fdd1130b;Mehr als 111.000 Euro Bargeld bei Fahrzeugkontrolle gefunden;https://www.zeit.de/news/2025-10/06/mehr-als-111-000-euro-bargeld-bei-fahrzeugkontrolle-gefunden;Hier finden Sie Informationen zu dem Thema „Verdacht der Geldwäsche“. Lesen Sie jetzt „Mehr als 111.000 Euro Bargeld bei Fahrzeugkontrolle gefunden“.;Verdacht der Geldwäsche;News, Verdacht der Geldwäsche, Potsdam, Fahrzeugkontrolle, Hauptzollamt, Bargeld, Geldwäsche, Auto, Geld;2025-10-06T09:20:24+02:00;2025-10-06T09:20:24+02:00;;dpa Berlin/Brandenburg;false
240ff6b10148029c701aea81623ee48b25bf0e7f188b27e10b27d162d72de817;Prozess: Mann aus Fenster gestoßen und vergewaltigt;https://www.zeit.de/news/2025-10/06/prozess-mann-aus-fenster-gestossen-und-vergewaltigt;Hier finden Sie Informationen zu dem Thema „Justiz“. Lesen Sie jetzt „Prozess: Mann aus Fenster gestoßen und vergewaltigt“.;Justiz;News, Justiz, Tübingen, Staatsanwaltschaft;2025-10-06T08:54:58+02:00;2025-10-06T08:54:58+02:00;;dpa Baden-Württemberg;false
9f1edf5200d792ec5ab48babc7973975af9cec52fd644234e2da37d91b7f5529;Wadephul will zu Gaza-Verhandlungen nach Ägypten reisen;https://www.zeit.de/politik/ausland/2025-10/gaza-frieden-israel-hamas-verhandlungen-aegypten-trump;In Scharm al-Scheich wollen Unterhändler über Trumps Friedensplan für Gaza verhandeln. Außenminister Wadephul kündigt Gespräche mit Ägyptens Außenminister in Kairo an.;Gaza-Krieg;Politik, Gaza-Krieg, Johann Wadephul, Ägypten, Israel, Gazastreifen, Donald Trump, Hamas, Waffenruhe;2025-10-06T08:39:28+02:00;2025-10-06T08:39:28+02:00;jse;DIE ZEIT,        AFP,        dpa,        							jse;false
f06d81f9707146fff49549b9104ec0e7d1da230f13f4add08f2ea6b951d94c5e;Gegen die Heldenpose;https://www.zeit.de/2025/42/einzelgaenger-im-himalaya-fritz-kolb-sozialist-bergsteiger;Fritz Kolbs Himalaya-Erinnerungen sind ein sozialistisches Gegenprogramm zu den NS‑Alpinisten.;"Z+ (abopflichtiger Inhalt);
        
    ""Einzelgänger im Himalaya""";"Kultur, ""Einzelgänger im Himalaya"", Buchrezension, Autor, Nationalsozialismus, Himalaya, Zweiter Weltkrieg, Geschichte";2025-10-06T08:33:04+02:00;2025-10-06T08:33:04+02:00;Thomas Mießgang;Aus der        ZEIT Nr. 42/2025;false
23c74edeef016a784f66868122c58d8b949fad45c033dca3cf3e567d7edc840d;Heute kein König;https://www.zeit.de/2025/42/die-deutsche-weinkoenigin-mann-levin-mckenzie-rheinhessen;Auch die Weinkönigin geht mit der Zeit, also wurde ihre Wahl geöffnet. Haben Männer das Zeug zur Majestät? Unterwegs mit zwei Bewerbern, die es wirklich wissen wollen.;"Z+ (abopflichtiger Inhalt);
        
    Die Deutsche Weinkönigin";Entdecken, Die Deutsche Weinkönigin, Gleichstellung, Getränk, Alkohol, Mann, Pfalz;2025-10-06T08:30:27+02:00;2025-10-06T08:30:27+02:00;Karin Ceballos Betancur;Aus der        ZEIT Nr. 42/2025;false
141426bba233a42276c4ec3b45af604bce2d7146a81a312ad64a4723bfdb5a33;Klingbeil will Kfz-Steuerbefreiung für E-Autos verlängern;https://www.zeit.de/mobilitaet/2025-10/elektromobilitaet-lars-klingbeil-kfz-steuer;Wie lässt sich die deutsche Autobranche stärken? Darüber beraten Bund und Gewerkschaften in dieser Woche. Finanzminister Klingbeil setzt auf Elektromobilität.;Elektromobilität;Mobilitaet, Elektromobilität, Elektroauto, Autoindustrie, Lars Klingbeil, Bundesregierung, Steuer, Nachhaltigkeit;2025-10-06T08:30:20+02:00;2025-10-06T08:30:20+02:00;akm;DIE ZEIT,        dpa,        							akm;false
dc1191a89003d76f74d88dfa3e91bf85462aea18baf8dc11eeeecf4cd2f15e44;Wenn der Nobelpreis Forschung ehrt, die das Schlimmste möglich macht;https://www.zeit.de/wissen/2025-10/nobelpreise-die-schattenseiten-grosser-entdeckungen;Kernspaltung, DDT, Psychochirurgie: Manch nobelpreisgekrönte Erkenntnis entpuppte sich als Gefahr für die Menschheit. Welche Verantwortung tragen ihre Entdecker daran?;Nobelpreise;Wissen, Nobelpreise, Nobelpreis, Alfred Nobel, Otto Hahn, Grundlagenforschung, Gentechnik, Erfindung;2025-10-06T08:14:56+02:00;2025-10-06T08:14:56+02:00;Katharina Menne;Erschienen bei spektrum.de;false
12e4ecd949b73e695c3bf9abcdec61e9d83b967717542abb067354e5d2c6b697;A100: Mehrheit der Berliner spricht sich für Weiterbau aus;https://www.zeit.de/news/2025-10/06/a100-mehrheit-der-berliner-spricht-sich-fuer-weiterbau-aus;Hier finden Sie Informationen zu dem Thema „Stadtautobahn“. Lesen Sie jetzt „A100: Mehrheit der Berliner spricht sich für Weiterbau aus“.;Stadtautobahn;News, Stadtautobahn, Lichtenberg, Tagesspiegel, Civey, Weiterbau, Stadtautobahn;2025-10-06T08:09:27+02:00;2025-10-06T08:09:27+02:00;;dpa Berlin/Brandenburg;false
1713fdb68095d9bb26d9daabbfe73eba99dc9986650605a5e9b403ad70e21436;"""Monster""-Star Hunnam ringt mit Serienmörder-Rolle";https://www.zeit.de/news/2025-10/06/monster-star-hunnam-ringt-mit-serienmoerder-rolle;"Hier finden Sie Informationen zu dem Thema „True Crime“. Lesen Sie jetzt „""Monster""-Star Hunnam ringt mit Serienmörder-Rolle“.";True Crime;News, True Crime, Charlie Hunnam, Ed Gein, Monster Worldwide, Netflix, Deutsche Presse-Agentur;2025-10-06T08:00:22+02:00;2025-10-06T08:00:22+02:00;;dpa;false
04343151192ef0e487677f48a56dd0e5cf4b98473fc9fda427abfde9b7062d96;Großbrand am Jagdschloss Göhrde ‒ halbe Million Euro Schaden;https://www.zeit.de/news/2025-10/06/grossbrand-am-jagdschloss-goehrde-halbe-million-euro-schaden;Hier finden Sie Informationen zu dem Thema „Brände“. Lesen Sie jetzt „Großbrand am Jagdschloss Göhrde ‒ halbe Million Euro Schaden“.;Brände;News, Brände, Göhrde, Landkreis Lüchow-Dannenberg, Polizei, Großbrand, Jagdschloss, Brand;2025-10-06T07:57:08+02:00;2025-10-06T07:57:08+02:00;;dpa Niedersachsen;false
1516fb069ecfaa840f35cae35a7a1de146c770eae23a45714746a22bf9c9a0f5;17-Jähriger flieht mit Traktor vor Polizei;https://www.zeit.de/news/2025-10/06/17-jaehriger-flieht-mit-traktor-vor-polizei;Hier finden Sie Informationen zu dem Thema „Fahrerflucht“. Lesen Sie jetzt „17-Jähriger flieht mit Traktor vor Polizei“.;Fahrerflucht;News, Fahrerflucht, Landkreis Sömmerda, Polizei, Traktor, Fahrerflucht;2025-10-06T07:47:27+02:00;2025-10-06T07:47:27+02:00;;dpa Thüringen;false
4029a8338e1d5e88f123ad0858da86ec32d12b104202c9f5417ac07adc8a33fe;Jagdverband appelliert: Jeden Wildunfall der Polizei melden;https://www.zeit.de/news/2025-10/06/jagdverband-appelliert-jeden-wildunfall-der-polizei-melden;Hier finden Sie Informationen zu dem Thema „Verkehr“. Lesen Sie jetzt „Jagdverband appelliert: Jeden Wildunfall der Polizei melden“.;Verkehr;News, Verkehr, Polizei, Deutscher Jagdverband, Wildunfall, Jagdverband, Verkehr, Tiere;2025-10-06T07:40:31+02:00;2025-10-06T07:40:31+02:00;;dpa;false
cb72cd2488a8a824411cc7ad319ea1ac3d4be8558549063a7204cdc158e67b69;Dieses Schulfach hat Schauspieler Max von Thun geliebt;https://www.zeit.de/news/2025-10/06/dieses-schulfach-hat-schauspieler-max-von-thun-geliebt;Hier finden Sie Informationen zu dem Thema „Promis“. Lesen Sie jetzt „Dieses Schulfach hat Schauspieler Max von Thun geliebt“.;Promis;News, Promis, Max von Thun, Schulfach;2025-10-06T07:40:08+02:00;2025-10-06T07:40:08+02:00;;dpa;false
ce0ecd5d5f8102b6ee13267475c69accb9370f69937419be69054551af0e61b8;Sturm in Sachsen, Sachsen-Anhalt und Thüringen erwartet;https://www.zeit.de/news/2025-10/06/sturm-in-sachsen-sachsen-anhalt-und-thueringen-erwartet;Hier finden Sie Informationen zu dem Thema „Wetter“. Lesen Sie jetzt „Sturm in Sachsen, Sachsen-Anhalt und Thüringen erwartet“.;Wetter;News, Wetter, Sachsen, Thüringen, Sachsen-Anhalt, Sturmtief, Wetter;2025-10-06T07:31:41+02:00;2025-10-06T07:31:41+02:00;;dpa Sachsen;false
c151c484098ef9d58b4eb97a69fb78415d49b9eba2fc14a476da5145d94d5f0c;Buenos Díaz, Bundesliga!;https://www.zeit.de/sport/2025-10/bundesliga-rueckschau-luis-diaz;Ein Kolumbianer sagt guten Morgen. Neymar spielt seit Kurzem in Köln. Und Sandro Wagner grüßt herzlichst die Familie. Alles Wichtige vom 6. Spieltag;Bundesligarückschau;Sport, Bundesligarückschau, Fußball, Fußball-Bundesliga, FC Bayern München, Borussia Dortmund, 1. FC Köln, VfL Wolfsburg, Bayer 04 Leverkusen, Eintracht Frankfurt, FC Augsburg, RB Leipzig;2025-10-06T07:29:44+02:00;2025-10-06T07:29:44+02:00;Christian Spiller;;false
4c6516bb2b133fb01822e9d54d0d8eef00d92fedcf1b2326c89ac6065df5878a;Feuer in Autowerkstatt - Wohnhaus vor Flammen gerettet;https://www.zeit.de/news/2025-10/06/feuer-in-autowerkstatt-wohnhaus-vor-flammen-gerettet;Hier finden Sie Informationen zu dem Thema „Ermittlungen laufen“. Lesen Sie jetzt „Feuer in Autowerkstatt - Wohnhaus vor Flammen gerettet“.;Ermittlungen laufen;News, Ermittlungen laufen, Autowerkstatt, Ermittlung;2025-10-06T07:29:34+02:00;2025-10-06T07:29:34+02:00;;dpa Hessen;false
