Hash;Title;Link;Description;Category;KeyWords;Published;LastUpdated;Author;Source;Paywall
9a03bc97905d3407f977f6b7abfcf58e6c4371941591b5e641b3cbc284711930;Zahl der Privatinsolvenzen nimmt deutlich zu;https://www.zeit.de/wirtschaft/2025-02/lebenshaltungskosten-privatinsolvenz-inflation-energiepreise-rente;Anhaltend hohe Energie- und Lebensmittelpreise setzen Privathaushalte unter Druck: Fast 100.000 haben 2024 Insolvenz angemeldet. Besonders betroffen sind ältere Menschen.;Lebenshaltungskosten;Wirtschaft, Lebenshaltungskosten, Frank Schlein, Privatinsolvenz, Lebensmittelpreis, Privathaushalt, Lebenshaltungskosten, Insolvenz, Rente;2025-02-28T09:48:34+01:00;2025-02-28T09:48:34+01:00;jsp;ZEIT ONLINE,        AFP,        							jsp;false
c84c504c9c3c77bc3ccc2065b0261fbd3797ffa849ea0bb2fd8207d134fd6c48;Zahl der Arbeitslosen in Hamburg gesunken;https://www.zeit.de/news/2025-02/28/zahl-der-arbeitslosen-in-hamburg-gesunken;Hier finden Sie Informationen zu dem Thema „Arbeitsmarkt“. Lesen Sie jetzt „Zahl der Arbeitslosen in Hamburg gesunken“.;Arbeitsmarkt;News, Arbeitsmarkt, Hamburg;2025-02-28T10:00:36+01:00;2025-02-28T10:00:36+01:00;;dpa Hamburg/Schleswig-Holstein;false
58ea2e80619cf16919e0b678308aca19d090cd57f9f9f2d856091ca13dd50379;Arbeitslosenquote in MV unverändert bei 8,6 Prozent;https://www.zeit.de/news/2025-02/28/arbeitslosenquote-in-mv-unveraendert-bei-8-6-prozent;Hier finden Sie Informationen zu dem Thema „Arbeitsmarkt“. Lesen Sie jetzt „Arbeitslosenquote in MV unverändert bei 8,6 Prozent“.;Arbeitsmarkt;News, Arbeitsmarkt, Mecklenburg-Vorpommern, Regionaldirektion, Arbeitslosenquote;2025-02-28T10:00:36+01:00;2025-02-28T10:00:36+01:00;;dpa Mecklenburg-Vorpommern;false
4814d81988d8733ed6d23210cc55ad3bfc2e74e97ac21c311c23a405a1c57f3b;Arbeitslosigkeit in Bremen steigt leicht an;https://www.zeit.de/news/2025-02/28/arbeitslosigkeit-in-bremen-steigt-leicht-an;Hier finden Sie Informationen zu dem Thema „Arbeitsmarkt“. Lesen Sie jetzt „Arbeitslosigkeit in Bremen steigt leicht an“.;Arbeitsmarkt;News, Arbeitsmarkt, Bremen, Arbeitslosigkeit;2025-02-28T10:00:34+01:00;2025-02-28T10:00:34+01:00;;dpa Niedersachsen;false
06865d63c87a2df7ec96bd3a562739d1a8236b992d556f201d51f119c50569bb;Zukunft mit Zumutungen;https://www.zeit.de/wirtschaft/2025-03/transformation-bundesregierung-wirtschaft-investitionen-unternehmen;Die neue Regierung braucht den Mut zu einem grundlegenden Kurswechsel. Dieser wird vielen Menschen Entbehrungen abverlangen. Diskutieren Sie hier mit unserem Gastautor.;Transformation;Wirtschaft, Transformation, Bundesregierung, Friedrich Merz, Bundestagswahlkampf, Koalitionsvertrag, Digitalisierung, Rente;2025-02-28T09:59:59+01:00;2025-02-28T09:59:59+01:00;Marcel Fratzscher;;false
90dd9825c5b19a4c36d7fa34cb81ccd880fefdb13bee9cc36704f10c2064b8d5;Arbeitslosigkeit geht in Deutschland minimal zurück;https://www.zeit.de/news/2025-02/28/arbeitslosigkeit-im-februar-leicht-gesunken;Hier finden Sie Informationen zu dem Thema „Arbeitsmarkt“. Lesen Sie jetzt „Arbeitslosigkeit geht in Deutschland minimal zurück“.;Arbeitsmarkt;News, Arbeitsmarkt, Arbeitslosigkeit;2025-02-28T09:59:03+01:00;2025-02-28T09:59:03+01:00;;dpa;false
fa5e2f207c5152cef245b93b63cb096a3da4460c966056e206d42cc5466ba81d;Tariflöhne seit 2020 erstmals stärker gestiegen als Verbraucherpreise;https://www.zeit.de/wirtschaft/unternehmen/2025-02/tarifloehne-erstmals-gestiegen-seit-2020;Die tariflichen Monatsverdienste und Sonderzahlungen haben sich 2024 im Schnitt um 4,8 Prozent erhöht. Gering Verdienende profitierten dabei am meisten von Sonderprämien.;Statistisches Bundesamt;Arbeit, Statistisches Bundesamt, Tariflohn, Monatsverdienst, Sonderzahlung, Verbraucherpreis, Sonderprämie, Coronavirus;2025-02-28T09:58:30+01:00;2025-02-28T09:58:30+01:00;bam;ZEIT ONLINE,        Reuters,        AFP,        							bam;false
511b4f59bbd2f32ac1af552d2c6381ebe82521b153306adbcfbe2af3ce0983b2;Arbeitslosigkeit in Niedersachsen fast unverändert;https://www.zeit.de/news/2025-02/28/arbeitslosigkeit-in-niedersachsen-fast-unveraendert;Hier finden Sie Informationen zu dem Thema „Arbeitsmarkt“. Lesen Sie jetzt „Arbeitslosigkeit in Niedersachsen fast unverändert“.;Arbeitsmarkt;News, Arbeitsmarkt, Niedersachsen, Arbeitslosigkeit, Regionaldirektion;2025-02-28T09:55:41+01:00;2025-02-28T09:55:41+01:00;;dpa Niedersachsen;false
674f98ebea0f2112bc27b31d922ae1413b58816b18648b0d5322bbb2e8d5ce6b;Zahl der Arbeitslosen auf hohem Niveau;https://www.zeit.de/news/2025-02/28/zahl-der-arbeitslosen-auf-hohem-niveau;Hier finden Sie Informationen zu dem Thema „Arbeitslosigkeit in Bayern“. Lesen Sie jetzt „Zahl der Arbeitslosen auf hohem Niveau“.;Arbeitslosigkeit in Bayern;News, Arbeitslosigkeit in Bayern, Bayern;2025-02-28T09:55:40+01:00;2025-02-28T09:55:40+01:00;;dpa Bayern;false
343cd20978c3dea764c965b430179d7495879e95f21cdf380dcc3eff5b235a5a;Zahl der Arbeitslosen in Brandenburg ist stabil;https://www.zeit.de/news/2025-02/28/zahl-der-arbeitslosen-in-brandenburg-ist-stabil;Hier finden Sie Informationen zu dem Thema „Arbeitsmarkt“. Lesen Sie jetzt „Zahl der Arbeitslosen in Brandenburg ist stabil“.;Arbeitsmarkt;News, Arbeitsmarkt, Brandenburg;2025-02-28T09:55:40+01:00;2025-02-28T09:55:40+01:00;;dpa Berlin/Brandenburg;false
25f734e8b25922c7f77936a96992a772c88656bf17f95a97a2d484c8355f6ed7;Zahl der Arbeitslosen in Berlin stabil über 10 Prozent;https://www.zeit.de/news/2025-02/28/zahl-der-arbeitslosen-in-berlin-stabil-ueber-10-prozent;Hier finden Sie Informationen zu dem Thema „Arbeitsmarkt“. Lesen Sie jetzt „Zahl der Arbeitslosen in Berlin stabil über 10 Prozent“.;Arbeitsmarkt;News, Arbeitsmarkt, Berlin, Arbeitslosenquote;2025-02-28T09:55:39+01:00;2025-02-28T09:55:39+01:00;;dpa Berlin/Brandenburg;false
033c3bdc28bd33270ac542e6e3cfe542bd8e67b93a100c6017ec23a442900201;Etwas mehr Arbeitslose in Thüringen im Februar;https://www.zeit.de/news/2025-02/28/etwas-mehr-arbeitslose-in-thueringen-im-februar;Hier finden Sie Informationen zu dem Thema „Arbeitslosigkeit“. Lesen Sie jetzt „Etwas mehr Arbeitslose in Thüringen im Februar“.;Arbeitslosigkeit;News, Arbeitslosigkeit, Thüringen;2025-02-28T09:55:38+01:00;2025-02-28T09:55:38+01:00;;dpa Thüringen;false
12e8d45b8f3972dd93b2cf8714350a2dfbb61bf8d5f395783435a84a71f835fb;Mehr als 150.000 Menschen arbeitslos;https://www.zeit.de/news/2025-02/28/mehr-als-150-000-menschen-arbeitslos;Hier finden Sie Informationen zu dem Thema „Arbeitslosigkeit“. Lesen Sie jetzt „Mehr als 150.000 Menschen arbeitslos“.;Arbeitslosigkeit;News, Arbeitslosigkeit, Sachsen, Regionaldirektion, Arbeitslosigkeit;2025-02-28T09:55:38+01:00;2025-02-28T09:55:38+01:00;;dpa Sachsen;false
cae22a22531c51bce9555a7f9f67dcbf73c0a8267de3c1f23bf1b147b9dd8b8f;Leichter Rückgang der Arbeitslosigkeit im Februar;https://www.zeit.de/news/2025-02/28/leichter-rueckgang-der-arbeitslosigkeit-im-februar;Hier finden Sie Informationen zu dem Thema „Erwerbslosigkeit“. Lesen Sie jetzt „Leichter Rückgang der Arbeitslosigkeit im Februar“.;Erwerbslosigkeit;News, Erwerbslosigkeit, Mann, Saarbrücken, Rheinland-Pfalz, Bundesagentur für Arbeit, Erwerbslosigkeit, Rückgang, Regionaldirektion, Arbeitslosenquote;2025-02-28T09:55:37+01:00;2025-02-28T09:55:37+01:00;;dpa Rheinland-Pfalz/Saarland;false
d89ceb671f08a62b382d43be2c53274674349dc0ab463a191b9b4d888daec0a5;Etwas weniger Arbeitslose an der Saar;https://www.zeit.de/news/2025-02/28/etwas-weniger-arbeitslose-an-der-saar;Hier finden Sie Informationen zu dem Thema „Arbeitsmarkt“. Lesen Sie jetzt „Etwas weniger Arbeitslose an der Saar“.;Arbeitsmarkt;News, Arbeitsmarkt, Mann, Saarland, Saarbrücken, Bundesagentur für Arbeit, Arbeitslosenquote;2025-02-28T09:55:37+01:00;2025-02-28T09:55:37+01:00;;dpa Rheinland-Pfalz/Saarland;false
3ef24d696b29078a9e55aa009dd608feab15c573abe178e0a19e366f02527b40;Kaum Bewegung am Arbeitsmarkt in Sachsen-Anhalt;https://www.zeit.de/news/2025-02/28/kaum-bewegung-am-arbeitsmarkt-in-sachsen-anhalt;Hier finden Sie Informationen zu dem Thema „Arbeitslosenquote“. Lesen Sie jetzt „Kaum Bewegung am Arbeitsmarkt in Sachsen-Anhalt“.;Arbeitslosenquote;News, Arbeitslosenquote, Sachsen-Anhalt, Regionaldirektion, Arbeitslosenquote;2025-02-28T09:55:37+01:00;2025-02-28T09:55:37+01:00;;dpa Sachsen;false
c55f8f8bb38046723849250bd3e1123638397c087e1da0c930b76288aaa9d475;Zahl der Arbeitslosen in Nordrhein-Westfalen steigt leicht;https://www.zeit.de/news/2025-02/28/zahl-der-arbeitslosen-in-nordrhein-westfalen-steigt-leicht;Hier finden Sie Informationen zu dem Thema „Arbeitsmarkt“. Lesen Sie jetzt „Zahl der Arbeitslosen in Nordrhein-Westfalen steigt leicht“.;Arbeitsmarkt;News, Arbeitsmarkt, Nordrhein-Westfalen;2025-02-28T09:55:36+01:00;2025-02-28T09:55:36+01:00;;dpa Nordrhein-Westfalen;false
ff17410a99a6f1b8a0ccd11e23e801e2e9b86bee748163707c8df6e620b45a94;Arbeitslosenzahl nimmt im Februar leicht ab;https://www.zeit.de/news/2025-02/28/arbeitslosenzahl-nimmt-im-februar-leicht-ab;Hier finden Sie Informationen zu dem Thema „Arbeitsmarkt“. Lesen Sie jetzt „Arbeitslosenzahl nimmt im Februar leicht ab“.;Arbeitsmarkt;News, Arbeitsmarkt, Stuttgart, Baden-Württemberg, Bundesagentur für Arbeit, Arbeitslosenzahl, Regionaldirektion, Arbeitslosenquote;2025-02-28T09:55:36+01:00;2025-02-28T09:55:36+01:00;;dpa Baden-Württemberg;false
47af2b0e87be4ee6642cbc4793c97ffd808bb9d29eefa517478744f5abc4ec77;Die wichtigsten Entscheidungen Donald Trumps im Überblick;https://www.zeit.de/politik/ausland/2025-02/regierung-donald-trump-entscheidungen-dekrete-usa;Hunderte Meteorologen, die für Gefahrenwarnungen zuständig sind, wurden entlassen. Auch in der US-Umweltbehörde wird gekürzt. Unsere Chronik von Trumps Entscheidungen;Entscheidungen der US-Regierung;Politik, Entscheidungen der US-Regierung, Donald Trump, USA, DOGE, US-Regierung, Republikaner (USA), Verfassung;2025-02-28T09:52:46+01:00;2025-02-28T09:52:46+01:00;mgakjjjsprecakmiisdiyf;ZEIT ONLINE,        dpa,        AFP,        Reuters,        KNA,        epd,        							mga					,        							kj					,        							jj					,        							spr					,        							eca					,        							kmi					,        							isd					,        							iyf;false
70e5a812daa33aa051216422bceff5d5306634b08f5c721373938bec7de986cc;Fahrer flieht vor Polizeikontrolle und überschlägt sich;https://www.zeit.de/news/2025-02/28/fahrer-flieht-vor-polizeikontrolle-und-ueberschlaegt-sich;Hier finden Sie Informationen zu dem Thema „Kriminalität“. Lesen Sie jetzt „Fahrer flieht vor Polizeikontrolle und überschlägt sich“.;Kriminalität;News, Kriminalität, Bundespolizei, Polizei, Polizeikontrolle, Kriminalität, Auto;2025-02-28T09:48:09+01:00;2025-02-28T09:48:09+01:00;;dpa Berlin/Brandenburg;false
4b77b6bd5c2565978d18f1d61b79e844084447468ee4b1c96dc4948c859562c9;Bilder des Tages;https://www.zeit.de/news/2025-02/28/bilder-des-tages;Hier finden Sie Informationen zu dem Thema „Fotografie“. Lesen Sie jetzt „Bilder des Tages“.;Fotografie;News, Fotografie, News;2025-02-28T09:40:53+01:00;2025-02-28T09:40:53+01:00;;dpa;false
befd6189cc768ff681b6760324186507efc1a61272f8995a61cd24559631ad35;Lastwagenfahrer mit 2,59 Promille auf A1 unterwegs;https://www.zeit.de/news/2025-02/28/lastwagenfahrer-mit-2-59-promille-auf-a1-unterwegs;Hier finden Sie Informationen zu dem Thema „Auf der Autobahn“. Lesen Sie jetzt „Lastwagenfahrer mit 2,59 Promille auf A1 unterwegs“.;Auf der Autobahn;News, Auf der Autobahn, Autobahn;2025-02-28T09:40:53+01:00;2025-02-28T09:40:53+01:00;;dpa Hamburg/Schleswig-Holstein;false
fb7434adf105e0d7202056739c33816cf937ff918f0796deca3440c21b96f16e;US-Regierung entlässt hunderte Meteorologen aus Wetterbehörde;https://www.zeit.de/politik/ausland/2025-02/usa-noaa-entlassungen-donald-trump-wetterdienst;Etwa zehn Prozent der Belegschaft der US-Wetter- und Ozeanographiebehörde Noaa sind gefeuert worden. Sie waren unter anderem zuständig für Gefahrenwarnungen.;Wetter- und Ozeanographiebehörde Noaa;Politik, Wetter- und Ozeanographiebehörde Noaa, Ozeanographiebehörde, Wetterbehörde, Gefahrenwarnung, Belegschaft, Wetter;2025-02-28T09:34:57+01:00;2025-02-28T09:34:57+01:00;kzi;ZEIT ONLINE,        AP,        							kzi;false
25de11f204cd492129cf4140bce52264671563ec09c6f93ed71dfdebda989277;Ordnungsgeld wegen weißer Substanz im Gesicht;https://www.zeit.de/news/2025-02/28/ordnungsgeld-wegen-weisser-substanz-im-gesicht;Hier finden Sie Informationen zu dem Thema „Eklat“. Lesen Sie jetzt „Ordnungsgeld wegen weißer Substanz im Gesicht“.;Eklat;News, Eklat, Oskar Schindler, Johannes Marxen, Astrid Wallmann, Michel Friedman, Wiesbaden, Alternative für Deutschland, CDU, Ordnungsgeld, Eklat, Gedenkstunde;2025-02-28T09:34:25+01:00;2025-02-28T09:34:25+01:00;;dpa Hessen;false
266d1fc314ad03113fe0d74f05a918a7cbdc395a2b896275b1404cf4793dccc9;Ein blauer Geist soll auf dem Mond landen;https://www.zeit.de/news/2025-02/28/ein-blauer-geist-soll-auf-dem-mond-landen;Hier finden Sie Informationen zu dem Thema „Raumfahrt“. Lesen Sie jetzt „Ein blauer Geist soll auf dem Mond landen“.;Raumfahrt;News, Raumfahrt, Elon Musk, Ghost Rider, Cape Canaveral, Florida, Firefly Aerospace, NASA, SpaceX;2025-02-28T09:32:56+01:00;2025-02-28T09:32:56+01:00;;dpa;false
dc4e441566089bc56cbe9b3609b6f6d2a6f957dd60cecb75c76b7b10f39b2f4f;Wenn die Zuckerwatte hart wird;https://www.zeit.de/kultur/musik/2025-02/darkside-nothing-album-rezension-nicolas-jaar;"Darkside ist eine Supergroup der elektronischen und experimentellen Musik. Ihr Album ""Nothing"" fasst die Gegenwart ohne politische Slogans: ein Lehrstück über die Leere.";"Z+ (abopflichtiger Inhalt);
        
    ""Nothing"" von Darkside";"Kultur, ""Nothing"" von Darkside, Musik, elektronische Musik, Band, Album, Musiker, Musikindustrie";2025-02-28T09:30:26+01:00;2025-02-28T09:30:26+01:00;Tobi Müller;;false
04a275ea60afedab6cdb95352ff88873f58415579a78886c2b3a5b880965e70e;Fünf Feuerwehrleute bei Einsatz verletzt;https://www.zeit.de/news/2025-02/28/fuenf-feuerwehrleute-bei-einsatz-verletzt;Hier finden Sie Informationen zu dem Thema „Brennende Mülltonnen“. Lesen Sie jetzt „Fünf Feuerwehrleute bei Einsatz verletzt“.;Brennende Mülltonnen;News, Brennende Mülltonnen, Feuerwehr, Mülltonne, Hausdurchgang, Lösche;2025-02-28T09:30:00+01:00;2025-02-28T09:30:00+01:00;;dpa Hessen;false
24a66fb6d9d33e5be4ceceb4acbc10b6f19ae09a3417b78c9279d9d12f0334d1;Ältere besonders betroffen: Deutlich mehr Privatinsolvenzen;https://www.zeit.de/news/2025-02/28/aeltere-besonders-betroffen-deutlich-mehr-privatinsolvenzen;Hier finden Sie Informationen zu dem Thema „Lebenskosten steigen“. Lesen Sie jetzt „Ältere besonders betroffen: Deutlich mehr Privatinsolvenzen“.;Lebenskosten steigen;News, Lebenskosten steigen, Frank Schlein, Privatinsolvenz, Lebenskosten, Privatpleite;2025-02-28T09:23:01+01:00;2025-02-28T09:23:01+01:00;;dpa;false
2204c17af7b650e978f4d8abc4843e6277b715523026a2f125a598cf58c149ed;Georg Milbradt warnt vor wachsender Bedrohung durch Russland;https://www.zeit.de/news/2025-02/28/georg-milbradt-warnt-vor-wachsender-bedrohung-durch-russland;Hier finden Sie Informationen zu dem Thema „Konflikte“. Lesen Sie jetzt „Georg Milbradt warnt vor wachsender Bedrohung durch Russland“.;Konflikte;News, Konflikte, Georg Milbradt, Russland, Sachsen, Europa, MDR, CDU, Bedrohung, Krieg in der Ukraine;2025-02-28T09:19:18+01:00;2025-02-28T09:19:18+01:00;;dpa Sachsen;false
24e7b4a58034e37c074d074c2e35c2d9330df95b7b1629a727888b7d2be675f0;Antidiskriminierungsbüro: Fälle um elf Prozent gestiegen;https://www.zeit.de/news/2025-02/28/antidiskriminierungsbuero-faelle-um-elf-prozent-gestiegen;Hier finden Sie Informationen zu dem Thema „Ungleichbehandlung“. Lesen Sie jetzt „Antidiskriminierungsbüro: Fälle um elf Prozent gestiegen“.;Ungleichbehandlung;News, Ungleichbehandlung, Jan Diebold, Sachsen, Antidiskriminierungsbüro, Ungleichbehandlung, Diskriminierungsfall;2025-02-28T09:17:21+01:00;2025-02-28T09:17:21+01:00;;dpa Sachsen;false
b1f7925d2d6b369f1fc8db0ef65ec7a58115aaae6ac94d3ad5f03f4e99f04c73;Angriff mit Messer - Tatverdächtiger festgenommen;https://www.zeit.de/news/2025-02/28/angriff-mit-messer-tatverdaechtiger-festgenommen;Hier finden Sie Informationen zu dem Thema „Kriminalität“. Lesen Sie jetzt „Angriff mit Messer - Tatverdächtiger festgenommen“.;Kriminalität;News, Kriminalität, Polizei, Angriff, Messerangriff, Streife, Kriminalität;2025-02-28T09:15:33+01:00;2025-02-28T09:15:33+01:00;;dpa Hamburg/Schleswig-Holstein;false
a2bd3839dd77ebe57e21f96fce68adb3786662ae1f3766829f5de7c2ea6aba9e;Ukraine erobern Gelände bei Pokrowsk zurück;https://www.zeit.de/politik/ausland/karte-ukraine-krieg-russland-frontverlauf-truppenbewegungen;Ukrainische Truppen können verlorene Posten bei Pokrowsk zurückgewinnen. Im Süden der Region Donezk besetzten russische Truppen offenbar eine Siedlung.;Ukrainekarte aktuell;Politik, Ukrainekarte aktuell, Krieg in der Ukraine, Russland, Militär, Donezk, Luhansk, Kursk, Charkiw;2025-02-28T09:15:11+01:00;2025-02-28T09:15:11+01:00;Dominik LenzeChristina FelschenPauline PieperYevgeniya ShcherbakovaJulius TrögerBenja Zehr;;false
84f5b651eec3b630e59cf4be24b2847fc0cee05412f09057369852b050df079c;Warnstreiks bei der Post werden zwei Tage lang fortgesetzt;https://www.zeit.de/politik/deutschland/2025-02/warnstreiks-verdi-post-fortsetzung;Im Tarifstreit mit der Deutschen Post weitet die Gewerkschaft ver.di ihre Warnstreiks nochmals aus. Die Verhandlungen sollen nächste Woche weitergeführt werden.;Ver.di-Streik;Politik, Ver.di-Streik, Deutsche Post, Warnstreik, Ver.di, Tarifvertrag, Streik, Gehalt;2025-02-28T09:14:59+01:00;2025-02-28T09:14:59+01:00;bam;ZEIT ONLINE,        dpa,        AFP,        							bam;false
3bb8b2dc913e5eaf66ebda9b40768dc2462214bcad42c1ce72190b2d0d0cb933;SC Potsdam reist optimistisch nach Stuttgart;https://www.zeit.de/news/2025-02/28/sc-potsdam-reist-optimistisch-nach-stuttgart;Hier finden Sie Informationen zu dem Thema „Volleyball-Bundesliga“. Lesen Sie jetzt „SC Potsdam reist optimistisch nach Stuttgart“.;Volleyball-Bundesliga;News, Volleyball-Bundesliga, Alina Nasin, Stuttgart, MTV Stuttgart, SC Potsdam, Bundesliga;2025-02-28T09:14:10+01:00;2025-02-28T09:14:10+01:00;;dpa Berlin/Brandenburg;false
371a565850b5c1561d4e6b7e0f8ded85c9d568fb2f4e27cdf32b5009897989f2;Unfall auf A4 bei Dresden führt zu Einschränkungen;https://www.zeit.de/news/2025-02/28/unfall-auf-a4-bei-dresden-fuehrt-zu-einschraenkungen;Hier finden Sie Informationen zu dem Thema „Verkehrsbehinderungen“. Lesen Sie jetzt „Unfall auf A4 bei Dresden führt zu Einschränkungen“.;Verkehrsbehinderungen;News, Verkehrsbehinderungen, Dresden, Unfall, Verkehrsbehinderung, Einschränkung, Aufräumarbeit;2025-02-28T09:11:56+01:00;2025-02-28T09:11:56+01:00;;dpa Sachsen;false
19fabc7628e5eb7831e4df24fe94aaa365598fa2e02265817056b7e64c7f4811;So gelingt der Start in den Frühling;https://www.zeit.de/news/2025-02/28/so-gelingt-der-start-in-den-fruehling;Hier finden Sie Informationen zu dem Thema „Der Lenz ist da“. Lesen Sie jetzt „So gelingt der Start in den Frühling“.;Der Lenz ist da;News, Der Lenz ist da, Christina Endler, Rheinland-Pfalz, Rheinland, NABU, Vogelgezwitscher, Tiere, Auto;2025-02-28T09:08:54+01:00;2025-02-28T09:08:54+01:00;;dpa Rheinland-Pfalz/Saarland;false
a4dd1d978b874dab69f0848f9fcf78739affe9867b6a52cee0f4f6f0630339f8;Zahl der Verkehrstoten sinkt auf drittniedrigsten Stand seit 1953;https://www.zeit.de/mobilitaet/2025-02/verkehrssicherheit-unfall-tote-2024-rueckgang;Im vergangenen Jahr sind 2.780 Menschen im Straßenverkehr ums Leben gekommen. Nur in den Pandemiejahren 2020 und 2021 waren es weniger.;Verkehrssicherheit;Mobilitaet, Verkehrssicherheit, Straßenverkehr, Tod, Verkehr, Fahrrad, Autoindustrie, Elektroauto;2025-02-28T09:08:44+01:00;2025-02-28T09:08:44+01:00;jsp;ZEIT ONLINE,        dpa,        							jsp;false
a22695ade1eeb073042b8a0127c9a8f5c884d28ea331d57c9b1bc573092574c2;Einzelhandel startet mit Umsatzplus ins Jahr;https://www.zeit.de/news/2025-02/28/einzelhandel-startet-mit-umsatzplus-ins-jahr;Hier finden Sie Informationen zu dem Thema „Januar-Zahlen“. Lesen Sie jetzt „Einzelhandel startet mit Umsatzplus ins Jahr“.;Januar-Zahlen;News, Januar-Zahlen, Umsatzplus, Einzelhandel;2025-02-28T09:08:37+01:00;2025-02-28T09:08:37+01:00;;dpa;false
753804de56d74f43abe7cebd8e389b024f8af36c6f8f19401c1ac112ebd340fb;Verdi bestreikt bis Samstag Paketzentren im Norden;https://www.zeit.de/news/2025-02/28/verdi-bestreikt-bis-samstag-paketzentren-im-norden;Hier finden Sie Informationen zu dem Thema „Streit um mehr Geld“. Lesen Sie jetzt „Verdi bestreikt bis Samstag Paketzentren im Norden“.;Streit um mehr Geld;News, Streit um mehr Geld, Hamburg, Schleswig-Holstein, Mecklenburg-Vorpommern, Ver.di, Bürgerschaftswahl, Paketzentrum, Geld, Warnstreik, Logistik;2025-02-28T09:05:26+01:00;2025-02-28T09:05:26+01:00;;dpa Hamburg/Schleswig-Holstein;false
6da96f58d2d626452c83c8ee3b876e5b28c943d78807025c735038b829a18722;Geldautomat in Mittelfranken gesprengt;https://www.zeit.de/news/2025-02/28/geldautomat-in-mittelfranken-gesprengt;Hier finden Sie Informationen zu dem Thema „Kriminalität“. Lesen Sie jetzt „Geldautomat in Mittelfranken gesprengt“.;Kriminalität;News, Kriminalität, Mittelfranken, Geldautomat, Selbstbedienungsfiliale, Kriminalität;2025-02-28T09:04:26+01:00;2025-02-28T09:04:26+01:00;;dpa Bayern;false
e8481219530cb57ae4f7c952c60337b86cb5a130aded7438b1c96da5351a54b4;Verdächtiger Kanister vor Rathaus Lübz - Gefahrguteinsatz;https://www.zeit.de/news/2025-02/28/verdaechtiger-kanister-vor-rathaus-luebz-gefahrguteinsatz;Hier finden Sie Informationen zu dem Thema „Notfälle“. Lesen Sie jetzt „Verdächtiger Kanister vor Rathaus Lübz - Gefahrguteinsatz“.;Notfälle;News, Notfälle, Lübz, Landkreis Ludwigslust-Parchim, Feuerwehr, Gefahrguteinsatz, Kanister, Notfall;2025-02-28T08:59:11+01:00;2025-02-28T08:59:11+01:00;;dpa Mecklenburg-Vorpommern;false
2415f4bee9e9ba29b382e043b483cf1b87d7106e78e3cfcf80c3746f653fc790;Fußgängerin wird beim Einparken von Auto erfasst und stirbt;https://www.zeit.de/news/2025-02/28/fussgaengerin-wird-beim-einparken-von-auto-erfasst-und-stirbt;Hier finden Sie Informationen zu dem Thema „Unfall“. Lesen Sie jetzt „Fußgängerin wird beim Einparken von Auto erfasst und stirbt“.;Unfall;News, Unfall, Polizei, Unfall, Auto;2025-02-28T08:56:45+01:00;2025-02-28T08:56:45+01:00;;dpa Berlin/Brandenburg;false
a30f5cec0561c6dbbde295368975691ca408b48e55bd712fb851de030b6646f8;Nach Schüssen: Tatverdächtiger stellt sich der Polizei;https://www.zeit.de/news/2025-02/28/bild-tatverdaechtiger-stellt-sich-nach-schuessen;Hier finden Sie Informationen zu dem Thema „Kriminalität“. Lesen Sie jetzt „Nach Schüssen: Tatverdächtiger stellt sich der Polizei“.;Kriminalität;News, Kriminalität, Bielefeld, Polizei, Staatsanwaltschaft, Amtsgericht, Mord, Kriminalität, Tötung;2025-02-28T08:54:27+01:00;2025-02-28T08:54:27+01:00;;dpa;false
10268bd66bdcd8705ce37c186ec873c7d17053863f1b088f81e62093015e501e;Trotz Frosts und Schnees Wintersport nur bedingt möglich;https://www.zeit.de/news/2025-02/28/trotz-frosts-und-schnees-wintersport-nur-bedingt-moeglich;Hier finden Sie Informationen zu dem Thema „Wetter“. Lesen Sie jetzt „Trotz Frosts und Schnees Wintersport nur bedingt möglich“.;Wetter;News, Wetter, Linda Noël, Baden-Württemberg, Wintersport, Winterspaziergang, Neuschnee, Wetter;2025-02-28T08:51:20+01:00;2025-02-28T08:51:20+01:00;;dpa Baden-Württemberg;false
4ee3f4b7c4b63a6bb62aa5ad0eb18c4b077bba8f34fa418e31f72027fdd089fb;Wechselhaftes Wetter zum Wochenende;https://www.zeit.de/news/2025-02/28/wechselhaftes-wetter-zum-wochenende;Hier finden Sie Informationen zu dem Thema „Wettervorhersage“. Lesen Sie jetzt „Wechselhaftes Wetter zum Wochenende“.;Wettervorhersage;News, Wettervorhersage, Saarland, Rheinland-Pfalz, Wettervorhersage, Wetter;2025-02-28T08:50:25+01:00;2025-02-28T08:50:25+01:00;;dpa Rheinland-Pfalz/Saarland;false
bc1335a9872d5d2c5216ef847c797d7321066dc561926e2f7da44fcd79e5ea21;Verdi verlängert Post-Warnstreik um zwei Tage;https://www.zeit.de/news/2025-02/28/verdi-verlaengert-post-warnstreik-um-zwei-tage;Hier finden Sie Informationen zu dem Thema „Tarife“. Lesen Sie jetzt „Verdi verlängert Post-Warnstreik um zwei Tage“.;Tarife;News, Tarife, David Merck, Bayern, Ver.di, Zustellstützpunkt, Warnstreik, Logistik;2025-02-28T08:46:16+01:00;2025-02-28T08:46:16+01:00;;dpa Bayern;false
682210539fe46e2bf0ae1877bb91aaf74dc91689a8b552c5db38b60b2091dc4f;Tippgemeinschaft gewinnt Jackpot von fast 88 Millionen Euro;https://www.zeit.de/news/2025-02/28/tippgemeinschaft-gewinnt-jackpot-von-fast-88-millionen-euro;Hier finden Sie Informationen zu dem Thema „Millionengewinn“. Lesen Sie jetzt „Tippgemeinschaft gewinnt Jackpot von fast 88 Millionen Euro“.;Millionengewinn;News, Millionengewinn, Hessen, Tippgemeinschaft, Jackpot, Millionengewinn;2025-02-28T08:44:57+01:00;2025-02-28T08:44:57+01:00;;dpa;false
a9e0a921cb0be876d131fad9a0a851f1ebb30cea59e3236c1c8f30a404959ad7;Schwere Knieverletzung: WM für Skispringerin Görlich vorbei;https://www.zeit.de/news/2025-02/28/schwere-knieverletzung-wm-fuer-skispringerin-goerlich-vorbei;Hier finden Sie Informationen zu dem Thema „Nordische Ski-WM“. Lesen Sie jetzt „Schwere Knieverletzung: WM für Skispringerin Görlich vorbei“.;Nordische Ski-WM;News, Nordische Ski-WM, Luisa Görlich, DSV, Deutscher Skiverband, Ski-WM, Knieverletzung;2025-02-28T08:44:56+01:00;2025-02-28T08:44:56+01:00;;dpa Sport;false
