Hash;Title;Link;Description;Category;KeyWords;Published;LastUpdated;Author;Source;Paywall
ad2a326f23dbe0f05292c1c8143e0515cb903f37b6501531c4f24d0bd519830b;Polizist schießt bei Verfolgung von 17-jährigem Autofahrer;https://www.zeit.de/news/2026-02/14/polizist-schiesst-bei-verfolgung-von-17-jaehrigem-autofahrer;Hier finden Sie Informationen zu dem Thema „Verfolgungsfahrt“. Lesen Sie jetzt „Polizist schießt bei Verfolgung von 17-jährigem Autofahrer“.;Verfolgungsfahrt;News, Verfolgungsfahrt, Passau, Polizei, Verfolgungsfahrt, Verfolgung, Auto;2026-02-14T10:05:34+01:00;2026-02-14T10:05:34+01:00;;dpa Bayern;false
3bff8df665771f391546558094c916bfa2ec2a866779ccedd6a5ff2351c9951f;5,8 Prozent mehr Geld für Beschäftigte der Länder;https://www.zeit.de/news/2026-02/14/5-8-prozent-mehr-geld-fuer-beschaeftigte-der-laender;Hier finden Sie Informationen zu dem Thema „Tarifverhandlungen“. Lesen Sie jetzt „5,8 Prozent mehr Geld für Beschäftigte der Länder“.;Tarifverhandlungen;News, Tarifverhandlungen, Frank Werneke, Andreas Dressel, Potsdam, Rostock, Greifswald, Ver.di, Tarifgemeinschaft deutscher Länder TdL, Tarifverhandlung, Geld, Warnstreik;2026-02-14T10:02:11+01:00;2026-02-14T10:02:11+01:00;;dpa Mecklenburg-Vorpommern;false
b5bcb39a0049f5e7e88ec10db925cfac9f30a3c2a92733b60a360c30604d5fb8;Süchtig nach Molke;https://www.zeit.de/2026/07/proteinpulver-whey-molkenprotein-influencer-the-quality-group;Dem Proteinhype entkommt niemand mehr. Mit dem einstigen Abfallprodukt Molke werden dabei Milliarden verdient. Während Mediziner vor Influencer-Tipps warnen.;"Z+ (abopflichtiger Inhalt);
        
    Proteinpulver";Wirtschaft, Proteinpulver, Protein, Lebensmittel, Ernährung, Fitness, Soziale Medien, Milchprodukt;2026-02-14T09:59:24+01:00;2026-02-14T09:59:24+01:00;Lara DehariAnton  Preuss;Aus der        ZEIT Nr. 07/2026;false
8269b09c1fb293342a20d6c9aec867df6f09003750e3d596675237d168e9adca;Biathletin Hettich-Walz sagt für Sprintrennen ab;https://www.zeit.de/news/2026-02/14/biathletin-hettich-walz-sagt-fuer-sprintrennen-ab;Hier finden Sie Informationen zu dem Thema „Winterspiele“. Lesen Sie jetzt „Biathletin Hettich-Walz sagt für Sprintrennen ab“.;Winterspiele;News, Winterspiele, Janina Hettich-Walz, Winterspiel, Sprint;2026-02-14T09:59:18+01:00;2026-02-14T09:59:18+01:00;;dpa Sport;false
96a81693320deac88719824b5a201efc59e0993ace565797af6295ca2f6e7874;Autofahrt mit über 2 Promille und gestohlenen Kennzeichen;https://www.zeit.de/news/2026-02/14/autofahrt-mit-ueber-2-promille-und-gestohlenen-kennzeichen;Hier finden Sie Informationen zu dem Thema „Kriminalität“. Lesen Sie jetzt „Autofahrt mit über 2 Promille und gestohlenen Kennzeichen“.;Kriminalität;News, Kriminalität, Autofahrt, Kriminalität, Auto;2026-02-14T09:58:44+01:00;2026-02-14T09:58:44+01:00;;dpa Baden-Württemberg;false
3bff8df665771f391546558094c916bfa2ec2a866779ccedd6a5ff2351c9951f;5,8 Prozent mehr Geld für Beschäftigte der Länder;https://www.zeit.de/news/2026-02/14/tarifgespraeche-fuer-oeffentlichen-dienst-in-der-verlaengerung;Hier finden Sie Informationen zu dem Thema „Tarifverhandlungen“. Lesen Sie jetzt „5,8 Prozent mehr Geld für Beschäftigte der Länder“.;Tarifverhandlungen;News, Tarifverhandlungen, Tarifgespräch;2026-02-14T09:58:23+01:00;2026-02-14T09:58:23+01:00;;dpa;false
8a08cc1f3c0993f6d47fea0ea9fe29e4a3934520c2236db588ea7b2d3efd7568;Wohnungsbrand verursacht Schaden von 250.000 Euro;https://www.zeit.de/news/2026-02/14/wohnungsbrand-verursacht-schaden-von-250-000-euro;Hier finden Sie Informationen zu dem Thema „Brände“. Lesen Sie jetzt „Wohnungsbrand verursacht Schaden von 250.000 Euro“.;Brände;News, Brände, Wohnungsbrand, Brand;2026-02-14T09:57:27+01:00;2026-02-14T09:57:27+01:00;;dpa Hessen;false
c5e51e899041ba392a9c9ec3cde1b002036acbe3e73307ec633399bdd40b4981;"Regierungschef Schulze: AfD ist ein ""Selbstbedienungsladen""";https://www.zeit.de/news/2026-02/14/regierungschef-schulze-afd-ist-ein-selbstbedienungsladen;"Hier finden Sie Informationen zu dem Thema „Vetternwirtschaftsvorwürfe“. Lesen Sie jetzt „Regierungschef Schulze: AfD ist ein ""Selbstbedienungsladen""“.";Vetternwirtschaftsvorwürfe;News, Vetternwirtschaftsvorwürfe, Sven Schulze, Sachsen-Anhalt, Alternative für Deutschland, CDU, Vetternwirtschaftsvorwurf, Selbstbedienungsladen, Vetternwirtschaft;2026-02-14T09:56:58+01:00;2026-02-14T09:56:58+01:00;;dpa Sachsen;false
7aeea3815113624e8cfcc1b851b87bc88068d4b99456cfe90c0e13eec4a4e7d4;Tarifparteien einigen sich auf mehr Geld für Länderbeschäftigte;https://www.zeit.de/wirtschaft/2026-02/einigung-im-tarifkonflikt-um-den-oeffentlichen-dienst-der-laender;Nach drei Verhandlungsrunden gibt es eine Einigung im Tarifkonflikt des öffentlichen Dienstes der Länder. Die Gehälter sollen in drei Schritten um 5,8 Prozent steigen.;Tarifkonflikt;Wirtschaft, Tarifkonflikt, Tarifkonflikt;2026-02-14T09:48:11+01:00;2026-02-14T09:48:11+01:00;Johanna Sethe;;false
4ac05e45a82308be271a2735598d8a325e6d83ce65d815cc4ba4d0babaf94365;"""Wir gehören zusammen"": Rubios Angebot an Europa";https://www.zeit.de/news/2026-02/14/merz-streckt-die-hand-aus-wie-reagiert-rubio;"Hier finden Sie Informationen zu dem Thema „Münchner Sicherheitskonferenz“. Lesen Sie jetzt „""Wir gehören zusammen"": Rubios Angebot an Europa“.";Münchner Sicherheitskonferenz;News, Münchner Sicherheitskonferenz, Marco Rubio, Friedrich Merz, Emmanuel Macron, München, Europa, USA, CDU, Münchner Sicherheitskonferenz;2026-02-14T09:42:54+01:00;2026-02-14T09:42:54+01:00;;dpa;false
16a82ded7987b8dc71e3bd9b03980ae364b69ed529f5065edc72a6009b086afe;Selenskyj ehrt Skeletoni Heraskewytsch mit Staatsorden;https://www.zeit.de/politik/ausland/2026-02/selenskyj-wladyslaw-heraskewytsch-olympische-spiele-staatsorden-gxe;Der ukrainische Präsident Selenskyj hat dem Sekeleton-Fahrer Wladyslaw Heraskewytsch einen Orden verliehen. Der Skeletoni hatte bei Olympia an getötete Athleten erinnert.;Ausschluss von Olympischen Winterspielen;Politik, Ausschluss von Olympischen Winterspielen, Wolodymyr Selenskyj, Olympische Winterspiele, Krieg in der Ukraine, IOC, Sportler, Skeleton;2026-02-14T09:42:05+01:00;2026-02-14T09:42:05+01:00;jse;DIE ZEIT,        dpa,        Reuters,        SID,        							jse;false
dd7c636afb3f0eaa8403f73ad2cac2c50a71c611f12970b66cdd40627f0a40ac;Kasachen gibt's;https://www.zeit.de/sport/2026-02/olympische-winterspiele-eiskunstlauf-michail-schaidorow;Der Eiskunstlauf der Männer endet mit einer Überraschung, die an einen Skandal grenzt. Der Eistanz hat den schon. Und dann gehen auch noch die Kondome aus. Der Olympiatag;Olympische Winterspiele;Sport, Olympische Winterspiele, Mann, Olympische Winterspiele, Eiskunstlauf, Eistanz, Olympiatag;2026-02-14T09:40:49+01:00;2026-02-14T09:40:49+01:00;Oliver Fritsch;;false
9107ae35024c93ceee09c3aaa3516280b580901be21a6c63a3e09069290178a8;Eine Fahrt im Nachtzug schützt vor den Zumutungen der Welt;https://www.zeit.de/feuilleton/2026-02/nachtzuege-oebb-wes-anderson-werbung-bahn;Nachtzüge sind etwas für Nostalgiker, genauso wie die Filme von Wes Anderson. Da passt es ja, dass der Regisseur neuerdings für die Österreichische Bundesbahn wirbt.;"Z+ (abopflichtiger Inhalt);
        
    Nachtzüge";Feuilleton, Nachtzüge, Wes Anderson, Österreich, Fernverkehr, Verkehrswende, Werbung, Reisen;2026-02-14T09:34:42+01:00;2026-02-14T09:34:42+01:00;Jochen Overbeck;;false
6d59b08cd79b663567f667ce261a374b08126e951c3e6302a37c01a893dbc81c;"US-Außenminister Rubio will ""ein starkes Europa""";https://www.zeit.de/politik/ausland/2026-02/rubio-rede-muenchener-sicherheitskonferenz;"Marco Rubio erinnert in München an die Zusammengehörigkeit der Vereinigten Staaten mit dem europäischen Kontinent. ""Europa muss überleben"", sagte der US-Außenminister.";Sicherheitskonferenz in München;Politik, Sicherheitskonferenz in München, Sicherheitskonferenz, Sicherheitspolitik, Sicherheit, Münchner Sicherheitskonferenz, München, Marco Rubio;2026-02-14T09:26:10+01:00;2026-02-14T09:26:10+01:00;jfw;DIE ZEIT,        							jfw;false
1144345f226c31ec9ca0cf6df7f9a17bf8cb2e5119afe74413d1cb9b3dae0ada;Durchbruch im Tarifstreit um öffentlichen Dienst;https://www.zeit.de/news/2026-02/14/durchbruch-im-tarifstreit-um-oeffentlichen-dienst;Hier finden Sie Informationen zu dem Thema „Tarifverhandlungen“. Lesen Sie jetzt „Durchbruch im Tarifstreit um öffentlichen Dienst“.;Tarifverhandlungen;News, Tarifverhandlungen, Tarifstreit, Durchbruch, Tarifverhandlung;2026-02-14T09:25:20+01:00;2026-02-14T09:25:20+01:00;;dpa;false
043acfb526b9bd9c7f62b464ded84ea4cf77b99aa585ae2c74a7469dc7ad60f0;Kiki, Ötte und der Millionen-Coup;https://www.zeit.de/2026/07/bankraub-gelsenkirchen-sparkasse-schliessfaecher-100-millionen;"Einbruch auf ""Champions League""-Niveau. 3.000 Opfer, 350 Ermittler, zwei Anwälte und ein Sparkassenchef rätseln: Wer ist schuld am Millionencoup von Gelsenkirchen?";"Z+ (abopflichtiger Inhalt);
        
    Diebstahl in Gelsenkirchen";Geld, Diebstahl in Gelsenkirchen, Diebstahl, Sparkasse, Gelsenkirchen, Ermittlung, Nordrhein-Westfalen, Polizei;2026-02-14T09:23:44+01:00;2026-02-14T09:23:44+01:00;Celine SchäferStefan Willeke;Aus der        ZEIT Nr. 07/2026;false
9ad78655c49b004635786a6e4d5d4cc85e64f912508fd57b5d7c9106344e7944;Venezuela lässt 17 politische Gefangene frei;https://www.zeit.de/politik/ausland/2026-02/venezuela-freilassung-gefaengnis-gefangene-dissidenten-amnestiegesetz;Zehn Männer und sieben Frauen sollen aus einem Gefängnis in Caracas freigelassen worden sein. Die Nationalversammlung verhandelt über ein weitreichendes Amnestiegesetz.;Venezuela;Politik, Venezuela, Mann, Venezuela, Caracas, Amnestiegesetz, Nationalversammlung;2026-02-14T09:09:25+01:00;2026-02-14T09:09:25+01:00;ps;DIE ZEIT,        Reuters,        AFP,        							ps;false
615fdd44eb7fb3f5269972d9fff2921388848fa8fe542f91c19738e96c6c8bad;Klingbeil will klare Regeln bei sozialen Medien für Kinder;https://www.zeit.de/news/2026-02/14/klingbeil-will-klare-regeln-bei-sozialen-medien-fuer-kinder;Hier finden Sie Informationen zu dem Thema „Jugend und Social Media“. Lesen Sie jetzt „Klingbeil will klare Regeln bei sozialen Medien für Kinder“.;Jugend und Social Media;News, Jugend und Social Media, Lars Klingbeil, Rheinpfalz, SPD, Soziale Medien;2026-02-14T08:59:42+01:00;2026-02-14T08:59:42+01:00;;dpa Rheinland-Pfalz/Saarland;false
7f8aab3f6c33444e382c08f2c2434740462a42974a6943a1208f9d9300a32736;Ukrainische Truppen befreien drei Orte in der Region Saporischschja;https://www.zeit.de/politik/ausland/ukraine-russland-frontverlauf-krieg-karte-aktuell;Nördlich von Huljajpole sind ukrainische Soldaten erneut vorgerückt. Russische Truppen besetzten hingegen neue Gebiete in der Region Donezk.;Ukrainekarte aktuell;Politik, Ukrainekarte aktuell, Krieg in der Ukraine, Russland, Militär, Streitkräfte, Donezk, Charkiw;2026-02-14T08:48:17+01:00;2026-02-14T08:48:17+01:00;Justus WilkeTimo StukenbergChristina FelschenElizabeth RushtonPauline PieperJulius TrögerBenja Zehr;;false
f8606aac3e2877cd3d26b7297f53493f436e7ffd81067510b143313db9781f46;Glätteunfall in Hamburg-Billstedt - fünf Verletzte;https://www.zeit.de/news/2026-02/14/unfall-in-hamburg-billstedt-fuenf-verletzte;Hier finden Sie Informationen zu dem Thema „Unfälle“. Lesen Sie jetzt „Glätteunfall in Hamburg-Billstedt - fünf Verletzte“.;Unfälle;News, Unfälle, Hamburg-Billstedt, Billstedt, Unfall;2026-02-14T08:46:36+01:00;2026-02-14T08:46:36+01:00;;dpa Hamburg/Schleswig-Holstein;false
2318c36247a4298fd8c7bb8e1a3b1c52b731d684839048a7a58698c62d9eaea5;Wochenende bringt Regen und Schnee;https://www.zeit.de/wissen/umwelt/2026-02/schnee-regen-glatteis-sonne-wetter-gxe;Auf den Straßen kann es am Wochenende nass und glatt werden. Am Sonntag wird es gelegentlich sonnig. In den Alpen werden bis zu zehn Zentimeter Neuschnee erwartet.;Wetter in Deutschland;Wissen, Wetter in Deutschland, DWD, Wettervorhersage, Schneefall, Wetter, Alpen, Winter;2026-02-14T08:28:05+01:00;2026-02-14T08:28:05+01:00;iyf;DIE ZEIT,        dpa,        							iyf;false
5cc8d1ed5ee1b6555fbb45c419911e6c4d076b03b6a296a05c008125fb7e2626;Selenskyj überreicht Orden an Skeleton-Piloten Heraskewytsch;https://www.zeit.de/sport/2026-01/olympische-winterspiele-italien-live;Der ukrainische Präsident ehrt Wladyslaw Heraskewytsch, der von Olympia ausgeschlossen wurde. Die deutschen Skeletoni Jungk und Grotheer fahren aufs Podest. Das Liveblog;Liveblog:                     Olympische Winterspiele;Sport, Olympische Winterspiele, Liveblog, Cortina d'Ampezzo, Mailand, Italien, Olympische Winterspiele;2026-02-14T08:08:42+01:00;2026-02-14T08:08:42+01:00;Fabian AlbrechtBastian Hartig;;false
e94f74644f1738ad4cdded4879439a3079485821ac3d30b6691fa147d292c864;Chinas Außenminister ruft EU zu engerer Zusammenarbeit auf;https://www.zeit.de/politik/deutschland/2026-02/muenchner-sicherheitskonferenz-china-eu-wang-yi;Wang Yi hat die EU am Rande der Münchner Sicherheitskonferenz als Partner bezeichnet. Gegenseitige Abhängigkeit stelle aus Sicht Chinas kein Risiko dar.;Münchner Sicherheitskonferenz;Politik, Münchner Sicherheitskonferenz, Wang Yi, China, Wang, Europäische Union, Münchner Sicherheitskonferenz;2026-02-14T08:04:44+01:00;2026-02-14T08:04:44+01:00;wil;DIE ZEIT,        Reuters,        							wil;false
dd62e824a187248f8648c6658d90016fb3df56d798da39fa67ad0a0169fb4176;Trump holen berüchtigte Razzien ein;https://www.zeit.de/news/2026-02/14/us-heimatschutzministerium-bekommt-kein-frisches-geld-mehr;Hier finden Sie Informationen zu dem Thema „Streit um den Haushalt“. Lesen Sie jetzt „Trump holen berüchtigte Razzien ein“.;Streit um den Haushalt;News, Streit um den Haushalt, Donald Trump, Demokraten (USA), Republikaner (USA), Übergangshaushalt, Migrationsbehörde, Nachfolgeregelung, Geld, ICE;2026-02-14T07:42:11+01:00;2026-02-14T07:42:11+01:00;;dpa;false
2012f5abecab9aeaf247d11b0f1c88ef32dae2dc36393f6d6d72b8078e3cd1ee;Schnee zum Valentinstag – Hochwassergefahr bleibt bestehen;https://www.zeit.de/news/2026-02/14/schnee-zum-valentinstag-hochwassergefahr-bleibt-bestehen;Hier finden Sie Informationen zu dem Thema „Wetterbericht“. Lesen Sie jetzt „Schnee zum Valentinstag – Hochwassergefahr bleibt bestehen“.;Wetterbericht;News, Wetterbericht, Nordbayern, DWD, Valentinstag, Wetterbericht, Kaltfront, Freistaat, Hochwassergefahr, Hochwasserlage, Hochwasser;2026-02-14T07:41:46+01:00;2026-02-14T07:41:46+01:00;;dpa Bayern;false
bdc30449bdbd0a055dd56cab5779b46b50a35b495145956a93366b391b3bc7c9;Bankschließfächer in Stuhr bei Bremen aufgebrochen;https://www.zeit.de/news/2026-02/13/schliessfaecher-in-bank-in-stuhr-aufgebrochen-beute-unklar;Hier finden Sie Informationen zu dem Thema „Ermittlungen laufen“. Lesen Sie jetzt „Bankschließfächer in Stuhr bei Bremen aufgebrochen“.;Ermittlungen laufen;News, Ermittlungen laufen, Stuhr, Diepholz, Bremen, Polizei, Schließfach, Ermittlung;2026-02-14T07:27:57+01:00;2026-02-14T07:27:57+01:00;;dpa;false
4f0fa4de073426cc4215104670f356b15267318d2ff0be992ca0aa329f07c4f3;Hier müssen sich Narren im Südwesten auf Schnee einstellen;https://www.zeit.de/news/2026-02/14/hier-muessen-sich-narren-im-suedwesten-auf-schnee-einstellen;Hier finden Sie Informationen zu dem Thema „Wetter zur Fastnacht“. Lesen Sie jetzt „Hier müssen sich Narren im Südwesten auf Schnee einstellen“.;Wetter zur Fastnacht;News, Wetter zur Fastnacht, Schwarzwald, Baden-Württemberg, Rhein, DWD, Südwesten, Fastnacht, Wetter;2026-02-14T07:27:38+01:00;2026-02-14T07:27:38+01:00;;dpa Baden-Württemberg;false
ae3390f691ec6a4351e9c3154458f2cec8faba4db3ee5e550dda2370f3844bd4;Streit um ICE führt zu dritter Haushaltssperre unter Trump;https://www.zeit.de/politik/ausland/2026-02/shutdown-usa-streit-ice-kongress-gxe;Das Heimatschutzministerium ist im teilweisen Shutdown, weil Republikaner und Demokraten sich nicht geeinigt haben. Die Behörde ICE hat aber noch vorab bewilligte Gelder.;US-Kongress;Politik, US-Kongress, US-Regierung, Donald Trump, Republikaner (USA), Demokraten (USA), Immigration and Customs Enforcement, USA;2026-02-14T06:58:19+01:00;2026-02-14T06:58:19+01:00;mm;DIE ZEIT,        dpa,        AFP,        							mm;false
2ba9fccb69453822c495b2b38be80d1b4c06d776baf5b77c04c8218ca008a780;Alice Schwarzer: Katze wischte mir die Tränen ab;https://www.zeit.de/news/2026-02/14/alice-schwarzer-katze-wischte-mir-die-traenen-ab;Hier finden Sie Informationen zu dem Thema „Tierliebe“. Lesen Sie jetzt „Alice Schwarzer: Katze wischte mir die Tränen ab“.;Tierliebe;News, Tierliebe, Alice Schwarzer, Katze;2026-02-14T06:54:04+01:00;2026-02-14T06:54:04+01:00;;dpa Nordrhein-Westfalen;false
39935192a5959bffd7f0fc222678309c41fb2df2cea0936ba16e4715b61fc372;EU-Kommission prüft Social-Media-Verbot für Jugendliche;https://www.zeit.de/digital/2026-02/social-media-verbot-eu-virkkunen-gxe;Bis zum Sommer will die EU-Kommission über ein Social-Media-Verbot für Jugendliche entscheiden. Digitalkommissarin Virkkunen sprach sich für eine europäische Lösung aus.;Alterskontrollen;Digital, Alterskontrollen, EU-Kommission, Soziale Medien, Europäische Union, Jugendschutz, Sucht, Jugendliche;2026-02-14T06:48:49+01:00;2026-02-14T06:48:49+01:00;wil;DIE ZEIT,        epd,        							wil;false
5f8524c0ceccc4bea6768a351aacda89148ae78c30b6aded796b5c0523dd3d07;Gericht erlaubt Auftritte von Björn Höcke in Bayern;https://www.zeit.de/politik/deutschland/2026-02/afd-bjoern-hoecke-redeverbot-bayern-kommunalwahlen-redeverbot-gekippt;Zwei bayerische Gemeinden wollten verhindern, dass Björn Höcke am Wochenende auf Wahlkampfveranstaltungen spricht. Ein Gericht erklärte diese Auflage nun für unzulässig.;Kommunalwahl in Bayern;Politik, Kommunalwahl in Bayern, Björn Höcke, Bayern, Bayreuth, Alternative für Deutschland, Kommunalwahl, Rechtsextremismus;2026-02-14T06:36:46+01:00;2026-02-14T06:36:46+01:00;lk;DIE ZEIT,        AFP,        							lk;false
269f3e8710983d3a6935d1119820a9773b4fa1b5def640f7e35b85862381a54f;Aus für Freihafenelbbrücke - Langzeit-Planungen hinfällig;https://www.zeit.de/news/2026-02/14/aus-fuer-freihafenelbbruecke-langzeit-planungen-hinfaellig;Hier finden Sie Informationen zu dem Thema „Elbquerung“. Lesen Sie jetzt „Aus für Freihafenelbbrücke - Langzeit-Planungen hinfällig“.;Elbquerung;News, Elbquerung, Martin Helfrich, Polizei, Freihafenelbbrücke, Elbquerung, Schiff;2026-02-14T06:30:04+01:00;2026-02-14T06:30:04+01:00;;dpa Hamburg/Schleswig-Holstein;false
671e13dc63fa21faa5932f4fc8b90cd1a59752beee62d4fd38e8df378c9c1918;Ich, die Enttäuschung meines Vaters;https://www.zeit.de/familie/2026-02/enttaeuschung-eltern-kinder-erziehung-kindheit;"Kinder sind eine Art Vermächtnis, aber was für eins? ""Wenn du Erwartungen an deine Kinder hast, bist du verloren!"" sagt einer, der es wissen muss. Mein Vater. ";"Z+ (abopflichtiger Inhalt);
        
    Enttäuschung bei Eltern";Familie, Enttäuschung bei Eltern, Eltern, Kinder, Familie, Mütter, Väter, Kindererziehung;2026-02-14T06:22:24+01:00;2026-02-14T06:22:24+01:00;Adam Fletcher;;false
8791da414d66c68997c6b334169cc72e83676cc9807df67f41e22d1a0648a257;Nina Warken plant Gesetz für medizinische Versorgung im Kriegsfall;https://www.zeit.de/politik/deutschland/2026-02/gesundheitssystem-bundesgesundheitsministerin-nina-warken-gesetz-kriegsfall-gxe;"Deutschlands Gesundheitswesen müsse sich ""leider auch auf Kriegsszenarien"" einstellen, sagt die Bundesgesundheitsministerin. Es fehle vor allem an Daten und Know-how.";Gesundheitssystem;Politik, Gesundheitssystem, Nina Warken, Gesundheitssystem, Ausnahmezustand, Bundeswehr, CDU, Gesundheitspolitik;2026-02-14T06:21:17+01:00;2026-02-14T06:21:17+01:00;eca;DIE ZEIT,        dpa,        KNA,        							eca;false
98d083560023bad38d15803edea13b79516353d549f64ad980e604acac747dac;Karneval in Rio startet mit berühmten Umzügen im Sambodrom;https://www.zeit.de/news/2026-02/14/karneval-in-rio-startet-mit-beruehmten-umzuegen-im-sambodrom;Hier finden Sie Informationen zu dem Thema „Spektakel am Zuckerhut“. Lesen Sie jetzt „Karneval in Rio startet mit berühmten Umzügen im Sambodrom“.;Spektakel am Zuckerhut;News, Spektakel am Zuckerhut, Eduardo Paes, Rio, Zuckerhut, Rio de Janeiro, Karneval, Umzug, Spektakel;2026-02-14T06:17:29+01:00;2026-02-14T06:17:29+01:00;;dpa;false
8ec5d46df1f169a811c7570e9b4a2fa6ca2c6bc984da22c5f976211ade0e26ff;Rostocker Busse und Straßenbahnen verbuchen weniger Nutzer;https://www.zeit.de/news/2026-02/14/rostocker-busse-und-strassenbahnen-verbuchen-weniger-nutzer;Hier finden Sie Informationen zu dem Thema „Verkehr“. Lesen Sie jetzt „Rostocker Busse und Straßenbahnen verbuchen weniger Nutzer“.;Verkehr;News, Verkehr, Rostock, Rostock-Gehlsdorf, Straßenbahn, Verkehr, Deutschlandticket;2026-02-14T06:00:06+01:00;2026-02-14T06:00:06+01:00;;dpa Mecklenburg-Vorpommern;false
4ccac1847964dbf6b1cfc6ff28939d8e760fef0ace4ccfee61d0e76bb52dbb06;Sicherheitslage sorgt für Zulauf bei Reservisten im Norden;https://www.zeit.de/news/2026-02/14/sicherheitslage-sorgt-fuer-zulauf-bei-reservisten-im-norden;Hier finden Sie Informationen zu dem Thema „Reservistenverband“. Lesen Sie jetzt „Sicherheitslage sorgt für Zulauf bei Reservisten im Norden“.;Reservistenverband;News, Reservistenverband, Marc Lemmermann, Schleswig-Holstein, Schleswig, Holstein, Deutsche Presse-Agentur, Bundeswehr, Sicherheitslage, Reservistenverband;2026-02-14T06:00:06+01:00;2026-02-14T06:00:06+01:00;;dpa Hamburg/Schleswig-Holstein;false
09581d9f9652bbce0692f202e545d3743039411f14afa9156728dcbc1d6b2cd8;Patentkrimi ums Telefon: Bell setzt sich mit List durch;https://www.zeit.de/news/2026-02/14/patentkrimi-ums-telefon-bell-setzt-sich-mit-list-durch;Hier finden Sie Informationen zu dem Thema „Vor 150 Jahren“. Lesen Sie jetzt „Patentkrimi ums Telefon: Bell setzt sich mit List durch“.;Vor 150 Jahren;News, Vor 150 Jahren, Alexander Graham Bell, Elisha Gray, Johann Philipp Reis, Zenas Fisk Wilber, Philipp Reis, Washington, D. C., AT&T, Patentkrimi, Technikgeschichte;2026-02-14T06:00:05+01:00;2026-02-14T06:00:05+01:00;;dpa;false
7ab54b219e1b4a2e341f4f7620cae6dfa4643f5ef1b21de2fbb9b6f58452c60c;Sparpläne bei Integrationskursen lösen Kritik aus;https://www.zeit.de/news/2026-02/14/sparplaene-bei-integrationskursen-loesen-kritik-aus;Hier finden Sie Informationen zu dem Thema „Migrationspolitik“. Lesen Sie jetzt „Sparpläne bei Integrationskursen lösen Kritik aus“.;Migrationspolitik;News, Migrationspolitik, Kirstin Neumann, Brandenburg, Bundesinnenministerium, Bamf, Integrationskurs, Migrationspolitik, Sparplan, Kritik, Flüchtlinge;2026-02-14T06:00:05+01:00;2026-02-14T06:00:05+01:00;;dpa Berlin/Brandenburg;false
707a19adc0948c617d39142546820d1470fd8b89fa3f68c5c9dd93d81d728804;US-Militär meldet drei Tote bei Angriff auf angebliches Drogenboot;https://www.zeit.de/politik/ausland/2026-02/angriff-drogenboot-usa-drei-tote-gxe;Erneut hat das US-Militär ein angebliches Drogenboot angegriffen und dabei drei Menschen getötet. Kritiker halten das Vorgehen für einen Verstoß gegen das Völkerrecht.;Karibik;Politik, Karibik, Karibik, Pete Hegseth, Donald Trump, US-Regierung, Drogenhandel, Militär;2026-02-14T05:59:52+01:00;2026-02-14T05:59:52+01:00;htg;DIE ZEIT,        dpa,        AP,        AFP,        							htg;false
8647395abbff0f23c8bc6594f41b9e6b533740247cecd16ec8123add050e0566;Historischer Meilenstein: HSV vor 1.887. Bundesliga-Spiel;https://www.zeit.de/news/2026-02/14/historischer-meilenstein-hsv-vor-1-887-bundesliga-spiel;Hier finden Sie Informationen zu dem Thema „Fußball-Bundesliga“. Lesen Sie jetzt „Historischer Meilenstein: HSV vor 1.887. Bundesliga-Spiel“.;Fußball-Bundesliga;News, Fußball-Bundesliga, Charly Dörfel, SC Germania, FC Falke, Borussia Dortmund, Hamburger SV, 1. FC Union Berlin, FC Bayern München, Eintracht Frankfurt, Bundesliga, Fußball-Bundesliga;2026-02-14T05:48:05+01:00;2026-02-14T05:48:05+01:00;;dpa Hamburg/Schleswig-Holstein;false
abf64102b101a0fddab4946c9a989f2204a500ec510196c9eaad1c12302a4069;Datenschützer fordern Beschränkungen für Bodycam-Einsatz der Bahn;https://www.zeit.de/politik/deutschland/2026-02/deutsche-bahn-datenschuetzer-forderung-einschraenkungen-bodycams;Um Mitarbeiter besser vor Angriffen zu schützen, will die Deutsche Bahn sie mit Bodycams ausstatten. Diese dürften aber nicht permanent filmen, mahnen Datenschützer.;Deutsche Bahn;Digital, Deutsche Bahn, Alexander Roßnagel, Kirsten Bock, DB, Deutsche Bahn, RedaktionsNetzwerk Deutschland, Datenschützer, Bodycameinsatz, Bodycam, Einschränkung, Angriff;2026-02-14T05:32:31+01:00;2026-02-14T05:32:31+01:00;eca;DIE ZEIT,        dpa,        AFP,        							eca;false
3ae8898f3569985778a956a28f0a65774b98c8bc2a0e1c7afa3643773f3f2006;Die Eisberge in Geesthacht trotzten dem Tauwetter;https://www.zeit.de/news/2026-02/14/die-eisberge-in-geesthacht-trotzten-dem-tauwetter;Hier finden Sie Informationen zu dem Thema „Eisiges Naturspektakel“. Lesen Sie jetzt „Die Eisberge in Geesthacht trotzten dem Tauwetter“.;Eisiges Naturspektakel;News, Eisiges Naturspektakel, Geesthacht, Elbe, Kreis Herzogtum Lauenburg, Eisbergen, Eisberg, Naturspektakel, Naturereignis, Wetter, Auto, Eis;2026-02-14T05:30:06+01:00;2026-02-14T05:30:06+01:00;;dpa Hamburg/Schleswig-Holstein;false
af4101facbf02e13edd1dbf0badd68a738ec3164131435dc44a9fd1108dc0df8;Landesforsten versteigern wertvolle Nadelhölzer online;https://www.zeit.de/news/2026-02/14/landesforsten-versteigern-wertvolle-nadelhoelzer-online;Hier finden Sie Informationen zu dem Thema „Wertvolle Bäume“. Lesen Sie jetzt „Landesforsten versteigern wertvolle Nadelhölzer online“.;Wertvolle Bäume;News, Wertvolle Bäume, Stefan Heidecke, Oerrel, Niedersachsen, Mecklenburg-Vorpommern, Landesforst, Nadelholz;2026-02-14T05:30:05+01:00;2026-02-14T05:30:05+01:00;;dpa Mecklenburg-Vorpommern;false
