Hash;Title;Link;Description;Category;KeyWords;Published;LastUpdated;Author;Source;Paywall
1da2b4d4f9b4c12a9210be5888368a902967d4922375a6842f07bc3a0036ee8e;Michael Wimmer neuer Trainer in Regensburg;https://www.zeit.de/news/2025-05/23/michael-wimmer-neuer-trainer-in-regensburg;Hier finden Sie Informationen zu dem Thema „3. Liga“. Lesen Sie jetzt „Michael Wimmer neuer Trainer in Regensburg“.;3. Liga;News, 3. Liga, Michael Wimmer, Regensburg, SSV Jahn Regensburg, Zweijahresvertrag;2025-05-23T18:07:30+02:00;2025-05-23T18:07:30+02:00;;dpa Bayern;false
a3bb9a4a525c40311967ef502166e546d6f1bc71f078921ab67d17950208914f;FC Augsburg trennt sich von Trainer und Sportdirektor;https://www.zeit.de/news/2025-05/23/fc-augsburg-trennt-sich-von-trainer-und-sportdirektor;Hier finden Sie Informationen zu dem Thema „Fußball-Bundesliga“. Lesen Sie jetzt „FC Augsburg trennt sich von Trainer und Sportdirektor“.;Fußball-Bundesliga;News, Fußball-Bundesliga, Jess Thorup, Sandro Wagner, Michael Ströll, Augsburg, FC Zürich, FC Augsburg, Fußball-Bundesliga, Bundesliga, Saisonanalyse, Sommer;2025-05-23T18:07:19+02:00;2025-05-23T18:07:19+02:00;;dpa Bayern;false
6974d414c15b17ad495313417f3b42d71118494107d45c144ff345185f50b5ff;Putin will es noch einmal wissen;https://www.zeit.de/politik/ausland/2025-05/russische-offensive-ukrainekrieg-sommer-friedensverhandlungen;Die Europäer glauben, dass Russlands Präsident Verhandlungen mit der Ukraine nur simuliert. Aber warum? Um sie zu ermüden? Seine Pläne dürften weitaus konkreter sein.;"Z+ (abopflichtiger Inhalt);
        
    Russische Offensive";Politik, Russische Offensive, Krieg in der Ukraine, Russland, Wladimir Putin, Militär, Drohne;2025-05-23T18:06:22+02:00;2025-05-23T18:06:22+02:00;Maxim Kireev;;false
95b8ca0c9faea2883e252fdd4b2909b7af10b1f32953f32a83e66bb5eccfefa7;FC Augsburg trennt sich von Trainer Thorup;https://www.zeit.de/news/2025-05/23/fc-augsburg-trennt-sich-von-trainer-thorup;Hier finden Sie Informationen zu dem Thema „Fußball-Bundesliga“. Lesen Sie jetzt „FC Augsburg trennt sich von Trainer Thorup“.;Fußball-Bundesliga;News, Fußball-Bundesliga, News;2025-05-23T18:04:52+02:00;2025-05-23T18:04:52+02:00;;dpa;false
9752772b6ad720188b54b6015aa6885116bf5b30858f3f82c877fab311015074;Trockenheit verursacht Futtermangel - Vorschriften gelockert;https://www.zeit.de/news/2025-05/23/trockenheit-verursacht-futtermangel-vorschriften-gelockert;Hier finden Sie Informationen zu dem Thema „Trockenheit“. Lesen Sie jetzt „Trockenheit verursacht Futtermangel - Vorschriften gelockert“.;Trockenheit;News, Trockenheit, Till Backhaus, Trockenheit, Futtermangel, Vorschrift, Naturschutzauflage;2025-05-23T18:03:31+02:00;2025-05-23T18:03:31+02:00;;dpa Mecklenburg-Vorpommern;false
897ebe1e66760a6f535c65725e46bc623a44905d2a0d3017c2dc50a955dc7b77;Verhandlungsrunde zwischen Iran und USA ohne Durchbruch;https://www.zeit.de/news/2025-05/23/usa-und-iran-atomverhandlungen-gehen-in-entscheidende-phase;Hier finden Sie Informationen zu dem Thema „Atomstreit“. Lesen Sie jetzt „Verhandlungsrunde zwischen Iran und USA ohne Durchbruch“.;Atomstreit;News, Atomstreit, Steve Witkoff, Abbas Araghtschi, Tammy Bruce, X. Grajewski, USA, Iran, Teheran, Rom, Oman, Maskat;2025-05-23T18:02:38+02:00;2025-05-23T18:02:38+02:00;;dpa;false
5e10ed6c6b3dc510fad2e6c3cd977199fb4447efdcd6bf8edbd98bdf6ad65e3d;Baustart für Multifunktionshalle vorerst symbolisch;https://www.zeit.de/news/2025-05/23/baustart-fuer-multifunktionshalle-vorerst-symbolisch;Hier finden Sie Informationen zu dem Thema „Eisenach“. Lesen Sie jetzt „Baustart für Multifunktionshalle vorerst symbolisch“.;Eisenach;News, Eisenach, Eisenach, Baustart, Multifunktionshalle, Veranstaltungsarena;2025-05-23T18:00:35+02:00;2025-05-23T18:00:35+02:00;;dpa Thüringen;false
bc810d15dcea23939accd9bc05aaff2398d48ee498823a2796f4647fceb5c908;UN-Chef: Gesamte Bevölkerung Gazas von Hungersnot bedroht;https://www.zeit.de/news/2025-05/23/hilfe-erreicht-menschen-in-gaza-tropfen-im-ozean;Hier finden Sie Informationen zu dem Thema „Gaza-Krieg“. Lesen Sie jetzt „UN-Chef: Gesamte Bevölkerung Gazas von Hungersnot bedroht“.;Gaza-Krieg;News, Gaza-Krieg, Kerem Schalom, Tom Fletcher, Benjamin Netanjahu, Gazastreifen, Gaza, UN, Hamas, Brot, Ozean, Hilfsgut;2025-05-23T18:00:00+02:00;2025-05-23T18:00:00+02:00;;dpa;false
8d96b095eabaf9b6a84b15368c67d53494a248e5cd9d842ea9674f34e515ff68;Mutter von totem Baby in Neukölln stellt sich bei Polizei;https://www.zeit.de/news/2025-05/23/mutter-von-totem-baby-in-neukoelln-stellt-sich-bei-polizei;Hier finden Sie Informationen zu dem Thema „Kriminalität“. Lesen Sie jetzt „Mutter von totem Baby in Neukölln stellt sich bei Polizei“.;Kriminalität;News, Kriminalität, Neukölln, Berlin-Gropiusstadt, Polizei, Staatsanwaltschaft, Kriminalität, Säugling;2025-05-23T17:56:16+02:00;2025-05-23T17:56:16+02:00;;dpa Berlin/Brandenburg;false
e4f1cd5c7558c97d154d112a60df0777391095a294af65f078f32a2cdda46014;Berlin wagt den Olympia-Sprung mit vier Partnern;https://www.zeit.de/news/2025-05/23/berlin-wagt-den-olympia-sprung-mit-vier-partnern;Hier finden Sie Informationen zu dem Thema „Nationale Bewerbung“. Lesen Sie jetzt „Berlin wagt den Olympia-Sprung mit vier Partnern“.;Nationale Bewerbung;News, Nationale Bewerbung, Michael Mronz, Kai Wegner, Dietmar Woidke, Manuela Schwesig, Berlin, Brandenburg, Sachsen, Schleswig-Holstein, Europa, Leipzig;2025-05-23T17:52:48+02:00;2025-05-23T17:52:48+02:00;;dpa Berlin/Brandenburg;false
4dff46aa69f76900c4bca057aaf76e272d7794f080972256656e37182fb99724;LNG-Tanker nach Grundberührung weiter vor Rügen festgesetzt;https://www.zeit.de/news/2025-05/23/lng-tanker-nach-grundberuehrung-weiter-vor-ruegen-festgesetzt;Hier finden Sie Informationen zu dem Thema „Schifffahrt“. Lesen Sie jetzt „LNG-Tanker nach Grundberührung weiter vor Rügen festgesetzt“.;Schifffahrt;News, Schifffahrt, Mukran, Sassnitz, LNG, Grundberührung, Schifffahrt, Wasserschutzpolizei, Schiff;2025-05-23T17:49:31+02:00;2025-05-23T17:49:31+02:00;;dpa Mecklenburg-Vorpommern;false
34e292cc495dace6b5664a3d8419cd1b77887bfe916fd9075b512e1781e5a681;"""Moabit Hilft"" will auch ohne eigene Räume weitermachen";https://www.zeit.de/news/2025-05/23/moabit-hilft-will-auch-ohne-eigene-raeume-weitermachen;"Hier finden Sie Informationen zu dem Thema „Soziales“. Lesen Sie jetzt „""Moabit Hilft"" will auch ohne eigene Räume weitermachen“.";Soziales;News, Soziales, Diana Henniges, Moabit, Deutsche Presse-Agentur;2025-05-23T17:49:26+02:00;2025-05-23T17:49:26+02:00;;dpa Berlin/Brandenburg;false
a2b147c433adcfc5206278bcb13cefed1f39aa394c494aa708b5e875377e3542;Angriff auf Mitschüler: Tatverdächtiger 13-Jähriger gefasst;https://www.zeit.de/news/2025-05/23/nach-angriff-an-schule-13-jaehriger-noch-immer-verschwunden;Hier finden Sie Informationen zu dem Thema „Angriff in Berlin“. Lesen Sie jetzt „Angriff auf Mitschüler: Tatverdächtiger 13-Jähriger gefasst“.;Angriff in Berlin;News, Angriff in Berlin, Spandau, Polizei, Angriff;2025-05-23T17:44:09+02:00;2025-05-23T17:44:09+02:00;;dpa;false
2ec9d18b8e246c788ebb249af915e2608b893ce22464231dffa931028b515182;Bewerber für Demokratiepreis gesucht;https://www.zeit.de/news/2025-05/23/bewerber-fuer-demokratiepreis-gesucht;Hier finden Sie Informationen zu dem Thema „Auszeichnung“. Lesen Sie jetzt „Bewerber für Demokratiepreis gesucht“.;Auszeichnung;News, Auszeichnung, Amadeu Antonio Stiftung, Demokratiepreis, Auszeichnung, Förderpreis;2025-05-23T17:42:08+02:00;2025-05-23T17:42:08+02:00;;dpa Sachsen;false
04787e21cb6bbb7d3f748f720a663935c472d9f9047f7862d328acd3a4821a6c;Drittligist Mannheim muss knapp 50.000 Euro zahlen;https://www.zeit.de/news/2025-05/23/drittligist-mannheim-muss-knapp-50-000-euro-zahlen;Hier finden Sie Informationen zu dem Thema „Geldstrafe“. Lesen Sie jetzt „Drittligist Mannheim muss knapp 50.000 Euro zahlen“.;Geldstrafe;News, Geldstrafe, SV Waldhof Mannheim, Dynamo Dresden, Geldstrafe;2025-05-23T17:41:14+02:00;2025-05-23T17:41:14+02:00;;dpa Baden-Württemberg;false
27434c885fe84df094c89b12c7683ceec4fd12ec646fa42743657b45eda9daa2;Festnahme: Mann soll eigenen Vater getötet haben;https://www.zeit.de/news/2025-05/23/festnahme-mann-soll-eigenen-vater-getoetet-haben;Hier finden Sie Informationen zu dem Thema „Kriminalität“. Lesen Sie jetzt „Festnahme: Mann soll eigenen Vater getötet haben“.;Kriminalität;News, Kriminalität, Kriminalität, Festnahme;2025-05-23T17:32:52+02:00;2025-05-23T17:32:52+02:00;;dpa Baden-Württemberg;false
60448d21662c7c8eef1591c251bf3d4f53a2a00525315e5eb695695bc856d8ec;Länder-Energieminister für Kontinuität in der Energiewende;https://www.zeit.de/news/2025-05/23/laender-energieminister-fuer-kontinuitaet-in-der-energiewende;Hier finden Sie Informationen zu dem Thema „Ministerkonferenz“. Lesen Sie jetzt „Länder-Energieminister für Kontinuität in der Energiewende“.;Ministerkonferenz;News, Ministerkonferenz, Wolfgang Blank, Katherina Reiche, Rostock-Warnemünde, Mecklenburg-Vorpommern, CDU, Ministerkonferenz, Kontinuität, Energiewende;2025-05-23T17:31:32+02:00;2025-05-23T17:31:32+02:00;;dpa Bayern;false
387d13a50e8456a17ae28f680fccbb5b73acb0517893c3fccae8e6fa3bc48191;"""Macht keinen Sinn"": Funkel bleibt nicht länger in Köln";https://www.zeit.de/news/2025-05/23/macht-keinen-sinn-funkel-bleibt-nicht-laenger-in-koeln;"Hier finden Sie Informationen zu dem Thema „Fußball-Bundesliga“. Lesen Sie jetzt „""Macht keinen Sinn"": Funkel bleibt nicht länger in Köln“.";Fußball-Bundesliga;News, Fußball-Bundesliga, Friedhelm Funkel, Thomas Kessler, Köln, 1. FC Köln, Fußball-Bundesliga, Bundesliga;2025-05-23T17:28:21+02:00;2025-05-23T17:28:21+02:00;;dpa Nordrhein-Westfalen;false
e4476ffbb841d0c2c16c91ebe6b28ecb16e0d3937542048b98819e19d2beb833;Polizei nimmt Verdächtigen nach Messerangriff an Schule in Gewahrsam;https://www.zeit.de/gesellschaft/2025-05/festnahme-messerattacke-grundschule-13-jaehriger-spandau;Die Polizei hat in Berlin den 13-Jährigen gefasst, der einen Mitschüler mit einem Messer schwer verletzt haben soll. Er war bundesweit gesucht worden.;Angriff auf Grundschüler;Gesellschaft, Angriff auf Grundschüler, Spandau, Berlin, Polizei, Grundschule;2025-05-23T17:26:19+02:00;2025-05-23T17:26:19+02:00;edd;ZEIT ONLINE,        dpa,        AFP,        							edd;false
670481b5a4c64567a977bd47a7a430396b455b189fedf504e25e884aeb1effe4;Drohmails an Schulen - Unterricht fällt teilweise aus;https://www.zeit.de/news/2025-05/23/drohschreiben-an-mehreren-nrw-schulen-eingegangen;Hier finden Sie Informationen zu dem Thema „Kriminalität“. Lesen Sie jetzt „Drohmails an Schulen - Unterricht fällt teilweise aus“.;Kriminalität;News, Kriminalität, NRW-Schulen, Drohschreiben, Kriminalität;2025-05-23T17:25:04+02:00;2025-05-23T17:25:04+02:00;;dpa Nordrhein-Westfalen;false
e3e932abdfd206d530a89b9c5a937c1d5f93bed41eb2fca7d91b5809f63e1e42;Gespräche über Zulage für Parlamentarische Geschäftsführer;https://www.zeit.de/news/2025-05/23/gespraeche-ueber-zulage-fuer-parlamentarische-geschaeftsfuehrer;Hier finden Sie Informationen zu dem Thema „Landtag“. Lesen Sie jetzt „Gespräche über Zulage für Parlamentarische Geschäftsführer“.;Landtag;News, Landtag, FDP, CDU, SPD, FAZ, Landtag;2025-05-23T17:21:29+02:00;2025-05-23T17:21:29+02:00;;dpa Hessen;false
0d0bb12668cdce73b094f4cfae937007b6d1ad6ae165e2e0344efb6758b31305;Nach 13 Jahren: Dienstältester HSV-Profi hört auf;https://www.zeit.de/news/2025-05/23/nach-13-jahren-dienstaeltester-hsv-profi-hoert-auf;Hier finden Sie Informationen zu dem Thema „Fußball-Bundesliga“. Lesen Sie jetzt „Nach 13 Jahren: Dienstältester HSV-Profi hört auf“.;Fußball-Bundesliga;News, Fußball-Bundesliga, Tom Mickel, Hamburg, HSV, Hamburger SV, Fußball-Bundesliga, Bundesliga;2025-05-23T17:20:36+02:00;2025-05-23T17:20:36+02:00;;dpa Hamburg/Schleswig-Holstein;false
e01be36744afe6b6e9d3ee8ad215e55838eb6e8ea46f32736aaa530853c04e79;"Keine juristischen Folgen zu ""Hofnarr-Affäre""";https://www.zeit.de/news/2025-05/23/keine-juristischen-folgen-zu-hofnarr-affaere;"Hier finden Sie Informationen zu dem Thema „Ermittlungen eingestellt“. Lesen Sie jetzt „Keine juristischen Folgen zu ""Hofnarr-Affäre""“.";Ermittlungen eingestellt;News, Ermittlungen eingestellt, Olaf Scholz, Joe Chialo, Berlin, Tagesspiegel, SPD, CDU, Staatsanwaltschaft, Ermittlung, Kritik;2025-05-23T17:20:18+02:00;2025-05-23T17:20:18+02:00;;dpa Berlin/Brandenburg;false
63b388fc412a88df8a04d54998413ec9e1dcbbb9980ca78c8976411920bf7612;Russland und Ukraine tauschen erste 390 Gefangene aus;https://www.zeit.de/news/2025-05/23/ukraine-weist-putins-plan-fuer-pufferzone-zurueck;Hier finden Sie Informationen zu dem Thema „Ukraine-Krieg“. Lesen Sie jetzt „Russland und Ukraine tauschen erste 390 Gefangene aus“.;Ukraine-Krieg;News, Ukraine-Krieg, Wladimir Putin, Andrij Sybiha, Heorhij Tychyj, Wolodymyr Selenskyj, Kursk, Belgorod, Russland, X, G7, Pufferzone;2025-05-23T17:19:42+02:00;2025-05-23T17:19:42+02:00;;dpa;false
e87bffae150837695773142bdd7941be2a60c11a41913a850d8911675caee868;Arminia gegen den VfB: Wüst und Kretschmann fachsimpeln;https://www.zeit.de/news/2025-05/23/arminia-gegen-den-vfb-wuest-und-kretschmann-fachsimpeln;Hier finden Sie Informationen zu dem Thema „DFB-Pokalfinale“. Lesen Sie jetzt „Arminia gegen den VfB: Wüst und Kretschmann fachsimpeln“.;DFB-Pokalfinale;News, DFB-Pokalfinale, Winfried Kretschmann, Hendrik Wüst, Stuttgart, Nordrhein-Westfalen, Baden-Württemberg, Westfalen, Arminia Bielefeld, Deutscher Fußball-Bund, VfB Stuttgart, CDU;2025-05-23T17:16:27+02:00;2025-05-23T17:16:27+02:00;;dpa Baden-Württemberg;false
106a33a31cf4b17083fc50b3a2a09fd5f5e8dfcb14a36480d9f60822b326c3fb;Berlin bewirbt sich mit vier anderen Ländern um Olympia;https://www.zeit.de/news/2025-05/23/berlin-bewirbt-sich-mit-vier-anderen-laendern-um-olympia;Hier finden Sie Informationen zu dem Thema „Nationale Bewerbung“. Lesen Sie jetzt „Berlin bewirbt sich mit vier anderen Ländern um Olympia“.;Nationale Bewerbung;News, Nationale Bewerbung, Berlin, Brandenburg, Sachsen, Schleswig-Holstein, Mecklenburg-Vorpommern, Olympiastadion Berlin, CDU, SPD, Olympia, Paralympics;2025-05-23T17:13:48+02:00;2025-05-23T17:13:48+02:00;;dpa Berlin/Brandenburg;false
64b50a35542b5a397cf5dcc754ddb16f6d6f2fca13012620b3e9f6085c39075e;Düsseldorfer EG verlängert mit Max Balinson;https://www.zeit.de/news/2025-05/23/duesseldorfer-eg-verlaengert-mit-max-balinson;Hier finden Sie Informationen zu dem Thema „Eishockey“. Lesen Sie jetzt „Düsseldorfer EG verlängert mit Max Balinson“.;Eishockey;News, Eishockey, Max Balinson, Leon Hümer, EG, DEL, DEL2, Eishockey, Personalplanung;2025-05-23T17:13:45+02:00;2025-05-23T17:13:45+02:00;;dpa Nordrhein-Westfalen;false
cac416431097bcec9890fc5c3adc4aee002716ff71bce11e7c5f272a30b5ec6c;Karl Mays literarische Helden kommentieren die Gegenwart;https://www.zeit.de/news/2025-05/23/karl-mays-literarische-helden-kommentieren-die-gegenwart;Hier finden Sie Informationen zu dem Thema „Ausstellungsprojekt“. Lesen Sie jetzt „Karl Mays literarische Helden kommentieren die Gegenwart“.;Ausstellungsprojekt;News, Ausstellungsprojekt, Karl May, Karl Mays, Ausstellungsprojekt;2025-05-23T17:09:57+02:00;2025-05-23T17:09:57+02:00;;dpa Sachsen;false
9bc688e9734b261717fe88ec29859ad555e1e78165573b00653c699dbd262ae2;Teilerfolg für One-Dyas im Kabel-Streit für Gasförderung;https://www.zeit.de/news/2025-05/23/teilerfolg-fuer-one-dyas-im-kabel-streit-fuer-gasfoerderung;Hier finden Sie Informationen zu dem Thema „Energieprojekt vor Borkum“. Lesen Sie jetzt „Teilerfolg für One-Dyas im Kabel-Streit für Gasförderung“.;Energieprojekt vor Borkum;News, Energieprojekt vor Borkum, Borkum, Nordsee, Oldenburg, Hannover, Verwaltungsgericht, BMU, Teilerfolg, Gasförderung, Energieprojekt, Stromkabel;2025-05-23T16:59:51+02:00;2025-05-23T16:59:51+02:00;;dpa Niedersachsen;false
b19c6f356220f6a91f17ac23e242f483397b06ad66fbca29ab7208793a24f6e9;UN prangern Gewalteskalation im Südsudan an;https://www.zeit.de/politik/ausland/2025-05/un-suedsudan-gewalt-menschenrechte;Der UN-Kommissar für Menschenrechte hat vor den Entwicklungen im Südsudan gewarnt. Zuletzt gab es vermehrt tödliche Angriffe auf Zivilisten, Tausende wurden vertrieben. ;Bürgerkrieg;Politik, Bürgerkrieg, Südsudan, UN, Bürgerkrieg, Menschenrechte, Sudan;2025-05-23T16:58:59+02:00;2025-05-23T16:58:59+02:00;bam;ZEIT ONLINE,        Reuters,        KNA,        							bam;false
b311a13611df6fdfa4e205fb4e2120e82aee26ace4776dc3e49fe62616c204dc;Vor Karriereende: Toba turnt bei Heim-EM keinen Mehrkampf;https://www.zeit.de/news/2025-05/23/vor-karriereende-toba-turnt-bei-heim-em-keinen-mehrkampf;Hier finden Sie Informationen zu dem Thema „Turnen“. Lesen Sie jetzt „Vor Karriereende: Toba turnt bei Heim-EM keinen Mehrkampf“.;Turnen;News, Turnen, Jens Milbradt, Nils Dunkel, Andreas Toba, Leipzig, Ludwigsburg, Eder, Turn-Europameisterschaften, Karriereende, Mehrkampf, Finale;2025-05-23T16:57:48+02:00;2025-05-23T16:57:48+02:00;;dpa Sachsen;false
c8c06b72949f488009feea3cbd796337ffd51193ff1e58841182c8840a1c384e;Schüsse in Essen - Polizei vermutet Clan-Konflikt;https://www.zeit.de/news/2025-05/23/frau-wird-durch-schuesse-verletzt-taeter-auf-der-flucht;Hier finden Sie Informationen zu dem Thema „Kriminalität“. Lesen Sie jetzt „Schüsse in Essen - Polizei vermutet Clan-Konflikt“.;Kriminalität;News, Kriminalität, Polizei;2025-05-23T16:54:39+02:00;2025-05-23T16:54:39+02:00;;dpa Nordrhein-Westfalen;false
c7f49d2aec8c0d2d72cda6f988cbbbbdf3407d6c597d01ba9c15f78e8034ffdb;Schweitzer in Vertretung der katholischen Laien gewählt;https://www.zeit.de/news/2025-05/23/schweitzer-in-vertretung-der-katholischen-laien-gewaehlt;Hier finden Sie Informationen zu dem Thema „Kirche“. Lesen Sie jetzt „Schweitzer in Vertretung der katholischen Laien gewählt“.;Kirche;News, Kirche, Alexander Schweitzer;2025-05-23T16:51:45+02:00;2025-05-23T16:51:45+02:00;;dpa Rheinland-Pfalz/Saarland;false
b0b9910aa99f634315944901ab1cb439cecffcede388d10ee3f63cb57d591205;Lee Chang Dongs brennender Filmtraum;https://www.zeit.de/2025/22/burning-lee-chang-dong-film-thriller-christian-petzold;"Christian Petzold schreibt über das Thema „""Burning""“. Lesen Sie jetzt „Lee Chang Dongs brennender Filmtraum“.";"Z+ (abopflichtiger Inhalt);
        
    ""Burning""";"Kultur, ""Burning"", Lee Chang Dong, André Bazin, Jean-Luc Godard, Berlin, Chang, Seoul, Südkorea, Kinowelt, Filmtraum, Sommernachmittag";2025-05-23T16:50:11+02:00;2025-05-23T16:50:11+02:00;Christian Petzold;Aus der        ZEIT Nr. 22/2025;false
532cc8f6c8dab8f488fb5fe48b5bce4fe4fcde42c56ea86d9466ddb04e201b67;Die beste Mode des  21. Jahrhunderts;https://www.zeit.de/2025/22/modetrends-21-jahrhundert-kleidung-design;Hier finden Sie Informationen zu dem Thema „Modetrends “. Lesen Sie jetzt „Die beste Mode des  21. Jahrhunderts“.;"Z+ (abopflichtiger Inhalt);
        
    Modetrends";Kultur, Modetrends , Skinny Jeans, Mann, Mode, Nullerjahr;2025-05-23T16:50:08+02:00;2025-05-23T16:50:08+02:00;;Aus der        ZEIT Nr. 22/2025;false
37244b3811236475e4fb1e4bfbc59bd9848e76363e2277fd176472fe4d3857ef;Ein Tisch, ein Stuhl, ein Blick;https://www.zeit.de/2025/22/the-artist-is-present-marina-abramovic-perfromance-kuenstlerin;Was sehen Sie, wenn Sie dieser Frau länger in die Augen schauen? Marina Abramović beantwortete die Frage, was Kunst ist, ganz neu.;"Z+ (abopflichtiger Inhalt);
        
    ""The Artist Is Present"" von Marina Abramović";"Kultur, ""The Artist Is Present"" von Marina Abramović , Marina Abramović, Hanno Rauterberg, Isabella Rossellini, Lou Reed, Cyprien Gaillard, Antony Gormley, Björk, New York, Hamburg, Deichtorhallen";2025-05-23T16:50:04+02:00;2025-05-23T16:50:04+02:00;Hanno Rauterberg;Aus der        ZEIT Nr. 22/2025;false
f123b2de8077c1c43dbd80fac84053f96e1efb99bf18a82f178ef1f7c8d832ec;Die besten Podcasts des 21. Jahrhunderts;https://www.zeit.de/2025/22/podcast-sendungen-erfolgreich-21-jahrhundert-folgen;Hier finden Sie Informationen zu dem Thema „Podcast-Sendungen “. Lesen Sie jetzt „Die besten Podcasts des 21. Jahrhunderts“.;"Z+ (abopflichtiger Inhalt);
        
    Podcast-Sendungen";Kultur, Podcast-Sendungen , Podcast, Coronavirus;2025-05-23T16:50:00+02:00;2025-05-23T16:50:00+02:00;;Aus der        ZEIT Nr. 22/2025;false
9774156b19e7e85ebe700cd34a0ca97271360c39f49911a491519ed5bf0a7cd6;"""Drive My Car"" erzählt von unserer Sehnsucht nach Austausch";https://www.zeit.de/2025/22/drive-my-car-hamaguchi-ryusuke-japan-film-drama;ZEIT ONLINE | Nachrichten, Hintergründe und Debatten;"Z+ (abopflichtiger Inhalt);
        
    ""Drive My Car""";"Kultur, ""Drive My Car"", Ryusuke Hamaguchi, Haruki Murakami, Yusuke Kafuku, Anton Tschechow, Hiroshima, SaaB, Onkel Wanja, Sehnsucht, Kino, Auto";2025-05-23T16:49:57+02:00;2025-05-23T16:49:57+02:00;Katja Nicodemus;Aus der        ZEIT Nr. 22/2025;false
5d0c959f0b50f8091349b93a221dea09822e9d60a890f35bcea930d5335244d5;Als Podcasts lernten, Literatur zu sein;https://www.zeit.de/2025/22/s-town-podcast-brian-reed-journalismus-investigativ;Ein Uhrmacher aus einer Kleinstadt in Alabama behauptet, von einem Mord zu wissen. Ein Reporter nimmt die Spur auf.;"Z+ (abopflichtiger Inhalt);
        
    Geniale Einfälle";Kultur, Geniale Einfälle, Dirk Peitz, Brian Reed, John B, Alabama, Mclemores, Mord, Einfall, Kleinstadt, Podcast;2025-05-23T16:49:53+02:00;2025-05-23T16:49:53+02:00;Dirk Peitz;Aus der        ZEIT Nr. 22/2025;false
d53ae65a413e78a978bb132894d0a03bdbedc836c5cc3bc5479c49fbf73ab563;Die besten Filme des 21. Jahrhunderts;https://www.zeit.de/2025/22/filme-21-jahrhundert-kino-regisseure-schauspieler;Welche Filme werden in die Geschichte des 21. Jahrhunderts eingehen? Das ZEIT Feuilleton hat die wichtigsten Filme der vergangenen 25 Jahre ausgewählt.;"Z+ (abopflichtiger Inhalt);
        
    Filme im 21. Jahrhundert";Kultur, Filme im 21. Jahrhundert , Hayao Miyazaki, David Lynch, Lucrecia Martel, Sofia Coppola, Bill Murray, Scarlett Johansson, Quentin Tarantino, Uma Thurman, Michael Haneke, Woody Allen Woody Allen;2025-05-23T16:49:49+02:00;2025-05-23T16:49:49+02:00;;Aus der        ZEIT Nr. 22/2025;false
0eb5fb851e37ca3f4c0c4a81f6b3b04248f62ee6d605a1a99d5e0a5b18fa2b6a;"""Toni Erdmann"" und der humanistische Humor";https://www.zeit.de/2025/22/toni-erdmann-maren-ade-filmfestival-cannes-komoedie;"Katja Nicodemus schreibt über das Thema „""Toni Erdmann""“. Lesen Sie jetzt „""Toni Erdmann"" und der humanistische Humor“.";"Z+ (abopflichtiger Inhalt);
        
    ""Toni Erdmann""";"Kultur, ""Toni Erdmann"", Toni Erdmann, Maren Ades, Sandra Hüller, Peter Simonischek, Cannes, Palais des Festivals et des Congrès, Kino";2025-05-23T16:49:46+02:00;2025-05-23T16:49:46+02:00;Katja Nicodemus;Aus der        ZEIT Nr. 22/2025;false
0c9d5605a48314ff1cf45dc5158f2f1e951c9337110c19768469e1b5dbf4d37f;Sekundenschläfrig und  voller Energie: Als Billie Eilish die Welt eroberte;https://www.zeit.de/2025/22/billie-eilish-saengerin-erfolg-karriere;Julia Lorenz schreibt über das Thema „Billie Eilish“. Lesen Sie jetzt „Sekundenschläfrig und  voller Energie: Als Billie Eilish die Welt eroberte“.;"Z+ (abopflichtiger Inhalt);
        
    Billie Eilish";Kultur, Billie Eilish, Billie Eilish, Greta Thunberg, Sängerin, Stockholm, Sindelfingen, Klimaaktivismus, Generation Z, Teenager;2025-05-23T16:49:42+02:00;2025-05-23T16:49:42+02:00;Julia Lorenz;Aus der        ZEIT Nr. 22/2025;false
5f88275a70d1e39b199bf4ae0f9ae08fc7f34ab126e0e2fd3632716e6969a724;"""Wall-E"" und der neue Animationsrealismus";https://www.zeit.de/2025/22/wall-e-animation-kunst-klimawandel-kritik;"Wolfgang M. Schmitt schreibt über das Thema „""Wall-E""“. Lesen Sie jetzt „""Wall-E"" und der neue Animationsrealismus“.";"Z+ (abopflichtiger Inhalt);
        
    ""Wall-E""";"Kultur, ""Wall-E"", Pixar Animation Studios, Walt Disney, Wall-E, Animationsrealismus, Animationsstudio, Kinderfilm, Vermenschlichung, Auto, Kino, Ordnung";2025-05-23T16:49:38+02:00;2025-05-23T16:49:38+02:00;Wolfgang M. Schmitt;Aus der        ZEIT Nr. 22/2025;false
6e1405cff28c6cad803ac5e0ecc683d70f9f32855641b1cab7a08229c8489a14;Gern schnell. Besser langsam;https://www.zeit.de/2025/22/thinking-fast-and-slow-daniel-kahneman-sachbuch-psychologie;Gerade noch hatte der Mensch als rational gegolten,  aber dann kam Kahnemann. Und alles war ganz schön anders.;"Z+ (abopflichtiger Inhalt);
        
    ""Thinking, Fast and Slow""";"Kultur, ""Thinking, Fast and Slow"" , Elisabeth von Thadden, Daniel Kahnemann, Bauchgefühl";2025-05-23T16:49:35+02:00;2025-05-23T16:49:35+02:00;Elisabeth von Thadden;Aus der        ZEIT Nr. 22/2025;false
ff2bb5608825af49c4911d7b558a4d1f031e1809b51f75ad3c501b53ba15dd9f;Jetzt reicht’s;https://www.zeit.de/2025/22/sachbuecher-ungleichheiten-sozial-wirtschaftlich-thomas-piketty-david-graeber;Es war kurz nach der Finanzkrise, da lasen die Menschen plötzlich dicke Bücher über Ungleichheit und Schulden.;"Z+ (abopflichtiger Inhalt);
        
    Sachbücher über Ungleichheiten";Kultur, Sachbücher über Ungleichheiten, Nils Markwardt, David Graeber, Thomas Piketty, Ägypten, Mesopotamien, Ungleichheit, Finanzkrise, Einfall, Zehnerjahr, Schulden;2025-05-23T16:49:31+02:00;2025-05-23T16:49:31+02:00;Nils Markwardt;Aus der        ZEIT Nr. 22/2025;false
