Hash;Title;Link;Description;Category;KeyWords;Published;LastUpdated;Author;Source;Paywall
02cf54f7708dfe571955b209d8733390389c625dda339bf00c704e5b45379d47;US-Regierung droht weiteren 36 Ländern mit Einreisesperren;https://www.zeit.de/politik/ausland/2025-06/usa-donald-trump-einreiseverbot-36-laender-forderungen;Donald Trump erwägt laut Medienberichten zusätzliche Einreiseverbote – darunter sind 25 Staaten aus Afrika. Sie sollen bis Mitte August bestimmte Anforderungen erfüllen.;USA;Politik, USA, US-Regierung, Außenministerium der Vereinigten Staaten, Donald Trump, USA, Reisen, Visum;2025-06-15T17:57:40+02:00;2025-06-15T17:57:40+02:00;ces;ZEIT ONLINE,        Reuters,        							ces;false
d2f7fd3ab365c2b1c77b34db680fb0df52eb7a451a3a572cbd74387625de66d1;"""Teheran brennt"" - Krieg der Erzfeinde eskaliert";https://www.zeit.de/news/2025-06/15/israels-armee-wieder-raketenbeschuss-aus-iran;"Hier finden Sie Informationen zu dem Thema „Lage im Überblick“. Lesen Sie jetzt „""Teheran brennt"" - Krieg der Erzfeinde eskaliert“.";Lage im Überblick;News, Lage im Überblick, Iran, Nahost, Raketenbeschuss, Militär;2025-06-15T17:56:11+02:00;2025-06-15T17:56:11+02:00;;dpa;false
982c47e02c5fd744dfc495263ec57b74619e78f8d1e3fa4f217fe883c698a589;Zweitliga-Duell für Hertha - RSV Eintracht gegen Lautern;https://www.zeit.de/news/2025-06/15/zweitliga-duell-fuer-hertha-rsv-eintracht-gegen-lautern;Hier finden Sie Informationen zu dem Thema „DFB-Pokal“. Lesen Sie jetzt „Zweitliga-Duell für Hertha - RSV Eintracht gegen Lautern“.;DFB-Pokal;News, DFB-Pokal, Gütersloh, Hertha BSC, FC Gütersloh, Deutscher Fußball-Bund, Hertha BSC Berlin, BFC Dynamo, Preußen Münster, SC Preußen 06 e.V. Münster, 1. FC Köln, Hannover 96;2025-06-15T17:55:55+02:00;2025-06-15T17:55:55+02:00;;dpa Berlin/Brandenburg;false
96ea53755329673a9d911d6d978e27daa4f9b3665426c3766caa792234fe72de;Bayern im Pokal bei Wehen Wiesbaden - BVB in Essen;https://www.zeit.de/news/2025-06/15/bayern-im-pokal-bei-wehen-wiesbaden-bvb-in-essen;Hier finden Sie Informationen zu dem Thema „Auslosung der ersten Runde“. Lesen Sie jetzt „Bayern im Pokal bei Wehen Wiesbaden - BVB in Essen“.;Auslosung der ersten Runde;News, Auslosung der ersten Runde, Wiesbaden, Dortmund, BVB, FC Bayern München, SV Wehen Wiesbaden, Pokal, Auslosung;2025-06-15T17:55:47+02:00;2025-06-15T17:55:47+02:00;;dpa Nordrhein-Westfalen;false
6816f6fc41715764863fc7923f14f70690893dbb1353ea685b5449ef392d54c9;Wehen Wiesbaden gegen Bayern München im DFB-Pokal;https://www.zeit.de/news/2025-06/15/wehen-wiesbaden-gegen-bayern-muenchen-im-dfb-pokal;Hier finden Sie Informationen zu dem Thema „Auslosung der ersten Runde“. Lesen Sie jetzt „Wehen Wiesbaden gegen Bayern München im DFB-Pokal“.;Auslosung der ersten Runde;News, Auslosung der ersten Runde, Wiesbaden, München, FC Bayern München, Deutscher Fußball-Bund, SV Wehen Wiesbaden, Wehe, Auslosung, Fußballmuseum;2025-06-15T17:48:29+02:00;2025-06-15T17:48:29+02:00;;dpa Hessen;false
1768def50ab6b10bf0e9a157a5bc9dfdf5ac42930c205b63d41fea6a61ed2092;Lukas Nmecha verlässt Wolfsburg in Richtung England;https://www.zeit.de/news/2025-06/15/lukas-nmecha-verlaesst-wolfsburg-in-richtung-england;Hier finden Sie Informationen zu dem Thema „Fußball-Bundesliga“. Lesen Sie jetzt „Lukas Nmecha verlässt Wolfsburg in Richtung England“.;Fußball-Bundesliga;News, Fußball-Bundesliga, Wolfsburg, England, VfL Wolfsburg, Fußball-Bundesliga, Premier League;2025-06-15T17:48:08+02:00;2025-06-15T17:48:08+02:00;;dpa Niedersachsen;false
7e43cbaad51d4b3f7d5092f92621d8f5d32fd82cb8ef40b994aec7186b7a1a5a;Scheune brennt: Polizei vermutet Blitzschlag als Ursache;https://www.zeit.de/news/2025-06/15/scheune-brennt-polizei-vermutet-blitzschlag-als-ursache;Hier finden Sie Informationen zu dem Thema „Brände“. Lesen Sie jetzt „Scheune brennt: Polizei vermutet Blitzschlag als Ursache“.;Brände;News, Brände, Polizei, Blitzschlag, Enzkreis, Pferdehof, Kelter, Brand;2025-06-15T17:38:52+02:00;2025-06-15T17:38:52+02:00;;dpa Baden-Württemberg;false
1feef8bd1e18b4ca1b4c9294bb7757668bdda15c073fb19c31cf92a69adfd1c9;SEK stürmt Reihenhaus in Hamburg und findet Waffe;https://www.zeit.de/news/2025-06/15/sek-stuermt-reihenhaus-in-hamburg-und-findet-waffe;Hier finden Sie Informationen zu dem Thema „Kriminalität“. Lesen Sie jetzt „SEK stürmt Reihenhaus in Hamburg und findet Waffe“.;Kriminalität;News, Kriminalität, Hamburg, Polizei, Reihenhaus, Kriminalität;2025-06-15T17:38:17+02:00;2025-06-15T17:38:17+02:00;;dpa Hamburg/Schleswig-Holstein;false
b473c0411f3f112d1dca7f2d633b20f32d9f9cb3e7fbe86d50b2396f7ef68ea4;Bei Pogacars Gala: Lipowitz bereit für große Tour-Prüfung;https://www.zeit.de/news/2025-06/15/slowene-pogacar-gewinnt-erstmals-dauphin-rundfahrt;Hier finden Sie Informationen zu dem Thema „Dauphiné-Rundfahrt“. Lesen Sie jetzt „Bei Pogacars Gala: Lipowitz bereit für große Tour-Prüfung“.;Dauphiné-Rundfahrt;News, Dauphiné-Rundfahrt, Tadej Pogacar, Jonas Vingegaard, Dauphiné, Radsport;2025-06-15T17:37:50+02:00;2025-06-15T17:37:50+02:00;;dpa Sport;false
1a2bd967c6e6e2a3781a192d3e262227a9df7e868abd9d51955606c8449feb75;Künftige Landlehrer können sich für Stipendium bewerben;https://www.zeit.de/news/2025-06/15/kuenftige-landlehrer-koennen-sich-fuer-stipendium-bewerben;Hier finden Sie Informationen zu dem Thema „Brandenburg-Stipendium“. Lesen Sie jetzt „Künftige Landlehrer können sich für Stipendium bewerben“.;Brandenburg-Stipendium;News, Brandenburg-Stipendium, Stipendium;2025-06-15T17:34:52+02:00;2025-06-15T17:34:52+02:00;;dpa Berlin/Brandenburg;false
d395d1ebaaf4d4d0670b160a34bfa65664deb414253dbf28896f9b5a15721b31;"""Bild"": Werder mit Niklas Stark über Verlängerung einig";https://www.zeit.de/news/2025-06/15/bild-werder-mit-niklas-stark-ueber-verlaengerung-einig;"Hier finden Sie Informationen zu dem Thema „Fußball-Bundesliga“. Lesen Sie jetzt „""Bild"": Werder mit Niklas Stark über Verlängerung einig“.";Fußball-Bundesliga;News, Fußball-Bundesliga, Niklas Stark, Fußball-Bundesliga;2025-06-15T17:29:27+02:00;2025-06-15T17:29:27+02:00;;dpa Niedersachsen;false
d728beda9190d64a1618414898e33c8c2fbad107bf6d4187927aadf229d668f9;Deutsches Rettungsschiff bringt 65 Geflüchtete nach Sizilien;https://www.zeit.de/gesellschaft/zeitgeschehen/2025-06/sea-eye-5-pazolla-sizilien-migration-rettung-flucht;"Das Schiff ""Sea-Eye 5"" hat in Not geratene Menschen im Mittelmeer gerettet. Nach medizinischen Notfällen durfte es im sizilianischen Pozzallo anlegen.";Seenotrettung;Gesellschaft, Seenotrettung, Seenotrettung, Geflüchtete, Sizilien, Mittelmeer, Migration, Italien;2025-06-15T17:25:21+02:00;2025-06-15T17:25:21+02:00;ore;ZEIT ONLINE,        dpa,        							ore;false
433a4a6ccf3a1eb82483b173d785fef53f9b58179cd5019d0346594a35935a97;Geländewagen landet in Vorgarten;https://www.zeit.de/news/2025-06/15/gelaendewagen-landet-in-vorgarten;Hier finden Sie Informationen zu dem Thema „Unfälle“. Lesen Sie jetzt „Geländewagen landet in Vorgarten“.;Unfälle;News, Unfälle, Wettenberg, Polizei, Geländewagen, Unfall, Vorgarten;2025-06-15T17:22:16+02:00;2025-06-15T17:22:16+02:00;;dpa;false
d86863c8dddaba24c227e23e963ef5dfb68fa60998238bdca1d7c0d7ef806ded;Worum es beim G7-Gipfel in Kanada geht;https://www.zeit.de/news/2025-06/15/worum-es-beim-g7-gipfel-in-kanada-geht;Hier finden Sie Informationen zu dem Thema „International“. Lesen Sie jetzt „Worum es beim G7-Gipfel in Kanada geht“.;International;News, International, Donald Trump, Friedrich Merz, Kanada, Russland, China, Rocky Mountains, Kananaskis, Iran, USA, Washington;2025-06-15T17:20:12+02:00;2025-06-15T17:20:12+02:00;;dpa;false
064e6872aae3f4b6ee6a5f612074b8ffaf4e2ebb89a26ef79eb73dbd57ba3ddb;AfD Potsdam stellt Chaled-Uwe Said für OB-Wahl auf;https://www.zeit.de/news/2025-06/15/afd-potsdam-stellt-chaled-uwe-said-fuer-ob-wahl-auf;Hier finden Sie Informationen zu dem Thema „Oberbürgermeisterwahl“. Lesen Sie jetzt „AfD Potsdam stellt Chaled-Uwe Said für OB-Wahl auf“.;Oberbürgermeisterwahl;News, Oberbürgermeisterwahl, Chaled-Uwe Said, Potsdam, Alternative für Deutschland, Oberbürgermeisterwahl;2025-06-15T17:18:01+02:00;2025-06-15T17:18:01+02:00;;dpa Berlin/Brandenburg;false
47bbc245d81dfa2d48c191571246d9ca92e9699d44e481393a25772feb67c8e5;Neue Präses in Bielefeld in Amt eingeführt;https://www.zeit.de/news/2025-06/15/neue-praeses-in-bielefeld-in-amt-eingefuehrt;Hier finden Sie Informationen zu dem Thema „Westfälische Landeskirche“. Lesen Sie jetzt „Neue Präses in Bielefeld in Amt eingeführt“.;Westfälische Landeskirche;News, Westfälische Landeskirche, Bielefeld, Landeskirche;2025-06-15T17:15:19+02:00;2025-06-15T17:15:19+02:00;;dpa Nordrhein-Westfalen;false
b8d6b67832cffa337976edfc856cb3199a0fdfcb919cba94b73a5829bd284f2e;Krämerbrückenfest war Besuchermagnet;https://www.zeit.de/news/2025-06/15/kraemerbrueckenfest-war-besuchermagnet;Hier finden Sie Informationen zu dem Thema „Großes Altstadtfest“. Lesen Sie jetzt „Krämerbrückenfest war Besuchermagnet“.;Großes Altstadtfest;News, Großes Altstadtfest, Erfurt, Thüringen, Krämerbrücke, Krämerbrückenfest, Altstadtfest, Stadtverwaltung;2025-06-15T17:13:55+02:00;2025-06-15T17:13:55+02:00;;dpa Thüringen;false
3fe1b92e69cea120f2a2aee1d79352dcf61aa316f7bb362e1888385c82d4614e;"Kompany setzt sofort auf Tah: ""Wird uns schnell helfen""";https://www.zeit.de/news/2025-06/15/kompany-setzt-sofort-auf-tah-wird-uns-schnell-helfen;"Hier finden Sie Informationen zu dem Thema „Fußball-Club-WM“. Lesen Sie jetzt „Kompany setzt sofort auf Tah: ""Wird uns schnell helfen""“.";Fußball-Club-WM;News, Fußball-Club-WM, Vincent Kompany, Jonathan Tah, USA, Auckland City, Cincinnati, Bayer 04 Leverkusen;2025-06-15T17:12:48+02:00;2025-06-15T17:12:48+02:00;;dpa Bayern;false
4f84e41a7982383ddcd3c542ca35e34f8122e06f412a3ad5222b9d732ba9604d;Meteorologen warnen vor Unwetter - Überschwemmungen möglich;https://www.zeit.de/news/2025-06/15/gewitter-und-starkregen-werden-in-baden-wuerttemberg-erwartet;Hier finden Sie Informationen zu dem Thema „Wetter“. Lesen Sie jetzt „Meteorologen warnen vor Unwetter - Überschwemmungen möglich“.;Wetter;News, Wetter, Karlsruhe, Mannheim, Baden-Württemberg, DWD, Gewitter, Starkregen, Wetter, Unwetter;2025-06-15T17:11:41+02:00;2025-06-15T17:11:41+02:00;;dpa Baden-Württemberg;false
b288d9de5321cd87236998a002fcd33939660002396f85b5f22a8f00e6618a78;Nur einer bleibt fehlerfrei: Stevens neuer deutscher Meister;https://www.zeit.de/news/2025-06/15/zweiter-kuer-titel-soenke-rothenberger-gewinnt-in-balve;Hier finden Sie Informationen zu dem Thema „Pferdesport“. Lesen Sie jetzt „Nur einer bleibt fehlerfrei: Stevens neuer deutscher Meister“.;Pferdesport;News, Pferdesport, Sönke Rothenberger, Balve, Pferdesport, Dressurreiter;2025-06-15T17:10:52+02:00;2025-06-15T17:10:52+02:00;;dpa Nordrhein-Westfalen;false
1c2ec4185a36363efc31a84b0efaf521d2ad4ab69b7884974a9f672bf125ca86;Gennaro Gattuso wird Trainer der italienischen Nationalmannschaft;https://www.zeit.de/sport/2025-06/gennaro-gattuso-fussball-trainer-italien-nationalmannschaft;Nach der 0:3-Niederlage gegen Norwegen wurde der italienische Nationaltrainer Spalletti freigestellt. Nun soll Gennaro Gattuso Italien wieder zum Erfolg führen.;Fußball;Sport, Fußball, Fußball, Gennaro Gattuso, Italien, Norwegen, Trainer, Profisport;2025-06-15T17:09:34+02:00;2025-06-15T17:09:34+02:00;;ZEIT ONLINE,        Reuters;false
844131bf9894064bad1459b149e82fc4ccb33b84b7e91ffa622e2f7fda96c95e;Bahnverspätungen wegen spielender Kinder am Gleis;https://www.zeit.de/news/2025-06/15/bahnverspaetungen-wegen-spielender-kinder-am-gleis;Hier finden Sie Informationen zu dem Thema „Zugverkehr“. Lesen Sie jetzt „Bahnverspätungen wegen spielender Kinder am Gleis“.;Zugverkehr;News, Zugverkehr, Grabow, Mecklenburg-Vorpommern, Bundespolizei, Bahnverspätung, Zugverkehr, Bahnstrecke;2025-06-15T17:08:36+02:00;2025-06-15T17:08:36+02:00;;dpa;false
5f03a884e12201e6b94f560bcd2c0a353e5d44da5fef8b8997d4cf604757f609;"""Der erste Döner am Vormittag ist immer der beste""";https://www.zeit.de/zeit-magazin/wochenmarkt/2025-06/doener-berlin-qualitaet-lebensmittel-kosten;Fleisch, Salat, Soße: Wir haben in zehn Berliner Dönerläden nachgefragt, woran man einen guten Kebab erkennt, was der kosten darf – und worauf man noch achten sollte.  ;"Z+ (abopflichtiger Inhalt);
        
    Döner";Berlin, Kreuzberg, Brot, Fleisch, Lebensmittel, Gemüse;2025-06-15T17:03:18+02:00;2025-06-15T17:03:18+02:00;Juliane FrisseClarissa HofmannAnja MartinCelina PlagJakob PontiusLara VoelterJonas Berndt;;false
3377b258e829f33812714db077c3d38fb810d2ddf50697788390781a64dd5e2e;75-Jähriger stirbt nach Autounfall nahe Trendelburg;https://www.zeit.de/news/2025-06/15/75-jaehriger-stirbt-nach-autounfall-nahe-trendelburg;Hier finden Sie Informationen zu dem Thema „Unfälle“. Lesen Sie jetzt „75-Jähriger stirbt nach Autounfall nahe Trendelburg“.;Unfälle;News, Unfälle, Trendelburg, Polizei, Autounfall, Unfall;2025-06-15T17:03:00+02:00;2025-06-15T17:03:00+02:00;;dpa Hessen;false
8e54668dab2f2e13bc90c1e185bd2e96f2d91f238983a19c04173e1254ece95c;"""Danke Timo!"" Bolls Karriere endet unter großem Jubel";https://www.zeit.de/news/2025-06/15/timo-boll-beendet-karriere-mit-final-niederlage;"Hier finden Sie Informationen zu dem Thema „Tischtennis-Bundesliga“. Lesen Sie jetzt „""Danke Timo!"" Bolls Karriere endet unter großem Jubel“.";Tischtennis-Bundesliga;News, Tischtennis-Bundesliga, Timo Boll, Düsseldorf, Borussia Düsseldorf, TTF Liebherr Ochsenhausen, Bundesliga, Tischtennis, Finale;2025-06-15T17:01:23+02:00;2025-06-15T17:01:23+02:00;;dpa Hessen;false
d9208321ac2bbff6cf659ba65024e0fe00aa303c7f3d1467acd63185bc0663a6;Motorradfahrer stirbt bei Unfall im Landkreis Goslar;https://www.zeit.de/news/2025-06/15/quadfahrer-stirbt-bei-unfall-im-landkreis-goslar;Hier finden Sie Informationen zu dem Thema „Genauer Hergang noch unklar“. Lesen Sie jetzt „Motorradfahrer stirbt bei Unfall im Landkreis Goslar“.;Genauer Hergang noch unklar;News, Genauer Hergang noch unklar, Seesen, Landkreis Goslar, Polizei, Unfall, Hergang;2025-06-15T16:55:33+02:00;2025-06-15T16:55:33+02:00;;dpa Niedersachsen;false
055ca3433fd2aa18f0e941b00bad43958895224fe1b71da7ce6ec15206bcf9ff;Fachleute aus aller Welt sprechen in Hamburg über Nahverkehr;https://www.zeit.de/news/2025-06/15/fachleute-aus-aller-welt-sprechen-in-hamburg-ueber-nahverkehr;Hier finden Sie Informationen zu dem Thema „Verkehr“. Lesen Sie jetzt „Fachleute aus aller Welt sprechen in Hamburg über Nahverkehr“.;Verkehr;News, Verkehr, Hamburg, Nahverkehr, Verkehr, Fachleute, Verkehrssektor;2025-06-15T16:54:30+02:00;2025-06-15T16:54:30+02:00;;dpa Hamburg/Schleswig-Holstein;false
b17f2455e88a34256d95566444a79e3b0f4fa1d9b2ef193ca05fc7da848a38a7;"Man ist nie zu alt für ""Mario Kart"". Oder?";https://www.zeit.de/digital/games/2025-06/mario-kart-world-nintendo-switch-2-rennspiel-mehrspieler-nostalgie;"Das neue ""Mario Kart"" hat von allem mehr – und einen guten Mehrspieler-Modus. Unser Autor hat alle Teile der Reihe gespielt und lässt sich von der Nostalgie überwältigen.";"Z+ (abopflichtiger Inhalt);
        
    ""Mario Kart World""";"Digital, ""Mario Kart World"", Games, Videospiel, Nintendo, Freizeit, Kinder, Emotion";2025-06-15T16:48:53+02:00;2025-06-15T16:48:53+02:00;Matthias Kreienbrink;;false
b53f6e1f9617389ee27d2bbb87f25c7a0a6d0b12cc4a14948e50aec8e7cca3e0;Tennis-Märchen: Zverev und Maria in Wimbledon-Form;https://www.zeit.de/news/2025-06/15/tennis-ass-zverev-verpasst-titel-in-stuttgart;Hier finden Sie Informationen zu dem Thema „Vorbereitung auf Wimbledon“. Lesen Sie jetzt „Tennis-Märchen: Zverev und Maria in Wimbledon-Form“.;Vorbereitung auf Wimbledon;News, Vorbereitung auf Wimbledon, Alexander Zverev, Taylor Fritz, Stuttgart, Tokio, Wimbledon, Turniersieg, Endspiel;2025-06-15T16:46:56+02:00;2025-06-15T16:46:56+02:00;;dpa Baden-Württemberg;false
d4d9686b067b360cb98155a0587a9c06915a7bfc9896f58de0710cc3156954b9;Auto und Zug stoßen in Braunschweig zusammen;https://www.zeit.de/news/2025-06/15/auto-und-zug-stossen-in-braunschweig-zusammen;Hier finden Sie Informationen zu dem Thema „An unbeschranktem Bahnübergang“. Lesen Sie jetzt „Auto und Zug stoßen in Braunschweig zusammen“.;An unbeschranktem Bahnübergang;News, An unbeschranktem Bahnübergang, Braunschweig, Bundespolizei, Auto;2025-06-15T16:44:38+02:00;2025-06-15T16:44:38+02:00;;dpa Niedersachsen;false
5ad67078c3b0a9a853c31a96986e3189cf9793f4c6c27728f09864a42c9da279;Streife entdeckt auf Weg zum Einsatz verletzten Biker;https://www.zeit.de/news/2025-06/15/streife-entdeckt-auf-weg-zum-einsatz-verletzten-biker;Hier finden Sie Informationen zu dem Thema „Unfälle“. Lesen Sie jetzt „Streife entdeckt auf Weg zum Einsatz verletzten Biker“.;Unfälle;News, Unfälle, Aarbergen, Polizei, Streife, Unfall;2025-06-15T16:41:06+02:00;2025-06-15T16:41:06+02:00;;dpa Hessen;false
2d44a974d40a7be099f843932d37081d8a015783abd8724b7306cc709e6155e8;Medizinischer Notfall – Mann fährt gegen Mauer und stirbt;https://www.zeit.de/news/2025-06/15/medizinischer-notfall-mann-faehrt-gegen-mauer-und-stirbt;Hier finden Sie Informationen zu dem Thema „Unfälle“. Lesen Sie jetzt „Medizinischer Notfall – Mann fährt gegen Mauer und stirbt“.;Unfälle;News, Unfälle, Notfall, Unfall;2025-06-15T16:40:29+02:00;2025-06-15T16:40:29+02:00;;dpa Hessen;false
4274eba625d3707e5cdd13cf75179b63aab971a5211275006d00f9fed0dc2839;"""Queen of Queens"": Maria mit Tennis-Märchen vor Wimbledon";https://www.zeit.de/news/2025-06/15/tennis-maerchen-maria-holt-sensationell-titel-in-london;"Hier finden Sie Informationen zu dem Thema „Vorbereitung auf Wimbledon“. Lesen Sie jetzt „""Queen of Queens"": Maria mit Tennis-Märchen vor Wimbledon“.";Vorbereitung auf Wimbledon;News, Vorbereitung auf Wimbledon, Tatjana Maria, Amanda Anisimowa, London, Wimbledon, Erfolgslauf, Finale, Erfolg;2025-06-15T16:23:43+02:00;2025-06-15T16:23:43+02:00;;dpa Baden-Württemberg;false
c127ac8a47ad2d13f2092af72c3428fabdf56ff8f672f860faecc1b08c9215d2;Die ganze Stadt ist ein Museum;https://www.zeit.de/2025/23/joanna-warsza-stadtkuratorin-hamburg-kunst;Hamburgs neue Stadtkuratorin Joanna Warsza will zeigen, wie toll die Kunstwerke sind, die überall in der Stadt herumstehen. Na, dann mal los! ;"Z+ (abopflichtiger Inhalt);
        
    Joanna Warsza";Hamburg, Joanna Warsza, Hamburg, Kunst, Öffentlichkeit, Ausstellung, Stadtplanung, Kunstwerk;2025-06-15T16:23:38+02:00;2025-06-15T16:23:38+02:00;Oskar Piegsa;Aus der        ZEIT Nr. 23/2025;false
cad466041ac03373b298639fec1f2f99ed9e74bf6779cf4cdb314674bf7191b8;Saudi-Arabien richtet Journalisten hin;https://www.zeit.de/politik/ausland/2025-06/hinrichtung-journalist-saudi-arabien-turki-al-jasser;Der Journalist Turki al-Jasser soll Berichten zufolge in Saudi-Arabien nach langer Haftstrafe hingerichtet worden sein. Ihm wurden Terrorismus und Hochverrat vorgeworfen.;Pressefreiheit;Politik, Pressefreiheit, Saudi-Arabien, Pressefreiheit, Todesstrafe, Journalismus, Iran;2025-06-15T16:22:54+02:00;2025-06-15T16:22:54+02:00;psc;ZEIT ONLINE,        AP,        							psc;false
972a405d5d7011524393a73d5e5a0392c837cefd9e8e8136c3b14b8963fdb96d;Baum kracht auf fahrendes Auto;https://www.zeit.de/news/2025-06/15/baum-kracht-auf-fahrendes-auto;Hier finden Sie Informationen zu dem Thema „Unfälle“. Lesen Sie jetzt „Baum kracht auf fahrendes Auto“.;Unfälle;News, Unfälle, Wied, Polizei, Unfall, Westerwaldkreis, Auto;2025-06-15T16:22:54+02:00;2025-06-15T16:22:54+02:00;;dpa Rheinland-Pfalz/Saarland;false
e43a9079ee7b4f5ba05889a496ad8b3f231a23dea225f4dbe4bab8b91f3c3dae;Händel-Festspiele ziehen 41.000 Gäste nach Halle;https://www.zeit.de/news/2025-06/15/haendel-festspiele-ziehen-41-000-gaeste-nach-halle;Hier finden Sie Informationen zu dem Thema „Kultur“. Lesen Sie jetzt „Händel-Festspiele ziehen 41.000 Gäste nach Halle“.;Kultur;News, Kultur, Georg Friedrich Händel, Alexander Vogt, Händel-Festspiele Halle, Erfolg;2025-06-15T16:15:14+02:00;2025-06-15T16:15:14+02:00;;dpa Sachsen;false
861a42458281d09b50d04d47a10eca5148ad41e5f760384ecbf7365b33bf9599;"""Im Krieg meiner Kindheit gab es wenigstens Bunker. Heute? Nichts""";https://www.zeit.de/politik/ausland/2025-06/israel-angriff-iran-regime-lage-erfahrungsbericht;Wie erleben die Menschen im Iran Israels Angriffe? Fünf von ihnen berichten von Angst, Wut und der Hoffnung, dass sich etwas ändern könnte. Obwohl sie es kaum glauben.;"Z+ (abopflichtiger Inhalt);
        
    Lage im Iran";Politik, Lage im Iran, Iran, Teheran, Israel, Libanon, Gazastreifen, USA, Atomprogramm, Bürgerkrieg;2025-06-15T16:15:09+02:00;2025-06-15T16:15:09+02:00;Omid RezaeeLea Frehse;;false
1d3f6466fcaf7cfc5b909566278e84aa54cc0193378f5a0379d22bbe529552e0;Koalition gegen jährlichen Tüv für ältere Autos;https://www.zeit.de/news/2025-06/15/koalition-gegen-jaehrlichen-tuev-fuer-aeltere-autos;Hier finden Sie Informationen zu dem Thema „Fahrzeugcheck“. Lesen Sie jetzt „Koalition gegen jährlichen Tüv für ältere Autos“.;Fahrzeugcheck;News, Fahrzeugcheck, Jonas Urbach, Thüringen, CDU, Bündnis Sahra Wagenknecht, SPD, EU, Fahrzeugcheck, Regierungskoalition, Koalition, Auto;2025-06-15T16:13:17+02:00;2025-06-15T16:13:17+02:00;;dpa Thüringen;false
00714f3eebb00febf4621d72d8d238049e42ab6c82c3416e6dd95dc5a514a4a8;Merz plädiert für Einigkeit beim G7-Gipfel in Kanada;https://www.zeit.de/politik/ausland/2025-06/g7-gipfel-kanada-merz;Vor seinem Abflug nach Kanada betont Merz die Chance zu wichtigen Gesprächen in schwierigen Zeiten. Die sieben Industrienationen müssten jetzt entschlossen handeln.;G7-Gipfel;Politik, G7-Gipfel , G7-Gipfel, Friedrich Merz, Kanada, Krieg in der Ukraine, Frankreich, USA, Großbritannien, Italien, Japan, Russland;2025-06-15T16:13:05+02:00;2025-06-15T16:13:05+02:00;mns;ZEIT ONLINE,        dpa,        Reuters,        							mns;false
6576e3a9e1cb2e0fc71571793239afe75846ac71feb3f1f1b92bcde909dbc161;Footballer von Thunder holen zweiten Saisonsieg;https://www.zeit.de/news/2025-06/15/footballer-von-thunder-holen-zweiten-saisonsieg;Hier finden Sie Informationen zu dem Thema „American Football“. Lesen Sie jetzt „Footballer von Thunder holen zweiten Saisonsieg“.;American Football;News, American Football, Berlin, ELF, Berlin Thunder, European Football League, Saisonsieg, Preussenstadion, American Football;2025-06-15T16:10:44+02:00;2025-06-15T16:10:44+02:00;;dpa Berlin/Brandenburg;false
37fa2025dee25fe72099f1060d97397777a3fd9064fa2d65c02ae017e42872cf;Tödliche Polizeischüsse: Ermittler erstellen 3D-Tatortmodell;https://www.zeit.de/news/2025-06/15/toedliche-polizeischuesse-tatort-wird-fuer-3d-modell-vermessen;Hier finden Sie Informationen zu dem Thema „Oldenburg“. Lesen Sie jetzt „Tödliche Polizeischüsse: Ermittler erstellen 3D-Tatortmodell“.;Oldenburg;News, Oldenburg, Oldenburg, Polizei, Polizeischuss, Tatort;2025-06-15T16:05:32+02:00;2025-06-15T16:05:32+02:00;;dpa;false
c98d7700bd13c43263af92a7472de73543dd6ce4f23d47d8ace18177d8061c53;Heftige Gewitter und ein Tornado-Verdacht in NRW;https://www.zeit.de/news/2025-06/15/wetter-in-nrw-gewitter-klingen-ab-neue-woche-bringt-sonne;Hier finden Sie Informationen zu dem Thema „Wetter“. Lesen Sie jetzt „Heftige Gewitter und ein Tornado-Verdacht in NRW“.;Wetter;News, Wetter, NRW, Nordrhein-Westfalen, DWD, Gewitter, Wettervorhersage, Wetter;2025-06-15T16:03:54+02:00;2025-06-15T16:03:54+02:00;;dpa Nordrhein-Westfalen;false
b79bf5e6eee11438223c696d199fa79fcedf0f8b5df85fe539bf7dae06db4a50;Sechsfache Mutter getötet - Mordverdacht gegen Ehemann;https://www.zeit.de/news/2025-06/15/sechsfache-mutter-getoetet-mordverdacht-gegen-ehemann;Hier finden Sie Informationen zu dem Thema „Tötungsdelikt“. Lesen Sie jetzt „Sechsfache Mutter getötet - Mordverdacht gegen Ehemann“.;Tötungsdelikt;News, Tötungsdelikt, Krailling, Polizeipräsidium Oberbayern Nord, Polizei, Mordverdacht, Tötungsdelikt;2025-06-15T16:03:48+02:00;2025-06-15T16:03:48+02:00;;dpa;false
9f724d0f73ca57bbb64198e923818b564e6cd8c22c1b3d9354e77a5e5b717f46;Feuer an ehemaligem Schulgebäude sorgt für hohen Sachschaden;https://www.zeit.de/news/2025-06/15/feuer-an-ehemaligem-schulgebaeude-sorgt-fuer-hohen-sachschaden;Hier finden Sie Informationen zu dem Thema „Brände“. Lesen Sie jetzt „Feuer an ehemaligem Schulgebäude sorgt für hohen Sachschaden“.;Brände;News, Brände, Polizei, Sachschaden, Schulgebäude, Dachstuhlbrand, Brand;2025-06-15T15:59:04+02:00;2025-06-15T15:59:04+02:00;;dpa Rheinland-Pfalz/Saarland;false
bf4ebed1875aaa418ca1805613c0be8e00ba19a3dfd7a2e42d1d9a043f2d85fb;Vermummte greifen Kundgebung gegen rechts in Brandenburg an;https://www.zeit.de/gesellschaft/zeitgeschehen/2025-06/bad-freienwalde-angriff-kundgebung-rechts-verletzte-brandenburg;Zehn bis 15 Täter haben eine Veranstaltung für mehr Vielfalt in der Kleinstadt Bad Freienwalde angegriffen. Mindestens zwei Menschen wurden mit Schlagstöcken verletzt.;Bad Freienwalde;Gesellschaft, Bad Freienwalde, Brandenburg, Polizei, Rechtsextremismus, Demonstration, Gewalt;2025-06-15T15:53:45+02:00;2025-06-15T15:53:45+02:00;ces;ZEIT ONLINE,        dpa,        							ces;false
61e22d1cbd55f8f67e5d733d8f1e5e91e76fac47630f292dc90a8c1ceca35090;Autofahrer stirbt nach Unfall bei Daldorf;https://www.zeit.de/news/2025-06/15/autofahrer-stirbt-nach-unfall-bei-daldorf;Hier finden Sie Informationen zu dem Thema „Unfälle“. Lesen Sie jetzt „Autofahrer stirbt nach Unfall bei Daldorf“.;Unfälle;News, Unfälle, Daldorf, Kreis Segeberg, Unfall, Auto;2025-06-15T15:51:29+02:00;2025-06-15T15:51:29+02:00;;dpa Hamburg/Schleswig-Holstein;false
