Hash;Title;Link;Description;Category;KeyWords;Published;LastUpdated;Author;Source;Paywall
6a4e84aa8a0af426455b82ffd1371d73b76c566c3f7dc01e902f7b70f704319c;Karlsruhe stärkt Afghanen bei Visa-Klagen den Rücken;https://www.zeit.de/news/2026-07/24/karlsruhe-staerkt-afghanen-bei-visa-klagen-den-ruecken;Hier finden Sie Informationen zu dem Thema „Bundesverfassungsgericht“. Lesen Sie jetzt „Karlsruhe stärkt Afghanen bei Visa-Klagen den Rücken“.;Bundesverfassungsgericht;News, Bundesverfassungsgericht, Karlsruhe, Pakistan, Bundesrepublik Deutschland, Afghanistan, Bundesverfassungsgericht, OVG, Bundesinnenministerium, Bundesregierung, Taliban, Aufnahmeprogramm;2026-07-24T12:53:56+02:00;2026-07-24T12:53:56+02:00;;dpa;false
84a7db7f36281901c4bafabfe385dc2c23550b61db9ef0cfd0a371e18a14da8a;Fast 1.000 Abschlüsse anerkannt – Gesundheitsberufe vorn;https://www.zeit.de/news/2026-07/24/fast-1-000-abschluesse-anerkannt-gesundheitsberufe-vorn;Hier finden Sie Informationen zu dem Thema „Ausländische Berufsabschlüsse“. Lesen Sie jetzt „Fast 1.000 Abschlüsse anerkannt – Gesundheitsberufe vorn“.;Ausländische Berufsabschlüsse;News, Ausländische Berufsabschlüsse, Thüringen, Gesundheitsberuf, Berufsabschluss, Gesundheitspersonal, Anerkennungsverfahren;2026-07-24T12:53:33+02:00;2026-07-24T12:53:33+02:00;;dpa Thüringen;false
6d4a3abafb31d917f01b18ab440f014c839d0df9fb9ae384e16626d3e0fa73da;Kreise: Batteriehersteller Varta stellt Insolvenzantrag;https://www.zeit.de/news/2026-07/24/kreise-batteriehersteller-varta-stellt-insolvenzantrag;Hier finden Sie Informationen zu dem Thema „Konsumgüter“. Lesen Sie jetzt „Kreise: Batteriehersteller Varta stellt Insolvenzantrag“.;Konsumgüter;News, Konsumgüter, VARTA, Insolvenzantrag, Eigenverwaltung, Konsumgut, Insolvenz;2026-07-24T12:53:26+02:00;2026-07-24T12:53:26+02:00;;dpa;false
547a35d50c3e9eba71d15058f9941b599d67ec5f9ffeefd17951b261794c11b9;EU-Kommission wirft TikTok unzureichenden Schutz von Kindern vor;https://www.zeit.de/politik/ausland/2026-07/tiktok-eu-kommission-kinderschutz-minderjaehrige;Minderjährige können auf TikTok ein öffentlich zugängliches Profil anlegen. Die EU-Kommission kritisiert das als Einfallstor für Cybermobbing und fordert besseren Schutz.;Social Media;Digital, Social Media, Europäische Union, TikTok, Videoplattform, Cybermobbing;2026-07-24T12:50:45+02:00;2026-07-24T12:50:45+02:00;tlf;DIE ZEIT,        AFP,        dpa,        							tlf;false
8b075727dbf89447cd6c546bf7d38f3946b4f3bc3b995d4af250a79576ee396c;Bundeswehr baut Sigmaringen zum Zentrum für Heimatschutz aus;https://www.zeit.de/news/2026-07/24/bundeswehr-baut-sigmaringen-zum-zentrum-fuer-heimatschutz-aus;Hier finden Sie Informationen zu dem Thema „Aufbau Bundeswehrstandort“. Lesen Sie jetzt „Bundeswehr baut Sigmaringen zum Zentrum für Heimatschutz aus“.;Aufbau Bundeswehrstandort;News, Aufbau Bundeswehrstandort, Mann, Sigmaringen, Pfullendorf, Stetten am kalten Markt, Graf-Stauffenberg-Kaserne, Baden-Württemberg, Bundeswehr, Deutsche Presse-Agentur, Heimatschutz, Bundeswehrstandort;2026-07-24T12:49:09+02:00;2026-07-24T12:49:09+02:00;;dpa Baden-Württemberg;false
70308191e82f056783641cc9070bec81bf9e2f96d192c7b5aab4499479c18dcb;Spaltung bei Polens rechtskonservativer PiS;https://www.zeit.de/news/2026-07/24/spaltung-bei-polens-rechtskonservativer-pis;Hier finden Sie Informationen zu dem Thema „Richtungsstreit eskaliert“. Lesen Sie jetzt „Spaltung bei Polens rechtskonservativer PiS“.;Richtungsstreit eskaliert;News, Richtungsstreit eskaliert, Mateusz Morawiecki, Jarosław Kaczyński, Warschau, PiS, Parlamentswahl, Richtungsstreit;2026-07-24T12:45:32+02:00;2026-07-24T12:45:32+02:00;;dpa;false
bacb76af02da84dead870c682d7640e9ce2c0ab59fe6e74e3a94dc633928320b;76-jähriger Urlauber stirbt bei Absturz im Karwendelgebirge;https://www.zeit.de/news/2026-07/24/76-jaehriger-urlauber-stirbt-bei-absturz-im-karwendelgebirge;Hier finden Sie Informationen zu dem Thema „Tödlicher Bergunfall“. Lesen Sie jetzt „76-jähriger Urlauber stirbt bei Absturz im Karwendelgebirge“.;Tödlicher Bergunfall;News, Tödlicher Bergunfall, Karwendelgebirge, Polizei, Bergunfall, Absturz, Leitersteig;2026-07-24T12:44:04+02:00;2026-07-24T12:44:04+02:00;;dpa;false
aa0c02968fab21b57a426442d8f1edab7f790c1e0732abd17b84c10b36448a8f;Merz baut Regierung um - Wirbel um Schnieder;https://www.zeit.de/news/2026-07/24/merz-baut-regierung-und-cdu-fuehrung-um;Hier finden Sie Informationen zu dem Thema „Nach Spahns Rücktritt“. Lesen Sie jetzt „Merz baut Regierung um - Wirbel um Schnieder“.;Nach Spahns Rücktritt;News, Nach Spahns Rücktritt, Friedrich Merz, Thorsten Frei, Jens Spahn, Nina Warken, Carsten Linnemann, Philipp Amthor, ZDF, CDU, CDU/CSU-Bundestagsfraktion, Bundesregierung;2026-07-24T12:43:32+02:00;2026-07-24T12:43:32+02:00;;dpa;false
d580e27578843d9b2a3729656687ee5c8ac8ee2806fa560fa8dffb6263a4753d;Polzins Sommerpause: Zeit nehmen, um über sich nachzudenken;https://www.zeit.de/news/2026-07/24/polzins-sommerpause-zeit-nehmen-um-ueber-sich-nachzudenken;Hier finden Sie Informationen zu dem Thema „HSV-Cheftrainer“. Lesen Sie jetzt „Polzins Sommerpause: Zeit nehmen, um über sich nachzudenken“.;HSV-Cheftrainer;News, HSV-Cheftrainer, Merlin Polzin, Hamburger SV, Fußball-Bundesliga, Bundesliga, Sommerpause;2026-07-24T12:42:41+02:00;2026-07-24T12:42:41+02:00;;dpa Hamburg/Schleswig-Holstein;false
4b77b6bd5c2565978d18f1d61b79e844084447468ee4b1c96dc4948c859562c9;Bilder des Tages;https://www.zeit.de/news/2026-07/24/bilder-des-tages;Hier finden Sie Informationen zu dem Thema „Fotografie“. Lesen Sie jetzt „Bilder des Tages“.;Fotografie;News, Fotografie, News;2026-07-24T12:39:49+02:00;2026-07-24T12:39:49+02:00;;dpa;false
3bb840c741cb5e3d2027f6a1d02974a2135b2cd1c892ecce66e2760145417baa;Angebliche Bankmitarbeiterin betrügt Mann um 35.000 Euro;https://www.zeit.de/news/2026-07/24/angebliche-bankmitarbeiterin-betruegt-mann-um-35-000-euro;Hier finden Sie Informationen zu dem Thema „Betrugsmasche“. Lesen Sie jetzt „Angebliche Bankmitarbeiterin betrügt Mann um 35.000 Euro“.;Betrugsmasche;News, Betrugsmasche, Landkreis Hildburghausen, Polizei, Betrugsmasche;2026-07-24T12:38:51+02:00;2026-07-24T12:38:51+02:00;;dpa Thüringen;false
08421c113c5687c02c32b5367ad028f6a296c12bfd180470124f86ce68eec4c6;Bayreuther «Rienzi» fragt nach dem Ende der Demokratie;https://www.zeit.de/news/2026-07/24/bayreuther-rienzi-fragt-nach-dem-ende-der-demokratie;Hier finden Sie Informationen zu dem Thema „Bayreuther Festspiele“. Lesen Sie jetzt „Bayreuther «Rienzi» fragt nach dem Ende der Demokratie“.;Bayreuther Festspiele;News, Bayreuther Festspiele, Alexandra Szemerédy, Adolf Hitler, Bayreuth, Bayreuther Festspiele, Oper;2026-07-24T12:37:40+02:00;2026-07-24T12:37:40+02:00;;dpa Bayern;false
15ada1b5866d9c324c279357707f19b3b50690ee25327ff364cb0e59e6b27e00;Klopps Knallstart: Bundestrainer warnt und träumt;https://www.zeit.de/news/2026-07/24/dfb-gremien-stimmen-klopp-engagement-zu;Hier finden Sie Informationen zu dem Thema „Fußball-Nationalmannschaft“. Lesen Sie jetzt „Klopps Knallstart: Bundestrainer warnt und träumt“.;Fußball-Nationalmannschaft;News, Fußball-Nationalmannschaft, Jürgen Klopp, Deutscher Fußball-Bund, Gesellschafterversammlung, Bundestrainer, Fußballnationalmannschaft;2026-07-24T12:35:53+02:00;2026-07-24T12:35:53+02:00;;dpa;false
5bae13185f546793ee7bd20003553292f44d720603b29083d542715f32ff45d3;EM-Stadionkletterer zahlt 7.000 Euro an Polizeikosten;https://www.zeit.de/news/2026-07/24/em-stadionkletterer-zahlt-7-000-euro-an-polizeikosten;Hier finden Sie Informationen zu dem Thema „Gerichtliche Einigung“. Lesen Sie jetzt „EM-Stadionkletterer zahlt 7.000 Euro an Polizeikosten“.;Gerichtliche Einigung;News, Gerichtliche Einigung, Gelsenkirchen, Dortmund, Verwaltungsgericht, Polizei, Polizeikosten, Klettertour, Dachkonstruktion;2026-07-24T12:34:24+02:00;2026-07-24T12:34:24+02:00;;dpa Niedersachsen;false
b104b8de6125d3310d94acd8207954bcb3accaf0a987aa3b20239016a0c55777;Wüst freut sich im neuen Kabinett über «Macher» aus NRW;https://www.zeit.de/news/2026-07/24/wuest-freut-sich-im-neuen-kabinett-ueber-macher-aus-nrw;Hier finden Sie Informationen zu dem Thema „Nach Kabinettsumbildung“. Lesen Sie jetzt „Wüst freut sich im neuen Kabinett über «Macher» aus NRW“.;Nach Kabinettsumbildung;News, Nach Kabinettsumbildung, Carsten Linnemann, Hendrik Wüst, NRW, Nordrhein-Westfalen, CDU, Kabinettsumbildung;2026-07-24T12:33:19+02:00;2026-07-24T12:33:19+02:00;;dpa Nordrhein-Westfalen;false
35511380f776236568e1c02301a094e6f1682d0fb3a8421da94c04154a83bb65;»Das Beste, was Fußballdeutschland jetzt passieren kann«;https://www.zeit.de/sport/2026-07/juergen-klopp-bundestrainer-dfb-bernd-neuendorf;Die Sportwelt ist voll des Lobes über den neuen Bundestrainer. Jürgen Klopp habe es »auf perfekte Weise« verstanden, Spieler zu führen, sagt Mario Götze.;Jürgen Klopp als neuer Bundestrainer;Sport, Jürgen Klopp als neuer Bundestrainer, Jürgen Klopp, Bernd Neuendorf, DFB-Präsident, Julian Nagelsmann, Deutscher Fußball-Bund, Bundestrainer;2026-07-24T12:32:51+02:00;2026-07-24T12:32:51+02:00;kzi;DIE ZEIT,        SID,        							kzi;false
460ff3aaa0cd3eefbe91dfd68ef34a294577b9a391a5e50eebc51481ade6de26;Zahnmediziner: Sehen immer mehr Menschen ohne Versorgung;https://www.zeit.de/news/2026-07/24/zahnmediziner-sehen-immer-mehr-menschen-ohne-versorgung;Hier finden Sie Informationen zu dem Thema „Besuch beim Zahnarzt“. Lesen Sie jetzt „Zahnmediziner: Sehen immer mehr Menschen ohne Versorgung“.;Besuch beim Zahnarzt;News, Besuch beim Zahnarzt, Brandenburg an der Havel, Brandenburg, Zahnmedizin, Versorgung;2026-07-24T12:31:01+02:00;2026-07-24T12:31:01+02:00;;dpa Berlin/Brandenburg;false
b357c07520d93f4a6315d0f7319600f50d11909d430ce70eefcf7efafb08a3d8;Rewe-Reisekonzern übernimmt komplett Rostocker Hotelgruppe;https://www.zeit.de/news/2026-07/24/rewe-reisekonzern-uebernimmt-komplett-rostocker-hotelgruppe;Hier finden Sie Informationen zu dem Thema „Reisen“. Lesen Sie jetzt „Rewe-Reisekonzern übernimmt komplett Rostocker Hotelgruppe“.;Reisen;News, Reisen, Österreich, Italien, Rostock, Dertour, Rewe, Reisen, Hotelgruppe, Seereederei;2026-07-24T12:30:04+02:00;2026-07-24T12:30:04+02:00;;dpa Hamburg/Schleswig-Holstein;false
231f69e745076e7dac868f160ea4446ecfd82eea63feea94ac22d68f6183f6d5;Mehr als 40 Prozent weniger Schleuserkriminalität;https://www.zeit.de/news/2026-07/24/mehr-als-40-prozent-weniger-schleuserkriminalitaet;Hier finden Sie Informationen zu dem Thema „Migration“. Lesen Sie jetzt „Mehr als 40 Prozent weniger Schleuserkriminalität“.;Migration;News, Migration, Europa, Bundespolizei, Schleuserkriminalität, Migration, Lagebild, Schleusung;2026-07-24T12:29:46+02:00;2026-07-24T12:29:46+02:00;;dpa;false
fe44c4d838f482c047374aaed196d074b9eea564cd8f6ad051fdb4a67ea0284d;Matratze brennt im Treppenhaus: Vier Menschen im Krankenhaus;https://www.zeit.de/news/2026-07/24/matratze-brennt-im-treppenhaus-evakuierung-von-75-menschen;Hier finden Sie Informationen zu dem Thema „Mehrfamilienhaus“. Lesen Sie jetzt „Matratze brennt im Treppenhaus: Vier Menschen im Krankenhaus“.;Mehrfamilienhaus;News, Mehrfamilienhaus, Polizei, Matratze, Treppenhaus, Evakuierung;2026-07-24T12:29:13+02:00;2026-07-24T12:29:13+02:00;;dpa Nordrhein-Westfalen;false
ba6ea43739884b82812703b4c3f2b4e596cbca5fc08e6c57c1fc99c3e8763e3e;Jürgen Klopp wird Bundestrainer;https://www.zeit.de/sport/2026-07/dfb-bestaetigt-juergen-klopp-wird-bundestrainer;"Die Fußball-Nationalmannschaft wird künftig von Jürgen Klopp trainiert. »Ich hab’ Bock«, sagte der 59-Jährige. Per Mertesacker übernimmt als DFB-Geschäftsführer Sport. 
";DFB;Sport, DFB, Jürgen Klopp, Deutscher Fußball-Bund, Bundestrainer;2026-07-24T12:29:00+02:00;2026-07-24T12:29:00+02:00;mpi;DIE ZEIT,        dpa,        SID,        							mpi;false
3ab0b91e6740aef6ea664387e96359371a1e9788e47eb05c74d9221f1665ce55;Blume will VW-Sparpaket bis Jahresende festzurren;https://www.zeit.de/news/2026-07/24/blume-will-vw-sparpaket-bis-jahresende-festzurren;Hier finden Sie Informationen zu dem Thema „Volkswagen“. Lesen Sie jetzt „Blume will VW-Sparpaket bis Jahresende festzurren“.;Volkswagen;News, Volkswagen, Oliver Blume, Volkswagen, VW, Jahresende;2026-07-24T12:28:27+02:00;2026-07-24T12:28:27+02:00;;dpa Sachsen;false
4d40efffb9e1dbcda92f424633e3dfd1f60471f456d5e80f10294bdf6d29e15e;»Viele Leihmütter vermeiden Wörter wie ›Honorar‹«;https://www.zeit.de/familie/2026-07/leihmutterschaft-usa-arbeit-kinderwunsch-heather-jacobson;Die meisten Leihmütter in den USA werden bezahlt, sehen Leihmutterschaft aber nicht als einen Job. Die Soziologin Heather Jacobson findet: Man sollte das Arbeit nennen.;"Z+ (abopflichtiger Inhalt);
        
    Leihmutterschaft in den USA";Familie, Leihmutterschaft in den USA, Leihmutterschaft, Soziologie, Kinderwunsch, Frauen, USA, Familie, Kinder;2026-07-24T12:28:23+02:00;2026-07-24T12:28:23+02:00;Wlada Kolosowa;;false
882f4dba66733b740477a370cd2957cace5ec8942ea0089b965d045f093544e7;Fischbrötchen-Wahlkampagne - Superidee oder geschmacklos?;https://www.zeit.de/news/2026-07/24/fischbroetchen-wahlkampagne-superidee-oder-geschmacklos;Hier finden Sie Informationen zu dem Thema „Wahlkampf“. Lesen Sie jetzt „Fischbrötchen-Wahlkampagne - Superidee oder geschmacklos?“.;Wahlkampf;News, Wahlkampf, Lilly Blaudszun, Daniel Peters, Mecklenburg-Vorpommern, CDU, SPD, X, Alternative für Deutschland, Landtagswahl, Superidee, Fischbrötchen;2026-07-24T12:27:23+02:00;2026-07-24T12:27:23+02:00;;dpa Mecklenburg-Vorpommern;false
593cd34b212ff5699056a3aa7a1f78747151cf619c396fec95c0fbeed47645aa;Hass-Video: Uni prüft Exmatrikulation;https://www.zeit.de/news/2026-07/24/hass-video-uni-prueft-exmatrikulation;Hier finden Sie Informationen zu dem Thema „Skandal“. Lesen Sie jetzt „Hass-Video: Uni prüft Exmatrikulation“.;Skandal;News, Skandal, Astrid Bergmeister, Krefeld, Düsseldorf, Duisburg, Universität Duisburg-Essen, CDU, Deutsche Presse-Agentur, WAZ, Exmatrikulation, Muslime;2026-07-24T12:26:22+02:00;2026-07-24T12:26:22+02:00;;dpa Nordrhein-Westfalen;false
5c16a3293258bd8f8b0d37178c6b5384dd3c304b7401ab91f6cf0197cd3ed050;Spezialisten entfernen erstes Nest der Asiatischen Hornisse;https://www.zeit.de/news/2026-07/24/spezialisten-entfernen-erstes-nest-der-asiatischen-hornisse;Hier finden Sie Informationen zu dem Thema „Invasive Art in Brandenburg“. Lesen Sie jetzt „Spezialisten entfernen erstes Nest der Asiatischen Hornisse“.;Invasive Art in Brandenburg;News, Invasive Art in Brandenburg, Brandenburg, Hornisse, Spezialausrüstung, Imkerverband, Dachvorsprung;2026-07-24T12:26:14+02:00;2026-07-24T12:26:14+02:00;;dpa Berlin/Brandenburg;false
b2e5244f8cdc59c0348b16228dc3dc5278d4961a3b909b600a75921635383928;Achtjährige sexuell belästigt – Jugendlicher festgenommen;https://www.zeit.de/news/2026-07/24/achtjaehrige-sexuell-belaestigt-jugendlicher-festgenommen;Hier finden Sie Informationen zu dem Thema „An Jugendtreff“. Lesen Sie jetzt „Achtjährige sexuell belästigt – Jugendlicher festgenommen“.;An Jugendtreff;News, An Jugendtreff, Dotternhausen, Jugendtreff, Jugendtreffpunkt;2026-07-24T12:25:55+02:00;2026-07-24T12:25:55+02:00;;dpa Baden-Württemberg;false
ba8849b9ad7d1d4a3437c72fff3e839823f55bd8555c7e8eb2d7768b31f83275;Rumänien schießt fremde Drohne im eigenen Luftraum ab;https://www.zeit.de/news/2026-07/24/rumaenien-schiesst-fremde-drohne-im-eigenen-luftraum-ab;Hier finden Sie Informationen zu dem Thema „Ukraine-Krieg“. Lesen Sie jetzt „Rumänien schießt fremde Drohne im eigenen Luftraum ab“.;Ukraine-Krieg;News, Ukraine-Krieg, Rumänien, Bukarest, Padina, Luftwaffe, Verteidigungsministerium, Europäische Union, Luftraum, Krieg in der Ukraine;2026-07-24T12:25:21+02:00;2026-07-24T12:25:21+02:00;;dpa;false
c095c14c6e5d6da31637f7c0c86c41f50d41d6057d8d8db55b2fa447535da1ef;63.000 Menschen sollen sich vor Waldbränden in Sicherheit bringen;https://www.zeit.de/gesellschaft/2026-07/waldbraende-frankreich-atlantikkueste-cap-ferret-touristen-evakuierung;An der französischen Atlantikküste sind wegen der Brände 63.000 Menschen aufgerufen, ihre Häuser zu verlassen. In Spanien gilt für zwei Regionen der Notstand.;Französische Atlantikküste;Gesellschaft, Französische Atlantikküste, Frankreich, Atlantikküste, Arcachon, Halbinsel, Waldbrand, Sicherheit;2026-07-24T12:23:33+02:00;2026-07-24T12:23:33+02:00;jaca;DIE ZEIT,        dpa,        AFP,        							jaca;false
28177d611384c20c90f034a99174147d4da8d064723f5384fb4b1f8fa2ecfb68;Steidl Verlag verlässt vorläufiges Insolvenzverfahren;https://www.zeit.de/news/2026-07/24/steidl-verlag-verlaesst-vorlaeufiges-insolvenzverfahren;Hier finden Sie Informationen zu dem Thema „Literatur“. Lesen Sie jetzt „Steidl Verlag verlässt vorläufiges Insolvenzverfahren“.;Literatur;News, Literatur, Göttingen, Steidl, Amtsgericht, Insolvenzverfahren, Verlag;2026-07-24T12:23:06+02:00;2026-07-24T12:23:06+02:00;;dpa Niedersachsen;false
2141b4ff1d111c7c8ddeaf384fb9c35612d8d55694cdf3508145f65ac726b24e;Niederwalddenkmal nach Farbattacke wieder gereinigt;https://www.zeit.de/news/2026-07/24/niederwalddenkmal-nach-farbattacke-wieder-gereinigt;Hier finden Sie Informationen zu dem Thema „Rüdesheim am Rhein“. Lesen Sie jetzt „Niederwalddenkmal nach Farbattacke wieder gereinigt“.;Rüdesheim am Rhein;News, Rüdesheim am Rhein, Rüdesheim am Rhein, Rhein, Niederwalddenkmal, Farbattacke;2026-07-24T12:22:54+02:00;2026-07-24T12:22:54+02:00;;dpa Hessen;false
0e5e2e9dd3b83e1282a14b5c3343a1bed3d71ad10925d22137e4c8d906cf266a;Minister: Mehr Konsequenz bei Ausreisepflicht von Afghanen;https://www.zeit.de/news/2026-07/24/minister-mehr-konsequenz-bei-ausreisepflicht-von-afghanen;Hier finden Sie Informationen zu dem Thema „Migrationspolitik“. Lesen Sie jetzt „Minister: Mehr Konsequenz bei Ausreisepflicht von Afghanen“.;Migrationspolitik;News, Migrationspolitik, Mainz, Rheinland-Pfalz, Afghanistan, Innenministerium, CDU, Ausreisepflicht, Migrationspolitik, Konsequenz, Abschiebung, Ausländerbehörde;2026-07-24T12:19:27+02:00;2026-07-24T12:19:27+02:00;;dpa Rheinland-Pfalz/Saarland;false
f7999bcee01c1437a90e1cc53a185b237ee24e842f0a54c48202151f6fb03898;Senior bedroht Lkw-Fahrer auf Bauernhof mit Gewehr;https://www.zeit.de/news/2026-07/24/senior-bedroht-lkw-fahrer-auf-bauernhof-mit-gewehr;Hier finden Sie Informationen zu dem Thema „Größerer Polizeieinsatz“. Lesen Sie jetzt „Senior bedroht Lkw-Fahrer auf Bauernhof mit Gewehr“.;Größerer Polizeieinsatz;News, Größerer Polizeieinsatz, Allgäu, Polizei, Bauernhof, Polizeieinsatz, Luftgewehr;2026-07-24T12:18:50+02:00;2026-07-24T12:18:50+02:00;;dpa Baden-Württemberg;false
e07e9712a08355bb1378fb13d19b99e284b796b87710516fc5f0653f55014347;Staatliche Kunstsammlungen Dresden feiern Gründungsvater;https://www.zeit.de/news/2026-07/24/staatliche-kunstsammlungen-dresden-feiern-gruendungsvater;Hier finden Sie Informationen zu dem Thema „Ausstellungen“. Lesen Sie jetzt „Staatliche Kunstsammlungen Dresden feiern Gründungsvater“.;Ausstellungen;News, Ausstellungen, Dresden, Staatliche Kunstsammlungen Dresden, Kunstsammlung;2026-07-24T12:18:40+02:00;2026-07-24T12:18:40+02:00;;dpa Sachsen;false
f9307b127020aedfa3c80bc2200541b06ccfd19f6d3f6b31282a5008f9ce4d5e;Klopp: Fußball kann «ein Land verändern»;https://www.zeit.de/news/2026-07/24/bericht-dfb-macht-mertesacker-zum-geschaeftsfuehrer;Hier finden Sie Informationen zu dem Thema „Nationalmannschaft“. Lesen Sie jetzt „Klopp: Fußball kann «ein Land verändern»“.;Nationalmannschaft;News, Nationalmannschaft, Jürgen Klopp, Andreas Rettig, Per Mertesacker, Deutscher Fußball-Bund, RTL, FC Arsenal, Bundestrainer, Fußballnationalmannschaft;2026-07-24T12:17:06+02:00;2026-07-24T12:17:06+02:00;;dpa Sport;false
ead3e459da926b7f006eb6ea477b41f5f73248f983edcbeacb94b4f241b3d0c0;USA verhängen neue Zölle gegen 60 Handelspartner;https://www.zeit.de/news/2026-07/23/zwangsarbeit-trump-kuendigt-zoelle-gegen-60-handelspartner-an;Hier finden Sie Informationen zu dem Thema „Zollkonflikt“. Lesen Sie jetzt „USA verhängen neue Zölle gegen 60 Handelspartner“.;Zollkonflikt;News, Zollkonflikt, Jamieson Greer, Taiwan, Japan, Schweiz, EU, Europäische Union, Zwangsarbeit, Zoll, Zollkonflikt, Importe;2026-07-24T12:15:35+02:00;2026-07-24T12:15:35+02:00;;dpa;false
6da9460ec4bb313da287bd901ab393261c66f45e89d906683615d9e1e90d9254;Weniger Parteien bei Berlin-Wahl;https://www.zeit.de/news/2026-07/24/weniger-parteien-bei-berlin-wahl;Hier finden Sie Informationen zu dem Thema „Wahlgang im September“. Lesen Sie jetzt „Weniger Parteien bei Berlin-Wahl“.;Wahlgang im September;News, Wahlgang im September, Berlin, Wahlgang, Bezirksliste, Abgeordnetenhaus, Landeswahlamt;2026-07-24T12:15:32+02:00;2026-07-24T12:15:32+02:00;;dpa Berlin/Brandenburg;false
2391ac2388da66599def80f5a6fa2d4339d8c40319126fbb5f4640e52348f244;Klopp-Berater Kosicke erhält Job beim DFB-Team;https://www.zeit.de/news/2026-07/24/das-sind-die-ersten-aufgaben-von-klopp-als-bundestrainer;Hier finden Sie Informationen zu dem Thema „Fußball-Nationalmannschaft“. Lesen Sie jetzt „Klopp-Berater Kosicke erhält Job beim DFB-Team“.;Fußball-Nationalmannschaft;News, Fußball-Nationalmannschaft, Jürgen Klopp, Joshua Kimmich, Sven Bender, Rudi Völler, Manuel Neuer, Deutscher Fußball-Bund, FC Bayern München, Bundestrainer, Fußballnationalmannschaft;2026-07-24T12:15:06+02:00;2026-07-24T12:15:06+02:00;;dpa;false
88d0f0522af3a40fc12142ba4e84689b22df13086c102a7310492ff48ef2b6e6;Ernte im Norden läuft mit großen regionalen Unterschieden;https://www.zeit.de/news/2026-07/24/ernte-im-norden-laeuft-mit-grossen-regionalen-unterschieden;Hier finden Sie Informationen zu dem Thema „Ernte-Zwischenbilanz“. Lesen Sie jetzt „Ernte im Norden läuft mit großen regionalen Unterschieden“.;Ernte-Zwischenbilanz;News, Ernte-Zwischenbilanz, Rendsburg, Schleswig-Holstein, Ernte, Wintergerste, Erfolg;2026-07-24T12:13:08+02:00;2026-07-24T12:13:08+02:00;;dpa Hamburg/Schleswig-Holstein;false
5c029d48e9eac07745f702a744f8c6163f0f0676cf6587315ff3b931e1ece9e1;Rumänien schießt erstmals Drohne in eigenem Luftraum ab;https://www.zeit.de/politik/ausland/ukraine-krieg-news-liveblog;Eine rumänische F-16 hat eine Drohne im Luftraum des Nato-Landes abgewehrt. Ukraine attackiert russische Rüstungsfabrik, Kyjiw wird mit Raketen beschossen. Das Liveblog;Liveblog:                     Krieg gegen die Ukraine;Politik, Krieg gegen die Ukraine, Krieg in der Ukraine, Wolodymyr Selenskyj, Russland, Militär, Drohne, Kyjiw;2026-07-24T12:11:01+02:00;2026-07-24T12:11:01+02:00;Tom-Luca FreundAlexander Eydlin;;false
26999c3cff384ff02cfeeb591c0e8cae8da1ab334efc78266af9fa0e3376e350;Besten Freund erstochen? 21-Jähriger steht vor Gericht;https://www.zeit.de/news/2026-07/24/prozess-21-jaehriger-soll-guten-kumpel-erstochen-haben;Hier finden Sie Informationen zu dem Thema „Kriminalität“. Lesen Sie jetzt „Besten Freund erstochen? 21-Jähriger steht vor Gericht“.;Kriminalität;News, Kriminalität, Bremen, Staatsanwaltschaft;2026-07-24T12:10:15+02:00;2026-07-24T12:10:15+02:00;;dpa Niedersachsen;false
bb17e6f30b85b6d35c1b55a6741c567491ed82e7c208ae62ceb570674518b45d;Wie geht es jetzt bei der Regierungsumbildung weiter?;https://www.zeit.de/news/2026-07/24/wie-geht-es-jetzt-bei-der-regierungsumbildung-weiter;Hier finden Sie Informationen zu dem Thema „Nach Spahns Rücktritt“. Lesen Sie jetzt „Wie geht es jetzt bei der Regierungsumbildung weiter?“.;Nach Spahns Rücktritt;News, Nach Spahns Rücktritt, Friedrich Merz, Carsten Linnemann, Thorsten Frei, Frank-Walter Steinmeier, CDU, Bundesregierung, Deutscher Bundestag, Regierungsumbildung, Umbildung, Rücktritt;2026-07-24T12:09:33+02:00;2026-07-24T12:09:33+02:00;;dpa;false
2baa71c53cd7c679dbab57fa44db006f91a6980ac8ea818b01a8fa6dd0ed2597;Angriff in Stuttgart - Zeugen löschen Frau mit Feuerlöscher;https://www.zeit.de/news/2026-07/24/nach-angriff-im-einkaufszentrum-so-geht-es-heute-weiter;Hier finden Sie Informationen zu dem Thema „Ehemann als Tatverdächtiger“. Lesen Sie jetzt „Angriff in Stuttgart - Zeugen löschen Frau mit Feuerlöscher“.;Ehemann als Tatverdächtiger;News, Ehemann als Tatverdächtiger, Polizei, Staatsanwaltschaft, Einkaufszentrum, Angriff;2026-07-24T12:06:02+02:00;2026-07-24T12:06:02+02:00;;dpa;false
ca98b4e7d7c37382089e3e0290e4702586cb9f101f9d33ef227e87ebb1abe5c3;91-jähriger Biker stürzt von Motorrad – leicht verletzt;https://www.zeit.de/news/2026-07/24/91-jaehriger-biker-stuerzt-von-motorrad-leicht-verletzt;Hier finden Sie Informationen zu dem Thema „Autobahn 9“. Lesen Sie jetzt „91-jähriger Biker stürzt von Motorrad – leicht verletzt“.;Autobahn 9;News, Autobahn 9, Polizei, Motorrad, Unfall, Baustellenabsperrung, Autobahn;2026-07-24T12:04:50+02:00;2026-07-24T12:04:50+02:00;;dpa Bayern;false
406b51fc80a07b2aefc7e06196207f1a0443ebcad173d79924ea9c0f7944f369;84-Jährige tot nach Brand in Wohnung gefunden;https://www.zeit.de/news/2026-07/24/toter-mensch-nach-brand-in-pflegeheim-gefunden;Hier finden Sie Informationen zu dem Thema „Mittelfranken“. Lesen Sie jetzt „84-Jährige tot nach Brand in Wohnung gefunden“.;Mittelfranken;News, Mittelfranken, Mittelfranken, Pflegeheim, Rettungskraft;2026-07-24T12:04:19+02:00;2026-07-24T12:04:19+02:00;;dpa Bayern;false
