Hash;Title;Link;Description;Category;KeyWords;Published;LastUpdated;Author;Source;Paywall
854d6dff1a6ff723bce661bdbba50aa50d9cfda82eba7fad719a42f569d2a49a;Deutschland gibt mehr Geld für humanitäre Hilfe im Gazastreifen;https://www.zeit.de/politik/ausland/2025-08/gaza-hungernot-hilfe-ernaehrungsprogramm-wadephul-deutschland;Außenminister Wadephul hat weitere Hilfen für die hungernde Bevölkerung in Gaza angekündigt. Deutschland wird seinen Beitrag demnach um fünf Millionen Euro aufstocken.;Hungersnot in Gaza;Politik, Hungersnot in Gaza, Johann Wadephul, Gazastreifen, Hungersnot, Hilfsorganisation, Israel, Vereinte Nationen;2025-08-01T11:02:07+02:00;2025-08-01T11:02:07+02:00;lgi;DIE ZEIT,        dpa,        AFP,        							lgi;false
d18df0bd3500747c367c0d652b4b05ae5b0718b83cee394b7e0815807bebd09b;Nach Mallorca-Video: Neuhaus vor Rückkehr zu Düsseldorf?;https://www.zeit.de/news/2025-08/01/nach-mallorca-video-neuhaus-vor-rueckkehr-zu-duesseldorf;Hier finden Sie Informationen zu dem Thema „Fußball“. Lesen Sie jetzt „Nach Mallorca-Video: Neuhaus vor Rückkehr zu Düsseldorf?“.;Fußball;News, Fußball, Florian Neuhaus, Klaus Allofs, Gladbach, Düsseldorf, Borussia Mönchengladbach, Fortuna Düsseldorf, Fußball;2025-08-01T11:00:24+02:00;2025-08-01T11:00:24+02:00;;dpa Nordrhein-Westfalen;false
6db1dcbef089bae9aad898755050676ea223993fee9cdda3dcb235a864eb0aa9;EU-Urteil zieht Grenzen für Listen sicherer Herkunftsländer;https://www.zeit.de/news/2025-08/01/asylverfahren-auslagern-italiens-albanien-modell-vor-eugh;Hier finden Sie Informationen zu dem Thema „Asylverfahren“. Lesen Sie jetzt „EU-Urteil zieht Grenzen für Listen sicherer Herkunftsländer“.;Asylverfahren;News, Asylverfahren, Giorgia Meloni, Pauline Endres, Italien, Bangladesch, Westbalkanländer, Georgien, Moldau, Senegal, Albanien, Europa;2025-08-01T10:59:48+02:00;2025-08-01T10:59:48+02:00;;dpa;false
a7e71f834fdafcbdab37b625a2d3c3a3857d9bcdf58d3deb7d3ebe74dbd6155c;31 Tote und 159 Verletzte nach Angriff auf Kyjiw;https://www.zeit.de/politik/ausland/ukraine-krieg-news-liveblog;"Bei einem Luftangriff auf die ukrainische Hauptstadt sind mindestens 31 Menschen getötet worden. Donald Trump nennt Russlands Vorgehen ""widerwärtig"". Das Liveblog";Liveblog:                     Krieg gegen die Ukraine;Politik, Krieg gegen die Ukraine, Wolodymyr Selenskyj, Krieg in der Ukraine, Russland, Waffenruhe, Wladimir Putin, Sanktion;2025-08-01T10:57:42+02:00;2025-08-01T10:57:42+02:00;Mathis GannVerena Hölzl;;false
18d0defe04a99f45562dcf23c55d66c37176d2d4169e6471312ee974a3e59516;Dieser Dip ist ein Hauptgericht;https://www.zeit.de/zeit-magazin/wochenmarkt/2025-07/borani-sellerie-dip-rezept-wochenmarkt;Erinnert optisch an Za­zi­ki, dank geschmortem Sellerie macht das Joghurtgericht sogar satt. Na gut, Kichererbsen und selbst gemachtes Pfannenbrot tragen auch dazu bei.;"Z+ (abopflichtiger Inhalt);
        
    Borani mit Sellerie";vegetarische Rezepte, Fingerfood;2025-08-01T10:56:24+02:00;2025-08-01T10:56:24+02:00;Sarah Golbaz;;false
0c4dee9b6463405b81f95f6fa1391054cf10fd2387a40b1c1bc764eeea5cd1dc;"""Diese Luftbrücke ist ein Spektakel""";https://www.zeit.de/politik/ausland/2025-07/aerzte-ohne-grenzen-hilfslieferung-gazastreifen-medizin-versorgung-luftbruecke;Mohammed Fadlalla von Ärzte ohne Grenzen ist gerade in Gaza im Einsatz. Im Gespräch berichtet er von offenen Brüchen, defekten Fallschirmen und dem Hunger in seinem Team.;"Z+ (abopflichtiger Inhalt);
        
    Ärzte ohne Grenzen";Politik, Ärzte ohne Grenzen, Gazastreifen, Bundeswehr, Arzt, Medizin, Versorgung, Hilfslieferung, Ärzte ohne Grenzen;2025-08-01T10:54:19+02:00;2025-08-01T10:54:19+02:00;Franziska Wunderlich;;false
79c66f59b4882c030bf5982d21ac3c1f5b23f122626c4776a0b8bd2f4616716a;Opernklänge von Strauss in Rheinsberg - Sonderbusse rollen;https://www.zeit.de/news/2025-08/01/opernklaenge-von-strauss-in-rheinsberg-sonderbusse-rollen;Hier finden Sie Informationen zu dem Thema „Operette“. Lesen Sie jetzt „Opernklänge von Strauss in Rheinsberg - Sonderbusse rollen“.;Operette;News, Operette, Johann Strauss, Rheinsberg, Opernklang, Sonderbus, Operette, Festivalsaison;2025-08-01T10:53:52+02:00;2025-08-01T10:53:52+02:00;;dpa Berlin/Brandenburg;false
a566560b6ed03f05c0e2102121eff4b85a51f13dc3092e5d91d7235ae151fb87;Tomaten auf den Augen? Nein, im Glas!;https://www.zeit.de/zeit-magazin/wochenmarkt/2025-07/confierte-tomaten-rezept-wochenmarkt;In Öl gekochte Tomaten sind ein echter Schatz. Sie schmecken nicht nur wahnsinnig aromatisch, sondern halten sich bis in den Herbst. So lässt sich der Sommer confieren.;"Z+ (abopflichtiger Inhalt);
        
    Confierte Tomaten";Zeit-Magazin, Wochenmarkt;2025-08-01T10:51:09+02:00;2025-08-01T10:51:09+02:00;Angelika Schwaff;;false
88a968b51ece83d8ab8feb19aef98b1b22ec2471b4001abe36b32ce2fef18625;Gedenkort für Dahlmeier in Kirche eingerichtet;https://www.zeit.de/news/2025-08/01/gedenkort-fuer-dahlmeier-in-kirche-eingerichtet;Hier finden Sie Informationen zu dem Thema „In ihrer Heimat“. Lesen Sie jetzt „Gedenkort für Dahlmeier in Kirche eingerichtet“.;In ihrer Heimat;News, In ihrer Heimat, Laura Dahlmeier, Pakistan, Garmisch-Partenkirchen, Gedenkort, Unglück;2025-08-01T10:46:47+02:00;2025-08-01T10:46:47+02:00;;dpa Bayern;false
4b77b6bd5c2565978d18f1d61b79e844084447468ee4b1c96dc4948c859562c9;Bilder des Tages;https://www.zeit.de/news/2025-08/01/bilder-des-tages;Hier finden Sie Informationen zu dem Thema „Fotografie“. Lesen Sie jetzt „Bilder des Tages“.;Fotografie;News, Fotografie, News;2025-08-01T10:46:27+02:00;2025-08-01T10:46:27+02:00;;dpa;false
53d9111d80ea4d2c7fbbba3e526e34ccb2d964041b7845fffa59b0214ce2b142;Saugut, diese Soba;https://www.zeit.de/zeit-magazin/wochenmarkt/2025-07/zaru-soba-rezept-wochenmarkt;Wer sagt, dass Nudeln nicht auch kalt schmecken, hat dieses japanische Gericht noch nicht probiert. Die Buchweizennudeln werden einfach in eine salzig-süße Soße getunkt.;"Z+ (abopflichtiger Inhalt);
        
    Zaru Soba";Pasta;2025-08-01T10:46:08+02:00;2025-08-01T10:46:08+02:00;Angelika Schwaff;;false
c3bdbccdeb312bf3379f200229f34b728c097b76a1346ef88005fa9819f7db20;EuGH verschärft Bedingungen für Listen sicherer Herkunftsländer;https://www.zeit.de/politik/ausland/2025-08/eugh-albanien-modell-sichere-herkunftsstaaten-asylbewerber;EU-Staaten dürfen ein Herkunftsland nur dann als sicher definieren, wenn die gesamte Bevölkerung in dem betreffenden Staat sicher ist. Das entschied der EuGH.;Europäischer Gerichtshof;Politik, Europäischer Gerichtshof, Giorgia Meloni, Luxemburg, Italien, Albanien, EuGH, Europäische Union, Gerichtshof der Europäischen Union, Gericht der Europäischen Union, Herkunftsland, Asylbewerber;2025-08-01T10:45:29+02:00;2025-08-01T10:45:29+02:00;mga;DIE ZEIT,        dpa,        AFP,        							mga;false
13e3483d4c03ac0c38d321fd48d114233649c90ea05492d1d096712abec9be04;Polizei: Weniger Einschränkungen für Kontrollen bei Schengen;https://www.zeit.de/news/2025-08/01/polizei-weniger-einschraenkungen-fuer-kontrollen-bei-schengen;Hier finden Sie Informationen zu dem Thema „Grenze“. Lesen Sie jetzt „Polizei: Weniger Einschränkungen für Kontrollen bei Schengen“.;Grenze;News, Grenze, Schengen, Polizei, Einschränkung, Verkehrsproblem, Grenze, Grenzkontrolle, Fahrzeug;2025-08-01T10:45:25+02:00;2025-08-01T10:45:25+02:00;;dpa Rheinland-Pfalz/Saarland;false
21a64f8b8a579195e9f0d0ff2c339d0eaed66f11af216c3935f5e62c445e15ee;Sich beim Cobbler um das letzte Stück kabbeln;https://www.zeit.de/zeit-magazin/wochenmarkt/2025-07/pfirsich-cobbler-kuchen-rezept;Dieses Dessert hat immer Saison – sie müssen nur die Fruchtsorten wechseln. Aktuell schmecken unter der Teighaube Pfirsiche besonders gut. Das Rezept geht ruckzuck. ;"Z+ (abopflichtiger Inhalt);
        
    Pfirsisch-Cobbler";Kuchen, Desserts;2025-08-01T10:40:06+02:00;2025-08-01T10:40:06+02:00;Elena Cremer;;false
7bb740b726db8ee6f37a3b29c4c7f8c7a2a1cb6466d5dfb20ac3d89d9354fa63;Kommunen können zusätzlich Geld beantragen;https://www.zeit.de/news/2025-08/01/kommunen-koennen-zusaetzlich-geld-beantragen;Hier finden Sie Informationen zu dem Thema „Finanzen“. Lesen Sie jetzt „Kommunen können zusätzlich Geld beantragen“.;Finanzen;News, Finanzen, Sachsen-Anhalt, BMF, Kommune, Finanzen, Landeszuweisung, Runderlass, Geld;2025-08-01T10:39:09+02:00;2025-08-01T10:39:09+02:00;;dpa Sachsen;false
0ddba881535b1f612e1b9dfb6756cffe2ac85cccd16dc6df6a52641f8adf26f8;Schwerverletzter bei Unfall - A73 mehrere Stunden gesperrt;https://www.zeit.de/news/2025-08/01/bergungsarbeiten-auf-a73-fahrtrichtung-nuernberg-gesperrt;Hier finden Sie Informationen zu dem Thema „Verkehr“. Lesen Sie jetzt „Schwerverletzter bei Unfall - A73 mehrere Stunden gesperrt“.;Verkehr;News, Verkehr, Nürnberg, Forchheim, Bergungsarbeit, Fahrtrichtung, Verkehr, Auto;2025-08-01T10:38:31+02:00;2025-08-01T10:38:31+02:00;;dpa Bayern;false
434f30f97b140ce786fa4bd3288ea8e15f51fe0a2edebbf63bbdc69103b38de0;Invasive Ameisenart in Südhessen;https://www.zeit.de/news/2025-08/01/invasive-ameisenart-in-suedhessen;Hier finden Sie Informationen zu dem Thema „Insekten“. Lesen Sie jetzt „Invasive Ameisenart in Südhessen“.;Insekten;News, Insekten, Südhessen, Landkreis Darmstadt-Dieburg, Ameisenart, Insekt, Ameisenplage, Drüsenameise, Tiere;2025-08-01T10:36:54+02:00;2025-08-01T10:36:54+02:00;;dpa Hessen;false
ab559859374a7c4fcd092f8468f1eeb1fd2e8c8a4488bc6016abb5ad3f3999b4;Zahl der Toten nach Angriff in Kiew steigt auf 31;https://www.zeit.de/news/2025-08/01/zahl-der-toten-nach-angriff-in-kiew-steigt-auf-28;Hier finden Sie Informationen zu dem Thema „Russischer Angriffskrieg“. Lesen Sie jetzt „Zahl der Toten nach Angriff in Kiew steigt auf 31“.;Russischer Angriffskrieg;News, Russischer Angriffskrieg, Russland, Kyjiw, Dnjepropetrowsk, Angriffskrieg, Angriff, Trümmer, Drohne;2025-08-01T10:35:08+02:00;2025-08-01T10:35:08+02:00;;dpa;false
efc38d677e51cf0e472a3a4e0f0b213c163c801fa95b708feb3cb9418b2fae23;Greenpeace protestiert auf Bohrplatz gegen Gasförderung;https://www.zeit.de/news/2025-08/01/greenpeace-protestiert-auf-bohrplatz-gegen-gasfoerderung;Hier finden Sie Informationen zu dem Thema „Umstrittenes Energieprojekt“. Lesen Sie jetzt „Greenpeace protestiert auf Bohrplatz gegen Gasförderung“.;Umstrittenes Energieprojekt;News, Umstrittenes Energieprojekt, Reichling, Ammersee, Bayern, Landsberg am Lech, Greenpeace, Bohrplatz, Gasförderung, Energieprojekt, Erdgasbohrung;2025-08-01T10:34:50+02:00;2025-08-01T10:34:50+02:00;;dpa Bayern;false
d6bf5fe7ffa5b0d6367c076b047a92a2b6d3eed341b4cb0c0485c1158160825e;Reiche: Rüstungsindustrie essenziell für deutsche Wirtschaft;https://www.zeit.de/news/2025-08/01/reiche-ruestungsindustrie-essenziell-fuer-deutsche-wirtschaft;Hier finden Sie Informationen zu dem Thema „Bundeswirtschaftsministerin“. Lesen Sie jetzt „Reiche: Rüstungsindustrie essenziell für deutsche Wirtschaft“.;Bundeswirtschaftsministerin;News, Bundeswirtschaftsministerin, Katherina Reiche, Boris Pistorius, Kassel, Bundeswehr, Resiliente, Rüstungsindustrie, Krieg in der Ukraine, Leopard 2;2025-08-01T10:34:32+02:00;2025-08-01T10:34:32+02:00;;dpa Hessen;false
d73d13c381c25ef388e85f9e0c27ca59376cf90eaa90fb0a4fb917a73c3f97f6;Lastwagen prallt gegen Baum - Fahrer stirbt;https://www.zeit.de/news/2025-08/01/lastwagen-prallt-gegen-baum-fahrer-stirbt;Hier finden Sie Informationen zu dem Thema „Bretten“. Lesen Sie jetzt „Lastwagen prallt gegen Baum - Fahrer stirbt“.;Bretten;News, Bretten, Bretten, Karlsruhe;2025-08-01T10:32:31+02:00;2025-08-01T10:32:31+02:00;;dpa Baden-Württemberg;false
e2d5d864f72dc334848643184c4cb0d3bfeacf329a41437aa9f03e5a8370d8b6;EuGH setzt Hürden für Listen sicherer Herkunftsländer;https://www.zeit.de/news/2025-08/01/eugh-setzt-huerden-fuer-listen-sicherer-herkunftslaender;Hier finden Sie Informationen zu dem Thema „Flüchtlinge“. Lesen Sie jetzt „EuGH setzt Hürden für Listen sicherer Herkunftsländer“.;Flüchtlinge;News, Flüchtlinge, News;2025-08-01T10:32:11+02:00;2025-08-01T10:32:11+02:00;;dpa;false
57c79a810b996823bae34dc7f950cefef72af4e1b2c7c80e5dcf1b922a6231da;Meißner: Beauftragte hat Migration und Integration im Blick;https://www.zeit.de/news/2025-08/01/meissner-beauftragte-hat-migration-und-integration-im-blick;Hier finden Sie Informationen zu dem Thema „Personalie“. Lesen Sie jetzt „Meißner: Beauftragte hat Migration und Integration im Blick“.;Personalie;News, Personalie, Dorothea Storch, CDU, Migration;2025-08-01T10:29:39+02:00;2025-08-01T10:29:39+02:00;;dpa Thüringen;false
c116c251507c049e6209d344fd15a57e75c5c92c9fd07be1676ae9bfaf3c1349;Unzufriedenheit im Norden mit Berliner Energiepolitik wächst;https://www.zeit.de/news/2025-08/01/unzufriedenheit-im-norden-mit-berliner-energiepolitik-waechst;Hier finden Sie Informationen zu dem Thema „Unternehmen zur Energiepolitik“. Lesen Sie jetzt „Unzufriedenheit im Norden mit Berliner Energiepolitik wächst“.;Unternehmen zur Energiepolitik;News, Unternehmen zur Energiepolitik, Schleswig-Holstein, IHK, Unzufriedenheit, Energiepolitik, Energiewende, Koalitionsvertrag;2025-08-01T10:27:12+02:00;2025-08-01T10:27:12+02:00;;dpa Hamburg/Schleswig-Holstein;false
b21ddb217da3ac9b9c0576f7fcf40a0b33a01e9c43971f45e5f33a509bc1228f;Mutmaßliche Callcenter-Betrüger in Albanien hochgenommen;https://www.zeit.de/news/2025-08/01/mutmassliche-callcenter-betrueger-in-albanien-hochgenommen;Hier finden Sie Informationen zu dem Thema „400.000 Euro erbeutet“. Lesen Sie jetzt „Mutmaßliche Callcenter-Betrüger in Albanien hochgenommen“.;400.000 Euro erbeutet;News, 400.000 Euro erbeutet, Mann, Albanien, Callcenter;2025-08-01T10:25:43+02:00;2025-08-01T10:25:43+02:00;;dpa Baden-Württemberg;false
1db2acec38db130c45ff3c6454599fa2cfb1ca3ae88266770d0e63a7ecceaef3;Unfall auf Sommerrodelbahn bei 50 km/h - Kind verletzt;https://www.zeit.de/news/2025-08/01/unfall-auf-sommerrodelbahn-bei-50-km-h-kind-verletzt;Hier finden Sie Informationen zu dem Thema „Freizeitunfall“. Lesen Sie jetzt „Unfall auf Sommerrodelbahn bei 50 km/h - Kind verletzt“.;Freizeitunfall;News, Freizeitunfall, Österreich, Linz, Polizei, Unfall, Sommerrodelbahn, Freizeitunfall;2025-08-01T10:18:55+02:00;2025-08-01T10:18:55+02:00;;dpa;false
25342a346af50dacbe51fd372770a6038b8d26b0112fe02eb62185b5db54a0da;Dresdner Volleyballerinnen verpflichten Miku Akimoto;https://www.zeit.de/news/2025-08/01/dresdner-volleyballerinnen-verpflichten-miku-akimoto;Hier finden Sie Informationen zu dem Thema „Volleyball-Bundesliga“. Lesen Sie jetzt „Dresdner Volleyballerinnen verpflichten Miku Akimoto“.;Volleyball-Bundesliga;News, Volleyball-Bundesliga, Miku Akimoto, Himeji, Elbe, Japan, Dresdner SC, Bundesliga, Außenangriff;2025-08-01T10:17:32+02:00;2025-08-01T10:17:32+02:00;;dpa Sachsen;false
98d9cd73fd7b801842f6a6745615f619e028007c6efd325e08d1cf398a44fe48;Patriot-Lieferung an die Ukraine kann anlaufen;https://www.zeit.de/news/2025-08/01/patriot-lieferung-an-die-ukraine-kann-anlaufen;Hier finden Sie Informationen zu dem Thema „Krieg in der Ukraine“. Lesen Sie jetzt „Patriot-Lieferung an die Ukraine kann anlaufen“.;Krieg in der Ukraine;News, Krieg in der Ukraine, USA, Bundesregierung, Bundeswehr, Krieg in der Ukraine;2025-08-01T10:11:55+02:00;2025-08-01T10:11:55+02:00;;dpa;false
644b78ccfc59b8904a12d760337573f9e1e074b48ef823cff018575c7535bf96;Steuerzahlerbund: Abwassergebühren stark gestiegen;https://www.zeit.de/news/2025-08/01/steuerzahlerbund-abwassergebuehren-stark-gestiegen;Hier finden Sie Informationen zu dem Thema „Wieder teurer geworden“. Lesen Sie jetzt „Steuerzahlerbund: Abwassergebühren stark gestiegen“.;Wieder teurer geworden;News, Wieder teurer geworden, Nordrhein-Westfalen, Bund der Steuerzahler, Abwassergebühr, Musterhaushalt, Steuerzahlerbund;2025-08-01T10:00:40+02:00;2025-08-01T10:00:40+02:00;;dpa Nordrhein-Westfalen;false
aed90051712ee42c129138b3165e6966cd8aed76cb9af373580803af533017cd;KI soll Helgoländer Friesisch vor dem Aussterben bewahren;https://www.zeit.de/news/2025-08/01/ki-soll-helgolaender-friesisch-vor-dem-aussterben-bewahren;Hier finden Sie Informationen zu dem Thema „Minderheitensprachen“. Lesen Sie jetzt „KI soll Helgoländer Friesisch vor dem Aussterben bewahren“.;Minderheitensprachen;News, Minderheitensprachen, Jakob Martens, Lena Dettmer, Amnesty International, Minderheitensprache;2025-08-01T10:00:36+02:00;2025-08-01T10:00:36+02:00;;dpa Hamburg/Schleswig-Holstein;false
45cee9e1cfc16a8e608f4dc407adb193f6074de53dc0dceb412710a0a0c110e4;Deutschland gibt weitere Hilfen gegen Hunger in Gaza;https://www.zeit.de/news/2025-08/01/wadephul-macht-druck-auf-israel-und-warnt-vor-isolierung;Hier finden Sie Informationen zu dem Thema „Deutschland und Israel“. Lesen Sie jetzt „Deutschland gibt weitere Hilfen gegen Hunger in Gaza“.;Deutschland und Israel;News, Deutschland und Israel, Johann Wadephul, Steve Witkoff, Mike Huckabee, Mahmud Abbas, Israel, Jerusalem, Westjordanland, Ramallah, Slowenien, USA;2025-08-01T09:58:05+02:00;2025-08-01T09:58:05+02:00;;dpa;false
b1a7ff8bfc960408729227b6d4d146bb7c46a0c2f936ebc760c3f7574e0f085b;Brand einer Mehrzweckhalle - 600.000 Euro Schaden;https://www.zeit.de/news/2025-08/01/brand-einer-mehrzweckhalle-600-000-euro-schaden;Hier finden Sie Informationen zu dem Thema „Landkreis Osnabrück“. Lesen Sie jetzt „Brand einer Mehrzweckhalle - 600.000 Euro Schaden“.;Landkreis Osnabrück;News, Landkreis Osnabrück, Mehrzweckhalle, Brand;2025-08-01T09:57:54+02:00;2025-08-01T09:57:54+02:00;;dpa Niedersachsen;false
99545fd3b77eb1138b28342b2cfdc1324c29b672415cddda6bbac4d00c2caeb1;So geht es fort, man möchte rasend werden;https://www.zeit.de/kultur/2025-08/robert-wilson-regisseur-theater-tod;"Stummfilm, Musical, Goethes ""Faust"": Den Genres und Klassikern setzte der Regisseur Robert Wilson eine eigene Schöpfung entgegen. Jetzt ist er gestorben. Ein Nachruf";Nachruf auf Robert Wilson;Kultur, Nachruf auf Robert Wilson, Robert Wilson, Regisseur, Theater, Berliner Ensemble, Biografie, Kunst;2025-08-01T09:57:50+02:00;2025-08-01T09:57:50+02:00;Peter Kümmel;;false
39f4e5b547a2fc96b38e75fb25a9f41e43fb8ba4706b0436cc4f7ab00520f5db;Flaute in Nordamerika macht Daimler Truck zu schaffen;https://www.zeit.de/news/2025-08/01/flaute-in-nordamerika-macht-daimler-truck-zu-schaffen;Hier finden Sie Informationen zu dem Thema „Nutzfahrzeughersteller“. Lesen Sie jetzt „Flaute in Nordamerika macht Daimler Truck zu schaffen“.;Nutzfahrzeughersteller;News, Nutzfahrzeughersteller, Karin Radström, Nordamerika, USA, Daimler Truck, Flaute, Marktschwäche, Jahresausblick, Wirtschaftslage, US-Zölle, Dax;2025-08-01T09:54:20+02:00;2025-08-01T09:54:20+02:00;;dpa Baden-Württemberg;false
8ffbc9df51105b62d1977c5cb613fae781374b4a478d022fb7e4a0515059bef7;Sperrungen auf zentraler NRW-Zugstrecke dauern ganzen Tag an;https://www.zeit.de/news/2025-08/01/massive-behinderungen-nach-kabelbrand-an-zugstrecke-in-nrw;Hier finden Sie Informationen zu dem Thema „Sabotage an der Strecke“. Lesen Sie jetzt „Sperrungen auf zentraler NRW-Zugstrecke dauern ganzen Tag an“.;Sabotage an der Strecke;News, Sabotage an der Strecke, NRW, Düsseldorf, Flughafen Düsseldorf International, Duisburg, Polizei, Kabelbrand, Zugstrecke, Behinderung, Bahnverkehr;2025-08-01T09:52:54+02:00;2025-08-01T09:52:54+02:00;;dpa;false
70d3288f1b772a66b525935f8b992bfd12d8a109d4979314dc8d24b25aeef23c;Nach Hubschrauberunglück: Ölsperre auf der Mulde entfernt;https://www.zeit.de/news/2025-08/01/nach-hubschrauberunglueck-oelsperre-auf-der-mulde-entfernt;Hier finden Sie Informationen zu dem Thema „Unfälle“. Lesen Sie jetzt „Nach Hubschrauberunglück: Ölsperre auf der Mulde entfernt“.;Unfälle;News, Unfälle, Grimma, Bundeswehr, Hubschrauberunglück, Ölsperre, Unfall, Hubschrauberabsturz, Helikopter, Hubschrauber;2025-08-01T09:50:37+02:00;2025-08-01T09:50:37+02:00;;dpa Sachsen;false
3ad77087e3cc9ecffaf8386101f262ef777b7a7bd739be00ea734ced91b4a8b8;Chase wechselt vom VfB Stuttgart nach Salzburg;https://www.zeit.de/news/2025-08/01/chase-wechselt-vom-vfb-stuttgart-nach-salzburg;Hier finden Sie Informationen zu dem Thema „Fußball-Bundesliga“. Lesen Sie jetzt „Chase wechselt vom VfB Stuttgart nach Salzburg“.;Fußball-Bundesliga;News, Fußball-Bundesliga, Salzburg, Stuttgart, VfB Stuttgart, FC Red Bull Salzburg, Fußball-Bundesliga, Bundesliga;2025-08-01T09:45:13+02:00;2025-08-01T09:45:13+02:00;;dpa Baden-Württemberg;false
3ee338ce51260c3318a5084ac5e6f31aeb4f0574ca6fa3e6d20b5228d40f38b7;Zahl der Bafög-Geförderten gesunken, niedrigster Wert seit 2000;https://www.zeit.de/campus/2025-08/zahl-bafoeg-empfaenger-2024-statistisches-bundesamt;Im vergangenen Jahr haben weniger Studierende und Schüler Bafög bezogen. Die Zahl der Empfänger sank laut Statistischem Bundesamt um vier Prozent auf knapp 613.000.;Ausbildungsförderung;Campus, Ausbildungsförderung, Bafög, Studienfinanzierung, Statistik, Statistisches Bundesamt, Sozialstaat, Bildung;2025-08-01T09:39:04+02:00;2025-08-01T09:39:04+02:00;lgi;DIE ZEIT,        epd,        							lgi;false
8ffbc9df51105b62d1977c5cb613fae781374b4a478d022fb7e4a0515059bef7;Sperrungen auf zentraler NRW-Zugstrecke dauern ganzen Tag an;https://www.zeit.de/news/2025-08/01/sperrungen-auf-zentraler-nrw-zugstrecke-dauern-ganzen-tag-an;Hier finden Sie Informationen zu dem Thema „Sabotage an der Strecke“. Lesen Sie jetzt „Sperrungen auf zentraler NRW-Zugstrecke dauern ganzen Tag an“.;Sabotage an der Strecke;News, Sabotage an der Strecke, News;2025-08-01T09:33:37+02:00;2025-08-01T09:33:37+02:00;;dpa;false
0c4d5d2e38188a72497782453c146ea72082ec61b6b2024c3bdb56eb003bb7df;Hilfe, es sind Ferien!;https://www.zeit.de/2025/32/ferienbetreuung-eltern-kinder-sommerferien-urlaubstage;Drei Kinder, zwei Monate durchwurschteln: die Sommerferien, ein institutionalisierter Betreuungsnotstand. Eltern brauchen mehr Urlaubstage oder mehr Betreuungsangebote.;"Z+ (abopflichtiger Inhalt);
        
    Ferienbetreuung";Familie, Ferienbetreuung, Kinderbetreuung, Eltern, Kinder, Urlaub, Kindergarten, Schule;2025-08-01T09:20:53+02:00;2025-08-01T09:20:53+02:00;Johannes Schneider;Aus der        ZEIT Nr. 32/2025;false
27a629a0962bb78eaab59c70f1640bc7340e33090a747e51a2eb05d73a964517;Russland kontrolliert Tschassiw Jar offenbar noch nicht vollständig;https://www.zeit.de/politik/ausland/karte-ukraine-krieg-russland-frontverlauf-truppenbewegungen;Die russische Regierung hat die Einnahme von Tschassiw Jar verkündet. Im Westen der Stadt sind Einheiten vorgerückt, doch die Außenbezirke haben sie noch nicht erobert.;Ukrainekarte aktuell;Politik, Ukrainekarte aktuell, Krieg in der Ukraine, Russland, Militär, Charkiw, Donezk, Streitkräfte;2025-08-01T09:14:56+02:00;2025-08-01T09:14:56+02:00;Justus WilkePauline PieperElizabeth RushtonTimo StukenbergChristina FelschenJulius TrögerBenja Zehr;;false
af8d898136ef04b31229b2c229987bc061bdf87f808575e42cbdae8e872d623b;Bafög-Zahl sinkt auf niedrigsten Wert seit 2000;https://www.zeit.de/news/2025-08/01/bafoeg-zahl-sinkt-auf-niedrigsten-wert-seit-2000;Hier finden Sie Informationen zu dem Thema „Statistik“. Lesen Sie jetzt „Bafög-Zahl sinkt auf niedrigsten Wert seit 2000“.;Statistik;News, Statistik, Mann, Statistisches Bundesamt;2025-08-01T09:14:51+02:00;2025-08-01T09:14:51+02:00;;dpa;false
ee79b99f8a00fe6348beaf364a84c2b8cb8b0f8afa03d1d84de4671c49b5ad03;Schweiz nach Zollhammer unter Schock;https://www.zeit.de/news/2025-08/01/schweiz-nach-zollhammer-unter-schock;Hier finden Sie Informationen zu dem Thema „Welthandel“. Lesen Sie jetzt „Schweiz nach Zollhammer unter Schock“.;Welthandel;News, Welthandel, Schweiz, USA, Zollhammer;2025-08-01T09:13:46+02:00;2025-08-01T09:13:46+02:00;;dpa;false
9a0d9a40e541df12320bedd62fa559c201bebfe7039841f60a4b965ec840b15f;Drei Männern im Iran wegen Diebstahls Hände amputiert;https://www.zeit.de/news/2025-08/01/drei-maennern-im-iran-wegen-diebstahls-haende-amputiert;Hier finden Sie Informationen zu dem Thema „Drakonische Strafe“. Lesen Sie jetzt „Drei Männern im Iran wegen Diebstahls Hände amputiert“.;Drakonische Strafe;News, Drakonische Strafe, Mann, Iran, Diebstahl;2025-08-01T09:01:13+02:00;2025-08-01T09:01:13+02:00;;dpa;false
593b1736ce31848a4d33bb4ec7f198e6bcad2cd85c960750738226df8eb0e133;500. Sieg auf der Tour: Zverev in Toronto im Achtelfinale;https://www.zeit.de/news/2025-08/01/500-sieg-auf-der-tour-zverev-in-toronto-im-achtelfinale;Hier finden Sie Informationen zu dem Thema „Tennis“. Lesen Sie jetzt „500. Sieg auf der Tour: Zverev in Toronto im Achtelfinale“.;Tennis;News, Tennis, Matteo Arnaldi, Toronto, Italien, ATP-Tour;2025-08-01T09:01:05+02:00;2025-08-01T09:01:05+02:00;;dpa Sport;false
28aea2cc5ec84e4338621e3dfc1099ff5806046ce97fb4a429ee3117450aef1d;"""Vielleicht war es gut, dass wir zurück nach Deutschland mussten""";https://www.zeit.de/arbeit/2025-06/auswanderung-usa-rechtsruck-pflege-kosten;"Nach dem Abi verliebte sich Joachim Reppmann in die USA – er blieb 33 Jahre. Nie fühlte er sich so frei. Bis sein amerikanischer Traum zerbrach.

";"Z+ (abopflichtiger Inhalt);
        
    Auswanderung in die USA";Arbeit, Auswanderung in die USA, USA, Pflege, Auswanderung, Familie, Rente, Pflegekosten;2025-08-01T08:58:33+02:00;2025-08-01T08:58:33+02:00;Hannah Mara Schmitt;;false
089caf593d45975028bdddb6a125cb8c91c3e3e3fe88da5f5b22674e5e7b8d75;Auto bleibt auf Wanderweg hängen;https://www.zeit.de/news/2025-08/01/auto-bleibt-auf-wanderweg-haengen;Hier finden Sie Informationen zu dem Thema „Nächtliche Rettungsaktion“. Lesen Sie jetzt „Auto bleibt auf Wanderweg hängen“.;Nächtliche Rettungsaktion;News, Nächtliche Rettungsaktion, St. Pankraz-Kircherl, Berchtesgadener Land, Bad Reichenhall, Polizei, Wanderweg, Rettungsaktion, Auto, Fahrzeug;2025-08-01T08:56:11+02:00;2025-08-01T08:56:11+02:00;;dpa Bayern;false
