Hash;Title;Link;Description;Category;KeyWords;Published;LastUpdated;Author;Source;Paywall
f022a54dcb672d41041498d69ddd19ad3ec557ed8cb429f39168f59d1e474001;Arbeitslosigkeit in Sachsen-Anhalt leicht gesunken;https://www.zeit.de/news/2025-10/31/arbeitslosigkeit-in-sachsen-anhalt-leicht-gesunken;Hier finden Sie Informationen zu dem Thema „Arbeitsmarkt“. Lesen Sie jetzt „Arbeitslosigkeit in Sachsen-Anhalt leicht gesunken“.;Arbeitsmarkt;News, Arbeitsmarkt, Sachsen-Anhalt, Regionaldirektion, Arbeitslosigkeit, Arbeitslosenquote;2025-10-31T09:04:03+01:00;2025-10-31T09:04:03+01:00;;dpa Sachsen;false
1f77c26bac43792f490a9dc971a66cc0217c985101d8baea55d792ba4a7b5557;Unirektorin: Auflagen für Lesung zum Nahostkonflikt verletzt;https://www.zeit.de/news/2025-10/31/unirektorin-auflagen-fuer-lesung-zum-nahostkonflikt-verletzt;Hier finden Sie Informationen zu dem Thema „Wissenschaft“. Lesen Sie jetzt „Unirektorin: Auflagen für Lesung zum Nahostkonflikt verletzt“.;Wissenschaft;News, Wissenschaft, Helga Baumgarten, Claudia Becker, Halle, Gazastreifen, Palästinensergebiet, Universität Halle, Deutsche Presse-Agentur, Lesung, Auflage, Nahostkonflikt;2025-10-31T09:02:57+01:00;2025-10-31T09:02:57+01:00;;dpa Sachsen;false
dc0c66d42f47d14e27b92f73b1aca9d8860eb46591f7df521e22e7e40ce663ed;Audi vervielfacht Gewinn - mit eher schwachen Zahlen;https://www.zeit.de/news/2025-10/31/audi-vervielfacht-gewinn-mit-eher-schwachen-zahlen;Hier finden Sie Informationen zu dem Thema „Autoindustrie“. Lesen Sie jetzt „Audi vervielfacht Gewinn - mit eher schwachen Zahlen“.;Autoindustrie;News, Autoindustrie, Marken Bentley, Jürgen Rittersberger, Brüssel, China, USA, Audi, Automobili Lamborghini, Ducati Motor Holding, BMW, Gruppenebene;2025-10-31T09:00:10+01:00;2025-10-31T09:00:10+01:00;;dpa;false
42f1342129235f4f6a0198705175bea6975149b698d5e9a39ad8ec742d3ebe37;Arbeitgeberpräsident fordert von CSU Verzicht auf geplante Mütterrente;https://www.zeit.de/politik/deutschland/2025-10/muetterrende-csu-arbeitgeber-rentenerhoehung;Wegen der anhaltenden Konjunkturschwäche sollte Rainer Dulger zufolge die Mütterrente nicht erhöht werden. Zudem sende dies ein falsches Signal an die junge Generation.;Rentensystem;Politik, Rentensystem, Markus Söder, Konjunktur, Unionsfraktion, Arbeitgeber, CSU, Rente;2025-10-31T08:53:46+01:00;2025-10-31T08:53:46+01:00;mns;DIE ZEIT,        dpa,        AFP,        Reuters,        							mns;false
335905077458e20f30892a5f875374299b40d1a96d55557a882c6f434d924022;Brasilien meldet deutlich weniger Abholzung in seinem Amazonasgebiet;https://www.zeit.de/wissen/umwelt/2025-10/staatliches-klimainstitut-inpe-brasilien-abholzung-gxe;Etwa 5.800 Quadratkilometer des Amazonaswaldes in Brasilien wurden laut dem staatlichen Klimainstitut Inpe zuletzt abgeholzt. Das sei der niedrigste Wert seit elf Jahren.;Staatliches Klimainstitut;Wissen, Staatliches Klimainstitut, Abholzung, Südamerika, Klimaschutz, Amazonas, Umweltschutz, Brasilien;2025-10-31T08:50:30+01:00;2025-10-31T08:50:30+01:00;mmh;DIE ZEIT,        KNA,        Reuters,        AFP,        							mmh;false
7f6eb30d25268268ee3789f92f710d9cae77201c1003a03efcedd773e231b58a;Schüsse auf Shishabar;https://www.zeit.de/news/2025-10/31/schuesse-auf-shishabar;Hier finden Sie Informationen zu dem Thema „Kriminalität“. Lesen Sie jetzt „Schüsse auf Shishabar“.;Kriminalität;News, Kriminalität, Polizei, Patronenhülse, Glasscheibe, Kriminalität;2025-10-31T08:48:01+01:00;2025-10-31T08:48:01+01:00;;dpa Hessen;false
2df847e6bc9f1e5a91093638b3cca95ea5eb740f225383c293f2d321874fef67;Mann liegt neben Auto und stirbt - Polizei sucht Zeugen;https://www.zeit.de/news/2025-10/31/mann-liegt-neben-auto-und-stirbt-polizei-sucht-zeugen;Hier finden Sie Informationen zu dem Thema „Unfälle“. Lesen Sie jetzt „Mann liegt neben Auto und stirbt - Polizei sucht Zeugen“.;Unfälle;News, Unfälle, Polizei, Unfall, Auto;2025-10-31T08:44:57+01:00;2025-10-31T08:44:57+01:00;;dpa Nordrhein-Westfalen;false
3f7fd4aaf65a8f24f3908c59e3a0eade20f87c898e66dfd58a719e5ed2798cc4;Arbeitgeber gegen geplante Mütterrente – SPD bekräftigt Kurs;https://www.zeit.de/news/2025-10/31/arbeitgeber-gegen-geplante-muetterrente-spd-bekraeftigt-kurs;Hier finden Sie Informationen zu dem Thema „Rente“. Lesen Sie jetzt „Arbeitgeber gegen geplante Mütterrente – SPD bekräftigt Kurs“.;Rente;News, Rente, Dirk Wiese, Rainer Dulger, SPD, RTL, Deutscher Bundestag, Mütterrente, Rente, Koalition, Mütter;2025-10-31T08:38:37+01:00;2025-10-31T08:38:37+01:00;;dpa;false
367b352b5e0ff2c390369e76e46a183df140c2391768458beb4d95a2cee74bca;Unbekannte stehlen Ortstafel der Gemeinde Jucken;https://www.zeit.de/news/2025-10/31/unbekannte-stehlen-ortstafel-der-gemeinde-jucken;Hier finden Sie Informationen zu dem Thema „Polizei ermittelt“. Lesen Sie jetzt „Unbekannte stehlen Ortstafel der Gemeinde Jucken“.;Polizei ermittelt;News, Polizei ermittelt, Polizei, Ortstafel, Eifelkreis, Ortsgemeinde;2025-10-31T08:38:22+01:00;2025-10-31T08:38:22+01:00;;dpa Rheinland-Pfalz/Saarland;false
a58d2af4e0ec38c0923d8c08bf87c0b986229d667f2728a3255ba9147d650733;Wadephul im Libanon - Hisbollah-Entwaffnung im Zentrum;https://www.zeit.de/news/2025-10/31/wadephul-im-libanon-hisbollah-entwaffnung-im-zentrum;Hier finden Sie Informationen zu dem Thema „Nahostreise“. Lesen Sie jetzt „Wadephul im Libanon - Hisbollah-Entwaffnung im Zentrum“.;Nahostreise;News, Nahostreise, Johann Wadephul, Joseph Aoun, Nauaf Salam, Libanon, Beirut, Iran, Hisbollah, CDU, Nahostreise;2025-10-31T08:33:04+01:00;2025-10-31T08:33:04+01:00;;dpa;false
caf66ffe0c9301a621d9c1ea16903a3a130d975bf440de538a37103f52a511ef;Drogenlabor in Nauen: U-Haft für zwei Tatverdächtige;https://www.zeit.de/news/2025-10/31/drogenlabor-in-nauen-u-haft-fuer-zwei-tatverdaechtige;Hier finden Sie Informationen zu dem Thema „Kriminalität“. Lesen Sie jetzt „Drogenlabor in Nauen: U-Haft für zwei Tatverdächtige“.;Kriminalität;News, Kriminalität, Havelland, Deutsche Presse-Agentur, Drogenlabor, Zollfahndungsamt, Kriminalität, Drogen;2025-10-31T08:28:46+01:00;2025-10-31T08:28:46+01:00;;dpa Berlin/Brandenburg;false
36f85ba96f9c1f6382061881e669ada196f8fa15fd508de65151add38fcb5a92;Rätsel um Tyrannosaurus rex gelöst;https://www.zeit.de/news/2025-10/31/raetsel-um-tyrannosaurus-rex-geloest;Hier finden Sie Informationen zu dem Thema „Neue Studie“. Lesen Sie jetzt „Rätsel um Tyrannosaurus rex gelöst“.;Neue Studie;News, Neue Studie, Lindsay Zanno, James Napoli, T. Rex, North Carolina, Nanotyrannu, Raleigh, Tyrannosaurus, Rätsel;2025-10-31T08:25:53+01:00;2025-10-31T08:25:53+01:00;;dpa;false
7bf316e7f4d8c6c341577cc4f8d56eb01cd952a5563f1bf92474335194884726;Axt-Räuber überfällt Supermarkt in Offenbach;https://www.zeit.de/news/2025-10/31/axt-raeuber-ueberfaellt-supermarkt-in-offenbach;Hier finden Sie Informationen zu dem Thema „Kriminalität“. Lesen Sie jetzt „Axt-Räuber überfällt Supermarkt in Offenbach“.;Kriminalität;News, Kriminalität, Offenbach, Supermarkt, Kriminalität;2025-10-31T08:22:53+01:00;2025-10-31T08:22:53+01:00;;dpa Hessen;false
bde31605697b98852fe90d5b377db2d6c62f6a72fecf514e02170d5e02d60d20;Goldenes Herbstwetter am Reformationstag;https://www.zeit.de/news/2025-10/31/goldenes-herbstwetter-am-reformationstag;Hier finden Sie Informationen zu dem Thema „Wetterausblick“. Lesen Sie jetzt „Goldenes Herbstwetter am Reformationstag“.;Wetterausblick;News, Wetterausblick, Sachsen, Thüringen, Sachsen-Anhalt, DWD, Reformationstag, Wetterausblick;2025-10-31T08:12:33+01:00;2025-10-31T08:12:33+01:00;;dpa Sachsen;false
6e5b4e0662e13c4649d03bdc6cb886900b0911188c2c7342f41463635f96eacd;BER-Chefin: Inlandsflüge bleiben wichtiges Thema;https://www.zeit.de/news/2025-10/31/ber-chefin-inlandsfluege-bleiben-wichtiges-thema;Hier finden Sie Informationen zu dem Thema „Flughafen Berlin-Brandenburg“. Lesen Sie jetzt „BER-Chefin: Inlandsflüge bleiben wichtiges Thema“.;Flughafen Berlin-Brandenburg;News, Flughafen Berlin-Brandenburg, Berlin-Brandenburg, Berlin, Brandenburg, BER, Inlandsflug, Flughafen, Coronavirus;2025-10-31T08:01:05+01:00;2025-10-31T08:01:05+01:00;;dpa Berlin/Brandenburg;false
13d899bb31b3d64f1a33cb8679a03840d8302e75bd26ad6eb466f6da7bd6fc8d;Polizei verfolgt Auto über belgische Grenze und zurück;https://www.zeit.de/news/2025-10/31/polizei-verfolgt-auto-ueber-belgische-grenze-und-zurueck;Hier finden Sie Informationen zu dem Thema „Mutmaßlich Diebstahl“. Lesen Sie jetzt „Polizei verfolgt Auto über belgische Grenze und zurück“.;Mutmaßlich Diebstahl;News, Mutmaßlich Diebstahl, Polizei, Diebstahl, Verfolgungsfahrt, Auto, Grenze;2025-10-31T08:00:56+01:00;2025-10-31T08:00:56+01:00;;dpa Nordrhein-Westfalen;false
9abd58fafdd86f98352dda9df13f24620168b3635f21f71866537f356732c9f0;Zoos schützen Nandus, Keas und Co. vor Vogelgrippe;https://www.zeit.de/news/2025-10/31/zoos-schuetzen-nandus-keas-und-co-vor-vogelgrippe;Hier finden Sie Informationen zu dem Thema „Tierparks sorgen vor“. Lesen Sie jetzt „Zoos schützen Nandus, Keas und Co. vor Vogelgrippe“.;Tierparks sorgen vor;News, Tierparks sorgen vor, Simone Hagenmeyer, Nils Kramer, Janina Ehrhardt, Asta Knoth, Nordhorn, Niedersachsen, Bremen, Zoo Hannover, Serengeti-Park, Nandu;2025-10-31T08:00:05+01:00;2025-10-31T08:00:05+01:00;;dpa Niedersachsen;false
c746ce9e47633f22292056195cc74efcda7368fa5e5e35ed08b758bfeda69ac4;Nach Treffen mit Trump: Xi warnt vor gestörten Lieferketten;https://www.zeit.de/news/2025-10/31/nach-treffen-mit-trump-xi-warnt-vor-gestoerten-lieferketten;Hier finden Sie Informationen zu dem Thema „Handelsstreit“. Lesen Sie jetzt „Nach Treffen mit Trump: Xi warnt vor gestörten Lieferketten“.;Handelsstreit;News, Handelsstreit, Donald Trump, Xi Jinping, China, USA, APEC, Treffen, Lieferkette, Handelsstreit;2025-10-31T07:30:12+01:00;2025-10-31T07:30:12+01:00;;dpa;false
4e87a800588533deff96e992568b18687108915ef1b2fb551d8db90f1292a0bd;Traktor fährt von allein los – und löst Polizeieinsatz aus;https://www.zeit.de/news/2025-10/31/traktor-faehrt-von-allein-los-und-loest-polizeieinsatz-aus;Hier finden Sie Informationen zu dem Thema „Landkreis Bernkastel-Wittlich“. Lesen Sie jetzt „Traktor fährt von allein los – und löst Polizeieinsatz aus“.;Landkreis Bernkastel-Wittlich;News, Landkreis Bernkastel-Wittlich, Bernkastel-Wittlich, Wittlich, Polizei, Traktor, Polizeieinsatz, Landkreis;2025-10-31T07:30:08+01:00;2025-10-31T07:30:08+01:00;;dpa Rheinland-Pfalz/Saarland;false
6178790614020e2e4e6f49e9a09d55eb39d2bed349ecbb8986d446cd6f46a46c;Undichte Fässer auf Lastwagen – Raststätte teils gesperrt;https://www.zeit.de/news/2025-10/31/undichte-faesser-auf-lastwagen-raststaette-teils-gesperrt;Hier finden Sie Informationen zu dem Thema „Notfall“. Lesen Sie jetzt „Undichte Fässer auf Lastwagen – Raststätte teils gesperrt“.;Notfall;News, Notfall, Feuerwehr, Polizei, Raststätte, Notfall, Aromastoff;2025-10-31T07:26:45+01:00;2025-10-31T07:26:45+01:00;;dpa Hessen;false
c9bf4fe10147f183e214fb14a873e15d58c519bfae3a8060036c43613d9715a5;"Nino de Angelo: ""Noch Bock, lange zu leben""";https://www.zeit.de/news/2025-10/31/nino-de-angelo-noch-bock-lange-zu-leben;"Hier finden Sie Informationen zu dem Thema „Schlagerstar“. Lesen Sie jetzt „Nino de Angelo: ""Noch Bock, lange zu leben""“.";Schlagerstar;News, Schlagerstar, Nino de Angelo, Allgäu, Italien, Umbrien, Tiere;2025-10-31T07:21:22+01:00;2025-10-31T07:21:22+01:00;;dpa Bayern;false
f731876a272016f5252fcea3d1653e66766ab17f5d43e215b53708c215b505ff;Brücken im Gleisdreieckpark werden durch Neubauten ersetzt;https://www.zeit.de/news/2025-10/31/bruecken-im-gleisdreieckpark-werden-durch-neubauten-ersetzt;Hier finden Sie Informationen zu dem Thema „Marode U-Bahn-Brücken“. Lesen Sie jetzt „Brücken im Gleisdreieckpark werden durch Neubauten ersetzt“.;Marode U-Bahn-Brücken;News, Marode U-Bahn-Brücken, Gleisdreieckpark, Neubau, Gleisdreieck;2025-10-31T07:15:17+01:00;2025-10-31T07:15:17+01:00;;dpa Berlin/Brandenburg;false
53dd3b53d2bdf4e2d024c8bfd8ffc5c028090e87cf228a413b2636e7efceaf28;A36 nach Brand an Lkw Richtung Bernburg gesperrt;https://www.zeit.de/news/2025-10/31/a36-nach-brand-an-lkw-richtung-bernburg-gesperrt;Hier finden Sie Informationen zu dem Thema „Verkehr“. Lesen Sie jetzt „A36 nach Brand an Lkw Richtung Bernburg gesperrt“.;Verkehr;News, Verkehr, Bernburg, Verkehr;2025-10-31T07:15:13+01:00;2025-10-31T07:15:13+01:00;;dpa Sachsen;false
5a1327d37c86524bce58a5eb114fe3a8c1eee204fddb8a54a66c9a56231412af;Warum der Konflikt zwischen den USA und Venezuela eskaliert;https://www.zeit.de/politik/ausland/2025-10/usa-venezuela-bombenangriffe-trump-rubio-maduro-drogen;"Seit zwei Monaten bombardiert das US-Militär Boote in der Karibik und im Pazifik vor Südamerika. Der Vorwurf: ""Drogen-Terrorismus"". Was über die Angriffe bekannt ist.";US-Militärschläge in Lateinamerika;Politik, US-Militärschläge in Lateinamerika, Marco Rubio, Nicolás Maduro, USA, Venezuela, Karibik, Drogen, Militär, Terrorismus;2025-10-31T07:12:17+01:00;2025-10-31T07:12:17+01:00;David WillWie viele Boote hat das US-Militär bisher bombardiert?Wie rechtfertigen die USA die Militärschläge?Gibt es für die Behauptungen der USA Belege?Sind die Militärschläge legal?Was werfen die USA der venezolanischen Regierung vor?Was ist dran an den Vorwürfen?Droht jetzt ein Krieg?;;false
eca82e84c6ac8e9d781702ee06e503a73dbaee9e4c46baae1586703afb055262;"""Ich habe keine Ahnung, welches Verbrechen ich begangen hätte""";https://www.zeit.de/kultur/2025-10/eva-illouz-universitaet-rotterdam-ausladung-boykott-israel;Die Soziologin Eva Illouz ist eine Ikone der linken Theorie – und kritisiert die Linke beim Thema Israel. Nun wurde sie von der Universität Rotterdam ausgeladen. Warum?;"Z+ (abopflichtiger Inhalt);
        
    Eva Illouz";Kultur, Eva Illouz, Eva Illouz, Ahnung, Verbrechen;2025-10-31T07:11:01+01:00;2025-10-31T07:11:01+01:00;Dr. Peter Neumann;;false
000ea949bf3e13b2c317826437f206c710baec8f0789db729572c191651e16cb;Feuerwehr rettet Bewohner aus brennendem Haus;https://www.zeit.de/news/2025-10/31/feuerwehr-rettet-bewohner-aus-brennendem-haus;Hier finden Sie Informationen zu dem Thema „Brände“. Lesen Sie jetzt „Feuerwehr rettet Bewohner aus brennendem Haus“.;Brände;News, Brände, Feuerwehr, Wohnungsbrand, Bewohner, Brand;2025-10-31T07:06:52+01:00;2025-10-31T07:06:52+01:00;;dpa Hamburg/Schleswig-Holstein;false
8608d1b678066b6eaef695066e6a48305078961ef03d7d665af19997478ac5c5;Emmanuel Macron ist in Frankreich so unbeliebt wie noch nie;https://www.zeit.de/politik/ausland/2025-10/frankreich-emmanuel-macron-zustimmung-umfrage-gxe;Nur noch elf Prozent der Franzosen stehen laut einer Umfrage hinter Emmanuel Macron – so unpopulär war kein Präsident vor ihm. Die Unzufriedenheit hat mehrere Gründe.;Frankreich;Politik, Frankreich, Emmanuel Macron, Sébastien Lecornu, Paris, Le Figaro, Frankreich, Schulden;2025-10-31T07:01:30+01:00;2025-10-31T07:01:30+01:00;jsp;DIE ZEIT,        AFP,        							jsp;false
5a5670bef2c473eed23c1839226f382cad96869bea844171cad0973239bc749e;Flammen in Bruchsal - rund 100.000 Euro Schaden;https://www.zeit.de/news/2025-10/31/flammen-in-bruchsal-rund-100-000-euro-schaden;Hier finden Sie Informationen zu dem Thema „Brand“. Lesen Sie jetzt „Flammen in Bruchsal - rund 100.000 Euro Schaden“.;Brand;News, Brand, Bruchsal;2025-10-31T06:56:48+01:00;2025-10-31T06:56:48+01:00;;dpa Baden-Württemberg;false
d8bdad52759c54bd23937a273ade7aff738de43cd6f9b4bfcfd6761deefa1423;Flug mit schutzbedürftigen Afghanen in Deutschland gelandet;https://www.zeit.de/politik/deutschland/2025-10/asyl-afghanistan-flugzeug-hannover-istanbul;In Pakistan warten fast 2.000 Afghaninnen und Afghanen mit Aufnahmezusage auf ihre Ausreise nach Deutschland. Zwei Familien sind nun in Hannover gelandet.;Asyl;Politik, Asyl, Afghanistan, Geflüchtete, Islamabad, Migration, Asyl, Flugzeug;2025-10-31T06:39:30+01:00;2025-10-31T06:39:30+01:00;edd;DIE ZEIT,        dpa,        							edd;false
b32ba723355d311de1e9f8b8b2677c5d109d75318a0e136e237d9194f119cd7a;"20 Jahre ""Bauer sucht Frau"" haben Inka Bause jung gehalten";https://www.zeit.de/news/2025-10/31/20-jahre-bauer-sucht-frau-haben-inka-bause-jung-gehalten;"Hier finden Sie Informationen zu dem Thema „Moderatorin“. Lesen Sie jetzt „20 Jahre ""Bauer sucht Frau"" haben Inka Bause jung gehalten“.";Moderatorin;News, Moderatorin, Inka Bause, Deutsche Presse-Agentur, Bauer sucht Frau, Liebe;2025-10-31T06:30:10+01:00;2025-10-31T06:30:10+01:00;;dpa Berlin/Brandenburg;false
873cf51f7cce80cd73dceed9f601e32387b93a3e7299c2821ea8650ea945ef2a;Herbstferien enden - ADAC erwartet lebhaften Verkehr;https://www.zeit.de/news/2025-10/31/herbstferien-enden-adac-erwartet-lebhaften-verkehr;Hier finden Sie Informationen zu dem Thema „Staugefahr“. Lesen Sie jetzt „Herbstferien enden - ADAC erwartet lebhaften Verkehr“.;Staugefahr;News, Staugefahr, Hamburg, Schleswig-Holstein, ADAC, Reformationstag, Herbstferien, Staugefahr, Verkehr;2025-10-31T06:30:06+01:00;2025-10-31T06:30:06+01:00;;dpa Hamburg/Schleswig-Holstein;false
65e41fe390f4d1b71c401909a7ffdc77b74ecbbf25c8e2ec4951b39cf86a5c48;Verdacht auf illegales Glücksspiel – Razzia in Celle;https://www.zeit.de/news/2025-10/31/verdacht-auf-illegales-gluecksspiel-razzia-in-celle;Hier finden Sie Informationen zu dem Thema „Kriminalität“. Lesen Sie jetzt „Verdacht auf illegales Glücksspiel – Razzia in Celle“.;Kriminalität;News, Kriminalität, Celle, Polizei, Glücksspiel, Kriminalität, Razzia;2025-10-31T06:29:38+01:00;2025-10-31T06:29:38+01:00;;dpa Niedersachsen;false
4a3f16fa2f56560fa0f9e92159b0bef57c75f700e87a14d5ccd0ac30988a42fb;Schutzbedürftige Afghanen auf dem Weg nach Deutschland;https://www.zeit.de/politik/2025-10/afghanen-deutschland-einreise-schutzbedarf-migration-gxe;Schwarz-Rot hat das Aufnahmeprogramm für schutzbedürftige Afghanen gestoppt, einige erhalten trotzdem Visa. Jetzt fliegen erneut Betroffene aus Pakistan ein.;Afghanistan;Politik, Afghanistan, Pakistan, Afghanistan, Schwarz-rote Koalition, Asyl, Visum, Migration, Menschenrechte, Taliban;2025-10-31T06:25:47+01:00;2025-10-31T06:25:47+01:00;yernmo;DIE ZEIT,        dpa,        							yer					,        							nmo;false
11aa8656c3056aee88372ff867ea63426093b76779837258580b9019272ed11f;Oktober verabschiedet sich mit milden 19 Grad;https://www.zeit.de/news/2025-10/31/oktober-verabschiedet-sich-mit-milden-19-grad;Hier finden Sie Informationen zu dem Thema „Wetter“. Lesen Sie jetzt „Oktober verabschiedet sich mit milden 19 Grad“.;Wetter;News, Wetter, Baden-Württemberg, DWD, Monatsende, Wetter;2025-10-31T06:25:14+01:00;2025-10-31T06:25:14+01:00;;dpa Baden-Württemberg;false
30e1529853d366e7c0ee103c00a55069090c116f8ab739256d67534cc2ded9e3;Zugprobleme am Niederrhein bislang nicht behoben;https://www.zeit.de/news/2025-10/31/zugprobleme-am-niederrhein-bislang-nicht-behoben;Hier finden Sie Informationen zu dem Thema „Defekt an Stellwerk“. Lesen Sie jetzt „Zugprobleme am Niederrhein bislang nicht behoben“.;Defekt an Stellwerk;News, Defekt an Stellwerk, Niederrhein, Zugproblem, Stellwerk, Zugausfall, Hauptbahnhof;2025-10-31T06:16:49+01:00;2025-10-31T06:16:49+01:00;;dpa Nordrhein-Westfalen;false
42dc0245c6861bdde858cee848c9d113b67a0dfa4ca762136e4f301b9e1757a2;Details zum neuen Bestattungsgesetz kommen bald;https://www.zeit.de/news/2025-10/31/details-zum-neuen-bestattungsgesetz-kommen-bald;Hier finden Sie Informationen zu dem Thema „Totenkultur“. Lesen Sie jetzt „Details zum neuen Bestattungsgesetz kommen bald“.;Totenkultur;News, Totenkultur, Mainz, Bestattungsgesetz, Totenkultur, Bestattungsform;2025-10-31T06:05:06+01:00;2025-10-31T06:05:06+01:00;;dpa Rheinland-Pfalz/Saarland;false
aa186842dce366170482c40efec7bd8fca126ef0855c6f2851a68199ffdb7a95;Parchimer Martinimarkt startet – Weihnachtsmärkte in Kürze;https://www.zeit.de/news/2025-10/31/parchimer-martinimarkt-startet-weihnachtsmaerkte-in-kuerze;Hier finden Sie Informationen zu dem Thema „Feste“. Lesen Sie jetzt „Parchimer Martinimarkt startet – Weihnachtsmärkte in Kürze“.;Feste;News, Feste, Parchim, Rostock, Mecklenburg-Vorpommern, Martinimarkt, Weihnachtsmarkt, Jahrmarkt;2025-10-31T06:00:22+01:00;2025-10-31T06:00:22+01:00;;dpa Mecklenburg-Vorpommern;false
52d6c7e2dc1e476c4738efe8bf0784d9e48613dd75e81d574936a22e04515aa1;Lübeck erinnert an Kolonialismus und Verfolgung;https://www.zeit.de/news/2025-10/31/luebeck-erinnert-an-kolonialismus-und-verfolgung;Hier finden Sie Informationen zu dem Thema „Veranstaltungsreihe“. Lesen Sie jetzt „Lübeck erinnert an Kolonialismus und Verfolgung“.;Veranstaltungsreihe;News, Veranstaltungsreihe, Dagmar Herzog, Lübeck, Veranstaltungsreihe, Kolonialismus, Verfolgung;2025-10-31T06:00:10+01:00;2025-10-31T06:00:10+01:00;;dpa Hamburg/Schleswig-Holstein;false
a416247a1f8e0ebe66873a64858fe18b49df41dbf6c1d14dba5ee210d6ed15a9;Hebammen werden anders bezahlt - was das für Familien heißt;https://www.zeit.de/news/2025-10/31/hebammen-werden-anders-bezahlt-was-das-fuer-familien-heisst;Hier finden Sie Informationen zu dem Thema „Geburtshilfe“. Lesen Sie jetzt „Hebammen werden anders bezahlt - was das für Familien heißt“.;Geburtshilfe;News, Geburtshilfe, Diana Schmidt, Thüringen, Gebührenordnung;2025-10-31T06:00:07+01:00;2025-10-31T06:00:07+01:00;;dpa Thüringen;false
eb9d0e2844fe6a51e44c7d2493e77a6cb63e5badd578ce79aa4d44f21f18d38b;"Trump senkt Obergrenze für Geflüchtete, ""Eingreiftruppe"" gegen Unruhen";https://www.zeit.de/politik/ausland/2025-10/us-ueberblick-eingreiftruppe-gegen-unruhen-trump-obergrenze-gefluechtete;"Die Nationalgarde soll laut Berichten eine ""schnelle Eingreiftruppe"" für das Inland bekommen. Die Aufnahme von Geflüchteten wird auf 7.500 pro Jahr begrenzt. Die Nacht";US-Überblick am Morgen;Politik, US-Überblick am Morgen, Donald Trump, USA, US-Regierung, Geflüchtete, Bankenaufsicht, Fed;2025-10-31T05:55:08+01:00;2025-10-31T05:55:08+01:00;eca;DIE ZEIT,        Reuters,        dpa,        AP,        							eca;false
bea343b252185538cc4f35eb03274c06097f15e29f0b6ec397349cd1fa159a63;Jamaika meldet 19 Tote nach Sturm Melissa;https://www.zeit.de/gesellschaft/2025-10/wirbelsturm-melissa-tote-jamaika-haiti-kuba;In der Karibik sind durch Hurrikan Melissa mindestens 50 Menschen ums Leben gekommen. Der Sturm bewegte sich anschließend auf Bermuda im Nordatlantik zu.;Tropischer Wirbelsturm;Gesellschaft, Tropischer Wirbelsturm, Jamaika, Wirbelsturm, Extremwetter, Haiti, Karibik, Dominikanische Republik;2025-10-31T05:38:38+01:00;2025-10-31T05:38:38+01:00;jj;DIE ZEIT,        dpa,        AFP,        							jj;false
264a3540e5c438f45a65d1f3ebeb5a6f7afa7d6f98a36e3da1248a5839376a14;Sören Schulz: Mit 15 Jahren Gemüsebauer mit Leib und Seele;https://www.zeit.de/news/2025-10/31/soeren-schulz-mit-15-jahren-gemuesebauer-mit-leib-und-seele;Hier finden Sie Informationen zu dem Thema „Jugend in der Landwirtschaft“. Lesen Sie jetzt „Sören Schulz: Mit 15 Jahren Gemüsebauer mit Leib und Seele“.;Jugend in der Landwirtschaft;News, Jugend in der Landwirtschaft, Uelzen;2025-10-31T05:30:10+01:00;2025-10-31T05:30:10+01:00;;dpa Niedersachsen;false
b62f4cfb0677702758cd1da465c7d04c71ae4c2187a69e2518d8e8a82377e0d0;"""Dann war ich eben schuld""";https://www.zeit.de/2025/46/das-versagen-katja-gloger-georg-mascolo-deutsche-russlandpolitik-gxe;Katja Gloger und Georg Mascolo schildern in ihrem neuen Buch eindrucksvoll das Scheitern der deutschen Russlandpolitik. Es ist ein Glanzstück journalistischer Recherche.;"Z+ (abopflichtiger Inhalt);
        
    ""Das Versagen""";"Kultur, ""Das Versagen"", Katja Gloger, Georg Mascolo, Angela Merkel, Carsten Breuer, William Burns, Bob Woodward, Putin zu Poroschenko, Klaus Mangold, Sigmar Gabriel, Gerhard Schröder";2025-10-31T05:26:58+01:00;2025-10-31T05:26:58+01:00;Matthias Naß;Aus der        ZEIT Nr. 46/2025;false
4fb14bef4618ba98ce27dbca12b8e819112ac0a79f5949266a6eac061f8bd4ab;Das Gelbe vom Ei;https://www.zeit.de/zeit-magazin/wochenmarkt/2025-05/kuerbis-pisto-rezept-wochenmarkt;Dass Suppen von Croûtons getoppt werden, kennen wir. Auf diesem spanischen Kürbiseintopf tanzen neben Brot- auch Chorizowürfel – und darüber balanciert ein Spiegelei.;"Z+ (abopflichtiger Inhalt);
        
    Kürbis-Pisto";Zeit-Magazin, Wochenmarkt;2025-10-31T05:25:45+01:00;2025-10-31T05:25:45+01:00;José Pizarro;;false
2c637fd9af3e82ebb4fb36d5abb44b5a6210d161781c103017867eb07cb5fb32;Scheidungsgrund Schlürfen;https://www.zeit.de/2025/46/misophonie-ekel-geraeusche-forschung-gxe;Raschel, knusper, schmatz: Manche Menschen hassen bestimmte Geräusche. Wie sie ticken, haben Forschende jetzt untersucht. Vor allem die Bildertests waren aufschlussreich.;"Z+ (abopflichtiger Inhalt);
        
    Misofonie";Gesundheit, Misofonie, Essen, Phobie, Psychologie, Forschung, Psyche, Stress;2025-10-31T05:25:26+01:00;2025-10-31T05:25:26+01:00;Stefanie Kara;Aus der        ZEIT Nr. 46/2025;false
b57e525eb43a786d17b7dfbe7d78b4faf00d68f4e81cae72a9a43568877131be;SPD: Landesregierung macht Berufsschulen das Leben schwer;https://www.zeit.de/news/2025-10/31/spd-landesregierung-macht-berufsschulen-das-leben-schwer;Hier finden Sie Informationen zu dem Thema „Schuljahr 2025/26“. Lesen Sie jetzt „SPD: Landesregierung macht Berufsschulen das Leben schwer“.;Schuljahr 2025/26;News, Schuljahr 2025/26, Martin Habersaat, Schleswig-Holstein, SPD, Berufsschule, Landesregierung, Schuljahr;2025-10-31T05:05:05+01:00;2025-10-31T05:05:05+01:00;;dpa Hamburg/Schleswig-Holstein;false
