Hash;Title;Link;Description;Category;KeyWords;Published;LastUpdated;Author;Source;Paywall
08e718f5c1d7217580324b3ac4699a1ec0532b96ec820b8da6f91a7ff8ea922e;"""Na, ganz allein hier?"" – Zu Besuch in einem Hotel nur für Frauen";https://www.zeit.de/hamburg/2025-03/elbvertiefung-24-03-2025;Weibliche Gäste sollen hier ihre Ruhe haben. Außerdem: SPD will weiter mit den Grünen regieren, Panne bei Sprengungen am Kraftwerk Moorburg;Frauenhotel Hanseatin;Hamburg, Frauenhotel Hanseatin, Viola Diem, Silja Kröger, Mann, Moorburg, Eimsbüttel, Hamburg, Bremen, Hamburger Hafen, HSV, SPD;2025-03-24T10:00:08+01:00;2025-03-24T10:00:08+01:00;Viola Diem;;false
75295c236ef398bf82cfa6401bfd7d7e15fe688b71f8bed7ca6e5f2237e8a777;Türkische Journalisten nach Berichten über Proteste festgenommen;https://www.zeit.de/politik/ausland/2025-03/tuerkei-proteste-erdogan-imamoglu-journalisten-festnahme;Im Zuge der Proteste gegen die Regierung gehen die Behörden auch gegen Reporter vor. Mehrere werden festgenommen, der genaue Grund ist unklar.;Proteste gegen Erdoğan;Politik, Proteste gegen Erdoğan, Recep Tayyip Erdogan, Ekrem İmamoğlu, Journalistengewerkschaft;2025-03-24T09:52:54+01:00;2025-03-24T09:52:54+01:00;ale;ZEIT ONLINE,        Reuters,        							ale;false
dc3147eb9f2386ae9874f4ec1c4fdda20782e129613f3a4ba0ecebaca244e979;Wechsel nach Hannover? Handball-Talent Grgić weicht aus;https://www.zeit.de/news/2025-03/24/wechsel-nach-hannover-handball-talent-grgi-weicht-aus;Hier finden Sie Informationen zu dem Thema „Eisenach legt Veto ein“. Lesen Sie jetzt „Wechsel nach Hannover? Handball-Talent Grgić weicht aus“.;Eisenach legt Veto ein;News, Eisenach legt Veto ein, Mario Grgić, Hannover, Eisenach, Stuttgart, Dyn, ThSV Eisenach, Bundesliga, Wechselspekulation;2025-03-24T09:52:37+01:00;2025-03-24T09:52:37+01:00;;dpa Niedersachsen;false
2ccb9ab4019471f42b884ba0fde0c4d0b56fbc91156461ba2d452832af06e2a2;Pariser wollen Autos aus Hunderten Straßen verbannen;https://www.zeit.de/mobilitaet/2025-03/paris-frankreich-autofreie-strassen-buergerbefragung;Bei einer Befragung in Frankreichs Hauptstadt sprechen sich viele Menschen dafür aus, 500 Straßen in Fußgängerzonen umzuwandeln. 10.000 Parkplätze könnten wegfallen.;Stadtverkehr;Mobilitaet, Stadtverkehr, Frankreich, Paris, Anne Hidalgo, Infrastruktur, Umweltschutz;2025-03-24T09:47:40+01:00;2025-03-24T09:47:40+01:00;mp;ZEIT ONLINE,        dpa,        							mp;false
71dee5ded7998086dd21aa2e1ec3d55ca7e51f657a95ca96ee991c36e08f3a23;"""Wenn wir mal in den Urlaub gefahren sind, dann höchstens vier Tage""";https://www.zeit.de/arbeit/2025-03/selbststaendigkeit-krankheit-familie-kinder-arbeitsalltag;Wer selbstständig ist, muss jeden Tag funktionieren: Der darf eigentlich nicht ausfallen oder kranke Kinder haben. Fünf Eltern erzählen, wie sie Alltag und Job hinbiegen.;"Z+ (abopflichtiger Inhalt);
        
    Selbstständigkeit";Arbeit, Selbstständigkeit, Selbstständigkeit, Vereinbarkeit von Familie und Beruf, Kinder, Alltag, Familie;2025-03-24T09:42:37+01:00;2025-03-24T09:42:37+01:00;Gerrit-Freya Klebe;;false
0a6f84971ecd0b85645f542a2ac671b6777c2b040f65fd11130b1cf44b994ff3;Letzte Generation offenbar wegen krimineller Vereinigung angeklagt;https://www.zeit.de/gesellschaft/zeitgeschehen/2025-03/klima-aktivismus-fruehere-letzte-generation-mittelung-anklage-kriminelle-vereinigung;Die frühere Letzte Generation hat bekannt gegeben, dass gegen sie Anklage erhoben worden sei. Fünf Mitgliedern werde Bildung einer kriminellen Vereinigung vorgeworfen.;Klimaaktivismus;Gesellschaft, Klimaaktivismus, Letzte Generation, Anklage, Vereinigung, Klimaaktivismus;2025-03-24T09:39:40+01:00;2025-03-24T09:39:40+01:00;mmh;ZEIT ONLINE,        AFP,        							mmh;false
1ef8269eea32d41cee5584affcbb676c88e46576a0d69f16be961cb9c615fd46;Endstation Vaihingen;https://www.zeit.de/2025/12/gaeubahn-zuerich-stuttgart-eisenbahn;Seit 150 Jahren verbindet die Gäubahn Zürich mit Stuttgart. Jetzt soll die Strecke bereits am Stadtrand enden. Was soll das?;"Z+ (abopflichtiger Inhalt);
        
    Gäubahn";Mobilitaet, Gäubahn, Benedikt Weibel, Zürich, Stuttgart, Vaihingen, Dresden, Schweiz, Schaffhausen, Tuttlingen, Rottweil, St. Petersburg;2025-03-24T09:37:57+01:00;2025-03-24T09:37:57+01:00;Marlon Rusch;Aus der        ZEIT Nr. 12/2025;false
c22fd35a2a4e1a1d72943e1447c6912e313ece96134bce7fb63f28bd5c1b2ac5;Mutmaßlicher Schütze von Fürth stellt sich Behörden;https://www.zeit.de/news/2025-03/24/mutmasslicher-schuetze-von-fuerth-stellt-sich-behoerden;Hier finden Sie Informationen zu dem Thema „Kriminalität“. Lesen Sie jetzt „Mutmaßlicher Schütze von Fürth stellt sich Behörden“.;Kriminalität;News, Kriminalität, Fürth, Kriminalität;2025-03-24T09:34:27+01:00;2025-03-24T09:34:27+01:00;;dpa;false
c25ac7ed415edba30e0084f39cfe56adc24cc27421f6023a3b45316258cf3f45;Rund ein Viertel der Beschäftigten arbeitet im Homeoffice;https://www.zeit.de/arbeit/2025-03/ifo-institut-umfrage-homeoffice-25-prozent-beschaeftigte-stabil;Mehr als 24 Prozent der deutschen Beschäftigten arbeiten laut einer ifo-Umfrage zumindest teilweise von zu Hause aus. Das Homeoffice-Modell habe sich fest etabliert.;ifo-Umfrage;Arbeit, ifo-Umfrage, Statistik, Homeoffice, Arbeitsmarkt, Arbeitsplatz, Ifo-Institut für Wirtschaftsforschung;2025-03-24T09:20:29+01:00;2025-03-24T09:20:29+01:00;mmh;ZEIT ONLINE,        KNA,        dpa,        							mmh;false
ec7f574534ece6a1ee3d09c8516c1f3c71b8558af077c79d26b0ee3ca6eba9ef;"Nena feiert 65. Geburtstag mit ""Tanz in den Frühling""";https://www.zeit.de/news/2025-03/24/nena-feiert-65-geburtstag-mit-tanz-in-den-fruehling;"Hier finden Sie Informationen zu dem Thema „Leute“. Lesen Sie jetzt „Nena feiert 65. Geburtstag mit ""Tanz in den Frühling""“.";Leute;News, Leute, Nena, Sängerin, Geburtstag, Party;2025-03-24T09:16:02+01:00;2025-03-24T09:16:02+01:00;;dpa Hamburg/Schleswig-Holstein;false
612ca47f2d20c28a65430aaa471d0ae9bd189182599247c8192a465f7eeb67f7;Vertreter von US-Konzernen treffen chinesische Führung;https://www.zeit.de/wirtschaft/2025-03/china-usa-konzerne-apple-handelskonflikt-donald-trump;Der chinesische Vizepremier He Lifeng hat unter anderem Vertreter von Apple und Mastercard empfangen. Die Regierung in Peking hofft auf Entspannung im Handelskonflikt.;China und USA;Wirtschaft, China und USA, China, Peking, USA, Apple, MasterCard Incorporated;2025-03-24T09:15:55+01:00;2025-03-24T09:15:55+01:00;ale;ZEIT ONLINE,        Reuters,        							ale;false
a4b45b44feb7b80c32cafef764b30c49578e01c238225f57284775d273fe450d;Gästezahlen in Hamburg steigen im Januar;https://www.zeit.de/news/2025-03/24/gaestezahlen-in-hamburg-steigen-im-januar;Hier finden Sie Informationen zu dem Thema „Statistik“. Lesen Sie jetzt „Gästezahlen in Hamburg steigen im Januar“.;Statistik;News, Statistik, Hamburg, Gästezahl, Statistik;2025-03-24T09:15:55+01:00;2025-03-24T09:15:55+01:00;;dpa Hamburg/Schleswig-Holstein;false
5eb4b63c5d86776625af6b0453cbe9e13dd60a24403dc18a2e365718f0676077;Zahl der Elterngeldempfänger sinkt;https://www.zeit.de/news/2025-03/24/zahl-der-elterngeldempfaenger-sinkt;Hier finden Sie Informationen zu dem Thema „Nach der Geburt“. Lesen Sie jetzt „Zahl der Elterngeldempfänger sinkt“.;Nach der Geburt;News, Nach der Geburt, Wiesbaden, Statistisches Bundesamt, Elterngeld, Geburt, Väter, Mütter, Elterngeld Plus;2025-03-24T09:13:36+01:00;2025-03-24T09:13:36+01:00;;dpa;false
255fd8bc5b4d3f539be893506833fc755fada9e7426e9f82cdb2d069287da7f0;Depardieu-Prozess beginnt - Gab es sexuelle Übergriffe?;https://www.zeit.de/news/2025-03/24/depardieu-prozess-beginnt-gab-es-sexuelle-uebergriffe;Hier finden Sie Informationen zu dem Thema „Missbrauchs-Vorwürfe“. Lesen Sie jetzt „Depardieu-Prozess beginnt - Gab es sexuelle Übergriffe?“.;Missbrauchs-Vorwürfe;News, Missbrauchs-Vorwürfe, Gérard Depardieu, Jérémie Assou, Paris, Staatsanwaltschaft, Gesundheitsgrund, Sexuelle Übergriffe;2025-03-24T09:12:37+01:00;2025-03-24T09:12:37+01:00;;dpa;false
aa99c966d0e18bb0410d112b529bd15a4b0379c0c9e77633c1a23dc531a20bed;Sonne, Wolken und nur wenig Regen;https://www.zeit.de/news/2025-03/24/sonne-wolken-und-nur-wenig-regen;Hier finden Sie Informationen zu dem Thema „Wetter“. Lesen Sie jetzt „Sonne, Wolken und nur wenig Regen“.;Wetter;News, Wetter, Saarland, Rheinland-Pfalz, Wetter;2025-03-24T09:12:18+01:00;2025-03-24T09:12:18+01:00;;dpa Rheinland-Pfalz/Saarland;false
37f04d8a2877e67e26b23cc2a46074738a88b4076b5eaa9c025634f994eb95fb;Mensch stirbt bei Autounfall bei Schönermark;https://www.zeit.de/news/2025-03/24/mensch-stirbt-bei-autounfall-bei-schoenermark;Hier finden Sie Informationen zu dem Thema „Unfälle“. Lesen Sie jetzt „Mensch stirbt bei Autounfall bei Schönermark“.;Unfälle;News, Unfälle, Schönermark, Unfall, Autounfall, Auto;2025-03-24T09:10:23+01:00;2025-03-24T09:10:23+01:00;;dpa Berlin/Brandenburg;false
cb239522b0d43035f6ac61122bbc51d0397e314d37bd5a049803312e062c2e13;Strom weg: Schnellabschaltung an Schweizer Atomreaktor;https://www.zeit.de/news/2025-03/24/strom-weg-schnellabschaltung-an-schweizer-atomreaktor;Hier finden Sie Informationen zu dem Thema „Atomstrom“. Lesen Sie jetzt „Strom weg: Schnellabschaltung an Schweizer Atomreaktor“.;Atomstrom;News, Atomstrom, Schweiz, Beznau, Axpo Holding, Schnellabschaltung, Atomreaktor, Atomstrom, Netzanbindung, Kernkraftwerk, Grenze;2025-03-24T09:07:21+01:00;2025-03-24T09:07:21+01:00;;dpa Baden-Württemberg;false
8fffa26aad07839cf69d0422707a6a343e22870557689187894e58e72f4426dd;Gebete und Blumen am Jahrestag des Germanwings-Absturzes;https://www.zeit.de/news/2025-03/24/gebete-und-blumen-am-jahrestag-des-germanwings-absturzes;Hier finden Sie Informationen zu dem Thema „Flug 4U9525“. Lesen Sie jetzt „Gebete und Blumen am Jahrestag des Germanwings-Absturzes“.;Flug 4U9525;News, Flug 4U9525, Alpen, Barcelona, Düsseldorf, Germanwings, Gebet, Jahrestag, Blume, Katastrophe, Luftfahrtgeschichte, Absturz;2025-03-24T09:05:06+01:00;2025-03-24T09:05:06+01:00;;dpa;false
599b3629553449d4e85598b0707b32eadaed4f264c34eda3bad9ce2a5330fda8;Mehrere Schüsse in Offenburg abgegeben - Polizei ermittelt;https://www.zeit.de/news/2025-03/24/mehrere-schuesse-in-offenburg-abgegeben-polizei-ermittelt;Hier finden Sie Informationen zu dem Thema „Motiv unklar“. Lesen Sie jetzt „Mehrere Schüsse in Offenburg abgegeben - Polizei ermittelt“.;Motiv unklar;News, Motiv unklar, Offenburg, Polizei;2025-03-24T08:59:46+01:00;2025-03-24T08:59:46+01:00;;dpa Baden-Württemberg;false
3d8db306945dc7f6e5d8be960381f37ea5b9843ed86216bd06c6ed5eb2a962ca;Sieben Autos in Brand - hoher Schaden;https://www.zeit.de/news/2025-03/24/sieben-autos-in-brand-hoher-schaden;Hier finden Sie Informationen zu dem Thema „Brände“. Lesen Sie jetzt „Sieben Autos in Brand - hoher Schaden“.;Brände;News, Brände, Auto, Brand;2025-03-24T08:59:24+01:00;2025-03-24T08:59:24+01:00;;dpa Niedersachsen;false
9e8952cc4f03c2043d2a8187a584b671a93f1a263d83f1267890ade2ef618749;Laster durchbricht Leitplanke - mehrere Schwerverletzte;https://www.zeit.de/news/2025-03/24/laster-durchbricht-leitplanke-mehrere-schwerverletzte;Hier finden Sie Informationen zu dem Thema „Unfall“. Lesen Sie jetzt „Laster durchbricht Leitplanke - mehrere Schwerverletzte“.;Unfall;News, Unfall, Leitplanke, Unfall, Fahrzeug;2025-03-24T08:56:13+01:00;2025-03-24T08:56:13+01:00;;dpa Bayern;false
15e63ee205819ec46b2ffd4bb44834edf9c1b83eefe141862a0f1f6cf27689e5;Verkehrseinschränkungen durch brennenden Lkw auf A9;https://www.zeit.de/news/2025-03/24/verkehrseinschraenkungen-durch-brennenden-lkw-auf-a9;Hier finden Sie Informationen zu dem Thema „Unfälle“. Lesen Sie jetzt „Verkehrseinschränkungen durch brennenden Lkw auf A9“.;Unfälle;News, Unfälle, Polizei, Verkehrseinschränkung, Unfall;2025-03-24T08:55:51+01:00;2025-03-24T08:55:51+01:00;;dpa Thüringen;false
7c2e072c538f1200db6a01de71d8332088d92951d1815ea1e4d161d98324508a;Mehr Verbraucherinsolvenzen in Sachsen 2024;https://www.zeit.de/news/2025-03/24/mehr-verbraucherinsolvenzen-in-sachsen-2024;Hier finden Sie Informationen zu dem Thema „Insolvenzen“. Lesen Sie jetzt „Mehr Verbraucherinsolvenzen in Sachsen 2024“.;Insolvenzen;News, Insolvenzen, Sachsen, Verbraucherinsolvenz, Insolvenz;2025-03-24T08:49:21+01:00;2025-03-24T08:49:21+01:00;;dpa Sachsen;false
69e9a0090bea5b34a1e1fc1dd188ee1536f9fe8a4cdef5649b1c370f9ce4ec44;Geldautomatensprengung in Frankfurt - Täter geflüchtet;https://www.zeit.de/news/2025-03/24/geldautomatensprengung-in-frankfurt-taeter-gefluechtet;Hier finden Sie Informationen zu dem Thema „Kriminalität“. Lesen Sie jetzt „Geldautomatensprengung in Frankfurt - Täter geflüchtet“.;Kriminalität;News, Kriminalität, Frankfurt, Geldautomatensprengung, Kriminalität;2025-03-24T08:48:53+01:00;2025-03-24T08:48:53+01:00;;dpa Hessen;false
67b525bb994dafab45b4372d2de094d42a695d4ad618445028fa0e70a68d79bb;"Cannabis-Unternehmen will Markenschutz für ""Rambo Zambo""";https://www.zeit.de/news/2025-03/24/cannabis-unternehmen-will-markenschutz-fuer-rambo-zambo;"Hier finden Sie Informationen zu dem Thema „Berühmter Merz-Slogan“. Lesen Sie jetzt „Cannabis-Unternehmen will Markenschutz für ""Rambo Zambo""“.";Berühmter Merz-Slogan;News, Berühmter Merz-Slogan, Rambo Zambo, Cannabis, Markenschutz, Registereintrag, Tabak, Pharma;2025-03-24T08:48:37+01:00;2025-03-24T08:48:37+01:00;;dpa Nordrhein-Westfalen;false
577abff3407d9f52790f5ea51b4a6646295d62caa62d9e1907188f999ef8bf07;Mehr Touristen besuchten im Januar Schleswig-Holstein;https://www.zeit.de/news/2025-03/24/mehr-touristen-besuchten-im-januar-schleswig-holstein;Hier finden Sie Informationen zu dem Thema „Statistik“. Lesen Sie jetzt „Mehr Touristen besuchten im Januar Schleswig-Holstein“.;Statistik;News, Statistik, Schleswig-Holstein, Statistik;2025-03-24T08:47:39+01:00;2025-03-24T08:47:39+01:00;;dpa Hamburg/Schleswig-Holstein;false
3f11a49a4bf1a76e5c179975e7cf2ee49ffb218bb0af470afd4d024e7b9998bb;Polizistin angefahren - Verdächtiger festgenommen;https://www.zeit.de/news/2025-03/24/polizistin-angefahren-verdaechtiger-festgenommen;Hier finden Sie Informationen zu dem Thema „Festnahme nach Großfahndung“. Lesen Sie jetzt „Polizistin angefahren - Verdächtiger festgenommen“.;Festnahme nach Großfahndung;News, Festnahme nach Großfahndung, Göttingen, Landkreis Göttingen, Polizei, Staatsanwaltschaft, Großfahndung, Fahndungserfolg, Festnahme, Auto;2025-03-24T08:42:44+01:00;2025-03-24T08:42:44+01:00;;dpa Niedersachsen;false
e14a8819358d1a1de229b2ef314d0af8e5fabb8b01aeab9843dbaa4d53abbff6;Gewalttat bei Feier - Zeugen befragen und Spuren auswerten;https://www.zeit.de/news/2025-03/24/gewalttat-bei-feier-zeugen-befragen-und-spuren-auswerten;Hier finden Sie Informationen zu dem Thema „Ermittlungen laufen“. Lesen Sie jetzt „Gewalttat bei Feier - Zeugen befragen und Spuren auswerten“.;Ermittlungen laufen;News, Ermittlungen laufen, Parsberg, Neumarkt in der Oberpfalz, Polizei, Gewalttat, Ermittlung;2025-03-24T08:41:41+01:00;2025-03-24T08:41:41+01:00;;dpa Bayern;false
5b585e29c7cea7a99110521c223cb59f7d18a45c22241379892cf31b361c81c7;Geldtransporter in Marzahn überfallen - Täter bewaffnet;https://www.zeit.de/news/2025-03/24/geldtransporter-in-marzahn-ueberfallen-taeter-bewaffnet;Hier finden Sie Informationen zu dem Thema „Kriminalität“. Lesen Sie jetzt „Geldtransporter in Marzahn überfallen - Täter bewaffnet“.;Kriminalität;News, Kriminalität, Marzahn, Polizei, Geldtransporter, Überfall, Kriminalität, Auto;2025-03-24T08:36:24+01:00;2025-03-24T08:36:24+01:00;;dpa Berlin/Brandenburg;false
f1052550244b19449bae67d344b1678ff412e1ca3e82c9f4c0d83ab9f3ef5186;Ifo: Homeoffice fest etabliert - Jeder Vierte nutzt es;https://www.zeit.de/news/2025-03/24/ifo-homeoffice-fest-etabliert-jeder-vierte-nutzt-es;Hier finden Sie Informationen zu dem Thema „Arbeitszeitmodelle“. Lesen Sie jetzt „Ifo: Homeoffice fest etabliert - Jeder Vierte nutzt es“.;Arbeitszeitmodelle;News, Arbeitszeitmodelle, Arbeitszeitmodell, Homeoffice;2025-03-24T08:35:31+01:00;2025-03-24T08:35:31+01:00;;dpa;false
3eeee5e8e1bdb9c418459153524ef2d4ac7556f73f210388b6155c76fa9132bd;Ukraine nimmt Siedlung östlich von Borowa ein;https://www.zeit.de/politik/ausland/karte-ukraine-krieg-russland-frontverlauf-truppenbewegungen;Ukrainische Truppen haben den Ort Nadija in der Region Luhansk eingenommen. Russland rückt im umkämpften Torezk und bei Pokrowsk vor.;Ukrainekarte aktuell;Politik, Ukrainekarte aktuell, Krieg in der Ukraine, Russland, Militär, Donezk, Luhansk, Kursk, Charkiw;2025-03-24T08:34:29+01:00;2025-03-24T08:34:29+01:00;Timo StukenbergDominik LenzeYevgeniya ShcherbakovaChristina FelschenJustus WilkeElizabeth RushtonPauline PieperJulius TrögerBenja Zehr;;false
a945ef1ee865f842e13b23bd3aafaf2991ce80fb4b53292d97dab94fc5b3370d;Verletzter Davies gibt Entwarnung nach Auswechslung;https://www.zeit.de/news/2025-03/24/verletzter-davies-gibt-entwarnung-nach-auswechslung;Hier finden Sie Informationen zu dem Thema „FC Bayern München“. Lesen Sie jetzt „Verletzter Davies gibt Entwarnung nach Auswechslung“.;FC Bayern München;News, FC Bayern München, Alphonso Davies, Inglewood, FC Bayern München, Auswechslung;2025-03-24T08:33:53+01:00;2025-03-24T08:33:53+01:00;;dpa Bayern;false
bf5ca08c158bcf681f0a754148252c17aee9f7db56990fce6aa9ede5e7229781;"""Niemand will auf der schlimmsten Schule Deutschlands sein""";https://www.zeit.de/familie/2025-03/friedrich-bergius-schule-engin-catik-schueler-bildung;Gewalt, Chaos, Angst: Die Bergius-Schule in Berlin wurde zum Synonym für alles, was schiefläuft. Nun soll ein junger Rektor sie retten. Eskalation ist für ihn Alltag.;"Z+ (abopflichtiger Inhalt);
        
    Friedrich-Bergius-Schule";Familie, Friedrich-Bergius-Schule, Schule, Bildung, Berlin, Polizei, CDU, Ramadan;2025-03-24T08:26:43+01:00;2025-03-24T08:26:43+01:00;Eser AktayJacobia Dahm;;false
92248e4e293fac7ada909ca43cffee3a7ed83fc90be155ec718921d555471c5e;Autos kollidieren - ein Mensch schwer verletzt;https://www.zeit.de/news/2025-03/24/autos-kollidieren-ein-mensch-schwer-verletzt;Hier finden Sie Informationen zu dem Thema „Unfälle“. Lesen Sie jetzt „Autos kollidieren - ein Mensch schwer verletzt“.;Unfälle;News, Unfälle, Herzlake, Unfall, Auto;2025-03-24T08:25:46+01:00;2025-03-24T08:25:46+01:00;;dpa Niedersachsen;false
9707c77eb723dc53d033393845f666a00101dc9d553ae827fc47a974da72cbd4;USA und Russland nehmen Verhandlungen in Saudi-Arabien auf;https://www.zeit.de/news/2025-03/24/usa-und-russland-nehmen-verhandlungen-in-saudi-arabien-auf;Hier finden Sie Informationen zu dem Thema „Ukraine-Krieg“. Lesen Sie jetzt „USA und Russland nehmen Verhandlungen in Saudi-Arabien auf“.;Ukraine-Krieg;News, Ukraine-Krieg, Wladimir Putin, Keith Kellogg, USA, Russland, Saudi-Arabien, Riad, Treffen, Verhandlung, Krieg in der Ukraine;2025-03-24T08:24:28+01:00;2025-03-24T08:24:28+01:00;;dpa;false
6b9ead0a5730252ea29a8085dd045e6c79983ab07c6685254d4d69e116904139;Der Countdown läuft: Bayerisches Start-up testet Rakete;https://www.zeit.de/news/2025-03/24/der-countdown-laeuft-bayerisches-start-up-testet-rakete;Hier finden Sie Informationen zu dem Thema „Raumfahrt“. Lesen Sie jetzt „Der Countdown läuft: Bayerisches Start-up testet Rakete“.;Raumfahrt;News, Raumfahrt, Isar Aerospace, Countdown, Testflug, Wetter;2025-03-24T08:21:30+01:00;2025-03-24T08:21:30+01:00;;dpa;false
3da790bdecd2fb09805b193ce944f7568a815c70e0b1a1928459b510af3bef5f;Mutmaßliches Autorennen: Zweiter Verdächtiger noch frei;https://www.zeit.de/news/2025-03/24/mutmassliches-autorennen-zweiter-verdaechtiger-noch-frei;Hier finden Sie Informationen zu dem Thema „Ludwigsburg“. Lesen Sie jetzt „Mutmaßliches Autorennen: Zweiter Verdächtiger noch frei“.;Ludwigsburg;News, Ludwigsburg, Ludwigsburg, Polizei, Autorennen, Ermittlungserfolg, Auto;2025-03-24T08:17:28+01:00;2025-03-24T08:17:28+01:00;;dpa Baden-Württemberg;false
03511718e2d201ef73893db7e74981f544499daf479c52b33318a074baa3a1f9;Innenministerin Lange: Jedes Jahr 100 neue Polizisten;https://www.zeit.de/news/2025-03/24/innenministerin-lange-jedes-jahr-100-neue-polizisten;Hier finden Sie Informationen zu dem Thema „Polizei“. Lesen Sie jetzt „Innenministerin Lange: Jedes Jahr 100 neue Polizisten“.;Polizei;News, Polizei, Katrin Lange, Polizei, SPD;2025-03-24T08:14:32+01:00;2025-03-24T08:14:32+01:00;;dpa Berlin/Brandenburg;false
ebf4d5f5ed0cbeb18ed26d56836c1bb6b7795bfa8293f39e4ed206b1b191a2fe;Schauer und teils auch Gewitter in Hessen;https://www.zeit.de/news/2025-03/24/schauer-und-teils-auch-gewitter-in-hessen;Hier finden Sie Informationen zu dem Thema „Wetter“. Lesen Sie jetzt „Schauer und teils auch Gewitter in Hessen“.;Wetter;News, Wetter, Hessen, DWD, Gewitter, Wetter;2025-03-24T08:09:38+01:00;2025-03-24T08:09:38+01:00;;dpa Hessen;false
d4beccc21f2db8e7c775188e88d1dda82a46a2d2bc81d2677d26e256e6d4fc33;Nagelsmann wird keine Rücksicht auf Club-WM nehmen;https://www.zeit.de/news/2025-03/24/nagelsmann-wird-keine-ruecksicht-auf-club-wm-nehmen;Hier finden Sie Informationen zu dem Thema „Final Four der Nations League“. Lesen Sie jetzt „Nagelsmann wird keine Rücksicht auf Club-WM nehmen“.;Final Four der Nations League;News, Final Four der Nations League, Julian Nagelsmann, Italien, München, Stuttgart, USA, Nations League, Viertelfinalerfolg, Sommer;2025-03-24T08:08:12+01:00;2025-03-24T08:08:12+01:00;;dpa Bayern;false
7668d7a1ac4960c4b6d5f51efdcb3cc4d2625055941564e2ded726940a4ad7f5;Verletzter nach Garagenbrand in Obermaßfeld;https://www.zeit.de/news/2025-03/24/verletzter-nach-garagenbrand-in-obermassfeld;Hier finden Sie Informationen zu dem Thema „Feuer“. Lesen Sie jetzt „Verletzter nach Garagenbrand in Obermaßfeld“.;Feuer;News, Feuer, Obermaßfeld, Garagenbrand;2025-03-24T08:05:32+01:00;2025-03-24T08:05:32+01:00;;dpa Thüringen;false
5e592d456fabc3b19795de516820309985ee019409be02c48c1e0132dbc3b860;Lkw fährt in Stauende - A7 in Richtung Norden gesperrt;https://www.zeit.de/news/2025-03/24/lkw-faehrt-in-stauende-a7-in-richtung-norden-gesperrt;Hier finden Sie Informationen zu dem Thema „Unfälle“. Lesen Sie jetzt „Lkw fährt in Stauende - A7 in Richtung Norden gesperrt“.;Unfälle;News, Unfälle, Bad Bramstedt, Kreis Segeberg, Unfall;2025-03-24T08:04:07+01:00;2025-03-24T08:04:07+01:00;;dpa Hamburg/Schleswig-Holstein;false
2c4534568f478ac05d386d75d5c796634aa477308284da04360ff98b3a143a48;Tot stellen oder angreifen? Das Trump-Dilemma der Demokraten;https://www.zeit.de/news/2025-03/24/tot-stellen-oder-angreifen-das-trump-dilemma-der-demokraten;Hier finden Sie Informationen zu dem Thema „US-Opposition“. Lesen Sie jetzt „Tot stellen oder angreifen? Das Trump-Dilemma der Demokraten“.;US-Opposition;News, US-Opposition, Donald Trump, James Carville, Bill Clinton, Joe Biden, Gavin Newsom, Kamala Harris, Tim Walz, Bernie Sanders, Alexandria Ocasio-Cortez, Steve Bannon;2025-03-24T08:00:38+01:00;2025-03-24T08:00:38+01:00;;dpa;false
9269eaa1fa7b7eb49fb03eac97b59a0fba3843740389a7c10d96a18356f57061;Aktion gegen Elterntaxis und für mehr Kinder auf Schulwegen;https://www.zeit.de/news/2025-03/24/aktion-gegen-elterntaxis-und-fuer-mehr-kinder-auf-schulwegen;Hier finden Sie Informationen zu dem Thema „Verkehrssicherheit“. Lesen Sie jetzt „Aktion gegen Elterntaxis und für mehr Kinder auf Schulwegen“.;Verkehrssicherheit;News, Verkehrssicherheit, Hamburg, Polizei, ADAC, Elterntaxis, Schulweg, Verkehrssicherheit;2025-03-24T08:00:36+01:00;2025-03-24T08:00:36+01:00;;dpa Hamburg/Schleswig-Holstein;false
1346ec0f978a7e722efe31624723ccec16b8b9d368691f72c02a93735c0f875e;TV stets reich: Wo bleibt die Sozialkritik in Serien?;https://www.zeit.de/news/2025-03/24/tv-stets-reich-wo-bleibt-die-sozialkritik-in-serien;Hier finden Sie Informationen zu dem Thema „Mangel an armen Menschen“. Lesen Sie jetzt „TV stets reich: Wo bleibt die Sozialkritik in Serien?“.;Mangel an armen Menschen;News, Mangel an armen Menschen, Jördis Triebel, Gabriela Maria Schmeide, Joan Bleicher, Laila Stieler, Marzahn, ARD, Sozialkritik, Krimiserie, Heimatserie, Familie;2025-03-24T07:56:36+01:00;2025-03-24T07:56:36+01:00;;dpa;false
cd19004ec39e2d414cf7c8b575c45d47127ad214d101dcbe52f626c914aa1971;Mildes Wetter zum Wochenstart - bis 17 Grad;https://www.zeit.de/news/2025-03/24/mildes-wetter-zum-wochenstart-bis-17-grad;Hier finden Sie Informationen zu dem Thema „Das Wetter“. Lesen Sie jetzt „Mildes Wetter zum Wochenstart - bis 17 Grad“.;Das Wetter;News, Das Wetter, Wetter;2025-03-24T07:54:32+01:00;2025-03-24T07:54:32+01:00;;dpa Nordrhein-Westfalen;false
1ed47b9368788112453940b4b51fd6fbfe9f6526b7ce5594d76912b61a19ece1;"""Ich war tatsächlich auf dem Kran""";https://www.zeit.de/2025/12/schwebende-lasten-annett-groeschner-roman-magdeburg;"Annett Gröschner schreibt in ihrem Roman ""Schwebende Lasten"" über das Leben einer Arbeiterin und die Geschichte Magdeburgs. Was macht diese Stadt am Ende doch besonders?";"Z+ (abopflichtiger Inhalt);
        
    Annett Gröschner";Kultur, Annett Gröschner, Magdeburg, Schriftstellerin, Belletristik, Geschichte, DDR, Berlin;2025-03-24T07:53:29+01:00;2025-03-24T07:53:29+01:00;Cynthia Cornelius;Aus der        ZEIT Nr. 12/2025;false
a9f42a8ad14c24fc10aca45d4db1b5e39c3163f5b85a77213b2a5f2b5cf437d7;Mildes und wechselhaftes Wetter in Berlin und Brandenburg;https://www.zeit.de/news/2025-03/24/mildes-und-wechselhaftes-wetter-in-berlin-und-brandenburg;Hier finden Sie Informationen zu dem Thema „Wettervorhersage“. Lesen Sie jetzt „Mildes und wechselhaftes Wetter in Berlin und Brandenburg“.;Wettervorhersage;News, Wettervorhersage, Berlin, Brandenburg, DWD, Wettervorhersage, Hauptstadtregion, Wetter;2025-03-24T07:52:18+01:00;2025-03-24T07:52:18+01:00;;dpa Berlin/Brandenburg;false
