Hash;Title;Link;Description;Category;KeyWords;Published;LastUpdated;Author;Source;Paywall
54a25d79d3b0c620f804cbeec6b7fd77c663e09c18eddd1711cd9f3372926b5f;Petros Dritter im Halbmarathon - Silber und Bronze im Team;https://www.zeit.de/news/2024-06/09/petros-em-dritter-im-halbmarathon-bronze-auch-im-team;Hier finden Sie Informationen zu dem Thema „Leichtathletik-EM“. Lesen Sie jetzt „Petros Dritter im Halbmarathon - Silber und Bronze im Team“.;"Z+ (abopflichtiger Inhalt);
        
    
Leichtathletik-EM";News, Leichtathletik-EM, Pietro Riva, Richard Ringer, Rom, Amanal, Leichtathletik, Bronze, Halbmarathon;2024-06-09T10:58:57+02:00;2024-06-09T10:58:57+02:00;;dpa Sport;false
6d1bbfc8345368c686134627cfac73ab0072a10bc6d8904a310675a6bc0b083d;"Landeswahlleiter zur Europawahl: ""Im grünen Bereich""";https://www.zeit.de/news/2024-06/09/landeswahlleiter-zur-europawahl-im-gruenen-bereich;"Hier finden Sie Informationen zu dem Thema „EU“. Lesen Sie jetzt „Landeswahlleiter zur Europawahl: ""Im grünen Bereich""“.";"Z+ (abopflichtiger Inhalt);
        
    
EU";News, EU, News;2024-06-09T10:54:20+02:00;2024-06-09T10:54:20+02:00;;dpa Berlin/Brandenburg;false
4b77b6bd5c2565978d18f1d61b79e844084447468ee4b1c96dc4948c859562c9;Bilder des Tages;https://www.zeit.de/news/2024-06/09/bilder-des-tages;Hier finden Sie Informationen zu dem Thema „Fotografie“. Lesen Sie jetzt „Bilder des Tages“.;"Z+ (abopflichtiger Inhalt);
        
    
Fotografie";News, Fotografie, Vulkanausbruch;2024-06-09T10:50:53+02:00;2024-06-09T10:50:53+02:00;;dpa;false
dfa7cf069b8ca6c7dde5b959749cb5e88ba4c8e598247fe927d7287dd1f6e116;Mehr Geld für Beschäftigte in ostdeutscher Textilbranche;https://www.zeit.de/news/2024-06/08/mehr-geld-fuer-beschaeftigte-in-ostdeutscher-textilbranche;Hier finden Sie Informationen zu dem Thema „Tarifeinigung“. Lesen Sie jetzt „Mehr Geld für Beschäftigte in ostdeutscher Textilbranche“.;"Z+ (abopflichtiger Inhalt);
        
    
Tarifeinigung";News, Tarifeinigung, Anett Schmidt, Textilbranche, Tarifeinigung, Strumpfwerk, Tarifrunde, Geld, Textil;2024-06-09T10:50:13+02:00;2024-06-09T10:50:13+02:00;;dpa Sachsen;false
fee6350ac7ff1953d61673fbebca42a0675bb4d6e225621da82dc4a5fedcc4d9;Rauch und Thielemann erhalten Verfassungsmedaille;https://www.zeit.de/news/2024-06/08/neo-rauch-und-thielemann-erhalten-verfassungsmedaille;Hier finden Sie Informationen zu dem Thema „Auszeichnung in Dresden“. Lesen Sie jetzt „Rauch und Thielemann erhalten Verfassungsmedaille“.;"Z+ (abopflichtiger Inhalt);
        
    
Auszeichnung in Dresden";News, Auszeichnung in Dresden, Neo Rauch, Christian Thielemann, Dresden, Verfassungsmedaille, Auszeichnung;2024-06-09T10:49:30+02:00;2024-06-09T10:49:30+02:00;;dpa Sachsen;false
b4e60c8f2c4177d9e7365263a9f14e37b359cc399ce6140dd6be39ac274f91e0;Mehr als 35.000 Besucher bei Bundeswehr-Tag;https://www.zeit.de/news/2024-06/09/mehr-als-35-000-besucher-bei-bundeswehr-tag;Hier finden Sie Informationen zu dem Thema „Fliegerhorst Holzdorf“. Lesen Sie jetzt „Mehr als 35.000 Besucher bei Bundeswehr-Tag“.;"Z+ (abopflichtiger Inhalt);
        
    
Fliegerhorst Holzdorf";News, Fliegerhorst Holzdorf, Carsten Breuer, Holzdorf, Schönewalde, Brandenburg, Sachsen-Anhalt, Bundeswehr, Tag der Bundeswehr, Fliegerhorst, Transporthubschrauber, Militärflughafen;2024-06-09T10:22:11+02:00;2024-06-09T10:22:11+02:00;;dpa Berlin/Brandenburg;false
274bb37231f2d1725956d199b702885f39aca8ee1fb0003c4db751dc5e903ff1;Bahncard nur noch digital - Kritik von Verbraucherverbänden;https://www.zeit.de/news/2024-06/09/bahncard-nur-noch-digital-kritik-von-verbraucherverbaenden;Hier finden Sie Informationen zu dem Thema „Mobilität“. Lesen Sie jetzt „Bahncard nur noch digital - Kritik von Verbraucherverbänden“.;"Z+ (abopflichtiger Inhalt);
        
    
Mobilität";News, Mobilität, Deutsche Bahn, BahnCard, Verbraucherverband, Mobilität, Kritik;2024-06-09T10:17:36+02:00;2024-06-09T10:17:36+02:00;;dpa;false
a5c173fee3258440b81ffdc9e597c6a00646fe36ff202c6dd190e69bba97d478;Vier israelische Geiseln aus dem Gazastreifen gerettet;https://www.zeit.de/news/2024-06/09/vier-israelische-geiseln-aus-dem-gazastreifen-gerettet;Hier finden Sie Informationen zu dem Thema „Krieg in Nahost“. Lesen Sie jetzt „Vier israelische Geiseln aus dem Gazastreifen gerettet“.;"Z+ (abopflichtiger Inhalt);
        
    
Krieg in Nahost";News, Krieg in Nahost, Peter Leiner, Ismail Hanija, Nahost, Nuseirat, Gazastreifen, Israel, New York Times, Hamas, Musikfestival, Streitkräfte;2024-06-09T10:15:32+02:00;2024-06-09T10:15:32+02:00;;dpa;false
4091e22910c0b3bf8263d043efe3bce9cb39fa93e03454e100a88ad64c4b68f6;Europawahl in Deutschland hat begonnen;https://www.zeit.de/news/2024-06/09/europawahl-in-deutschland-hat-begonnen;Hier finden Sie Informationen zu dem Thema „EU“. Lesen Sie jetzt „Europawahl in Deutschland hat begonnen“.;"Z+ (abopflichtiger Inhalt);
        
    
EU";News, EU, Niederlande, Irland, Indien, Österreich, Frankreich, Italien, Brandenburg, Hamburg, Berlin, Europa;2024-06-09T10:12:19+02:00;2024-06-09T10:12:19+02:00;;dpa;false
3e4855317e3846e494d6538c3dae77e061cfd210a649ff3f4af95142dee4f188;Winzer trotz Regenmengen optimistisch;https://www.zeit.de/news/2024-06/08/winzer-trotz-regenmengen-optimistisch;Hier finden Sie Informationen zu dem Thema „Weinanbau“. Lesen Sie jetzt „Winzer trotz Regenmengen optimistisch“.;"Z+ (abopflichtiger Inhalt);
        
    
Weinanbau";News, Weinanbau, Regenmenge, Weinbau, Weinverkauf, Aufschrift;2024-06-09T10:11:37+02:00;2024-06-09T10:11:37+02:00;;dpa Bayern;false
068343fce5f9685bea3370e4d87281a1fe71d5362f9e42cfbc2bb4e12fea2e52;Urteil wegen Besitzes von Missbrauchsfotos rechtskräftig;https://www.zeit.de/news/2024-06/08/urteil-fuer-lehrer-missbrauchsfotos-rechtskraeftig;Hier finden Sie Informationen zu dem Thema „Landgericht Aschaffenburg“. Lesen Sie jetzt „Urteil wegen Besitzes von Missbrauchsfotos rechtskräftig“.;"Z+ (abopflichtiger Inhalt);
        
    
Landgericht Aschaffenburg";News, Landgericht Aschaffenburg, Aschaffenburg, Staatsanwaltschaft, Missbrauchsfoto, Justizgebäude;2024-06-09T10:10:53+02:00;2024-06-09T10:10:53+02:00;;dpa Bayern;false
d571a0d6156d95ce217604c54202b68188a5c495f1842169b00c328f1a180c7e;Mann soll Zugbegleiterin attackiert haben;https://www.zeit.de/news/2024-06/08/mann-soll-zugbegleiterin-attackiert-haben-hilferufe;Hier finden Sie Informationen zu dem Thema „Vergebliche Hilferufe“. Lesen Sie jetzt „Mann soll Zugbegleiterin attackiert haben“.;"Z+ (abopflichtiger Inhalt);
        
    
Vergebliche Hilferufe";News, Vergebliche Hilferufe, Deutsche Bahn, Hilferuf, Fahrrad;2024-06-09T10:10:08+02:00;2024-06-09T10:10:08+02:00;;dpa Bayern;false
ec57351dc463973b66b65eef8a3430a10fe513e56c687f01c1a60f26d6f4c679;Tausende gegen Rechtsextremismus - Demo in München;https://www.zeit.de/news/2024-06/08/tausende-gegen-rechtsextremismus-demo-in-muenchen;Hier finden Sie Informationen zu dem Thema „Protestaktion“. Lesen Sie jetzt „Tausende gegen Rechtsextremismus - Demo in München“.;"Z+ (abopflichtiger Inhalt);
        
    
Protestaktion";News, Protestaktion, München, Polizei, Europawahl, Demonstration, Polizeiauto, Rechtsextremismus;2024-06-09T10:09:32+02:00;2024-06-09T10:09:32+02:00;;dpa Bayern;false
3417cad60cff3858ae584f62227f00ae40a672efa89c5be2a5c5b13cb38c8d16;Wahlen beginnen ohne größere Zwischenfälle;https://www.zeit.de/news/2024-06/08/stimmabgabe-fuer-europa-und-kommunalwahlen-rheinland-pfalz;Hier finden Sie Informationen zu dem Thema „Euroa- und Kommunalwahl“. Lesen Sie jetzt „Wahlen beginnen ohne größere Zwischenfälle“.;"Z+ (abopflichtiger Inhalt);
        
    
Euroa- und Kommunalwahl";News, Euroa- und Kommunalwahl, Rheinland-Pfalz, Rheinland, Europäisches Parlament, Europawahl, Stimmabgabe, Kommunalwahl, Kommune;2024-06-09T10:06:19+02:00;2024-06-09T10:06:19+02:00;;dpa Rheinland-Pfalz/Saarland;false
b42f30838560433f15277127de4897c0a038ca3c0add41234ff64b54651af5db;Wahllokale in Sachsen geöffnet - keine Verzögerungen bekannt;https://www.zeit.de/news/2024-06/08/rund-3-3-millionen-sachsen-zur-wahl-aufgerufen;Hier finden Sie Informationen zu dem Thema „Europa- und Kommunalwahl“. Lesen Sie jetzt „Wahllokale in Sachsen geöffnet - keine Verzögerungen bekannt“.;"Z+ (abopflichtiger Inhalt);
        
    
Europa- und Kommunalwahl";News, Europa- und Kommunalwahl, Sachsen, Frankfurt (Oder), Europäisches Parlament, Kommunalwahl, Kommune, Wahlurne;2024-06-09T10:03:57+02:00;2024-06-09T10:03:57+02:00;;dpa Sachsen;false
b814bd08ded95c8fe6535cc0ae6805655d4063fdc85a842b95a2b2617649030a;Ministerpräsident Wüst bittet NSU-Opfer um Entschuldigung;https://www.zeit.de/news/2024-06/08/steinmeier-spricht-bei-gedenkfeier-zu-nsu-anschlag-in-koeln;Hier finden Sie Informationen zu dem Thema „Extremismus“. Lesen Sie jetzt „Ministerpräsident Wüst bittet NSU-Opfer um Entschuldigung“.;"Z+ (abopflichtiger Inhalt);
        
    
Extremismus";News, Extremismus, Joachim Gauck, Frank-Walter Steinmeier, Uwe Böhnhardt, Köln, NSU, Gedenkfeier, Extremismus;2024-06-09T09:53:30+02:00;2024-06-09T09:53:30+02:00;;dpa Nordrhein-Westfalen;false
1417053ba36bb565ffdeea7fd694c2c1510f2119645c244ea86d773f003902cb;Wie die grüne Ära verblasste;https://www.zeit.de/politik/deutschland/2024-06/die-gruenen-eu-wahl-hegemonie-feindbild;Zur Europawahl 2019 waren die Grünen die heißeste Aktie in der deutschen Politik. Seitdem haben sie viel mehr verloren als Wählerstimmen, ihre Deutungsmacht ist dahin.;"Z+ (abopflichtiger Inhalt);
        
    
Die Grünen";Politik, Die Grünen, Bündnis 90/Die Grünen, Europawahl, Annalena Baerbock, Robert Habeck, Greta Thunberg, Andrea Nahles, FDP, SPD, Europäisches Parlament, CDU;2024-06-09T09:31:26+02:00;2024-06-09T09:31:26+02:00;Ferdinand Otto;;false
1af05aa3784790c5b9cdc05e3538b2a824144c04e7399f8c6b2fd693111f6f12;Südkorea will erneut Propaganda an Grenze zu Nordkorea abspielen;https://www.zeit.de/politik/ausland/2024-06/suedkorea-propaganda-grenze-nordkorea-muellballons-reaktion;Weil Nordkorea mit Müll gefüllte Ballons gen Süden schickt, will Südkorea wieder politische Botschaften an der Grenze abspielen. Beobachter erwarten weitere Reaktionen.;"Z+ (abopflichtiger Inhalt);
        
    
Korea-Konflikt";Politik, Korea-Konflikt, Nordkorea, Südkorea, Propaganda, Asien, Grenze, Konflikt;2024-06-09T09:31:19+02:00;2024-06-09T09:31:19+02:00;;ZEIT ONLINE,        dpa,        Reuters,        caf;false
039ca0c5261099fafec85d094e258c880158adfb0d2bfdf1dd9a50a1dc099075;Tollpatsch, Rüpel, Patriot;https://www.zeit.de/2024/24/donald-duck-90-jahre-comic-geschichte-tollpatsch;Er schnattert pausenlos, ist faul, tollpatschig und wurde im Krieg gegen die Nazis sogar zum Patrioten: Wie ein jähzorniger Erpel Comic-Geschichte schrieb.;"Z+ (abopflichtiger Inhalt);
        
    
Donald Duck";Wissen, Donald Duck, Comic, Donald Duck, Carl Barks, Dagobert Duck, Walt Disney, Micky Maus;2024-06-09T09:30:31+02:00;2024-06-09T09:30:31+02:00;Jens Balzer;Aus der        ZEIT Nr. 24/2024;false
f5054d5640984b2ea812f791610143e650b3752a5511d1d3ac946c8c3c816b4f;"""Wir verdienen mehr als 170.000 im Jahr""";https://www.zeit.de/arbeit/2024-06/softwareentwickler-versicherung-gehalt-kontoauszug;Mark, 35, arbeitet als Softwareentwickler bei einem Versicherungsunternehmen. Er verdient viel, davon fährt er mehrere Male im Jahr in den Urlaub.;Softwareentwickler;Software, Internet, Einkommen, Gehalt, Reisen, Versicherungskonzern;2024-06-09T09:29:52+02:00;2024-06-09T09:29:52+02:00;Antonia Schaefer;;true
bd648302995ec36f9d3dd7e42009483642d8ee5466762274d4f26f6c7de430f5;Ministerpräsident Ramelow feiert mit Patenkindern;https://www.zeit.de/news/2024-06/08/ministerpraesident-ramelow-feiert-mit-patenkindern;Hier finden Sie Informationen zu dem Thema „Ehrenpatenschaft“. Lesen Sie jetzt „Ministerpräsident Ramelow feiert mit Patenkindern“.;"Z+ (abopflichtiger Inhalt);
        
    
Ehrenpatenschaft";News, Ehrenpatenschaft, Bodo Ramelow, Thüringen, Die Linke, Ehrenpatenschaft;2024-06-09T09:26:32+02:00;2024-06-09T09:26:32+02:00;;dpa Thüringen;false
f19e4be38c6098d82fe28008952926af0955313b908304bb600658b89cc35746;"""Feuer und Farbe"" - Kunstausstellung in Altenburg";https://www.zeit.de/news/2024-06/08/feuer-und-farbe-kunstausstellung-in-altenburg;"Hier finden Sie Informationen zu dem Thema „Lindenau Museum“. Lesen Sie jetzt „""Feuer und Farbe"" - Kunstausstellung in Altenburg“.";"Z+ (abopflichtiger Inhalt);
        
    
Lindenau Museum";News, Lindenau Museum, Walter Jacob, Altenburg, Kunstausstellung, Residenzschloss;2024-06-09T09:26:00+02:00;2024-06-09T09:26:00+02:00;;dpa Thüringen;false
2d7d9cb14aaae7802e39fe6587237b4275d1ecccda0bce5fb93d1d24d0d66849;"Rund 36.000 Einsätze für ""Christoph 70""";https://www.zeit.de/news/2024-06/08/rund-36-000-einsaetze-fuer-christoph-70;"Hier finden Sie Informationen zu dem Thema „Rettungshubschrauber“. Lesen Sie jetzt „Rund 36.000 Einsätze für ""Christoph 70""“.";"Z+ (abopflichtiger Inhalt);
        
    
Rettungshubschrauber";News, Rettungshubschrauber, Jena, ADAC, Rettungshubschrauber, Rettungskraft, Unfallstelle;2024-06-09T09:25:38+02:00;2024-06-09T09:25:38+02:00;;dpa Thüringen;false
8f273b2e7d17261f0e2eeda92be03db923c1620c44298c73e91ea4786ef9c042;Linke: Landtagskandidat an Supermarktkasse beleidigt;https://www.zeit.de/news/2024-06/08/linke-landtagskandidat-an-supermarktkasse-beleidigt;Hier finden Sie Informationen zu dem Thema „Polizei ermittelt“. Lesen Sie jetzt „Linke: Landtagskandidat an Supermarktkasse beleidigt“.;"Z+ (abopflichtiger Inhalt);
        
    
Polizei ermittelt";News, Polizei ermittelt, Christian Schaft, Eisenberg, Polizei, Einsatzwagen, Parteiangabe, Ermittlung;2024-06-09T09:25:07+02:00;2024-06-09T09:25:07+02:00;;dpa Thüringen;false
bada8c961aa7ddc3d68ef6939216f967ab035df45f3ffabb4eaaae9afb3ac083;Brand zerstört Häuser - 120.000 Euro Schaden;https://www.zeit.de/news/2024-06/08/brand-zerstoert-haeuser-120-000-euro-schaden;Hier finden Sie Informationen zu dem Thema „Kyffhäuserkreis“. Lesen Sie jetzt „Brand zerstört Häuser - 120.000 Euro Schaden“.;"Z+ (abopflichtiger Inhalt);
        
    
Kyffhäuserkreis";News, Kyffhäuserkreis, Feuerwehr, Kyffhäuserkreis;2024-06-09T09:24:37+02:00;2024-06-09T09:24:37+02:00;;dpa Thüringen;false
f280af0028e163bb86ddc94591307022f3e376977c0ff62d5ba464077676b88a;Neuer Leitfaden für Wolfsabschuss: Schafhalter enttäuscht;https://www.zeit.de/news/2024-06/08/neuer-leitfaden-fuer-wolfsabschuss-schafhalter-enttaeuscht;Hier finden Sie Informationen zu dem Thema „Kritik an Plänen“. Lesen Sie jetzt „Neuer Leitfaden für Wolfsabschuss: Schafhalter enttäuscht“.;"Z+ (abopflichtiger Inhalt);
        
    
Kritik an Plänen";News, Kritik an Plänen, Wendelin Schmücker, Bad Dürkheim, Niedersachsen, Treffen, Wolfsabschuss, Leitfaden, Umweltministerkonferenz, Tiere, Wald;2024-06-09T09:23:53+02:00;2024-06-09T09:23:53+02:00;;dpa Niedersachsen;false
9794ea52c0bc7b20d41d0aa56936cc56aa71c6fc9316e1198e50fe7f221d3554;Weniger Asylbewerberinnen und -bewerber in Rheinland-Pfalz;https://www.zeit.de/news/2024-06/08/weniger-asylbewerberinnen-und-bewerber-in-rheinland-pfalz;Hier finden Sie Informationen zu dem Thema „Migration“. Lesen Sie jetzt „Weniger Asylbewerberinnen und -bewerber in Rheinland-Pfalz“.;"Z+ (abopflichtiger Inhalt);
        
    
Migration";News, Migration, Trier, Bitburg, Rheinland-Pfalz, Deutsche Presse-Agentur, Aufnahmeeinrichtung, Migration, Herbst;2024-06-09T09:23:15+02:00;2024-06-09T09:23:15+02:00;;dpa Rheinland-Pfalz/Saarland;false
971a5d17345f74ae3097a41f04b50e8be03625205b1ee98388a5f1d695895d28;Europawahl beginnt in Hessen ohne größere Zwischenfälle;https://www.zeit.de/news/2024-06/09/hessens-wahllokale-geoeffnet;Hier finden Sie Informationen zu dem Thema „Wahl-Sonntag“. Lesen Sie jetzt „Europawahl beginnt in Hessen ohne größere Zwischenfälle“.;"Z+ (abopflichtiger Inhalt);
        
    
Wahl-Sonntag";News, Wahl-Sonntag, Frankfurt am Main, Hessen, Europäisches Parlament, Europawahl, Wahllokal, Europafest;2024-06-09T09:22:35+02:00;2024-06-09T09:22:35+02:00;;dpa Hessen;false
9783a631c9a73796993fec3a2092b35801ea6e520c224606a45f0a2f054942b0;"ARD: ""Die Zweiflers"" sind kleiner Mediathek-Hit";https://www.zeit.de/news/2024-06/08/ard-die-zweiflers-sind-kleiner-mediathek-hit;"Hier finden Sie Informationen zu dem Thema „Fernsehen“. Lesen Sie jetzt „ARD: ""Die Zweiflers"" sind kleiner Mediathek-Hit“.";"Z+ (abopflichtiger Inhalt);
        
    
Fernsehen";News, Fernsehen, Frankfurt, Cannes, ARD, Serienfestival, Familie;2024-06-09T09:21:26+02:00;2024-06-09T09:21:26+02:00;;dpa Hessen;false
2e48ee626e4286f24874ea41e6735a3edd501d494d7f226b5e8c14cf60cfedf0;Rhein: Bürgergeld verstärkt für Fachkräftemangel;https://www.zeit.de/news/2024-06/08/rhein-buergergeld-verstaerkt-fachkraeftemangel;Hier finden Sie Informationen zu dem Thema „Arbeitsmarkt“. Lesen Sie jetzt „Rhein: Bürgergeld verstärkt für Fachkräftemangel“.;"Z+ (abopflichtiger Inhalt);
        
    
Arbeitsmarkt";News, Arbeitsmarkt, Hessen, Rhein, Bürgergeld, Fachkräftemangel;2024-06-09T09:20:59+02:00;2024-06-09T09:20:59+02:00;;dpa Hessen;false
899f49f58a330d3a732f7da74719561158158f25c8ca24b979bf15ee6f71b53a;Sanierung des Limburger Doms soll 2026 beginnen;https://www.zeit.de/news/2024-06/08/sanierung-des-limburger-doms-soll-2026-beginnen;Hier finden Sie Informationen zu dem Thema „Kulturdenkmal“. Lesen Sie jetzt „Sanierung des Limburger Doms soll 2026 beginnen“.;"Z+ (abopflichtiger Inhalt);
        
    
Kulturdenkmal";News, Kulturdenkmal, Alexander Lorz, Limburg, FDP, Kulturdenkmal, Sanierung;2024-06-09T09:20:23+02:00;2024-06-09T09:20:23+02:00;;dpa Hessen;false
2b94c5312c38c986bdad142f6d412934ff0eb44ce43345f8bb7b8b92848f3beb;Scholz warnt vor Abschottung europäischer Märkte;https://www.zeit.de/news/2024-06/07/kanzler-besucht-opel-zum-jubilaeum;Hier finden Sie Informationen zu dem Thema „Diskussion um Strafzölle“. Lesen Sie jetzt „Scholz warnt vor Abschottung europäischer Märkte“.;"Z+ (abopflichtiger Inhalt);
        
    
Diskussion um Strafzölle";News, Diskussion um Strafzölle, Rüsselsheim, Opel Astra, Opel, Jubiläum, Mitarbeiterparkplatz, Ladestation, Fahrzeug;2024-06-09T09:20:03+02:00;2024-06-09T09:20:03+02:00;;dpa Hessen;false
714909caf6cc3902ff12ab34c4e571ffbe7a3834bdccd9e855ff58d5907db869;Bahncard 50 und 25 werden künftig nur noch digital ausgestellt;https://www.zeit.de/mobilitaet/2024-06/deutsche-bahn-bahncard-digital-verbraucher-verband-kritik;Nur noch auf dem Handy statt in der Hand: Die Deutsche Bahn bietet ihre Bahncard künftig nur noch in digitaler Form an. Einzige Ausnahme ist die Bahncard 100.;"Z+ (abopflichtiger Inhalt);
        
    
Deutsche Bahn";Mobilitaet, Deutsche Bahn, Deutsche Bahn, Digitalisierung, Verbraucherschutz, Umweltschutz, Fernverkehr, BahnCard, Zugverkehr;2024-06-09T09:15:41+02:00;2024-06-09T09:15:41+02:00;;ZEIT ONLINE,        dpa,        ale;false
2eaab5c79297e46cf156f91313bec19488dfc8b5a8dba12a081062b5ff726438;Hochwasser auch für Natur Herausforderung;https://www.zeit.de/news/2024-06/08/hochwasser-auch-fuer-natur-herausforderung;Hier finden Sie Informationen zu dem Thema „Umwelt“. Lesen Sie jetzt „Hochwasser auch für Natur Herausforderung“.;"Z+ (abopflichtiger Inhalt);
        
    
Umwelt";News, Umwelt, Nabu Thüringen, Thüringen, Naturschutzbund Deutschland, Eisvogel, Hochwasser, Tiere;2024-06-09T09:14:04+02:00;2024-06-09T09:14:04+02:00;;dpa Thüringen;false
032d76edde6b1df6157015ff466fa4b1e78f5e7c7485b9583289799f7765a681;Haitis neuer Ministerpräsident im Krankenhaus;https://www.zeit.de/politik/ausland/2024-06/haiti-garry-conille-ministerpraesident-krankenhaus;Erst Ende Mai war Garry Conille zum Ministerpräsidenten der haitianischen Übergangsregierung gewählt worden. Berichten zufolge leidet er unter Atembeschwerden.;"Z+ (abopflichtiger Inhalt);
        
    
Garry Conille";Politik, Garry Conille, Haiti, Port-au-Prince, Krankenhaus, Garry Conille, Atembeschwerde, Übergangsregierung;2024-06-09T09:13:45+02:00;2024-06-09T09:13:45+02:00;;ZEIT ONLINE,        dpa,        jci;false
63c589ac18218ee68996f82de27e26c78fd97c0a6b9a111d54ba3689fd37ee92;Stimmabgabe für Europa- und kommunale Stichwahlen;https://www.zeit.de/news/2024-06/08/finale-bei-kommunalwahlen-erstmals-europawahl-ab-16-jahren;Hier finden Sie Informationen zu dem Thema „Wahlen“. Lesen Sie jetzt „Stimmabgabe für Europa- und kommunale Stichwahlen“.;"Z+ (abopflichtiger Inhalt);
        
    
Wahlen";News, Wahlen, Thüringen, Europawahl, Kommunalwahl, Wahlbrief, Briefwahl, Finale, Stichwahl;2024-06-09T09:13:19+02:00;2024-06-09T09:13:19+02:00;;dpa Thüringen;false
e055ec73e5cdd17e43d0d14d8ecdea00b05815a0d4e60af6fa0efd87d984459a;Immer mehr Rückzugsräume zum Stillen in den Kommunen;https://www.zeit.de/news/2024-06/08/immer-mehr-rueckzugsraeume-zum-stillen-in-den-kommunen;Hier finden Sie Informationen zu dem Thema „Familienfreundlichkeit“. Lesen Sie jetzt „Immer mehr Rückzugsräume zum Stillen in den Kommunen“.;"Z+ (abopflichtiger Inhalt);
        
    
Familienfreundlichkeit";News, Familienfreundlichkeit, Stefanie Braune, Patrick Weisheit, Erfurt, Jena, Altenburg, Ilmenau, Suhl, Rückzugsraum, Familienfreundlichkeit, Kommune;2024-06-09T09:12:27+02:00;2024-06-09T09:12:27+02:00;;dpa Thüringen;false
8be6bbb0b60c220eff2b75bb119cd7e9cb1f9ba963e751481c30bf1a103c18f0;Noch immer keine Spur von vermisster Valeriia;https://www.zeit.de/news/2024-06/08/keine-spur-von-valeriia-suche-wird-fortgesetzt;Hier finden Sie Informationen zu dem Thema „Vermisstenfall“. Lesen Sie jetzt „Noch immer keine Spur von vermisster Valeriia“.;"Z+ (abopflichtiger Inhalt);
        
    
Vermisstenfall";News, Vermisstenfall, Döbeln, Landkreis Mittelsachsen, Vermisstenfall;2024-06-09T09:11:51+02:00;2024-06-09T09:11:51+02:00;;dpa Sachsen;false
f5e8bac4ec0fecc67690c72778838a967418910a21018cbfc98f2fee686a09ce;"DDR-Musiktheater ""Messeschlager Gisela"" in Berlin gefeiert";https://www.zeit.de/news/2024-06/09/ddr-musiktheater-messeschlager-gisela-in-berlin-gefeiert;"Hier finden Sie Informationen zu dem Thema „Theater“. Lesen Sie jetzt „DDR-Musiktheater ""Messeschlager Gisela"" in Berlin gefeiert“.";"Z+ (abopflichtiger Inhalt);
        
    
Theater";News, Theater, Gerd Natschinski, Adam Benzwi, Berlin, DDR, Komische Oper, Oper;2024-06-09T09:09:12+02:00;2024-06-09T09:09:12+02:00;;dpa Berlin/Brandenburg;false
891c6f2635dcf176190afb46ec378d1317243ff758809ef2bf07ae8b5c97d15f;Zwei AfD-Stadträte in Karlsruhe angegriffen;https://www.zeit.de/politik/2024-06/afd-stadtraete-karlsruhe-baden-wuerttemberg-angriff;Vermummte Angreifer haben zwei AfD-Politiker vor einem Café in der Innenstadt von Karlsruhe attackiert. Nach Angaben der Polizei wurden die Stadträte leicht verletzt.;"Z+ (abopflichtiger Inhalt);
        
    
Baden-Württemberg";Politik, Baden-Württemberg, Angriffe auf Politiker, Karlsruhe, Alternative für Deutschland, Polizei, Innenstadt;2024-06-09T09:08:49+02:00;2024-06-09T09:08:49+02:00;;ZEIT ONLINE,        dpa,        AFP,        jci;false
38c1a78096a1106776557e158c21421929cf13362b43a0341d034b36e25f59bd;Süß oder salzig?;https://www.zeit.de/2024/25/europawahl-rechte-parteien-ursula-von-der-leyen-green-deal-ukraine;360 Millionen Menschen entscheiden über das neue Parlament der Europäischen Union – und das hat Folgen auch für Ihren Alltag. Wir klären die wichtigsten Fragen;"Z+ (abopflichtiger Inhalt);
        
    
Europawahl";Politik, Europawahl, Europawahl, Europäisches Parlament, Ursula von der Leyen, Geert Wilders, Marine Le Pen, Giorgia Meloni;2024-06-09T08:55:15+02:00;2024-06-09T08:55:15+02:00;Ulrich Ladurner;Aus der        ZEIT Nr. 25/2024;false
51c7c282585c53265766f06c2760fb903c9910126bc534ccd10c2de50ec2b49f;Sachsen-Anhalter wählt für Europa und Kommunalparlamente;https://www.zeit.de/news/2024-06/08/ueber-1-8-millionen-in-sachsen-anhalt-zu-wahlen-aufgerufen;Hier finden Sie Informationen zu dem Thema „EU“. Lesen Sie jetzt „Sachsen-Anhalter wählt für Europa und Kommunalparlamente“.;"Z+ (abopflichtiger Inhalt);
        
    
EU";News, EU, Sachsen-Anhalt, EU, Europawahl;2024-06-09T08:52:24+02:00;2024-06-09T08:52:24+02:00;;dpa Sachsen;false
80a25d2ea0aa010f947a0824c78dd2e638eddfe67333ab370389bb05e65a54c4;Feuerwehr muss sich stärker für Wetterextreme wappnen;https://www.zeit.de/news/2024-06/08/feuerwehr-muss-sich-staerker-fuer-wetterextreme-wappnen;Hier finden Sie Informationen zu dem Thema „Katastrophenschutz“. Lesen Sie jetzt „Feuerwehr muss sich stärker für Wetterextreme wappnen“.;"Z+ (abopflichtiger Inhalt);
        
    
Katastrophenschutz";News, Katastrophenschutz, Frank Hachemer, Rheinland-Pfalz, Feuerwehr, Wetterextrem, Katastrophenschutz, Löschfahrzeug, Sturmschaden, Blaulicht, Starkregen, Hochwasser;2024-06-09T08:48:46+02:00;2024-06-09T08:48:46+02:00;;dpa Rheinland-Pfalz/Saarland;false
a4ebeec62c19e24c28d78f84915edd7cbe1376e12c7ed26d1535ea3dcd7f5130;Saarländer wählen EU-Parlament und Kommunalvertretungen;https://www.zeit.de/news/2024-06/08/rund-800-000-saarlaender-zur-wahl-aufgerufen;Hier finden Sie Informationen zu dem Thema „Wahlen“. Lesen Sie jetzt „Saarländer wählen EU-Parlament und Kommunalvertretungen“.;"Z+ (abopflichtiger Inhalt);
        
    
Wahlen";News, Wahlen, Mainz, Saarland, EU-Parlament, Europawahl, Briefwahlbüro, Wahlurne;2024-06-09T08:46:47+02:00;2024-06-09T08:46:47+02:00;;dpa Rheinland-Pfalz/Saarland;false
