Hash;Title;Link;Description;Category;KeyWords;Published;LastUpdated;Author;Source;Paywall
15e4ae72a299ddce8b929632387bf9f5b4190e10261681a128629bc584dfda20;Minus 273 Grad für Europas Sprung in Quantencomputer-Zukunft;https://www.zeit.de/news/2026-02/12/minus-273-grad-fuer-europas-sprung-in-quantencomputer-zukunft;Hier finden Sie Informationen zu dem Thema „Mega-Rechner für Europa“. Lesen Sie jetzt „Minus 273 Grad für Europas Sprung in Quantencomputer-Zukunft“.;Mega-Rechner für Europa;News, Mega-Rechner für Europa, Europa, Garching, München, Bayerische Akademie der Wissenschaften, Europäische Union, IQM, Quantencomputer, Quantentechnologie, Schlüsseltechnologie;2026-02-12T17:45:31+01:00;2026-02-12T17:45:31+01:00;;dpa;false
a8b0ba3ec13794089d7be95e34c2827ec0f50134bebd949f0f7499ac6a618ec3;Gericht: Bebauungsplan für Solarpark in Uckermark ungültig;https://www.zeit.de/news/2026-02/12/gericht-bebauungsplan-fuer-solarpark-in-uckermark-ungueltig;Hier finden Sie Informationen zu dem Thema „Erneuerbare Energie“. Lesen Sie jetzt „Gericht: Bebauungsplan für Solarpark in Uckermark ungültig“.;Erneuerbare Energie;News, Erneuerbare Energie, Uckermark, Bund für Umwelt und Naturschutz, BUND, OVG, Solarpark, Bebauungsplan;2026-02-12T17:35:15+01:00;2026-02-12T17:35:15+01:00;;dpa Berlin/Brandenburg;false
06fa80491bbace89fed5d212a922b9091f209beea38b3217e9cdd1cdc41e6194;AfD Sachsen-Anhalt weist Vetternwirtschaft-Vorwürfe zurück;https://www.zeit.de/news/2026-02/12/afd-sachsen-anhalt-weist-vetternwirtschaft-vorwuerfe-zurueck;Hier finden Sie Informationen zu dem Thema „Schreiben des Landesvorstands“. Lesen Sie jetzt „AfD Sachsen-Anhalt weist Vetternwirtschaft-Vorwürfe zurück“.;Schreiben des Landesvorstands;News, Schreiben des Landesvorstands, Sachsen-Anhalt, Alternative für Deutschland, Vetternwirtschaft;2026-02-12T17:31:09+01:00;2026-02-12T17:31:09+01:00;;dpa Sachsen;false
9610e21984259b57d6f0bf6c65f020f678f033e2d2f359360963f5443a0b5783;62-Jähriger verliert hohen Betrag an Telefonbetrüger;https://www.zeit.de/news/2026-02/12/62-jaehriger-verliert-hohen-betrag-an-telefonbetrueger;Hier finden Sie Informationen zu dem Thema „Betrug“. Lesen Sie jetzt „62-Jähriger verliert hohen Betrag an Telefonbetrüger“.;Betrug;News, Betrug, Polizei, Betrag, Betrug;2026-02-12T17:28:12+01:00;2026-02-12T17:28:12+01:00;;dpa Thüringen;false
fc9efb5c0124f4c4ab3f1ab659ff1a004b317ca8a3ec256e2eae87926841811c;Klage gegen Abschusserlaubnis für Goldschakal erfolglos;https://www.zeit.de/news/2026-02/12/klage-gegen-abschusserlaubnis-fuer-goldschakal-erfolglos;Hier finden Sie Informationen zu dem Thema „Tote Lämmer“. Lesen Sie jetzt „Klage gegen Abschusserlaubnis für Goldschakal erfolglos“.;Tote Lämmer;News, Tote Lämmer, Tote Lämmer, Schleswig, Sylt, Verwaltungsgericht, Goldschakal, Abschusserlaubnis, Abschussgenehmigung, Tiere;2026-02-12T17:26:27+01:00;2026-02-12T17:26:27+01:00;;dpa Hamburg/Schleswig-Holstein;false
496fc93694ce764e2e1001aae17696a7bda8c0846128cc548c6241b2fe3024b8;Europas Rüstungsprojekte zerbröseln;https://www.zeit.de/politik/deutschland/2026-02/fcas-kampfjet-programm-ruestung-frankreich;Die Regierungen in Berlin und Paris wollten mit FCAS gemeinsam den Kampfjet der Zukunft entwickeln. Doch Streit überschattet das Projekt. Wie es gerettet werden soll ;FCAS;Politik, FCAS, Berlin, Paris, Frankreich, Eurofighter, Drohne, Europa;2026-02-12T17:25:32+01:00;2026-02-12T17:25:32+01:00;Dr. Hauke Friederichs;;false
0bb7b0f3e90ed2ef1a08ce95d04a755412dfa3d2dc512d47e5e9a74ea99e101c;Lebensmittelwächter beanstanden Creme-Krapfen;https://www.zeit.de/news/2026-02/12/lebensmittelwaechter-beanstanden-creme-krapfen;Hier finden Sie Informationen zu dem Thema „Narrenfrei“. Lesen Sie jetzt „Lebensmittelwächter beanstanden Creme-Krapfen“.;Narrenfrei;News, Narrenfrei, Bayerisches Landesamt für Gesundheit und Lebensmittelsicherheit, Krapfenzeit, Hefegebäck, Schokofüllung, Weißwurst;2026-02-12T17:24:32+01:00;2026-02-12T17:24:32+01:00;;dpa Bayern;false
ac116f25b9cf24325e213a29d8b7ff35af91141137a6620f5b9c6bf7c8662f3f;55-Jährige getötet - Lebenslang für Vermieter-Paar gefordert;https://www.zeit.de/news/2026-02/12/55-jaehrige-getoetet-lebenslang-fuer-vermieter-paar-gefordert;Hier finden Sie Informationen zu dem Thema „Kriminalität“. Lesen Sie jetzt „55-Jährige getötet - Lebenslang für Vermieter-Paar gefordert“.;Kriminalität;News, Kriminalität, Lauterbach, Staatsanwaltschaft, Lebenslang, Hauburger, Kriminalität, Freiheitsstrafe, Körperverletzung;2026-02-12T17:23:24+01:00;2026-02-12T17:23:24+01:00;;dpa Hessen;false
6fbdcc357cdd4d6bb2c6b88cf49647a2da093555ad6f8fad89cd114973d516d3;Staatsbibliothek in Berlin muss für elf Jahre schließen;https://www.zeit.de/news/2026-02/12/staatsbibliothek-in-berlin-schliesst-ab-2030-fuer-elf-jahre;Hier finden Sie Informationen zu dem Thema „Bibliothek wird saniert“. Lesen Sie jetzt „Staatsbibliothek in Berlin muss für elf Jahre schließen“.;Bibliothek wird saniert;News, Bibliothek wird saniert, Marion Ackermann, Berlin, Potsdamer Platz, Stiftung Preußischer Kulturbesitz, Staatsbibliothek;2026-02-12T17:22:27+01:00;2026-02-12T17:22:27+01:00;;dpa Berlin/Brandenburg;false
f3a072208be1b1d719ef00d2f697536fde26595ce5c44512b1051e28c8210377;Elbfähre nach Eisunterbrechung wieder in Betrieb;https://www.zeit.de/news/2026-02/12/elbfaehre-nach-eisunterbrechung-wieder-in-betrieb;Hier finden Sie Informationen zu dem Thema „Fährverbindung über die Elbe“. Lesen Sie jetzt „Elbfähre nach Eisunterbrechung wieder in Betrieb“.;Fährverbindung über die Elbe;News, Fährverbindung über die Elbe, Elbe, Glückstadt, Wischhafen, Elbfähre, Eisunterbrechung, Fährverbindung;2026-02-12T17:19:24+01:00;2026-02-12T17:19:24+01:00;;dpa Hamburg/Schleswig-Holstein;false
9b2609146508b6642a2cdabba5cc5a12525926538d56a29f959f9be16a8aaf20;85-Jähriger stirbt nach Unfall mit Straßenbahn in Kassel;https://www.zeit.de/news/2026-02/12/85-jaehriger-stirbt-nach-unfall-mit-strassenbahn-in-kassel;Hier finden Sie Informationen zu dem Thema „Mit Tram zusammengestoßen“. Lesen Sie jetzt „85-Jähriger stirbt nach Unfall mit Straßenbahn in Kassel“.;Mit Tram zusammengestoßen;News, Mit Tram zusammengestoßen, Kassel, Unfall, Straßenbahn;2026-02-12T17:14:03+01:00;2026-02-12T17:14:03+01:00;;dpa Hessen;false
28fa3bcbbe4a1ffcd1b72b951513b6f6bf34fe1a007d218babdd1aed4e0e61d8;AfD-Chef Chrupalla beschäftigt Ehefrau eines Parteikollegen;https://www.zeit.de/news/2026-02/12/afd-chef-chrupalla-beschaeftigt-ehefrau-eines-parteikollegen;Hier finden Sie Informationen zu dem Thema „Bundesvorsitzender“. Lesen Sie jetzt „AfD-Chef Chrupalla beschäftigt Ehefrau eines Parteikollegen“.;Bundesvorsitzender;News, Bundesvorsitzender, Robert Kuhnert, Alice Weidel, Tino Chrupalla, Weißwasser, Niesky, Alternative für Deutschland, X, Deutscher Bundestag, Bundesvorsitzende, Bürgerbüro;2026-02-12T17:13:52+01:00;2026-02-12T17:13:52+01:00;;dpa Sachsen;false
9026c7341aa35370ed0d66a319189e97c9c6d328451dc6e63137fe7e9b84e301;Immer weniger Häftlinge in MV;https://www.zeit.de/news/2026-02/12/immer-weniger-haeftlinge-in-mv;Hier finden Sie Informationen zu dem Thema „Platz im Gefängnis“. Lesen Sie jetzt „Immer weniger Häftlinge in MV“.;Platz im Gefängnis;News, Platz im Gefängnis, Bützow, Stralsund, Waldeck, Neustrelitz, Mecklenburg-Vorpommern, Gefängnis;2026-02-12T17:13:12+01:00;2026-02-12T17:13:12+01:00;;dpa Mecklenburg-Vorpommern;false
6bd56b47c76251575361421fcb693dd1755624f8b3f423742f36dc273a48ef2a;Gestrandetes Segelschiff soll am Wochenende geborgen werden;https://www.zeit.de/news/2026-02/12/gestrandetes-segelschiff-soll-am-wochenende-geborgen-werden;Hier finden Sie Informationen zu dem Thema „Schifffahrt“. Lesen Sie jetzt „Gestrandetes Segelschiff soll am Wochenende geborgen werden“.;Schifffahrt;News, Schifffahrt, Cuxhaven, Segelschiff, Schifffahrt, Fachunternehmen, Schwimmkran, Schifffahrtsamt, Schiff;2026-02-12T17:08:40+01:00;2026-02-12T17:08:40+01:00;;dpa Niedersachsen;false
a3bfbd5dbedec1d24176f9b32187b7611a569931be508dced22301c9038fafc7;Mann verliert 180.000 Euro bei Anlagebetrug im Internet;https://www.zeit.de/news/2026-02/12/mann-verliert-180-000-euro-bei-anlagebetrug-im-internet;Hier finden Sie Informationen zu dem Thema „Betrugsmasche“. Lesen Sie jetzt „Mann verliert 180.000 Euro bei Anlagebetrug im Internet“.;Betrugsmasche;News, Betrugsmasche, Greifswald, Polizei, Anlagebetrug, Betrugsmasche;2026-02-12T17:04:11+01:00;2026-02-12T17:04:11+01:00;;dpa Mecklenburg-Vorpommern;false
54aab522677c44a819169154743231f3b17e2aedbde1fcaafef3bc36f580b5ab;Es war nie Nächstenliebe;https://www.zeit.de/politik/ausland/2026-02/muenchner-sicherheitskonferenz-transatlantisches-buendnis-europa-usa;Europa war Nutznießer der starken USA? Wir sollten dieser falschen Erzählung nicht glauben. Tatsächlich haben die Amerikaner den Europäern nichts geschenkt.;"Z+ (abopflichtiger Inhalt);
        
    Münchner Sicherheitskonferenz";Politik, Münchner Sicherheitskonferenz, Sicherheitspolitik, Münchner Sicherheitskonferenz, Europa, USA, Nato;2026-02-12T17:03:33+01:00;2026-02-12T17:03:33+01:00;Dr.  Moritz Weiss;;false
7232a44b4f45e1a14147fd22c0bb5213d6b3734c1b86cc3990c5b00652343cfb;Verband ordnet an: Usyk muss gegen Kabayel um WM-Titel boxen;https://www.zeit.de/news/2026-02/12/verband-ordnet-an-usyk-muss-gegen-kabayel-um-wm-titel-boxen;Hier finden Sie Informationen zu dem Thema „Schwergewicht“. Lesen Sie jetzt „Verband ordnet an: Usyk muss gegen Kabayel um WM-Titel boxen“.;Schwergewicht;News, Schwergewicht, Oleksandr Usyk, Deutsche Presse-Agentur, Krieg in der Ukraine;2026-02-12T17:02:44+01:00;2026-02-12T17:02:44+01:00;;dpa Sport;false
478d4127bb71f94edbc8518a25d64107d53d5c1d0d7cbd6bc87160f382a08228;Er war wie ein Bruder;https://www.zeit.de/feuilleton/film/2026-02/james-van-der-beek-schauspieler-dawsons-creek-tod;"In der TV-Serie ""Dawson's Creek"" spielte James Van Der Beek den nerdigen Teenager, den man selbst gern gekannt hätte. Jetzt ist der Schauspieler mit 48 Jahren gestorben.";"Z+ (abopflichtiger Inhalt);
        
    James Van Der Beek";Feuilleton, James Van Der Beek, Schauspieler, Kino, Fernsehen, Katie Holmes, Familie, USA;2026-02-12T17:01:14+01:00;2026-02-12T17:01:14+01:00;Lukas Heinser;;false
e3e91b747d379e231f0a04ffe2bc16be5cbf24b5af474150c49c7bdf974054a8;Überholmanöver endet im Feld – Schwerverletzter;https://www.zeit.de/news/2026-02/12/ueberholmanoever-endet-im-feld-schwerverletzter;Hier finden Sie Informationen zu dem Thema „Autounfall“. Lesen Sie jetzt „Überholmanöver endet im Feld – Schwerverletzter“.;Autounfall;News, Autounfall, Überholmanöver, Autounfall, Unfall, Fahrzeug, Auto;2026-02-12T16:58:16+01:00;2026-02-12T16:58:16+01:00;;dpa Baden-Württemberg;false
2539c693cb9c8c0330a4a830c9371efa90f664b58630cfe8772b7c54f96d2913;Frosta steigert Umsatz - Gewinn sinkt;https://www.zeit.de/news/2026-02/12/frosta-steigert-umsatz-gewinn-sinkt;Hier finden Sie Informationen zu dem Thema „Jahresbilanz 2025“. Lesen Sie jetzt „Frosta steigert Umsatz - Gewinn sinkt“.;Jahresbilanz 2025;News, Jahresbilanz 2025, Felix Ahlers, Bremerhaven, Frosta, Umsatz, Jahresbilanz, Materialkosten;2026-02-12T16:58:06+01:00;2026-02-12T16:58:06+01:00;;dpa Niedersachsen;false
bc18c3070f1db35496ed5f2864eab7bb5fa5f879aaf4956901f39809cd725582;"""In der Hose steckt mehr Freiheit""";https://www.zeit.de/2026/07/rose-markus-schleinzer-film-sandra-hueller-caro-braun-berlinale;"Im Film ""Rose"" spielt Sandra Hüller eine Frau, die sich als Mann ausgibt, und Caro Braun ihre Ehefrau. Ein Gespräch über Penisattrappen und nervige Geschlechterrollen ";"Z+ (abopflichtiger Inhalt);
        
    Sandra Hüller und Caro Braun";Kultur, Sandra Hüller und Caro Braun, Berlinale, Kino, Berlin, Filmfestival, Filmindustrie;2026-02-12T16:57:21+01:00;2026-02-12T16:57:21+01:00;Katja Nicodemus;Aus der        ZEIT Nr. 07/2026;false
ed037b4c909c426edd839390d715bd7aa299df26827969bb535ea5743e5f87b4;Seit 19 Jahren in Wolfsburg: Neuer Vertrag für Sportchef;https://www.zeit.de/news/2026-02/12/seit-19-jahren-in-wolfsburg-neuer-vertrag-fuer-sportchef;Hier finden Sie Informationen zu dem Thema „Deutsche Eishockey Liga“. Lesen Sie jetzt „Seit 19 Jahren in Wolfsburg: Neuer Vertrag für Sportchef“.;Deutsche Eishockey Liga;News, Deutsche Eishockey Liga, Karl-Heinz Fliegauf, Hartmut Rickel, Wolfsburg, Eishockey;2026-02-12T16:55:40+01:00;2026-02-12T16:55:40+01:00;;dpa Niedersachsen;false
8e5c8ed65dda7cab1130d801fac1b294adc8cf0150c4059426294d21f54f69b2;Tausende Schaulustige beim Chinesenfasching;https://www.zeit.de/news/2026-02/12/tausende-schaulustige-beim-chinesenfasching;Hier finden Sie Informationen zu dem Thema „Fernöstliche Narretei“. Lesen Sie jetzt „Tausende Schaulustige beim Chinesenfasching“.;Fernöstliche Narretei;News, Fernöstliche Narretei, Oberpfalz, DIetfurt, Altmühl, Dietfurt, Chinesenfasching, Narretei, Faschingsumzug, Wetter;2026-02-12T16:53:10+01:00;2026-02-12T16:53:10+01:00;;dpa Bayern;false
1156493fcf67e55f6d532211a8ac79d94e4699b36629072d230c4d58142a8674;BGH hebt Urteil gegen Ex-Pfarrer teilweise auf;https://www.zeit.de/news/2026-02/12/bgh-hebt-urteil-gegen-ex-pfarrer-teilweise-auf;Hier finden Sie Informationen zu dem Thema „Missbrauch“. Lesen Sie jetzt „BGH hebt Urteil gegen Ex-Pfarrer teilweise auf“.;Missbrauch;News, Missbrauch, Fulda, Bundesgerichtshof, Missbrauch, Erfolg;2026-02-12T16:51:36+01:00;2026-02-12T16:51:36+01:00;;dpa Hessen;false
b42b09540962d38d4e385f2709624eaba2905092eb1dab2b71b50fb681ca6e60;Richard Wagner kriegt aufs Maul;https://www.zeit.de/kultur/musik/2026-02/die-fritjof-saga-oper-elfrida-andree-essen-urauffuehrung;"In Essen feiert die feministische Oper ""Die Fritjof-Saga"" der Komponistin Elfrida Andrée ihre Uraufführung – 130 Jahre nach der Entstehung. Was für eine Entdeckung!";"Z+ (abopflichtiger Inhalt);
        
    ""Die Fritjof-Saga""";"Kultur, ""Die Fritjof-Saga"", Oper, Feminismus, Richard Wagner, Schriftstellerin, Essen";2026-02-12T16:51:19+01:00;2026-02-12T16:51:19+01:00;Hannah Schmidt;;false
24b3f2b4c99bce78f8fa489bb593de0054079f68b4f9d652c4432dcffe45fd39;Würth rechnet mit Aus der FDP im Südwesten;https://www.zeit.de/news/2026-02/12/wuerth-rechnet-mit-aus-der-fdp-im-suedwesten;Hier finden Sie Informationen zu dem Thema „Landtagswahl“. Lesen Sie jetzt „Würth rechnet mit Aus der FDP im Südwesten“.;Landtagswahl;News, Landtagswahl, Reinhold Würth, Stuttgart, FDP, CDU, Landtagswahl, Südwesten;2026-02-12T16:49:53+01:00;2026-02-12T16:49:53+01:00;;dpa Baden-Württemberg;false
e1decc1711e861b9d8518a589c6e057e82282254f37452031df764d788a97922;"St. Pauli mit Zuversicht nach Leverkusen: ""Wollen mehr""";https://www.zeit.de/news/2026-02/12/st-pauli-mit-zuversicht-nach-leverkusen-wollen-mehr;"Hier finden Sie Informationen zu dem Thema „Fußball-Bundesliga“. Lesen Sie jetzt „St. Pauli mit Zuversicht nach Leverkusen: ""Wollen mehr""“.";Fußball-Bundesliga;News, Fußball-Bundesliga, St. Pauli, Leverkusen, Deutscher Fußball-Bund, Bayer 04 Leverkusen, FC St. Pauli, Fußball-Bundesliga, Bundesliga, Zuversicht;2026-02-12T16:44:52+01:00;2026-02-12T16:44:52+01:00;;dpa Hamburg/Schleswig-Holstein;false
f6399bfbd029f0ca260b98ad1459bd597cc69626eabcd221bf7c42cc7cd92c99;Jagen oder reiten - Freizeitmesse im Frühling;https://www.zeit.de/news/2026-02/12/jagen-oder-reiten-freizeitmesse-im-fruehling;Hier finden Sie Informationen zu dem Thema „Messe Erfurt“. Lesen Sie jetzt „Jagen oder reiten - Freizeitmesse im Frühling“.;Messe Erfurt;News, Messe Erfurt, Erfurt, Freizeitmesse, Holzrücken;2026-02-12T16:43:27+01:00;2026-02-12T16:43:27+01:00;;dpa Thüringen;false
7522a7b95ca62b11d15d6fa847e7817c773746ce1088bc86c9da08fb48cefa67;US-Grenzbeauftragter Homan kündigt ICE-Abzug aus Minnesota an;https://www.zeit.de/politik/ausland/2026-02/us-grenzbeauftragter-homan-gibt-ice-abzug-aus-minnesota-bekannt;Die US-Regierung will ihre Abschiebeoffensive in Minnesota beenden. Der Grenzbeauftragte Homan sagte, dass der Abzug der Bundesbeamten bereits begonnen habe.;USA;Politik, USA, USA, Immigration and Customs Enforcement, Minnesota, Minneapolis, Tim Walz;2026-02-12T16:42:42+01:00;2026-02-12T16:42:42+01:00;yer;DIE ZEIT,        AP,        Reuters,        AFP,        							yer;false
4cc56d89cedaff053bad929f8d58d1127b3db12dce91bb999de34107e5e669e3;Neues Zentrum für Lehrerbildung - Richtfest an Uni Potsdam;https://www.zeit.de/news/2026-02/12/neues-zentrum-fuer-lehrerbildung-richtfest-an-uni-potsdam;Hier finden Sie Informationen zu dem Thema „35 Millionen Euro-Projekt“. Lesen Sie jetzt „Neues Zentrum für Lehrerbildung - Richtfest an Uni Potsdam“.;35 Millionen Euro-Projekt;News, 35 Millionen Euro-Projekt, Uni Potsdam, Universität Potsdam, Lehrerbildung, Richtfest;2026-02-12T16:42:30+01:00;2026-02-12T16:42:30+01:00;;dpa Berlin/Brandenburg;false
718f4c9ae70157eb2d5a95bb663ee22397cc09bf16321e3815892e0bc4d8a376;Bundesregierung gibt Schloss Meseberg als Gästehaus auf;https://www.zeit.de/politik/deutschland/2026-02/schloss-meseberg-brandenburg-bundesregierung-deutschland;Die Bundesregierung will den Mietvertrag mit dem Schloss Meseberg ab Februar 2027 auslaufen lassen. Hintergrund ist auch die Entfernung zur Hauptstadt.;Brandenburg;Politik, Brandenburg, Bundesrepublik Deutschland, Bundesregierung, Brandenburg, Stiftung, Mietvertrag;2026-02-12T16:41:59+01:00;2026-02-12T16:41:59+01:00;ngo;DIE ZEIT,        dpa,        epd,        							ngo;false
46fd9b4d6d186af895669158b20a460f09e79db7b65942256c5dbc2863a918a9;Urteile in Münster: Haftstrafen für Zwangsprostitution;https://www.zeit.de/news/2026-02/12/urteile-in-muenster-haftstrafen-fuer-zwangsprostitution;Hier finden Sie Informationen zu dem Thema „Landgericht“. Lesen Sie jetzt „Urteile in Münster: Haftstrafen für Zwangsprostitution“.;Landgericht;News, Landgericht, Münster, Zwangsprostitution, Haftstrafe, Landgericht, Zuhälterei, Geld;2026-02-12T16:38:06+01:00;2026-02-12T16:38:06+01:00;;dpa Nordrhein-Westfalen;false
58a657fff5c98889e22ba89adc5284ae3259e3d704211406aad40c24e01a8353;Ermittlungen gegen EU-Kommission wegen Immobilienverkäufen;https://www.zeit.de/news/2026-02/12/europaeische-staatsanwaltschaft-ermittelt-gegen-eu-kommission;Hier finden Sie Informationen zu dem Thema „Europäische Staatsanwaltschaft“. Lesen Sie jetzt „Ermittlungen gegen EU-Kommission wegen Immobilienverkäufen“.;Europäische Staatsanwaltschaft;News, Europäische Staatsanwaltschaft, Staatsanwaltschaft, Europäische Union, EU-Kommission;2026-02-12T16:37:32+01:00;2026-02-12T16:37:32+01:00;;dpa;false
a6a7b08bd6cf195564ff08a32c273173618897b5d2a9e6de8b8f2d0ef84370db;Schlag mit Baguette - Ehestreit eskaliert;https://www.zeit.de/news/2026-02/12/schlag-mit-baguette-ehestreit-eskaliert;Hier finden Sie Informationen zu dem Thema „Kriminalität“. Lesen Sie jetzt „Schlag mit Baguette - Ehestreit eskaliert“.;Kriminalität;News, Kriminalität, Niederbayern, Polizei, Ehestreit, Baguette, Wäscheständer, Kriminalität;2026-02-12T16:37:14+01:00;2026-02-12T16:37:14+01:00;;dpa Bayern;false
9de5e1c4fc40776dd26bc398f119f7c7ba6a5790368c573fa842e725ad809183;USA werben für Nato 3.0;https://www.zeit.de/news/2026-02/12/pistorius-schickt-hoechsten-soldaten-ins-rennen-um-nato-amt;Hier finden Sie Informationen zu dem Thema „Sicherheit und Verteidigung“. Lesen Sie jetzt „USA werben für Nato 3.0“.;Sicherheit und Verteidigung;News, Sicherheit und Verteidigung, Boris Pistorius, Carsten Breuer, Brüssel, Bundesrepublik Deutschland, Europa, Nato, Verteidigung, Sicherheit, Militär;2026-02-12T16:35:47+01:00;2026-02-12T16:35:47+01:00;;dpa;false
ae278e59ae0cc57af7b8cc1effcf91772791db84af2ff34f6a3460e2ac432c7f;Redeverbot für AfD-Politiker Höcke in Oberfranken;https://www.zeit.de/news/2026-02/12/redeverbot-fuer-afd-politiker-hoecke-in-oberfranken;Hier finden Sie Informationen zu dem Thema „Kommunalwahlkampf“. Lesen Sie jetzt „Redeverbot für AfD-Politiker Höcke in Oberfranken“.;Kommunalwahlkampf;News, Kommunalwahlkampf, Björn Höcke, Oberfranken, Bayreuth, Seybothenreuth, Lindenberg, Alternative für Deutschland, Verwaltungsgericht, Redeverbot, Kommunalwahlkampf, Wahlkampfveranstaltung;2026-02-12T16:33:58+01:00;2026-02-12T16:33:58+01:00;;dpa Bayern;false
065f3bd60d2819556d8ee9dff376606bfff976894c4210ffe868eec5f9edbe00;"Vergrabene Giftabfälle? ""Keine Gefahr für das Grundwasser""";https://www.zeit.de/news/2026-02/12/vergrabene-giftabfaelle-keine-gefahr-fuer-das-grundwasser;"Hier finden Sie Informationen zu dem Thema „Fliegerhorst Oldenburg“. Lesen Sie jetzt „Vergrabene Giftabfälle? ""Keine Gefahr für das Grundwasser""“.";Fliegerhorst Oldenburg;News, Fliegerhorst Oldenburg, Oldenburg, Staatsanwaltschaft, Giftabfall, Grundwasser, Fliegerhorst, Giftstoff;2026-02-12T16:32:58+01:00;2026-02-12T16:32:58+01:00;;dpa Niedersachsen;false
92d45fee883f22a31633ffea1fae65eeffdefe3ac9d83bd55077aae33309867f;Crack-Suchthilfezentrum in Frankfurt soll 2027 öffnen;https://www.zeit.de/news/2026-02/12/crack-suchthilfezentrum-in-frankfurt-soll-2027-oeffnen;Hier finden Sie Informationen zu dem Thema „Drogen“. Lesen Sie jetzt „Crack-Suchthilfezentrum in Frankfurt soll 2027 öffnen“.;Drogen;News, Drogen, Frankfurt, Drogen;2026-02-12T16:32:18+01:00;2026-02-12T16:32:18+01:00;;dpa Hessen;false
0359e4964d4658d0e3031590adf9f519aa1cfb66ad130d7c3ea0d88d9179842a;"Kriminalität sinkt - aber auch 2025 ""schlimme Taten""";https://www.zeit.de/news/2026-02/12/zahl-der-straftaten-in-hamburg-um-fuenf-prozent-gesunken;"Hier finden Sie Informationen zu dem Thema „Polizeistatistik für Hamburg“. Lesen Sie jetzt „Kriminalität sinkt - aber auch 2025 ""schlimme Taten""“.";Polizeistatistik für Hamburg;News, Polizeistatistik für Hamburg, Hamburg, Polizei, Straftat, Kriminalstatistik;2026-02-12T16:30:32+01:00;2026-02-12T16:30:32+01:00;;dpa Hamburg/Schleswig-Holstein;false
8d5847f6dfd9e08da26e24ea085aded0d94bee16501068262f859e26788178c9;Ein Leben für Bach – Dirigent Helmuth Rilling gestorben;https://www.zeit.de/news/2026-02/12/ein-leben-fuer-bach-dirigent-helmuth-rilling-gestorben;Hier finden Sie Informationen zu dem Thema „Musiker und Bach-Experte“. Lesen Sie jetzt „Ein Leben für Bach – Dirigent Helmuth Rilling gestorben“.;Musiker und Bach-Experte;News, Musiker und Bach-Experte, Helmuth Rilling, Johann Sebastian Bach, Stuttgart, Leonberg, Böblingen, Bachakademie;2026-02-12T16:28:34+01:00;2026-02-12T16:28:34+01:00;;dpa Baden-Württemberg;false
1bb560c39961d796f454741c13c89f6c0221919eacab890c7c7ff7fabf70990c;Dach teilweise eingestürzt – Bewohner in Sicherheit;https://www.zeit.de/news/2026-02/12/dach-teilweise-eingestuerzt-bewohner-in-sicherheit;Hier finden Sie Informationen zu dem Thema „Mannheim“. Lesen Sie jetzt „Dach teilweise eingestürzt – Bewohner in Sicherheit“.;Mannheim;News, Mannheim, Mannheim, Sicherheit;2026-02-12T16:27:57+01:00;2026-02-12T16:27:57+01:00;;dpa Baden-Württemberg;false
87273e5ec6c91df9849c712cd47b4ae9f8ce3feab36d4e93d55aafbfbb661492;Polizei schützt Barbetreiber vor Opferangehörigen der Brandkatastrophe;https://www.zeit.de/gesellschaft/zeitgeschehen/2026-02/schweiz-brand-crans-montana-opfer-angehoerige;Das Paar, das die Schweizer Bar Le Constellation betrieben hatte, ist vor einer Anhörung heftig beschimpft worden. Gegen beide wird wegen fahrlässiger Tötung ermittelt.;Brandkatastrophe in Crans-Montana;Gesellschaft, Brandkatastrophe in Crans-Montana, Schweiz, Crans-Montana, Polizei, Ermittlung, Gerichtsverfahren, Brand;2026-02-12T16:27:43+01:00;2026-02-12T16:27:43+01:00;mga;DIE ZEIT,        AFP,        dpa,        							mga;false
1aa9118016e5c64c13ca46603a1e97ef6e4050c69f5a3868bc361fb0906d826d;Narren haben auch bei Regen Spaß;https://www.zeit.de/news/2026-02/12/schunkeln-unterm-schirm-narren-feiern-weiberfastnacht;Hier finden Sie Informationen zu dem Thema „Karneval“. Lesen Sie jetzt „Narren haben auch bei Regen Spaß“.;Karneval;News, Karneval, Mainz, Weiberfastnacht, Karneval, Straßenkarneval;2026-02-12T16:26:01+01:00;2026-02-12T16:26:01+01:00;;dpa Rheinland-Pfalz/Saarland;false
fad0ab3f254564a930afdfe80f91824842ac1872e406b193a0fcb4491adc3710;Gericht kippt Sperren gegen Porno-Plattformen wegen EU-Recht;https://www.zeit.de/news/2026-02/12/gericht-kippt-sperren-gegen-porno-plattformen-wegen-eu-recht;Hier finden Sie Informationen zu dem Thema „Betreiberin mit Sitz in Zypern“. Lesen Sie jetzt „Gericht kippt Sperren gegen Porno-Plattformen wegen EU-Recht“.;Betreiberin mit Sitz in Zypern;News, Betreiberin mit Sitz in Zypern, Zypern, Neustadt an der Weinstraße, Rheinland-Pfalz, Europäische Union, Verwaltungsgericht, Sperre, Medienanstalt, Sperrverfügung;2026-02-12T16:23:24+01:00;2026-02-12T16:23:24+01:00;;dpa Rheinland-Pfalz/Saarland;false
dfde4ff5fe98a25236f37b4ba8fee3d3171f344263ddbb1f3a1119008563b8ec;500 Liter altes Frittierfett gestohlen;https://www.zeit.de/news/2026-02/12/500-liter-altes-frittierfett-gestohlen;Hier finden Sie Informationen zu dem Thema „Sinsheim“. Lesen Sie jetzt „500 Liter altes Frittierfett gestohlen“.;Sinsheim;News, Sinsheim, Sinsheim, Polizei, Frittierfett, Außenanlage, Schnellrestaurant, Grundstückstor;2026-02-12T16:20:57+01:00;2026-02-12T16:20:57+01:00;;dpa Baden-Württemberg;false
33c1f0a148f28aa992aff38f677d0187abd7e966de39b295e0b3459a210522c4;Viele Vorschläge für besseren Winterdienst in Berlin;https://www.zeit.de/news/2026-02/12/viele-vorschlaege-fuer-besseren-winterdienst-in-berlin;Hier finden Sie Informationen zu dem Thema „Parlament“. Lesen Sie jetzt „Viele Vorschläge für besseren Winterdienst in Berlin“.;Parlament;News, Parlament, Kai Wegner, Ute Bonde, Berlin, BSR, CDU, SPD, Alternative für Deutschland, Tausalz, Salzverbot, Abgeordnetenhaus;2026-02-12T16:13:54+01:00;2026-02-12T16:13:54+01:00;;dpa Berlin/Brandenburg;false
