Hash;Title;Link;Description;Category;KeyWords;Published;LastUpdated;Author;Source;Paywall
e805e54580259c14412d9cfb582f0408eb75b3b2e46182c2a9f6f12e880f26a0;Dieser Emoji half, ihn zu überführen: 🤗;https://www.zeit.de/wirtschaft/2026-03/crimenetwork-illegale-plattform-justiz-jannis-h;Jannis H. hat mit dem Drogenhandel auf seiner Plattform Crimenetwork ein Vermögen gemacht. Nun wurde er verurteilt. Eine Botschaft war dem Richter besonders wichtig.;"Z+ (abopflichtiger Inhalt);
        
    Crimenetwork";Wirtschaft, Crimenetwork, Gerichtsverfahren, Dubai, Drogenhandel, Drogen, Internet;2026-03-18T20:57:58+01:00;2026-03-18T20:57:58+01:00;Kai BiermannMartín SteinhagenJens TönnesmannSascha Venohr;;false
4850fe59ef6cba68b3f3981f06c0d43cb4b1325a75a7b90349e8c269fec46fc8;Tarifverhandlungen im Nahverkehr festgefahren;https://www.zeit.de/news/2026-03/18/tarifverhandlungen-im-nahverkehr-festgefahren;Hier finden Sie Informationen zu dem Thema „ÖPNV Thüringen“. Lesen Sie jetzt „Tarifverhandlungen im Nahverkehr festgefahren“.;ÖPNV Thüringen;News, ÖPNV Thüringen, Erfurt, Tarifverhandlung, Nahverkehr, Verhandlungsrunde;2026-03-18T20:45:55+01:00;2026-03-18T20:45:55+01:00;;dpa Thüringen;false
983e1c3291c502778b16e073b3946bd8a620a1785580f989b71b6faae544dfe4;"Städtetag fordert Milliardenhilfe gegen ""katastrophale"" Lage";https://www.zeit.de/politik/deutschland/2026-03/kommunen-staedtetag-milliarden-gemeinden;"""So schlecht ging es den deutschen Städten und Gemeinden seit 1945 nie zuvor"": Der Deutsche Städtetag fordert 30 Milliarden Euro jährliche Hilfe vom Bund.";Finanzlage der Kommunen;Politik, Finanzlage der Kommunen, Finanzen, Haushalt, Bundeshaushalt, SPD;2026-03-18T20:35:27+01:00;2026-03-18T20:35:27+01:00;kzi;DIE ZEIT,        dpa,        							kzi;false
b3f4f174c816480af898a64e7ced0c62ce9aaec0f481ee24214172185e0cdb58;Die Tech-Szene schweigt. Zwei Demokraten übernehmen;https://www.zeit.de/digital/2026-03/sxsw-silicon-valley-technologie-usa-demokraten;Die SXSW galt mal als das gute Gewissen des Silicon Valley. Doch unter Trump duckt sich die Tech-Elite weg. Kampfbereit zeigen sich nur zwei Shootingstars der Demokraten.;"Z+ (abopflichtiger Inhalt);
        
    SXSW";Digital, SXSW, Donald Trump, South by Southwest, Silicon Valley, Demokraten (USA), Gavin Newsom, Elon Musk, USA, Technologie, Austin, Wahlkampf;2026-03-18T20:30:53+01:00;2026-03-18T20:30:53+01:00;Nicolas Killian;;false
e8fe9a66ba9927118d03461b955707580ac72d0c1f9e6a59a319b0318593c8a8;Buhrufe für Weimer bei Festakt zur Buchmesse-Eröffnung;https://www.zeit.de/news/2026-03/18/weimer-fachbeamte-starteten-anfrage-beim-verfassungsschutz;Hier finden Sie Informationen zu dem Thema „Leipziger Buchmesse“. Lesen Sie jetzt „Buhrufe für Weimer bei Festakt zur Buchmesse-Eröffnung“.;Leipziger Buchmesse;News, Leipziger Buchmesse, Wolfram Weimer, Verfassungsschutz, Buchhandlungspreis;2026-03-18T20:25:15+01:00;2026-03-18T20:25:15+01:00;;dpa;false
3828c6f5ab48014aeae38fdeaf61d85f868de460fb07271c885825b91eca0c1e;Dann lieber alleine sterben;https://www.zeit.de/feuilleton/film/2026-03/louis-theroux-inside-the-manosphere-netflix-dokumentation-maenner;Gibt es intelligentes Leben im Reich der hypermaskulinen Influencer? Der Dokumentarfilmer Louis Theroux hat nachgeguckt. Seine Erkenntnisse sind nicht neu, aber schlimm.;"Z+ (abopflichtiger Inhalt);
        
    ""Louis Theroux: Inside the Manosphere""";"Feuilleton, ""Louis Theroux: Inside the Manosphere"", Mann, Dokumentation, Frauen, Netflix, Feminismus";2026-03-18T20:19:21+01:00;2026-03-18T20:19:21+01:00;Berit Dießelkämper;;false
0229a944952edefd396f7395bad22aa014ec3094049154f4b75fb30d586a1c92;Beziehung mit Häftling - Gericht bestätigt Entlassung;https://www.zeit.de/news/2026-03/18/beziehung-mit-haeftling-gericht-bestaetigt-entlassung;Hier finden Sie Informationen zu dem Thema „Verhältnis mit Häftling“. Lesen Sie jetzt „Beziehung mit Häftling - Gericht bestätigt Entlassung“.;Verhältnis mit Häftling;News, Verhältnis mit Häftling, Darmstadt, Verwaltungsgericht, Entlassung;2026-03-18T20:18:00+01:00;2026-03-18T20:18:00+01:00;;dpa Hessen;false
4abdedbde3a120d0fb6a5ac7e1df64052bb870dd6d824743ca42772ac2ac059c;Der Appetit auf Appeasement ist ihm vergangen;https://www.zeit.de/politik/deutschland/2026-03/regierungserklaerung-friedrich-merz-donald-trump-usa-iran;Deutlich wie nie geht Friedrich Merz auf Distanz zu Donald Trump und dessen Irankrieg. Warum riskiert der Kanzler das? Dahinter steht ein Vertrauensbruch.;"Z+ (abopflichtiger Inhalt);
        
    Friedrich Merz";Politik, Friedrich Merz, Friedrich Merz, Donald Trump, USA, Iran, Bundesregierung;2026-03-18T20:14:07+01:00;2026-03-18T20:14:07+01:00;Fabian Reinbold;;false
e1710b2a6e1ead8c4e12719c55a657d9e419c9b5e07b6e45ff2c3c2480616c6a;"Hoeneß nennt Titel-Entscheidung im Afrika Cup ""unwürdig""";https://www.zeit.de/news/2026-03/18/hoeness-nennt-titel-entscheidung-im-afrika-cup-unwuerdig;"Hier finden Sie Informationen zu dem Thema „Gerichtsurteil“. Lesen Sie jetzt „Hoeneß nennt Titel-Entscheidung im Afrika Cup ""unwürdig""“.";Gerichtsurteil;News, Gerichtsurteil, Sebastian Hoeneß, Afrika, Senegal, VfB Stuttgart, Gerichtsurteil;2026-03-18T20:13:37+01:00;2026-03-18T20:13:37+01:00;;dpa Baden-Württemberg;false
4c911d963dd65d0def127da40c63fbf1b1c24e74ceed5b223ac943f3df14e1d3;Eintracht-Frauen gewinnen wichtiges Spiel um Platz drei;https://www.zeit.de/news/2026-03/18/eintracht-frauen-gewinnen-wichtiges-spiel-um-platz-drei;Hier finden Sie Informationen zu dem Thema „Fußball“. Lesen Sie jetzt „Eintracht-Frauen gewinnen wichtiges Spiel um Platz drei“.;Fußball;News, Fußball, Eintracht Frankfurt, Bundesliga, Champions League, Fußball, Qualifikationsplatz;2026-03-18T20:12:00+01:00;2026-03-18T20:12:00+01:00;;dpa Hessen;false
443b910a49d1400f88e621965ba020e0987bce287ba7b3f051c302d6d2c70c8d;Nächste Pleite im Abstiegskampf: Jena unterliegt Wolfsburg;https://www.zeit.de/news/2026-03/18/naechste-pleite-im-abstiegskampf-jena-unterliegt-wolfsburg;Hier finden Sie Informationen zu dem Thema „Frauen-Bundesliga“. Lesen Sie jetzt „Nächste Pleite im Abstiegskampf: Jena unterliegt Wolfsburg“.;Frauen-Bundesliga;News, Frauen-Bundesliga, Wolfsburg, Bundesliga, Abstiegskampf;2026-03-18T20:08:32+01:00;2026-03-18T20:08:32+01:00;;dpa Thüringen;false
c46a5a9d0499f77bea1a20f64d029c7d4f226e4e2e4313538af52fb6af8d21d1;18 Stunden, 600 Seiten: Lesemarathon in Leipzig startet;https://www.zeit.de/news/2026-03/18/18-stunden-600-seiten-lesemarathon-in-leipzig-startet;Hier finden Sie Informationen zu dem Thema „Leipziger Buchmesse“. Lesen Sie jetzt „18 Stunden, 600 Seiten: Lesemarathon in Leipzig startet“.;Leipziger Buchmesse;News, Leipziger Buchmesse, Juli Zeh, Leipzig, Leipziger Buchmesse, Lesemarathon;2026-03-18T20:07:52+01:00;2026-03-18T20:07:52+01:00;;dpa Sachsen;false
e87108c1399a421a88e6df7395d4fa668d7c52e7fc971722a7036ceead0abc89;Irans Präsident bestätigt Tötung von Geheimdienstminister Chatib;https://www.zeit.de/politik/ausland/2026-03/israel-angriff-iran-geheimdienstminister-esmail-chatib;Israels Armee hat ein weiteres Mitglied der iranischen Führungsspitze getötet. Der Angriff folgt auf mehrere gezielte Tötungen iranischer Beamte durch Israel.;Israelische Angriffe;Politik, Israelische Angriffe, Iran, Israel, Teheran, Tel Aviv, Ali Chamenei;2026-03-18T20:07:47+01:00;2026-03-18T20:07:47+01:00;yil;DIE ZEIT,        AFP,        							yil;false
29d5c3deb6b408f0ee17dac821f8e075d5cfcea529299b9ffef0b47f9dc40763;60-Jährige stirbt nach Unfall bei Aschaffenburg;https://www.zeit.de/news/2026-03/18/60-jaehrige-stirbt-nach-unfall-bei-aschaffenburg;Hier finden Sie Informationen zu dem Thema „Verkehrsunfall“. Lesen Sie jetzt „60-Jährige stirbt nach Unfall bei Aschaffenburg“.;Verkehrsunfall;News, Verkehrsunfall, Aschaffenburg, Unfall, Verkehrsunfall;2026-03-18T19:51:10+01:00;2026-03-18T19:51:10+01:00;;dpa Bayern;false
b34bd8ba1890f2fb390a75e1547e569b48fe4d7c420226ebfe1c62d2035f5804;Wolf im Brandenburger Jagdrecht - Abschuss leichter möglich;https://www.zeit.de/news/2026-03/18/wolf-im-brandenburger-jagdrecht-abschuss-leichter-moeglich;Hier finden Sie Informationen zu dem Thema „Sonderregelungen“. Lesen Sie jetzt „Wolf im Brandenburger Jagdrecht - Abschuss leichter möglich“.;Sonderregelungen;News, Sonderregelungen, Brandenburg, SPD, CDU, Bündnis Sahra Wagenknecht, Alternative für Deutschland, Jagdrecht, Sonderregelung, Wölfe;2026-03-18T19:49:48+01:00;2026-03-18T19:49:48+01:00;;dpa Berlin/Brandenburg;false
98e67ce237e6578ca1d910d74128a343f0076f42a8a8917c491246ad2477a5b4;Mischung aus Geduld und Torejagd: VfB braucht Sieg in Porto;https://www.zeit.de/news/2026-03/18/mischung-aus-geduld-und-torejagd-vfb-braucht-sieg-in-porto;Hier finden Sie Informationen zu dem Thema „Europa League“. Lesen Sie jetzt „Mischung aus Geduld und Torejagd: VfB braucht Sieg in Porto“.;Europa League;News, Europa League, Deniz Undav, VfB Stuttgart, Deutscher Fußball-Bund, Europa League, Torejagd, Geduld, Mischung, Endspiel, Finale;2026-03-18T19:35:26+01:00;2026-03-18T19:35:26+01:00;;dpa Baden-Württemberg;false
79446d7330d0b4938379d99d4181e42c851a213cac524d0b8570395caf1844c8;"""Crimenetwork""-Betreiber verurteilt - Sieben Jahre Haft";https://www.zeit.de/news/2026-03/18/crimenetwork-betreiber-verurteilt-sieben-jahre-haft;"Hier finden Sie Informationen zu dem Thema „Drogenhandel“. Lesen Sie jetzt „""Crimenetwork""-Betreiber verurteilt - Sieben Jahre Haft“.";Drogenhandel;News, Drogenhandel, Crimenetwork, Drogenhandel, Internetplattform, Drogen;2026-03-18T19:32:52+01:00;2026-03-18T19:32:52+01:00;;dpa Hessen;false
602d86e77373570148ec1fdb8310a4d8b64a5a7b458caeb57b7838d2724f6c79;Krankenstuhlfahrer gerät in Straßengraben und stirbt;https://www.zeit.de/news/2026-03/18/krankenstuhlfahrer-geraet-in-strassengraben-und-stirbt;Hier finden Sie Informationen zu dem Thema „Wadersloh (Kreis Warendorf)“. Lesen Sie jetzt „Krankenstuhlfahrer gerät in Straßengraben und stirbt“.;Wadersloh (Kreis Warendorf);News, Wadersloh (Kreis Warendorf), Wadersloh, Warendorf, Straßengraben;2026-03-18T19:29:51+01:00;2026-03-18T19:29:51+01:00;;dpa Nordrhein-Westfalen;false
f4df802376969d792fcb9778919b628a1ee66b9f52dd89ff499ddeabe0275e14;Taktiker des Terrors;https://www.zeit.de/zeit-geschichte/2026/01/jassir-arafat-palaestina-plo-vereinte-nationen;Ölzweig in der einen, Pistole in der anderen Hand: Jassir Arafat machte aus Gewalt und Diplomatie eine Strategie. Damit brachte er die Palästinafrage bis in die UN.;"Z+ (abopflichtiger Inhalt);
        
    Jassir Arafat";Wissen, Jassir Arafat, Jassir Arafat, PLO, Israel, UN, Palästinensergebiet, Jordanien, Nahost;2026-03-18T19:29:00+01:00;2026-03-18T19:29:00+01:00;Lutz Kreller;Aus        ZEIT Geschichte Nr. 01/2026;false
f5eaa878a6a283e00eff46d5d136d3b86f3f605c6d128504f65d5c695673a2ed;Bremens Haushalt steht, doch das Geld ist knapp;https://www.zeit.de/news/2026-03/18/bremens-haushalt-steht-doch-das-geld-ist-knapp;Hier finden Sie Informationen zu dem Thema „Landesregierung“. Lesen Sie jetzt „Bremens Haushalt steht, doch das Geld ist knapp“.;Landesregierung;News, Landesregierung, Bremen, Bremische Bürgerschaft, Polizei, CDU, Haushalt, Landesregierung, Doppelhaushalt, Geld, Sicherheit;2026-03-18T19:16:19+01:00;2026-03-18T19:16:19+01:00;;dpa Niedersachsen;false
d26cc8ce29c4587952a56a017d6b2de25f692b5a8714c24f0e363f8f55a4bc5f;Auto bleibt auf Autobahn plötzlich stehen - Unfall;https://www.zeit.de/news/2026-03/18/auto-bleibt-auf-autobahn-ploetzlich-stehen-unfall;Hier finden Sie Informationen zu dem Thema „Verkehrsunfall“. Lesen Sie jetzt „Auto bleibt auf Autobahn plötzlich stehen - Unfall“.;Verkehrsunfall;News, Verkehrsunfall, München, Unfall, Verkehrsunfall, Autobahn, Auto, Fahrzeug;2026-03-18T19:14:59+01:00;2026-03-18T19:14:59+01:00;;dpa Bayern;false
4102a2c02a9e8f6651fd30a1c39ebd04035212bfdee87517431ed82d86cb86f3;Meningitis-Ausbruch in Kent: Auch Fall in Frankreich;https://www.zeit.de/news/2026-03/18/meningitis-ausbruch-in-kent-auch-fall-in-frankreich;Hier finden Sie Informationen zu dem Thema „Krankheiten“. Lesen Sie jetzt „Meningitis-Ausbruch in Kent: Auch Fall in Frankreich“.;Krankheiten;News, Krankheiten, Kent, Frankreich, Großbritannien, Canterbury;2026-03-18T19:14:38+01:00;2026-03-18T19:14:38+01:00;;dpa;false
1ca50a5351b813e1b3e5589bbb39a40cc9a9951f6a450ceec6b518d8493f9066;US-Notenbank Fed lässt Leitzins unverändert;https://www.zeit.de/wirtschaft/2026-03/leitzins-usa-federal-reserve-fed-krieg-iran;Seit dem Krieg im Iran ist die wirtschaftliche Unsicherheit groß. Daher hat die Fed erneut entschieden, den Leitzins vorerst nicht zu verändern.;Leitzins in den USA;Wirtschaft, Leitzins in den USA, Donald Trump, USA, Iran, Washington, Fed, Leitzins;2026-03-18T19:13:41+01:00;2026-03-18T19:13:41+01:00;akm;DIE ZEIT,        Reuters,        dpa,        							akm;false
39f334be830ada12251ced0140e723f5ba26de47327fd332dd17fcb8c76259c6;Saar-Landtag uneins über Benzinpreise;https://www.zeit.de/news/2026-03/18/saar-landtag-uneins-ueber-benzinpreise;Hier finden Sie Informationen zu dem Thema „Landtag“. Lesen Sie jetzt „Saar-Landtag uneins über Benzinpreise“.;Landtag;News, Landtag, SPD, CDU, Landtag, Übergewinn, Spritpreis;2026-03-18T19:08:50+01:00;2026-03-18T19:08:50+01:00;;dpa Rheinland-Pfalz/Saarland;false
92675be56ac71ab82239d661cf70ce4671f50b98139c98c68459dbb6afa84ee6;Reichinnek auf Distanz zu umstrittenen Linken-Beschluss;https://www.zeit.de/news/2026-03/18/reichinnek-auf-distanz-zu-umstrittenen-linken-beschluss;Hier finden Sie Informationen zu dem Thema „Antisemitismus-Vorwurf“. Lesen Sie jetzt „Reichinnek auf Distanz zu umstrittenen Linken-Beschluss“.;Antisemitismus-Vorwurf;News, Antisemitismus-Vorwurf, Heidi Reichinnek, Israel, Niedersachsen, Palästinensergebiet, Zionismus, Antisemitismus, Kritik;2026-03-18T19:07:25+01:00;2026-03-18T19:07:25+01:00;;dpa Niedersachsen;false
dba8cb4ba6bd146c9d281b907a080c93d64d82092b3c8401d91f7b1f97926ea0;Mehrere Hundert Menschen protestieren vor Buchmesse-Festakt;https://www.zeit.de/news/2026-03/18/mehrere-hundert-menschen-protestieren-vor-buchmesse-festakt;Hier finden Sie Informationen zu dem Thema „Leipziger Buchmesse“. Lesen Sie jetzt „Mehrere Hundert Menschen protestieren vor Buchmesse-Festakt“.;Leipziger Buchmesse;News, Leipziger Buchmesse, Wolfram Weimer, Leipzig, Bundesregierung, Leipziger Buchmesse;2026-03-18T19:06:44+01:00;2026-03-18T19:06:44+01:00;;dpa Sachsen;false
3a06c3ae8e20f8850273153f8649368632211f1edd3ddf4819d34cfc03cfe09b;"Merz zum Iran-Krieg: ""Wir hätten abgeraten""";https://www.zeit.de/news/2026-03/18/merz-zum-iran-krieg-wir-haetten-abgeraten;"Hier finden Sie Informationen zu dem Thema „Regierungserklärung“. Lesen Sie jetzt „Merz zum Iran-Krieg: ""Wir hätten abgeraten""“.";Regierungserklärung;News, Regierungserklärung, Friedrich Merz, Brüssel, USA, Iran, Washington, Europa, Straße von Hormus, CDU, Deutscher Bundestag, Europäische Union;2026-03-18T19:05:08+01:00;2026-03-18T19:05:08+01:00;;dpa;false
549cb0aea18081618be230a248440cd15d11546c75105519998d930516aa9da2;Hessens Kommunen sollen einfacher Aufträge vergeben können;https://www.zeit.de/news/2026-03/18/hessens-kommunen-sollen-einfacher-auftraege-vergeben-koennen;Hier finden Sie Informationen zu dem Thema „Vergaberecht“. Lesen Sie jetzt „Hessens Kommunen sollen einfacher Aufträge vergeben können“.;Vergaberecht;News, Vergaberecht, Hessen, Wiesbadener Landtag, SPD, Vergaberecht, Kommune;2026-03-18T19:03:26+01:00;2026-03-18T19:03:26+01:00;;dpa Hessen;false
772d66f491552785e5744374fadd8f50fe3265a663c7839c3445e97fa6b22d9d;"Prien empört über ""Ignoranz"" der Linken in Niedersachsen";https://www.zeit.de/news/2026-03/18/prien-empoert-ueber-ignoranz-der-linken-in-niedersachsen;"Hier finden Sie Informationen zu dem Thema „Umgang mit Israel und Juden“. Lesen Sie jetzt „Prien empört über ""Ignoranz"" der Linken in Niedersachsen“.";Umgang mit Israel und Juden;News, Umgang mit Israel und Juden, Karin Prien, Bettina Stark-Watzinger, Israel, Berlin, Niedersachsen, Hamas, CDU, Ignoranz, Zionismus, Kritik;2026-03-18T19:03:04+01:00;2026-03-18T19:03:04+01:00;;dpa Niedersachsen;false
3bcbc893f9c8d1cb3082788d92c54da49ed8f51a412c4da0f37dc22c3ea1addd;US-Notenbank lässt Leitzins unangetastet;https://www.zeit.de/news/2026-03/18/us-notenbank-laesst-leitzins-unangetastet;Hier finden Sie Informationen zu dem Thema „Konjunktur“. Lesen Sie jetzt „US-Notenbank lässt Leitzins unangetastet“.;Konjunktur;News, Konjunktur, Fed, Leitzins, Zinsspanne;2026-03-18T19:01:52+01:00;2026-03-18T19:01:52+01:00;;dpa;false
729be73864203d7e8879250f03f87e64883c4d0844c08a7958c315c001afc461;"""KI wird noch disruptiver als die industrielle Revolution""";https://www.zeit.de/politik/ausland/2026-03/walter-russell-mead-kuenstliche-intelligenz-gesellschaft-big-tech;Das Silicon Valley verbündet sich mit Trump, um die KI-Revolution voranzutreiben, sagt der US-Historiker Walter Russel Mead. Wie gefährlich ist das, gerade für Europa?;Walter Russell Mead;Politik, Walter Russell Mead, künstliche Intelligenz, Computer, Software, Donald Trump, Silicon Valley, USA;2026-03-18T18:54:14+01:00;2026-03-18T18:54:14+01:00;Marcus GatzkeUwe Jean Heuser;;false
96d3539b36454f35c0dc0307e935a2be00003bc7fdfad984b3b5575219dbfe38;Angriffe auf weltweit größtes Gasfeld im Iran, Ölpreis steigt;https://www.zeit.de/politik/ausland/2026-03/iran-angriffe-israel-oel-gas;Israel hat nach iranischen Angaben das Gasfeld South Pars angegriffen. Entstandene Brände an der Anlage sind offenbar unter Kontrolle. Der Ölpreis zog umgehend an.;Irankrieg;Politik, Irankrieg, Gaspreis, Ölpreis, Iran, Israel, Militär;2026-03-18T18:53:11+01:00;2026-03-18T18:53:11+01:00;kzi;DIE ZEIT,        dpa,        AFP,        							kzi;false
9114023fadb64862f52af8b002cfdbfa04964ab2b0895ef4586ffda17e1ce42e;Eine Frage der Weltanschuhung;https://www.zeit.de/feuilleton/2026-03/donald-trumps-schuhe-florsheim-usa;Donald Trump versorgt seine Minister mit Schuhen, und die ziehen sich den Schuh auch noch an. Doch was aussieht wie ein Hofstaat, ist bei Trump immer auch: ein Geschäft.;"Z+ (abopflichtiger Inhalt);
        
    Donald Trumps Schuhe";Feuilleton, Donald Trumps Schuhe, Donald Trump, USA, US-Regierung, Monarchie, Marco Rubio, Mode;2026-03-18T18:51:21+01:00;2026-03-18T18:51:21+01:00;David Will;;false
4b77b6bd5c2565978d18f1d61b79e844084447468ee4b1c96dc4948c859562c9;Bilder des Tages;https://www.zeit.de/news/2026-03/18/bilder-des-tages;Hier finden Sie Informationen zu dem Thema „Fotografie“. Lesen Sie jetzt „Bilder des Tages“.;Fotografie;News, Fotografie, News;2026-03-18T18:50:44+01:00;2026-03-18T18:50:44+01:00;;dpa;false
37bdff4c38c35383f9cc4fe58c04436eb7bd6ca0dc9beb09e62014abb6463fc6;Tödliche Schüsse in Bremen - Polizei bittet um Hinweise;https://www.zeit.de/news/2026-03/18/grosseinsatz-der-polizei-in-bremer-neustadt;Hier finden Sie Informationen zu dem Thema „Schüsse in Bremer Neustadt“. Lesen Sie jetzt „Tödliche Schüsse in Bremen - Polizei bittet um Hinweise“.;Schüsse in Bremer Neustadt;News, Schüsse in Bremer Neustadt, Polizei, Großeinsatz;2026-03-18T18:47:14+01:00;2026-03-18T18:47:14+01:00;;dpa Niedersachsen;false
6dab7bdc195696c90b7214646e6355978111dc9974c1ec89c758c178ab979995;26 sicherheitsrelevante Vorfälle in Kernkraftwerk Brokdorf;https://www.zeit.de/news/2026-03/18/26-sicherheitsrelevante-vorfaelle-in-kernkraftwerk-brokdorf;Hier finden Sie Informationen zu dem Thema „Kleine Anfrage der Grünen“. Lesen Sie jetzt „26 sicherheitsrelevante Vorfälle in Kernkraftwerk Brokdorf“.;Kleine Anfrage der Grünen;News, Kleine Anfrage der Grünen, Kreis Dithmarschen, Kernkraftwerk Brokdorf, PreussenElektra, Kernkraftwerk;2026-03-18T18:45:08+01:00;2026-03-18T18:45:08+01:00;;dpa Hamburg/Schleswig-Holstein;false
b5b7a26a52044ede04843b2b5aea9d3ea4080358d723b809a4434a8d41a69bce;Anna Mayr entdeckt ihren Verbraucher-Trotz;https://www.zeit.de/2026/12/ameisenkoeder-eu-regeln-verbraucher-schadstoffe;In Berlin ist es leichter, an harte Drogen zu kommen als an einen Ameisenköder. Und das ist nicht mal der größte Widerspruch, stellt unsere Autorin fest.;"Z+ (abopflichtiger Inhalt);
        
    Ameisenköder";Entdecken, Ameisenköder, Insekt, Berlin, Europäische Union, Pestizid, Verbraucherschutz, Umweltschutz;2026-03-18T18:38:47+01:00;2026-03-18T18:38:47+01:00;Anna Mayr;Aus der        ZEIT Nr. 12/2026;false
7d77035777f28fc4f621797a4704dc5b6459266490d6be375e897b7e7017b6ad;Privatisierung? Streit um das Staatsweingut Kloster Eberbach;https://www.zeit.de/news/2026-03/18/privatisierung-streit-um-das-staatsweingut-kloster-eberbach;Hier finden Sie Informationen zu dem Thema „Weinbau“. Lesen Sie jetzt „Privatisierung? Streit um das Staatsweingut Kloster Eberbach“.;Weinbau;News, Weinbau, Frank Grobe, Eberbach, Rheingau, Hessen, Wiesbadener Landtag, Alternative für Deutschland, Staatsweingut, Privatisierung, Weinbau, Weingut;2026-03-18T18:32:22+01:00;2026-03-18T18:32:22+01:00;;dpa Hessen;false
6b2a3384cbce5af26d5022a995a6f8fa0954dd0b4593310fed30d7c9628e865e;"""Chronischer Schmerz verändert ganze Familien""";https://www.zeit.de/2026/13/chronischer-schmerz-krankheit-schmerztherapie-versorgung-krankenhausreform;Zermürbende Schmerzen. Kein Mittel hilft. Kein Arzt weiß Rat. So geht es vielen Menschen mit chronischen Schmerzen. Warum man diese anders behandeln muss.;"Z+ (abopflichtiger Inhalt);
        
    Chronischer Schmerz";Gesundheit, Chronischer Schmerz, Schmerz, Medizin, Gesundheitssystem, Gesundheitspolitik, Reform, Gesundheitsrisiko;2026-03-18T18:31:32+01:00;2026-03-18T18:31:32+01:00;Hanna Grabbe;Aus der        ZEIT Nr. 13/2026;false
373968c90ed954edfb53c354bcbe7f973f9415ba5bc3f22a3b94a7b36dec0240;Verdi fordert sieben Prozent mehr im Hamburger Einzelhandel;https://www.zeit.de/news/2026-03/18/verdi-fordert-sieben-prozent-mehr-im-hamburger-einzelhandel;Hier finden Sie Informationen zu dem Thema „Tarife“. Lesen Sie jetzt „Verdi fordert sieben Prozent mehr im Hamburger Einzelhandel“.;Tarife;News, Tarife, Hamburg, Ver.di, Einzelhandel, Geld;2026-03-18T18:31:18+01:00;2026-03-18T18:31:18+01:00;;dpa Hamburg/Schleswig-Holstein;false
f94c24c2214a59caa37b113cf5db6edadd91830961650d6b74e415e1e5446d7c;DLRG fordert Sicherstellung der Schwimmausbildung;https://www.zeit.de/news/2026-03/18/dlrg-fordert-sicherstellung-der-schwimmausbildung;Hier finden Sie Informationen zu dem Thema „Schwimmen“. Lesen Sie jetzt „DLRG fordert Sicherstellung der Schwimmausbildung“.;Schwimmen;News, Schwimmen, Schleswig-Holstein, DLRG, Schwimmausbildung, Sicherstellung, Daseinsfürsorge, schwimmen;2026-03-18T18:30:04+01:00;2026-03-18T18:30:04+01:00;;dpa Hamburg/Schleswig-Holstein;false
6cee385d22168160179acadd01f0af19ffaef5d356f7265105b069c589273943;Familie von Thomas Anders heißt jetzt anders;https://www.zeit.de/news/2026-03/18/familie-von-thomas-anders-heisst-jetzt-anders;Hier finden Sie Informationen zu dem Thema „Namensänderung“. Lesen Sie jetzt „Familie von Thomas Anders heißt jetzt anders“.;Namensänderung;News, Namensänderung, Thomas Anders, Claudia Anders, Namensänderung, Familie;2026-03-18T18:24:59+01:00;2026-03-18T18:24:59+01:00;;dpa Rheinland-Pfalz/Saarland;false
1f5d2d38ab484b85f59789979cfa6aacd10544bdaa171caa51c5789eae8d146e;Mordversuch an Tochter: Acht Jahre Haft für Vater;https://www.zeit.de/news/2026-03/18/plaedoyers-in-prozess-um-mordversuch-an-tochter;Hier finden Sie Informationen zu dem Thema „Gerichtsverfahren“. Lesen Sie jetzt „Mordversuch an Tochter: Acht Jahre Haft für Vater“.;Gerichtsverfahren;News, Gerichtsverfahren, Landshut, Staatsanwaltschaft, Google Inc., Mordversuch, Plädoyer, Gerichtsverfahren, Unterhaltszahlung;2026-03-18T18:18:49+01:00;2026-03-18T18:18:49+01:00;;dpa Bayern;false
44660e9831e915e0cafa2cd0e22b6b99661346ebdb8d8d32d0ef07c114b10060;Nach Schalke-Einspruch: DFB verhandelt über Dzeko-Sperre;https://www.zeit.de/news/2026-03/18/nach-schalke-einspruch-dfb-verhandelt-ueber-dzeko-sperre;Hier finden Sie Informationen zu dem Thema „2. Fußball-Bundesliga“. Lesen Sie jetzt „Nach Schalke-Einspruch: DFB verhandelt über Dzeko-Sperre“.;2. Fußball-Bundesliga;News, 2. Fußball-Bundesliga, Edin Dzeko, Schalke, Deutscher Fußball-Bund, FC Schalke 04, Fußball-Bundesliga, Sportgericht;2026-03-18T18:13:34+01:00;2026-03-18T18:13:34+01:00;;dpa Nordrhein-Westfalen;false
66759f1217f67e3b8a7a02d34f4273756e5e3bc0dde95e91b56ec63fa81f65cf;Ex-Bundestagsabgeordneter wegen Kindesmissbrauchs verurteilt;https://www.zeit.de/news/2026-03/18/ex-bundestagsabgeordneter-wegen-kindesmissbrauchs-verurteilt;Hier finden Sie Informationen zu dem Thema „Prozess in Braunschweig“. Lesen Sie jetzt „Ex-Bundestagsabgeordneter wegen Kindesmissbrauchs verurteilt“.;Prozess in Braunschweig;News, Prozess in Braunschweig, Kindesmissbrauch, Kriminalität, Bundestagsabgeordnete;2026-03-18T18:12:32+01:00;2026-03-18T18:12:32+01:00;;dpa;false
950ad037d70dfa83ffb506ea4263c8b85d75621e9bdcbdb5e2095bcde3a3d338;Landtag beschließt neue Beteiligung an Erneuerbaren;https://www.zeit.de/news/2026-03/18/landtag-beschliesst-neue-beteiligung-an-erneuerbaren;Hier finden Sie Informationen zu dem Thema „Erneuerbare Energien“. Lesen Sie jetzt „Landtag beschließt neue Beteiligung an Erneuerbaren“.;Erneuerbare Energien;News, Erneuerbare Energien, Mecklenburg-Vorpommern, Landtag, Entschädigungsregel, Solaranlage, Gemeindebeteiligungsgesetz, Erneuerbare Energien;2026-03-18T18:11:15+01:00;2026-03-18T18:11:15+01:00;;dpa Mecklenburg-Vorpommern;false
