Hash;Title;Link;Description;Category;KeyWords;Published;LastUpdated;Author;Source;Paywall
becd94a4c30a6e2e8e47f91f3c4289cbbfdf91f510dc6dc0a2a875160943c2d1;Die New Yorker High Line wird 15 Jahre alt;https://www.zeit.de/news/2024-06/08/die-new-yorker-high-line-wird-15-jahre-alt;Hier finden Sie Informationen zu dem Thema „Erfolgsprojekt“. Lesen Sie jetzt „Die New Yorker High Line wird 15 Jahre alt“.;"Z+ (abopflichtiger Inhalt);
        
    
Erfolgsprojekt";News, Erfolgsprojekt, Joshua David, Robert Hammond, New York, Empire State Building, Treffen, Erfolgsprojekt, Hochbahntrasse, Erfolg;2024-06-08T11:38:19+02:00;2024-06-08T11:38:19+02:00;;dpa;false
5b75d77aef9245ea7437e35229c9dc3392bb96595d97adcac08d0c1b5241b25e;Hansa Rostock verpflichtet Benjamin Uphoff als Torhüter;https://www.zeit.de/news/2024-06/08/hansa-rostock-verpflichtet-benjamin-uphoff-als-torhueter;Hier finden Sie Informationen zu dem Thema „3. Liga“. Lesen Sie jetzt „Hansa Rostock verpflichtet Benjamin Uphoff als Torhüter“.;"Z+ (abopflichtiger Inhalt);
        
    
3. Liga";News, 3. Liga, Benjamin Uphoff, Freiburg, Hansa Rostock, Neuverpflichtung;2024-06-08T11:37:03+02:00;2024-06-08T11:37:03+02:00;;dpa Mecklenburg-Vorpommern;false
8b55d7c036ac77f73793532d633986b6b9171d2f67cd617cc0d69306fecbcbc9;Ortega Moreno verlängert vorzeitig bei Manchester City;https://www.zeit.de/news/2024-06/08/ortega-moreno-verlaengert-vorzeitig-bei-manchester-city;Hier finden Sie Informationen zu dem Thema „Fußball“. Lesen Sie jetzt „Ortega Moreno verlängert vorzeitig bei Manchester City“.;"Z+ (abopflichtiger Inhalt);
        
    
Fußball";News, Fußball, Stefan Ortega, Moreno, Manchester, Manchester City, Premier League, Fußball;2024-06-08T11:35:57+02:00;2024-06-08T11:35:57+02:00;;dpa Nordrhein-Westfalen;false
e7b21ea5eb4294e86f4f026cf97b71a59eb40a1c3dc7e2378d6ab088fe9ee2ef;Flugzeug mit 190 Passagieren kehrt um;https://www.zeit.de/news/2024-06/08/flugzeug-mit-190-passagieren-kehrt-um;Hier finden Sie Informationen zu dem Thema „Vogel im Triebwerk “. Lesen Sie jetzt „Flugzeug mit 190 Passagieren kehrt um“.;"Z+ (abopflichtiger Inhalt);
        
    
Vogel im Triebwerk";News, Vogel im Triebwerk , Flugzeug, Passagiermaschine;2024-06-08T11:34:40+02:00;2024-06-08T11:34:40+02:00;;dpa Nordrhein-Westfalen;false
9bd997a4f727236e8491615e8b61c14dbec3bd9891f3683771d4cea63abe836c;A7 und Elbtunnel in Hamburg voll gesperrt;https://www.zeit.de/news/2024-06/08/a7-und-elbtunnel-in-hamburg-voll-gesperrt;Hier finden Sie Informationen zu dem Thema „Brückenabriss“. Lesen Sie jetzt „A7 und Elbtunnel in Hamburg voll gesperrt“.;"Z+ (abopflichtiger Inhalt);
        
    
Brückenabriss";News, Brückenabriss, Hamburg, Heimfeld, Elbtunnel, Brückenabriss, Lärmschutzdeckel;2024-06-08T11:32:34+02:00;2024-06-08T11:32:34+02:00;;dpa Hamburg/Schleswig-Holstein;false
2d5feb0ee06cad9f21815672908b8c55a56d37a7835c1e61ea7c111f244d7055;Autofahrerin fährt sich auf Schotterhügel auf Baustelle fest;https://www.zeit.de/news/2024-06/08/autofahrerin-faehrt-sich-auf-schotterhuegel-auf-baustelle-fest;Hier finden Sie Informationen zu dem Thema „Kreis Göppingen“. Lesen Sie jetzt „Autofahrerin fährt sich auf Schotterhügel auf Baustelle fest“.;"Z+ (abopflichtiger Inhalt);
        
    
Kreis Göppingen";News, Kreis Göppingen, Göppingen, Polizei, Schotterhügel, Baustelle, Einsatzfahrzeug, Blaulicht, Auto;2024-06-08T11:31:44+02:00;2024-06-08T11:31:44+02:00;;dpa Baden-Württemberg;false
91abad50ded2e59a193f030a82037e7c97766976886f911ac7fd4691cf70158f;Jugendliche verprügeln 18-Jährigen und beleidigen Polizisten;https://www.zeit.de/news/2024-06/08/jugendliche-verpruegeln-18-jaehrigen-und-beleidigen-polizisten;Hier finden Sie Informationen zu dem Thema „Kreis Bautzen“. Lesen Sie jetzt „Jugendliche verprügeln 18-Jährigen und beleidigen Polizisten“.;"Z+ (abopflichtiger Inhalt);
        
    
Kreis Bautzen";News, Kreis Bautzen, Bautzen, Polizei, Blaulicht;2024-06-08T11:27:51+02:00;2024-06-08T11:27:51+02:00;;dpa Sachsen;false
4003c8cc344b92857ed95bd041cf56f3a899ca23cb88977cad6996a6f7b2ea92;"""Und jetzt das Wetter fürs Jahr 2050""";https://www.zeit.de/2024/25/klimawandel-wetter-hitzewelle-duerre-extremwetter;Deon ist zehn Jahre alt und lebt in Albanien. Eine besondere Vorhersage machte ihn dort zu einem Star. Nun soll er UN-Botschafter für den Klimaschutz werden.;"Z+ (abopflichtiger Inhalt);
        
    
Klimawandel";Gesellschaft, Klimawandel, Albanien, Tirana, UN, Klimawandel, Wetter, Hitze;2024-06-08T11:27:43+02:00;2024-06-08T11:27:43+02:00;Anna-Elisa Jakob;Aus der        ZEIT Nr. 25/2024;false
43ee9a439fc9b21570fc1372de9c4f75bd0944be1246b835e59d20aec1263807;Plötzlich ein Loch im Kinderherz – weil ein Teil für ein paar Euro fehlt;https://www.zeit.de/2024/25/mangel-medizinprodukte-kinder-katheter-eu-regelung;Neue EU-Vorschriften führen dazu, dass lebensrettende Medizinprodukte vor allem für Babys vom Markt verschwinden. Mediziner berichten von einer Katastrophe in Zeitlupe.;"Z+ (abopflichtiger Inhalt);
        
    
Mangel an Medizinprodukten";Wirtschaft, Mangel an Medizinprodukten, Medizintechnik, Gesundheitswesen, Kinder, Europäische Union, DDR, EU-Kommission;2024-06-08T11:25:15+02:00;2024-06-08T11:25:15+02:00;Marc Widmann;Aus der        ZEIT Nr. 25/2024;false
f28506028e87b8164c6ecc7413389f231b0c3f6f7fc015c587997bd88fff84bb;Koalitionsvertrag: Lindner pocht bei SPD auf Vereinbarungen;https://www.zeit.de/news/2024-06/08/koalitionsvertrag-lindner-pocht-bei-spd-auf-vereinbarungen;Hier finden Sie Informationen zu dem Thema „Haushalt“. Lesen Sie jetzt „Koalitionsvertrag: Lindner pocht bei SPD auf Vereinbarungen“.;"Z+ (abopflichtiger Inhalt);
        
    
Haushalt";News, Haushalt, Lars Klingbeil, Christian Lindner, FDP, SPD, Schuldenbremse, Haushalt, Steuererhöhung, Aufweichung, Koalitionsvertrag;2024-06-08T11:18:08+02:00;2024-06-08T11:18:08+02:00;;dpa;false
a03d8b89f5b434e2cf4372a15773f1cdee102d1469997e1237b4b2b04349337e;Mützenich kontra Habeck: Lieferkettengesetz nicht aussetzen;https://www.zeit.de/news/2024-06/08/muetzenich-kontra-habeck-lieferkettengesetz-nicht-aussetzen;Hier finden Sie Informationen zu dem Thema „Unternehmen“. Lesen Sie jetzt „Mützenich kontra Habeck: Lieferkettengesetz nicht aussetzen“.;"Z+ (abopflichtiger Inhalt);
        
    
Unternehmen";News, Unternehmen, Robert Habeck, Berlin, Mützenich, SPD, EU, Lieferkettengesetz, Menschenrechte;2024-06-08T11:15:39+02:00;2024-06-08T11:15:39+02:00;;dpa;false
6666e5c00fea07e1297dff4942f59a0d88553d419d6e1d7dafe616db9b7c6865;Lkw-Fahrer wird auf A9 angefahren und schwer verletzt;https://www.zeit.de/news/2024-06/08/lkw-fahrer-wird-auf-a9-angefahren-und-schwer-verletzt;Hier finden Sie Informationen zu dem Thema „Saale-Holzland-Kreis“. Lesen Sie jetzt „Lkw-Fahrer wird auf A9 angefahren und schwer verletzt“.;"Z+ (abopflichtiger Inhalt);
        
    
Saale-Holzland-Kreis";News, Saale-Holzland-Kreis, Fahrzeug;2024-06-08T11:13:09+02:00;2024-06-08T11:13:09+02:00;;dpa Thüringen;false
513a1c772348dada9eb2280844d1c2b80a5c146d009c5670af08e7c099c38785;Gruppe von Jugendlichen schlägt auf 19-Jährigen ein;https://www.zeit.de/news/2024-06/08/gruppe-von-jugendlichen-schlaegt-auf-19-jaehrigen-ein;Hier finden Sie Informationen zu dem Thema „Stuttgart“. Lesen Sie jetzt „Gruppe von Jugendlichen schlägt auf 19-Jährigen ein“.;"Z+ (abopflichtiger Inhalt);
        
    
Stuttgart";News, Stuttgart, Stuttgart, Polizei, Blaulicht, Polizeifahrzeug;2024-06-08T11:11:16+02:00;2024-06-08T11:11:16+02:00;;dpa Baden-Württemberg;false
07ac7b0e96cb9a86bf3f464f3108c58eb3012a349c8dda3cb513052115e6d816;"Astronaut und ""Earthrise""-Fotograf Anders gestorben";https://www.zeit.de/news/2024-06/08/vom-mond-aus-die-erde-entdeckt-earthrise-fotograf-ist-tot;"Hier finden Sie Informationen zu dem Thema „Raumfahrt“. Lesen Sie jetzt „Astronaut und ""Earthrise""-Fotograf Anders gestorben“.";"Z+ (abopflichtiger Inhalt);
        
    
Raumfahrt";News, Raumfahrt, William Anders, Frank Borman, Seattle, NASA, Hasselblad, Gott, Kamera;2024-06-08T11:09:14+02:00;2024-06-08T11:09:14+02:00;;dpa;false
266d5119840b30f153ae882a5630d68663a3ca897e2e9b381d7daeaf2d157f18;Bitte entfernen;https://www.zeit.de/2024/25/hassrede-x-twitter-meinung-klage-berlin-soziale-medien;"""Das wird man wohl noch sagen dürfen?"" Leider. Auf X, früher Twitter, wird sogar übelste Hassrede geduldet. Mit einer Klage wollen Aktivisten das ändern.";"Z+ (abopflichtiger Inhalt);
        
    
Hassrede auf X";Digital, Hassrede auf X, Twitter, Meinungsfreiheit, Elon Musk, Facebook, TikTok, Polizei, Europa;2024-06-08T11:06:07+02:00;2024-06-08T11:06:07+02:00;Eva Ricarda Lautsch;Aus der        ZEIT Nr. 25/2024;false
68e6dae114cfd4d3dd9d4a4630e90d684e9848a68a93ec176fbfd4b39b8b351d;AfD-Büro mit Hakenkreuzen beschmiert;https://www.zeit.de/news/2024-06/08/afd-buero-mit-hakenkreuzen-beschmiert;Hier finden Sie Informationen zu dem Thema „Staatsschutz ermittelt“. Lesen Sie jetzt „AfD-Büro mit Hakenkreuzen beschmiert“.;"Z+ (abopflichtiger Inhalt);
        
    
Staatsschutz ermittelt";News, Staatsschutz ermittelt, Alternative für Deutschland, Polizei, Hakenkreuz, Staatsschutz, Motorhaube, Streifenwagen;2024-06-08T11:02:29+02:00;2024-06-08T11:02:29+02:00;;dpa Sachsen;false
6fa1c7e91c2c4b062859c784824ee34c1b5cf8b2d01a34b0fc4f7f3c3a1c7b42;Kellerbrand in Berlin-Mitte;https://www.zeit.de/news/2024-06/08/kellerbrand-in-berlin-mitte;Hier finden Sie Informationen zu dem Thema „Feuerwehreinsatz“. Lesen Sie jetzt „Kellerbrand in Berlin-Mitte“.;"Z+ (abopflichtiger Inhalt);
        
    
Feuerwehreinsatz";News, Feuerwehreinsatz, Berlin-Mitte, Feuerwehr, Kellerbrand, Feuerwehreinsatz, Blaulicht, Einsatzort, Fahrzeug;2024-06-08T11:01:38+02:00;2024-06-08T11:01:38+02:00;;dpa Berlin/Brandenburg;false
323a48f007a821cae0f9a5412df5f9417840b705f0681e11d7adf5e74923933b;Wechselhaftes Wetter in Rheinland-Pfalz und im Saarland;https://www.zeit.de/news/2024-06/08/wechselhaftes-wetter-in-rheinland-pfalz-und-im-saarland;Hier finden Sie Informationen zu dem Thema „Vorhersage“. Lesen Sie jetzt „Wechselhaftes Wetter in Rheinland-Pfalz und im Saarland“.;"Z+ (abopflichtiger Inhalt);
        
    
Vorhersage";News, Vorhersage, Saarland, Rheinland-Pfalz, Eifel, Vorhersage, Wetter;2024-06-08T11:01:36+02:00;2024-06-08T11:01:36+02:00;;dpa Rheinland-Pfalz/Saarland;false
b17142f1b2414865ed8d602c318dfdc447b958169329a8c75e4c6247c16b88b8;Pedelecfahrer angefahren und lebensgefährlich verletzt;https://www.zeit.de/news/2024-06/08/pedelecfahrer-angefahren-und-lebensgefaehrlich-verletzt;Hier finden Sie Informationen zu dem Thema „Region Hannover“. Lesen Sie jetzt „Pedelecfahrer angefahren und lebensgefährlich verletzt“.;"Z+ (abopflichtiger Inhalt);
        
    
Region Hannover";News, Region Hannover, Hannover, Polizei, Einsatzfahrt, Rettungswagen;2024-06-08T11:00:22+02:00;2024-06-08T11:00:22+02:00;;dpa Niedersachsen;false
428eda08919f8343c1ac304555b6d38b59170e4744936d034a27676941b6155b;Mann wird bei Betriebsunfall in Schwaben schwer verletzt;https://www.zeit.de/news/2024-06/08/mann-wird-bei-betriebsunfall-in-schwaben-schwer-verletzt;Hier finden Sie Informationen zu dem Thema „Kreis Donau-Ries“. Lesen Sie jetzt „Mann wird bei Betriebsunfall in Schwaben schwer verletzt“.;"Z+ (abopflichtiger Inhalt);
        
    
Kreis Donau-Ries";News, Kreis Donau-Ries, Donau-Ries, Betriebsunfall, Rettungshubschrauber;2024-06-08T11:00:17+02:00;2024-06-08T11:00:17+02:00;;dpa Bayern;false
81fbbb9fcc5a5e43d61623d6cb1adbc9d3b28ad4e79af795a97cc7669b7e0c38;Brand in einer Scheune bei Demmin erfasst auch Wohnhaus;https://www.zeit.de/news/2024-06/08/brand-in-einer-scheune-bei-demmin-erfasst-auch-wohnhaus;Hier finden Sie Informationen zu dem Thema „Feuerwehreinsatz“. Lesen Sie jetzt „Brand in einer Scheune bei Demmin erfasst auch Wohnhaus“.;"Z+ (abopflichtiger Inhalt);
        
    
Feuerwehreinsatz";News, Feuerwehreinsatz, Feuerwehr, Feuerwehreinsatz, Fahrzeug;2024-06-08T10:59:17+02:00;2024-06-08T10:59:17+02:00;;dpa Mecklenburg-Vorpommern;false
bab1f4d6d66bbd650a0dc683bd3eda4421d16735df00d81a9cc9ff6591a54a1c;Zwei Schwerverletzte nach Unfall in Hamm;https://www.zeit.de/news/2024-06/08/zwei-schwerverletzte-nach-unfall-in-hamm;Hier finden Sie Informationen zu dem Thema „Polizeieinsatz“. Lesen Sie jetzt „Zwei Schwerverletzte nach Unfall in Hamm“.;"Z+ (abopflichtiger Inhalt);
        
    
Polizeieinsatz";News, Polizeieinsatz, Hamm, Polizei, Unfall, Polizeieinsatz, Motorhaube, Streifenwagen, Auto;2024-06-08T10:56:17+02:00;2024-06-08T10:56:17+02:00;;dpa Nordrhein-Westfalen;false
3577d4e9f1ebd90f0b4cc2d6698a48adda5ac15df7afd7c758aadb513361ad26;"""Ich nenne das Hyperpolitik""";https://www.zeit.de/kultur/2024-06/anton-jaeger-protest-demonstrationen-politik;Ob gegen rechts, gegen Polizeigewalt oder für das Klima: Warum blieben die großen politischen Proteste zuletzt so folgenlos? Der Historiker Anton Jäger hat eine Antwort.;"Z+ (abopflichtiger Inhalt);
        
    
Anton Jäger";Kultur, Anton Jäger, Protest, Geschichte, Demonstration, Polizeigewalt, Klimaaktivismus, Black Lives Matter;2024-06-08T10:55:07+02:00;2024-06-08T10:55:07+02:00;Julia LorenzAnn-Kristin Tlusty;;false
ec5f5923d515343a99616ccb885a47304872f3470f5dc4d2a6fd99d32a047c63;Lage in Regensburg entspannt sich: Schutzelemente bleiben;https://www.zeit.de/news/2024-06/08/lage-in-regensburg-entspannt-sich-schutzelemente-bleiben;Hier finden Sie Informationen zu dem Thema „Hochwasser“. Lesen Sie jetzt „Lage in Regensburg entspannt sich: Schutzelemente bleiben“.;"Z+ (abopflichtiger Inhalt);
        
    
Hochwasser";News, Hochwasser, Regensburg, Donauufer, Hochwasser;2024-06-08T10:51:22+02:00;2024-06-08T10:51:22+02:00;;dpa Bayern;false
b84f794295ccf52688d495c612bff518d1760ed29acccd9471e81f530283fe28;"Tag der ""Jungen Naturwächter"" stärkt Naturschutz";https://www.zeit.de/news/2024-06/08/tag-der-jungen-naturwaechter-staerkt-naturschutz;"Hier finden Sie Informationen zu dem Thema „Engagement“. Lesen Sie jetzt „Tag der ""Jungen Naturwächter"" stärkt Naturschutz“.";"Z+ (abopflichtiger Inhalt);
        
    
Engagement";News, Engagement, Naturschutz;2024-06-08T10:49:13+02:00;2024-06-08T10:49:13+02:00;;dpa Sachsen;false
a611d46490c04d30bf9e5a1c84e016e1618d1d219f2f4dd74071d492493c06de;Wechselhaftes Wetter in Hessen;https://www.zeit.de/news/2024-06/08/wechselhaftes-wetter-in-hessen;Hier finden Sie Informationen zu dem Thema „Vorhersage“. Lesen Sie jetzt „Wechselhaftes Wetter in Hessen“.;"Z+ (abopflichtiger Inhalt);
        
    
Vorhersage";News, Vorhersage, Hessen, Vorhersage, Wetter;2024-06-08T10:47:24+02:00;2024-06-08T10:47:24+02:00;;dpa Hessen;false
f3c643b3b81957e1e6c265f82aea38ad1d37377662eb7489df0bd4efce0f6f1b;Italien feiert in Verona Oper als Weltkulturerbe;https://www.zeit.de/news/2024-06/08/italien-feiert-in-verona-oper-als-weltkulturerbe;Hier finden Sie Informationen zu dem Thema „Oper“. Lesen Sie jetzt „Italien feiert in Verona Oper als Weltkulturerbe“.;"Z+ (abopflichtiger Inhalt);
        
    
Oper";News, Oper, Italien, Verona, Galakonzert, Opernkunst, Oper;2024-06-08T10:46:26+02:00;2024-06-08T10:46:26+02:00;;dpa;false
96799038befbd24671eb27cca6a1fed1e5466685e848cf0b392c541aaea77904;Schwerstkriminellen-Abschiebung: Söder zweifelt an Scholz;https://www.zeit.de/news/2024-06/08/schwerstkriminellen-abschiebung-soeder-zweifelt-an-scholz;Hier finden Sie Informationen zu dem Thema „Nach Messerattacke“. Lesen Sie jetzt „Schwerstkriminellen-Abschiebung: Söder zweifelt an Scholz“.;"Z+ (abopflichtiger Inhalt);
        
    
Nach Messerattacke";News, Nach Messerattacke, Markus Söder, Olaf Scholz, Bayern, Syrien, Afghanistan, CSU, SPD, Messerattacke, Abschiebung;2024-06-08T10:46:10+02:00;2024-06-08T10:46:10+02:00;;dpa Bayern;false
2c7d07534aaabafc6933086b3fcaf2b44963aafed89173624f7af684190436a6;"Zverevs Finalziel in Paris: Vom ""Küklein"" zum König";https://www.zeit.de/news/2024-06/08/zverevs-finalziel-in-paris-vom-kueklein-zum-koenig;"Hier finden Sie Informationen zu dem Thema „Tennis“. Lesen Sie jetzt „Zverevs Finalziel in Paris: Vom ""Küklein"" zum König“.";"Z+ (abopflichtiger Inhalt);
        
    
Tennis";News, Tennis, Alexander Zverev, Dominic Thiem, Paris, New York, French Open, Grand-Slam-Turnier, US Open, Finalziel, Finale;2024-06-08T10:45:11+02:00;2024-06-08T10:45:11+02:00;;dpa Sport;false
1eb0f9e5ce51bf4d586613d12c6fd2b58426730d1cdb25e736ce2a0799227af7;Wüst bittet NSU-Opfer in Köln um Entschuldigung;https://www.zeit.de/news/2024-06/08/wuest-bittet-nsu-opfer-in-koeln-um-entschuldigung;Hier finden Sie Informationen zu dem Thema „Extremismus“. Lesen Sie jetzt „Wüst bittet NSU-Opfer in Köln um Entschuldigung“.;"Z+ (abopflichtiger Inhalt);
        
    
Extremismus";News, Extremismus, Hendrik Wüst, Uwe Böhnhardt, Köln, Nordrhein-Westfalen, NSU, CDU, Hürriyet, Extremismus, Entschuldigung, Nagelbombe;2024-06-08T10:33:04+02:00;2024-06-08T10:33:04+02:00;;dpa;false
b1b4762e966581d8fd903a899c62575d474cf2b443e15981dba842bf00f8ce50;Krieg gegen die Ukraine: So ist die Lage;https://www.zeit.de/news/2024-06/08/krieg-gegen-die-ukraine-so-ist-die-lage;Hier finden Sie Informationen zu dem Thema „Russische Invasion“. Lesen Sie jetzt „Krieg gegen die Ukraine: So ist die Lage“.;"Z+ (abopflichtiger Inhalt);
        
    
Russische Invasion";News, Russische Invasion, Joe Biden, John Kirby, Wolodymyr Selenskyj, Emmanuel Macron, Frankreich, Paris, USA, Kiew, Russland, Normandie;2024-06-08T10:30:04+02:00;2024-06-08T10:30:04+02:00;;dpa;false
ad37417d9af5b435998108cbe9be7817c9e535f29e52683b5b43e28792ccc2b5;Linkspartei in Thüringen meldet Angriff auf Landtagskandidaten;https://www.zeit.de/politik/deutschland/2024-06/angriff-politiker-linke-thueringen-steffen-much;Ein Politiker der Linken ist an der Kasse eines Supermarkts im thüringischen Eisenberg attackiert und beleidigt worden. Der Angreifer habe ohne Anlass gehandelt.;"Z+ (abopflichtiger Inhalt);
        
    
Gewalt gegen Politiker";Politik, Gewalt gegen Politiker, Thüringen, Gewalt gegen Politiker, Die Linke, Polizei, Körperverletzung;2024-06-08T10:26:05+02:00;2024-06-08T10:26:05+02:00;;ZEIT ONLINE,        AFP,        ccp;false
e68da4db8e95cf430accef0dbdd4daa199f1749dfadc5c0dcd662fca6ac927c6;Dänemarks Regierungschefin auf offener Straße angegriffen;https://www.zeit.de/politik/ausland/2024-06/daenemark-regierungschefin-mette-frederiksen-angegriffen;Ministerpräsidentin Mette Frederiksen ist ihrem Büro zufolge in Kopenhagen attackiert worden, ein Mann wurde festgenommen. EU-Politiker äußern sich entsetzt.;"Z+ (abopflichtiger Inhalt);
        
    
Mette Frederiksen";Politik, Mette Frederiksen, Gewalt gegen Politiker, Mette Frederiksen, Dänemark, Kopenhagen, Polizei;2024-06-08T10:22:32+02:00;2024-06-08T10:22:32+02:00;;ZEIT ONLINE,        AFP,        dpa,        isd,        eca;false
f55935ea3e85d6ae3d30f08d886292df45d89188f854013466d080faa4f59897;Erlangens Handballer und Sportdirektor Alonso trennen sich;https://www.zeit.de/news/2024-06/08/erlangens-handballer-und-sportdirektor-alonso-trennen-sich;Hier finden Sie Informationen zu dem Thema „Handball-Bundesliga“. Lesen Sie jetzt „Erlangens Handballer und Sportdirektor Alonso trennen sich“.;"Z+ (abopflichtiger Inhalt);
        
    
Handball-Bundesliga";News, Handball-Bundesliga, Raul Alonso, Erlangen, Handball-Bundesliga, Spielfeldrand;2024-06-08T10:18:40+02:00;2024-06-08T10:18:40+02:00;;dpa Bayern;false
946eba2dbdea5fe337b6a5d3ccb4ea07256589697f1c880f808def4348bab7b8;Social Media und Nachtleben - Feiern fürs perfekte Bild?;https://www.zeit.de/news/2024-06/08/social-media-und-nachtleben-feiern-fuers-perfekte-bild;Hier finden Sie Informationen zu dem Thema „Szene“. Lesen Sie jetzt „Social Media und Nachtleben - Feiern fürs perfekte Bild?“.;"Z+ (abopflichtiger Inhalt);
        
    
Szene";News, Szene, Emilio Emelie, Angelo Mattina, Ulrich Reinhardt, München, Berlin, Dubai, Paris, Madrid, Köln, Instagram;2024-06-08T10:17:45+02:00;2024-06-08T10:17:45+02:00;;dpa;false
0db90ffe06cb8d4b5ead67aaaadeb61116a42a2bcce2241da76458d1109d0e79;Ausbau der A57 sorgt für Sperrungen am Wochenende;https://www.zeit.de/news/2024-06/08/ausbau-der-a57-sorgt-fuer-sperrungen-am-wochenende;Hier finden Sie Informationen zu dem Thema „Bis Sonntagabend um 18 Uhr“. Lesen Sie jetzt „Ausbau der A57 sorgt für Sperrungen am Wochenende“.;"Z+ (abopflichtiger Inhalt);
        
    
Bis Sonntagabend um 18 Uhr";News, Bis Sonntagabend um 18 Uhr, Köln, Krefeld, Meerbusch, Sperrung, Ausbau;2024-06-08T10:07:51+02:00;2024-06-08T10:07:51+02:00;;dpa Nordrhein-Westfalen;false
6ef3a8320899c4743bd3b39dc6c03d8c7bd9b9cf5f8184db373b4f9626879eed;Reifen prallt in Motorrad: 32-Jähriger schwer verletzt;https://www.zeit.de/news/2024-06/08/reifen-prallt-in-motorrad-32-jaehriger-schwer-verletzt;Hier finden Sie Informationen zu dem Thema „Leer“. Lesen Sie jetzt „Reifen prallt in Motorrad: 32-Jähriger schwer verletzt“.;"Z+ (abopflichtiger Inhalt);
        
    
Leer";News, Leer, Leer, Polizei, Motorrad, Motorhaube, Reifen, Auto;2024-06-08T10:05:50+02:00;2024-06-08T10:05:50+02:00;;dpa Mecklenburg-Vorpommern;false
55427ed2b3a0013eff3a422939bdc920bf7d9f23ee79bbea5d66e3d0683b307d;Brand in Studentenwohnheim: Ein Mann verletzt;https://www.zeit.de/news/2024-06/08/brand-in-studentenwohnheim-ein-mann-verletzt;Hier finden Sie Informationen zu dem Thema „Berlin-Karlshorst“. Lesen Sie jetzt „Brand in Studentenwohnheim: Ein Mann verletzt“.;"Z+ (abopflichtiger Inhalt);
        
    
Berlin-Karlshorst";News, Berlin-Karlshorst, Berlin-Karlshorst, Feuerwehr, Studentenwohnheim, Einsatzfahrzeug;2024-06-08T10:04:31+02:00;2024-06-08T10:04:31+02:00;;dpa Berlin/Brandenburg;false
95999ca4b4ea2f1f757f816452deb28120df8317096cf68e96e81e7424a160f2;"Kauls EM-Ziel: Wieder wie beim ""Gänsehaut""-Coup";https://www.zeit.de/news/2024-06/08/kauls-em-ziel-wieder-wie-beim-gaensehaut-coup;"Hier finden Sie Informationen zu dem Thema „Leichtathletik-EM“. Lesen Sie jetzt „Kauls EM-Ziel: Wieder wie beim ""Gänsehaut""-Coup“.";"Z+ (abopflichtiger Inhalt);
        
    
Leichtathletik-EM";News, Leichtathletik-EM, Niklas Kaul, Manuel Eitel, München, Ulm, Paris, Tokio, Deutsche Presse-Agentur, Leichtathletik-EM, Olympia, Gänsehaut;2024-06-08T10:03:52+02:00;2024-06-08T10:03:52+02:00;;dpa Sport;false
910470dffd611d875d14bf6baa3daeb434820d724ff38d716ef21912ca824943;Fußballspiel abgebrochen: Ermittlungen zu rechten Parolen;https://www.zeit.de/news/2024-06/08/fussballspiel-abgebrochen-ermittlungen-zu-rechten-parolen;Hier finden Sie Informationen zu dem Thema „Extremismus“. Lesen Sie jetzt „Fußballspiel abgebrochen: Ermittlungen zu rechten Parolen“.;"Z+ (abopflichtiger Inhalt);
        
    
Extremismus";News, Extremismus, Polizei, Fußballspiel, Extremismus, Ermittlung, Einsatzfahrzeug, Blaulicht;2024-06-08T10:03:31+02:00;2024-06-08T10:03:31+02:00;;dpa Sachsen;false
13b62efc9478383af6e09a5a42e92870e66dd721998c82dddf9d1a0347e2ada1;Jugendlicher wird von Auto erfasst und schwer verletzt;https://www.zeit.de/news/2024-06/08/jugendlicher-wird-von-auto-erfasst-und-schwer-verletzt;Hier finden Sie Informationen zu dem Thema „Unfall“. Lesen Sie jetzt „Jugendlicher wird von Auto erfasst und schwer verletzt“.;"Z+ (abopflichtiger Inhalt);
        
    
Unfall";News, Unfall, Unfall, Notrufnummer, Rettungswagen, Auto;2024-06-08T09:57:12+02:00;2024-06-08T09:57:12+02:00;;dpa Baden-Württemberg;false
6a7a53ca0dbb2ce97c61db18221b5e03f6475839aa77bd2b551fde7e77040bef;Benny Gantz gibt nach Rücktrittsandrohung Erklärung ab;https://www.zeit.de/politik/ausland/2024-06/benny-gantz-ruecktritt-israel-regierung-benjamin-netanjahu;Netanjahu müsse einen Nachkriegsplan für den Gazastreifen vorlegen, forderte Gantz – und setzte eine Frist bis heute. Auch andere Politiker drohen mit Rücktritt.;"Z+ (abopflichtiger Inhalt);
        
    
Gaza-Krieg";Politik, Gaza-Krieg, Israel, Benny Gantz, Benjamin Netanjahu, Gazastreifen, Waffenruhe;2024-06-08T09:53:39+02:00;2024-06-08T09:53:39+02:00;;ZEIT ONLINE,        AFP,        dpa,        lkk;false
669a7742d26415b65586572f4dd07f12099169075745ae03b9cbb3985015e1e0;Kretschmer fordert Abschiebung mehrfach straffälliger Geflüchteter;https://www.zeit.de/politik/deutschland/2024-06/michael-kretschmer-abschiebung-straffaellige-gefluechtete;Wer als jugendlicher Geflüchteter Straftaten begangen hat, soll mit 18 Jahren abgeschoben werden, fordert Sachsens Ministerpräsident Kretschmer. Auch nach Afghanistan.;"Z+ (abopflichtiger Inhalt);
        
    
Migration";Politik, Migration, Michael Kretschmer, Sachsen, CDU, Abschiebung, Straftat;2024-06-08T09:52:32+02:00;2024-06-08T09:52:32+02:00;;ZEIT ONLINE,        dpa,        ccp;false
91dad1a4dc89c1c1c561deee3257b32cd9c3adebb84b10b9c8b1aff4377cf015;Kellerbrand in Einfamilienhaus: Zwei verletzte Bewohner;https://www.zeit.de/news/2024-06/08/kellerbrand-in-einfamilienhaus-zwei-verletzte-bewohner;Hier finden Sie Informationen zu dem Thema „Kreis Waldshut“. Lesen Sie jetzt „Kellerbrand in Einfamilienhaus: Zwei verletzte Bewohner“.;"Z+ (abopflichtiger Inhalt);
        
    
Kreis Waldshut";News, Kreis Waldshut, Waldshut, Feuerwehr, Kellerbrand, Einfamilienhaus;2024-06-08T09:52:08+02:00;2024-06-08T09:52:08+02:00;;dpa Baden-Württemberg;false
