Hash;Title;Link;Description;Category;KeyWords;Published;LastUpdated;Author;Source;Paywall
51e95e54a006917000b2164c44ccd14d545d073b4f4f0a25b57c19402df85bf4;Stimmung im Handwerk weiter schlecht;https://www.zeit.de/news/2024-04/22/stimmung-im-handwerk-weiter-schlecht;Hier finden Sie Informationen zu dem Thema „Sachsen-Anhalts Süden“. Lesen Sie jetzt „Stimmung im Handwerk weiter schlecht“.;"Z+ (abopflichtiger Inhalt);
        
    
Sachsen-Anhalts Süden";News, Sachsen-Anhalts Süden, Thomas Keindorf, Sachsen-Anhalt, Handwerkskammer, CDU;2024-04-22T15:03:20+02:00;2024-04-22T15:03:20+02:00;;dpa Sachsen;false
152cdb0d229e889e9bed3c9898f8ce27fda10db36d3d59793c9c96f923cbd1e5;Senior von Hunden in Rastenberg gebissen und verletzt;https://www.zeit.de/news/2024-04/22/senior-von-hunden-in-rastenberg-gebissen-und-verletzt;Hier finden Sie Informationen zu dem Thema „Landkreis Sömmerda“. Lesen Sie jetzt „Senior von Hunden in Rastenberg gebissen und verletzt“.;"Z+ (abopflichtiger Inhalt);
        
    
Landkreis Sömmerda";News, Landkreis Sömmerda, Rastenberg, Landkreis Sömmerda, Polizei;2024-04-22T15:01:27+02:00;2024-04-22T15:01:27+02:00;;dpa Thüringen;false
2a0f046222112aa3efb9f07766fa21b10793bbe70c6c5c7c60d31af56230bae3;Ausschuss macht Weg für Verfassungsänderung frei;https://www.zeit.de/news/2024-04/22/ausschuss-macht-weg-fuer-verfassungsaenderung-frei;Hier finden Sie Informationen zu dem Thema „Landtag“. Lesen Sie jetzt „Ausschuss macht Weg für Verfassungsänderung frei“.;"Z+ (abopflichtiger Inhalt);
        
    
Landtag";News, Landtag, CDU, Verfassungsänderung, Landtag, Ausschuss, Plenarsitzung;2024-04-22T14:58:15+02:00;2024-04-22T14:58:15+02:00;;dpa Thüringen;false
1e5a1f0425135a73576e5c2ad76442df2227a574fbb7762006e8b3d4d4d8b688;Hinsehen, wer kann da noch hinsehen?;https://www.zeit.de/sport/2024-04/schach-kandidatenturnier-toronto-gukesh-ding-liren;Eine hochdramatische letzte Runde: Der erst 17-jährige Gukesh erkämpft ein Remis, siegt beim Kandidatenturnier und wird der nächste Herausforderer des Schachweltmeisters.;"Z+ (abopflichtiger Inhalt);
        
    
Schach-Kandidatenturnier";Sport, Schach-Kandidatenturnier, Schach, Kandidatenturnier, Toronto, Kanada, Profisport, Indien;2024-04-22T14:57:15+02:00;2024-04-22T14:57:15+02:00;Ulrich Stock;;false
3b021c80e5c3c1efa01dbef43f500bbe441080fbba5d70a8331ef042812bb309;Ex-Anwältin in Untreueprozess verurteilt;https://www.zeit.de/news/2024-04/22/ex-anwaeltin-in-untreueprozess-verurteilt;Hier finden Sie Informationen zu dem Thema „Prozess“. Lesen Sie jetzt „Ex-Anwältin in Untreueprozess verurteilt“.;"Z+ (abopflichtiger Inhalt);
        
    
Prozess";News, Prozess, Meiningen, Untreueprozess, Justizzentrum, Landgericht, Geld;2024-04-22T14:56:53+02:00;2024-04-22T14:56:53+02:00;;dpa Thüringen;false
b3b4edb28f90603868f25e0c77dd3fded31efc2fea20207966706566f59fcb3a;Mehr Kritik an Anhebung des Rentenalters für Feuerwehrleute;https://www.zeit.de/news/2024-04/22/mehr-kritik-an-anhebung-des-rentenalters-fuer-feuerwehrleute;Hier finden Sie Informationen zu dem Thema „NRW-Landesregierung“. Lesen Sie jetzt „Mehr Kritik an Anhebung des Rentenalters für Feuerwehrleute“.;"Z+ (abopflichtiger Inhalt);
        
    
NRW-Landesregierung";News, NRW-Landesregierung, NRW, Lembeck, Feuerwehr, Rentenalter, Anhebung, Industriehalle, Explosion, Kritik;2024-04-22T14:56:11+02:00;2024-04-22T14:56:11+02:00;;dpa Nordrhein-Westfalen;false
2c328c8318a4351d7bbe39eb51b74d1c22a3a48d22ab5781139264bf0f155461;Beschädigtes Auto mit Blutspuren aufgefunden;https://www.zeit.de/news/2024-04/22/beschaedigtes-auto-mit-blutspuren-aufgefunden;Hier finden Sie Informationen zu dem Thema „Landkreis Uckermark“. Lesen Sie jetzt „Beschädigtes Auto mit Blutspuren aufgefunden“.;"Z+ (abopflichtiger Inhalt);
        
    
Landkreis Uckermark";News, Landkreis Uckermark, Landkreis Uckermark, Polizei, Verkehrskontrolle, Auto;2024-04-22T14:55:29+02:00;2024-04-22T14:55:29+02:00;;dpa Berlin/Brandenburg;false
82aed4aa5f3b9b9401f9bb98fc4759eca1c87672f9e9446622bbdca95ac51ea5;Drogenhandel in Cafés? Angeklagter schweigt;https://www.zeit.de/news/2024-04/22/drogenhandel-in-caf-s-angeklagter-schweigt;Hier finden Sie Informationen zu dem Thema „Prozess“. Lesen Sie jetzt „Drogenhandel in Cafés? Angeklagter schweigt“.;"Z+ (abopflichtiger Inhalt);
        
    
Prozess";News, Prozess, Moabit, Heroin, Drogenhandel, Kriminalgericht, Café, Gesetzbuch, Verhandlungssaal, Strafrecht, Drogen;2024-04-22T14:53:34+02:00;2024-04-22T14:53:34+02:00;;dpa Berlin/Brandenburg;false
d0b0d507fc5427bfc62d2ab7f80d111e7031ffcde0ed86c6a5bbc4117c88b1e2;Steinmeier reist mit Dönerspieß in die Türkei;https://www.zeit.de/news/2024-04/22/steinmeier-reist-mit-doenerspiess-in-die-tuerkei;Hier finden Sie Informationen zu dem Thema „Bundespräsident“. Lesen Sie jetzt „Steinmeier reist mit Dönerspieß in die Türkei“.;"Z+ (abopflichtiger Inhalt);
        
    
Bundespräsident";News, Bundespräsident, Arif Keles, Frank-Walter Steinmeier, Türkei, Istanbul, Berlin, Bundeswehr, Airbus A350, Döner, Symbolbild, Bundespräsident;2024-04-22T14:50:18+02:00;2024-04-22T14:50:18+02:00;;dpa;false
59d6ad5c5d1ff65973864cea957ffa5af891323be440e8e171de729316635cc7;Lottospieler aus dem Saarland gewinnt eine halbe Million;https://www.zeit.de/news/2024-04/22/lottospieler-gewinnt-eine-halbe-million-euro;Hier finden Sie Informationen zu dem Thema „Saarlouis“. Lesen Sie jetzt „Lottospieler aus dem Saarland gewinnt eine halbe Million“.;"Z+ (abopflichtiger Inhalt);
        
    
Saarlouis";News, Saarlouis, Saarlouis, Saarland, Lottoschein;2024-04-22T14:43:06+02:00;2024-04-22T14:43:06+02:00;;dpa Rheinland-Pfalz/Saarland;false
e4b9b7c2e1c4a8beaff23f2ff716268d0b57792f6df94da45c746d0ac2fa2232;Achtjähriger von ausparkendem Auto erfasst: Schwer verletzt;https://www.zeit.de/news/2024-04/22/achtjaehriger-von-ausparkendem-auto-erfasst-schwer-verletzt;Hier finden Sie Informationen zu dem Thema „Main-Kinzig-Kreis“. Lesen Sie jetzt „Achtjähriger von ausparkendem Auto erfasst: Schwer verletzt“.;"Z+ (abopflichtiger Inhalt);
        
    
Main-Kinzig-Kreis";News, Main-Kinzig-Kreis, Main-Kinzig, Polizei, Rettungswagen, Auto, Fahrrad;2024-04-22T14:40:46+02:00;2024-04-22T14:40:46+02:00;;dpa Hessen;false
63774271f20c3568d3d4c902c198f98b4a738c2285ea30560a962355da95fd9b;Helene-Fischer-Spektakel in der Allianz Arena;https://www.zeit.de/news/2024-04/22/helene-fischer-spektakel-in-der-allianz-arena;Hier finden Sie Informationen zu dem Thema „Musik“. Lesen Sie jetzt „Helene-Fischer-Spektakel in der Allianz Arena“.;"Z+ (abopflichtiger Inhalt);
        
    
Musik";News, Musik, Helene Fischer, München, Allianz Arena, Messe München, Sommer;2024-04-22T14:39:23+02:00;2024-04-22T14:39:23+02:00;;dpa Bayern;false
3d3ea4d903863e3bc0a474b7aa629b9289ecc5c457d30995ebf677f484d075b6;Söder: Aigner soll Kiffen im Landtag verbieten;https://www.zeit.de/news/2024-04/22/soeder-aigner-soll-kiffen-im-landtag-verbieten;Hier finden Sie Informationen zu dem Thema „Legalisierung “. Lesen Sie jetzt „Söder: Aigner soll Kiffen im Landtag verbieten“.;"Z+ (abopflichtiger Inhalt);
        
    
Legalisierung";News, Legalisierung , Markus Söder, Ilse Aigner, Toni Schuberl, München, CSU, Bayerischer Landtag, Facebook, Landtag, Legalisierung, Bayernflagge;2024-04-22T14:37:45+02:00;2024-04-22T14:37:45+02:00;;dpa Bayern;false
eef0081a59a143ba81a57f2e4a075bcf4bd1fd67aae3f35d182eb1939a33b88e;Weder Söder noch bayerische Minister auf Bundestagsliste;https://www.zeit.de/news/2024-04/22/kreise-weder-soeder-noch-minister-gehen-auf-bundestagsliste;Hier finden Sie Informationen zu dem Thema „Parteien“. Lesen Sie jetzt „Weder Söder noch bayerische Minister auf Bundestagsliste“.;"Z+ (abopflichtiger Inhalt);
        
    
Parteien";News, Parteien, Markus Söder, Marion Kiechle, Bayern, Passau, München, Berlin, CSU, Bundestag, Bundestagswahl, Bundestagsliste;2024-04-22T14:36:36+02:00;2024-04-22T14:36:36+02:00;;dpa Bayern;false
47c42df61b2a4ef1eaf4e75789fe6ca21c9365002239384835b116a5055b1aef;Chefermittlerin im Cum-Ex-Skandal kündigt;https://www.zeit.de/wirtschaft/2024-04/cum-ex-ermittlerin-anne-brorhilker-kuendigung;Sie war Deutschlands wichtigste Cum-Ex-Ermittlerin: Staatsanwältin Anne Brorhilker hat gekündigt. Künftig will sie an anderer Stelle gegen Finanzkriminalität kämpfen.;"Z+ (abopflichtiger Inhalt);
        
    
Anne Brorhilker";Wirtschaft, Anne Brorhilker, Cum-Ex, Kriminalität, Finanzen, NGO, Strafverfolgung, Köln;2024-04-22T14:29:26+02:00;2024-04-22T14:29:26+02:00;;ZEIT ONLINE,        dpa,        mga;false
84099f1331c0dd78c2efd6d62a0e677add2af65373384af5624db7b2981e3ec6;Explosion in Erfurter Wohnhaus;https://www.zeit.de/news/2024-04/22/explosion-in-erfurter-wohnhaus;Hier finden Sie Informationen zu dem Thema „Unfall“. Lesen Sie jetzt „Explosion in Erfurter Wohnhaus“.;"Z+ (abopflichtiger Inhalt);
        
    
Unfall";News, Unfall, Erfurt, Polizei, Explosion, Unfall, Streife, Polizeiinspektion;2024-04-22T14:22:24+02:00;2024-04-22T14:22:24+02:00;;dpa Thüringen;false
619a33cbf785c95afc1de935f9e8efab96af7b638236e83ebe31e09620173993;Koalition verspielt Chance für deutsche Solarindustrie;https://www.zeit.de/news/2024-04/22/koalition-verspielt-chance-fuer-deutsche-solarindustrie;Hier finden Sie Informationen zu dem Thema „Solarverband“. Lesen Sie jetzt „Koalition verspielt Chance für deutsche Solarindustrie“.;"Z+ (abopflichtiger Inhalt);
        
    
Solarverband";News, Solarverband, Meyer Burger, Bundesverband Solarwirtschaft, Solarindustrie, Solarverband, Solarfeld, Solarunternehmen, Solarpaket, Koalition;2024-04-22T14:21:03+02:00;2024-04-22T14:21:03+02:00;;dpa Sachsen;false
cccd6fed1d71607a0133046e0d0fcd2590d63daf9b9bb151f86ecd7f7daec7f4;"Günther zur Wahl: ""Hoffe, dass viele Demokraten hingehen""";https://www.zeit.de/news/2024-04/22/landesregierung-stellt-kampagne-zur-europawahl-vor;"Hier finden Sie Informationen zu dem Thema „Europawahl“. Lesen Sie jetzt „Günther zur Wahl: ""Hoffe, dass viele Demokraten hingehen""“.";"Z+ (abopflichtiger Inhalt);
        
    
Europawahl";News, Europawahl, Daniel Günther, Werner Schwarz, Schleswig-Holstein, EU, CDU, Europawahl, Landesregierung, Kampagne, Fototermin;2024-04-22T14:20:22+02:00;2024-04-22T14:20:22+02:00;;dpa Hamburg/Schleswig-Holstein;false
736737c42bb6a63e1b1ad2384081e9acb6164e7072b8e294af117cc8ba269a4a;Nachbarn retten Bewohnerin in Zettlitz;https://www.zeit.de/news/2024-04/22/nachbarn-retten-bewohnerin-in-zettlitz;Hier finden Sie Informationen zu dem Thema „Brände“. Lesen Sie jetzt „Nachbarn retten Bewohnerin in Zettlitz“.;"Z+ (abopflichtiger Inhalt);
        
    
Brände";News, Brände, Zettlitz, Feuerwehr, Polizei, Brand, Auto;2024-04-22T14:19:40+02:00;2024-04-22T14:19:40+02:00;;dpa Sachsen;false
e4719df33ebc59a1c75cbbf35815a15c62248ac70cb2e406d742a8784527071b;Recycling-Firma kritisiert offenen Brief aus Berlin;https://www.zeit.de/news/2024-04/22/recycling-firma-kritisiert-offenen-brief-aus-berlin;Hier finden Sie Informationen zu dem Thema „SRW-Tarifkonflikt“. Lesen Sie jetzt „Recycling-Firma kritisiert offenen Brief aus Berlin“.;"Z+ (abopflichtiger Inhalt);
        
    
SRW-Tarifkonflikt";News, SRW-Tarifkonflikt, Daniel Fischer, Berlin, Rötha, Leipzig, Landkreis Leipzig, IG Metall, Mutterkonzern, Tarifkonflikt, Metall;2024-04-22T14:18:33+02:00;2024-04-22T14:18:33+02:00;;dpa Sachsen;false
1b8bab519a14e36700fc9453047446bf00461674ff11797a73b407cff552f531;Brauchen wir Gedichte, Herr von Ammon?;https://www.zeit.de/2024/17/geschichte-lyrik-gedichte-frieder-von-ammon;Manche Gedichte lösen diplomatische Krisen aus, manche retten Leben, und manche verstehen wir nicht. Frieder von Ammon forscht zu Theorie und Geschichte der Lyrik.;"Z+ (abopflichtiger Inhalt);
        
    
Geschichte der Lyrik";Kultur, Geschichte der Lyrik, Gedicht, Literatur, Lyrik, Ruth Klüger, Guantánamo, Jan Böhmermann;2024-04-22T14:16:59+02:00;2024-04-22T14:16:59+02:00;Hella KemperMaximilian Probst;Aus der        ZEIT Nr. 17/2024;false
9665c2696ca1ab682460ee32fe1d6604c30c982a16d2797ebed8e97728000198;Bayerns Fußball-Verbandspräsident in DFB-Kommission;https://www.zeit.de/news/2024-04/22/bayerns-fussball-verbandspraesident-in-dfb-kommission;Hier finden Sie Informationen zu dem Thema „Sport“. Lesen Sie jetzt „Bayerns Fußball-Verbandspräsident in DFB-Kommission“.;"Z+ (abopflichtiger Inhalt);
        
    
Sport";News, Sport, Christoph Kern, Bayern, DFB, Deutscher Fußball-Bund, Präsidium, Überarbeitung;2024-04-22T14:16:49+02:00;2024-04-22T14:16:49+02:00;;dpa Bayern;false
363046b8af160baaa16745d24140b412aa18ee62cfe9cd89596f5aec747f8c55;Dampfstrahler wird am Bahnhof von ICE mitgeschleift;https://www.zeit.de/news/2024-04/22/dampfstrahler-wird-am-bahnhof-von-ice-mitgeschleift;Hier finden Sie Informationen zu dem Thema „Augsburg“. Lesen Sie jetzt „Dampfstrahler wird am Bahnhof von ICE mitgeschleift“.;"Z+ (abopflichtiger Inhalt);
        
    
Augsburg";News, Augsburg, Augsburg, Hannover, ICE, Hauptbahnhof, Bahnsteig, Bahnhof, Verschlusszeit;2024-04-22T14:14:45+02:00;2024-04-22T14:14:45+02:00;;dpa Bayern;false
479ad5b78ecd90f8cf26bba43013a232b14c3399d694a65f0fe5c19ad7a4461f;Verkehrszählung an der B96 beendet: Weitere Zählung folgt;https://www.zeit.de/news/2024-04/22/verkehrszaehlung-an-der-b96-beendet-weitere-zaehlung-folgt;Hier finden Sie Informationen zu dem Thema „Verkehr“. Lesen Sie jetzt „Verkehrszählung an der B96 beendet: Weitere Zählung folgt“.;"Z+ (abopflichtiger Inhalt);
        
    
Verkehr";News, Verkehr, Brandenburg, Neubrandenburg, Mecklenburg-Vorpommern, Verkehrszählung, Zählung, Verkehr, Bundesstraße, Fahrzeug;2024-04-22T14:14:37+02:00;2024-04-22T14:14:37+02:00;;dpa Berlin/Brandenburg;false
49e11f38c308b93917b6fd87fd1a66d18f0eea1403b668c1596d417de152e657;Deutsches Symphonie-Orchester bleibt Komponistinnen treu;https://www.zeit.de/news/2024-04/22/deutsches-symphonie-orchester-bleibt-komponistinnen-treu;Hier finden Sie Informationen zu dem Thema „Musik“. Lesen Sie jetzt „Deutsches Symphonie-Orchester bleibt Komponistinnen treu“.;"Z+ (abopflichtiger Inhalt);
        
    
Musik";News, Musik, Robin Ticciati, Deutsches Symphonie-Orchester;2024-04-22T14:13:25+02:00;2024-04-22T14:13:25+02:00;;dpa Berlin/Brandenburg;false
fedb24ec344e5d18cbceec5c7962e3fcea7f5ffccafb28515a686b7383a38da7;Lausitz bekommt Medizinische Universität;https://www.zeit.de/news/2024-04/22/lausitz-bekommt-medizinische-universitaet;Hier finden Sie Informationen zu dem Thema „Medizin“. Lesen Sie jetzt „Lausitz bekommt Medizinische Universität“.;"Z+ (abopflichtiger Inhalt);
        
    
Medizin";News, Medizin, Lausitz, Cottbus, Brandenburg, Wissenschaftsrat;2024-04-22T14:12:23+02:00;2024-04-22T14:12:23+02:00;;dpa Berlin/Brandenburg;false
5db66dc56691f7c2c44cb0a591c718645ab46714f408bdad16d3fb4c94781376;Maschinenhalle steht in Flammen: Sechsstelliger Schaden;https://www.zeit.de/news/2024-04/22/stadel-steht-in-flammen-sechsstelliger-schaden;Hier finden Sie Informationen zu dem Thema „Reichertsheim“. Lesen Sie jetzt „Maschinenhalle steht in Flammen: Sechsstelliger Schaden“.;"Z+ (abopflichtiger Inhalt);
        
    
Reichertsheim";News, Reichertsheim, Reichertsheim, Feuerwehr, Polizei, Einsatzfahrzeug, Einsatzkraft, Stadel;2024-04-22T14:11:16+02:00;2024-04-22T14:11:16+02:00;;dpa Bayern;false
665d77caf93b3f349f0761df17f0981e2668a73ed536df4379887f00f92c8976;Filmproduzenten: Dulden keinen Antisemitismus;https://www.zeit.de/news/2024-04/22/filmproduzenten-dulden-keinen-antisemitismus;Hier finden Sie Informationen zu dem Thema „Extremismus“. Lesen Sie jetzt „Filmproduzenten: Dulden keinen Antisemitismus“.;"Z+ (abopflichtiger Inhalt);
        
    
Extremismus";News, Extremismus, Antisemitismus, Extremismus;2024-04-22T14:10:46+02:00;2024-04-22T14:10:46+02:00;;dpa Berlin/Brandenburg;false
fb71216b9fc53c10ccb11660f5bf61538ffef706262d698f74b3b83ca82fd1f6;Anklage gegen Vermieter nach Brandverletzungen;https://www.zeit.de/news/2024-04/22/anklage-gegen-vermieter-nach-brandverletzungen;Hier finden Sie Informationen zu dem Thema „Rauchmelder fehlt“. Lesen Sie jetzt „Anklage gegen Vermieter nach Brandverletzungen“.;"Z+ (abopflichtiger Inhalt);
        
    
Rauchmelder fehlt";News, Rauchmelder fehlt, Rauchmelder, Brandverletzung, Anklage, Hausflur;2024-04-22T14:10:12+02:00;2024-04-22T14:10:12+02:00;;dpa Berlin/Brandenburg;false
d1c04953fced63dbc7d804956f033e4c9a7439792fd744c2e39098e1253a366c;Polizeipräsenz kann Sicherheitsgefühl negativ beeinflussen;https://www.zeit.de/news/2024-04/22/polizeipraesenz-kann-sicherheitsgefuehl-negativ-beeinflussen;Hier finden Sie Informationen zu dem Thema „Studie“. Lesen Sie jetzt „Polizeipräsenz kann Sicherheitsgefühl negativ beeinflussen“.;"Z+ (abopflichtiger Inhalt);
        
    
Studie";News, Studie, Tim Pfeiffer, Kassel, Justus-Liebig-Universität, Polizei, Polizeipräsenz, Sicherheitsgefühl, Unsicherheitsgefühl, Streife, Polizeiinspektion, Sicherheit;2024-04-22T14:09:54+02:00;2024-04-22T14:09:54+02:00;;dpa Hessen;false
b1bb04e2f3769e4ba2bacdc4b9a91d5c66200233a61887f12a7552667ecd512b;Banken: Sorgen um wirtschaftliche Aussichten Deutschlands;https://www.zeit.de/news/2024-04/22/banken-sorgen-um-wirtschaftliche-aussichten-deutschlands;Hier finden Sie Informationen zu dem Thema „Bundesverband“. Lesen Sie jetzt „Banken: Sorgen um wirtschaftliche Aussichten Deutschlands“.;"Z+ (abopflichtiger Inhalt);
        
    
Bundesverband";News, Bundesverband, Christian Sewing, Berlin, Deutsche Bank, Bundesverband deutscher Banken, EU, Bundesverband;2024-04-22T14:08:33+02:00;2024-04-22T14:08:33+02:00;;dpa;false
ccdf0926ea9995f04ea52d7d78b47e2a0f6aafa669f63761a86f9ba94075e30f;Rafael Nadal beim Laver Cup in Berlin dabei;https://www.zeit.de/news/2024-04/22/rafael-nadal-beim-laver-cup-in-berlin-dabei;Hier finden Sie Informationen zu dem Thema „Tennis“. Lesen Sie jetzt „Rafael Nadal beim Laver Cup in Berlin dabei“.;"Z+ (abopflichtiger Inhalt);
        
    
Tennis";News, Tennis, Rafael Nadal, Berlin, Europa;2024-04-22T14:08:20+02:00;2024-04-22T14:08:20+02:00;;dpa Berlin/Brandenburg;false
1d0efecf05dea781cb6a7963317e0642a0d12f7fbea898096056e8429ef63b85;Einigung: Vuillard-Gemälde bleibt in Neusser Museum;https://www.zeit.de/news/2024-04/22/einigung-vuillard-gemaelde-bleibt-in-neusser-museum;Hier finden Sie Informationen zu dem Thema „Raubkunstfall“. Lesen Sie jetzt „Einigung: Vuillard-Gemälde bleibt in Neusser Museum“.;"Z+ (abopflichtiger Inhalt);
        
    
Raubkunstfall";News, Raubkunstfall, Clemens Sels, Édouard Vuillard, Armand Dorville, Neuss, NRW, Düsseldorf, Raubkunstfall;2024-04-22T14:04:10+02:00;2024-04-22T14:04:10+02:00;;dpa Nordrhein-Westfalen;false
82dbe3e729978474f077b553869f1250b4d6d2009e82fbec97ea211e5784db7d;Regierung will Deutschunterricht an Grundschulen fördern;https://www.zeit.de/news/2024-04/22/regierung-will-deutschunterricht-an-grundschulen-foerdern;Hier finden Sie Informationen zu dem Thema „Bildung“. Lesen Sie jetzt „Regierung will Deutschunterricht an Grundschulen fördern“.;"Z+ (abopflichtiger Inhalt);
        
    
Bildung";News, Bildung, Hessen, Deutschunterricht, Grundschule, Deutschförderung;2024-04-22T14:03:33+02:00;2024-04-22T14:03:33+02:00;;dpa Hessen;false
8fa5706a9a06ab0235df1869be3f569111437b5ea8942880c7fc3b66387c6c42;"Ex-Bankchef belastet Braun: Gesetz ""nicht so von Bedeutung""";https://www.zeit.de/news/2024-04/22/ex-bankchef-belastet-braun-gesetz-nicht-so-von-bedeutung;"Hier finden Sie Informationen zu dem Thema „Wirecard-Prozess“. Lesen Sie jetzt „Ex-Bankchef belastet Braun: Gesetz ""nicht so von Bedeutung""“.";"Z+ (abopflichtiger Inhalt);
        
    
Wirecard-Prozess";News, Wirecard-Prozess, Markus Braun, Wirecard, Milliardenbetrug, Kredit;2024-04-22T14:02:37+02:00;2024-04-22T14:02:37+02:00;;dpa Bayern;false
b9ba186dda298bfa9682f09bf4a5fe9c60b9cfb741a0e78fa161b00289ed6fc0;Verdächtiger nach blutigem Familienstreit in Haft;https://www.zeit.de/news/2024-04/22/verdaechtiger-nach-blutigem-familienstreit-in-haft;Hier finden Sie Informationen zu dem Thema „Gewalttat“. Lesen Sie jetzt „Verdächtiger nach blutigem Familienstreit in Haft“.;"Z+ (abopflichtiger Inhalt);
        
    
Gewalttat";News, Gewalttat, Münster, Polizei, Familienstreit, Gewalttat, Blaulicht;2024-04-22T14:02:14+02:00;2024-04-22T14:02:14+02:00;;dpa Nordrhein-Westfalen;false
0874241df9c71b12bf4ff9ca329c19e3aa1de3ca6c68da7b6bf5520eff0f5033;Söder fordert Machtwort von Scholz zu Baerbocks Außenpolitik;https://www.zeit.de/news/2024-04/22/soeder-fordert-machtwort-von-scholz-zu-baerbocks-aussenpolitik;Hier finden Sie Informationen zu dem Thema „Parteien“. Lesen Sie jetzt „Söder fordert Machtwort von Scholz zu Baerbocks Außenpolitik“.;"Z+ (abopflichtiger Inhalt);
        
    
Parteien";News, Parteien, Markus Söder, Annalena Baerbock, Olaf Scholz, FDP, CSU, SPD, Machtwort, Außenpolitik, Erfolg;2024-04-22T13:58:34+02:00;2024-04-22T13:58:34+02:00;;dpa Bayern;false
ca1f86d4ca4ccebcab3e7b782b68e38d74f3b7071c0caaac55048649198a52bc;Mann überquert S-Bahngleise und legt Fernverkehr kurz lahm;https://www.zeit.de/news/2024-04/22/mann-ueberquert-s-bahngleise-und-legt-fernverkehr-kurz-lahm;Hier finden Sie Informationen zu dem Thema „Verkehr“. Lesen Sie jetzt „Mann überquert S-Bahngleise und legt Fernverkehr kurz lahm“.;"Z+ (abopflichtiger Inhalt);
        
    
Verkehr";News, Verkehr, Hamburg, Bundespolizei, Stuttgart 21, Fernverkehr, Verkehr;2024-04-22T13:56:04+02:00;2024-04-22T13:56:04+02:00;;dpa Hamburg/Schleswig-Holstein;false
1ccc3366066acd5b7856c008828cdb417c3a2d138f243b8d6f3ffc2dad0f8efc;Scholz: Mehr Tempo beim Transfer von Forschung in die Praxis;https://www.zeit.de/news/2024-04/22/scholz-mehr-tempo-beim-transfer-von-forschung-in-die-praxis;Hier finden Sie Informationen zu dem Thema „Wissenschaft“. Lesen Sie jetzt „Scholz: Mehr Tempo beim Transfer von Forschung in die Praxis“.;"Z+ (abopflichtiger Inhalt);
        
    
Wissenschaft";News, Wissenschaft, Olaf Scholz, Hannover, SPD;2024-04-22T13:53:36+02:00;2024-04-22T13:53:36+02:00;;dpa Niedersachsen;false
78f8a8caff4ea4ddff58e5b7c6399f1534bcd4a59ec4298550b55e5d34c7c9d9;Söder: Neues Bundestagswahlrecht verfassungswidrig;https://www.zeit.de/news/2024-04/22/weder-soeder-noch-bayerische-minister-auf-bundestagsliste;Hier finden Sie Informationen zu dem Thema „Parteien“. Lesen Sie jetzt „Söder: Neues Bundestagswahlrecht verfassungswidrig“.;"Z+ (abopflichtiger Inhalt);
        
    
Parteien";News, Parteien, Markus Söder, Marion Kiechle, München, Berlin, Bayern, CSU, Bundestag, Bundestagswahl, Bundestagsliste;2024-04-22T13:51:31+02:00;2024-04-22T13:51:31+02:00;;dpa;false
e4bc8be82a6030a278e4d7ca9c85864645f5bc1f22bbc836643163915d724d0b;Mann in Hannover durch Stromschlag verletzt;https://www.zeit.de/news/2024-04/22/mann-in-hannover-durch-stromschlag-verletzt;Hier finden Sie Informationen zu dem Thema „Unfälle“. Lesen Sie jetzt „Mann in Hannover durch Stromschlag verletzt“.;"Z+ (abopflichtiger Inhalt);
        
    
Unfälle";News, Unfälle, Hannover, Stromschlag, Unfall, Rettungswagen, Blaulicht;2024-04-22T13:46:17+02:00;2024-04-22T13:46:17+02:00;;dpa Niedersachsen;false
52dee81929ab885d179eebf82312bb76c56337cf4747c687fe4f59d0725f4037;Abschiebungen nach Ruanda sollen laut Sunak in wenigen Wochen beginnen;https://www.zeit.de/politik/ausland/2024-04/abschieben-fluege-grossbritannien-ruanda-rishi-sunak;"""Diese Flüge werden stattfinden, komme, was wolle"": Der britische Premier Rishi Sunak will den Streit über Abschiebeflüge nach Ruanda beenden – und Gerichte ignorieren.";"Z+ (abopflichtiger Inhalt);
        
    
Großbritannien";Politik, Großbritannien, Abschiebung, Rishi Sunak, Großbritannien, Ruanda, Europäischer Gerichtshof für Menschenrechte, Asylpolitik;2024-04-22T13:45:04+02:00;2024-04-22T13:45:04+02:00;;ZEIT ONLINE,        AP,        mga;false
aafe5fbe54b20c79e88aff22b715cdb040fa472c8294bb5a15f472d9455c4b2a;"""Cum Ex""-Tagebuchstreit: Banker scheitert mit Beschwerde";https://www.zeit.de/news/2024-04/22/cum-ex-tagebuchstreit-banker-scheitert-mit-beschwerde;"Hier finden Sie Informationen zu dem Thema „Bundesverfassungsgericht“. Lesen Sie jetzt „""Cum Ex""-Tagebuchstreit: Banker scheitert mit Beschwerde“.";"Z+ (abopflichtiger Inhalt);
        
    
Bundesverfassungsgericht";News, Bundesverfassungsgericht, Christian Olearius, Bundesverfassungsgericht, Bundesgerichtshof, Beschwerde;2024-04-22T13:44:33+02:00;2024-04-22T13:44:33+02:00;;dpa;false
9849f204f82ec89edd57fa20e69a7b49a0bcae4dd70027f4f3a7219c0aa5f1b6;"Ärzte in Australien: ""Keine Giftschlangen mitbringen""";https://www.zeit.de/news/2024-04/22/aerzte-in-australien-keine-giftschlangen-mitbringen;"Hier finden Sie Informationen zu dem Thema „Tiere“. Lesen Sie jetzt „Ärzte in Australien: ""Keine Giftschlangen mitbringen""“.";"Z+ (abopflichtiger Inhalt);
        
    
Tiere";News, Tiere, Adam Michael, Australien, Aruba, Queensland, Rheinberg, Terrazoo, Klapperschlange, Terrarium, Schlangenbissen, Tiere;2024-04-22T13:44:13+02:00;2024-04-22T13:44:13+02:00;;dpa;false
5dcff9fa20788de8faee99e7f425753b7697db7870d6049ecf4995347270c4b0;BVB setzt nach Watzke-Ära auf Ricken;https://www.zeit.de/news/2024-04/22/ricken-wird-sport-geschaeftsfuehrer-beim-bvb;Hier finden Sie Informationen zu dem Thema „Bundesliga“. Lesen Sie jetzt „BVB setzt nach Watzke-Ära auf Ricken“.;"Z+ (abopflichtiger Inhalt);
        
    
Bundesliga";News, Bundesliga, Lars Ricken, Hans-Joachim Watzke, Dortmund, BVB, Bundesliga;2024-04-22T13:43:26+02:00;2024-04-22T13:43:26+02:00;;dpa;false
