Hash;Title;Link;Description;Category;KeyWords;Published;LastUpdated;Author;Source;Paywall
2e8e5d63e039e5d06e6e163acdfab60b23361fa97af048f66c0ffbcfe7ee392e;Mord an Pasolini beschäftigt Italien noch immer;https://www.zeit.de/news/2025-11/01/mord-an-pasolini-beschaeftigt-italien-noch-immer;Hier finden Sie Informationen zu dem Thema „Filmgeschichte“. Lesen Sie jetzt „Mord an Pasolini beschäftigt Italien noch immer“.;Filmgeschichte;News, Filmgeschichte, Pier Paolo Pasolini, Giuseppe Pelosi, Al Biondo, Aldo Moro, Giovanni Falcone, Paolo Borsellino, Italien, Rom, Tiber, Tevere;2025-11-01T10:00:05+01:00;2025-11-01T10:00:05+01:00;;dpa;false
9b08c7ab205b1e80e221271f5362a5245b87989f9db9a45c408d16cefe029574;Halloween-Nacht in Hessen verläuft überwiegend ruhig;https://www.zeit.de/news/2025-11/01/halloween-nacht-in-hessen-verlaeuft-ueberwiegend-ruhig;Hier finden Sie Informationen zu dem Thema „Keine größeren Einsätze“. Lesen Sie jetzt „Halloween-Nacht in Hessen verläuft überwiegend ruhig“.;Keine größeren Einsätze;News, Keine größeren Einsätze, Hessen, Polizei, Böllerwurf;2025-11-01T09:59:35+01:00;2025-11-01T09:59:35+01:00;;dpa Hessen;false
12a8ac9ba8e9288f04eeee07a2cbbcfb8af38b56cb6500a95e8e54ad9bc53e0f;Ukrainische Drohnen greifen erneut Moskauer Umland an;https://www.zeit.de/news/2025-11/01/ukrainische-drohnen-greifen-erneut-moskauer-umland-an;Hier finden Sie Informationen zu dem Thema „Ukraine-Krieg“. Lesen Sie jetzt „Ukrainische Drohnen greifen erneut Moskauer Umland an“.;Ukraine-Krieg;News, Ukraine-Krieg, Sergej Sobjanin, Moskau, Telegram, Drohne, Krieg in der Ukraine;2025-11-01T09:58:41+01:00;2025-11-01T09:58:41+01:00;;dpa;false
7eb1c10121b481ceeea2b323917a7b38a8ec5cd059ac67de3cbc4e703caccb23;Niederlande bekommen wohl einen First Gentleman;https://www.zeit.de/news/2025-11/01/niederlande-bekommen-wohl-einen-first-gentleman;Hier finden Sie Informationen zu dem Thema „Niederlande“. Lesen Sie jetzt „Niederlande bekommen wohl einen First Gentleman“.;Niederlande;News, Niederlande, Rob Jetten, Königin Máxima, Niederlande, Buenos Aires, Argentinien, Den Haag, WM-Finale;2025-11-01T09:54:23+01:00;2025-11-01T09:54:23+01:00;;dpa;false
f82d5f6774cdc21f3873c59cfa5b444db8c3326621ea34c1b94414191db5ec51;Autofahrer soll Fußgänger absichtlich angefahren haben;https://www.zeit.de/news/2025-11/01/autofahrer-soll-fussgaenger-absichtlich-angefahren-haben;Hier finden Sie Informationen zu dem Thema „Verkehr“. Lesen Sie jetzt „Autofahrer soll Fußgänger absichtlich angefahren haben“.;Verkehr;News, Verkehr, Verkehr;2025-11-01T09:52:21+01:00;2025-11-01T09:52:21+01:00;;dpa Nordrhein-Westfalen;false
b1bb8a13e7ac2adcd48da6a9d4d6b083d86f53836eac56feeb85eb065b008bb2;Auto gerät in Vollbrand - Fahrer stirbt;https://www.zeit.de/news/2025-11/01/auto-geraet-in-vollbrand-fahrer-stirbt;Hier finden Sie Informationen zu dem Thema „Oberpfalz“. Lesen Sie jetzt „Auto gerät in Vollbrand - Fahrer stirbt“.;Oberpfalz;News, Oberpfalz, Oberpfalz, Polizei, Vollbrand, Unfall, Auto;2025-11-01T09:49:54+01:00;2025-11-01T09:49:54+01:00;;dpa Bayern;false
2a9d7da7425846fe4156a00b09c270b916694865db2b5bbf3a250603f65e6a5b;"Hunderte ""Unfug-Einsätze"": Halloween-Nacht im Südwesten";https://www.zeit.de/news/2025-11/01/hunderte-einsaetze-in-halloween-nacht-in-baden-wuerttemberg;"Hier finden Sie Informationen zu dem Thema „Eier und Pyrotechnik“. Lesen Sie jetzt „Hunderte ""Unfug-Einsätze"": Halloween-Nacht im Südwesten“.";Eier und Pyrotechnik;News, Eier und Pyrotechnik, Freiburg, Baden-Württemberg, Polizei, Pyrotechnik;2025-11-01T09:47:45+01:00;2025-11-01T09:47:45+01:00;;dpa Baden-Württemberg;false
3b3dbddd6571f64bb743fe82fa3f8fa33dc51e9a581e32dadb39db467c0ea884;Amtsbeginn für Stalzer in Herdecke - Kritik auch an Merz;https://www.zeit.de/news/2025-11/01/amtsbeginn-fuer-herdeckes-buergermeisterin-nach-messerangriff;Hier finden Sie Informationen zu dem Thema „Vor der Vereidigung“. Lesen Sie jetzt „Amtsbeginn für Stalzer in Herdecke - Kritik auch an Merz“.;Vor der Vereidigung;News, Vor der Vereidigung, Iris Stalzer, Herdecke, SPD, Kommunalwahl, Messerangriff, Amtsbeginn, Vereidigung;2025-11-01T09:46:24+01:00;2025-11-01T09:46:24+01:00;;dpa Nordrhein-Westfalen;false
8a78528f3f02ee6ae45532d3c44655cc50a50add575018f455a77a1344a7ed77;Drei von der Hamas übergebene Leichen waren laut Israel keine Geiseln;https://www.zeit.de/politik/ausland/2025-10/krieg-gaza-israel-hamas-liveblog;Nach Untersuchungen gab Israel bekannt, dass keine der kürzlich übergebenen Leichen eine Geisel war. Außenminister Wadephul fordert Friedensplan für Nahost. Das Liveblog;Liveblog:                     Krieg in Gaza;Politik, Krieg in Gaza, Israel, Gazastreifen, Nahost, Hamas, Benjamin Netanjahu, Militär;2025-11-01T09:33:40+01:00;2025-11-01T09:33:40+01:00;Katharina BenninghoffEric Voigt;;false
9b4c1151e93bd7726a42c1cd473b9607e7785fc92ecb83d5790ebe0fa67672fd;Zweiter Shutdown-Monat in den USA;https://www.zeit.de/news/2025-11/01/zweiter-shutdown-monat-in-den-usa;Hier finden Sie Informationen zu dem Thema „Haushaltsblockade“. Lesen Sie jetzt „Zweiter Shutdown-Monat in den USA“.;Haushaltsblockade;News, Haushaltsblockade, USA, Demokraten (USA), Haushaltsblockade, Haushaltsstreit, Regierungsgeschäft, Eis;2025-11-01T09:32:56+01:00;2025-11-01T09:32:56+01:00;;dpa;false
1afa11214e7120dc81c58935da1e578f68e72ce158ff54a0b83ee066398ece17;Ukraine und Russland erobern Gebiete in der Region Donezk;https://www.zeit.de/politik/ausland/karte-ukraine-krieg-russland-frontverlauf-truppenbewegungen;Streitkräfte beider Seiten haben Siedlungen im Nordwesten der Region Donezk eingenommen. Auch nahe der Stadt Pokrowsk rückten ukrainische Kräfte marginal vor.;Ukrainekarte aktuell;Politik, Ukrainekarte aktuell, Krieg in der Ukraine, Russland, Donezk, Charkiw, Militär, Streitkräfte, Drohne;2025-11-01T09:32:47+01:00;2025-11-01T09:32:47+01:00;Elizabeth RushtonTimo StukenbergChristina FelschenJustus WilkePauline PieperJulius TrögerBenja Zehr;;false
c5f0c297ac7c994362479118e132056f1b6895064396406662069e9fe6478daf;Mutter-Kind-Kur? Mein Gamechanger;https://www.zeit.de/familie/2025-11/eltern-kind-kur-muetter-stress-klinik;Wie sollen drei Wochen in einer Eltern-Kind-Kur tatsächlich und nachhaltig etwas bewirken? Unsere Autorin war dort – und kam mit einer neuen Version ihrer Selbst zurück.;"Z+ (abopflichtiger Inhalt);
        
    Eltern-Kind-Kur";Familie, Eltern-Kind-Kur, Eltern, Stress, Familie, Gesundheitssystem, Mütter, Väter;2025-11-01T09:27:38+01:00;2025-11-01T09:27:38+01:00;Sarah Borufka;;false
d7e75beedd5f9446a167a77f8fbf966580f36870debb48970c2a08244080a169;Niedersachsen und Bremen: ruhige Halloween-Nacht für Polizei;https://www.zeit.de/news/2025-11/01/niedersachsen-und-bremen-ruhige-halloween-nacht-fuer-polizei;Hier finden Sie Informationen zu dem Thema „Kriminalität“. Lesen Sie jetzt „Niedersachsen und Bremen: ruhige Halloween-Nacht für Polizei“.;Kriminalität;News, Kriminalität, Niedersachsen, Bremen, Polizei, Kriminalität;2025-11-01T09:14:59+01:00;2025-11-01T09:14:59+01:00;;dpa Niedersachsen;false
ef9a8b6aea0caf323e020fc2b0d6c397e1fd4b64c39037519462de4a28d66757;Drohnen-Sichtung – Flugbetrieb am BER läuft ohne Störung;https://www.zeit.de/news/2025-11/01/drohnen-sichtung-keine-beeintraechtigungen-mehr-am-ber;Hier finden Sie Informationen zu dem Thema „Störung Hauptstadtflughafen“. Lesen Sie jetzt „Drohnen-Sichtung – Flugbetrieb am BER läuft ohne Störung“.;Störung Hauptstadtflughafen;News, Störung Hauptstadtflughafen, BER, Beeinträchtigung, Hauptstadtflughafen, Pausierung, Sichtung, Drohne;2025-11-01T09:08:00+01:00;2025-11-01T09:08:00+01:00;;dpa Berlin/Brandenburg;false
9d843454a49f9e85586926fd7eb2187ca0932bb74adce259b83bed74d0800d5f;Wochenende startet sonnig und mit bis zu 18 Grad;https://www.zeit.de/news/2025-11/01/wochenende-startet-sonnig-und-mit-bis-zu-18-grad;Hier finden Sie Informationen zu dem Thema „Wetterausblick“. Lesen Sie jetzt „Wochenende startet sonnig und mit bis zu 18 Grad“.;Wetterausblick;News, Wetterausblick, Wetterausblick;2025-11-01T09:04:42+01:00;2025-11-01T09:04:42+01:00;;dpa Berlin/Brandenburg;false
75b095d7a0f74e20b9c9ca736e1f1e65767c8bf96e670a8e93d09e105e0d2f2d;Israel: Von Hamas übergebene Leichen keine Geiseln;https://www.zeit.de/news/2025-11/01/israel-von-hamas-uebergebene-leichen-keine-geiseln;Hier finden Sie Informationen zu dem Thema „Konflikt in Nahost“. Lesen Sie jetzt „Israel: Von Hamas übergebene Leichen keine Geiseln“.;Konflikt in Nahost;News, Konflikt in Nahost, Donald Trump, Nahost, Israel, Gazastreifen, Hamas, Konflikt;2025-11-01T09:03:52+01:00;2025-11-01T09:03:52+01:00;;dpa;false
99b4dbdf1798c767f328530eeeb0069ff49a88c9ad3edb2f31b111437d558b20;"""Sollen wir jetzt etwa sagen, wir vergessen das Ganze?""";https://www.zeit.de/wirtschaft/2025-10/ottmar-edenhofer-klimaschaeden-klimafolgen-klimapolitik-weltpolitik;Bill Gates sagt, der Klimawandel ist nicht unser größtes Problem. Der Ökonom Ottmar Edenhofer widerspricht: Klimaschäden bleiben. Und erfordern eine effizientere Politik.;"Z+ (abopflichtiger Inhalt);
        
    Ottmar Edenhofer";Wirtschaft, Ottmar Edenhofer, USA, Europa, Potsdam, Klimapolitik, Naturkatastrophe, Klimaschaden;2025-11-01T08:57:58+01:00;2025-11-01T08:57:58+01:00;Uwe Jean Heuser;;false
f5731c1a5fdf14a620ecd859b23a96ba201da00ebae8e4b3278ae7526b394ad3;Nagel in Halloween-Süßigkeit gefunden;https://www.zeit.de/news/2025-11/01/nagel-in-halloween-suessigkeit-gefunden;Hier finden Sie Informationen zu dem Thema „Vorfall in Mittelfranken“. Lesen Sie jetzt „Nagel in Halloween-Süßigkeit gefunden“.;Vorfall in Mittelfranken;News, Vorfall in Mittelfranken, Dinkelsbühl, Mittelfranken, Landkreis Ansbach, Polizei;2025-11-01T08:51:02+01:00;2025-11-01T08:51:02+01:00;;dpa Bayern;false
a2efebef40ee7215bca7e9ae9277c8a75257f0d4415295ed2fdbd2c96996a00b;Mann wird aus Auto geschleudert und stirbt;https://www.zeit.de/news/2025-11/01/mann-wird-aus-auto-geschleudert-und-stirbt;Hier finden Sie Informationen zu dem Thema „Unfälle“. Lesen Sie jetzt „Mann wird aus Auto geschleudert und stirbt“.;Unfälle;News, Unfälle, Unfall, Auto;2025-11-01T08:49:47+01:00;2025-11-01T08:49:47+01:00;;dpa Bayern;false
431f9a5136f039ab80147743730cb77a7655b5b483587d331024168ac614e8b5;Autoflucht endet mit Aufprall gegen Baum;https://www.zeit.de/news/2025-11/01/autoflucht-endet-mit-aufprall-gegen-baum;Hier finden Sie Informationen zu dem Thema „Unfälle“. Lesen Sie jetzt „Autoflucht endet mit Aufprall gegen Baum“.;Unfälle;News, Unfälle, Polizei, Autoflucht, Aufprall, Unfall, Auto;2025-11-01T08:40:45+01:00;2025-11-01T08:40:45+01:00;;dpa Hamburg/Schleswig-Holstein;false
b4848dc7581855e51158b7eefbdad5376e6864f8749f337753773afff3056f5f;Türkischer Fußballverband sperrt fünf Schiedsrichter aus der Süper Lig;https://www.zeit.de/sport/2025-11/sportwetten-wettskandal-tuerkei-fussballverband-suspendiert-schiedsrichter;In der Türkei sollen fünf Schiedsrichter aus der obersten Spielklasse Sportwetten abgeschlossen haben. Gegen zwei weitere Süper-Lig-Referees wird noch ermittelt.;Wettskandal im türkischen Fußball;Sport, Wettskandal im türkischen Fußball, Türkei, Fußball, Schiedsrichter, Sportwette, Suspendierung;2025-11-01T08:34:32+01:00;2025-11-01T08:34:32+01:00;Eric Voigt;;false
fcaf71deb4a1bf0216e3ca6a74f5a571c1970dab9bf351efb0fcd919e0533be3;Ein Bewohner wird bei Brand auf Hochhaus-Balkon verletzt;https://www.zeit.de/news/2025-11/01/ein-bewohner-wird-bei-brand-auf-hochhaus-balkon-verletzt;Hier finden Sie Informationen zu dem Thema „Einsatz“. Lesen Sie jetzt „Ein Bewohner wird bei Brand auf Hochhaus-Balkon verletzt“.;Einsatz;News, Einsatz, Polizei;2025-11-01T08:34:06+01:00;2025-11-01T08:34:06+01:00;;dpa Baden-Württemberg;false
3707c97c13d3219047b2c378d67866ff925089f447f7100f4addc6303d76b9a1;NRW-Wetter: Regnerisches Wochenende erwartet;https://www.zeit.de/news/2025-11/01/nrw-wetter-regnerisches-wochenende-erwartet;Hier finden Sie Informationen zu dem Thema „Wetterprognose“. Lesen Sie jetzt „NRW-Wetter: Regnerisches Wochenende erwartet“.;Wetterprognose;News, Wetterprognose, Nordrhein-Westfalen, Wetterprognose, Wetter;2025-11-01T08:28:19+01:00;2025-11-01T08:28:19+01:00;;dpa Nordrhein-Westfalen;false
8dbcad07d6efd084addc4548b4c8087b53d6c4d58e9b625be1c8369329a04a70;Ruhige Halloween-Nacht in Mecklenburg-Vorpommern;https://www.zeit.de/news/2025-11/01/ruhige-halloween-nacht-in-mecklenburg-vorpommern;Hier finden Sie Informationen zu dem Thema „Kriminalität“. Lesen Sie jetzt „Ruhige Halloween-Nacht in Mecklenburg-Vorpommern“.;Kriminalität;News, Kriminalität, Mecklenburg-Vorpommern, Kriminalität;2025-11-01T08:23:00+01:00;2025-11-01T08:23:00+01:00;;dpa Mecklenburg-Vorpommern;false
ca79837006e27aa0ea20d2d033ae3c422ce3c62af82a19f53c0be35336d0f500;Mann in Detmold bei Zimmerbrand von Feuerwehr geweckt;https://www.zeit.de/news/2025-11/01/mann-in-detmold-bei-zimmerbrand-von-feuerwehr-geweckt;Hier finden Sie Informationen zu dem Thema „Brand“. Lesen Sie jetzt „Mann in Detmold bei Zimmerbrand von Feuerwehr geweckt“.;Brand;News, Brand, Detmold, Feuerwehr, Zimmerbrand;2025-11-01T08:16:11+01:00;2025-11-01T08:16:11+01:00;;dpa Nordrhein-Westfalen;false
5bdd83f5c5802748cd7a51252019a1f48a974ec92a45f84d004fb4b2d3176d67;Halloween-Dieb stiehlt Schmuckschatulle bei 78-Jährigem;https://www.zeit.de/news/2025-11/01/halloween-dieb-stiehlt-schmuckschatulle-bei-78-jaehrigen;Hier finden Sie Informationen zu dem Thema „Kriminalität“. Lesen Sie jetzt „Halloween-Dieb stiehlt Schmuckschatulle bei 78-Jährigem“.;Kriminalität;News, Kriminalität, Schmuckschatulle, Süßigkeit, Kriminalität, Schmuck;2025-11-01T08:10:10+01:00;2025-11-01T08:10:10+01:00;;dpa Rheinland-Pfalz/Saarland;false
70bad2a5a32510cdb3aff5a712277f1943eb02bafdaba515cf6e61847a5ac82a;Kirche nach Brand einsturzgefährdet;https://www.zeit.de/news/2025-11/01/kirche-nach-brand-einsturzgefaehrdet;Hier finden Sie Informationen zu dem Thema „Kreis Dithmarschen“. Lesen Sie jetzt „Kirche nach Brand einsturzgefährdet“.;Kreis Dithmarschen;News, Kreis Dithmarschen, Hamburg, Kreis Dithmarschen, Polizei, Pauluskirche;2025-11-01T08:08:23+01:00;2025-11-01T08:08:23+01:00;;dpa Hamburg/Schleswig-Holstein;false
803b055ab8176208bce00a86bf47cd032f43d45802e1ead345b4b50b5aa514d8;Weitgehend ruhige Halloween-Nacht in NRW;https://www.zeit.de/news/2025-11/01/weitgehend-ruhige-halloween-nacht-in-nrw;Hier finden Sie Informationen zu dem Thema „Halloweennacht“. Lesen Sie jetzt „Weitgehend ruhige Halloween-Nacht in NRW“.;Halloweennacht;News, Halloweennacht, NRW, Nordrhein-Westfalen, Hagen, Polizei, Halloweennacht, Pyrotechnik;2025-11-01T07:59:57+01:00;2025-11-01T07:59:57+01:00;;dpa Nordrhein-Westfalen;false
9611d38b5fe933ea826def0f4434b8ef16fb8c5ecf4fe4da9e86a25e9a1ec2ce;Auto erfasst Fußgängerin - 18-Jährige stirbt;https://www.zeit.de/news/2025-11/01/auto-erfasst-fussgaengerin-21-jaehrige-stirbt;Hier finden Sie Informationen zu dem Thema „Zittau“. Lesen Sie jetzt „Auto erfasst Fußgängerin - 18-Jährige stirbt“.;Zittau;News, Zittau, Zittau, Polizei, Auto;2025-11-01T07:34:50+01:00;2025-11-01T07:34:50+01:00;;dpa Sachsen;false
a5791c97e641f2bcf916286ff199387d440b70b07b4cddfe702bb3ade552e98f;Heidi Klum als monströse Medusa - Tom zu Stein erstarrt;https://www.zeit.de/news/2025-11/01/messerscharfe-zaehne-heidi-klum-gibt-gruseligen-einblick;Hier finden Sie Informationen zu dem Thema „Halloween-Party in New York“. Lesen Sie jetzt „Heidi Klum als monströse Medusa - Tom zu Stein erstarrt“.;Halloween-Party in New York;News, Halloween-Party in New York, Tom Kaulitz, Heidi Klum, Kostüm, Zahn, Einblick, Halloweenparty;2025-11-01T07:26:21+01:00;2025-11-01T07:26:21+01:00;;dpa;false
71f68edb1040c9d5d2f585e922d08b4f6919885d642da9c6853e04e1e655154e;Weißes Haus erschwert Reportern Arbeit, Trump dementiert Angriffsplan;https://www.zeit.de/politik/ausland/2025-11/us-ueberblick-trump-venezuela-lebensmittelhilfe-shutdown;Das Weiße Haus schränkt den Zugang zum Pressebereich im Weißen Haus für Journalisten ein. Bisher sind offenbar keine US-Luftangriffe auf Venezuela geplant. Die Nacht;US-Überblick am Morgen;Politik, US-Überblick am Morgen, USA, Washington, Shutdown, Donald Trump, Venezuela, Lebensmittel;2025-11-01T07:23:39+01:00;2025-11-01T07:23:39+01:00;jspkmi;DIE ZEIT,        Reuters,        AFP,        AP,        dpa,        							jsp					,        							kmi;false
7673946dcaecab4b9fa1cbce1da6bfa6ddb927968a8e6af68ab0fb8be0850087;Halloween-Nacht fordert Polizei mit zahlreichen Einsätzen;https://www.zeit.de/news/2025-11/01/halloween-nacht-fordert-polizei-mit-zahlreichen-einsaetzen;Hier finden Sie Informationen zu dem Thema „Bad-Kreuznach“. Lesen Sie jetzt „Halloween-Nacht fordert Polizei mit zahlreichen Einsätzen“.;Bad-Kreuznach;News, Bad-Kreuznach, Polizei;2025-11-01T07:17:10+01:00;2025-11-01T07:17:10+01:00;;dpa Rheinland-Pfalz/Saarland;false
8e0f911c9334b0edefa04a948736a2b6c02398f1c5f0dc51b63278a0dd67fa60;Allerheiligen startet mild – später folgen Regen und Sturm;https://www.zeit.de/news/2025-11/01/allerheiligen-startet-mild-spaeter-folgen-regen-und-sturm;Hier finden Sie Informationen zu dem Thema „Wetter“. Lesen Sie jetzt „Allerheiligen startet mild – später folgen Regen und Sturm“.;Wetter;News, Wetter, Südwest, Feldberg, Wetter, Wald;2025-11-01T07:15:29+01:00;2025-11-01T07:15:29+01:00;;dpa Baden-Württemberg;false
b1f79d2df8f76e7169748ea12bfeaf8215aef752482d8f6c29214407f31f5c41;Wahlkommission Tansanias erklärt Präsidentin Hassan zur Wahlsiegerin;https://www.zeit.de/politik/ausland/2025-11/tansania-wahlen-ergebnis-proteste-ausschreitungen-tote;Bei der umstrittenen Wahl in Tansania wurde Samia Suluhu Hassan wiedergewählt. Der Ausschluss der größten Oppositionspartei führte zuvor zu gewalttätigen Protesten.;Tansania;Politik, Tansania, Tansania, Protest, Demokratie, Opposition, Wahlergebnis;2025-11-01T07:10:39+01:00;2025-11-01T07:10:39+01:00;voi;DIE ZEIT,        Reuters,        dpa,        							voi;false
5c0e93dc3439d0dbc940be65f2d79ea4327bd9fe11c45104b682e960ac14f6e3;"Kovac genügt diesmal die A-Note: ""Die haben wir bestanden""";https://www.zeit.de/news/2025-11/01/kovac-genuegt-diesmal-die-a-note-die-haben-wir-bestanden;"Hier finden Sie Informationen zu dem Thema „Fußball-Bundesliga“. Lesen Sie jetzt „Kovac genügt diesmal die A-Note: ""Die haben wir bestanden""“.";Fußball-Bundesliga;News, Fußball-Bundesliga, Sebastian Kehl, Niko Kovač, Augsburg, Borussia Dortmund, Fußball-Bundesliga, Arbeitssieg;2025-11-01T06:52:06+01:00;2025-11-01T06:52:06+01:00;;dpa Bayern;false
a9f958a4915335681b9752b134aee627bdf615b8b88909efe62d126903e4c8d7;Frau verletzt sich bei Verfolgung mutmaßlicher Eierwerfer;https://www.zeit.de/news/2025-11/01/frau-verletzt-sich-bei-verfolgung-mutmasslicher-eierwerfer;Hier finden Sie Informationen zu dem Thema „Stuttgart“. Lesen Sie jetzt „Frau verletzt sich bei Verfolgung mutmaßlicher Eierwerfer“.;Stuttgart;News, Stuttgart, Stuttgart, Verfolgung;2025-11-01T06:33:41+01:00;2025-11-01T06:33:41+01:00;;dpa Baden-Württemberg;false
25e9e4517a8b8e0426c84dd7d8d5a485397b2c2b3760e554a3320e9a30a554e4;Fahrkarten für Bus und Bahn werden 2026 vielerorts teurer;https://www.zeit.de/mobilitaet/2025-11/bus-bahn-tickets-preissteigerung-2026;Nicht nur der Preis des Deutschlandtickets steigt kommendes Jahr. Viele Verkehrsverbünde heben ihre Preise für Fahrkarten im ÖPNV ebenfalls an – weil Geld fehlt. ;Öffentliche Verkehrsmittel;Mobilitaet, Öffentliche Verkehrsmittel, Nordrhein-Westfalen, Bremen, Niedersachsen, Deutschlandticket, Nahverkehr;2025-11-01T06:19:37+01:00;2025-11-01T06:19:37+01:00;peng;DIE ZEIT,        dpa,        							peng;false
415393813cbc676604c25b7a793dd836fe001f4ea2b103c3be767e23a3ed730d;"""Die Republikaner wollen diesen Schmerz""";https://www.zeit.de/politik/ausland/2025-10/shutdown-usa-krankenversicherung-obamacare-lebensmittelhilfe-snap;So langsam geht der Shutdown in den USA an die Substanz. Nun trifft es auch die Lebensmittelhilfen – die gerade jetzt viele nötig haben, die nicht mehr bezahlt werden.;"Z+ (abopflichtiger Inhalt);
        
    Shutdown in den USA";Politik, Shutdown in den USA, USA, Shutdown, Washington, US-Regierung, Donald Trump, Obamacare;2025-11-01T06:17:04+01:00;2025-11-01T06:17:04+01:00;Juliane Schäuble;;false
9f7c3a5fe9cb46b819fce60705f92451a873b6e25375a0e0d8aa3cd064cd290d;Protest-Plakate: Wagner stellt sich den FCA-Fans;https://www.zeit.de/news/2025-11/01/protest-plakate-wagner-stellt-sich-den-fca-fans;Hier finden Sie Informationen zu dem Thema „Fußball-Bundesliga“. Lesen Sie jetzt „Protest-Plakate: Wagner stellt sich den FCA-Fans“.;Fußball-Bundesliga;News, Fußball-Bundesliga, Sandro Wagner, Augsburg, Borussia Dortmund, FC Augsburg, Fußball-Bundesliga;2025-11-01T06:13:06+01:00;2025-11-01T06:13:06+01:00;;dpa Bayern;false
0cfa2301705e925e47a2b5aa449a0feed8c9817567ee3928fa14ac7d57a57ad1;Endlich 30 Urlaube im Jahr!;https://www.zeit.de/digital/internet/2025-10/ki-generierte-urlaubsfotos-endless-summer-app;Mit der App Endless Summer kann jeder um die Welt reisen, die KI generiert Hochglanzurlaubsfotos für wenig Geld. Wird das die Influencer-Kultur zerstören?;"Z+ (abopflichtiger Inhalt);
        
    KI-generierte Urlaubsfotos";Digital, KI-generierte Urlaubsfotos, Urlaub, Fotografie, App, künstliche Intelligenz, Reisen, Soziale Medien;2025-11-01T06:11:15+01:00;2025-11-01T06:11:15+01:00;Rose Tremlett;;false
355d693cdff1b56956f3503027075a0b35f827dcfc0fba28167e7684caea68ba;Experte: Vorbehalte bremsen E-Government in Thüringen aus;https://www.zeit.de/news/2025-11/01/experte-vorbehalte-bremsen-e-government-in-thueringen-aus;Hier finden Sie Informationen zu dem Thema „Verwaltung“. Lesen Sie jetzt „Experte: Vorbehalte bremsen E-Government in Thüringen aus“.;Verwaltung;News, Verwaltung, Sven Müller-Grune, Thüringen, Deutsche Presse-Agentur, Vorbehalt, E-Government, Digitalisierung;2025-11-01T06:05:06+01:00;2025-11-01T06:05:06+01:00;;dpa Thüringen;false
fc869268a2c9cf46bdd0467a48963534382f63893f66f61a79bfea04d84ad4c3;Volkshochschulen am Limit - Land deckelt Zuschüsse;https://www.zeit.de/news/2025-11/01/volkshochschulen-am-limit-land-deckelt-zuschuesse;Hier finden Sie Informationen zu dem Thema „Volkshochschulen“. Lesen Sie jetzt „Volkshochschulen am Limit - Land deckelt Zuschüsse“.;Volkshochschulen;News, Volkshochschulen, Ludwigslust-Parchim, Rostock, Mecklenburg-Vorpommern, Kreistag, VHS, Volkshochschule, Zuschuss, Gebührensteigerung;2025-11-01T06:00:20+01:00;2025-11-01T06:00:20+01:00;;dpa Mecklenburg-Vorpommern;false
3d06f9927ebf4a1ca252a278c9751a3638829123ed164113c21d3ca4c497e778;Grippe und Covid erhöhen Herzinfarkt- und Schlaganfallrisiko;https://www.zeit.de/news/2025-11/01/grippe-und-covid-erhoehen-herzinfarkt-und-schlaganfallrisiko;Hier finden Sie Informationen zu dem Thema „Krankheiten“. Lesen Sie jetzt „Grippe und Covid erhöhen Herzinfarkt- und Schlaganfallrisiko“.;Krankheiten;News, Krankheiten, Kosuke Kawai, Los Angeles, University of California, American Heart Association, Schlaganfallrisiko, Grippe, Grippevirus, Schlaganfall, Herzinfarkt, Infektion;2025-11-01T06:00:16+01:00;2025-11-01T06:00:16+01:00;;dpa;false
3c7952c568a7b9cd7d3e6b10fcd69bab8251343e44afe29b6dde0bf4a143fccf;Nordische Filmtage - Eröffnung mit dänischer Komödie;https://www.zeit.de/news/2025-11/01/nordische-filmtage-eroeffnung-mit-daenischer-komoedie;Hier finden Sie Informationen zu dem Thema „Filmfestival startet“. Lesen Sie jetzt „Nordische Filmtage - Eröffnung mit dänischer Komödie“.;Filmfestival startet;News, Filmfestival startet, Lübeck, Nordeuropa, baltische Staaten, Nordische Filmtage Lübeck, Filmfestival, Eröffnung, Dokumentarfilm, Anziehungspunkt, Hansestadt;2025-11-01T06:00:15+01:00;2025-11-01T06:00:15+01:00;;dpa Hamburg/Schleswig-Holstein;false
e929d1db891a16e7b05072e3bccc88330663809796a654359e56f42451c83fcf;Satelliteninternet stößt auf großes Interesse in Deutschland;https://www.zeit.de/news/2025-11/01/satelliteninternet-stoesst-auf-grosses-interesse-in-deutschland;Hier finden Sie Informationen zu dem Thema „Internet aus dem Weltall“. Lesen Sie jetzt „Satelliteninternet stößt auf großes Interesse in Deutschland“.;Internet aus dem Weltall;News, Internet aus dem Weltall, YouGov, DE-CIX, Satelliteninternet, Weltall, Satellitenverbindung;2025-11-01T06:00:13+01:00;2025-11-01T06:00:13+01:00;;dpa;false
5bfffc264c5d34d929118c954fc3ae37e260af08f3fa548245567ede048251f4;Wolfspopulation wächst – Straßenverkehr oft Todesfalle;https://www.zeit.de/news/2025-11/01/wolfspopulation-waechst-strassenverkehr-oft-todesfalle;Hier finden Sie Informationen zu dem Thema „Wölfe“. Lesen Sie jetzt „Wolfspopulation wächst – Straßenverkehr oft Todesfalle“.;Wölfe;News, Wölfe, Till Backhaus, Mecklenburg-Vorpommern, SPD, Wolfspopulation, Todesfalle, Straßenverkehr, Wölfe, Tiere, Fahrzeug, Auto;2025-11-01T06:00:09+01:00;2025-11-01T06:00:09+01:00;;dpa Mecklenburg-Vorpommern;false
a355b4d939acc3a0721525c10754b6f01a0153573f36fd05e2bdccb60e53d9a7;Polizei spricht von vergleichsweise ruhiger Halloween-Nacht;https://www.zeit.de/news/2025-11/01/polizei-spricht-von-vergleichsweise-ruhiger-halloween-nacht;Hier finden Sie Informationen zu dem Thema „Keine größeren Störungen“. Lesen Sie jetzt „Polizei spricht von vergleichsweise ruhiger Halloween-Nacht“.;Keine größeren Störungen;News, Keine größeren Störungen, Berlin, Polizei, Störung;2025-11-01T05:51:48+01:00;2025-11-01T05:51:48+01:00;;dpa Berlin/Brandenburg;false
