Hash;Title;Link;Description;Category;KeyWords;Published;LastUpdated;Author;Source;Paywall
9cb0664739a442397f43ce64c702e0848eae9ab8afdef129f47c46f47c960c4b;FC Bayern verlängert mit Fußball-Nationalspielerin Lohmann;https://www.zeit.de/news/2024-03/16/fc-bayern-verlaengert-mit-fussball-nationalspielerin-lohmann;Hier finden Sie Informationen zu dem Thema „Personalie“. Lesen Sie jetzt „FC Bayern verlängert mit Fußball-Nationalspielerin Lohmann“.;Personalie;News, Personalie, Sydney Lohmann, München, Bayern, FC Bayern München;2024-03-16T15:35:42+01:00;2024-03-16T15:35:42+01:00;;dpa Bayern;false
05b945bd3235ba016ca24f3dd1f75ce80db05b525b67dc95b8237eea00cfa20d;SPD will mit Zehn-Punkte-Plan die Wirtschaft fördern;https://www.zeit.de/politik/deutschland/2024-03/wirtschaftspolitik-spd-zehn-punkte-plan-angebot;Weniger Bürokratie, verlässliche Energiekosten, Entlastungen bei der Steuer: Die SPD will mit einer Angebotspolitik bei den Koalitionspartnern und der Wirtschaft punkten.;Wirtschaftspolitik;Politik, Wirtschaftspolitik, SPD, Lars Klingbeil, Wirtschaftspolitik, Bürokratie, Digitalisierung, Steuer;2024-03-16T15:35:02+01:00;2024-03-16T15:35:02+01:00;;ZEIT ONLINE,        Reuters,        AFP,        tgr;false
973d836d666d9af5109a51c14b15042001adeb94b26bd50322c56620af7ddca9;Olaf Scholz warnt vor israelischer Offensive in Rafah;https://www.zeit.de/politik/deutschland/2024-03/krieg-nahost-scholz-mahnung-netanjahu-bodenoffensive-rafah;Hunderttausende Menschen suchen in Rafah Zuflucht. Eine Bodenoffensive könne dort zu großem menschlichen Unglück führen, sagte der Bundeskanzler vor seiner Israel-Reise.;Krieg in Nahost;Politik, Krieg in Nahost, Nahostkrieg, Olaf Scholz, Benjamin Netanjahu, Gazastreifen, Waffenstillstand, Militär;2024-03-16T15:34:27+01:00;2024-03-16T15:34:27+01:00;;ZEIT ONLINE,        Reuters,        ces;false
4c766db144d1f5f71b6efb9ee36093ade2cb348074771e95a2b834714b6fbfd6;Annäherung an Unendlichkeit: Rekord bei Pi-Wettbewerb;https://www.zeit.de/news/2024-03/16/annaeherung-an-unendlichkeit-rekord-bei-pi-wettbewerb;Hier finden Sie Informationen zu dem Thema „Buntes“. Lesen Sie jetzt „Annäherung an Unendlichkeit: Rekord bei Pi-Wettbewerb“.;Buntes;News, Buntes, Jan van Koningsveld, Susanne Hippauf, Emden, Unendlichkeit, Annäherung, Rekord, Kreiszahl;2024-03-16T15:31:03+01:00;2024-03-16T15:31:03+01:00;;dpa Hessen;false
ebafbf4e1ace2bc0593f1c64497028d6904286fbdc1236d8d7f24f7dee40852f;Machtwechsel in Moskau;https://www.zeit.de/2024/12/russland-wladimir-putin-machtwechsel-nachfolger;Viele Russen wählen Putin, weil sie fürchten, dass ihr Land sonst ins Chaos stürzt. Doch diese Angst begleitet russische Amtswechsel seit je – und ist meist unbegründet.;Russland;Wissen, Russland, Krieg in der Ukraine, Russland, Geschichte, Moskau, Sowjetunion, Wladimir Putin, Nikita Chruschtschow, Leonid Breschnew, Juri Andropow, Konstantin Tschernenko;2024-03-16T15:29:29+01:00;2024-03-16T15:29:29+01:00;Michael Thumann;;true
ac8f5c45b30a3eaeb65fe7059df0c56b346641271594b40766d3a710a7f7b8c7;Sieben Verletzte bei Unfall auf Bundesstraße;https://www.zeit.de/news/2024-03/16/sieben-verletzte-bei-unfall-auf-bundesstrasse;Hier finden Sie Informationen zu dem Thema „Marburg-Biedenkopf“. Lesen Sie jetzt „Sieben Verletzte bei Unfall auf Bundesstraße“.;Marburg-Biedenkopf;News, Marburg-Biedenkopf, Marburg-Biedenkopf, Polizei, Unfall, Bundesstraße, Polizeifahrzeug, Leuchtschrift, Unfallstelle;2024-03-16T15:27:20+01:00;2024-03-16T15:27:20+01:00;;dpa Hessen;false
c3b222f95fa19a0eda4a0025c10fe99dc8dceec58a0f95cdf06364255bd6c738;Neue Erkenntnisse nach schwerem Unfall in Charlottenburg;https://www.zeit.de/news/2024-03/16/neue-erkenntnisse-nach-schwerem-unfall-in-charlottenburg;Hier finden Sie Informationen zu dem Thema „Berlin“. Lesen Sie jetzt „Neue Erkenntnisse nach schwerem Unfall in Charlottenburg“.;Berlin;News, Berlin, Charlottenburg, Berlin, Berlin-Charlottenburg, Polizei, Unfall, Unfallstelle, Auto;2024-03-16T15:26:21+01:00;2024-03-16T15:26:21+01:00;;dpa Berlin/Brandenburg;false
316828ecb0f17fcb07a6bb62a4fd2966b271d7d797fba05e0a1f64ee89ad79e1;0:2 - Elversberg gegen Aufstiegsanwärter Kiel ohne Chance;https://www.zeit.de/news/2024-03/16/0-2-elversberg-gegen-aufstiegsanwaerter-kiel-ohne-chance;Hier finden Sie Informationen zu dem Thema „Fußball“. Lesen Sie jetzt „0:2 - Elversberg gegen Aufstiegsanwärter Kiel ohne Chance“.;Fußball;News, Fußball, Philipp Sander, Holstein Kiel, SV Elversberg, Fußball;2024-03-16T15:22:34+01:00;2024-03-16T15:22:34+01:00;;dpa Rheinland-Pfalz/Saarland;false
98a29584cb31bd5f937027c2ec20a411197d0e41b0038eff5f434c2a6a7bfd9e;Lauterbach warnt vor Verzögerung der Cannabislegalisierung;https://www.zeit.de/politik/deutschland/2024-03/cannabis-legalisierung-lauterbach-gerichte-amnestie;"Die Bundesländer fürchten, bei einer Freigabe von Cannabis ab April Gerichte zu überlasten. Lauterbach entgegnet: ""Verschieben bringt nichts. Die Arbeit bleibt gleich.""";Cannabis;Politik, Cannabis, Karl Lauterbach, Cannabis, Drogen, Amnestie, Gesundheitsministerium, Drogenpolitik;2024-03-16T15:22:21+01:00;2024-03-16T15:22:21+01:00;;ZEIT ONLINE,        dpa,        ljk;false
d4344333489473c3b4ba43a166d3a93fc4489cab50eb9134040ee987ab83fb69;Transformation im Dreiländerraum soll gestärkt werden;https://www.zeit.de/news/2024-03/16/transformation-im-dreilaenderraum-soll-gestaerkt-werden;Hier finden Sie Informationen zu dem Thema „Regierung“. Lesen Sie jetzt „Transformation im Dreiländerraum soll gestärkt werden“.;Regierung;News, Regierung, Michael Kretschmer, Niederschlesien, Liberec, Dreiländerraum, Transformation;2024-03-16T15:21:33+01:00;2024-03-16T15:21:33+01:00;;dpa Sachsen;false
82adda825bfa6e8d0310ae2bd88383a6487ed1fbdb823dc4ee3e3477318d855d;St. Pauli legt nach - Auch Kiel siegt;https://www.zeit.de/news/2024-03/16/st-pauli-legt-nach-auch-kiel-siegt;Hier finden Sie Informationen zu dem Thema „2. Liga“. Lesen Sie jetzt „St. Pauli legt nach - Auch Kiel siegt“.;2. Liga;News, 2. Liga, Fabian Hürzeler, St. Pauli, Elversberg, FC St. Pauli, 1. FC Nürnberg, Fußball-Bundesliga, Bundesliga;2024-03-16T15:10:51+01:00;2024-03-16T15:10:51+01:00;;dpa Sport;false
d7de6ee298d117f6686fa3ff933d7be815b8531d1ba2ade2e30cbf5744be7233;Hansa Rostock in vier Fällen vor DFB-Sportgericht;https://www.zeit.de/news/2024-03/16/hansa-rostock-in-vier-faellen-vor-dfb-sportgericht;Hier finden Sie Informationen zu dem Thema „Fußball“. Lesen Sie jetzt „Hansa Rostock in vier Fällen vor DFB-Sportgericht“.;Fußball;News, Fußball, St. Pauli, Schalke, Paderborn, Hansa Rostock, DFB, Deutscher Fußball-Bund, 1. FC Nürnberg, FC St. Pauli, FC Schalke 04, SC Paderborn;2024-03-16T14:59:56+01:00;2024-03-16T14:59:56+01:00;;dpa Mecklenburg-Vorpommern;false
a30a8526694526b4c583cbb36406ad23723bf680e2a7afc766229f944a81d23c;Zwei Menschen bei Unfall schwer verletzt;https://www.zeit.de/news/2024-03/16/zwei-menschen-bei-unfall-schwer-verletzt;Hier finden Sie Informationen zu dem Thema „Vorpommern-Rügen“. Lesen Sie jetzt „Zwei Menschen bei Unfall schwer verletzt“.;Vorpommern-Rügen;News, Vorpommern-Rügen, Polizei, Unfall, Polizeifahrzeug, Blaulicht, Auto;2024-03-16T14:51:00+01:00;2024-03-16T14:51:00+01:00;;dpa Mecklenburg-Vorpommern;false
3c16f8335fab3f69f39b1f3b0d2fd720228bffbf84032249f0b969a44a29bb34;Frühlingsstart in Thüringens größtem Garten;https://www.zeit.de/news/2024-03/16/fruehlingsstart-in-thueringens-groesstem-garten;Hier finden Sie Informationen zu dem Thema „Freizeit“. Lesen Sie jetzt „Frühlingsstart in Thüringens größtem Garten“.;Freizeit;News, Freizeit, Thüringen, Erfurt, Frühlingsstart, Frühlingsblume, Freizeit, Springbrunnen;2024-03-16T14:48:56+01:00;2024-03-16T14:48:56+01:00;;dpa Thüringen;false
8232d9147299d1f49b757661f5cd21af49d827e81a500ae7213eee6e4b724546;Frau in Lebensgefahr: Schaulustige behindern Einsatz;https://www.zeit.de/news/2024-03/16/frau-in-lebensgefahr-schaulustige-behindern-einsatz;Hier finden Sie Informationen zu dem Thema „Verden“. Lesen Sie jetzt „Frau in Lebensgefahr: Schaulustige behindern Einsatz“.;Verden;News, Verden, Polizei, Lebensgefahr, Symbolfoto, Stadthalle, Blaulicht;2024-03-16T14:46:45+01:00;2024-03-16T14:46:45+01:00;;dpa Niedersachsen;false
e9e0645224dff74069ba11d1779568dc7d2cba84bc0e4214c34784cc7c6bec7d;Prien kritisiert Vorstoß für Zivilschutzübungen an Schulen;https://www.zeit.de/news/2024-03/16/prien-kritisiert-vorstoss-fuer-zivilschutzuebungen-an-schulen;Hier finden Sie Informationen zu dem Thema „Verteidigung“. Lesen Sie jetzt „Prien kritisiert Vorstoß für Zivilschutzübungen an Schulen“.;Verteidigung;News, Verteidigung, Karin Prien, Bettina Stark-Watzinger, Schleswig-Holstein, FDP, CDU, Bundeswehr, Zivilschutzübung, Verteidigung;2024-03-16T14:43:50+01:00;2024-03-16T14:43:50+01:00;;dpa Hamburg/Schleswig-Holstein;false
744d0929f33e6cca86371b050137889a689d924dc6dfbf691a87290984bdc800;Buntes Husum: Krokusblütenfest sorgt für Farbe im März;https://www.zeit.de/news/2024-03/15/krokusbluetenfest-faerbt-husum-am-wochenende-bunt;Hier finden Sie Informationen zu dem Thema „Frühlingsfest“. Lesen Sie jetzt „Buntes Husum: Krokusblütenfest sorgt für Farbe im März“.;Frühlingsfest;News, Frühlingsfest, Husum, Frühlingsfest, Krokusblütenfest;2024-03-16T14:40:13+01:00;2024-03-16T14:40:13+01:00;;dpa Hamburg/Schleswig-Holstein;false
c4ffd8705bef083ddb87f19508e3c1454ccb06f69c264cc2c62856cfdaa87ebe;Felgner bleibt Vorsitzender des SPD-Landesparteirates;https://www.zeit.de/news/2024-03/16/felgner-bleibt-vorsitzender-des-spd-landesparteirates;Hier finden Sie Informationen zu dem Thema „Politik“. Lesen Sie jetzt „Felgner bleibt Vorsitzender des SPD-Landesparteirates“.;Politik;News, Politik, Jörg Felgner, Magdeburg, Sachsen-Anhalt, SPD;2024-03-16T14:39:10+01:00;2024-03-16T14:39:10+01:00;;dpa Sachsen;false
4d6ca71045dc954ebe37d353b6d0724689a659539ec2d53c535d63dd54cbe39e;Luftwaffe wirft erste Hilfsgüter über dem Gazastreifen ab;https://www.zeit.de/politik/ausland/2024-03/bundeswehr-luftwaffe-gazastreifen-hilfsgueter;Die Lage der Zivilbevölkerung in dem abgeriegelten Küstenstreifen ist katastrophal. An Fallschirmen gelangen nun mehr Hilfsgüter in das umkämpfte Gebiet.;Bundeswehr;Politik, Bundeswehr, Nahostkrieg, Gazastreifen, Luftwaffe, Bundeswehr, Hilfsorganisation, Benjamin Netanjahu;2024-03-16T14:38:55+01:00;2024-03-16T14:38:55+01:00;;ZEIT ONLINE,        dpa,        jci;false
823c543c372cf9f683b6cc1e722d809d124c010b98870c437017fb86e137474c;Protest-Demo gegen den AfD-Parteitag;https://www.zeit.de/news/2024-03/16/protest-demo-gegen-den-afd-parteitag;Hier finden Sie Informationen zu dem Thema „Parteien“. Lesen Sie jetzt „Protest-Demo gegen den AfD-Parteitag“.;Parteien;News, Parteien, Rene Springer, Jüterbog, Brandenburg, Alternative für Deutschland, Landesvorsitz;2024-03-16T14:37:07+01:00;2024-03-16T14:37:07+01:00;;dpa Berlin/Brandenburg;false
5813f63089db30ee53d5eb4959b3b221896f9aa8bb71f2bfad641246df5e3e03;Ein bestrafender Sozialstaat schadet sich selbst;https://www.zeit.de/wirtschaft/2024-03/buergergeld-cdu-reform-grundsicherung-sanktionen;Die CDU will das Bürgergeld abschaffen und wieder 100-Prozent-Sanktionen einführen. Ein absurder und zutiefst schädlicher Vorschlag. ;Bürgergeld;Wirtschaft, Bürgergeld, Bürgergeld, CDU, Sozialstaat, Arbeitsmarkt, Fachkräftemangel, Hartz IV;2024-03-16T14:36:07+01:00;2024-03-16T14:36:07+01:00;Tina Groll;;true
5e2716630ead936d4482c9a13036344c1e95215c5e62f7d8c447d0060954e464;Odermatt verpasst perfekte Riesenslalom-Saison;https://www.zeit.de/news/2024-03/16/ausfall-odermatt-verpasst-perfekte-riesenslalom-saison;Hier finden Sie Informationen zu dem Thema „Ski alpin “. Lesen Sie jetzt „Odermatt verpasst perfekte Riesenslalom-Saison“.;Ski alpin;News, Ski alpin , Marco Odermatt, Alexander Schmid, Saalbach, Ausfall, Saisonfinale;2024-03-16T14:33:18+01:00;2024-03-16T14:33:18+01:00;;dpa Sport;false
aa7cecb8b30ddfc5981492f5589155b2cdd98e0497bcc7bb8b0af3a8f6538df4;77-Jähriger beraubt und geschlagen;https://www.zeit.de/news/2024-03/16/77-jaehriger-beraubt-und-geschlagen;Hier finden Sie Informationen zu dem Thema „Berlin-Mitte“. Lesen Sie jetzt „77-Jähriger beraubt und geschlagen“.;Berlin-Mitte;News, Berlin-Mitte, Berlin-Mitte, Polizei, Polizeiauto, Blaulicht;2024-03-16T14:32:17+01:00;2024-03-16T14:32:17+01:00;;dpa Berlin/Brandenburg;false
4b79012f46b8afe5ca382f40d75d791c72ac486300c8ccd5cc9db9b897707ac4;Lastwagen kollidiert mit Streifenwagen auf A72 bei Zwickau;https://www.zeit.de/news/2024-03/16/lastwagen-kollidiert-mit-streifenwagen-auf-a72-bei-zwickau;Hier finden Sie Informationen zu dem Thema „Zwickau“. Lesen Sie jetzt „Lastwagen kollidiert mit Streifenwagen auf A72 bei Zwickau“.;Zwickau;News, Zwickau, Zwickau, Polizei, Streifenwagen, Unfall, Fahrzeug;2024-03-16T14:20:19+01:00;2024-03-16T14:20:19+01:00;;dpa Sachsen;false
f4462438cdf0a613fafdc74598cd1357e3c5ecc12c693238b560e9b5c6098897;RB Leipzigs Frauen gehen beim Meister FC Bayern unter;https://www.zeit.de/news/2024-03/16/rb-leipzigs-frauen-gehen-beim-meister-fc-bayern-unter;Hier finden Sie Informationen zu dem Thema „Fußball“. Lesen Sie jetzt „RB Leipzigs Frauen gehen beim Meister FC Bayern unter“.;Fußball;News, Fußball, Pernille Harder, Lea Schüller, Linda Dallmann, Leipzig, Sachsen, RB Leipzig, FC Bayern München, Fußball;2024-03-16T14:18:56+01:00;2024-03-16T14:18:56+01:00;;dpa Sachsen;false
82e56e6f6cdd21d75e770bb6e05d504bb58174a376d944504c7a2150147ace8f;Bayern-Fußballerinnen machen Schritt in Richtung Titel;https://www.zeit.de/news/2024-03/16/bayern-fussballerinnen-machen-schritt-in-richtung-titel;Hier finden Sie Informationen zu dem Thema „Frauen-Bundesliga“. Lesen Sie jetzt „Bayern-Fußballerinnen machen Schritt in Richtung Titel“.;Frauen-Bundesliga;News, Frauen-Bundesliga, Lea Schüller, Wolfsburg, München, FC Bayern München, VfL Wolfsburg, Bundesliga;2024-03-16T14:16:36+01:00;2024-03-16T14:16:36+01:00;;dpa Bayern;false
421d361a25d10f135a0dec672e1c110e980d6e5f492b9a0380aeb4e8b9e7b1ff;Mutmaßlicher Handy-Dieb springt bei Flucht in Teich;https://www.zeit.de/news/2024-03/16/mutmasslicher-handy-dieb-springt-bei-flucht-in-teich;Hier finden Sie Informationen zu dem Thema „Düsseldorf“. Lesen Sie jetzt „Mutmaßlicher Handy-Dieb springt bei Flucht in Teich“.;Düsseldorf;News, Düsseldorf, Düsseldorf, Oberhausen, Polizei, Kaiserpark, schwimmen;2024-03-16T14:13:39+01:00;2024-03-16T14:13:39+01:00;;dpa Nordrhein-Westfalen;false
bb1e66844789a50bdce64ac6df587e9d4fd32d59e7c83bdb29cf2758fa415f48;Wissing: Neue Arbeitsmodelle haben Konfliktpotenzial;https://www.zeit.de/news/2024-03/16/wissing-neue-arbeitsmodelle-haben-konfliktpotenzial;Hier finden Sie Informationen zu dem Thema „Bahn“. Lesen Sie jetzt „Wissing: Neue Arbeitsmodelle haben Konfliktpotenzial“.;Bahn;News, Bahn, Volker Wissing, FDP, GDL, Arbeitsmodell, Konfliktpotenzial, Tarifkonflikt;2024-03-16T14:10:50+01:00;2024-03-16T14:10:50+01:00;;dpa Rheinland-Pfalz/Saarland;false
30a36c123bb95f2deb418ff778764b119e317e8064867090b86ccb21cc31fe1b;Tier- und Freizeitparks starten in die Saison;https://www.zeit.de/news/2024-03/16/serengeti-park-startet-puenktlich-in-neue-saison;Hier finden Sie Informationen zu dem Thema „Osterferien“. Lesen Sie jetzt „Tier- und Freizeitparks starten in die Saison“.;Osterferien;News, Osterferien, Tansania-See, Hodenhagen, Serengeti-Park, Schnellboot, Hochwasserlage, Tiere, Hochwasser;2024-03-16T14:06:22+01:00;2024-03-16T14:06:22+01:00;;dpa Niedersachsen;false
4f7d191fb20e307cdb3205517d6887810338df1e1b960dde4adbd8220f04bcd9;Schlafend an der Steuer;https://www.zeit.de/entdecken/2024-03/prokrastination-ueberwinden-steuererklaerung-motivation-tipps;"""Rose, viele Aufgaben sitzen mir seit Monaten im Nacken – zum Beispiel meine Steuererklärung. Wie motiviere ich mich zu etwas, auf das ich keine Lust habe?"" – fragt Alex.";Prokrastination überwinden;Entdecken, Prokrastination überwinden, Steuererklärung, Prokrastinieren, Prokrastination, Motivationsproblem, Motivationstraining;2024-03-16T14:05:56+01:00;2024-03-16T14:05:56+01:00;Rose Tremlett;;true
99be26cbc821093b02bc3774a904bb202f024487dd65162f0cd40be8257db49e;Kohleausstieg 2030: FDP will Auskünfte zu RWE-Verhandlungen;https://www.zeit.de/news/2024-03/16/kohleausstieg-2030-fdp-will-auskuenfte-zu-rwe-verhandlungen;Hier finden Sie Informationen zu dem Thema „Energie“. Lesen Sie jetzt „Kohleausstieg 2030: FDP will Auskünfte zu RWE-Verhandlungen“.;Energie;News, Energie, Henning Höne, NRW, FDP, RWE, Bundesregierung, Kohleausstieg, Landtag;2024-03-16T13:59:57+01:00;2024-03-16T13:59:57+01:00;;dpa Nordrhein-Westfalen;false
bf1865190b9cde734a68bf49870373c93e6f34a4d1896ce0f5c2543444c40866;Betrug mit Wunschkarten an Tankstelle aufgeflogen;https://www.zeit.de/news/2024-03/16/betrug-mit-wunschkarten-an-tankstelle-aufgeflogen;Hier finden Sie Informationen zu dem Thema „Kriminalität“. Lesen Sie jetzt „Betrug mit Wunschkarten an Tankstelle aufgeflogen“.;Kriminalität;News, Kriminalität, Trier, Polizei, Wunschkarte, Betrug, Streifenwagen, Kriminalität, Tankstelle;2024-03-16T13:56:20+01:00;2024-03-16T13:56:20+01:00;;dpa Rheinland-Pfalz/Saarland;false
e72ad62528bf28ea65ca8f439064c8ad73c2996013479e41712c178543c00db3;Vier Verletzte nach Zusammenstoß zweier Autos;https://www.zeit.de/news/2024-03/16/vier-verletzte-nach-zusammenstoss-zweier-autos;Hier finden Sie Informationen zu dem Thema „Verkehr“. Lesen Sie jetzt „Vier Verletzte nach Zusammenstoß zweier Autos“.;Verkehr;News, Verkehr, Polizei, Zusammenstoß, Verkehr, Streifenwagen, Auto;2024-03-16T13:55:40+01:00;2024-03-16T13:55:40+01:00;;dpa Baden-Württemberg;false
c72e2c80754c8b92a8aefe58199f81fdac3256ee5029b787dc32e8f613886353;Bibelturm Wörlitz öffnet wieder für Besucher;https://www.zeit.de/news/2024-03/16/bibelturm-woerlitz-oeffnet-wieder-fuer-besucher;Hier finden Sie Informationen zu dem Thema „Kirche“. Lesen Sie jetzt „Bibelturm Wörlitz öffnet wieder für Besucher“.;Kirche;News, Kirche, Wörlitz, Bibelturm, Gartenreich;2024-03-16T13:52:38+01:00;2024-03-16T13:52:38+01:00;;dpa Sachsen;false
96dcb42b021d19944f4b1570c26836257db81f945eceaa60e3a70452963ae15d;Mann schläft Rausch in fremdem Haus aus;https://www.zeit.de/news/2024-03/16/mann-schlaeft-rausch-in-fremdem-haus-aus;Hier finden Sie Informationen zu dem Thema „Kriminalität“. Lesen Sie jetzt „Mann schläft Rausch in fremdem Haus aus“.;Kriminalität;News, Kriminalität, Polizei, Streifenwagen, Kriminalität;2024-03-16T13:51:49+01:00;2024-03-16T13:51:49+01:00;;dpa Bayern;false
1c66332685308832e54bf11bc6316dea59eb0338c248529abe62deb221b2ff41;Serdar kann sich Verbleib in Italien vorstellen;https://www.zeit.de/news/2024-03/16/serdar-kann-sich-verbleib-in-italien-vorstellen;Hier finden Sie Informationen zu dem Thema „2. Liga“. Lesen Sie jetzt „Serdar kann sich Verbleib in Italien vorstellen“.;2. Liga;News, 2. Liga, Suat Serdar, Italien, Hertha BSC, Hertha BSC Berlin, Bundesliga;2024-03-16T13:51:10+01:00;2024-03-16T13:51:10+01:00;;dpa Berlin/Brandenburg;false
e9307008ab58ab985c737ee596dbc877d0ac912821488ea050352ca695a0df1b;Auto fährt Fußgängerin an: Schwer verletzt;https://www.zeit.de/news/2024-03/16/auto-faehrt-fussgaengerin-an-schwer-verletzt;Hier finden Sie Informationen zu dem Thema „Unfälle“. Lesen Sie jetzt „Auto fährt Fußgängerin an: Schwer verletzt“.;Unfälle;News, Unfälle, Unfall, Einsatzfahrt, Rettungswagen, Auto;2024-03-16T13:49:52+01:00;2024-03-16T13:49:52+01:00;;dpa Berlin/Brandenburg;false
6f72773437949946d53b0abe120d2697d24c75bd8ccd0377a5507190ff4824ab;Sachsens Grüne gehen mit Spitzentrio in Landtagswahl;https://www.zeit.de/news/2024-03/16/sachsens-gruene-gehen-mit-spitzentrio-in-landtagswahl;Hier finden Sie Informationen zu dem Thema „Parteien“. Lesen Sie jetzt „Sachsens Grüne gehen mit Spitzentrio in Landtagswahl“.;Parteien;News, Parteien, Katja Meier, Wolfram Günther, Sachsen, Bündnis 90 / Die Grünen, Landtagswahl, Spitzentrio, Landeswahlversammlung, Stimmkarte;2024-03-16T13:48:59+01:00;2024-03-16T13:48:59+01:00;;dpa Sachsen;false
04a15b4bf939591c460b1fdfd15dd5c955797ea0a2a649ed59a433d86806da66;Frau in Linienbus bei Notbremsung schwer verletzt;https://www.zeit.de/news/2024-03/16/frau-in-linienbus-bei-notbremsung-schwer-verletzt;Hier finden Sie Informationen zu dem Thema „Verkehr“. Lesen Sie jetzt „Frau in Linienbus bei Notbremsung schwer verletzt“.;Verkehr;News, Verkehr, Notbremsung, Linienbus, Verkehr, Einsatzfahrt, Rettungswagen;2024-03-16T13:47:55+01:00;2024-03-16T13:47:55+01:00;;dpa Baden-Württemberg;false
d32fa27b82a8de00162d203be6dab0e3f9943b27b138f12e4a0ca6a4883be5f9;Krankenkasse sieht hohes Stresslevel bei Eltern;https://www.zeit.de/news/2024-03/16/krankenkasse-sieht-hohes-stresslevel-bei-eltern;Hier finden Sie Informationen zu dem Thema „Gesundheit“. Lesen Sie jetzt „Krankenkasse sieht hohes Stresslevel bei Eltern“.;Gesundheit;News, Gesundheit, Aileen Könitz, Forsa, KKH, Stresslevel, Krankenkasse, Väter, Familie;2024-03-16T13:41:19+01:00;2024-03-16T13:41:19+01:00;;dpa Niedersachsen;false
0decab02ffcc4847db054f0340be543b813e2a9afe856de224752deafac356df;"Kampf mit Macheten: Streit im ""Dong Xuan Center"" eskaliert";https://www.zeit.de/news/2024-03/16/kampf-mit-macheten-streit-im-dong-xuan-center-eskaliert;"Hier finden Sie Informationen zu dem Thema „Berlin“. Lesen Sie jetzt „Kampf mit Macheten: Streit im ""Dong Xuan Center"" eskaliert“.";Berlin;News, Berlin, Dong Xuan, Berlin, Polizei, Machete, Spielzeug;2024-03-16T13:41:13+01:00;2024-03-16T13:41:13+01:00;;dpa;false
06ac4db25898422d89b84e3b7d3a25b670ed981d48c77c0ceebf9b0596a56dde;Hubig: Aussagen zu Zivilschutzübungen nicht nachvollziehbar;https://www.zeit.de/news/2024-03/16/hubig-aussagen-zu-zivilschutzuebungen-nicht-nachvollziehbar;Hier finden Sie Informationen zu dem Thema „Verteidigung“. Lesen Sie jetzt „Hubig: Aussagen zu Zivilschutzübungen nicht nachvollziehbar“.;Verteidigung;News, Verteidigung, Stefanie Hubig, Bettina Stark-Watzinger, Rheinland-Pfalz, FDP, SPD, Kultusministerkonferenz, Zivilschutzübung, Verteidigung;2024-03-16T13:40:42+01:00;2024-03-16T13:40:42+01:00;;dpa Rheinland-Pfalz/Saarland;false
8bdc41afefa76d05bdf2913b3a6f20359086ce4fb673c00e778065a01820366c;Wulff sieht Migranten als Gamechanger im Kampf um Demokratie;https://www.zeit.de/news/2024-03/16/wulff-sieht-migranten-als-gamechanger-im-kampf-um-demokratie;Hier finden Sie Informationen zu dem Thema „Gesellschaft“. Lesen Sie jetzt „Wulff sieht Migranten als Gamechanger im Kampf um Demokratie“.;Gesellschaft;News, Gesellschaft, Volker Wissing, Christian Wulff, Tutzing, Starnberger See, FDP, CDU, Alternative für Deutschland, Bundestagswahl, Gamechanger, Migrationsgeschichte;2024-03-16T13:39:40+01:00;2024-03-16T13:39:40+01:00;;dpa Bayern;false
737b8705e6e1b0f19b9daf1e33722bc82c2f578949a4402ede3667f1eb2d7e78;Bessin verzichtet auf AfD-Kandidatur;https://www.zeit.de/news/2024-03/16/bessin-verzichtet-auf-afd-kandidatur;Hier finden Sie Informationen zu dem Thema „Parteien“. Lesen Sie jetzt „Bessin verzichtet auf AfD-Kandidatur“.;Parteien;News, Parteien, Birgit Bessin, Brandenburg, Alternative für Deutschland, Abstimmung, Stimmkarte, Landesparteitag;2024-03-16T13:38:35+01:00;2024-03-16T13:38:35+01:00;;dpa Berlin/Brandenburg;false
3c588d88edb12155bb9d6ffae7258b278696b25ac7f1c2aff3261cc24653f4ec;Lauterbach legt Referentenentwurf für Krankenhausreform vor;https://www.zeit.de/politik/deutschland/2024-03/lauterbach-klinik-reform-patienten-pauschale;Die Klinikreform wird konkreter: Ein neuer Referentenentwurf liegt vor. Danach sollen etwa eine neue Vergütungsmethode eingeführt und Fallpauschalen gesenkt werden.;Gesundheitswesen;Politik, Gesundheitswesen, Karl Lauterbach, Krankenhausreform, Gesundheitswesen, Gesundheitspolitik, Krankenhaus, Arzt;2024-03-16T13:27:26+01:00;2024-03-16T13:27:26+01:00;;ZEIT ONLINE,        dpa,        ljk,        tgr;false
4e005b34f776ac3d11fa093d519ea60e9590e5542ac99e9aa094bbf83e5f83f6;Diktatur, wie lustig;https://www.zeit.de/kultur/2024-03/ddr-ampelkoalition-vergleich-michael-kretschmer;Bei Liberal-Konservativen taugt das Gedenken an die DDR zunehmend als Gagmaterial. Das ist nicht nur fragwürdig, sondern offenbart auch ein Identitätsproblem.;DDR-Vergleiche;Kultur, DDR-Vergleiche, Ampelkoalition, DDR, Michael Kretschmer, Markus Söder, Politischer Aschermittwoch, Margot Honecker, Ruprecht Polenz, Steffi Lemke, Björn Höcke, Bayern;2024-03-16T13:12:29+01:00;2024-03-16T13:12:29+01:00;Julia Lorenz;;true
1c6e928fb2775837434026decc2010db0d3c7c2df267e838e9206aae15f53b8f;Umweltgruppe blockiert drei Stunden Zufahrt zum LNG-Terminal;https://www.zeit.de/news/2024-03/16/umweltgruppe-beendet-blockadeaktion-am-lng-terminal;Hier finden Sie Informationen zu dem Thema „Energie“. Lesen Sie jetzt „Umweltgruppe blockiert drei Stunden Zufahrt zum LNG-Terminal“.;Energie;News, Energie, Brunsbüttel, LNG, Umweltgruppe, Blockadeaktion, Zufahrt;2024-03-16T12:57:13+01:00;2024-03-16T12:57:13+01:00;;dpa Hamburg/Schleswig-Holstein;false
eae24cf4893ea18653dbe4ce184ece3a945c60b3e3967ede6ac3ad377fb09d39;Indien wählt ab April ein neues Parlament;https://www.zeit.de/politik/ausland/2024-03/indien-parlamentswahlen-april-narendra-modi;Die Parlamentswahl in Indien soll sechs Wochen dauern und Mitte April beginnen. Ergebnisse werden erst am 4. Juni erwartet. Fast eine Milliarde Wähler sind aufgerufen.;Parlamentswahlen;Politik, Parlamentswahlen, Indien, Parlamentswahl, Narendra Modi, Opposition, Ministerpräsident, Demokratie;2024-03-16T12:54:26+01:00;2024-03-16T12:54:26+01:00;;ZEIT ONLINE,        AP,        jci;false
