Hash;Title;Link;Description;Category;KeyWords;Published;LastUpdated;Author;Source;Paywall
79017e3472deffbd6ddd34cb85408d473683795cedc31a8d56ddd8f77b1fc27f;Netflix plant mehr Werbeformate für 2026;https://www.zeit.de/news/2025-05/15/netflix-plant-mehr-werbeformate-fuer-2026;Hier finden Sie Informationen zu dem Thema „Video-Streaming“. Lesen Sie jetzt „Netflix plant mehr Werbeformate für 2026“.;Video-Streaming;News, Video-Streaming, Netflix, Werbeformat, Werbeunterbrechung, Anzeige, Streaming, künstliche Intelligenz;2025-05-15T07:52:00+02:00;2025-05-15T07:52:00+02:00;;dpa;false
47abb4303e367f92fb94319a0d801e6fcbab140993c9bff89c1f2d64a6b6a74a;Mehr Angriffe auf Geflüchtete und Unterkünfte als bisher angenommen;https://www.zeit.de/politik/deutschland/2025-05/fluechtlingsheim-angriffe-anstieg-2024-nachmeldungen;2023 haben die Behörden 176 Straftaten mit Bezug zu Flüchtlingsunterkünften erfasst, 2024 waren es 255. Auch jenseits der Heime gab es Angriffe auf Geflüchtete.;Politisch motivierte Straftaten;Politik, Politisch motivierte Straftaten, Geflüchtete, Straftat, Rassismus, Ermittlung;2025-05-15T02:51:04+02:00;2025-05-15T02:51:04+02:00;peng;ZEIT ONLINE,        AFP,        epd,        							peng;false
6a2cb6cbc320d7b6753c98a87eccd4bbd817f4ec90f62a0b12b911ddd5eb1d39;Ermittlungen gegen Nato-Mitarbeiter wegen Korruption und Geldwäsche;https://www.zeit.de/politik/ausland/2025-05/nato-mitarbeiter-korruptionsverdacht-ermittlungen-weitergabe-informationen-ruestungsunternehmen;Mitarbeitende der Nato-Beschaffungsagentur NSPA sollen gegen Geld Informationen an Rüstungsunternehmen weitergegeben haben. Mehrere Verdächtige wurden festgenommen.;Korruptionsverdacht;Politik, Korruptionsverdacht, Nato, Rüstungsindustrie, Ermittlung, Korruption, Geldwäsche;2025-05-15T02:06:45+02:00;2025-05-15T02:06:45+02:00;kj;ZEIT ONLINE,        dpa,        							kj;false
c5130967e9f2bd9a4490c61df23a1b15ed9c3c7d4f23856c6bb33c2d074dac10;Donald Trump und Wladimir Putin reisen nicht zum Treffen in die Türkei;https://www.zeit.de/politik/ausland/2025-05/ukraine-gespraeche-tuerkei-ohne-donald-trump-wladimir-putin;Der russische Staatschef steht nicht auf der Delegationsliste für Friedensgespräche in der Türkei. Auch US-Präsident Donald Trump bleibt daraufhin den Verhandlungen fern.;Ukraine-Gespräche;Politik, Ukraine-Gespräche, Wolodymyr Selenskyj, Wladimir Putin, Krieg in der Ukraine, Türkei, Donald Trump, Waffenruhe;2025-05-15T01:46:13+02:00;2025-05-15T01:46:13+02:00;jj;ZEIT ONLINE,        Reuters,        AFP,        							jj;false
beba698b3fff7e77d9e17b8f5a1b006e3aa44d660d83f2353db42a7ded6df038;Grüne werfen Merz mangelnden Ehrgeiz beim Klimaschutz vor;https://www.zeit.de/politik/deutschland/2025-05/merz-klimaschutz-gruene-kritik;Energiewende? Umweltschutz? Diese Themen habe Bundeskanzler Friedrich Merz in seiner Regierungserklärung vernachlässigt. Nicht nur das finden die Grünen bedenklich.;Regierungserklärung;Politik, Regierungserklärung, Friedrich Merz, Bündnis 90/Die Grünen, CDU, Klimawandel, Regierungserklärung, Energiewende;2025-05-15T01:37:24+02:00;2025-05-15T01:37:24+02:00;peng;ZEIT ONLINE,        dpa,        							peng;false
6891917bb0ac9c46fec55a03308055d784804349f105386bf8531bb712b876a4;Anbau eines Wohnhauses in Flammen - Nachbarhäuser evakuiert;https://www.zeit.de/news/2025-05/15/anbau-eines-wohnhauses-in-flammen-nachbarhaeuser-evakuiert;Hier finden Sie Informationen zu dem Thema „Brände“. Lesen Sie jetzt „Anbau eines Wohnhauses in Flammen - Nachbarhäuser evakuiert“.;Brände;News, Brände, Anbau, Nachbarhaus, Brand;2025-05-15T00:55:28+02:00;2025-05-15T00:55:28+02:00;;dpa Bayern;false
e085214b2db5fd2b670967e114b83b6b297571b388c0b3c3d984d1ce6a7f1ebc;Commerzbank einigt sich mit Betriebsrat über Stellenabbau;https://www.zeit.de/wirtschaft/unternehmen/2025-05/commerzbank-stellenabbau-sozialplan;Allein in Deutschland will die Commerzbank 3.000 Jobs streichen. Der Betriebsrat der Bank hat ausgehandelt, was den betroffenen Beschäftigen angeboten wird.;Arbeitsmarkt;Wirtschaft, Arbeitsmarkt, Commerzbank, Betriebsrat, Stellenabbau;2025-05-15T00:45:16+02:00;2025-05-15T00:45:16+02:00;peng;ZEIT ONLINE,        Reuters,        							peng;false
afaf9ba22affdfb61884610378253bc459f1b6b1bc0bcb739b938d13b8806833;Zwei Schwerverletzte - Rasche Entwarnung nach Autounfall;https://www.zeit.de/news/2025-05/14/auto-kollidiert-mit-fussgaengern-zwei-schwerverletzte;Hier finden Sie Informationen zu dem Thema „Landkreis Esslingen“. Lesen Sie jetzt „Zwei Schwerverletzte - Rasche Entwarnung nach Autounfall“.;Landkreis Esslingen;News, Landkreis Esslingen, Esslingen, Landkreis, Auto;2025-05-15T00:14:30+02:00;2025-05-15T00:14:30+02:00;;dpa;false
eac1ebb7a8eade3803ef1a4897bcc5f65051bb5b354ae1d5484bbfbaf610a1f0;Zverev verpasst Einzug ins Halbfinale von Rom;https://www.zeit.de/news/2025-05/14/zverev-verpasst-einzug-ins-halbfinale-von-rom;Hier finden Sie Informationen zu dem Thema „Tennis“. Lesen Sie jetzt „Zverev verpasst Einzug ins Halbfinale von Rom“.;Tennis;News, Tennis, Alexander Zverev, Lorenzo Musetti, Carlos Alcaraz, Rom, Halbfinale;2025-05-14T23:59:26+02:00;2025-05-14T23:59:26+02:00;;dpa Sport;false
2c46fcb52aa1865d3c4d6abcb3386ad8ee7134af192619b1f20601925b563371;Was geschah am 15. Mai?;https://www.zeit.de/news/2025-05/14/was-geschah-am-15-mai;Hier finden Sie Informationen zu dem Thema „Kalenderblatt“. Lesen Sie jetzt „Was geschah am 15. Mai?“.;Kalenderblatt;News, Kalenderblatt, Robert Fico, Thomas Müntzer, Handlová, Innenministerium, Kalenderblatt, Namenstag;2025-05-14T23:55:37+02:00;2025-05-14T23:55:37+02:00;;dpa;false
be8dc28c5a2f5254b852e43e13e535d15fc3f8d74441322d7c2a765f6470a076;Kanu kippt um - Kinder werden gerettet, Vater stirbt;https://www.zeit.de/news/2025-05/14/kanu-kippt-um-kinder-werden-gerettet-vater-stirbt;Hier finden Sie Informationen zu dem Thema „Unfälle“. Lesen Sie jetzt „Kanu kippt um - Kinder werden gerettet, Vater stirbt“.;Unfälle;News, Unfälle, Gartower See, Landkreis Lüchow-Dannenberg, Polizei, Unfall, Kanu;2025-05-14T23:47:21+02:00;2025-05-14T23:47:21+02:00;;dpa Berlin/Brandenburg;false
5c5c3071cdfaeeb9a56d3b8883e252db9810a539e6d020998e388c0d6afb1771;FC Bologna gewinnt Coppa Italia;https://www.zeit.de/sport/2025-05/fc-bologna-gewinnt-coppa-italia-ac-mailand;Der FC Bologna hat nach 51 Jahren erstmals wieder die Coppa Italia gewonnen. Nach dem Sieg gegen den AC Mailand ist das Ticket für die Europa League sicher.;Fußball;Sport, Fußball, Italien, Fußball, Bologna, AC Mailand, Europa League;2025-05-14T23:35:17+02:00;2025-05-14T23:35:17+02:00;ak;ZEIT ONLINE,        SID,        							ak;false
5761a6c3d0825ffba7881825f134d6387834b2f37ae3aec2dad231445368884d;"""Enshrouded"" als bestes deutsches Computerspiel geehrt";https://www.zeit.de/news/2025-05/14/enshrouded-als-bestes-deutsches-computerspiel-geehrt;"Hier finden Sie Informationen zu dem Thema „Games“. Lesen Sie jetzt „""Enshrouded"" als bestes deutsches Computerspiel geehrt“.";Games;News, Games, Keen Games, Berlin, Köln, Deutscher Entwicklerpreis, Deutscher Computerspielpreis, Computerspielpreis, Computerspiel;2025-05-14T23:10:38+02:00;2025-05-14T23:10:38+02:00;;dpa;false
d929e291ba75045bc4310e35f33d826843b212d784dacaf3227820a792aa227e;ZEIT-Autor Malte Henk erhält Egon-Erwin-Kisch-Preis für Reportage;https://www.zeit.de/kultur/2025-05/stern-preis-egon-erwin-kisch-preis-2025-zeit-autor-malte-henk;"Der Journalist wird für seinen Text ""Wie weit weg ist Buchenwald?"" geehrt. Henk habe ""eine Reportage gerade für die heutige Zeit"" geschrieben, lobte die Jury.";Auszeichnung;Kultur, Auszeichnung, Journalismus, Reportage, Auszeichnung, Buchenwald, Gedenkstätte, Konzentrationslager;2025-05-14T22:51:14+02:00;2025-05-14T22:51:14+02:00;kj;ZEIT ONLINE,        							kj;false
4cb1dcabcb77b025672530193b93c074f2a7ed4f0a580475444a402e3b06f506;Mit Motorrad kollidiert - junger Radfahrer schwer verletzt;https://www.zeit.de/news/2025-05/14/mit-motorrad-kollidiert-junger-radfahrer-schwer-verletzt;Hier finden Sie Informationen zu dem Thema „Bodenseekreis“. Lesen Sie jetzt „Mit Motorrad kollidiert - junger Radfahrer schwer verletzt“.;Bodenseekreis;News, Bodenseekreis, Tettnang, Bodenseekreis, Polizei, Motorrad, Fahrzeug;2025-05-14T22:49:45+02:00;2025-05-14T22:49:45+02:00;;dpa Baden-Württemberg;false
a6c2fa755ad3d8d6392f118bca77b1e1ad8a7aea13a23d7f8f00f79416144523;Zwei Tote und Waffe in Wohnung im Schwarzwald entdeckt;https://www.zeit.de/news/2025-05/14/zwei-tote-und-waffe-in-wohnung-im-schwarzwald-entdeckt;Hier finden Sie Informationen zu dem Thema „Lahr (Ortenaukreis)“. Lesen Sie jetzt „Zwei Tote und Waffe in Wohnung im Schwarzwald entdeckt“.;Lahr (Ortenaukreis);News, Lahr (Ortenaukreis), Schwarzwald, Lahr, Ortenaukreis;2025-05-14T22:45:32+02:00;2025-05-14T22:45:32+02:00;;dpa Baden-Württemberg;false
f911ab5f63ecc541ad1bcf1823999c4a1880a52560e824e7e241a9980a2b0fdc;Putin reist nicht zu Ukraine-Gesprächen nach Istanbul;https://www.zeit.de/news/2025-05/14/putin-reist-nicht-zu-ukraine-gespraechen-nach-istanbul;Hier finden Sie Informationen zu dem Thema „Ukraine-Krieg“. Lesen Sie jetzt „Putin reist nicht zu Ukraine-Gesprächen nach Istanbul“.;Ukraine-Krieg;News, Ukraine-Krieg, Wladimir Putin, Istanbul, Krieg in der Ukraine;2025-05-14T22:43:25+02:00;2025-05-14T22:43:25+02:00;;dpa;false
de9caeeb1585fcba0852083b3a93b6d0841438455fd73f4008e8ea64d5c663c2;Stern-Preis für Dokumentation über Völkermord an den Jesiden;https://www.zeit.de/news/2025-05/14/stern-preis-fuer-dokumentation-ueber-voelkermord-an-den-jesiden;Hier finden Sie Informationen zu dem Thema „Journalistenpreise“. Lesen Sie jetzt „Stern-Preis für Dokumentation über Völkermord an den Jesiden“.;Journalistenpreise;News, Journalistenpreise, Düzen Tekkal, Hamburg, Nordirak, ARD, Völkermord, Journalistenpreis, Dokumentation, Kino;2025-05-14T22:41:24+02:00;2025-05-14T22:41:24+02:00;;dpa Hamburg/Schleswig-Holstein;false
6a79b6170a824ed2ce315bf0fe4d0f19cd2eae49afa1940dd1be3ed7d5d8e200;"""Enshrouded"" ist das beste deutsche Spiel des Jahres";https://www.zeit.de/digital/games/2025-05/deutscher-computerspielpreis-enshrouded-videospiel-gewinner-gaming;"Das Survival-Game ""Enshrouded"" gewinnt einen der wichtigsten Spielepreise. Die anderen Ausgezeichneten reichen von politischer Bildung bis Vampir-Therapie-Simulator.";Deutscher Computerspielpreis 2025;Digital, Deutscher Computerspielpreis 2025, Berlin, Computer, Videospiel, Computerspiel, Games;2025-05-14T22:32:27+02:00;2025-05-14T22:32:27+02:00;Henrik Oerding;;false
55de6eb545a47f925fd1af7cd45a9669f1da39cda5a020ecfed86bb23637e64d;Commerzbank: Sozialplan für Stellenabbau vereinbart;https://www.zeit.de/news/2025-05/14/commerzbank-sozialplan-fuer-stellenabbau-vereinbart;Hier finden Sie Informationen zu dem Thema „Sparprogramm“. Lesen Sie jetzt „Commerzbank: Sozialplan für Stellenabbau vereinbart“.;Sparprogramm;News, Sparprogramm, Commerzbank, Unicredit, Sozialplan, Stellenabbau, Sparprogramm, Rahmensozialplan, Altersteilzeitangebot;2025-05-14T22:26:29+02:00;2025-05-14T22:26:29+02:00;;dpa Hessen;false
c6e79deaafef994f4fcd1d5189e5dc1735b63220064fd6940f2e5cd2c556225b;"""Keine anderen Pläne gerade"": Brandt will beim BVB bleiben";https://www.zeit.de/news/2025-05/14/keine-anderen-plaene-gerade-brandt-will-beim-bvb-bleiben;"Hier finden Sie Informationen zu dem Thema „Fußball-Bundesliga“. Lesen Sie jetzt „""Keine anderen Pläne gerade"": Brandt will beim BVB bleiben“.";Fußball-Bundesliga;News, Fußball-Bundesliga, Julian Brandt, BVB, Fußball-Bundesliga, Bundesliga;2025-05-14T22:01:10+02:00;2025-05-14T22:01:10+02:00;;dpa Nordrhein-Westfalen;false
a4efb454b5fafc34149f538ef79a3440218e34c4ab4e993005599e634cde2ef0;Störungen im Bahnverkehr um Hannover wieder aufgehoben;https://www.zeit.de/news/2025-05/14/bahnverkehr-um-hannover-von-stoerungen-betroffen;Hier finden Sie Informationen zu dem Thema „Verkehr“. Lesen Sie jetzt „Störungen im Bahnverkehr um Hannover wieder aufgehoben“.;Verkehr;News, Verkehr, Hannover, Niedersachsen, Bahnverkehr, Störung, Oberleitungsstörung, Verkehr;2025-05-14T21:58:03+02:00;2025-05-14T21:58:03+02:00;;dpa Niedersachsen;false
96da8bdf43ab474dbfd201f011ecb63e2c5df612be09079e7788c9833867af46;Thüringer HC gleicht Halbfinalserie aus;https://www.zeit.de/news/2025-05/14/thueringer-hc-gleicht-halbfinalserie-aus;Hier finden Sie Informationen zu dem Thema „Handball-Bundesliga“. Lesen Sie jetzt „Thüringer HC gleicht Halbfinalserie aus“.;Handball-Bundesliga;News, Handball-Bundesliga, Herbert Müller, Ludwigsburg, Thüringer HC, Handball-Bundesliga, Bundesliga, Halbfinalserie, Halbfinalspiel;2025-05-14T21:57:21+02:00;2025-05-14T21:57:21+02:00;;dpa Sachsen;false
a56aa75a2b7d0e5ac25c20f0c1db44389a65ba3bc2bca8b1facc7d63f41f1e37;67 Ex-Geiseln fordern Netanjahu zu Geisel-Deal auf;https://www.zeit.de/news/2025-05/14/67-ex-geiseln-fordern-netanjahu-zu-geisel-deal-auf;Hier finden Sie Informationen zu dem Thema „Gaza-Krieg“. Lesen Sie jetzt „67 Ex-Geiseln fordern Netanjahu zu Geisel-Deal auf“.;Gaza-Krieg;News, Gaza-Krieg, Benjamin Netanjahu, Edan Alexander, Gazastreifen;2025-05-14T21:37:23+02:00;2025-05-14T21:37:23+02:00;;dpa;false
4b77b6bd5c2565978d18f1d61b79e844084447468ee4b1c96dc4948c859562c9;Bilder des Tages;https://www.zeit.de/news/2025-05/14/bilder-des-tages;Hier finden Sie Informationen zu dem Thema „Fotografie“. Lesen Sie jetzt „Bilder des Tages“.;Fotografie;News, Fotografie, News;2025-05-14T21:10:25+02:00;2025-05-14T21:10:25+02:00;;dpa;false
8c75b40b5d0b458fc017641446aa5f560f9056155cacc5a45d2e3b2f7a41d0a3;Bayern-Verteidiger Dier wechselt nach Monaco;https://www.zeit.de/news/2025-05/14/bayern-verteidiger-dier-wechselt-nach-monaco;Hier finden Sie Informationen zu dem Thema „Fußball-Bundesliga“. Lesen Sie jetzt „Bayern-Verteidiger Dier wechselt nach Monaco“.;Fußball-Bundesliga;News, Fußball-Bundesliga, Eric Dier, Bayern, Monaco, FC Bayern München, AS Monaco, Fußball-Bundesliga;2025-05-14T21:05:43+02:00;2025-05-14T21:05:43+02:00;;dpa Bayern;false
ce79f9327439abfdc5ac4f5384dc448041ee688673d3a0ed30a2d0a4b85a8984;Ausbau des Kanzleramts geht weiter;https://www.zeit.de/news/2025-05/14/ausbau-des-kanzleramts-geht-weiter;Hier finden Sie Informationen zu dem Thema „Regierungsviertel“. Lesen Sie jetzt „Ausbau des Kanzleramts geht weiter“.;Regierungsviertel;News, Regierungsviertel, Friedrich Merz, Michael Meister, CDU, Regierungsviertel, Kanzleramt, Ausbau;2025-05-14T20:55:24+02:00;2025-05-14T20:55:24+02:00;;dpa Berlin/Brandenburg;false
5816a21827707160db67bb911ac149b92ac3e12b440c023ff0a776c7e4b8489c;So macht er sich mit der Macht;https://www.zeit.de/kultur/2025-05/regierungserklaerung-friedrich-merz-bundestag-kanzlerwahl-stilkritik;Dieser Moment gehört ihm: Friedrich Merz am Rednerpult, seine erste Regierungserklärung. Der Anzug ist blau, der Kopf oft gesenkt, die Euphorie spürbar. Eine Stilkritik;"Z+ (abopflichtiger Inhalt);
        
    Regierungserklärung von Friedrich Merz";Kultur, Regierungserklärung von Friedrich Merz, Friedrich Merz, Regierungserklärung, Deutscher Bundestag, CDU, Bundeskanzler;2025-05-14T20:54:46+02:00;2025-05-14T20:54:46+02:00;Heike-Melba Fendel;;false
ae839af484ec823130e519bbfa676422778a141b8ed0130ae77d771dc33cddee;Der Kassierer;https://www.zeit.de/2025/20/donald-trump-usa-golfstaaten-korruption-geschenk;Dealt er noch, oder lässt er sich schon kaufen? Der US-Präsident nimmt vom Emir von Katar ein Flugzeug an – und macht die Korruption zum Prinzip.;"Z+ (abopflichtiger Inhalt);
        
    Donald Trump";Politik, Donald Trump, Donald Trump, USA, Korruption, Katar, Flugzeug, Boeing;2025-05-14T20:50:32+02:00;2025-05-14T20:50:32+02:00;Lea Frehse;Aus der        ZEIT Nr. 20/2025;false
a10e9d38684a999e9e12f375f47e8ceb4c67e7c7905d2146f902ec91bfe6e36e;Die Sensation von Cannes;https://www.zeit.de/kultur/film/2025-05/in-die-sonne-schauen-mascha-schilinski-filmfestival-cannes-rezension;"""In die Sonne schauen"" von der Berliner Regisseurin Mascha Schilinski ist der erste Wettbewerbsfilm des Festivals. Eindrucksvoll zeigt er, was Kino sein kann.";"Z+ (abopflichtiger Inhalt);
        
    ""In die Sonne schauen"" von Mascha Schilinski";"Kultur, ""In die Sonne schauen"" von Mascha Schilinski, Filmfestspiele von Cannes, Regisseur, Filmindustrie, Filmrezension, Filmfestival, Cannes";2025-05-14T20:41:30+02:00;2025-05-14T20:41:30+02:00;Katja Nicodemus;;false
ae0901b77dd1d4d818673fac58cf1a944606ff595e37fc55f1c7bb7d3457b5c7;Kreise: Einsatz bei Ulm im Kontext mit Sabotage-Ermittlung;https://www.zeit.de/news/2025-05/14/kreise-einsatz-bei-ulm-im-kontext-mit-sabotage-ermittlung;Hier finden Sie Informationen zu dem Thema „Polizei“. Lesen Sie jetzt „Kreise: Einsatz bei Ulm im Kontext mit Sabotage-Ermittlung“.;Polizei;News, Polizei, Ulm, Baden-Württemberg, Polizei, Deutsche Presse-Agentur, LKA, Kontext, Gütertransport;2025-05-14T20:37:24+02:00;2025-05-14T20:37:24+02:00;;dpa Baden-Württemberg;false
583b385c58b50a560bfb3eae81c8f26b7e9cc40383bdd76283601114295f2dd8;"Esken beklagt ""öffentliche Jagd"" auf ihre Person";https://www.zeit.de/politik/deutschland/2025-05/saskia-esken-kritik-debatte-zukunft;Saskia Esken verliert ihren Posten in der SPD. In einem Interview kritisiert die scheidende Co-Chefin den medialen Umgang mit ihr und die Debatten über ihre Person.;SPD;Politik, SPD, Saskia Esken, SPD, Berichterstattung;2025-05-14T20:32:57+02:00;2025-05-14T20:32:57+02:00;voi;ZEIT ONLINE,        KNA,        dpa,        AFP,        							voi;false
9268ff83995b0164e027aae0ebe792e151613373823e3c0ef8fa06b696fd3ed2;NRW und Israel feiern ihre Völkerfreundschaft;https://www.zeit.de/news/2025-05/14/nrw-und-israel-feiern-ihre-voelkerfreundschaft;Hier finden Sie Informationen zu dem Thema „Diplomatie statt Krieg“. Lesen Sie jetzt „NRW und Israel feiern ihre Völkerfreundschaft“.;Diplomatie statt Krieg;News, Diplomatie statt Krieg, Hendrik Wüst, Ron Prosor, NRW, Israel, Nordrhein-Westfalen, CDU, Hamas, Völkerfreundschaft;2025-05-14T20:17:18+02:00;2025-05-14T20:17:18+02:00;;dpa Nordrhein-Westfalen;false
e30a68b9191e4e5ba1648e20e59b8bd0e72ec4ec540da7208e616466eb7f0a08;Phosphorbombe bei Kassel gesichert - Evakuierung beendet;https://www.zeit.de/news/2025-05/14/nach-bombenfund-im-kreis-kassel-tritt-phosphor-aus;Hier finden Sie Informationen zu dem Thema „Niestetal“. Lesen Sie jetzt „Phosphorbombe bei Kassel gesichert - Evakuierung beendet“.;Niestetal;News, Niestetal, Kassel, Polizei, Bombenfund, Phosphor, Warnmeldung, Bombenräumung, Niestetaler;2025-05-14T20:08:53+02:00;2025-05-14T20:08:53+02:00;;dpa Hessen;false
5a4841dc6430a333e27ad287a87fd2cfd55f24e6f37f09b64d4b0a359d3fa3d3;Combs soll damalige Freundin mit Sex-Videos erpresst haben;https://www.zeit.de/news/2025-05/14/combs-soll-damalige-freundin-mit-sex-videos-erpresst-haben;Hier finden Sie Informationen zu dem Thema „Verdacht auf Sexhandel“. Lesen Sie jetzt „Combs soll damalige Freundin mit Sex-Videos erpresst haben“.;Verdacht auf Sexhandel;News, Verdacht auf Sexhandel, Sean « Diddy » Combs, Cassie Ventura, Sängerin, Sexhandel;2025-05-14T20:06:11+02:00;2025-05-14T20:06:11+02:00;;dpa;false
6adc6fea0d2aab4bd447af37639d78f5793b13012e91c24e52441d80d52b11bc;AfD-Kandidat bei Wahl für Vizepräsidentschaft gescheitert;https://www.zeit.de/news/2025-05/14/afd-kandidat-bei-wahl-fuer-vizepraesidentschaft-gescheitert;Hier finden Sie Informationen zu dem Thema „Landtag“. Lesen Sie jetzt „AfD-Kandidat bei Wahl für Vizepräsidentschaft gescheitert“.;Landtag;News, Landtag, Patrick Schenk, Wiesbaden, Alternative für Deutschland, Vizepräsidentschaft, Landtag;2025-05-14T19:58:52+02:00;2025-05-14T19:58:52+02:00;;dpa Hessen;false
cfee89cbc9305f5e0b8513dbc33ad943ebc08034cf010a457fc330e90ffcd9df;Eine Supermacht gegen Tyrannen;https://www.zeit.de/2025/19/laurence-equilbey-dirigentin-robert-schumann-musik;"Die französische Dirigentin Laurence Equilbey kombiniert Beethoven mit Manga. Jetzt führt sie Schumanns ""Das Paradies und die Peri"" auf.";"Z+ (abopflichtiger Inhalt);
        
    Laurence Equilbey";Kultur, Laurence Equilbey, Orchester, Konzert, Musikrichtung, Musik, Robert Schumann, Musikindustrie;2025-05-14T19:57:37+02:00;2025-05-14T19:57:37+02:00;Wolfram Goertz;Aus der        ZEIT Nr. 19/2025;false
80de0d00748cf86f9343e0267e1d44f0e0baf158006780bb8f7af6fb06f427c7;Dorfnamen am Garzweiler-Tagebau nach Umsiedlung angepasst;https://www.zeit.de/news/2025-05/14/dorfnamen-am-garzweiler-tagebau-nach-umsiedlung-angepasst;Hier finden Sie Informationen zu dem Thema „Umbenennung“. Lesen Sie jetzt „Dorfnamen am Garzweiler-Tagebau nach Umsiedlung angepasst“.;Umbenennung;News, Umbenennung, Garzweiler, Keyenberg, Berverath, Erkelenz, Unterwestrich, Oberwestrich, Dorfnamen, Umsiedlung, Umbenennung, Umsiedlungsort;2025-05-14T19:49:36+02:00;2025-05-14T19:49:36+02:00;;dpa Nordrhein-Westfalen;false
c86aeb553d2dfb388a805aec8f78314526095e586a3f2a52bc477bfa03526f2f;HSV feiert Aufstieg mit Rathausempfang und Truck-Umzug;https://www.zeit.de/news/2025-05/14/hsv-feiert-aufstieg-mit-rathausempfang-und-truck-umzug;Hier finden Sie Informationen zu dem Thema „2. Fußball-Bundesliga“. Lesen Sie jetzt „HSV feiert Aufstieg mit Rathausempfang und Truck-Umzug“.;2. Fußball-Bundesliga;News, 2. Fußball-Bundesliga, Peter Tschentscher, Mann, HSV, Hamburger SV, Fußball-Bundesliga, Rathausempfang, Aufstieg;2025-05-14T19:47:52+02:00;2025-05-14T19:47:52+02:00;;dpa Hamburg/Schleswig-Holstein;false
1223a447e7c193ec937cc78ccd5134255148e97e94bbe57d8fc0727868a94e4b;Sänger Michael Schulte verkündet ESC-Punkte aus Deutschland;https://www.zeit.de/news/2025-05/14/saenger-michael-schulte-verkuendet-esc-punkte-aus-deutschland;Hier finden Sie Informationen zu dem Thema „Belegte 2018 den vierten Platz“. Lesen Sie jetzt „Sänger Michael Schulte verkündet ESC-Punkte aus Deutschland“.;Belegte 2018 den vierten Platz;News, Belegte 2018 den vierten Platz, Michael Schulte, Basel, Eurovision Song Contest;2025-05-14T19:41:05+02:00;2025-05-14T19:41:05+02:00;;dpa Baden-Württemberg;false
2f6a28965b224204eb817c5a4e7e5cd12c8a04cfa1e24edf47e8c00cc4430777;Pistorius sieht beim Wehrdienst keine Garantie für Freiwilligkeit;https://www.zeit.de/politik/deutschland/2025-05/bundeswehr-verteidigungsminister-boris-pistorius-wehrdienst-freiwilligkeit-keine-garantie;"Angesichts des Personalmangels der Bundeswehr setzt der Verteidigungsminister nur ""zunächst"" auf Freiwilligkeit. Die Armee meldet 20 Prozent mehr Einstellungen.";Bundeswehr;Politik, Bundeswehr, Boris Pistorius, Bundeswehr, SPD, Wehrdienst, Verteidigungspolitik;2025-05-14T19:39:08+02:00;2025-05-14T19:39:08+02:00;voi;ZEIT ONLINE,        dpa,        Reuters,        AFP,        							voi;false
53e3ffdc46253fcc2d9f787ab643f8c341785b6ee6ab84a46ed25dc45d512413;Gestatten, ich bin der Bundesmanager;https://www.zeit.de/politik/deutschland/2025-05/regierungserklaerung-friedrich-merz-bundestag-kanzlerwahl-bundesregierung;In seiner Regierungserklärung gibt Friedrich Merz den Außen- und Wirtschaftskanzler – und verliert kein Wort zur AfD. Werbung für die Bausparkasse könnte ähnlich klingen.;"Z+ (abopflichtiger Inhalt);
        
    Friedrich Merz";Politik, Friedrich Merz, Deutscher Bundestag, Bundesregierung, Regierungserklärung, Friedrich Merz, Kanzleramt;2025-05-14T19:39:05+02:00;2025-05-14T19:39:05+02:00;Fabian Reinbold;;false
4e38122d592de6897c172197f84d4c8c0e8258d5d03bdc508d6ee40da1848108;Leider ein Ausfall;https://www.zeit.de/2025/20/jerusalem-international-book-forum-absage-israel-literaturbranche;Das Jerusalem Book Forum wurde für dieses Jahr abgesagt. Offizieller Grund: Zu viele Airlines fliegen derzeit nicht nach Israel. Es steckt jedoch noch mehr dahinter.;Jerusalem International Book Forum;Kultur, Jerusalem International Book Forum, Buchpreis, Israel, Michel Houellebecq, Buchhandel, Belletristik, Jerusalem;2025-05-14T19:15:24+02:00;2025-05-14T19:15:24+02:00;Volker Weidermann;Aus der        ZEIT Nr. 20/2025;false
6f8c9e4a30b0a31aba64d21f6c379c3af1316936097223dad583ee4d1b75c048;Kairo oder Berlin – Hauptsache, verkabelt;https://www.zeit.de/kultur/musik/2025-05/inside-the-studio-matthias-pasdzierny-gero-cacciatore-elektronische-musik-buch;Ein Bildband zeigt das organisierte Chaos in den Studios von Elektromusikern. Man lernt: Nicht alles, was ein Laptop ersetzen kann, muss auch von ihm verschluckt werden.;"Z+ (abopflichtiger Inhalt);
        
    ""Inside the Studio""";"Kultur, ""Inside the Studio"", Kairo, Berlin, Musik, Software, Technologie, Buchrezension";2025-05-14T19:14:01+02:00;2025-05-14T19:14:01+02:00;Tobi Müller;;false
3808a42e0e713a53b6630eab63ca65004ade9fc5f04225f83cc1b8019f60fc40;Feuerwehr löscht Waldbrand an der A13;https://www.zeit.de/news/2025-05/14/feuerwehr-loescht-waldbrand-an-der-a13;Hier finden Sie Informationen zu dem Thema „Brände“. Lesen Sie jetzt „Feuerwehr löscht Waldbrand an der A13“.;Brände;News, Brände, Feuerwehr, Feuerwehreinsatz, Waldbrand, Brand;2025-05-14T19:13:50+02:00;2025-05-14T19:13:50+02:00;;dpa Berlin/Brandenburg;false
236d43cccbfc6fd10023d3951281f3b9a08e3fcc15d7d3e5644ba86e210eeb39;Boeing sichert sich Order für 96 Milliarden Dollar in Katar;https://www.zeit.de/news/2025-05/14/boeing-sichert-sich-order-fuer-96-milliarden-dollar-in-katar;Hier finden Sie Informationen zu dem Thema „Flugzeugbauer“. Lesen Sie jetzt „Boeing sichert sich Order für 96 Milliarden Dollar in Katar“.;Flugzeugbauer;News, Flugzeugbauer, Donald Trump, Katar, Boeing, Qatar Airways, Weißes Haus, Dreamliner;2025-05-14T19:10:28+02:00;2025-05-14T19:10:28+02:00;;dpa;false
