Hash;Title;Link;Description;Category;KeyWords;Published;LastUpdated;Author;Source;Paywall
9a09ccbc2c3ed096df52ae71f875f783e85dd075b4c5d094063d1c640a5e59ef;SPD-Landesvorstand will mit Willingmann in Wahl 2026 gehen;https://www.zeit.de/news/2025-06/16/spd-landesvorstand-will-mit-willingmann-in-wahl-2026-gehen;Hier finden Sie Informationen zu dem Thema „Sachsen-Anhalt“. Lesen Sie jetzt „SPD-Landesvorstand will mit Willingmann in Wahl 2026 gehen“.;Sachsen-Anhalt;News, Sachsen-Anhalt, Armin Willingmann, Sachsen-Anhalt, SPD, Landtagswahl;2025-06-16T18:39:04+02:00;2025-06-16T18:39:04+02:00;;dpa Sachsen;false
98892b5d60a3e42f09609e8866045650bdcc7ed96963523278526f9c2e501e54;"Wegner will Regierungsstil ""ohne Streit"" 2026 weiterführen";https://www.zeit.de/news/2025-06/16/wegner-will-regierungsstil-ohne-streit-2026-weiterfuehren;"Hier finden Sie Informationen zu dem Thema „Wahl 2026“. Lesen Sie jetzt „Wegner will Regierungsstil ""ohne Streit"" 2026 weiterführen“.";Wahl 2026;News, Wahl 2026, Kai Wegner, Berlin, CDU, Regierungsstil;2025-06-16T18:36:52+02:00;2025-06-16T18:36:52+02:00;;dpa Berlin/Brandenburg;false
2493e57cbb3808ce2b7f47dc0c36b926312cbcc01400d31bf5b21f8e14ed8b8b;Trump: Iran signalisiert Gesprächsbereitschaft;https://www.zeit.de/news/2025-06/16/israels-armee-wieder-raketenbeschuss-aus-iran;Hier finden Sie Informationen zu dem Thema „International“. Lesen Sie jetzt „Trump: Iran signalisiert Gesprächsbereitschaft“.;International;News, International, Iran, Nahost, Raketenbeschuss, Militär;2025-06-16T18:36:37+02:00;2025-06-16T18:36:37+02:00;;dpa;false
123ff5d76368b0779b6c71bacdc6c0c4399dae1d1c98877a683f80374940d050;Große Träume, leeres Konto?;https://www.zeit.de/campus/2025/03/geld-sparen-reisen-tipps-guenstig-roadtrip;Der Sommer ist endlich da, aber Ihr Konto sagt eher Freibad als Frankreich? Wie Sie billig an einen Mietwagen kommen oder umsonst in einer portugiesische Villa schlafen.;"Z+ (abopflichtiger Inhalt);
        
    Geld sparen beim Reisen";Campus, Geld sparen beim Reisen , Urlaub, Europa, Geld sparen, Reisen, Radtour;2025-06-16T18:34:32+02:00;2025-06-16T18:34:32+02:00;Torben BeckerChristoph FarkasCharlotte KöhlerFrieder OelzeNina PiatscheckJulian SchmelmerPia SchreiberTheresa Tröndle;Aus        ZEIT Campus Nr. 03/2025;false
21a37d6364ce642974497434c3cd866509fed4692b44330499b6218d782ae089;Unwetter in Sachsen: Straßen überflutet, Bäume umgestürzt;https://www.zeit.de/news/2025-06/16/unwetter-sorgen-fuer-viele-rettungseinsaetze-in-sachsen;Hier finden Sie Informationen zu dem Thema „Straßen überflutet“. Lesen Sie jetzt „Unwetter in Sachsen: Straßen überflutet, Bäume umgestürzt“.;Straßen überflutet;News, Straßen überflutet, Sachsen, Zwickau, Chemnitz, Vogtland, Rettungseinsatz, Erzgebirgskreis, Unwetter;2025-06-16T18:34:19+02:00;2025-06-16T18:34:19+02:00;;dpa Sachsen;false
a92a3eff737223ecc01f83bc81087ebc993627c1951fb407044fdc6b6a4c7344;Italien verbietet Handys auch in oberen Klassen;https://www.zeit.de/news/2025-06/16/italien-verbietet-handys-auch-in-oberen-klassen;Hier finden Sie Informationen zu dem Thema „Schule“. Lesen Sie jetzt „Italien verbietet Handys auch in oberen Klassen“.;Schule;News, Schule, Italien, Rom, BMBF;2025-06-16T18:22:29+02:00;2025-06-16T18:22:29+02:00;;dpa;false
48f36959df9ff02c890857f5b905bfcb8908be173491a37dcef0fdafb0ee74b0;"Razzia bei mutmaßlichem ""Kaiserreichsgruppen""-Unterstützer";https://www.zeit.de/news/2025-06/16/razzia-in-mv-im-zusammenhang-mit-kaiserreichsgruppe;"Hier finden Sie Informationen zu dem Thema „Reichsbürger“. Lesen Sie jetzt „Razzia bei mutmaßlichem ""Kaiserreichsgruppen""-Unterstützer“.";Reichsbürger;News, Reichsbürger, Groß Wokern, Hamburg, Mecklenburg-Vorpommern, Landkreis Rostock, LKA, Kaiserreichsgruppe, Extremismus, Razzia, Reichsbürger;2025-06-16T18:16:21+02:00;2025-06-16T18:16:21+02:00;;dpa Hamburg/Schleswig-Holstein;false
8e84978571dc2b4f425f7f9b4c1375007011297fa7b627d043a53f119d114221;Verkehrsapp Max soll im zweiten Halbjahr 2026 verfügbar sein;https://www.zeit.de/news/2025-06/16/verkehrsapp-max-soll-im-zweiten-halbjahr-2026-verfuegbar-sein;Hier finden Sie Informationen zu dem Thema „Nahverkehr“. Lesen Sie jetzt „Verkehrsapp Max soll im zweiten Halbjahr 2026 verfügbar sein“.;Nahverkehr;News, Nahverkehr, Berlin, Hamburg, BVG, Nahverkehr;2025-06-16T18:11:21+02:00;2025-06-16T18:11:21+02:00;;dpa Berlin/Brandenburg;false
91f7dd7df8c2bb064d9eea2d24fc7f0e86b8785ea21ce9f57569eb54c9fe37ca;Rochen verletzt Jungen auf Mallorca;https://www.zeit.de/news/2025-06/16/rochen-verletzt-jungen-auf-mallorca;Hier finden Sie Informationen zu dem Thema „Meere“. Lesen Sie jetzt „Rochen verletzt Jungen auf Mallorca“.;Meere;News, Meere, Mallorca, Magaluf, Rochen, Schnittverletzung, Teufelsrochen;2025-06-16T18:10:07+02:00;2025-06-16T18:10:07+02:00;;dpa;false
223aecd4cfc2569a4940f9fbb34ff5ce40a9cce48718c8d76e690382b30c7f02;Mehrere Badetote und vermisster Schwimmer;https://www.zeit.de/news/2025-06/16/mehrere-badetote-und-vermisster-schwimmer;Hier finden Sie Informationen zu dem Thema „Badeunfälle“. Lesen Sie jetzt „Mehrere Badetote und vermisster Schwimmer“.;Badeunfälle;News, Badeunfälle, Bayern, Starnberger See, Polizei, Badeunfall, Wasserwacht, Rettungskraft, Badetot, Familie;2025-06-16T18:08:39+02:00;2025-06-16T18:08:39+02:00;;dpa Bayern;false
8921185df5a7fdeb3521bb055c00e2c7cff12d237c71e8de7438a53e3c76693a;Überraschend verwundbar;https://www.zeit.de/politik/ausland/2025-06/israel-iran-konflikt-netanjahu-strategie-deeskalation;Die iranischen Vergeltungsschläge treffen Israel viel stärker, als viele erwartet hatten. Im Land wachsen die Zweifel, ob Netanjahu noch der richtige Regierungschef ist. ;"Z+ (abopflichtiger Inhalt);
        
    Israel und Iran";Politik, Israel und Iran , Benjamin Netanjahu, Iran, Israel, Nahostkrieg, Gazastreifen, Tel Aviv;2025-06-16T18:01:06+02:00;2025-06-16T18:01:06+02:00;Steffi Hentschke;;false
3f264f5adb52aa0cf49bd3018057ae8762ba517f95dca557184a01ad04df72e3;Zahl judenfeindlicher Taten enorm gestiegen;https://www.zeit.de/news/2025-06/16/zahl-judenfeindlicher-taten-enorm-gestiegen;Hier finden Sie Informationen zu dem Thema „Antisemitische Vorfälle“. Lesen Sie jetzt „Zahl judenfeindlicher Taten enorm gestiegen“.;Antisemitische Vorfälle;News, Antisemitische Vorfälle, Katarzyna Miszkiel-Deppe, Oldenburg, Niedersachsen, RIAS, Informationsstelle;2025-06-16T18:00:36+02:00;2025-06-16T18:00:36+02:00;;dpa Niedersachsen;false
e5759a6a5a36390b0127486dfabb9bd43b6ec86e1721c19f7774c9ab71189683;Bericht: Wirtz am Freitag zum Medizincheck beim FC Liverpool;https://www.zeit.de/news/2025-06/16/bericht-wirtz-am-freitag-zum-medizincheck-beim-fc-liverpool;Hier finden Sie Informationen zu dem Thema „Rekordtransfer vor Abschluss“. Lesen Sie jetzt „Bericht: Wirtz am Freitag zum Medizincheck beim FC Liverpool“.;Rekordtransfer vor Abschluss;News, Rekordtransfer vor Abschluss, Florian Wirtz, FC Liverpool, Medizincheck, Rekordtransfer;2025-06-16T18:00:14+02:00;2025-06-16T18:00:14+02:00;;dpa Nordrhein-Westfalen;false
3b18e85fee38386b8ed062666aece672559aea5097be8c5a4f9cbcc13d445076;Nordländer fordern niedrigere Strompreise;https://www.zeit.de/news/2025-06/16/nordlaender-fordern-niedrigere-strompreise;Hier finden Sie Informationen zu dem Thema „Erneuerbare Energie“. Lesen Sie jetzt „Nordländer fordern niedrigere Strompreise“.;Erneuerbare Energie;News, Erneuerbare Energie, Norddeutschland, Bundesregierung, Strompreis, Stromkosten, Energiewende;2025-06-16T17:59:16+02:00;2025-06-16T17:59:16+02:00;;dpa Hamburg/Schleswig-Holstein;false
5e1eb2c041f687cfb21443c9462d2f5c0f100ac10dd0847c35ea67a1f19707ba;Steinwürfe auf A100 - Mann sitzt in Untersuchungshaft;https://www.zeit.de/news/2025-06/16/steinwuerfe-auf-a100-mann-sitzt-in-untersuchungshaft;Hier finden Sie Informationen zu dem Thema „Kriminalität“. Lesen Sie jetzt „Steinwürfe auf A100 - Mann sitzt in Untersuchungshaft“.;Kriminalität;News, Kriminalität, Berlin, Staatsanwaltschaft, Polizei, Steinwurf, Untersuchungshaft, Kriminalität;2025-06-16T17:53:14+02:00;2025-06-16T17:53:14+02:00;;dpa Berlin/Brandenburg;false
818340989c01167e54d22c777f9b0177f3903f2dd67b8cd04e4fcb03d9b8f013;Verdachts auf Sexualdelikte: Lehrer in Erfurt festgenommen;https://www.zeit.de/news/2025-06/16/verdachts-auf-sexualdelikte-lehrer-in-erfurt-festgenommen;Hier finden Sie Informationen zu dem Thema „Kriminalität“. Lesen Sie jetzt „Verdachts auf Sexualdelikte: Lehrer in Erfurt festgenommen“.;Kriminalität;News, Kriminalität, Erfurt, Polizei, Sexualdelikt, Kriminalität;2025-06-16T17:52:55+02:00;2025-06-16T17:52:55+02:00;;dpa Thüringen;false
2ddc1f451631fc2035b83624ac9299f3a258dce37001b0a3b6c5ed234a21c267;"""Der 'Rest der Welt' meldet sich zurück""";https://www.zeit.de/2025/25/amitav-acharya-welthandelsordnung-usa-europa-waehrung;Die von den USA dominierte internationale Ordnung sei am Ende, sagt der Politikforscher Amitav Acharya. Historisch gesehen kein Grund, um den Welthandel zu bangen.;Amitav Acharya;Wirtschaft, Amitav Acharya, Donald Trump, USA, China, Indien, Europa, US-Zölle;2025-06-16T17:49:29+02:00;2025-06-16T17:49:29+02:00;Thomas Fischermann;Aus der        ZEIT Nr. 25/2025;false
88f5bda974540425f65f5c165ad9bb5d26376d2ac6e34c789cc1e90dc9848533;Mann rastet wegen kaputten Fahrstuhls aus;https://www.zeit.de/news/2025-06/16/mann-rastet-wegen-kaputten-fahrstuhls-aus;Hier finden Sie Informationen zu dem Thema „Gefährliche Körperverletzung“. Lesen Sie jetzt „Mann rastet wegen kaputten Fahrstuhls aus“.;Gefährliche Körperverletzung;News, Gefährliche Körperverletzung, Wiesloch, Rhein-Neckar-Kreis, Polizei, Fahrstuhl, Fahrstuhlfrust, Fahrradwurf, Körperverletzung, Fahrrad;2025-06-16T17:47:14+02:00;2025-06-16T17:47:14+02:00;;dpa Baden-Württemberg;false
eb9f29703bbe04195bdde11cb3b76db35893bfc847c531dd76604d21a80718c2;Frühlingszwiebel-Fladenbrote aus dem Effeff!;https://www.zeit.de/zeit-magazin/wochenmarkt/2025-05/fruehlingszwiebel-fladenbrote-raeucherlachs-wochenmarkt-rezept;Fladenbrote lassen sich so leicht selbst machen: kneten, ausrollen und ab in die Pfanne. Frischer geht's nicht – perfekt für einen Lunch mit Räucherlachs und Frischkäse.;"Z+ (abopflichtiger Inhalt);
        
    Fladenbrote mit Räucherlachs";Brot, Mittagessen, Leichte Küche, Frühling, Sommer;2025-06-16T17:38:44+02:00;2025-06-16T17:38:44+02:00;Georgina Hayden;;false
3afd4f0e6d50586d0ff0353c94ab00b2c4a15cf4e2991b506f449373b4d0fd1a;Polizei rettet Rentner aus überhitztem Auto;https://www.zeit.de/news/2025-06/16/polizei-rettet-rentner-aus-ueberhitztem-auto;Hier finden Sie Informationen zu dem Thema „Notfall bei Hitze“. Lesen Sie jetzt „Polizei rettet Rentner aus überhitztem Auto“.;Notfall bei Hitze;News, Notfall bei Hitze, Wittenburg, Landkreis Ludwigslust-Parchim, Polizei, Notfall, Schließvorrichtung, Auto, Hitze;2025-06-16T17:38:04+02:00;2025-06-16T17:38:04+02:00;;dpa Mecklenburg-Vorpommern;false
55a168ccb5b864c2375c201f3f794c3485be5e101ad1fc5817379280e24b5b4f;Männer verletzen acht Menschen in Straßenbahn mit Reizgas;https://www.zeit.de/news/2025-06/16/maenner-verletzen-acht-menschen-in-strassenbahn-mit-reizgas;Hier finden Sie Informationen zu dem Thema „Festnahmen in Freiburg“. Lesen Sie jetzt „Männer verletzen acht Menschen in Straßenbahn mit Reizgas“.;Festnahmen in Freiburg;News, Festnahmen in Freiburg, Mann, Freiburg, Polizei, Reizgas, Straßenbahn;2025-06-16T17:38:02+02:00;2025-06-16T17:38:02+02:00;;dpa Baden-Württemberg;false
cf20121aeb1af219ed8f8eaefa3c195b66a07e6607df0bcd616926c2af9c1594;Trumps Söhne stellen Handyangebot mit Familiennamen vor;https://www.zeit.de/wirtschaft/unternehmen/2025-06/trump-mobile-familie-us-praesident-handyvertrag-smartphone;Die Söhne des US-Präsidenten haben einen Handyvertrag namens Trump Mobile und ein Smartphone vorgestellt. Kritiker bemängeln die Vermengung von Politik und Geschäften.;Trump Mobile;Wirtschaft, Trump Mobile, Donald Trump, USA, Familie, Smartphone, Technologie, Telekommunikation, Ökonomie;2025-06-16T17:36:23+02:00;2025-06-16T17:36:23+02:00;mmh;ZEIT ONLINE,        dpa,        AP,        Reuters,        							mmh;false
053d3d451de56109b84b9715e41caae66f82c714c855d2d8bcb7b682a7d1d2e8;Iran: Israel greift Staatssender in Teheran an;https://www.zeit.de/news/2025-06/16/iran-israel-greift-staatssender-in-teheran-an;Hier finden Sie Informationen zu dem Thema „Nahost“. Lesen Sie jetzt „Iran: Israel greift Staatssender in Teheran an“.;Nahost;News, Nahost, News;2025-06-16T17:32:29+02:00;2025-06-16T17:32:29+02:00;;dpa;false
388810c356d0f184941659ff283a32331a4279022366218a0716ce897babd242;Experte: Ostsee-Munitionsbergung keine Jahrhundertaufgabe;https://www.zeit.de/news/2025-06/16/experte-ostsee-munitionsbergung-keine-jahrhundertaufgabe;Hier finden Sie Informationen zu dem Thema „Umwelt“. Lesen Sie jetzt „Experte: Ostsee-Munitionsbergung keine Jahrhundertaufgabe“.;Umwelt;News, Umwelt, Jens Greinert, Ostsee, Kiel, Jahrhundertaufgabe, Munitionsaltlast, Kampfstoff;2025-06-16T17:30:28+02:00;2025-06-16T17:30:28+02:00;;dpa Hamburg/Schleswig-Holstein;false
fd9f1d98308490ae7ae8ec1754932035b30ca8e3ccdcce74ed4a5852122b4627;Brand in Lichtenfelser Einkaufszentrum;https://www.zeit.de/news/2025-06/16/brand-in-lichtenfelser-einkaufszentrum;Hier finden Sie Informationen zu dem Thema „Ursache noch unklar“. Lesen Sie jetzt „Brand in Lichtenfelser Einkaufszentrum“.;Ursache noch unklar;News, Ursache noch unklar, Lichtenfels, Polizei, Einkaufszentrum, Sachschaden;2025-06-16T17:30:27+02:00;2025-06-16T17:30:27+02:00;;dpa Bayern;false
937d24df4875ef56536d5bea1a035c8c7572d1a6d6e5d98ceb8e023e29774891;"""Wir haben Deutschland viel mehr lieb als damals""";https://www.zeit.de/kultur/2025-06/bill-tom-kaulitz-tokio-hotel-netflix-reality-tv-staffel-2;Bill und Tom Kaulitz lieben deutsche Hausmannskost, deutsche Staubsauger und Angela Merkel. Dabei leben sie weit weg vom Heimatland – wo sie sich nicht sicher fühlten.;"Z+ (abopflichtiger Inhalt);
        
    Bill und Tom Kaulitz";Kultur, Bill und Tom Kaulitz, Streaming, Netflix, Bill Kaulitz, Angela Merkel, Tom Kaulitz, Hausmannskost;2025-06-16T17:30:22+02:00;2025-06-16T17:30:22+02:00;Stella Schalamon;;false
c0218a448a21898c0c23c8e86bd486d990a0287e106a5a9cb6368231088daf8c;Auto überschlägt sich - Fahrer mit drei Promille unterwegs;https://www.zeit.de/news/2025-06/16/auto-ueberschlaegt-sich-fahrer-mit-drei-promille-unterwegs;Hier finden Sie Informationen zu dem Thema „Bei Leipzig“. Lesen Sie jetzt „Auto überschlägt sich - Fahrer mit drei Promille unterwegs“.;Bei Leipzig;News, Bei Leipzig, Leipzig, Neukieritzsch, Landkreis Leipzig, Polizei, Auto;2025-06-16T17:29:00+02:00;2025-06-16T17:29:00+02:00;;dpa Sachsen;false
9fca75ee501b7884f1e1c702fcd9f6ecc7a46977d327c09fd0e56c9f5386f965;Spaziergänger findet Leiche von vermisstem Schwimmer;https://www.zeit.de/news/2025-06/16/spaziergaenger-findet-leiche-von-vermisstem-schwimmer;Hier finden Sie Informationen zu dem Thema „Notfälle“. Lesen Sie jetzt „Spaziergänger findet Leiche von vermisstem Schwimmer“.;Notfälle;News, Notfälle, Kölner See, Notfall;2025-06-16T17:28:06+02:00;2025-06-16T17:28:06+02:00;;dpa Nordrhein-Westfalen;false
d1f678f5d278c495328066ace8ead07b3ae8298d4e1ab97b9b867a31e5e27de7;Zoff wegen Final-Terminen: BBL wehrt sich gegen Ulmer Kritik;https://www.zeit.de/news/2025-06/16/zoff-wegen-final-terminen-bbl-wehrt-sich-gegen-ulmer-kritik;Hier finden Sie Informationen zu dem Thema „Basketball“. Lesen Sie jetzt „Zoff wegen Final-Terminen: BBL wehrt sich gegen Ulmer Kritik“.;Basketball;News, Basketball, Ulm, München, BBL, Ratiopharm Ulm, FC Bayern München, NBA, Bundesliga, Basketball, Spielansetzung, Finalserie;2025-06-16T17:26:38+02:00;2025-06-16T17:26:38+02:00;;dpa Baden-Württemberg;false
51696497047e3808173cd66c76380c9e4fd84b6f90fafda503f09eec06960955;Die Rache des Narzissten;https://www.zeit.de/zeit-verbrechen/2025/33/entfuehrung-psychotherapeutin-koeln-narzissmus-rache;Ein Mann fühlt sich von seiner Therapeutin gedemütigt und will sich rächen: mit einer Tat, die nur ein Narzisst begehen kann. In Deutschland gibt es immer mehr davon.;"Z+ (abopflichtiger Inhalt);
        
    Entführung";Gesellschaft, Entführung, Entführung, Köln, Folter, Gerichtsverfahren, Türkei;2025-06-16T17:22:43+02:00;2025-06-16T17:22:43+02:00;Hariett Drack;Aus        ZEIT Verbrechen Nr. 33/2025;false
1c4cf440fdfa8db8658a7aa7b8d53aae9a7939705fcc130f0421f6820eaee00c;Wiebke Winter ist neue Bremer CDU-Fraktionsvorsitzende;https://www.zeit.de/news/2025-06/16/wiebke-winter-ist-neue-bremer-cdu-fraktionsvorsitzende;Hier finden Sie Informationen zu dem Thema „Wahl in Bremen“. Lesen Sie jetzt „Wiebke Winter ist neue Bremer CDU-Fraktionsvorsitzende“.;Wahl in Bremen;News, Wahl in Bremen, Bremen, CDU, Winter;2025-06-16T17:20:39+02:00;2025-06-16T17:20:39+02:00;;dpa Niedersachsen;false
c7572aa6b024981237a2e2021f67509ba7f2be9c26ec2c6779017f9e98b0d857;Putzaktion in Rostocker Park zur Pflege jüdischen Erbes;https://www.zeit.de/news/2025-06/16/putzaktion-in-rostocker-park-zur-pflege-juedischen-erbes;Hier finden Sie Informationen zu dem Thema „Judentum“. Lesen Sie jetzt „Putzaktion in Rostocker Park zur Pflege jüdischen Erbes“.;Judentum;News, Judentum, Martin Rösel, Rostock, Universität Rostock, Putzaktion, Pflege, Judentum, Lindenpark;2025-06-16T17:20:23+02:00;2025-06-16T17:20:23+02:00;;dpa Mecklenburg-Vorpommern;false
acf00fd8b610f3786cd4920d07afb7784ae43a4598e383231dd89ab322fbf998;Bundestagsspitze: Regenbogennetzwerk nicht beim CSD;https://www.zeit.de/news/2025-06/16/weisung-der-bundestagsspitze-regennetzwerk-nicht-beim-csd;Hier finden Sie Informationen zu dem Thema „Queere Gruppe“. Lesen Sie jetzt „Bundestagsspitze: Regenbogennetzwerk nicht beim CSD“.;Queere Gruppe;News, Queere Gruppe, Berlin, Deutscher Bundestag, Christopher Street Day, Bundestagsspitze, Regennetzwerk, Weisung, Regenbogennetzwerk, Bundestagsverwaltung;2025-06-16T17:19:58+02:00;2025-06-16T17:19:58+02:00;;dpa Berlin/Brandenburg;false
8f8cff9101e9022c025111aa34a45909e36238901a92ce0ae4f036cebda2ffaf;Verblüffend verunsicherte Truppe;https://www.zeit.de/2025/25/extremismus-afd-matthias-helferich-verfassungsschutz-alice-weidel;Siegeszuversicht, Selbstzweifel und die Angst vor einem Verbotsverfahren: Wer sich in diesen Tagen in der AfD umhört, trifft auf eine verblüffend verunsicherte Truppe.;Extremismus in der AfD;Politik, Extremismus in der AfD, Rechtsextremismus, Alternative für Deutschland, Alice Weidel, Verfassungsschutz, Extremismus;2025-06-16T17:18:22+02:00;2025-06-16T17:18:22+02:00;Mariam Lau;Aus der        ZEIT Nr. 25/2025;false
d7195a3d1280de6918a456c6dfae085dfb1c448bb169479ff7e7e9d9796447a1;Sprechende Bushaltestelle soll Reisezentren ersetzen;https://www.zeit.de/news/2025-06/16/hvv-will-bushaltestelle-mit-sprachassistent-einfuehren;Hier finden Sie Informationen zu dem Thema „Künstliche Intelligenz“. Lesen Sie jetzt „Sprechende Bushaltestelle soll Reisezentren ersetzen“.;Künstliche Intelligenz;News, Künstliche Intelligenz, Oliver Krischer, Anjes Tjarks, Hamburg, Hamburger Verkehrsverbund, Sprachassistent, Bushaltestelle, Mobilitätskongress, Korbutt, künstliche Intelligenz;2025-06-16T17:15:37+02:00;2025-06-16T17:15:37+02:00;;dpa Hamburg/Schleswig-Holstein;false
5530b01402ff63e72996e6fe31687c407b569fc83d084428f86c79f88df3d739;Chinesische Studentin in München unter Spionageverdacht;https://www.zeit.de/news/2025-06/16/chinesische-studentin-in-muenchen-unter-spionageverdacht;Hier finden Sie Informationen zu dem Thema „Technische Universität“. Lesen Sie jetzt „Chinesische Studentin in München unter Spionageverdacht“.;Technische Universität;News, Technische Universität, München, China, TU München, TU, Spionageverdacht, Generalstaatsanwaltschaft, Geheimnisverrat;2025-06-16T17:14:31+02:00;2025-06-16T17:14:31+02:00;;dpa Bayern;false
7a92e5f47c853ea3e4d194c2601c88909fe1072e68cc479834cda073caeef272;Ministerium: Paul ging wegen Terminen nicht ans Handy;https://www.zeit.de/news/2025-06/16/ministerium-paul-ging-wegen-terminen-nicht-ans-handy;Hier finden Sie Informationen zu dem Thema „Fall Solingen“. Lesen Sie jetzt „Ministerium: Paul ging wegen Terminen nicht ans Handy“.;Fall Solingen;News, Fall Solingen, Mona Neubaur, Josefine Paul, Solingen, Düsseldorf, Deutsche Presse-Agentur, Kölner Stadt-Anzeiger, BAMF, LKA, CDU, Flüchtlingsministerium;2025-06-16T17:11:21+02:00;2025-06-16T17:11:21+02:00;;dpa Nordrhein-Westfalen;false
f9d4988c46620b9c08f104c9b03d90e5b3c356e1c83e6e3a2bce1fb7470a5d42;Welche Flugabwehrsysteme Israel vor iranischen Raketen schützen;https://www.zeit.de/politik/ausland/2024-08/israel-luftverteidigung-iran-raketen-faq;Iron Dome, Arrow – Israels Luftverteidigung gilt als eine der besten weltweit. Welche Systeme sie nutzt und warum trotzdem iranische Raketen einschlagen. Ein Überblick;Israels Luftverteidigung;Politik, Israels Luftverteidigung, Israel, Militär, Luftwaffe, Rakete, Iran, Gazastreifen, Teheran, USA, Hisbollah, Huthi;2025-06-16T17:10:55+02:00;2025-06-16T17:10:55+02:00;Mathis GannLeon Ginzel;;false
0291165946a27ee2e1eded7e678aceb7ff0ee71b78e551ef80bd99e991e30a23;Bundeswehrfeindliche Plakate - Staatsschutz ermittelt;https://www.zeit.de/news/2025-06/16/bundeswehrfeindliche-plakate-staatsschutz-ermittelt;Hier finden Sie Informationen zu dem Thema „Ermittlungen“. Lesen Sie jetzt „Bundeswehrfeindliche Plakate - Staatsschutz ermittelt“.;Ermittlungen;News, Ermittlungen, Schwerin, Bundeswehr, Polizei, Staatsschutz, Plakat, Ermittlung, Werbeplakat;2025-06-16T17:10:18+02:00;2025-06-16T17:10:18+02:00;;dpa Mecklenburg-Vorpommern;false
f62b912395552060dd63abf4f6e8059e198e9039b960053a5874f524b2fc7268;Schweißer bei Arbeitsunfall erschlagen;https://www.zeit.de/news/2025-06/16/schweisser-bei-arbeitsunfall-erschlagen;Hier finden Sie Informationen zu dem Thema „Tödlicher Unfall“. Lesen Sie jetzt „Schweißer bei Arbeitsunfall erschlagen“.;Tödlicher Unfall;News, Tödlicher Unfall, Arbeitsunfall, Unfall, Schweißtisch, Stahlbetrieb;2025-06-16T17:07:00+02:00;2025-06-16T17:07:00+02:00;;dpa Niedersachsen;false
0576912568703bd529a13ca80b6ac7c3d78347a52936e99f814f9e84872227f5;Brandursache nach Wespenbekämpfung mit Deo weiter ungeklärt;https://www.zeit.de/news/2025-06/16/mann-bekaempft-wespen-mit-deo-und-legt-aus-versehen-feuer;Hier finden Sie Informationen zu dem Thema „Fahrlässige Brandstiftung?“. Lesen Sie jetzt „Brandursache nach Wespenbekämpfung mit Deo weiter ungeklärt“.;Fahrlässige Brandstiftung?;News, Fahrlässige Brandstiftung?, Polizei, Wespe, Brandstiftung;2025-06-16T17:06:49+02:00;2025-06-16T17:06:49+02:00;;dpa Baden-Württemberg;false
cbf46569f6daaf67f9a7f7bb24757f1592df0d5389052b336ee6444c68e2040d;Esa-Satellitenpaar erzeugt künstliche Sonnenfinsternis;https://www.zeit.de/news/2025-06/16/esa-satellitenpaar-erzeugt-kuenstliche-sonnenfinsternis;Hier finden Sie Informationen zu dem Thema „Raumfahrt“. Lesen Sie jetzt „Esa-Satellitenpaar erzeugt künstliche Sonnenfinsternis“.;Raumfahrt;News, Raumfahrt, Sonnenfinsternis, Sonnenkorona;2025-06-16T16:59:02+02:00;2025-06-16T16:59:02+02:00;;dpa;false
2e1cfcf463e4a8ce94dead7d1c451f0d980c0a35e86ce5fa824a0bbbf9ef1652;Trauerfeier für Künstler Günther Uecker im Schweriner Dom;https://www.zeit.de/news/2025-06/16/trauerfeier-fuer-kuenstler-guenther-uecker-im-schweriner-dom;Hier finden Sie Informationen zu dem Thema „Letzte Ehre“. Lesen Sie jetzt „Trauerfeier für Künstler Günther Uecker im Schweriner Dom“.;Letzte Ehre;News, Letzte Ehre, Günther Uecker, Schwerin, Düsseldorf, Trauerfeier;2025-06-16T16:58:43+02:00;2025-06-16T16:58:43+02:00;;dpa Mecklenburg-Vorpommern;false
3cb903bd95c9f5de443451cbd3e10da43db35861cecfc72ad52aaea899a788b9;Von Zigarettenstummeln zum Haftbefehl: Mann festgenommen;https://www.zeit.de/news/2025-06/16/von-zigarettenstummeln-zum-haftbefehl-mann-festgenommen;Hier finden Sie Informationen zu dem Thema „Fulda“. Lesen Sie jetzt „Von Zigarettenstummeln zum Haftbefehl: Mann festgenommen“.;Fulda;News, Fulda, Fulda, Bundespolizei, Zigarettenstummel, Haftbefehl, Gleisbereich, Streife;2025-06-16T16:54:07+02:00;2025-06-16T16:54:07+02:00;;dpa Hessen;false
6b2b1be2690bb97f129810839ab97dc8960d193947c4853686ae128535af9e25;Gans und Küken mit Pfeilen beschossen;https://www.zeit.de/news/2025-06/16/gans-und-kueken-mit-pfeilen-beschossen;Hier finden Sie Informationen zu dem Thema „Kriminalität“. Lesen Sie jetzt „Gans und Küken mit Pfeilen beschossen“.;Kriminalität;News, Kriminalität, Ludwigshafen, Polizei, Pfeil, Blasrohrpfeil, Kriminalität;2025-06-16T16:51:18+02:00;2025-06-16T16:51:18+02:00;;dpa Rheinland-Pfalz/Saarland;false
4e96958fb68ee08256f163acf0fbac16f305b98e4eb60ae4bf731a65e2bd7e99;Sammelklage gegen Vodafone knackt 100.000er Marke;https://www.zeit.de/news/2025-06/16/sammelklage-gegen-vodafone-knackt-100-000er-marke;Hier finden Sie Informationen zu dem Thema „Umstrittene Preiserhöhung“. Lesen Sie jetzt „Sammelklage gegen Vodafone knackt 100.000er Marke“.;Umstrittene Preiserhöhung;News, Umstrittene Preiserhöhung, Hamm, Vodafone, Verbraucherzentrale Bundesverband, OLG, Sammelklage, Preiserhöhung, Klageregister;2025-06-16T16:50:47+02:00;2025-06-16T16:50:47+02:00;;dpa;false
3924a11fdbeb8e4f85049349558de6439c6514195a5bb58869b35d99af020b38;Kinder angesprochen - 35-Jähriger in Haft;https://www.zeit.de/news/2025-06/16/kinder-angesprochen-35-jaehriger-in-haft;Hier finden Sie Informationen zu dem Thema „Krefeld“. Lesen Sie jetzt „Kinder angesprochen - 35-Jähriger in Haft“.;Krefeld;News, Krefeld, Krefeld, Polizei;2025-06-16T16:46:30+02:00;2025-06-16T16:46:30+02:00;;dpa Nordrhein-Westfalen;false
