Hash;Title;Link;Description;Category;KeyWords;Published;LastUpdated;Author;Source;Paywall
f935eaba5032bf6581854715ab91930c4102830e540c2072117996fb43345bae;Zwei Leichtverletzte bei Kollision von Lkw und Hafenbahn;https://www.zeit.de/news/2026-03/19/zwei-leichtverletzte-bei-kollision-von-lkw-und-hafenbahn;Hier finden Sie Informationen zu dem Thema „Unfall im Hamburger Hafen“. Lesen Sie jetzt „Zwei Leichtverletzte bei Kollision von Lkw und Hafenbahn“.;Unfall im Hamburger Hafen;News, Unfall im Hamburger Hafen, Hamburger Hafen, Hafenbahn, Kollision, Unfall;2026-03-19T18:18:46+01:00;2026-03-19T18:18:46+01:00;;dpa Hamburg/Schleswig-Holstein;false
b5b1444ec0da4ccff01547503892f341f861fcc856504721ae7addad9f30e2f3;Karl Lauterbach verteidigt Coronamaßnahmen und Impfstrategie;https://www.zeit.de/politik/deutschland/2026-03/coronavirus-lothar-wieler-datenlage-krisenmanagement;Vor einer Bundestagskommission hat Karl Lauterbach gesagt, Deutschland sei verhältnismäßig gut durch die Pandemie gekommen. Ex-RKI-Chef Wieler zog ein gemischtes Fazit.;Coronavirus;Politik, Coronavirus, Karl Lauterbach, RKI, Pandemie, Coronavirus, Lothar Wieler, Gesundheitspolitik, Impfung;2026-03-19T18:07:27+01:00;2026-03-19T18:07:27+01:00;eddyer;DIE ZEIT,        dpa,        							edd					,        							yer;false
09ed79610182ab9cb49ec34ebd3352a8a2affaf35354214c511ce15dedcbbc6c;Laster geht auf Autobahnbrücke bei Würzburg in Flammen auf;https://www.zeit.de/news/2026-03/19/laster-geht-auf-autobahnbruecke-bei-wuerzburg-in-flammen-auf;Hier finden Sie Informationen zu dem Thema „A3 bei Randersacker“. Lesen Sie jetzt „Laster geht auf Autobahnbrücke bei Würzburg in Flammen auf“.;A3 bei Randersacker;News, A3 bei Randersacker, Würzburg, Randersacker, Autobahnbrücke;2026-03-19T18:06:23+01:00;2026-03-19T18:06:23+01:00;;dpa Bayern;false
292fc832f9a23262ee4257bba05fc08e2683df1f197d2aca3c55f2cd916cedc5;Preis der Leipziger Buchmesse geht an Katerina Poladjan;https://www.zeit.de/feuilleton/literatur/2026-03/preis-leipziger-buchmesse-katerina-poladjan-belletristik;"Für ihren Roman ""Goldstrand"" hat Katerina Poladjan den Preis der Leipziger Buchmesse gewonnen. 2022 hatte sie bereits auf der Shortlist gestanden.";Leipziger Buchmesse;Feuilleton, Leipziger Buchmesse, Leipziger Buchmesse, Belletristik, Auszeichnung, Schriftstellerin, Literatur, Biografie;2026-03-19T18:04:24+01:00;2026-03-19T18:04:24+01:00;man;DIE ZEIT,        dpa,        AFP,        SID,        							man;false
bf704854c2962f223783a5bf47eb52afead5fad421f80ad8770623facd4220f6;Bewusstlose Frauen missbraucht? 32-Jähriger vor Gericht;https://www.zeit.de/news/2026-03/19/bewusstlose-frauen-missbraucht-32-jaehriger-vor-gericht;Hier finden Sie Informationen zu dem Thema „Sexualstraftaten“. Lesen Sie jetzt „Bewusstlose Frauen missbraucht? 32-Jähriger vor Gericht“.;Sexualstraftaten;News, Sexualstraftaten, China, Berlin, Sexualstraftat, Chatgruppe, Sexuelle Übergriffe, Vergewaltigung, Körperverletzung;2026-03-19T18:01:52+01:00;2026-03-19T18:01:52+01:00;;dpa Berlin/Brandenburg;false
812754e45628f73e42474dcf005dabe49ce2166a00d91a0a6430d66a2d025af3;Wittenberg bereitet sich auf historisches Stadtfest vor;https://www.zeit.de/news/2026-03/19/wittenberg-bereitet-sich-auf-historisches-stadtfest-vor;Hier finden Sie Informationen zu dem Thema „Kultur“. Lesen Sie jetzt „Wittenberg bereitet sich auf historisches Stadtfest vor“.;Kultur;News, Kultur, Martin Luther, Wittenberg, Stadtfest, Altstadtfest;2026-03-19T18:00:05+01:00;2026-03-19T18:00:05+01:00;;dpa Sachsen;false
0b9ce0fab3d537c92e31217f56df72290a130603534915f81b3a1f8b968c0c0d;Feuerwehr rettet Katze aus verrauchter Wohnung;https://www.zeit.de/news/2026-03/19/feuerwehr-rettet-katze-aus-verrauchter-wohnung;Hier finden Sie Informationen zu dem Thema „Schwetzingen“. Lesen Sie jetzt „Feuerwehr rettet Katze aus verrauchter Wohnung“.;Schwetzingen;News, Schwetzingen, Schwetzingen, Feuerwehr, Katze;2026-03-19T17:57:20+01:00;2026-03-19T17:57:20+01:00;;dpa Baden-Württemberg;false
62f6aed3e7177d6d570ce34d08a9d14514b38f0d9852a0506b5209f2fd484938;Minister warnt vor Folgen für Bahnverkehr in Brandenburg;https://www.zeit.de/news/2026-03/19/minister-warnt-vor-folgen-fuer-bahnverkehr-in-brandenburg;Hier finden Sie Informationen zu dem Thema „Europäischer Gerichtshof“. Lesen Sie jetzt „Minister warnt vor Folgen für Bahnverkehr in Brandenburg“.;Europäischer Gerichtshof;News, Europäischer Gerichtshof, Robert Crumbach, Brandenburg, EuGH, SPD, Bahnverkehr;2026-03-19T17:54:19+01:00;2026-03-19T17:54:19+01:00;;dpa Berlin/Brandenburg;false
33ade20521df0b9f79db25c2b20cf3920b9c61ddbf976c2c1200b251dc5d2e88;"Eintritt nur mit Ticket? ""Dann ist das nicht mehr mein Dom""";https://www.zeit.de/feuilleton/2026-03/barbara-schock-werner-dombaumeisterin-koelner-dom-eintrittsgeld;Die ehemalige Dombaumeisterin Barbara Schock-Werner äußert sich alarmiert über Pläne, für das Kölner Wahrzeichen Eintritt zu verlangen. Wäre das ein Sündenfall?;Barbara Schock-Werner;Feuilleton, Barbara Schock-Werner, Köln, Nordrhein-Westfalen, Denkmalschutz, Katholische Kirche, Tourismus, Architektur;2026-03-19T17:50:28+01:00;2026-03-19T17:50:28+01:00;Yannic Vitz;;false
eca5ad4e102ee24d993c188710d7d0d2466ffc5068c9ce07488f1de2164dcfed;Landtag Brandenburg verteidigt Einstufung der AfD als extrem;https://www.zeit.de/news/2026-03/19/landtag-brandenburg-verteidigt-einstufung-der-afd-als-extrem;Hier finden Sie Informationen zu dem Thema „Verfassungsschutz“. Lesen Sie jetzt „Landtag Brandenburg verteidigt Einstufung der AfD als extrem“.;Verfassungsschutz;News, Verfassungsschutz, Brandenburg, Alternative für Deutschland, Verfassungsschutz, SPD, CDU, Bündnis Sahra Wagenknecht, Verwaltungsgericht, Einstufung, Landtag;2026-03-19T17:50:21+01:00;2026-03-19T17:50:21+01:00;;dpa Berlin/Brandenburg;false
693941d04eaf49aff154ce6b84c9bdf88f738e80eed4e6536b0a78b0c7e8094b;Land will Feiertagsgesetz reformieren – Streit um Tanzverbot;https://www.zeit.de/news/2026-03/19/land-will-feiertagsgesetz-reformieren-streit-um-tanzverbot;Hier finden Sie Informationen zu dem Thema „Feiertage“. Lesen Sie jetzt „Land will Feiertagsgesetz reformieren – Streit um Tanzverbot“.;Feiertage;News, Feiertage, Wiesbadener Landtag, FDP, CDU, Karfreitag, Feiertagsgesetz, Tanzverbot, Feiertag, Belletristik;2026-03-19T17:47:35+01:00;2026-03-19T17:47:35+01:00;;dpa Hessen;false
1a2e7473df55534038a3d5005963706031049de1cb7957ef2fdccd9f95a9a466;Sängerin Angelika Mann in Berlin beigesetzt;https://www.zeit.de/news/2026-03/19/saengerin-angelika-mann-in-berlin-beigesetzt;Hier finden Sie Informationen zu dem Thema „DDR-Star“. Lesen Sie jetzt „Sängerin Angelika Mann in Berlin beigesetzt“.;DDR-Star;News, DDR-Star, Angelika Mann, Sängerin, Berlin, Berlin-Schöneberg, Stubenrauchstraße;2026-03-19T17:46:30+01:00;2026-03-19T17:46:30+01:00;;dpa Berlin/Brandenburg;false
38d41577387f1456823783bdccfa37451b1f954598a2ae23eb4f1f7972fce2cf;Frauenfeindliche Inhalte machen Menschen tatsächlich frauenfeindlich;https://www.zeit.de/wissen/2026-03/misogynie-medienkonsum-sexismus-frauenfeindlichkeit-psychologie;Eine Studie zeigt: Wer misogyne Videos, Games oder Pornos konsumiert, übernimmt oft sexistische Haltungen und aggressives Verhalten. Das gilt mitunter sogar für Frauen.;"Z+ (abopflichtiger Inhalt);
        
    Misogynie und Medienkonsum";Wissen, Misogynie und Medienkonsum, Sexismus, Soziale Medien, Mann, Frauen, Vergewaltigung, Psychologie, Pornografie, Studie, Videospiel;2026-03-19T17:44:59+01:00;2026-03-19T17:44:59+01:00;Dr.  Maria Mast;;false
71c385ea6fbf5a8777bfb211910a46891ca4da0e81a6d293aefb69306af1fa9e;Nach dem Unglück in der Schweiz: Wie sicher sind Seilbahnen?;https://www.zeit.de/news/2026-03/19/nach-dem-unglueck-in-der-schweiz-wie-sicher-sind-seilbahnen;Hier finden Sie Informationen zu dem Thema „Wintersport“. Lesen Sie jetzt „Nach dem Unglück in der Schweiz: Wie sicher sind Seilbahnen?“.;Wintersport;News, Wintersport, Reto Canale, Schweiz, Österreich, Polizei, Staatsanwaltschaft, Unglück, Seilbahn, Wintersport, Gondel, Sicherheit;2026-03-19T17:41:27+01:00;2026-03-19T17:41:27+01:00;;dpa;false
f5cbd4ba509882346151420071855b0268356e5a9555dfd130c6952b6c6647a7;Preuß-Nachfolgerin: Jeanmonnot holt Biathlon-Gesamtweltcup;https://www.zeit.de/news/2026-03/19/preuss-nachfolgerin-jeanmonnot-holt-biathlon-gesamtweltcup;Hier finden Sie Informationen zu dem Thema „Saisonfinale in Oslo“. Lesen Sie jetzt „Preuß-Nachfolgerin: Jeanmonnot holt Biathlon-Gesamtweltcup“.;Saisonfinale in Oslo;News, Saisonfinale in Oslo, Lou Jeanmonnot, Franziska Preuß, Hanna Öberg, Oslo, Norwegen, Saisonfinale, Winter;2026-03-19T17:40:00+01:00;2026-03-19T17:40:00+01:00;;dpa Sport;false
22ec8631033b8e84ed76a895ffde1b6030af628eda202f366037a3f2b91bc5ac;"Mehrjährige Haft für Mitglieder der ""Porsche-Bande""";https://www.zeit.de/news/2026-03/19/mehrjaehrige-haft-fuer-mitglieder-der-porsche-bande;"Hier finden Sie Informationen zu dem Thema „Luxusautos gestohlen“. Lesen Sie jetzt „Mehrjährige Haft für Mitglieder der ""Porsche-Bande""“.";Luxusautos gestohlen;News, Luxusautos gestohlen, Mann, Düsseldorf, Porsche, Landgericht Düsseldorf, Luxusauto, Haftstrafe;2026-03-19T17:39:36+01:00;2026-03-19T17:39:36+01:00;;dpa Hessen;false
b004184c300c509c1abcc36f053f74e52aee123012e3fdc7cdc3af5eadf18650;19.000 Jugendliche probieren bei Aktionswoche Berufe aus;https://www.zeit.de/news/2026-03/19/19-000-jugendliche-probieren-bei-aktionswoche-berufe-aus;Hier finden Sie Informationen zu dem Thema „Ausbildung“. Lesen Sie jetzt „19.000 Jugendliche probieren bei Aktionswoche Berufe aus“.;Ausbildung;News, Ausbildung, Aktionswoche, Beruf;2026-03-19T17:38:12+01:00;2026-03-19T17:38:12+01:00;;dpa Sachsen;false
5e7ead2c881a56f90c207c9cf6fda7c5baf7ce371b159027d988637016256a63;Gondelabsturz: Ermittler sichern Klemme und prüfen Videos;https://www.zeit.de/news/2026-03/19/gondelabsturz-ermittler-sichern-klemme-und-pruefen-videos;Hier finden Sie Informationen zu dem Thema „Wintersport“. Lesen Sie jetzt „Gondelabsturz: Ermittler sichern Klemme und prüfen Videos“.;Wintersport;News, Wintersport, Schweiz, Gondelabsturz, Wintersport, Unfalluntersuchungsstelle;2026-03-19T17:38:04+01:00;2026-03-19T17:38:04+01:00;;dpa Baden-Württemberg;false
4114be6ebbfde58b3f9a6f714b9daa3d6bd14b077b94bf73e6fbf5218241bc21;Nachbar tötet Frau für weniger als 600 Euro – lebenslang;https://www.zeit.de/news/2026-03/19/urteil-im-mordprozess-um-getoetete-nachbarin-lebenslang;Hier finden Sie Informationen zu dem Thema „Prozesse“. Lesen Sie jetzt „Nachbar tötet Frau für weniger als 600 Euro – lebenslang“.;Prozesse;News, Prozesse, Landgericht Hannover, Mordprozess, Tötung, Freiheitsstrafe, Geld;2026-03-19T17:38:02+01:00;2026-03-19T17:38:02+01:00;;dpa Niedersachsen;false
a08d5ee491fc156592bde7760d1c24122747b71901188acb532f0a358ae2605d;So wollen andere Länder die Spritpreise senken;https://www.zeit.de/mobilitaet/2026-03/kraftstoffpreise-massnahmen-gesetzentwurf-preisbremse-regulierung;Preisobergrenzen und Steuerrabatte: Während Tankstellen in Deutschland künftig nur noch einmal am Tag die Preise erhöhen dürfen, greifen andere Regierungen stärker ein.;Hohe Kraftstoffpreise;Mobilitaet, Hohe Kraftstoffpreise, Benzinpreis, Diesel, Tankstelle, Bundesregierung, Slowakei, Ungarn, Österreich, Frankreich, Griechenland, Energiepolitik;2026-03-19T17:34:33+01:00;2026-03-19T17:34:33+01:00;Niclas Kreft;;false
9a4b1847cd5581b70f92ee1185810cdbb06e6fb429376de5550fcd0f4d5876ad;Falsche Polizisten ergaunern wertvolle Gegenstände;https://www.zeit.de/news/2026-03/19/falsche-polizisten-ergaunern-wertvolle-gegenstaende;Hier finden Sie Informationen zu dem Thema „Ehrenkirchen“. Lesen Sie jetzt „Falsche Polizisten ergaunern wertvolle Gegenstände“.;Ehrenkirchen;News, Ehrenkirchen, Ehrenkirche, Gegenstand;2026-03-19T17:33:09+01:00;2026-03-19T17:33:09+01:00;;dpa Baden-Württemberg;false
74a3340cd8337412560b4192f73865b1c591d3838ce7d4a56a92723bb77d9507;Urteil zu Leiche im Krötentunnel: Reichen die Indizien aus?;https://www.zeit.de/news/2026-03/19/urteil-zu-leiche-im-kroetentunnel-reichen-die-indizien-aus;Hier finden Sie Informationen zu dem Thema „Prozesse“. Lesen Sie jetzt „Urteil zu Leiche im Krötentunnel: Reichen die Indizien aus?“.;Prozesse;News, Prozesse, Sindelfingen, Krötentunnel;2026-03-19T17:30:08+01:00;2026-03-19T17:30:08+01:00;;dpa Baden-Württemberg;false
cbf32ff70638981f2afb1298e1730d10c81b27bd63dfc2be8aeb021ac07ab890;Polizei fahndet nach Brandstifter von Bornheim;https://www.zeit.de/news/2026-03/19/polizei-fahndet-nach-brandstifter-von-bornheim;Hier finden Sie Informationen zu dem Thema „Kriminalität“. Lesen Sie jetzt „Polizei fahndet nach Brandstifter von Bornheim“.;Kriminalität;News, Kriminalität, Bornheim, Polizei, Brandstiftung, Kriminalität;2026-03-19T17:24:19+01:00;2026-03-19T17:24:19+01:00;;dpa Nordrhein-Westfalen;false
a81a5c9a4ba064b11edffdf5886c3f05665cebfec7f80d97e0e9340b679de9f5;MV will Pläne für Stromtrasse nach Schweden wiederbeleben;https://www.zeit.de/news/2026-03/19/mv-will-plaene-fuer-stromtrasse-nach-schweden-wiederbeleben;Hier finden Sie Informationen zu dem Thema „Energie“. Lesen Sie jetzt „MV will Pläne für Stromtrasse nach Schweden wiederbeleben“.;Energie;News, Energie, Ostsee, Schwerin, Güstrow, Schweden, Mecklenburg-Vorpommern, Bundesregierung, Stromtrasse;2026-03-19T17:22:06+01:00;2026-03-19T17:22:06+01:00;;dpa Mecklenburg-Vorpommern;false
d69d8c859dfa8f5768d15f08e1642a207ea11fb914c4d7b8d807e7c2369209cc;Engelbergtunnel Richtung Karlsruhe nun einspurig befahrbar;https://www.zeit.de/news/2026-03/19/engelbergtunnel-richtung-karlsruhe-nun-einspurig-befahrbar;Hier finden Sie Informationen zu dem Thema „140.000 Fahrzeuge pro Tag“. Lesen Sie jetzt „Engelbergtunnel Richtung Karlsruhe nun einspurig befahrbar“.;140.000 Fahrzeuge pro Tag;News, 140.000 Fahrzeuge pro Tag, Karlsruhe, Leonberg, die Autobahn GmbH des Bundes, Engelbergtunnel, Südwesten, Weströhre, Fahrzeug;2026-03-19T17:16:39+01:00;2026-03-19T17:16:39+01:00;;dpa Baden-Württemberg;false
d2d4bcc76d7a732139cbe77f236403158bfc457b469629fc0d0b3fc3f9c16882;Bärbel Bas will rechtliche Klarheit für Umgang mit Beschäftigtendaten;https://www.zeit.de/arbeit/2026-03/baerbel-bas-beschaeftigtendatengesetz-kuenstliche-intelligenz-arbeit;Mehr als die Hälfte der Arbeitnehmenden nutzt künstliche Intelligenz in ihrem Job. Laut Bärbel Bas braucht es daher Regulierungen. Sie fordert ein entsprechendes Gesetz.;Künstliche Intelligenz;Arbeit, Künstliche Intelligenz, künstliche Intelligenz, Bärbel Bas, Digitalisierung, Sprachmodell, Datenschutz, Arbeitnehmer, SPD;2026-03-19T17:12:38+01:00;2026-03-19T17:12:38+01:00;ngo;DIE ZEIT,        dpa,        AFP,        							ngo;false
3194f2a577c99cd6214ac1f942c38dfdc627c8c0cc655802cde8f03b8255b629;Katerina Poladjan mit Preis der Leipziger Buchmesse geehrt;https://www.zeit.de/news/2026-03/19/katerina-poladjan-mit-preis-der-leipziger-buchmesse-geehrt;Hier finden Sie Informationen zu dem Thema „Leipziger Buchmesse“. Lesen Sie jetzt „Katerina Poladjan mit Preis der Leipziger Buchmesse geehrt“.;Leipziger Buchmesse;News, Leipziger Buchmesse, Katerina Poladjan, Moskau, Rom, Bulgarien, Europa, Sowjetunion, Leipzig, Odessa, Preis der Leipziger Buchmesse, Leipziger Buchmesse;2026-03-19T17:11:55+01:00;2026-03-19T17:11:55+01:00;;dpa;false
8c180c8b00ed70a2f343ca2df3cb94d2aacf2e2e09a895a88faebb8ceb4c0933;Streit zwischen Verwandten endet mit Messerverletzung;https://www.zeit.de/news/2026-03/19/streit-zwischen-verwandten-endet-mit-messerverletzung;Hier finden Sie Informationen zu dem Thema „Landkreis Bad Kreuznach“. Lesen Sie jetzt „Streit zwischen Verwandten endet mit Messerverletzung“.;Landkreis Bad Kreuznach;News, Landkreis Bad Kreuznach, Landkreis Bad Kreuznach, Polizei, Messerverletzung;2026-03-19T17:09:36+01:00;2026-03-19T17:09:36+01:00;;dpa Rheinland-Pfalz/Saarland;false
866fb0c3dac51feff791605d47ff22296bf217ad87c57be269f4cd857a058519;Warnstreik legt Nahverkehr lahm – weitere Ausfälle drohen;https://www.zeit.de/news/2026-03/19/warnstreik-legt-nahverkehr-lahm-weitere-ausfaelle-drohen;Hier finden Sie Informationen zu dem Thema „Busse und Bahnen stehen still“. Lesen Sie jetzt „Warnstreik legt Nahverkehr lahm – weitere Ausfälle drohen“.;Busse und Bahnen stehen still;News, Busse und Bahnen stehen still, Benjamin Schladitz, Magdeburg, Dessau, Sachsen-Anhalt, Dessau-Roßlau, Burgenlandkreis, Ver.di, Nahverkehr, Ausfall, Warnstreik;2026-03-19T17:09:24+01:00;2026-03-19T17:09:24+01:00;;dpa Sachsen;false
4d8c6b11c79db99f4d65384fed24f9bf321ad0ecdfebdc5d1d79aa359a86038a;Gemeinsame Terrorabwehr-Übung verläuft erfolgreich;https://www.zeit.de/news/2026-03/19/gemeinsame-terrorabwehr-uebung-verlaeuft-erfolgreich;Hier finden Sie Informationen zu dem Thema „Zusammenarbeit für Sicherheit“. Lesen Sie jetzt „Gemeinsame Terrorabwehr-Übung verläuft erfolgreich“.;Zusammenarbeit für Sicherheit;News, Zusammenarbeit für Sicherheit, Daniel Günther, Schleswig-Holstein, CDU, Bundespolizei, Bundeswehr, Polizei, Zusammenarbeit, Terrorabwehrübung, Getex, Sicherheit;2026-03-19T17:08:16+01:00;2026-03-19T17:08:16+01:00;;dpa Hamburg/Schleswig-Holstein;false
b3dcc80358f3598bbe278b1c17ae4cab90808d2d4518983ea406320e0d60ffda;Zufriedenheit mit Demokratie in NRW bei Jungen eingebrochen;https://www.zeit.de/news/2026-03/19/zufriedenheit-mit-demokratie-in-nrw-bei-jungen-eingebrochen;Hier finden Sie Informationen zu dem Thema „Demokratiebericht“. Lesen Sie jetzt „Zufriedenheit mit Demokratie in NRW bei Jungen eingebrochen“.;Demokratiebericht;News, Demokratiebericht, NRW, Nordrhein-Westfalen, Landeszentrale für politische Bildung, Demokratiebericht, Zufriedenheit;2026-03-19T17:07:44+01:00;2026-03-19T17:07:44+01:00;;dpa Nordrhein-Westfalen;false
575cfa942ab3da1524ecafb9809e51c92cfba2249201dded42da3f62ca0a848e;Verteidigung von Høiby fordert Freispruch von Vergewaltigungsvorwürfen;https://www.zeit.de/gesellschaft/2026-03/norwegen-marius-borg-hoiby-anklage-verteidigung-vorwurf-vergewaltigung-freispruch-gxe;Die Verteidigung des Kronprinzessinnen-Sohns fordert einen Freispruch von den Vergewaltigungsvorwürfen. In anderen Anklagepunkten plädiert sie für eine kurze Haft.;Norwegen;Gesellschaft, Norwegen, Norwegen, Vergewaltigung, Monarchie, Sexueller Missbrauch, Gerichtsverfahren, Oslo;2026-03-19T17:07:27+01:00;2026-03-19T17:07:27+01:00;voi;DIE ZEIT,        dpa,        							voi;false
cacba665d05435bcd2569a345e51aee7be11db73f8f1672915b3a99cb443137d;21-Jähriger spielt Seniorin und überführt Telefonbetrüger;https://www.zeit.de/news/2026-03/19/21-jaehriger-spielt-seniorin-und-ueberfuehrt-telefonbetrueger;Hier finden Sie Informationen zu dem Thema „Telefonbetrug“. Lesen Sie jetzt „21-Jähriger spielt Seniorin und überführt Telefonbetrüger“.;Telefonbetrug;News, Telefonbetrug, Bayern, Polizei, Telefonbetrug, Schauspieleinlage, Schockanruf, Ahorntal;2026-03-19T17:07:00+01:00;2026-03-19T17:07:00+01:00;;dpa Bayern;false
fdedc212637e0ee6e8ff085c549621da3800981c65ed744c9f3eb3523544dd57;Buchladen-Betreiberinnen fordern Unterlassungserklärung von Weimer;https://www.zeit.de/feuilleton/literatur/2026-03/buchladen-zur-schwankenden-weltkugel-wolfram-weimer-deutscher-buchhandlungspreis-klage;In einem ZEIT-Interview hat Kulturstaatsminister Weimer den Ausschluss von Läden vom Buchhandlungspreis mit deren Extremismus begründet. Betreiberinnen wehren sich jetzt.;"Buchladen ""Zur schwankenden Weltkugel""";"Feuilleton, Buchladen ""Zur schwankenden Weltkugel"", Wolfram Weimer, Literatur, Politische Linke, Kulturpolitik, Linksextremismus, Extremismus";2026-03-19T17:06:19+01:00;2026-03-19T17:06:19+01:00;yer;DIE ZEIT,        dpa,        							yer;false
2a47e156be83b2ba730b1bd140572b480a164758974a72def9f1c33ae14dc932;Nagelsmann nominiert Havertz, Rüdiger und Undav für WM-Testspiele;https://www.zeit.de/sport/2026-03/wm-kader-nagelsmann-testspiele-schweiz-ghana;Zwei Partien gegen die Schweiz und Ghana sind Gradmesser für die Fußball-WM. Bundestrainer Nagelsmann nominiert lange vermisste Spieler und sorgt für Überraschungen.;WM-Testspiele;Sport, WM-Testspiele, Julian Nagelsmann, Fifa, Fußball-WM, Bundestrainer, Sportler, Fußballnationalmannschaft, Pascal Groß, Antonio Rüdiger, Kai Havertz, Deniz Undav;2026-03-19T17:04:08+01:00;2026-03-19T17:04:08+01:00;man;DIE ZEIT,        SID,        dpa,        							man;false
2f0354e683c3d1849bbddae9fa626c5b24320e3448e825c9314d5cbacb0d30bc;Katerina Poladjan gewinnt Preis der Leipziger Buchmesse;https://www.zeit.de/news/2026-03/19/katerina-poladjan-gewinnt-preis-der-leipziger-buchmesse;Hier finden Sie Informationen zu dem Thema „Literatur“. Lesen Sie jetzt „Katerina Poladjan gewinnt Preis der Leipziger Buchmesse“.;Literatur;News, Literatur, Katerina Poladjan, Preis der Leipziger Buchmesse;2026-03-19T17:02:46+01:00;2026-03-19T17:02:46+01:00;;dpa;false
58ddfd17db5a0d1b627d3c76935adf16ae4a400e3c8493e1ea54d026dfaf6ec9;Dachstuhlbrand führt zu Verkehrschaos in Mannheim;https://www.zeit.de/news/2026-03/19/dachstuhlbrand-fuehrt-zu-verkehrschaos-in-mannheim;Hier finden Sie Informationen zu dem Thema „Rollbühlstraße“. Lesen Sie jetzt „Dachstuhlbrand führt zu Verkehrschaos in Mannheim“.;Rollbühlstraße;News, Rollbühlstraße, Mannheim, Dachstuhlbrand, Rollbühlstraße, Verkehrschaos, Dachstuhl;2026-03-19T17:00:05+01:00;2026-03-19T17:00:05+01:00;;dpa Baden-Württemberg;false
bae2d8d34cbee526dfe9a7c185a769598cabaf7ac837d6a6f845a9d3a87ab2a4;Drogen-Razzia in Neukölln - Polizei durchsucht sechs Objekte;https://www.zeit.de/news/2026-03/19/drogen-razzia-in-neukoelln-polizei-durchsucht-sechs-objekte;Hier finden Sie Informationen zu dem Thema „Kriminalität“. Lesen Sie jetzt „Drogen-Razzia in Neukölln - Polizei durchsucht sechs Objekte“.;Kriminalität;News, Kriminalität, Neukölln, Polizei, Objekt, Kriminalität, Drogen, Razzia;2026-03-19T16:53:09+01:00;2026-03-19T16:53:09+01:00;;dpa Berlin/Brandenburg;false
0fc27f2ab99d1428955c2714491aaef4f58de5d70f9a5b275a65e7a4a50e2d53;Streit über Steuern auf Spritpreise;https://www.zeit.de/news/2026-03/19/landtag-streitet-ueber-steuern-auf-spritpreise;Hier finden Sie Informationen zu dem Thema „Hohe Spritpreise“. Lesen Sie jetzt „Streit über Steuern auf Spritpreise“.;Hohe Spritpreise;News, Hohe Spritpreise, Wiebke Knell, Klaus Gagel, FDP, Spritpreis, Landtag, Steuer, Sprit, Kosmetik;2026-03-19T16:49:28+01:00;2026-03-19T16:49:28+01:00;;dpa Hessen;false
f7357be93d271952f696b6919ed6c78a492bc3913d16334c2d0031870cd97634;Mehrere Jugendliche in Schulbus bei Unfall leicht verletzt;https://www.zeit.de/news/2026-03/19/mehrere-jugendliche-in-schulbus-bei-unfall-leicht-verletzt;Hier finden Sie Informationen zu dem Thema „Autobahn 11“. Lesen Sie jetzt „Mehrere Jugendliche in Schulbus bei Unfall leicht verletzt“.;Autobahn 11;News, Autobahn 11, Polizei, Unfall, Schulbus, Autobahn;2026-03-19T16:46:21+01:00;2026-03-19T16:46:21+01:00;;dpa Mecklenburg-Vorpommern;false
8f77d60e0e4dd649b2012e6a31c6052ff46787488dcc1e104187510ee8e08428;VW zahlt Mitarbeitern trotz Krise eine Prämie;https://www.zeit.de/wirtschaft/2026-03/volkswagen-krise-praemie-mitarbeiter;Erst vergangene Woche hat Volkswagen Gewinneinbrüche von 44 Prozent gemeldet. Trotzdem sollen die Mitarbeiter im Mai eine Prämie für 2024 erhalten. ;Volkswagen;Wirtschaft, Volkswagen, Volkswagen, Autoindustrie, Arbeitnehmer, Gehalt, Großunternehmen, Industriebetrieb;2026-03-19T16:42:25+01:00;2026-03-19T16:42:25+01:00;man;DIE ZEIT,        dpa,        Reuters,        							man;false
97e2883e109095b13cbc8270427802831ccedf1782a1a44d8b76c6fbc7aba29a;Rot-Schwarz: Woidke will Sicherheit für Brandenburg in Krise;https://www.zeit.de/news/2026-03/19/woidke-will-mit-rot-schwarz-sicherheit-in-der-krise-geben;Hier finden Sie Informationen zu dem Thema „Regierungserklärung“. Lesen Sie jetzt „Rot-Schwarz: Woidke will Sicherheit für Brandenburg in Krise“.;Regierungserklärung;News, Regierungserklärung, Dietmar Woidke, Brandenburg, SPD, Regierungserklärung, Sicherheit, Krise, Koalition;2026-03-19T16:42:20+01:00;2026-03-19T16:42:20+01:00;;dpa Berlin/Brandenburg;false
6a1a084d23d29a6966a6d4aefad10f3790ba8a1ce825181e7353c543ada105a5;Tödlicher Arbeitsunfall - Lkw-Einweiser eingeklemmt;https://www.zeit.de/news/2026-03/19/toedlicher-arbeitsunfall-lkw-einweiser-eingeklemmt;Hier finden Sie Informationen zu dem Thema „Vor Einkaufsmarkt“. Lesen Sie jetzt „Tödlicher Arbeitsunfall - Lkw-Einweiser eingeklemmt“.;Vor Einkaufsmarkt;News, Vor Einkaufsmarkt, Polizei, Arbeitsunfall, Einkaufsmarkt, Warenanlieferung;2026-03-19T16:41:33+01:00;2026-03-19T16:41:33+01:00;;dpa Thüringen;false
6f46cf26a43edb442aa3798b746cf0123e9dac1e5d5f4c08dc5c495757fa8b40;Nachgerückt: Ski-Legende Hilde Gerg geht in die Politik;https://www.zeit.de/news/2026-03/19/nachgerueckt-ski-legende-hilde-gerg-geht-in-die-politik;Hier finden Sie Informationen zu dem Thema „Gemeinderat“. Lesen Sie jetzt „Nachgerückt: Ski-Legende Hilde Gerg geht in die Politik“.;Gemeinderat;News, Gemeinderat, Hilde Gerg, Königsee, Schönau, CSU, Kommunalwahl;2026-03-19T16:39:58+01:00;2026-03-19T16:39:58+01:00;;dpa Bayern;false
c7cb6cd240525623aa7161ffaac1d8dd9f7b0036f2d7009db641c38452cbe868;Horror-Schweinemast in Spanien: Krankheiten, Kadaver, Ratten;https://www.zeit.de/news/2026-03/19/horror-schweinemast-in-spanien-krankheiten-kadaver-ratten;Hier finden Sie Informationen zu dem Thema „Tierwohl“. Lesen Sie jetzt „Horror-Schweinemast in Spanien: Krankheiten, Kadaver, Ratten“.;Tierwohl;News, Tierwohl, Spanien, Teruel, Tierwohl, Kadaver, Schweinemastbetrieb, Nichtregierungsorganisation, Tiere, Tierquälerei, Schlachthof;2026-03-19T16:38:13+01:00;2026-03-19T16:38:13+01:00;;dpa;false
