Hash;Title;Link;Description;Category;KeyWords;Published;LastUpdated;Author;Source;Paywall
996645eb73aa4d971aa2c48bffca331a33402554741293d5b00890c0ec43a109;Hackerangriff auf Stadt Aschaffenburg abgewehrt;https://www.zeit.de/news/2024-11/14/hackerangriff-auf-stadt-aschaffenburg;Hier finden Sie Informationen zu dem Thema „Kriminalität“. Lesen Sie jetzt „Hackerangriff auf Stadt Aschaffenburg abgewehrt“.;"Z+ (abopflichtiger Inhalt);
        
    
Kriminalität";News, Kriminalität, Aschaffenburg, Hackerangriff, Kriminalität;2024-11-14T12:51:17+01:00;2024-11-14T12:51:17+01:00;;dpa Bayern;false
ff64cc977408097f0df4a6eae947cc296dea366f30db7c10da1753d2b9fd39ff;Pariser Polizei bereitet sich auf Hochrisikospiel vor;https://www.zeit.de/gesellschaft/zeitgeschehen/2024-11/nations-league-frankreich-israel;4.000 Polizisten sichern das Fußballspiel zwischen Frankreich und Israel in Paris. Nach Ausschreitungen in Amsterdam wolle man vorbereitet sein, sagte der Polizeichef.;"Z+ (abopflichtiger Inhalt);
        
    
Nations League";Gesellschaft, Nations League, Israel, Frankreich, Nations League, Paris, Amsterdam, Polizei;2024-11-14T12:50:54+01:00;2024-11-14T12:50:54+01:00;svj;ZEIT ONLINE,        dpa,        							svj;false
b23ecf3bff586731e6999ad2da05169859361b0edc92e90102d89f5846df6698;Auto kracht in Linienbus - Kleinkind verletzt;https://www.zeit.de/news/2024-11/14/auto-kracht-in-linienbus-kleinkind-verletzt;Hier finden Sie Informationen zu dem Thema „Linienbusunfall mit Verletzten“. Lesen Sie jetzt „Auto kracht in Linienbus - Kleinkind verletzt“.;"Z+ (abopflichtiger Inhalt);
        
    
Linienbusunfall mit Verletzten";News, Linienbusunfall mit Verletzten, Wilhelmsburg, Hamburg, Linienbus, Linienbusunfall, Auto;2024-11-14T12:49:09+01:00;2024-11-14T12:49:09+01:00;;dpa Hamburg/Schleswig-Holstein;false
67c1b43b25fceca387d8849295eb16feae549ac12046377903fe6d1a1dc4d05d;83-jährige Fußgängerin angefahren und tödlich verletzt;https://www.zeit.de/news/2024-11/14/83-jaehrige-fussgaengerin-angefahren-und-toedlich-verletzt;Hier finden Sie Informationen zu dem Thema „Landkreis München“. Lesen Sie jetzt „83-jährige Fußgängerin angefahren und tödlich verletzt“.;"Z+ (abopflichtiger Inhalt);
        
    
Landkreis München";News, Landkreis München, Landkreis München, Polizei;2024-11-14T12:47:52+01:00;2024-11-14T12:47:52+01:00;;dpa Bayern;false
c60df6ac12d4696042aee645a85890a1de1645d652e0e2f736bef1b347e3d0b1;Schüsse im Sozialamt: Täter zu Haftstrafe verurteilt;https://www.zeit.de/news/2024-11/13/prozess-wegen-schuessen-in-sozialamt-urteil-erwartet;Hier finden Sie Informationen zu dem Thema „Landgericht Frankfurt“. Lesen Sie jetzt „Schüsse im Sozialamt: Täter zu Haftstrafe verurteilt“.;"Z+ (abopflichtiger Inhalt);
        
    
Landgericht Frankfurt";News, Landgericht Frankfurt, Frankfurt, Sozialamt, Landgericht;2024-11-14T12:46:43+01:00;2024-11-14T12:46:43+01:00;;dpa Hessen;false
523c2a7a624442a559d82cc314defec3eb98e8f5574c0256088de968e5108d8b;Opposition hat Redebedarf bei Sondervermögen für Unimedizin;https://www.zeit.de/news/2024-11/14/opposition-hat-redebedarf-bei-sondervermoegen-fuer-unimedizin;Hier finden Sie Informationen zu dem Thema „Landtag“. Lesen Sie jetzt „Opposition hat Redebedarf bei Sondervermögen für Unimedizin“.;"Z+ (abopflichtiger Inhalt);
        
    
Landtag";News, Landtag, Christof Reichert, Mainz, CDU, Unionsfraktion, Redebedarf, Unimedizin, Sondervermögen, Landtag, Universitätsmedizin, Geld;2024-11-14T12:44:30+01:00;2024-11-14T12:44:30+01:00;;dpa Rheinland-Pfalz/Saarland;false
d6e597a08bf2901371e74280e3576660ac4da338477cccdc9293204444f56971;FC Bayern bestreitet erneut Testspiel mit RB Salzburg;https://www.zeit.de/news/2024-11/14/fc-bayern-bestreitet-erneut-testspiel-mit-rb-salzburg;Hier finden Sie Informationen zu dem Thema „Wiedersehen“. Lesen Sie jetzt „FC Bayern bestreitet erneut Testspiel mit RB Salzburg“.;"Z+ (abopflichtiger Inhalt);
        
    
Wiedersehen";News, Wiedersehen, FC Bayern München, FC Red Bull Salzburg, Testspiel;2024-11-14T12:41:21+01:00;2024-11-14T12:41:21+01:00;;dpa Bayern;false
bcb0b57d80421da4626a0c1eb17e2b3aee05fec346abfd73f27f3b5ce6a4f40d;Landkreis Leer erteilt Genehmigung für Wolfsabschuss;https://www.zeit.de/news/2024-11/14/landkreis-leer-erteilt-genehmigung-fuer-wolfsabschuss;Hier finden Sie Informationen zu dem Thema „Nutztiere gerissen“. Lesen Sie jetzt „Landkreis Leer erteilt Genehmigung für Wolfsabschuss“.;"Z+ (abopflichtiger Inhalt);
        
    
Nutztiere gerissen";News, Nutztiere gerissen, Matthias Groote, Leer, Wolfsabschuss, Nutztier, Genehmigung;2024-11-14T12:41:14+01:00;2024-11-14T12:41:14+01:00;;dpa Niedersachsen;false
ad816041bc885d5a94d0a9e48fef8393413d91ba6b3a9afb4d751f6a78c3fdb5;Mehr Meldungen von Kindeswohlgefährdung - aber weniger Fälle;https://www.zeit.de/news/2024-11/14/mehr-meldungen-von-kindeswohlgefaehrdungen-in-brandenburg;Hier finden Sie Informationen zu dem Thema „Kinderschutz“. Lesen Sie jetzt „Mehr Meldungen von Kindeswohlgefährdung - aber weniger Fälle“.;"Z+ (abopflichtiger Inhalt);
        
    
Kinderschutz";News, Kinderschutz, Hans Leitner, Brandenburg, Kindeswohlgefährdung, Kinderschutz;2024-11-14T12:39:22+01:00;2024-11-14T12:39:22+01:00;;dpa Berlin/Brandenburg;false
aeca550e2418fce984e260dd7e68bcbbce577f3307ea21448a18786a72e02fcd;Landespflegeausschuss hat Maßnahmenpaket beschlossen;https://www.zeit.de/news/2024-11/14/landespflegeausschuss-hat-massnahmenpaket-beschlossen;Hier finden Sie Informationen zu dem Thema „Pflegerische Versorgung“. Lesen Sie jetzt „Landespflegeausschuss hat Maßnahmenpaket beschlossen“.;"Z+ (abopflichtiger Inhalt);
        
    
Pflegerische Versorgung";News, Pflegerische Versorgung, Aminata Touré, Schleswig-Holstein, Landespflegeausschuss, Maßnahmenpaket, Versorgung, Sicherstellung, Pflege;2024-11-14T12:38:34+01:00;2024-11-14T12:38:34+01:00;;dpa Hamburg/Schleswig-Holstein;false
c2e371303868dae5988e39a8d848aaf8856c9adb1b9888e5362321c29c95a020;Listenparteitage für den Bundestag stehen fast alle fest;https://www.zeit.de/news/2024-11/14/listenparteitage-fuer-den-bundestag-stehen-fast-alle-fest;Hier finden Sie Informationen zu dem Thema „Bundestagswahl“. Lesen Sie jetzt „Listenparteitage für den Bundestag stehen fast alle fest“.;"Z+ (abopflichtiger Inhalt);
        
    
Bundestagswahl";News, Bundestagswahl, Weilerbach, Kaiserslautern, Rheinland-Pfalz, Rhein, FDP, Deutscher Bundestag, FW, Die Partei, CDU, Bundestagswahl;2024-11-14T12:36:42+01:00;2024-11-14T12:36:42+01:00;;dpa Rheinland-Pfalz/Saarland;false
84a465c85676ebc6258b1d04bb4aca38eeebe415e7d19bdf2e456642ce4aca8c;Die ersten Wildgänse sind zurück am Niederrhein;https://www.zeit.de/news/2024-11/14/die-ersten-wildgaense-sind-zurueck-am-niederrhein;Hier finden Sie Informationen zu dem Thema „Saisonstart“. Lesen Sie jetzt „Die ersten Wildgänse sind zurück am Niederrhein“.;"Z+ (abopflichtiger Inhalt);
        
    
Saisonstart";News, Saisonstart, Janna Nielen, Südeuropa, Afrika, Sibirien, Skandinavien, Nimwegen, Niederrhein, Westeuropa, Duisburg, Naturschutzbund Deutschland;2024-11-14T12:31:19+01:00;2024-11-14T12:31:19+01:00;;dpa Nordrhein-Westfalen;false
ed35eca95fd4c6f87203de45cef9897280f1aeced85ddb6ecc1b2d742dad04a5;Geschäfte ohne Personal sollen sonntags öffnen dürfen;https://www.zeit.de/news/2024-11/14/geschaefte-ohne-personal-sollen-sonntags-oeffnen-duerfen;Hier finden Sie Informationen zu dem Thema „Ladenöffnungszeiten“. Lesen Sie jetzt „Geschäfte ohne Personal sollen sonntags öffnen dürfen“.;"Z+ (abopflichtiger Inhalt);
        
    
Ladenöffnungszeiten";News, Ladenöffnungszeiten, Andreas Silbersack, Sachsen-Anhalt, Deutsche Presse-Agentur, Ladenöffnungszeit, Öffnungsmöglichkeit, Einkaufsladen, Ladenöffnungszeitengesetz, Koalition;2024-11-14T12:30:48+01:00;2024-11-14T12:30:48+01:00;;dpa Sachsen;false
d7f1e8ca201b474bc27fb7d6d4f57dcc7702608956d5fdea5f7d80c6ea235b10;Zollfahnder entdecken Waffen bei mutmaßlichem Reichsbürger;https://www.zeit.de/news/2024-11/14/zollfahnder-entdecken-waffen-bei-mutmasslichem-reichsbuerger;Hier finden Sie Informationen zu dem Thema „Zoll-Razzia“. Lesen Sie jetzt „Zollfahnder entdecken Waffen bei mutmaßlichem Reichsbürger“.;"Z+ (abopflichtiger Inhalt);
        
    
Zoll-Razzia";News, Zoll-Razzia, Stralsund, Landkreis Rostock, Hauptzollamt, Finanzkontrolle, Schwarzarbeit, Razzia, Gold;2024-11-14T12:30:15+01:00;2024-11-14T12:30:15+01:00;;dpa Mecklenburg-Vorpommern;false
8669e590136b0512dab44ac6dda0fc94133146fe78504fe55ce91a5251aabf38;Zahlreiche Unfälle auf glatten Straßen in und um Dresden;https://www.zeit.de/news/2024-11/14/zahlreiche-unfaelle-auf-glatten-strassen-in-und-um-dresden;Hier finden Sie Informationen zu dem Thema „Polizei ruft zu Vorsicht auf“. Lesen Sie jetzt „Zahlreiche Unfälle auf glatten Straßen in und um Dresden“.;"Z+ (abopflichtiger Inhalt);
        
    
Polizei ruft zu Vorsicht auf";News, Polizei ruft zu Vorsicht auf, Dresden, Polizei, Unfall, Auto;2024-11-14T12:27:41+01:00;2024-11-14T12:27:41+01:00;;dpa Sachsen;false
26dce254fd3cd8e0f8324e5cc773717e807180d5a91ffb702a078d2cbedfa565;Dax-Konzerne machen deutlich weniger Gewinn;https://www.zeit.de/news/2024-11/14/dax-konzerne-machen-deutlich-weniger-gewinn;Hier finden Sie Informationen zu dem Thema „Quartalsbilanz“. Lesen Sie jetzt „Dax-Konzerne machen deutlich weniger Gewinn“.;"Z+ (abopflichtiger Inhalt);
        
    
Quartalsbilanz";News, Quartalsbilanz, DAX, Quartalsbilanz, Börsenliga, Vorjahresquartal, Dax, Sommer, Autoindustrie;2024-11-14T12:25:08+01:00;2024-11-14T12:25:08+01:00;;dpa;false
c979b43cd11d9d77b0701158bcbf7861595274f876e5c2d96e79d30a9d077b5c;Verkehrsministerin: Winterdienst gut vorbereitet;https://www.zeit.de/news/2024-11/14/verkehrsministerin-winterdienst-gut-vorbereitet;Hier finden Sie Informationen zu dem Thema „Winter“. Lesen Sie jetzt „Verkehrsministerin: Winterdienst gut vorbereitet“.;"Z+ (abopflichtiger Inhalt);
        
    
Winter";News, Winter, Susanna Karawanskij, Christoph Wolf, Thüringen, Erfurt, Breitenworbis, Hermsdorf, Zella-Mehlis, Streue, Landesstraße, Winterdienstfahrzeug;2024-11-14T12:24:36+01:00;2024-11-14T12:24:36+01:00;;dpa Thüringen;false
6f1ce5f815ee056b1dd5bf281bccf297b6f06ced1a8717295ecc31853c5509b3;Eintracht Braunschweig mehrere Monate ohne Sidney Raebiger;https://www.zeit.de/news/2024-11/14/eintracht-braunschweig-mehrere-monate-ohne-sidney-raebiger;Hier finden Sie Informationen zu dem Thema „2. Fußball-Bundesliga“. Lesen Sie jetzt „Eintracht Braunschweig mehrere Monate ohne Sidney Raebiger“.;"Z+ (abopflichtiger Inhalt);
        
    
2. Fußball-Bundesliga";News, 2. Fußball-Bundesliga, Sidney Raebiger, Braunschweig, Eintracht Braunschweig, Fußball-Bundesliga;2024-11-14T12:19:21+01:00;2024-11-14T12:19:21+01:00;;dpa Niedersachsen;false
963934a6379498d220865218c8d490bb826a208154b0ed2afd1774002c409f0b;"TV-Geschäft: Telekom vermutet hohe Zahl von ""Schwarzsehern""";https://www.zeit.de/news/2024-11/14/tv-geschaeft-telekom-vermutet-hohe-zahl-von-schwarzsehern;"Hier finden Sie Informationen zu dem Thema „Fernsehverträge“. Lesen Sie jetzt „TV-Geschäft: Telekom vermutet hohe Zahl von ""Schwarzsehern""“.";"Z+ (abopflichtiger Inhalt);
        
    
Fernsehverträge";News, Fernsehverträge, Christian Illek, Bonn, Vodafone, Deutsche Telekom, Fernsehvertrag;2024-11-14T12:18:58+01:00;2024-11-14T12:18:58+01:00;;dpa;false
fed2d71a18fba9b6da2915c1007951f94bd894bea5b9bc47af389c548127fd40;Debatte über transatlantische Beziehungen und US-Wahl;https://www.zeit.de/news/2024-11/14/debatte-ueber-transatlantische-beziehungen-und-us-wahl;Hier finden Sie Informationen zu dem Thema „Landtag“. Lesen Sie jetzt „Debatte über transatlantische Beziehungen und US-Wahl“.;"Z+ (abopflichtiger Inhalt);
        
    
Landtag";News, Landtag, Donald Trump, USA, Rheinland-Pfalz, Alternative für Deutschland, SPD, Landtag;2024-11-14T12:18:17+01:00;2024-11-14T12:18:17+01:00;;dpa Rheinland-Pfalz/Saarland;false
a264827c5524141e9e870e4111e489bc6a65a18bbe9ca9bf3e9124e42d168826;"Zverev gegen Alcaraz - ""Popcorn-Match"" beim Saisonfinale";https://www.zeit.de/news/2024-11/14/hat-supermatch-gespielt-zverev-freut-sich-auf-alcaraz;"Hier finden Sie Informationen zu dem Thema „Entscheidung über Halbfinale“. Lesen Sie jetzt „Zverev gegen Alcaraz - ""Popcorn-Match"" beim Saisonfinale“.";"Z+ (abopflichtiger Inhalt);
        
    
Entscheidung über Halbfinale";News, Entscheidung über Halbfinale, Alexander Zverev, Andrej Rubljow, Carlos Alcaraz, Turin, ATP Finals, Supermatch, Saisonfinale;2024-11-14T12:18:12+01:00;2024-11-14T12:18:12+01:00;;dpa;false
2ded9ad7638d8e694daf13f9edc81b9a32968302c613db0daee3fccc5ef710a9;Sängerin Ayliva tritt bei Channel Aid in Hamburg auf;https://www.zeit.de/news/2024-11/14/saengerin-ayliva-tritt-bei-channel-aid-in-hamburg-auf;Hier finden Sie Informationen zu dem Thema „Konzert für guten Zweck“. Lesen Sie jetzt „Sängerin Ayliva tritt bei Channel Aid in Hamburg auf“.;"Z+ (abopflichtiger Inhalt);
        
    
Konzert für guten Zweck";News, Konzert für guten Zweck, Sängerin, Hamburg, YouTube;2024-11-14T12:17:57+01:00;2024-11-14T12:17:57+01:00;;dpa Hamburg/Schleswig-Holstein;false
b5e8b2568505ba89cb9c6134869cf1b52448dbee51e5926305f4e2d99bc72a8e;Traktorfahrer hinterlässt Spur der Verwüstung;https://www.zeit.de/news/2024-11/14/traktorfahrer-hinterlaesst-spur-der-verwuestung;Hier finden Sie Informationen zu dem Thema „Medizinischer Notfall“. Lesen Sie jetzt „Traktorfahrer hinterlässt Spur der Verwüstung“.;"Z+ (abopflichtiger Inhalt);
        
    
Medizinischer Notfall";News, Medizinischer Notfall, Oberpfalz, Polizei, Verwüstung, Notfall;2024-11-14T12:15:06+01:00;2024-11-14T12:15:06+01:00;;dpa Bayern;false
8e7fb29ac56d1b52ba0b52bbc31d9b4a4954903a40d2d1ed5cc4154064721692;BayernLB trotzt Krise mit steigendem Gewinn;https://www.zeit.de/news/2024-11/14/bayernlb-trotzt-krise-mit-steigendem-gewinn;Hier finden Sie Informationen zu dem Thema „Bankenbranche“. Lesen Sie jetzt „BayernLB trotzt Krise mit steigendem Gewinn“.;"Z+ (abopflichtiger Inhalt);
        
    
Bankenbranche";News, Bankenbranche, Stephan Winkelmeier, BayernLB, Bankenbranche, Nettogewinn, Krise;2024-11-14T12:15:00+01:00;2024-11-14T12:15:00+01:00;;dpa;false
057d4f78ccb36963ebc7e0b4bcbe5dfec2b45e23e6aa63821ef3d9317dfecd3c;Kretschmann: Transparenz in Netz und Medien wichtig;https://www.zeit.de/news/2024-11/14/kretschmann-transparenz-in-netz-und-medien-wichtig;Hier finden Sie Informationen zu dem Thema „Social Media und KI“. Lesen Sie jetzt „Kretschmann: Transparenz in Netz und Medien wichtig“.;"Z+ (abopflichtiger Inhalt);
        
    
Social Media und KI";News, Social Media und KI, Winfried Kretschmann, Transparenz, Soziale Medien;2024-11-14T12:13:25+01:00;2024-11-14T12:13:25+01:00;;dpa Baden-Württemberg;false
8b74a133779e895475c71c4eb96f627c40932215606fdb8f3dc7b937b70a04ff;Wieder nächtliche Messflüge am Frankfurter Flughafen;https://www.zeit.de/news/2024-11/14/wieder-naechtliche-messfluege-am-frankfurter-flughafen;Hier finden Sie Informationen zu dem Thema „Nachtflüge“. Lesen Sie jetzt „Wieder nächtliche Messflüge am Frankfurter Flughafen“.;"Z+ (abopflichtiger Inhalt);
        
    
Nachtflüge";News, Nachtflüge, Flughafen Frankfurt, Messflug, Nachtflug, Nachtflugverbot;2024-11-14T12:12:52+01:00;2024-11-14T12:12:52+01:00;;dpa Hessen;false
0dec17c14718de86ae3f8cee12aaa7e19c8b31db8587248dcc4531f486f1cf1d;Feuer aus Wut über Geldschulden gelegt? Anklage;https://www.zeit.de/news/2024-11/14/feuer-aus-wut-ueber-geldschulden-gelegt-anklage;Hier finden Sie Informationen zu dem Thema „Brandstiftung“. Lesen Sie jetzt „Feuer aus Wut über Geldschulden gelegt? Anklage“.;"Z+ (abopflichtiger Inhalt);
        
    
Brandstiftung";News, Brandstiftung, Berlin-Mitte, Staatsanwaltschaft, Geldschuld, Brandstiftung, Anklage, Körperverletzung, Geld;2024-11-14T12:11:41+01:00;2024-11-14T12:11:41+01:00;;dpa Berlin/Brandenburg;false
daa4f9560830550bb67e002a252a5551789e3d70222f74db66885c80bf47e944;In 350 Jahren zum Vorkriegszustand;https://www.zeit.de/politik/ausland/2024-11/wirtschaft-gaza-nahostkonflikt-kapitalstock-zerstoerung;Von der ohnehin fragilen Wirtschaft im Gazastreifen ist kaum etwas geblieben. Eine Erholung der Lage würde selbst unter den besten Bedingungen Jahrzehnte dauern.;"Z+ (abopflichtiger Inhalt);
        
    
Wirtschaft in Gaza";Politik, Wirtschaft in Gaza, Nahost, Gazastreifen, Westjordanland, Weltbank, Einkommen, Arbeitslosenquote, UN, ILO, Hamas;2024-11-14T12:11:34+01:00;2024-11-14T12:11:34+01:00;Patrick  Kaczmarczyk;;false
57aafd4802829711e0256b9fb9aa709a4f4bffa079356a9156b5082081c16273;Altenheim-Mitarbeiterin soll Millionen veruntreut haben;https://www.zeit.de/news/2024-11/14/altenheim-mitarbeiterin-soll-millionen-veruntreut-haben;Hier finden Sie Informationen zu dem Thema „Untreueverdacht“. Lesen Sie jetzt „Altenheim-Mitarbeiterin soll Millionen veruntreut haben“.;"Z+ (abopflichtiger Inhalt);
        
    
Untreueverdacht";News, Untreueverdacht, Landau, Landshut, Isar, Landkreis Dingolfing-Landau, Staatsanwaltschaft, Untreueverdacht, Pflegeeinrichtung;2024-11-14T12:10:25+01:00;2024-11-14T12:10:25+01:00;;dpa Bayern;false
7d70cb741a0a74b92049e054449f1e7fdbd845a341322d01c9c5554921199e36;Ramelow: Wollen finanzielle Hängepartie verhindern;https://www.zeit.de/news/2024-11/14/ramelow-wollen-finanzielle-haengepartie-verhindern;Hier finden Sie Informationen zu dem Thema „Landesfinanzen“. Lesen Sie jetzt „Ramelow: Wollen finanzielle Hängepartie verhindern“.;"Z+ (abopflichtiger Inhalt);
        
    
Landesfinanzen";News, Landesfinanzen, Bodo Ramelow, Thüringen, CDU, Hängepartie, Landesfinanzen;2024-11-14T12:09:27+01:00;2024-11-14T12:09:27+01:00;;dpa Thüringen;false
e0ec0d21b75f13f7e51169cd15db40bfe4f0892f71889a81b1cdf1285ad36d57;SPD-Fraktion setzt sich für Deutschlandticket ein;https://www.zeit.de/news/2024-11/14/spd-fraktion-setzt-sich-fuer-deutschlandticket-ein;Hier finden Sie Informationen zu dem Thema „Nahverkehr mit Bus und Bahn“. Lesen Sie jetzt „SPD-Fraktion setzt sich für Deutschlandticket ein“.;"Z+ (abopflichtiger Inhalt);
        
    
Nahverkehr mit Bus und Bahn";News, Nahverkehr mit Bus und Bahn, SPD, Deutschlandticket, Nahverkehr, Dringlichkeitsantrag;2024-11-14T12:02:25+01:00;2024-11-14T12:02:25+01:00;;dpa Hamburg/Schleswig-Holstein;false
57acc67f4e68fc790875b31ec21b8199899d29409d8636ce33198920487579ba;Bericht: Lufthansa Airlines streicht 400 Verwaltungsjobs;https://www.zeit.de/news/2024-11/14/bericht-lufthansa-airlines-streicht-400-verwaltungsjobs;Hier finden Sie Informationen zu dem Thema „Luftverkehr“. Lesen Sie jetzt „Bericht: Lufthansa Airlines streicht 400 Verwaltungsjobs“.;"Z+ (abopflichtiger Inhalt);
        
    
Luftverkehr";News, Luftverkehr, Deutsche Lufthansa, Manager Magazin, Verwaltungsjob, Luftverkehr, Kerngesellschaft;2024-11-14T12:01:35+01:00;2024-11-14T12:01:35+01:00;;dpa;false
744d7efd927be01b65920cc6e66e0ff36c1bd8f55ea75c903ec1c65c31402369;Bayern-Star Kim mit ungewöhnlichem Wehrdienst;https://www.zeit.de/news/2024-11/14/bayern-star-kim-mit-ungewoehnlichem-wehrdienst;Hier finden Sie Informationen zu dem Thema „Video-Schalten mit Teenagern“. Lesen Sie jetzt „Bayern-Star Kim mit ungewöhnlichem Wehrdienst“.;"Z+ (abopflichtiger Inhalt);
        
    
Video-Schalten mit Teenagern";News, Video-Schalten mit Teenagern, Minjae Kim, Bayern, Südkorea, Wehrdienst, Militär;2024-11-14T11:59:07+01:00;2024-11-14T11:59:07+01:00;;dpa Bayern;false
4f91aa42df0382dd555bf80e95dc8136881ad5c8e04af5b4a776659dc10ca893;VW-Sparkurs: IG Metall plant Protest-Kundgebung in Wolfsburg;https://www.zeit.de/news/2024-11/14/vw-sparkurs-ig-metall-plant-protest-kundgebung-in-wolfsburg;Hier finden Sie Informationen zu dem Thema „Tarifrunde“. Lesen Sie jetzt „VW-Sparkurs: IG Metall plant Protest-Kundgebung in Wolfsburg“.;"Z+ (abopflichtiger Inhalt);
        
    
Tarifrunde";News, Tarifrunde, Daniela Cavallo, Thorsten Gröger, Wolfsburg, IG Metall, Volkswagen, VW, Tarifrunde, Sparkurs, Metall, Sparmaßnahme;2024-11-14T11:58:16+01:00;2024-11-14T11:58:16+01:00;;dpa Niedersachsen;false
15ae5781f3982a0197689eed10ff0f7e4e8d03573c92591906b1f6ff4be431ac;Warnung vor Anschlägen bei Full Moon Party in Thailand;https://www.zeit.de/news/2024-11/14/warnung-vor-anschlaegen-bei-full-moon-party-in-thailand;Hier finden Sie Informationen zu dem Thema „Terrordrohung“. Lesen Sie jetzt „Warnung vor Anschlägen bei Full Moon Party in Thailand“.;"Z+ (abopflichtiger Inhalt);
        
    
Terrordrohung";News, Terrordrohung, Thailand, Bangkok, Haad Rin Beach, Deutsche Botschaft, Full Moon Party, Terrordrohung, Anschlag, Reisewarnung;2024-11-14T11:57:53+01:00;2024-11-14T11:57:53+01:00;;dpa;false
8f5846fd6983685cbdf644ee70ddfaa374b92d7062273fcd28395eee4e65e481;Mann wird mit Baseballschläger und Holzlatten attackiert;https://www.zeit.de/news/2024-11/14/mann-wird-mit-baseballschlaeger-und-holzlatten-attackiert;Hier finden Sie Informationen zu dem Thema „Von Unbekannten angegriffen“. Lesen Sie jetzt „Mann wird mit Baseballschläger und Holzlatten attackiert“.;"Z+ (abopflichtiger Inhalt);
        
    
Von Unbekannten angegriffen";News, Von Unbekannten angegriffen, Polizei, Auto;2024-11-14T11:55:43+01:00;2024-11-14T11:55:43+01:00;;dpa Baden-Württemberg;false
f11938c667c467eb73b4ebe1c44ceeadcb558c762ff2912a2cb21fe01acfd143;Landtags-Vizepräsidentin Janssen-Kucz legt Mandat nieder;https://www.zeit.de/news/2024-11/14/landtags-vizepraesidentin-janssen-kucz-legt-mandat-nieder;Hier finden Sie Informationen zu dem Thema „Grüne“. Lesen Sie jetzt „Landtags-Vizepräsidentin Janssen-Kucz legt Mandat nieder“.;"Z+ (abopflichtiger Inhalt);
        
    
Grüne";News, Grüne, Mandat, Landtag;2024-11-14T11:54:49+01:00;2024-11-14T11:54:49+01:00;;dpa Niedersachsen;false
99788a630c7e7f160cf7f4f2ddd34cc024a136319f3f2043f9099ffb04c84548;SPD-Chefs stellen sich hinter Scholz als Kanzlerkandidaten;https://www.zeit.de/news/2024-11/14/spd-chefs-stellen-sich-hinter-scholz-als-kanzlerkandidaten;Hier finden Sie Informationen zu dem Thema „Neuwahl“. Lesen Sie jetzt „SPD-Chefs stellen sich hinter Scholz als Kanzlerkandidaten“.;"Z+ (abopflichtiger Inhalt);
        
    
Neuwahl";News, Neuwahl, Nicola Böcker-Giannini, Martin Hikel, Olaf Scholz, Boris Pistorius, SPD, Kanzlerkandidat;2024-11-14T11:53:54+01:00;2024-11-14T11:53:54+01:00;;dpa Berlin/Brandenburg;false
0b08a4a4a8a6a050e8a1659288a11dc872fae7004d24e0155bfac4cb21c33436;Deutsche Hockey-Teams starten bei der EM gegen Frankreich;https://www.zeit.de/news/2024-11/14/deutsche-hockey-teams-starten-bei-der-em-gegen-frankreich;Hier finden Sie Informationen zu dem Thema „Hockey“. Lesen Sie jetzt „Deutsche Hockey-Teams starten bei der EM gegen Frankreich“.;"Z+ (abopflichtiger Inhalt);
        
    
Hockey";News, Hockey, Frankreich;2024-11-14T11:53:32+01:00;2024-11-14T11:53:32+01:00;;dpa Nordrhein-Westfalen;false
71d2a08587feb25c33b3654bcbdca9420209a6b83f1ee49953b1fa4840648743;Auf einmal wirkt Tesla altmodisch und behäbig;https://www.zeit.de/mobilitaet/2024-11/tesla-china-marktanteile-e-autos-handelskonflikt;Tesla verliert Marktanteile im wichtigen Chinageschäft. Die dortige Konkurrenz baut bessere und billigere E-Autos. Und jetzt droht auch noch ein Handelskonflikt.;"Z+ (abopflichtiger Inhalt);
        
    
Tesla in China";Mobilitaet, Tesla in China, Tesla, China, Elektromobilität, Elon Musk, Donald Trump, Shanghai, BMW;2024-11-14T11:48:11+01:00;2024-11-14T11:48:11+01:00;Jens Mühling;;false
884bac7558ff7753b11f911e4002e9a8a94d528a9383a14bd61a7bd7bde6b450;Nirgendwo mehr sicher;https://www.zeit.de/sport/2024-11/israelische-nationalelf-fussball-europa-amsterdam-sicherheit;Israels Fußballteams spielen seit 30 Jahren in Europa, weil es sicherer ist als im Nahen Osten. Nach Amsterdam und vor dem Spiel in Paris geht diese Hoffnung verloren.;"Z+ (abopflichtiger Inhalt);
        
    
Israelische Nationalelf";Sport, Israelische Nationalelf, Israel, Fußballnationalmannschaft, Europa, Ajax Amsterdam, Nationalelf, Paris, Amsterdam, Frankreich, Berlin, Schottland;2024-11-14T11:48:03+01:00;2024-11-14T11:48:03+01:00;Ronny Blaschke;;false
bd7dc14e35392431a5b42d081957c31350217f8bbae03bc546a1a08d43b6ead3;Königsklasse bleibt Monaco treu: Neuer Vertrag bis 2031;https://www.zeit.de/news/2024-11/14/koenigsklasse-bleibt-monaco-treu-neuer-vertrag-bis-2031;Hier finden Sie Informationen zu dem Thema „Formel 1“. Lesen Sie jetzt „Königsklasse bleibt Monaco treu: Neuer Vertrag bis 2031“.;"Z+ (abopflichtiger Inhalt);
        
    
Formel 1";News, Formel 1, Monaco, Formel 1, Königsklasse;2024-11-14T11:47:23+01:00;2024-11-14T11:47:23+01:00;;dpa Sport;false
a10feec508f28221667c3d225142bbe5fd4b5f1343ed1a14c32e782434ad4c04;"SPD: Sparpläne der Regierung ""Tritt in Hintern"" für Schulen";https://www.zeit.de/news/2024-11/14/spd-sparplaene-der-regierung-tritt-in-hintern-fuer-schulen;"Hier finden Sie Informationen zu dem Thema „Lehrermangel“. Lesen Sie jetzt „SPD: Sparpläne der Regierung ""Tritt in Hintern"" für Schulen“.";"Z+ (abopflichtiger Inhalt);
        
    
Lehrermangel";News, Lehrermangel, Dorothee Feller, Jochen Ott, NRW, FDP, SPD, Sparplan, Lehrermangel, Hintern;2024-11-14T11:45:23+01:00;2024-11-14T11:45:23+01:00;;dpa Nordrhein-Westfalen;false
