Hash;Title;Link;Description;Category;KeyWords;Published;LastUpdated;Author;Source;Paywall
b05fc250b7f86f1854b308a8998fea9e74d180af3a5ad012e3d3387976ca5111;Das sollten Sie zur Landtagswahl in Rheinland-Pfalz wissen;https://www.zeit.de/politik/deutschland/2026-02/landtagswahlen-rheinland-pfalz-2026-spitzenkandidaten-wahlkampfthemen-faq;Umfragen sagen für die Rheinland-Pfalz-Wahl ein enges Rennen zwischen SPD und CDU voraus. Wer kandidiert? Welche Themen beherrschten den Wahlkampf? Ein Überblick;Landtagswahl in Rheinland-Pfalz;Politik, Landtagswahl in Rheinland-Pfalz, Rheinland-Pfalz, Gordon Schnieder, Alexander Schweitzer, Landtag, Wahlkampf, Landtagswahl;2026-03-20T10:11:12+01:00;2026-03-20T10:11:12+01:00;Marie Antoinette N'gouanDieter HoßWann wird in Rheinland-Pfalz ein neuer Landtag gewählt?Welche Parteien treten an?Wer sind die Spitzenkandidatinnen und -kandidaten der Parteien?Wie ist die politische Ausgangslage?Wer sitzt derzeit im Landtag von Rheinland-Pfalz?Was waren die wichtigsten Wahlkampfthemen?Was besagen die jüngsten Umfragen?Wie wird gewählt?;;false
385989b139e169c0093cd6ef855d23f687a71b0de91775c7df6f1ee1344f3228;Polizei: Kita-Kind nach Sturz in Fluss außer Lebensgefahr;https://www.zeit.de/news/2026-03/20/polizei-kita-kind-nach-sturz-in-fluss-ausser-lebensgefahr;Hier finden Sie Informationen zu dem Thema „Bei Ausflug in Siegen“. Lesen Sie jetzt „Polizei: Kita-Kind nach Sturz in Fluss außer Lebensgefahr“.;Bei Ausflug in Siegen;News, Bei Ausflug in Siegen, Polizei, Lebensgefahr, Ausflug;2026-03-20T10:08:10+01:00;2026-03-20T10:08:10+01:00;;dpa Nordrhein-Westfalen;false
796b838c13013cf5f81e0613c8bf40bcfe25e0440543ce84541482bc9733ca59;Feuer auf Mülldeponie fast gelöscht – Flüsse werden geprüft;https://www.zeit.de/news/2026-03/20/feuer-auf-muelldeponie-fast-geloescht-fluesse-werden-geprueft;Hier finden Sie Informationen zu dem Thema „Großbrand“. Lesen Sie jetzt „Feuer auf Mülldeponie fast gelöscht – Flüsse werden geprüft“.;Großbrand;News, Großbrand, Zeulenroda-Triebes, Landkreis Greiz, Feuerwehr, Mülldeponie, Großbrand;2026-03-20T10:04:12+01:00;2026-03-20T10:04:12+01:00;;dpa Thüringen;false
8827670a3a272bafce4037629127c0aa822db23db7e66ab4e7343d175ce088a6;Jetzt redet Mette-Marit: So war ihre Freundschaft zu Epstein;https://www.zeit.de/news/2026-03/20/jetzt-redet-mette-marit-so-war-ihre-freundschaft-zu-epstein;Hier finden Sie Informationen zu dem Thema „Kronprinzessin in TV-Interview“. Lesen Sie jetzt „Jetzt redet Mette-Marit: So war ihre Freundschaft zu Epstein“.;Kronprinzessin in TV-Interview;News, Kronprinzessin in TV-Interview, Jeffrey Epstein, Mette-Marit Tjessem Høiby, Haakon von Norwegen, Norwegen, USA, Paris, Treffen, Freundschaft, Kritik;2026-03-20T10:00:58+01:00;2026-03-20T10:00:58+01:00;;dpa;false
48f1d7d698cf8eee270d3c4e41ae9c08e3f71014c171f35b5591bf5783ac2c51;18-Jähriger nach Schockanruf festgenommen;https://www.zeit.de/news/2026-03/20/18-jaehriger-nach-schockanruf-festgenommen;Hier finden Sie Informationen zu dem Thema „Fahndungserfolg“. Lesen Sie jetzt „18-Jähriger nach Schockanruf festgenommen“.;Fahndungserfolg;News, Fahndungserfolg, Südhessen, Frankfurt, Polizei, Schockanruf, Fahndungserfolg, Festnahme;2026-03-20T10:00:54+01:00;2026-03-20T10:00:54+01:00;;dpa Hessen;false
8233958367c7cca9970210246230d2be91a36472c70b5ab954e3a291653099dc;73-Jähriger attackiert Ehefrau mit Messer;https://www.zeit.de/news/2026-03/20/73-jaehriger-attackiert-ehefrau-mit-messer;Hier finden Sie Informationen zu dem Thema „Kriminalität in Hamburg“. Lesen Sie jetzt „73-Jähriger attackiert Ehefrau mit Messer“.;Kriminalität in Hamburg;News, Kriminalität in Hamburg, Hamburg, Kriminalität;2026-03-20T09:56:07+01:00;2026-03-20T09:56:07+01:00;;dpa Hamburg/Schleswig-Holstein;false
9b4e439c20ed1079801b9952a36d2b490d872fee8839864b94b07ea7ba07f4d6;Unbekannter sticht im Bremer Steintor auf zwei Männer ein;https://www.zeit.de/news/2026-03/20/unbekannter-sticht-im-bremer-steintor-auf-zwei-maenner-ein;Hier finden Sie Informationen zu dem Thema „Auseinandersetzung“. Lesen Sie jetzt „Unbekannter sticht im Bremer Steintor auf zwei Männer ein“.;Auseinandersetzung;News, Auseinandersetzung, Mann, Polizei, Steintor, Auseinandersetzung;2026-03-20T09:55:36+01:00;2026-03-20T09:55:36+01:00;;dpa Niedersachsen;false
7330fa80c9e65dcfde4c9f5abf779293dc435e264e949e9be52fcfe22e9a196e;Fahrer von Unglücks-Tram soll am Handy gewesen sein;https://www.zeit.de/news/2026-03/20/fahrer-von-ungluecks-tram-soll-am-handy-gewesen-sein;Hier finden Sie Informationen zu dem Thema „Mailand“. Lesen Sie jetzt „Fahrer von Unglücks-Tram soll am Handy gewesen sein“.;Mailand;News, Mailand, Mailand, Unglück;2026-03-20T09:53:55+01:00;2026-03-20T09:53:55+01:00;;dpa;false
de246ac54815d04ae21ba1203a8f8629179177d3b1477932d325b36efbab54d9;Tiefflug der Bundeswehr verunsichert Anwohner;https://www.zeit.de/news/2026-03/20/tiefflug-der-bundeswehr-verunsichert-anwohner;Hier finden Sie Informationen zu dem Thema „Feier in Germersheim“. Lesen Sie jetzt „Tiefflug der Bundeswehr verunsichert Anwohner“.;Feier in Germersheim;News, Feier in Germersheim, Germersheim, Südpfalz, Bundeswehr, Polizei, Flugmanöver;2026-03-20T09:52:10+01:00;2026-03-20T09:52:10+01:00;;dpa Rheinland-Pfalz/Saarland;false
629d7a4bad5b7fd6be0533e9b1902bb1e1f09247c71e80d389ba032c8058fe69;Schlägerei an S-Bahnhof: Männer stürzen ins Gleisbett;https://www.zeit.de/news/2026-03/20/schlaegerei-an-s-bahnhof-maenner-stuerzen-ins-gleisbett;Hier finden Sie Informationen zu dem Thema „Auseinandersetzung in Hamburg“. Lesen Sie jetzt „Schlägerei an S-Bahnhof: Männer stürzen ins Gleisbett“.;Auseinandersetzung in Hamburg;News, Auseinandersetzung in Hamburg, Mann, Hamburg, Polizei, Gleisbett, Schlägerei, Auseinandersetzung;2026-03-20T09:43:59+01:00;2026-03-20T09:43:59+01:00;;dpa Hamburg/Schleswig-Holstein;false
7be79646f4d7d7e77d53d51da56c17845b52d6307fd3ce46d8183ac7463a130b;Einjähriges Kind durch Verpuffung schwer verletzt;https://www.zeit.de/news/2026-03/20/einjaehriges-kind-durch-verpuffung-schwer-verletzt;Hier finden Sie Informationen zu dem Thema „Unfälle“. Lesen Sie jetzt „Einjähriges Kind durch Verpuffung schwer verletzt“.;Unfälle;News, Unfälle, Polizei, Verpuffung, Unfall;2026-03-20T09:43:55+01:00;2026-03-20T09:43:55+01:00;;dpa Niedersachsen;false
92809ca0a3a7c6828db36139dd2ef3d766e11f6a9a1b73cfa8f152f0372423d9;OECD rät von Tankrabatt und höherer Pendlerpauschale ab;https://www.zeit.de/wirtschaft/2026-03/oecd-empfehlung-energiepreise-tankrabatt-irankrieg;Die OECD hat von bestimmten Unterstützungsmaßnahmen für die hohen Energiepreise abgeraten. Sie warnt vor hohen Kosten und empfiehlt, arme Haushalte gezielt zu entlasten.;Hohe Kraftstoffpreise;Wirtschaft, Hohe Kraftstoffpreise, Robert Grundke, OECD, Tankrabatt, Pendlerpauschale, Unterstützungsmaßnahme, Energiepreis, Haushalt;2026-03-20T09:42:08+01:00;2026-03-20T09:42:08+01:00;man;DIE ZEIT,        Reuters,        dpa,        							man;false
fc3a62a01d2ae4db6de44549cd7cbabe5e2de28b652505a6f6d3a7b9969f9d83;In Dunkelblau zur WM: DFB stellt Auswärtstrikot vor;https://www.zeit.de/news/2026-03/20/in-dunkelblau-zur-wm-dfb-stellt-auswaertstrikot-vor;Hier finden Sie Informationen zu dem Thema „Fußball-Nationalmannschaft“. Lesen Sie jetzt „In Dunkelblau zur WM: DFB stellt Auswärtstrikot vor“.;Fußball-Nationalmannschaft;News, Fußball-Nationalmannschaft, Florian Wirtz, Mann, Deutscher Fußball-Bund, Auswärtstrikot, Dunkelblau, Fußballnationalmannschaft;2026-03-20T09:41:46+01:00;2026-03-20T09:41:46+01:00;;dpa Sport;false
a502ef53052870d730c84a3a1be4ce7612c885e40b12484646b2e9d19edf8440;Erster Spargel geerntet - Saison startet im April richtig;https://www.zeit.de/news/2026-03/20/erster-spargel-geerntet-saison-startet-im-april-richtig;Hier finden Sie Informationen zu dem Thema „Agrar“. Lesen Sie jetzt „Erster Spargel geerntet - Saison startet im April richtig“.;Agrar;News, Agrar, Claudia Westner, Miriam Adel, Bayern, Franken, Spargel, Wetter, Winter;2026-03-20T09:39:16+01:00;2026-03-20T09:39:16+01:00;;dpa Bayern;false
25d49f39f4b0c620924c2654c22454a450af461b9b888df1af4bd6fb05fc4c8c;Bundesjustizministerin plant Gesetz gegen pornografische Deepfakes;https://www.zeit.de/politik/deutschland/2026-03/digitale-gewalt-bundesjustizministerin-stefanie-hubig-neues-gesetz-pornografische-deepfakes-gxe;"'Täter sollen sich nicht mehr sicher fühlen"" – Bundesjustizministerin Hubig will das Strafrecht bei digitaler Gewalt verschärfen. Sie kündigte ein neues Gesetz an.";Digitale Gewalt;Politik, Digitale Gewalt, Stefanie Hubig, Strafrecht, Pornografie, Internet, Computer;2026-03-20T09:38:17+01:00;2026-03-20T09:38:17+01:00;lgi;DIE ZEIT,        AFP,        epd,        							lgi;false
5234149c82342f44409d4bfd3d171b72bf798a9d67dc8411455bec70ff46c39e;Königin Silvia besucht Düsseldorf;https://www.zeit.de/news/2026-03/20/koenigin-silvia-besucht-duesseldorf;Hier finden Sie Informationen zu dem Thema „Von Schweden an den Rhein“. Lesen Sie jetzt „Königin Silvia besucht Düsseldorf“.;Von Schweden an den Rhein;News, Von Schweden an den Rhein, Silvia von Schweden, Düsseldorf, Rhein, Uniklinik, Staatskanzlei;2026-03-20T09:33:02+01:00;2026-03-20T09:33:02+01:00;;dpa Nordrhein-Westfalen;false
8ee65bd0fab7c52bea7dfce3b75e287d71d7b9c96f107c01b4cc5cd62b159b18;Feuer vernichtet zwei Haushälften - 46-Jähriger verletzt;https://www.zeit.de/news/2026-03/20/feuer-vernichtet-zwei-haushaelften-46-jaehriger-verletzt;Hier finden Sie Informationen zu dem Thema „Brände“. Lesen Sie jetzt „Feuer vernichtet zwei Haushälften - 46-Jähriger verletzt“.;Brände;News, Brände, Haushälfte, Brand;2026-03-20T09:25:30+01:00;2026-03-20T09:25:30+01:00;;dpa Baden-Württemberg;false
5d922a4f23a37f534fc6e84cbc9fc0705c440540b1b863c4c6aee8280f1ffdcc;Fünfter Champions-League-Platz für Bundesliga weit entfernt;https://www.zeit.de/news/2026-03/20/fuenfter-champions-league-platz-fuer-bundesliga-weit-entfernt;Hier finden Sie Informationen zu dem Thema „UEFA-Wertung“. Lesen Sie jetzt „Fünfter Champions-League-Platz für Bundesliga weit entfernt“.;UEFA-Wertung;News, UEFA-Wertung, Spanien, Real Madrid, Celta Vigo, Uefa, FC Bayern München, SC Freiburg, FC Barcelona, Atlético Madrid, Bundesliga, Fußball-Bundesliga;2026-03-20T09:14:52+01:00;2026-03-20T09:14:52+01:00;;dpa Sport;false
a186d5e01563b525241c48860b8822c560bccd4e2f49efedb032eeaf30edd939;An der Brandmauer nachts um Viertel nach elf;https://www.zeit.de/feuilleton/film/2026-03/markus-lanz-boris-palmer-politische-kultur-ole-von-beust-herfried-muenkler;Markus Lanz lässt in seiner Sendung über die politische Kultur reden. Dazu Boris Palmer einzuladen, ist eine interessante Idee. Es wird dann ein schwermütiger Abend.;"Z+ (abopflichtiger Inhalt);
        
    ""Markus Lanz""";"Feuilleton, ""Markus Lanz"", Markus Lanz, Boris Palmer, Ole von Beust, Herfried Münkler, Hamburg, Politikwissenschaft";2026-03-20T09:11:04+01:00;2026-03-20T09:11:04+01:00;Peter Kümmel;;false
4013c809c3e0ca7d56658a397c5923b1138d4ac58c524aadf6e838fe844cd682;Von zwei Autos erfasst: Fußgänger stirbt auf Bundesstraße;https://www.zeit.de/news/2026-03/20/von-zwei-autos-erfasst-fussgaenger-stirbt-auf-bundesstrasse;Hier finden Sie Informationen zu dem Thema „Unfälle“. Lesen Sie jetzt „Von zwei Autos erfasst: Fußgänger stirbt auf Bundesstraße“.;Unfälle;News, Unfälle, Bundesstraße, Unfall, Auto;2026-03-20T09:08:20+01:00;2026-03-20T09:08:20+01:00;;dpa Berlin/Brandenburg;false
6337886a4c12c42f99568ed18c9ebc509b66b4f4f0ad066c77d334076bf61692;Wie weiter für Wolfram Weimer?;https://www.zeit.de/news/2026-03/20/wie-weiter-fuer-wolfram-weimer;Hier finden Sie Informationen zu dem Thema „Kultur und Kulturkampf“. Lesen Sie jetzt „Wie weiter für Wolfram Weimer?“.;Kultur und Kulturkampf;News, Kultur und Kulturkampf, Wolfram Weimer, Friedrich Schiller, Friedrich Merz, Tricia Tuttle, Olaf Zimmermann, Jürgen Habermas, Deutsche Nationalbibliothek, Deutsche Presse-Agentur, Berlinale, Kulturkampf;2026-03-20T09:04:00+01:00;2026-03-20T09:04:00+01:00;;dpa;false
f2e3c530bc995dc00c7b9eff788b72d54cbcbdf7e4c7ffee29b021c818325f20;15-Jähriger flieht mit Auto des Vaters vor der Polizei;https://www.zeit.de/news/2026-03/20/15-jaehriger-flieht-mit-auto-des-vaters-vor-der-polizei;Hier finden Sie Informationen zu dem Thema „Verfolgungsfahrt“. Lesen Sie jetzt „15-Jähriger flieht mit Auto des Vaters vor der Polizei“.;Verfolgungsfahrt;News, Verfolgungsfahrt, Karlsruhe, Polizei, Verfolgungsfahrt, Auto;2026-03-20T09:03:39+01:00;2026-03-20T09:03:39+01:00;;dpa Baden-Württemberg;false
233d2081d3e1982ad543e62bccfa434b415b796ec5a6f2408e633025f5bb5bbb;Norwegens Kronprinzessin spricht über Freundschaft mit Epstein;https://www.zeit.de/politik/ausland/2026-03/norwegen-mette-marit-jeffry-epstein-gxe;Kronprinzessin Mette-Marit hat sich mit Verspätung zu ihrem Kontakt mit Jeffrey Epstein geäußert. Sie bereue es, mit dem Sexualstraftäter befreundet gewesen zu sein.;Norwegen;Politik, Norwegen, Jeffrey Epstein, Norwegen, Freundschaft, Sexueller Missbrauch;2026-03-20T09:02:06+01:00;2026-03-20T09:02:06+01:00;edd;DIE ZEIT,        dpa,        							edd;false
7286dd518d3db2ad91c0acdc5dd44714ea1650556b418e72d899e110e735f4ef;Was BTS zu einer der erfolgreichsten Bands macht;https://www.zeit.de/news/2026-03/20/was-bts-zu-einer-der-erfolgreichsten-bands-macht;Hier finden Sie Informationen zu dem Thema „Musik-Comeback des Jahres“. Lesen Sie jetzt „Was BTS zu einer der erfolgreichsten Bands macht“.;Musik-Comeback des Jahres;News, Musik-Comeback des Jahres, Seoul, Südkorea, Polizei, Netflix, YouTube, Guinessbuch, Erfolgsband, Outdoor, Erfolg;2026-03-20T09:00:07+01:00;2026-03-20T09:00:07+01:00;;dpa;false
ed3bf25a0bded39410b338db08525f21455176321d14701ab213b2b33e3e60c7;Froschtag: Weibchen legt beispiellose Ei-Serie in Australien;https://www.zeit.de/news/2026-03/20/froschtag-weibchen-legt-beispiellose-ei-serie-in-australien;Hier finden Sie Informationen zu dem Thema „Südlicher Stotterfrosch“. Lesen Sie jetzt „Froschtag: Weibchen legt beispiellose Ei-Serie in Australien“.;Südlicher Stotterfrosch;News, Südlicher Stotterfrosch, Australien, Froschtag, Stotterfrosch, Weibchen, Welttag, Aussie, Zuchterfolg, Tierschutzorganisation;2026-03-20T08:58:35+01:00;2026-03-20T08:58:35+01:00;;dpa;false
b70697aff4f03fa0ff3a9bc5be5cf0de9a7fc1ef08e6f87cfe8b25b753ee1dc9;US-Behörde hat Zweifel an Teslas System für automatisiertes Fahren;https://www.zeit.de/mobilitaet/2026-03/tesla-autonomes-fahren-system-untersuchung-usa-unfaelle-kameras-gxe;Wie sicher ist Teslas kamerabasiertes System für automatisiertes Fahren? Daten der US-Behörde NHTSA zeigen Probleme bei schlechter Sicht, sie vertieft ihre Untersuchung.;Tesla;Mobilitaet, Tesla, autonomes Fahren, USA, Tesla, Elon Musk, Autoindustrie;2026-03-20T08:56:41+01:00;2026-03-20T08:56:41+01:00;lgi;DIE ZEIT,        dpa,        							lgi;false
27db23fcd4fe046d56f82158cda59ba447fa41f2b931235c1245c35a3be32ae3;Wer hat hier das Sagen?;https://www.zeit.de/politik/deutschland/2026-03/antisemitismus-linke-zionismus-niedersachsen-nahostbeschluss;Lange ging es für die die Linke bergauf. Jetzt stürzt ein Beschluss über die Abkehr vom Zionismus die Partei in die Krise. Dabei geht es nicht nur um den Nahostkonflikt.;"Z+ (abopflichtiger Inhalt);
        
    Antisemitismus bei der Linken";Politik, Antisemitismus bei der Linken, Die Linke, Antisemitismus, Jan van Aken, Heidi Reichinnek, Ines Schwerdtner, Nahostkonflikt;2026-03-20T08:56:22+01:00;2026-03-20T08:56:22+01:00;Fritz Zimmermann;;false
c77e8812e93d87af7f578d5a45edccd777e49ade6be6b5f878449093a3d19212;Mit drei Promille kaum vom Rad gekommen;https://www.zeit.de/news/2026-03/20/mit-drei-promille-kaum-vom-rad-gekommen;Hier finden Sie Informationen zu dem Thema „Verkehr“. Lesen Sie jetzt „Mit drei Promille kaum vom Rad gekommen“.;Verkehr;News, Verkehr, Verkehr, Polizeistreife;2026-03-20T08:54:40+01:00;2026-03-20T08:54:40+01:00;;dpa Baden-Württemberg;false
4b77b6bd5c2565978d18f1d61b79e844084447468ee4b1c96dc4948c859562c9;Bilder des Tages;https://www.zeit.de/news/2026-03/20/bilder-des-tages;Hier finden Sie Informationen zu dem Thema „Fotografie“. Lesen Sie jetzt „Bilder des Tages“.;Fotografie;News, Fotografie, News;2026-03-20T08:48:16+01:00;2026-03-20T08:48:16+01:00;;dpa;false
09e3166a13c700b28371523fa37ef149f9ddc37fce4c10f9b8b0921337e3444c;Schüsse in Berlin-Kreuzberg – Mann verletzt;https://www.zeit.de/news/2026-03/20/schuesse-in-berlin-kreuzberg-mann-verletzt;Hier finden Sie Informationen zu dem Thema „Kriminalität“. Lesen Sie jetzt „Schüsse in Berlin-Kreuzberg – Mann verletzt“.;Kriminalität;News, Kriminalität, Berlin-Kreuzberg, Polizei, Graefestraße, Kriminalität;2026-03-20T08:40:52+01:00;2026-03-20T08:40:52+01:00;;dpa Berlin/Brandenburg;false
3cf52ac32737eddda565bdb2ab642e30b040691f05d8a81168b505fe62af9517;Junger Mann und Teenager bei Verkehrsunfall schwer verletzt;https://www.zeit.de/news/2026-03/20/junger-mann-und-teenager-bei-verkehrsunfall-schwer-verletzt;Hier finden Sie Informationen zu dem Thema „Unfälle“. Lesen Sie jetzt „Junger Mann und Teenager bei Verkehrsunfall schwer verletzt“.;Unfälle;News, Unfälle, Unfall, Verkehrsunfall, Teenager, Auto;2026-03-20T08:40:41+01:00;2026-03-20T08:40:41+01:00;;dpa Hamburg/Schleswig-Holstein;false
caf0e5de10466e9d1fa8272ebd877023f687b3d0fdc21dcbe2d88c8b8dffe40f;Nach Leichenfund: Polizei geht nicht von Straftat aus;https://www.zeit.de/news/2026-03/20/nach-leichenfund-polizei-geht-nicht-von-straftat-aus;Hier finden Sie Informationen zu dem Thema „Notfälle“. Lesen Sie jetzt „Nach Leichenfund: Polizei geht nicht von Straftat aus“.;Notfälle;News, Notfälle, Polizei, Leichenfund, Straftat, Notfall;2026-03-20T08:39:37+01:00;2026-03-20T08:39:37+01:00;;dpa Baden-Württemberg;false
135563d88bdddac77f7673fc13fe9be3f51a05874e4a99ac5b049bf21bddf216;Baumarkt-Diebstahl bringt noch mehr Straftaten ans Licht;https://www.zeit.de/news/2026-03/20/baumarkt-diebstahl-bringt-noch-mehr-straftaten-ans-licht;Hier finden Sie Informationen zu dem Thema „Polizei im Einsatz“. Lesen Sie jetzt „Baumarkt-Diebstahl bringt noch mehr Straftaten ans Licht“.;Polizei im Einsatz;News, Polizei im Einsatz, Mann, Polizei, Straftat, Schleifaufsatz, Baumarkt, Auto;2026-03-20T08:34:00+01:00;2026-03-20T08:34:00+01:00;;dpa Rheinland-Pfalz/Saarland;false
e30b603dce41c8799c27a24d225295f535cbb1621ef21c8c4bf1bffa8c36c249;Venezuelas Übergangspräsidentin tauscht gesamte Armeeführung aus;https://www.zeit.de/politik/ausland/2026-03/venezuela-praesidentin-delcy-rodriguez-armee-gxe;Delcy Rodríguez, die venezolanische Übergangspräsidentin, hat alle Posten der Armeekommandanten neu besetzt. Der Armee wird Missbrauch vorgeworfen.;Venezuela;Politik, Venezuela, Militär, Venezuela, Missbrauch, Nicolás Maduro, Präsidentschaft;2026-03-20T08:33:53+01:00;2026-03-20T08:33:53+01:00;man;DIE ZEIT,        AFP,        epd,        							man;false
f0033f58a4a81a82dc47de0cdac6e506e7197138d7929bbdbb801c5b83d716b2;Weniger Verkehrstote und Verletzte;https://www.zeit.de/news/2026-03/20/weniger-verkehrstote-und-verletzte;Hier finden Sie Informationen zu dem Thema „Unfälle“. Lesen Sie jetzt „Weniger Verkehrstote und Verletzte“.;Unfälle;News, Unfälle, Unfall, Verkehrsunfall;2026-03-20T08:31:44+01:00;2026-03-20T08:31:44+01:00;;dpa Sachsen;false
74f78a518f3f549b2f0538c87956ce49d35ff963bd8f6315f5be842db9898012;"""Love Scamming"" - Mann wird um zehntausende Euro betrogen";https://www.zeit.de/news/2026-03/20/love-scamming-mann-wird-um-zehntausende-euro-betrogen;"Hier finden Sie Informationen zu dem Thema „Kriminalität“. Lesen Sie jetzt „""Love Scamming"" - Mann wird um zehntausende Euro betrogen“.";Kriminalität;News, Kriminalität, Landkreis Rostock, Polizei, Geld;2026-03-20T08:30:09+01:00;2026-03-20T08:30:09+01:00;;dpa Mecklenburg-Vorpommern;false
71f5afaf71b9c39fb3009ea9156f6d2d90000cb929ce00d8d2ce94145e23625f;Wechselhaftes Wochenende, danach wieder freundlicher;https://www.zeit.de/news/2026-03/20/wechselhaftes-wochenende-danach-wieder-freundlicher;Hier finden Sie Informationen zu dem Thema „Wetter“. Lesen Sie jetzt „Wechselhaftes Wochenende, danach wieder freundlicher“.;Wetter;News, Wetter, Sachsen, Thüringen, Sachsen-Anhalt, Kaltfront, Wetter;2026-03-20T08:28:58+01:00;2026-03-20T08:28:58+01:00;;dpa Sachsen;false
b2eeda7cc36cfca9912336e368a9c559f6b7052e7f223598c5b5c53e911f0567;Toter Jugendlicher in Eckernförde: Mann aus Haft entlassen;https://www.zeit.de/news/2026-03/20/toter-jugendlicher-in-eckernfoerde-mann-aus-haft-entlassen;Hier finden Sie Informationen zu dem Thema „Ermittlungserfolg“. Lesen Sie jetzt „Toter Jugendlicher in Eckernförde: Mann aus Haft entlassen“.;Ermittlungserfolg;News, Ermittlungserfolg, Eckernförde, Ostsee, Polizei, Staatsanwaltschaft, Ermittlungserfolg, Auto;2026-03-20T08:22:41+01:00;2026-03-20T08:22:41+01:00;;dpa;false
e4f21d74c786185ed35165df72c326d255ca8115b3a0c30558c6a79a886a6cd0;"Marty McFly in Hamburg - ""Zurück in die Zukunft"" als Musical";https://www.zeit.de/news/2026-03/20/marty-mcfly-in-hamburg-zurueck-in-die-zukunft-als-musical;"Hier finden Sie Informationen zu dem Thema „Zeitreise-Kult auf der Bühne“. Lesen Sie jetzt „Marty McFly in Hamburg - ""Zurück in die Zukunft"" als Musical“.";Zeitreise-Kult auf der Bühne;News, Zeitreise-Kult auf der Bühne, Doc Brown, Michael J. Fox, Raphael Groß, Jan Kersjes, Bob Gale, Hamburg, Broadway, New York, Tokio, London;2026-03-20T08:13:05+01:00;2026-03-20T08:13:05+01:00;;dpa Hamburg/Schleswig-Holstein;false
11275bbaa99b6b7567c187a068f74b789d65ce42aeed76511586f9c30c41db57;Lehrerverband sieht mögliche WhatsApp-Regulierung für Kinder skeptisch;https://www.zeit.de/familie/2026-03/whatsapp-regulierung-klassenchats-lehrerverband-skeptisch-vorschlag-karin-prien-gxe;Bundesbildungsministerin Karin Prien hat sich für eine Regulierung von Messengerdiensten wie WhatsApp ausgesprochen. Der Lehrerverband hält das nicht für umsetzbar.;Problematische Inhalte in Klassenchats;Familie, Problematische Inhalte in Klassenchats, Kinder, Schule, Karin Prien, WhatsApp, Jugendliche, Soziale Medien;2026-03-20T08:09:26+01:00;2026-03-20T08:09:26+01:00;lgi;DIE ZEIT,        dpa,        epd,        							lgi;false
f86d895949b5ee71dcb6af1f0176ec38ffadac5e987f3333499a6c6722806045;In Mecklenburg-Vorpommern strahlt am Wochenende die Sonne;https://www.zeit.de/news/2026-03/20/in-mecklenburg-vorpommern-strahlt-am-wochenende-die-sonne;Hier finden Sie Informationen zu dem Thema „Wetter“. Lesen Sie jetzt „In Mecklenburg-Vorpommern strahlt am Wochenende die Sonne“.;Wetter;News, Wetter, Vorpommern, Mecklenburg, Mecklenburg-Vorpommern, Hochdruckgebiet, Wetter;2026-03-20T08:08:04+01:00;2026-03-20T08:08:04+01:00;;dpa Mecklenburg-Vorpommern;false
1b7274581131500b6d74879f450caff6a5c5fabeaea852016efcfbc065b1d942;Die Energiepreise könnten nur der Anfang sein;https://www.zeit.de/wirtschaft/2026-03/inflationsschub-nahost-krieg-ezb-spritpreise-lebensmittelpreise;Der Krieg im Nahen Osten lässt die Preise in Deutschland wieder steigen. Im Supermarkt sind sie noch stabil – doch das könnte sich nun ändern.;Inflation durch den Nahostkrieg;Wirtschaft, Inflation durch den Nahostkrieg, Inflation, Konjunktur, Lebensmittelpreise, Benzinpreis, Ölpreis, Iran, Statistisches Bundesamt, EZB, Straße von Hormus;2026-03-20T08:08:01+01:00;2026-03-20T08:08:01+01:00;Jurik Caspar Iser;;false
0df262d789b410939b5aed76a111531aadd2da3b69a0066dcdcdfe05908b423a;Polizei nimmt mutmaßlichen Tankstellenräuber fest;https://www.zeit.de/news/2026-03/20/polizei-nimmt-mutmasslichen-tankstellenraeuber-fest;Hier finden Sie Informationen zu dem Thema „Vier Überfälle“. Lesen Sie jetzt „Polizei nimmt mutmaßlichen Tankstellenräuber fest“.;Vier Überfälle;News, Vier Überfälle, Schwalm-Eder-Kreis, Polizei, Überfall;2026-03-20T08:05:55+01:00;2026-03-20T08:05:55+01:00;;dpa Hessen;false
53d666b7d1b862eee67f391c730dcc3f189d0325733e7a9002c0ddea7cbf45e1;"""Hitzekuppel"" lässt USA schon im März brüten";https://www.zeit.de/news/2026-03/20/hitzekuppel-laesst-usa-schon-im-maerz-brueten;"Hier finden Sie Informationen zu dem Thema „Extremwetter“. Lesen Sie jetzt „""Hitzekuppel"" lässt USA schon im März brüten“.";Extremwetter;News, Extremwetter, USA, Kalifornien, Arizona, Hitzekuppel, Extremwetter, Hitzewelle, Hitze;2026-03-20T08:04:38+01:00;2026-03-20T08:04:38+01:00;;dpa;false
d16d52aacf1ccd72ebd5e99bba167ed75700608ddca3cdb6474877237046088b;Was wäre die Bundesliga ohne die Bayern?;https://www.zeit.de/sport/2026-03/bundesliga-vorschau-fc-bayern-dieter-reiter-27-spieltag;Nur Zuschauer. Denn in Europa hat Deutschland aktuell nur einen Topklub. Über den wiederum könnte Münchens roter Oberbürgermeister stürzen. Der 27. Spieltag;Bundesligavorschau;Sport, Bundesligavorschau, Fußball, Fußball-Bundesliga, FC Bayern München, Borussia Dortmund, 1. FC Union Berlin, Champions League;2026-03-20T07:54:28+01:00;2026-03-20T07:54:28+01:00;Nico Horn;;false
9c13fa15847c32038287f34e4a969563c0fa820c1124c2b5bec55f9c32678d56;Explosionen und Feuer in mehreren Golfstaaten durch Luftangriffe;https://www.zeit.de/politik/ausland/2026-03/iran-krieg-usa-israel-liveblog;Iranische Luftangriffe lösen Explosionen und einen Brand in Bahrain, Saudi-Arabien und Dubai aus. Drohnenattacken treffen eine Ölraffinerie in Kuwait. Das Liveblog;Liveblog:                     Irankrieg;Politik, Irankrieg, Iran, Israel, USA, Donald Trump, Atomabkommen, Nahost, Militär;2026-03-20T07:52:12+01:00;2026-03-20T07:52:12+01:00;Mounia MeiborgBastian HartigMaxim Nägele;;false
