Hash;Title;Link;Description;Category;KeyWords;Published;LastUpdated;Author;Source;Paywall
34f0085d263bac72df8779ace4aa3308c44041c5747b0efc405c1979cf28e124;Gegendemonstranten blockieren Demo in Mainz;https://www.zeit.de/news/2025-03/22/gegendemonstration-blockiert-gemeinsam-fuer-deutschland;Hier finden Sie Informationen zu dem Thema „Protest“. Lesen Sie jetzt „Gegendemonstranten blockieren Demo in Mainz“.;Protest;News, Protest, Mainz, Polizei, Gegendemonstration, Grenzkontrolle;2025-03-22T20:40:42+01:00;2025-03-22T20:40:42+01:00;;dpa Rheinland-Pfalz/Saarland;false
1e34063dff511381476eecb778116786c3f14af8b31e8f8eaf4a70968b3dcf12;Dresdner Volleyballerinnen starten mit Sieg in Play-offs;https://www.zeit.de/news/2025-03/22/dresdner-volleyballerinnen-starten-mit-sieg-in-play-offs;Hier finden Sie Informationen zu dem Thema „Volleyball-Bundesliga“. Lesen Sie jetzt „Dresdner Volleyballerinnen starten mit Sieg in Play-offs“.;Volleyball-Bundesliga;News, Volleyball-Bundesliga, Alexander Waibl, Hessen, Dresdner SC, VC Wiesbaden, Bundesliga;2025-03-22T20:33:04+01:00;2025-03-22T20:33:04+01:00;;dpa Sachsen;false
c9a166ce6effec7d4fc6f1b85f1e1c4529162aad7d2bbea669b821cfe867bf3c;Wie sie ihr Herz verteilt;https://www.zeit.de/2025/12/fatma-said-opernsaengerin-aegypten-berlin;Beinahe wäre Fatma Said Tennisprofi geworden. Dann hat die junge ägyptische Sopranistin sich doch für deutsche Kunstlieder entschieden. Ein großes Glück für die Musik!;"Z+ (abopflichtiger Inhalt);
        
    Fatma Said";Kultur, Fatma Said, Oper, Kairo, Franz Schubert, Johannes Brahms, Fatma Said;2025-03-22T20:29:54+01:00;2025-03-22T20:29:54+01:00;Christine Lemke-Matwey;Aus der        ZEIT Nr. 12/2025;false
3fbbe80ef3ef69a70c2f4fc89ea05815a8144608a3d86b11a66efe3b0ec46030;Debakel für Rostocker Basketballer beim Meister;https://www.zeit.de/news/2025-03/22/debakel-fuer-rostocker-basketballer-beim-meister;Hier finden Sie Informationen zu dem Thema „Basketball-Bundesliga“. Lesen Sie jetzt „Debakel für Rostocker Basketballer beim Meister“.;Basketball-Bundesliga;News, Basketball-Bundesliga, Przemyslaw Frasunkiewicz, München, BB, FC Bayern München, Debakel;2025-03-22T20:26:49+01:00;2025-03-22T20:26:49+01:00;;dpa Mecklenburg-Vorpommern;false
8217ddc104930be12fdc644db5612f401ae0638606100899cd06081d7d733655;"""Die Deutschen sollten Donald Trump dankbar sein""";https://www.zeit.de/2025/12/niall-ferguson-historiker-donald-trump-usa;Er berät Regierungen und lehrt an der Eliteuniversität Stanford: Der Historiker Niall Ferguson sagt, warum er Trump für den richtigen Präsidenten zur richtigen Zeit hält.;"Z+ (abopflichtiger Inhalt);
        
    Niall Ferguson";Kultur, Niall Ferguson, Donald Trump, Niall Ferguson, USA, J. D. Vance, Richard Nixon, Europa, Wolodymyr Selenskyj, Russland, Vietnam, China;2025-03-22T20:23:06+01:00;2025-03-22T20:23:06+01:00;Götz HamannJohn F. Jungclaussen;Aus der        ZEIT Nr. 12/2025;false
25ee7a80bd95068f7d2b72b4b455972341df9309cceb19d9f9f9682befd1539d;Ernste allgemeine Verunsicherung;https://www.zeit.de/entdecken/reisen/2025-03/einreise-usa-festnahmen-reisen-donald-trump;Seit mehreren Festnahmen an der Grenze verbreitet Donald Trump auch unter USA-Reisenden kalkulierte Unruhe. Wer stornieren möchte, hat schlechte Karten.;"Z+ (abopflichtiger Inhalt);
        
    Einreise in die USA";Entdecken, Einreise in die USA, USA, Donald Trump, Reisen, Flughafen, Verhaftung, Tourismus;2025-03-22T20:12:18+01:00;2025-03-22T20:12:18+01:00;David Denk;;false
8773780dc1a2661b520fba846caa801735fd6f1f9a2debd769cd3a50fd9f008c;Wie gut kenne ich mich wirklich?;https://www.zeit.de/gesundheit/2025-03/impathie-gefuehle-mentale-gesundheit-video-podcast;Wer seine Gefühle spürt und versteht, schützt sich vor Stress, Schuld und Scham. Stefanie Neubrand erforscht die Impathie und zeigt, wie man sich in sich selbst einfühlt.;Impathie;Gesundheit, Impathie, Emotion, Psychologie, Mentalität, Psyche, Stress;2025-03-22T20:10:07+01:00;2025-03-22T20:10:07+01:00;Sven Stockrahm;;false
640f2d52dc7c094740b03f2a84bbf613b73f2ecff6bdabed5936e583cf5e5c36;SPD und Grüne in Hamburg nehmen Koalitionsverhandlungen auf;https://www.zeit.de/politik/deutschland/2025-03/hamburg-buergerschaftswahl-koalitionsverhandlungen-spd-gruene;Drei Wochen nach der Bürgerschaftswahl in Hamburg hat sich die SPD für Koalitionsverhandlungen mit den Grünen entschieden. Beide regieren seit 2015 gemeinsam in Hamburg.;Bürgerschaftswahl;Politik, Bürgerschaftswahl, Hamburg, SPD, Bündnis 90/Die Grünen, Peter Tschentscher, Bürgerschaftswahl, Koalitionsverhandlung;2025-03-22T20:08:07+01:00;2025-03-22T20:08:07+01:00;skö;ZEIT ONLINE,        AFP,        dpa,        							skö;false
9de7213ef93f7d9087b3339e0a9b7390fe0fec2545be34a12875642c5085788e;Israel greift nach Raketenbeschuss Hisbollah im Libanon an;https://www.zeit.de/news/2025-03/22/israel-raketen-abgefangen-angriffe-im-suedlibanon;Hier finden Sie Informationen zu dem Thema „Nahost“. Lesen Sie jetzt „Israel greift nach Raketenbeschuss Hisbollah im Libanon an“.;Nahost;News, Nahost, Südlibanon, Nahost, Libanon, Metula, Hisbollah, Rakete, Angriff, Militär;2025-03-22T20:03:16+01:00;2025-03-22T20:03:16+01:00;;dpa;false
6e97ae38bbaa3f97b3388b5f03a2cdf71b829c9c75e761d53056a4f5425e3a57;SPD will in Hamburg weiter mit Grünen regieren;https://www.zeit.de/news/2025-03/22/spd-will-mit-gruenen-ueber-koalition-verhandeln;Hier finden Sie Informationen zu dem Thema „Regierungsbildung Hamburg“. Lesen Sie jetzt „SPD will in Hamburg weiter mit Grünen regieren“.;Regierungsbildung Hamburg;News, Regierungsbildung Hamburg, Hamburg, SPD, Regierungsbildung, Koalition;2025-03-22T19:59:07+01:00;2025-03-22T19:59:07+01:00;;dpa Hamburg/Schleswig-Holstein;false
5a716396e49c38658754bf2a116d2233e809faf82753a1d3144ca725a7a2921e;Defekte Bahnoberleitung: Funken fliegen, Böschung verkohlt;https://www.zeit.de/news/2025-03/22/defekte-bahnoberleitung-funken-fliegen-boeschung-verkohlt;Hier finden Sie Informationen zu dem Thema „Heidelberg und Mannheim“. Lesen Sie jetzt „Defekte Bahnoberleitung: Funken fliegen, Böschung verkohlt“.;Heidelberg und Mannheim;News, Heidelberg und Mannheim, Heidelberg, Mannheim, Bundespolizei, Bahnoberleitung, Böschung, Oberleitung, Gleisseite;2025-03-22T19:52:46+01:00;2025-03-22T19:52:46+01:00;;dpa Baden-Württemberg;false
1eb6498dcdd5889a3e11ab5671208c2098a53510099b5b45d63c095862c0ae00;Flensburgs Handballer gewinnen 112. Landesderby gegen Kiel;https://www.zeit.de/news/2025-03/22/flensburgs-handballer-gewinnen-112-landesderby-gegen-kiel;Hier finden Sie Informationen zu dem Thema „Bundesliga“. Lesen Sie jetzt „Flensburgs Handballer gewinnen 112. Landesderby gegen Kiel“.;Bundesliga;News, Bundesliga, Lukas Jörgensen, Emil Madsen, Flensburg, Schleswig-Holstein-Derby, Kiel, SG Flensburg-Handewitt, THW Kiel, THW, Bundesliga, Landesderby;2025-03-22T19:44:28+01:00;2025-03-22T19:44:28+01:00;;dpa Hamburg/Schleswig-Holstein;false
7f4f8def55079fb5e416c1109879da7586aeefd6c5b5864dcf28bad3ce572431;Auch nur mit Wasser;https://www.zeit.de/2025/12/gruener-wasserstoff-energie-klimaschutz-ostdeutschland;Grüner Wasserstoff vor allem aus Ostdeutschland soll die Wirtschaft klimaneutral machen. Vor fünf Jahren erlebte die Branche einen irren Hype. Jetzt beginnt die Realität.;"Z+ (abopflichtiger Inhalt);
        
    Grüner Wasserstoff";Wirtschaft, Grüner Wasserstoff, Ostdeutschland, Leuna, Wasserstoff, Klimapolitik, Friedrich Merz;2025-03-22T19:43:03+01:00;2025-03-22T19:43:03+01:00;Jakob Milzner;Aus der        ZEIT Nr. 12/2025;false
7ed25374d56e1888d2bca655836755896ded6699452ec56004115f70ef74eb0c;SPD will in Hamburg mit Grünen über Koalition verhandeln;https://www.zeit.de/news/2025-03/22/spd-will-in-hamburg-mit-gruenen-ueber-koalition-verhandeln;Hier finden Sie Informationen zu dem Thema „Regierungsbildung Hamburg“. Lesen Sie jetzt „SPD will in Hamburg mit Grünen über Koalition verhandeln“.;Regierungsbildung Hamburg;News, Regierungsbildung Hamburg, Peter Tschentscher, Hamburg, Rot-Grün, SPD, CDU, Bürgerschaftswahl, Koalition;2025-03-22T19:39:35+01:00;2025-03-22T19:39:35+01:00;;dpa;false
6d5e353a24bea55c04220842945ef06543303663296f17c40cb69366d200e1e1;"""Bin auf einem guten Weg"": Füllkrug kündigt Comeback an";https://www.zeit.de/news/2025-03/22/bin-auf-einem-guten-weg-fuellkrug-kuendigt-comeback-an;"Hier finden Sie Informationen zu dem Thema „Fußball“. Lesen Sie jetzt „""Bin auf einem guten Weg"": Füllkrug kündigt Comeback an“.";Fußball;News, Fußball, Niclas Füllkrug, West Ham United F.C., Comeback, Fußball, Verletzungsproblem;2025-03-22T19:38:56+01:00;2025-03-22T19:38:56+01:00;;dpa Niedersachsen;false
5a24feff112850ada0325232277c5a9e67ed4bdd23f0c445bcc9c32824d29ff5;21-Jähriger wird aus Auto geschleudert und stirbt;https://www.zeit.de/news/2025-03/22/21-jaehriger-wird-aus-auto-geschleudert-und-stirbt;Hier finden Sie Informationen zu dem Thema „Tödlicher Unfall“. Lesen Sie jetzt „21-Jähriger wird aus Auto geschleudert und stirbt“.;Tödlicher Unfall;News, Tödlicher Unfall, Lauenstein, Polizei, Unfall, Auto;2025-03-22T19:38:56+01:00;2025-03-22T19:38:56+01:00;;dpa Niedersachsen;false
4b77b6bd5c2565978d18f1d61b79e844084447468ee4b1c96dc4948c859562c9;Bilder des Tages;https://www.zeit.de/news/2025-03/22/bilder-des-tages;Hier finden Sie Informationen zu dem Thema „Fotografie“. Lesen Sie jetzt „Bilder des Tages“.;Fotografie;News, Fotografie, News;2025-03-22T19:32:25+01:00;2025-03-22T19:32:25+01:00;;dpa;false
707c6f8e097003c48090ff5016eeaa7392d22b7f43c412bdfb6c1b51db69e49d;"Trauer um den ""Alten"" - Rolf Schimpf ist tot";https://www.zeit.de/news/2025-03/22/er-war-der-alte-tv-star-rolf-schimpf-ist-tot;"Hier finden Sie Informationen zu dem Thema „Todesfall“. Lesen Sie jetzt „Trauer um den ""Alten"" - Rolf Schimpf ist tot“.";Todesfall;News, Todesfall, Detlef Vetten, München, ZDF, Deutsche Presse-Agentur;2025-03-22T19:25:16+01:00;2025-03-22T19:25:16+01:00;;dpa;false
a1d440ff80f3138a515d3142b948e23e3eae20fbd5ef39244f1866d61f23fddf;Wenig Zuspruch für bundesweite Demo-Aktion in Bayern;https://www.zeit.de/news/2025-03/22/wenig-zuspruch-fuer-bundesweite-demo-aktion-in-bayern;Hier finden Sie Informationen zu dem Thema „Gesellschaft“. Lesen Sie jetzt „Wenig Zuspruch für bundesweite Demo-Aktion in Bayern“.;Gesellschaft;News, Gesellschaft, Bayern, Nürnberg, München, Polizei, Zuspruch;2025-03-22T19:17:39+01:00;2025-03-22T19:17:39+01:00;;dpa Bayern;false
c951eed3cf15301df6834fb8057b5dbc46621e2db5940058b6e64111bc6f7ce3;23-Jähriger schleudert mit Auto auf Bahngleis;https://www.zeit.de/news/2025-03/22/23-jaehriger-schleudert-mit-auto-auf-bahngleis;Hier finden Sie Informationen zu dem Thema „Oberbayern“. Lesen Sie jetzt „23-Jähriger schleudert mit Auto auf Bahngleis“.;Oberbayern;News, Oberbayern, Bischofswiesen, Bahngleis, Bahnstrecke, Auto;2025-03-22T19:14:16+01:00;2025-03-22T19:14:16+01:00;;dpa Bayern;false
c7c969eafafc39c58b5912c0927129eb755af65174495758f7beb594929133d3;Wegen Sturms? Baugerüst am NDR-Funkhaus stürzt zum Teil ein;https://www.zeit.de/news/2025-03/22/wegen-sturms-baugeruest-am-ndr-funkhaus-stuerzt-zum-teil-ein;Hier finden Sie Informationen zu dem Thema „Feuerwehr-Einsatz in Hannover“. Lesen Sie jetzt „Wegen Sturms? Baugerüst am NDR-Funkhaus stürzt zum Teil ein“.;Feuerwehr-Einsatz in Hannover;News, Feuerwehr-Einsatz in Hannover, Hannover, Feuerwehr, Baugerüst;2025-03-22T19:09:37+01:00;2025-03-22T19:09:37+01:00;;dpa Niedersachsen;false
42b2a211a90841d7df375a3ccdfde85ba70f17ddd97e90072d248cf2c77a38df;Papst Franziskus wird aus dem Krankenhaus entlassen;https://www.zeit.de/gesellschaft/zeitgeschehen/2025-03/papst-franziskus-krankenhaus-entlassung-vatikan;Nach mehr als fünf Wochen im Krankenhaus soll Papst Franziskus am Sonntag in den Vatikan zurückkehren. Von seiner Erkrankung muss sich der Papst aber weiterhin erholen.;Vatikan;Gesellschaft, Vatikan, Papst Franziskus, Vatikanstaat, Katholische Kirche, Krankenhaus, Rom, Papst;2025-03-22T19:06:29+01:00;2025-03-22T19:06:29+01:00;skö;ZEIT ONLINE,        AFP,        Reuters,        dpa,        KNA,        							skö;false
96c5aa0dad165105bded0235dba6c42a161e490462e01d699a3016b951fa4dc0;"""Der Alte""-Schauspieler Rolf Schimpf ist tot";https://www.zeit.de/news/2025-03/22/der-alte-schauspieler-rolf-schimpf-ist-tot;"Hier finden Sie Informationen zu dem Thema „Film“. Lesen Sie jetzt „""Der Alte""-Schauspieler Rolf Schimpf ist tot“.";Film;News, Film, Rolf Schimpf, Kino;2025-03-22T19:03:30+01:00;2025-03-22T19:03:30+01:00;;dpa;false
e711c46bd203bb86ca9a53a5f00c4bb7fcb553a11a7a20650a3055b845ac777c;Rolf Schimpf ist tot;https://www.zeit.de/kultur/film/2025-03/der-alte-rolf-schimpf-schauspieler-tot;"21 Jahre lang hatte er den Hauptkommissar der Krimireihe ""Der Alte"" gespielt und war Teil vieler Fernsehproduktionen. Rolf Schimpf starb im Alter von 100 Jahren.";"""Der Alte""";"Kultur, ""Der Alte"", Fernsehen, Tod, Fernsehproduktion, Kriminalfilm, ZDF, Fernsehserie";2025-03-22T19:02:52+01:00;2025-03-22T19:02:52+01:00;iso;ZEIT ONLINE,        dpa,        AFP,        							iso;false
94e26ca84cfb0d0f9fadd7b785a06dfb5c40ed8e5a59bc4a62de5dc971b948d1;Die Angst ist besiegt, es lebe der Mut;https://www.zeit.de/wirtschaft/2025-03/schuldenpaket-finanzen-bundesregierung-schuldenbremse-sondervermoegen;Die Furcht vor Schulden hat Deutschland lange genug gelähmt. Höchste Zeit, mit dem Schwarzmalen aufzuhören. Die geplanten Milliardeninvestitionen sind eine große Chance.;Schuldenpaket;Wirtschaft, Schuldenpaket, Finanzpolitik, Bundesregierung, Schuldenbremse, Ökonomie, Schulden, Zinsen, Europa;2025-03-22T18:57:45+01:00;2025-03-22T18:57:45+01:00;Jurik Caspar Iser;;false
900dc8676ba545357e23f16344b9cb6fa96e6edf6d46d102b28c29bc72af919d;Die Jungs und ihre erste Liebe;https://www.zeit.de/2025/12/christoph-kramer-roman-jugend-fussball;Der Weltmeister, Fußballexperte und neuerdings Ex-Profi Christoph Kramer hat einen Roman über seine Jugend geschrieben. Da gehen wir den Autor doch mal zu Hause besuchen.;"Z+ (abopflichtiger Inhalt);
        
    Christoph Kramer";Kultur, Christoph Kramer, Fußball, Profisport, Jugendliche, Belletristik, Traumjob, Christoph Kramer;2025-03-22T18:56:12+01:00;2025-03-22T18:56:12+01:00;Volker Weidermann;Aus der        ZEIT Nr. 12/2025;false
fa1224f381aad1bd6bcabec0124961f707ee1b1e4475da37144e8cc2f688fa38;Papst Franziskus wird aus Klinik entlassen;https://www.zeit.de/news/2025-03/22/papst-franziskus-wird-aus-klinik-entlassen;Hier finden Sie Informationen zu dem Thema „Vatikan“. Lesen Sie jetzt „Papst Franziskus wird aus Klinik entlassen“.;Vatikan;News, Vatikan, Sergio Alfieri, Luigi Carbone, Victor Fernandez, Papst Franziskus, Rom, Katholische Kirche, Vatikan;2025-03-22T18:51:14+01:00;2025-03-22T18:51:14+01:00;;dpa;false
adeb542c779d8ba70d0599d647becb7c93ab9b80a203297f835e31843c3a413d;Rund 4.000 Menschen bei Demos in Stuttgarter Innenstadt;https://www.zeit.de/news/2025-03/22/rund-1-500-menschen-bei-demos-in-stuttgarter-innenstadt;Hier finden Sie Informationen zu dem Thema „Rechte und Linke demonstrieren“. Lesen Sie jetzt „Rund 4.000 Menschen bei Demos in Stuttgarter Innenstadt“.;Rechte und Linke demonstrieren;News, Rechte und Linke demonstrieren, Stuttgart, Polizei, Innenstadt;2025-03-22T18:43:26+01:00;2025-03-22T18:43:26+01:00;;dpa Baden-Württemberg;false
01504717f242f8157a67cb7d8bf1fc1a8a4199865916daecd84972eaaf147481;Rund 2.500 Menschen protestieren in Potsdam;https://www.zeit.de/news/2025-03/22/rund-2-500-menschen-protestieren-in-potsdam;Hier finden Sie Informationen zu dem Thema „Einsparungen“. Lesen Sie jetzt „Rund 2.500 Menschen protestieren in Potsdam“.;Einsparungen;News, Einsparungen, Potsdam, Einsparplan, Einsparung;2025-03-22T18:35:32+01:00;2025-03-22T18:35:32+01:00;;dpa Berlin/Brandenburg;false
99466bcc9b6db4174904b3d06b2c2c1b9cb33df518e3ccb40978ff3bd3a67544;SSC-Volleyballerinnen starten mit Sieg in die Play-offs;https://www.zeit.de/news/2025-03/22/ssc-volleyballerinnen-starten-mit-sieg-in-die-play-offs;Hier finden Sie Informationen zu dem Thema „Volleyball-Bundesliga“. Lesen Sie jetzt „SSC-Volleyballerinnen starten mit Sieg in die Play-offs“.;Volleyball-Bundesliga;News, Volleyball-Bundesliga, Schwerin, Aachen, Bundesliga;2025-03-22T18:24:44+01:00;2025-03-22T18:24:44+01:00;;dpa Mecklenburg-Vorpommern;false
a6273b56d6b3ac6d100a5d5177b048bdb57d28dce351000490a806a16009cae0;"Polizei stoppt ""Koks-Taxi""- Verfolgungsjagd und Schüsse";https://www.zeit.de/news/2025-03/22/polizei-stoppt-fluechtendes-auto-mit-schuessen;"Hier finden Sie Informationen zu dem Thema „Verkehrskontrolle“. Lesen Sie jetzt „Polizei stoppt ""Koks-Taxi""- Verfolgungsjagd und Schüsse“.";Verkehrskontrolle;News, Verkehrskontrolle, Berlin-Kreuzberg, Polizei, Verkehrskontrolle, Auto;2025-03-22T18:18:45+01:00;2025-03-22T18:18:45+01:00;;dpa Berlin/Brandenburg;false
eeba96a33e8005c15238cc472e85e911e7d87ddf728c4e0d8e1b173f0fb2243b;Demonstrationen vor BDS-Prozess am Bundesverwaltungsgericht;https://www.zeit.de/news/2025-03/22/demonstrationen-vor-bds-prozess-am-bundesverwaltungsgericht;Hier finden Sie Informationen zu dem Thema „Konflikt in Nahost“. Lesen Sie jetzt „Demonstrationen vor BDS-Prozess am Bundesverwaltungsgericht“.;Konflikt in Nahost;News, Konflikt in Nahost, Nahost, Leipzig, BDS, BVerwG, Polizei, Demonstration, Konflikt, Nahostkonflikt;2025-03-22T18:16:55+01:00;2025-03-22T18:16:55+01:00;;dpa Sachsen;false
72d6c49bf83a657bc7575d382f69b34631fc5fb242463ad6df47c559515a27fb;Rettungswagen stößt mit Auto zusammen - ein Verletzter;https://www.zeit.de/news/2025-03/22/rettungswagen-stoesst-mit-auto-zusammen-ein-verletzter;Hier finden Sie Informationen zu dem Thema „Unfall in Wilmersdorf“. Lesen Sie jetzt „Rettungswagen stößt mit Auto zusammen - ein Verletzter“.;Unfall in Wilmersdorf;News, Unfall in Wilmersdorf, Wilmersdorf, Polizei, Rettungswagen, Unfall, Auto;2025-03-22T18:16:35+01:00;2025-03-22T18:16:35+01:00;;dpa Berlin/Brandenburg;false
1b32cc23a67fee206ee1f95236dbefa65c388f6798dc0a6064c019d6fc873e8f;Papst kann Krankenhaus am Sonntag verlassen;https://www.zeit.de/news/2025-03/22/papst-kann-krankenhaus-am-sonntag-verlassen;Hier finden Sie Informationen zu dem Thema „Kirche“. Lesen Sie jetzt „Papst kann Krankenhaus am Sonntag verlassen“.;Kirche;News, Kirche, Papst Franziskus;2025-03-22T18:07:23+01:00;2025-03-22T18:07:23+01:00;;dpa;false
d57deba10261a0cf72136164122b4710e0bafbc9a02c64bc5cd7b8f71a941cee;Thüringer HC gewinnt Viertelfinal-Hinspiel;https://www.zeit.de/news/2025-03/22/thueringer-hc-gewinnt-viertelfinal-hinspiel;Hier finden Sie Informationen zu dem Thema „Handball: European League“. Lesen Sie jetzt „Thüringer HC gewinnt Viertelfinal-Hinspiel“.;Handball: European League;News, Handball: European League, Herbert Müller, Johanna Reichert, Thüringer HC, Bundesliga, Handball;2025-03-22T18:02:59+01:00;2025-03-22T18:02:59+01:00;;dpa Sachsen;false
c49a1d78c9958db22c55b85202bae3f50cc1e47349579f90c096809fe52aeb04;Mauer stürzt auf Kleingärtner in Lüneburg – schwer verletzt;https://www.zeit.de/news/2025-03/22/mauer-stuerzt-auf-kleingaertner-in-lueneburg-schwer-verletzt;Hier finden Sie Informationen zu dem Thema „Unfall“. Lesen Sie jetzt „Mauer stürzt auf Kleingärtner in Lüneburg – schwer verletzt“.;Unfall;News, Unfall, Lüneburg, Feuerwehr, Unfall;2025-03-22T17:55:07+01:00;2025-03-22T17:55:07+01:00;;dpa Niedersachsen;false
37e0a2d213c519be3e37af61afd2a4e4545d5a255f4e3d2a79d1df8222c8ea6e;Der Hundertjährige, der das alles nicht glauben kann;https://www.zeit.de/kultur/2025-03/albrecht-weinberg-holocaust-zeitzeuge-bundesverdienstkreuz-geburtstag;Albrecht Weinberg hat den Holocaust überlebt, jetzt wurde er zu seinem Geburtstag von Schülern im ostfriesischen Rhauderfehn gefeiert. Dort, wo er nie wieder hinwollte. ;"Z+ (abopflichtiger Inhalt);
        
    Albrecht Weinberg";Kultur, Albrecht Weinberg, Holocaust, Nationalsozialismus, Auschwitz, Bundesverdienstkreuz, Schule, Geschichte;2025-03-22T17:50:45+01:00;2025-03-22T17:50:45+01:00;Stella Schalamon;;false
7af7e6de261cb91e8cf6211ea4ebb1e4647e1af17c9edec488074ea8ad56a237;TTC Eastside schließt Bundesliga-Hauptrunde als Sechster ab;https://www.zeit.de/news/2025-03/22/ttc-eastside-schliesst-bundesliga-hauptrunde-als-sechster-ab;Hier finden Sie Informationen zu dem Thema „Tischtennis-Bundesliga“. Lesen Sie jetzt „TTC Eastside schließt Bundesliga-Hauptrunde als Sechster ab“.;Tischtennis-Bundesliga;News, Tischtennis-Bundesliga, Berlin, TTC Eastside, TTC Berlin, Eastside, Bundesliga, Punkterunde, Hauptrunde, Tischtennis;2025-03-22T17:50:23+01:00;2025-03-22T17:50:23+01:00;;dpa Berlin/Brandenburg;false
54d4c9e7ccabe9c274550162bace74ef6e1517c27540e0da5f436d6c7bc75932;Rettet die Liebe!;https://www.zeit.de/2025/12/liebesromane-beziehungen-geschichten-sex;Mit der Liebe kann man sich infizieren. Vor allem beim Lesen von Romanen. Unsere Autorin hat die neuen Liebesromane gesichtet – und einen besonders aufregenden entdeckt.;"Z+ (abopflichtiger Inhalt);
        
    Liebesromane";Kultur, Liebesromane, Belletristik, Romantik, Autor, Roland Schimmelpfennig, Arthur Schnitzler;2025-03-22T17:47:53+01:00;2025-03-22T17:47:53+01:00;Iris Radisch;Aus der        ZEIT Nr. 12/2025;false
c8cf0f4e3b2da34fefb4bf07ce8d58538b098821c359abf6d7a6021869002683;Die Feuilletonchefin dreht durch;https://www.zeit.de/2025/12/der-einfluss-der-fasane-antje-ravik-strubel-buch;In Antje Rávik Strubels neuem Roman treibt eine Journalistin einen Mann in den Tod. Oder?;"Z+ (abopflichtiger Inhalt);
        
    ""Der Einfluss der Fasane"" von Antje Rávik Strubel";"Kultur, ""Der Einfluss der Fasane"" von Antje Rávik Strubel, Belletristik, Autor, Deutscher Buchpreis, Suizid";2025-03-22T17:45:48+01:00;2025-03-22T17:45:48+01:00;Laura Hertreiter;Aus der        ZEIT Nr. 12/2025;false
1eb59842d4409fd8604bb3434baf1dfcf3e80faff6fc3b138218a91ae205bc80;Vermisste Deutsche auf den Philippinen gefunden;https://www.zeit.de/news/2025-03/22/vermisste-deutsche-auf-den-philippinen-gefunden;Hier finden Sie Informationen zu dem Thema „Wanderung ohne Tourenführer“. Lesen Sie jetzt „Vermisste Deutsche auf den Philippinen gefunden“.;Wanderung ohne Tourenführer;News, Wanderung ohne Tourenführer, Mann, Philippinen, Valencia, Negros, Oriental, Polizei, Notfall, Touristengruppe, Suchtrupp;2025-03-22T17:39:32+01:00;2025-03-22T17:39:32+01:00;;dpa;false
e79ff88a361d73f8360d68fe6d40126a655cd43fe86e65e996ec2ecae17dbc3d;Spandau 04 auf Halbfinalkurs - Potsdam unglücklich;https://www.zeit.de/news/2025-03/22/spandau-04-auf-halbfinalkurs-potsdam-ungluecklich;Hier finden Sie Informationen zu dem Thema „Wasserball-Bundesliga“. Lesen Sie jetzt „Spandau 04 auf Halbfinalkurs - Potsdam unglücklich“.;Wasserball-Bundesliga;News, Wasserball-Bundesliga, Potsdam, Duisburg, Wasserfreunde Spandau 04, Bundesliga, Halbfinalkurs;2025-03-22T17:39:00+01:00;2025-03-22T17:39:00+01:00;;dpa Berlin/Brandenburg;false
54486e79b494823b6659986eae06f4c30494bb002abbbfcd3f95b12600eb300d;Essen und Duisburg im Niederrhein-Pokalfinale;https://www.zeit.de/news/2025-03/22/essen-und-duisburg-im-niederrhein-pokalfinale;Hier finden Sie Informationen zu dem Thema „Fußball-Landespokal“. Lesen Sie jetzt „Essen und Duisburg im Niederrhein-Pokalfinale“.;Fußball-Landespokal;News, Fußball-Landespokal, Duisburg, Niederrhein, Oberhausen, Rot-Weiss Essen, MSV Duisburg, Finaltag, Endspiel;2025-03-22T17:33:54+01:00;2025-03-22T17:33:54+01:00;;dpa Nordrhein-Westfalen;false
a65b29b5ca6ad489d3802ae88c18d8f6be2135f3f07bc29fdf7b079a43ce2b6e;Ich verliere ständig Regenschirme. Was kann ich tun?;https://www.zeit.de/2025/12/regenschirme-geld-sparen-vergessen;Regenschirme sind erfunden worden, um vergessen zu werden. Schirm-Sharing ist leider auch nicht die Lösung. Doch kanadische Forscher haben die rettende Idee.;"Z+ (abopflichtiger Inhalt);
        
    Regenschirme";Arbeit, Regenschirme, Unwetter, Alltag, Psychologie, Mode, Wetter;2025-03-22T17:31:28+01:00;2025-03-22T17:31:28+01:00;Marcus Rohwetter;Aus der        ZEIT Nr. 12/2025;false
11e877fa8f23d5091d290aaf8383381c22e91af374bd933182d90928a915470b;Hunderte bei Autokorso und Protestmarsch in Gera;https://www.zeit.de/news/2025-03/22/hunderte-bei-autokorso-und-protestmarsch-in-gera;Hier finden Sie Informationen zu dem Thema „Demonstration“. Lesen Sie jetzt „Hunderte bei Autokorso und Protestmarsch in Gera“.;Demonstration;News, Demonstration, Gera, Autokorso, Protestmarsch, Demonstration;2025-03-22T17:25:12+01:00;2025-03-22T17:25:12+01:00;;dpa Thüringen;false
5b08365904c68344c537ecba014964fb42dce0ae7ab4c0e59bf7dbf749bc32a5;USA und Venezuela einigen sich auf Rückführung von Migranten;https://www.zeit.de/politik/ausland/2025-03/venezuela-usa-abschiebungen-fluege-einigung;Venezuela will Abschiebeflüge aus den USA wieder akzeptieren. Zuvor hatten die USA angebliche Gangmitglieder aus Venezuela in ein Gefängnis in El Salvador ausgeflogen.;Abschiebeflüge;Politik, Abschiebeflüge, USA, Venezuela, Migration, Abschiebung, El Salvador, Häftlinge;2025-03-22T17:20:42+01:00;2025-03-22T17:20:42+01:00;skö;ZEIT ONLINE,        AFP,        Reuters,        							skö;false
77b40a0a9af0c00305660c56df507f0344675bdaf87211797032a52ae6db4c5a;Sind Waffen jetzt links?;https://www.zeit.de/2025/12/waffen-verteidigung-jan-van-aken-jakob-blasel-links;"Kriege mit ""militärischen Mitteln"" stoppen? Das fordert der Sprecher der Grünen Jugend, Jakob Blasel. Linken-Chef Jan van Aken hält das für zu kurz gedacht.";"Z+ (abopflichtiger Inhalt);
        
    Waffen zur Verteidigung";Politik, Waffen zur Verteidigung, Jan van Aken, Die Linke, Bündnis 90/Die Grünen, Aufrüstung, Bundeswehr, Krieg in der Ukraine;2025-03-22T17:19:04+01:00;2025-03-22T17:19:04+01:00;Peter DausendMark Schieritz;Aus der        ZEIT Nr. 12/2025;false
