Hash;Title;Link;Description;Category;KeyWords;Published;LastUpdated;Author;Source;Paywall
9ec30be82ee9573198c695416a20490631a25fd19dc0d2e7a8c49e3c505c865e;Missbrauchsverdacht: Klinik prüft Verstoß gegen Schutzregel;https://www.zeit.de/news/2026-01/14/klinik-zu-missbrauchsverdacht-4-augen-prinzip-verletzt;Hier finden Sie Informationen zu dem Thema „Kinderarzt in U-Haft“. Lesen Sie jetzt „Missbrauchsverdacht: Klinik prüft Verstoß gegen Schutzregel“.;Kinderarzt in U-Haft;News, Kinderarzt in U-Haft, Havelland, Rathenow, Missbrauchsverdacht, Kinderarzt;2026-01-14T16:09:38+01:00;2026-01-14T16:09:38+01:00;;dpa Berlin/Brandenburg;false
7e185f09b7a71ca9e87ed738b6e44263cac2f1564a5f868c9ff3d27925209e2e;Kind stirbt bei Zahnarzt – Gericht muss Mordfrage neu prüfen;https://www.zeit.de/news/2026-01/14/kind-stirbt-bei-zahnarzt-gericht-muss-mordfrage-neu-pruefen;Hier finden Sie Informationen zu dem Thema „Bundesgerichtshof“. Lesen Sie jetzt „Kind stirbt bei Zahnarzt – Gericht muss Mordfrage neu prüfen“.;Bundesgerichtshof;News, Bundesgerichtshof, Hochtaunuskreis, Frankfurt, Bundesgerichtshof, Mordfrage;2026-01-14T16:08:43+01:00;2026-01-14T16:08:43+01:00;;dpa Hessen;false
ae99c9ac6285c51d6b4fd6534940794d2b8b5829f7ad132e390f07f1fa468104;Krankenhausgesellschaft warnt Kliniken vor Sicherheitslücken;https://www.zeit.de/news/2026-01/14/krankenhausgesellschaft-warnt-kliniken-vor-sicherheitsluecken;Hier finden Sie Informationen zu dem Thema „Kritische Infrastruktur“. Lesen Sie jetzt „Krankenhausgesellschaft warnt Kliniken vor Sicherheitslücken“.;Kritische Infrastruktur;News, Kritische Infrastruktur, Krankenhausgesellschaft, Sicherheitslücke, Klinik, Infrastruktur, Drohnenüberflug, Cyberangriff;2026-01-14T16:08:42+01:00;2026-01-14T16:08:42+01:00;;dpa Berlin/Brandenburg;false
99557e07e3201734245d61b4165b394c1e8f2f3c807b6d46eec7a4472efc7c05;"Milliardenschwer: Osapiens aus Mannheim wird zum ""Einhorn""";https://www.zeit.de/news/2026-01/14/milliardenschwer-osapiens-aus-mannheim-wird-zum-einhorn;"Hier finden Sie Informationen zu dem Thema „Software-Anbieter“. Lesen Sie jetzt „Milliardenschwer: Osapiens aus Mannheim wird zum ""Einhorn""“.";Software-Anbieter;News, Software-Anbieter, Mannheim, Software;2026-01-14T16:07:30+01:00;2026-01-14T16:07:30+01:00;;dpa Baden-Württemberg;false
fa2cf2cf09b8f707bdc836fec73923a931e55d2878ff5cf600cfb63611c5ed44;Forschungsministerin Dorothee Bär nimmt nicht am Erhard-Gipfel teil;https://www.zeit.de/politik/deutschland/2026-01/dorothee-baer-ludwig-erhard-gipfel-absage-gxe;Immer mehr Spitzenpolitiker sagen ihre Teilnahme am Ludwig-Erhard-Gipfel ab, darunter Bundesforschungsministerin Bär. Bayern will die Veranstaltung nicht mehr fördern.;Gipfel am Tegernsee;Politik, Gipfel am Tegernsee, Dorothee Bär, CSU, Markus Söder, Wolfram Weimer, Medienbranche;2026-01-14T16:04:42+01:00;2026-01-14T16:04:42+01:00;mnslgi;DIE ZEIT,        dpa,        							mns					,        							lgi;false
e8986790916c4178a70ba49c2d8a2ed2355b39a2c9ea1b90c713319207aa9959;Brandenburg will Maßnahmenpaket gegen Gewalt an Schulen;https://www.zeit.de/news/2026-01/14/brandenburg-will-massnahmenpaket-gegen-gewalt-an-schulen;Hier finden Sie Informationen zu dem Thema „Vorfälle in Cottbus“. Lesen Sie jetzt „Brandenburg will Maßnahmenpaket gegen Gewalt an Schulen“.;Vorfälle in Cottbus;News, Vorfälle in Cottbus, René Wilke, Brandenburg, Cottbus, SPD, Polizei, Treffen, Maßnahmenpaket, Sondersitzung, Körperverletzung;2026-01-14T16:04:20+01:00;2026-01-14T16:04:20+01:00;;dpa Berlin/Brandenburg;false
eb383f76c1d678d3a471761addade10306887a61df3d109b28a2690c9703b808;"GEW nennt Hymnenpflicht bei Schulfeiern ""Schnapsidee""";https://www.zeit.de/news/2026-01/14/gew-nennt-hymnenpflicht-bei-schulfeiern-schnapsidee;"Hier finden Sie Informationen zu dem Thema „Schulen“. Lesen Sie jetzt „GEW nennt Hymnenpflicht bei Schulfeiern ""Schnapsidee""“.";Schulen;News, Schulen, Markus Söder, Florian Kohl, Bayern, GEW, CSU, Hymnenpflicht, Schulfeiern, Schnapsidee, Erziehungsgewerkschaft, Schulabschlussfeiern;2026-01-14T16:00:40+01:00;2026-01-14T16:00:40+01:00;;dpa Bayern;false
4846e36752073d4cae6bcfb74bbe88b3b32ead549bf3e2ddc418980524bc7d42;Zwei Schwerverletzte bei Unfall auf B105;https://www.zeit.de/news/2026-01/14/zwei-schwerverletzte-bei-unfall-auf-b105;Hier finden Sie Informationen zu dem Thema „Überholmanöver missglückt“. Lesen Sie jetzt „Zwei Schwerverletzte bei Unfall auf B105“.;Überholmanöver missglückt;News, Überholmanöver missglückt, Mann, Sandhagen, Rostock, Landkreis Rostock, Unfall, Überholmanöver, Auto;2026-01-14T15:59:53+01:00;2026-01-14T15:59:53+01:00;;dpa Mecklenburg-Vorpommern;false
c945109d3ec926f83b550d9ead6d6240fb7853208f5d68bbbca3c10ea288493a;Eine Machtbastion in Afrika;https://www.zeit.de/2026/03/somaliland-israel-anerkennung-afrika-huthi-rebellen-jemen;Israel hat das de facto unabhängige Somaliland anerkannt – zum Ärger vieler arabischer Staaten. Dabei war die kleine Machtbastion noch nie so wichtig wie heute.;Somaliland;Politik, Somaliland, Israel, Somalia, Huthi, Afrika, Jerusalem;2026-01-14T15:59:37+01:00;2026-01-14T15:59:37+01:00;Jan Roß;Aus der        ZEIT Nr. 03/2026;false
9f9453dcf288aaa92dbe0e9f2f5fdbe997ee612dafeacc0f190f85d5189f7003;Gemischtes Echo auf Söder-Vorstoß für Länderfusionen;https://www.zeit.de/news/2026-01/14/gemischtes-echo-auf-soeder-vorstoss-fuer-laenderfusionen;Hier finden Sie Informationen zu dem Thema „CSU-Fraktionsklausur“. Lesen Sie jetzt „Gemischtes Echo auf Söder-Vorstoß für Länderfusionen“.;CSU-Fraktionsklausur;News, CSU-Fraktionsklausur, Florian Streibl, Christian Hartmann, Bayern, Sachsen-Anhalt, CSU, CDU, Länderfusion, Echo;2026-01-14T15:58:48+01:00;2026-01-14T15:58:48+01:00;;dpa Bayern;false
9751d8d39c6f25bea3774ebc51b891a5a4e82034e9267d669e34741135ae20bf;Lkw-Fahrer nach Brand verletzt - Feuer durch Gaskocher?;https://www.zeit.de/news/2026-01/14/lkw-fahrer-nach-brand-verletzt-feuer-durch-gaskocher;Hier finden Sie Informationen zu dem Thema „Feuer“. Lesen Sie jetzt „Lkw-Fahrer nach Brand verletzt - Feuer durch Gaskocher?“.;Feuer;News, Feuer, Polizei;2026-01-14T15:58:05+01:00;2026-01-14T15:58:05+01:00;;dpa Baden-Württemberg;false
ed6c5597ccc37a2cd6cf47e57b14fc31591ad81093714adb9778c647c1770ce6;Frau schwer mit Messer verletzt – Polizei sucht Ehemann;https://www.zeit.de/news/2026-01/14/frau-schwer-mit-messer-verletzt-polizei-sucht-ehemann;Hier finden Sie Informationen zu dem Thema „Kriminalität“. Lesen Sie jetzt „Frau schwer mit Messer verletzt – Polizei sucht Ehemann“.;Kriminalität;News, Kriminalität, Polizei, Staatsanwaltschaft, Kriminalität;2026-01-14T15:57:23+01:00;2026-01-14T15:57:23+01:00;;dpa Nordrhein-Westfalen;false
6ccf780681c19276ba343e7e42104955d5bd81400a3ad28ad128e1b4f8e74eae;Was schon fünf Minuten mehr Bewegung am Tag bringen;https://www.zeit.de/gesundheit/2026-01/lebenserwartung-verbesserung-bewegung-alltag-lancet-studie;Sie schaffen es nicht, dreimal pro Woche zu joggen? Eine neue Lancet-Studie zeigt, dass schon ein bisschen mehr Bewegung die Lebenserwartung messbar steigern kann.;"Z+ (abopflichtiger Inhalt);
        
    Verbesserung der Lebenserwartung";Gesundheit, Verbesserung der Lebenserwartung, Lebenserwartung, Fitness, Studie, Alltag, Gesundheitsrisiko, Prävention;2026-01-14T15:57:08+01:00;2026-01-14T15:57:08+01:00;Lisa Röther;;false
0d6bdb0da3a627e6dda1b5788075b2616e82e4b5a770bae62797c8a0ca365dc2;"Torhüter Wolff provoziert Österreich vor ""Handball-Cordoba""";https://www.zeit.de/news/2026-01/14/torhueter-wolff-provoziert-oesterreich-vor-handball-cordoba;"Hier finden Sie Informationen zu dem Thema „EM-Auftakt“. Lesen Sie jetzt „Torhüter Wolff provoziert Österreich vor ""Handball-Cordoba""“.";EM-Auftakt;News, EM-Auftakt, Andreas Wolff, Constantin Möstl, Juri Knorr, Jannik Kohlbacher, Alfred Gislason, Johannes Golla, Benjamin Chatton, Österreich, Herning, ARD;2026-01-14T15:56:09+01:00;2026-01-14T15:56:09+01:00;;dpa Sport;false
03bb67050da1faaf04667f4ddc69d6e234d9296ebb7dd152a849ab73c1677f0c;Göttinger Elch geht an Karikaturisten-Duo Rattelschneck;https://www.zeit.de/news/2026-01/14/goettinger-elch-geht-an-karikaturisten-duo-rattelschneck;Hier finden Sie Informationen zu dem Thema „Auszeichnung“. Lesen Sie jetzt „Göttinger Elch geht an Karikaturisten-Duo Rattelschneck“.;Auszeichnung;News, Auszeichnung, Marcus Weimer, Olav Westphalen, Göttingen, Göttinger Elch, Auszeichnung, Satirepreis;2026-01-14T15:55:16+01:00;2026-01-14T15:55:16+01:00;;dpa Niedersachsen;false
dc3e400ff591b0ae0529e80c9fa064e4de6b20a92b101eb215b6b694c4eaa490;Apple: Kein KI-Training mit Nutzerdaten;https://www.zeit.de/news/2026-01/14/apple-kein-ki-training-mit-nutzerdaten;Hier finden Sie Informationen zu dem Thema „iPhone-Konzern“. Lesen Sie jetzt „Apple: Kein KI-Training mit Nutzerdaten“.;iPhone-Konzern;News, iPhone-Konzern, Brent Chiu-Watson, Apple, iPhone, Nutzerdaten, Software;2026-01-14T15:54:08+01:00;2026-01-14T15:54:08+01:00;;dpa;false
3e71afbbe010c78957c4f66bc1d814d87a0959149d68e4b928017b5af5d618e2;Land will Vergabe öffentlicher Aufträge vereinfachen;https://www.zeit.de/news/2026-01/14/land-will-vergabe-oeffentlicher-auftraege-vereinfachen;Hier finden Sie Informationen zu dem Thema „Vergaberecht“. Lesen Sie jetzt „Land will Vergabe öffentlicher Aufträge vereinfachen“.;Vergaberecht;News, Vergaberecht, Wiesbaden, Hessen, Löhne, SPD, Vergaberecht, Brückensanierung, Dumpinglohn, Schneckentempo, Schulbau, Geld;2026-01-14T15:50:54+01:00;2026-01-14T15:50:54+01:00;;dpa Hessen;false
4876e1f522a8d1f046d29295852beedf858a4dc5b195e9ad538036ee9f82d446;Mann stirbt vor Haftbefehl im Amtsgericht Oldenburg;https://www.zeit.de/news/2026-01/14/mann-stirbt-vor-haftbefehl-im-amtsgericht-oldenburg;Hier finden Sie Informationen zu dem Thema „Plötzlicher Tod“. Lesen Sie jetzt „Mann stirbt vor Haftbefehl im Amtsgericht Oldenburg“.;Plötzlicher Tod;News, Plötzlicher Tod, Oldenburg, Amtsgericht, Staatsanwaltschaft, Haftbefehl, Untersuchungshaftbefehl, Obduktion;2026-01-14T15:48:34+01:00;2026-01-14T15:48:34+01:00;;dpa Niedersachsen;false
bde564d3498659660f97a867f58ee5d3af2019a5f103481d435c8b615c761041;Magdeburg plant Investitionen in Höhe von 90 Millionen Euro;https://www.zeit.de/news/2026-01/14/magdeburg-plant-investitionen-in-hoehe-von-90-millionen-euro;Hier finden Sie Informationen zu dem Thema „Jahresauftaktpressekonferenz“. Lesen Sie jetzt „Magdeburg plant Investitionen in Höhe von 90 Millionen Euro“.;Jahresauftaktpressekonferenz;News, Jahresauftaktpressekonferenz, Simone Borris, Magdeburg, Sachsen-Anhalt, Jahresauftaktpressekonferenz, Investition, Stadtkasse, Geld;2026-01-14T15:44:52+01:00;2026-01-14T15:44:52+01:00;;dpa Sachsen;false
6f2dc9b2cdc7d1fcc0c892a79951df93d8200acec256122eb5c90902ae93ce4d;Autofahrer fährt auf Polizisten zu – Schüsse auf Reifen;https://www.zeit.de/news/2026-01/14/polizei-schiesst-in-bedrohungslage-niemand-verletzt;Hier finden Sie Informationen zu dem Thema „Kriminalität“. Lesen Sie jetzt „Autofahrer fährt auf Polizisten zu – Schüsse auf Reifen“.;Kriminalität;News, Kriminalität, Polizei, Bedrohungslage, Verfolgungsfahrt, Schusswaffeneinsatz, Kriminalität;2026-01-14T15:43:32+01:00;2026-01-14T15:43:32+01:00;;dpa Hamburg/Schleswig-Holstein;false
c8c136ef2b2ac5e589a9099dab40e3f7bd3be1e07b438dc6878c8daa05247cf7;Rahmedetalbrücke: Lücke an zweiter Brückenhälfte geschlossen;https://www.zeit.de/news/2026-01/14/rahmedetalbruecke-luecke-an-zweiter-brueckenhaelfte-geschlossen;Hier finden Sie Informationen zu dem Thema „Baustellenfortschritt“. Lesen Sie jetzt „Rahmedetalbrücke: Lücke an zweiter Brückenhälfte geschlossen“.;Baustellenfortschritt;News, Baustellenfortschritt, Weihnachten, Rahmedetalbrücke, Brückenhälfte, Baustellenfortschritt;2026-01-14T15:39:54+01:00;2026-01-14T15:39:54+01:00;;dpa Nordrhein-Westfalen;false
d725d084ec9a986aa748618dd49b3b87ee5d44b2643e3a5ecc5bbb4c31461609;Zwei Runden im Wald: Baumgarts lustiger Termin-Fauxpas;https://www.zeit.de/news/2026-01/14/zwei-runden-im-wald-baumgarts-lustiger-termin-fauxpas;Hier finden Sie Informationen zu dem Thema „Union Berlin“. Lesen Sie jetzt „Zwei Runden im Wald: Baumgarts lustiger Termin-Fauxpas“.;Union Berlin;News, Union Berlin, Steffen Baumgart, Augsburg, Berlin, 1. FC Union Berlin, FC Augsburg, Vertragsverlängerung, Wald;2026-01-14T15:38:49+01:00;2026-01-14T15:38:49+01:00;;dpa Bayern;false
9abdb04ec11c2de4d8b44d319fb61e8b629dfbb14247517e85583651916748a7;Sanktionszoff: Umgang mit Irans Revolutionsgarden spaltet EU;https://www.zeit.de/news/2026-01/14/sanktionszoff-umgang-mit-irans-revolutionsgarden-spaltet-eu;Hier finden Sie Informationen zu dem Thema „Massenproteste in Teheran“. Lesen Sie jetzt „Sanktionszoff: Umgang mit Irans Revolutionsgarden spaltet EU“.;Massenproteste in Teheran;News, Massenproteste in Teheran, Iran, Teheran, Frankreich, Italien, Spanien, Europäische Union, EU, Deutsche Presse-Agentur, Bundesregierung, Massenprotest;2026-01-14T15:38:05+01:00;2026-01-14T15:38:05+01:00;;dpa;false
9e66b1bbf3db960add8a71668614a8615e4dd899045c2a6355cb2f6517665836;"Kleist-Förderpreis geht an das Stück ""Debritz""";https://www.zeit.de/news/2026-01/14/kleist-foerderpreis-geht-an-das-stueck-debritz;"Hier finden Sie Informationen zu dem Thema „Auszeichnungen“. Lesen Sie jetzt „Kleist-Förderpreis geht an das Stück ""Debritz""“.";Auszeichnungen;News, Auszeichnungen, Kaleb Erdmann, Auszeichnung;2026-01-14T15:34:51+01:00;2026-01-14T15:34:51+01:00;;dpa Berlin/Brandenburg;false
2bf28a779ff5cc8fa976ae62be34d09c9f98e8d98c841c0306bd29957c1f996f;Die türkische Variante von Shortbread;https://www.zeit.de/zeit-magazin/wochenmarkt/2026-01/tuerkische-kekse-rezept-wochenmarkt;Kaffee und Kuchen? Kekse und Tee! In der Türkei reicht man Un kurabiyesi, ein zart-pudriges Gebäck, das genau die richtige Süße hat. Hier kommen Pistazien dazu.;"Z+ (abopflichtiger Inhalt);
        
    Türkische Kekse";vegetarische Rezepte, backen, Türkische Küche;2026-01-14T15:28:41+01:00;2026-01-14T15:28:41+01:00;Yelda Yilmaz;;false
3bad715d85db35f31714bb44124b0f6d7ac6e791b42415994f187975f639fd60;Warnstreiktag in MV - Geue: Sieben Prozent sind zu viel;https://www.zeit.de/news/2026-01/14/warnstreiktag-angelaufen-demos-in-rostock-und-schwerin;Hier finden Sie Informationen zu dem Thema „Tarifstreit“. Lesen Sie jetzt „Warnstreiktag in MV - Geue: Sieben Prozent sind zu viel“.;Tarifstreit;News, Tarifstreit, Rostock, Schwerin, Mecklenburg-Vorpommern, Ver.di, Warnstreiktag, Tarifstreit, Tarifrunde, Warnstreikaktion;2026-01-14T15:25:59+01:00;2026-01-14T15:25:59+01:00;;dpa Mecklenburg-Vorpommern;false
97d784c3dfcc4cb5772b37b96905737a0fd29ec2b099752f8f047b66518877e0;Wie Brauer auf Verbraucher reagieren;https://www.zeit.de/news/2026-01/14/wie-brauer-auf-verbraucher-reagieren;Hier finden Sie Informationen zu dem Thema „Konsumflaute bei Bier“. Lesen Sie jetzt „Wie Brauer auf Verbraucher reagieren“.;Konsumflaute bei Bier;News, Konsumflaute bei Bier, Volker Kuhl, VELTINS, Konsumflaute, Absatzrückgang, Geschmacksvariante, Hellbier, Gastronomie;2026-01-14T15:25:56+01:00;2026-01-14T15:25:56+01:00;;dpa;false
4b0cf0c9c6151c10b417465f075877de6d361c41eb2675c2a0b62e1995aec15e;Rehlinger wehrt sich gegen Söder-Forderung;https://www.zeit.de/news/2026-01/14/rehlinger-wehrt-sich-gegen-soeder-forderung;Hier finden Sie Informationen zu dem Thema „Neuordnung Bundesländer“. Lesen Sie jetzt „Rehlinger wehrt sich gegen Söder-Forderung“.;Neuordnung Bundesländer;News, Neuordnung Bundesländer, Markus Söder, Anke Rehlinger, Saarland, FDP, SPD, CSU, RTL, Neuordnung;2026-01-14T15:23:54+01:00;2026-01-14T15:23:54+01:00;;dpa Rheinland-Pfalz/Saarland;false
191b6aba8c3d93479399f85c5b36f5af97f2e1796c1caf77ec52aa971eabaa4b;SPD wirft Kritikern des Erbschaftsteuerentwurfs Falschdarstellung vor;https://www.zeit.de/politik/deutschland/2026-01/erbschaftsteuer-reform-spd-kritik-reaktion-gxe;Vertreterinnen und Vertreter der Union und Wirtschaft kritisierten die SPD-Pläne für eine Erbschaftsteuerreform. Nun reagierte SPD-Fraktionsvizechefin Wiebke Esdar.;SPD-Erbschaftsteuerkonzept;Politik, SPD-Erbschaftsteuerkonzept, Reform, SPD, Erbschaftsteuer, Erbschaft, Desinformation, Steuerpolitik;2026-01-14T15:23:46+01:00;2026-01-14T15:23:46+01:00;ngo;DIE ZEIT,        dpa,        AFP,        							ngo;false
671c5742177296caf9acae13e8714fd39afd766e59d1c5b51f59d9eb114bbb51;Tourist will mit toter Frau ins Flugzeug;https://www.zeit.de/news/2026-01/14/tourist-will-mit-toter-frau-ins-flugzeug;Hier finden Sie Informationen zu dem Thema „Beklemmender Vorfall“. Lesen Sie jetzt „Tourist will mit toter Frau ins Flugzeug“.;Beklemmender Vorfall;News, Beklemmender Vorfall, Teneriffa, Polizei, Flugzeug;2026-01-14T15:21:39+01:00;2026-01-14T15:21:39+01:00;;dpa;false
ac5681f18d1a9f61fe34b36dceda4ebf2bbbb2fb19057dd65f7b39f18c4f5b9d;Polizei bittet nach Sexualdelikt um Hinweise aus Bevölkerung;https://www.zeit.de/news/2026-01/14/polizei-bittet-nach-sexualdelikt-um-hinweise-aus-bevoelkerung;Hier finden Sie Informationen zu dem Thema „Regensburg“. Lesen Sie jetzt „Polizei bittet nach Sexualdelikt um Hinweise aus Bevölkerung“.;Regensburg;News, Regensburg, Mann, Regensburg, Polizei, LKA Bayern, Kripo, Sexualdelikt;2026-01-14T15:18:07+01:00;2026-01-14T15:18:07+01:00;;dpa Bayern;false
e0ccad6130219cd08112443c7e71660c22ee6e6a8b86dbde2d3dc435a3ae3686;Latif und Bruhn werden Ehrenbürger Schleswig-Holsteins;https://www.zeit.de/news/2026-01/14/latif-und-bruhn-werden-ehrenbuerger-schleswig-holsteins;Hier finden Sie Informationen zu dem Thema „Aufnahme in illustre Runde“. Lesen Sie jetzt „Latif und Bruhn werden Ehrenbürger Schleswig-Holsteins“.;Aufnahme in illustre Runde;News, Aufnahme in illustre Runde, Kirsten Bruhn, Mojib Latif, Daniel Günther, Schleswig-Holstein, Heide, CDU, Ehrenbürger;2026-01-14T15:16:15+01:00;2026-01-14T15:16:15+01:00;;dpa Hamburg/Schleswig-Holstein;false
0ddd471baa175d14e85501478fd545aa1a672594a6efdd7a346cd9b28388d947;Explosion an Funkmast – Staatsschutz ermittelt;https://www.zeit.de/news/2026-01/14/explosion-an-funkmast-staatsschutz-ermittelt;Hier finden Sie Informationen zu dem Thema „Detonation“. Lesen Sie jetzt „Explosion an Funkmast – Staatsschutz ermittelt“.;Detonation;News, Detonation, Polizei, Explosion, Funkmast, Staatsschutz, Schaltschrank;2026-01-14T15:14:57+01:00;2026-01-14T15:14:57+01:00;;dpa Nordrhein-Westfalen;false
4b0ec10c6dcbf3eb187900abf790209546602c77012bb8ffa8a18df71782a402;"""Tagesthemen""-Chef Helge Fuhst wechselt zu Axel Springer";https://www.zeit.de/kultur/film/2026-01/helge-fuhst-ard-tagesthemen-axel-springer;"Der Leiter der ""Tagesthemen""-Redaktion, Helge Fuhst, verlässt die ARD. Er wird Chefredakteur der ""Welt""-Gruppe und Vorsitzender weiterer Redaktionen bei Axel Springer.";Helge Fuhst;Kultur, Helge Fuhst, Axel Springer, ARD, Medienbranche, Journalismus, Chef, Helge Fuhst;2026-01-14T15:14:23+01:00;2026-01-14T15:14:23+01:00;bam;DIE ZEIT,        dpa,        KNA,        							bam;false
423c2099efa0329557015ef22e16c7c990ef3cbd207baf61896f71c7d6ca869d;Dobrindt will mit neuem Migrationsbotschafter Abschiebungen steigern;https://www.zeit.de/politik/deutschland/2026-01/bundesinnenministerium-abschiebung-alexander-dobrindt-gxe;"Bundesinnenminister Dobrindt hat einen neuen Zuständigen für Migrations- und Abschiebungsfragen. Der ""Migrationsbotschafter"" ersetzt den früheren Sonderbevollmächtigten.";Bundesinnenministerium;Politik, Bundesinnenministerium, Alexander Dobrindt, Bundesinnenministerium, Migration, Abschiebung, Menschenrechte, CSU;2026-01-14T15:13:45+01:00;2026-01-14T15:13:45+01:00;bam;DIE ZEIT,        epd,        							bam;false
4fc73e27f3a7ae255fae718a5c99ab500dc7fb1387900ec19a3e894314b3e7ec;Voller Einsatz bis zur letzten Abfahrt;https://www.zeit.de/wirtschaft/2026-01/skigebiet-sauerland-buergerverein-boedefeld-insolvenz;"Im Sauerland retten ein Bäcker, ein Klempner und ein Rentner unbezahlt ein Skigebiet – trotz Schneemangel. Das schlaucht und ist riskant. Warum tun sie sich das an?

";"Z+ (abopflichtiger Inhalt);
        
    Skigebiet im Sauerland";Wirtschaft, Skigebiet im Sauerland, Sauerland, Wintersport, Insolvenz, Klimawandel, Ehrenamt, Winter;2026-01-14T15:09:43+01:00;2026-01-14T15:09:43+01:00;Anne-Sophie LangKaja Smith;;false
7f7e93b9cf43dd5c082ff7341241d7d4d1f99f80f84fd66103aa532811fb74e4;Robbe stirbt bei Unfall mit einem Auto;https://www.zeit.de/news/2026-01/14/robbe-stirbt-bei-unfall-mit-einem-auto;Hier finden Sie Informationen zu dem Thema „Ungewöhnlicher Zusammenprall“. Lesen Sie jetzt „Robbe stirbt bei Unfall mit einem Auto“.;Ungewöhnlicher Zusammenprall;News, Ungewöhnlicher Zusammenprall, Unfall, Zusammenprall, Auto, Tiere;2026-01-14T15:09:08+01:00;2026-01-14T15:09:08+01:00;;dpa Niedersachsen;false
d49c19fb8d09b1885c8f0107668778e362e5826c669a6d2e63acd8a3b018f94d;Joggen im Wald: Baumgart verschwitzt Pressekonferenz;https://www.zeit.de/news/2026-01/14/joggen-im-wald-baumgart-verschwitzt-pressekonferenz;Hier finden Sie Informationen zu dem Thema „Union Berlin“. Lesen Sie jetzt „Joggen im Wald: Baumgart verschwitzt Pressekonferenz“.;Union Berlin;News, Union Berlin, Steffen Baumgart, Augsburg, 1. FC Union Berlin, FC Augsburg, Bundesliga, Vertragsverlängerung, Wald;2026-01-14T15:07:53+01:00;2026-01-14T15:07:53+01:00;;dpa Bayern;false
703c250ffdbee2d2d2b9696b0762c659dcee5bcdce276f6ce47e006e13f2ba7d;Leiche eines 65-Jährigen bei Asylunterkunft gefunden;https://www.zeit.de/news/2026-01/14/leiche-eines-65-jaehrigen-bei-asylunterkunft-gefunden;Hier finden Sie Informationen zu dem Thema „Notfälle“. Lesen Sie jetzt „Leiche eines 65-Jährigen bei Asylunterkunft gefunden“.;Notfälle;News, Notfälle, Asylunterkunft, Notfall, Asyl;2026-01-14T15:05:42+01:00;2026-01-14T15:05:42+01:00;;dpa Baden-Württemberg;false
254b13f7c9bd9542427b16b27b941f75ddf1265d9c47ea8cc1be254f4880b601;Polizei veröffentlicht Foto zu Mord vor rund 38 Jahren;https://www.zeit.de/news/2026-01/14/polizei-veroeffentlicht-foto-zu-mord-vor-rund-38-jahren;Hier finden Sie Informationen zu dem Thema „Kriminalität“. Lesen Sie jetzt „Polizei veröffentlicht Foto zu Mord vor rund 38 Jahren“.;Kriminalität;News, Kriminalität, Berlin, Polizei, Mord, Stadtforst, Kriminalität;2026-01-14T15:05:20+01:00;2026-01-14T15:05:20+01:00;;dpa Berlin/Brandenburg;false
0803557bcf3f85d683090ba0445dc2313ed9ad4cd3e5249ed920e2008c00eb01;2026 kein Geld vom Wirtschaftsministerium für Erhard-Gipfel?;https://www.zeit.de/news/2026-01/14/2026-kein-geld-vom-wirtschaftsministerium-fuer-erhard-gipfel;Hier finden Sie Informationen zu dem Thema „Tegernsee-Gipfel“. Lesen Sie jetzt „2026 kein Geld vom Wirtschaftsministerium für Erhard-Gipfel?“.;Tegernsee-Gipfel;News, Tegernsee-Gipfel, Markus Söder, Hubert Aiwanger, Wolfram Weimer, Tegernsee, Berchtesgadener Land, BMWi, CSU, Freie Wähler, Geld;2026-01-14T15:04:56+01:00;2026-01-14T15:04:56+01:00;;dpa Bayern;false
fec54f5638f2290a0ae8175f632c95eb16ec4ccef147ef09bed351c6acf68142;Donald Trump droht ExxonMobil mit Blockade von Investitionen;https://www.zeit.de/politik/ausland/2026-01/venezuela-usa-angriff-nicolas-maduro-liveblog;Nach dem Militäreinsatz der USA in Venezuela lässt das Land schrittweise politische Gefangene frei. Streit gibt es um das Öl in dem Land. Das Liveblog zum Nachlesen;Venezuela;Politik, Venezuela, Erdöl, Venezuela, USA, Nicolás Maduro, Caracas, Subvention;2026-01-14T14:15:49+00:00;2026-01-14T14:15:49+00:00;Eva CasperJan-Frederik Wendt;;false
ffd12ea730ae85c852acf3a50e398600beb5aebe51142a5c4944fc432a5cccdd;Hunderte Autos bei Brandstiftungen beschädigt;https://www.zeit.de/news/2026-01/14/hunderte-autos-bei-brandstiftungen-beschaedigt;Hier finden Sie Informationen zu dem Thema „Brandstiftung“. Lesen Sie jetzt „Hunderte Autos bei Brandstiftungen beschädigt“.;Brandstiftung;News, Brandstiftung, Berlin, Polizei, Brandstiftung, Auto, Fahrzeug, Hitze;2026-01-14T15:03:50+01:00;2026-01-14T15:03:50+01:00;;dpa Berlin/Brandenburg;false
0b7b0c65fc1353d472e413c62c9aa8e00ab1a835bee85c4fe0077dfad1e0befe;Polizeiwagen und weiteres Auto kollidieren – sechs Verletzte;https://www.zeit.de/news/2026-01/14/polizeiwagen-und-weiteres-auto-kollidieren-leichtverletzte;Hier finden Sie Informationen zu dem Thema „Zusammenstoß in Minden“. Lesen Sie jetzt „Polizeiwagen und weiteres Auto kollidieren – sechs Verletzte“.;Zusammenstoß in Minden;News, Zusammenstoß in Minden, Minden, Polizei, Polizeiwagen, Zusammenstoß, Auto;2026-01-14T15:03:31+01:00;2026-01-14T15:03:31+01:00;;dpa Nordrhein-Westfalen;false
7c6053662d1d914e16a49c1615fbbeba31466c718869c2482c4883543d044cdc;Appell von Weber: EU-Botschaften sollen Schutzräume werden;https://www.zeit.de/news/2026-01/14/appell-von-weber-eu-botschaften-sollen-schutzraeume-werden;Hier finden Sie Informationen zu dem Thema „Wegen Gewalt im Iran“. Lesen Sie jetzt „Appell von Weber: EU-Botschaften sollen Schutzräume werden“.;Wegen Gewalt im Iran;News, Wegen Gewalt im Iran, Manfred Weber, Iran, Europäische Union, CSU, Schutzraum;2026-01-14T15:03:18+01:00;2026-01-14T15:03:18+01:00;;dpa;false
00d28c34f73693358b4d647e929291e6ec2c052040ba01c3c3177fe1d9873a85;400.000 Euro Schaden nach Lkw-Auffahrunfall in der Oberpfalz;https://www.zeit.de/news/2026-01/14/400-000-euro-schaden-nach-lkw-auffahrunfall-in-der-oberpfalz;Hier finden Sie Informationen zu dem Thema „Unfälle“. Lesen Sie jetzt „400.000 Euro Schaden nach Lkw-Auffahrunfall in der Oberpfalz“.;Unfälle;News, Unfälle, Oberpfalz, Polizei, Unfall, Auffahrunfall;2026-01-14T15:02:35+01:00;2026-01-14T15:02:35+01:00;;dpa Bayern;false
