Hash;Title;Link;Description;Category;KeyWords;Published;LastUpdated;Author;Source;Paywall
95f1747a5ea8e4f3264c896bea568f411cbf9112d60265bbc53c7ffc10d0b292;230 Millionen Euro für Kieler Instituts-Neubau;https://www.zeit.de/news/2026-02/13/230-millionen-euro-fuer-kieler-instituts-neubau;Hier finden Sie Informationen zu dem Thema „Forschungszentrum“. Lesen Sie jetzt „230 Millionen Euro für Kieler Instituts-Neubau“.;Forschungszentrum;News, Forschungszentrum, Forschungszentrum, Neubau, Lebensmittel;2026-02-13T12:15:02+01:00;2026-02-13T12:15:02+01:00;;dpa Hamburg/Schleswig-Holstein;false
6b558f09b9fe19cef9b582f1e3ee20e972a54f0f7699fa54540b324d637fa97d;14-Jähriger flüchtet mit Mietwagen – zwei Schwerverletzte;https://www.zeit.de/news/2026-02/13/14-jaehriger-fluechtet-mit-mietwagen-zwei-schwerverletzte;Hier finden Sie Informationen zu dem Thema „Ohne Führerschein“. Lesen Sie jetzt „14-Jähriger flüchtet mit Mietwagen – zwei Schwerverletzte“.;Ohne Führerschein;News, Ohne Führerschein, Düsseldorf, Polizei, Mietwagen, Carsharing, Auto;2026-02-13T12:13:14+01:00;2026-02-13T12:13:14+01:00;;dpa Nordrhein-Westfalen;false
381770a7dde275cb94cdbfd01a88d5fc58943c8e0faf0a580baab4ab3a64ac69;Erneut Schüsse in Berlin - Mann lebensgefährlich verletzt;https://www.zeit.de/news/2026-02/13/erneut-schuesse-in-berlin-ein-verletzter;Hier finden Sie Informationen zu dem Thema „Kriminalität“. Lesen Sie jetzt „Erneut Schüsse in Berlin - Mann lebensgefährlich verletzt“.;Kriminalität;News, Kriminalität, Berlin, Kreuzberg, Polizei, Kriminalität, Fahrzeug;2026-02-13T12:11:31+01:00;2026-02-13T12:11:31+01:00;;dpa Berlin/Brandenburg;false
fa6af163bf8e455208fc1fe516843e8a2c68eed37cc8e2971cfb6289e5123b1d;11.000 Liter Natronlauge bei Coca-Cola ausgelaufen;https://www.zeit.de/news/2026-02/13/11-000-liter-natronlauge-bei-getraenkehersteller-ausgelaufen;Hier finden Sie Informationen zu dem Thema „Notfälle“. Lesen Sie jetzt „11.000 Liter Natronlauge bei Coca-Cola ausgelaufen“.;Notfälle;News, Notfälle, Deizisau, Natronlauge, Notfall;2026-02-13T12:10:57+01:00;2026-02-13T12:10:57+01:00;;dpa Baden-Württemberg;false
4d250d9e2d9d73343cb746f6328df973684d90984f5dbe2c1bc74416d6c9a555;Schnee in Sicht - ab Rosenmontag im Westen milder;https://www.zeit.de/news/2026-02/13/schnee-in-sicht-ab-rosenmontag-im-westen-milder;Hier finden Sie Informationen zu dem Thema „Wettervorhersage“. Lesen Sie jetzt „Schnee in Sicht - ab Rosenmontag im Westen milder“.;Wettervorhersage;News, Wettervorhersage, Alpen, DWD, Rosenmontag, Wettervorhersage, Wetter;2026-02-13T12:07:49+01:00;2026-02-13T12:07:49+01:00;;dpa;false
56696144e1efbda99aa86baefd4b579039c613733a2d43f6924e43a16469e26d;Volleys in Europa-Zwickmühle;https://www.zeit.de/news/2026-02/13/volleys-in-europa-zwickmuehle;Hier finden Sie Informationen zu dem Thema „Volleyball-Champions League“. Lesen Sie jetzt „Volleys in Europa-Zwickmühle“.;Volleyball-Champions League;News, Volleyball-Champions League, Moritz Reichert, Las Palmas, BR, Champions League, Volley, Satzball;2026-02-13T12:05:35+01:00;2026-02-13T12:05:35+01:00;;dpa Berlin/Brandenburg;false
c025cd07ef5ff291224ecf7cb46d10c26a8e12536db4ebaae9a1e3f3c43f1eee;"Fregatte ""Nordrhein-Westfalen"" läuft zu Auslandseinsatz aus";https://www.zeit.de/news/2026-02/13/fregatte-nordrhein-westfalen-laeuft-zu-auslandseinsatz-aus;"Hier finden Sie Informationen zu dem Thema „UN-Einsatz im Mittelmeer“. Lesen Sie jetzt „Fregatte ""Nordrhein-Westfalen"" läuft zu Auslandseinsatz aus“.";UN-Einsatz im Mittelmeer;News, UN-Einsatz im Mittelmeer, Mittelmeer, Wilhelmshaven, Libanon, Nordrhein-Westfalen, Auslandseinsatz;2026-02-13T12:02:19+01:00;2026-02-13T12:02:19+01:00;;dpa Niedersachsen;false
e229ef239b2ce6e8fa49537b4e09df683be54c613475805de999d9a9082cc00a;Hamburgs Handballer verpflichten Noah Beyer;https://www.zeit.de/news/2026-02/13/hamburgs-handballer-verpflichten-noah-beyer;Hier finden Sie Informationen zu dem Thema „Handball-Bundesliga“. Lesen Sie jetzt „Hamburgs Handballer verpflichten Noah Beyer“.;Handball-Bundesliga;News, Handball-Bundesliga, Noah Beyer, Casper Mortensen, Hamburg, Handball-Bundesliga, Vertragsende;2026-02-13T12:00:04+01:00;2026-02-13T12:00:04+01:00;;dpa Hamburg/Schleswig-Holstein;false
58c0dc11449ad2170c9ca911fd8c1fa26fc46468f38c6a3f2b50624531e42521;"Heidenheim vor Augsburg: Rettung nur mit ""innerer Stärke""";https://www.zeit.de/news/2026-02/13/heidenheim-vor-augsburg-rettung-nur-mit-innerer-staerke;"Hier finden Sie Informationen zu dem Thema „Fußball-Bundesliga“. Lesen Sie jetzt „Heidenheim vor Augsburg: Rettung nur mit ""innerer Stärke""“.";Fußball-Bundesliga;News, Fußball-Bundesliga, Frank Schmidt, Heidenheim, Augsburg, Borussia Dortmund, 1. FC Heidenheim, FC Augsburg, DAZN, Fußball-Bundesliga, Rettung;2026-02-13T11:56:21+01:00;2026-02-13T11:56:21+01:00;;dpa Baden-Württemberg;false
a5cdc0020a601432c0c858203bbca3020a72f50dd0e0ff6d94b08a006022ac74;Steuererklärung mit einem Klick startet ab Juli für bestimmte Personen;https://www.zeit.de/geld/2026-02/steuererklaerung-app-finanzamt-deutschland-bundeslaender;Ab Juli soll die Steuererklärung per App und mit nur einem Klick für 11,5 Millionen Menschen möglich sein. Lohnsteuerhilfen warnen vor finanziellen Nachteilen.;Steuererklärung;Geld, Steuererklärung, Steuererklärung, Finanzen, Finanzamt, App;2026-02-13T11:53:47+01:00;2026-02-13T11:53:47+01:00;ngo;DIE ZEIT,        dpa,        							ngo;false
91ad20a9267dbd9173e41fe9daad2164ae6cee9c248b6aae9622f9556f30484c;Die AfD ist eine Gefahr für Demokratie und Wohlstand;https://www.zeit.de/wirtschaft/2026-02/afd-wirtschaftspolitik-oekonomie-demokratie-gesellschaft;Die AfD-Ideologie ist eine Gefahr für die Demokratie. Sie nutzt ein Menschenbild, das von Angst geprägt ist, und ökonomische Konzepte, die Wohlstand vernichten würden.;Wirtschaftspolitik der AfD;Wirtschaft, Wirtschaftspolitik der AfD, Wirtschaftspolitik, Alternative für Deutschland, Ökonomie, Demokratie, Angst;2026-02-13T11:51:18+01:00;2026-02-13T11:51:18+01:00;Marcel Fratzscher;;false
c5c54636c6bfb41a8ef7340bdb874a0356d6f62ff25af2bf11b536199532bb8b;Anklage: Mann soll Ehefrau mit Giftspritze angegriffen haben;https://www.zeit.de/news/2026-02/13/anklage-mann-soll-ehefrau-mit-giftspritze-angegriffen-haben;Hier finden Sie Informationen zu dem Thema „Staatsanwaltschaft Paderborn“. Lesen Sie jetzt „Anklage: Mann soll Ehefrau mit Giftspritze angegriffen haben“.;Staatsanwaltschaft Paderborn;News, Staatsanwaltschaft Paderborn, Paderborn, Staatsanwaltschaft, Giftspritze, Anklage;2026-02-13T11:50:59+01:00;2026-02-13T11:50:59+01:00;;dpa Nordrhein-Westfalen;false
8552452732bdcfecf9eb07ab2d1efae776e2c4371d68d43ac1b59f654c5986df;"Kalorien-Exzess, Kater-Killer: Hype um den ""Taxi-Teller""";https://www.zeit.de/news/2026-02/13/kalorien-exzess-kater-killer-hype-um-den-taxi-teller;"Hier finden Sie Informationen zu dem Thema „Fast Food der besonderen Art“. Lesen Sie jetzt „Kalorien-Exzess, Kater-Killer: Hype um den ""Taxi-Teller""“.";Fast Food der besonderen Art;News, Fast Food der besonderen Art, Dat Ding, Antonija Dreznjak, Stuttgart, Schweiz, Esse-Stoppenberg, Mayo, Ruhrgebiet, Porta Westfalica, Landsmannschaft im CC Sorabia-Westfalen zu Münster, TikTok;2026-02-13T11:49:56+01:00;2026-02-13T11:49:56+01:00;;dpa;false
2985fa659b1b88ce18f87eaa92e5f72630227913216a6a7c1544e0efdf79a8e5;Fördergeld für Ganzjahrestourismus;https://www.zeit.de/news/2026-02/13/foerdergeld-fuer-ganzjahrestourismus;Hier finden Sie Informationen zu dem Thema „Tourismus“. Lesen Sie jetzt „Fördergeld für Ganzjahrestourismus“.;Tourismus;News, Tourismus, Ganzjahrestourismus, Fördergeld, Tourismusangebot, Förderprogramm, Freistaat, Tourismus;2026-02-13T11:46:41+01:00;2026-02-13T11:46:41+01:00;;dpa Sachsen;false
0873129af0d5667a9dd2d1bb159e57ccd85f6dcea960627bddfb0726743ff369;Friede, Fastnacht, Feuerspatzen;https://www.zeit.de/zeit-magazin/wochenmarkt/2026-02/fraenkische-feuerspatzen-schmalzgebaeck-hefegebaeck-rezept;Im Spätmittelalter galt Nürnberg als Fastnachtshochburg. Die fränkischen Feuerspatzen erinnern bis heute an diese Zeit. Am besten schmecken sie, wenn sie noch warm sind.;"Z+ (abopflichtiger Inhalt);
        
    Fränkische Feuerspatzen";vegetarische Rezepte, Desserts, Fingerfood, Party-Rezept;2026-02-13T11:42:28+01:00;2026-02-13T11:42:28+01:00;Gabriele Hussenether;;false
0add4cd145caef79a48b5e6ccf9680f8603700eeab6d53f059ce6ece4cb2c5f4;Linke: Geflüchtete in leerstehenden Wohnungen unterbringen;https://www.zeit.de/news/2026-02/13/linke-gefluechtete-in-leerstehenden-wohnungen-unterbringen;Hier finden Sie Informationen zu dem Thema „Migration“. Lesen Sie jetzt „Linke: Geflüchtete in leerstehenden Wohnungen unterbringen“.;Migration;News, Migration, Juliane Nagel, Dresden, Migration, Gemeinschaftsunterkunft, Unterbringung, Geflüchtete;2026-02-13T11:38:22+01:00;2026-02-13T11:38:22+01:00;;dpa Sachsen;false
86bbbcab06bb360e94aa5da4407f976823b7d4b57090fc276997d3db019ec997;Unbekannte überfallen Mann im Schlafzimmer – Opfer verletzt;https://www.zeit.de/news/2026-02/13/unbekannte-ueberfallen-mann-im-schlafzimmer-opfer-verletzt;Hier finden Sie Informationen zu dem Thema „Angriff im Wohnhaus“. Lesen Sie jetzt „Unbekannte überfallen Mann im Schlafzimmer – Opfer verletzt“.;Angriff im Wohnhaus;News, Angriff im Wohnhaus, Angriff;2026-02-13T11:37:20+01:00;2026-02-13T11:37:20+01:00;;dpa Nordrhein-Westfalen;false
db39d47dcee99fcdab474e8bf558b473deb9b707c887a792303a4249cd078991;Mutmaßlich gestohlener Tresor bei tödlichem Unfall entdeckt;https://www.zeit.de/news/2026-02/13/mutmasslich-gestohlener-tresor-bei-toedlichem-unfall-entdeckt;Hier finden Sie Informationen zu dem Thema „Südniedersachsen“. Lesen Sie jetzt „Mutmaßlich gestohlener Tresor bei tödlichem Unfall entdeckt“.;Südniedersachsen;News, Südniedersachsen, Südniedersachsen, Northeim, Polizei, Unfall, Tresor;2026-02-13T11:35:59+01:00;2026-02-13T11:35:59+01:00;;dpa Niedersachsen;false
75c6a7409aad95257287908b173bb2b298ce58cbf67c032ba9a548d01ae6d3f3;Mehrheit der Eltern beklagt Ausfälle bei Kinderbetreuung;https://www.zeit.de/gesellschaft/2026-02/studie-kinderbetreuung-hans-boeckler-stiftung-gxe;Mehr als die Hälfte der Familien in Deutschland ist laut einer Studie von Betreuungsausfällen betroffen. Viele Eltern müssen ihre Arbeitszeit reduzieren.;Studie;Gesellschaft, Studie, Eltern, Kinder, Familie, Kinderbetreuung, Hans-Böckler-Stiftung, Studie;2026-02-13T11:35:09+01:00;2026-02-13T11:35:09+01:00;cga;DIE ZEIT,        KNA,        AFP,        							cga;false
dc2bf71a3678c343fb5c593a4e9e39f69e0ee411d8a9a3368a89adff79afb280;"Wie geht's weiter mit Neuer? Bayern sehen ""keinen Stress""";https://www.zeit.de/news/2026-02/13/wie-geht-s-weiter-mit-neuer-bayern-sehen-keinen-stress;"Hier finden Sie Informationen zu dem Thema „Fußball-Bundesliga“. Lesen Sie jetzt „Wie geht's weiter mit Neuer? Bayern sehen ""keinen Stress""“.";Fußball-Bundesliga;News, Fußball-Bundesliga, Vincent Kompany, Christoph Freund, Manuel Neuer, Bremen, München, FC Bayern München, Fußball-Bundesliga, Bundesliga, Stress, Fußballnationalmannschaft;2026-02-13T11:34:21+01:00;2026-02-13T11:34:21+01:00;;dpa Bayern;false
8f40367c701b594c21451a645d52e7b3d554ee277ca2fef477e3f6d0921128e1;"""Als ich fragte, wie es ihnen geht, antworteten sie: Ich will mich nicht beschweren, ich lebe""";https://www.zeit.de/2026/07/brandkatastrophe-crans-montana-psychische-betreuung-trauma;Die Psychiaterin Nuria Bonvin-Mullor kümmerte sich in der Brandnacht von Crans-Montana um die verletzten Jugendlichen. Wie finden sie wieder Vertrauen ins Leben?;"Z+ (abopflichtiger Inhalt);
        
    Brandkatastrophe in Crans-Montana";Gesundheit, Brandkatastrophe in Crans-Montana, Crans-Montana, Trauma, Brand, Schweiz, Psychologie;2026-02-13T11:34:08+01:00;2026-02-13T11:34:08+01:00;Salome Müller;Aus der        ZEIT Nr. 07/2026;false
b7705e3b4bfc06184142992d6896a30d448af23032b2a79b2607aa0439c9cab7;Wadephul kündigt selbstbewussten Umgang mit USA an;https://www.zeit.de/politik/ausland/2026-02/muenchner-sicherheitskonferenz-johann-wadephul-aussenminister-nato-usa-gxe;"Die Nato stehe unter Druck, sagt Außenminister Johann Wadephul. Auf der Münchner Sicherheitskonferenz will er der US-Delegation klarmachen, ""was auf dem Spiel steht"". ";Münchner Sicherheitskonferenz;Politik, Münchner Sicherheitskonferenz, Johann Wadephul, Münchner Sicherheitskonferenz, Marco Rubio, USA, Nato, Außenminister;2026-02-13T11:33:42+01:00;2026-02-13T11:33:42+01:00;als;DIE ZEIT,        dpa,        AFP,        							als;false
85b95495221cb7bee8455a9806fabb75b5288a3856b3fcbf8e74199f4d001ba4;"""Überwältigt"": Sharon Stone verlässt kurzzeitig Opernball";https://www.zeit.de/news/2026-02/12/ueberwaeltigt-sharon-stone-verlaesst-kurzzeitig-opernball;"Hier finden Sie Informationen zu dem Thema „Gesellschaft“. Lesen Sie jetzt „""Überwältigt"": Sharon Stone verlässt kurzzeitig Opernball“.";Gesellschaft;News, Gesellschaft, Sharon Stone, Karl Guschlbauer, Fran Drescher, ORF, Wiener Opernball, Opernball, Hollywood, Süßwaren;2026-02-13T11:33:40+01:00;2026-02-13T11:33:40+01:00;;dpa;false
fb0d91a0b9fd5ac37df0f8c9e7e0a64067e15f7b0132830ba9c7c23876a2e1dc;Ines Claus will Stellvertreterin von CDU-Chef Merz werden;https://www.zeit.de/news/2026-02/13/ines-claus-will-stellvertreterin-von-cdu-chef-merz-werden;Hier finden Sie Informationen zu dem Thema „CDU“. Lesen Sie jetzt „Ines Claus will Stellvertreterin von CDU-Chef Merz werden“.;CDU;News, CDU, Ines Claus, Friedrich Merz, Stuttgart, CDU;2026-02-13T11:31:18+01:00;2026-02-13T11:31:18+01:00;;dpa Hessen;false
3c8a27b27b0d889e8304aaff7fa9602f52dd5165cd112ccc182c9d8b43966e4c;Statistisches Bundesamt meldet Rückgang bei Unternehmensinsolvenzen;https://www.zeit.de/wirtschaft/2026-02/unternehmensinsolvenzen-deutschland-statistisches-bundesamt-zahlen-gxe;Im November 2025 sind in Deutschland weniger Firmen insolvent gegangen als im vorherigen Monat. Es ist der niedrigste Monatswert im gesamten Jahresverlauf.;Wirtschaftslage in Deutschland;Wirtschaft, Wirtschaftslage in Deutschland, DIHK, Statistisches Bundesamt, Unternehmen, Insolvenz, Wirtschaftswachstum;2026-02-13T11:31:15+01:00;2026-02-13T11:31:15+01:00;lgi;DIE ZEIT,        AFP,        Reuters,        dpa,        							lgi;false
222de6d759d6d6eebdc50d20e14fe5ba493ff197dbcf074ba448dcb71c1e0b50;Wintereinbruch zum Valentinstag – DWD warnt vor Glätte;https://www.zeit.de/news/2026-02/13/winterlich-und-glatt-schnee-zum-wochenende-erwartet;Hier finden Sie Informationen zu dem Thema „Wettervorhersage“. Lesen Sie jetzt „Wintereinbruch zum Valentinstag – DWD warnt vor Glätte“.;Wettervorhersage;News, Wettervorhersage, Baden-Württemberg, Rhein, DWD, Wettervorhersage, Südwesten, Wetter;2026-02-13T11:28:42+01:00;2026-02-13T11:28:42+01:00;;dpa Baden-Württemberg;false
bd199bd50835763f85a6addd3d4aa2576dbad08d144fc5bf6806aead5454b187;Profs, werdet Gründer!;https://www.zeit.de/2026/07/technologietransfer-innovation-wissen-ausgruendungen-patente-efi;Deutschlands Forschung soll die Wirtschaft retten. Machbar. Aber dafür muss sich einiges ändern, sagen ein Wirtschaftsprofessor und eine Professorin für Entrepreneurship.;"Z+ (abopflichtiger Inhalt);
        
    Technologietransfer";Wissen, Technologietransfer, Technologie, Forschung, Hochschule, Bundesregierung, Impfstoff;2026-02-13T11:25:40+01:00;2026-02-13T11:25:40+01:00;Guido BünstorfCarolin Häussler;Aus der        ZEIT Nr. 07/2026;false
5a037ee01fc44458573f410eef6a992908a1501faca945483dc177095d8a3aea;Gipfeltreffen für mehr Sicherheit bei der Bahn hat begonnen;https://www.zeit.de/politik/2026-02/bahn-sicherheit-personal-schuetzen-gipfel-evelyn-palla-gxe;In Berlin beraten Vertreter von Bahn und Politik über mehr Sicherheit für Bahnbeschäftigte. Schaffner können zum eigenen Schutz künftig freiwillig Bodycams tragen.;Bahn-Sicherheit;Politik, Bahn-Sicherheit, Fernverkehr, Deutsche Bahn, Evelyn Palla, Berlin, Gewerkschaft;2026-02-13T11:20:30+01:00;2026-02-13T11:20:30+01:00;hell;DIE ZEIT,        dpa,        							hell;false
9ffd7cff7f358927f8711ade2407d280d8126d9e5050c9c840f186787b701533;Das haben Berlins Grüne im Wahlprogramm vor;https://www.zeit.de/news/2026-02/13/das-haben-berlins-gruene-im-wahlprogramm-vor;Hier finden Sie Informationen zu dem Thema „Parteien“. Lesen Sie jetzt „Das haben Berlins Grüne im Wahlprogramm vor“.;Parteien;News, Parteien, Berlin, Treffen, Programmentwurf, Wahlprogramm, Parteitag, Geld;2026-02-13T11:17:56+01:00;2026-02-13T11:17:56+01:00;;dpa Berlin/Brandenburg;false
224711fd0b580dd4ecc147c0d9dad97cc850b9788217b4c3c9d74fe4c3d1f836;Lampe zu heiß - 91-Jähriger stirbt bei Brand;https://www.zeit.de/news/2026-02/13/lampe-zu-heiss-91-jaehriger-stirbt-bei-brand;Hier finden Sie Informationen zu dem Thema „Brand in Schwaben“. Lesen Sie jetzt „Lampe zu heiß - 91-Jähriger stirbt bei Brand“.;Brand in Schwaben;News, Brand in Schwaben, Polizei, Halogenlampe;2026-02-13T11:16:35+01:00;2026-02-13T11:16:35+01:00;;dpa Bayern;false
18fccbacc3d9c3d22d01b455d553d9e9217d937a93acc610e908c7f40146b5df;Volksbankkunden investieren stärker in Aktien;https://www.zeit.de/news/2026-02/13/volksbankkunden-investieren-staerker-in-aktien;Hier finden Sie Informationen zu dem Thema „Finanzieren und sparen“. Lesen Sie jetzt „Volksbankkunden investieren stärker in Aktien“.;Finanzieren und sparen;News, Finanzieren und sparen, Heino, Sachsen-Anhalt, Raiffeisenbank, Aktien, Kryptowährung;2026-02-13T11:09:57+01:00;2026-02-13T11:09:57+01:00;;dpa Sachsen;false
0234e9e049a1080910130cac6a80d7433f6f902bc0e94d42b071d7296721398b;"""Vor lauter Wut spuckte der Mann mir ins Gesicht""";https://www.zeit.de/arbeit/2026-02/angriffe-bahnpersonal-zugbegleiter-lokfuehrer-bahn-gewalt;Der Respekt schwindet, die Gewalt eskaliert: Zwei Bahnmitarbeiter erzählen, was sie täglich in den Zügen erleben. Und von den anderen Fahrgästen, die stumm zuschauen.;"Z+ (abopflichtiger Inhalt);
        
    Angriffe auf Bahnpersonal";Arbeit, Angriffe auf Bahnpersonal, Fernverkehr, Deutsche Bahn, Bahnhof, Kriminalität, Polizei;2026-02-13T11:08:33+01:00;2026-02-13T11:08:33+01:00;Benjamin EmontsAnne Jeschke;;false
aa1f15c90cec52571bc6805344eb5bbe3af2a6e8f1fbfb910ab9638b1227ecbb;Warum in Erfurter Bussen nicht mehr bar bezahlt werden kann;https://www.zeit.de/news/2026-02/13/warum-in-erfurter-bussen-nicht-mehr-bar-bezahlt-werden-kann;Hier finden Sie Informationen zu dem Thema „Öffentlicher Nahverkehr“. Lesen Sie jetzt „Warum in Erfurter Bussen nicht mehr bar bezahlt werden kann“.;Öffentlicher Nahverkehr;News, Öffentlicher Nahverkehr, EVAG, Nahverkehr, Verkehrsbetrieb, Bargeld;2026-02-13T11:08:04+01:00;2026-02-13T11:08:04+01:00;;dpa Thüringen;false
2b48ae80e8b07fef546c0f3b4b37035f21058143a2651dad8a76d5e652e99978;Nord-SPD fordert Reform des Ehegattensplittings;https://www.zeit.de/news/2026-02/13/nord-spd-fordert-reform-des-ehegattensplittings;Hier finden Sie Informationen zu dem Thema „Nachteilige Erwerbsanreize“. Lesen Sie jetzt „Nord-SPD fordert Reform des Ehegattensplittings“.;Nachteilige Erwerbsanreize;News, Nachteilige Erwerbsanreize, Beate Raudies, Schleswig-Holstein, SPD, Ehegattensplitting, Erwerbsanreiz;2026-02-13T11:07:04+01:00;2026-02-13T11:07:04+01:00;;dpa Hamburg/Schleswig-Holstein;false
76b425be0855ab284ef5e1df46cb9fc8d2a50faad7842ebee0f97a82d5371b18;UN-Berichterstatterin Francesca Albanese lehnt Rücktritt ab;https://www.zeit.de/politik/ausland/2026-02/nahost-konflikt-israel-francesca-albanese-un-ruecktritt-kritik-gxe;"Die UN-Berichterstatterin für die Palästinensergebiete sprach mit Bezug auf Israel von einem ""Feind"". Rücktrittsforderungen Deutschlands und Frankreichs weist sie ab.";Nahostkonflikt;Politik, Nahostkonflikt, UN, Nahostkonflikt, Israel, Palästinensergebiet, Frankreich, Bundesrepublik Deutschland;2026-02-13T11:03:27+01:00;2026-02-13T11:03:27+01:00;ale;DIE ZEIT,        dpa,        KNA,        							ale;false
0e36cee801d78314a60f934d3fee7b0e4631703177869ef8e248e9d51fec655e;Soldat leistete nach Attacke auf Zugbegleiter Erste Hilfe;https://www.zeit.de/news/2026-02/13/soldat-leistete-nach-attacke-auf-zugbegleiter-erste-hilfe;Hier finden Sie Informationen zu dem Thema „Angriff in Regionalzug“. Lesen Sie jetzt „Soldat leistete nach Attacke auf Zugbegleiter Erste Hilfe“.;Angriff in Regionalzug;News, Angriff in Regionalzug, Rheinland-Pfalz, Zweibrücken, Attacke, Angriff;2026-02-13T11:03:23+01:00;2026-02-13T11:03:23+01:00;;dpa Rheinland-Pfalz/Saarland;false
e1b520ffed6a7dd5f49a1636bde72ce28cc61cafcdea35ceec7376519faebd54;Zoll stoppt verdächtige Cashewkerne und Kosmetik in Kassel;https://www.zeit.de/news/2026-02/13/zoll-stoppt-verdaechtige-cashewkerne-und-kosmetik-in-kassel;Hier finden Sie Informationen zu dem Thema „Mehrere Tonnen Ware“. Lesen Sie jetzt „Zoll stoppt verdächtige Cashewkerne und Kosmetik in Kassel“.;Mehrere Tonnen Ware;News, Mehrere Tonnen Ware, Elfenbeinküste, Kassel, Cashewkern, Kosmetikprodukt, Hauptzollamt, Einfuhrsendung, Kosmetik, Lebensmittel;2026-02-13T11:00:44+01:00;2026-02-13T11:00:44+01:00;;dpa Hessen;false
25170eede024d30b0a8c7c1c6e66e0321283e7c45b18a5ae81e128ea2d138ccb;Koalition will Modellkommunen von Bürokratie befreien;https://www.zeit.de/news/2026-02/13/koalition-will-modellkommunen-von-buerokratie-befreien;Hier finden Sie Informationen zu dem Thema „Bürokratieabbau“. Lesen Sie jetzt „Koalition will Modellkommunen von Bürokratie befreien“.;Bürokratieabbau;News, Bürokratieabbau, Klaus Holetschek, München, CSU, Modellkommune, Bürokratieabbau, Bürokratie, Modellregion, Kommune, Koalition;2026-02-13T10:59:27+01:00;2026-02-13T10:59:27+01:00;;dpa Bayern;false
651275572457b6f1f7dc982eccfe1c90d49a5eca03c06adc5ed0be636795775b;Transfer-Coup: Wetzlar holt Palicka und Allendorf;https://www.zeit.de/news/2026-02/13/transfer-coup-wetzlar-holt-palicka-und-allendorf;Hier finden Sie Informationen zu dem Thema „Handball-Bundesliga“. Lesen Sie jetzt „Transfer-Coup: Wetzlar holt Palicka und Allendorf“.;Handball-Bundesliga;News, Handball-Bundesliga, Andreas Palicka, Björn Seipp, Wetzlar, Allendorf, Handball-Bundesliga, HSG Wetzlar, Bundesliga, Sommer;2026-02-13T10:54:55+01:00;2026-02-13T10:54:55+01:00;;dpa Hessen;false
f8e5078a21c2f9de07b25e551d9651de11316d6e77ce6364d98376afeaf3dd19;Freier Eintritt in Schlössern durch Kuss an der Kasse;https://www.zeit.de/news/2026-02/13/freier-eintritt-in-schloessern-durch-kuss-an-der-kasse;Hier finden Sie Informationen zu dem Thema „Valentinstag“. Lesen Sie jetzt „Freier Eintritt in Schlössern durch Kuss an der Kasse“.;Valentinstag;News, Valentinstag, Bruchsal, Ludwigsburg, Baden-Württemberg, Valentinstag, Eintritt, Schlosstor, Liebe;2026-02-13T10:43:59+01:00;2026-02-13T10:43:59+01:00;;dpa Baden-Württemberg;false
00b79f64bc9c14969c443b2cf4ba76fcdcc2870335deccb2c93afc4e7a9cf3de;Flughafen Köln/Bonn öffnet nach Sicherheitsvorfall wieder;https://www.zeit.de/gesellschaft/2026-02/flugverkehr-flughafen-koeln-bonn-sicherheitsvorfalls-gxe;Wegen eines Sicherheitsvorfalls wurde der Betrieb am Flughafen Köln/Bonn kurzfristig gestoppt. Akute Gefahr bestand laut der Bundespolizei aber nicht.;Flugverkehr;Gesellschaft, Flugverkehr, Bonn, Köln, Flughafen, Flugverkehr, Bundespolizei;2026-02-13T10:35:35+01:00;2026-02-13T10:35:35+01:00;mns;DIE ZEIT,        dpa,        							mns;false
862011375a7dd08d2525ee729564fa14bf13a04ff82919da65b9a29a8f6cc027;Bauarbeiten sorgen für Haltausfälle bei der RB26;https://www.zeit.de/news/2026-02/13/bauarbeiten-sorgen-fuer-haltausfaelle-bei-der-rb26;Hier finden Sie Informationen zu dem Thema „Regionalverkehr“. Lesen Sie jetzt „Bauarbeiten sorgen für Haltausfälle bei der RB26“.;Regionalverkehr;News, Regionalverkehr, Deutz, Köln, Bonn, Haltausfall, Regionalverkehr, Mittelrheinbahn;2026-02-13T10:35:00+01:00;2026-02-13T10:35:00+01:00;;dpa Nordrhein-Westfalen;false
1d44d1357c419db305bb7e3216bc782b692408138fcb8029ebde893b3712e72e;Aber Hitler mochte ihn nicht;https://www.zeit.de/2026/07/herbert-von-karajan-nationalsozialismus-nsdap-michael-wolffsohn;War der weltberühmte Stardirigent Herbert von Karajan ein Nazi? Der Historiker Michael Wolffsohn rollt diese Frage in seinem neuen Buch noch einmal ganz neu auf.;"Z+ (abopflichtiger Inhalt);
        
    Herbert von Karajan";Kultur, Herbert von Karajan, Herbert von Karajan, Michael Wolffsohn, Salzburg, St. Moritz, Ulm, Berlin, Wien, Aachen, NSDAP, Berliner Philharmoniker;2026-02-13T10:34:29+01:00;2026-02-13T10:34:29+01:00;Christine Lemke-Matwey;Aus der        ZEIT Nr. 07/2026;false
db3f37142bc9443f9086e55e3f11243870a412b30639732ccb29424b842d29b9;Giftiger Stoff tropft aus Tank - Drei Verletzte im Hafen;https://www.zeit.de/news/2026-02/13/giftiger-stoff-tropft-aus-tank-drei-verletzte-im-hafen;Hier finden Sie Informationen zu dem Thema „Einsatz im JadeWeserPort“. Lesen Sie jetzt „Giftiger Stoff tropft aus Tank - Drei Verletzte im Hafen“.;Einsatz im JadeWeserPort;News, Einsatz im JadeWeserPort, Wilhelmshaven, JadeWeserPort;2026-02-13T10:32:09+01:00;2026-02-13T10:32:09+01:00;;dpa Niedersachsen;false
0ec32c36cb5838ef8a99311dba7e8b3c545df5443e2c8677cdfeed86350d8818;Kreise: Bodycams für Bahnbeschäftigte auch im Fernverkehr;https://www.zeit.de/news/2026-02/13/kreise-bodycams-fuer-bahnbeschaeftigte-auch-im-fernverkehr;Hier finden Sie Informationen zu dem Thema „Nach tödlichem Angriff“. Lesen Sie jetzt „Kreise: Bodycams für Bahnbeschäftigte auch im Fernverkehr“.;Nach tödlichem Angriff;News, Nach tödlichem Angriff, Evelyn Palla, Bodycam, Fernverkehr, Angriff;2026-02-13T10:28:54+01:00;2026-02-13T10:28:54+01:00;;dpa;false
