Hash;Title;Link;Description;Category;KeyWords;Published;LastUpdated;Author;Source;Paywall
6f75a86e18bbcd4c8a26291d275b79ba3708d243774214898ab7808d0e5b1414;Sané bei EM dabei: Aber kein Ticket für Hummels und Goretzka;https://www.zeit.de/news/2024-05/14/san-bekommt-em-ticket-in-kunsthalle;Hier finden Sie Informationen zu dem Thema „Nationalmannschaft“. Lesen Sie jetzt „Sané bei EM dabei: Aber kein Ticket für Hummels und Goretzka“.;"Z+ (abopflichtiger Inhalt);
        
    
Nationalmannschaft";News, Nationalmannschaft, Leroy Sané, München, FC Bayern München, Kunsthalle, Nationalmannschaft;2024-05-14T15:36:08+02:00;2024-05-14T15:36:08+02:00;;dpa;false
362a2a5a5a3b15466d5fbe03e6a551aba6b78c3bb7937bb8b9fd27234aa7d4da;Spionage: Haft für AfD-nahen Offizier gefordert;https://www.zeit.de/news/2024-05/14/dreieinhalb-jahre-haft-fuer-spionage-von-offizier-gefordert;Hier finden Sie Informationen zu dem Thema „Bundesanwaltschaft“. Lesen Sie jetzt „Spionage: Haft für AfD-nahen Offizier gefordert“.;"Z+ (abopflichtiger Inhalt);
        
    
Bundesanwaltschaft";News, Bundesanwaltschaft, Russland, Bundesanwaltschaft, Alternative für Deutschland, Spionage, Krieg in der Ukraine;2024-05-14T15:34:38+02:00;2024-05-14T15:34:38+02:00;;dpa Rheinland-Pfalz/Saarland;false
d04f72d3ccc40e9dd03882074a49758037bdb7567b0b6febb297fc960d4afe62;Neues Lagebild Islamismus warnt vor Online-Radikalisierung;https://www.zeit.de/news/2024-05/13/nrw-innenminister-stellt-lagebild-islamismus-vor;Hier finden Sie Informationen zu dem Thema „Extremismus“. Lesen Sie jetzt „Neues Lagebild Islamismus warnt vor Online-Radikalisierung“.;"Z+ (abopflichtiger Inhalt);
        
    
Extremismus";News, Extremismus, Herbert Reul, NRW, Nordrhein-Westfalen, CDU, Lagebild, Islamismus, Extremismus;2024-05-14T15:34:12+02:00;2024-05-14T15:34:12+02:00;;dpa Nordrhein-Westfalen;false
7d7931454c28d0cea840b44d3d53c65a8678902610f6ffc6ca296d444bc58a36;"""Tage des Verrats"" - Haft für AfD-nahen Offizier gefordert";https://www.zeit.de/news/2024-05/14/dreieinhalb-jahre-haft-fuer-afd-nahen-offizier-gefordert;"Hier finden Sie Informationen zu dem Thema „Spionage“. Lesen Sie jetzt „""Tage des Verrats"" - Haft für AfD-nahen Offizier gefordert“.";"Z+ (abopflichtiger Inhalt);
        
    
Spionage";News, Spionage, Russland, Alternative für Deutschland, Bundesanwaltschaft, Spionage, Krieg in der Ukraine;2024-05-14T15:33:23+02:00;2024-05-14T15:33:23+02:00;;dpa Nordrhein-Westfalen;false
ca2eda27c949f114d07e141e2691c345d9f5931fe33a70eae8e7a0d8fa32f266;Verfahren wegen Aufruf zur Ausrottung der AfD eingestellt;https://www.zeit.de/news/2024-05/13/mann-wegen-aufrufs-zur-ausrottung-der-afd-vor-gericht;Hier finden Sie Informationen zu dem Thema „Prozess“. Lesen Sie jetzt „Verfahren wegen Aufruf zur Ausrottung der AfD eingestellt“.;"Z+ (abopflichtiger Inhalt);
        
    
Prozess";News, Prozess, Augsburg, Alternative für Deutschland, Amtsgericht, Ausrottung, Aufruf, Strafjustizzentrum;2024-05-14T15:32:31+02:00;2024-05-14T15:32:31+02:00;;dpa Bayern;false
e276ad6cef3bcd4344006562c24057475ef17e51fdb7232706f5462f5c243473;Lilienthal wird Leiter der Lessingtage am Thalia Theater;https://www.zeit.de/news/2024-05/14/lilienthal-wird-leiter-der-lessingtage-am-thalia-theater;Hier finden Sie Informationen zu dem Thema „Hamburg“. Lesen Sie jetzt „Lilienthal wird Leiter der Lessingtage am Thalia Theater“.;"Z+ (abopflichtiger Inhalt);
        
    
Hamburg";News, Hamburg, Matthias Lilienthal, Sonja Anders, Hamburg, Thalia Theater Hamburg, Thalia Theater, Münchner Kammerspiele, Lessingtag, Malsaal;2024-05-14T15:31:54+02:00;2024-05-14T15:31:54+02:00;;dpa Hamburg/Schleswig-Holstein;false
0a31cf23f428e3cd1336c31a19925dc8d1d232ee2e77afeb3583670814c54865;Mittelstädt in deutschen EM-Kader berufen;https://www.zeit.de/news/2024-05/14/mittelstaedt-in-deutschen-em-kader-berufen;Hier finden Sie Informationen zu dem Thema „Nationalmannschaft“. Lesen Sie jetzt „Mittelstädt in deutschen EM-Kader berufen“.;"Z+ (abopflichtiger Inhalt);
        
    
Nationalmannschaft";News, Nationalmannschaft, Maximilian Mittelstädt, Joshua Kimmich, Nationalmannschaft;2024-05-14T15:31:32+02:00;2024-05-14T15:31:32+02:00;;dpa Sport;false
7b753b9e945956d70edd7e3a25ddc295d77234b58734da2155fb887efe090a60;Bremer Regierung will Bauregeln vereinfachen;https://www.zeit.de/news/2024-05/14/bremer-regierung-will-bauregeln-vereinfachen;Hier finden Sie Informationen zu dem Thema „Senat“. Lesen Sie jetzt „Bremer Regierung will Bauregeln vereinfachen“.;"Z+ (abopflichtiger Inhalt);
        
    
Senat";News, Senat, Susanne Schmitt, Bremen, Bauregel, Senat, Leitbake;2024-05-14T15:31:11+02:00;2024-05-14T15:31:11+02:00;;dpa Niedersachsen;false
a0eb674ab8a4a8f7cd211935b4be7f651fc49f1972beb9dfbf406a2ae4a6ca3c;Scholz fordert Erhöhung des Mindestlohns auf 15 Euro;https://www.zeit.de/news/2024-05/14/scholz-fordert-erhoehung-des-mindestlohns-auf-15-euro;Hier finden Sie Informationen zu dem Thema „Arbeit“. Lesen Sie jetzt „Scholz fordert Erhöhung des Mindestlohns auf 15 Euro“.;"Z+ (abopflichtiger Inhalt);
        
    
Arbeit";News, Arbeit, Olaf Scholz, SPD, Bundestagswahl, Wahlversprechen, Mindestlohn, Kritik;2024-05-14T15:28:39+02:00;2024-05-14T15:28:39+02:00;;dpa;false
82b25d668fb0d02a2125ec48db06448e619f028f58500f7abe623ee86e2096f0;Hessentagspaar wirbt im Landtag für Landesfest;https://www.zeit.de/news/2024-05/14/hessentagspaar-wirbt-im-landtag-fuer-landesfest;Hier finden Sie Informationen zu dem Thema „Hessentag“. Lesen Sie jetzt „Hessentagspaar wirbt im Landtag für Landesfest“.;"Z+ (abopflichtiger Inhalt);
        
    
Hessentag";News, Hessentag, Hartmut Spogat, Fritzlar, CDU, Hessentagspaar, Landesfest, Hessentag, Landtag;2024-05-14T15:26:06+02:00;2024-05-14T15:26:06+02:00;;dpa Hessen;false
e2aef50c6258cdf16f4a302cda6c36a24ca0c992550ec09739ca119f95ee618b;Hamburger Freibadsaison startet: Erstes Sommerfreibad öffnet;https://www.zeit.de/news/2024-05/14/hamburger-freibadsaison-startet-erstes-sommerfreibad-oeffnet;Hier finden Sie Informationen zu dem Thema „Freizeit“. Lesen Sie jetzt „Hamburger Freibadsaison startet: Erstes Sommerfreibad öffnet“.;"Z+ (abopflichtiger Inhalt);
        
    
Freizeit";News, Freizeit, Michael Dietel, Hamburg, Freibadsaison, Sommerfreibad, Fünfmeter, Bäderland, Maiferien, Freizeit;2024-05-14T15:25:16+02:00;2024-05-14T15:25:16+02:00;;dpa Hamburg/Schleswig-Holstein;false
4b1eeb6d7beb6be060d7d09435a31da3c489a525f0326f182d17277b743bfb2f;Neues Gesetz soll AfD-Verfassungsrichter verhindern;https://www.zeit.de/news/2024-05/14/neues-gesetz-soll-afd-verfassungsrichter-verhindern;Hier finden Sie Informationen zu dem Thema „Landtag“. Lesen Sie jetzt „Neues Gesetz soll AfD-Verfassungsrichter verhindern“.;"Z+ (abopflichtiger Inhalt);
        
    
Landtag";News, Landtag, Alternative für Deutschland, Bayerischer Verfassungsgerichtshof, CSU, Freie Wähler, SPD, Landtag, Verfassungsgerichtshof;2024-05-14T15:23:04+02:00;2024-05-14T15:23:04+02:00;;dpa Bayern;false
05b554affe5293fec7dc8c1548877f8e5d6c2a594b042536d431d5014eccb2a3;Umsturzpläne mit Waffengewalt vor Gericht;https://www.zeit.de/news/2024-05/13/27-jaehriger-soll-umsturz-vorbereitet-haben;Hier finden Sie Informationen zu dem Thema „Prozess“. Lesen Sie jetzt „Umsturzpläne mit Waffengewalt vor Gericht“.;"Z+ (abopflichtiger Inhalt);
        
    
Prozess";News, Prozess, Frankfurt, Amtsgericht, Revolution;2024-05-14T15:21:13+02:00;2024-05-14T15:21:13+02:00;;dpa Hessen;false
e1989944c8781280a57e076d0c69ec683d306252b6c9dfe1db94a748622562e4;Traktor rollt los - Mann lebensgefährlich verletzt;https://www.zeit.de/news/2024-05/14/traktor-rollt-los-mann-lebensgefaehrlich-verletzt;Hier finden Sie Informationen zu dem Thema „Kreis Sigmaringen“. Lesen Sie jetzt „Traktor rollt los - Mann lebensgefährlich verletzt“.;"Z+ (abopflichtiger Inhalt);
        
    
Kreis Sigmaringen";News, Kreis Sigmaringen, Sigmaringen, Traktor, Einsatzfahrzeug;2024-05-14T15:19:15+02:00;2024-05-14T15:19:15+02:00;;dpa Baden-Württemberg;false
9e72feaaad8c09a17aa2f2c1bfaa08ca086fcd5fcdd436ea38f86e09f778510e;Bochums Passlack nach Platzverweis für ein Spiel gesperrt;https://www.zeit.de/news/2024-05/14/bochums-passlack-nach-platzverweis-fuer-ein-spiel-gesperrt;Hier finden Sie Informationen zu dem Thema „Bundesliga“. Lesen Sie jetzt „Bochums Passlack nach Platzverweis für ein Spiel gesperrt“.;"Z+ (abopflichtiger Inhalt);
        
    
Bundesliga";News, Bundesliga, Manuel Riemann, Felix Passlack, Bochum, VfL Bochum, Bayer 04 Leverkusen, DFB, Bundesliga, Platzverweis;2024-05-14T15:17:54+02:00;2024-05-14T15:17:54+02:00;;dpa Nordrhein-Westfalen;false
c2838971eb30535c6d037de4cea116cb3c2b430cf690f7fb5e5c06fc3b872657;Senatsempfang für Austeiger St. Pauli am Montag im Rathaus;https://www.zeit.de/news/2024-05/14/senatsempfang-fuer-austeiger-st-pauli-am-montag-im-rathaus;Hier finden Sie Informationen zu dem Thema „2. Bundesliga“. Lesen Sie jetzt „Senatsempfang für Austeiger St. Pauli am Montag im Rathaus“.;"Z+ (abopflichtiger Inhalt);
        
    
2. Bundesliga";News, 2. Bundesliga, Fabian Hürzeler, St. Pauli, St. Paulis, FC St. Pauli, Fußball-Bundesliga, Bundesliga, Senatsempfang;2024-05-14T15:15:59+02:00;2024-05-14T15:15:59+02:00;;dpa Hamburg/Schleswig-Holstein;false
964b9d23d858290636e8f524b35cdb8ded3f06ea746740f15bf065511c0fe71e;Bericht: FC Bayern an Manchesters Fernandes interessiert;https://www.zeit.de/news/2024-05/14/bericht-fc-bayern-an-manchesters-fernandes-interessiert;Hier finden Sie Informationen zu dem Thema „Bundesliga“. Lesen Sie jetzt „Bericht: FC Bayern an Manchesters Fernandes interessiert“.;"Z+ (abopflichtiger Inhalt);
        
    
Bundesliga";News, Bundesliga, Bruno Fernandes, Harry Kane, Manchester, München, Manchester United, FC Bayern München, Bundesliga, Sommer;2024-05-14T15:15:04+02:00;2024-05-14T15:15:04+02:00;;dpa Bayern;false
993f4b9432132fd24218d194436c1164d52162fb34e64b84ac18904d64b75574;Wasserqualität der Badeseen fast überall ausgezeichnet;https://www.zeit.de/news/2024-05/13/wasserqualitaet-der-badeseen-fast-ueberall-ausgezeichnet;Hier finden Sie Informationen zu dem Thema „Saisonstart“. Lesen Sie jetzt „Wasserqualität der Badeseen fast überall ausgezeichnet“.;"Z+ (abopflichtiger Inhalt);
        
    
Saisonstart";News, Saisonstart, Hannover, Niedersachsen, Wasserqualität, Saisonstart, Landesgesundheitsamt, Badesaison, Familie, Wetter;2024-05-14T15:14:12+02:00;2024-05-14T15:14:12+02:00;;dpa Niedersachsen;false
958e4f2e5bc819072d4993d9195c7afcbbbdc13ff2376efbda787fa1b8bfc257;Wie sich die Polizei auf die EM vorbereitet;https://www.zeit.de/news/2024-05/13/so-sicher-wie-moeglich-polizei-probt-einsatzlage-bei-em;Hier finden Sie Informationen zu dem Thema „Fußball“. Lesen Sie jetzt „Wie sich die Polizei auf die EM vorbereitet“.;"Z+ (abopflichtiger Inhalt);
        
    
Fußball";News, Fußball, Stuttgart, Ungarn, Polizei, Fußball-EM, Einsatzlage, Fußball;2024-05-14T15:13:55+02:00;2024-05-14T15:13:55+02:00;;dpa Baden-Württemberg;false
8d02032b4ca1873d0030e35d39638944e453ec5e845dcb3227e31351802d9924;DOSB nominiert die ersten 13 Athleten für Olympia;https://www.zeit.de/news/2024-05/14/dosb-nominiert-die-ersten-13-athleten-fuer-olympia;Hier finden Sie Informationen zu dem Thema „Sommerspiele in Paris“. Lesen Sie jetzt „DOSB nominiert die ersten 13 Athleten für Olympia“.;"Z+ (abopflichtiger Inhalt);
        
    
Sommerspiele in Paris";News, Sommerspiele in Paris, Richard Ringer, Paris, Marathon, DOSB, Deutscher Olympischer Sportbund, Olympia, Olympische Spiele, Sommerspiel, Sommer;2024-05-14T15:13:38+02:00;2024-05-14T15:13:38+02:00;;dpa Sport;false
66d8cf9484827f67a68c2cc23e68bb753c0d4ca3b8d6ff83890ceb8da6747bca;Schärfere EU-Asylregeln endgültig beschlossen;https://www.zeit.de/news/2024-05/14/schaerfere-eu-asylregeln-endgueltig-beschlossen;Hier finden Sie Informationen zu dem Thema „Migration“. Lesen Sie jetzt „Schärfere EU-Asylregeln endgültig beschlossen“.;"Z+ (abopflichtiger Inhalt);
        
    
Migration";News, Migration, EU;2024-05-14T15:13:16+02:00;2024-05-14T15:13:16+02:00;;dpa;false
99eb9ca94bf6c8ceba3cda20572bff7e67630b7e82b105dd421225b36446be4b;Bremen bei Betreuungsquote bundesweit am schlechtesten;https://www.zeit.de/news/2024-05/14/bremen-bei-betreuungsquote-bundesweit-am-schlechtesten;Hier finden Sie Informationen zu dem Thema „Kindertagesstätten“. Lesen Sie jetzt „Bremen bei Betreuungsquote bundesweit am schlechtesten“.;"Z+ (abopflichtiger Inhalt);
        
    
Kindertagesstätten";News, Kindertagesstätten, Bremen, Mecklenburg-Vorpommern, Betreuungsquote, Kindertagesstätte, Kinderschuhe;2024-05-14T15:12:56+02:00;2024-05-14T15:12:56+02:00;;dpa Niedersachsen;false
fbf29e6487491dc180c6f5d4a140ef7af42c68e1574ec2fa4f79ab84bdf57683;Aussitzen wird jetzt richtig teuer;https://www.zeit.de/wirtschaft/2024-05/investitionsbedarf-studie-regierung-klimaschutz-sanierung;Schlechte Straßen, marode Schulen: Der Investitionsbedarf im Land steigt in den nächsten Jahren auf 600 Milliarden Euro an. Führende Ökonomen sehen nur einen Ausweg.;"Z+ (abopflichtiger Inhalt);
        
    
Investitionsbedarf";Wirtschaft, Investitionsbedarf, Ökonomie, Bundesregierung, Stromversorgung, Infrastruktur, Sebastian Dullien, Michael Hüther, Investition, Stromnetz;2024-05-14T15:12:38+02:00;2024-05-14T15:12:38+02:00;Marlies Uken;;false
89383bfbc9f9ed8ce7309cd7bcbabc6a6a592733f4fd1105be47e93d79fdfc64;Schwere Unfälle auf A72 und A4: zwei Tote und ein Verletzter;https://www.zeit.de/news/2024-05/14/transporterfahrer-stirbt-bei-unfall-auf-a72-bei-stollberg;Hier finden Sie Informationen zu dem Thema „Erzgebirgskreis“. Lesen Sie jetzt „Schwere Unfälle auf A72 und A4: zwei Tote und ein Verletzter“.;"Z+ (abopflichtiger Inhalt);
        
    
Erzgebirgskreis";News, Erzgebirgskreis, Polizei, Erzgebirgskreis, Unfall, Blaulicht;2024-05-14T15:11:31+02:00;2024-05-14T15:11:31+02:00;;dpa Sachsen;false
d65455d635982d14812a9dd8140194b8751a5408269c7224b7f60fa2ddc1f759;Marton Dardai und Unions Schäfer im ungarischen EM-Kader;https://www.zeit.de/news/2024-05/14/marton-dardai-und-unions-schaefer-im-ungarischen-em-kader;Hier finden Sie Informationen zu dem Thema „2. Liga“. Lesen Sie jetzt „Marton Dardai und Unions Schäfer im ungarischen EM-Kader“.;"Z+ (abopflichtiger Inhalt);
        
    
2. Liga";News, 2. Liga, Marton, Berlin, Hertha BSC, Hertha BSC Berlin;2024-05-14T15:10:41+02:00;2024-05-14T15:10:41+02:00;;dpa Berlin/Brandenburg;false
79cb424ffcd3d19ffdfa2a6b2914984779d7635f17ef0885aefeee81f176c9df;Verbaut sich Georgien den Weg in die EU?;https://www.zeit.de/politik/ausland/2024-05/proteste-georgien-agentengesetz-zivilgesellschaftliche-organisationen-faq;"Seit Wochen wird dagegen protestiert, jedoch ohne Erfolg: Das Parlament von Georgien hat das ""russische Gesetz"" gebilligt. Worum es darin geht und was kritisiert wird.";"Z+ (abopflichtiger Inhalt);
        
    
""Russisches Gesetz"" in Georgien";"Politik, ""Russisches Gesetz"" in Georgien, Georgien, Europäische Union, EU-Beitritt, Tbilissi, Protest, NGO, Medienfreiheit";2024-05-14T15:10:13+02:00;2024-05-14T15:10:13+02:00;Sarah VojtaMathis GannCarl FriedrichsLea-Katharina KrauseWelche Vorgeschichte hat das Gesetzesvorhaben?Worum geht es in dem Gesetz?Was sind die wichtigsten Kritikpunkte an dem Gesetz?Welche Folgen hat das Gesetz für den möglichen georgischen EU-Beitritt?Wann tritt das Gesetz in Kraft?Wie reagiert die georgische Zivilgesellschaft auf die Pläne der Regierung?;;false
0630b7186c49e22eff7b7fd6e4d2af4e70b4f9bdaac9cbaa79519ca17dfab055;Berliner Senat plant Hitzeaktionsplan;https://www.zeit.de/news/2024-05/14/berliner-senat-plant-hitzeaktionsplan;Hier finden Sie Informationen zu dem Thema „Gesundheit“. Lesen Sie jetzt „Berliner Senat plant Hitzeaktionsplan“.;"Z+ (abopflichtiger Inhalt);
        
    
Gesundheit";News, Gesundheit, Brandenburger Tor, Berliner Senat, Hitzeaktionsplan, Gegenlicht, Fernsehturm, Klimawandel, Hitze;2024-05-14T15:09:09+02:00;2024-05-14T15:09:09+02:00;;dpa Berlin/Brandenburg;false
b6c076bbe0410ee817364ec4a23f740f4903c99c4e2ffa5f7473a35accbd5968;Zwei Schwerverletzte bei Frontalzusammenstoß bei Bad Homburg;https://www.zeit.de/news/2024-05/14/zwei-schwerverletzte-bei-frontalzusammenstoss-bei-bad-homburg;Hier finden Sie Informationen zu dem Thema „Unfall“. Lesen Sie jetzt „Zwei Schwerverletzte bei Frontalzusammenstoß bei Bad Homburg“.;"Z+ (abopflichtiger Inhalt);
        
    
Unfall";News, Unfall, Bad Homburg, Frontalzusammenstoß, Unfall, Polizeifahrzeug, Blaulicht;2024-05-14T15:08:23+02:00;2024-05-14T15:08:23+02:00;;dpa Hessen;false
23b0cf002e4a1925354e88130c85b2907faa4a88d22be286fb05a5d509ddc9b3;Infektionsstudie: Kühe werden mit Vogelgrippevirus infiziert;https://www.zeit.de/news/2024-05/14/infektionsstudie-kuehe-werden-mit-vogelgrippevirus-infiziert;Hier finden Sie Informationen zu dem Thema „Riems“. Lesen Sie jetzt „Infektionsstudie: Kühe werden mit Vogelgrippevirus infiziert“.;"Z+ (abopflichtiger Inhalt);
        
    
Riems";News, Riems, Riem, Ostsee-Insel, Greifswald, USA, Friedrich-Loeffler-Institut, Infektionsstudie, Vogelgrippevirus, H5N1, Virus;2024-05-14T15:08:07+02:00;2024-05-14T15:08:07+02:00;;dpa Mecklenburg-Vorpommern;false
835be01ea4b94639a77c7b536a7ece28503cb8a5aeae1f371671133823de2e89;Das bleibt!;https://www.zeit.de/2024/21/abbau-muell-natur-zigaretten-windeln-plastik;Das Kaugummi ins Gebüsch, die Zigarette fliegt aus dem Autofenster: Oft wird Müll so entsorgt. Warum das wirklich keine gute Idee ist, zeigt diese Übersicht in Grafiken.;"Z+ (abopflichtiger Inhalt);
        
    
Abbau von Müll";Wissen, Abbau von Müll, Zivilisation, Abfall, Verwesung, Kompost, Kaugummi, Windel, Styropor, Plastik, Zigarettenstummel, Caroline Reißner;2024-05-14T15:07:03+02:00;2024-05-14T15:07:03+02:00;Urs WillmannCaroline Reißner;Aus der        ZEIT Nr. 21/2024;false
bd246e40e0f0b309fff5d4a1763fcbe0bc34c984ca7a0caebb1989718fe1403e;Pilot mit Ultraleichtflugzeug bei Dessau abgestürzt;https://www.zeit.de/news/2024-05/14/pilot-mit-ultraleichtflugzeug-bei-dessau-abgestuerzt;Hier finden Sie Informationen zu dem Thema „Unfall“. Lesen Sie jetzt „Pilot mit Ultraleichtflugzeug bei Dessau abgestürzt“.;"Z+ (abopflichtiger Inhalt);
        
    
Unfall";News, Unfall, Dessau, Dessau-Roßlau, Ultraleichtflugzeug, Unfall, Baumkrone;2024-05-14T15:07:01+02:00;2024-05-14T15:07:01+02:00;;dpa Sachsen;false
f9d8e6b476c62f2c5567c6f1c647ad8baef4eab6ee1272e86387225f26ebb81a;Jugendlicher soll mit Softair-Pistole geschossen haben;https://www.zeit.de/news/2024-05/14/jugendlicher-soll-mit-softair-pistole-geschossen-haben;Hier finden Sie Informationen zu dem Thema „Landkreis Ostallgäu“. Lesen Sie jetzt „Jugendlicher soll mit Softair-Pistole geschossen haben“.;"Z+ (abopflichtiger Inhalt);
        
    
Landkreis Ostallgäu";News, Landkreis Ostallgäu, Landkreis Ostallgäu, Polizei, Einsatzwagen;2024-05-14T15:06:59+02:00;2024-05-14T15:06:59+02:00;;dpa Bayern;false
d9c61b4330ee17207c6784f3dfc39f32ca0807b2751fa5d3eb7cbf21c0679b50;Künstlerische Rarität für die Festung Königstein;https://www.zeit.de/news/2024-05/14/kuenstlerische-raritaet-fuer-die-festung-koenigstein;Hier finden Sie Informationen zu dem Thema „Museen“. Lesen Sie jetzt „Künstlerische Rarität für die Festung Königstein“.;"Z+ (abopflichtiger Inhalt);
        
    
Museen";News, Museen, Ernst Ferdinand Oehme, Königstein, Sächsische Schweiz, Festung, Rarität, Wehranlage, Innenansicht, Lilienstein, Luftaufnahme, Familie;2024-05-14T15:06:27+02:00;2024-05-14T15:06:27+02:00;;dpa Sachsen;false
39fe4572582026e53e8844f8cebadf73759302aaee71bdd3d404babdac6a58e4;Verteilte Stimmzettel für Kreistagswahl ungültig;https://www.zeit.de/news/2024-05/14/verteilte-stimmzettel-fuer-kreistagswahl-ungueltig;Hier finden Sie Informationen zu dem Thema „Erzgebirgskreis“. Lesen Sie jetzt „Verteilte Stimmzettel für Kreistagswahl ungültig“.;"Z+ (abopflichtiger Inhalt);
        
    
Erzgebirgskreis";News, Erzgebirgskreis, Kreistagswahl, Erzgebirgskreis, Stimmzettel, Wahllokal;2024-05-14T15:05:27+02:00;2024-05-14T15:05:27+02:00;;dpa Sachsen;false
44549d5662996624bb1c916aa8e4cdcf86bc2c6de6ebe0088a79cb7a33baa40d;"Dreimal ""Rudelgucken"" zum Champions-League-Finale";https://www.zeit.de/news/2024-05/14/dreimal-rudelgucken-zum-champions-league-finale;"Hier finden Sie Informationen zu dem Thema „Borussia Dortmund“. Lesen Sie jetzt „Dreimal ""Rudelgucken"" zum Champions-League-Finale“.";"Z+ (abopflichtiger Inhalt);
        
    
Borussia Dortmund";News, Borussia Dortmund, Dortmund, ZDF, BVB, DAZN, Vereinigte Elektrizitätswerke Westfalen, Champions-League-Finale, Champions League, Rudelgucken, Pokal, Finale;2024-05-14T15:05:01+02:00;2024-05-14T15:05:01+02:00;;dpa Nordrhein-Westfalen;false
46b68917b81efd51056ebed21d2bbd5f4af1c3de2f2c8b9b70cc8c28f52c30fc;Sachsen und Thüringen: Treffen wegen Stahlindustrie;https://www.zeit.de/news/2024-05/14/sachsen-und-thueringen-treffen-wegen-stahlindustrie;Hier finden Sie Informationen zu dem Thema „Bundesländer“. Lesen Sie jetzt „Sachsen und Thüringen: Treffen wegen Stahlindustrie“.;"Z+ (abopflichtiger Inhalt);
        
    
Bundesländer";News, Bundesländer, Thüringen, Treffen, Stahlknüppel, Feralpi, Stranggussanlage, Stahlindustrie;2024-05-14T15:04:30+02:00;2024-05-14T15:04:30+02:00;;dpa Sachsen;false
c8cb1ed73aad3f5148da4cc1a4a64a0ee3c733c0ae162e2e792086a81e730f68;Missbrauch: Gericht schlägt Bistum und Klägern Vergleich vor;https://www.zeit.de/news/2024-05/14/missbrauch-gericht-schlaegt-bistum-und-klaegern-vergleich-vor;Hier finden Sie Informationen zu dem Thema „Kirche“. Lesen Sie jetzt „Missbrauch: Gericht schlägt Bistum und Klägern Vergleich vor“.;"Z+ (abopflichtiger Inhalt);
        
    
Kirche";News, Kirche, Aachen, Bistum, Missbrauch, Vergleich, Justizzentrum, Landgericht;2024-05-14T15:03:31+02:00;2024-05-14T15:03:31+02:00;;dpa Nordrhein-Westfalen;false
82507673651b3cb26762bdea9187ae1251d871209471c954e1f167c208a4763d;Wiederaufbau Nordflügel auf Burg Posterstein kommt voran;https://www.zeit.de/news/2024-05/14/wiederaufbau-nordfluegel-auf-burg-posterstein-kommt-voran;Hier finden Sie Informationen zu dem Thema „Denkmäler“. Lesen Sie jetzt „Wiederaufbau Nordflügel auf Burg Posterstein kommt voran“.;"Z+ (abopflichtiger Inhalt);
        
    
Denkmäler";News, Denkmäler, Wiederaufbau, Posterstein, Nordflügel, Baustellenbesichtigung, Denkmal;2024-05-14T15:02:11+02:00;2024-05-14T15:02:11+02:00;;dpa Thüringen;false
c2a0df4c3880df394ca932b2b8e84b7600ff9730d6e8851b123d0920806fb403;Werner: Andere Ministerien binden Senioren zu wenig ein;https://www.zeit.de/news/2024-05/14/werner-andere-ministerien-binden-senioren-zu-wenig-ein;Hier finden Sie Informationen zu dem Thema „Regierung“. Lesen Sie jetzt „Werner: Andere Ministerien binden Senioren zu wenig ein“.;"Z+ (abopflichtiger Inhalt);
        
    
Regierung";News, Regierung, Heike Werner, Thüringen, Die Linke, Senioren, Hitze;2024-05-14T15:01:09+02:00;2024-05-14T15:01:09+02:00;;dpa Thüringen;false
a7e5b94e94b9a0e5a447376d023434515d472bad5000f5c8e2d5d9b59ec23c93;CSU-Politiker Stefinger leidet unter Schilddrüsenkrebs;https://www.zeit.de/news/2024-05/14/csu-politiker-stefinger-leidet-unter-schilddruesenkrebs;Hier finden Sie Informationen zu dem Thema „Krankheit“. Lesen Sie jetzt „CSU-Politiker Stefinger leidet unter Schilddrüsenkrebs“.;"Z+ (abopflichtiger Inhalt);
        
    
Krankheit";News, Krankheit, CSU, BMZ, Bundestag, Schilddrüsenkrebs;2024-05-14T14:59:48+02:00;2024-05-14T14:59:48+02:00;;dpa Bayern;false
7324126d492b556582accec11451e38c6bf14a399c63de48a2bbd1f4b6874530;30 Millionen Euro für Familienförderung in Thüringen;https://www.zeit.de/news/2024-05/14/30-millionen-euro-fuer-familienfoerderung-in-thueringen;Hier finden Sie Informationen zu dem Thema „Regierung“. Lesen Sie jetzt „30 Millionen Euro für Familienförderung in Thüringen“.;"Z+ (abopflichtiger Inhalt);
        
    
Regierung";News, Regierung, Heike Werner, Thüringen, Familienförderung, Eurobanknote, Geld;2024-05-14T14:57:54+02:00;2024-05-14T14:57:54+02:00;;dpa Thüringen;false
5c9e559e9af6d5f43da4306f6ede271941e8e9ea3203ea361479e163b4791972;Nürnberger Staatstheater: Rekordnachfrage nach Karten;https://www.zeit.de/news/2024-05/14/nuernberger-staatstheater-rekordnachfrage-nach-karten;Hier finden Sie Informationen zu dem Thema „Theater“. Lesen Sie jetzt „Nürnberger Staatstheater: Rekordnachfrage nach Karten“.;"Z+ (abopflichtiger Inhalt);
        
    
Theater";News, Theater, Staatstheater Nürnberg, Rekordnachfrage, Staatstheater;2024-05-14T14:57:47+02:00;2024-05-14T14:57:47+02:00;;dpa Bayern;false
2d7e72d4f45dbcec4fc97e7a5a984697db284355f6599962deaa5a7fc1f969a4;Untersuchungsausschuss zur Treuhand: Fraktionen uneins;https://www.zeit.de/news/2024-05/14/untersuchungsausschuss-zur-treuhand-fraktionen-uneins;Hier finden Sie Informationen zu dem Thema „Landtag“. Lesen Sie jetzt „Untersuchungsausschuss zur Treuhand: Fraktionen uneins“.;"Z+ (abopflichtiger Inhalt);
        
    
Landtag";News, Landtag, Maik Kowalleck, Bischofferode, Thüringen, Erfurt, CDU, Landtag, Kaliberg, Kaliwerk, Fraktion, Untersuchungsausschuss;2024-05-14T14:57:16+02:00;2024-05-14T14:57:16+02:00;;dpa Thüringen;false
