Hash;Title;Link;Description;Category;KeyWords;Published;LastUpdated;Author;Source;Paywall
e6f9badabd8185edb7e562ae8b4aad190beeed0e2ab23ffda725fe13b2b7f15b;Verfassungsgericht weist AfD-Antrag zu Corona-Regeln zurück;https://www.zeit.de/news/2026-02/23/verfassungsgericht-weist-afd-antrag-zu-corona-regeln-zurueck;Hier finden Sie Informationen zu dem Thema „Pandemie“. Lesen Sie jetzt „Verfassungsgericht weist AfD-Antrag zu Corona-Regeln zurück“.;Pandemie;News, Pandemie, Brandenburg, Bundesverfassungsgericht, Alternative für Deutschland, Pandemie, Normenkontrollantrag, Zutrittsgewährung, Corona-Maßnahmen, Erfolg;2026-02-23T17:52:25+01:00;2026-02-23T17:52:25+01:00;;dpa Berlin/Brandenburg;false
a382143d6052bf5150eefb169ee759c01f2cfdef364a648f8b8e6aa62d7458f3;Sie wollen die Restauration;https://www.zeit.de/2026/08/reform-uk-nigel-farage-partei-brexit-einwanderung;Der Brexit wird von vielen Briten mittlerweile kritisch gesehen. Und doch wird die Partei von Nigel Farage immer stärker. Woher kommt dieser Erfolg?;"Z+ (abopflichtiger Inhalt);
        
    Reform UK";Politik, Reform UK, Großbritannien, Nigel Farage, Keir Starmer, Europäische Union, Brexit, Einwanderung;2026-02-23T17:51:16+01:00;2026-02-23T17:51:16+01:00;Jochen Bittner;Aus der        ZEIT Nr. 08/2026;false
f4512afa0c43c352a9fc96e0a1b46c851dec30c5b1a314c65f3387077df38844;Doch fit für den Clásico? - Berichte: Neuer im Training;https://www.zeit.de/news/2026-02/23/doch-fit-fuer-den-cl-sico-berichte-neuer-im-training;Hier finden Sie Informationen zu dem Thema „Fußball-Bundesliga“. Lesen Sie jetzt „Doch fit für den Clásico? - Berichte: Neuer im Training“.;Fußball-Bundesliga;News, Fußball-Bundesliga, Manuel Neuer, FC Bayern München, Fußball-Bundesliga, Bundesliga;2026-02-23T17:48:40+01:00;2026-02-23T17:48:40+01:00;;dpa Bayern;false
a86e2696e981849c0e7050a615f66614f1af2971f5bcbf935577c4d48d665836;Messerattacke in Hamburg - Festnahme in Uelzen;https://www.zeit.de/news/2026-02/23/messerattacke-in-hamburg-festnahme-in-uelzen;Hier finden Sie Informationen zu dem Thema „Kriminalität“. Lesen Sie jetzt „Messerattacke in Hamburg - Festnahme in Uelzen“.;Kriminalität;News, Kriminalität, Hamburg, Uelzen, Polizei, Messerattacke, Drogeneinrichtung, Kriminalität, Festnahme, Drogen;2026-02-23T17:47:26+01:00;2026-02-23T17:47:26+01:00;;dpa Hamburg/Schleswig-Holstein;false
1c0e58c1c538c10c41a72cc2eabf41b24d132c8a14422088d376ce69ea1ef0d2;Unsicherheit nach US-Urteil - EU legt Zollabkommen auf Eis;https://www.zeit.de/news/2026-02/23/eu-parlament-stoppt-umsetzung-von-zolldeal-mit-usa;Hier finden Sie Informationen zu dem Thema „Welthandel“. Lesen Sie jetzt „Unsicherheit nach US-Urteil - EU legt Zollabkommen auf Eis“.;Welthandel;News, Welthandel, USA, Europäisches Parlament, Europäische Union, Zolldeal;2026-02-23T17:46:22+01:00;2026-02-23T17:46:22+01:00;;dpa;false
93318769249a630dc87fd9b88d404f70bf827630c3acf1174c0c85d3229892bc;"Wie wird man eine ""heitere Alte"", Frau von Arnim?";https://www.zeit.de/2026/09/gabriele-von-arnim-heiterkeit-bitterkeit-alter-krankheit;Aufgabe der Alten, gerade heute, ist doch: Freude in sich finden und sie Familie und Freunden schenken. Sagt die Schriftstellerin Gabriele von Arnim. Mit Dinnerpartys!;"Z+ (abopflichtiger Inhalt);
        
    Gabriele von Arnim";Feuilleton, Gabriele von Arnim, Schriftstellerin, Alter, Familie, Wandern, Gabriele von Arnim;2026-02-23T17:43:59+01:00;2026-02-23T17:43:59+01:00;Silke Weber;Aus der        ZEIT Nr. 09/2026;false
7fdfcd1fbc54a32feab4f669750f9adb17bdc993e244971a5579d2ad4e731636;Erste Verkehrskontrolle: Warum will man zur Polizei?;https://www.zeit.de/news/2026-02/23/erste-verkehrskontrolle-warum-will-man-zur-polizei;Hier finden Sie Informationen zu dem Thema „Motivation“. Lesen Sie jetzt „Erste Verkehrskontrolle: Warum will man zur Polizei?“.;Motivation;News, Motivation, Berlin, Polizei, Kripo, Verkehrskontrolle, Studium;2026-02-23T17:43:12+01:00;2026-02-23T17:43:12+01:00;;dpa Berlin/Brandenburg;false
f646774647796dc067b856e9612a3d543d970973795172a5e68f4a6d82bccd94;Hersteller warnt vor Glassplittern in Brühe;https://www.zeit.de/news/2026-02/23/hersteller-warnt-vor-glassplittern-in-bruehe;Hier finden Sie Informationen zu dem Thema „Rückruf“. Lesen Sie jetzt „Hersteller warnt vor Glassplittern in Brühe“.;Rückruf;News, Rückruf, Glassplitter, Brühe, Rückruf, Ökoland;2026-02-23T17:41:12+01:00;2026-02-23T17:41:12+01:00;;dpa Baden-Württemberg;false
a473484017b4aa2aed7f076dc4b9b8e38377081d209ecc50067bd46519447233;Woidke dringt auf schnelles Ende des Ukraine-Kriegs;https://www.zeit.de/news/2026-02/23/woidke-dringt-auf-schnelles-ende-des-ukraine-kriegs;Hier finden Sie Informationen zu dem Thema „Vierter Jahrestag“. Lesen Sie jetzt „Woidke dringt auf schnelles Ende des Ukraine-Kriegs“.;Vierter Jahrestag;News, Vierter Jahrestag, Dietmar Woidke, Wladimir Putin, Diana Gonzalez, Brandenburg, Russland, SPD, Deutsche Presse-Agentur, Jahrestag, Krieg in der Ukraine;2026-02-23T17:40:36+01:00;2026-02-23T17:40:36+01:00;;dpa Berlin/Brandenburg;false
97b0c32461c32704cbaf1bbde937137cdda9903a6c07f6959cc0205ae7beff47;Bei Rot über die Ampel – Unfall mit sieben Verletzten;https://www.zeit.de/news/2026-02/23/bei-rot-ueber-die-ampel-unfall-mit-sieben-verletzten;Hier finden Sie Informationen zu dem Thema „Unfall“. Lesen Sie jetzt „Bei Rot über die Ampel – Unfall mit sieben Verletzten“.;Unfall;News, Unfall, Unfall, Auto;2026-02-23T17:40:22+01:00;2026-02-23T17:40:22+01:00;;dpa Baden-Württemberg;false
7c6328a7460ec36dddadf6421d1220ddd9f6b0066f67521b787314179e954190;13-Jähriger greift mutmaßlich Schüler mit Messer an;https://www.zeit.de/news/2026-02/23/bedrohungslage-in-bretten-schueler-muessen-in-klassen-bleiben;Hier finden Sie Informationen zu dem Thema „Schulen“. Lesen Sie jetzt „13-Jähriger greift mutmaßlich Schüler mit Messer an“.;Schulen;News, Schulen, Bretten, Bedrohungslage;2026-02-23T17:31:12+01:00;2026-02-23T17:31:12+01:00;;dpa;false
4b77b6bd5c2565978d18f1d61b79e844084447468ee4b1c96dc4948c859562c9;Bilder des Tages;https://www.zeit.de/news/2026-02/23/bilder-des-tages;Hier finden Sie Informationen zu dem Thema „Fotografie“. Lesen Sie jetzt „Bilder des Tages“.;Fotografie;News, Fotografie, News;2026-02-23T17:28:38+01:00;2026-02-23T17:28:38+01:00;;dpa;false
113353cc4884a1c648d12d7ce79d130b42df6e876a5efe9c38c7a8e92926617f;Das ist doch ein ganz klassischer Rolltreppenwitz;https://www.zeit.de/feuilleton/2026-02/rolltreppen-ausfall-reparatur-bahnhof-geschichte;Bei der Bahn fallen bundesweit Rolltreppen aus. Das ist ärgerlich, klar. Aber: Wer sich darüber aufregt, hat die dunkle Seite des Fortschritts noch nicht ganz verstanden.;"Z+ (abopflichtiger Inhalt);
        
    Rolltreppen";Feuilleton, Rolltreppen, Bahnhof, Geschichte, Rolltreppe;2026-02-23T17:28:32+01:00;2026-02-23T17:28:32+01:00;Nils Markwardt;;false
4a39dd13e3815788c61794c54dceeba338d1ef160b1f6756c8b7ef701ee66064;BASF plant Verkauf von 4.400 Wohnungen;https://www.zeit.de/news/2026-02/23/basf-plant-verkauf-von-4-400-wohnungen;Hier finden Sie Informationen zu dem Thema „Bis zum ersten Quartal 2027“. Lesen Sie jetzt „BASF plant Verkauf von 4.400 Wohnungen“.;Bis zum ersten Quartal 2027;News, Bis zum ersten Quartal 2027, BASF;2026-02-23T17:28:17+01:00;2026-02-23T17:28:17+01:00;;dpa Rheinland-Pfalz/Saarland;false
199a08f4cd73f0c42a90c835eb2f96bbc81e0e58bf86dd48134b8d74e90bdc98;Sachsens LKA hat einen neuen Präsidenten;https://www.zeit.de/news/2026-02/23/sachsens-lka-hat-einen-neuen-praesidenten;Hier finden Sie Informationen zu dem Thema „Polizei“. Lesen Sie jetzt „Sachsens LKA hat einen neuen Präsidenten“.;Polizei;News, Polizei, Dirk Lichtenberger, Sonja Penzel, Sachsen, LKA, Polizei, LKA Sachsen;2026-02-23T17:27:54+01:00;2026-02-23T17:27:54+01:00;;dpa Sachsen;false
2221228dd3d66a8b9971021adad6232287f6bacd3d3c70e71519d6aa2b787f13;Flaschenwurf auf Kind bei Fastnacht? – Polizei sucht Zeugen;https://www.zeit.de/news/2026-02/23/flaschenwurf-auf-kind-bei-fastnacht-polizei-sucht-zeugen;Hier finden Sie Informationen zu dem Thema „Umzug“. Lesen Sie jetzt „Flaschenwurf auf Kind bei Fastnacht? – Polizei sucht Zeugen“.;Umzug;News, Umzug, Polizei, Flaschenwurf, Fastnacht, Umzug, Fastnachtsumzug;2026-02-23T17:25:57+01:00;2026-02-23T17:25:57+01:00;;dpa Baden-Württemberg;false
5ddd4a1eb41f21f7a7260558a9ca04d36dcce0e3cc5eaa1fb124c8080ba6eeee;Unfreiwillige Nacht im Flieger - Entschädigung für Fluggäste;https://www.zeit.de/news/2026-02/23/unfreiwillige-nacht-im-flieger-entschaedigung-fuer-fluggaeste;Hier finden Sie Informationen zu dem Thema „Schneechaos“. Lesen Sie jetzt „Unfreiwillige Nacht im Flieger - Entschädigung für Fluggäste“.;Schneechaos;News, Schneechaos, Deutsche Lufthansa, Schneechaos, Entschädigung;2026-02-23T17:24:48+01:00;2026-02-23T17:24:48+01:00;;dpa;false
440f3bcc72d85c82a946120123d796028c305cef32fe4fb67d20e539c3d48515;"Wegner: ""Berlin steht fest an der Seite der Ukraine""";https://www.zeit.de/news/2026-02/23/wegner-berlin-steht-fest-an-der-seite-der-ukraine;"Hier finden Sie Informationen zu dem Thema „Krieg in der Ukraine“. Lesen Sie jetzt „Wegner: ""Berlin steht fest an der Seite der Ukraine""“.";Krieg in der Ukraine;News, Krieg in der Ukraine, Kai Wegner, Berlin, Brandenburger Tor, CDU, Krieg in der Ukraine;2026-02-23T17:24:36+01:00;2026-02-23T17:24:36+01:00;;dpa Berlin/Brandenburg;false
ae73914c1f0bec8390f2ce71843d83d5e0372a23d1166bfd05932417cf5cbef5;Fast 50 Verbände warnen vor AfD und fordern Stärkung;https://www.zeit.de/news/2026-02/23/fast-50-verbaende-warnen-vor-afd-und-fordern-staerkung;Hier finden Sie Informationen zu dem Thema „Staatliche Förderung“. Lesen Sie jetzt „Fast 50 Verbände warnen vor AfD und fordern Stärkung“.;Staatliche Förderung;News, Staatliche Förderung, Robert Crumbach, Brandenburg, Alternative für Deutschland, DGB, Mehr Demokratie, Stärkung, Rechtsextremismus;2026-02-23T17:24:14+01:00;2026-02-23T17:24:14+01:00;;dpa Berlin/Brandenburg;false
5c216065742b80d43e4a597b934602cadf13e3fb6bc027dc45ad00d9eb04da35;"Nabu bittet um Rücksicht auf ""liebestrunkene Lurche""";https://www.zeit.de/news/2026-02/23/nabu-bittet-um-ruecksicht-auf-liebestrunkene-lurche;"Hier finden Sie Informationen zu dem Thema „Krötenwanderung“. Lesen Sie jetzt „Nabu bittet um Rücksicht auf ""liebestrunkene Lurche""“.";Krötenwanderung;News, Krötenwanderung, Manuela Heberer, Mecklenburg-Vorpommern, Naturschutzbund Deutschland, NABU, Krötenwanderung, Lurch, Eis, Tiere;2026-02-23T17:17:48+01:00;2026-02-23T17:17:48+01:00;;dpa Mecklenburg-Vorpommern;false
7e4c0f82c7f5a250020a2b30802b00a8fa92781620729024246c2daf13854cab;Nashornkuh zieht von Magdeburg nach Tschechien;https://www.zeit.de/news/2026-02/23/nashornkuh-zieht-von-magdeburg-nach-tschechien;Hier finden Sie Informationen zu dem Thema „Tiere“. Lesen Sie jetzt „Nashornkuh zieht von Magdeburg nach Tschechien“.;Tiere;News, Tiere, Magdeburg, Tschechien, Nashornbox, Spezialcontainer, Tiere;2026-02-23T17:15:12+01:00;2026-02-23T17:15:12+01:00;;dpa Sachsen;false
4c4fcbab580771fad4f8c7c46ab55fc368119267d8637c9de91dfdde5efbc2d5;Tödlicher Parkplatzunfall: Seniorin überfährt Fußgänger;https://www.zeit.de/news/2026-02/23/toedlicher-parkplatzunfall-seniorin-ueberfaehrt-fussgaenger;Hier finden Sie Informationen zu dem Thema „Unfälle“. Lesen Sie jetzt „Tödlicher Parkplatzunfall: Seniorin überfährt Fußgänger“.;Unfälle;News, Unfälle, Polizei, Parkplatzunfall, Unfall;2026-02-23T17:10:50+01:00;2026-02-23T17:10:50+01:00;;dpa Thüringen;false
33d234a763bbfc6db5dfb2547aeb10cf8be6876bcfd230a9c24c83ff0a239336;Fußgängerin wird von Auto erfasst und schwer verletzt;https://www.zeit.de/news/2026-02/23/fussgaengerin-wird-von-auto-erfasst-und-schwer-verletzt;Hier finden Sie Informationen zu dem Thema „Unfälle“. Lesen Sie jetzt „Fußgängerin wird von Auto erfasst und schwer verletzt“.;Unfälle;News, Unfälle, Unfall, Auto;2026-02-23T17:08:45+01:00;2026-02-23T17:08:45+01:00;;dpa Baden-Württemberg;false
23dc31fd3bdcf94cac3f102e6f9123578723e940971885b7882516f4cfb99617;Nach Lawinen-Unglücken in Österreich: Ruf nach Konsequenzen;https://www.zeit.de/news/2026-02/23/nach-lawinen-ungluecken-in-oesterreich-ruf-nach-konsequenzen;Hier finden Sie Informationen zu dem Thema „Elf Tote in den Alpen“. Lesen Sie jetzt „Nach Lawinen-Unglücken in Österreich: Ruf nach Konsequenzen“.;Elf Tote in den Alpen;News, Elf Tote in den Alpen, Astrid Mair, Österreich, Alpen, Schweiz, Kronen Zeitung, Konsequenz, Sicherheit;2026-02-23T17:08:15+01:00;2026-02-23T17:08:15+01:00;;dpa Bayern;false
dd186a25ac6026580bfd85221fa898192d9159d27795568ad3d5dbc86ca46ce0;Zahl der Verkehrstoten sinkt auf 21 – jeder Zweite fuhr Rad;https://www.zeit.de/news/2026-02/23/21-verkehrstote-in-hamburg-im-jahr-2025-starker-rueckgang;Hier finden Sie Informationen zu dem Thema „Unfallstatistik“. Lesen Sie jetzt „Zahl der Verkehrstoten sinkt auf 21 – jeder Zweite fuhr Rad“.;Unfallstatistik;News, Unfallstatistik, Mirko Streiber, Hamburg, Polizei, Unfallstatistik, Rückgang;2026-02-23T17:05:36+01:00;2026-02-23T17:05:36+01:00;;dpa Hamburg/Schleswig-Holstein;false
59e05bc5549bc0f47f17b4a4e784b8bfeea5e45cf43cdaa9cf97a46712230e9e;Sinkende Pegelstände zur Wochenmitte in Rheinland-Pfalz;https://www.zeit.de/news/2026-02/23/sinkende-pegelstaende-zur-wochenmitte-in-rheinland-pfalz;Hier finden Sie Informationen zu dem Thema „Hochwasser“. Lesen Sie jetzt „Sinkende Pegelstände zur Wochenmitte in Rheinland-Pfalz“.;Hochwasser;News, Hochwasser, Mosel, Koblenz, Rheinland-Pfalz, Mittelrhein, Pegelstand, Wochenmitte, Wasserstand, Hochwasservorhersagezentrale, Hochwasser, Hochwassergefahr;2026-02-23T17:03:21+01:00;2026-02-23T17:03:21+01:00;;dpa Rheinland-Pfalz/Saarland;false
227aa06a0704b795f6631e1c09f80ce72dd1cf1873bf36d2f3df8eda0bdc60a7;Krankschreibungen bei Bundesbehörden überdurchschnittlich hoch;https://www.zeit.de/gesundheit/2026-02/bundesbehoerden-krankheitstage-2024;Neue Zahlen zeigen, wie häufig sich Mitarbeitende der Bundesbehörden 2024 krankschreiben ließen. Zwischen den Institutionen gibt es große Unterschiede.;Krankheitstage;Gesundheit, Krankheitstage, CDU, Bundesrat, Arbeitsplatz, Krankheitstag, Krankschreibung, Bundesbehörde;2026-02-23T16:59:49+01:00;2026-02-23T16:59:49+01:00;hap;DIE ZEIT,        dpa,        							hap;false
813a34c92842dd9e88ba76171eba51153dfc2d3962f7effb3602ebc373bb9438;Autofahrer stirbt nach Frontalzusammenstoß mit Laster;https://www.zeit.de/news/2026-02/23/autofahrer-stirbt-nach-frontalzusammenstoss-mit-laster;Hier finden Sie Informationen zu dem Thema „Unfall“. Lesen Sie jetzt „Autofahrer stirbt nach Frontalzusammenstoß mit Laster“.;Unfall;News, Unfall, Polizei, Frontalzusammenstoß, Unfall;2026-02-23T16:58:44+01:00;2026-02-23T16:58:44+01:00;;dpa Baden-Württemberg;false
3a7d62cd714bd7d9bcea0be751b08b5eb661818f4d341ef6867e9265458b5548;USA ziehen Diplomaten aus dem Libanon ab;https://www.zeit.de/politik/ausland/2026-02/usa-diplomaten-abzug-libanon-iran;Seit Wochen erhöhen die USA den Druck auf den Iran, das US-Militär soll zum Angriff bereit sein. Inmitten der Krise ziehen die USA Botschaftspersonal aus der Region ab.;USA-Iran-Konflikt;Politik, USA-Iran-Konflikt, USA, Iran, Libanon, Außenministerium der Vereinigten Staaten;2026-02-23T16:57:15+01:00;2026-02-23T16:57:15+01:00;sko;DIE ZEIT,        AP,        AFP,        							sko;false
5fe5d3d70a47ab5127054c433432c98143c6a52088da9fba48302e2e3390b073;"Merz gibt Regierung Note ""befriedigend""";https://www.zeit.de/news/2026-02/23/merz-gibt-regierung-note-befriedigend;"Hier finden Sie Informationen zu dem Thema „Ein Jahr nach Wahl“. Lesen Sie jetzt „Merz gibt Regierung Note ""befriedigend""“.";Ein Jahr nach Wahl;News, Ein Jahr nach Wahl, Friedrich Merz, Bundestagswahl;2026-02-23T16:54:48+01:00;2026-02-23T16:54:48+01:00;;dpa;false
27144fe51dc36913a015819837a297875c9697d816b723b13cfd4e27907a3920;Auto kollidiert mit Lkw - Fahrer stirbt am Unfallort;https://www.zeit.de/news/2026-02/23/auto-kollidiert-mit-lkw-fahrer-stirbt-am-unfallort;Hier finden Sie Informationen zu dem Thema „Verkehr“. Lesen Sie jetzt „Auto kollidiert mit Lkw - Fahrer stirbt am Unfallort“.;Verkehr;News, Verkehr, Polizei, Unfallort, Verkehr, Auto;2026-02-23T16:54:28+01:00;2026-02-23T16:54:28+01:00;;dpa Rheinland-Pfalz/Saarland;false
c3c68fb01f1606e5fc9e6aa47c647c3e6c04bb6261cdf58f291aeadb725f4cdd;74 Tote bei Festnahme von mächtigem Drogenboss in Mexiko;https://www.zeit.de/news/2026-02/23/mexikos-praesidentin-nach-tod-von-drogenboss-ruhe-bewahren;Hier finden Sie Informationen zu dem Thema „Militäreinsatz gegen Kartell“. Lesen Sie jetzt „74 Tote bei Festnahme von mächtigem Drogenboss in Mexiko“.;Militäreinsatz gegen Kartell;News, Militäreinsatz gegen Kartell, Claudia Sheinbaum, Nemesio Oseguera Cervantes, Mexiko, USA, X, Gewaltwelle, Kartell, Militäreinsatz, Tötung, Militär;2026-02-23T16:52:34+01:00;2026-02-23T16:52:34+01:00;;dpa;false
49f65ae40f0e2e663f4ddc3264acd75b0ee99bede486f04cfd03c4e46bd3927c;Gasleck bei Gartenarbeiten – Häuser in Baunatal evakuiert;https://www.zeit.de/news/2026-02/23/gasleck-bei-gartenarbeiten-haeuser-in-baunatal-evakuiert;Hier finden Sie Informationen zu dem Thema „Unfall mit Gasleitung“. Lesen Sie jetzt „Gasleck bei Gartenarbeiten – Häuser in Baunatal evakuiert“.;Unfall mit Gasleitung;News, Unfall mit Gasleitung, Baunatal, Gasleck, Gartenarbeit, Unfall, Gasleitung, Gartenbauarbeit;2026-02-23T16:50:55+01:00;2026-02-23T16:50:55+01:00;;dpa Hessen;false
4a0204510094812a5eb5835e979f5dc058395b3984bd20dea4d1fd3d8e5c027d;Nach Rassismus-Vorfall: UEFA sperrt Prestianni für Rückspiel;https://www.zeit.de/news/2026-02/23/nach-rassismus-vorfall-uefa-sperrt-prestianni-fuer-rueckspiel;Hier finden Sie Informationen zu dem Thema „Fußball“. Lesen Sie jetzt „Nach Rassismus-Vorfall: UEFA sperrt Prestianni für Rückspiel“.;Fußball;News, Fußball, Gianluca Prestianni, Benfica Lissabon, Uefa, Champions League, Rückspiel, Fußball;2026-02-23T16:50:27+01:00;2026-02-23T16:50:27+01:00;;dpa Sport;false
71fe27d85fe35f99e89b3d30b1c5edea14272acf1714586bff196503fdc812b9;Grenzpolizei entdeckt 2,5 Kilo Heroin bei Kontrolle im Zug;https://www.zeit.de/news/2026-02/23/grenzpolizei-entdeckt-2-5-kilo-heroin-bei-kontrolle-im-zug;Hier finden Sie Informationen zu dem Thema „Grenzkontrollen“. Lesen Sie jetzt „Grenzpolizei entdeckt 2,5 Kilo Heroin bei Kontrolle im Zug“.;Grenzkontrollen;News, Grenzkontrollen, Heroin, Grenzkontrolle;2026-02-23T16:50:07+01:00;2026-02-23T16:50:07+01:00;;dpa Bayern;false
23ef74f51ce33d265f6a44cd187a19287f3c5ca129b2fbbfc3c49d4c42ff14e2;AfD Sachsen-Anhalt setzt Kommission zu Anstellungen ein;https://www.zeit.de/news/2026-02/23/afd-sachsen-anhalt-setzt-kommission-zu-anstellungen-ein;Hier finden Sie Informationen zu dem Thema „Vorwürfe der Vetternwirtschaft“. Lesen Sie jetzt „AfD Sachsen-Anhalt setzt Kommission zu Anstellungen ein“.;Vorwürfe der Vetternwirtschaft;News, Vorwürfe der Vetternwirtschaft, Magdeburg, Sachsen-Anhalt, Alternative für Deutschland, Vetternwirtschaft, Anstellungsverhältnis;2026-02-23T16:45:09+01:00;2026-02-23T16:45:09+01:00;;dpa Sachsen;false
54a002ffb24d41e9a7c53ef89f87b51ce7b049b88681871925cd3888bcc6e0cd;Jugendliche treten Mann in Berlin Bahnhofstreppe hinunter;https://www.zeit.de/news/2026-02/23/mann-wird-von-jugendlichen-bahnhofstreppe-heruntergetreten;Hier finden Sie Informationen zu dem Thema „Gewaltkriminalität“. Lesen Sie jetzt „Jugendliche treten Mann in Berlin Bahnhofstreppe hinunter“.;Gewaltkriminalität;News, Gewaltkriminalität, Berlin-Neukölln, Bundespolizei, Bahnhofstreppe, Gewaltkriminalität;2026-02-23T16:43:17+01:00;2026-02-23T16:43:17+01:00;;dpa Berlin/Brandenburg;false
092fd24735d2170897916402e23379f503cb0f44dae8f8b0df28f3e81293c8c1;Hochwasser in Hessen durch Regen und Schneeschmelze;https://www.zeit.de/news/2026-02/23/hochwasser-in-hessen-durch-regen-und-schneeschmelze;Hier finden Sie Informationen zu dem Thema „Hochwasser“. Lesen Sie jetzt „Hochwasser in Hessen durch Regen und Schneeschmelze“.;Hochwasser;News, Hochwasser, Vogelsberg, Hessen, Schneeschmelze, Hochwasser;2026-02-23T16:42:05+01:00;2026-02-23T16:42:05+01:00;;dpa Hessen;false
d688ac0ab46f2cad8d144a062596433cd344e2c6ed4d2c050e3de7e7edcfaf4a;Lindsey Vonn: Arzt rettete mein Bein vor Amputation;https://www.zeit.de/news/2026-02/23/lindsey-vonn-arzt-rettete-mein-bein-vor-amputation;Hier finden Sie Informationen zu dem Thema „Nach Sturz bei Olympia“. Lesen Sie jetzt „Lindsey Vonn: Arzt rettete mein Bein vor Amputation“.;Nach Sturz bei Olympia;News, Nach Sturz bei Olympia, Lindsey Vonn, Italien, Instagram, Olympia, Olympische Winterspiele, Amputation;2026-02-23T16:41:13+01:00;2026-02-23T16:41:13+01:00;;dpa Sport;false
d24663be67f9640bb424e00c90760e7dd97dcf8bc1910d19ed1b098c420eb40e;Ex-Präsident Duterte wegen vielfachen Mordes vor Gericht;https://www.zeit.de/news/2026-02/23/ex-praesident-duterte-wegen-vielfachen-mordes-vor-gericht;Hier finden Sie Informationen zu dem Thema „Weltstrafgericht“. Lesen Sie jetzt „Ex-Präsident Duterte wegen vielfachen Mordes vor Gericht“.;Weltstrafgericht;News, Weltstrafgericht, Nicholas Kaufman, Rodrigo Duterte, Philippinen, IStGH, Mord, Weltstrafgericht, Verbrechen, Drogen;2026-02-23T16:38:40+01:00;2026-02-23T16:38:40+01:00;;dpa;false
ae68482b3733123eaabe4708e9f08a4d177f760173c09512611d3f16efe7d420;Tod von Familie in Istanbul – Prozess beginnt im April;https://www.zeit.de/news/2026-02/23/tod-von-familie-in-istanbul-prozess-beginnt-im-april;Hier finden Sie Informationen zu dem Thema „Vergiftung im Türkei-Urlaub“. Lesen Sie jetzt „Tod von Familie in Istanbul – Prozess beginnt im April“.;Vergiftung im Türkei-Urlaub;News, Vergiftung im Türkei-Urlaub, April Im, Istanbul, Hamburg, Türkei, Anadolu, Staatsanwaltschaft, Vergiftung, Prozessdatum, Türkeiurlaub, Familie;2026-02-23T16:38:23+01:00;2026-02-23T16:38:23+01:00;;dpa;false
a4d16ca21f9be2b93b57e02e50fdd2d617d665b04a23378612b2fbbd15031ebf;Alte Brücken und Frost sorgen für Baustellen auf Autobahnen;https://www.zeit.de/news/2026-02/23/alte-bruecken-und-frost-sorgen-fuer-baustellen-auf-autobahnen;Hier finden Sie Informationen zu dem Thema „Achtung Baustelle!“. Lesen Sie jetzt „Alte Brücken und Frost sorgen für Baustellen auf Autobahnen“.;Achtung Baustelle!;News, Achtung Baustelle!, Ronald Normann, Brandenburg, Berlin, Güstrow, Rüdersdorf, Mecklenburg-Vorpommern, Märkisch-Oderland, die Autobahn GmbH des Bundes, Baustelle, Frostschaden;2026-02-23T16:38:04+01:00;2026-02-23T16:38:04+01:00;;dpa Berlin/Brandenburg;false
addc2a1b2f27d7085152fa52ea63a4f41da4c959a0585d93aceaae75d00c0d6d;Wahlplakate in Wiesbaden beschädigt;https://www.zeit.de/news/2026-02/23/wahlplakate-in-wiesbaden-beschaedigt;Hier finden Sie Informationen zu dem Thema „Vandalismus“. Lesen Sie jetzt „Wahlplakate in Wiesbaden beschädigt“.;Vandalismus;News, Vandalismus, Wiesbaden, Polizei, Wahlplakat, Vandalismus;2026-02-23T16:37:19+01:00;2026-02-23T16:37:19+01:00;;dpa Hessen;false
9f81db80f78e5213ca846dfa0f9680549e7d2b4e5f7e51626af1b0ba31650d90;Weckruf: Das wollen Städte von der nächsten Landesregierung;https://www.zeit.de/news/2026-02/23/weckruf-das-wollen-staedte-von-der-naechsten-landesregierung;Hier finden Sie Informationen zu dem Thema „Wahlen“. Lesen Sie jetzt „Weckruf: Das wollen Städte von der nächsten Landesregierung“.;Wahlen;News, Wahlen, Markus Zwick, Mainz, Rheinland-Pfalz, Weckruf, Landesregierung, Städtetag, Geld, Digitalisierung, Haushaltsdefizit;2026-02-23T16:34:27+01:00;2026-02-23T16:34:27+01:00;;dpa Rheinland-Pfalz/Saarland;false
068234e2ff3eded434eb541cd630d530323fdc89bcc621f1c44be3b981420f49;Das fliehende Klassenzimmer?;https://www.zeit.de/feuilleton/literatur/2026-02/alexander-ferdinand-von-schirach-kinderbuch-autor;"Der Jurist Ferdinand von Schirach hat ein Kinderbuch geschrieben. Er stellt ""Alexander"" ausgerechnet in einem Eliteinternat vor. Zeugnis eines ungewöhnlichen Auftritts";"Z+ (abopflichtiger Inhalt);
        
    ""Alexander"" von Ferdinand von Schirach";"Feuilleton, ""Alexander"" von Ferdinand von Schirach, Ferdinand von Schirach, Teaser";2026-02-23T16:34:15+01:00;2026-02-23T16:34:15+01:00;Katrin Hörnlein;;false
63f2002a5d9089ba0e939f7fdb9ceb44d2e134650121ad3db6ae447a2e2da15d;Baggern für den Natur- und Klimaschutz;https://www.zeit.de/news/2026-02/23/baggern-fuer-den-natur-und-klimaschutz;Hier finden Sie Informationen zu dem Thema „Natur- und Klimaschutz“. Lesen Sie jetzt „Baggern für den Natur- und Klimaschutz“.;Natur- und Klimaschutz;News, Natur- und Klimaschutz, Cornelia Schmachtenberg, Tobias Goldschmidt, Chris Freise, Janis Ahrens, Schleswig-Holstein, Kreis Segeberg, Heidmoor, Klimaschutz, Raupenkette, Wetter;2026-02-23T16:32:52+01:00;2026-02-23T16:32:52+01:00;;dpa Hamburg/Schleswig-Holstein;false
ea71597a6ef514baf757df6ccd1e389ccf1f53e0ebacdf1f29f1cd013571d373;Weißwasser bangt um zugesagte Stellen für Bundesamt;https://www.zeit.de/news/2026-02/23/weisswasser-bangt-um-zugesagte-stellen-fuer-bundesamt;Hier finden Sie Informationen zu dem Thema „Bundesbehörden“. Lesen Sie jetzt „Weißwasser bangt um zugesagte Stellen für Bundesamt“.;Bundesbehörden;News, Bundesbehörden, Stephan Meyer, Florian Oest, Weißwasser, Ostsachsen, Lausitz, CDU, BAFA, Bundesbehörde, Bundesamt;2026-02-23T16:31:45+01:00;2026-02-23T16:31:45+01:00;;dpa Sachsen;false
