Hash;Title;Link;Description;Category;KeyWords;Published;LastUpdated;Author;Source;Paywall
e9c58f41626baa695c52e8463824c5dd059949df4b7baabc7aa2a08f5461e77c;Aiwanger als Bundesvorsitzender der Freien Wähler bestätigt;https://www.zeit.de/news/2024-11/16/aiwanger-als-bundesvorsitzender-der-freien-waehler-bestaetigt;Hier finden Sie Informationen zu dem Thema „Parteitag“. Lesen Sie jetzt „Aiwanger als Bundesvorsitzender der Freien Wähler bestätigt“.;"Z+ (abopflichtiger Inhalt);
        
    
Parteitag";News, Parteitag, Hubert Aiwanger, Friedrich Merz, Geiselwind, FW, Deutscher Bundestag, CDU, Bundestagswahl, Bundesvorsitzende, Parteitag;2024-11-17T15:23:56+01:00;2024-11-17T15:23:56+01:00;;dpa Bayern;false
f4aabe4f99767a83fc497427783988e1f4a841469deae7b212763fc9b2de6c50;Olaf Scholz verteidigt Telefonat mit Wladimir Putin;https://www.zeit.de/politik/2024-11/scholz-putin-telefonat-ukraine;"Nach seinem Telefonat mit Russlands Präsidenten Wladimir Putin war Olaf Scholz kritisiert worden. Nun bekräftigte der Kanzler: ""Das war wichtig.""";"Z+ (abopflichtiger Inhalt);
        
    
Russland";Politik, Russland, Olaf Scholz, Wladimir Putin, Russland, Krieg in der Ukraine, Europa, Telefonat;2024-11-17T15:21:20+01:00;2024-11-17T15:21:20+01:00;ast;ZEIT ONLINE,        dpa,        							ast;false
368d6c28ca24d38b6d1e346698edfaf2f80c98e8a0081f5da62ad8d39addd57f;Dynamo-Präsident Scholze mit scharfer Kritik nach Rücktritt;https://www.zeit.de/news/2024-11/17/dynamo-praesident-scholze-mit-scharfer-kritik-nach-ruecktritt;Hier finden Sie Informationen zu dem Thema „Unruhe bei Drittligist Dresden“. Lesen Sie jetzt „Dynamo-Präsident Scholze mit scharfer Kritik nach Rücktritt“.;"Z+ (abopflichtiger Inhalt);
        
    
Unruhe bei Drittligist Dresden";News, Unruhe bei Drittligist Dresden, Holger Scholz, Holger Scholze, MDR, Dynamo Dresden, Rücktritt, Kritik;2024-11-17T15:18:28+01:00;2024-11-17T15:18:28+01:00;;dpa Sachsen;false
06c901bdfb017a04e4dc4e208c96ac85b876c014eb70a1fd82dd0763f00282a8;111 vorläufige Festnahmen bei Pro-Palästina-Demo in Berlin;https://www.zeit.de/news/2024-11/17/111-vorlaeufige-festnahmen-bei-pro-palaestina-demo-in-berlin;Hier finden Sie Informationen zu dem Thema „Nahost-Konflikt“. Lesen Sie jetzt „111 vorläufige Festnahmen bei Pro-Palästina-Demo in Berlin“.;"Z+ (abopflichtiger Inhalt);
        
    
Nahost-Konflikt";News, Nahost-Konflikt, Berlin, Palästinensergebiet, Polizei, Nahostkonflikt;2024-11-17T15:10:38+01:00;2024-11-17T15:10:38+01:00;;dpa Berlin/Brandenburg;false
8b8b31bb4d917dd38a470f128b5dd0600dd32fa867b637075320840bae11f76a;Streit wegen Gesang eskaliert - 27-Jähriger schwer verletzt;https://www.zeit.de/news/2024-11/17/streit-wegen-gesang-eskaliert-27-jaehriger-schwer-verletzt;Hier finden Sie Informationen zu dem Thema „Kriminalität“. Lesen Sie jetzt „Streit wegen Gesang eskaliert - 27-Jähriger schwer verletzt“.;"Z+ (abopflichtiger Inhalt);
        
    
Kriminalität";News, Kriminalität, Berlin, Polizei, Kriminalität;2024-11-17T15:10:01+01:00;2024-11-17T15:10:01+01:00;;dpa Berlin/Brandenburg;false
7ccb46d58ab08e1e2371f6884e113da8078dab21e74486dc5ec303631d0823eb;Sängerin Conchita Wurst bei Schlossfestspielen Schwerin;https://www.zeit.de/news/2024-11/17/saengerin-conchita-wurst-bei-schlossfestspielen-schwerin;Hier finden Sie Informationen zu dem Thema „Konzert“. Lesen Sie jetzt „Sängerin Conchita Wurst bei Schlossfestspielen Schwerin“.;"Z+ (abopflichtiger Inhalt);
        
    
Konzert";News, Konzert, Conchita Wurst, Tom Neuwirth, Sängerin, Schwerin, Eurovision Song Contest, Schlossfestspiel, Sommer;2024-11-17T15:07:20+01:00;2024-11-17T15:07:20+01:00;;dpa Mecklenburg-Vorpommern;false
a92e8ffe672a62a87852e942afb5a7bcb415f8652036815f9ee366981089b5ee;Brienz geräumt - Schuttstrom bedroht Schweizer Dorf;https://www.zeit.de/news/2024-11/17/brienz-geraeumt-schuttstrom-bedroht-schweizer-dorf;Hier finden Sie Informationen zu dem Thema „Gefahr vom Berg“. Lesen Sie jetzt „Brienz geräumt - Schuttstrom bedroht Schweizer Dorf“.;"Z+ (abopflichtiger Inhalt);
        
    
Gefahr vom Berg";News, Gefahr vom Berg, Brienz, Graubünden, Schuttstrom, Steinstrom, Sicherheit, Gestein;2024-11-17T15:05:45+01:00;2024-11-17T15:05:45+01:00;;dpa;false
cfb3f6f8943d6d53b8c92ddd3d576c5e86377905965dfb9df3aae07d219b1828;Das Spiel, das nicht mehr weggeht;https://www.zeit.de/digital/games/2024-11/die-staemme-browsergame-online-spiel-innogames;"In den Nullerjahren boomten die Browsergames, kurz darauf galten sie als tot. Heute ist das 21 Jahre alte ""Die Stämme"" so erfolgreich wie nie. Warum? ";"Z+ (abopflichtiger Inhalt);
        
    
""Die Stämme""";"Digital, ""Die Stämme"", Games, Computerspiel, Videospiel, Online-Dienst, Browser, Hamburg";2024-11-17T15:02:48+01:00;2024-11-17T15:02:48+01:00;Henrik Oerding;;false
334ca348a5a2f282e1756065bcde74a2740ce262b18d2bd8dafddc9ba14e59d6;Ein Bergdorf wartet auf die Katastrophe;https://www.zeit.de/wissen/2024-11/brienz-schweiz-bergdorf-raeumung-steinlawine;Das Schweizer Bergdorf Brienz wurde evakuiert: Es droht ein Hangrutsch, der den ganzen Ort begraben könnte. Doch niemand weiß, ob die Katastrophe wirklich kommt.;"Z+ (abopflichtiger Inhalt);
        
    
Brienz";Wissen, Brienz, Schweiz, Evakuierung, Erdrutsch, Lawine, Alpen, Brienz, Hangrutsch, Gestein;2024-11-17T15:01:17+01:00;2024-11-17T15:01:17+01:00;Dr. Claudia Vallentin;;false
64d35bba61870016a173eefe8e89108f8790f5967787ac1e13d70052ed79b653;Splitterbombe in Homburg kontrolliert gesprengt;https://www.zeit.de/news/2024-11/17/splitterbombe-in-homburg-kontrolliert-gesprengt;Hier finden Sie Informationen zu dem Thema „Weltkriegsrelikt“. Lesen Sie jetzt „Splitterbombe in Homburg kontrolliert gesprengt“.;"Z+ (abopflichtiger Inhalt);
        
    
Weltkriegsrelikt";News, Weltkriegsrelikt, Homburg, Splitterbombe, Weltkriegsrelikt;2024-11-17T14:56:09+01:00;2024-11-17T14:56:09+01:00;;dpa Rheinland-Pfalz/Saarland;false
6e18f4c4d88e1714f6f989a680c0b4ddd0910faf19c755a7cc58b1495ed5a9da;Zwei Tote in einem Transporter gefunden;https://www.zeit.de/news/2024-11/17/zwei-tote-in-einem-transporter-gefunden;Hier finden Sie Informationen zu dem Thema „Kriminalität“. Lesen Sie jetzt „Zwei Tote in einem Transporter gefunden“.;"Z+ (abopflichtiger Inhalt);
        
    
Kriminalität";News, Kriminalität, Frankfurt (Oder), Polizei, Transporter, Kriminalität;2024-11-17T14:56:04+01:00;2024-11-17T14:56:04+01:00;;dpa Berlin/Brandenburg;false
14b6834bea324916760ed720c9e4de2e32ff4c42108c044637f028dd00845958;G20 ruft zu Waffenstillstand in Gazastreifen und Libanon auf;https://www.zeit.de/politik/ausland/2023-12/news-israel-gaza-krieg-live;"Die G20-Staatengruppe fordert einen ""umfassenden"" Waffenstillstand in Nahost. Die USA stellen sich gegen eine Aufnahme von Hamas-Führern in der Türkei. Das Liveblog";Liveblog:                     Krieg in Nahost;Politik, Krieg in Nahost, Israel, Gazastreifen, Hamas, Hisbollah, Militär, Nahostkonflikt, Syrien, Jemen, Benjamin Netanjahu;2024-11-19T08:56:23+00:00;2024-11-19T08:56:23+00:00;Leonardo PapeKatharina JamesEva Casper;;false
57fb5d6867e14570c17012279877647fdaf3aeb0ad0ab4b6b3cc727bb0448b8f;Nächtliche Großkontrolle - 20 Spielautomaten sichergestellt;https://www.zeit.de/news/2024-11/17/naechtliche-grosskontrolle-20-spielautomaten-sichergestellt;Hier finden Sie Informationen zu dem Thema „Illegales Glücksspiel“. Lesen Sie jetzt „Nächtliche Großkontrolle - 20 Spielautomaten sichergestellt“.;"Z+ (abopflichtiger Inhalt);
        
    
Illegales Glücksspiel";News, Illegales Glücksspiel, Elmshorn, Großkontrolle, Glücksspiel, Spielautomat;2024-11-17T14:47:31+01:00;2024-11-17T14:47:31+01:00;;dpa Hamburg/Schleswig-Holstein;false
80e1875c7e036cd6790978d8c6b1d7b306082ddcc854338a3d62b0d7fd77f1ec;Kein Stau trotz mehrstündiger A7-Sperrung bei Rendsburg;https://www.zeit.de/news/2024-11/17/kein-stau-trotz-mehrstuendiger-a7-sperrung-bei-rendsburg;Hier finden Sie Informationen zu dem Thema „Verkehr“. Lesen Sie jetzt „Kein Stau trotz mehrstündiger A7-Sperrung bei Rendsburg“.;"Z+ (abopflichtiger Inhalt);
        
    
Verkehr";News, Verkehr, Rendsburg, Hamburg, Flensburg, Autobahnpolizei, Stau, Verkehr, Sperrung;2024-11-17T14:46:38+01:00;2024-11-17T14:46:38+01:00;;dpa Hamburg/Schleswig-Holstein;false
6afb8867f5946b0e26168c4a41ee38971661fc21c7308d31158b4b96ceedec97;"Slalom-Ass Straßer zum Start geschlagen - ""Winter ist lang""";https://www.zeit.de/news/2024-11/17/slalom-ass-strasser-zum-start-geschlagen-winter-ist-lang;"Hier finden Sie Informationen zu dem Thema „Ski alpin“. Lesen Sie jetzt „Slalom-Ass Straßer zum Start geschlagen - ""Winter ist lang""“.";"Z+ (abopflichtiger Inhalt);
        
    
Ski alpin";News, Ski alpin, Linus Straßer, Lena Dürr, Clement Noel, Hendrik Kristoffersen, Manuel Feller, Marcel Hirscher, Shiffrin, Finnland, Frankreich, Norwegen;2024-11-17T14:45:29+01:00;2024-11-17T14:45:29+01:00;;dpa Sport;false
23ffb377d59f57788b1e1db1b3deb48718d40df4485645076d468042fbaddedb;Erinnerung an Opfer - Volkstrauertag begangen;https://www.zeit.de/news/2024-11/17/erinnerung-an-opfer-volkstrauertag-begangen;Hier finden Sie Informationen zu dem Thema „Gedenktag“. Lesen Sie jetzt „Erinnerung an Opfer - Volkstrauertag begangen“.;"Z+ (abopflichtiger Inhalt);
        
    
Gedenktag";News, Gedenktag, Thadäus König, Bodo Ramelow, St. Margaretha, Eichsfeld, Hildburghausen, Breitenbach, Volkstrauertag, Gedenktag, Krieg in der Ukraine;2024-11-17T14:32:20+01:00;2024-11-17T14:32:20+01:00;;dpa Thüringen;false
6931dfb673fed484d9b3e89acbc62b4b91644bba9b448fe1a5ea6f954760d6ba;Sechs Menschen sterben bei Unfall im Münsterland;https://www.zeit.de/news/2024-11/17/sechs-menschen-sterben-bei-unfall-im-muensterland;Hier finden Sie Informationen zu dem Thema „Auto gerät in Gegenverkehr“. Lesen Sie jetzt „Sechs Menschen sterben bei Unfall im Münsterland“.;"Z+ (abopflichtiger Inhalt);
        
    
Auto gerät in Gegenverkehr";News, Auto gerät in Gegenverkehr, Münsterland, Ochtrup, Polizei, Unfall, Gegenverkehr, Verkehrsunfall, Auto, Fahrzeug;2024-11-17T14:29:39+01:00;2024-11-17T14:29:39+01:00;;dpa;false
6fd00186412ef59dd0583b2d148d6ea23ab07e80915e7e56e3eaf2e473fc816f;Robert Habeck zum Kanzlerkandidaten der Grünen gewählt;https://www.zeit.de/politik/deutschland/2024-11/robert-habeck-zum-kanzlerkandidaten-der-gruenen-gewaehlt;Bundeswirtschaftsminister Robert Habeck wird Spitzenkandidat der Grünen für die Bundestagswahl. Die Delegierten wählten ihn mit 96,5 Prozent der Stimmen.;"Z+ (abopflichtiger Inhalt);
        
    
Spitzenkandidat";Politik, Spitzenkandidat, Robert Habeck, Bündnis 90/Die Grünen, Ampel-Aus, Bundestagswahl, Bundeskanzler, Parteitag, Kanzlerkandidat;2024-11-17T14:28:00+01:00;2024-11-17T14:28:00+01:00;astiyf;ZEIT ONLINE,        AFP,        Reuters,        							ast					,        							iyf;false
b311fcf87b788d2eeef7cb44cfc64ea3a70379a4ca5e3fe1d7b7bccf9a74778e;Weniger Verbindungen, höhere Preise;https://www.zeit.de/mobilitaet/2024-11/oepnv-preissteigerung-bahn-kosten-trassenpreise;Ausgerechnet weil der Bund wieder in die Bahn investiert, wird der Nahverkehr teurer und Verbindungen könnten wegfallen. Aber das Dilemma ließe sich lösen.;"Z+ (abopflichtiger Inhalt);
        
    
ÖPNV";Mobilitaet, ÖPNV, Verkehr, Deutsche Bahn, Nahverkehr, S-Bahn, Fernverkehr, Oliver Wittke;2024-11-17T14:27:21+01:00;2024-11-17T14:27:21+01:00;Paul Meerkamp;;false
c8d5549243a3938b337c753ad10e89e429f1cf6897a16692a471f2cf4d2b701c;Auto kracht gegen Strommast - Fahrer wird schwer verletzt;https://www.zeit.de/news/2024-11/17/auto-kracht-gegen-strommast-fahrer-wird-schwer-verletzt;Hier finden Sie Informationen zu dem Thema „Polizei ermittelt gegen Mann“. Lesen Sie jetzt „Auto kracht gegen Strommast - Fahrer wird schwer verletzt“.;"Z+ (abopflichtiger Inhalt);
        
    
Polizei ermittelt gegen Mann";News, Polizei ermittelt gegen Mann, Neuburg-Schrobenhausen, Schrobenhausen, Polizei, Strommast, Stromverteilerkasten, Auto;2024-11-17T14:26:55+01:00;2024-11-17T14:26:55+01:00;;dpa Bayern;false
468e181be7ddca68eec4e4e62b82a90bd15a40eb9fa426df992d96f55c419fc8;Gedenken an Opfer von Krieg und Gewaltherrschaft;https://www.zeit.de/news/2024-11/17/gedenken-an-opfer-von-krieg-und-gewaltherrschaft;Hier finden Sie Informationen zu dem Thema „Volkstrauertag“. Lesen Sie jetzt „Gedenken an Opfer von Krieg und Gewaltherrschaft“.;"Z+ (abopflichtiger Inhalt);
        
    
Volkstrauertag";News, Volkstrauertag, Schleswig-Holstein, Europa, Volksbund Deutsche Kriegsgräberfürsorge, CDU, Volkstrauertag, Gewaltherrschaft, Krieg in der Ukraine, Herbst;2024-11-17T14:26:30+01:00;2024-11-17T14:26:30+01:00;;dpa Hamburg/Schleswig-Holstein;false
f81f6b5a7f3abd406f58b283edbbe02da31471a65ec332915cee4b0b915ab4b0;"""Ich dachte: Gleich überschlage ich mich""";https://www.zeit.de/2024/46/wasserrutschen-test-hamburg-europaeischen-hof-spa;Wo steht die beste Wasserrutsche? Das weiß Rutschentester Jakob Kaplan. Ein Gespräch über Black-Hole-Effekte, Turborutsche – und die wildesten Ritte Hamburgs.;"Z+ (abopflichtiger Inhalt);
        
    
Wasserrutschen";Hamburg, Wasserrutschen  , Freizeitpark, Hamburg, München, Kinder, Schwimmbad, TÜV, Wasserrutsche;2024-11-17T14:21:45+01:00;2024-11-17T14:21:45+01:00;Tom Kroll;Aus der        ZEIT Nr. 46/2024;false
eee5cbf5cc3b6ffa525f49e7680d0a7226f4025a530eb5ecf25c5c4aeb4af766;"""Ich habe geweint""";https://www.zeit.de/2024/48/simon-and-garfunkel-versoehnung-musik-pop;Paul Simon und Art Garfunkel haben sich versöhnt, es gab Tränen, Umarmungen und ein Mittagessen. Jetzt die große Frage: Bringt Simon zum nächsten Treffen die Gitarre mit?;"Z+ (abopflichtiger Inhalt);
        
    
Simon & Garfunkel";Kultur, Simon & Garfunkel, Musik, Popmusik, Band, Paul Simon, Hollywood, Art Garfunkel;2024-11-17T14:19:00+01:00;2024-11-17T14:19:00+01:00;Christoph Amend;Aus der        ZEIT Nr. 48/2024;false
b765e05e7d42f0febdc54d2ac716f7e3ab84a7e9d91f41309468964bc599b603;Volle Straßen wegen gesperrter Norderelbbrücke auf der A1;https://www.zeit.de/news/2024-11/17/volle-strassen-wegen-gesperrter-norderelbbruecke-auf-der-a1;Hier finden Sie Informationen zu dem Thema „Verkehr“. Lesen Sie jetzt „Volle Straßen wegen gesperrter Norderelbbrücke auf der A1“.;"Z+ (abopflichtiger Inhalt);
        
    
Verkehr";News, Verkehr, Hamburg, Norderelbbrücke, Verkehr, Sperrung;2024-11-17T14:17:51+01:00;2024-11-17T14:17:51+01:00;;dpa Hamburg/Schleswig-Holstein;false
667b4ae0c2301fac50d13341b1b118c2e3fe65216cc7c46f51765245b9980446;Liegt dort mein Klimaparadies?;https://www.zeit.de/2024/47/klimafolgen-naturkatastrophe-wohnort-sicherheit;Wohin auswandern, um Bränden, Fluten, Stürmen zu entgehen? Ein Schweizer Fachmann, der sonst für reiche Menschen neue Wohnorte sucht, hat unsere Autorin beraten.;"Z+ (abopflichtiger Inhalt);
        
    
Klimafolgen";Wissen, Klimafolgen, Klimawandel, Auswanderung, Wohnen, Flut, UN-Klimakonferenz, Klimakrise, Naturkatastrophe;2024-11-17T14:16:02+01:00;2024-11-17T14:16:02+01:00;Laura Cwiertnia;Aus der        ZEIT Nr. 47/2024;false
2373f6b47662add665e4d02301425fb0d234f7e38236b60dd7129345a2043adc;Hunderte Anzeigen wegen unerlaubten Plakatierens;https://www.zeit.de/news/2024-11/17/hunderte-anzeigen-wegen-unerlaubten-plakatierens;Hier finden Sie Informationen zu dem Thema „Ordnungswidrigkeit“. Lesen Sie jetzt „Hunderte Anzeigen wegen unerlaubten Plakatierens“.;"Z+ (abopflichtiger Inhalt);
        
    
Ordnungswidrigkeit";News, Ordnungswidrigkeit, Berlin, Tempelhof-Schöneberg, Alternative für Deutschland, Ordnungswidrigkeit, Anzeige, Plakatieren, Werbezwecke;2024-11-17T14:15:26+01:00;2024-11-17T14:15:26+01:00;;dpa Berlin/Brandenburg;false
758da725aefbdfcbf422a4332efbbe4855b7968ee00a92d4ce3e6f8eba09045c;Schwesig am Volkstrauertag: Haben Verantwortung, zu erinnern;https://www.zeit.de/news/2024-11/17/schwesig-am-volkstrauertag-haben-verantwortung-zu-erinnern;Hier finden Sie Informationen zu dem Thema „Gedenken“. Lesen Sie jetzt „Schwesig am Volkstrauertag: Haben Verantwortung, zu erinnern“.;"Z+ (abopflichtiger Inhalt);
        
    
Gedenken";News, Gedenken, Manuela Schwesig, Mecklenburg-Vorpommern, SPD, Volkstrauertag, Zweiter Weltkrieg, Nationalsozialismus, Verbrechen;2024-11-17T14:09:48+01:00;2024-11-17T14:09:48+01:00;;dpa Mecklenburg-Vorpommern;false
ef360c4087e95da22ca3dffb2199675c1de4adbe120f83ab1bb8c01a79c25df5;Haldenwang will keine Karriere in der Politik machen;https://www.zeit.de/news/2024-11/17/haldenwang-will-keine-karriere-in-der-politik-machen;Hier finden Sie Informationen zu dem Thema „Bundestagswahl“. Lesen Sie jetzt „Haldenwang will keine Karriere in der Politik machen“.;"Z+ (abopflichtiger Inhalt);
        
    
Bundestagswahl";News, Bundestagswahl, Thomas Haldenwang, Verfassungsschutz, CDU, Deutscher Bundestag, Bundestagswahl;2024-11-17T14:08:06+01:00;2024-11-17T14:08:06+01:00;;dpa Nordrhein-Westfalen;false
a33bee5f32701588fc640f7c05697a1a1a938775e3ad48e744adb206cab94aa9;13-jähriger Junge wird von Auto erfasst und schwer verletzt;https://www.zeit.de/news/2024-11/17/13-jaehriger-junge-wird-von-auto-erfasst-und-schwer-verletzt;Hier finden Sie Informationen zu dem Thema „Unfall“. Lesen Sie jetzt „13-jähriger Junge wird von Auto erfasst und schwer verletzt“.;"Z+ (abopflichtiger Inhalt);
        
    
Unfall";News, Unfall, Polizei, Unfall, Auto;2024-11-17T14:00:10+01:00;2024-11-17T14:00:10+01:00;;dpa Baden-Württemberg;false
c1c001701373b23154043ca8b2966ec0687bfd220ad5bfd084e6ac56bfca1fed;Zusteller bewirft Männer mit Paketen - dann folgt Schlägerei;https://www.zeit.de/news/2024-11/17/zusteller-bewirft-maenner-mit-paketen-dann-folgt-schlaegerei;Hier finden Sie Informationen zu dem Thema „Buntes“. Lesen Sie jetzt „Zusteller bewirft Männer mit Paketen - dann folgt Schlägerei“.;"Z+ (abopflichtiger Inhalt);
        
    
Buntes";News, Buntes, Mann, Polizei, Schlägerei;2024-11-17T13:56:26+01:00;2024-11-17T13:56:26+01:00;;dpa Rheinland-Pfalz/Saarland;false
974db2db5ca0f02f1ca26d45920a3e7a4c5ae69ec2ba000a7c991b14797b8861;Auto prallt gegen Baum - Fahrerin schwer verletzt;https://www.zeit.de/news/2024-11/17/auto-prallt-gegen-baum-fahrerin-schwer-verletzt;Hier finden Sie Informationen zu dem Thema „Unfall“. Lesen Sie jetzt „Auto prallt gegen Baum - Fahrerin schwer verletzt“.;"Z+ (abopflichtiger Inhalt);
        
    
Unfall";News, Unfall, Unfall, Auto;2024-11-17T13:55:01+01:00;2024-11-17T13:55:01+01:00;;dpa Baden-Württemberg;false
5d5b2e304f92fcc665c2ae93432e323d853a6a91ad322937590529bb1b396874;Grüne ziehen mit Habeck an der Spitze in die Bundestagswahl;https://www.zeit.de/news/2024-11/17/gruene-ziehen-mit-habeck-an-der-spitze-in-die-bundestagswahl;Hier finden Sie Informationen zu dem Thema „Parteitag“. Lesen Sie jetzt „Grüne ziehen mit Habeck an der Spitze in die Bundestagswahl“.;"Z+ (abopflichtiger Inhalt);
        
    
Parteitag";News, Parteitag, Robert Habeck, Bundestagswahl, Parteitag;2024-11-17T13:54:43+01:00;2024-11-17T13:54:43+01:00;;dpa;false
006c163c82034a234031650f0d313bf36390c55708bdb41b9c783973b96ec22f;Nachbarschaftsstreit eskaliert - Mann in Lebensgefahr;https://www.zeit.de/news/2024-11/17/nachbarschaftsstreit-eskaliert-mann-in-lebensgefahr;Hier finden Sie Informationen zu dem Thema „Kriminalität“. Lesen Sie jetzt „Nachbarschaftsstreit eskaliert - Mann in Lebensgefahr“.;"Z+ (abopflichtiger Inhalt);
        
    
Kriminalität";News, Kriminalität, Nachbarschaftsstreit, Lebensgefahr, Kriminalität;2024-11-17T13:52:48+01:00;2024-11-17T13:52:48+01:00;;dpa Niedersachsen;false
c9d528c448f22711c6b31f80724ab0ebcd8484e02c085b2247b6cb2c7e1b3edf;Hamas-Amt: Fast 100 Tote bei Angriffen im Gazastreifen;https://www.zeit.de/news/2024-11/17/hamas-amt-fast-100-tote-bei-angriffen-im-gazastreifen;Hier finden Sie Informationen zu dem Thema „Gaza-Krieg“. Lesen Sie jetzt „Hamas-Amt: Fast 100 Tote bei Angriffen im Gazastreifen“.;"Z+ (abopflichtiger Inhalt);
        
    
Gaza-Krieg";News, Gaza-Krieg, Gazastreifen, Lahia, Hamas, Angriff;2024-11-17T13:49:15+01:00;2024-11-17T13:49:15+01:00;;dpa;false
52ca65e2c0e48a2f7b125a395cdad0b7d2e471dbaa9cc7957c7ecd8e4bf82476;Erste Schneeflocken im Norden erwartet;https://www.zeit.de/news/2024-11/17/erste-schneeflocken-im-norden-erwartet;Hier finden Sie Informationen zu dem Thema „Wettervorhersage“. Lesen Sie jetzt „Erste Schneeflocken im Norden erwartet“.;"Z+ (abopflichtiger Inhalt);
        
    
Wettervorhersage";News, Wettervorhersage, Hamburg, Schleswig-Holstein, Mecklenburg-Vorpommern, Schneeflocke, Wettervorhersage, Wetter;2024-11-17T13:47:10+01:00;2024-11-17T13:47:10+01:00;;dpa Hamburg/Schleswig-Holstein;false
bf9a27c71d93e0f6ad7e8b61b85d65d23fe89b1450ce377d9663f8787caf1833;Hecking will mögliche Lösung im Fall Riemann mittragen;https://www.zeit.de/news/2024-11/17/hecking-will-moegliche-loesung-im-fall-riemann-mittragen;Hier finden Sie Informationen zu dem Thema „Fußball-Bundesliga“. Lesen Sie jetzt „Hecking will mögliche Lösung im Fall Riemann mittragen“.;"Z+ (abopflichtiger Inhalt);
        
    
Fußball-Bundesliga";News, Fußball-Bundesliga, Manuel Riemann, Dieter Hecking, Bochum, Fußball-Bundesliga, VfL Bochum;2024-11-17T13:42:52+01:00;2024-11-17T13:42:52+01:00;;dpa Nordrhein-Westfalen;false
ccf717ef1f86823ca9c3f71706d0c5a67630ace3d8434a4909cd176ce8d53398;Schnee, Wind und Regen in Baden-Württemberg erwartet;https://www.zeit.de/news/2024-11/17/schnee-wind-und-regen-in-baden-wuerttemberg-erwartet;Hier finden Sie Informationen zu dem Thema „Wettervorhersage“. Lesen Sie jetzt „Schnee, Wind und Regen in Baden-Württemberg erwartet“.;"Z+ (abopflichtiger Inhalt);
        
    
Wettervorhersage";News, Wettervorhersage, Baden-Württemberg, Wettervorhersage;2024-11-17T13:36:16+01:00;2024-11-17T13:36:16+01:00;;dpa Baden-Württemberg;false
1700e10fafa9b8d5c54f1ba5823ba401a9a31567ec0d7c25bb2dabcf3f54f5c1;Neue Woche bringt Schnee nach Bayern;https://www.zeit.de/news/2024-11/17/neue-woche-bringt-schnee-nach-bayern;Hier finden Sie Informationen zu dem Thema „Wettervorhersage“. Lesen Sie jetzt „Neue Woche bringt Schnee nach Bayern“.;"Z+ (abopflichtiger Inhalt);
        
    
Wettervorhersage";News, Wettervorhersage, Bayern, Wettervorhersage;2024-11-17T13:34:21+01:00;2024-11-17T13:34:21+01:00;;dpa Bayern;false
d3b4dd01059bc47ac76ae829e628ae0058ada61bc924b195ddb9590716143a5e;Kirche und Thälmann-Denkmal mit Symbolen beschmiert;https://www.zeit.de/news/2024-11/17/kirche-und-thaelmann-denkmal-mit-symbolen-beschmiert;Hier finden Sie Informationen zu dem Thema „Extremismus“. Lesen Sie jetzt „Kirche und Thälmann-Denkmal mit Symbolen beschmiert“.;"Z+ (abopflichtiger Inhalt);
        
    
Extremismus";News, Extremismus, Polizei, Extremismus, Symbol;2024-11-17T13:31:01+01:00;2024-11-17T13:31:01+01:00;;dpa Berlin/Brandenburg;false
433fdbecf46e91f9dc0a7e0834aae6d8e203a898d428eaa60929b12bb23be0b3;Forscher führen Anstieg der Dengue-Zahlen auf Klimawandel zurück;https://www.zeit.de/wissen/2024-11/denguefieber-klimawandel-ausbreitung-studie;Steigende Temperaturen bedeuten laut einer Studie mehr Infektionen mit bestimmten Krankheiten weltweit. Das Denguefieber könne sich etwa rasant ausbreiten.;"Z+ (abopflichtiger Inhalt);
        
    
Denguefieber";Wissen, Denguefieber, Klimawandel, Infektion, Gesundheitsrisiko, Studie, Forschung, Dengue, Denguefieber;2024-11-17T13:29:12+01:00;2024-11-17T13:29:12+01:00;lak;ZEIT ONLINE,        dpa,        							lak;false
b98b5ac1af8177ad810c582fc3bec70458b8fd04c8d82a4522915e70fb166986;Volkstrauertag im Zeichen der aktuellen Kriege auf der Welt;https://www.zeit.de/news/2024-11/17/volkstrauertag-im-zeichen-der-aktuellen-kriege-auf-der-welt;Hier finden Sie Informationen zu dem Thema „Gedenken“. Lesen Sie jetzt „Volkstrauertag im Zeichen der aktuellen Kriege auf der Welt“.;"Z+ (abopflichtiger Inhalt);
        
    
Gedenken";News, Gedenken, Magdeburg, Sachsen-Anhalt, Volkstrauertag, Gedenkveranstaltung, Kranzniederlegung;2024-11-17T13:26:04+01:00;2024-11-17T13:26:04+01:00;;dpa Sachsen;false
d0cb40a4f5f61c3888123d8169c3c169589933d9b9d79e229b5a75b279f865d5;Ferienhaus abgebrannt - 180.000 Euro Schaden;https://www.zeit.de/news/2024-11/17/ferienhaus-abgebrannt-180-000-euro-schaden;Hier finden Sie Informationen zu dem Thema „Hoher Schaden“. Lesen Sie jetzt „Ferienhaus abgebrannt - 180.000 Euro Schaden“.;"Z+ (abopflichtiger Inhalt);
        
    
Hoher Schaden";News, Hoher Schaden, Hoher Schaden, Landkreis Tübingen, Polizei, Ferienhaus;2024-11-17T13:24:46+01:00;2024-11-17T13:24:46+01:00;;dpa Baden-Württemberg;false
8e31a44ec4db4b9647961d4e99a1ba980092bf0fcc14d40acccf185e6b5b79bf;Tschentscher legt Kranz in KZ-Gedenkstätte Neuengamme nieder;https://www.zeit.de/news/2024-11/17/tschentscher-legt-kranz-in-kz-gedenkstaette-neuengamme-nieder;Hier finden Sie Informationen zu dem Thema „Volkstrauertag“. Lesen Sie jetzt „Tschentscher legt Kranz in KZ-Gedenkstätte Neuengamme nieder“.;"Z+ (abopflichtiger Inhalt);
        
    
Volkstrauertag";News, Volkstrauertag, Peter Tschentscher, Carola Veit, Hamburg, KZ-Gedenkstätte Neuengamme, Volkstrauertag, Gedenkstätte;2024-11-17T13:15:45+01:00;2024-11-17T13:15:45+01:00;;dpa Hamburg/Schleswig-Holstein;false
64dc1d6cfffab091dc777e94183c28b348bb921c5c4068670d37de53f61f6601;"Kane warnt Englands Stars: ""Scheut keine Konfrontation""";https://www.zeit.de/news/2024-11/17/kane-warnt-englands-stars-scheut-keine-konfrontation;"Hier finden Sie Informationen zu dem Thema „Nationaltrainer Thomas Tuchel“. Lesen Sie jetzt „Kane warnt Englands Stars: ""Scheut keine Konfrontation""“.";"Z+ (abopflichtiger Inhalt);
        
    
Nationaltrainer Thomas Tuchel";News, Nationaltrainer Thomas Tuchel, Thomas Tuchel, Harry Kane, England, FC Bayern München, Konfrontation;2024-11-17T13:12:26+01:00;2024-11-17T13:12:26+01:00;;dpa Bayern;false
