Hash;Title;Link;Description;Category;KeyWords;Published;LastUpdated;Author;Source;Paywall
32ff4aa61a44674927dcbc0c8e4253a24415854d8231a063f3228c028daf937a;Louvre meldet erneut Schäden durch eine Überschwemmung;https://www.zeit.de/gesellschaft/2026-02/paris-louvre-wasserschaden-deckenmalerei-museum;Eine erneute Überschwemmung im Louvre hat eine Deckenmalerei beschädigt. Wasser soll aus einem defekten Heizungszuleitungsrohr in einem Technikraum geflossen sein.;Louvre in Paris;Gesellschaft, Louvre in Paris, Louvre, Kunstmuseum, Paris, Überschwemmung, Kunst, Frankreich;2026-02-13T17:30:10+01:00;2026-02-13T17:30:10+01:00;ngo;DIE ZEIT,        dpa,        AFP,        							ngo;false
06667237bde61fe14cee7de3e7c3cffbec7a4f135a3176175d84b25ec3789300;Nord-SPD will bei Parteitag neuen Landesvorsitz wählen;https://www.zeit.de/news/2026-02/13/nord-spd-will-bei-parteitag-neuen-landesvorsitz-waehlen;Hier finden Sie Informationen zu dem Thema „Außerordentlicher Parteitag“. Lesen Sie jetzt „Nord-SPD will bei Parteitag neuen Landesvorsitz wählen“.;Außerordentlicher Parteitag;News, Außerordentlicher Parteitag, Ulf Kämpfer, Serpil Midyatli, SPD, Landesvorsitz, Parteitag;2026-02-13T17:30:04+01:00;2026-02-13T17:30:04+01:00;;dpa Hamburg/Schleswig-Holstein;false
2ff09a5ae307f5c06f1979fc45f56c01229313ebe2f9f495fc9f1c0640b516d5;Ziel: sicher nach Hause kommen - Training für Zugbegleiter;https://www.zeit.de/news/2026-02/13/ziel-sicher-nach-hause-kommen-training-fuer-zugbegleiter;Hier finden Sie Informationen zu dem Thema „Sicherheit für Bahnmitarbeiter“. Lesen Sie jetzt „Ziel: sicher nach Hause kommen - Training für Zugbegleiter“.;Sicherheit für Bahnmitarbeiter;News, Sicherheit für Bahnmitarbeiter, Erfurt, Sachsen, Thüringen, Rheinland-Pfalz, Sachsen-Anhalt, Deutsche Bahn, Sicherheit, Senioren;2026-02-13T17:27:07+01:00;2026-02-13T17:27:07+01:00;;dpa Sachsen;false
06a9b446af95de5288a65028a6ce253050468965b2f5e1950e5b6908e696ca3b;Messerattacke bei Karnevalsfeier in Grefrath;https://www.zeit.de/news/2026-02/13/mutmasslich-versuchte-toetung-nach-karnevalsfeier-in-grefrath;Hier finden Sie Informationen zu dem Thema „Kriminalität“. Lesen Sie jetzt „Messerattacke bei Karnevalsfeier in Grefrath“.;Kriminalität;News, Kriminalität, Grefrath, Karnevalsfeier, Kriminalität, Tötung;2026-02-13T17:27:05+01:00;2026-02-13T17:27:05+01:00;;dpa Nordrhein-Westfalen;false
8ae6c45a0f5fb00cb622c24164fe49f19813ec24ff2ff973b4a1da4758c62aa3;Frau in Hotel festgehalten: Mutmaßlicher Erpresser gefasst;https://www.zeit.de/news/2026-02/13/frau-in-hotel-festgehalten-mutmasslicher-erpresser-gefasst;Hier finden Sie Informationen zu dem Thema „Kriminalität“. Lesen Sie jetzt „Frau in Hotel festgehalten: Mutmaßlicher Erpresser gefasst“.;Kriminalität;News, Kriminalität, Mann, Köln, Polizei, Spezialeinheit, Kriminalität, Erpresser;2026-02-13T17:26:58+01:00;2026-02-13T17:26:58+01:00;;dpa Nordrhein-Westfalen;false
cad343ca27812423a4a8d7f5619242dff2d7667302e0e0a49e52a8fddcc224fe;Nach Protesten: DB Museum Halle öffnet wieder für Besucher;https://www.zeit.de/news/2026-02/13/nach-protesten-db-museum-halle-oeffnet-wieder-fuer-besucher;Hier finden Sie Informationen zu dem Thema „Verkehr“. Lesen Sie jetzt „Nach Protesten: DB Museum Halle öffnet wieder für Besucher“.;Verkehr;News, Verkehr, Halle, DDR, DB, Deutsche Bahn, Verkehr;2026-02-13T17:24:40+01:00;2026-02-13T17:24:40+01:00;;dpa Sachsen;false
ba3858c79e791da59f4e7dbcc36a46ae58c03305b6ed76989e293da686d9f0d9;Zwei Tote bei Glätte-Unfällen - Winter bleibt;https://www.zeit.de/news/2026-02/13/b105-nach-unfall-voll-gesperrt;Hier finden Sie Informationen zu dem Thema „Verkehr“. Lesen Sie jetzt „Zwei Tote bei Glätte-Unfällen - Winter bleibt“.;Verkehr;News, Verkehr, Feuerwehr, Unfall, Verkehr, Ortsumgehung;2026-02-13T17:24:12+01:00;2026-02-13T17:24:12+01:00;;dpa Mecklenburg-Vorpommern;false
ef8064c9d2737c1c36d3d60c703fac991695e8a964f4099a52de834514324a5b;Pinkel und Pfeife - Ein besonderes Mahl wie vor 480 Jahren;https://www.zeit.de/news/2026-02/13/pinkel-und-pfeife-ein-besonderes-mahl-wie-vor-480-jahren;Hier finden Sie Informationen zu dem Thema „Tradition“. Lesen Sie jetzt „Pinkel und Pfeife - Ein besonderes Mahl wie vor 480 Jahren“.;Tradition;News, Tradition, Vincent Clerc, Mærsk, Treffen, Kapitänsuniform, Schaffermahlzeit, Tradition;2026-02-13T17:14:03+01:00;2026-02-13T17:14:03+01:00;;dpa Niedersachsen;false
5cbce8bb151ac776a31ea576f85ceb4ea8b1a6525ac07f969c51a3fc1a35e204;Italienische Biathletin darf trotz positiver Dopingprobe starten;https://www.zeit.de/sport/2026-02/olympia-2026-biathlon-rebecca-passler-doping;Ein Gericht hat die Suspendierung der Biathletin Rebecca Passler wegen Dopings aufgehoben. Sie soll die Substanz unbeabsichtigt eingenommen haben – über ein Nutella-Glas.;Winterspiele;Sport, Winterspiele, Olympische Winterspiele, Wintersport, Doping, Italien;2026-02-13T17:12:16+01:00;2026-02-13T17:12:16+01:00;yer;DIE ZEIT,        SID,        dpa,        							yer;false
0a69eb3ce910a14448e4c72336b449bd22728cb735631c12debbd155bd5b39e6;US-Inflationsrate sinkt im Januar stärker als erwartet;https://www.zeit.de/wirtschaft/2026-02/verbraucherpreise-usa-inflationsrate-januar-2-4-prozent;Die Verbraucherpreise in den USA sind im Januar um 2,4 Prozent gestiegen – deutlich weniger als erwartet. Auswirkungen der US-Zollpolitik zeigen sich bislang kaum.;Verbraucherpreise;Wirtschaft, Verbraucherpreise, USA, Inflation, Fed, Verbraucherpreis, US-Wirtschaft, US-Zölle;2026-02-13T17:01:50+01:00;2026-02-13T17:01:50+01:00;skö;DIE ZEIT,        Reuters,        dpa,        AFP,        							skö;false
ef9339b79290b950c83489153df915b7728549d73fb7bb3731e37eb39adcd528;Sondersitzung Landtag - Linke für strengere Förderregeln;https://www.zeit.de/news/2026-02/13/zalando-aus-in-erfurt-linke-fuer-strengere-foerderregeln;Hier finden Sie Informationen zu dem Thema „Internet-Modehändler“. Lesen Sie jetzt „Sondersitzung Landtag - Linke für strengere Förderregeln“.;Internet-Modehändler;News, Internet-Modehändler, Erfurt, Zalando, Die Linke, Förderregel, Sondersitzung, Logistik;2026-02-13T16:58:48+01:00;2026-02-13T16:58:48+01:00;;dpa Thüringen;false
4290a56ed02fd41ab336ec0514a13de7e1b76c6df011ce0c5db2bdb82569c889;"""Auch die USA sind abhängig von Europa""";https://www.zeit.de/digital/datenschutz/2026-02/bundesamt-fuer-sicherheit-und-informationstechnik-digitale-souveraenitaet-sicherheit;Claudia Plattners Behörde entscheidet, welche Software sicher genug für die Regierung ist. Sie arbeitet auch mit Amazon und Google zusammen. Kann das gut gehen?;"Z+ (abopflichtiger Inhalt);
        
    Bundesamt für Sicherheit in der Informationstechnik";Digital, Bundesamt für Sicherheit in der Informationstechnik, IT-Sicherheit, Informationstechnik, Google, Technologie, Digitalisierung, Microsoft;2026-02-13T16:58:44+01:00;2026-02-13T16:58:44+01:00;Pauline SchinkelsJakob von Lindern;;false
b1dcd592ce58f5cfd4a266240997e846d86cbe956719006927b7629c990c696b;Hohe Geldstrafe für den 1. FC Köln wegen zündelnder Fans;https://www.zeit.de/news/2026-02/13/hohe-geldstrafe-fuer-den-1-fc-koeln-wegen-zuendelnder-fans;Hier finden Sie Informationen zu dem Thema „Fußball-Bundesliga“. Lesen Sie jetzt „Hohe Geldstrafe für den 1. FC Köln wegen zündelnder Fans“.;Fußball-Bundesliga;News, Fußball-Bundesliga, 1. FC Köln, Deutscher Fußball-Bund, Fußball-Bundesliga, Geldstrafe, Sportgericht;2026-02-13T16:57:09+01:00;2026-02-13T16:57:09+01:00;;dpa Nordrhein-Westfalen;false
1f1079365ef009609fa560377669bb70a04d1d46b042359971638c3d995c4c1c;Doping-Suspendierung von Passler aufgehoben - Start möglich;https://www.zeit.de/news/2026-02/13/doping-suspendierung-von-passler-aufgehoben-start-moeglich;Hier finden Sie Informationen zu dem Thema „Winterspiele in Antholz“. Lesen Sie jetzt „Doping-Suspendierung von Passler aufgehoben - Start möglich“.;Winterspiele in Antholz;News, Winterspiele in Antholz, Rebecca Passler, Antholz, Italien, Mailand, Internationaler Sportgerichtshof, Olympische Winterspiele, Olympia, Winterspiel, Dopingbefund, Suspendierung;2026-02-13T16:53:07+01:00;2026-02-13T16:53:07+01:00;;dpa Sport;false
a9f92d50d8dc8684a48aef5d1c8c0b87da0eea158778c68c1d605960f6961294;Rauch aus Triebfahrzeug – ICE mit 280 Passagieren evakuiert;https://www.zeit.de/news/2026-02/13/rauch-aus-triebfahrzeug-ice-mit-280-passagieren-evakuiert;Hier finden Sie Informationen zu dem Thema „Strecke München-Karlsruhe“. Lesen Sie jetzt „Rauch aus Triebfahrzeug – ICE mit 280 Passagieren evakuiert“.;Strecke München-Karlsruhe;News, Strecke München-Karlsruhe, München-Karlsruhe, München, Karlsruhe, Dornstadt, Alb-Donau-Kreis, Bundespolizei, Triebfahrzeug, ICE;2026-02-13T16:52:28+01:00;2026-02-13T16:52:28+01:00;;dpa Baden-Württemberg;false
79b5847dd66f84bd27c0e3ab6b24c1e8c58638d12e2b6ac696b6baed43194b87;"""Die Leute werden eher den letzten Sperrmüll in die Wohnung stellen""";https://www.zeit.de/wirtschaft/2026-02/wunderflats-jan-hase-plattform-befristete-moeblierte-wohnungen-mietmarkt-gxe;Justizministerin Stefanie Hubig will möblierte Kurzzeitvermietungen begrenzen. Jan Hase, Chef eines Vermittlers möblierter Wohnungen, hält ihre Regeln für lebensfremd.;"Z+ (abopflichtiger Inhalt);
        
    Wunderflats";Wirtschaft, Wunderflats, Immobilienmarkt, Wohnen, Miete, Möbel, Stefanie Hubig, Berlin;2026-02-13T16:50:55+01:00;2026-02-13T16:50:55+01:00;Marcus Rohwetter;;false
cd2d636d7b8e281157bdf7fa16ff4851c279bd7b4f69ffee9206d0e99fe9fdf7;Zoff um Job für Angehörige – Kostet das Frohnmaier Prozente?;https://www.zeit.de/news/2026-02/13/zoff-um-job-fuer-angehoerige-kostet-das-frohnmaier-prozente;Hier finden Sie Informationen zu dem Thema „Über-Kreuz-Beschäftigungen“. Lesen Sie jetzt „Zoff um Job für Angehörige – Kostet das Frohnmaier Prozente?“.;Über-Kreuz-Beschäftigungen;News, Über-Kreuz-Beschäftigungen, Anton Baron, Emil Sänze, Johann Martel, Frank Brettschneider, Tino Chrupalla, Baden-Württemberg, Sachsen-Anhalt, Alternative für Deutschland, Deutsche Presse-Agentur, Deutscher Bundestag;2026-02-13T16:50:29+01:00;2026-02-13T16:50:29+01:00;;dpa Baden-Württemberg;false
337ad41564a3c10a3de3f6d52fecdc462faef69f70e0ec65b9d9f347a433376f;Tochter getötet – Staatsanwaltschaft beantragt Unterbringung;https://www.zeit.de/news/2026-02/13/tochter-getoetet-staatsanwaltschaft-beantragt-unterbringung;Hier finden Sie Informationen zu dem Thema „Kriminalität“. Lesen Sie jetzt „Tochter getötet – Staatsanwaltschaft beantragt Unterbringung“.;Kriminalität;News, Kriminalität, Bollschweil, Breisgau, Staatsanwaltschaft, Polizei, Unterbringung, Kriminalität;2026-02-13T16:48:25+01:00;2026-02-13T16:48:25+01:00;;dpa Baden-Württemberg;false
7daaac2902c3d69156468fe3603c2c71700e7248d06a277695b9cf8520da6bf8;"""Katastrophal"": Land kritisiert Sparkurs bei Integration";https://www.zeit.de/news/2026-02/13/katastrophal-land-kritisiert-sparkurs-bei-integration;"Hier finden Sie Informationen zu dem Thema „Brief an Dobrindt“. Lesen Sie jetzt „""Katastrophal"": Land kritisiert Sparkurs bei Integration“.";Brief an Dobrindt;News, Brief an Dobrindt, Alexander Dobrindt, Olaf Lie, Julia Willie Hamburg, Niedersachsen, SPD, CSU, Deutsche Presse-Agentur, Bamf, Sparkurs;2026-02-13T16:47:28+01:00;2026-02-13T16:47:28+01:00;;dpa Niedersachsen;false
04f9a56619a101e3dd415ea050e85ce7ca173c98e0d5f8032b1af20e1d4f4b32;Wie gut lässt sich Intelligenz verstecken?;https://www.zeit.de/zeit-wissen/2026/02/intelligenz-psychologie-kompetenzen-rhetorik-fachsprache;Kommt drauf an, ob sie hoch oder niedrig ist. Und ob man ein Mensch oder eine Maschine ist. Warum es einfacher ist, sich schlau zu stellen, als dumm.;"Z+ (abopflichtiger Inhalt);
        
    Intelligenz";Wissen, Intelligenz, Intelligenz, Psychologie, künstliche Intelligenz, Soziologie;2026-02-13T16:42:38+01:00;2026-02-13T16:42:38+01:00;Tobias Hürter;Aus        ZEIT Wissen Nr. 02/2026;false
25443caf2f95a83cd98983b4b08a37653b26a2c37b16a01c11d982cccfd4dad5;Keine Sorgen? Gesperrter SC-Trainer Schuster vertraut Voßler;https://www.zeit.de/news/2026-02/13/keine-sorgen-gesperrter-sc-trainer-schuster-vertraut-vossler;Hier finden Sie Informationen zu dem Thema „Fußball-Bundesliga“. Lesen Sie jetzt „Keine Sorgen? Gesperrter SC-Trainer Schuster vertraut Voßler“.;Fußball-Bundesliga;News, Fußball-Bundesliga, Lars Voßler, Johan Manzambi, Lukas Kübler, Philipp Lienhart, Julian Schuster, Christian Ilzer, Voßler, Hoffenheim, Sinsheim, Freiburg;2026-02-13T16:42:16+01:00;2026-02-13T16:42:16+01:00;;dpa Baden-Württemberg;false
46b2b3abc35487f567b6bc855d09377dde8de712e4ab9d942c316f4a6b3a2e0c;Berlin will mit internationaler Strahlkraft punkten;https://www.zeit.de/news/2026-02/13/berlin-will-mit-internationaler-strahlkraft-punkten;Hier finden Sie Informationen zu dem Thema „Olympia-Bewerbung“. Lesen Sie jetzt „Berlin will mit internationaler Strahlkraft punkten“.;Olympia-Bewerbung;News, Olympia-Bewerbung, Kai Wegner, Berlin, CDU, Olympia, Strahlkraft;2026-02-13T16:38:48+01:00;2026-02-13T16:38:48+01:00;;dpa Berlin/Brandenburg;false
003c6dc8a5e67b1ff8f26bffa7fdc321fee65f14ea9155ff3064f86f117c1f45;"""Von untreuem Kerl geschlagen"": Sticheleien gegen Laegreid";https://www.zeit.de/news/2026-02/13/horn-im-biathlon-sprint-bei-olympia-in-antholz-zehnter;"Hier finden Sie Informationen zu dem Thema „Biathlon bei Olympia“. Lesen Sie jetzt „""Von untreuem Kerl geschlagen"": Sticheleien gegen Laegreid“.";Biathlon bei Olympia;News, Biathlon bei Olympia, Philipp Horn, Quentin Fillon, Philipp Nawrath, Antholz, Olympia, Olympische Winterspiele, Winterspiel, Einzelrennen, Strafrunde;2026-02-13T16:38:05+01:00;2026-02-13T16:38:05+01:00;;dpa Sport;false
94d4ea25f73386bc60d20fc17b880069a0fe94c035f249f6e677a68fa028725f;Anouschka Renzi als Bösewichtin beim Piraten Open Air 2026;https://www.zeit.de/news/2026-02/13/anouschka-renzi-als-boesewichtin-beim-piraten-open-air-2026;Hier finden Sie Informationen zu dem Thema „Promi bei Theater Open Air“. Lesen Sie jetzt „Anouschka Renzi als Bösewichtin beim Piraten Open Air 2026“.;Promi bei Theater Open Air;News, Promi bei Theater Open Air, Anouschka Renzi, Sommer;2026-02-13T16:36:42+01:00;2026-02-13T16:36:42+01:00;;dpa Mecklenburg-Vorpommern;false
54d57863aec7aa61c2823824d2027c134ad63dc2d997387279059ea168cd1e6e;Staatsanwalt vor Gericht - Gesuchter in den Emiraten gefasst;https://www.zeit.de/news/2026-02/13/staatsanwalt-vor-gericht-gesuchter-in-den-emiraten-gefasst;Hier finden Sie Informationen zu dem Thema „Kriminalität“. Lesen Sie jetzt „Staatsanwalt vor Gericht - Gesuchter in den Emiraten gefasst“.;Kriminalität;News, Kriminalität, Vereinigte Arabische Emirate, Justizministerium, Staatsanwaltschaft, Landgericht Hannover, Emirat, Drogenverfahren, Kriminalität, Festnahme;2026-02-13T16:35:49+01:00;2026-02-13T16:35:49+01:00;;dpa Niedersachsen;false
baf27c604ccc2e4d3ecc846897f79748fa849dd0e728e1d23e0373883537be5d;Weiträumige Umleitung – A2 bei Dortmund mehrere Tage dicht;https://www.zeit.de/news/2026-02/13/weitraeumige-umleitung-a2-bei-dortmund-mehrere-tage-dicht;Hier finden Sie Informationen zu dem Thema „Verkehr“. Lesen Sie jetzt „Weiträumige Umleitung – A2 bei Dortmund mehrere Tage dicht“.;Verkehr;News, Verkehr, Hannover, Dortmund, Ruhrgebiet, die Autobahn GmbH des Bundes, Umleitung, Verkehr;2026-02-13T16:34:36+01:00;2026-02-13T16:34:36+01:00;;dpa Nordrhein-Westfalen;false
a6d944552b951016a9698a6e2d41686ab2d83d49ce2308b3ba8a6cf09bea196a;"Verdi will mit ""Wellenstreiks"" Druck machen";https://www.zeit.de/news/2026-02/13/verdi-will-mit-wellenstreiks-druck-machen;"Hier finden Sie Informationen zu dem Thema „Tarifkonflikt“. Lesen Sie jetzt „Verdi will mit ""Wellenstreiks"" Druck machen“.";Tarifkonflikt;News, Tarifkonflikt, Ver.di, Wellenstreik, Hochbahn, Tarifkonflikt, Warnstreik;2026-02-13T16:34:04+01:00;2026-02-13T16:34:04+01:00;;dpa Hamburg/Schleswig-Holstein;false
ecd4211846561b8b799c65d33dfb6e992532214f543e5837d914d8d30d26372e;VfL Wolfsburg: Häme als Extra-Motivation im Abstiegskampf;https://www.zeit.de/news/2026-02/13/vfl-wolfsburg-haeme-als-extra-motivation-im-abstiegskampf;Hier finden Sie Informationen zu dem Thema „Fußball-Bundesliga“. Lesen Sie jetzt „VfL Wolfsburg: Häme als Extra-Motivation im Abstiegskampf“.;Fußball-Bundesliga;News, Fußball-Bundesliga, Daniel Bauer, Wolfsburg, VfL Wolfsburg, Fußball-Bundesliga, Abstiegskampf;2026-02-13T16:33:49+01:00;2026-02-13T16:33:49+01:00;;dpa Niedersachsen;false
3da77c27b227b6d9cc1cc07f7558eac875be8395269b260b0e32986185b5586f;Was eine Bahn-Ausbilderin über den Einsatz von Bodycams sagt;https://www.zeit.de/news/2026-02/13/was-eine-bahn-ausbilderin-ueber-den-einsatz-von-bodycams-sagt;Hier finden Sie Informationen zu dem Thema „Sicherheitsdebatte“. Lesen Sie jetzt „Was eine Bahn-Ausbilderin über den Einsatz von Bodycams sagt“.;Sicherheitsdebatte;News, Sicherheitsdebatte, Jennifer Morasch, Berlin, Pfalz, Rheinland-Pfalz, Bodycam, Sicherheitsdebatte, Sicherheit;2026-02-13T16:32:39+01:00;2026-02-13T16:32:39+01:00;;dpa Rheinland-Pfalz/Saarland;false
eb224a78cb0632b0e3ef9228e469ebecef460c936c2d2a87aa489d8f51856c75;Deutsch-ukrainisches Rüstungsunternehmen beginnt mit Drohnenproduktion;https://www.zeit.de/politik/ausland/ukraine-krieg-news-liveblog;Ein deutsch-ukrainisches Unternehmen will bis Jahresende in Deutschland mindestens 10.000 Drohnen herstellen. Mark Rutte nennt die russische Armee langsam. Das Liveblog;Liveblog:                     Krieg gegen die Ukraine;Politik, Krieg gegen die Ukraine, Krieg in der Ukraine, Marco Rubio, Florida, Waffenruhe, Russland, Polen;2026-02-14T07:19:47+00:00;2026-02-14T07:19:47+00:00;Alexander EydlinIven Yorick Fenker;;false
f2acca80531b30066da0941332a055764efa71f5a68b3384814267a08782418b;Frankfurt will Protest vor geschlossener Moschee stoppen;https://www.zeit.de/news/2026-02/13/frankfurt-will-protest-vor-geschlossener-moschee-stoppen;Hier finden Sie Informationen zu dem Thema „Religion“. Lesen Sie jetzt „Frankfurt will Protest vor geschlossener Moschee stoppen“.;Religion;News, Religion, Frankfurt, Verwaltungsgericht, Treffen, Moschee, Muslime;2026-02-13T16:25:47+01:00;2026-02-13T16:25:47+01:00;;dpa Hessen;false
7f5c73cec545f7f0b5d13b4bf0b7cd0e7c982c2045c20d523dda1a54c6f8e966;Saarbrücken hofft auf Leichtigkeit des neuen Coaches;https://www.zeit.de/news/2026-02/13/saarbruecken-hofft-auf-leichtigkeit-des-neuen-coaches;Hier finden Sie Informationen zu dem Thema „3. Liga“. Lesen Sie jetzt „Saarbrücken hofft auf Leichtigkeit des neuen Coaches“.;3. Liga;News, 3. Liga, Argirios Giannikis, Saarbrücken, 1. FC Saarbrücken, VfB Stuttgart II, Leichtigkeit;2026-02-13T16:25:40+01:00;2026-02-13T16:25:40+01:00;;dpa Rheinland-Pfalz/Saarland;false
a2efeb0c5d4158e2b866013a4ba98f63bda81e83eff2bea41a91c63f866487f0;Tarifstreit um öffentlichen Dienst zäher als erwartet;https://www.zeit.de/news/2026-02/13/noch-kein-durchbruch-in-tarifstreit;Hier finden Sie Informationen zu dem Thema „Tarifverhandlungen“. Lesen Sie jetzt „Tarifstreit um öffentlichen Dienst zäher als erwartet“.;Tarifverhandlungen;News, Tarifverhandlungen, Volker Geyer, Potsdam, Beamtenbund, Ver.di, Tarifstreit, Tarifverhandlung, Durchbruch;2026-02-13T16:24:37+01:00;2026-02-13T16:24:37+01:00;;dpa;false
4eaca79c8050b7afdd275bbbbb625b419eaa6c5d1f643a3604f652b2b3b132ba;Entwarnung nach Fund von verdächtigem Koffer in Hanau;https://www.zeit.de/news/2026-02/13/verdaechtiger-gegenstand-in-hanauer-innenstadt-gefunden;Hier finden Sie Informationen zu dem Thema „Bereich gesperrt“. Lesen Sie jetzt „Entwarnung nach Fund von verdächtigem Koffer in Hanau“.;Bereich gesperrt;News, Bereich gesperrt, Innenstadt, Gegenstand;2026-02-13T16:24:36+01:00;2026-02-13T16:24:36+01:00;;dpa Hessen;false
daaa3a9c61b57162aa3b80a3f699aa9edd2f3431bed5ce4dfe96130d0d932f98;Verdacht auf Trunkenheit am Steuer bei Busfahrerin;https://www.zeit.de/news/2026-02/13/verdacht-auf-trunkenheit-am-steuer-bei-busfahrerin;Hier finden Sie Informationen zu dem Thema „Kriminalität“. Lesen Sie jetzt „Verdacht auf Trunkenheit am Steuer bei Busfahrerin“.;Kriminalität;News, Kriminalität, Polizei, Trunkenheit, Kriminalität;2026-02-13T16:22:35+01:00;2026-02-13T16:22:35+01:00;;dpa Hamburg/Schleswig-Holstein;false
ece268aa553dc42e664b7a364ba7eea3b45731c06091d47deab2ac1282e52cd2;Drohbrief und Steinwurf auf Haus von Kommunalwahlkandidat;https://www.zeit.de/news/2026-02/13/drohbrief-und-steinwurf-auf-haus-von-kommunalwahlkandidat;Hier finden Sie Informationen zu dem Thema „Kriminalität“. Lesen Sie jetzt „Drohbrief und Steinwurf auf Haus von Kommunalwahlkandidat“.;Kriminalität;News, Kriminalität, Polizei, Drohbrief, Steinwurf, Kriminalität;2026-02-13T16:17:37+01:00;2026-02-13T16:17:37+01:00;;dpa Bayern;false
18143f9e51903de7bef79e3a9c216f858e8d4c270352a863f4800ee833a2bc7d;"Osnabrück-OB: ""Nicht alle Schulausfälle waren nötig""";https://www.zeit.de/news/2026-02/13/osnabrueck-ob-nicht-alle-schulausfaelle-waren-noetig;"Hier finden Sie Informationen zu dem Thema „Wintereinbruch im Januar“. Lesen Sie jetzt „Osnabrück-OB: ""Nicht alle Schulausfälle waren nötig""“.";Wintereinbruch im Januar;News, Wintereinbruch im Januar, Katharina Pötter, Osnabrück, CDU, Schulausfall, Wintereinbruch, Eis;2026-02-13T16:17:29+01:00;2026-02-13T16:17:29+01:00;;dpa Niedersachsen;false
13ff05ba6ea798cd18bee4bdc600a0f2e721a8034edac451c32b986bc62a6012;Noch kein Burkardt-Comeback bei Eintracht Frankfurt;https://www.zeit.de/news/2026-02/13/noch-kein-burkardt-comeback-bei-eintracht-frankfurt;Hier finden Sie Informationen zu dem Thema „Fußball-Bundesliga“. Lesen Sie jetzt „Noch kein Burkardt-Comeback bei Eintracht Frankfurt“.;Fußball-Bundesliga;News, Fußball-Bundesliga, Jonathan Burkardt, Albert Riera, Arthur Theate, Eintracht Frankfurt, Borussia Mönchengladbach, Fußball-Bundesliga, Pflichtspiel;2026-02-13T16:17:28+01:00;2026-02-13T16:17:28+01:00;;dpa Hessen;false
c31b2097fe5e6749b9bf80c5c9488da9de1b881d461f5b0725bd0ade7131dece;"So groß ist XXL-Schneemann ""Jakob"" in diesem Jahr";https://www.zeit.de/news/2026-02/13/wissenswertes-zum-riesenschneemann-jakob;"Hier finden Sie Informationen zu dem Thema „Winter“. Lesen Sie jetzt „So groß ist XXL-Schneemann ""Jakob"" in diesem Jahr“.";Winter;News, Winter, Wilhelm Zapf, Bischofsgrün, Fichtelgebirge, Landkreis Bayreuth, Riesenschneemann, Winter;2026-02-13T16:14:28+01:00;2026-02-13T16:14:28+01:00;;dpa Bayern;false
cdc8bf95871e4fe3dec031391cc02ac70c81db9be9d1ebc83dbd5f3c5ecb0bcb;Wo die USA verwundbar sind;https://www.zeit.de/politik/deutschland/2026-02/europa-usa-donald-trump-dezernat-zukunft;Der US-Präsident nutzt seine Wirtschaftsmacht, um andere Länder zu erpressen. Doch eine Studie zeigt nun die Schwachstellen der USA – und wie Europa Trump schaden könnte.;"Z+ (abopflichtiger Inhalt);
        
    Europa und die USA";Politik, Europa und die USA, Donald Trump, USA, Europäische Union, Europa, Wirtschaftspolitik, US-Zölle;2026-02-13T16:12:18+01:00;2026-02-13T16:12:18+01:00;Mark SchieritzMoritz Matzner;;false
f25c2cce43dbd1b3b16933d559ded273b13f1b3efc63acc727b2677f0b5b4656;ExxonMobil-Beschäftigte arbeiten wieder unter Tarifverträgen;https://www.zeit.de/news/2026-02/13/exxonmobil-beschaeftigte-arbeiten-wieder-unter-tarifvertraegen;Hier finden Sie Informationen zu dem Thema „Öl und Gas“. Lesen Sie jetzt „ExxonMobil-Beschäftigte arbeiten wieder unter Tarifverträgen“.;Öl und Gas;News, Öl und Gas, Hamburg, Hannover, Exxon Mobil, ExxonMobil, IG BCE, Tarifvertrag, Gaskonzern;2026-02-13T16:12:01+01:00;2026-02-13T16:12:01+01:00;;dpa Hamburg/Schleswig-Holstein;false
7667aa83fa4df2705dedf37dee982fd2d0897046a652133f80a3476fc552dacb;Bundeskanzler Merz will transatlantische Beziehung neu ausrichten;https://www.zeit.de/politik/2026-02/friedrich-merz-muenchner-sicherheitskonferenz-rede-aussenpolitik;"""Die internationale Ordnung gibt es nicht mehr"", mahnt Kanzler Merz auf der Münchner Sicherheitskonferenz. Er kritisiert die USA deutlich, reicht aber auch die Hand.";Münchner Sicherheitskonferenz;Politik, Münchner Sicherheitskonferenz, Friedrich Merz, Münchner Sicherheitskonferenz, USA, CDU, Außenpolitik, Marco Rubio;2026-02-13T16:11:35+01:00;2026-02-13T16:11:35+01:00;Leon Ginzel;;false
2eedb41a56dfc06bd1cc727e0c45a33abc93252e67ad707a755f777a965cf80a;Erste Kundgebungen rund um die Münchner Sicherheitskonferenz;https://www.zeit.de/news/2026-02/13/kletterer-entrollen-protest-transparent-an-kran-in-muenchen;Hier finden Sie Informationen zu dem Thema „Demonstrationen“. Lesen Sie jetzt „Erste Kundgebungen rund um die Münchner Sicherheitskonferenz“.;Demonstrationen;News, Demonstrationen, München, Greenpeace, Münchner Sicherheitskonferenz, Baukran, Sicherheit;2026-02-13T16:10:58+01:00;2026-02-13T16:10:58+01:00;;dpa Bayern;false
d61c9da7d3a397d2d896d6544b8d336ed20ddb4d39ee786ab00323328ebde233;Nach Streit mit Schwerverletztem: Mutmaßlicher Täter in Haft;https://www.zeit.de/news/2026-02/13/nach-streit-mit-schwerverletztem-mutmasslicher-taeter-in-haft;Hier finden Sie Informationen zu dem Thema „Versuchter Totschlag“. Lesen Sie jetzt „Nach Streit mit Schwerverletztem: Mutmaßlicher Täter in Haft“.;Versuchter Totschlag;News, Versuchter Totschlag, Totschlag;2026-02-13T16:07:07+01:00;2026-02-13T16:07:07+01:00;;dpa Hessen;false
e78994eaaff63d574233642fa20438ab56d5ba68c8b3d14dbb023749e2a21dbf;Prozess gegen Letzte Generation nicht vor Ende 2026;https://www.zeit.de/news/2026-02/13/prozess-gegen-letzte-generation-nicht-vor-ende-2026;Hier finden Sie Informationen zu dem Thema „Verfahren gegen Aktivisten“. Lesen Sie jetzt „Prozess gegen Letzte Generation nicht vor Ende 2026“.;Verfahren gegen Aktivisten;News, Verfahren gegen Aktivisten, Potsdam, Letzte Generation;2026-02-13T16:06:23+01:00;2026-02-13T16:06:23+01:00;;dpa Berlin/Brandenburg;false
