Hash;Title;Link;Description;Category;KeyWords;Published;LastUpdated;Author;Source;Paywall
7951b00567f86ea57c4e40b028bd5f695e9028c5a0c695f7dbcd1cbd9dd31077;Frauen in Berlin: Lohnlücke etwas geschrumpft;https://www.zeit.de/news/2025-02/27/frauen-in-berlin-lohnluecke-etwas-geschrumpft;Hier finden Sie Informationen zu dem Thema „Internationaler Frauentag“. Lesen Sie jetzt „Frauen in Berlin: Lohnlücke etwas geschrumpft“.;Internationaler Frauentag;News, Internationaler Frauentag, Cansel Kiziltepe, Mann, Berlin, SPD, Frauentag, Lohnlücke, Familie;2025-02-27T12:53:59+01:00;2025-02-27T12:53:59+01:00;;dpa Berlin/Brandenburg;false
4e3467f301a87073679987059840d3e688b62ff8f4999907ad67269a29a9e73a;Beiersdorf wächst etwas schwächer;https://www.zeit.de/news/2025-02/27/beiersdorf-waechst-etwas-schwaecher;Hier finden Sie Informationen zu dem Thema „Konsumgüter“. Lesen Sie jetzt „Beiersdorf wächst etwas schwächer“.;Konsumgüter;News, Konsumgüter, Beiersdorf, Hamburg, Konsumgut, Konsumgüterkonzern, Umsatz, Wechselkurseffekt, Dax;2025-02-27T12:52:45+01:00;2025-02-27T12:52:45+01:00;;dpa Hamburg/Schleswig-Holstein;false
1528014a3e6ea1b72569c14f1d797ae700bd40a71ed9eb0d1a9d45bad8ef2487;Mehr als 700 Aussteller bei Verbrauchermesse im März;https://www.zeit.de/news/2025-02/27/mehr-als-700-aussteller-bei-verbrauchermesse-im-maerz;Hier finden Sie Informationen zu dem Thema „Verbrauchermesse“. Lesen Sie jetzt „Mehr als 700 Aussteller bei Verbrauchermesse im März“.;Verbrauchermesse;News, Verbrauchermesse, Thüringen, Verbrauchermesse, Verbraucherausstellung;2025-02-27T12:48:54+01:00;2025-02-27T12:48:54+01:00;;dpa Thüringen;false
a15b824ba5824a5842b72ad2b9b3f80352511627f322257ceca0e9a76d602a0b;Winter in Rheinland-Pfalz war zu mild;https://www.zeit.de/news/2025-02/27/winter-in-rheinland-pfalz-war-zu-mild;Hier finden Sie Informationen zu dem Thema „Wetterbilanz“. Lesen Sie jetzt „Winter in Rheinland-Pfalz war zu mild“.;Wetterbilanz;News, Wetterbilanz, Rheinland-Pfalz, Wetterbilanz, Durchschnittstemperatur, Referenzperiode, Mittelwert, Winter;2025-02-27T12:46:09+01:00;2025-02-27T12:46:09+01:00;;dpa Rheinland-Pfalz/Saarland;false
fd9c45ac236fa38ecdabe529dea21abea260e02dcf666e93b0a066fd6df2cf4f;Weiberfastnacht: Im Rathaus sind die Jecken los;https://www.zeit.de/news/2025-02/27/weiberfastnacht-im-rathaus-sind-die-jecken-los;Hier finden Sie Informationen zu dem Thema „Karnevalsbeginn“. Lesen Sie jetzt „Weiberfastnacht: Im Rathaus sind die Jecken los“.;Karnevalsbeginn;News, Karnevalsbeginn, Jens Kalliske, Mann, Lausitz, Cottbus, Weiberfastnacht, Karnevalsbeginn, Karnevalswoche;2025-02-27T12:45:18+01:00;2025-02-27T12:45:18+01:00;;dpa Berlin/Brandenburg;false
791b05b250a8d05c29fa0c93ca529107f2a23d1b3aa4f7ce66ddd84af47ba169;Panda-Zwillinge Leni und Lotti bekommen Milch-Fläschchen;https://www.zeit.de/news/2025-02/27/panda-zwillinge-leni-und-lotti-bekommen-milch-flaeschchen;Hier finden Sie Informationen zu dem Thema „Zoo Berlin“. Lesen Sie jetzt „Panda-Zwillinge Leni und Lotti bekommen Milch-Fläschchen“.;Zoo Berlin;News, Zoo Berlin, Zoologischer Garten Berlin;2025-02-27T12:45:02+01:00;2025-02-27T12:45:02+01:00;;dpa Berlin/Brandenburg;false
c90595ac3e44bbc3aa35111e0d7322f5ae2307f4501b599df1f5f4863fe69a2c;Tick, Tack;https://www.zeit.de/kultur/film/2025-02/bridget-jones-verrueckt-nach-ihm-renee-zellweger-hugh-grant-colin-firth;"Bridget Jones ist wieder da! Die Problembereiche ""Männer"" und ""Körper"" sind im neuen, vierten Film nun um die Problembereiche ""Älterwerden"" und ""Trauer"" erweitert.";"""Bridget Jones – Verrückt nach ihm""";"Kultur, ""Bridget Jones – Verrückt nach ihm"", Beziehung, Spielfilm, Hugh Grant, Kino, Mann, Frauen";2025-02-27T12:44:31+01:00;2025-02-27T12:44:31+01:00;Berit Dießelkämper;;false
f2f7fffb8135f2e2409bef19086c2cf16cd22824e9f080e82f7575212c6169f0;Saarland war im Winter vergleichsweise nass;https://www.zeit.de/news/2025-02/27/saarland-war-im-winter-vergleichsweise-nass;Hier finden Sie Informationen zu dem Thema „Wetterbilanz“. Lesen Sie jetzt „Saarland war im Winter vergleichsweise nass“.;Wetterbilanz;News, Wetterbilanz, Saarland, Wetterbilanz, Winter;2025-02-27T12:40:59+01:00;2025-02-27T12:40:59+01:00;;dpa Rheinland-Pfalz/Saarland;false
c4737f7b2c0f519690577efb7259fe31e2f95c32bd252ce0dddd31c77a1a4643;Hansa: Unterhaching-Absage keine Folge der jüngsten Randale;https://www.zeit.de/news/2025-02/27/hansa-unterhaching-absage-keine-folge-der-juengsten-randale;Hier finden Sie Informationen zu dem Thema „3. Fußball-Liga“. Lesen Sie jetzt „Hansa: Unterhaching-Absage keine Folge der jüngsten Randale“.;3. Fußball-Liga;News, 3. Fußball-Liga, Jürgen Wehlend, Unterhaching, Rostock, Ostsee-Zeitung, FC Hansa, Hansa Rostock, SpVgg Unterhaching, Polizei, Deutscher Fußball-Bund, Sicherheit;2025-02-27T12:38:54+01:00;2025-02-27T12:38:54+01:00;;dpa Bayern;false
e0a06fe7a747c9db4463243dcfa93a52c625e0cd125537137024fc8c2abe5c84;Sperrung der A1 Richtung Fehmarn am 2. März;https://www.zeit.de/news/2025-02/27/sperrung-der-a1-richtung-fehmarn-am-2-maerz;Hier finden Sie Informationen zu dem Thema „Verkehr“. Lesen Sie jetzt „Sperrung der A1 Richtung Fehmarn am 2. März“.;Verkehr;News, Verkehr, Fehmarn, Lensahn, Sperrung, Verkehr, Anschlussstelle;2025-02-27T12:36:13+01:00;2025-02-27T12:36:13+01:00;;dpa Hamburg/Schleswig-Holstein;false
00655dfa04d02c84b57813fb0846aeda5ef44fb2619ed0e7cb417f196987c63d;Winter in Deutschland seit 14 Jahren relativ mild;https://www.zeit.de/gesellschaft/2025-02/deutscher-wetterdienst-winter-deutschland-mild;Wenig Regen, mehr Sonne und Schnee oft nur in höheren Regionen: Das 14. Mal ist der Winter in Deutschland besonders mild. Die Durchschnittstemperatur lag bei 2,1 °C.;Deutscher Wetterdienst;Gesellschaft, Deutscher Wetterdienst, Winter, Wetter, Bayern, Bremen, Deutscher Wetterdienst, Schneefall, Temperatur;2025-02-27T12:36:10+01:00;2025-02-27T12:36:10+01:00;akm;ZEIT ONLINE,        dpa,        							akm;false
f0f46d3121c6b261f4feac578778ee57c1cac7b764537e5d7a7d639c1a7b5d58;Senat: Wohnungen für Azubis auf Schulgrundstücken;https://www.zeit.de/news/2025-02/27/senat-wohnungen-fuer-azubis-auf-schulgrundstuecken;Hier finden Sie Informationen zu dem Thema „Wohnen“. Lesen Sie jetzt „Senat: Wohnungen für Azubis auf Schulgrundstücken“.;Wohnen;News, Wohnen, Hamburg, Schulgrundstück, Senat;2025-02-27T12:34:44+01:00;2025-02-27T12:34:44+01:00;;dpa Hamburg/Schleswig-Holstein;false
c3c7f5dc2a681fa4ae58237b118581dbe2b4754d689b814bde019e37bccf36ad;Das wird man ja wohl noch fragen dürfen!;https://www.zeit.de/politik/deutschland/2025-02/cdu-ngos-unionsfraktion-finanzierung-afd;Die Union will es wissen: Welche NGOs bekommen warum Geld vom Staat? In einer Anfrage dazu werfen CDU und CSU vieles wild durcheinander. Differenzierung? Fehlanzeige.;"Z+ (abopflichtiger Inhalt);
        
    CDU und NGOs";Politik, CDU und NGOs, NGO, Unionsfraktion, Demonstration, Protest, Ehrenamt;2025-02-27T12:33:23+01:00;2025-02-27T12:33:23+01:00;Eva Ricarda LautschLeon Kaessmann;;false
931c1bb884e4c00cf0f3f3a6ad8c98ace22e4d502a18070416a5e47e8816bc94;Erste Festnahme nach versuchtem Mord in Silvesternacht;https://www.zeit.de/news/2025-02/27/erste-festnahme-nach-versuchtem-mord-in-silvesternacht;Hier finden Sie Informationen zu dem Thema „Kriminalität“. Lesen Sie jetzt „Erste Festnahme nach versuchtem Mord in Silvesternacht“.;Kriminalität;News, Kriminalität, Frankfurt, Polizei, Staatsanwaltschaft, Mord, Silvesternacht, Kriminalität, Festnahme, E-Scooter;2025-02-27T12:33:09+01:00;2025-02-27T12:33:09+01:00;;dpa Hessen;false
1e4ff6d29153c227350383fd180c9d521a2b46b7c0138e6dd06e664de8aea8eb;OMR-Festival bleibt in Hamburg - Vertrag über zehn Jahre;https://www.zeit.de/news/2025-02/27/omr-festival-bleibt-in-hamburg-vertrag-ueber-zehn-jahre;Hier finden Sie Informationen zu dem Thema „OMR-Festival“. Lesen Sie jetzt „OMR-Festival bleibt in Hamburg - Vertrag über zehn Jahre“.;OMR-Festival;News, OMR-Festival, Melanie Leonhard, Philipp Westermeyer, Hamburg, Elbe, SPD, Hamburg Messe und Congress GmbH, Marketingmesse, Messehalle;2025-02-27T12:30:03+01:00;2025-02-27T12:30:03+01:00;;dpa Hamburg/Schleswig-Holstein;false
b56cac08476ca8c58550c5a7e11c0f7b0ce4225e0314abdafdaf58d5fe9b41cf;Steigende Kosten – SPD warnt vor Pflege als Armutsfalle;https://www.zeit.de/news/2025-02/27/spd-pflege-darf-nicht-zur-armutsfalle-werden;Hier finden Sie Informationen zu dem Thema „Landtag“. Lesen Sie jetzt „Steigende Kosten – SPD warnt vor Pflege als Armutsfalle“.;Landtag;News, Landtag, Birte Pauls, SPD, Armutsfalle, Pflege, Landtag, Eigenanteil;2025-02-27T12:29:41+01:00;2025-02-27T12:29:41+01:00;;dpa Hamburg/Schleswig-Holstein;false
0e11d1410f5088b4485a27fb1de2101f924e91b466c2fb83e55c15f7dd938122;Gut jeder zehnte Abgeordnete hat Migrationshintergrund;https://www.zeit.de/news/2025-02/27/gut-jeder-zehnte-abgeordnete-hat-migrationshintergrund;Hier finden Sie Informationen zu dem Thema „Bundestag“. Lesen Sie jetzt „Gut jeder zehnte Abgeordnete hat Migrationshintergrund“.;Bundestag;News, Bundestag, Misbah Khan, Deutscher Bundestag, SPD, CDU, Bundestag, Migrationshintergrund, Bundestagsabgeordnete;2025-02-27T12:28:12+01:00;2025-02-27T12:28:12+01:00;;dpa;false
154b6ba78c4d814d671b45ab57452766c4c13a4c10d72a421713f5d9539f3ee5;Warnstreik am Flughafen München: 80 Prozent Flugausfälle;https://www.zeit.de/news/2025-02/27/warnstreik-am-flughafen-muenchen-80-prozent-flugausfaelle;Hier finden Sie Informationen zu dem Thema „Tarifstreit“. Lesen Sie jetzt „Warnstreik am Flughafen München: 80 Prozent Flugausfälle“.;Tarifstreit;News, Tarifstreit, München, FMG, Flughafen München, Ver.di, Flugausfall, Tarifstreit, Warnstreik;2025-02-27T12:26:11+01:00;2025-02-27T12:26:11+01:00;;dpa Bayern;false
c71dbb5f053a88f1906b79761102fd085be51d07e3a3b47ab838d27ed0948100;Stefan Gelbhaar fordert 1,7 Millionen Euro vom RBB;https://www.zeit.de/politik/deutschland/2025-02/stefan-gelbhaar-schadensersatzforderung-rbb;Der Grünenpolitiker Stefan Gelbhaar geht juristisch gegen falsche Anschuldigungen der sexuellen Belästigung vor. Vom RBB fordert er einen hohen Schadensersatz.;Grünenpolitiker;Politik, Grünenpolitiker, Stefan Gelbhaar, RBB, Schadensersatz, Bündnis 90/Die Grünen, Berichterstattung;2025-02-27T12:23:30+01:00;2025-02-27T12:23:30+01:00;isd;ZEIT ONLINE,        epd,        							isd;false
866483b2ef440d58901da546384880e7bae68b7b4aea37daae2ca962d43f25db;Mehr Polizei beim größten Karnevalsumzug in MV;https://www.zeit.de/news/2025-02/27/mehr-polizei-beim-groessten-karnevalsumzug-in-mv;Hier finden Sie Informationen zu dem Thema „Straßenkarneval“. Lesen Sie jetzt „Mehr Polizei beim größten Karnevalsumzug in MV“.;Straßenkarneval;News, Straßenkarneval, Andreas Hermann, Dömitz, Brandenburg, Ludwigslust, Mecklenburg-Vorpommern, Landkreis Ludwigslust-Parchim, Polizei, Karnevalsumzug, Straßenkarneval;2025-02-27T12:21:03+01:00;2025-02-27T12:21:03+01:00;;dpa Mecklenburg-Vorpommern;false
a8758837a68531b8de647ede116e2164b30b4d9e9922b328e3e88c57e2c62802;Letztes Triell vor der Bürgerschaftswahl;https://www.zeit.de/news/2025-02/27/letztes-triell-vor-der-buergerschaftswahl;Hier finden Sie Informationen zu dem Thema „Wahlkampf“. Lesen Sie jetzt „Letztes Triell vor der Bürgerschaftswahl“.;Wahlkampf;News, Wahlkampf, Peter Tschentscher, Hamburg, NDR, SPD, CDU, Bürgerschaftswahl, Diskussionsrunde, Wahlkampf;2025-02-27T12:20:45+01:00;2025-02-27T12:20:45+01:00;;dpa Hamburg/Schleswig-Holstein;false
9072be41ec12ba673aa421ac16eb38095ab0241d63fe1e36c403d265dfd2fe06;Spätestens ab Sonntag bestes Karnevalswetter;https://www.zeit.de/news/2025-02/27/spaetestens-ab-sonntag-bestes-karnevalswetter;Hier finden Sie Informationen zu dem Thema „Wetteraussichten“. Lesen Sie jetzt „Spätestens ab Sonntag bestes Karnevalswetter“.;Wetteraussichten;News, Wetteraussichten, Christian Herold, Bergland, Alpen, Köln, Wetteraussicht, Karnevalsregion, Karneval, Wetter;2025-02-27T12:19:49+01:00;2025-02-27T12:19:49+01:00;;dpa;false
d720dc0bb1616242a9f3e44e8a99dac3d4490f3ca271bbea84a683a2bfbbca59;Vertreter der prokurdischen Partei DEM treffen PKK-Chef Öcalan;https://www.zeit.de/politik/ausland/2025-02/oecalan-abdullah-pkk-dem-erklaerung-frieden-konflikt-erdogan;"Schon lange bekämpft die PKK türkische Politiker. Nun treffen DEM-Vertreter den PKK-Gründer Abdullah Öcalan erneut in Haft. Sie kündigen eine ""historische Erklärung"" an.";PKK;Politik, PKK, Abdullah Öcalan, PKK, Recep Tayyip Erdogan, Türkei, Istanbul;2025-02-27T12:19:43+01:00;2025-02-27T12:19:43+01:00;sko;ZEIT ONLINE,        AFP,        Reuters,        							sko;false
779157920fb909f8a0c99a36bd8dfb9d0f3bf4cb1487514ffb79c5ab95a226b3;Wie junge Eisbären ihre Geburtshöhlen verlassen;https://www.zeit.de/news/2025-02/27/wie-junge-eisbaeren-ihre-geburtshoehlen-verlassen;Hier finden Sie Informationen zu dem Thema „Internationaler Eisbären-Tag“. Lesen Sie jetzt „Wie junge Eisbären ihre Geburtshöhlen verlassen“.;Internationaler Eisbären-Tag;News, Internationaler Eisbären-Tag, Norwegen, Höhle, Spitzbergen, Neujahr, Geburtshöhle, Eisbär, Kamerafalle, Herbst, Eis, Tiere;2025-02-27T12:18:48+01:00;2025-02-27T12:18:48+01:00;;dpa;false
22b8128ffdccab78ce968616ac0f35bbbd7e58d72b8e60cc50c1b6164bdff52e;O2 und die Telekom gewinnen Hunderttausende Handykunden;https://www.zeit.de/news/2025-02/27/o2-und-die-telekom-gewinnen-hunderttausende-handykunden;Hier finden Sie Informationen zu dem Thema „Mobilfunk“. Lesen Sie jetzt „O2 und die Telekom gewinnen Hunderttausende Handykunden“.;Mobilfunk;News, Mobilfunk, Vodafone, Deutsche Telekom, Telefónica, 1&1, Mobilfunk;2025-02-27T12:14:55+01:00;2025-02-27T12:14:55+01:00;;dpa;false
5764935b58cd3024b6d69658323b48504a08f5f40377b81813dd03d100e5c646;Islamismus: Männer wegen blutiger Anschlagspläne verurteilt;https://www.zeit.de/news/2025-02/27/mehrere-jahre-haft-fuer-islamistische-terror-unterstuetzer;Hier finden Sie Informationen zu dem Thema „Extremismus“. Lesen Sie jetzt „Islamismus: Männer wegen blutiger Anschlagspläne verurteilt“.;Extremismus;News, Extremismus, Mann, Extremismus, Tötung;2025-02-27T12:12:29+01:00;2025-02-27T12:12:29+01:00;;dpa Thüringen;false
80dba8315f167db8a007a089b6547f95ff87e5de0ef2f0ceea7b4e3c987d623c;"""Trump muss Musk dominieren, um ihn fallen zu lassen""";https://www.zeit.de/politik/ausland/2025-02/michael-wolff-autor-donald-trump-buch-alles-oder-nichts;Wenige beobachten Trump so genau wie Biograf Michael Wolff. Er glaubt, die Beziehung zu Musk kippt bald. Und erklärt, warum der Ehestatus der Trumps nie diskutiert wird.;"Z+ (abopflichtiger Inhalt);
        
    Michael Wolff";Politik, Michael Wolff, Donald Trump, Biografie, Sachbuch, Melania Trump, USA, Elon Musk;2025-02-27T12:02:27+01:00;2025-02-27T12:02:27+01:00;Kerstin Kohlenberg;;false
4536ea5b784d33d280c2162480fe443c5aaecc1b10c11769cd4a9ae175f70eb8;Tochter in Rhein geworfen? - Mordprozess gegen Eltern;https://www.zeit.de/news/2025-02/27/tochter-in-rhein-geworfen-mordprozess-gegen-eltern;Hier finden Sie Informationen zu dem Thema „Aussagen zum Auftakt“. Lesen Sie jetzt „Tochter in Rhein geworfen? - Mordprozess gegen Eltern“.;Aussagen zum Auftakt;News, Aussagen zum Auftakt, Mainz, Pirmasens, Rhein, Mordprozess;2025-02-27T12:00:22+01:00;2025-02-27T12:00:22+01:00;;dpa Rheinland-Pfalz/Saarland;false
85603add421198097b78e17459299f3fecd77c503141dfbf2c07f46fd4578b47;Melbourne wirkt nach: Zverev außer Form;https://www.zeit.de/news/2025-02/27/zverev-scheitert-in-acapulco-an-teenager;Hier finden Sie Informationen zu dem Thema „Tennis“. Lesen Sie jetzt „Melbourne wirkt nach: Zverev außer Form“.;Tennis;News, Tennis, Alexander Zverev, Learner Tien, Acapulco, Hartplatzturnier, Teenager;2025-02-27T11:58:34+01:00;2025-02-27T11:58:34+01:00;;dpa Sport;false
26b99db0ee90ce53a0ef383c828ad87329c8225f3c835ac7f13e161dceea4f5d;Köln-Profi Martel nach Verletzung wieder zurück;https://www.zeit.de/news/2025-02/27/koeln-profi-martel-nach-verletzung-wieder-zurueck;Hier finden Sie Informationen zu dem Thema „2. Fußball-Bundesliga“. Lesen Sie jetzt „Köln-Profi Martel nach Verletzung wieder zurück“.;2. Fußball-Bundesliga;News, 2. Fußball-Bundesliga, Eric Martel, Gerhard Struber, Köln, Fußball-Bundesliga, 1. FC Köln, Karlsruher SC, Verletzung;2025-02-27T11:58:17+01:00;2025-02-27T11:58:17+01:00;;dpa Nordrhein-Westfalen;false
7c434a5eb9ccad60e5e295d5980e2e27eead77185064bf92d9b57c36ec00ccf4;USA und Russland sprechen über Arbeit ihrer Botschaften;https://www.zeit.de/news/2025-02/27/usa-und-russland-sprechen-ueber-arbeit-ihrer-botschaften;Hier finden Sie Informationen zu dem Thema „Diplomatie“. Lesen Sie jetzt „USA und Russland sprechen über Arbeit ihrer Botschaften“.;Diplomatie;News, Diplomatie, USA, Russland, Istanbul, Moskau, Botschaft, Wiederannäherung, Krieg in der Ukraine;2025-02-27T11:57:57+01:00;2025-02-27T11:57:57+01:00;;dpa;false
bc5d54b2573879702fd58ef6e94c27cc9c07c476a25abdd3a297c725b5022f4a;Höhere Kassenbeiträge für Rentner, Ausweitung der Mietpreisbremse;https://www.zeit.de/geld/2025-02/aenderungen-maerz-2025-krankrassen-beritraege-rentner-mietpreisbremse;Für Mofas gelten neue Kennzeichen, der Zeitarbeit-Mindestlohn steigt und aus der Ukraine Geflüchtete bekommen einen längeren Schutzstatus. Das ändert sich im März;Änderungen im März 2025;Geld, Änderungen im März 2025, Rente, Krankenkasse, Mietpreisbremse, Mindestlohn, Zeitarbeit, Geflüchtete;2025-02-27T11:56:20+01:00;2025-02-27T11:56:20+01:00;Eric Voigt;;false
789435cbc0cdb49fb11fcf20a3057be06831f1b644336802038d634536045a90;Milder und sonniger Winter in Hessen;https://www.zeit.de/news/2025-02/27/milder-und-sonniger-winter-in-hessen;Hier finden Sie Informationen zu dem Thema „Wetterbilanz“. Lesen Sie jetzt „Milder und sonniger Winter in Hessen“.;Wetterbilanz;News, Wetterbilanz, Hessen, DWD, Wetterbilanz, Mittelwert, Referenzperiode, Durchschnittstemperatur, Winter;2025-02-27T11:53:50+01:00;2025-02-27T11:53:50+01:00;;dpa Hessen;false
52dd2265d3891012e0fcebff012fda5f725fdc371488937f9c03b7abbc7392fe;Mehr Gemüse von kleinerer Fläche in Brandenburg geerntet;https://www.zeit.de/news/2025-02/27/mehr-gemuese-von-kleinerer-flaeche-in-brandenburg-geerntet;Hier finden Sie Informationen zu dem Thema „Landwirtschaft“. Lesen Sie jetzt „Mehr Gemüse von kleinerer Fläche in Brandenburg geerntet“.;Landwirtschaft;News, Landwirtschaft, Brandenburg, Amt für Statistik Berlin-Brandenburg, Gemüse, Freilandgemüse;2025-02-27T11:52:16+01:00;2025-02-27T11:52:16+01:00;;dpa Berlin/Brandenburg;false
ecc738ea98d05440d96c3e790360a60d7b58f41233901bbb14b5f23cdc7c589b;Krankenkasse: Zu wenig Bewegung bei Kindern und Jugendlichen;https://www.zeit.de/news/2025-02/27/krankenkasse-zu-wenig-bewegung-bei-kindern-und-jugendlichen;Hier finden Sie Informationen zu dem Thema „Gesundheit“. Lesen Sie jetzt „Krankenkasse: Zu wenig Bewegung bei Kindern und Jugendlichen“.;Gesundheit;News, Gesundheit, Hannover, KKH, Krankenkasse;2025-02-27T11:51:07+01:00;2025-02-27T11:51:07+01:00;;dpa Niedersachsen;false
46da75317cc51d68310cd0ca10018e94e3ad99a8e9d7c1b1e6270b9e9e0916ed;Rückhalt für Stadtrat nach Anklage wegen Geheimnisverrats;https://www.zeit.de/news/2025-02/27/rueckhalt-fuer-stadtrat-nach-anklage-wegen-geheimnisverrats;Hier finden Sie Informationen zu dem Thema „Anklage am Amtsgericht“. Lesen Sie jetzt „Rückhalt für Stadtrat nach Anklage wegen Geheimnisverrats“.;Anklage am Amtsgericht;News, Anklage am Amtsgericht, Paul Wandrey, Hanno Benz, Amtsgericht, CDU, SPD, Anklage, Geheimnisverrat;2025-02-27T11:49:33+01:00;2025-02-27T11:49:33+01:00;;dpa Hessen;false
8f32df007f429215aa46b8f407ebf8dc0ba74f277db1ae4fe10db9065ee528d8;Post-Warnstreiks: Jede zwanzigste Sendung bleibt liegen;https://www.zeit.de/news/2025-02/27/verdi-weitet-warnstreiks-bei-der-deutschen-post-aus;Hier finden Sie Informationen zu dem Thema „Streit um mehr Geld“. Lesen Sie jetzt „Post-Warnstreiks: Jede zwanzigste Sendung bleibt liegen“.;Streit um mehr Geld;News, Streit um mehr Geld, Ver.di, Deutsche Post, Verbundzustellung, Dienstleistungsgewerkschaft, Warnstreik, Geld, Tarifkonflikt;2025-02-27T11:46:44+01:00;2025-02-27T11:46:44+01:00;;dpa;false
bb44450705576f80866ad5d26855f032b90eae57591a3eaca78865f5352a05d1;Niedersachsen will Deutschlandticket langfristig erhalten;https://www.zeit.de/news/2025-02/27/minister-lies-muessen-deutschlandticket-langfristig-erhalten;Hier finden Sie Informationen zu dem Thema „Zukunft des D-Tickets unsicher“. Lesen Sie jetzt „Niedersachsen will Deutschlandticket langfristig erhalten“.;Zukunft des D-Tickets unsicher;News, Zukunft des D-Tickets unsicher, Olaf Lie, Malte Diehl, Niedersachsen, Bundesregierung, SPD, Deutsche Presse-Agentur, Deutschlandticket;2025-02-27T11:43:18+01:00;2025-02-27T11:43:18+01:00;;dpa Niedersachsen;false
e6fc459da06344aae6892d0a6fb5b1f69600a085367716a340589ea9f2b8699b;"Helau! 70 Jahre ""Mainz bleibt Mainz""";https://www.zeit.de/news/2025-02/27/helau-70-jahre-mainz-bleibt-mainz;"Hier finden Sie Informationen zu dem Thema „Fastnacht“. Lesen Sie jetzt „Helau! 70 Jahre ""Mainz bleibt Mainz""“.";Fastnacht;News, Fastnacht, Florian Sitte, Klare Kante, Christian Lindner, Mainz, ARD, Deutscher Bundestag, Bundestagswahl, Helau, Fastnacht, Fastnachtssitzung;2025-02-27T11:39:28+01:00;2025-02-27T11:39:28+01:00;;dpa Rheinland-Pfalz/Saarland;false
2c0d025f089e1398e28f7a1e78c92034d90ca290cce99d8fbd335320596bea2d;EuGH stärkt Verbraucherrechte bei Bonitätsbewertung;https://www.zeit.de/wirtschaft/2025-02/eugh-bonitaetsbewertung-schufa-urteil-transparenz;Verbraucher haben ein Recht darauf, zu erfahren, wie die Entscheidung über ihren Bonitätswert zustande kommt. Die Schufa gibt an, die Anforderungen bereits zu erfüllen.;Europäischer Gerichtshof;Wirtschaft, Europäischer Gerichtshof, Schufa, EuGH, Verbraucherschutz, Transparenz, Justiz;2025-02-27T11:36:58+01:00;2025-02-27T11:36:58+01:00;isd;ZEIT ONLINE,        dpa,        							isd;false
e7f2b1a21e964c211d8d6d3da9f04d9e101770b2b0dd27d037e6ad983eb1bade;Wie riskant sollte Ihr perfektes Portfolio sein?;https://www.zeit.de/geld/2025-02/geldanlage-risiko-portfolio-geldverbesserer;Sie zocken ungern? Verständlich! Aber wer Geld profitabel anlegen will, muss damit rechnen, es zu verlieren. So finden Sie Ihren Sweetspot zwischen Sicherheit und Risiko.;"Z+ (abopflichtiger Inhalt);
        
    Geldanlage";Geld, Geldanlage, Finanzen, Aktien, ETF, Kryptowährung, Konto, Bundesverband deutscher Banken, Inflation;2025-02-27T11:34:48+01:00;2025-02-27T11:34:48+01:00;Thomas KehlLaura Städtler;;false
a61882a16587bc03a156b64de0745bb3d01f3a6264c05a6049d83feadf08f6b1;Kommunen nehmen weniger Grundsteuer für Agrarflächen ein;https://www.zeit.de/news/2025-02/27/kommunen-nehmen-weniger-grundsteuer-fuer-agrarflaechen-ein;Hier finden Sie Informationen zu dem Thema „Steuern“. Lesen Sie jetzt „Kommunen nehmen weniger Grundsteuer für Agrarflächen ein“.;Steuern;News, Steuern, Sachsen-Anhalt, Grundsteuer, Kommune, Steuer;2025-02-27T11:32:09+01:00;2025-02-27T11:32:09+01:00;;dpa Sachsen;false
4cb2d1c2e824db1ce02b91745ee773375c1fb30d8f8a230d613ed0b89769de0d;AfD zitiert Ministerpräsident in den Landtag;https://www.zeit.de/news/2025-02/27/afd-zitiert-ministerpraesident-in-den-landtag;Hier finden Sie Informationen zu dem Thema „Plenarsitzung“. Lesen Sie jetzt „AfD zitiert Ministerpräsident in den Landtag“.;Plenarsitzung;News, Plenarsitzung, Dietmar Woidke, Ulrike Liedtke, Alternative für Deutschland, SPD, Plenarsitzung, Landtag, Ministerpräsidentenkonferenz;2025-02-27T11:22:31+01:00;2025-02-27T11:22:31+01:00;;dpa Berlin/Brandenburg;false
5811c03786625a4beb774eb93a657dea6680f6e355309ce778e6b51f57708225;Ver.di weitet Warnstreiks bei der Deutschen Post aus;https://www.zeit.de/arbeit/2025-02/verdi-warnstreiks-deutsche-post-pakete-briefe;Nach Streiks in den Paketzentren ruft die Gewerkschaft nun auch zu Arbeitsstopps bei der Zustellung auf. Das Angebot der Deutschen Post im Tarifkonflikt sei unzureichend.;Tarifstreit;Arbeit, Tarifstreit, Ver.di, Deutsche Post, Streik, Warnstreik, Tarifvertrag;2025-02-27T11:21:50+01:00;2025-02-27T11:21:50+01:00;tbl;ZEIT ONLINE,        dpa,        							tbl;false
7e13bb174857fbd5d344e6282b16ffa19c2d75e83f92a747dc636a9d96085aa5;Jüdische Studierende fühlen sich an deutschen Hochschulen nicht sicher;https://www.zeit.de/gesellschaft/zeitgeschehen/2025-02/juedische-studierende-uni-antisemitismus-sicherheit;Seit dem Terrorangriff der Hamas auf Israel befinden sich studierende Juden und Jüdinnen im Ausnahmezustand. Das zeigt ein Lagebericht zum Antisemitismus an Hochschulen.;Antisemitismus;Gesellschaft, Antisemitismus , Antisemitismus, Hochschule, Judentum, Rechtsextremismus, Diskriminierung;2025-02-27T11:18:54+01:00;2025-02-27T11:18:54+01:00;iyf;ZEIT ONLINE,        epd,        							iyf;false
7b6650bd9ab34cca9ccadac0c56d5e3ab2aabbb939bdfb8503df67fcadbb23a1;Mann bei Zusammenstoß tödlich verletzt;https://www.zeit.de/news/2025-02/27/mann-bei-zusammenstoss-toedlich-verletzt;Hier finden Sie Informationen zu dem Thema „Unfälle“. Lesen Sie jetzt „Mann bei Zusammenstoß tödlich verletzt“.;Unfälle;News, Unfälle, Oberfranken, Polizei, Unfall, Zusammenstoß, Überholmanöver, Auto;2025-02-27T11:18:28+01:00;2025-02-27T11:18:28+01:00;;dpa Bayern;false
ba8aa556c0a3443b9e56981f37660b08109debe0d1f750a97bbf9007196e9233;Kirchen und Sport treten gegen Extremismus ein;https://www.zeit.de/news/2025-02/27/kirchen-und-sport-treten-gegen-extremismus-ein;Hier finden Sie Informationen zu dem Thema „Antisemitismus“. Lesen Sie jetzt „Kirchen und Sport treten gegen Extremismus ein“.;Antisemitismus;News, Antisemitismus, Frankfurt, Nassau, Hessen, Extremismus, Antisemitismus, Sportverband;2025-02-27T11:17:31+01:00;2025-02-27T11:17:31+01:00;;dpa Hessen;false
